{
  "hand_id": "257150196418",
  "date": "30-07-2025 23:24:58",
  "table": "Gilgamesh",
  "game_type": "holdem",
  "hero": "SrLyce",
  "hero_position": "",
  "hero_cards": [
    "2h",
    "Kd"
  ],
  "stacks": {
    "riverrrrrrmagic": 120.5,
    "SrLyce": 112.0,
    "Jumby34": 100.0,
    "xapkk": 100.0,
    "samaritano34": 90.5,
    "Fretzo67500": 128.5
  },
  "actions": {
    "preflop": [
      "Asiento 1: riverrrrrrmagic (2.41 € en fichas)",
      "Asiento 2: SrLyce (2.24 € en fichas)",
      "Asiento 3: Jumby34 (2 € en fichas)",
      "Asiento 4: xapkk (2 € en fichas)",
      "Asiento 5: samaritano34 (1.81 € en fichas)",
      "Asiento 6: Fretzo67500 (2.57 € en fichas)",
      "Fretzo67500: pone la ciega pequeña 0.01 €",
      "riverrrrrrmagic: pone la ciega grande 0.02 €",
      "SrLyce: se retira",
      "Jumby34: se retira",
      "xapkk: se retira",
      "samaritano34: se retira",
      "Fretzo67500: iguala 0.01 €",
      "riverrrrrrmagic: pasa"
    ],
    "flop": [
      "Fretzo67500: apuesta 0.02 €",
      "riverrrrrrmagic: iguala 0.02 €"
    ],
    "turn": [
      "Fretzo67500: apuesta 0.02 €",
      "riverrrrrrmagic: iguala 0.02 €"
    ],
    "river": [
      "Fretzo67500: apuesta 0.02 €",
      "riverrrrrrmagic: iguala 0.02 €",
      "Fretzo67500: muestra [7h 9c] (pareja de sietes)",
      "riverrrrrrmagic: muestra [9s Ah] (pareja de ases)",
      "Asiento 1: riverrrrrrmagic (ciega grande) muestra [9s Ah] y ganó (0.15 €) con pareja de ases",
      "Asiento 2: SrLyce se retiró antes del Flop (no apostó)",
      "Asiento 3: Jumby34 se retiró antes del Flop (no apostó)",
      "Asiento 4: xapkk se retiró antes del Flop (no apostó)",
      "Asiento 5: samaritano34 (botón) se retiró antes del Flop (no apostó)",
      "Asiento 6: Fretzo67500 (ciega pequeña) muestra [7h 9c] y perdió con pareja de sietes"
    ]
  },
  "board": [
    "4c",
    "7c",
    "Ac",
    "2s",
    "3s"
  ],
  "winner": "riverrrrrrmagic",
  "win_amount": 7.5,
  "sb": 0.01,
  "bb": 0.02,
  "rake": 0.5,
  "raw_text": "Mano n.º 257150196418 de PokerStars:  Hold'em No Limit (0.01 €/0.02 € EUR) - 30-07-2025 23:24:58 CET [30-07-2025 17:24:58 ET]\nMesa \"Gilgamesh\" 6-max El asiento n.º 5 es el botón\nAsiento 1: riverrrrrrmagic (2.41 € en fichas) \nAsiento 2: SrLyce (2.24 € en fichas) \nAsiento 3: Jumby34 (2 € en fichas) \nAsiento 4: xapkk (2 € en fichas) \nAsiento 5: samaritano34 (1.81 € en fichas) \nAsiento 6: Fretzo67500 (2.57 € en fichas) \nFretzo67500: pone la ciega pequeña 0.01 €\nriverrrrrrmagic: pone la ciega grande 0.02 €\n*** CARTAS DE MANO ***\nRepartidas a SrLyce [2h Kd]\nSrLyce: se retira \nJumby34: se retira \nxapkk: se retira \nsamaritano34: se retira \nFretzo67500: iguala 0.01 €\nriverrrrrrmagic: pasa \n*** FLOP *** [4c 7c Ac]\nFretzo67500: apuesta 0.02 €\nriverrrrrrmagic: iguala 0.02 €\n*** TURN *** [4c 7c Ac] [2s]\nFretzo67500: apuesta 0.02 €\nriverrrrrrmagic: iguala 0.02 €\n*** RIVER *** [4c 7c Ac 2s] [3s]\nFretzo67500: apuesta 0.02 €\nriverrrrrrmagic: iguala 0.02 €\n*** SHOW DOWN ***\nFretzo67500: muestra [7h 9c] (pareja de sietes)\nriverrrrrrmagic: muestra [9s Ah] (pareja de ases)\nriverrrrrrmagic se lleva 0.15 € del bote \n*** RESUMEN ***\nBote total 0.16 € | Comisión 0.01 € \nComunitarias [4c 7c Ac 2s 3s]\nAsiento 1: riverrrrrrmagic (ciega grande) muestra [9s Ah] y ganó (0.15 €) con pareja de ases\nAsiento 2: SrLyce se retiró antes del Flop (no apostó)\nAsiento 3: Jumby34 se retiró antes del Flop (no apostó)\nAsiento 4: xapkk se retiró antes del Flop (no apostó)\nAsiento 5: samaritano34 (botón) se retiró antes del Flop (no apostó)\nAsiento 6: Fretzo67500 (ciega pequeña) muestra [7h 9c] y perdió con pareja de sietes"
}