{
  "hand_id": "257150397050",
  "date": "30-07-2025 23:38:54",
  "table": "Martha",
  "game_type": "holdem",
  "hero": "SrLyce",
  "hero_position": "",
  "hero_cards": [
    "6c",
    "3d"
  ],
  "stacks": {
    "mivipkr": 101.5,
    "NovacaineZxc": 126.5,
    "BudyXXIII": 106.5,
    "Sigiilo": 98.5,
    "SrLyce": 100.0,
    "alexfw300": 100.0
  },
  "actions": {
    "preflop": [
      "Asiento 1: mivipkr (2.03 € en fichas)",
      "Asiento 2: NovacaineZxc (2.53 € en fichas)",
      "Asiento 3: BudyXXIII (2.13 € en fichas)",
      "Asiento 4: Sigiilo (1.97 € en fichas)",
      "Asiento 5: SrLyce (2 € en fichas)",
      "Asiento 6: alexfw300 (2 € en fichas)",
      "SrLyce: pone la ciega pequeña 0.01 €",
      "alexfw300: pone la ciega grande 0.02 €",
      "mivipkr: sube 0.02 € a 0.04 €",
      "NovacaineZxc: se retira",
      "BudyXXIII: se retira",
      "Sigiilo: se retira",
      "SrLyce: se retira",
      "alexfw300: se retira",
      "mivipkr: no muestra su mano",
      "Asiento 1: mivipkr recaudó (0.05 €)",
      "Asiento 2: NovacaineZxc se retiró antes del Flop (no apostó)",
      "Asiento 3: BudyXXIII se retiró antes del Flop (no apostó)",
      "Asiento 4: Sigiilo (botón) se retiró antes del Flop (no apostó)",
      "Asiento 5: SrLyce (ciega pequeña) se retiró antes del Flop",
      "Asiento 6: alexfw300 (ciega grande) se retiró antes del Flop"
    ],
    "flop": [],
    "turn": [],
    "river": []
  },
  "board": [],
  "winner": "mivipkr",
  "win_amount": 2.5,
  "sb": 0.01,
  "bb": 0.02,
  "rake": 0.0,
  "raw_text": "Mano n.º 257150397050 de PokerStars:  Hold'em No Limit (0.01 €/0.02 € EUR) - 30-07-2025 23:38:54 CET [30-07-2025 17:38:54 ET]\nMesa \"Martha\" 6-max El asiento n.º 4 es el botón\nAsiento 1: mivipkr (2.03 € en fichas) \nAsiento 2: NovacaineZxc (2.53 € en fichas) \nAsiento 3: BudyXXIII (2.13 € en fichas) \nAsiento 4: Sigiilo (1.97 € en fichas) \nAsiento 5: SrLyce (2 € en fichas) \nAsiento 6: alexfw300 (2 € en fichas) \nSrLyce: pone la ciega pequeña 0.01 €\nalexfw300: pone la ciega grande 0.02 €\n*** CARTAS DE MANO ***\nRepartidas a SrLyce [6c 3d]\nmivipkr: sube 0.02 € a 0.04 €\nNovacaineZxc: se retira \nBudyXXIII: se retira \nSigiilo: se retira \nSrLyce: se retira \nalexfw300: se retira \nLa apuesta no igualada (0.02 €) ha sido devuelta a mivipkr\nmivipkr se lleva 0.05 € del bote \nmivipkr: no muestra su mano \n*** RESUMEN ***\nBote total 0.05 € | Comisión 0 € \nAsiento 1: mivipkr recaudó (0.05 €)\nAsiento 2: NovacaineZxc se retiró antes del Flop (no apostó)\nAsiento 3: BudyXXIII se retiró antes del Flop (no apostó)\nAsiento 4: Sigiilo (botón) se retiró antes del Flop (no apostó)\nAsiento 5: SrLyce (ciega pequeña) se retiró antes del Flop\nAsiento 6: alexfw300 (ciega grande) se retiró antes del Flop"
}