{
  "hand_id": "257215028977",
  "date": "04-08-2025 22:19:55",
  "table": "Anneliese II",
  "game_type": "holdem",
  "hero": "SrLyce",
  "hero_position": "",
  "hero_cards": [
    "4s",
    "Jd"
  ],
  "stacks": {
    "betterrrrrr": 100.0,
    "niyomalo": 123.0,
    "ElManu62": 116.0,
    "SrLyce": 98.5,
    "Mr_Pkr98": 141.5,
    "Spotick": 109.0
  },
  "actions": {
    "preflop": [
      "Asiento 1: betterrrrrr (2 € en fichas)",
      "Asiento 2: niyomalo (2.46 € en fichas)",
      "Asiento 3: ElManu62 (2.32 € en fichas)",
      "Asiento 4: SrLyce (1.97 € en fichas)",
      "Asiento 5: Mr_Pkr98 (2.83 € en fichas)",
      "Asiento 6: Spotick (2.18 € en fichas)",
      "betterrrrrr: pone la ciega pequeña 0.01 €",
      "niyomalo: pone la ciega grande 0.02 €",
      "ElManu62: se retira",
      "SrLyce: se retira",
      "Mr_Pkr98: se retira",
      "Spotick: sube 0.02 € a 0.04 €",
      "betterrrrrr: se retira",
      "niyomalo: iguala 0.02 €"
    ],
    "flop": [
      "niyomalo: pasa",
      "Spotick: apuesta 0.04 €",
      "niyomalo: se retira",
      "Spotick: no muestra su mano",
      "Asiento 1: betterrrrrr (ciega pequeña) se retiró antes del Flop",
      "Asiento 2: niyomalo (ciega grande) se retiró en el Flop",
      "Asiento 3: ElManu62 se retiró antes del Flop (no apostó)",
      "Asiento 4: SrLyce se retiró antes del Flop (no apostó)",
      "Asiento 5: Mr_Pkr98 se retiró antes del Flop (no apostó)",
      "Asiento 6: Spotick (botón) recaudó (0.08 €)"
    ],
    "turn": [],
    "river": []
  },
  "board": [
    "Ah",
    "Js",
    "Tc"
  ],
  "winner": "Spotick",
  "win_amount": 4.0,
  "sb": 0.01,
  "bb": 0.02,
  "rake": 0.5,
  "raw_text": "Mano n.º 257215028977 de PokerStars:  Hold'em No Limit (0.01 €/0.02 € EUR) - 04-08-2025 22:19:55 CET [04-08-2025 16:19:55 ET]\nMesa \"Anneliese II\" 6-max El asiento n.º 6 es el botón\nAsiento 1: betterrrrrr (2 € en fichas) \nAsiento 2: niyomalo (2.46 € en fichas) \nAsiento 3: ElManu62 (2.32 € en fichas) \nAsiento 4: SrLyce (1.97 € en fichas) \nAsiento 5: Mr_Pkr98 (2.83 € en fichas) \nAsiento 6: Spotick (2.18 € en fichas) \nbetterrrrrr: pone la ciega pequeña 0.01 €\nniyomalo: pone la ciega grande 0.02 €\n*** CARTAS DE MANO ***\nRepartidas a SrLyce [4s Jd]\nElManu62: se retira \nSrLyce: se retira \nMr_Pkr98: se retira \nSpotick: sube 0.02 € a 0.04 €\nbetterrrrrr: se retira \nniyomalo: iguala 0.02 €\n*** FLOP *** [Ah Js Tc]\nniyomalo: pasa \nSpotick: apuesta 0.04 €\nniyomalo: se retira \nLa apuesta no igualada (0.04 €) ha sido devuelta a Spotick\nSpotick se lleva 0.08 € del bote \nSpotick: no muestra su mano \n*** RESUMEN ***\nBote total 0.09 € | Comisión 0.01 € \nComunitarias [Ah Js Tc]\nAsiento 1: betterrrrrr (ciega pequeña) se retiró antes del Flop\nAsiento 2: niyomalo (ciega grande) se retiró en el Flop\nAsiento 3: ElManu62 se retiró antes del Flop (no apostó)\nAsiento 4: SrLyce se retiró antes del Flop (no apostó)\nAsiento 5: Mr_Pkr98 se retiró antes del Flop (no apostó)\nAsiento 6: Spotick (botón) recaudó (0.08 €)"
}