{
  "hand_id": "257150458232",
  "date": "30-07-2025 23:43:17",
  "table": "Martha",
  "game_type": "holdem",
  "hero": "SrLyce",
  "hero_position": "",
  "hero_cards": [
    "3s",
    "5s"
  ],
  "stacks": {
    "mivipkr": 106.0,
    "NovacaineZxc": 119.0,
    "BudyXXIII": 112.0,
    "Sigiilo": 100.0,
    "SrLyce": 98.0,
    "alexfw300": 104.5
  },
  "actions": {
    "preflop": [
      "Asiento 1: mivipkr (2.12 € en fichas)",
      "Asiento 2: NovacaineZxc (2.38 € en fichas)",
      "Asiento 3: BudyXXIII (2.24 € en fichas)",
      "Asiento 4: Sigiilo (2 € en fichas)",
      "Asiento 5: SrLyce (1.96 € en fichas)",
      "Asiento 6: alexfw300 (2.09 € en fichas)",
      "NovacaineZxc: pone la ciega pequeña 0.01 €",
      "BudyXXIII: pone la ciega grande 0.02 €",
      "Sigiilo: se retira",
      "SrLyce: se retira",
      "alexfw300: se retira",
      "mivipkr: se retira",
      "NovacaineZxc: sube 0.02 € a 0.04 €",
      "BudyXXIII: se retira",
      "NovacaineZxc: no muestra su mano",
      "Asiento 1: mivipkr (botón) se retiró antes del Flop (no apostó)",
      "Asiento 2: NovacaineZxc (ciega pequeña) recaudó (0.04 €)",
      "Asiento 3: BudyXXIII (ciega grande) se retiró antes del Flop",
      "Asiento 4: Sigiilo se retiró antes del Flop (no apostó)",
      "Asiento 5: SrLyce se retiró antes del Flop (no apostó)",
      "Asiento 6: alexfw300 se retiró antes del Flop (no apostó)"
    ],
    "flop": [],
    "turn": [],
    "river": []
  },
  "board": [],
  "winner": "NovacaineZxc",
  "win_amount": 2.0,
  "sb": 0.01,
  "bb": 0.02,
  "rake": 0.0,
  "raw_text": "Mano n.º 257150458232 de PokerStars:  Hold'em No Limit (0.01 €/0.02 € EUR) - 30-07-2025 23:43:17 CET [30-07-2025 17:43:17 ET]\nMesa \"Martha\" 6-max El asiento n.º 1 es el botón\nAsiento 1: mivipkr (2.12 € en fichas) \nAsiento 2: NovacaineZxc (2.38 € en fichas) \nAsiento 3: BudyXXIII (2.24 € en fichas) \nAsiento 4: Sigiilo (2 € en fichas) \nAsiento 5: SrLyce (1.96 € en fichas) \nAsiento 6: alexfw300 (2.09 € en fichas) \nNovacaineZxc: pone la ciega pequeña 0.01 €\nBudyXXIII: pone la ciega grande 0.02 €\n*** CARTAS DE MANO ***\nRepartidas a SrLyce [3s 5s]\nSigiilo: se retira \nSrLyce: se retira \nalexfw300: se retira \nmivipkr: se retira \nNovacaineZxc: sube 0.02 € a 0.04 €\nBudyXXIII: se retira \nLa apuesta no igualada (0.02 €) ha sido devuelta a NovacaineZxc\nNovacaineZxc se lleva 0.04 € del bote \nNovacaineZxc: no muestra su mano \n*** RESUMEN ***\nBote total 0.04 € | Comisión 0 € \nAsiento 1: mivipkr (botón) se retiró antes del Flop (no apostó)\nAsiento 2: NovacaineZxc (ciega pequeña) recaudó (0.04 €)\nAsiento 3: BudyXXIII (ciega grande) se retiró antes del Flop\nAsiento 4: Sigiilo se retiró antes del Flop (no apostó)\nAsiento 5: SrLyce se retiró antes del Flop (no apostó)\nAsiento 6: alexfw300 se retiró antes del Flop (no apostó)"
}