{
  "hand_id": "257238410565",
  "date": "06-08-2025 18:55:34",
  "table": "Adelaide III",
  "game_type": "holdem",
  "hero": "SrLyce",
  "hero_position": "",
  "hero_cards": [
    "2c",
    "8h"
  ],
  "stacks": {
    "Macklemore0": 100.0,
    "N3xtTIm35": 138.0,
    "aliendee07": 58.0,
    "SrLyce": 90.0,
    "ismagonzalez7": 53.5,
    "pauquair5": 72.0
  },
  "actions": {
    "preflop": [
      "Asiento 3: Macklemore0 (2 € en fichas) está ausente",
      "Asiento 1: N3xtTIm35 (2.76 € en fichas)",
      "Asiento 2: aliendee07 (1.16 € en fichas)",
      "Asiento 4: SrLyce (1.80 € en fichas)",
      "Asiento 5: ismagonzalez7 (1.07 € en fichas)",
      "Asiento 6: pauquair5 (1.44 € en fichas)",
      "pauquair5: pone la ciega pequeña 0.01 €",
      "N3xtTIm35: pone la ciega grande 0.02 €",
      "Macklemore0: se ausenta",
      "aliendee07: se retira",
      "SrLyce: se retira",
      "ismagonzalez7: sube 0.02 € a 0.04 €",
      "pauquair5: iguala 0.03 €",
      "N3xtTIm35: se retira"
    ],
    "flop": [
      "pauquair5: pasa",
      "ismagonzalez7: apuesta 0.05 €",
      "pauquair5: iguala 0.05 €"
    ],
    "turn": [
      "pauquair5: pasa",
      "ismagonzalez7: apuesta 0.10 €",
      "pauquair5: se retira",
      "ismagonzalez7: no muestra su mano",
      "Asiento 3: Macklemore0",
      "Asiento 1: N3xtTIm35 (ciega grande) se retiró antes del Flop",
      "Asiento 2: aliendee07 se retiró antes del Flop (no apostó)",
      "Asiento 4: SrLyce se retiró antes del Flop (no apostó)",
      "Asiento 5: ismagonzalez7 (botón) recaudó (0.19 €)",
      "Asiento 6: pauquair5 (ciega pequeña) se retiró en el Turn"
    ],
    "river": []
  },
  "board": [
    "4c",
    "Qd",
    "Ts",
    "9c"
  ],
  "winner": "ismagonzalez7",
  "win_amount": 9.5,
  "sb": 0.01,
  "bb": 0.02,
  "rake": 0.5,
  "raw_text": "Mano n.º 257238410565 de PokerStars:  Hold'em No Limit (0.01 €/0.02 € EUR) - 06-08-2025 18:55:34 CET [06-08-2025 12:55:34 ET]\nMesa \"Adelaide III\" 6-max El asiento n.º 5 es el botón\nAsiento 3: Macklemore0 (2 € en fichas) está ausente\nAsiento 1: N3xtTIm35 (2.76 € en fichas) \nAsiento 2: aliendee07 (1.16 € en fichas) \nAsiento 4: SrLyce (1.80 € en fichas) \nAsiento 5: ismagonzalez7 (1.07 € en fichas) \nAsiento 6: pauquair5 (1.44 € en fichas) \npauquair5: pone la ciega pequeña 0.01 €\nN3xtTIm35: pone la ciega grande 0.02 €\nMacklemore0: se ausenta \n*** CARTAS DE MANO ***\nRepartidas a SrLyce [2c 8h]\naliendee07: se retira \nSrLyce: se retira \nismagonzalez7: sube 0.02 € a 0.04 €\npauquair5: iguala 0.03 €\nN3xtTIm35: se retira \n*** FLOP *** [4c Qd Ts]\npauquair5: pasa \nismagonzalez7: apuesta 0.05 €\npauquair5: iguala 0.05 €\n*** TURN *** [4c Qd Ts] [9c]\npauquair5: pasa \nismagonzalez7: apuesta 0.10 €\npauquair5: se retira \nLa apuesta no igualada (0.10 €) ha sido devuelta a ismagonzalez7\nismagonzalez7 se lleva 0.19 € del bote \nismagonzalez7: no muestra su mano \n*** RESUMEN ***\nBote total 0.20 € | Comisión 0.01 € \nComunitarias [4c Qd Ts 9c]\nAsiento 3: Macklemore0\nAsiento 1: N3xtTIm35 (ciega grande) se retiró antes del Flop\nAsiento 2: aliendee07 se retiró antes del Flop (no apostó)\nAsiento 4: SrLyce se retiró antes del Flop (no apostó)\nAsiento 5: ismagonzalez7 (botón) recaudó (0.19 €)\nAsiento 6: pauquair5 (ciega pequeña) se retiró en el Turn"
}