{
  "hand_id": "257148968672",
  "date": "30-07-2025 21:57:35",
  "table": "Sirona",
  "game_type": "holdem",
  "hero": "SrLyce",
  "hero_position": "",
  "hero_cards": [
    "3c",
    "Ad"
  ],
  "stacks": {
    "SrLyce": 116.0,
    "lecontrebandier": 96.5,
    "christoph363": 203.5,
    "oliverdu70": 137.0,
    "Dakoo44": 69.0
  },
  "actions": {
    "preflop": [
      "Asiento 1: SrLyce (2.32 € en fichas)",
      "Asiento 2: lecontrebandier (1.93 € en fichas)",
      "Asiento 3: christoph363 (4.07 € en fichas)",
      "Asiento 4: oliverdu70 (2.74 € en fichas)",
      "Asiento 6: Dakoo44 (1.38 € en fichas)",
      "SrLyce: pone la ciega pequeña 0.01 €",
      "lecontrebandier: pone la ciega grande 0.02 €",
      "christoph363: se retira",
      "oliverdu70: iguala 0.02 €",
      "Dakoo44: se retira",
      "SrLyce: iguala 0.01 €",
      "lecontrebandier: pasa"
    ],
    "flop": [
      "SrLyce: pasa",
      "lecontrebandier: pasa",
      "oliverdu70: pasa"
    ],
    "turn": [
      "SrLyce: apuesta 0.06 €",
      "lecontrebandier: se retira",
      "oliverdu70: se retira",
      "SrLyce: no muestra su mano",
      "Asiento 1: SrLyce (ciega pequeña) recaudó (0.06 €)",
      "Asiento 2: lecontrebandier (ciega grande) se retiró en el Turn",
      "Asiento 3: christoph363 se retiró antes del Flop (no apostó)",
      "Asiento 4: oliverdu70 se retiró en el Turn",
      "Asiento 6: Dakoo44 (botón) se retiró antes del Flop (no apostó)"
    ],
    "river": []
  },
  "board": [
    "As",
    "9s",
    "6s",
    "Ah"
  ],
  "winner": "SrLyce",
  "win_amount": 3.0,
  "sb": 0.01,
  "bb": 0.02,
  "rake": 0.0,
  "raw_text": "Mano n.º 257148968672 de PokerStars:  Hold'em No Limit (0.01 €/0.02 € EUR) - 30-07-2025 21:57:35 CET [30-07-2025 15:57:35 ET]\nMesa \"Sirona\" 6-max El asiento n.º 6 es el botón\nAsiento 1: SrLyce (2.32 € en fichas) \nAsiento 2: lecontrebandier (1.93 € en fichas) \nAsiento 3: christoph363 (4.07 € en fichas) \nAsiento 4: oliverdu70 (2.74 € en fichas) \nAsiento 6: Dakoo44 (1.38 € en fichas) \nSrLyce: pone la ciega pequeña 0.01 €\nlecontrebandier: pone la ciega grande 0.02 €\n*** CARTAS DE MANO ***\nRepartidas a SrLyce [3c Ad]\nchristoph363: se retira \noliverdu70: iguala 0.02 €\nDakoo44: se retira \nSrLyce: iguala 0.01 €\nlecontrebandier: pasa \n*** FLOP *** [As 9s 6s]\nSrLyce: pasa \nlecontrebandier: pasa \noliverdu70: pasa \n*** TURN *** [As 9s 6s] [Ah]\nSrLyce: apuesta 0.06 €\nlecontrebandier: se retira \noliverdu70: se retira \nLa apuesta no igualada (0.06 €) ha sido devuelta a SrLyce\nSrLyce se lleva 0.06 € del bote \nSrLyce: no muestra su mano \n*** RESUMEN ***\nBote total 0.06 € | Comisión 0 € \nComunitarias [As 9s 6s Ah]\nAsiento 1: SrLyce (ciega pequeña) recaudó (0.06 €)\nAsiento 2: lecontrebandier (ciega grande) se retiró en el Turn\nAsiento 3: christoph363 se retiró antes del Flop (no apostó)\nAsiento 4: oliverdu70 se retiró en el Turn\nAsiento 6: Dakoo44 (botón) se retiró antes del Flop (no apostó)"
}