{
  "hand_id": "257237748117",
  "date": "06-08-2025 17:54:08",
  "table": "Euneus III",
  "game_type": "holdem",
  "hero": "SrLyce",
  "hero_position": "",
  "hero_cards": [
    "4s",
    "Ad"
  ],
  "stacks": {
    "DeMula62": 107.0,
    "Il_BM00": 106.5,
    "djrojas9": 147.5,
    "eleuvehache": 95.5,
    "SrLyce": 116.5,
    "t053n": 49.5
  },
  "actions": {
    "preflop": [
      "Asiento 1: DeMula62 (2.14 € en fichas)",
      "Asiento 2: Il_BM00 (2.13 € en fichas)",
      "Asiento 3: djrojas9 (2.95 € en fichas)",
      "Asiento 4: eleuvehache (1.91 € en fichas)",
      "Asiento 5: SrLyce (2.33 € en fichas)",
      "Asiento 6: t053n (0.99 € en fichas)",
      "djrojas9: pone la ciega pequeña 0.01 €",
      "eleuvehache: pone la ciega grande 0.02 €",
      "SrLyce: se retira",
      "t053n: sube 0.04 € a 0.06 €",
      "DeMula62: se retira",
      "Il_BM00: se retira",
      "djrojas9: se retira",
      "eleuvehache: iguala 0.04 €"
    ],
    "flop": [
      "eleuvehache: pasa",
      "t053n: apuesta 0.10 €",
      "eleuvehache: se retira",
      "Asiento 1: DeMula62 se retiró antes del Flop (no apostó)",
      "Asiento 2: Il_BM00 (botón) se retiró antes del Flop (no apostó)",
      "Asiento 3: djrojas9 (ciega pequeña) se retiró antes del Flop",
      "Asiento 4: eleuvehache (ciega grande) se retiró en el Flop",
      "Asiento 5: SrLyce se retiró antes del Flop (no apostó)",
      "Asiento 6: t053n recaudó (0.12 €)"
    ],
    "turn": [],
    "river": []
  },
  "board": [
    "7c",
    "Qd",
    "5s"
  ],
  "winner": "t053n",
  "win_amount": 6.0,
  "sb": 0.01,
  "bb": 0.02,
  "rake": 0.5,
  "raw_text": "Mano n.º 257237748117 de PokerStars:  Hold'em No Limit (0.01 €/0.02 € EUR) - 06-08-2025 17:54:08 CET [06-08-2025 11:54:08 ET]\nMesa \"Euneus III\" 6-max El asiento n.º 2 es el botón\nAsiento 1: DeMula62 (2.14 € en fichas) \nAsiento 2: Il_BM00 (2.13 € en fichas) \nAsiento 3: djrojas9 (2.95 € en fichas) \nAsiento 4: eleuvehache (1.91 € en fichas) \nAsiento 5: SrLyce (2.33 € en fichas) \nAsiento 6: t053n (0.99 € en fichas) \ndjrojas9: pone la ciega pequeña 0.01 €\neleuvehache: pone la ciega grande 0.02 €\n*** CARTAS DE MANO ***\nRepartidas a SrLyce [4s Ad]\nSrLyce: se retira \nt053n: sube 0.04 € a 0.06 €\nDeMula62: se retira \nIl_BM00: se retira \ndjrojas9: se retira \neleuvehache: iguala 0.04 €\n*** FLOP *** [7c Qd 5s]\neleuvehache: pasa \nt053n: apuesta 0.10 €\neleuvehache: se retira \nLa apuesta no igualada (0.10 €) ha sido devuelta a t053n\nt053n se lleva 0.12 € del bote \n*** RESUMEN ***\nBote total 0.13 € | Comisión 0.01 € \nComunitarias [7c Qd 5s]\nAsiento 1: DeMula62 se retiró antes del Flop (no apostó)\nAsiento 2: Il_BM00 (botón) se retiró antes del Flop (no apostó)\nAsiento 3: djrojas9 (ciega pequeña) se retiró antes del Flop\nAsiento 4: eleuvehache (ciega grande) se retiró en el Flop\nAsiento 5: SrLyce se retiró antes del Flop (no apostó)\nAsiento 6: t053n recaudó (0.12 €)"
}