{
  "hand_id": "257168254948",
  "date": "01-08-2025 11:13:43",
  "table": "Atlas",
  "game_type": "holdem",
  "hero": "SrLyce",
  "hero_position": "",
  "hero_cards": [
    "4h",
    "6c"
  ],
  "stacks": {
    "SrLyce": 100.0,
    "Akourdideh": 100.0
  },
  "actions": {
    "preflop": [
      "Asiento 1: SrLyce (2 € en fichas)",
      "Asiento 6: Akourdideh (2 € en fichas)",
      "Akourdideh: pone la ciega pequeña 0.01 €",
      "SrLyce: pone la ciega grande 0.02 €",
      "Akourdideh: se retira",
      "SrLyce: no muestra su mano",
      "Asiento 1: SrLyce (ciega grande) recaudó (0.02 €)",
      "Asiento 6: Akourdideh (botón) (ciega pequeña) se retiró antes del Flop"
    ],
    "flop": [],
    "turn": [],
    "river": []
  },
  "board": [],
  "winner": "SrLyce",
  "win_amount": 1.0,
  "sb": 0.01,
  "bb": 0.02,
  "rake": 0.0,
  "raw_text": "Mano n.º 257168254948 de PokerStars:  Hold'em No Limit (0.01 €/0.02 € EUR) - 01-08-2025 11:13:43 CET [01-08-2025 5:13:43 ET]\nMesa \"Atlas\" 6-max El asiento n.º 6 es el botón\nAsiento 1: SrLyce (2 € en fichas) \nAsiento 6: Akourdideh (2 € en fichas) \nAkourdideh: pone la ciega pequeña 0.01 €\nSrLyce: pone la ciega grande 0.02 €\n*** CARTAS DE MANO ***\nRepartidas a SrLyce [4h 6c]\nFharock se une a la mesa en el asiento n.º 2 \nAkourdideh: se retira \nLa apuesta no igualada (0.01 €) ha sido devuelta a SrLyce\nSrLyce se lleva 0.02 € del bote \nSrLyce: no muestra su mano \n*** RESUMEN ***\nBote total 0.02 € | Comisión 0 € \nAsiento 1: SrLyce (ciega grande) recaudó (0.02 €)\nAsiento 6: Akourdideh (botón) (ciega pequeña) se retiró antes del Flop"
}