{
  "hand_id": "257238363265",
  "date": "06-08-2025 18:51:19",
  "table": "Alruccabah II",
  "game_type": "holdem",
  "hero": "SrLyce",
  "hero_position": "",
  "hero_cards": [
    "9c",
    "5d"
  ],
  "stacks": {
    "SrLyce": 100.0,
    "Davdgoni": 286.0,
    "tatinette35": 100.0,
    "Nicanor Cast": 55.5,
    "rayao32": 46.5
  },
  "actions": {
    "preflop": [
      "Asiento 1: SrLyce (2 € en fichas)",
      "Asiento 2: Davdgoni (5.72 € en fichas)",
      "Asiento 3: tatinette35 (2 € en fichas)",
      "Asiento 4: serviettski(fr) (2 € en fichas)",
      "Asiento 5: Nicanor Cast (1.11 € en fichas)",
      "Asiento 6: rayao32 (0.93 € en fichas)",
      "serviettski(fr): pone la ciega pequeña 0.01 €",
      "Nicanor Cast: pone la ciega grande 0.02 €",
      "rayao32: iguala 0.02 €",
      "SrLyce: se retira",
      "Davdgoni: se retira",
      "tatinette35: se retira",
      "serviettski(fr): se retira",
      "Nicanor Cast: pasa"
    ],
    "flop": [
      "Nicanor Cast: pasa",
      "rayao32: pasa"
    ],
    "turn": [
      "Nicanor Cast: pasa",
      "rayao32: pasa"
    ],
    "river": [
      "Nicanor Cast: pasa",
      "rayao32: apuesta 0.08 €",
      "Nicanor Cast: se retira",
      "Asiento 1: SrLyce se retiró antes del Flop (no apostó)",
      "Asiento 2: Davdgoni se retiró antes del Flop (no apostó)",
      "Asiento 3: tatinette35 (botón) se retiró antes del Flop (no apostó)",
      "Asiento 4: serviettski(fr) (ciega pequeña) se retiró antes del Flop",
      "Asiento 5: Nicanor Cast (ciega grande) se retiró en el River",
      "Asiento 6: rayao32 recaudó (0.05 €)"
    ]
  },
  "board": [
    "5c",
    "2s",
    "8d",
    "3s",
    "Qc"
  ],
  "winner": "rayao32",
  "win_amount": 2.5,
  "sb": 0.01,
  "bb": 0.02,
  "rake": 0.0,
  "raw_text": "Mano n.º 257238363265 de PokerStars:  Hold'em No Limit (0.01 €/0.02 € EUR) - 06-08-2025 18:51:19 CET [06-08-2025 12:51:19 ET]\nMesa \"Alruccabah II\" 6-max El asiento n.º 3 es el botón\nAsiento 1: SrLyce (2 € en fichas) \nAsiento 2: Davdgoni (5.72 € en fichas) \nAsiento 3: tatinette35 (2 € en fichas) \nAsiento 4: serviettski(fr) (2 € en fichas) \nAsiento 5: Nicanor Cast (1.11 € en fichas) \nAsiento 6: rayao32 (0.93 € en fichas) \nserviettski(fr): pone la ciega pequeña 0.01 €\nNicanor Cast: pone la ciega grande 0.02 €\n*** CARTAS DE MANO ***\nRepartidas a SrLyce [9c 5d]\nrayao32: iguala 0.02 €\nSrLyce: se retira \nDavdgoni: se retira \ntatinette35: se retira \nserviettski(fr): se retira \nNicanor Cast: pasa \n*** FLOP *** [5c 2s 8d]\nNicanor Cast: pasa \nrayao32: pasa \n*** TURN *** [5c 2s 8d] [3s]\nNicanor Cast: pasa \nrayao32: pasa \n*** RIVER *** [5c 2s 8d 3s] [Qc]\nNicanor Cast: pasa \nrayao32: apuesta 0.08 €\nNicanor Cast: se retira \nLa apuesta no igualada (0.08 €) ha sido devuelta a rayao32\nrayao32 se lleva 0.05 € del bote \n*** RESUMEN ***\nBote total 0.05 € | Comisión 0 € \nComunitarias [5c 2s 8d 3s Qc]\nAsiento 1: SrLyce se retiró antes del Flop (no apostó)\nAsiento 2: Davdgoni se retiró antes del Flop (no apostó)\nAsiento 3: tatinette35 (botón) se retiró antes del Flop (no apostó)\nAsiento 4: serviettski(fr) (ciega pequeña) se retiró antes del Flop\nAsiento 5: Nicanor Cast (ciega grande) se retiró en el River\nAsiento 6: rayao32 recaudó (0.05 €)"
}