{
  "hand_id": "257149091411",
  "date": "30-07-2025 22:07:23",
  "table": "Sirona",
  "game_type": "holdem",
  "hero": "SrLyce",
  "hero_position": "",
  "hero_cards": [
    "6h",
    "2d"
  ],
  "stacks": {
    "SrLyce": 141.0,
    "lecontrebandier": 73.5,
    "christoph363": 213.0,
    "oliverdu70": 186.0,
    "MitchATP65": 100.0
  },
  "actions": {
    "preflop": [
      "Asiento 1: SrLyce (2.82 € en fichas)",
      "Asiento 2: lecontrebandier (1.47 € en fichas)",
      "Asiento 3: christoph363 (4.26 € en fichas)",
      "Asiento 4: oliverdu70 (3.72 € en fichas)",
      "Asiento 6: MitchATP65 (2 € en fichas)",
      "SrLyce: pone la ciega pequeña 0.01 €",
      "lecontrebandier: pone la ciega grande 0.02 €",
      "christoph363: se retira",
      "oliverdu70: se retira",
      "MitchATP65: se retira",
      "SrLyce: se retira",
      "lecontrebandier: no muestra su mano",
      "Asiento 1: SrLyce (ciega pequeña) se retiró antes del Flop",
      "Asiento 2: lecontrebandier (ciega grande) recaudó (0.02 €)",
      "Asiento 3: christoph363 se retiró antes del Flop (no apostó)",
      "Asiento 4: oliverdu70 se retiró antes del Flop (no apostó)",
      "Asiento 6: MitchATP65 (botón) se retiró antes del Flop (no apostó)"
    ],
    "flop": [],
    "turn": [],
    "river": []
  },
  "board": [],
  "winner": "lecontrebandier",
  "win_amount": 1.0,
  "sb": 0.01,
  "bb": 0.02,
  "rake": 0.0,
  "raw_text": "Mano n.º 257149091411 de PokerStars:  Hold'em No Limit (0.01 €/0.02 € EUR) - 30-07-2025 22:07:23 CET [30-07-2025 16:07:23 ET]\nMesa \"Sirona\" 6-max El asiento n.º 6 es el botón\nAsiento 1: SrLyce (2.82 € en fichas) \nAsiento 2: lecontrebandier (1.47 € en fichas) \nAsiento 3: christoph363 (4.26 € en fichas) \nAsiento 4: oliverdu70 (3.72 € en fichas) \nAsiento 6: MitchATP65 (2 € en fichas) \nSrLyce: pone la ciega pequeña 0.01 €\nlecontrebandier: pone la ciega grande 0.02 €\n*** CARTAS DE MANO ***\nRepartidas a SrLyce [6h 2d]\nchristoph363: se retira \noliverdu70: se retira \nMitchATP65: se retira \nSrLyce: se retira \nLa apuesta no igualada (0.01 €) ha sido devuelta a lecontrebandier\nlecontrebandier se lleva 0.02 € del bote \nlecontrebandier: no muestra su mano \n*** RESUMEN ***\nBote total 0.02 € | Comisión 0 € \nAsiento 1: SrLyce (ciega pequeña) se retiró antes del Flop\nAsiento 2: lecontrebandier (ciega grande) recaudó (0.02 €)\nAsiento 3: christoph363 se retiró antes del Flop (no apostó)\nAsiento 4: oliverdu70 se retiró antes del Flop (no apostó)\nAsiento 6: MitchATP65 (botón) se retiró antes del Flop (no apostó)"
}