{
  "hand_id": "257237763395",
  "date": "06-08-2025 17:55:44",
  "table": "Euneus III",
  "game_type": "holdem",
  "hero": "SrLyce",
  "hero_position": "",
  "hero_cards": [
    "2c",
    "8h"
  ],
  "stacks": {
    "DeMula62": 107.0,
    "Il_BM00": 112.0,
    "djrojas9": 147.0,
    "eleuvehache": 89.5,
    "SrLyce": 113.5
  },
  "actions": {
    "preflop": [
      "Asiento 1: DeMula62 (2.14 € en fichas)",
      "Asiento 2: Il_BM00 (2.24 € en fichas)",
      "Asiento 3: djrojas9 (2.94 € en fichas)",
      "Asiento 4: eleuvehache (1.79 € en fichas)",
      "Asiento 5: SrLyce (2.27 € en fichas)",
      "SrLyce: pone la ciega pequeña 0.01 €",
      "DeMula62: pone la ciega grande 0.02 €",
      "Il_BM00: sube 0.04 € a 0.06 €",
      "djrojas9: se retira",
      "eleuvehache: iguala 0.06 €",
      "SrLyce: se retira",
      "DeMula62: sube 0.22 € a 0.28 €",
      "Il_BM00: se retira",
      "eleuvehache: iguala 0.22 €"
    ],
    "flop": [
      "DeMula62: apuesta 0.18 €",
      "eleuvehache: iguala 0.18 €"
    ],
    "turn": [
      "DeMula62: apuesta 0.30 €",
      "eleuvehache: sube 1.03 € a 1.33 € y está all-in",
      "DeMula62: se retira",
      "eleuvehache: no muestra su mano",
      "Asiento 1: DeMula62 (ciega grande) se retiró en el Turn",
      "Asiento 2: Il_BM00 se retiró antes del Flop",
      "Asiento 3: djrojas9 se retiró antes del Flop (no apostó)",
      "Asiento 4: eleuvehache (botón) recaudó (1.49 €)",
      "Asiento 5: SrLyce (ciega pequeña) se retiró antes del Flop"
    ],
    "river": []
  },
  "board": [
    "8c",
    "Ks",
    "Th",
    "Qc"
  ],
  "winner": "eleuvehache",
  "win_amount": 74.5,
  "sb": 0.01,
  "bb": 0.02,
  "rake": 5.0,
  "raw_text": "Mano n.º 257237763395 de PokerStars:  Hold'em No Limit (0.01 €/0.02 € EUR) - 06-08-2025 17:55:44 CET [06-08-2025 11:55:44 ET]\nMesa \"Euneus III\" 6-max El asiento n.º 4 es el botón\nAsiento 1: DeMula62 (2.14 € en fichas) \nAsiento 2: Il_BM00 (2.24 € en fichas) \nAsiento 3: djrojas9 (2.94 € en fichas) \nAsiento 4: eleuvehache (1.79 € en fichas) \nAsiento 5: SrLyce (2.27 € en fichas) \nSrLyce: pone la ciega pequeña 0.01 €\nDeMula62: pone la ciega grande 0.02 €\n*** CARTAS DE MANO ***\nRepartidas a SrLyce [2c 8h]\nIl_BM00: sube 0.04 € a 0.06 €\ndjrojas9: se retira \neleuvehache: iguala 0.06 €\nSrLyce: se retira \nDeMula62: sube 0.22 € a 0.28 €\nIl_BM00: se retira \neleuvehache: iguala 0.22 €\n*** FLOP *** [8c Ks Th]\nDeMula62: apuesta 0.18 €\neleuvehache: iguala 0.18 €\n*** TURN *** [8c Ks Th] [Qc]\nDeMula62: apuesta 0.30 €\neleuvehache: sube 1.03 € a 1.33 € y está all-in\nDeMula62: se retira \nLa apuesta no igualada (1.03 €) ha sido devuelta a eleuvehache\neleuvehache se lleva 1.49 € del bote \neleuvehache: no muestra su mano \n*** RESUMEN ***\nBote total 1.59 € | Comisión 0.10 € \nComunitarias [8c Ks Th Qc]\nAsiento 1: DeMula62 (ciega grande) se retiró en el Turn\nAsiento 2: Il_BM00 se retiró antes del Flop\nAsiento 3: djrojas9 se retiró antes del Flop (no apostó)\nAsiento 4: eleuvehache (botón) recaudó (1.49 €)\nAsiento 5: SrLyce (ciega pequeña) se retiró antes del Flop"
}