{
  "hand_id": "257238442502",
  "date": "06-08-2025 18:59:23",
  "table": "Herculina II",
  "game_type": "holdem",
  "hero": "SrLyce",
  "hero_position": "",
  "hero_cards": [
    "5c",
    "Ks"
  ],
  "stacks": {
    "koldipk": 184.0,
    "David98X": 100.0,
    "JJer11": 200.0,
    "SrLyce": 104.5,
    "Macklemore0": 100.0,
    "ScarvBlack": 119.0
  },
  "actions": {
    "preflop": [
      "Asiento 1: koldipk (3.68 € en fichas)",
      "Asiento 2: David98X (2 € en fichas)",
      "Asiento 3: JJer11 (4 € en fichas)",
      "Asiento 4: SrLyce (2.09 € en fichas)",
      "Asiento 5: Macklemore0 (2 € en fichas)",
      "Asiento 6: ScarvBlack (2.38 € en fichas)",
      "koldipk: pone la ciega pequeña 0.01 €",
      "David98X: pone la ciega grande 0.02 €",
      "JJer11: se retira",
      "SrLyce: se retira",
      "Macklemore0: se retira",
      "ScarvBlack: se retira",
      "koldipk: sube 0.04 € a 0.06 €",
      "David98X: iguala 0.04 €"
    ],
    "flop": [
      "koldipk: pasa",
      "David98X: apuesta 0.04 €",
      "koldipk: iguala 0.04 €"
    ],
    "turn": [
      "koldipk: pasa",
      "David98X: apuesta 0.29 €",
      "koldipk: iguala 0.29 €"
    ],
    "river": [
      "koldipk: pasa",
      "David98X: apuesta 1.10 €",
      "koldipk: se retira",
      "David98X: no muestra su mano",
      "Asiento 1: koldipk (ciega pequeña) se retiró en el River",
      "Asiento 2: David98X (ciega grande) recaudó (0.73 €)",
      "Asiento 3: JJer11 se retiró antes del Flop (no apostó)",
      "Asiento 4: SrLyce se retiró antes del Flop (no apostó)",
      "Asiento 5: Macklemore0 se retiró antes del Flop (no apostó)",
      "Asiento 6: ScarvBlack (botón) se retiró antes del Flop (no apostó)"
    ]
  },
  "board": [
    "3c",
    "3h",
    "Kh",
    "5s",
    "2d"
  ],
  "winner": "David98X",
  "win_amount": 36.5,
  "sb": 0.01,
  "bb": 0.02,
  "rake": 2.5,
  "raw_text": "Mano n.º 257238442502 de PokerStars:  Hold'em No Limit (0.01 €/0.02 € EUR) - 06-08-2025 18:59:23 CET [06-08-2025 12:59:23 ET]\nMesa \"Herculina II\" 6-max El asiento n.º 6 es el botón\nAsiento 1: koldipk (3.68 € en fichas) \nAsiento 2: David98X (2 € en fichas) \nAsiento 3: JJer11 (4 € en fichas) \nAsiento 4: SrLyce (2.09 € en fichas) \nAsiento 5: Macklemore0 (2 € en fichas) \nAsiento 6: ScarvBlack (2.38 € en fichas) \nkoldipk: pone la ciega pequeña 0.01 €\nDavid98X: pone la ciega grande 0.02 €\n*** CARTAS DE MANO ***\nRepartidas a SrLyce [5c Ks]\nJJer11: se retira \nSrLyce: se retira \nMacklemore0: se retira \nScarvBlack: se retira \nkoldipk: sube 0.04 € a 0.06 €\nDavid98X: iguala 0.04 €\n*** FLOP *** [3c 3h Kh]\nkoldipk: pasa \nDavid98X: apuesta 0.04 €\nkoldipk: iguala 0.04 €\n*** TURN *** [3c 3h Kh] [5s]\nkoldipk: pasa \nDavid98X: apuesta 0.29 €\nkoldipk: iguala 0.29 €\n*** RIVER *** [3c 3h Kh 5s] [2d]\nkoldipk: pasa \nDavid98X: apuesta 1.10 €\nkoldipk: se retira \nLa apuesta no igualada (1.10 €) ha sido devuelta a David98X\nDavid98X se lleva 0.73 € del bote \nDavid98X: no muestra su mano \n*** RESUMEN ***\nBote total 0.78 € | Comisión 0.05 € \nComunitarias [3c 3h Kh 5s 2d]\nAsiento 1: koldipk (ciega pequeña) se retiró en el River\nAsiento 2: David98X (ciega grande) recaudó (0.73 €)\nAsiento 3: JJer11 se retiró antes del Flop (no apostó)\nAsiento 4: SrLyce se retiró antes del Flop (no apostó)\nAsiento 5: Macklemore0 se retiró antes del Flop (no apostó)\nAsiento 6: ScarvBlack (botón) se retiró antes del Flop (no apostó)"
}