{
  "hand_id": "257168311580",
  "date": "01-08-2025 11:24:33",
  "table": "Jupiter",
  "game_type": "holdem",
  "hero": "SrLyce",
  "hero_position": "",
  "hero_cards": [
    "Qs",
    "9c"
  ],
  "stacks": {
    "sifilis5": 95.0,
    "Filou203": 113.0,
    "SrLyce": 118.5,
    "LOLA19711971": 30.5,
    "dadou13mars": 214.5,
    "Alvii37": 108.0
  },
  "actions": {
    "preflop": [
      "Asiento 1: sifilis5 (1.90 € en fichas)",
      "Asiento 2: Filou203 (2.26 € en fichas)",
      "Asiento 3: SrLyce (2.37 € en fichas)",
      "Asiento 4: LOLA19711971 (0.61 € en fichas)",
      "Asiento 5: dadou13mars (4.29 € en fichas)",
      "Asiento 6: Alvii37 (2.16 € en fichas)",
      "dadou13mars: pone la ciega pequeña 0.01 €",
      "Alvii37: pone la ciega grande 0.02 €",
      "sifilis5: se retira",
      "Filou203: se retira",
      "SrLyce: se retira",
      "LOLA19711971: se retira",
      "dadou13mars: se retira",
      "Alvii37: no muestra su mano",
      "Asiento 1: sifilis5 se retiró antes del Flop (no apostó)",
      "Asiento 2: Filou203 se retiró antes del Flop (no apostó)",
      "Asiento 3: SrLyce se retiró antes del Flop (no apostó)",
      "Asiento 4: LOLA19711971 (botón) se retiró antes del Flop (no apostó)",
      "Asiento 5: dadou13mars (ciega pequeña) se retiró antes del Flop",
      "Asiento 6: Alvii37 (ciega grande) recaudó (0.02 €)"
    ],
    "flop": [],
    "turn": [],
    "river": []
  },
  "board": [],
  "winner": "Alvii37",
  "win_amount": 1.0,
  "sb": 0.01,
  "bb": 0.02,
  "rake": 0.0,
  "raw_text": "Mano n.º 257168311580 de PokerStars:  Hold'em No Limit (0.01 €/0.02 € EUR) - 01-08-2025 11:24:33 CET [01-08-2025 5:24:33 ET]\nMesa \"Jupiter\" 6-max El asiento n.º 4 es el botón\nAsiento 1: sifilis5 (1.90 € en fichas) \nAsiento 2: Filou203 (2.26 € en fichas) \nAsiento 3: SrLyce (2.37 € en fichas) \nAsiento 4: LOLA19711971 (0.61 € en fichas) \nAsiento 5: dadou13mars (4.29 € en fichas) \nAsiento 6: Alvii37 (2.16 € en fichas) \ndadou13mars: pone la ciega pequeña 0.01 €\nAlvii37: pone la ciega grande 0.02 €\n*** CARTAS DE MANO ***\nRepartidas a SrLyce [Qs 9c]\nsifilis5: se retira \nFilou203: se retira \nSrLyce: se retira \nLOLA19711971: se retira \ndadou13mars: se retira \nLa apuesta no igualada (0.01 €) ha sido devuelta a Alvii37\nAlvii37 se lleva 0.02 € del bote \nAlvii37: no muestra su mano \n*** RESUMEN ***\nBote total 0.02 € | Comisión 0 € \nAsiento 1: sifilis5 se retiró antes del Flop (no apostó)\nAsiento 2: Filou203 se retiró antes del Flop (no apostó)\nAsiento 3: SrLyce se retiró antes del Flop (no apostó)\nAsiento 4: LOLA19711971 (botón) se retiró antes del Flop (no apostó)\nAsiento 5: dadou13mars (ciega pequeña) se retiró antes del Flop\nAsiento 6: Alvii37 (ciega grande) recaudó (0.02 €)"
}