{
  "hand_id": "257238254806",
  "date": "06-08-2025 18:41:49",
  "table": "Alruccabah II",
  "game_type": "holdem",
  "hero": "SrLyce",
  "hero_position": "",
  "hero_cards": [
    "Jc",
    "3s"
  ],
  "stacks": {
    "rayao32": 52.0,
    "SrLyce": 91.0,
    "Davdgoni": 265.5,
    "PerroBestia": 55.5,
    "Nicanor Cast": 51.5
  },
  "actions": {
    "preflop": [
      "Asiento 6: rayao32 (1.04 € en fichas) está ausente",
      "Asiento 1: SrLyce (1.82 € en fichas)",
      "Asiento 2: Davdgoni (5.31 € en fichas)",
      "Asiento 3: PerroBestia (1.11 € en fichas)",
      "Asiento 4: serviettski(fr) (2 € en fichas)",
      "Asiento 5: Nicanor Cast (1.03 € en fichas)",
      "SrLyce: pone la ciega pequeña 0.01 €",
      "Davdgoni: pone la ciega grande 0.02 €",
      "PerroBestia: se retira",
      "serviettski(fr): se retira",
      "Nicanor Cast: se retira",
      "SrLyce: se retira",
      "Davdgoni: no muestra su mano",
      "Asiento 6: rayao32",
      "Asiento 1: SrLyce (ciega pequeña) se retiró antes del Flop",
      "Asiento 2: Davdgoni (ciega grande) recaudó (0.02 €)",
      "Asiento 3: PerroBestia se retiró antes del Flop (no apostó)",
      "Asiento 4: serviettski(fr) se retiró antes del Flop (no apostó)",
      "Asiento 5: Nicanor Cast (botón) se retiró antes del Flop (no apostó)"
    ],
    "flop": [],
    "turn": [],
    "river": []
  },
  "board": [],
  "winner": "Davdgoni",
  "win_amount": 1.0,
  "sb": 0.01,
  "bb": 0.02,
  "rake": 0.0,
  "raw_text": "Mano n.º 257238254806 de PokerStars:  Hold'em No Limit (0.01 €/0.02 € EUR) - 06-08-2025 18:41:49 CET [06-08-2025 12:41:49 ET]\nMesa \"Alruccabah II\" 6-max El asiento n.º 5 es el botón\nAsiento 6: rayao32 (1.04 € en fichas) está ausente\nAsiento 1: SrLyce (1.82 € en fichas) \nAsiento 2: Davdgoni (5.31 € en fichas) \nAsiento 3: PerroBestia (1.11 € en fichas) \nAsiento 4: serviettski(fr) (2 € en fichas) \nAsiento 5: Nicanor Cast (1.03 € en fichas) \nSrLyce: pone la ciega pequeña 0.01 €\nDavdgoni: pone la ciega grande 0.02 €\n*** CARTAS DE MANO ***\nRepartidas a SrLyce [Jc 3s]\nPerroBestia: se retira \nserviettski(fr): se retira \nNicanor Cast: se retira \nSrLyce: se retira \nLa apuesta no igualada (0.01 €) ha sido devuelta a Davdgoni\nDavdgoni se lleva 0.02 € del bote \nDavdgoni: no muestra su mano \n*** RESUMEN ***\nBote total 0.02 € | Comisión 0 € \nAsiento 6: rayao32\nAsiento 1: SrLyce (ciega pequeña) se retiró antes del Flop\nAsiento 2: Davdgoni (ciega grande) recaudó (0.02 €)\nAsiento 3: PerroBestia se retiró antes del Flop (no apostó)\nAsiento 4: serviettski(fr) se retiró antes del Flop (no apostó)\nAsiento 5: Nicanor Cast (botón) se retiró antes del Flop (no apostó)"
}