{
  "hand_id": "257149027515",
  "date": "30-07-2025 22:02:53",
  "table": "Sirona",
  "game_type": "holdem",
  "hero": "SrLyce",
  "hero_position": "",
  "hero_cards": [
    "5c",
    "3c"
  ],
  "stacks": {
    "Dakoo44": 0.0,
    "SrLyce": 121.0,
    "lecontrebandier": 93.0,
    "christoph363": 210.0,
    "oliverdu70": 187.0,
    "NaruchoH1": 100.0
  },
  "actions": {
    "preflop": [
      "Asiento 6: Dakoo44 (0 € en fichas) está ausente",
      "Asiento 1: SrLyce (2.42 € en fichas)",
      "Asiento 2: lecontrebandier (1.86 € en fichas)",
      "Asiento 3: christoph363 (4.20 € en fichas)",
      "Asiento 4: oliverdu70 (3.74 € en fichas)",
      "Asiento 5: NaruchoH1 (2 € en fichas)",
      "christoph363: pone la ciega pequeña 0.01 €",
      "oliverdu70: pone la ciega grande 0.02 €",
      "NaruchoH1: se retira",
      "SrLyce: se retira",
      "lecontrebandier: se retira",
      "christoph363: se retira",
      "Asiento 6: Dakoo44",
      "Asiento 1: SrLyce se retiró antes del Flop (no apostó)",
      "Asiento 2: lecontrebandier (botón) se retiró antes del Flop (no apostó)",
      "Asiento 3: christoph363 (ciega pequeña) se retiró antes del Flop",
      "Asiento 4: oliverdu70 (ciega grande) recaudó (0.02 €)",
      "Asiento 5: NaruchoH1 se retiró antes del Flop (no apostó)"
    ],
    "flop": [],
    "turn": [],
    "river": []
  },
  "board": [],
  "winner": "oliverdu70",
  "win_amount": 1.0,
  "sb": 0.01,
  "bb": 0.02,
  "rake": 0.0,
  "raw_text": "Mano n.º 257149027515 de PokerStars:  Hold'em No Limit (0.01 €/0.02 € EUR) - 30-07-2025 22:02:53 CET [30-07-2025 16:02:53 ET]\nMesa \"Sirona\" 6-max El asiento n.º 2 es el botón\nAsiento 6: Dakoo44 (0 € en fichas) está ausente\nAsiento 1: SrLyce (2.42 € en fichas) \nAsiento 2: lecontrebandier (1.86 € en fichas) \nAsiento 3: christoph363 (4.20 € en fichas) \nAsiento 4: oliverdu70 (3.74 € en fichas) \nAsiento 5: NaruchoH1 (2 € en fichas) \nchristoph363: pone la ciega pequeña 0.01 €\noliverdu70: pone la ciega grande 0.02 €\n*** CARTAS DE MANO ***\nRepartidas a SrLyce [5c 3c]\nNaruchoH1: se retira \nDakoo44 deja la mesa\nSrLyce: se retira \nlecontrebandier: se retira \nchristoph363: se retira \nLa apuesta no igualada (0.01 €) ha sido devuelta a oliverdu70\noliverdu70 se lleva 0.02 € del bote \n*** RESUMEN ***\nBote total 0.02 € | Comisión 0 € \nAsiento 6: Dakoo44\nAsiento 1: SrLyce se retiró antes del Flop (no apostó)\nAsiento 2: lecontrebandier (botón) se retiró antes del Flop (no apostó)\nAsiento 3: christoph363 (ciega pequeña) se retiró antes del Flop\nAsiento 4: oliverdu70 (ciega grande) recaudó (0.02 €)\nAsiento 5: NaruchoH1 se retiró antes del Flop (no apostó)"
}