{
  "hand_id": "257237578664",
  "date": "06-08-2025 17:37:50",
  "table": "Themisto III",
  "game_type": "holdem",
  "hero": "SrLyce",
  "hero_position": "",
  "hero_cards": [
    "Th",
    "8d"
  ],
  "stacks": {
    "elso253": 78.0,
    "SrLyce": 114.5,
    "idigon": 13.5,
    "fred2d23po": 77.5,
    "mivipkr": 124.0,
    "marignamo": 90.5
  },
  "actions": {
    "preflop": [
      "Asiento 1: elso253 (1.56 € en fichas)",
      "Asiento 2: SrLyce (2.29 € en fichas)",
      "Asiento 3: idigon (0.27 € en fichas)",
      "Asiento 4: fred2d23po (1.55 € en fichas)",
      "Asiento 5: mivipkr (2.48 € en fichas)",
      "Asiento 6: marignamo (1.81 € en fichas)",
      "fred2d23po: pone la ciega pequeña 0.01 €",
      "mivipkr: pone la ciega grande 0.02 €",
      "marignamo: se retira",
      "elso253: se retira",
      "SrLyce: sube 0.04 € a 0.06 €",
      "idigon: iguala 0.06 €",
      "fred2d23po: se retira",
      "mivipkr: iguala 0.04 €"
    ],
    "flop": [
      "mivipkr: apuesta 0.05 €",
      "SrLyce: iguala 0.05 €",
      "idigon: se retira"
    ],
    "turn": [
      "mivipkr: apuesta 0.20 €",
      "SrLyce: sube 0.34 € a 0.54 €",
      "mivipkr: se retira",
      "SrLyce: no muestra su mano",
      "Asiento 1: elso253 se retiró antes del Flop (no apostó)",
      "Asiento 2: SrLyce recaudó (0.65 €)",
      "Asiento 3: idigon (botón) se retiró en el Flop",
      "Asiento 4: fred2d23po (ciega pequeña) se retiró antes del Flop",
      "Asiento 5: mivipkr (ciega grande) se retiró en el Turn",
      "Asiento 6: marignamo se retiró antes del Flop (no apostó)"
    ],
    "river": []
  },
  "board": [
    "9h",
    "2c",
    "Js",
    "7c"
  ],
  "winner": "SrLyce",
  "win_amount": 32.5,
  "sb": 0.01,
  "bb": 0.02,
  "rake": 2.0,
  "raw_text": "Mano n.º 257237578664 de PokerStars:  Hold'em No Limit (0.01 €/0.02 € EUR) - 06-08-2025 17:37:50 CET [06-08-2025 11:37:50 ET]\nMesa \"Themisto III\" 6-max El asiento n.º 3 es el botón\nAsiento 1: elso253 (1.56 € en fichas) \nAsiento 2: SrLyce (2.29 € en fichas) \nAsiento 3: idigon (0.27 € en fichas) \nAsiento 4: fred2d23po (1.55 € en fichas) \nAsiento 5: mivipkr (2.48 € en fichas) \nAsiento 6: marignamo (1.81 € en fichas) \nfred2d23po: pone la ciega pequeña 0.01 €\nmivipkr: pone la ciega grande 0.02 €\n*** CARTAS DE MANO ***\nRepartidas a SrLyce [Th 8d]\nmarignamo: se retira \nelso253: se retira \nSrLyce: sube 0.04 € a 0.06 €\nidigon: iguala 0.06 €\nfred2d23po: se retira \nmivipkr: iguala 0.04 €\n*** FLOP *** [9h 2c Js]\nmivipkr: apuesta 0.05 €\nSrLyce: iguala 0.05 €\nidigon: se retira \n*** TURN *** [9h 2c Js] [7c]\nmivipkr: apuesta 0.20 €\nSrLyce: sube 0.34 € a 0.54 €\nmivipkr: se retira \nLa apuesta no igualada (0.34 €) ha sido devuelta a SrLyce\nSrLyce se lleva 0.65 € del bote \nSrLyce: no muestra su mano \n*** RESUMEN ***\nBote total 0.69 € | Comisión 0.04 € \nComunitarias [9h 2c Js 7c]\nAsiento 1: elso253 se retiró antes del Flop (no apostó)\nAsiento 2: SrLyce recaudó (0.65 €)\nAsiento 3: idigon (botón) se retiró en el Flop\nAsiento 4: fred2d23po (ciega pequeña) se retiró antes del Flop\nAsiento 5: mivipkr (ciega grande) se retiró en el Turn\nAsiento 6: marignamo se retiró antes del Flop (no apostó)"
}