{
  "hand_id": "257238567142",
  "date": "06-08-2025 19:10:38",
  "table": "Adelaide III",
  "game_type": "holdem",
  "hero": "SrLyce",
  "hero_position": "",
  "hero_cards": [
    "Ad",
    "2d"
  ],
  "stacks": {
    "Alceo27": 100.0,
    "aliendee07": 68.0,
    "Macklemore0": 103.0,
    "SrLyce": 88.5,
    "ismagonzalez7": 67.5,
    "pauquair5": 61.0
  },
  "actions": {
    "preflop": [
      "Asiento 1: Alceo27 (2 € en fichas) está ausente",
      "Asiento 2: aliendee07 (1.36 € en fichas)",
      "Asiento 3: Macklemore0 (2.06 € en fichas)",
      "Asiento 4: SrLyce (1.77 € en fichas)",
      "Asiento 5: ismagonzalez7 (1.35 € en fichas)",
      "Asiento 6: pauquair5 (1.22 € en fichas)",
      "Macklemore0: pone la ciega pequeña 0.01 €",
      "SrLyce: pone la ciega grande 0.02 €",
      "Alceo27: se ausenta",
      "ismagonzalez7: se retira",
      "pauquair5: se retira",
      "aliendee07: se retira",
      "Macklemore0: se retira",
      "SrLyce: no muestra su mano",
      "Asiento 1: Alceo27",
      "Asiento 2: aliendee07 (botón) se retiró antes del Flop (no apostó)",
      "Asiento 3: Macklemore0 (ciega pequeña) se retiró antes del Flop",
      "Asiento 4: SrLyce (ciega grande) recaudó (0.02 €)",
      "Asiento 5: ismagonzalez7 se retiró antes del Flop (no apostó)",
      "Asiento 6: pauquair5 se retiró antes del Flop (no apostó)"
    ],
    "flop": [],
    "turn": [],
    "river": []
  },
  "board": [],
  "winner": "SrLyce",
  "win_amount": 1.0,
  "sb": 0.01,
  "bb": 0.02,
  "rake": 0.0,
  "raw_text": "Mano n.º 257238567142 de PokerStars:  Hold'em No Limit (0.01 €/0.02 € EUR) - 06-08-2025 19:10:38 CET [06-08-2025 13:10:38 ET]\nMesa \"Adelaide III\" 6-max El asiento n.º 2 es el botón\nAsiento 1: Alceo27 (2 € en fichas) está ausente\nAsiento 2: aliendee07 (1.36 € en fichas) \nAsiento 3: Macklemore0 (2.06 € en fichas) \nAsiento 4: SrLyce (1.77 € en fichas) \nAsiento 5: ismagonzalez7 (1.35 € en fichas) \nAsiento 6: pauquair5 (1.22 € en fichas) \nMacklemore0: pone la ciega pequeña 0.01 €\nSrLyce: pone la ciega grande 0.02 €\nAlceo27: se ausenta \n*** CARTAS DE MANO ***\nRepartidas a SrLyce [Ad 2d]\nismagonzalez7: se retira \npauquair5: se retira \naliendee07: se retira \nMacklemore0: se retira \nLa apuesta no igualada (0.01 €) ha sido devuelta a SrLyce\nSrLyce se lleva 0.02 € del bote \nSrLyce: no muestra su mano \n*** RESUMEN ***\nBote total 0.02 € | Comisión 0 € \nAsiento 1: Alceo27\nAsiento 2: aliendee07 (botón) se retiró antes del Flop (no apostó)\nAsiento 3: Macklemore0 (ciega pequeña) se retiró antes del Flop\nAsiento 4: SrLyce (ciega grande) recaudó (0.02 €)\nAsiento 5: ismagonzalez7 se retiró antes del Flop (no apostó)\nAsiento 6: pauquair5 se retiró antes del Flop (no apostó)"
}