{
  "hand_id": "257238491167",
  "date": "06-08-2025 19:04:06",
  "table": "Herculina II",
  "game_type": "holdem",
  "hero": "SrLyce",
  "hero_position": "",
  "hero_cards": [
    "3c",
    "9c"
  ],
  "stacks": {
    "koldipk": 160.0,
    "David98X": 128.0,
    "JJer11": 209.0,
    "SrLyce": 101.0,
    "Macklemore0": 100.0,
    "ScarvBlack": 116.0
  },
  "actions": {
    "preflop": [
      "Asiento 1: koldipk (3.20 € en fichas)",
      "Asiento 2: David98X (2.56 € en fichas)",
      "Asiento 3: JJer11 (4.18 € en fichas)",
      "Asiento 4: SrLyce (2.02 € en fichas)",
      "Asiento 5: Macklemore0 (2 € en fichas)",
      "Asiento 6: ScarvBlack (2.32 € en fichas)",
      "David98X: pone la ciega pequeña 0.01 €",
      "JJer11: pone la ciega grande 0.02 €",
      "SrLyce: se retira",
      "Macklemore0: se retira",
      "ScarvBlack: sube 0.04 € a 0.06 €",
      "koldipk: se retira",
      "David98X: se retira",
      "JJer11: se retira",
      "ScarvBlack: no muestra su mano",
      "Asiento 1: koldipk (botón) se retiró antes del Flop (no apostó)",
      "Asiento 2: David98X (ciega pequeña) se retiró antes del Flop",
      "Asiento 3: JJer11 (ciega grande) se retiró antes del Flop",
      "Asiento 4: SrLyce se retiró antes del Flop (no apostó)",
      "Asiento 5: Macklemore0 se retiró antes del Flop (no apostó)",
      "Asiento 6: ScarvBlack recaudó (0.05 €)"
    ],
    "flop": [],
    "turn": [],
    "river": []
  },
  "board": [],
  "winner": "ScarvBlack",
  "win_amount": 2.5,
  "sb": 0.01,
  "bb": 0.02,
  "rake": 0.0,
  "raw_text": "Mano n.º 257238491167 de PokerStars:  Hold'em No Limit (0.01 €/0.02 € EUR) - 06-08-2025 19:04:06 CET [06-08-2025 13:04:06 ET]\nMesa \"Herculina II\" 6-max El asiento n.º 1 es el botón\nAsiento 1: koldipk (3.20 € en fichas) \nAsiento 2: David98X (2.56 € en fichas) \nAsiento 3: JJer11 (4.18 € en fichas) \nAsiento 4: SrLyce (2.02 € en fichas) \nAsiento 5: Macklemore0 (2 € en fichas) \nAsiento 6: ScarvBlack (2.32 € en fichas) \nDavid98X: pone la ciega pequeña 0.01 €\nJJer11: pone la ciega grande 0.02 €\n*** CARTAS DE MANO ***\nRepartidas a SrLyce [3c 9c]\nSrLyce: se retira \nMacklemore0: se retira \nScarvBlack: sube 0.04 € a 0.06 €\nkoldipk: se retira \nDavid98X: se retira \nJJer11: se retira \nLa apuesta no igualada (0.04 €) ha sido devuelta a ScarvBlack\nScarvBlack se lleva 0.05 € del bote \nScarvBlack: no muestra su mano \n*** RESUMEN ***\nBote total 0.05 € | Comisión 0 € \nAsiento 1: koldipk (botón) se retiró antes del Flop (no apostó)\nAsiento 2: David98X (ciega pequeña) se retiró antes del Flop\nAsiento 3: JJer11 (ciega grande) se retiró antes del Flop\nAsiento 4: SrLyce se retiró antes del Flop (no apostó)\nAsiento 5: Macklemore0 se retiró antes del Flop (no apostó)\nAsiento 6: ScarvBlack recaudó (0.05 €)"
}