{
  "hand_id": "257238163477",
  "date": "06-08-2025 18:33:42",
  "table": "Patientia III",
  "game_type": "holdem",
  "hero": "SrLyce",
  "hero_position": "",
  "hero_cards": [
    "4c",
    "6h"
  ],
  "stacks": {
    "Phryxz": 123.0,
    "SrLyce": 71.0,
    "chordewman": 110.5,
    "lehamock": 100.0,
    "niyomalo": 85.0
  },
  "actions": {
    "preflop": [
      "Asiento 1: Phryxz (2.46 € en fichas)",
      "Asiento 2: serviettski(fr) (2.53 € en fichas)",
      "Asiento 3: SrLyce (1.42 € en fichas)",
      "Asiento 4: chordewman (2.21 € en fichas)",
      "Asiento 5: lehamock (2 € en fichas)",
      "Asiento 6: niyomalo (1.70 € en fichas)",
      "Phryxz: pone la ciega pequeña 0.01 €",
      "serviettski(fr): pone la ciega grande 0.02 €",
      "lehamock: pone la ciega grande 0.02 €",
      "SrLyce: se retira",
      "chordewman: sube 0.03 € a 0.05 €",
      "lehamock: sube 0.03 € a 0.08 €",
      "niyomalo: se retira",
      "Phryxz: se retira",
      "serviettski(fr): se retira",
      "chordewman: iguala 0.03 €"
    ],
    "flop": [
      "chordewman: pasa",
      "lehamock: apuesta 0.09 €",
      "chordewman: se retira",
      "lehamock: no muestra su mano",
      "Asiento 1: Phryxz (ciega pequeña) se retiró antes del Flop",
      "Asiento 2: serviettski(fr) (ciega grande) se retiró antes del Flop",
      "Asiento 3: SrLyce se retiró antes del Flop (no apostó)",
      "Asiento 4: chordewman se retiró en el Flop",
      "Asiento 5: lehamock recaudó (0.18 €)",
      "Asiento 6: niyomalo (botón) se retiró antes del Flop (no apostó)"
    ],
    "turn": [],
    "river": []
  },
  "board": [
    "Th",
    "6d",
    "5h"
  ],
  "winner": "lehamock",
  "win_amount": 9.0,
  "sb": 0.01,
  "bb": 0.02,
  "rake": 0.5,
  "raw_text": "Mano n.º 257238163477 de PokerStars:  Hold'em No Limit (0.01 €/0.02 € EUR) - 06-08-2025 18:33:42 CET [06-08-2025 12:33:42 ET]\nMesa \"Patientia III\" 6-max El asiento n.º 6 es el botón\nAsiento 1: Phryxz (2.46 € en fichas) \nAsiento 2: serviettski(fr) (2.53 € en fichas) \nAsiento 3: SrLyce (1.42 € en fichas) \nAsiento 4: chordewman (2.21 € en fichas) \nAsiento 5: lehamock (2 € en fichas) \nAsiento 6: niyomalo (1.70 € en fichas) \nPhryxz: pone la ciega pequeña 0.01 €\nserviettski(fr): pone la ciega grande 0.02 €\nlehamock: pone la ciega grande 0.02 €\n*** CARTAS DE MANO ***\nRepartidas a SrLyce [4c 6h]\nSrLyce: se retira \nchordewman: sube 0.03 € a 0.05 €\nlehamock: sube 0.03 € a 0.08 €\nniyomalo: se retira \nPhryxz: se retira \nserviettski(fr): se retira \nchordewman: iguala 0.03 €\n*** FLOP *** [Th 6d 5h]\nchordewman: pasa \nlehamock: apuesta 0.09 €\nchordewman: se retira \nLa apuesta no igualada (0.09 €) ha sido devuelta a lehamock\nlehamock se lleva 0.18 € del bote \nlehamock: no muestra su mano \n*** RESUMEN ***\nBote total 0.19 € | Comisión 0.01 € \nComunitarias [Th 6d 5h]\nAsiento 1: Phryxz (ciega pequeña) se retiró antes del Flop\nAsiento 2: serviettski(fr) (ciega grande) se retiró antes del Flop\nAsiento 3: SrLyce se retiró antes del Flop (no apostó)\nAsiento 4: chordewman se retiró en el Flop\nAsiento 5: lehamock recaudó (0.18 €)\nAsiento 6: niyomalo (botón) se retiró antes del Flop (no apostó)"
}