{
  "hand_id": "257150385964",
  "date": "30-07-2025 23:38:07",
  "table": "Lobelia",
  "game_type": "holdem",
  "hero": "SrLyce",
  "hero_position": "",
  "hero_cards": [
    "Ad",
    "9d"
  ],
  "stacks": {
    "LeVbks": 119.0,
    "fcis666": 42.5,
    "Dlaguancha": 126.5,
    "SrLyce": 85.0,
    "riverluck444": 84.5,
    "javipondio": 42.0
  },
  "actions": {
    "preflop": [
      "Asiento 1: LeVbks (2.38 € en fichas)",
      "Asiento 2: fcis666 (0.85 € en fichas)",
      "Asiento 3: Dlaguancha (2.53 € en fichas)",
      "Asiento 4: SrLyce (1.70 € en fichas)",
      "Asiento 5: riverluck444 (1.69 € en fichas)",
      "Asiento 6: javipondio (0.84 € en fichas)",
      "fcis666: pone la ciega pequeña 0.01 €",
      "Dlaguancha: pone la ciega grande 0.02 €",
      "SrLyce: sube 0.04 € a 0.06 €",
      "riverluck444: se retira",
      "javipondio: se retira",
      "LeVbks: se retira",
      "fcis666: se retira",
      "Dlaguancha: iguala 0.04 €"
    ],
    "flop": [
      "Dlaguancha: pasa",
      "SrLyce: pasa"
    ],
    "turn": [
      "Dlaguancha: apuesta 0.02 €",
      "SrLyce: iguala 0.02 €"
    ],
    "river": [
      "Dlaguancha: apuesta 0.02 €",
      "SrLyce: iguala 0.02 €",
      "Dlaguancha: muestra [7s 7h] (doble pareja, sietes y cincos)",
      "SrLyce: descarta su mano sin mostrar",
      "Asiento 1: LeVbks (botón) se retiró antes del Flop (no apostó)",
      "Asiento 2: fcis666 (ciega pequeña) se retiró antes del Flop",
      "Asiento 3: Dlaguancha (ciega grande) muestra [7s 7h] y ganó (0.20 €) con doble pareja, sietes y cincos",
      "Asiento 4: SrLyce descartó sin mostrar [Ad 9d]",
      "Asiento 5: riverluck444 se retiró antes del Flop (no apostó)",
      "Asiento 6: javipondio se retiró antes del Flop (no apostó)"
    ]
  },
  "board": [
    "2c",
    "6s",
    "2s",
    "5c",
    "5s"
  ],
  "winner": "Dlaguancha",
  "win_amount": 10.0,
  "sb": 0.01,
  "bb": 0.02,
  "rake": 0.5,
  "raw_text": "Mano n.º 257150385964 de PokerStars:  Hold'em No Limit (0.01 €/0.02 € EUR) - 30-07-2025 23:38:07 CET [30-07-2025 17:38:07 ET]\nMesa \"Lobelia\" 6-max El asiento n.º 1 es el botón\nAsiento 1: LeVbks (2.38 € en fichas) \nAsiento 2: fcis666 (0.85 € en fichas) \nAsiento 3: Dlaguancha (2.53 € en fichas) \nAsiento 4: SrLyce (1.70 € en fichas) \nAsiento 5: riverluck444 (1.69 € en fichas) \nAsiento 6: javipondio (0.84 € en fichas) \nfcis666 tiene conexión \nfcis666: pone la ciega pequeña 0.01 €\nDlaguancha: pone la ciega grande 0.02 €\n*** CARTAS DE MANO ***\nRepartidas a SrLyce [Ad 9d]\nSrLyce: sube 0.04 € a 0.06 €\nriverluck444: se retira \njavipondio: se retira \nLeVbks: se retira \nfcis666: se retira \nDlaguancha: iguala 0.04 €\n*** FLOP *** [2c 6s 2s]\nDlaguancha: pasa \nSrLyce: pasa \n*** TURN *** [2c 6s 2s] [5c]\nDlaguancha: apuesta 0.02 €\nSrLyce: iguala 0.02 €\n*** RIVER *** [2c 6s 2s 5c] [5s]\nDlaguancha: apuesta 0.02 €\nSrLyce: iguala 0.02 €\n*** SHOW DOWN ***\nDlaguancha: muestra [7s 7h] (doble pareja, sietes y cincos)\nSrLyce: descarta su mano sin mostrar \nDlaguancha se lleva 0.20 € del bote \n*** RESUMEN ***\nBote total 0.21 € | Comisión 0.01 € \nComunitarias [2c 6s 2s 5c 5s]\nAsiento 1: LeVbks (botón) se retiró antes del Flop (no apostó)\nAsiento 2: fcis666 (ciega pequeña) se retiró antes del Flop\nAsiento 3: Dlaguancha (ciega grande) muestra [7s 7h] y ganó (0.20 €) con doble pareja, sietes y cincos\nAsiento 4: SrLyce descartó sin mostrar [Ad 9d]\nAsiento 5: riverluck444 se retiró antes del Flop (no apostó)\nAsiento 6: javipondio se retiró antes del Flop (no apostó)"
}