{
  "hand_id": "257238784660",
  "date": "06-08-2025 19:28:47",
  "table": "Adelaide III",
  "game_type": "holdem",
  "hero": "SrLyce",
  "hero_position": "",
  "hero_cards": [
    "6s",
    "8s"
  ],
  "stacks": {
    "Alceo27": 100.0,
    "aliendee07": 48.0,
    "Macklemore0": 130.5,
    "SrLyce": 149.5,
    "ismagonzalez7": 81.5,
    "McFlash3": 130.0
  },
  "actions": {
    "preflop": [
      "Asiento 1: Alceo27 (2 € en fichas)",
      "Asiento 2: aliendee07 (0.96 € en fichas)",
      "Asiento 3: Macklemore0 (2.61 € en fichas)",
      "Asiento 4: SrLyce (2.99 € en fichas)",
      "Asiento 5: ismagonzalez7 (1.63 € en fichas)",
      "Asiento 6: McFlash3 (2.60 € en fichas)",
      "SrLyce: pone la ciega pequeña 0.01 €",
      "ismagonzalez7: pone la ciega grande 0.02 €",
      "McFlash3: sube 0.04 € a 0.06 €",
      "Alceo27: se retira",
      "aliendee07: se retira",
      "Macklemore0: iguala 0.06 €",
      "SrLyce: iguala 0.05 €",
      "ismagonzalez7: iguala 0.04 €"
    ],
    "flop": [
      "SrLyce: pasa",
      "ismagonzalez7: apuesta 0.08 €",
      "McFlash3: se retira",
      "Macklemore0: se retira",
      "SrLyce: se retira",
      "ismagonzalez7: no muestra su mano",
      "Asiento 1: Alceo27 se retiró antes del Flop (no apostó)",
      "Asiento 2: aliendee07 se retiró antes del Flop (no apostó)",
      "Asiento 3: Macklemore0 (botón) se retiró en el Flop",
      "Asiento 4: SrLyce (ciega pequeña) se retiró en el Flop",
      "Asiento 5: ismagonzalez7 (ciega grande) recaudó (0.23 €)",
      "Asiento 6: McFlash3 se retiró en el Flop"
    ],
    "turn": [],
    "river": []
  },
  "board": [
    "As",
    "Jh",
    "3d"
  ],
  "winner": "ismagonzalez7",
  "win_amount": 11.5,
  "sb": 0.01,
  "bb": 0.02,
  "rake": 0.5,
  "raw_text": "Mano n.º 257238784660 de PokerStars:  Hold'em No Limit (0.01 €/0.02 € EUR) - 06-08-2025 19:28:47 CET [06-08-2025 13:28:47 ET]\nMesa \"Adelaide III\" 6-max El asiento n.º 3 es el botón\nAsiento 1: Alceo27 (2 € en fichas) \nAsiento 2: aliendee07 (0.96 € en fichas) \nAsiento 3: Macklemore0 (2.61 € en fichas) \nAsiento 4: SrLyce (2.99 € en fichas) \nAsiento 5: ismagonzalez7 (1.63 € en fichas) \nAsiento 6: McFlash3 (2.60 € en fichas) \nSrLyce: pone la ciega pequeña 0.01 €\nismagonzalez7: pone la ciega grande 0.02 €\n*** CARTAS DE MANO ***\nRepartidas a SrLyce [6s 8s]\nMcFlash3: sube 0.04 € a 0.06 €\nAlceo27: se retira \naliendee07: se retira \nMacklemore0: iguala 0.06 €\nSrLyce: iguala 0.05 €\nismagonzalez7: iguala 0.04 €\n*** FLOP *** [As Jh 3d]\nSrLyce: pasa \nismagonzalez7: apuesta 0.08 €\nMcFlash3: se retira \nMacklemore0: se retira \nSrLyce: se retira \nLa apuesta no igualada (0.08 €) ha sido devuelta a ismagonzalez7\nismagonzalez7 se lleva 0.23 € del bote \nismagonzalez7: no muestra su mano \n*** RESUMEN ***\nBote total 0.24 € | Comisión 0.01 € \nComunitarias [As Jh 3d]\nAsiento 1: Alceo27 se retiró antes del Flop (no apostó)\nAsiento 2: aliendee07 se retiró antes del Flop (no apostó)\nAsiento 3: Macklemore0 (botón) se retiró en el Flop\nAsiento 4: SrLyce (ciega pequeña) se retiró en el Flop\nAsiento 5: ismagonzalez7 (ciega grande) recaudó (0.23 €)\nAsiento 6: McFlash3 se retiró en el Flop"
}