{
  "hand_id": "257148959479",
  "date": "30-07-2025 21:56:37",
  "table": "Sirona",
  "game_type": "holdem",
  "hero": "SrLyce",
  "hero_position": "",
  "hero_cards": [
    "Ac",
    "Th"
  ],
  "stacks": {
    "NachoAlmirante": 110.0,
    "SrLyce": 109.5,
    "lecontrebandier": 96.5,
    "christoph363": 209.0,
    "oliverdu70": 137.5,
    "Dakoo44": 70.5
  },
  "actions": {
    "preflop": [
      "Asiento 5: NachoAlmirante (2.20 € en fichas) está ausente",
      "Asiento 1: SrLyce (2.19 € en fichas)",
      "Asiento 2: lecontrebandier (1.93 € en fichas)",
      "Asiento 3: christoph363 (4.18 € en fichas)",
      "Asiento 4: oliverdu70 (2.75 € en fichas)",
      "Asiento 6: Dakoo44 (1.41 € en fichas)",
      "oliverdu70: pone la ciega pequeña 0.01 €",
      "NachoAlmirante: está ausente",
      "Dakoo44: pone la ciega grande 0.02 €",
      "SrLyce: sube 0.04 € a 0.06 €",
      "lecontrebandier: se retira",
      "christoph363: iguala 0.06 €",
      "oliverdu70: se retira",
      "Dakoo44: se retira"
    ],
    "flop": [
      "SrLyce: apuesta 0.05 €",
      "christoph363: iguala 0.05 €"
    ],
    "turn": [
      "SrLyce: apuesta 0.12 €",
      "christoph363: se retira",
      "SrLyce: no muestra su mano",
      "Asiento 5: NachoAlmirante",
      "Asiento 1: SrLyce recaudó (0.23 €)",
      "Asiento 2: lecontrebandier se retiró antes del Flop (no apostó)",
      "Asiento 3: christoph363 (botón) se retiró en el Turn",
      "Asiento 4: oliverdu70 (ciega pequeña) se retiró antes del Flop",
      "Asiento 6: Dakoo44 (ciega grande) se retiró antes del Flop"
    ],
    "river": []
  },
  "board": [
    "Ah",
    "5h",
    "9h",
    "2c"
  ],
  "winner": "SrLyce",
  "win_amount": 11.5,
  "sb": 0.01,
  "bb": 0.02,
  "rake": 1.0,
  "raw_text": "Mano n.º 257148959479 de PokerStars:  Hold'em No Limit (0.01 €/0.02 € EUR) - 30-07-2025 21:56:37 CET [30-07-2025 15:56:37 ET]\nMesa \"Sirona\" 6-max El asiento n.º 3 es el botón\nAsiento 5: NachoAlmirante (2.20 € en fichas) está ausente\nAsiento 1: SrLyce (2.19 € en fichas) \nAsiento 2: lecontrebandier (1.93 € en fichas) \nAsiento 3: christoph363 (4.18 € en fichas) \nAsiento 4: oliverdu70 (2.75 € en fichas) \nAsiento 6: Dakoo44 (1.41 € en fichas) \noliverdu70: pone la ciega pequeña 0.01 €\nNachoAlmirante: está ausente \nDakoo44: pone la ciega grande 0.02 €\n*** CARTAS DE MANO ***\nRepartidas a SrLyce [Ac Th]\nNachoAlmirante deja la mesa\nSrLyce: sube 0.04 € a 0.06 €\nlecontrebandier: se retira \nchristoph363: iguala 0.06 €\noliverdu70: se retira \nDakoo44: se retira \n*** FLOP *** [Ah 5h 9h]\nSrLyce: apuesta 0.05 €\nchristoph363: iguala 0.05 €\n*** TURN *** [Ah 5h 9h] [2c]\nSrLyce: apuesta 0.12 €\nchristoph363: se retira \nLa apuesta no igualada (0.12 €) ha sido devuelta a SrLyce\nSrLyce se lleva 0.23 € del bote \nSrLyce: no muestra su mano \n*** RESUMEN ***\nBote total 0.25 € | Comisión 0.02 € \nComunitarias [Ah 5h 9h 2c]\nAsiento 5: NachoAlmirante\nAsiento 1: SrLyce recaudó (0.23 €)\nAsiento 2: lecontrebandier se retiró antes del Flop (no apostó)\nAsiento 3: christoph363 (botón) se retiró en el Turn\nAsiento 4: oliverdu70 (ciega pequeña) se retiró antes del Flop\nAsiento 6: Dakoo44 (ciega grande) se retiró antes del Flop"
}