{
  "hand_id": "257214986792",
  "date": "04-08-2025 22:17:11",
  "table": "Aldhafera II",
  "game_type": "holdem",
  "hero": "SrLyce",
  "hero_position": "",
  "hero_cards": [
    "5s",
    "Qc"
  ],
  "stacks": {
    "BudyXXIII": 268.0,
    "wsx25": 98.5,
    "SrLyce": 99.0,
    "rhidoxxx": 121.5,
    "jte-ken": 82.5,
    "betterrrrrr": 110.5
  },
  "actions": {
    "preflop": [
      "Asiento 2: BudyXXIII (5.36 € en fichas) está ausente",
      "Asiento 1: wsx25 (1.97 € en fichas)",
      "Asiento 3: SrLyce (1.98 € en fichas)",
      "Asiento 4: rhidoxxx (2.43 € en fichas)",
      "Asiento 5: jte-ken (1.65 € en fichas)",
      "Asiento 6: betterrrrrr (2.21 € en fichas)",
      "SrLyce: pone la ciega pequeña 0.01 €",
      "rhidoxxx: pone la ciega grande 0.02 €",
      "jte-ken: sube 0.04 € a 0.06 €",
      "betterrrrrr: iguala 0.06 €",
      "wsx25: se retira",
      "SrLyce: iguala 0.05 €",
      "rhidoxxx: se retira"
    ],
    "flop": [
      "SrLyce: pasa",
      "jte-ken: apuesta 0.10 €",
      "betterrrrrr: se retira",
      "SrLyce: se retira",
      "Asiento 2: BudyXXIII",
      "Asiento 1: wsx25 (botón) se retiró antes del Flop (no apostó)",
      "Asiento 3: SrLyce (ciega pequeña) se retiró en el Flop",
      "Asiento 4: rhidoxxx (ciega grande) se retiró antes del Flop",
      "Asiento 5: jte-ken recaudó (0.19 €)",
      "Asiento 6: betterrrrrr se retiró en el Flop"
    ],
    "turn": [],
    "river": []
  },
  "board": [
    "4c",
    "Ah",
    "4d"
  ],
  "winner": "jte-ken",
  "win_amount": 9.5,
  "sb": 0.01,
  "bb": 0.02,
  "rake": 0.5,
  "raw_text": "Mano n.º 257214986792 de PokerStars:  Hold'em No Limit (0.01 €/0.02 € EUR) - 04-08-2025 22:17:11 CET [04-08-2025 16:17:11 ET]\nMesa \"Aldhafera II\" 6-max El asiento n.º 1 es el botón\nAsiento 2: BudyXXIII (5.36 € en fichas) está ausente\nAsiento 1: wsx25 (1.97 € en fichas) \nAsiento 3: SrLyce (1.98 € en fichas) \nAsiento 4: rhidoxxx (2.43 € en fichas) \nAsiento 5: jte-ken (1.65 € en fichas) \nAsiento 6: betterrrrrr (2.21 € en fichas) \nSrLyce: pone la ciega pequeña 0.01 €\nrhidoxxx: pone la ciega grande 0.02 €\n*** CARTAS DE MANO ***\nRepartidas a SrLyce [5s Qc]\njte-ken: sube 0.04 € a 0.06 €\nbetterrrrrr: iguala 0.06 €\nwsx25: se retira \nSrLyce: iguala 0.05 €\nrhidoxxx: se retira \n*** FLOP *** [4c Ah 4d]\nSrLyce: pasa \njte-ken: apuesta 0.10 €\nbetterrrrrr: se retira \nSrLyce: se retira \nLa apuesta no igualada (0.10 €) ha sido devuelta a jte-ken\njte-ken se lleva 0.19 € del bote \n*** RESUMEN ***\nBote total 0.20 € | Comisión 0.01 € \nComunitarias [4c Ah 4d]\nAsiento 2: BudyXXIII\nAsiento 1: wsx25 (botón) se retiró antes del Flop (no apostó)\nAsiento 3: SrLyce (ciega pequeña) se retiró en el Flop\nAsiento 4: rhidoxxx (ciega grande) se retiró antes del Flop\nAsiento 5: jte-ken recaudó (0.19 €)\nAsiento 6: betterrrrrr se retiró en el Flop"
}