{
  "hand_id": "257238755892",
  "date": "06-08-2025 19:26:24",
  "table": "Adelaide III",
  "game_type": "holdem",
  "hero": "SrLyce",
  "hero_position": "",
  "hero_cards": [
    "3d",
    "4c"
  ],
  "stacks": {
    "Alceo27": 100.0,
    "aliendee07": 43.0,
    "Macklemore0": 132.0,
    "SrLyce": 132.0,
    "ismagonzalez7": 102.5,
    "McFlash3": 127.0
  },
  "actions": {
    "preflop": [
      "Asiento 1: Alceo27 (2 € en fichas)",
      "Asiento 2: aliendee07 (0.86 € en fichas)",
      "Asiento 3: Macklemore0 (2.64 € en fichas)",
      "Asiento 4: SrLyce (2.64 € en fichas)",
      "Asiento 5: ismagonzalez7 (2.05 € en fichas)",
      "Asiento 6: McFlash3 (2.54 € en fichas)",
      "McFlash3: pone la ciega pequeña 0.01 €",
      "Alceo27: pone la ciega grande 0.02 €",
      "aliendee07: se retira",
      "Macklemore0: se retira",
      "SrLyce: se retira",
      "ismagonzalez7: sube 0.02 € a 0.04 €",
      "McFlash3: sube 0.14 € a 0.18 €",
      "Alceo27: se retira",
      "ismagonzalez7: se retira",
      "McFlash3: no muestra su mano",
      "Asiento 1: Alceo27 (ciega grande) se retiró antes del Flop",
      "Asiento 2: aliendee07 se retiró antes del Flop (no apostó)",
      "Asiento 3: Macklemore0 se retiró antes del Flop (no apostó)",
      "Asiento 4: SrLyce se retiró antes del Flop (no apostó)",
      "Asiento 5: ismagonzalez7 (botón) se retiró antes del Flop",
      "Asiento 6: McFlash3 (ciega pequeña) recaudó (0.10 €)"
    ],
    "flop": [],
    "turn": [],
    "river": []
  },
  "board": [],
  "winner": "McFlash3",
  "win_amount": 5.0,
  "sb": 0.01,
  "bb": 0.02,
  "rake": 0.0,
  "raw_text": "Mano n.º 257238755892 de PokerStars:  Hold'em No Limit (0.01 €/0.02 € EUR) - 06-08-2025 19:26:24 CET [06-08-2025 13:26:24 ET]\nMesa \"Adelaide III\" 6-max El asiento n.º 5 es el botón\nAsiento 1: Alceo27 (2 € en fichas) \nAsiento 2: aliendee07 (0.86 € en fichas) \nAsiento 3: Macklemore0 (2.64 € en fichas) \nAsiento 4: SrLyce (2.64 € en fichas) \nAsiento 5: ismagonzalez7 (2.05 € en fichas) \nAsiento 6: McFlash3 (2.54 € en fichas) \nMcFlash3: pone la ciega pequeña 0.01 €\nAlceo27: pone la ciega grande 0.02 €\n*** CARTAS DE MANO ***\nRepartidas a SrLyce [3d 4c]\naliendee07: se retira \nMacklemore0: se retira \nSrLyce: se retira \nismagonzalez7: sube 0.02 € a 0.04 €\nMcFlash3: sube 0.14 € a 0.18 €\nAlceo27: se retira \nismagonzalez7: se retira \nLa apuesta no igualada (0.14 €) ha sido devuelta a McFlash3\nMcFlash3 se lleva 0.10 € del bote \nMcFlash3: no muestra su mano \n*** RESUMEN ***\nBote total 0.10 € | Comisión 0 € \nAsiento 1: Alceo27 (ciega grande) se retiró antes del Flop\nAsiento 2: aliendee07 se retiró antes del Flop (no apostó)\nAsiento 3: Macklemore0 se retiró antes del Flop (no apostó)\nAsiento 4: SrLyce se retiró antes del Flop (no apostó)\nAsiento 5: ismagonzalez7 (botón) se retiró antes del Flop\nAsiento 6: McFlash3 (ciega pequeña) recaudó (0.10 €)"
}