{
  "hand_id": "257238573962",
  "date": "06-08-2025 19:11:12",
  "table": "Adelaide III",
  "game_type": "holdem",
  "hero": "SrLyce",
  "hero_position": "",
  "hero_cards": [
    "7s",
    "Kh"
  ],
  "stacks": {
    "Alceo27": 100.0,
    "aliendee07": 67.0,
    "Macklemore0": 100.0,
    "SrLyce": 95.0,
    "ismagonzalez7": 66.5,
    "pauquair5": 61.0
  },
  "actions": {
    "preflop": [
      "Asiento 1: Alceo27 (2 € en fichas) está ausente",
      "Asiento 2: aliendee07 (1.34 € en fichas)",
      "Asiento 3: Macklemore0 (2 € en fichas)",
      "Asiento 4: SrLyce (1.90 € en fichas)",
      "Asiento 5: ismagonzalez7 (1.33 € en fichas)",
      "Asiento 6: pauquair5 (1.22 € en fichas)",
      "ismagonzalez7: pone la ciega pequeña 0.01 €",
      "pauquair5: pone la ciega grande 0.02 €",
      "Alceo27: se ausenta",
      "aliendee07: se retira",
      "Macklemore0: sube 0.04 € a 0.06 €",
      "SrLyce: se retira",
      "ismagonzalez7: se retira",
      "pauquair5: iguala 0.04 €"
    ],
    "flop": [
      "pauquair5: pasa",
      "Macklemore0: apuesta 0.04 €",
      "pauquair5: iguala 0.04 €"
    ],
    "turn": [
      "pauquair5: pasa",
      "Macklemore0: pasa"
    ],
    "river": [
      "pauquair5: pasa",
      "Macklemore0: apuesta 0.06 €",
      "pauquair5: iguala 0.06 €",
      "Macklemore0: muestra [Qh Kd] (doble pareja, reyes y jotas)",
      "pauquair5: descarta su mano sin mostrar",
      "Asiento 1: Alceo27",
      "Asiento 2: aliendee07 se retiró antes del Flop (no apostó)",
      "Asiento 3: Macklemore0 muestra [Qh Kd] y ganó (0.31 €) con doble pareja, reyes y jotas",
      "Asiento 4: SrLyce (botón) se retiró antes del Flop (no apostó)",
      "Asiento 5: ismagonzalez7 (ciega pequeña) se retiró antes del Flop",
      "Asiento 6: pauquair5 (ciega grande) descartó sin mostrar [Ad 5c]"
    ]
  },
  "board": [
    "4c",
    "Jh",
    "Jd",
    "Ks",
    "4h"
  ],
  "winner": "Macklemore0",
  "win_amount": 15.5,
  "sb": 0.01,
  "bb": 0.02,
  "rake": 1.0,
  "raw_text": "Mano n.º 257238573962 de PokerStars:  Hold'em No Limit (0.01 €/0.02 € EUR) - 06-08-2025 19:11:12 CET [06-08-2025 13:11:12 ET]\nMesa \"Adelaide III\" 6-max El asiento n.º 4 es el botón\nAsiento 1: Alceo27 (2 € en fichas) está ausente\nAsiento 2: aliendee07 (1.34 € en fichas) \nAsiento 3: Macklemore0 (2 € en fichas) \nAsiento 4: SrLyce (1.90 € en fichas) \nAsiento 5: ismagonzalez7 (1.33 € en fichas) \nAsiento 6: pauquair5 (1.22 € en fichas) \nismagonzalez7: pone la ciega pequeña 0.01 €\npauquair5: pone la ciega grande 0.02 €\nAlceo27: se ausenta \n*** CARTAS DE MANO ***\nRepartidas a SrLyce [7s Kh]\naliendee07: se retira \nMacklemore0: sube 0.04 € a 0.06 €\nSrLyce: se retira \nismagonzalez7: se retira \npauquair5: iguala 0.04 €\n*** FLOP *** [4c Jh Jd]\npauquair5: pasa \nMacklemore0: apuesta 0.04 €\npauquair5: iguala 0.04 €\n*** TURN *** [4c Jh Jd] [Ks]\npauquair5: pasa \nMacklemore0: pasa \n*** RIVER *** [4c Jh Jd Ks] [4h]\npauquair5: pasa \nMacklemore0: apuesta 0.06 €\npauquair5: iguala 0.06 €\n*** SHOW DOWN ***\nMacklemore0: muestra [Qh Kd] (doble pareja, reyes y jotas)\npauquair5: descarta su mano sin mostrar \nMacklemore0 se lleva 0.31 € del bote \n*** RESUMEN ***\nBote total 0.33 € | Comisión 0.02 € \nComunitarias [4c Jh Jd Ks 4h]\nAsiento 1: Alceo27\nAsiento 2: aliendee07 se retiró antes del Flop (no apostó)\nAsiento 3: Macklemore0 muestra [Qh Kd] y ganó (0.31 €) con doble pareja, reyes y jotas\nAsiento 4: SrLyce (botón) se retiró antes del Flop (no apostó)\nAsiento 5: ismagonzalez7 (ciega pequeña) se retiró antes del Flop\nAsiento 6: pauquair5 (ciega grande) descartó sin mostrar [Ad 5c]"
}