{
  "hand_id": "257238563232",
  "date": "06-08-2025 19:10:19",
  "table": "Herculina II",
  "game_type": "holdem",
  "hero": "SrLyce",
  "hero_position": "",
  "hero_cards": [
    "5c",
    "4c"
  ],
  "stacks": {
    "Alceo27": 100.0,
    "David98X": 176.5,
    "JJer11": 206.0,
    "SrLyce": 98.5,
    "Macklemore0": 100.5,
    "ScarvBlack": 114.5
  },
  "actions": {
    "preflop": [
      "Asiento 1: Alceo27 (2 € en fichas) está ausente",
      "Asiento 2: David98X (3.53 € en fichas)",
      "Asiento 3: JJer11 (4.12 € en fichas)",
      "Asiento 4: SrLyce (1.97 € en fichas)",
      "Asiento 5: Macklemore0 (2.01 € en fichas)",
      "Asiento 6: ScarvBlack (2.29 € en fichas)",
      "Macklemore0: pone la ciega pequeña 0.01 €",
      "ScarvBlack: pone la ciega grande 0.02 €",
      "Alceo27: se ausenta",
      "David98X: se retira",
      "JJer11: sube 0.04 € a 0.06 €",
      "SrLyce: iguala 0.06 €",
      "Macklemore0: se retira",
      "ScarvBlack: sube 0.19 € a 0.25 €",
      "JJer11: se retira",
      "SrLyce: se retira",
      "ScarvBlack: no muestra su mano",
      "Asiento 1: Alceo27",
      "Asiento 2: David98X se retiró antes del Flop (no apostó)",
      "Asiento 3: JJer11 se retiró antes del Flop",
      "Asiento 4: SrLyce (botón) se retiró antes del Flop",
      "Asiento 5: Macklemore0 (ciega pequeña) se retiró antes del Flop",
      "Asiento 6: ScarvBlack (ciega grande) recaudó (0.19 €)"
    ],
    "flop": [],
    "turn": [],
    "river": []
  },
  "board": [],
  "winner": "ScarvBlack",
  "win_amount": 9.5,
  "sb": 0.01,
  "bb": 0.02,
  "rake": 0.0,
  "raw_text": "Mano n.º 257238563232 de PokerStars:  Hold'em No Limit (0.01 €/0.02 € EUR) - 06-08-2025 19:10:19 CET [06-08-2025 13:10:19 ET]\nMesa \"Herculina II\" 6-max El asiento n.º 4 es el botón\nAsiento 1: Alceo27 (2 € en fichas) está ausente\nAsiento 2: David98X (3.53 € en fichas) \nAsiento 3: JJer11 (4.12 € en fichas) \nAsiento 4: SrLyce (1.97 € en fichas) \nAsiento 5: Macklemore0 (2.01 € en fichas) \nAsiento 6: ScarvBlack (2.29 € en fichas) \nMacklemore0: pone la ciega pequeña 0.01 €\nScarvBlack: pone la ciega grande 0.02 €\nAlceo27: se ausenta \n*** CARTAS DE MANO ***\nRepartidas a SrLyce [5c 4c]\nDavid98X: se retira \nJJer11: sube 0.04 € a 0.06 €\nSrLyce: iguala 0.06 €\nMacklemore0: se retira \nScarvBlack: sube 0.19 € a 0.25 €\nJJer11: se retira \nSrLyce: se retira \nLa apuesta no igualada (0.19 €) ha sido devuelta a ScarvBlack\nScarvBlack se lleva 0.19 € del bote \nScarvBlack: no muestra su mano \n*** RESUMEN ***\nBote total 0.19 € | Comisión 0 € \nAsiento 1: Alceo27\nAsiento 2: David98X se retiró antes del Flop (no apostó)\nAsiento 3: JJer11 se retiró antes del Flop\nAsiento 4: SrLyce (botón) se retiró antes del Flop\nAsiento 5: Macklemore0 (ciega pequeña) se retiró antes del Flop\nAsiento 6: ScarvBlack (ciega grande) recaudó (0.19 €)"
}