{
  "hand_id": "257149107970",
  "date": "30-07-2025 22:08:34",
  "table": "Esclangona",
  "game_type": "holdem",
  "hero": "SrLyce",
  "hero_position": "",
  "hero_cards": [
    "2c",
    "Js"
  ],
  "stacks": {
    "Zorgue1080": 66.5,
    "SrLyce": 151.0,
    "NoahBolete": 125.0,
    "Davdgoni": 114.5,
    "DiaZzZ1": 93.0
  },
  "actions": {
    "preflop": [
      "Asiento 1: Zorgue1080 (1.33 € en fichas)",
      "Asiento 2: SrLyce (3.02 € en fichas)",
      "Asiento 3: NoahBolete (2.50 € en fichas)",
      "Asiento 4: Davdgoni (2.29 € en fichas)",
      "Asiento 5: DiaZzZ1 (1.86 € en fichas)",
      "Zorgue1080: pone la ciega pequeña 0.01 €",
      "SrLyce: pone la ciega grande 0.02 €",
      "NoahBolete: se retira",
      "Davdgoni: sube 0.04 € a 0.06 €",
      "DiaZzZ1: se retira",
      "Zorgue1080: se retira",
      "SrLyce: se retira",
      "Davdgoni: no muestra su mano",
      "Asiento 1: Zorgue1080 (ciega pequeña) se retiró antes del Flop",
      "Asiento 2: SrLyce (ciega grande) se retiró antes del Flop",
      "Asiento 3: NoahBolete se retiró antes del Flop (no apostó)",
      "Asiento 4: Davdgoni recaudó (0.05 €)",
      "Asiento 5: DiaZzZ1 (botón) se retiró antes del Flop (no apostó)"
    ],
    "flop": [],
    "turn": [],
    "river": []
  },
  "board": [],
  "winner": "Davdgoni",
  "win_amount": 2.5,
  "sb": 0.01,
  "bb": 0.02,
  "rake": 0.0,
  "raw_text": "Mano n.º 257149107970 de PokerStars:  Hold'em No Limit (0.01 €/0.02 € EUR) - 30-07-2025 22:08:34 CET [30-07-2025 16:08:34 ET]\nMesa \"Esclangona\" 6-max El asiento n.º 5 es el botón\nAsiento 1: Zorgue1080 (1.33 € en fichas) \nAsiento 2: SrLyce (3.02 € en fichas) \nAsiento 3: NoahBolete (2.50 € en fichas) \nAsiento 4: Davdgoni (2.29 € en fichas) \nAsiento 5: DiaZzZ1 (1.86 € en fichas) \nZorgue1080: pone la ciega pequeña 0.01 €\nSrLyce: pone la ciega grande 0.02 €\n*** CARTAS DE MANO ***\nRepartidas a SrLyce [2c Js]\nNoahBolete: se retira \nDavdgoni: sube 0.04 € a 0.06 €\nDiaZzZ1: se retira \nZorgue1080: se retira \nSrLyce: se retira \nLa apuesta no igualada (0.04 €) ha sido devuelta a Davdgoni\nDavdgoni se lleva 0.05 € del bote \nDavdgoni: no muestra su mano \n*** RESUMEN ***\nBote total 0.05 € | Comisión 0 € \nAsiento 1: Zorgue1080 (ciega pequeña) se retiró antes del Flop\nAsiento 2: SrLyce (ciega grande) se retiró antes del Flop\nAsiento 3: NoahBolete se retiró antes del Flop (no apostó)\nAsiento 4: Davdgoni recaudó (0.05 €)\nAsiento 5: DiaZzZ1 (botón) se retiró antes del Flop (no apostó)"
}