{
  "hand_id": "257148608415",
  "date": "30-07-2025 21:31:23",
  "table": "Sirona",
  "game_type": "holdem",
  "hero": "SrLyce",
  "hero_position": "",
  "hero_cards": [
    "7d",
    "8h"
  ],
  "stacks": {
    "olibellier": 40.0,
    "SrLyce": 98.5,
    "lecontrebandier": 100.0,
    "christoph363": 180.0,
    "oliverdu70": 97.5,
    "Dakoo44": 101.5
  },
  "actions": {
    "preflop": [
      "Asiento 5: olibellier (0.80 € en fichas) está ausente",
      "Asiento 1: SrLyce (1.97 € en fichas)",
      "Asiento 2: lecontrebandier (2 € en fichas)",
      "Asiento 3: christoph363 (3.60 € en fichas)",
      "Asiento 4: oliverdu70 (1.95 € en fichas)",
      "Asiento 6: Dakoo44 (2.03 € en fichas)",
      "christoph363: pone la ciega pequeña 0.01 €",
      "oliverdu70: pone la ciega grande 0.02 €",
      "olibellier: se ausenta",
      "Dakoo44: sube 0.03 € a 0.05 €",
      "SrLyce: se retira",
      "lecontrebandier: se retira",
      "christoph363: se retira",
      "oliverdu70: se retira",
      "Dakoo44: no muestra su mano",
      "Asiento 5: olibellier",
      "Asiento 1: SrLyce se retiró antes del Flop (no apostó)",
      "Asiento 2: lecontrebandier (botón) se retiró antes del Flop (no apostó)",
      "Asiento 3: christoph363 (ciega pequeña) se retiró antes del Flop",
      "Asiento 4: oliverdu70 (ciega grande) se retiró antes del Flop",
      "Asiento 6: Dakoo44 recaudó (0.05 €)"
    ],
    "flop": [],
    "turn": [],
    "river": []
  },
  "board": [],
  "winner": "Dakoo44",
  "win_amount": 2.5,
  "sb": 0.01,
  "bb": 0.02,
  "rake": 0.0,
  "raw_text": "Mano n.º 257148608415 de PokerStars:  Hold'em No Limit (0.01 €/0.02 € EUR) - 30-07-2025 21:31:23 CET [30-07-2025 15:31:23 ET]\nMesa \"Sirona\" 6-max El asiento n.º 2 es el botón\nAsiento 5: olibellier (0.80 € en fichas) está ausente\nAsiento 1: SrLyce (1.97 € en fichas) \nAsiento 2: lecontrebandier (2 € en fichas) \nAsiento 3: christoph363 (3.60 € en fichas) \nAsiento 4: oliverdu70 (1.95 € en fichas) \nAsiento 6: Dakoo44 (2.03 € en fichas) \nchristoph363: pone la ciega pequeña 0.01 €\noliverdu70: pone la ciega grande 0.02 €\nolibellier: se ausenta \n*** CARTAS DE MANO ***\nRepartidas a SrLyce [7d 8h]\nDakoo44: sube 0.03 € a 0.05 €\nSrLyce: se retira \nlecontrebandier: se retira \nchristoph363: se retira \noliverdu70: se retira \nLa apuesta no igualada (0.03 €) ha sido devuelta a Dakoo44\nDakoo44 se lleva 0.05 € del bote \nDakoo44: no muestra su mano \n*** RESUMEN ***\nBote total 0.05 € | Comisión 0 € \nAsiento 5: olibellier\nAsiento 1: SrLyce se retiró antes del Flop (no apostó)\nAsiento 2: lecontrebandier (botón) se retiró antes del Flop (no apostó)\nAsiento 3: christoph363 (ciega pequeña) se retiró antes del Flop\nAsiento 4: oliverdu70 (ciega grande) se retiró antes del Flop\nAsiento 6: Dakoo44 recaudó (0.05 €)"
}