{
  "hand_id": "257149024505",
  "date": "30-07-2025 22:02:40",
  "table": "Esclangona",
  "game_type": "holdem",
  "hero": "SrLyce",
  "hero_position": "",
  "hero_cards": [
    "2h",
    "Ac"
  ],
  "stacks": {
    "Zorgue1080": 71.0,
    "SrLyce": 184.0,
    "NoahBolete": 98.5,
    "Davdgoni": 104.0,
    "DiaZzZ1": 96.0,
    "berlcht403": 35.0
  },
  "actions": {
    "preflop": [
      "Asiento 1: Zorgue1080 (1.42 € en fichas)",
      "Asiento 2: SrLyce (3.68 € en fichas)",
      "Asiento 3: NoahBolete (1.97 € en fichas)",
      "Asiento 4: Davdgoni (2.08 € en fichas)",
      "Asiento 5: DiaZzZ1 (1.92 € en fichas)",
      "Asiento 6: berlcht403 (0.70 € en fichas)",
      "NoahBolete: pone la ciega pequeña 0.01 €",
      "Davdgoni: pone la ciega grande 0.02 €",
      "DiaZzZ1: se retira",
      "berlcht403: se retira",
      "Zorgue1080: se retira",
      "SrLyce: se retira",
      "NoahBolete: sube 0.04 € a 0.06 €",
      "Davdgoni: se retira",
      "NoahBolete: no muestra su mano",
      "Asiento 1: Zorgue1080 se retiró antes del Flop (no apostó)",
      "Asiento 2: SrLyce (botón) se retiró antes del Flop (no apostó)",
      "Asiento 3: NoahBolete (ciega pequeña) recaudó (0.04 €)",
      "Asiento 4: Davdgoni (ciega grande) se retiró antes del Flop",
      "Asiento 5: DiaZzZ1 se retiró antes del Flop (no apostó)",
      "Asiento 6: berlcht403 se retiró antes del Flop (no apostó)"
    ],
    "flop": [],
    "turn": [],
    "river": []
  },
  "board": [],
  "winner": "NoahBolete",
  "win_amount": 2.0,
  "sb": 0.01,
  "bb": 0.02,
  "rake": 0.0,
  "raw_text": "Mano n.º 257149024505 de PokerStars:  Hold'em No Limit (0.01 €/0.02 € EUR) - 30-07-2025 22:02:40 CET [30-07-2025 16:02:40 ET]\nMesa \"Esclangona\" 6-max El asiento n.º 2 es el botón\nAsiento 1: Zorgue1080 (1.42 € en fichas) \nAsiento 2: SrLyce (3.68 € en fichas) \nAsiento 3: NoahBolete (1.97 € en fichas) \nAsiento 4: Davdgoni (2.08 € en fichas) \nAsiento 5: DiaZzZ1 (1.92 € en fichas) \nAsiento 6: berlcht403 (0.70 € en fichas) \nNoahBolete: pone la ciega pequeña 0.01 €\nDavdgoni: pone la ciega grande 0.02 €\n*** CARTAS DE MANO ***\nRepartidas a SrLyce [2h Ac]\nDiaZzZ1: se retira \nberlcht403: se retira \nZorgue1080: se retira \nSrLyce ha agotado su tiempo\nSrLyce: se retira \nNoahBolete: sube 0.04 € a 0.06 €\nDavdgoni: se retira \nLa apuesta no igualada (0.04 €) ha sido devuelta a NoahBolete\nNoahBolete se lleva 0.04 € del bote \nNoahBolete: no muestra su mano \n*** RESUMEN ***\nBote total 0.04 € | Comisión 0 € \nAsiento 1: Zorgue1080 se retiró antes del Flop (no apostó)\nAsiento 2: SrLyce (botón) se retiró antes del Flop (no apostó)\nAsiento 3: NoahBolete (ciega pequeña) recaudó (0.04 €)\nAsiento 4: Davdgoni (ciega grande) se retiró antes del Flop\nAsiento 5: DiaZzZ1 se retiró antes del Flop (no apostó)\nAsiento 6: berlcht403 se retiró antes del Flop (no apostó)"
}