{
  "hand_id": "257237916104",
  "date": "06-08-2025 18:11:34",
  "table": "Nuwa III",
  "game_type": "holdem",
  "hero": "SrLyce",
  "hero_position": "",
  "hero_cards": [
    "Jc",
    "2c"
  ],
  "stacks": {
    "xododo": 40.0,
    "JGDOBLAS": 100.0,
    "BuXHexter": 100.0,
    "kcg_rm": 105.0,
    "SrLyce": 104.5,
    "acavada": 104.5
  },
  "actions": {
    "preflop": [
      "Asiento 1: xododo (0.80 € en fichas) está ausente",
      "Asiento 5: JGDOBLAS (2 € en fichas) está ausente",
      "Asiento 2: BuXHexter (2 € en fichas)",
      "Asiento 3: kcg_rm (2.10 € en fichas)",
      "Asiento 4: SrLyce (2.09 € en fichas)",
      "Asiento 6: acavada (2.09 € en fichas)",
      "BuXHexter: pone la ciega pequeña 0.01 €",
      "kcg_rm: pone la ciega grande 0.02 €",
      "JGDOBLAS: se ausenta",
      "SrLyce: se retira",
      "acavada: se retira",
      "BuXHexter: sube 0.04 € a 0.06 €",
      "kcg_rm: se retira",
      "BuXHexter: no muestra su mano",
      "Asiento 1: xododo",
      "Asiento 5: JGDOBLAS",
      "Asiento 2: BuXHexter (ciega pequeña) recaudó (0.04 €)",
      "Asiento 3: kcg_rm (ciega grande) se retiró antes del Flop",
      "Asiento 4: SrLyce se retiró antes del Flop (no apostó)",
      "Asiento 6: acavada (botón) se retiró antes del Flop (no apostó)"
    ],
    "flop": [],
    "turn": [],
    "river": []
  },
  "board": [],
  "winner": "BuXHexter",
  "win_amount": 2.0,
  "sb": 0.01,
  "bb": 0.02,
  "rake": 0.0,
  "raw_text": "Mano n.º 257237916104 de PokerStars:  Hold'em No Limit (0.01 €/0.02 € EUR) - 06-08-2025 18:11:34 CET [06-08-2025 12:11:34 ET]\nMesa \"Nuwa III\" 6-max El asiento n.º 6 es el botón\nAsiento 1: xododo (0.80 € en fichas) está ausente\nAsiento 5: JGDOBLAS (2 € en fichas) está ausente\nAsiento 2: BuXHexter (2 € en fichas) \nAsiento 3: kcg_rm (2.10 € en fichas) \nAsiento 4: SrLyce (2.09 € en fichas) \nAsiento 6: acavada (2.09 € en fichas) \nBuXHexter: pone la ciega pequeña 0.01 €\nkcg_rm: pone la ciega grande 0.02 €\nJGDOBLAS: se ausenta \n*** CARTAS DE MANO ***\nRepartidas a SrLyce [Jc 2c]\nSrLyce: se retira \nacavada: se retira \nBuXHexter: sube 0.04 € a 0.06 €\nkcg_rm: se retira \nLa apuesta no igualada (0.04 €) ha sido devuelta a BuXHexter\nBuXHexter se lleva 0.04 € del bote \nBuXHexter: no muestra su mano \n*** RESUMEN ***\nBote total 0.04 € | Comisión 0 € \nAsiento 1: xododo\nAsiento 5: JGDOBLAS\nAsiento 2: BuXHexter (ciega pequeña) recaudó (0.04 €)\nAsiento 3: kcg_rm (ciega grande) se retiró antes del Flop\nAsiento 4: SrLyce se retiró antes del Flop (no apostó)\nAsiento 6: acavada (botón) se retiró antes del Flop (no apostó)"
}