{
  "hand_id": "257238362395",
  "date": "06-08-2025 18:51:15",
  "table": "Herculina II",
  "game_type": "holdem",
  "hero": "SrLyce",
  "hero_position": "",
  "hero_cards": [
    "2h",
    "6h"
  ],
  "stacks": {
    "koldipk": 101.0,
    "David98X": 110.5,
    "JJer11": 195.5,
    "SrLyce": 90.5,
    "El Calvo 65": 201.0,
    "ScarvBlack": 100.0
  },
  "actions": {
    "preflop": [
      "Asiento 1: koldipk (2.02 € en fichas)",
      "Asiento 2: David98X (2.21 € en fichas)",
      "Asiento 3: JJer11 (3.91 € en fichas)",
      "Asiento 4: SrLyce (1.81 € en fichas)",
      "Asiento 5: El Calvo 65 (4.02 € en fichas)",
      "Asiento 6: ScarvBlack (2 € en fichas)",
      "JJer11: pone la ciega pequeña 0.01 €",
      "SrLyce: pone la ciega grande 0.02 €",
      "El Calvo 65: se retira",
      "ScarvBlack: sube 0.04 € a 0.06 €",
      "koldipk: se retira",
      "David98X: se retira",
      "JJer11: se retira",
      "SrLyce: iguala 0.04 €"
    ],
    "flop": [
      "SrLyce: pasa",
      "ScarvBlack: apuesta 0.08 €",
      "SrLyce: iguala 0.08 €"
    ],
    "turn": [
      "SrLyce: pasa",
      "ScarvBlack: pasa"
    ],
    "river": [
      "SrLyce: pasa",
      "ScarvBlack: apuesta 0.14 €",
      "SrLyce: iguala 0.14 €",
      "ScarvBlack: muestra [5h 4c] (pareja de ochos)",
      "SrLyce: muestra [2h 6h] (doble pareja, ochos y seises)",
      "Asiento 1: koldipk se retiró antes del Flop (no apostó)",
      "Asiento 2: David98X (botón) se retiró antes del Flop (no apostó)",
      "Asiento 3: JJer11 (ciega pequeña) se retiró antes del Flop",
      "Asiento 4: SrLyce (ciega grande) muestra [2h 6h] y ganó (0.54 €) con doble pareja, ochos y seises",
      "Asiento 5: El Calvo 65 se retiró antes del Flop (no apostó)",
      "Asiento 6: ScarvBlack muestra [5h 4c] y perdió con pareja de ochos"
    ]
  },
  "board": [
    "3c",
    "6s",
    "8h",
    "As",
    "8c"
  ],
  "winner": "SrLyce",
  "win_amount": 27.0,
  "sb": 0.01,
  "bb": 0.02,
  "rake": 1.5,
  "raw_text": "Mano n.º 257238362395 de PokerStars:  Hold'em No Limit (0.01 €/0.02 € EUR) - 06-08-2025 18:51:15 CET [06-08-2025 12:51:15 ET]\nMesa \"Herculina II\" 6-max El asiento n.º 2 es el botón\nAsiento 1: koldipk (2.02 € en fichas) \nAsiento 2: David98X (2.21 € en fichas) \nAsiento 3: JJer11 (3.91 € en fichas) \nAsiento 4: SrLyce (1.81 € en fichas) \nAsiento 5: El Calvo 65 (4.02 € en fichas) \nAsiento 6: ScarvBlack (2 € en fichas) \nJJer11: pone la ciega pequeña 0.01 €\nSrLyce: pone la ciega grande 0.02 €\n*** CARTAS DE MANO ***\nRepartidas a SrLyce [2h 6h]\nEl Calvo 65: se retira \nScarvBlack: sube 0.04 € a 0.06 €\nkoldipk: se retira \nDavid98X: se retira \nJJer11: se retira \nSrLyce: iguala 0.04 €\n*** FLOP *** [3c 6s 8h]\nSrLyce: pasa \nScarvBlack: apuesta 0.08 €\nSrLyce: iguala 0.08 €\n*** TURN *** [3c 6s 8h] [As]\nSrLyce: pasa \nScarvBlack: pasa \n*** RIVER *** [3c 6s 8h As] [8c]\nSrLyce: pasa \nScarvBlack: apuesta 0.14 €\nSrLyce: iguala 0.14 €\n*** SHOW DOWN ***\nScarvBlack: muestra [5h 4c] (pareja de ochos)\nSrLyce: muestra [2h 6h] (doble pareja, ochos y seises)\nSrLyce se lleva 0.54 € del bote \n*** RESUMEN ***\nBote total 0.57 € | Comisión 0.03 € \nComunitarias [3c 6s 8h As 8c]\nAsiento 1: koldipk se retiró antes del Flop (no apostó)\nAsiento 2: David98X (botón) se retiró antes del Flop (no apostó)\nAsiento 3: JJer11 (ciega pequeña) se retiró antes del Flop\nAsiento 4: SrLyce (ciega grande) muestra [2h 6h] y ganó (0.54 €) con doble pareja, ochos y seises\nAsiento 5: El Calvo 65 se retiró antes del Flop (no apostó)\nAsiento 6: ScarvBlack muestra [5h 4c] y perdió con pareja de ochos"
}