{
  "hand_id": "257215188299",
  "date": "04-08-2025 22:29:52",
  "table": "Anneliese II",
  "game_type": "holdem",
  "hero": "SrLyce",
  "hero_position": "",
  "hero_cards": [
    "3c",
    "6h"
  ],
  "stacks": {
    "betterrrrrr": 100.0,
    "piropanzer": 39.5,
    "ElManu62": 122.0,
    "SrLyce": 98.5,
    "Mr_Pkr98": 143.5,
    "Spotick": 115.0
  },
  "actions": {
    "preflop": [
      "Asiento 1: betterrrrrr (2 € en fichas)",
      "Asiento 2: piropanzer (0.79 € en fichas)",
      "Asiento 3: ElManu62 (2.44 € en fichas)",
      "Asiento 4: SrLyce (1.97 € en fichas)",
      "Asiento 5: Mr_Pkr98 (2.87 € en fichas)",
      "Asiento 6: Spotick (2.30 € en fichas)",
      "Mr_Pkr98: pone la ciega pequeña 0.01 €",
      "Spotick: pone la ciega grande 0.02 €",
      "betterrrrrr: sube 0.04 € a 0.06 €",
      "piropanzer: iguala 0.06 €",
      "ElManu62: se retira",
      "SrLyce: se retira",
      "Mr_Pkr98: se retira",
      "Spotick: se retira"
    ],
    "flop": [
      "betterrrrrr: pasa",
      "piropanzer: pasa"
    ],
    "turn": [
      "betterrrrrr: apuesta 0.21 €",
      "piropanzer: se retira",
      "betterrrrrr: no muestra su mano",
      "Asiento 1: betterrrrrr recaudó (0.14 €)",
      "Asiento 2: piropanzer se retiró en el Turn",
      "Asiento 3: ElManu62 se retiró antes del Flop (no apostó)",
      "Asiento 4: SrLyce (botón) se retiró antes del Flop (no apostó)",
      "Asiento 5: Mr_Pkr98 (ciega pequeña) se retiró antes del Flop",
      "Asiento 6: Spotick (ciega grande) se retiró antes del Flop"
    ],
    "river": []
  },
  "board": [
    "8s",
    "Th",
    "7c",
    "Qh"
  ],
  "winner": "betterrrrrr",
  "win_amount": 7.0,
  "sb": 0.01,
  "bb": 0.02,
  "rake": 0.5,
  "raw_text": "Mano n.º 257215188299 de PokerStars:  Hold'em No Limit (0.01 €/0.02 € EUR) - 04-08-2025 22:29:52 CET [04-08-2025 16:29:52 ET]\nMesa \"Anneliese II\" 6-max El asiento n.º 4 es el botón\nAsiento 1: betterrrrrr (2 € en fichas) \nAsiento 2: piropanzer (0.79 € en fichas) \nAsiento 3: ElManu62 (2.44 € en fichas) \nAsiento 4: SrLyce (1.97 € en fichas) \nAsiento 5: Mr_Pkr98 (2.87 € en fichas) \nAsiento 6: Spotick (2.30 € en fichas) \nMr_Pkr98: pone la ciega pequeña 0.01 €\nSpotick: pone la ciega grande 0.02 €\n*** CARTAS DE MANO ***\nRepartidas a SrLyce [3c 6h]\nbetterrrrrr: sube 0.04 € a 0.06 €\npiropanzer: iguala 0.06 €\nElManu62: se retira \nSrLyce: se retira \nMr_Pkr98: se retira \nSpotick: se retira \n*** FLOP *** [8s Th 7c]\nbetterrrrrr: pasa \npiropanzer: pasa \n*** TURN *** [8s Th 7c] [Qh]\nbetterrrrrr: apuesta 0.21 €\npiropanzer: se retira \nLa apuesta no igualada (0.21 €) ha sido devuelta a betterrrrrr\nbetterrrrrr se lleva 0.14 € del bote \nbetterrrrrr: no muestra su mano \n*** RESUMEN ***\nBote total 0.15 € | Comisión 0.01 € \nComunitarias [8s Th 7c Qh]\nAsiento 1: betterrrrrr recaudó (0.14 €)\nAsiento 2: piropanzer se retiró en el Turn\nAsiento 3: ElManu62 se retiró antes del Flop (no apostó)\nAsiento 4: SrLyce (botón) se retiró antes del Flop (no apostó)\nAsiento 5: Mr_Pkr98 (ciega pequeña) se retiró antes del Flop\nAsiento 6: Spotick (ciega grande) se retiró antes del Flop"
}