{
  "hand_id": "257215236132",
  "date": "04-08-2025 22:32:49",
  "table": "Aldhafera II",
  "game_type": "holdem",
  "hero": "SrLyce",
  "hero_position": "",
  "hero_cards": [
    "4s",
    "Ah"
  ],
  "stacks": {
    "wsx25": 67.5,
    "BudyXXIII": 293.0,
    "SrLyce": 100.0,
    "rhidoxxx": 87.5,
    "jte-ken": 100.5,
    "betterrrrrr": 179.0
  },
  "actions": {
    "preflop": [
      "Asiento 1: wsx25 (1.35 € en fichas)",
      "Asiento 2: BudyXXIII (5.86 € en fichas)",
      "Asiento 3: SrLyce (2 € en fichas)",
      "Asiento 4: rhidoxxx (1.75 € en fichas)",
      "Asiento 5: jte-ken (2.01 € en fichas)",
      "Asiento 6: betterrrrrr (3.58 € en fichas)",
      "BudyXXIII: pone la ciega pequeña 0.01 €",
      "SrLyce: pone la ciega grande 0.02 €",
      "rhidoxxx: se retira",
      "jte-ken: sube 0.04 € a 0.06 €",
      "betterrrrrr: sube 0.12 € a 0.18 €",
      "wsx25: se retira",
      "BudyXXIII: se retira",
      "SrLyce: se retira",
      "jte-ken: iguala 0.12 €"
    ],
    "flop": [
      "jte-ken: pasa",
      "betterrrrrr: pasa"
    ],
    "turn": [
      "jte-ken: apuesta 0.37 €",
      "betterrrrrr: se retira",
      "Asiento 1: wsx25 (botón) se retiró antes del Flop (no apostó)",
      "Asiento 2: BudyXXIII (ciega pequeña) se retiró antes del Flop",
      "Asiento 3: SrLyce (ciega grande) se retiró antes del Flop",
      "Asiento 4: rhidoxxx se retiró antes del Flop (no apostó)",
      "Asiento 5: jte-ken recaudó (0.37 €)",
      "Asiento 6: betterrrrrr se retiró en el Turn"
    ],
    "river": []
  },
  "board": [
    "Kd",
    "Qs",
    "9h",
    "9s"
  ],
  "winner": "jte-ken",
  "win_amount": 18.5,
  "sb": 0.01,
  "bb": 0.02,
  "rake": 1.0,
  "raw_text": "Mano n.º 257215236132 de PokerStars:  Hold'em No Limit (0.01 €/0.02 € EUR) - 04-08-2025 22:32:49 CET [04-08-2025 16:32:49 ET]\nMesa \"Aldhafera II\" 6-max El asiento n.º 1 es el botón\nAsiento 1: wsx25 (1.35 € en fichas) \nAsiento 2: BudyXXIII (5.86 € en fichas) \nAsiento 3: SrLyce (2 € en fichas) \nAsiento 4: rhidoxxx (1.75 € en fichas) \nAsiento 5: jte-ken (2.01 € en fichas) \nAsiento 6: betterrrrrr (3.58 € en fichas) \nBudyXXIII: pone la ciega pequeña 0.01 €\nSrLyce: pone la ciega grande 0.02 €\n*** CARTAS DE MANO ***\nRepartidas a SrLyce [4s Ah]\nrhidoxxx: se retira \njte-ken: sube 0.04 € a 0.06 €\nbetterrrrrr: sube 0.12 € a 0.18 €\nwsx25: se retira \nBudyXXIII: se retira \nSrLyce: se retira \njte-ken: iguala 0.12 €\n*** FLOP *** [Kd Qs 9h]\njte-ken: pasa \nbetterrrrrr: pasa \n*** TURN *** [Kd Qs 9h] [9s]\njte-ken: apuesta 0.37 €\nbetterrrrrr: se retira \nLa apuesta no igualada (0.37 €) ha sido devuelta a jte-ken\njte-ken se lleva 0.37 € del bote \n*** RESUMEN ***\nBote total 0.39 € | Comisión 0.02 € \nComunitarias [Kd Qs 9h 9s]\nAsiento 1: wsx25 (botón) se retiró antes del Flop (no apostó)\nAsiento 2: BudyXXIII (ciega pequeña) se retiró antes del Flop\nAsiento 3: SrLyce (ciega grande) se retiró antes del Flop\nAsiento 4: rhidoxxx se retiró antes del Flop (no apostó)\nAsiento 5: jte-ken recaudó (0.37 €)\nAsiento 6: betterrrrrr se retiró en el Turn"
}