{
  "hand_id": "257237872287",
  "date": "06-08-2025 18:07:28",
  "table": "Euneus III",
  "game_type": "holdem",
  "hero": "SrLyce",
  "hero_position": "",
  "hero_cards": [
    "Jd",
    "5c"
  ],
  "stacks": {
    "christgear": 100.0,
    "Begoton": 100.0,
    "Il_BM00": 99.5,
    "djrojas9": 154.5,
    "JGDOBLAS": 99.0,
    "SrLyce": 108.5
  },
  "actions": {
    "preflop": [
      "Asiento 1: christgear (2 € en fichas) está ausente",
      "Asiento 6: Begoton (2 € en fichas) está ausente",
      "Asiento 2: Il_BM00 (1.99 € en fichas)",
      "Asiento 3: djrojas9 (3.09 € en fichas)",
      "Asiento 4: JGDOBLAS (1.98 € en fichas)",
      "Asiento 5: SrLyce (2.17 € en fichas)",
      "JGDOBLAS: pone la ciega pequeña 0.01 €",
      "SrLyce: pone la ciega grande 0.02 €",
      "Begoton: se ausenta",
      "christgear: se ausenta",
      "Il_BM00: se retira",
      "djrojas9: se retira",
      "JGDOBLAS: se retira",
      "SrLyce: no muestra su mano",
      "Asiento 1: christgear",
      "Asiento 6: Begoton",
      "Asiento 2: Il_BM00 se retiró antes del Flop (no apostó)",
      "Asiento 3: djrojas9 (botón) se retiró antes del Flop (no apostó)",
      "Asiento 4: JGDOBLAS (ciega pequeña) se retiró antes del Flop",
      "Asiento 5: SrLyce (ciega grande) recaudó (0.02 €)"
    ],
    "flop": [],
    "turn": [],
    "river": []
  },
  "board": [],
  "winner": "SrLyce",
  "win_amount": 1.0,
  "sb": 0.01,
  "bb": 0.02,
  "rake": 0.0,
  "raw_text": "Mano n.º 257237872287 de PokerStars:  Hold'em No Limit (0.01 €/0.02 € EUR) - 06-08-2025 18:07:28 CET [06-08-2025 12:07:28 ET]\nMesa \"Euneus III\" 6-max El asiento n.º 3 es el botón\nAsiento 1: christgear (2 € en fichas) está ausente\nAsiento 6: Begoton (2 € en fichas) está ausente\nAsiento 2: Il_BM00 (1.99 € en fichas) \nAsiento 3: djrojas9 (3.09 € en fichas) \nAsiento 4: JGDOBLAS (1.98 € en fichas) \nAsiento 5: SrLyce (2.17 € en fichas) \nJGDOBLAS: pone la ciega pequeña 0.01 €\nSrLyce: pone la ciega grande 0.02 €\nBegoton: se ausenta \nchristgear: se ausenta \n*** CARTAS DE MANO ***\nRepartidas a SrLyce [Jd 5c]\nIl_BM00: se retira \ndjrojas9 ha agotado su tiempo\ndjrojas9: se retira \nJGDOBLAS: se retira \nLa apuesta no igualada (0.01 €) ha sido devuelta a SrLyce\nSrLyce se lleva 0.02 € del bote \nSrLyce: no muestra su mano \n*** RESUMEN ***\nBote total 0.02 € | Comisión 0 € \nAsiento 1: christgear\nAsiento 6: Begoton\nAsiento 2: Il_BM00 se retiró antes del Flop (no apostó)\nAsiento 3: djrojas9 (botón) se retiró antes del Flop (no apostó)\nAsiento 4: JGDOBLAS (ciega pequeña) se retiró antes del Flop\nAsiento 5: SrLyce (ciega grande) recaudó (0.02 €)"
}