{
  "hand_id": "257150544059",
  "date": "30-07-2025 23:49:33",
  "table": "Mizuho",
  "game_type": "holdem",
  "hero": "SrLyce",
  "hero_position": "",
  "hero_cards": [
    "8c",
    "Jd"
  ],
  "stacks": {
    "benipoker123": 0.0,
    "SrLyce": 278.0,
    "JstLeonel": 115.0,
    "Ozzy3110": 290.5,
    "toonsy2010": 93.0,
    "mivipkr": 105.5
  },
  "actions": {
    "preflop": [
      "Asiento 1: benipoker123 (0 € en fichas) está ausente",
      "Asiento 2: SrLyce (5.56 € en fichas)",
      "Asiento 3: JstLeonel (2.30 € en fichas)",
      "Asiento 4: Ozzy3110 (5.81 € en fichas)",
      "Asiento 5: toonsy2010 (1.86 € en fichas)",
      "Asiento 6: mivipkr (2.11 € en fichas)",
      "SrLyce: pone la ciega pequeña 0.01 €",
      "JstLeonel: pone la ciega grande 0.02 €",
      "Ozzy3110: sube 0.03 € a 0.05 €",
      "toonsy2010: se retira",
      "mivipkr: se retira",
      "SrLyce: iguala 0.04 €",
      "JstLeonel: iguala 0.03 €"
    ],
    "flop": [
      "SrLyce: pasa",
      "JstLeonel: pasa",
      "Ozzy3110: apuesta 0.05 €",
      "SrLyce: se retira",
      "JstLeonel: iguala 0.05 €"
    ],
    "turn": [
      "JstLeonel: pasa",
      "Ozzy3110: apuesta 0.17 €",
      "JstLeonel: se retira",
      "Ozzy3110: no muestra su mano",
      "Asiento 1: benipoker123",
      "Asiento 2: SrLyce (ciega pequeña) se retiró en el Flop",
      "Asiento 3: JstLeonel (ciega grande) se retiró en el Turn",
      "Asiento 4: Ozzy3110 recaudó (0.23 €)",
      "Asiento 5: toonsy2010 se retiró antes del Flop (no apostó)",
      "Asiento 6: mivipkr (botón) se retiró antes del Flop (no apostó)"
    ],
    "river": []
  },
  "board": [
    "Th",
    "5d",
    "4h",
    "3d"
  ],
  "winner": "Ozzy3110",
  "win_amount": 11.5,
  "sb": 0.01,
  "bb": 0.02,
  "rake": 1.0,
  "raw_text": "Mano n.º 257150544059 de PokerStars:  Hold'em No Limit (0.01 €/0.02 € EUR) - 30-07-2025 23:49:33 CET [30-07-2025 17:49:33 ET]\nMesa \"Mizuho\" 6-max El asiento n.º 6 es el botón\nAsiento 1: benipoker123 (0 € en fichas) está ausente\nAsiento 2: SrLyce (5.56 € en fichas) \nAsiento 3: JstLeonel (2.30 € en fichas) \nAsiento 4: Ozzy3110 (5.81 € en fichas) \nAsiento 5: toonsy2010 (1.86 € en fichas) \nAsiento 6: mivipkr (2.11 € en fichas) \nSrLyce: pone la ciega pequeña 0.01 €\nJstLeonel: pone la ciega grande 0.02 €\n*** CARTAS DE MANO ***\nRepartidas a SrLyce [8c Jd]\nOzzy3110: sube 0.03 € a 0.05 €\ntoonsy2010: se retira \nmivipkr: se retira \nSrLyce: iguala 0.04 €\nJstLeonel: iguala 0.03 €\n*** FLOP *** [Th 5d 4h]\nSrLyce: pasa \nJstLeonel: pasa \nOzzy3110: apuesta 0.05 €\nSrLyce: se retira \nJstLeonel: iguala 0.05 €\n*** TURN *** [Th 5d 4h] [3d]\nJstLeonel: pasa \nbenipoker123 deja la mesa\nOzzy3110: apuesta 0.17 €\nJstLeonel: se retira \nLa apuesta no igualada (0.17 €) ha sido devuelta a Ozzy3110\nOzzy3110 se lleva 0.23 € del bote \nOzzy3110: no muestra su mano \nAFR29 se une a la mesa en el asiento n.º 1 \n*** RESUMEN ***\nBote total 0.25 € | Comisión 0.02 € \nComunitarias [Th 5d 4h 3d]\nAsiento 1: benipoker123\nAsiento 2: SrLyce (ciega pequeña) se retiró en el Flop\nAsiento 3: JstLeonel (ciega grande) se retiró en el Turn\nAsiento 4: Ozzy3110 recaudó (0.23 €)\nAsiento 5: toonsy2010 se retiró antes del Flop (no apostó)\nAsiento 6: mivipkr (botón) se retiró antes del Flop (no apostó)"
}