{
  "hand_id": "257237720889",
  "date": "06-08-2025 17:51:32",
  "table": "Virtus",
  "game_type": "holdem",
  "hero": "SrLyce",
  "hero_position": "",
  "hero_cards": [
    "8d",
    "Jc"
  ],
  "stacks": {
    "Kingzilla87": 167.0,
    "SrLyce": 98.5,
    "zzranger_03": 180.5,
    "JGDOBLAS": 90.0,
    "don.corle": 142.0,
    "rudik34385": 97.5
  },
  "actions": {
    "preflop": [
      "Asiento 1: Kingzilla87 (3.34 € en fichas)",
      "Asiento 2: SrLyce (1.97 € en fichas)",
      "Asiento 3: zzranger_03 (3.61 € en fichas)",
      "Asiento 4: JGDOBLAS (1.80 € en fichas)",
      "Asiento 5: don.corle (2.84 € en fichas)",
      "Asiento 6: rudik34385 (1.95 € en fichas)",
      "don.corle: pone la ciega pequeña 0.01 €",
      "rudik34385: pone la ciega grande 0.02 €",
      "Kingzilla87: sube 0.04 € a 0.06 €",
      "SrLyce: se retira",
      "zzranger_03: se retira",
      "JGDOBLAS: se retira",
      "don.corle: se retira",
      "rudik34385: sube 0.04 € a 0.10 €",
      "Kingzilla87: iguala 0.04 €"
    ],
    "flop": [
      "rudik34385: pasa",
      "Kingzilla87: pasa"
    ],
    "turn": [
      "rudik34385: pasa",
      "Kingzilla87: apuesta 0.10 €",
      "rudik34385: se retira",
      "Kingzilla87: no muestra su mano",
      "Asiento 1: Kingzilla87 recaudó (0.20 €)",
      "Asiento 2: SrLyce se retiró antes del Flop (no apostó)",
      "Asiento 3: zzranger_03 se retiró antes del Flop (no apostó)",
      "Asiento 4: JGDOBLAS (botón) se retiró antes del Flop (no apostó)",
      "Asiento 5: don.corle (ciega pequeña) se retiró antes del Flop",
      "Asiento 6: rudik34385 (ciega grande) se retiró en el Turn"
    ],
    "river": []
  },
  "board": [
    "3d",
    "5d",
    "Td",
    "As"
  ],
  "winner": "Kingzilla87",
  "win_amount": 10.0,
  "sb": 0.01,
  "bb": 0.02,
  "rake": 0.5,
  "raw_text": "Mano n.º 257237720889 de PokerStars:  Hold'em No Limit (0.01 €/0.02 € EUR) - 06-08-2025 17:51:32 CET [06-08-2025 11:51:32 ET]\nMesa \"Virtus\" 6-max El asiento n.º 4 es el botón\nAsiento 1: Kingzilla87 (3.34 € en fichas) \nAsiento 2: SrLyce (1.97 € en fichas) \nAsiento 3: zzranger_03 (3.61 € en fichas) \nAsiento 4: JGDOBLAS (1.80 € en fichas) \nAsiento 5: don.corle (2.84 € en fichas) \nAsiento 6: rudik34385 (1.95 € en fichas) \ndon.corle: pone la ciega pequeña 0.01 €\nrudik34385: pone la ciega grande 0.02 €\n*** CARTAS DE MANO ***\nRepartidas a SrLyce [8d Jc]\nKingzilla87: sube 0.04 € a 0.06 €\nSrLyce: se retira \nzzranger_03: se retira \nJGDOBLAS: se retira \ndon.corle: se retira \nrudik34385: sube 0.04 € a 0.10 €\nKingzilla87: iguala 0.04 €\n*** FLOP *** [3d 5d Td]\nrudik34385: pasa \nKingzilla87: pasa \n*** TURN *** [3d 5d Td] [As]\nrudik34385: pasa \nKingzilla87: apuesta 0.10 €\nrudik34385: se retira \nLa apuesta no igualada (0.10 €) ha sido devuelta a Kingzilla87\nKingzilla87 se lleva 0.20 € del bote \nKingzilla87: no muestra su mano \n*** RESUMEN ***\nBote total 0.21 € | Comisión 0.01 € \nComunitarias [3d 5d Td As]\nAsiento 1: Kingzilla87 recaudó (0.20 €)\nAsiento 2: SrLyce se retiró antes del Flop (no apostó)\nAsiento 3: zzranger_03 se retiró antes del Flop (no apostó)\nAsiento 4: JGDOBLAS (botón) se retiró antes del Flop (no apostó)\nAsiento 5: don.corle (ciega pequeña) se retiró antes del Flop\nAsiento 6: rudik34385 (ciega grande) se retiró en el Turn"
}