{
  "hand_id": "257238349012",
  "date": "06-08-2025 18:50:04",
  "table": "Alruccabah II",
  "game_type": "holdem",
  "hero": "SrLyce",
  "hero_position": "",
  "hero_cards": [
    "2h",
    "Ac"
  ],
  "stacks": {
    "SrLyce": 100.0,
    "Davdgoni": 284.0,
    "tatinette35": 100.0,
    "Nicanor Cast": 55.5,
    "rayao32": 46.0
  },
  "actions": {
    "preflop": [
      "Asiento 1: SrLyce (2 € en fichas)",
      "Asiento 2: Davdgoni (5.68 € en fichas)",
      "Asiento 3: tatinette35 (2 € en fichas)",
      "Asiento 4: serviettski(fr) (2 € en fichas)",
      "Asiento 5: Nicanor Cast (1.11 € en fichas)",
      "Asiento 6: rayao32 (0.92 € en fichas)",
      "Davdgoni: pone la ciega pequeña 0.01 €",
      "tatinette35: pone la ciega grande 0.02 €",
      "serviettski(fr): se retira",
      "Nicanor Cast: se retira",
      "rayao32: iguala 0.02 €",
      "SrLyce: se retira",
      "Davdgoni: se retira",
      "tatinette35: pasa"
    ],
    "flop": [
      "tatinette35: pasa",
      "rayao32: pasa"
    ],
    "turn": [
      "tatinette35: pasa",
      "rayao32: pasa"
    ],
    "river": [
      "tatinette35: pasa",
      "rayao32: apuesta 0.08 €",
      "tatinette35: se retira",
      "Asiento 1: SrLyce (botón) se retiró antes del Flop (no apostó)",
      "Asiento 2: Davdgoni (ciega pequeña) se retiró antes del Flop",
      "Asiento 3: tatinette35 (ciega grande) se retiró en el River",
      "Asiento 4: serviettski(fr) se retiró antes del Flop (no apostó)",
      "Asiento 5: Nicanor Cast se retiró antes del Flop (no apostó)",
      "Asiento 6: rayao32 recaudó (0.05 €)"
    ]
  },
  "board": [
    "4s",
    "2s",
    "Js",
    "Kc",
    "Th"
  ],
  "winner": "rayao32",
  "win_amount": 2.5,
  "sb": 0.01,
  "bb": 0.02,
  "rake": 0.0,
  "raw_text": "Mano n.º 257238349012 de PokerStars:  Hold'em No Limit (0.01 €/0.02 € EUR) - 06-08-2025 18:50:04 CET [06-08-2025 12:50:04 ET]\nMesa \"Alruccabah II\" 6-max El asiento n.º 1 es el botón\nAsiento 1: SrLyce (2 € en fichas) \nAsiento 2: Davdgoni (5.68 € en fichas) \nAsiento 3: tatinette35 (2 € en fichas) \nAsiento 4: serviettski(fr) (2 € en fichas) \nAsiento 5: Nicanor Cast (1.11 € en fichas) \nAsiento 6: rayao32 (0.92 € en fichas) \nDavdgoni: pone la ciega pequeña 0.01 €\ntatinette35: pone la ciega grande 0.02 €\n*** CARTAS DE MANO ***\nRepartidas a SrLyce [2h Ac]\nserviettski(fr): se retira \nNicanor Cast: se retira \nrayao32: iguala 0.02 €\nSrLyce: se retira \nDavdgoni: se retira \ntatinette35: pasa \n*** FLOP *** [4s 2s Js]\ntatinette35: pasa \nrayao32: pasa \n*** TURN *** [4s 2s Js] [Kc]\ntatinette35: pasa \nrayao32: pasa \n*** RIVER *** [4s 2s Js Kc] [Th]\ntatinette35: pasa \nrayao32: apuesta 0.08 €\ntatinette35: se retira \nLa apuesta no igualada (0.08 €) ha sido devuelta a rayao32\nrayao32 se lleva 0.05 € del bote \n*** RESUMEN ***\nBote total 0.05 € | Comisión 0 € \nComunitarias [4s 2s Js Kc Th]\nAsiento 1: SrLyce (botón) se retiró antes del Flop (no apostó)\nAsiento 2: Davdgoni (ciega pequeña) se retiró antes del Flop\nAsiento 3: tatinette35 (ciega grande) se retiró en el River\nAsiento 4: serviettski(fr) se retiró antes del Flop (no apostó)\nAsiento 5: Nicanor Cast se retiró antes del Flop (no apostó)\nAsiento 6: rayao32 recaudó (0.05 €)"
}