{
  "hand_id": "257237958366",
  "date": "06-08-2025 18:15:24",
  "table": "Atreus",
  "game_type": "holdem",
  "hero": "SrLyce",
  "hero_position": "",
  "hero_cards": [
    "Qs",
    "6c"
  ],
  "stacks": {
    "PrendsCa": 100.0,
    "NRules82": 73.0,
    "JENOFONTE73": 122.5,
    "Fharock": 106.0,
    "SrLyce": 119.5,
    "FishamanReggae": 33.0
  },
  "actions": {
    "preflop": [
      "Asiento 1: PrendsCa (2 € en fichas)",
      "Asiento 2: NRules82 (1.46 € en fichas)",
      "Asiento 3: JENOFONTE73 (2.45 € en fichas)",
      "Asiento 4: Fharock (2.12 € en fichas)",
      "Asiento 5: SrLyce (2.39 € en fichas)",
      "Asiento 6: FishamanReggae (0.66 € en fichas)",
      "Fharock: pone la ciega pequeña 0.01 €",
      "SrLyce: pone la ciega grande 0.02 €",
      "FishamanReggae: se retira",
      "PrendsCa: sube 0.02 € a 0.04 €",
      "NRules82: iguala 0.04 €",
      "JENOFONTE73: sube 0.18 € a 0.22 €",
      "Fharock: se retira",
      "SrLyce: se retira",
      "PrendsCa: se retira",
      "NRules82: iguala 0.18 €"
    ],
    "flop": [
      "NRules82: pasa",
      "JENOFONTE73: apuesta 0.36 €",
      "NRules82: se retira",
      "JENOFONTE73: no muestra su mano",
      "Asiento 1: PrendsCa se retiró antes del Flop",
      "Asiento 2: NRules82 se retiró en el Flop",
      "Asiento 3: JENOFONTE73 (botón) recaudó (0.48 €)",
      "Asiento 4: Fharock (ciega pequeña) se retiró antes del Flop",
      "Asiento 5: SrLyce (ciega grande) se retiró antes del Flop",
      "Asiento 6: FishamanReggae se retiró antes del Flop (no apostó)"
    ],
    "turn": [],
    "river": []
  },
  "board": [
    "Qh",
    "As",
    "7s"
  ],
  "winner": "JENOFONTE73",
  "win_amount": 24.0,
  "sb": 0.01,
  "bb": 0.02,
  "rake": 1.5,
  "raw_text": "Mano n.º 257237958366 de PokerStars:  Hold'em No Limit (0.01 €/0.02 € EUR) - 06-08-2025 18:15:24 CET [06-08-2025 12:15:24 ET]\nMesa \"Atreus\" 6-max El asiento n.º 3 es el botón\nAsiento 1: PrendsCa (2 € en fichas) \nAsiento 2: NRules82 (1.46 € en fichas) \nAsiento 3: JENOFONTE73 (2.45 € en fichas) \nAsiento 4: Fharock (2.12 € en fichas) \nAsiento 5: SrLyce (2.39 € en fichas) \nAsiento 6: FishamanReggae (0.66 € en fichas) \nFharock: pone la ciega pequeña 0.01 €\nSrLyce: pone la ciega grande 0.02 €\n*** CARTAS DE MANO ***\nRepartidas a SrLyce [Qs 6c]\nFishamanReggae: se retira \nPrendsCa: sube 0.02 € a 0.04 €\nNRules82: iguala 0.04 €\nJENOFONTE73: sube 0.18 € a 0.22 €\nFharock: se retira \nSrLyce: se retira \nPrendsCa: se retira \nNRules82: iguala 0.18 €\n*** FLOP *** [Qh As 7s]\nNRules82: pasa \nJENOFONTE73: apuesta 0.36 €\nNRules82: se retira \nLa apuesta no igualada (0.36 €) ha sido devuelta a JENOFONTE73\nJENOFONTE73 se lleva 0.48 € del bote \nJENOFONTE73: no muestra su mano \n*** RESUMEN ***\nBote total 0.51 € | Comisión 0.03 € \nComunitarias [Qh As 7s]\nAsiento 1: PrendsCa se retiró antes del Flop\nAsiento 2: NRules82 se retiró en el Flop\nAsiento 3: JENOFONTE73 (botón) recaudó (0.48 €)\nAsiento 4: Fharock (ciega pequeña) se retiró antes del Flop\nAsiento 5: SrLyce (ciega grande) se retiró antes del Flop\nAsiento 6: FishamanReggae se retiró antes del Flop (no apostó)"
}