{
  "hand_id": "257149229305",
  "date": "30-07-2025 22:17:09",
  "table": "Esclangona",
  "game_type": "holdem",
  "hero": "SrLyce",
  "hero_position": "",
  "hero_cards": [
    "8s",
    "Ac"
  ],
  "stacks": {
    "ansiedadd": 44.5,
    "SrLyce": 87.0,
    "NoahBolete": 130.5,
    "Davdgoni": 236.0,
    "DiaZzZ1": 96.5,
    "elketefaka1": 88.5
  },
  "actions": {
    "preflop": [
      "Asiento 1: ansiedadd (0.89 € en fichas)",
      "Asiento 2: SrLyce (1.74 € en fichas)",
      "Asiento 3: NoahBolete (2.61 € en fichas)",
      "Asiento 4: Davdgoni (4.72 € en fichas)",
      "Asiento 5: DiaZzZ1 (1.93 € en fichas)",
      "Asiento 6: elketefaka1 (1.77 € en fichas)",
      "SrLyce: pone la ciega pequeña 0.01 €",
      "NoahBolete: pone la ciega grande 0.02 €",
      "Davdgoni: sube 0.05 € a 0.07 €",
      "DiaZzZ1: se retira",
      "elketefaka1: iguala 0.07 €",
      "ansiedadd: iguala 0.07 €",
      "SrLyce: iguala 0.06 €",
      "NoahBolete: sube 0.08 € a 0.15 €",
      "Davdgoni: iguala 0.08 €",
      "elketefaka1: iguala 0.08 €",
      "ansiedadd: se retira",
      "SrLyce: iguala 0.08 €"
    ],
    "flop": [
      "SrLyce: pasa",
      "NoahBolete: pasa",
      "Davdgoni: pasa",
      "elketefaka1: pasa"
    ],
    "turn": [
      "SrLyce: apuesta 0.32 €",
      "NoahBolete: se retira",
      "Davdgoni: iguala 0.32 €",
      "elketefaka1: iguala 0.32 €"
    ],
    "river": [
      "SrLyce: pasa",
      "Davdgoni: pasa",
      "elketefaka1: apuesta 1.30 € y está all-in",
      "SrLyce: iguala 1.27 € y está all-in",
      "Davdgoni: se retira",
      "elketefaka1: muestra [6d 7d] (carta alta as)",
      "SrLyce: muestra [8s Ac] (doble pareja, ases y ochos)",
      "Asiento 1: ansiedadd (botón) se retiró antes del Flop",
      "Asiento 2: SrLyce (ciega pequeña) muestra [8s Ac] y ganó (3.92 €) con doble pareja, ases y ochos",
      "Asiento 3: NoahBolete (ciega grande) se retiró en el Turn",
      "Asiento 4: Davdgoni se retiró en el River",
      "Asiento 5: DiaZzZ1 se retiró antes del Flop (no apostó)",
      "Asiento 6: elketefaka1 muestra [6d 7d] y perdió con carta alta as"
    ]
  },
  "board": [
    "As",
    "5d",
    "8c",
    "Ks",
    "Th"
  ],
  "winner": "SrLyce",
  "win_amount": 196.0,
  "sb": 0.01,
  "bb": 0.02,
  "rake": 12.5,
  "raw_text": "Mano n.º 257149229305 de PokerStars:  Hold'em No Limit (0.01 €/0.02 € EUR) - 30-07-2025 22:17:09 CET [30-07-2025 16:17:09 ET]\nMesa \"Esclangona\" 6-max El asiento n.º 1 es el botón\nAsiento 1: ansiedadd (0.89 € en fichas) \nAsiento 2: SrLyce (1.74 € en fichas) \nAsiento 3: NoahBolete (2.61 € en fichas) \nAsiento 4: Davdgoni (4.72 € en fichas) \nAsiento 5: DiaZzZ1 (1.93 € en fichas) \nAsiento 6: elketefaka1 (1.77 € en fichas) \nSrLyce: pone la ciega pequeña 0.01 €\nNoahBolete: pone la ciega grande 0.02 €\n*** CARTAS DE MANO ***\nRepartidas a SrLyce [8s Ac]\nDavdgoni: sube 0.05 € a 0.07 €\nDiaZzZ1: se retira \nelketefaka1: iguala 0.07 €\nansiedadd: iguala 0.07 €\nDavdgoni no tiene conexión \nSrLyce: iguala 0.06 €\nNoahBolete: sube 0.08 € a 0.15 €\nDavdgoni: iguala 0.08 €\nelketefaka1: iguala 0.08 €\nansiedadd: se retira \nSrLyce: iguala 0.08 €\n*** FLOP *** [As 5d 8c]\nSrLyce: pasa \nNoahBolete: pasa \nDavdgoni: pasa \nelketefaka1: pasa \n*** TURN *** [As 5d 8c] [Ks]\nSrLyce: apuesta 0.32 €\nNoahBolete: se retira \nDavdgoni: iguala 0.32 €\nelketefaka1: iguala 0.32 €\n*** RIVER *** [As 5d 8c Ks] [Th]\nSrLyce: pasa \nDavdgoni: pasa \nelketefaka1: apuesta 1.30 € y está all-in\nSrLyce: iguala 1.27 € y está all-in\nDavdgoni: se retira \nLa apuesta no igualada (0.03 €) ha sido devuelta a elketefaka1\nDavdgoni deja la mesa\n*** SHOW DOWN ***\nelketefaka1: muestra [6d 7d] (carta alta as)\nSrLyce: muestra [8s Ac] (doble pareja, ases y ochos)\nSrLyce se lleva 3.92 € del bote \n*** RESUMEN ***\nBote total 4.17 € | Comisión 0.25 € \nComunitarias [As 5d 8c Ks Th]\nAsiento 1: ansiedadd (botón) se retiró antes del Flop\nAsiento 2: SrLyce (ciega pequeña) muestra [8s Ac] y ganó (3.92 €) con doble pareja, ases y ochos\nAsiento 3: NoahBolete (ciega grande) se retiró en el Turn\nAsiento 4: Davdgoni se retiró en el River\nAsiento 5: DiaZzZ1 se retiró antes del Flop (no apostó)\nAsiento 6: elketefaka1 muestra [6d 7d] y perdió con carta alta as"
}