{
  "hand_id": "257237925819",
  "date": "06-08-2025 18:12:27",
  "table": "Atreus",
  "game_type": "holdem",
  "hero": "SrLyce",
  "hero_position": "",
  "hero_cards": [
    "7h",
    "4h"
  ],
  "stacks": {
    "PrendsCa": 105.0,
    "NRules82": 88.5,
    "JENOFONTE73": 124.0,
    "Fharock": 101.5,
    "SrLyce": 95.5,
    "FishamanReggae": 33.0
  },
  "actions": {
    "preflop": [
      "Asiento 1: PrendsCa (2.10 € en fichas)",
      "Asiento 2: NRules82 (1.77 € en fichas)",
      "Asiento 3: JENOFONTE73 (2.48 € en fichas)",
      "Asiento 4: Fharock (2.03 € en fichas)",
      "Asiento 5: SrLyce (1.91 € en fichas)",
      "Asiento 6: FishamanReggae (0.66 € en fichas)",
      "PrendsCa: pone la ciega pequeña 0.01 €",
      "NRules82: pone la ciega grande 0.02 €",
      "JENOFONTE73: se retira",
      "Fharock: sube 0.03 € a 0.05 €",
      "SrLyce: se retira",
      "FishamanReggae: se retira",
      "PrendsCa: se retira",
      "NRules82: iguala 0.03 €"
    ],
    "flop": [
      "NRules82: pasa",
      "Fharock: pasa"
    ],
    "turn": [
      "NRules82: apuesta 0.04 €",
      "Fharock: iguala 0.04 €"
    ],
    "river": [
      "NRules82: apuesta 0.10 €",
      "Fharock: sube 0.19 € a 0.29 €",
      "NRules82: se retira",
      "Fharock: muestra [8s]",
      "Asiento 1: PrendsCa (ciega pequeña) se retiró antes del Flop",
      "Asiento 2: NRules82 (ciega grande) se retiró en el River",
      "Asiento 3: JENOFONTE73 se retiró antes del Flop (no apostó)",
      "Asiento 4: Fharock recaudó (0.37 €)",
      "Asiento 5: SrLyce se retiró antes del Flop (no apostó)",
      "Asiento 6: FishamanReggae (botón) se retiró antes del Flop (no apostó)"
    ]
  },
  "board": [
    "6s",
    "6d",
    "6c",
    "Jc",
    "2s"
  ],
  "winner": "Fharock",
  "win_amount": 18.5,
  "sb": 0.01,
  "bb": 0.02,
  "rake": 1.0,
  "raw_text": "Mano n.º 257237925819 de PokerStars:  Hold'em No Limit (0.01 €/0.02 € EUR) - 06-08-2025 18:12:27 CET [06-08-2025 12:12:27 ET]\nMesa \"Atreus\" 6-max El asiento n.º 6 es el botón\nAsiento 1: PrendsCa (2.10 € en fichas) \nAsiento 2: NRules82 (1.77 € en fichas) \nAsiento 3: JENOFONTE73 (2.48 € en fichas) \nAsiento 4: Fharock (2.03 € en fichas) \nAsiento 5: SrLyce (1.91 € en fichas) \nAsiento 6: FishamanReggae (0.66 € en fichas) \nPrendsCa: pone la ciega pequeña 0.01 €\nNRules82: pone la ciega grande 0.02 €\n*** CARTAS DE MANO ***\nRepartidas a SrLyce [7h 4h]\nJENOFONTE73: se retira \nFharock: sube 0.03 € a 0.05 €\nSrLyce: se retira \nFishamanReggae: se retira \nPrendsCa: se retira \nNRules82: iguala 0.03 €\n*** FLOP *** [6s 6d 6c]\nNRules82: pasa \nFharock: pasa \n*** TURN *** [6s 6d 6c] [Jc]\nNRules82: apuesta 0.04 €\nFharock: iguala 0.04 €\n*** RIVER *** [6s 6d 6c Jc] [2s]\nNRules82: apuesta 0.10 €\nFharock: sube 0.19 € a 0.29 €\nNRules82: se retira \nLa apuesta no igualada (0.19 €) ha sido devuelta a Fharock\nFharock se lleva 0.37 € del bote \nFharock: muestra [8s]\n*** RESUMEN ***\nBote total 0.39 € | Comisión 0.02 € \nComunitarias [6s 6d 6c Jc 2s]\nAsiento 1: PrendsCa (ciega pequeña) se retiró antes del Flop\nAsiento 2: NRules82 (ciega grande) se retiró en el River\nAsiento 3: JENOFONTE73 se retiró antes del Flop (no apostó)\nAsiento 4: Fharock recaudó (0.37 €)\nAsiento 5: SrLyce se retiró antes del Flop (no apostó)\nAsiento 6: FishamanReggae (botón) se retiró antes del Flop (no apostó)"
}