{
  "hand_id": "257237859254",
  "date": "06-08-2025 18:06:15",
  "table": "Euneus III",
  "game_type": "holdem",
  "hero": "SrLyce",
  "hero_position": "",
  "hero_cards": [
    "4s",
    "8s"
  ],
  "stacks": {
    "christgear": 100.0,
    "JGDOBLAS": 100.0,
    "Begoton": 100.0,
    "Il_BM00": 108.5,
    "djrojas9": 149.0,
    "SrLyce": 105.5
  },
  "actions": {
    "preflop": [
      "Asiento 1: christgear (2 € en fichas) está ausente",
      "Asiento 4: JGDOBLAS (2 € en fichas) está ausente",
      "Asiento 6: Begoton (2 € en fichas) está ausente",
      "Asiento 2: Il_BM00 (2.17 € en fichas)",
      "Asiento 3: djrojas9 (2.98 € en fichas)",
      "Asiento 5: SrLyce (2.11 € en fichas)",
      "Il_BM00: pone la ciega pequeña 0.01 €",
      "djrojas9: pone la ciega grande 0.02 €",
      "JGDOBLAS: se ausenta",
      "SrLyce: sube 0.03 € a 0.05 €",
      "Il_BM00: iguala 0.04 €",
      "djrojas9: se retira"
    ],
    "flop": [
      "Il_BM00: pasa",
      "SrLyce: apuesta 0.06 €",
      "Il_BM00: se retira",
      "SrLyce: no muestra su mano",
      "Asiento 1: christgear",
      "Asiento 4: JGDOBLAS",
      "Asiento 6: Begoton",
      "Asiento 2: Il_BM00 (ciega pequeña) se retiró en el Flop",
      "Asiento 3: djrojas9 (ciega grande) se retiró antes del Flop",
      "Asiento 5: SrLyce (botón) recaudó (0.11 €)"
    ],
    "turn": [],
    "river": []
  },
  "board": [
    "8d",
    "4d",
    "3d"
  ],
  "winner": "SrLyce",
  "win_amount": 5.5,
  "sb": 0.01,
  "bb": 0.02,
  "rake": 0.5,
  "raw_text": "Mano n.º 257237859254 de PokerStars:  Hold'em No Limit (0.01 €/0.02 € EUR) - 06-08-2025 18:06:15 CET [06-08-2025 12:06:15 ET]\nMesa \"Euneus III\" 6-max El asiento n.º 5 es el botón\nAsiento 1: christgear (2 € en fichas) está ausente\nAsiento 4: JGDOBLAS (2 € en fichas) está ausente\nAsiento 6: Begoton (2 € en fichas) está ausente\nAsiento 2: Il_BM00 (2.17 € en fichas) \nAsiento 3: djrojas9 (2.98 € en fichas) \nAsiento 5: SrLyce (2.11 € en fichas) \nIl_BM00: pone la ciega pequeña 0.01 €\ndjrojas9: pone la ciega grande 0.02 €\nJGDOBLAS: se ausenta \n*** CARTAS DE MANO ***\nRepartidas a SrLyce [4s 8s]\nSrLyce: sube 0.03 € a 0.05 €\nIl_BM00: iguala 0.04 €\ndjrojas9: se retira \n*** FLOP *** [8d 4d 3d]\nIl_BM00: pasa \nSrLyce: apuesta 0.06 €\nIl_BM00: se retira \nLa apuesta no igualada (0.06 €) ha sido devuelta a SrLyce\nSrLyce se lleva 0.11 € del bote \nSrLyce: no muestra su mano \n*** RESUMEN ***\nBote total 0.12 € | Comisión 0.01 € \nComunitarias [8d 4d 3d]\nAsiento 1: christgear\nAsiento 4: JGDOBLAS\nAsiento 6: Begoton\nAsiento 2: Il_BM00 (ciega pequeña) se retiró en el Flop\nAsiento 3: djrojas9 (ciega grande) se retiró antes del Flop\nAsiento 5: SrLyce (botón) recaudó (0.11 €)"
}