{
  "hand_id": "257237923877",
  "date": "06-08-2025 18:12:17",
  "table": "Euneus III",
  "game_type": "holdem",
  "hero": "SrLyce",
  "hero_position": "",
  "hero_cards": [
    "7s",
    "5s"
  ],
  "stacks": {
    "djrojas9": 153.0,
    "lol-in 2000": 100.0,
    "christgear": 103.5,
    "Il_BM00": 136.0,
    "SrLyce": 99.5,
    "kcg_rm": 99.0
  },
  "actions": {
    "preflop": [
      "Asiento 3: djrojas9 (3.06 € en fichas) está ausente",
      "Asiento 4: lol-in 2000 (2 € en fichas) está ausente",
      "Asiento 1: christgear (2.07 € en fichas)",
      "Asiento 2: Il_BM00 (2.72 € en fichas)",
      "Asiento 5: SrLyce (1.99 € en fichas)",
      "Asiento 6: kcg_rm (1.98 € en fichas)",
      "kcg_rm: pone la ciega pequeña 0.01 €",
      "christgear: pone la ciega grande 0.02 €",
      "djrojas9: se ausenta",
      "lol-in 2000: se ausenta",
      "Il_BM00: sube 0.04 € a 0.06 €",
      "SrLyce: iguala 0.06 €",
      "kcg_rm: se retira",
      "christgear: se retira"
    ],
    "flop": [
      "Il_BM00: apuesta 0.07 €",
      "SrLyce: sube 0.11 € a 0.18 €",
      "Il_BM00: se retira",
      "SrLyce: no muestra su mano",
      "Asiento 3: djrojas9",
      "Asiento 4: lol-in 2000",
      "Asiento 1: christgear (ciega grande) se retiró antes del Flop",
      "Asiento 2: Il_BM00 se retiró en el Flop",
      "Asiento 5: SrLyce (botón) recaudó (0.27 €)",
      "Asiento 6: kcg_rm (ciega pequeña) se retiró antes del Flop"
    ],
    "turn": [],
    "river": []
  },
  "board": [
    "Qs",
    "2s",
    "9s"
  ],
  "winner": "SrLyce",
  "win_amount": 13.5,
  "sb": 0.01,
  "bb": 0.02,
  "rake": 1.0,
  "raw_text": "Mano n.º 257237923877 de PokerStars:  Hold'em No Limit (0.01 €/0.02 € EUR) - 06-08-2025 18:12:17 CET [06-08-2025 12:12:17 ET]\nMesa \"Euneus III\" 6-max El asiento n.º 5 es el botón\nAsiento 3: djrojas9 (3.06 € en fichas) está ausente\nAsiento 4: lol-in 2000 (2 € en fichas) está ausente\nAsiento 1: christgear (2.07 € en fichas) \nAsiento 2: Il_BM00 (2.72 € en fichas) \nAsiento 5: SrLyce (1.99 € en fichas) \nAsiento 6: kcg_rm (1.98 € en fichas) \nkcg_rm: pone la ciega pequeña 0.01 €\nchristgear: pone la ciega grande 0.02 €\ndjrojas9: se ausenta \nlol-in 2000: se ausenta \n*** CARTAS DE MANO ***\nRepartidas a SrLyce [7s 5s]\nIl_BM00: sube 0.04 € a 0.06 €\nSrLyce: iguala 0.06 €\nkcg_rm: se retira \nchristgear: se retira \n*** FLOP *** [Qs 2s 9s]\nIl_BM00: apuesta 0.07 €\nSrLyce: sube 0.11 € a 0.18 €\nIl_BM00: se retira \nLa apuesta no igualada (0.11 €) ha sido devuelta a SrLyce\nSrLyce se lleva 0.27 € del bote \nSrLyce: no muestra su mano \n*** RESUMEN ***\nBote total 0.29 € | Comisión 0.02 € \nComunitarias [Qs 2s 9s]\nAsiento 3: djrojas9\nAsiento 4: lol-in 2000\nAsiento 1: christgear (ciega grande) se retiró antes del Flop\nAsiento 2: Il_BM00 se retiró en el Flop\nAsiento 5: SrLyce (botón) recaudó (0.27 €)\nAsiento 6: kcg_rm (ciega pequeña) se retiró antes del Flop"
}