{
  "hand_id": "257148580621",
  "date": "30-07-2025 21:29:24",
  "table": "Sirona",
  "game_type": "holdem",
  "hero": "SrLyce",
  "hero_position": "",
  "hero_cards": [
    "Kh",
    "8d"
  ],
  "stacks": {
    "lecontrebandier": 100.0,
    "varvase": 196.5,
    "SrLyce": 93.0,
    "christoph363": 181.0,
    "oliverdu70": 98.0,
    "Dakoo44": 50.5
  },
  "actions": {
    "preflop": [
      "Asiento 2: lecontrebandier (2 € en fichas) está ausente",
      "Asiento 5: varvase (3.93 € en fichas) está ausente",
      "Asiento 1: SrLyce (1.86 € en fichas)",
      "Asiento 3: christoph363 (3.62 € en fichas)",
      "Asiento 4: oliverdu70 (1.96 € en fichas)",
      "Asiento 6: Dakoo44 (1.01 € en fichas)",
      "oliverdu70: pone la ciega pequeña 0.01 €",
      "varvase: está ausente",
      "Dakoo44: pone la ciega grande 0.02 €",
      "lecontrebandier: se ausenta",
      "SrLyce: se retira",
      "christoph363: se retira",
      "oliverdu70: se retira",
      "Dakoo44: no muestra su mano",
      "Asiento 2: lecontrebandier",
      "Asiento 5: varvase",
      "Asiento 1: SrLyce se retiró antes del Flop (no apostó)",
      "Asiento 3: christoph363 (botón) se retiró antes del Flop (no apostó)",
      "Asiento 4: oliverdu70 (ciega pequeña) se retiró antes del Flop",
      "Asiento 6: Dakoo44 (ciega grande) recaudó (0.02 €)"
    ],
    "flop": [],
    "turn": [],
    "river": []
  },
  "board": [],
  "winner": "Dakoo44",
  "win_amount": 1.0,
  "sb": 0.01,
  "bb": 0.02,
  "rake": 0.0,
  "raw_text": "Mano n.º 257148580621 de PokerStars:  Hold'em No Limit (0.01 €/0.02 € EUR) - 30-07-2025 21:29:24 CET [30-07-2025 15:29:24 ET]\nMesa \"Sirona\" 6-max El asiento n.º 3 es el botón\nAsiento 2: lecontrebandier (2 € en fichas) está ausente\nAsiento 5: varvase (3.93 € en fichas) está ausente\nAsiento 1: SrLyce (1.86 € en fichas) \nAsiento 3: christoph363 (3.62 € en fichas) \nAsiento 4: oliverdu70 (1.96 € en fichas) \nAsiento 6: Dakoo44 (1.01 € en fichas) \noliverdu70: pone la ciega pequeña 0.01 €\nvarvase: está ausente \nDakoo44: pone la ciega grande 0.02 €\nlecontrebandier: se ausenta \n*** CARTAS DE MANO ***\nRepartidas a SrLyce [Kh 8d]\nvarvase deja la mesa\nSrLyce: se retira \nchristoph363: se retira \noliverdu70: se retira \nLa apuesta no igualada (0.01 €) ha sido devuelta a Dakoo44\nDakoo44 se lleva 0.02 € del bote \nDakoo44: no muestra su mano \n*** RESUMEN ***\nBote total 0.02 € | Comisión 0 € \nAsiento 2: lecontrebandier\nAsiento 5: varvase\nAsiento 1: SrLyce se retiró antes del Flop (no apostó)\nAsiento 3: christoph363 (botón) se retiró antes del Flop (no apostó)\nAsiento 4: oliverdu70 (ciega pequeña) se retiró antes del Flop\nAsiento 6: Dakoo44 (ciega grande) recaudó (0.02 €)"
}