{
  "hand_id": "257149058667",
  "date": "30-07-2025 22:05:05",
  "table": "Sirona",
  "game_type": "holdem",
  "hero": "SrLyce",
  "hero_position": "",
  "hero_cards": [
    "Jh",
    "Th"
  ],
  "stacks": {
    "SrLyce": 121.0,
    "lecontrebandier": 93.5,
    "christoph363": 214.0,
    "oliverdu70": 185.5,
    "NaruchoH1": 100.0,
    "MitchATP65": 100.0
  },
  "actions": {
    "preflop": [
      "Asiento 1: SrLyce (2.42 € en fichas)",
      "Asiento 2: lecontrebandier (1.87 € en fichas)",
      "Asiento 3: christoph363 (4.28 € en fichas)",
      "Asiento 4: oliverdu70 (3.71 € en fichas)",
      "Asiento 5: NaruchoH1 (2 € en fichas)",
      "Asiento 6: MitchATP65 (2 € en fichas)",
      "lecontrebandier: pone la ciega pequeña 0.01 €",
      "christoph363: pone la ciega grande 0.02 €",
      "oliverdu70: se retira",
      "NaruchoH1: se retira",
      "MitchATP65: sube 0.04 € a 0.06 €",
      "SrLyce: iguala 0.06 €",
      "lecontrebandier: iguala 0.05 €",
      "christoph363: se retira"
    ],
    "flop": [
      "lecontrebandier: apuesta 0.10 €",
      "MitchATP65: se retira",
      "SrLyce: sube 0.20 € a 0.30 €",
      "lecontrebandier: iguala 0.20 €"
    ],
    "turn": [
      "lecontrebandier: pasa",
      "SrLyce: apuesta 0.75 €",
      "lecontrebandier: se retira",
      "SrLyce: no muestra su mano",
      "Asiento 1: SrLyce (botón) recaudó (0.75 €)",
      "Asiento 2: lecontrebandier (ciega pequeña) se retiró en el Turn",
      "Asiento 3: christoph363 (ciega grande) se retiró antes del Flop",
      "Asiento 4: oliverdu70 se retiró antes del Flop (no apostó)",
      "Asiento 5: NaruchoH1 se retiró antes del Flop (no apostó)",
      "Asiento 6: MitchATP65 se retiró en el Flop"
    ],
    "river": []
  },
  "board": [
    "9d",
    "Qh",
    "Kc",
    "Jd"
  ],
  "winner": "SrLyce",
  "win_amount": 37.5,
  "sb": 0.01,
  "bb": 0.02,
  "rake": 2.5,
  "raw_text": "Mano n.º 257149058667 de PokerStars:  Hold'em No Limit (0.01 €/0.02 € EUR) - 30-07-2025 22:05:05 CET [30-07-2025 16:05:05 ET]\nMesa \"Sirona\" 6-max El asiento n.º 1 es el botón\nAsiento 1: SrLyce (2.42 € en fichas) \nAsiento 2: lecontrebandier (1.87 € en fichas) \nAsiento 3: christoph363 (4.28 € en fichas) \nAsiento 4: oliverdu70 (3.71 € en fichas) \nAsiento 5: NaruchoH1 (2 € en fichas) \nAsiento 6: MitchATP65 (2 € en fichas) \nlecontrebandier: pone la ciega pequeña 0.01 €\nchristoph363: pone la ciega grande 0.02 €\n*** CARTAS DE MANO ***\nRepartidas a SrLyce [Jh Th]\noliverdu70: se retira \nNaruchoH1: se retira \nMitchATP65: sube 0.04 € a 0.06 €\nSrLyce: iguala 0.06 €\nlecontrebandier: iguala 0.05 €\nchristoph363: se retira \n*** FLOP *** [9d Qh Kc]\nlecontrebandier: apuesta 0.10 €\nMitchATP65: se retira \nSrLyce: sube 0.20 € a 0.30 €\nlecontrebandier: iguala 0.20 €\n*** TURN *** [9d Qh Kc] [Jd]\nlecontrebandier: pasa \nSrLyce: apuesta 0.75 €\nlecontrebandier: se retira \nLa apuesta no igualada (0.75 €) ha sido devuelta a SrLyce\nSrLyce se lleva 0.75 € del bote \nSrLyce: no muestra su mano \n*** RESUMEN ***\nBote total 0.80 € | Comisión 0.05 € \nComunitarias [9d Qh Kc Jd]\nAsiento 1: SrLyce (botón) recaudó (0.75 €)\nAsiento 2: lecontrebandier (ciega pequeña) se retiró en el Turn\nAsiento 3: christoph363 (ciega grande) se retiró antes del Flop\nAsiento 4: oliverdu70 se retiró antes del Flop (no apostó)\nAsiento 5: NaruchoH1 se retiró antes del Flop (no apostó)\nAsiento 6: MitchATP65 se retiró en el Flop"
}