{
  "hand_id": "257168327365",
  "date": "01-08-2025 11:27:29",
  "table": "Jupiter",
  "game_type": "holdem",
  "hero": "SrLyce",
  "hero_position": "",
  "hero_cards": [
    "3s",
    "6d"
  ],
  "stacks": {
    "sifilis5": 108.5,
    "Filou203": 111.5,
    "SrLyce": 107.0,
    "LOLA19711971": 27.5,
    "dadou13mars": 215.5,
    "Alvii37": 108.0
  },
  "actions": {
    "preflop": [
      "Asiento 1: sifilis5 (2.17 € en fichas)",
      "Asiento 2: Filou203 (2.23 € en fichas)",
      "Asiento 3: SrLyce (2.14 € en fichas)",
      "Asiento 4: LOLA19711971 (0.55 € en fichas)",
      "Asiento 5: dadou13mars (4.31 € en fichas)",
      "Asiento 6: Alvii37 (2.16 € en fichas)",
      "LOLA19711971: pone la ciega pequeña 0.01 €",
      "dadou13mars: pone la ciega grande 0.02 €",
      "Alvii37: se retira",
      "sifilis5: se retira",
      "Filou203: se retira",
      "SrLyce: se retira",
      "LOLA19711971: iguala 0.01 €",
      "dadou13mars: pasa"
    ],
    "flop": [
      "LOLA19711971: apuesta 0.04 €",
      "dadou13mars: se retira",
      "Asiento 1: sifilis5 se retiró antes del Flop (no apostó)",
      "Asiento 2: Filou203 se retiró antes del Flop (no apostó)",
      "Asiento 3: SrLyce (botón) se retiró antes del Flop (no apostó)",
      "Asiento 4: LOLA19711971 (ciega pequeña) recaudó (0.04 €)",
      "Asiento 5: dadou13mars (ciega grande) se retiró en el Flop",
      "Asiento 6: Alvii37 se retiró antes del Flop (no apostó)"
    ],
    "turn": [],
    "river": []
  },
  "board": [
    "9s",
    "Kd",
    "Kh"
  ],
  "winner": "LOLA19711971",
  "win_amount": 2.0,
  "sb": 0.01,
  "bb": 0.02,
  "rake": 0.0,
  "raw_text": "Mano n.º 257168327365 de PokerStars:  Hold'em No Limit (0.01 €/0.02 € EUR) - 01-08-2025 11:27:29 CET [01-08-2025 5:27:29 ET]\nMesa \"Jupiter\" 6-max El asiento n.º 3 es el botón\nAsiento 1: sifilis5 (2.17 € en fichas) \nAsiento 2: Filou203 (2.23 € en fichas) \nAsiento 3: SrLyce (2.14 € en fichas) \nAsiento 4: LOLA19711971 (0.55 € en fichas) \nAsiento 5: dadou13mars (4.31 € en fichas) \nAsiento 6: Alvii37 (2.16 € en fichas) \nLOLA19711971: pone la ciega pequeña 0.01 €\ndadou13mars: pone la ciega grande 0.02 €\n*** CARTAS DE MANO ***\nRepartidas a SrLyce [3s 6d]\nAlvii37: se retira \nsifilis5: se retira \nFilou203: se retira \nSrLyce: se retira \nLOLA19711971: iguala 0.01 €\ndadou13mars: pasa \n*** FLOP *** [9s Kd Kh]\nLOLA19711971: apuesta 0.04 €\ndadou13mars: se retira \nLa apuesta no igualada (0.04 €) ha sido devuelta a LOLA19711971\nLOLA19711971 se lleva 0.04 € del bote \n*** RESUMEN ***\nBote total 0.04 € | Comisión 0 € \nComunitarias [9s Kd Kh]\nAsiento 1: sifilis5 se retiró antes del Flop (no apostó)\nAsiento 2: Filou203 se retiró antes del Flop (no apostó)\nAsiento 3: SrLyce (botón) se retiró antes del Flop (no apostó)\nAsiento 4: LOLA19711971 (ciega pequeña) recaudó (0.04 €)\nAsiento 5: dadou13mars (ciega grande) se retiró en el Flop\nAsiento 6: Alvii37 se retiró antes del Flop (no apostó)"
}