{
  "hand_id": "257168415338",
  "date": "01-08-2025 11:43:38",
  "table": "Atlas",
  "game_type": "holdem",
  "hero": "SrLyce",
  "hero_position": "",
  "hero_cards": [
    "Jd",
    "6c"
  ],
  "stacks": {
    "SrLyce": 113.0,
    "Fharock": 128.0,
    "ecuinas": 79.0,
    "LxckxStrxkx": 126.0,
    "soy_cule74": 100.0,
    "Akourdideh": 84.5
  },
  "actions": {
    "preflop": [
      "Asiento 1: SrLyce (2.26 € en fichas)",
      "Asiento 2: Fharock (2.56 € en fichas)",
      "Asiento 3: ecuinas (1.58 € en fichas)",
      "Asiento 4: LxckxStrxkx (2.52 € en fichas)",
      "Asiento 5: soy_cule74 (2 € en fichas)",
      "Asiento 6: Akourdideh (1.69 € en fichas)",
      "LxckxStrxkx: pone la ciega pequeña 0.01 €",
      "soy_cule74: pone la ciega grande 0.02 €",
      "Akourdideh: se retira",
      "SrLyce: se retira",
      "Fharock: se retira",
      "ecuinas: se retira",
      "LxckxStrxkx: sube 0.04 € a 0.06 €",
      "soy_cule74: iguala 0.04 €"
    ],
    "flop": [
      "LxckxStrxkx: pasa",
      "soy_cule74: pasa"
    ],
    "turn": [
      "LxckxStrxkx: apuesta 0.12 €",
      "soy_cule74: se retira",
      "LxckxStrxkx: no muestra su mano",
      "Asiento 1: SrLyce se retiró antes del Flop (no apostó)",
      "Asiento 2: Fharock se retiró antes del Flop (no apostó)",
      "Asiento 3: ecuinas (botón) se retiró antes del Flop (no apostó)",
      "Asiento 4: LxckxStrxkx (ciega pequeña) recaudó (0.11 €)",
      "Asiento 5: soy_cule74 (ciega grande) se retiró en el Turn",
      "Asiento 6: Akourdideh se retiró antes del Flop (no apostó)"
    ],
    "river": []
  },
  "board": [
    "4c",
    "Qc",
    "4d",
    "3c"
  ],
  "winner": "LxckxStrxkx",
  "win_amount": 5.5,
  "sb": 0.01,
  "bb": 0.02,
  "rake": 0.5,
  "raw_text": "Mano n.º 257168415338 de PokerStars:  Hold'em No Limit (0.01 €/0.02 € EUR) - 01-08-2025 11:43:38 CET [01-08-2025 5:43:38 ET]\nMesa \"Atlas\" 6-max El asiento n.º 3 es el botón\nAsiento 1: SrLyce (2.26 € en fichas) \nAsiento 2: Fharock (2.56 € en fichas) \nAsiento 3: ecuinas (1.58 € en fichas) \nAsiento 4: LxckxStrxkx (2.52 € en fichas) \nAsiento 5: soy_cule74 (2 € en fichas) \nAsiento 6: Akourdideh (1.69 € en fichas) \nLxckxStrxkx: pone la ciega pequeña 0.01 €\nsoy_cule74: pone la ciega grande 0.02 €\n*** CARTAS DE MANO ***\nRepartidas a SrLyce [Jd 6c]\nAkourdideh: se retira \nSrLyce: se retira \nFharock: se retira \necuinas: se retira \nFharock deja la mesa\nLxckxStrxkx: sube 0.04 € a 0.06 €\nsoy_cule74: iguala 0.04 €\n*** FLOP *** [4c Qc 4d]\nLxckxStrxkx: pasa \nsoy_cule74: pasa \n*** TURN *** [4c Qc 4d] [3c]\nLxckxStrxkx: apuesta 0.12 €\nsoy_cule74: se retira \nLa apuesta no igualada (0.12 €) ha sido devuelta a LxckxStrxkx\nLxckxStrxkx se lleva 0.11 € del bote \nRamonsex777 se une a la mesa en el asiento n.º 2 \nLxckxStrxkx: no muestra su mano \n*** RESUMEN ***\nBote total 0.12 € | Comisión 0.01 € \nComunitarias [4c Qc 4d 3c]\nAsiento 1: SrLyce se retiró antes del Flop (no apostó)\nAsiento 2: Fharock se retiró antes del Flop (no apostó)\nAsiento 3: ecuinas (botón) se retiró antes del Flop (no apostó)\nAsiento 4: LxckxStrxkx (ciega pequeña) recaudó (0.11 €)\nAsiento 5: soy_cule74 (ciega grande) se retiró en el Turn\nAsiento 6: Akourdideh se retiró antes del Flop (no apostó)"
}