{
  "hand_id": "257238736263",
  "date": "06-08-2025 19:24:47",
  "table": "Herculina II",
  "game_type": "holdem",
  "hero": "SrLyce",
  "hero_position": "",
  "hero_cards": [
    "7d",
    "2s"
  ],
  "stacks": {
    "Alceo27": 120.5,
    "David98X": 143.0,
    "JJer11": 190.5,
    "SrLyce": 144.0,
    "Macklemore0": 104.5,
    "ScarvBlack": 100.0
  },
  "actions": {
    "preflop": [
      "Asiento 1: Alceo27 (2.41 € en fichas)",
      "Asiento 2: David98X (2.86 € en fichas)",
      "Asiento 3: JJer11 (3.81 € en fichas)",
      "Asiento 4: SrLyce (2.88 € en fichas)",
      "Asiento 5: Macklemore0 (2.09 € en fichas)",
      "Asiento 6: ScarvBlack (2 € en fichas)",
      "Macklemore0: pone la ciega pequeña 0.01 €",
      "ScarvBlack: pone la ciega grande 0.02 €",
      "Alceo27: se retira",
      "David98X: sube 0.04 € a 0.06 €",
      "JJer11: se retira",
      "SrLyce: se retira",
      "Macklemore0: se retira",
      "ScarvBlack: iguala 0.04 €"
    ],
    "flop": [
      "ScarvBlack: pasa",
      "David98X: apuesta 0.10 €",
      "ScarvBlack: iguala 0.10 €"
    ],
    "turn": [
      "ScarvBlack: pasa",
      "David98X: pasa"
    ],
    "river": [
      "ScarvBlack: pasa",
      "David98X: pasa",
      "ScarvBlack: muestra [8s 9c] (color, carta alta jota)",
      "David98X: descarta su mano sin mostrar",
      "Asiento 1: Alceo27 se retiró antes del Flop (no apostó)",
      "Asiento 2: David98X descartó sin mostrar [Td Ts]",
      "Asiento 3: JJer11 se retiró antes del Flop (no apostó)",
      "Asiento 4: SrLyce (botón) se retiró antes del Flop (no apostó)",
      "Asiento 5: Macklemore0 (ciega pequeña) se retiró antes del Flop",
      "Asiento 6: ScarvBlack (ciega grande) muestra [8s 9c] y ganó (0.31 €) con color, carta alta jota"
    ]
  },
  "board": [
    "Tc",
    "4c",
    "7c",
    "6c",
    "Jc"
  ],
  "winner": "ScarvBlack",
  "win_amount": 15.5,
  "sb": 0.01,
  "bb": 0.02,
  "rake": 1.0,
  "raw_text": "Mano n.º 257238736263 de PokerStars:  Hold'em No Limit (0.01 €/0.02 € EUR) - 06-08-2025 19:24:47 CET [06-08-2025 13:24:47 ET]\nMesa \"Herculina II\" 6-max El asiento n.º 4 es el botón\nAsiento 1: Alceo27 (2.41 € en fichas) \nAsiento 2: David98X (2.86 € en fichas) \nAsiento 3: JJer11 (3.81 € en fichas) \nAsiento 4: SrLyce (2.88 € en fichas) \nAsiento 5: Macklemore0 (2.09 € en fichas) \nAsiento 6: ScarvBlack (2 € en fichas) \nMacklemore0: pone la ciega pequeña 0.01 €\nScarvBlack: pone la ciega grande 0.02 €\n*** CARTAS DE MANO ***\nRepartidas a SrLyce [7d 2s]\nAlceo27: se retira \nDavid98X: sube 0.04 € a 0.06 €\nJJer11: se retira \nSrLyce: se retira \nMacklemore0: se retira \nScarvBlack: iguala 0.04 €\n*** FLOP *** [Tc 4c 7c]\nScarvBlack: pasa \nDavid98X: apuesta 0.10 €\nScarvBlack: iguala 0.10 €\n*** TURN *** [Tc 4c 7c] [6c]\nScarvBlack: pasa \nDavid98X: pasa \n*** RIVER *** [Tc 4c 7c 6c] [Jc]\nScarvBlack: pasa \nDavid98X: pasa \n*** SHOW DOWN ***\nScarvBlack: muestra [8s 9c] (color, carta alta jota)\nDavid98X: descarta su mano sin mostrar \nScarvBlack se lleva 0.31 € del bote \n*** RESUMEN ***\nBote total 0.33 € | Comisión 0.02 € \nComunitarias [Tc 4c 7c 6c Jc]\nAsiento 1: Alceo27 se retiró antes del Flop (no apostó)\nAsiento 2: David98X descartó sin mostrar [Td Ts]\nAsiento 3: JJer11 se retiró antes del Flop (no apostó)\nAsiento 4: SrLyce (botón) se retiró antes del Flop (no apostó)\nAsiento 5: Macklemore0 (ciega pequeña) se retiró antes del Flop\nAsiento 6: ScarvBlack (ciega grande) muestra [8s 9c] y ganó (0.31 €) con color, carta alta jota"
}