{
  "hand_id": "257149073130",
  "date": "30-07-2025 22:06:06",
  "table": "Esclangona",
  "game_type": "holdem",
  "hero": "SrLyce",
  "hero_position": "",
  "hero_cards": [
    "9s",
    "Kh"
  ],
  "stacks": {
    "Zorgue1080": 67.5,
    "SrLyce": 180.0,
    "NoahBolete": 94.5,
    "Davdgoni": 114.5,
    "DiaZzZ1": 94.5,
    "berlcht403": 35.5
  },
  "actions": {
    "preflop": [
      "Asiento 1: Zorgue1080 (1.35 € en fichas)",
      "Asiento 2: SrLyce (3.60 € en fichas)",
      "Asiento 3: NoahBolete (1.89 € en fichas)",
      "Asiento 4: Davdgoni (2.29 € en fichas)",
      "Asiento 5: DiaZzZ1 (1.89 € en fichas)",
      "Asiento 6: berlcht403 (0.71 € en fichas)",
      "NoahBolete: pone la ciega pequeña 0.01 €",
      "Davdgoni: pone la ciega grande 0.02 €",
      "DiaZzZ1: se retira",
      "berlcht403: iguala 0.02 €",
      "Zorgue1080: se retira",
      "SrLyce: se retira",
      "NoahBolete: sube 0.04 € a 0.06 €",
      "Davdgoni: se retira",
      "berlcht403: iguala 0.04 €"
    ],
    "flop": [
      "NoahBolete: apuesta 0.04 €",
      "berlcht403: se retira",
      "NoahBolete: no muestra su mano",
      "Asiento 1: Zorgue1080 se retiró antes del Flop (no apostó)",
      "Asiento 2: SrLyce (botón) se retiró antes del Flop (no apostó)",
      "Asiento 3: NoahBolete (ciega pequeña) recaudó (0.13 €)",
      "Asiento 4: Davdgoni (ciega grande) se retiró antes del Flop",
      "Asiento 5: DiaZzZ1 se retiró antes del Flop (no apostó)",
      "Asiento 6: berlcht403 se retiró en el Flop"
    ],
    "turn": [],
    "river": []
  },
  "board": [
    "7s",
    "6c",
    "Kc"
  ],
  "winner": "NoahBolete",
  "win_amount": 6.5,
  "sb": 0.01,
  "bb": 0.02,
  "rake": 0.5,
  "raw_text": "Mano n.º 257149073130 de PokerStars:  Hold'em No Limit (0.01 €/0.02 € EUR) - 30-07-2025 22:06:06 CET [30-07-2025 16:06:06 ET]\nMesa \"Esclangona\" 6-max El asiento n.º 2 es el botón\nAsiento 1: Zorgue1080 (1.35 € en fichas) \nAsiento 2: SrLyce (3.60 € en fichas) \nAsiento 3: NoahBolete (1.89 € en fichas) \nAsiento 4: Davdgoni (2.29 € en fichas) \nAsiento 5: DiaZzZ1 (1.89 € en fichas) \nAsiento 6: berlcht403 (0.71 € en fichas) \nNoahBolete: pone la ciega pequeña 0.01 €\nDavdgoni: pone la ciega grande 0.02 €\n*** CARTAS DE MANO ***\nRepartidas a SrLyce [9s Kh]\nDiaZzZ1: se retira \nberlcht403: iguala 0.02 €\nZorgue1080: se retira \nSrLyce: se retira \nNoahBolete: sube 0.04 € a 0.06 €\nDavdgoni: se retira \nberlcht403: iguala 0.04 €\n*** FLOP *** [7s 6c Kc]\nNoahBolete: apuesta 0.04 €\nberlcht403: se retira \nLa apuesta no igualada (0.04 €) ha sido devuelta a NoahBolete\nberlcht403 deja la mesa\nNoahBolete se lleva 0.13 € del bote \nNoahBolete: no muestra su mano \n*** RESUMEN ***\nBote total 0.14 € | Comisión 0.01 € \nComunitarias [7s 6c Kc]\nAsiento 1: Zorgue1080 se retiró antes del Flop (no apostó)\nAsiento 2: SrLyce (botón) se retiró antes del Flop (no apostó)\nAsiento 3: NoahBolete (ciega pequeña) recaudó (0.13 €)\nAsiento 4: Davdgoni (ciega grande) se retiró antes del Flop\nAsiento 5: DiaZzZ1 se retiró antes del Flop (no apostó)\nAsiento 6: berlcht403 se retiró en el Flop"
}