{
  "hand_id": "257150146077",
  "date": "30-07-2025 23:21:28",
  "table": "Gilgamesh",
  "game_type": "holdem",
  "hero": "SrLyce",
  "hero_position": "",
  "hero_cards": [
    "Ah",
    "2s"
  ],
  "stacks": {
    "riverrrrrrmagic": 122.5,
    "SrLyce": 98.5,
    "Jumby34": 101.5,
    "xapkk": 100.0,
    "samaritano34": 92.0,
    "Fretzo67500": 122.5
  },
  "actions": {
    "preflop": [
      "Asiento 1: riverrrrrrmagic (2.45 € en fichas)",
      "Asiento 2: SrLyce (1.97 € en fichas)",
      "Asiento 3: Jumby34 (2.03 € en fichas)",
      "Asiento 4: xapkk (2 € en fichas)",
      "Asiento 5: samaritano34 (1.84 € en fichas)",
      "Asiento 6: Fretzo67500 (2.45 € en fichas)",
      "SrLyce: pone la ciega pequeña 0.01 €",
      "Jumby34: pone la ciega grande 0.02 €",
      "xapkk: se retira",
      "samaritano34: se retira",
      "Fretzo67500: iguala 0.02 €",
      "riverrrrrrmagic: iguala 0.02 €",
      "SrLyce: iguala 0.01 €",
      "Jumby34: pasa"
    ],
    "flop": [
      "SrLyce: pasa",
      "Jumby34: pasa",
      "Fretzo67500: apuesta 0.04 €",
      "riverrrrrrmagic: se retira",
      "SrLyce: se retira",
      "Jumby34: se retira",
      "Asiento 1: riverrrrrrmagic (botón) se retiró en el Flop",
      "Asiento 2: SrLyce (ciega pequeña) se retiró en el Flop",
      "Asiento 3: Jumby34 (ciega grande) se retiró en el Flop",
      "Asiento 4: xapkk se retiró antes del Flop (no apostó)",
      "Asiento 5: samaritano34 se retiró antes del Flop (no apostó)",
      "Asiento 6: Fretzo67500 recaudó (0.08 €)"
    ],
    "turn": [],
    "river": []
  },
  "board": [
    "8c",
    "4h",
    "3s"
  ],
  "winner": "Fretzo67500",
  "win_amount": 4.0,
  "sb": 0.01,
  "bb": 0.02,
  "rake": 0.0,
  "raw_text": "Mano n.º 257150146077 de PokerStars:  Hold'em No Limit (0.01 €/0.02 € EUR) - 30-07-2025 23:21:28 CET [30-07-2025 17:21:28 ET]\nMesa \"Gilgamesh\" 6-max El asiento n.º 1 es el botón\nAsiento 1: riverrrrrrmagic (2.45 € en fichas) \nAsiento 2: SrLyce (1.97 € en fichas) \nAsiento 3: Jumby34 (2.03 € en fichas) \nAsiento 4: xapkk (2 € en fichas) \nAsiento 5: samaritano34 (1.84 € en fichas) \nAsiento 6: Fretzo67500 (2.45 € en fichas) \nSrLyce: pone la ciega pequeña 0.01 €\nJumby34: pone la ciega grande 0.02 €\n*** CARTAS DE MANO ***\nRepartidas a SrLyce [Ah 2s]\nxapkk: se retira \nsamaritano34: se retira \nFretzo67500: iguala 0.02 €\nriverrrrrrmagic: iguala 0.02 €\nSrLyce: iguala 0.01 €\nJumby34: pasa \n*** FLOP *** [8c 4h 3s]\nSrLyce: pasa \nJumby34: pasa \nFretzo67500: apuesta 0.04 €\nriverrrrrrmagic: se retira \nSrLyce: se retira \nJumby34: se retira \nLa apuesta no igualada (0.04 €) ha sido devuelta a Fretzo67500\nFretzo67500 se lleva 0.08 € del bote \n*** RESUMEN ***\nBote total 0.08 € | Comisión 0 € \nComunitarias [8c 4h 3s]\nAsiento 1: riverrrrrrmagic (botón) se retiró en el Flop\nAsiento 2: SrLyce (ciega pequeña) se retiró en el Flop\nAsiento 3: Jumby34 (ciega grande) se retiró en el Flop\nAsiento 4: xapkk se retiró antes del Flop (no apostó)\nAsiento 5: samaritano34 se retiró antes del Flop (no apostó)\nAsiento 6: Fretzo67500 recaudó (0.08 €)"
}