{
  "hand_id": "257150335200",
  "date": "30-07-2025 23:34:34",
  "table": "Martha",
  "game_type": "holdem",
  "hero": "SrLyce",
  "hero_position": "",
  "hero_cards": [
    "3c",
    "Ac"
  ],
  "stacks": {
    "mivipkr": 101.0,
    "NovacaineZxc": 120.0,
    "BudyXXIII": 106.0,
    "SrLyce": 100.0,
    "coyallen": 97.5
  },
  "actions": {
    "preflop": [
      "﻿Mano n.º 257150335200 de PokerStars:  Hold'em No Limit (0.01 €/0.02 € EUR) - 30-07-2025 23:34:34 CET [30-07-2025 17:34:34 ET]",
      "Asiento 1: mivipkr (2.02 € en fichas)",
      "Asiento 2: NovacaineZxc (2.40 € en fichas)",
      "Asiento 3: BudyXXIII (2.12 € en fichas)",
      "Asiento 5: SrLyce (2 € en fichas)",
      "Asiento 6: coyallen (1.95 € en fichas)",
      "BudyXXIII: pone la ciega pequeña 0.01 €",
      "SrLyce: pone la ciega grande 0.02 €",
      "coyallen: se retira",
      "mivipkr: sube 0.03 € a 0.05 €",
      "NovacaineZxc: se retira",
      "BudyXXIII: se retira",
      "SrLyce: iguala 0.03 €"
    ],
    "flop": [
      "SrLyce: pasa",
      "mivipkr: pasa"
    ],
    "turn": [
      "SrLyce: pasa",
      "mivipkr: apuesta 0.08 €",
      "SrLyce: se retira",
      "mivipkr: no muestra su mano",
      "Asiento 1: mivipkr recaudó (0.10 €)",
      "Asiento 2: NovacaineZxc (botón) se retiró antes del Flop (no apostó)",
      "Asiento 3: BudyXXIII (ciega pequeña) se retiró antes del Flop",
      "Asiento 5: SrLyce (ciega grande) se retiró en el Turn",
      "Asiento 6: coyallen se retiró antes del Flop (no apostó)"
    ],
    "river": []
  },
  "board": [
    "9h",
    "8s",
    "5s",
    "8c"
  ],
  "winner": "mivipkr",
  "win_amount": 5.0,
  "sb": 0.01,
  "bb": 0.02,
  "rake": 0.5,
  "raw_text": "﻿Mano n.º 257150335200 de PokerStars:  Hold'em No Limit (0.01 €/0.02 € EUR) - 30-07-2025 23:34:34 CET [30-07-2025 17:34:34 ET]\nMesa \"Martha\" 6-max El asiento n.º 2 es el botón\nAsiento 1: mivipkr (2.02 € en fichas) \nAsiento 2: NovacaineZxc (2.40 € en fichas) \nAsiento 3: BudyXXIII (2.12 € en fichas) \nAsiento 5: SrLyce (2 € en fichas) \nAsiento 6: coyallen (1.95 € en fichas) \nBudyXXIII: pone la ciega pequeña 0.01 €\nSrLyce: pone la ciega grande 0.02 €\n*** CARTAS DE MANO ***\nRepartidas a SrLyce [3c Ac]\ncoyallen: se retira \nmivipkr: sube 0.03 € a 0.05 €\nNovacaineZxc: se retira \nBudyXXIII: se retira \nSrLyce: iguala 0.03 €\n*** FLOP *** [9h 8s 5s]\nSrLyce: pasa \nSigiilo se une a la mesa en el asiento n.º 4 \nmivipkr: pasa \n*** TURN *** [9h 8s 5s] [8c]\nSrLyce: pasa \nmivipkr: apuesta 0.08 €\nSrLyce: se retira \nLa apuesta no igualada (0.08 €) ha sido devuelta a mivipkr\nmivipkr se lleva 0.10 € del bote \nmivipkr: no muestra su mano \n*** RESUMEN ***\nBote total 0.11 € | Comisión 0.01 € \nComunitarias [9h 8s 5s 8c]\nAsiento 1: mivipkr recaudó (0.10 €)\nAsiento 2: NovacaineZxc (botón) se retiró antes del Flop (no apostó)\nAsiento 3: BudyXXIII (ciega pequeña) se retiró antes del Flop\nAsiento 5: SrLyce (ciega grande) se retiró en el Turn\nAsiento 6: coyallen se retiró antes del Flop (no apostó)"
}