{
  "hand_id": "257238759277",
  "date": "06-08-2025 19:26:41",
  "table": "Adelaide III",
  "game_type": "holdem",
  "hero": "SrLyce",
  "hero_position": "",
  "hero_cards": [
    "Th",
    "Qc"
  ],
  "stacks": {
    "Alceo27": 100.0,
    "aliendee07": 43.0,
    "Macklemore0": 132.0,
    "SrLyce": 132.0,
    "ismagonzalez7": 100.5,
    "McFlash3": 130.0
  },
  "actions": {
    "preflop": [
      "Asiento 1: Alceo27 (2 € en fichas)",
      "Asiento 2: aliendee07 (0.86 € en fichas)",
      "Asiento 3: Macklemore0 (2.64 € en fichas)",
      "Asiento 4: SrLyce (2.64 € en fichas)",
      "Asiento 5: ismagonzalez7 (2.01 € en fichas)",
      "Asiento 6: McFlash3 (2.60 € en fichas)",
      "Alceo27: pone la ciega pequeña 0.01 €",
      "aliendee07: pone la ciega grande 0.02 €",
      "Macklemore0: se retira",
      "SrLyce: sube 0.03 € a 0.05 €",
      "ismagonzalez7: iguala 0.05 €",
      "McFlash3: se retira",
      "Alceo27: se retira",
      "aliendee07: se retira"
    ],
    "flop": [
      "SrLyce: apuesta 0.04 €",
      "ismagonzalez7: sube 0.10 € a 0.14 €",
      "SrLyce: iguala 0.10 €"
    ],
    "turn": [
      "SrLyce: pasa",
      "ismagonzalez7: apuesta 0.20 €",
      "SrLyce: iguala 0.20 €"
    ],
    "river": [
      "SrLyce: pasa",
      "ismagonzalez7: pasa",
      "SrLyce: muestra [Th Qc] (doble pareja, damas y dieces)",
      "ismagonzalez7: descarta su mano sin mostrar",
      "Asiento 1: Alceo27 (ciega pequeña) se retiró antes del Flop",
      "Asiento 2: aliendee07 (ciega grande) se retiró antes del Flop",
      "Asiento 3: Macklemore0 se retiró antes del Flop (no apostó)",
      "Asiento 4: SrLyce muestra [Th Qc] y ganó (0.76 €) con doble pareja, damas y dieces",
      "Asiento 5: ismagonzalez7 descartó sin mostrar [8c 8s]",
      "Asiento 6: McFlash3 (botón) se retiró antes del Flop (no apostó)"
    ]
  },
  "board": [
    "4h",
    "Tc",
    "5c",
    "5s",
    "Qd"
  ],
  "winner": "SrLyce",
  "win_amount": 38.0,
  "sb": 0.01,
  "bb": 0.02,
  "rake": 2.5,
  "raw_text": "Mano n.º 257238759277 de PokerStars:  Hold'em No Limit (0.01 €/0.02 € EUR) - 06-08-2025 19:26:41 CET [06-08-2025 13:26:41 ET]\nMesa \"Adelaide III\" 6-max El asiento n.º 6 es el botón\nAsiento 1: Alceo27 (2 € en fichas) \nAsiento 2: aliendee07 (0.86 € en fichas) \nAsiento 3: Macklemore0 (2.64 € en fichas) \nAsiento 4: SrLyce (2.64 € en fichas) \nAsiento 5: ismagonzalez7 (2.01 € en fichas) \nAsiento 6: McFlash3 (2.60 € en fichas) \nAlceo27: pone la ciega pequeña 0.01 €\naliendee07: pone la ciega grande 0.02 €\n*** CARTAS DE MANO ***\nRepartidas a SrLyce [Th Qc]\nMacklemore0: se retira \nSrLyce: sube 0.03 € a 0.05 €\nismagonzalez7: iguala 0.05 €\nMcFlash3: se retira \nAlceo27: se retira \naliendee07: se retira \n*** FLOP *** [4h Tc 5c]\nSrLyce: apuesta 0.04 €\nismagonzalez7: sube 0.10 € a 0.14 €\nSrLyce: iguala 0.10 €\n*** TURN *** [4h Tc 5c] [5s]\nSrLyce: pasa \nismagonzalez7: apuesta 0.20 €\nSrLyce: iguala 0.20 €\n*** RIVER *** [4h Tc 5c 5s] [Qd]\nSrLyce: pasa \nismagonzalez7: pasa \n*** SHOW DOWN ***\nSrLyce: muestra [Th Qc] (doble pareja, damas y dieces)\nismagonzalez7: descarta su mano sin mostrar \nSrLyce se lleva 0.76 € del bote \n*** RESUMEN ***\nBote total 0.81 € | Comisión 0.05 € \nComunitarias [4h Tc 5c 5s Qd]\nAsiento 1: Alceo27 (ciega pequeña) se retiró antes del Flop\nAsiento 2: aliendee07 (ciega grande) se retiró antes del Flop\nAsiento 3: Macklemore0 se retiró antes del Flop (no apostó)\nAsiento 4: SrLyce muestra [Th Qc] y ganó (0.76 €) con doble pareja, damas y dieces\nAsiento 5: ismagonzalez7 descartó sin mostrar [8c 8s]\nAsiento 6: McFlash3 (botón) se retiró antes del Flop (no apostó)"
}