{
  "hand_id": "257238172204",
  "date": "06-08-2025 18:34:29",
  "table": "Alruccabah II",
  "game_type": "holdem",
  "hero": "SrLyce",
  "hero_position": "",
  "hero_cards": [
    "Ac",
    "8s"
  ],
  "stacks": {
    "SrLyce": 95.0,
    "Davdgoni": 257.5,
    "PerroBestia": 43.5,
    "Nicanor Cast": 53.5,
    "rayao32": 39.0
  },
  "actions": {
    "preflop": [
      "Asiento 1: SrLyce (1.90 € en fichas)",
      "Asiento 2: Davdgoni (5.15 € en fichas)",
      "Asiento 3: PerroBestia (0.87 € en fichas)",
      "Asiento 4: serviettski(fr) (2.16 € en fichas)",
      "Asiento 5: Nicanor Cast (1.07 € en fichas)",
      "Asiento 6: rayao32 (0.78 € en fichas)",
      "Nicanor Cast: pone la ciega pequeña 0.01 €",
      "rayao32: pone la ciega grande 0.02 €",
      "SrLyce: sube 0.03 € a 0.05 €",
      "Davdgoni: iguala 0.05 €",
      "PerroBestia: se retira",
      "serviettski(fr): se retira",
      "Nicanor Cast: se retira",
      "rayao32: iguala 0.03 €"
    ],
    "flop": [
      "rayao32: pasa",
      "SrLyce: pasa",
      "Davdgoni: pasa"
    ],
    "turn": [
      "rayao32: pasa",
      "SrLyce: apuesta 0.05 €",
      "Davdgoni: iguala 0.05 €",
      "rayao32: iguala 0.05 €"
    ],
    "river": [
      "rayao32: pasa",
      "SrLyce: pasa",
      "Davdgoni: pasa",
      "rayao32: muestra [9s 7s] (trío de sietes)",
      "SrLyce: descarta su mano sin mostrar",
      "Davdgoni: descarta su mano sin mostrar",
      "Asiento 1: SrLyce descartó sin mostrar [Ac 8s]",
      "Asiento 2: Davdgoni descartó sin mostrar [Js Qh]",
      "Asiento 3: PerroBestia se retiró antes del Flop (no apostó)",
      "Asiento 4: serviettski(fr) (botón) se retiró antes del Flop (no apostó)",
      "Asiento 5: Nicanor Cast (ciega pequeña) se retiró antes del Flop",
      "Asiento 6: rayao32 (ciega grande) muestra [9s 7s] y ganó (0.29 €) con trío de sietes"
    ]
  },
  "board": [
    "2d",
    "Tc",
    "7h",
    "8d",
    "7d"
  ],
  "winner": "rayao32",
  "win_amount": 14.5,
  "sb": 0.01,
  "bb": 0.02,
  "rake": 1.0,
  "raw_text": "Mano n.º 257238172204 de PokerStars:  Hold'em No Limit (0.01 €/0.02 € EUR) - 06-08-2025 18:34:29 CET [06-08-2025 12:34:29 ET]\nMesa \"Alruccabah II\" 6-max El asiento n.º 4 es el botón\nAsiento 1: SrLyce (1.90 € en fichas) \nAsiento 2: Davdgoni (5.15 € en fichas) \nAsiento 3: PerroBestia (0.87 € en fichas) \nAsiento 4: serviettski(fr) (2.16 € en fichas) \nAsiento 5: Nicanor Cast (1.07 € en fichas) \nAsiento 6: rayao32 (0.78 € en fichas) \nNicanor Cast: pone la ciega pequeña 0.01 €\nrayao32: pone la ciega grande 0.02 €\n*** CARTAS DE MANO ***\nRepartidas a SrLyce [Ac 8s]\nSrLyce: sube 0.03 € a 0.05 €\nDavdgoni: iguala 0.05 €\nPerroBestia: se retira \nserviettski(fr): se retira \nNicanor Cast: se retira \nrayao32: iguala 0.03 €\n*** FLOP *** [2d Tc 7h]\nrayao32: pasa \nSrLyce: pasa \nDavdgoni: pasa \n*** TURN *** [2d Tc 7h] [8d]\nrayao32: pasa \nSrLyce: apuesta 0.05 €\nDavdgoni: iguala 0.05 €\nrayao32: iguala 0.05 €\n*** RIVER *** [2d Tc 7h 8d] [7d]\nrayao32: pasa \nSrLyce: pasa \nDavdgoni: pasa \n*** SHOW DOWN ***\nrayao32: muestra [9s 7s] (trío de sietes)\nSrLyce: descarta su mano sin mostrar \nDavdgoni: descarta su mano sin mostrar \nrayao32 se lleva 0.29 € del bote \n*** RESUMEN ***\nBote total 0.31 € | Comisión 0.02 € \nComunitarias [2d Tc 7h 8d 7d]\nAsiento 1: SrLyce descartó sin mostrar [Ac 8s]\nAsiento 2: Davdgoni descartó sin mostrar [Js Qh]\nAsiento 3: PerroBestia se retiró antes del Flop (no apostó)\nAsiento 4: serviettski(fr) (botón) se retiró antes del Flop (no apostó)\nAsiento 5: Nicanor Cast (ciega pequeña) se retiró antes del Flop\nAsiento 6: rayao32 (ciega grande) muestra [9s 7s] y ganó (0.29 €) con trío de sietes"
}