{
  "hand_id": "257237753958",
  "date": "06-08-2025 17:54:43",
  "table": "Virtus",
  "game_type": "holdem",
  "hero": "SrLyce",
  "hero_position": "",
  "hero_cards": [
    "4s",
    "2c"
  ],
  "stacks": {
    "pullup0": 40.0,
    "Kingzilla87": 170.5,
    "SrLyce": 107.5,
    "JGDOBLAS": 99.5,
    "don.corle": 141.5,
    "rudik34385": 78.5
  },
  "actions": {
    "preflop": [
      "Asiento 3: pullup0 (0.80 € en fichas) está ausente",
      "Asiento 1: Kingzilla87 (3.41 € en fichas)",
      "Asiento 2: SrLyce (2.15 € en fichas)",
      "Asiento 4: JGDOBLAS (1.99 € en fichas)",
      "Asiento 5: don.corle (2.83 € en fichas)",
      "Asiento 6: rudik34385 (1.57 € en fichas)",
      "rudik34385: pone la ciega pequeña 0.01 €",
      "Kingzilla87: pone la ciega grande 0.02 €",
      "pullup0: se ausenta",
      "SrLyce: se retira",
      "JGDOBLAS: sube 0.03 € a 0.05 €",
      "don.corle: se retira",
      "rudik34385: se retira",
      "Kingzilla87: se retira",
      "JGDOBLAS: no muestra su mano",
      "Asiento 3: pullup0",
      "Asiento 1: Kingzilla87 (ciega grande) se retiró antes del Flop",
      "Asiento 2: SrLyce se retiró antes del Flop (no apostó)",
      "Asiento 4: JGDOBLAS recaudó (0.05 €)",
      "Asiento 5: don.corle (botón) se retiró antes del Flop (no apostó)",
      "Asiento 6: rudik34385 (ciega pequeña) se retiró antes del Flop"
    ],
    "flop": [],
    "turn": [],
    "river": []
  },
  "board": [],
  "winner": "JGDOBLAS",
  "win_amount": 2.5,
  "sb": 0.01,
  "bb": 0.02,
  "rake": 0.0,
  "raw_text": "Mano n.º 257237753958 de PokerStars:  Hold'em No Limit (0.01 €/0.02 € EUR) - 06-08-2025 17:54:43 CET [06-08-2025 11:54:43 ET]\nMesa \"Virtus\" 6-max El asiento n.º 5 es el botón\nAsiento 3: pullup0 (0.80 € en fichas) está ausente\nAsiento 1: Kingzilla87 (3.41 € en fichas) \nAsiento 2: SrLyce (2.15 € en fichas) \nAsiento 4: JGDOBLAS (1.99 € en fichas) \nAsiento 5: don.corle (2.83 € en fichas) \nAsiento 6: rudik34385 (1.57 € en fichas) \nrudik34385: pone la ciega pequeña 0.01 €\nKingzilla87: pone la ciega grande 0.02 €\npullup0: se ausenta \n*** CARTAS DE MANO ***\nRepartidas a SrLyce [4s 2c]\nSrLyce: se retira \nJGDOBLAS: sube 0.03 € a 0.05 €\ndon.corle: se retira \nrudik34385: se retira \nKingzilla87: se retira \nLa apuesta no igualada (0.03 €) ha sido devuelta a JGDOBLAS\nJGDOBLAS se lleva 0.05 € del bote \nJGDOBLAS: no muestra su mano \n*** RESUMEN ***\nBote total 0.05 € | Comisión 0 € \nAsiento 3: pullup0\nAsiento 1: Kingzilla87 (ciega grande) se retiró antes del Flop\nAsiento 2: SrLyce se retiró antes del Flop (no apostó)\nAsiento 4: JGDOBLAS recaudó (0.05 €)\nAsiento 5: don.corle (botón) se retiró antes del Flop (no apostó)\nAsiento 6: rudik34385 (ciega pequeña) se retiró antes del Flop"
}