{
  "hand_id": "257168390336",
  "date": "01-08-2025 11:39:03",
  "table": "Jupiter",
  "game_type": "holdem",
  "hero": "SrLyce",
  "hero_position": "",
  "hero_cards": [
    "6h",
    "2c"
  ],
  "stacks": {
    "sifilis5": 100.0,
    "Filou203": 104.0,
    "SrLyce": 112.0,
    "LOLA19711971": 39.0,
    "dadou13mars": 210.5,
    "Alvii37": 117.5
  },
  "actions": {
    "preflop": [
      "Asiento 1: sifilis5 (2 € en fichas)",
      "Asiento 2: Filou203 (2.08 € en fichas)",
      "Asiento 3: SrLyce (2.24 € en fichas)",
      "Asiento 4: LOLA19711971 (0.78 € en fichas)",
      "Asiento 5: dadou13mars (4.21 € en fichas)",
      "Asiento 6: Alvii37 (2.35 € en fichas)",
      "LOLA19711971: pone la ciega pequeña 0.01 €",
      "dadou13mars: pone la ciega grande 0.02 €",
      "Alvii37: se retira",
      "sifilis5: se retira",
      "Filou203: sube 0.03 € a 0.05 €",
      "SrLyce: se retira",
      "LOLA19711971: se retira",
      "dadou13mars: se retira",
      "Filou203: no muestra su mano",
      "Asiento 1: sifilis5 se retiró antes del Flop (no apostó)",
      "Asiento 2: Filou203 recaudó (0.05 €)",
      "Asiento 3: SrLyce (botón) se retiró antes del Flop (no apostó)",
      "Asiento 4: LOLA19711971 (ciega pequeña) se retiró antes del Flop",
      "Asiento 5: dadou13mars (ciega grande) se retiró antes del Flop",
      "Asiento 6: Alvii37 se retiró antes del Flop (no apostó)"
    ],
    "flop": [],
    "turn": [],
    "river": []
  },
  "board": [],
  "winner": "Filou203",
  "win_amount": 2.5,
  "sb": 0.01,
  "bb": 0.02,
  "rake": 0.0,
  "raw_text": "Mano n.º 257168390336 de PokerStars:  Hold'em No Limit (0.01 €/0.02 € EUR) - 01-08-2025 11:39:03 CET [01-08-2025 5:39:03 ET]\nMesa \"Jupiter\" 6-max El asiento n.º 3 es el botón\nAsiento 1: sifilis5 (2 € en fichas) \nAsiento 2: Filou203 (2.08 € en fichas) \nAsiento 3: SrLyce (2.24 € en fichas) \nAsiento 4: LOLA19711971 (0.78 € en fichas) \nAsiento 5: dadou13mars (4.21 € en fichas) \nAsiento 6: Alvii37 (2.35 € en fichas) \nLOLA19711971: pone la ciega pequeña 0.01 €\ndadou13mars: pone la ciega grande 0.02 €\n*** CARTAS DE MANO ***\nRepartidas a SrLyce [6h 2c]\nAlvii37: se retira \nsifilis5: se retira \nFilou203: sube 0.03 € a 0.05 €\nSrLyce: se retira \nLOLA19711971: se retira \ndadou13mars: se retira \nLa apuesta no igualada (0.03 €) ha sido devuelta a Filou203\nFilou203 se lleva 0.05 € del bote \nFilou203: no muestra su mano \n*** RESUMEN ***\nBote total 0.05 € | Comisión 0 € \nAsiento 1: sifilis5 se retiró antes del Flop (no apostó)\nAsiento 2: Filou203 recaudó (0.05 €)\nAsiento 3: SrLyce (botón) se retiró antes del Flop (no apostó)\nAsiento 4: LOLA19711971 (ciega pequeña) se retiró antes del Flop\nAsiento 5: dadou13mars (ciega grande) se retiró antes del Flop\nAsiento 6: Alvii37 se retiró antes del Flop (no apostó)"
}