{
  "hand_id": "257238279560",
  "date": "06-08-2025 18:43:58",
  "table": "Herculina II",
  "game_type": "holdem",
  "hero": "SrLyce",
  "hero_position": "",
  "hero_cards": [
    "5s",
    "6c"
  ],
  "stacks": {
    "koldipk": 168.0,
    "David98X": 109.5,
    "JJer11": 100.0,
    "SrLyce": 89.5,
    "El Calvo 65": 233.5,
    "dragonfly2467": 100.0
  },
  "actions": {
    "preflop": [
      "Asiento 1: koldipk (3.36 € en fichas)",
      "Asiento 2: David98X (2.19 € en fichas)",
      "Asiento 3: JJer11 (2 € en fichas)",
      "Asiento 4: SrLyce (1.79 € en fichas)",
      "Asiento 5: El Calvo 65 (4.67 € en fichas)",
      "Asiento 6: dragonfly2467 (2 € en fichas)",
      "SrLyce: pone la ciega pequeña 0.01 €",
      "El Calvo 65: pone la ciega grande 0.02 €",
      "dragonfly2467: sube 0.04 € a 0.06 €",
      "koldipk: se retira",
      "David98X: se retira",
      "JJer11: se retira",
      "SrLyce: iguala 0.05 €",
      "El Calvo 65: se retira"
    ],
    "flop": [
      "SrLyce: pasa",
      "dragonfly2467: pasa"
    ],
    "turn": [
      "SrLyce: apuesta 0.06 €",
      "dragonfly2467: iguala 0.06 €"
    ],
    "river": [
      "SrLyce: apuesta 0.19 €",
      "dragonfly2467: se retira",
      "SrLyce: no muestra su mano",
      "Asiento 1: koldipk se retiró antes del Flop (no apostó)",
      "Asiento 2: David98X se retiró antes del Flop (no apostó)",
      "Asiento 3: JJer11 (botón) se retiró antes del Flop (no apostó)",
      "Asiento 4: SrLyce (ciega pequeña) recaudó (0.24 €)",
      "Asiento 5: El Calvo 65 (ciega grande) se retiró antes del Flop",
      "Asiento 6: dragonfly2467 se retiró en el River"
    ]
  },
  "board": [
    "Jd",
    "Td",
    "Kc",
    "Ts",
    "2d"
  ],
  "winner": "SrLyce",
  "win_amount": 12.0,
  "sb": 0.01,
  "bb": 0.02,
  "rake": 1.0,
  "raw_text": "Mano n.º 257238279560 de PokerStars:  Hold'em No Limit (0.01 €/0.02 € EUR) - 06-08-2025 18:43:58 CET [06-08-2025 12:43:58 ET]\nMesa \"Herculina II\" 6-max El asiento n.º 3 es el botón\nAsiento 1: koldipk (3.36 € en fichas) \nAsiento 2: David98X (2.19 € en fichas) \nAsiento 3: JJer11 (2 € en fichas) \nAsiento 4: SrLyce (1.79 € en fichas) \nAsiento 5: El Calvo 65 (4.67 € en fichas) \nAsiento 6: dragonfly2467 (2 € en fichas) \nSrLyce: pone la ciega pequeña 0.01 €\nEl Calvo 65: pone la ciega grande 0.02 €\n*** CARTAS DE MANO ***\nRepartidas a SrLyce [5s 6c]\ndragonfly2467: sube 0.04 € a 0.06 €\nkoldipk: se retira \nDavid98X: se retira \nJJer11: se retira \nSrLyce: iguala 0.05 €\nEl Calvo 65: se retira \n*** FLOP *** [Jd Td Kc]\nSrLyce: pasa \ndragonfly2467: pasa \n*** TURN *** [Jd Td Kc] [Ts]\nSrLyce: apuesta 0.06 €\ndragonfly2467: iguala 0.06 €\n*** RIVER *** [Jd Td Kc Ts] [2d]\nSrLyce: apuesta 0.19 €\ndragonfly2467: se retira \nLa apuesta no igualada (0.19 €) ha sido devuelta a SrLyce\nSrLyce se lleva 0.24 € del bote \nSrLyce: no muestra su mano \n*** RESUMEN ***\nBote total 0.26 € | Comisión 0.02 € \nComunitarias [Jd Td Kc Ts 2d]\nAsiento 1: koldipk se retiró antes del Flop (no apostó)\nAsiento 2: David98X se retiró antes del Flop (no apostó)\nAsiento 3: JJer11 (botón) se retiró antes del Flop (no apostó)\nAsiento 4: SrLyce (ciega pequeña) recaudó (0.24 €)\nAsiento 5: El Calvo 65 (ciega grande) se retiró antes del Flop\nAsiento 6: dragonfly2467 se retiró en el River"
}