{
  "hand_id": "257148860676",
  "date": "30-07-2025 21:49:10",
  "table": "Esclangona",
  "game_type": "holdem",
  "hero": "SrLyce",
  "hero_position": "",
  "hero_cards": [
    "Ks",
    "2s"
  ],
  "stacks": {
    "Zorgue1080": 85.0,
    "SrLyce": 162.0,
    "NoahBolete": 96.5,
    "Davdgoni": 108.0,
    "DiaZzZ1": 96.5,
    "berlcht403": 40.0
  },
  "actions": {
    "preflop": [
      "Asiento 1: Zorgue1080 (1.70 € en fichas)",
      "Asiento 2: SrLyce (3.24 € en fichas)",
      "Asiento 3: NoahBolete (1.93 € en fichas)",
      "Asiento 4: Davdgoni (2.16 € en fichas)",
      "Asiento 5: DiaZzZ1 (1.93 € en fichas)",
      "Asiento 6: berlcht403 (0.80 € en fichas)",
      "NoahBolete: pone la ciega pequeña 0.01 €",
      "Davdgoni: pone la ciega grande 0.02 €",
      "DiaZzZ1: se retira",
      "berlcht403: se retira",
      "Zorgue1080: se retira",
      "SrLyce: sube 0.04 € a 0.06 €",
      "NoahBolete: sube 0.08 € a 0.14 €",
      "Davdgoni: se retira",
      "SrLyce: se retira",
      "NoahBolete: no muestra su mano",
      "Asiento 1: Zorgue1080 se retiró antes del Flop (no apostó)",
      "Asiento 2: SrLyce (botón) se retiró antes del Flop",
      "Asiento 3: NoahBolete (ciega pequeña) recaudó (0.14 €)",
      "Asiento 4: Davdgoni (ciega grande) se retiró antes del Flop",
      "Asiento 5: DiaZzZ1 se retiró antes del Flop (no apostó)",
      "Asiento 6: berlcht403 se retiró antes del Flop (no apostó)"
    ],
    "flop": [],
    "turn": [],
    "river": []
  },
  "board": [],
  "winner": "NoahBolete",
  "win_amount": 7.0,
  "sb": 0.01,
  "bb": 0.02,
  "rake": 0.0,
  "raw_text": "Mano n.º 257148860676 de PokerStars:  Hold'em No Limit (0.01 €/0.02 € EUR) - 30-07-2025 21:49:10 CET [30-07-2025 15:49:10 ET]\nMesa \"Esclangona\" 6-max El asiento n.º 2 es el botón\nAsiento 1: Zorgue1080 (1.70 € en fichas) \nAsiento 2: SrLyce (3.24 € en fichas) \nAsiento 3: NoahBolete (1.93 € en fichas) \nAsiento 4: Davdgoni (2.16 € en fichas) \nAsiento 5: DiaZzZ1 (1.93 € en fichas) \nAsiento 6: berlcht403 (0.80 € en fichas) \nNoahBolete: pone la ciega pequeña 0.01 €\nDavdgoni: pone la ciega grande 0.02 €\n*** CARTAS DE MANO ***\nRepartidas a SrLyce [Ks 2s]\nDiaZzZ1: se retira \nberlcht403: se retira \nZorgue1080: se retira \nSrLyce: sube 0.04 € a 0.06 €\nNoahBolete: sube 0.08 € a 0.14 €\nDavdgoni: se retira \nSrLyce: se retira \nLa apuesta no igualada (0.08 €) ha sido devuelta a NoahBolete\nNoahBolete se lleva 0.14 € del bote \nNoahBolete: no muestra su mano \n*** RESUMEN ***\nBote total 0.14 € | Comisión 0 € \nAsiento 1: Zorgue1080 se retiró antes del Flop (no apostó)\nAsiento 2: SrLyce (botón) se retiró antes del Flop\nAsiento 3: NoahBolete (ciega pequeña) recaudó (0.14 €)\nAsiento 4: Davdgoni (ciega grande) se retiró antes del Flop\nAsiento 5: DiaZzZ1 se retiró antes del Flop (no apostó)\nAsiento 6: berlcht403 se retiró antes del Flop (no apostó)"
}