{
  "hand_id": "257237975377",
  "date": "06-08-2025 18:16:56",
  "table": "Atreus",
  "game_type": "holdem",
  "hero": "SrLyce",
  "hero_position": "",
  "hero_cards": [
    "3c",
    "Qc"
  ],
  "stacks": {
    "PrendsCa": 100.0,
    "NRules82": 62.0,
    "JENOFONTE73": 133.5,
    "Fharock": 103.5,
    "SrLyce": 124.0,
    "FishamanReggae": 31.0
  },
  "actions": {
    "preflop": [
      "Asiento 1: PrendsCa (2 € en fichas)",
      "Asiento 2: NRules82 (1.24 € en fichas)",
      "Asiento 3: JENOFONTE73 (2.67 € en fichas)",
      "Asiento 4: Fharock (2.07 € en fichas)",
      "Asiento 5: SrLyce (2.48 € en fichas)",
      "Asiento 6: FishamanReggae (0.62 € en fichas)",
      "FishamanReggae: pone la ciega pequeña 0.01 €",
      "PrendsCa: pone la ciega grande 0.02 €",
      "NRules82: sube 0.02 € a 0.04 €",
      "JENOFONTE73: se retira",
      "Fharock: sube 0.07 € a 0.11 €",
      "SrLyce: se retira",
      "FishamanReggae: se retira",
      "PrendsCa: iguala 0.09 €",
      "NRules82: iguala 0.07 €"
    ],
    "flop": [
      "PrendsCa: pasa",
      "NRules82: pasa",
      "Fharock: apuesta 0.12 €",
      "PrendsCa: se retira",
      "NRules82: iguala 0.12 €"
    ],
    "turn": [
      "NRules82: pasa",
      "Fharock: pasa"
    ],
    "river": [
      "NRules82: apuesta 0.24 €",
      "Fharock: se retira",
      "Asiento 1: PrendsCa (ciega grande) se retiró en el Flop",
      "Asiento 2: NRules82 recaudó (0.55 €)",
      "Asiento 3: JENOFONTE73 se retiró antes del Flop (no apostó)",
      "Asiento 4: Fharock se retiró en el River",
      "Asiento 5: SrLyce (botón) se retiró antes del Flop (no apostó)",
      "Asiento 6: FishamanReggae (ciega pequeña) se retiró antes del Flop"
    ]
  },
  "board": [
    "4h",
    "Ad",
    "5c",
    "8c",
    "9h"
  ],
  "winner": "NRules82",
  "win_amount": 27.5,
  "sb": 0.01,
  "bb": 0.02,
  "rake": 1.5,
  "raw_text": "Mano n.º 257237975377 de PokerStars:  Hold'em No Limit (0.01 €/0.02 € EUR) - 06-08-2025 18:16:56 CET [06-08-2025 12:16:56 ET]\nMesa \"Atreus\" 6-max El asiento n.º 5 es el botón\nAsiento 1: PrendsCa (2 € en fichas) \nAsiento 2: NRules82 (1.24 € en fichas) \nAsiento 3: JENOFONTE73 (2.67 € en fichas) \nAsiento 4: Fharock (2.07 € en fichas) \nAsiento 5: SrLyce (2.48 € en fichas) \nAsiento 6: FishamanReggae (0.62 € en fichas) \nFishamanReggae: pone la ciega pequeña 0.01 €\nPrendsCa: pone la ciega grande 0.02 €\n*** CARTAS DE MANO ***\nRepartidas a SrLyce [3c Qc]\nNRules82: sube 0.02 € a 0.04 €\nJENOFONTE73: se retira \nFharock: sube 0.07 € a 0.11 €\nSrLyce: se retira \nFishamanReggae: se retira \nPrendsCa: iguala 0.09 €\nNRules82: iguala 0.07 €\n*** FLOP *** [4h Ad 5c]\nPrendsCa: pasa \nNRules82: pasa \nFharock: apuesta 0.12 €\nPrendsCa: se retira \nNRules82: iguala 0.12 €\n*** TURN *** [4h Ad 5c] [8c]\nNRules82: pasa \nFharock: pasa \n*** RIVER *** [4h Ad 5c 8c] [9h]\nNRules82: apuesta 0.24 €\nFharock: se retira \nLa apuesta no igualada (0.24 €) ha sido devuelta a NRules82\nNRules82 se lleva 0.55 € del bote \n*** RESUMEN ***\nBote total 0.58 € | Comisión 0.03 € \nComunitarias [4h Ad 5c 8c 9h]\nAsiento 1: PrendsCa (ciega grande) se retiró en el Flop\nAsiento 2: NRules82 recaudó (0.55 €)\nAsiento 3: JENOFONTE73 se retiró antes del Flop (no apostó)\nAsiento 4: Fharock se retiró en el River\nAsiento 5: SrLyce (botón) se retiró antes del Flop (no apostó)\nAsiento 6: FishamanReggae (ciega pequeña) se retiró antes del Flop"
}