{
  "hand_id": "257214961147",
  "date": "04-08-2025 22:15:33",
  "table": "Anneliese II",
  "game_type": "holdem",
  "hero": "SrLyce",
  "hero_position": "",
  "hero_cards": [
    "Ac",
    "Qh"
  ],
  "stacks": {
    "betterrrrrr": 100.0,
    "niyomalo": 104.5,
    "ElManu62": 113.0,
    "SrLyce": 101.5,
    "Mr_Pkr98": 143.0,
    "Spotick": 109.0
  },
  "actions": {
    "preflop": [
      "Asiento 1: betterrrrrr (2 € en fichas)",
      "Asiento 2: niyomalo (2.09 € en fichas)",
      "Asiento 3: ElManu62 (2.26 € en fichas)",
      "Asiento 4: SrLyce (2.03 € en fichas)",
      "Asiento 5: Mr_Pkr98 (2.86 € en fichas)",
      "Asiento 6: Spotick (2.18 € en fichas)",
      "niyomalo: pone la ciega pequeña 0.01 €",
      "ElManu62: pone la ciega grande 0.02 €",
      "SrLyce: sube 0.04 € a 0.06 €",
      "Mr_Pkr98: se retira",
      "Spotick: se retira",
      "betterrrrrr: se retira",
      "niyomalo: se retira",
      "ElManu62: iguala 0.04 €"
    ],
    "flop": [
      "ElManu62: pasa",
      "SrLyce: pasa"
    ],
    "turn": [
      "ElManu62: apuesta 0.12 €",
      "SrLyce: se retira",
      "ElManu62: no muestra su mano",
      "Asiento 1: betterrrrrr (botón) se retiró antes del Flop (no apostó)",
      "Asiento 2: niyomalo (ciega pequeña) se retiró antes del Flop",
      "Asiento 3: ElManu62 (ciega grande) recaudó (0.12 €)",
      "Asiento 4: SrLyce se retiró en el Turn",
      "Asiento 5: Mr_Pkr98 se retiró antes del Flop (no apostó)",
      "Asiento 6: Spotick se retiró antes del Flop (no apostó)"
    ],
    "river": []
  },
  "board": [
    "Jh",
    "6c",
    "3h",
    "Js"
  ],
  "winner": "ElManu62",
  "win_amount": 6.0,
  "sb": 0.01,
  "bb": 0.02,
  "rake": 0.5,
  "raw_text": "Mano n.º 257214961147 de PokerStars:  Hold'em No Limit (0.01 €/0.02 € EUR) - 04-08-2025 22:15:33 CET [04-08-2025 16:15:33 ET]\nMesa \"Anneliese II\" 6-max El asiento n.º 1 es el botón\nAsiento 1: betterrrrrr (2 € en fichas) \nAsiento 2: niyomalo (2.09 € en fichas) \nAsiento 3: ElManu62 (2.26 € en fichas) \nAsiento 4: SrLyce (2.03 € en fichas) \nAsiento 5: Mr_Pkr98 (2.86 € en fichas) \nAsiento 6: Spotick (2.18 € en fichas) \nniyomalo: pone la ciega pequeña 0.01 €\nElManu62: pone la ciega grande 0.02 €\n*** CARTAS DE MANO ***\nRepartidas a SrLyce [Ac Qh]\nSrLyce: sube 0.04 € a 0.06 €\nMr_Pkr98: se retira \nSpotick: se retira \nbetterrrrrr: se retira \nniyomalo: se retira \nElManu62: iguala 0.04 €\n*** FLOP *** [Jh 6c 3h]\nElManu62: pasa \nSrLyce: pasa \n*** TURN *** [Jh 6c 3h] [Js]\nElManu62: apuesta 0.12 €\nSrLyce: se retira \nLa apuesta no igualada (0.12 €) ha sido devuelta a ElManu62\nElManu62 se lleva 0.12 € del bote \nElManu62: no muestra su mano \n*** RESUMEN ***\nBote total 0.13 € | Comisión 0.01 € \nComunitarias [Jh 6c 3h Js]\nAsiento 1: betterrrrrr (botón) se retiró antes del Flop (no apostó)\nAsiento 2: niyomalo (ciega pequeña) se retiró antes del Flop\nAsiento 3: ElManu62 (ciega grande) recaudó (0.12 €)\nAsiento 4: SrLyce se retiró en el Turn\nAsiento 5: Mr_Pkr98 se retiró antes del Flop (no apostó)\nAsiento 6: Spotick se retiró antes del Flop (no apostó)"
}