{
  "hand_id": "257237766756",
  "date": "06-08-2025 17:56:09",
  "table": "Atreus",
  "game_type": "holdem",
  "hero": "SrLyce",
  "hero_position": "",
  "hero_cards": [
    "6c",
    "Qc"
  ],
  "stacks": {
    "PrendsCa": 108.0,
    "NRules82": 74.5,
    "JENOFONTE73": 132.5,
    "JGDOBLAS": 93.5,
    "SrLyce": 114.0
  },
  "actions": {
    "preflop": [
      "Asiento 1: PrendsCa (2.16 € en fichas)",
      "Asiento 2: NRules82 (1.49 € en fichas)",
      "Asiento 3: JENOFONTE73 (2.65 € en fichas)",
      "Asiento 4: JGDOBLAS (1.87 € en fichas)",
      "Asiento 5: SrLyce (2.28 € en fichas)",
      "JGDOBLAS: pone la ciega pequeña 0.01 €",
      "SrLyce: pone la ciega grande 0.02 €",
      "PrendsCa: se retira",
      "NRules82: sube 0.02 € a 0.04 €",
      "JENOFONTE73: se retira",
      "JGDOBLAS: se retira",
      "SrLyce: iguala 0.02 €"
    ],
    "flop": [
      "SrLyce: pasa",
      "NRules82: apuesta 0.02 €",
      "SrLyce: iguala 0.02 €"
    ],
    "turn": [
      "SrLyce: pasa",
      "NRules82: apuesta 0.06 €",
      "SrLyce: iguala 0.06 €"
    ],
    "river": [
      "SrLyce: pasa",
      "NRules82: apuesta 0.23 €",
      "SrLyce: se retira",
      "Asiento 1: PrendsCa se retiró antes del Flop (no apostó)",
      "Asiento 2: NRules82 recaudó (0.23 €)",
      "Asiento 3: JENOFONTE73 (botón) se retiró antes del Flop (no apostó)",
      "Asiento 4: JGDOBLAS (ciega pequeña) se retiró antes del Flop",
      "Asiento 5: SrLyce (ciega grande) se retiró en el River"
    ]
  },
  "board": [
    "As",
    "Tc",
    "Js",
    "5c",
    "7s"
  ],
  "winner": "NRules82",
  "win_amount": 11.5,
  "sb": 0.01,
  "bb": 0.02,
  "rake": 1.0,
  "raw_text": "Mano n.º 257237766756 de PokerStars:  Hold'em No Limit (0.01 €/0.02 € EUR) - 06-08-2025 17:56:09 CET [06-08-2025 11:56:09 ET]\nMesa \"Atreus\" 6-max El asiento n.º 3 es el botón\nAsiento 1: PrendsCa (2.16 € en fichas) \nAsiento 2: NRules82 (1.49 € en fichas) \nAsiento 3: JENOFONTE73 (2.65 € en fichas) \nAsiento 4: JGDOBLAS (1.87 € en fichas) \nAsiento 5: SrLyce (2.28 € en fichas) \nJGDOBLAS: pone la ciega pequeña 0.01 €\nSrLyce: pone la ciega grande 0.02 €\n*** CARTAS DE MANO ***\nRepartidas a SrLyce [6c Qc]\nPrendsCa: se retira \nNRules82: sube 0.02 € a 0.04 €\nJENOFONTE73: se retira \nJGDOBLAS: se retira \nSrLyce: iguala 0.02 €\n*** FLOP *** [As Tc Js]\nSrLyce: pasa \nNRules82: apuesta 0.02 €\nSrLyce: iguala 0.02 €\n*** TURN *** [As Tc Js] [5c]\nSrLyce: pasa \nNRules82: apuesta 0.06 €\nSrLyce: iguala 0.06 €\n*** RIVER *** [As Tc Js 5c] [7s]\nSrLyce: pasa \nNRules82: apuesta 0.23 €\nSrLyce: se retira \nLa apuesta no igualada (0.23 €) ha sido devuelta a NRules82\nNRules82 se lleva 0.23 € del bote \n*** RESUMEN ***\nBote total 0.25 € | Comisión 0.02 € \nComunitarias [As Tc Js 5c 7s]\nAsiento 1: PrendsCa se retiró antes del Flop (no apostó)\nAsiento 2: NRules82 recaudó (0.23 €)\nAsiento 3: JENOFONTE73 (botón) se retiró antes del Flop (no apostó)\nAsiento 4: JGDOBLAS (ciega pequeña) se retiró antes del Flop\nAsiento 5: SrLyce (ciega grande) se retiró en el River"
}