{
  "hand_id": "257238132451",
  "date": "06-08-2025 18:30:57",
  "table": "Alruccabah II",
  "game_type": "holdem",
  "hero": "SrLyce",
  "hero_position": "",
  "hero_cards": [
    "Kh",
    "5s"
  ],
  "stacks": {
    "SrLyce": 97.0,
    "Davdgoni": 259.5,
    "PerroBestia": 41.5,
    "Nicanor Cast": 52.5,
    "THEBLACK972": 172.5
  },
  "actions": {
    "preflop": [
      "Asiento 1: SrLyce (1.94 € en fichas)",
      "Asiento 2: Davdgoni (5.19 € en fichas)",
      "Asiento 3: PerroBestia (0.83 € en fichas)",
      "Asiento 4: serviettski(fr) (2.13 € en fichas)",
      "Asiento 5: Nicanor Cast (1.05 € en fichas)",
      "Asiento 6: THEBLACK972 (3.45 € en fichas)",
      "THEBLACK972: pone la ciega pequeña 0.01 €",
      "SrLyce: pone la ciega grande 0.02 €",
      "Davdgoni: se retira",
      "PerroBestia: se retira",
      "serviettski(fr): se retira",
      "Nicanor Cast: sube 0.02 € a 0.04 €",
      "THEBLACK972: se retira",
      "SrLyce: iguala 0.02 €"
    ],
    "flop": [
      "SrLyce: pasa",
      "Nicanor Cast: apuesta 0.04 €",
      "SrLyce: se retira",
      "Nicanor Cast: no muestra su mano",
      "Asiento 1: SrLyce (ciega grande) se retiró en el Flop",
      "Asiento 2: Davdgoni se retiró antes del Flop (no apostó)",
      "Asiento 3: PerroBestia se retiró antes del Flop (no apostó)",
      "Asiento 4: serviettski(fr) se retiró antes del Flop (no apostó)",
      "Asiento 5: Nicanor Cast (botón) recaudó (0.08 €)",
      "Asiento 6: THEBLACK972 (ciega pequeña) se retiró antes del Flop"
    ],
    "turn": [],
    "river": []
  },
  "board": [
    "Qh",
    "Ad",
    "2c"
  ],
  "winner": "Cast",
  "win_amount": 4.0,
  "sb": 0.01,
  "bb": 0.02,
  "rake": 0.5,
  "raw_text": "Mano n.º 257238132451 de PokerStars:  Hold'em No Limit (0.01 €/0.02 € EUR) - 06-08-2025 18:30:57 CET [06-08-2025 12:30:57 ET]\nMesa \"Alruccabah II\" 6-max El asiento n.º 5 es el botón\nAsiento 1: SrLyce (1.94 € en fichas) \nAsiento 2: Davdgoni (5.19 € en fichas) \nAsiento 3: PerroBestia (0.83 € en fichas) \nAsiento 4: serviettski(fr) (2.13 € en fichas) \nAsiento 5: Nicanor Cast (1.05 € en fichas) \nAsiento 6: THEBLACK972 (3.45 € en fichas) \nTHEBLACK972: pone la ciega pequeña 0.01 €\nSrLyce: pone la ciega grande 0.02 €\n*** CARTAS DE MANO ***\nRepartidas a SrLyce [Kh 5s]\nDavdgoni: se retira \nPerroBestia: se retira \nserviettski(fr): se retira \nNicanor Cast: sube 0.02 € a 0.04 €\nTHEBLACK972: se retira \nSrLyce: iguala 0.02 €\n*** FLOP *** [Qh Ad 2c]\nTHEBLACK972 deja la mesa\nSrLyce: pasa \nNicanor Cast: apuesta 0.04 €\nSrLyce: se retira \nLa apuesta no igualada (0.04 €) ha sido devuelta a Nicanor Cast\nNicanor Cast se lleva 0.08 € del bote \nNicanor Cast: no muestra su mano \n*** RESUMEN ***\nBote total 0.09 € | Comisión 0.01 € \nComunitarias [Qh Ad 2c]\nAsiento 1: SrLyce (ciega grande) se retiró en el Flop\nAsiento 2: Davdgoni se retiró antes del Flop (no apostó)\nAsiento 3: PerroBestia se retiró antes del Flop (no apostó)\nAsiento 4: serviettski(fr) se retiró antes del Flop (no apostó)\nAsiento 5: Nicanor Cast (botón) recaudó (0.08 €)\nAsiento 6: THEBLACK972 (ciega pequeña) se retiró antes del Flop"
}