{
  "hand_id": "257238102301",
  "date": "06-08-2025 18:28:16",
  "table": "Atreus",
  "game_type": "holdem",
  "hero": "SrLyce",
  "hero_position": "",
  "hero_cards": [
    "Ks",
    "7s"
  ],
  "stacks": {
    "PrendsCa": 102.5,
    "NRules82": 27.5,
    "JENOFONTE73": 168.5,
    "Fharock": 90.5,
    "SrLyce": 125.5,
    "FishamanReggae": 33.5
  },
  "actions": {
    "preflop": [
      "Asiento 1: PrendsCa (2.05 € en fichas)",
      "Asiento 2: NRules82 (0.55 € en fichas)",
      "Asiento 3: JENOFONTE73 (3.37 € en fichas)",
      "Asiento 4: Fharock (1.81 € en fichas)",
      "Asiento 5: SrLyce (2.51 € en fichas)",
      "Asiento 6: FishamanReggae (0.67 € en fichas)",
      "NRules82: pone la ciega pequeña 0.01 €",
      "JENOFONTE73: pone la ciega grande 0.02 €",
      "Fharock: se retira",
      "SrLyce: sube 0.03 € a 0.05 €",
      "FishamanReggae: se retira",
      "PrendsCa: se retira",
      "NRules82: iguala 0.04 €",
      "JENOFONTE73: se retira"
    ],
    "flop": [
      "NRules82: pasa",
      "SrLyce: apuesta 0.04 €",
      "NRules82: iguala 0.04 €"
    ],
    "turn": [
      "NRules82: pasa",
      "SrLyce: pasa"
    ],
    "river": [
      "NRules82: apuesta 0.10 €",
      "SrLyce: se retira",
      "Asiento 1: PrendsCa (botón) se retiró antes del Flop (no apostó)",
      "Asiento 2: NRules82 (ciega pequeña) recaudó (0.19 €)",
      "Asiento 3: JENOFONTE73 (ciega grande) se retiró antes del Flop",
      "Asiento 4: Fharock se retiró antes del Flop (no apostó)",
      "Asiento 5: SrLyce se retiró en el River",
      "Asiento 6: FishamanReggae se retiró antes del Flop (no apostó)"
    ]
  },
  "board": [
    "8c",
    "5s",
    "3s",
    "3c",
    "2d"
  ],
  "winner": "NRules82",
  "win_amount": 9.5,
  "sb": 0.01,
  "bb": 0.02,
  "rake": 0.5,
  "raw_text": "Mano n.º 257238102301 de PokerStars:  Hold'em No Limit (0.01 €/0.02 € EUR) - 06-08-2025 18:28:16 CET [06-08-2025 12:28:16 ET]\nMesa \"Atreus\" 6-max El asiento n.º 1 es el botón\nAsiento 1: PrendsCa (2.05 € en fichas) \nAsiento 2: NRules82 (0.55 € en fichas) \nAsiento 3: JENOFONTE73 (3.37 € en fichas) \nAsiento 4: Fharock (1.81 € en fichas) \nAsiento 5: SrLyce (2.51 € en fichas) \nAsiento 6: FishamanReggae (0.67 € en fichas) \nNRules82: pone la ciega pequeña 0.01 €\nJENOFONTE73: pone la ciega grande 0.02 €\n*** CARTAS DE MANO ***\nRepartidas a SrLyce [Ks 7s]\nFharock: se retira \nSrLyce: sube 0.03 € a 0.05 €\nFishamanReggae: se retira \nPrendsCa: se retira \nNRules82: iguala 0.04 €\nJENOFONTE73: se retira \n*** FLOP *** [8c 5s 3s]\nNRules82: pasa \nSrLyce: apuesta 0.04 €\nNRules82: iguala 0.04 €\n*** TURN *** [8c 5s 3s] [3c]\nNRules82: pasa \nSrLyce: pasa \n*** RIVER *** [8c 5s 3s 3c] [2d]\nNRules82: apuesta 0.10 €\nSrLyce: se retira \nLa apuesta no igualada (0.10 €) ha sido devuelta a NRules82\nNRules82 se lleva 0.19 € del bote \n*** RESUMEN ***\nBote total 0.20 € | Comisión 0.01 € \nComunitarias [8c 5s 3s 3c 2d]\nAsiento 1: PrendsCa (botón) se retiró antes del Flop (no apostó)\nAsiento 2: NRules82 (ciega pequeña) recaudó (0.19 €)\nAsiento 3: JENOFONTE73 (ciega grande) se retiró antes del Flop\nAsiento 4: Fharock se retiró antes del Flop (no apostó)\nAsiento 5: SrLyce se retiró en el River\nAsiento 6: FishamanReggae se retiró antes del Flop (no apostó)"
}