{
  "hand_id": "257238370911",
  "date": "06-08-2025 18:52:00",
  "table": "Adelaide III",
  "game_type": "holdem",
  "hero": "SrLyce",
  "hero_position": "",
  "hero_cards": [
    "4d",
    "Jd"
  ],
  "stacks": {
    "pauquair5": 75.0,
    "N3xtTIm35": 102.5,
    "aliendee07": 51.5,
    "Ischadia": 96.0,
    "SrLyce": 100.0,
    "ismagonzalez7": 83.0
  },
  "actions": {
    "preflop": [
      "Asiento 6: pauquair5 (1.50 € en fichas) está ausente",
      "Asiento 1: N3xtTIm35 (2.05 € en fichas)",
      "Asiento 2: aliendee07 (1.03 € en fichas)",
      "Asiento 3: Ischadia (1.92 € en fichas)",
      "Asiento 4: SrLyce (2 € en fichas)",
      "Asiento 5: ismagonzalez7 (1.66 € en fichas)",
      "N3xtTIm35: pone la ciega pequeña 0.01 €",
      "aliendee07: pone la ciega grande 0.02 €",
      "Ischadia: se retira",
      "SrLyce: se retira",
      "ismagonzalez7: sube 0.02 € a 0.04 €",
      "N3xtTIm35: se retira",
      "aliendee07: se retira",
      "ismagonzalez7: no muestra su mano",
      "Asiento 6: pauquair5",
      "Asiento 1: N3xtTIm35 (ciega pequeña) se retiró antes del Flop",
      "Asiento 2: aliendee07 (ciega grande) se retiró antes del Flop",
      "Asiento 3: Ischadia se retiró antes del Flop (no apostó)",
      "Asiento 4: SrLyce se retiró antes del Flop (no apostó)",
      "Asiento 5: ismagonzalez7 (botón) recaudó (0.05 €)"
    ],
    "flop": [],
    "turn": [],
    "river": []
  },
  "board": [],
  "winner": "ismagonzalez7",
  "win_amount": 2.5,
  "sb": 0.01,
  "bb": 0.02,
  "rake": 0.0,
  "raw_text": "Mano n.º 257238370911 de PokerStars:  Hold'em No Limit (0.01 €/0.02 € EUR) - 06-08-2025 18:52:00 CET [06-08-2025 12:52:00 ET]\nMesa \"Adelaide III\" 6-max El asiento n.º 5 es el botón\nAsiento 6: pauquair5 (1.50 € en fichas) está ausente\nAsiento 1: N3xtTIm35 (2.05 € en fichas) \nAsiento 2: aliendee07 (1.03 € en fichas) \nAsiento 3: Ischadia (1.92 € en fichas) \nAsiento 4: SrLyce (2 € en fichas) \nAsiento 5: ismagonzalez7 (1.66 € en fichas) \nN3xtTIm35: pone la ciega pequeña 0.01 €\naliendee07: pone la ciega grande 0.02 €\n*** CARTAS DE MANO ***\nRepartidas a SrLyce [4d Jd]\nIschadia: se retira \nSrLyce: se retira \nismagonzalez7: sube 0.02 € a 0.04 €\nN3xtTIm35: se retira \naliendee07: se retira \nLa apuesta no igualada (0.02 €) ha sido devuelta a ismagonzalez7\nismagonzalez7 se lleva 0.05 € del bote \nismagonzalez7: no muestra su mano \n*** RESUMEN ***\nBote total 0.05 € | Comisión 0 € \nAsiento 6: pauquair5\nAsiento 1: N3xtTIm35 (ciega pequeña) se retiró antes del Flop\nAsiento 2: aliendee07 (ciega grande) se retiró antes del Flop\nAsiento 3: Ischadia se retiró antes del Flop (no apostó)\nAsiento 4: SrLyce se retiró antes del Flop (no apostó)\nAsiento 5: ismagonzalez7 (botón) recaudó (0.05 €)"
}