{
  "hand_id": "257150497722",
  "date": "30-07-2025 23:46:09",
  "table": "Mizuho",
  "game_type": "holdem",
  "hero": "SrLyce",
  "hero_position": "",
  "hero_cards": [
    "4d",
    "2c"
  ],
  "stacks": {
    "benipoker123": 99.5,
    "SrLyce": 99.5,
    "JstLeonel": 120.5,
    "Ozzy3110": 311.0,
    "toonsy2010": 98.5,
    "mivipkr": 166.5
  },
  "actions": {
    "preflop": [
      "Asiento 1: benipoker123 (1.99 € en fichas)",
      "Asiento 2: SrLyce (1.99 € en fichas)",
      "Asiento 3: JstLeonel (2.41 € en fichas)",
      "Asiento 4: Ozzy3110 (6.22 € en fichas)",
      "Asiento 5: toonsy2010 (1.97 € en fichas)",
      "Asiento 6: mivipkr (3.33 € en fichas)",
      "JstLeonel: pone la ciega pequeña 0.01 €",
      "Ozzy3110: pone la ciega grande 0.02 €",
      "toonsy2010: se retira",
      "mivipkr: se retira",
      "benipoker123: sube 0.04 € a 0.06 €",
      "SrLyce: se retira",
      "JstLeonel: se retira",
      "Ozzy3110: sube 0.20 € a 0.26 €",
      "benipoker123: sube 1.73 € a 1.99 € y está all-in",
      "Ozzy3110: se retira",
      "benipoker123: no muestra su mano",
      "Asiento 1: benipoker123 recaudó (0.53 €)",
      "Asiento 2: SrLyce (botón) se retiró antes del Flop (no apostó)",
      "Asiento 3: JstLeonel (ciega pequeña) se retiró antes del Flop",
      "Asiento 4: Ozzy3110 (ciega grande) se retiró antes del Flop",
      "Asiento 5: toonsy2010 se retiró antes del Flop (no apostó)",
      "Asiento 6: mivipkr se retiró antes del Flop (no apostó)"
    ],
    "flop": [],
    "turn": [],
    "river": []
  },
  "board": [],
  "winner": "benipoker123",
  "win_amount": 26.5,
  "sb": 0.01,
  "bb": 0.02,
  "rake": 0.0,
  "raw_text": "Mano n.º 257150497722 de PokerStars:  Hold'em No Limit (0.01 €/0.02 € EUR) - 30-07-2025 23:46:09 CET [30-07-2025 17:46:09 ET]\nMesa \"Mizuho\" 6-max El asiento n.º 2 es el botón\nAsiento 1: benipoker123 (1.99 € en fichas) \nAsiento 2: SrLyce (1.99 € en fichas) \nAsiento 3: JstLeonel (2.41 € en fichas) \nAsiento 4: Ozzy3110 (6.22 € en fichas) \nAsiento 5: toonsy2010 (1.97 € en fichas) \nAsiento 6: mivipkr (3.33 € en fichas) \nJstLeonel: pone la ciega pequeña 0.01 €\nOzzy3110: pone la ciega grande 0.02 €\n*** CARTAS DE MANO ***\nRepartidas a SrLyce [4d 2c]\ntoonsy2010: se retira \nmivipkr: se retira \nbenipoker123: sube 0.04 € a 0.06 €\nSrLyce: se retira \nJstLeonel: se retira \nOzzy3110: sube 0.20 € a 0.26 €\nbenipoker123: sube 1.73 € a 1.99 € y está all-in\nOzzy3110: se retira \nLa apuesta no igualada (1.73 €) ha sido devuelta a benipoker123\nbenipoker123 se lleva 0.53 € del bote \nbenipoker123: no muestra su mano \n*** RESUMEN ***\nBote total 0.53 € | Comisión 0 € \nAsiento 1: benipoker123 recaudó (0.53 €)\nAsiento 2: SrLyce (botón) se retiró antes del Flop (no apostó)\nAsiento 3: JstLeonel (ciega pequeña) se retiró antes del Flop\nAsiento 4: Ozzy3110 (ciega grande) se retiró antes del Flop\nAsiento 5: toonsy2010 se retiró antes del Flop (no apostó)\nAsiento 6: mivipkr se retiró antes del Flop (no apostó)"
}