{
  "hand_id": "257238561202",
  "date": "06-08-2025 19:10:08",
  "table": "Herculina II",
  "game_type": "holdem",
  "hero": "SrLyce",
  "hero_position": "",
  "hero_cards": [
    "Tc",
    "4d"
  ],
  "stacks": {
    "Alceo27": 100.0,
    "David98X": 176.5,
    "JJer11": 206.0,
    "SrLyce": 99.0,
    "Macklemore0": 100.0,
    "ScarvBlack": 114.5
  },
  "actions": {
    "preflop": [
      "Asiento 1: Alceo27 (2 € en fichas) está ausente",
      "Asiento 2: David98X (3.53 € en fichas)",
      "Asiento 3: JJer11 (4.12 € en fichas)",
      "Asiento 4: SrLyce (1.98 € en fichas)",
      "Asiento 5: Macklemore0 (2 € en fichas)",
      "Asiento 6: ScarvBlack (2.29 € en fichas)",
      "SrLyce: pone la ciega pequeña 0.01 €",
      "Macklemore0: pone la ciega grande 0.02 €",
      "Alceo27: se ausenta",
      "ScarvBlack: se retira",
      "David98X: se retira",
      "JJer11: se retira",
      "SrLyce: se retira",
      "Macklemore0: no muestra su mano",
      "Asiento 1: Alceo27",
      "Asiento 2: David98X se retiró antes del Flop (no apostó)",
      "Asiento 3: JJer11 (botón) se retiró antes del Flop (no apostó)",
      "Asiento 4: SrLyce (ciega pequeña) se retiró antes del Flop",
      "Asiento 5: Macklemore0 (ciega grande) recaudó (0.02 €)",
      "Asiento 6: ScarvBlack se retiró antes del Flop (no apostó)"
    ],
    "flop": [],
    "turn": [],
    "river": []
  },
  "board": [],
  "winner": "Macklemore0",
  "win_amount": 1.0,
  "sb": 0.01,
  "bb": 0.02,
  "rake": 0.0,
  "raw_text": "Mano n.º 257238561202 de PokerStars:  Hold'em No Limit (0.01 €/0.02 € EUR) - 06-08-2025 19:10:08 CET [06-08-2025 13:10:08 ET]\nMesa \"Herculina II\" 6-max El asiento n.º 3 es el botón\nAsiento 1: Alceo27 (2 € en fichas) está ausente\nAsiento 2: David98X (3.53 € en fichas) \nAsiento 3: JJer11 (4.12 € en fichas) \nAsiento 4: SrLyce (1.98 € en fichas) \nAsiento 5: Macklemore0 (2 € en fichas) \nAsiento 6: ScarvBlack (2.29 € en fichas) \nSrLyce: pone la ciega pequeña 0.01 €\nMacklemore0: pone la ciega grande 0.02 €\nAlceo27: se ausenta \n*** CARTAS DE MANO ***\nRepartidas a SrLyce [Tc 4d]\nScarvBlack: se retira \nDavid98X: se retira \nJJer11: se retira \nSrLyce: se retira \nLa apuesta no igualada (0.01 €) ha sido devuelta a Macklemore0\nMacklemore0 se lleva 0.02 € del bote \nMacklemore0: no muestra su mano \n*** RESUMEN ***\nBote total 0.02 € | Comisión 0 € \nAsiento 1: Alceo27\nAsiento 2: David98X se retiró antes del Flop (no apostó)\nAsiento 3: JJer11 (botón) se retiró antes del Flop (no apostó)\nAsiento 4: SrLyce (ciega pequeña) se retiró antes del Flop\nAsiento 5: Macklemore0 (ciega grande) recaudó (0.02 €)\nAsiento 6: ScarvBlack se retiró antes del Flop (no apostó)"
}