{
  "hand_id": "257148662459",
  "date": "30-07-2025 21:35:11",
  "table": "Esclangona",
  "game_type": "holdem",
  "hero": "SrLyce",
  "hero_position": "",
  "hero_cards": [
    "9s",
    "5h"
  ],
  "stacks": {
    "gabriella657": 285.0,
    "Zorgue1080": 106.5,
    "SrLyce": 95.5,
    "Davdgoni": 159.5,
    "DiaZzZ1": 101.0,
    "berlcht403": 43.0
  },
  "actions": {
    "preflop": [
      "Asiento 3: gabriella657 (5.70 € en fichas) está ausente",
      "Asiento 1: Zorgue1080 (2.13 € en fichas)",
      "Asiento 2: SrLyce (1.91 € en fichas)",
      "Asiento 4: Davdgoni (3.19 € en fichas)",
      "Asiento 5: DiaZzZ1 (2.02 € en fichas)",
      "Asiento 6: berlcht403 (0.86 € en fichas)",
      "DiaZzZ1: pone la ciega pequeña 0.01 €",
      "berlcht403: pone la ciega grande 0.02 €",
      "Zorgue1080: se retira",
      "SrLyce: se retira",
      "Davdgoni: se retira",
      "DiaZzZ1: sube 0.03 € a 0.05 €",
      "berlcht403: sube 0.10 € a 0.15 €",
      "DiaZzZ1: iguala 0.10 €"
    ],
    "flop": [
      "DiaZzZ1: apuesta 0.08 €",
      "berlcht403: iguala 0.08 €"
    ],
    "turn": [
      "DiaZzZ1: apuesta 0.13 €",
      "berlcht403: se retira",
      "DiaZzZ1: no muestra su mano",
      "Asiento 3: gabriella657",
      "Asiento 1: Zorgue1080 se retiró antes del Flop (no apostó)",
      "Asiento 2: SrLyce se retiró antes del Flop (no apostó)",
      "Asiento 4: Davdgoni (botón) se retiró antes del Flop (no apostó)",
      "Asiento 5: DiaZzZ1 (ciega pequeña) recaudó (0.43 €)",
      "Asiento 6: berlcht403 (ciega grande) se retiró en el Turn"
    ],
    "river": []
  },
  "board": [
    "Kc",
    "4d",
    "Ks",
    "3h"
  ],
  "winner": "DiaZzZ1",
  "win_amount": 21.5,
  "sb": 0.01,
  "bb": 0.02,
  "rake": 1.5,
  "raw_text": "Mano n.º 257148662459 de PokerStars:  Hold'em No Limit (0.01 €/0.02 € EUR) - 30-07-2025 21:35:11 CET [30-07-2025 15:35:11 ET]\nMesa \"Esclangona\" 6-max El asiento n.º 4 es el botón\nAsiento 3: gabriella657 (5.70 € en fichas) está ausente\nAsiento 1: Zorgue1080 (2.13 € en fichas) \nAsiento 2: SrLyce (1.91 € en fichas) \nAsiento 4: Davdgoni (3.19 € en fichas) \nAsiento 5: DiaZzZ1 (2.02 € en fichas) \nAsiento 6: berlcht403 (0.86 € en fichas) \nDiaZzZ1: pone la ciega pequeña 0.01 €\nberlcht403: pone la ciega grande 0.02 €\n*** CARTAS DE MANO ***\nRepartidas a SrLyce [9s 5h]\nZorgue1080: se retira \nSrLyce: se retira \nDavdgoni: se retira \nDiaZzZ1: sube 0.03 € a 0.05 €\nberlcht403: sube 0.10 € a 0.15 €\nDiaZzZ1: iguala 0.10 €\n*** FLOP *** [Kc 4d Ks]\nDiaZzZ1: apuesta 0.08 €\nberlcht403: iguala 0.08 €\n*** TURN *** [Kc 4d Ks] [3h]\nDiaZzZ1: apuesta 0.13 €\nberlcht403: se retira \nLa apuesta no igualada (0.13 €) ha sido devuelta a DiaZzZ1\nDiaZzZ1 se lleva 0.43 € del bote \nDiaZzZ1: no muestra su mano \n*** RESUMEN ***\nBote total 0.46 € | Comisión 0.03 € \nComunitarias [Kc 4d Ks 3h]\nAsiento 3: gabriella657\nAsiento 1: Zorgue1080 se retiró antes del Flop (no apostó)\nAsiento 2: SrLyce se retiró antes del Flop (no apostó)\nAsiento 4: Davdgoni (botón) se retiró antes del Flop (no apostó)\nAsiento 5: DiaZzZ1 (ciega pequeña) recaudó (0.43 €)\nAsiento 6: berlcht403 (ciega grande) se retiró en el Turn"
}