{
  "hand_id": "257237943097",
  "date": "06-08-2025 18:14:01",
  "table": "Euneus III",
  "game_type": "holdem",
  "hero": "SrLyce",
  "hero_position": "",
  "hero_cards": [
    "Jc",
    "Kc"
  ],
  "stacks": {
    "lol-in 2000": 100.0,
    "christgear": 100.0,
    "Il_BM00": 128.5,
    "djrojas9": 153.0,
    "SrLyce": 106.5,
    "kcg_rm": 110.5
  },
  "actions": {
    "preflop": [
      "Asiento 4: lol-in 2000 (2 € en fichas) está ausente",
      "Asiento 1: christgear (2 € en fichas)",
      "Asiento 2: Il_BM00 (2.57 € en fichas)",
      "Asiento 3: djrojas9 (3.06 € en fichas)",
      "Asiento 5: SrLyce (2.13 € en fichas)",
      "Asiento 6: kcg_rm (2.21 € en fichas)",
      "Il_BM00: pone la ciega pequeña 0.01 €",
      "djrojas9: pone la ciega grande 0.02 €",
      "lol-in 2000: se ausenta",
      "SrLyce: sube 0.03 € a 0.05 €",
      "kcg_rm: se retira",
      "christgear: se retira",
      "Il_BM00: se retira",
      "djrojas9: iguala 0.03 €"
    ],
    "flop": [
      "djrojas9: pasa",
      "SrLyce: apuesta 0.03 €",
      "djrojas9: sube 0.05 € a 0.08 €",
      "SrLyce: iguala 0.05 €"
    ],
    "turn": [
      "djrojas9: apuesta 0.13 €",
      "SrLyce: iguala 0.13 €"
    ],
    "river": [
      "djrojas9: pasa",
      "SrLyce: apuesta 0.25 €",
      "djrojas9: se retira",
      "SrLyce: no muestra su mano",
      "Asiento 4: lol-in 2000",
      "Asiento 1: christgear (botón) se retiró antes del Flop (no apostó)",
      "Asiento 2: Il_BM00 (ciega pequeña) se retiró antes del Flop",
      "Asiento 3: djrojas9 (ciega grande) se retiró en el River",
      "Asiento 5: SrLyce recaudó (0.50 €)",
      "Asiento 6: kcg_rm se retiró antes del Flop (no apostó)"
    ]
  },
  "board": [
    "6d",
    "Ks",
    "8s",
    "Qh",
    "9h"
  ],
  "winner": "SrLyce",
  "win_amount": 25.0,
  "sb": 0.01,
  "bb": 0.02,
  "rake": 1.5,
  "raw_text": "Mano n.º 257237943097 de PokerStars:  Hold'em No Limit (0.01 €/0.02 € EUR) - 06-08-2025 18:14:01 CET [06-08-2025 12:14:01 ET]\nMesa \"Euneus III\" 6-max El asiento n.º 1 es el botón\nAsiento 4: lol-in 2000 (2 € en fichas) está ausente\nAsiento 1: christgear (2 € en fichas) \nAsiento 2: Il_BM00 (2.57 € en fichas) \nAsiento 3: djrojas9 (3.06 € en fichas) \nAsiento 5: SrLyce (2.13 € en fichas) \nAsiento 6: kcg_rm (2.21 € en fichas) \nIl_BM00: pone la ciega pequeña 0.01 €\ndjrojas9: pone la ciega grande 0.02 €\nlol-in 2000: se ausenta \n*** CARTAS DE MANO ***\nRepartidas a SrLyce [Jc Kc]\nSrLyce: sube 0.03 € a 0.05 €\nkcg_rm: se retira \nchristgear: se retira \nIl_BM00: se retira \ndjrojas9: iguala 0.03 €\n*** FLOP *** [6d Ks 8s]\ndjrojas9: pasa \nSrLyce: apuesta 0.03 €\ndjrojas9: sube 0.05 € a 0.08 €\nSrLyce: iguala 0.05 €\n*** TURN *** [6d Ks 8s] [Qh]\ndjrojas9: apuesta 0.13 €\nSrLyce: iguala 0.13 €\n*** RIVER *** [6d Ks 8s Qh] [9h]\ndjrojas9: pasa \nSrLyce: apuesta 0.25 €\ndjrojas9: se retira \nLa apuesta no igualada (0.25 €) ha sido devuelta a SrLyce\nSrLyce se lleva 0.50 € del bote \nSrLyce: no muestra su mano \n*** RESUMEN ***\nBote total 0.53 € | Comisión 0.03 € \nComunitarias [6d Ks 8s Qh 9h]\nAsiento 4: lol-in 2000\nAsiento 1: christgear (botón) se retiró antes del Flop (no apostó)\nAsiento 2: Il_BM00 (ciega pequeña) se retiró antes del Flop\nAsiento 3: djrojas9 (ciega grande) se retiró en el River\nAsiento 5: SrLyce recaudó (0.50 €)\nAsiento 6: kcg_rm se retiró antes del Flop (no apostó)"
}