{
  "hand_id": "257237905954",
  "date": "06-08-2025 18:10:38",
  "table": "Nuwa III",
  "game_type": "holdem",
  "hero": "SrLyce",
  "hero_position": "",
  "hero_cards": [
    "5h",
    "Th"
  ],
  "stacks": {
    "Begoton": 100.0,
    "BuXHexter": 100.0,
    "kcg_rm": 107.0,
    "SrLyce": 103.5,
    "acavada": 103.0
  },
  "actions": {
    "preflop": [
      "Asiento 1: Begoton (2 € en fichas) está ausente",
      "Asiento 2: BuXHexter (2 € en fichas)",
      "Asiento 3: kcg_rm (2.14 € en fichas)",
      "Asiento 4: SrLyce (2.07 € en fichas)",
      "Asiento 6: acavada (2.06 € en fichas)",
      "SrLyce: pone la ciega pequeña 0.01 €",
      "acavada: pone la ciega grande 0.02 €",
      "Begoton: está ausente",
      "BuXHexter: se retira",
      "kcg_rm: se retira",
      "SrLyce: sube 0.02 € a 0.04 €",
      "acavada: se retira",
      "SrLyce: no muestra su mano",
      "Asiento 1: Begoton",
      "Asiento 2: BuXHexter se retiró antes del Flop (no apostó)",
      "Asiento 3: kcg_rm (botón) se retiró antes del Flop (no apostó)",
      "Asiento 4: SrLyce (ciega pequeña) recaudó (0.04 €)",
      "Asiento 6: acavada (ciega grande) se retiró antes del Flop"
    ],
    "flop": [],
    "turn": [],
    "river": []
  },
  "board": [],
  "winner": "SrLyce",
  "win_amount": 2.0,
  "sb": 0.01,
  "bb": 0.02,
  "rake": 0.0,
  "raw_text": "Mano n.º 257237905954 de PokerStars:  Hold'em No Limit (0.01 €/0.02 € EUR) - 06-08-2025 18:10:38 CET [06-08-2025 12:10:38 ET]\nMesa \"Nuwa III\" 6-max El asiento n.º 3 es el botón\nAsiento 1: Begoton (2 € en fichas) está ausente\nAsiento 2: BuXHexter (2 € en fichas) \nAsiento 3: kcg_rm (2.14 € en fichas) \nAsiento 4: SrLyce (2.07 € en fichas) \nAsiento 6: acavada (2.06 € en fichas) \nSrLyce: pone la ciega pequeña 0.01 €\nacavada: pone la ciega grande 0.02 €\nBegoton: está ausente \n*** CARTAS DE MANO ***\nRepartidas a SrLyce [5h Th]\nBegoton deja la mesa\nBuXHexter: se retira \nkcg_rm: se retira \nSrLyce: sube 0.02 € a 0.04 €\nacavada: se retira \nLa apuesta no igualada (0.02 €) ha sido devuelta a SrLyce\nSrLyce se lleva 0.04 € del bote \nSrLyce: no muestra su mano \n*** RESUMEN ***\nBote total 0.04 € | Comisión 0 € \nAsiento 1: Begoton\nAsiento 2: BuXHexter se retiró antes del Flop (no apostó)\nAsiento 3: kcg_rm (botón) se retiró antes del Flop (no apostó)\nAsiento 4: SrLyce (ciega pequeña) recaudó (0.04 €)\nAsiento 6: acavada (ciega grande) se retiró antes del Flop"
}