{
  "hand_id": "257215099696",
  "date": "04-08-2025 22:24:21",
  "table": "Aldhafera II",
  "game_type": "holdem",
  "hero": "SrLyce",
  "hero_position": "",
  "hero_cards": [
    "Qs",
    "6s"
  ],
  "stacks": {
    "wsx25": 95.0,
    "BudyXXIII": 266.5,
    "SrLyce": 100.0,
    "rhidoxxx": 85.5,
    "jte-ken": 120.5,
    "betterrrrrr": 168.0
  },
  "actions": {
    "preflop": [
      "Asiento 1: wsx25 (1.90 € en fichas)",
      "Asiento 2: BudyXXIII (5.33 € en fichas)",
      "Asiento 3: SrLyce (2 € en fichas)",
      "Asiento 4: rhidoxxx (1.71 € en fichas)",
      "Asiento 5: jte-ken (2.41 € en fichas)",
      "Asiento 6: betterrrrrr (3.36 € en fichas)",
      "jte-ken: pone la ciega pequeña 0.01 €",
      "betterrrrrr: pone la ciega grande 0.02 €",
      "wsx25: se retira",
      "BudyXXIII: se retira",
      "SrLyce: sube 0.04 € a 0.06 €",
      "rhidoxxx: se retira",
      "jte-ken: sube 2.35 € a 2.41 € y está all-in",
      "betterrrrrr: se retira",
      "SrLyce: se retira",
      "Asiento 1: wsx25 se retiró antes del Flop (no apostó)",
      "Asiento 2: BudyXXIII se retiró antes del Flop (no apostó)",
      "Asiento 3: SrLyce se retiró antes del Flop",
      "Asiento 4: rhidoxxx (botón) se retiró antes del Flop (no apostó)",
      "Asiento 5: jte-ken (ciega pequeña) recaudó (0.14 €)",
      "Asiento 6: betterrrrrr (ciega grande) se retiró antes del Flop"
    ],
    "flop": [],
    "turn": [],
    "river": []
  },
  "board": [],
  "winner": "jte-ken",
  "win_amount": 7.0,
  "sb": 0.01,
  "bb": 0.02,
  "rake": 0.0,
  "raw_text": "Mano n.º 257215099696 de PokerStars:  Hold'em No Limit (0.01 €/0.02 € EUR) - 04-08-2025 22:24:21 CET [04-08-2025 16:24:21 ET]\nMesa \"Aldhafera II\" 6-max El asiento n.º 4 es el botón\nAsiento 1: wsx25 (1.90 € en fichas) \nAsiento 2: BudyXXIII (5.33 € en fichas) \nAsiento 3: SrLyce (2 € en fichas) \nAsiento 4: rhidoxxx (1.71 € en fichas) \nAsiento 5: jte-ken (2.41 € en fichas) \nAsiento 6: betterrrrrr (3.36 € en fichas) \njte-ken: pone la ciega pequeña 0.01 €\nbetterrrrrr: pone la ciega grande 0.02 €\n*** CARTAS DE MANO ***\nRepartidas a SrLyce [Qs 6s]\nwsx25: se retira \nBudyXXIII: se retira \nSrLyce: sube 0.04 € a 0.06 €\nrhidoxxx: se retira \njte-ken: sube 2.35 € a 2.41 € y está all-in\nbetterrrrrr: se retira \nSrLyce: se retira \nLa apuesta no igualada (2.35 €) ha sido devuelta a jte-ken\njte-ken se lleva 0.14 € del bote \n*** RESUMEN ***\nBote total 0.14 € | Comisión 0 € \nAsiento 1: wsx25 se retiró antes del Flop (no apostó)\nAsiento 2: BudyXXIII se retiró antes del Flop (no apostó)\nAsiento 3: SrLyce se retiró antes del Flop\nAsiento 4: rhidoxxx (botón) se retiró antes del Flop (no apostó)\nAsiento 5: jte-ken (ciega pequeña) recaudó (0.14 €)\nAsiento 6: betterrrrrr (ciega grande) se retiró antes del Flop"
}