{
  "hand_id": "257238334277",
  "date": "06-08-2025 18:48:46",
  "table": "Alruccabah II",
  "game_type": "holdem",
  "hero": "SrLyce",
  "hero_position": "",
  "hero_cards": [
    "5c",
    "5s"
  ],
  "stacks": {
    "SrLyce": 99.5,
    "Davdgoni": 282.0,
    "tatinette35": 100.0,
    "Nicanor Cast": 55.5,
    "rayao32": 49.5
  },
  "actions": {
    "preflop": [
      "Asiento 1: SrLyce (1.99 € en fichas)",
      "Asiento 2: Davdgoni (5.64 € en fichas)",
      "Asiento 3: tatinette35 (2 € en fichas)",
      "Asiento 4: serviettski(fr) (2 € en fichas)",
      "Asiento 5: Nicanor Cast (1.11 € en fichas)",
      "Asiento 6: rayao32 (0.99 € en fichas)",
      "rayao32: pone la ciega pequeña 0.01 €",
      "SrLyce: pone la ciega grande 0.02 €",
      "Davdgoni: sube 0.04 € a 0.06 €",
      "tatinette35: se retira",
      "serviettski(fr): se retira",
      "Nicanor Cast: se retira",
      "rayao32: se retira",
      "SrLyce: iguala 0.04 €"
    ],
    "flop": [
      "SrLyce: pasa",
      "Davdgoni: apuesta 0.12 €",
      "SrLyce: se retira",
      "Davdgoni: no muestra su mano",
      "Asiento 1: SrLyce (ciega grande) se retiró en el Flop",
      "Asiento 2: Davdgoni recaudó (0.12 €)",
      "Asiento 3: tatinette35 se retiró antes del Flop (no apostó)",
      "Asiento 4: serviettski(fr) se retiró antes del Flop (no apostó)",
      "Asiento 5: Nicanor Cast (botón) se retiró antes del Flop (no apostó)",
      "Asiento 6: rayao32 (ciega pequeña) se retiró antes del Flop"
    ],
    "turn": [],
    "river": []
  },
  "board": [
    "6s",
    "Qc",
    "2h"
  ],
  "winner": "Davdgoni",
  "win_amount": 6.0,
  "sb": 0.01,
  "bb": 0.02,
  "rake": 0.5,
  "raw_text": "Mano n.º 257238334277 de PokerStars:  Hold'em No Limit (0.01 €/0.02 € EUR) - 06-08-2025 18:48:46 CET [06-08-2025 12:48:46 ET]\nMesa \"Alruccabah II\" 6-max El asiento n.º 5 es el botón\nAsiento 1: SrLyce (1.99 € en fichas) \nAsiento 2: Davdgoni (5.64 € en fichas) \nAsiento 3: tatinette35 (2 € en fichas) \nAsiento 4: serviettski(fr) (2 € en fichas) \nAsiento 5: Nicanor Cast (1.11 € en fichas) \nAsiento 6: rayao32 (0.99 € en fichas) \nrayao32: pone la ciega pequeña 0.01 €\nSrLyce: pone la ciega grande 0.02 €\n*** CARTAS DE MANO ***\nRepartidas a SrLyce [5c 5s]\nDavdgoni: sube 0.04 € a 0.06 €\ntatinette35: se retira \nserviettski(fr): se retira \nNicanor Cast: se retira \nrayao32: se retira \nSrLyce: iguala 0.04 €\n*** FLOP *** [6s Qc 2h]\nSrLyce: pasa \nDavdgoni: apuesta 0.12 €\nSrLyce: se retira \nLa apuesta no igualada (0.12 €) ha sido devuelta a Davdgoni\nDavdgoni se lleva 0.12 € del bote \nDavdgoni: no muestra su mano \n*** RESUMEN ***\nBote total 0.13 € | Comisión 0.01 € \nComunitarias [6s Qc 2h]\nAsiento 1: SrLyce (ciega grande) se retiró en el Flop\nAsiento 2: Davdgoni recaudó (0.12 €)\nAsiento 3: tatinette35 se retiró antes del Flop (no apostó)\nAsiento 4: serviettski(fr) se retiró antes del Flop (no apostó)\nAsiento 5: Nicanor Cast (botón) se retiró antes del Flop (no apostó)\nAsiento 6: rayao32 (ciega pequeña) se retiró antes del Flop"
}