{
  "hand_id": "257237028229",
  "date": "06-08-2025 17:32:53",
  "table": "Themisto III",
  "game_type": "holdem",
  "hero": "SrLyce",
  "hero_position": "",
  "hero_cards": [
    "4d",
    "Qh"
  ],
  "stacks": {
    "elso253": 72.5,
    "SrLyce": 101.5,
    "idigon": 27.5,
    "mivipkr": 124.0,
    "marignamo": 96.0
  },
  "actions": {
    "preflop": [
      "Asiento 1: elso253 (1.45 € en fichas)",
      "Asiento 2: SrLyce (2.03 € en fichas)",
      "Asiento 3: idigon (0.55 € en fichas)",
      "Asiento 5: mivipkr (2.48 € en fichas)",
      "Asiento 6: marignamo (1.92 € en fichas)",
      "idigon: pone la ciega pequeña 0.01 €",
      "mivipkr: pone la ciega grande 0.02 €",
      "marignamo: se retira",
      "elso253: se retira",
      "SrLyce: se retira",
      "idigon: se retira",
      "mivipkr: no muestra su mano",
      "Asiento 1: elso253 se retiró antes del Flop (no apostó)",
      "Asiento 2: SrLyce (botón) se retiró antes del Flop (no apostó)",
      "Asiento 3: idigon (ciega pequeña) se retiró antes del Flop",
      "Asiento 5: mivipkr (ciega grande) recaudó (0.02 €)",
      "Asiento 6: marignamo se retiró antes del Flop (no apostó)"
    ],
    "flop": [],
    "turn": [],
    "river": []
  },
  "board": [],
  "winner": "mivipkr",
  "win_amount": 1.0,
  "sb": 0.01,
  "bb": 0.02,
  "rake": 0.0,
  "raw_text": "Mano n.º 257237028229 de PokerStars:  Hold'em No Limit (0.01 €/0.02 € EUR) - 06-08-2025 17:32:53 CET [06-08-2025 11:32:53 ET]\nMesa \"Themisto III\" 6-max El asiento n.º 2 es el botón\nAsiento 1: elso253 (1.45 € en fichas) \nAsiento 2: SrLyce (2.03 € en fichas) \nAsiento 3: idigon (0.55 € en fichas) \nAsiento 5: mivipkr (2.48 € en fichas) \nAsiento 6: marignamo (1.92 € en fichas) \nidigon: pone la ciega pequeña 0.01 €\nmivipkr: pone la ciega grande 0.02 €\n*** CARTAS DE MANO ***\nRepartidas a SrLyce [4d Qh]\nfred2d23po se une a la mesa en el asiento n.º 4 \nmarignamo: se retira \nelso253: se retira \nSrLyce: se retira \nidigon: se retira \nLa apuesta no igualada (0.01 €) ha sido devuelta a mivipkr\nmivipkr se lleva 0.02 € del bote \nmivipkr: no muestra su mano \n*** RESUMEN ***\nBote total 0.02 € | Comisión 0 € \nAsiento 1: elso253 se retiró antes del Flop (no apostó)\nAsiento 2: SrLyce (botón) se retiró antes del Flop (no apostó)\nAsiento 3: idigon (ciega pequeña) se retiró antes del Flop\nAsiento 5: mivipkr (ciega grande) recaudó (0.02 €)\nAsiento 6: marignamo se retiró antes del Flop (no apostó)"
}