{
  "hand_id": "257168288479",
  "date": "01-08-2025 11:20:13",
  "table": "Jupiter",
  "game_type": "holdem",
  "hero": "SrLyce",
  "hero_position": "",
  "hero_cards": [
    "Jd",
    "Kd"
  ],
  "stacks": {
    "LOLA19711971": 30.5,
    "sifilis5": 88.5,
    "Filou203": 111.5,
    "SrLyce": 115.0,
    "dadou13mars": 227.0,
    "Alvii37": 108.0
  },
  "actions": {
    "preflop": [
      "Asiento 4: LOLA19711971 (0.61 € en fichas) está ausente",
      "Asiento 1: sifilis5 (1.77 € en fichas)",
      "Asiento 2: Filou203 (2.23 € en fichas)",
      "Asiento 3: SrLyce (2.30 € en fichas)",
      "Asiento 5: dadou13mars (4.54 € en fichas)",
      "Asiento 6: Alvii37 (2.16 € en fichas)",
      "sifilis5: pone la ciega pequeña 0.01 €",
      "Filou203: pone la ciega grande 0.02 €",
      "SrLyce: sube 0.04 € a 0.06 €",
      "dadou13mars: se retira",
      "Alvii37: se retira",
      "sifilis5: se retira",
      "Filou203: se retira",
      "SrLyce: no muestra su mano",
      "Asiento 4: LOLA19711971",
      "Asiento 1: sifilis5 (ciega pequeña) se retiró antes del Flop",
      "Asiento 2: Filou203 (ciega grande) se retiró antes del Flop",
      "Asiento 3: SrLyce recaudó (0.05 €)",
      "Asiento 5: dadou13mars se retiró antes del Flop (no apostó)",
      "Asiento 6: Alvii37 (botón) se retiró antes del Flop (no apostó)"
    ],
    "flop": [],
    "turn": [],
    "river": []
  },
  "board": [],
  "winner": "SrLyce",
  "win_amount": 2.5,
  "sb": 0.01,
  "bb": 0.02,
  "rake": 0.0,
  "raw_text": "Mano n.º 257168288479 de PokerStars:  Hold'em No Limit (0.01 €/0.02 € EUR) - 01-08-2025 11:20:13 CET [01-08-2025 5:20:13 ET]\nMesa \"Jupiter\" 6-max El asiento n.º 6 es el botón\nAsiento 4: LOLA19711971 (0.61 € en fichas) está ausente\nAsiento 1: sifilis5 (1.77 € en fichas) \nAsiento 2: Filou203 (2.23 € en fichas) \nAsiento 3: SrLyce (2.30 € en fichas) \nAsiento 5: dadou13mars (4.54 € en fichas) \nAsiento 6: Alvii37 (2.16 € en fichas) \nsifilis5: pone la ciega pequeña 0.01 €\nFilou203: pone la ciega grande 0.02 €\n*** CARTAS DE MANO ***\nRepartidas a SrLyce [Jd Kd]\nSrLyce: sube 0.04 € a 0.06 €\ndadou13mars: se retira \nAlvii37: se retira \nsifilis5: se retira \nFilou203: se retira \nLa apuesta no igualada (0.04 €) ha sido devuelta a SrLyce\nSrLyce se lleva 0.05 € del bote \nSrLyce: no muestra su mano \n*** RESUMEN ***\nBote total 0.05 € | Comisión 0 € \nAsiento 4: LOLA19711971\nAsiento 1: sifilis5 (ciega pequeña) se retiró antes del Flop\nAsiento 2: Filou203 (ciega grande) se retiró antes del Flop\nAsiento 3: SrLyce recaudó (0.05 €)\nAsiento 5: dadou13mars se retiró antes del Flop (no apostó)\nAsiento 6: Alvii37 (botón) se retiró antes del Flop (no apostó)"
}