{
  "hand_id": "257237826018",
  "date": "06-08-2025 18:03:03",
  "table": "Nuwa III",
  "game_type": "holdem",
  "hero": "SrLyce",
  "hero_position": "",
  "hero_cards": [
    "Js",
    "2h"
  ],
  "stacks": {
    "davinci1962": 118.0,
    "BuXHexter": 104.5,
    "kcg_rm": 107.0,
    "SrLyce": 95.5,
    "RiskAllinkali": 114.5,
    "acavada": 101.5
  },
  "actions": {
    "preflop": [
      "Asiento 1: davinci1962 (2.36 € en fichas)",
      "Asiento 2: BuXHexter (2.09 € en fichas)",
      "Asiento 3: kcg_rm (2.14 € en fichas)",
      "Asiento 4: SrLyce (1.91 € en fichas)",
      "Asiento 5: RiskAllinkali (2.29 € en fichas)",
      "Asiento 6: acavada (2.03 € en fichas)",
      "acavada: pone la ciega pequeña 0.01 €",
      "davinci1962: pone la ciega grande 0.02 €",
      "BuXHexter: se retira",
      "kcg_rm: se retira",
      "SrLyce: se retira",
      "RiskAllinkali: sube 0.04 € a 0.06 €",
      "acavada: se retira",
      "davinci1962: se retira",
      "RiskAllinkali: no muestra su mano",
      "Asiento 1: davinci1962 (ciega grande) se retiró antes del Flop",
      "Asiento 2: BuXHexter se retiró antes del Flop (no apostó)",
      "Asiento 3: kcg_rm se retiró antes del Flop (no apostó)",
      "Asiento 4: SrLyce se retiró antes del Flop (no apostó)",
      "Asiento 5: RiskAllinkali (botón) recaudó (0.05 €)",
      "Asiento 6: acavada (ciega pequeña) se retiró antes del Flop"
    ],
    "flop": [],
    "turn": [],
    "river": []
  },
  "board": [],
  "winner": "RiskAllinkali",
  "win_amount": 2.5,
  "sb": 0.01,
  "bb": 0.02,
  "rake": 0.0,
  "raw_text": "Mano n.º 257237826018 de PokerStars:  Hold'em No Limit (0.01 €/0.02 € EUR) - 06-08-2025 18:03:03 CET [06-08-2025 12:03:03 ET]\nMesa \"Nuwa III\" 6-max El asiento n.º 5 es el botón\nAsiento 1: davinci1962 (2.36 € en fichas) \nAsiento 2: BuXHexter (2.09 € en fichas) \nAsiento 3: kcg_rm (2.14 € en fichas) \nAsiento 4: SrLyce (1.91 € en fichas) \nAsiento 5: RiskAllinkali (2.29 € en fichas) \nAsiento 6: acavada (2.03 € en fichas) \nacavada: pone la ciega pequeña 0.01 €\ndavinci1962: pone la ciega grande 0.02 €\n*** CARTAS DE MANO ***\nRepartidas a SrLyce [Js 2h]\nBuXHexter: se retira \nkcg_rm: se retira \nSrLyce: se retira \nRiskAllinkali: sube 0.04 € a 0.06 €\nacavada: se retira \ndavinci1962: se retira \nLa apuesta no igualada (0.04 €) ha sido devuelta a RiskAllinkali\nRiskAllinkali se lleva 0.05 € del bote \nRiskAllinkali: no muestra su mano \n*** RESUMEN ***\nBote total 0.05 € | Comisión 0 € \nAsiento 1: davinci1962 (ciega grande) se retiró antes del Flop\nAsiento 2: BuXHexter se retiró antes del Flop (no apostó)\nAsiento 3: kcg_rm se retiró antes del Flop (no apostó)\nAsiento 4: SrLyce se retiró antes del Flop (no apostó)\nAsiento 5: RiskAllinkali (botón) recaudó (0.05 €)\nAsiento 6: acavada (ciega pequeña) se retiró antes del Flop"
}