{
  "hand_id": "257149052022",
  "date": "30-07-2025 22:04:37",
  "table": "Sirona",
  "game_type": "holdem",
  "hero": "SrLyce",
  "hero_position": "",
  "hero_cards": [
    "8s",
    "Qh"
  ],
  "stacks": {
    "SrLyce": 120.0,
    "lecontrebandier": 94.5,
    "christoph363": 214.0,
    "oliverdu70": 185.5,
    "NaruchoH1": 100.0,
    "MitchATP65": 100.0
  },
  "actions": {
    "preflop": [
      "Asiento 1: SrLyce (2.40 € en fichas)",
      "Asiento 2: lecontrebandier (1.89 € en fichas)",
      "Asiento 3: christoph363 (4.28 € en fichas)",
      "Asiento 4: oliverdu70 (3.71 € en fichas)",
      "Asiento 5: NaruchoH1 (2 € en fichas)",
      "Asiento 6: MitchATP65 (2 € en fichas)",
      "SrLyce: pone la ciega pequeña 0.01 €",
      "lecontrebandier: pone la ciega grande 0.02 €",
      "christoph363: se retira",
      "oliverdu70: se retira",
      "NaruchoH1: se retira",
      "MitchATP65: se retira",
      "SrLyce: sube 0.04 € a 0.06 €",
      "lecontrebandier: se retira",
      "SrLyce: no muestra su mano",
      "Asiento 1: SrLyce (ciega pequeña) recaudó (0.04 €)",
      "Asiento 2: lecontrebandier (ciega grande) se retiró antes del Flop",
      "Asiento 3: christoph363 se retiró antes del Flop (no apostó)",
      "Asiento 4: oliverdu70 se retiró antes del Flop (no apostó)",
      "Asiento 5: NaruchoH1 se retiró antes del Flop (no apostó)",
      "Asiento 6: MitchATP65 (botón) se retiró antes del Flop (no apostó)"
    ],
    "flop": [],
    "turn": [],
    "river": []
  },
  "board": [],
  "winner": "SrLyce",
  "win_amount": 2.0,
  "sb": 0.01,
  "bb": 0.02,
  "rake": 0.0,
  "raw_text": "Mano n.º 257149052022 de PokerStars:  Hold'em No Limit (0.01 €/0.02 € EUR) - 30-07-2025 22:04:37 CET [30-07-2025 16:04:37 ET]\nMesa \"Sirona\" 6-max El asiento n.º 6 es el botón\nAsiento 1: SrLyce (2.40 € en fichas) \nAsiento 2: lecontrebandier (1.89 € en fichas) \nAsiento 3: christoph363 (4.28 € en fichas) \nAsiento 4: oliverdu70 (3.71 € en fichas) \nAsiento 5: NaruchoH1 (2 € en fichas) \nAsiento 6: MitchATP65 (2 € en fichas) \nSrLyce: pone la ciega pequeña 0.01 €\nlecontrebandier: pone la ciega grande 0.02 €\n*** CARTAS DE MANO ***\nRepartidas a SrLyce [8s Qh]\nchristoph363: se retira \noliverdu70: se retira \nNaruchoH1: se retira \nMitchATP65: se retira \nSrLyce: sube 0.04 € a 0.06 €\nlecontrebandier: se retira \nLa apuesta no igualada (0.04 €) ha sido devuelta a SrLyce\nSrLyce se lleva 0.04 € del bote \nSrLyce: no muestra su mano \n*** RESUMEN ***\nBote total 0.04 € | Comisión 0 € \nAsiento 1: SrLyce (ciega pequeña) recaudó (0.04 €)\nAsiento 2: lecontrebandier (ciega grande) se retiró antes del Flop\nAsiento 3: christoph363 se retiró antes del Flop (no apostó)\nAsiento 4: oliverdu70 se retiró antes del Flop (no apostó)\nAsiento 5: NaruchoH1 se retiró antes del Flop (no apostó)\nAsiento 6: MitchATP65 (botón) se retiró antes del Flop (no apostó)"
}