{
  "hand_id": "257238681144",
  "date": "06-08-2025 19:20:11",
  "table": "Herculina II",
  "game_type": "holdem",
  "hero": "SrLyce",
  "hero_position": "",
  "hero_cards": [
    "7h",
    "7c"
  ],
  "stacks": {
    "Alceo27": 122.0,
    "David98X": 150.5,
    "JJer11": 192.0,
    "SrLyce": 113.5,
    "Macklemore0": 101.0,
    "ScarvBlack": 111.5
  },
  "actions": {
    "preflop": [
      "Asiento 1: Alceo27 (2.44 € en fichas)",
      "Asiento 2: David98X (3.01 € en fichas)",
      "Asiento 3: JJer11 (3.84 € en fichas)",
      "Asiento 4: SrLyce (2.27 € en fichas)",
      "Asiento 5: Macklemore0 (2.02 € en fichas)",
      "Asiento 6: ScarvBlack (2.23 € en fichas)",
      "SrLyce: pone la ciega pequeña 0.01 €",
      "Macklemore0: pone la ciega grande 0.02 €",
      "ScarvBlack: sube 0.04 € a 0.06 €",
      "Alceo27: se retira",
      "David98X: se retira",
      "JJer11: se retira",
      "SrLyce: iguala 0.05 €",
      "Macklemore0: se retira"
    ],
    "flop": [
      "SrLyce: apuesta 0.07 €",
      "ScarvBlack: sube 0.14 € a 0.21 €",
      "SrLyce: sube 0.14 € a 0.35 €",
      "ScarvBlack: iguala 0.14 €"
    ],
    "turn": [
      "SrLyce: pasa",
      "ScarvBlack: pasa"
    ],
    "river": [
      "SrLyce: apuesta 1.86 € y está all-in",
      "ScarvBlack: se retira",
      "SrLyce: no muestra su mano",
      "Asiento 1: Alceo27 se retiró antes del Flop (no apostó)",
      "Asiento 2: David98X se retiró antes del Flop (no apostó)",
      "Asiento 3: JJer11 (botón) se retiró antes del Flop (no apostó)",
      "Asiento 4: SrLyce (ciega pequeña) recaudó (0.79 €)",
      "Asiento 5: Macklemore0 (ciega grande) se retiró antes del Flop",
      "Asiento 6: ScarvBlack se retiró en el River"
    ]
  },
  "board": [
    "Qc",
    "8h",
    "7d",
    "Jc",
    "Kd"
  ],
  "winner": "SrLyce",
  "win_amount": 39.5,
  "sb": 0.01,
  "bb": 0.02,
  "rake": 2.5,
  "raw_text": "Mano n.º 257238681144 de PokerStars:  Hold'em No Limit (0.01 €/0.02 € EUR) - 06-08-2025 19:20:11 CET [06-08-2025 13:20:11 ET]\nMesa \"Herculina II\" 6-max El asiento n.º 3 es el botón\nAsiento 1: Alceo27 (2.44 € en fichas) \nAsiento 2: David98X (3.01 € en fichas) \nAsiento 3: JJer11 (3.84 € en fichas) \nAsiento 4: SrLyce (2.27 € en fichas) \nAsiento 5: Macklemore0 (2.02 € en fichas) \nAsiento 6: ScarvBlack (2.23 € en fichas) \nSrLyce: pone la ciega pequeña 0.01 €\nMacklemore0: pone la ciega grande 0.02 €\n*** CARTAS DE MANO ***\nRepartidas a SrLyce [7h 7c]\nScarvBlack: sube 0.04 € a 0.06 €\nAlceo27: se retira \nDavid98X: se retira \nJJer11: se retira \nSrLyce: iguala 0.05 €\nMacklemore0: se retira \n*** FLOP *** [Qc 8h 7d]\nSrLyce: apuesta 0.07 €\nScarvBlack: sube 0.14 € a 0.21 €\nSrLyce: sube 0.14 € a 0.35 €\nScarvBlack: iguala 0.14 €\n*** TURN *** [Qc 8h 7d] [Jc]\nSrLyce: pasa \nScarvBlack: pasa \n*** RIVER *** [Qc 8h 7d Jc] [Kd]\nSrLyce: apuesta 1.86 € y está all-in\nScarvBlack: se retira \nLa apuesta no igualada (1.86 €) ha sido devuelta a SrLyce\nSrLyce se lleva 0.79 € del bote \nSrLyce: no muestra su mano \n*** RESUMEN ***\nBote total 0.84 € | Comisión 0.05 € \nComunitarias [Qc 8h 7d Jc Kd]\nAsiento 1: Alceo27 se retiró antes del Flop (no apostó)\nAsiento 2: David98X se retiró antes del Flop (no apostó)\nAsiento 3: JJer11 (botón) se retiró antes del Flop (no apostó)\nAsiento 4: SrLyce (ciega pequeña) recaudó (0.79 €)\nAsiento 5: Macklemore0 (ciega grande) se retiró antes del Flop\nAsiento 6: ScarvBlack se retiró en el River"
}