{
  "hand_id": "257149923843",
  "date": "30-07-2025 23:06:12",
  "table": "Gilgamesh",
  "game_type": "holdem",
  "hero": "SrLyce",
  "hero_position": "",
  "hero_cards": [
    "Td",
    "8s"
  ],
  "stacks": {
    "riverrrrrrmagic": 120.5,
    "SrLyce": 118.0,
    "Jumby34": 100.0,
    "cbo54": 75.0,
    "Fretzo67500": 117.0
  },
  "actions": {
    "preflop": [
      "Asiento 1: riverrrrrrmagic (2.41 € en fichas)",
      "Asiento 2: SrLyce (2.36 € en fichas)",
      "Asiento 3: Jumby34 (2 € en fichas)",
      "Asiento 5: cbo54 (1.50 € en fichas)",
      "Asiento 6: Fretzo67500 (2.34 € en fichas)",
      "cbo54: pone la ciega pequeña 0.01 €",
      "Fretzo67500: pone la ciega grande 0.02 €",
      "riverrrrrrmagic: se retira",
      "SrLyce: sube 0.04 € a 0.06 €",
      "Jumby34: iguala 0.06 €",
      "cbo54: iguala 0.05 €",
      "Fretzo67500: iguala 0.04 €"
    ],
    "flop": [
      "cbo54: apuesta 0.04 €",
      "Fretzo67500: iguala 0.04 €",
      "SrLyce: se retira",
      "Jumby34: se retira"
    ],
    "turn": [
      "cbo54: apuesta 0.06 €",
      "Fretzo67500: sube 0.06 € a 0.12 €",
      "cbo54: iguala 0.06 €"
    ],
    "river": [
      "cbo54: apuesta 0.02 €",
      "Fretzo67500: iguala 0.02 €",
      "cbo54: muestra [Ad 7h] (doble pareja, damas y sietes)",
      "Fretzo67500: descarta su mano sin mostrar",
      "Asiento 1: riverrrrrrmagic se retiró antes del Flop (no apostó)",
      "Asiento 2: SrLyce se retiró en el Flop",
      "Asiento 3: Jumby34 (botón) se retiró en el Flop",
      "Asiento 5: cbo54 (ciega pequeña) muestra [Ad 7h] y ganó (0.56 €) con doble pareja, damas y sietes",
      "Asiento 6: Fretzo67500 (ciega grande) descartó sin mostrar [9s As]"
    ]
  },
  "board": [
    "7c",
    "Js",
    "Qc",
    "Qs",
    "3d"
  ],
  "winner": "cbo54",
  "win_amount": 28.0,
  "sb": 0.01,
  "bb": 0.02,
  "rake": 2.0,
  "raw_text": "Mano n.º 257149923843 de PokerStars:  Hold'em No Limit (0.01 €/0.02 € EUR) - 30-07-2025 23:06:12 CET [30-07-2025 17:06:12 ET]\nMesa \"Gilgamesh\" 6-max El asiento n.º 3 es el botón\nAsiento 1: riverrrrrrmagic (2.41 € en fichas) \nAsiento 2: SrLyce (2.36 € en fichas) \nAsiento 3: Jumby34 (2 € en fichas) \nAsiento 5: cbo54 (1.50 € en fichas) \nAsiento 6: Fretzo67500 (2.34 € en fichas) \ncbo54: pone la ciega pequeña 0.01 €\nFretzo67500: pone la ciega grande 0.02 €\n*** CARTAS DE MANO ***\nRepartidas a SrLyce [Td 8s]\nxapkk se une a la mesa en el asiento n.º 4 \nriverrrrrrmagic: se retira \nSrLyce: sube 0.04 € a 0.06 €\nJumby34: iguala 0.06 €\ncbo54: iguala 0.05 €\nFretzo67500: iguala 0.04 €\n*** FLOP *** [7c Js Qc]\ncbo54: apuesta 0.04 €\nFretzo67500: iguala 0.04 €\nSrLyce: se retira \nJumby34: se retira \n*** TURN *** [7c Js Qc] [Qs]\ncbo54: apuesta 0.06 €\nFretzo67500: sube 0.06 € a 0.12 €\ncbo54: iguala 0.06 €\n*** RIVER *** [7c Js Qc Qs] [3d]\ncbo54: apuesta 0.02 €\nFretzo67500: iguala 0.02 €\n*** SHOW DOWN ***\ncbo54: muestra [Ad 7h] (doble pareja, damas y sietes)\nFretzo67500: descarta su mano sin mostrar \ncbo54 se lleva 0.56 € del bote \n*** RESUMEN ***\nBote total 0.60 € | Comisión 0.04 € \nComunitarias [7c Js Qc Qs 3d]\nAsiento 1: riverrrrrrmagic se retiró antes del Flop (no apostó)\nAsiento 2: SrLyce se retiró en el Flop\nAsiento 3: Jumby34 (botón) se retiró en el Flop\nAsiento 5: cbo54 (ciega pequeña) muestra [Ad 7h] y ganó (0.56 €) con doble pareja, damas y sietes\nAsiento 6: Fretzo67500 (ciega grande) descartó sin mostrar [9s As]"
}