{
  "hand_id": "257148720694",
  "date": "30-07-2025 21:39:17",
  "table": "Sirona",
  "game_type": "holdem",
  "hero": "SrLyce",
  "hero_position": "",
  "hero_cards": [
    "6c",
    "Jd"
  ],
  "stacks": {
    "SrLyce": 91.5,
    "lecontrebandier": 97.0,
    "christoph363": 179.0,
    "oliverdu70": 105.0,
    "olibellier": 31.5,
    "Dakoo44": 110.5
  },
  "actions": {
    "preflop": [
      "Asiento 1: SrLyce (1.83 € en fichas)",
      "Asiento 2: lecontrebandier (1.94 € en fichas)",
      "Asiento 3: christoph363 (3.58 € en fichas)",
      "Asiento 4: oliverdu70 (2.10 € en fichas)",
      "Asiento 5: olibellier (0.63 € en fichas)",
      "Asiento 6: Dakoo44 (2.21 € en fichas)",
      "olibellier: pone la ciega pequeña 0.01 €",
      "Dakoo44: pone la ciega grande 0.02 €",
      "SrLyce: se retira",
      "lecontrebandier: se retira",
      "christoph363: sube 0.04 € a 0.06 €",
      "oliverdu70: se retira",
      "olibellier: se retira",
      "Dakoo44: se retira",
      "Asiento 1: SrLyce se retiró antes del Flop (no apostó)",
      "Asiento 2: lecontrebandier se retiró antes del Flop (no apostó)",
      "Asiento 3: christoph363 recaudó (0.05 €)",
      "Asiento 4: oliverdu70 (botón) se retiró antes del Flop (no apostó)",
      "Asiento 5: olibellier (ciega pequeña) se retiró antes del Flop",
      "Asiento 6: Dakoo44 (ciega grande) se retiró antes del Flop"
    ],
    "flop": [],
    "turn": [],
    "river": []
  },
  "board": [],
  "winner": "christoph363",
  "win_amount": 2.5,
  "sb": 0.01,
  "bb": 0.02,
  "rake": 0.0,
  "raw_text": "Mano n.º 257148720694 de PokerStars:  Hold'em No Limit (0.01 €/0.02 € EUR) - 30-07-2025 21:39:17 CET [30-07-2025 15:39:17 ET]\nMesa \"Sirona\" 6-max El asiento n.º 4 es el botón\nAsiento 1: SrLyce (1.83 € en fichas) \nAsiento 2: lecontrebandier (1.94 € en fichas) \nAsiento 3: christoph363 (3.58 € en fichas) \nAsiento 4: oliverdu70 (2.10 € en fichas) \nAsiento 5: olibellier (0.63 € en fichas) \nAsiento 6: Dakoo44 (2.21 € en fichas) \nolibellier: pone la ciega pequeña 0.01 €\nDakoo44: pone la ciega grande 0.02 €\n*** CARTAS DE MANO ***\nRepartidas a SrLyce [6c Jd]\nSrLyce: se retira \nlecontrebandier: se retira \nchristoph363: sube 0.04 € a 0.06 €\noliverdu70: se retira \nolibellier: se retira \nDakoo44: se retira \nLa apuesta no igualada (0.04 €) ha sido devuelta a christoph363\nchristoph363 se lleva 0.05 € del bote \n*** RESUMEN ***\nBote total 0.05 € | Comisión 0 € \nAsiento 1: SrLyce se retiró antes del Flop (no apostó)\nAsiento 2: lecontrebandier se retiró antes del Flop (no apostó)\nAsiento 3: christoph363 recaudó (0.05 €)\nAsiento 4: oliverdu70 (botón) se retiró antes del Flop (no apostó)\nAsiento 5: olibellier (ciega pequeña) se retiró antes del Flop\nAsiento 6: Dakoo44 (ciega grande) se retiró antes del Flop"
}