{
  "hand_id": "257238314239",
  "date": "06-08-2025 18:47:01",
  "table": "Herculina II",
  "game_type": "holdem",
  "hero": "SrLyce",
  "hero_position": "",
  "hero_cards": [
    "Qc",
    "4d"
  ],
  "stacks": {
    "ScarvBlack": 100.0,
    "koldipk": 73.0,
    "David98X": 108.0,
    "JJer11": 195.5,
    "SrLyce": 94.5,
    "El Calvo 65": 227.5
  },
  "actions": {
    "preflop": [
      "Asiento 6: ScarvBlack (2 € en fichas) está ausente",
      "Asiento 1: koldipk (1.46 € en fichas)",
      "Asiento 2: David98X (2.16 € en fichas)",
      "Asiento 3: JJer11 (3.91 € en fichas)",
      "Asiento 4: SrLyce (1.89 € en fichas)",
      "Asiento 5: El Calvo 65 (4.55 € en fichas)",
      "JJer11: pone la ciega pequeña 0.01 €",
      "SrLyce: pone la ciega grande 0.02 €",
      "ScarvBlack: se ausenta",
      "El Calvo 65: se retira",
      "koldipk: se retira",
      "David98X: sube 0.04 € a 0.06 €",
      "JJer11: se retira",
      "SrLyce: se retira",
      "David98X: no muestra su mano",
      "Asiento 6: ScarvBlack",
      "Asiento 1: koldipk se retiró antes del Flop (no apostó)",
      "Asiento 2: David98X (botón) recaudó (0.05 €)",
      "Asiento 3: JJer11 (ciega pequeña) se retiró antes del Flop",
      "Asiento 4: SrLyce (ciega grande) se retiró antes del Flop",
      "Asiento 5: El Calvo 65 se retiró antes del Flop (no apostó)"
    ],
    "flop": [],
    "turn": [],
    "river": []
  },
  "board": [],
  "winner": "David98X",
  "win_amount": 2.5,
  "sb": 0.01,
  "bb": 0.02,
  "rake": 0.0,
  "raw_text": "Mano n.º 257238314239 de PokerStars:  Hold'em No Limit (0.01 €/0.02 € EUR) - 06-08-2025 18:47:01 CET [06-08-2025 12:47:01 ET]\nMesa \"Herculina II\" 6-max El asiento n.º 2 es el botón\nAsiento 6: ScarvBlack (2 € en fichas) está ausente\nAsiento 1: koldipk (1.46 € en fichas) \nAsiento 2: David98X (2.16 € en fichas) \nAsiento 3: JJer11 (3.91 € en fichas) \nAsiento 4: SrLyce (1.89 € en fichas) \nAsiento 5: El Calvo 65 (4.55 € en fichas) \nJJer11: pone la ciega pequeña 0.01 €\nSrLyce: pone la ciega grande 0.02 €\nScarvBlack: se ausenta \n*** CARTAS DE MANO ***\nRepartidas a SrLyce [Qc 4d]\nEl Calvo 65: se retira \nkoldipk: se retira \nDavid98X: sube 0.04 € a 0.06 €\nJJer11: se retira \nSrLyce: se retira \nLa apuesta no igualada (0.04 €) ha sido devuelta a David98X\nDavid98X se lleva 0.05 € del bote \nDavid98X: no muestra su mano \n*** RESUMEN ***\nBote total 0.05 € | Comisión 0 € \nAsiento 6: ScarvBlack\nAsiento 1: koldipk se retiró antes del Flop (no apostó)\nAsiento 2: David98X (botón) recaudó (0.05 €)\nAsiento 3: JJer11 (ciega pequeña) se retiró antes del Flop\nAsiento 4: SrLyce (ciega grande) se retiró antes del Flop\nAsiento 5: El Calvo 65 se retiró antes del Flop (no apostó)"
}