{
  "hand_id": "257238651179",
  "date": "06-08-2025 19:17:40",
  "table": "Adelaide III",
  "game_type": "holdem",
  "hero": "SrLyce",
  "hero_position": "",
  "hero_cards": [
    "2d",
    "Ts"
  ],
  "stacks": {
    "Macklemore0": 106.5,
    "Alceo27": 104.0,
    "aliendee07": 68.0,
    "SrLyce": 130.0,
    "ismagonzalez7": 30.0,
    "McFlash3": 100.0
  },
  "actions": {
    "preflop": [
      "Asiento 3: Macklemore0 (2.13 € en fichas) está ausente",
      "Asiento 1: Alceo27 (2.08 € en fichas)",
      "Asiento 2: aliendee07 (1.36 € en fichas)",
      "Asiento 4: SrLyce (2.60 € en fichas)",
      "Asiento 5: ismagonzalez7 (0.60 € en fichas)",
      "Asiento 6: McFlash3 (2 € en fichas)",
      "Alceo27: pone la ciega pequeña 0.01 €",
      "aliendee07: pone la ciega grande 0.02 €",
      "Macklemore0: se ausenta",
      "SrLyce: se retira",
      "ismagonzalez7: sube 0.02 € a 0.04 €",
      "McFlash3: iguala 0.04 €",
      "Alceo27: se retira",
      "aliendee07: sube 0.08 € a 0.12 €",
      "ismagonzalez7: iguala 0.08 €",
      "McFlash3: iguala 0.08 €"
    ],
    "flop": [
      "aliendee07: pasa",
      "ismagonzalez7: apuesta 0.12 €",
      "McFlash3: se retira",
      "aliendee07: sube 1.12 € a 1.24 € y está all-in",
      "ismagonzalez7: iguala 0.36 € y está all-in"
    ],
    "turn": [],
    "river": [
      "aliendee07: muestra [Qh Qd] (doble pareja, damas y seises)",
      "ismagonzalez7: muestra [Ah 3c] (full de treses y seises)",
      "Asiento 3: Macklemore0",
      "Asiento 1: Alceo27 (ciega pequeña) se retiró antes del Flop",
      "Asiento 2: aliendee07 (ciega grande) muestra [Qh Qd] y perdió con doble pareja, damas y seises",
      "Asiento 4: SrLyce se retiró antes del Flop (no apostó)",
      "Asiento 5: ismagonzalez7 muestra [Ah 3c] y ganó (1.25 €) con full de treses y seises",
      "Asiento 6: McFlash3 (botón) se retiró en el Flop"
    ]
  },
  "board": [
    "3h",
    "6h",
    "7d",
    "3d",
    "6d"
  ],
  "winner": "ismagonzalez7",
  "win_amount": 62.5,
  "sb": 0.01,
  "bb": 0.02,
  "rake": 4.0,
  "raw_text": "Mano n.º 257238651179 de PokerStars:  Hold'em No Limit (0.01 €/0.02 € EUR) - 06-08-2025 19:17:40 CET [06-08-2025 13:17:40 ET]\nMesa \"Adelaide III\" 6-max El asiento n.º 6 es el botón\nAsiento 3: Macklemore0 (2.13 € en fichas) está ausente\nAsiento 1: Alceo27 (2.08 € en fichas) \nAsiento 2: aliendee07 (1.36 € en fichas) \nAsiento 4: SrLyce (2.60 € en fichas) \nAsiento 5: ismagonzalez7 (0.60 € en fichas) \nAsiento 6: McFlash3 (2 € en fichas) \nAlceo27: pone la ciega pequeña 0.01 €\naliendee07: pone la ciega grande 0.02 €\nMacklemore0: se ausenta \n*** CARTAS DE MANO ***\nRepartidas a SrLyce [2d Ts]\nSrLyce: se retira \nismagonzalez7: sube 0.02 € a 0.04 €\nMcFlash3: iguala 0.04 €\nAlceo27: se retira \naliendee07: sube 0.08 € a 0.12 €\nismagonzalez7: iguala 0.08 €\nMcFlash3: iguala 0.08 €\n*** FLOP *** [3h 6h 7d]\naliendee07: pasa \nismagonzalez7: apuesta 0.12 €\nMcFlash3: se retira \naliendee07: sube 1.12 € a 1.24 € y está all-in\nismagonzalez7: iguala 0.36 € y está all-in\nLa apuesta no igualada (0.76 €) ha sido devuelta a aliendee07\n*** TURN *** [3h 6h 7d] [3d]\n*** RIVER *** [3h 6h 7d 3d] [6d]\n*** SHOW DOWN ***\naliendee07: muestra [Qh Qd] (doble pareja, damas y seises)\nismagonzalez7: muestra [Ah 3c] (full de treses y seises)\nismagonzalez7 se lleva 1.25 € del bote \n*** RESUMEN ***\nBote total 1.33 € | Comisión 0.08 € \nComunitarias [3h 6h 7d 3d 6d]\nAsiento 3: Macklemore0\nAsiento 1: Alceo27 (ciega pequeña) se retiró antes del Flop\nAsiento 2: aliendee07 (ciega grande) muestra [Qh Qd] y perdió con doble pareja, damas y seises\nAsiento 4: SrLyce se retiró antes del Flop (no apostó)\nAsiento 5: ismagonzalez7 muestra [Ah 3c] y ganó (1.25 €) con full de treses y seises\nAsiento 6: McFlash3 (botón) se retiró en el Flop"
}