{
  "hand_id": "257238425876",
  "date": "06-08-2025 18:57:25",
  "table": "Adelaide III",
  "game_type": "holdem",
  "hero": "SrLyce",
  "hero_position": "",
  "hero_cards": [
    "Kc",
    "3c"
  ],
  "stacks": {
    "N3xtTIm35": 124.5,
    "aliendee07": 57.0,
    "Macklemore0": 100.0,
    "SrLyce": 106.5,
    "ismagonzalez7": 58.5,
    "pauquair5": 62.5
  },
  "actions": {
    "preflop": [
      "Asiento 1: N3xtTIm35 (2.49 € en fichas)",
      "Asiento 2: aliendee07 (1.14 € en fichas)",
      "Asiento 3: Macklemore0 (2 € en fichas)",
      "Asiento 4: SrLyce (2.13 € en fichas)",
      "Asiento 5: ismagonzalez7 (1.17 € en fichas)",
      "Asiento 6: pauquair5 (1.25 € en fichas)",
      "aliendee07: pone la ciega pequeña 0.01 €",
      "Macklemore0: pone la ciega grande 0.02 €",
      "SrLyce: se retira",
      "ismagonzalez7: se retira",
      "pauquair5: sube 0.02 € a 0.04 €",
      "N3xtTIm35: se retira",
      "aliendee07: iguala 0.03 €",
      "Macklemore0: se retira"
    ],
    "flop": [
      "aliendee07: pasa",
      "pauquair5: pasa"
    ],
    "turn": [
      "aliendee07: pasa",
      "pauquair5: apuesta 0.06 €",
      "aliendee07: iguala 0.06 €"
    ],
    "river": [
      "aliendee07: pasa",
      "pauquair5: apuesta 0.12 €",
      "aliendee07: iguala 0.12 €",
      "pauquair5: muestra [As 8d] (escalera, de as a cinco)",
      "aliendee07: muestra [Ah 3h] (escalera, de as a cinco)",
      "Asiento 1: N3xtTIm35 (botón) se retiró antes del Flop (no apostó)",
      "Asiento 2: aliendee07 (ciega pequeña) muestra [Ah 3h] y ganó (0.22 €) con escalera, de as a cinco",
      "Asiento 3: Macklemore0 (ciega grande) se retiró antes del Flop",
      "Asiento 4: SrLyce se retiró antes del Flop (no apostó)",
      "Asiento 5: ismagonzalez7 se retiró antes del Flop (no apostó)",
      "Asiento 6: pauquair5 muestra [As 8d] y ganó (0.21 €) con escalera, de as a cinco"
    ]
  },
  "board": [
    "5c",
    "2c",
    "2s",
    "3d",
    "4h"
  ],
  "winner": "aliendee07",
  "win_amount": 11.0,
  "sb": 0.01,
  "bb": 0.02,
  "rake": 1.5,
  "raw_text": "Mano n.º 257238425876 de PokerStars:  Hold'em No Limit (0.01 €/0.02 € EUR) - 06-08-2025 18:57:25 CET [06-08-2025 12:57:25 ET]\nMesa \"Adelaide III\" 6-max El asiento n.º 1 es el botón\nAsiento 1: N3xtTIm35 (2.49 € en fichas) \nAsiento 2: aliendee07 (1.14 € en fichas) \nAsiento 3: Macklemore0 (2 € en fichas) \nAsiento 4: SrLyce (2.13 € en fichas) \nAsiento 5: ismagonzalez7 (1.17 € en fichas) \nAsiento 6: pauquair5 (1.25 € en fichas) \naliendee07: pone la ciega pequeña 0.01 €\nMacklemore0: pone la ciega grande 0.02 €\n*** CARTAS DE MANO ***\nRepartidas a SrLyce [Kc 3c]\nSrLyce: se retira \nismagonzalez7: se retira \npauquair5: sube 0.02 € a 0.04 €\nN3xtTIm35: se retira \naliendee07: iguala 0.03 €\nMacklemore0: se retira \n*** FLOP *** [5c 2c 2s]\naliendee07: pasa \npauquair5: pasa \n*** TURN *** [5c 2c 2s] [3d]\naliendee07: pasa \npauquair5: apuesta 0.06 €\naliendee07: iguala 0.06 €\n*** RIVER *** [5c 2c 2s 3d] [4h]\naliendee07: pasa \npauquair5: apuesta 0.12 €\naliendee07: iguala 0.12 €\n*** SHOW DOWN ***\npauquair5: muestra [As 8d] (escalera, de as a cinco)\naliendee07: muestra [Ah 3h] (escalera, de as a cinco)\naliendee07 se lleva 0.22 € del bote \npauquair5 se lleva 0.21 € del bote \n*** RESUMEN ***\nBote total 0.46 € | Comisión 0.03 € \nComunitarias [5c 2c 2s 3d 4h]\nAsiento 1: N3xtTIm35 (botón) se retiró antes del Flop (no apostó)\nAsiento 2: aliendee07 (ciega pequeña) muestra [Ah 3h] y ganó (0.22 €) con escalera, de as a cinco\nAsiento 3: Macklemore0 (ciega grande) se retiró antes del Flop\nAsiento 4: SrLyce se retiró antes del Flop (no apostó)\nAsiento 5: ismagonzalez7 se retiró antes del Flop (no apostó)\nAsiento 6: pauquair5 muestra [As 8d] y ganó (0.21 €) con escalera, de as a cinco"
}