{
  "hand_id": "257238447323",
  "date": "06-08-2025 18:59:58",
  "table": "Adelaide III",
  "game_type": "holdem",
  "hero": "SrLyce",
  "hero_position": "",
  "hero_cards": [
    "3c",
    "Kh"
  ],
  "stacks": {
    "N3xtTIm35": 124.5,
    "aliendee07": 64.5,
    "Macklemore0": 100.0,
    "SrLyce": 98.5,
    "ismagonzalez7": 58.5,
    "pauquair5": 62.0
  },
  "actions": {
    "preflop": [
      "Asiento 1: N3xtTIm35 (2.49 € en fichas)",
      "Asiento 2: aliendee07 (1.29 € en fichas)",
      "Asiento 3: Macklemore0 (2 € en fichas)",
      "Asiento 4: SrLyce (1.97 € en fichas)",
      "Asiento 5: ismagonzalez7 (1.17 € en fichas)",
      "Asiento 6: pauquair5 (1.24 € en fichas)",
      "SrLyce: pone la ciega pequeña 0.01 €",
      "ismagonzalez7: pone la ciega grande 0.02 €",
      "pauquair5: se retira",
      "N3xtTIm35: se retira",
      "aliendee07: se retira",
      "Macklemore0: se retira",
      "SrLyce: se retira",
      "ismagonzalez7: no muestra su mano",
      "Asiento 1: N3xtTIm35 se retiró antes del Flop (no apostó)",
      "Asiento 2: aliendee07 se retiró antes del Flop (no apostó)",
      "Asiento 3: Macklemore0 (botón) se retiró antes del Flop (no apostó)",
      "Asiento 4: SrLyce (ciega pequeña) se retiró antes del Flop",
      "Asiento 5: ismagonzalez7 (ciega grande) recaudó (0.02 €)",
      "Asiento 6: pauquair5 se retiró antes del Flop (no apostó)"
    ],
    "flop": [],
    "turn": [],
    "river": []
  },
  "board": [],
  "winner": "ismagonzalez7",
  "win_amount": 1.0,
  "sb": 0.01,
  "bb": 0.02,
  "rake": 0.0,
  "raw_text": "Mano n.º 257238447323 de PokerStars:  Hold'em No Limit (0.01 €/0.02 € EUR) - 06-08-2025 18:59:58 CET [06-08-2025 12:59:58 ET]\nMesa \"Adelaide III\" 6-max El asiento n.º 3 es el botón\nAsiento 1: N3xtTIm35 (2.49 € en fichas) \nAsiento 2: aliendee07 (1.29 € en fichas) \nAsiento 3: Macklemore0 (2 € en fichas) \nAsiento 4: SrLyce (1.97 € en fichas) \nAsiento 5: ismagonzalez7 (1.17 € en fichas) \nAsiento 6: pauquair5 (1.24 € en fichas) \nSrLyce: pone la ciega pequeña 0.01 €\nismagonzalez7: pone la ciega grande 0.02 €\n*** CARTAS DE MANO ***\nRepartidas a SrLyce [3c Kh]\npauquair5: se retira \nN3xtTIm35: se retira \naliendee07: se retira \nMacklemore0: se retira \nSrLyce: se retira \nLa apuesta no igualada (0.01 €) ha sido devuelta a ismagonzalez7\nismagonzalez7 se lleva 0.02 € del bote \nismagonzalez7: no muestra su mano \n*** RESUMEN ***\nBote total 0.02 € | Comisión 0 € \nAsiento 1: N3xtTIm35 se retiró antes del Flop (no apostó)\nAsiento 2: aliendee07 se retiró antes del Flop (no apostó)\nAsiento 3: Macklemore0 (botón) se retiró antes del Flop (no apostó)\nAsiento 4: SrLyce (ciega pequeña) se retiró antes del Flop\nAsiento 5: ismagonzalez7 (ciega grande) recaudó (0.02 €)\nAsiento 6: pauquair5 se retiró antes del Flop (no apostó)"
}