{
  "hand_id": "257238106489",
  "date": "06-08-2025 18:28:38",
  "table": "Alruccabah II",
  "game_type": "holdem",
  "hero": "SrLyce",
  "hero_position": "",
  "hero_cards": [
    "7d",
    "5h"
  ],
  "stacks": {
    "SrLyce": 97.0,
    "Davdgoni": 262.5,
    "PerroBestia": 42.0,
    "Nicanor Cast": 54.0,
    "THEBLACK972": 173.5
  },
  "actions": {
    "preflop": [
      "Asiento 1: SrLyce (1.94 € en fichas)",
      "Asiento 2: Davdgoni (5.25 € en fichas)",
      "Asiento 3: PerroBestia (0.84 € en fichas)",
      "Asiento 4: serviettski(fr) (2.03 € en fichas)",
      "Asiento 5: Nicanor Cast (1.08 € en fichas)",
      "Asiento 6: THEBLACK972 (3.47 € en fichas)",
      "PerroBestia: pone la ciega pequeña 0.01 €",
      "serviettski(fr): pone la ciega grande 0.02 €",
      "Nicanor Cast: se retira",
      "THEBLACK972: se retira",
      "SrLyce: se retira",
      "Davdgoni: sube 0.02 € a 0.04 €",
      "PerroBestia: se retira",
      "serviettski(fr): iguala 0.02 €"
    ],
    "flop": [
      "serviettski(fr): pasa",
      "Davdgoni: apuesta 0.08 €",
      "serviettski(fr): iguala 0.08 €"
    ],
    "turn": [
      "serviettski(fr): pasa",
      "Davdgoni: pasa"
    ],
    "river": [
      "serviettski(fr): pasa",
      "Davdgoni: pasa",
      "serviettski(fr): muestra [Qc Kd] (pareja de damas)",
      "Davdgoni: descarta su mano sin mostrar",
      "Asiento 1: SrLyce se retiró antes del Flop (no apostó)",
      "Asiento 2: Davdgoni (botón) descartó sin mostrar [Jd 9h]",
      "Asiento 3: PerroBestia (ciega pequeña) se retiró antes del Flop",
      "Asiento 4: serviettski(fr) (ciega grande) muestra [Qc Kd] y ganó (0.23 €) con pareja de damas",
      "Asiento 5: Nicanor Cast se retiró antes del Flop (no apostó)",
      "Asiento 6: THEBLACK972 se retiró antes del Flop (no apostó)"
    ]
  },
  "board": [
    "Qd",
    "Ah",
    "Jc",
    "8c",
    "6d"
  ],
  "winner": "serviettski(fr)",
  "win_amount": 11.5,
  "sb": 0.01,
  "bb": 0.02,
  "rake": 1.0,
  "raw_text": "Mano n.º 257238106489 de PokerStars:  Hold'em No Limit (0.01 €/0.02 € EUR) - 06-08-2025 18:28:38 CET [06-08-2025 12:28:38 ET]\nMesa \"Alruccabah II\" 6-max El asiento n.º 2 es el botón\nAsiento 1: SrLyce (1.94 € en fichas) \nAsiento 2: Davdgoni (5.25 € en fichas) \nAsiento 3: PerroBestia (0.84 € en fichas) \nAsiento 4: serviettski(fr) (2.03 € en fichas) \nAsiento 5: Nicanor Cast (1.08 € en fichas) \nAsiento 6: THEBLACK972 (3.47 € en fichas) \nPerroBestia: pone la ciega pequeña 0.01 €\nserviettski(fr): pone la ciega grande 0.02 €\n*** CARTAS DE MANO ***\nRepartidas a SrLyce [7d 5h]\nNicanor Cast: se retira \nTHEBLACK972: se retira \nSrLyce: se retira \nDavdgoni: sube 0.02 € a 0.04 €\nPerroBestia: se retira \nserviettski(fr): iguala 0.02 €\n*** FLOP *** [Qd Ah Jc]\nserviettski(fr): pasa \nDavdgoni: apuesta 0.08 €\nserviettski(fr): iguala 0.08 €\n*** TURN *** [Qd Ah Jc] [8c]\nserviettski(fr): pasa \nDavdgoni: pasa \n*** RIVER *** [Qd Ah Jc 8c] [6d]\nserviettski(fr): pasa \nDavdgoni: pasa \n*** SHOW DOWN ***\nserviettski(fr): muestra [Qc Kd] (pareja de damas)\nDavdgoni: descarta su mano sin mostrar \nserviettski(fr) se lleva 0.23 € del bote \n*** RESUMEN ***\nBote total 0.25 € | Comisión 0.02 € \nComunitarias [Qd Ah Jc 8c 6d]\nAsiento 1: SrLyce se retiró antes del Flop (no apostó)\nAsiento 2: Davdgoni (botón) descartó sin mostrar [Jd 9h]\nAsiento 3: PerroBestia (ciega pequeña) se retiró antes del Flop\nAsiento 4: serviettski(fr) (ciega grande) muestra [Qc Kd] y ganó (0.23 €) con pareja de damas\nAsiento 5: Nicanor Cast se retiró antes del Flop (no apostó)\nAsiento 6: THEBLACK972 se retiró antes del Flop (no apostó)"
}