{
  "hand_id": "257149205560",
  "date": "30-07-2025 22:15:28",
  "table": "Sirona",
  "game_type": "holdem",
  "hero": "SrLyce",
  "hero_position": "",
  "hero_cards": [
    "5c",
    "Kd"
  ],
  "stacks": {
    "SrLyce": 251.5,
    "Tropki": 101.5,
    "christoph363": 92.5,
    "oliverdu70": 186.0,
    "hadhod1976": 37.5,
    "MitchATP65": 103.0
  },
  "actions": {
    "preflop": [
      "Asiento 1: SrLyce (5.03 € en fichas)",
      "Asiento 2: Tropki (2.03 € en fichas)",
      "Asiento 3: christoph363 (1.85 € en fichas)",
      "Asiento 4: oliverdu70 (3.72 € en fichas)",
      "Asiento 5: hadhod1976 (0.75 € en fichas)",
      "Asiento 6: MitchATP65 (2.06 € en fichas)",
      "hadhod1976: pone la ciega pequeña 0.01 €",
      "MitchATP65: pone la ciega grande 0.02 €",
      "SrLyce: se retira",
      "Tropki: se retira",
      "christoph363: se retira",
      "oliverdu70: se retira",
      "hadhod1976: se retira",
      "MitchATP65: no muestra su mano",
      "Asiento 1: SrLyce se retiró antes del Flop (no apostó)",
      "Asiento 2: Tropki se retiró antes del Flop (no apostó)",
      "Asiento 3: christoph363 se retiró antes del Flop (no apostó)",
      "Asiento 4: oliverdu70 (botón) se retiró antes del Flop (no apostó)",
      "Asiento 5: hadhod1976 (ciega pequeña) se retiró antes del Flop",
      "Asiento 6: MitchATP65 (ciega grande) recaudó (0.02 €)"
    ],
    "flop": [],
    "turn": [],
    "river": []
  },
  "board": [],
  "winner": "MitchATP65",
  "win_amount": 1.0,
  "sb": 0.01,
  "bb": 0.02,
  "rake": 0.0,
  "raw_text": "Mano n.º 257149205560 de PokerStars:  Hold'em No Limit (0.01 €/0.02 € EUR) - 30-07-2025 22:15:28 CET [30-07-2025 16:15:28 ET]\nMesa \"Sirona\" 6-max El asiento n.º 4 es el botón\nAsiento 1: SrLyce (5.03 € en fichas) \nAsiento 2: Tropki (2.03 € en fichas) \nAsiento 3: christoph363 (1.85 € en fichas) \nAsiento 4: oliverdu70 (3.72 € en fichas) \nAsiento 5: hadhod1976 (0.75 € en fichas) \nAsiento 6: MitchATP65 (2.06 € en fichas) \nhadhod1976: pone la ciega pequeña 0.01 €\nMitchATP65: pone la ciega grande 0.02 €\n*** CARTAS DE MANO ***\nRepartidas a SrLyce [5c Kd]\nSrLyce: se retira \nTropki: se retira \nchristoph363: se retira \noliverdu70: se retira \nhadhod1976: se retira \nLa apuesta no igualada (0.01 €) ha sido devuelta a MitchATP65\nMitchATP65 se lleva 0.02 € del bote \nMitchATP65: no muestra su mano \n*** RESUMEN ***\nBote total 0.02 € | Comisión 0 € \nAsiento 1: SrLyce se retiró antes del Flop (no apostó)\nAsiento 2: Tropki se retiró antes del Flop (no apostó)\nAsiento 3: christoph363 se retiró antes del Flop (no apostó)\nAsiento 4: oliverdu70 (botón) se retiró antes del Flop (no apostó)\nAsiento 5: hadhod1976 (ciega pequeña) se retiró antes del Flop\nAsiento 6: MitchATP65 (ciega grande) recaudó (0.02 €)"
}