{
  "hand_id": "257150111214",
  "date": "30-07-2025 23:19:04",
  "table": "Gilgamesh",
  "game_type": "holdem",
  "hero": "SrLyce",
  "hero_position": "",
  "hero_cards": [
    "Jd",
    "7c"
  ],
  "stacks": {
    "riverrrrrrmagic": 127.5,
    "SrLyce": 96.0,
    "Jumby34": 101.5,
    "xapkk": 100.0,
    "samaritano34": 95.0,
    "Fretzo67500": 118.0
  },
  "actions": {
    "preflop": [
      "Asiento 1: riverrrrrrmagic (2.55 € en fichas)",
      "Asiento 2: SrLyce (1.92 € en fichas)",
      "Asiento 3: Jumby34 (2.03 € en fichas)",
      "Asiento 4: xapkk (2 € en fichas)",
      "Asiento 5: samaritano34 (1.90 € en fichas)",
      "Asiento 6: Fretzo67500 (2.36 € en fichas)",
      "samaritano34: pone la ciega pequeña 0.01 €",
      "Fretzo67500: pone la ciega grande 0.02 €",
      "riverrrrrrmagic: iguala 0.02 €",
      "SrLyce: se retira",
      "Jumby34: se retira",
      "xapkk: se retira",
      "samaritano34: se retira",
      "Fretzo67500: sube 0.14 € a 0.16 €",
      "riverrrrrrmagic: se retira",
      "Asiento 1: riverrrrrrmagic se retiró antes del Flop",
      "Asiento 2: SrLyce se retiró antes del Flop (no apostó)",
      "Asiento 3: Jumby34 se retiró antes del Flop (no apostó)",
      "Asiento 4: xapkk (botón) se retiró antes del Flop (no apostó)",
      "Asiento 5: samaritano34 (ciega pequeña) se retiró antes del Flop",
      "Asiento 6: Fretzo67500 (ciega grande) recaudó (0.05 €)"
    ],
    "flop": [],
    "turn": [],
    "river": []
  },
  "board": [],
  "winner": "Fretzo67500",
  "win_amount": 2.5,
  "sb": 0.01,
  "bb": 0.02,
  "rake": 0.0,
  "raw_text": "Mano n.º 257150111214 de PokerStars:  Hold'em No Limit (0.01 €/0.02 € EUR) - 30-07-2025 23:19:04 CET [30-07-2025 17:19:04 ET]\nMesa \"Gilgamesh\" 6-max El asiento n.º 4 es el botón\nAsiento 1: riverrrrrrmagic (2.55 € en fichas) \nAsiento 2: SrLyce (1.92 € en fichas) \nAsiento 3: Jumby34 (2.03 € en fichas) \nAsiento 4: xapkk (2 € en fichas) \nAsiento 5: samaritano34 (1.90 € en fichas) \nAsiento 6: Fretzo67500 (2.36 € en fichas) \nsamaritano34: pone la ciega pequeña 0.01 €\nFretzo67500: pone la ciega grande 0.02 €\n*** CARTAS DE MANO ***\nRepartidas a SrLyce [Jd 7c]\nriverrrrrrmagic: iguala 0.02 €\nSrLyce: se retira \nJumby34: se retira \nxapkk: se retira \nsamaritano34: se retira \nFretzo67500: sube 0.14 € a 0.16 €\nriverrrrrrmagic: se retira \nLa apuesta no igualada (0.14 €) ha sido devuelta a Fretzo67500\nFretzo67500 se lleva 0.05 € del bote \n*** RESUMEN ***\nBote total 0.05 € | Comisión 0 € \nAsiento 1: riverrrrrrmagic se retiró antes del Flop\nAsiento 2: SrLyce se retiró antes del Flop (no apostó)\nAsiento 3: Jumby34 se retiró antes del Flop (no apostó)\nAsiento 4: xapkk (botón) se retiró antes del Flop (no apostó)\nAsiento 5: samaritano34 (ciega pequeña) se retiró antes del Flop\nAsiento 6: Fretzo67500 (ciega grande) recaudó (0.05 €)"
}