{
  "hand_id": "257238133296",
  "date": "06-08-2025 18:31:01",
  "table": "Atreus",
  "game_type": "holdem",
  "hero": "SrLyce",
  "hero_position": "",
  "hero_cards": [
    "3s",
    "Kd"
  ],
  "stacks": {
    "PrendsCa": 100.5,
    "NRules82": 36.0,
    "JENOFONTE73": 165.0,
    "Fharock": 94.5,
    "SrLyce": 123.0,
    "FishamanReggae": 27.0
  },
  "actions": {
    "preflop": [
      "Asiento 1: PrendsCa (2.01 € en fichas)",
      "Asiento 2: NRules82 (0.72 € en fichas)",
      "Asiento 3: JENOFONTE73 (3.30 € en fichas)",
      "Asiento 4: Fharock (1.89 € en fichas)",
      "Asiento 5: SrLyce (2.46 € en fichas)",
      "Asiento 6: FishamanReggae (0.54 € en fichas)",
      "FishamanReggae: pone la ciega pequeña 0.01 €",
      "PrendsCa: pone la ciega grande 0.02 €",
      "NRules82: se retira",
      "JENOFONTE73: se retira",
      "Fharock: se retira",
      "SrLyce: se retira",
      "FishamanReggae: iguala 0.01 €",
      "PrendsCa: pasa"
    ],
    "flop": [
      "FishamanReggae: pasa",
      "PrendsCa: apuesta 0.02 €",
      "FishamanReggae: se retira",
      "PrendsCa: no muestra su mano",
      "Asiento 1: PrendsCa (ciega grande) recaudó (0.04 €)",
      "Asiento 2: NRules82 se retiró antes del Flop (no apostó)",
      "Asiento 3: JENOFONTE73 se retiró antes del Flop (no apostó)",
      "Asiento 4: Fharock se retiró antes del Flop (no apostó)",
      "Asiento 5: SrLyce (botón) se retiró antes del Flop (no apostó)",
      "Asiento 6: FishamanReggae (ciega pequeña) se retiró en el Flop"
    ],
    "turn": [],
    "river": []
  },
  "board": [
    "Js",
    "Td",
    "Kh"
  ],
  "winner": "PrendsCa",
  "win_amount": 2.0,
  "sb": 0.01,
  "bb": 0.02,
  "rake": 0.0,
  "raw_text": "Mano n.º 257238133296 de PokerStars:  Hold'em No Limit (0.01 €/0.02 € EUR) - 06-08-2025 18:31:01 CET [06-08-2025 12:31:01 ET]\nMesa \"Atreus\" 6-max El asiento n.º 5 es el botón\nAsiento 1: PrendsCa (2.01 € en fichas) \nAsiento 2: NRules82 (0.72 € en fichas) \nAsiento 3: JENOFONTE73 (3.30 € en fichas) \nAsiento 4: Fharock (1.89 € en fichas) \nAsiento 5: SrLyce (2.46 € en fichas) \nAsiento 6: FishamanReggae (0.54 € en fichas) \nFishamanReggae: pone la ciega pequeña 0.01 €\nPrendsCa: pone la ciega grande 0.02 €\n*** CARTAS DE MANO ***\nRepartidas a SrLyce [3s Kd]\nNRules82: se retira \nJENOFONTE73: se retira \nFharock: se retira \nSrLyce: se retira \nFishamanReggae: iguala 0.01 €\nPrendsCa: pasa \n*** FLOP *** [Js Td Kh]\nFishamanReggae: pasa \nPrendsCa: apuesta 0.02 €\nFishamanReggae: se retira \nLa apuesta no igualada (0.02 €) ha sido devuelta a PrendsCa\nPrendsCa se lleva 0.04 € del bote \nPrendsCa: no muestra su mano \n*** RESUMEN ***\nBote total 0.04 € | Comisión 0 € \nComunitarias [Js Td Kh]\nAsiento 1: PrendsCa (ciega grande) recaudó (0.04 €)\nAsiento 2: NRules82 se retiró antes del Flop (no apostó)\nAsiento 3: JENOFONTE73 se retiró antes del Flop (no apostó)\nAsiento 4: Fharock se retiró antes del Flop (no apostó)\nAsiento 5: SrLyce (botón) se retiró antes del Flop (no apostó)\nAsiento 6: FishamanReggae (ciega pequeña) se retiró en el Flop"
}