{
  "hand_id": "257190036798",
  "date": "03-08-2025 1:04:09",
  "table": "Tamariwa",
  "game_type": "holdem",
  "hero": "SrLyce",
  "hero_position": "",
  "hero_cards": [
    "5d",
    "9c"
  ],
  "stacks": {
    "datmawi": 60.5,
    "BluesMyWay": 216.0,
    "arthurtfa": 33.0,
    "toonsy2010": 167.0,
    "SrLyce": 110.5,
    "DiaZzZ1": 143.5
  },
  "actions": {
    "preflop": [
      "Asiento 1: datmawi (1.21 € en fichas)",
      "Asiento 2: BluesMyWay (4.32 € en fichas)",
      "Asiento 3: arthurtfa (0.66 € en fichas)",
      "Asiento 4: toonsy2010 (3.34 € en fichas)",
      "Asiento 5: SrLyce (2.21 € en fichas)",
      "Asiento 6: DiaZzZ1 (2.87 € en fichas)",
      "DiaZzZ1: pone la ciega pequeña 0.01 €",
      "datmawi: pone la ciega grande 0.02 €",
      "BluesMyWay: se retira",
      "arthurtfa: se retira",
      "toonsy2010: sube 0.06 € a 0.08 €",
      "SrLyce: se retira",
      "DiaZzZ1: se retira",
      "datmawi: se retira",
      "toonsy2010: no muestra su mano",
      "Asiento 1: datmawi (ciega grande) se retiró antes del Flop",
      "Asiento 2: BluesMyWay se retiró antes del Flop (no apostó)",
      "Asiento 3: arthurtfa se retiró antes del Flop (no apostó)",
      "Asiento 4: toonsy2010 recaudó (0.05 €)",
      "Asiento 5: SrLyce (botón) se retiró antes del Flop (no apostó)",
      "Asiento 6: DiaZzZ1 (ciega pequeña) se retiró antes del Flop"
    ],
    "flop": [],
    "turn": [],
    "river": []
  },
  "board": [],
  "winner": "toonsy2010",
  "win_amount": 2.5,
  "sb": 0.01,
  "bb": 0.02,
  "rake": 0.0,
  "raw_text": "Mano n.º 257190036798 de PokerStars:  Hold'em No Limit (0.01 €/0.02 € EUR) - 03-08-2025 1:04:09 CET [02-08-2025 19:04:09 ET]\nMesa \"Tamariwa\" 6-max El asiento n.º 5 es el botón\nAsiento 1: datmawi (1.21 € en fichas) \nAsiento 2: BluesMyWay (4.32 € en fichas) \nAsiento 3: arthurtfa (0.66 € en fichas) \nAsiento 4: toonsy2010 (3.34 € en fichas) \nAsiento 5: SrLyce (2.21 € en fichas) \nAsiento 6: DiaZzZ1 (2.87 € en fichas) \nDiaZzZ1: pone la ciega pequeña 0.01 €\ndatmawi: pone la ciega grande 0.02 €\n*** CARTAS DE MANO ***\nRepartidas a SrLyce [5d 9c]\nBluesMyWay: se retira \narthurtfa: se retira \ntoonsy2010: sube 0.06 € a 0.08 €\nSrLyce: se retira \nDiaZzZ1: se retira \ndatmawi: se retira \nLa apuesta no igualada (0.06 €) ha sido devuelta a toonsy2010\ntoonsy2010 se lleva 0.05 € del bote \ntoonsy2010: no muestra su mano \n*** RESUMEN ***\nBote total 0.05 € | Comisión 0 € \nAsiento 1: datmawi (ciega grande) se retiró antes del Flop\nAsiento 2: BluesMyWay se retiró antes del Flop (no apostó)\nAsiento 3: arthurtfa se retiró antes del Flop (no apostó)\nAsiento 4: toonsy2010 recaudó (0.05 €)\nAsiento 5: SrLyce (botón) se retiró antes del Flop (no apostó)\nAsiento 6: DiaZzZ1 (ciega pequeña) se retiró antes del Flop"
}