{
  "hand_id": "257168387275",
  "date": "01-08-2025 11:38:30",
  "table": "Atlas",
  "game_type": "holdem",
  "hero": "SrLyce",
  "hero_position": "",
  "hero_cards": [
    "7d",
    "Ah"
  ],
  "stacks": {
    "SrLyce": 119.0,
    "Fharock": 109.5,
    "ecuinas": 90.0,
    "LxckxStrxkx": 100.0,
    "soy_cule74": 100.0,
    "Akourdideh": 110.5
  },
  "actions": {
    "preflop": [
      "Asiento 1: SrLyce (2.38 € en fichas)",
      "Asiento 2: Fharock (2.19 € en fichas)",
      "Asiento 3: ecuinas (1.80 € en fichas)",
      "Asiento 4: LxckxStrxkx (2 € en fichas)",
      "Asiento 5: soy_cule74 (2 € en fichas)",
      "Asiento 6: Akourdideh (2.21 € en fichas)",
      "ecuinas: pone la ciega pequeña 0.01 €",
      "LxckxStrxkx: pone la ciega grande 0.02 €",
      "soy_cule74: se retira",
      "Akourdideh: sube 0.04 € a 0.06 €",
      "SrLyce: iguala 0.06 €",
      "Fharock: se retira",
      "ecuinas: se retira",
      "LxckxStrxkx: se retira"
    ],
    "flop": [
      "Akourdideh: apuesta 0.07 €",
      "SrLyce: se retira",
      "Asiento 1: SrLyce se retiró en el Flop",
      "Asiento 2: Fharock (botón) se retiró antes del Flop (no apostó)",
      "Asiento 3: ecuinas (ciega pequeña) se retiró antes del Flop",
      "Asiento 4: LxckxStrxkx (ciega grande) se retiró antes del Flop",
      "Asiento 5: soy_cule74 se retiró antes del Flop (no apostó)",
      "Asiento 6: Akourdideh recaudó (0.14 €)"
    ],
    "turn": [],
    "river": []
  },
  "board": [
    "Jc",
    "Tc",
    "Td"
  ],
  "winner": "Akourdideh",
  "win_amount": 7.0,
  "sb": 0.01,
  "bb": 0.02,
  "rake": 0.5,
  "raw_text": "Mano n.º 257168387275 de PokerStars:  Hold'em No Limit (0.01 €/0.02 € EUR) - 01-08-2025 11:38:30 CET [01-08-2025 5:38:30 ET]\nMesa \"Atlas\" 6-max El asiento n.º 2 es el botón\nAsiento 1: SrLyce (2.38 € en fichas) \nAsiento 2: Fharock (2.19 € en fichas) \nAsiento 3: ecuinas (1.80 € en fichas) \nAsiento 4: LxckxStrxkx (2 € en fichas) \nAsiento 5: soy_cule74 (2 € en fichas) \nAsiento 6: Akourdideh (2.21 € en fichas) \necuinas: pone la ciega pequeña 0.01 €\nLxckxStrxkx: pone la ciega grande 0.02 €\n*** CARTAS DE MANO ***\nRepartidas a SrLyce [7d Ah]\nsoy_cule74: se retira \nAkourdideh: sube 0.04 € a 0.06 €\nSrLyce: iguala 0.06 €\nFharock ha agotado su tiempo\nFharock: se retira \necuinas: se retira \nLxckxStrxkx: se retira \n*** FLOP *** [Jc Tc Td]\nAkourdideh: apuesta 0.07 €\nSrLyce: se retira \nLa apuesta no igualada (0.07 €) ha sido devuelta a Akourdideh\nAkourdideh se lleva 0.14 € del bote \n*** RESUMEN ***\nBote total 0.15 € | Comisión 0.01 € \nComunitarias [Jc Tc Td]\nAsiento 1: SrLyce se retiró en el Flop\nAsiento 2: Fharock (botón) se retiró antes del Flop (no apostó)\nAsiento 3: ecuinas (ciega pequeña) se retiró antes del Flop\nAsiento 4: LxckxStrxkx (ciega grande) se retiró antes del Flop\nAsiento 5: soy_cule74 se retiró antes del Flop (no apostó)\nAsiento 6: Akourdideh recaudó (0.14 €)"
}