{
  "hand_id": "257237719940",
  "date": "06-08-2025 17:51:26",
  "table": "Euneus III",
  "game_type": "holdem",
  "hero": "SrLyce",
  "hero_position": "",
  "hero_cards": [
    "7d",
    "3d"
  ],
  "stacks": {
    "DeMula62": 100.0,
    "Il_BM00": 106.5,
    "djrojas9": 151.5,
    "eleuvehache": 98.5,
    "SrLyce": 99.0,
    "t053n": 69.0
  },
  "actions": {
    "preflop": [
      "Asiento 1: DeMula62 (2 € en fichas) está ausente",
      "Asiento 2: Il_BM00 (2.13 € en fichas)",
      "Asiento 3: djrojas9 (3.03 € en fichas)",
      "Asiento 4: eleuvehache (1.97 € en fichas)",
      "Asiento 5: SrLyce (1.98 € en fichas)",
      "Asiento 6: t053n (1.38 € en fichas)",
      "SrLyce: pone la ciega pequeña 0.01 €",
      "t053n: pone la ciega grande 0.02 €",
      "DeMula62: se ausenta",
      "Il_BM00: se retira",
      "djrojas9: se retira",
      "eleuvehache: sube 0.02 € a 0.04 €",
      "SrLyce: se retira",
      "t053n: iguala 0.02 €"
    ],
    "flop": [
      "t053n: pasa",
      "eleuvehache: apuesta 0.02 €",
      "t053n: iguala 0.02 €"
    ],
    "turn": [
      "t053n: apuesta 0.10 €",
      "eleuvehache: se retira",
      "Asiento 1: DeMula62",
      "Asiento 2: Il_BM00 se retiró antes del Flop (no apostó)",
      "Asiento 3: djrojas9 se retiró antes del Flop (no apostó)",
      "Asiento 4: eleuvehache (botón) se retiró en el Turn",
      "Asiento 5: SrLyce (ciega pequeña) se retiró antes del Flop",
      "Asiento 6: t053n (ciega grande) recaudó (0.12 €)"
    ],
    "river": []
  },
  "board": [
    "9h",
    "3s",
    "3c",
    "4h"
  ],
  "winner": "t053n",
  "win_amount": 6.0,
  "sb": 0.01,
  "bb": 0.02,
  "rake": 0.5,
  "raw_text": "Mano n.º 257237719940 de PokerStars:  Hold'em No Limit (0.01 €/0.02 € EUR) - 06-08-2025 17:51:26 CET [06-08-2025 11:51:26 ET]\nMesa \"Euneus III\" 6-max El asiento n.º 4 es el botón\nAsiento 1: DeMula62 (2 € en fichas) está ausente\nAsiento 2: Il_BM00 (2.13 € en fichas) \nAsiento 3: djrojas9 (3.03 € en fichas) \nAsiento 4: eleuvehache (1.97 € en fichas) \nAsiento 5: SrLyce (1.98 € en fichas) \nAsiento 6: t053n (1.38 € en fichas) \nSrLyce: pone la ciega pequeña 0.01 €\nt053n: pone la ciega grande 0.02 €\nDeMula62: se ausenta \n*** CARTAS DE MANO ***\nRepartidas a SrLyce [7d 3d]\nIl_BM00: se retira \ndjrojas9: se retira \neleuvehache: sube 0.02 € a 0.04 €\nSrLyce: se retira \nt053n: iguala 0.02 €\n*** FLOP *** [9h 3s 3c]\nt053n: pasa \neleuvehache: apuesta 0.02 €\nt053n: iguala 0.02 €\n*** TURN *** [9h 3s 3c] [4h]\nt053n: apuesta 0.10 €\neleuvehache: se retira \nLa apuesta no igualada (0.10 €) ha sido devuelta a t053n\nt053n se lleva 0.12 € del bote \n*** RESUMEN ***\nBote total 0.13 € | Comisión 0.01 € \nComunitarias [9h 3s 3c 4h]\nAsiento 1: DeMula62\nAsiento 2: Il_BM00 se retiró antes del Flop (no apostó)\nAsiento 3: djrojas9 se retiró antes del Flop (no apostó)\nAsiento 4: eleuvehache (botón) se retiró en el Turn\nAsiento 5: SrLyce (ciega pequeña) se retiró antes del Flop\nAsiento 6: t053n (ciega grande) recaudó (0.12 €)"
}