{
  "hand_id": "257168283600",
  "date": "01-08-2025 11:19:17",
  "table": "Atlas",
  "game_type": "holdem",
  "hero": "SrLyce",
  "hero_position": "",
  "hero_cards": [
    "Kh",
    "9h"
  ],
  "stacks": {
    "SrLyce": 93.5,
    "Fharock": 92.0,
    "ecuinas": 98.5,
    "LxckxStrxkx": 100.0,
    "erCampos23": 42.0,
    "Akourdideh": 116.0
  },
  "actions": {
    "preflop": [
      "Asiento 1: SrLyce (1.87 € en fichas)",
      "Asiento 2: Fharock (1.84 € en fichas)",
      "Asiento 3: ecuinas (1.97 € en fichas)",
      "Asiento 4: LxckxStrxkx (2 € en fichas)",
      "Asiento 5: erCampos23 (0.84 € en fichas)",
      "Asiento 6: Akourdideh (2.32 € en fichas)",
      "SrLyce: pone la ciega pequeña 0.01 €",
      "Fharock: pone la ciega grande 0.02 €",
      "ecuinas: se retira",
      "LxckxStrxkx: sube 0.04 € a 0.06 €",
      "erCampos23: iguala 0.06 €",
      "Akourdideh: se retira",
      "SrLyce: iguala 0.05 €",
      "Fharock: se retira"
    ],
    "flop": [
      "SrLyce: pasa",
      "LxckxStrxkx: apuesta 0.08 €",
      "erCampos23: se retira",
      "SrLyce: se retira",
      "LxckxStrxkx: no muestra su mano",
      "Asiento 1: SrLyce (ciega pequeña) se retiró en el Flop",
      "Asiento 2: Fharock (ciega grande) se retiró antes del Flop",
      "Asiento 3: ecuinas se retiró antes del Flop (no apostó)",
      "Asiento 4: LxckxStrxkx recaudó (0.19 €)",
      "Asiento 5: erCampos23 se retiró en el Flop",
      "Asiento 6: Akourdideh (botón) se retiró antes del Flop (no apostó)"
    ],
    "turn": [],
    "river": []
  },
  "board": [
    "Qd",
    "Ac",
    "8d"
  ],
  "winner": "LxckxStrxkx",
  "win_amount": 9.5,
  "sb": 0.01,
  "bb": 0.02,
  "rake": 0.5,
  "raw_text": "Mano n.º 257168283600 de PokerStars:  Hold'em No Limit (0.01 €/0.02 € EUR) - 01-08-2025 11:19:17 CET [01-08-2025 5:19:17 ET]\nMesa \"Atlas\" 6-max El asiento n.º 6 es el botón\nAsiento 1: SrLyce (1.87 € en fichas) \nAsiento 2: Fharock (1.84 € en fichas) \nAsiento 3: ecuinas (1.97 € en fichas) \nAsiento 4: LxckxStrxkx (2 € en fichas) \nAsiento 5: erCampos23 (0.84 € en fichas) \nAsiento 6: Akourdideh (2.32 € en fichas) \nSrLyce: pone la ciega pequeña 0.01 €\nFharock: pone la ciega grande 0.02 €\n*** CARTAS DE MANO ***\nRepartidas a SrLyce [Kh 9h]\necuinas: se retira \nLxckxStrxkx: sube 0.04 € a 0.06 €\nerCampos23: iguala 0.06 €\nAkourdideh: se retira \nSrLyce: iguala 0.05 €\nFharock: se retira \n*** FLOP *** [Qd Ac 8d]\nSrLyce: pasa \nLxckxStrxkx: apuesta 0.08 €\nerCampos23: se retira \nSrLyce: se retira \nLa apuesta no igualada (0.08 €) ha sido devuelta a LxckxStrxkx\nLxckxStrxkx se lleva 0.19 € del bote \nLxckxStrxkx: no muestra su mano \n*** RESUMEN ***\nBote total 0.20 € | Comisión 0.01 € \nComunitarias [Qd Ac 8d]\nAsiento 1: SrLyce (ciega pequeña) se retiró en el Flop\nAsiento 2: Fharock (ciega grande) se retiró antes del Flop\nAsiento 3: ecuinas se retiró antes del Flop (no apostó)\nAsiento 4: LxckxStrxkx recaudó (0.19 €)\nAsiento 5: erCampos23 se retiró en el Flop\nAsiento 6: Akourdideh (botón) se retiró antes del Flop (no apostó)"
}