{
  "hand_id": "257238315077",
  "date": "06-08-2025 18:47:06",
  "table": "Aidamina II",
  "game_type": "holdem",
  "hero": "SrLyce",
  "hero_position": "",
  "hero_cards": [
    "9h",
    "9s"
  ],
  "stacks": {
    "GarciaTT416": 100.0,
    "McFlash3": 103.0,
    "niyomalo": 126.5,
    "durahimovic": 127.5,
    "JustWin9960": 108.0,
    "SrLyce": 88.5
  },
  "actions": {
    "preflop": [
      "Asiento 1: GarciaTT416 (2 € en fichas)",
      "Asiento 2: McFlash3 (2.06 € en fichas)",
      "Asiento 3: niyomalo (2.53 € en fichas)",
      "Asiento 4: durahimovic (2.55 € en fichas)",
      "Asiento 5: JustWin9960 (2.16 € en fichas)",
      "Asiento 6: SrLyce (1.77 € en fichas)",
      "McFlash3: pone la ciega pequeña 0.01 €",
      "niyomalo: pone la ciega grande 0.02 €",
      "durahimovic: sube 0.04 € a 0.06 €",
      "JustWin9960: se retira",
      "SrLyce: iguala 0.06 €",
      "GarciaTT416: se retira",
      "McFlash3: se retira",
      "niyomalo: se retira"
    ],
    "flop": [
      "durahimovic: apuesta 0.05 €",
      "SrLyce: iguala 0.05 €"
    ],
    "turn": [
      "durahimovic: apuesta 0.21 €",
      "SrLyce: se retira",
      "durahimovic: no muestra su mano",
      "Asiento 1: GarciaTT416 (botón) se retiró antes del Flop (no apostó)",
      "Asiento 2: McFlash3 (ciega pequeña) se retiró antes del Flop",
      "Asiento 3: niyomalo (ciega grande) se retiró antes del Flop",
      "Asiento 4: durahimovic recaudó (0.23 €)",
      "Asiento 5: JustWin9960 se retiró antes del Flop (no apostó)",
      "Asiento 6: SrLyce se retiró en el Turn"
    ],
    "river": []
  },
  "board": [
    "Ac",
    "7d",
    "3s",
    "6h"
  ],
  "winner": "durahimovic",
  "win_amount": 11.5,
  "sb": 0.01,
  "bb": 0.02,
  "rake": 1.0,
  "raw_text": "Mano n.º 257238315077 de PokerStars:  Hold'em No Limit (0.01 €/0.02 € EUR) - 06-08-2025 18:47:06 CET [06-08-2025 12:47:06 ET]\nMesa \"Aidamina II\" 6-max El asiento n.º 1 es el botón\nAsiento 1: GarciaTT416 (2 € en fichas) \nAsiento 2: McFlash3 (2.06 € en fichas) \nAsiento 3: niyomalo (2.53 € en fichas) \nAsiento 4: durahimovic (2.55 € en fichas) \nAsiento 5: JustWin9960 (2.16 € en fichas) \nAsiento 6: SrLyce (1.77 € en fichas) \nMcFlash3: pone la ciega pequeña 0.01 €\nniyomalo: pone la ciega grande 0.02 €\n*** CARTAS DE MANO ***\nRepartidas a SrLyce [9h 9s]\ndurahimovic: sube 0.04 € a 0.06 €\nJustWin9960: se retira \nSrLyce: iguala 0.06 €\nGarciaTT416: se retira \nMcFlash3: se retira \nniyomalo: se retira \n*** FLOP *** [Ac 7d 3s]\ndurahimovic: apuesta 0.05 €\nSrLyce: iguala 0.05 €\n*** TURN *** [Ac 7d 3s] [6h]\ndurahimovic: apuesta 0.21 €\nSrLyce: se retira \nLa apuesta no igualada (0.21 €) ha sido devuelta a durahimovic\ndurahimovic se lleva 0.23 € del bote \ndurahimovic: no muestra su mano \n*** RESUMEN ***\nBote total 0.25 € | Comisión 0.02 € \nComunitarias [Ac 7d 3s 6h]\nAsiento 1: GarciaTT416 (botón) se retiró antes del Flop (no apostó)\nAsiento 2: McFlash3 (ciega pequeña) se retiró antes del Flop\nAsiento 3: niyomalo (ciega grande) se retiró antes del Flop\nAsiento 4: durahimovic recaudó (0.23 €)\nAsiento 5: JustWin9960 se retiró antes del Flop (no apostó)\nAsiento 6: SrLyce se retiró en el Turn"
}