{
  "hand_id": "257190011710",
  "date": "03-08-2025 1:02:02",
  "table": "Polydoros II",
  "game_type": "holdem",
  "hero": "SrLyce",
  "hero_position": "",
  "hero_cards": [
    "4s",
    "5s"
  ],
  "stacks": {
    "SrLyce": 144.0,
    "djulkk421": 80.5
  },
  "actions": {
    "preflop": [
      "Asiento 4: SrLyce (2.88 € en fichas)",
      "Asiento 6: djulkk421 (1.61 € en fichas)",
      "SrLyce: pone la ciega pequeña 0.01 €",
      "djulkk421: pone la ciega grande 0.02 €",
      "SrLyce: sube 0.04 € a 0.06 €",
      "djulkk421: se retira",
      "SrLyce: no muestra su mano",
      "Asiento 4: SrLyce (botón) (ciega pequeña) recaudó (0.04 €)",
      "Asiento 6: djulkk421 (ciega grande) se retiró antes del Flop"
    ],
    "flop": [],
    "turn": [],
    "river": []
  },
  "board": [],
  "winner": "SrLyce",
  "win_amount": 2.0,
  "sb": 0.01,
  "bb": 0.02,
  "rake": 0.0,
  "raw_text": "Mano n.º 257190011710 de PokerStars:  Hold'em No Limit (0.01 €/0.02 € EUR) - 03-08-2025 1:02:02 CET [02-08-2025 19:02:02 ET]\nMesa \"Polydoros II\" 6-max El asiento n.º 4 es el botón\nAsiento 4: SrLyce (2.88 € en fichas) \nAsiento 6: djulkk421 (1.61 € en fichas) \nSrLyce: pone la ciega pequeña 0.01 €\ndjulkk421: pone la ciega grande 0.02 €\n*** CARTAS DE MANO ***\nRepartidas a SrLyce [4s 5s]\nSrLyce: sube 0.04 € a 0.06 €\ndjulkk421: se retira \nLa apuesta no igualada (0.04 €) ha sido devuelta a SrLyce\nSrLyce se lleva 0.04 € del bote \nSrLyce: no muestra su mano \n*** RESUMEN ***\nBote total 0.04 € | Comisión 0 € \nAsiento 4: SrLyce (botón) (ciega pequeña) recaudó (0.04 €)\nAsiento 6: djulkk421 (ciega grande) se retiró antes del Flop"
}