{
  "hand_id": "257237030499",
  "date": "06-08-2025 17:33:06",
  "table": "Themisto III",
  "game_type": "holdem",
  "hero": "SrLyce",
  "hero_position": "",
  "hero_cards": [
    "Jh",
    "8c"
  ],
  "stacks": {
    "fred2d23po": 80.0,
    "elso253": 72.5,
    "SrLyce": 101.5,
    "idigon": 27.0,
    "mivipkr": 124.5,
    "marignamo": 96.0
  },
  "actions": {
    "preflop": [
      "Asiento 4: fred2d23po (1.60 € en fichas) está ausente",
      "Asiento 1: elso253 (1.45 € en fichas)",
      "Asiento 2: SrLyce (2.03 € en fichas)",
      "Asiento 3: idigon (0.54 € en fichas)",
      "Asiento 5: mivipkr (2.49 € en fichas)",
      "Asiento 6: marignamo (1.92 € en fichas)",
      "mivipkr: pone la ciega pequeña 0.01 €",
      "marignamo: pone la ciega grande 0.02 €",
      "elso253: sube 0.03 € a 0.05 €",
      "SrLyce: se retira",
      "idigon: iguala 0.05 €",
      "mivipkr: se retira",
      "marignamo: iguala 0.03 €"
    ],
    "flop": [
      "marignamo: pasa",
      "elso253: apuesta 0.08 €",
      "idigon: se retira",
      "marignamo: se retira",
      "elso253: no muestra su mano",
      "Asiento 4: fred2d23po",
      "Asiento 1: elso253 recaudó (0.15 €)",
      "Asiento 2: SrLyce se retiró antes del Flop (no apostó)",
      "Asiento 3: idigon (botón) se retiró en el Flop",
      "Asiento 5: mivipkr (ciega pequeña) se retiró antes del Flop",
      "Asiento 6: marignamo (ciega grande) se retiró en el Flop"
    ],
    "turn": [],
    "river": []
  },
  "board": [
    "4d",
    "7s",
    "9s"
  ],
  "winner": "elso253",
  "win_amount": 7.5,
  "sb": 0.01,
  "bb": 0.02,
  "rake": 0.5,
  "raw_text": "Mano n.º 257237030499 de PokerStars:  Hold'em No Limit (0.01 €/0.02 € EUR) - 06-08-2025 17:33:06 CET [06-08-2025 11:33:06 ET]\nMesa \"Themisto III\" 6-max El asiento n.º 3 es el botón\nAsiento 4: fred2d23po (1.60 € en fichas) está ausente\nAsiento 1: elso253 (1.45 € en fichas) \nAsiento 2: SrLyce (2.03 € en fichas) \nAsiento 3: idigon (0.54 € en fichas) \nAsiento 5: mivipkr (2.49 € en fichas) \nAsiento 6: marignamo (1.92 € en fichas) \nmivipkr: pone la ciega pequeña 0.01 €\nmarignamo: pone la ciega grande 0.02 €\n*** CARTAS DE MANO ***\nRepartidas a SrLyce [Jh 8c]\nelso253: sube 0.03 € a 0.05 €\nSrLyce: se retira \nidigon: iguala 0.05 €\nmivipkr: se retira \nmarignamo: iguala 0.03 €\n*** FLOP *** [4d 7s 9s]\nmarignamo: pasa \nelso253: apuesta 0.08 €\nidigon: se retira \nmarignamo: se retira \nLa apuesta no igualada (0.08 €) ha sido devuelta a elso253\nelso253 se lleva 0.15 € del bote \nelso253: no muestra su mano \n*** RESUMEN ***\nBote total 0.16 € | Comisión 0.01 € \nComunitarias [4d 7s 9s]\nAsiento 4: fred2d23po\nAsiento 1: elso253 recaudó (0.15 €)\nAsiento 2: SrLyce se retiró antes del Flop (no apostó)\nAsiento 3: idigon (botón) se retiró en el Flop\nAsiento 5: mivipkr (ciega pequeña) se retiró antes del Flop\nAsiento 6: marignamo (ciega grande) se retiró en el Flop"
}