{
  "hand_id": "257237939645",
  "date": "06-08-2025 18:13:43",
  "table": "Atreus",
  "game_type": "holdem",
  "hero": "SrLyce",
  "hero_position": "",
  "hero_cards": [
    "Qs",
    "Kd"
  ],
  "stacks": {
    "PrendsCa": 104.5,
    "NRules82": 79.0,
    "JENOFONTE73": 124.0,
    "Fharock": 110.5,
    "SrLyce": 95.5,
    "FishamanReggae": 33.0
  },
  "actions": {
    "preflop": [
      "Asiento 1: PrendsCa (2.09 € en fichas)",
      "Asiento 2: NRules82 (1.58 € en fichas)",
      "Asiento 3: JENOFONTE73 (2.48 € en fichas)",
      "Asiento 4: Fharock (2.21 € en fichas)",
      "Asiento 5: SrLyce (1.91 € en fichas)",
      "Asiento 6: FishamanReggae (0.66 € en fichas)",
      "NRules82: pone la ciega pequeña 0.01 €",
      "JENOFONTE73: pone la ciega grande 0.02 €",
      "Fharock: iguala 0.02 €",
      "SrLyce: sube 0.05 € a 0.07 €",
      "FishamanReggae: se retira",
      "PrendsCa: se retira",
      "NRules82: iguala 0.06 €",
      "JENOFONTE73: se retira",
      "Fharock: iguala 0.05 €"
    ],
    "flop": [
      "NRules82: pasa",
      "Fharock: pasa",
      "SrLyce: pasa"
    ],
    "turn": [
      "NRules82: apuesta 0.06 €",
      "Fharock: se retira",
      "SrLyce: iguala 0.06 €"
    ],
    "river": [
      "NRules82: pasa",
      "SrLyce: pasa",
      "NRules82: muestra [4c Ad] (doble pareja, dieces y sietes)",
      "SrLyce: descarta su mano sin mostrar",
      "Asiento 1: PrendsCa (botón) se retiró antes del Flop (no apostó)",
      "Asiento 2: NRules82 (ciega pequeña) muestra [4c Ad] y ganó (0.33 €) con doble pareja, dieces y sietes",
      "Asiento 3: JENOFONTE73 (ciega grande) se retiró antes del Flop",
      "Asiento 4: Fharock se retiró en el Turn",
      "Asiento 5: SrLyce descartó sin mostrar [Qs Kd]",
      "Asiento 6: FishamanReggae se retiró antes del Flop (no apostó)"
    ]
  },
  "board": [
    "Tc",
    "Td",
    "7c",
    "7s",
    "3c"
  ],
  "winner": "NRules82",
  "win_amount": 16.5,
  "sb": 0.01,
  "bb": 0.02,
  "rake": 1.0,
  "raw_text": "Mano n.º 257237939645 de PokerStars:  Hold'em No Limit (0.01 €/0.02 € EUR) - 06-08-2025 18:13:43 CET [06-08-2025 12:13:43 ET]\nMesa \"Atreus\" 6-max El asiento n.º 1 es el botón\nAsiento 1: PrendsCa (2.09 € en fichas) \nAsiento 2: NRules82 (1.58 € en fichas) \nAsiento 3: JENOFONTE73 (2.48 € en fichas) \nAsiento 4: Fharock (2.21 € en fichas) \nAsiento 5: SrLyce (1.91 € en fichas) \nAsiento 6: FishamanReggae (0.66 € en fichas) \nNRules82: pone la ciega pequeña 0.01 €\nJENOFONTE73: pone la ciega grande 0.02 €\n*** CARTAS DE MANO ***\nRepartidas a SrLyce [Qs Kd]\nFharock: iguala 0.02 €\nSrLyce: sube 0.05 € a 0.07 €\nFishamanReggae: se retira \nPrendsCa: se retira \nNRules82: iguala 0.06 €\nJENOFONTE73: se retira \nFharock: iguala 0.05 €\n*** FLOP *** [Tc Td 7c]\nNRules82: pasa \nFharock: pasa \nSrLyce: pasa \n*** TURN *** [Tc Td 7c] [7s]\nNRules82: apuesta 0.06 €\nFharock: se retira \nSrLyce: iguala 0.06 €\n*** RIVER *** [Tc Td 7c 7s] [3c]\nNRules82: pasa \nSrLyce: pasa \n*** SHOW DOWN ***\nNRules82: muestra [4c Ad] (doble pareja, dieces y sietes)\nSrLyce: descarta su mano sin mostrar \nNRules82 se lleva 0.33 € del bote \n*** RESUMEN ***\nBote total 0.35 € | Comisión 0.02 € \nComunitarias [Tc Td 7c 7s 3c]\nAsiento 1: PrendsCa (botón) se retiró antes del Flop (no apostó)\nAsiento 2: NRules82 (ciega pequeña) muestra [4c Ad] y ganó (0.33 €) con doble pareja, dieces y sietes\nAsiento 3: JENOFONTE73 (ciega grande) se retiró antes del Flop\nAsiento 4: Fharock se retiró en el Turn\nAsiento 5: SrLyce descartó sin mostrar [Qs Kd]\nAsiento 6: FishamanReggae se retiró antes del Flop (no apostó)"
}