{
  "hand_id": "257168409496",
  "date": "01-08-2025 11:42:31",
  "table": "Jupiter",
  "game_type": "holdem",
  "hero": "SrLyce",
  "hero_position": "",
  "hero_cards": [
    "4h",
    "9s"
  ],
  "stacks": {
    "Tuerno": 100.0,
    "sifilis5": 98.5,
    "SrLyce": 112.5,
    "LOLA19711971": 43.5,
    "dadou13mars": 207.5,
    "Alvii37": 130.5
  },
  "actions": {
    "preflop": [
      "Asiento 2: Tuerno (2 € en fichas) está ausente",
      "Asiento 1: sifilis5 (1.97 € en fichas)",
      "Asiento 3: SrLyce (2.25 € en fichas)",
      "Asiento 4: LOLA19711971 (0.87 € en fichas)",
      "Asiento 5: dadou13mars (4.15 € en fichas)",
      "Asiento 6: Alvii37 (2.61 € en fichas)",
      "LOLA19711971: pone la ciega pequeña 0.01 €",
      "dadou13mars: pone la ciega grande 0.02 €",
      "Tuerno: se ausenta",
      "Alvii37: sube 0.04 € a 0.06 €",
      "sifilis5: se retira",
      "SrLyce: se retira",
      "LOLA19711971: iguala 0.05 €",
      "dadou13mars: se retira"
    ],
    "flop": [
      "LOLA19711971: pasa",
      "Alvii37: apuesta 0.04 €",
      "LOLA19711971: se retira",
      "Alvii37: no muestra su mano",
      "Asiento 2: Tuerno",
      "Asiento 1: sifilis5 se retiró antes del Flop (no apostó)",
      "Asiento 3: SrLyce (botón) se retiró antes del Flop (no apostó)",
      "Asiento 4: LOLA19711971 (ciega pequeña) se retiró en el Flop",
      "Asiento 5: dadou13mars (ciega grande) se retiró antes del Flop",
      "Asiento 6: Alvii37 recaudó (0.13 €)"
    ],
    "turn": [],
    "river": []
  },
  "board": [
    "Td",
    "Qc",
    "6h"
  ],
  "winner": "Alvii37",
  "win_amount": 6.5,
  "sb": 0.01,
  "bb": 0.02,
  "rake": 0.5,
  "raw_text": "Mano n.º 257168409496 de PokerStars:  Hold'em No Limit (0.01 €/0.02 € EUR) - 01-08-2025 11:42:31 CET [01-08-2025 5:42:31 ET]\nMesa \"Jupiter\" 6-max El asiento n.º 3 es el botón\nAsiento 2: Tuerno (2 € en fichas) está ausente\nAsiento 1: sifilis5 (1.97 € en fichas) \nAsiento 3: SrLyce (2.25 € en fichas) \nAsiento 4: LOLA19711971 (0.87 € en fichas) \nAsiento 5: dadou13mars (4.15 € en fichas) \nAsiento 6: Alvii37 (2.61 € en fichas) \nLOLA19711971: pone la ciega pequeña 0.01 €\ndadou13mars: pone la ciega grande 0.02 €\nTuerno: se ausenta \n*** CARTAS DE MANO ***\nRepartidas a SrLyce [4h 9s]\nAlvii37: sube 0.04 € a 0.06 €\nsifilis5: se retira \nSrLyce: se retira \nLOLA19711971: iguala 0.05 €\ndadou13mars: se retira \n*** FLOP *** [Td Qc 6h]\nLOLA19711971: pasa \nAlvii37: apuesta 0.04 €\nLOLA19711971: se retira \nLa apuesta no igualada (0.04 €) ha sido devuelta a Alvii37\nAlvii37 se lleva 0.13 € del bote \nAlvii37: no muestra su mano \n*** RESUMEN ***\nBote total 0.14 € | Comisión 0.01 € \nComunitarias [Td Qc 6h]\nAsiento 2: Tuerno\nAsiento 1: sifilis5 se retiró antes del Flop (no apostó)\nAsiento 3: SrLyce (botón) se retiró antes del Flop (no apostó)\nAsiento 4: LOLA19711971 (ciega pequeña) se retiró en el Flop\nAsiento 5: dadou13mars (ciega grande) se retiró antes del Flop\nAsiento 6: Alvii37 recaudó (0.13 €)"
}