{
  "hand_id": "257150575674",
  "date": "30-07-2025 23:51:53",
  "table": "Mizuho",
  "game_type": "holdem",
  "hero": "SrLyce",
  "hero_position": "",
  "hero_cards": [
    "Qh",
    "8h"
  ],
  "stacks": {
    "SrLyce": 260.0,
    "JstLeonel": 109.5,
    "Ozzy3110": 314.0,
    "toonsy2010": 90.0,
    "mivipkr": 105.5
  },
  "actions": {
    "preflop": [
      "Asiento 2: SrLyce (5.20 € en fichas)",
      "Asiento 3: JstLeonel (2.19 € en fichas)",
      "Asiento 4: Ozzy3110 (6.28 € en fichas)",
      "Asiento 5: toonsy2010 (1.80 € en fichas)",
      "Asiento 6: mivipkr (2.11 € en fichas)",
      "Ozzy3110: pone la ciega pequeña 0.01 €",
      "toonsy2010: pone la ciega grande 0.02 €",
      "mivipkr: se retira",
      "SrLyce: sube 0.04 € a 0.06 €",
      "JstLeonel: iguala 0.06 €",
      "Ozzy3110: se retira",
      "toonsy2010: se retira"
    ],
    "flop": [
      "SrLyce: pasa",
      "JstLeonel: pasa"
    ],
    "turn": [
      "SrLyce: pasa",
      "JstLeonel: apuesta 0.09 €",
      "SrLyce: se retira",
      "JstLeonel: no muestra su mano",
      "Asiento 2: SrLyce se retiró en el Turn",
      "Asiento 3: JstLeonel (botón) recaudó (0.14 €)",
      "Asiento 4: Ozzy3110 (ciega pequeña) se retiró antes del Flop",
      "Asiento 5: toonsy2010 (ciega grande) se retiró antes del Flop",
      "Asiento 6: mivipkr se retiró antes del Flop (no apostó)"
    ],
    "river": []
  },
  "board": [
    "Kc",
    "Js",
    "5h",
    "6d"
  ],
  "winner": "JstLeonel",
  "win_amount": 7.0,
  "sb": 0.01,
  "bb": 0.02,
  "rake": 0.5,
  "raw_text": "Mano n.º 257150575674 de PokerStars:  Hold'em No Limit (0.01 €/0.02 € EUR) - 30-07-2025 23:51:53 CET [30-07-2025 17:51:53 ET]\nMesa \"Mizuho\" 6-max El asiento n.º 3 es el botón\nAsiento 2: SrLyce (5.20 € en fichas) \nAsiento 3: JstLeonel (2.19 € en fichas) \nAsiento 4: Ozzy3110 (6.28 € en fichas) \nAsiento 5: toonsy2010 (1.80 € en fichas) \nAsiento 6: mivipkr (2.11 € en fichas) \nOzzy3110: pone la ciega pequeña 0.01 €\ntoonsy2010: pone la ciega grande 0.02 €\n*** CARTAS DE MANO ***\nRepartidas a SrLyce [Qh 8h]\nmivipkr: se retira \nlinceXXII se une a la mesa en el asiento n.º 1 \nSrLyce: sube 0.04 € a 0.06 €\nJstLeonel: iguala 0.06 €\nOzzy3110: se retira \ntoonsy2010: se retira \n*** FLOP *** [Kc Js 5h]\nSrLyce: pasa \nJstLeonel: pasa \n*** TURN *** [Kc Js 5h] [6d]\nSrLyce: pasa \nJstLeonel: apuesta 0.09 €\nSrLyce: se retira \nLa apuesta no igualada (0.09 €) ha sido devuelta a JstLeonel\nJstLeonel se lleva 0.14 € del bote \nJstLeonel: no muestra su mano \n*** RESUMEN ***\nBote total 0.15 € | Comisión 0.01 € \nComunitarias [Kc Js 5h 6d]\nAsiento 2: SrLyce se retiró en el Turn\nAsiento 3: JstLeonel (botón) recaudó (0.14 €)\nAsiento 4: Ozzy3110 (ciega pequeña) se retiró antes del Flop\nAsiento 5: toonsy2010 (ciega grande) se retiró antes del Flop\nAsiento 6: mivipkr se retiró antes del Flop (no apostó)"
}