{
  "hand_id": "257150388248",
  "date": "30-07-2025 23:38:17",
  "table": "Martha",
  "game_type": "holdem",
  "hero": "SrLyce",
  "hero_position": "",
  "hero_cards": [
    "7c",
    "5c"
  ],
  "stacks": {
    "alexfw300": 100.0,
    "mivipkr": 101.5,
    "NovacaineZxc": 126.5,
    "BudyXXIII": 104.0,
    "Sigiilo": 99.0,
    "SrLyce": 102.5
  },
  "actions": {
    "preflop": [
      "Asiento 6: alexfw300 (2 € en fichas) está ausente",
      "Asiento 1: mivipkr (2.03 € en fichas)",
      "Asiento 2: NovacaineZxc (2.53 € en fichas)",
      "Asiento 3: BudyXXIII (2.08 € en fichas)",
      "Asiento 4: Sigiilo (1.98 € en fichas)",
      "Asiento 5: SrLyce (2.05 € en fichas)",
      "Sigiilo: pone la ciega pequeña 0.01 €",
      "SrLyce: pone la ciega grande 0.02 €",
      "alexfw300: se ausenta",
      "mivipkr: se retira",
      "NovacaineZxc: se retira",
      "BudyXXIII: sube 0.03 € a 0.05 €",
      "Sigiilo: se retira",
      "SrLyce: iguala 0.03 €"
    ],
    "flop": [
      "SrLyce: pasa",
      "BudyXXIII: apuesta 0.05 €",
      "SrLyce: se retira",
      "BudyXXIII: no muestra su mano",
      "Asiento 6: alexfw300",
      "Asiento 1: mivipkr se retiró antes del Flop (no apostó)",
      "Asiento 2: NovacaineZxc se retiró antes del Flop (no apostó)",
      "Asiento 3: BudyXXIII (botón) recaudó (0.10 €)",
      "Asiento 4: Sigiilo (ciega pequeña) se retiró antes del Flop",
      "Asiento 5: SrLyce (ciega grande) se retiró en el Flop"
    ],
    "turn": [],
    "river": []
  },
  "board": [
    "5d",
    "Qh",
    "Kh"
  ],
  "winner": "BudyXXIII",
  "win_amount": 5.0,
  "sb": 0.01,
  "bb": 0.02,
  "rake": 0.5,
  "raw_text": "Mano n.º 257150388248 de PokerStars:  Hold'em No Limit (0.01 €/0.02 € EUR) - 30-07-2025 23:38:17 CET [30-07-2025 17:38:17 ET]\nMesa \"Martha\" 6-max El asiento n.º 3 es el botón\nAsiento 6: alexfw300 (2 € en fichas) está ausente\nAsiento 1: mivipkr (2.03 € en fichas) \nAsiento 2: NovacaineZxc (2.53 € en fichas) \nAsiento 3: BudyXXIII (2.08 € en fichas) \nAsiento 4: Sigiilo (1.98 € en fichas) \nAsiento 5: SrLyce (2.05 € en fichas) \nSigiilo: pone la ciega pequeña 0.01 €\nSrLyce: pone la ciega grande 0.02 €\nalexfw300: se ausenta \n*** CARTAS DE MANO ***\nRepartidas a SrLyce [7c 5c]\nmivipkr: se retira \nNovacaineZxc: se retira \nBudyXXIII: sube 0.03 € a 0.05 €\nSigiilo: se retira \nSrLyce: iguala 0.03 €\n*** FLOP *** [5d Qh Kh]\nSrLyce: pasa \nBudyXXIII: apuesta 0.05 €\nSrLyce: se retira \nLa apuesta no igualada (0.05 €) ha sido devuelta a BudyXXIII\nBudyXXIII se lleva 0.10 € del bote \nBudyXXIII: no muestra su mano \n*** RESUMEN ***\nBote total 0.11 € | Comisión 0.01 € \nComunitarias [5d Qh Kh]\nAsiento 6: alexfw300\nAsiento 1: mivipkr se retiró antes del Flop (no apostó)\nAsiento 2: NovacaineZxc se retiró antes del Flop (no apostó)\nAsiento 3: BudyXXIII (botón) recaudó (0.10 €)\nAsiento 4: Sigiilo (ciega pequeña) se retiró antes del Flop\nAsiento 5: SrLyce (ciega grande) se retiró en el Flop"
}