{
  "hand_id": "257238617993",
  "date": "06-08-2025 19:14:54",
  "table": "Adelaide III",
  "game_type": "holdem",
  "hero": "SrLyce",
  "hero_position": "",
  "hero_cards": [
    "Jc",
    "Qc"
  ],
  "stacks": {
    "Macklemore0": 106.5,
    "Alceo27": 100.0,
    "aliendee07": 69.5,
    "SrLyce": 138.5,
    "ismagonzalez7": 24.5
  },
  "actions": {
    "preflop": [
      "Asiento 3: Macklemore0 (2.13 € en fichas) está ausente",
      "Asiento 1: Alceo27 (2 € en fichas)",
      "Asiento 2: aliendee07 (1.39 € en fichas)",
      "Asiento 4: SrLyce (2.77 € en fichas)",
      "Asiento 5: ismagonzalez7 (0.49 € en fichas)",
      "ismagonzalez7: pone la ciega pequeña 0.01 €",
      "Alceo27: pone la ciega grande 0.02 €",
      "aliendee07: se retira",
      "SrLyce: sube 0.03 € a 0.05 €",
      "ismagonzalez7: iguala 0.04 €",
      "Alceo27: se retira"
    ],
    "flop": [
      "ismagonzalez7: pasa",
      "SrLyce: pasa"
    ],
    "turn": [
      "ismagonzalez7: apuesta 0.06 €",
      "SrLyce: iguala 0.06 €"
    ],
    "river": [
      "ismagonzalez7: apuesta 0.12 €",
      "SrLyce: se retira",
      "ismagonzalez7: no muestra su mano",
      "Asiento 3: Macklemore0",
      "Asiento 1: Alceo27 (ciega grande) se retiró antes del Flop",
      "Asiento 2: aliendee07 se retiró antes del Flop (no apostó)",
      "Asiento 4: SrLyce (botón) se retiró en el River",
      "Asiento 5: ismagonzalez7 (ciega pequeña) recaudó (0.23 €)"
    ]
  },
  "board": [
    "6d",
    "4h",
    "Kh",
    "Th",
    "3d"
  ],
  "winner": "ismagonzalez7",
  "win_amount": 11.5,
  "sb": 0.01,
  "bb": 0.02,
  "rake": 0.5,
  "raw_text": "Mano n.º 257238617993 de PokerStars:  Hold'em No Limit (0.01 €/0.02 € EUR) - 06-08-2025 19:14:54 CET [06-08-2025 13:14:54 ET]\nMesa \"Adelaide III\" 6-max El asiento n.º 4 es el botón\nAsiento 3: Macklemore0 (2.13 € en fichas) está ausente\nAsiento 1: Alceo27 (2 € en fichas) \nAsiento 2: aliendee07 (1.39 € en fichas) \nAsiento 4: SrLyce (2.77 € en fichas) \nAsiento 5: ismagonzalez7 (0.49 € en fichas) \nismagonzalez7: pone la ciega pequeña 0.01 €\nAlceo27: pone la ciega grande 0.02 €\n*** CARTAS DE MANO ***\nRepartidas a SrLyce [Jc Qc]\naliendee07: se retira \nSrLyce: sube 0.03 € a 0.05 €\nismagonzalez7: iguala 0.04 €\nAlceo27: se retira \n*** FLOP *** [6d 4h Kh]\nismagonzalez7: pasa \nSrLyce: pasa \n*** TURN *** [6d 4h Kh] [Th]\nismagonzalez7: apuesta 0.06 €\nSrLyce: iguala 0.06 €\n*** RIVER *** [6d 4h Kh Th] [3d]\nismagonzalez7: apuesta 0.12 €\nSrLyce: se retira \nLa apuesta no igualada (0.12 €) ha sido devuelta a ismagonzalez7\nismagonzalez7 se lleva 0.23 € del bote \nismagonzalez7: no muestra su mano \n*** RESUMEN ***\nBote total 0.24 € | Comisión 0.01 € \nComunitarias [6d 4h Kh Th 3d]\nAsiento 3: Macklemore0\nAsiento 1: Alceo27 (ciega grande) se retiró antes del Flop\nAsiento 2: aliendee07 se retiró antes del Flop (no apostó)\nAsiento 4: SrLyce (botón) se retiró en el River\nAsiento 5: ismagonzalez7 (ciega pequeña) recaudó (0.23 €)"
}