{
  "hand_id": "257238570866",
  "date": "06-08-2025 19:10:57",
  "table": "Leonteus",
  "game_type": "holdem",
  "hero": "SrLyce",
  "hero_position": "",
  "hero_cards": [
    "Kh",
    "2c"
  ],
  "stacks": {
    "BuXHexter": 145.5,
    "practikal_C23": 53.5,
    "durahimovic": 284.5,
    "davinci1962": 135.5,
    "Andark47": 187.0,
    "SrLyce": 99.5
  },
  "actions": {
    "preflop": [
      "Asiento 4: BuXHexter (2.91 € en fichas) está ausente",
      "Asiento 1: practikal_C23 (1.07 € en fichas)",
      "Asiento 2: durahimovic (5.69 € en fichas)",
      "Asiento 3: davinci1962 (2.71 € en fichas)",
      "Asiento 5: Andark47 (3.74 € en fichas)",
      "Asiento 6: SrLyce (1.99 € en fichas)",
      "Andark47: pone la ciega pequeña 0.01 €",
      "SrLyce: pone la ciega grande 0.02 €",
      "practikal_C23: se retira",
      "durahimovic: se retira",
      "davinci1962: se retira",
      "Andark47: se retira",
      "SrLyce: no muestra su mano",
      "Asiento 4: BuXHexter",
      "Asiento 1: practikal_C23 se retiró antes del Flop (no apostó)",
      "Asiento 2: durahimovic se retiró antes del Flop (no apostó)",
      "Asiento 3: davinci1962 (botón) se retiró antes del Flop (no apostó)",
      "Asiento 5: Andark47 (ciega pequeña) se retiró antes del Flop",
      "Asiento 6: SrLyce (ciega grande) recaudó (0.02 €)"
    ],
    "flop": [],
    "turn": [],
    "river": []
  },
  "board": [],
  "winner": "SrLyce",
  "win_amount": 1.0,
  "sb": 0.01,
  "bb": 0.02,
  "rake": 0.0,
  "raw_text": "Mano n.º 257238570866 de PokerStars:  Hold'em No Limit (0.01 €/0.02 € EUR) - 06-08-2025 19:10:57 CET [06-08-2025 13:10:57 ET]\nMesa \"Leonteus\" 6-max El asiento n.º 3 es el botón\nAsiento 4: BuXHexter (2.91 € en fichas) está ausente\nAsiento 1: practikal_C23 (1.07 € en fichas) \nAsiento 2: durahimovic (5.69 € en fichas) \nAsiento 3: davinci1962 (2.71 € en fichas) \nAsiento 5: Andark47 (3.74 € en fichas) \nAsiento 6: SrLyce (1.99 € en fichas) \nAndark47: pone la ciega pequeña 0.01 €\nSrLyce: pone la ciega grande 0.02 €\n*** CARTAS DE MANO ***\nRepartidas a SrLyce [Kh 2c]\npractikal_C23: se retira \ndurahimovic: se retira \ndavinci1962: se retira \nAndark47 ha agotado su tiempo\nAndark47: se retira \nLa apuesta no igualada (0.01 €) ha sido devuelta a SrLyce\nSrLyce se lleva 0.02 € del bote \nSrLyce: no muestra su mano \n*** RESUMEN ***\nBote total 0.02 € | Comisión 0 € \nAsiento 4: BuXHexter\nAsiento 1: practikal_C23 se retiró antes del Flop (no apostó)\nAsiento 2: durahimovic se retiró antes del Flop (no apostó)\nAsiento 3: davinci1962 (botón) se retiró antes del Flop (no apostó)\nAsiento 5: Andark47 (ciega pequeña) se retiró antes del Flop\nAsiento 6: SrLyce (ciega grande) recaudó (0.02 €)"
}