{
  "hand_id": "257237848703",
  "date": "06-08-2025 18:05:15",
  "table": "Nuwa III",
  "game_type": "holdem",
  "hero": "SrLyce",
  "hero_position": "",
  "hero_cards": [
    "Ah",
    "4d"
  ],
  "stacks": {
    "davinci1962": 124.0,
    "BuXHexter": 100.0,
    "kcg_rm": 104.5,
    "SrLyce": 97.0,
    "RiskAllinkali": 116.0,
    "acavada": 101.0
  },
  "actions": {
    "preflop": [
      "Asiento 1: davinci1962 (2.48 € en fichas)",
      "Asiento 2: BuXHexter (2 € en fichas)",
      "Asiento 3: kcg_rm (2.09 € en fichas)",
      "Asiento 4: SrLyce (1.94 € en fichas)",
      "Asiento 5: RiskAllinkali (2.32 € en fichas)",
      "Asiento 6: acavada (2.02 € en fichas)",
      "kcg_rm: pone la ciega pequeña 0.01 €",
      "SrLyce: pone la ciega grande 0.02 €",
      "RiskAllinkali: se retira",
      "acavada: se retira",
      "davinci1962: se retira",
      "BuXHexter: se retira",
      "kcg_rm: sube 0.04 € a 0.06 €",
      "SrLyce: iguala 0.04 €"
    ],
    "flop": [
      "kcg_rm: apuesta 0.04 €",
      "SrLyce: iguala 0.04 €"
    ],
    "turn": [
      "kcg_rm: apuesta 0.14 €",
      "SrLyce: se retira",
      "kcg_rm: no muestra su mano",
      "Asiento 1: davinci1962 se retiró antes del Flop (no apostó)",
      "Asiento 2: BuXHexter (botón) se retiró antes del Flop (no apostó)",
      "Asiento 3: kcg_rm (ciega pequeña) recaudó (0.19 €)",
      "Asiento 4: SrLyce (ciega grande) se retiró en el Turn",
      "Asiento 5: RiskAllinkali se retiró antes del Flop (no apostó)",
      "Asiento 6: acavada se retiró antes del Flop (no apostó)"
    ],
    "river": []
  },
  "board": [
    "2s",
    "2c",
    "Jh",
    "2h"
  ],
  "winner": "kcg_rm",
  "win_amount": 9.5,
  "sb": 0.01,
  "bb": 0.02,
  "rake": 0.5,
  "raw_text": "Mano n.º 257237848703 de PokerStars:  Hold'em No Limit (0.01 €/0.02 € EUR) - 06-08-2025 18:05:15 CET [06-08-2025 12:05:15 ET]\nMesa \"Nuwa III\" 6-max El asiento n.º 2 es el botón\nAsiento 1: davinci1962 (2.48 € en fichas) \nAsiento 2: BuXHexter (2 € en fichas) \nAsiento 3: kcg_rm (2.09 € en fichas) \nAsiento 4: SrLyce (1.94 € en fichas) \nAsiento 5: RiskAllinkali (2.32 € en fichas) \nAsiento 6: acavada (2.02 € en fichas) \nkcg_rm: pone la ciega pequeña 0.01 €\nSrLyce: pone la ciega grande 0.02 €\n*** CARTAS DE MANO ***\nRepartidas a SrLyce [Ah 4d]\nRiskAllinkali: se retira \nacavada: se retira \ndavinci1962: se retira \nBuXHexter: se retira \nkcg_rm: sube 0.04 € a 0.06 €\nSrLyce: iguala 0.04 €\n*** FLOP *** [2s 2c Jh]\nkcg_rm: apuesta 0.04 €\nSrLyce: iguala 0.04 €\n*** TURN *** [2s 2c Jh] [2h]\nkcg_rm: apuesta 0.14 €\nSrLyce: se retira \nLa apuesta no igualada (0.14 €) ha sido devuelta a kcg_rm\nkcg_rm se lleva 0.19 € del bote \nkcg_rm: no muestra su mano \n*** RESUMEN ***\nBote total 0.20 € | Comisión 0.01 € \nComunitarias [2s 2c Jh 2h]\nAsiento 1: davinci1962 se retiró antes del Flop (no apostó)\nAsiento 2: BuXHexter (botón) se retiró antes del Flop (no apostó)\nAsiento 3: kcg_rm (ciega pequeña) recaudó (0.19 €)\nAsiento 4: SrLyce (ciega grande) se retiró en el Turn\nAsiento 5: RiskAllinkali se retiró antes del Flop (no apostó)\nAsiento 6: acavada se retiró antes del Flop (no apostó)"
}