{
  "hand_id": "257168395500",
  "date": "01-08-2025 11:39:59",
  "table": "Atlas",
  "game_type": "holdem",
  "hero": "SrLyce",
  "hero_position": "",
  "hero_cards": [
    "6h",
    "5s"
  ],
  "stacks": {
    "SrLyce": 119.0,
    "Fharock": 109.5,
    "ecuinas": 89.5,
    "LxckxStrxkx": 100.0,
    "soy_cule74": 97.0,
    "Akourdideh": 114.5
  },
  "actions": {
    "preflop": [
      "Asiento 1: SrLyce (2.38 € en fichas)",
      "Asiento 2: Fharock (2.19 € en fichas)",
      "Asiento 3: ecuinas (1.79 € en fichas)",
      "Asiento 4: LxckxStrxkx (2 € en fichas)",
      "Asiento 5: soy_cule74 (1.94 € en fichas)",
      "Asiento 6: Akourdideh (2.29 € en fichas)",
      "soy_cule74: pone la ciega pequeña 0.01 €",
      "Akourdideh: pone la ciega grande 0.02 €",
      "SrLyce: se retira",
      "Fharock: sube 0.03 € a 0.05 €",
      "ecuinas: se retira",
      "LxckxStrxkx: se retira",
      "soy_cule74: se retira",
      "Akourdideh: se retira",
      "Fharock: no muestra su mano",
      "Asiento 1: SrLyce se retiró antes del Flop (no apostó)",
      "Asiento 2: Fharock recaudó (0.05 €)",
      "Asiento 3: ecuinas se retiró antes del Flop (no apostó)",
      "Asiento 4: LxckxStrxkx (botón) se retiró antes del Flop (no apostó)",
      "Asiento 5: soy_cule74 (ciega pequeña) se retiró antes del Flop",
      "Asiento 6: Akourdideh (ciega grande) se retiró antes del Flop"
    ],
    "flop": [],
    "turn": [],
    "river": []
  },
  "board": [],
  "winner": "Fharock",
  "win_amount": 2.5,
  "sb": 0.01,
  "bb": 0.02,
  "rake": 0.0,
  "raw_text": "Mano n.º 257168395500 de PokerStars:  Hold'em No Limit (0.01 €/0.02 € EUR) - 01-08-2025 11:39:59 CET [01-08-2025 5:39:59 ET]\nMesa \"Atlas\" 6-max El asiento n.º 4 es el botón\nAsiento 1: SrLyce (2.38 € en fichas) \nAsiento 2: Fharock (2.19 € en fichas) \nAsiento 3: ecuinas (1.79 € en fichas) \nAsiento 4: LxckxStrxkx (2 € en fichas) \nAsiento 5: soy_cule74 (1.94 € en fichas) \nAsiento 6: Akourdideh (2.29 € en fichas) \nsoy_cule74: pone la ciega pequeña 0.01 €\nAkourdideh: pone la ciega grande 0.02 €\n*** CARTAS DE MANO ***\nRepartidas a SrLyce [6h 5s]\nSrLyce: se retira \nFharock: sube 0.03 € a 0.05 €\necuinas: se retira \nLxckxStrxkx: se retira \nsoy_cule74: se retira \nAkourdideh: se retira \nLa apuesta no igualada (0.03 €) ha sido devuelta a Fharock\nFharock se lleva 0.05 € del bote \nFharock: no muestra su mano \n*** RESUMEN ***\nBote total 0.05 € | Comisión 0 € \nAsiento 1: SrLyce se retiró antes del Flop (no apostó)\nAsiento 2: Fharock recaudó (0.05 €)\nAsiento 3: ecuinas se retiró antes del Flop (no apostó)\nAsiento 4: LxckxStrxkx (botón) se retiró antes del Flop (no apostó)\nAsiento 5: soy_cule74 (ciega pequeña) se retiró antes del Flop\nAsiento 6: Akourdideh (ciega grande) se retiró antes del Flop"
}