{
  "hand_id": "257149036926",
  "date": "30-07-2025 22:03:33",
  "table": "Esclangona",
  "game_type": "holdem",
  "hero": "SrLyce",
  "hero_position": "",
  "hero_cards": [
    "9c",
    "3d"
  ],
  "stacks": {
    "Zorgue1080": 71.0,
    "SrLyce": 186.5,
    "NoahBolete": 99.5,
    "Davdgoni": 102.5,
    "DiaZzZ1": 95.0,
    "berlcht403": 34.0
  },
  "actions": {
    "preflop": [
      "Asiento 1: Zorgue1080 (1.42 € en fichas)",
      "Asiento 2: SrLyce (3.73 € en fichas)",
      "Asiento 3: NoahBolete (1.99 € en fichas)",
      "Asiento 4: Davdgoni (2.05 € en fichas)",
      "Asiento 5: DiaZzZ1 (1.90 € en fichas)",
      "Asiento 6: berlcht403 (0.68 € en fichas)",
      "DiaZzZ1: pone la ciega pequeña 0.01 €",
      "berlcht403: pone la ciega grande 0.02 €",
      "Zorgue1080: se retira",
      "SrLyce: se retira",
      "NoahBolete: se retira",
      "Davdgoni: se retira",
      "DiaZzZ1: se retira",
      "Asiento 1: Zorgue1080 se retiró antes del Flop (no apostó)",
      "Asiento 2: SrLyce se retiró antes del Flop (no apostó)",
      "Asiento 3: NoahBolete se retiró antes del Flop (no apostó)",
      "Asiento 4: Davdgoni (botón) se retiró antes del Flop (no apostó)",
      "Asiento 5: DiaZzZ1 (ciega pequeña) se retiró antes del Flop",
      "Asiento 6: berlcht403 (ciega grande) recaudó (0.02 €)"
    ],
    "flop": [],
    "turn": [],
    "river": []
  },
  "board": [],
  "winner": "berlcht403",
  "win_amount": 1.0,
  "sb": 0.01,
  "bb": 0.02,
  "rake": 0.0,
  "raw_text": "Mano n.º 257149036926 de PokerStars:  Hold'em No Limit (0.01 €/0.02 € EUR) - 30-07-2025 22:03:33 CET [30-07-2025 16:03:33 ET]\nMesa \"Esclangona\" 6-max El asiento n.º 4 es el botón\nAsiento 1: Zorgue1080 (1.42 € en fichas) \nAsiento 2: SrLyce (3.73 € en fichas) \nAsiento 3: NoahBolete (1.99 € en fichas) \nAsiento 4: Davdgoni (2.05 € en fichas) \nAsiento 5: DiaZzZ1 (1.90 € en fichas) \nAsiento 6: berlcht403 (0.68 € en fichas) \nDiaZzZ1: pone la ciega pequeña 0.01 €\nberlcht403: pone la ciega grande 0.02 €\n*** CARTAS DE MANO ***\nRepartidas a SrLyce [9c 3d]\nZorgue1080: se retira \nSrLyce: se retira \nNoahBolete: se retira \nDavdgoni: se retira \nDiaZzZ1: se retira \nLa apuesta no igualada (0.01 €) ha sido devuelta a berlcht403\nberlcht403 se lleva 0.02 € del bote \n*** RESUMEN ***\nBote total 0.02 € | Comisión 0 € \nAsiento 1: Zorgue1080 se retiró antes del Flop (no apostó)\nAsiento 2: SrLyce se retiró antes del Flop (no apostó)\nAsiento 3: NoahBolete se retiró antes del Flop (no apostó)\nAsiento 4: Davdgoni (botón) se retiró antes del Flop (no apostó)\nAsiento 5: DiaZzZ1 (ciega pequeña) se retiró antes del Flop\nAsiento 6: berlcht403 (ciega grande) recaudó (0.02 €)"
}