{
  "hand_id": "257148890648",
  "date": "30-07-2025 21:51:17",
  "table": "Esclangona",
  "game_type": "holdem",
  "hero": "SrLyce",
  "hero_position": "",
  "hero_cards": [
    "7h",
    "3c"
  ],
  "stacks": {
    "Zorgue1080": 84.0,
    "SrLyce": 159.0,
    "NoahBolete": 102.0,
    "Davdgoni": 100.0,
    "DiaZzZ1": 105.5,
    "berlcht403": 37.5
  },
  "actions": {
    "preflop": [
      "Asiento 1: Zorgue1080 (1.68 € en fichas)",
      "Asiento 2: SrLyce (3.18 € en fichas)",
      "Asiento 3: NoahBolete (2.04 € en fichas)",
      "Asiento 4: Davdgoni (2 € en fichas)",
      "Asiento 5: DiaZzZ1 (2.11 € en fichas)",
      "Asiento 6: berlcht403 (0.75 € en fichas)",
      "Zorgue1080: pone la ciega pequeña 0.01 €",
      "SrLyce: pone la ciega grande 0.02 €",
      "NoahBolete: se retira",
      "Davdgoni: se retira",
      "DiaZzZ1: se retira",
      "berlcht403: iguala 0.02 €",
      "Zorgue1080: iguala 0.01 €",
      "SrLyce: pasa"
    ],
    "flop": [
      "Zorgue1080: pasa",
      "SrLyce: pasa",
      "berlcht403: apuesta 0.06 €",
      "Zorgue1080: iguala 0.06 €",
      "SrLyce: se retira"
    ],
    "turn": [
      "Zorgue1080: pasa",
      "berlcht403: apuesta 0.02 €",
      "Zorgue1080: sube 0.11 € a 0.13 €",
      "berlcht403: se retira",
      "Zorgue1080: no muestra su mano",
      "Asiento 1: Zorgue1080 (ciega pequeña) recaudó (0.21 €)",
      "Asiento 2: SrLyce (ciega grande) se retiró en el Flop",
      "Asiento 3: NoahBolete se retiró antes del Flop (no apostó)",
      "Asiento 4: Davdgoni se retiró antes del Flop (no apostó)",
      "Asiento 5: DiaZzZ1 se retiró antes del Flop (no apostó)",
      "Asiento 6: berlcht403 (botón) se retiró en el Turn"
    ],
    "river": []
  },
  "board": [
    "8d",
    "Ts",
    "8h",
    "Kh"
  ],
  "winner": "Zorgue1080",
  "win_amount": 10.5,
  "sb": 0.01,
  "bb": 0.02,
  "rake": 0.5,
  "raw_text": "Mano n.º 257148890648 de PokerStars:  Hold'em No Limit (0.01 €/0.02 € EUR) - 30-07-2025 21:51:17 CET [30-07-2025 15:51:17 ET]\nMesa \"Esclangona\" 6-max El asiento n.º 6 es el botón\nAsiento 1: Zorgue1080 (1.68 € en fichas) \nAsiento 2: SrLyce (3.18 € en fichas) \nAsiento 3: NoahBolete (2.04 € en fichas) \nAsiento 4: Davdgoni (2 € en fichas) \nAsiento 5: DiaZzZ1 (2.11 € en fichas) \nAsiento 6: berlcht403 (0.75 € en fichas) \nZorgue1080: pone la ciega pequeña 0.01 €\nSrLyce: pone la ciega grande 0.02 €\n*** CARTAS DE MANO ***\nRepartidas a SrLyce [7h 3c]\nNoahBolete: se retira \nDavdgoni: se retira \nDiaZzZ1: se retira \nberlcht403: iguala 0.02 €\nZorgue1080: iguala 0.01 €\nSrLyce: pasa \n*** FLOP *** [8d Ts 8h]\nZorgue1080: pasa \nSrLyce: pasa \nberlcht403: apuesta 0.06 €\nZorgue1080: iguala 0.06 €\nSrLyce: se retira \n*** TURN *** [8d Ts 8h] [Kh]\nZorgue1080: pasa \nberlcht403: apuesta 0.02 €\nZorgue1080: sube 0.11 € a 0.13 €\nberlcht403: se retira \nLa apuesta no igualada (0.11 €) ha sido devuelta a Zorgue1080\nZorgue1080 se lleva 0.21 € del bote \nZorgue1080: no muestra su mano \n*** RESUMEN ***\nBote total 0.22 € | Comisión 0.01 € \nComunitarias [8d Ts 8h Kh]\nAsiento 1: Zorgue1080 (ciega pequeña) recaudó (0.21 €)\nAsiento 2: SrLyce (ciega grande) se retiró en el Flop\nAsiento 3: NoahBolete se retiró antes del Flop (no apostó)\nAsiento 4: Davdgoni se retiró antes del Flop (no apostó)\nAsiento 5: DiaZzZ1 se retiró antes del Flop (no apostó)\nAsiento 6: berlcht403 (botón) se retiró en el Turn"
}