{
  "hand_id": "257238468895",
  "date": "06-08-2025 19:02:10",
  "table": "Alruccabah II",
  "game_type": "holdem",
  "hero": "SrLyce",
  "hero_position": "",
  "hero_cards": [
    "Kh",
    "4h"
  ],
  "stacks": {
    "zoioachado": 0.0,
    "SrLyce": 150.5,
    "yonisanlu": 143.0,
    "Nicanor Cast": 51.0,
    "rayao32": 34.5
  },
  "actions": {
    "preflop": [
      "Asiento 2: zoioachado (0 € en fichas) está ausente",
      "Asiento 1: SrLyce (3.01 € en fichas)",
      "Asiento 3: yonisanlu (2.86 € en fichas)",
      "Asiento 4: serviettski(fr) (2 € en fichas)",
      "Asiento 5: Nicanor Cast (1.02 € en fichas)",
      "Asiento 6: rayao32 (0.69 € en fichas)",
      "rayao32: pone la ciega pequeña 0.01 €",
      "SrLyce: pone la ciega grande 0.02 €",
      "yonisanlu: se retira",
      "serviettski(fr): se retira",
      "Nicanor Cast: sube 0.02 € a 0.04 €",
      "rayao32: iguala 0.03 €",
      "SrLyce: iguala 0.02 €"
    ],
    "flop": [
      "rayao32: pasa",
      "SrLyce: pasa",
      "Nicanor Cast: pasa"
    ],
    "turn": [
      "rayao32: pasa",
      "SrLyce: pasa",
      "Nicanor Cast: pasa"
    ],
    "river": [
      "rayao32: apuesta 0.10 €",
      "SrLyce: iguala 0.10 €",
      "Nicanor Cast: se retira",
      "rayao32: muestra [9c 6s] (escalera, de cinco a nueve)",
      "SrLyce: descarta su mano sin mostrar",
      "Asiento 2: zoioachado",
      "Asiento 1: SrLyce (ciega grande) descartó sin mostrar [Kh 4h]",
      "Asiento 3: yonisanlu se retiró antes del Flop (no apostó)",
      "Asiento 4: serviettski(fr) se retiró antes del Flop (no apostó)",
      "Asiento 5: Nicanor Cast (botón) se retiró en el River",
      "Asiento 6: rayao32 (ciega pequeña) muestra [9c 6s] y ganó (0.30 €) con escalera, de cinco a nueve"
    ]
  },
  "board": [
    "8c",
    "8d",
    "7d",
    "5s",
    "4d"
  ],
  "winner": "rayao32",
  "win_amount": 15.0,
  "sb": 0.01,
  "bb": 0.02,
  "rake": 1.0,
  "raw_text": "Mano n.º 257238468895 de PokerStars:  Hold'em No Limit (0.01 €/0.02 € EUR) - 06-08-2025 19:02:10 CET [06-08-2025 13:02:10 ET]\nMesa \"Alruccabah II\" 6-max El asiento n.º 5 es el botón\nAsiento 2: zoioachado (0 € en fichas) está ausente\nAsiento 1: SrLyce (3.01 € en fichas) \nAsiento 3: yonisanlu (2.86 € en fichas) \nAsiento 4: serviettski(fr) (2 € en fichas) \nAsiento 5: Nicanor Cast (1.02 € en fichas) \nAsiento 6: rayao32 (0.69 € en fichas) \nrayao32: pone la ciega pequeña 0.01 €\nSrLyce: pone la ciega grande 0.02 €\n*** CARTAS DE MANO ***\nRepartidas a SrLyce [Kh 4h]\nyonisanlu: se retira \nserviettski(fr): se retira \nNicanor Cast: sube 0.02 € a 0.04 €\nrayao32: iguala 0.03 €\nSrLyce: iguala 0.02 €\n*** FLOP *** [8c 8d 7d]\nrayao32: pasa \nSrLyce: pasa \nNicanor Cast: pasa \n*** TURN *** [8c 8d 7d] [5s]\nrayao32: pasa \nSrLyce: pasa \nNicanor Cast: pasa \n*** RIVER *** [8c 8d 7d 5s] [4d]\nrayao32: apuesta 0.10 €\nSrLyce: iguala 0.10 €\nNicanor Cast: se retira \n*** SHOW DOWN ***\nrayao32: muestra [9c 6s] (escalera, de cinco a nueve)\nSrLyce: descarta su mano sin mostrar \nrayao32 se lleva 0.30 € del bote \n*** RESUMEN ***\nBote total 0.32 € | Comisión 0.02 € \nComunitarias [8c 8d 7d 5s 4d]\nAsiento 2: zoioachado\nAsiento 1: SrLyce (ciega grande) descartó sin mostrar [Kh 4h]\nAsiento 3: yonisanlu se retiró antes del Flop (no apostó)\nAsiento 4: serviettski(fr) se retiró antes del Flop (no apostó)\nAsiento 5: Nicanor Cast (botón) se retiró en el River\nAsiento 6: rayao32 (ciega pequeña) muestra [9c 6s] y ganó (0.30 €) con escalera, de cinco a nueve"
}