{
  "hand_id": "257238564167",
  "date": "06-08-2025 19:10:23",
  "table": "Leonteus",
  "game_type": "holdem",
  "hero": "SrLyce",
  "hero_position": "",
  "hero_cards": [
    "6d",
    "Jc"
  ],
  "stacks": {
    "BuXHexter": 145.5,
    "practikal_C23": 53.5,
    "durahimovic": 283.0,
    "davinci1962": 136.0,
    "Andark47": 188.0,
    "SrLyce": 99.5
  },
  "actions": {
    "preflop": [
      "Asiento 4: BuXHexter (2.91 € en fichas) está ausente",
      "Asiento 1: practikal_C23 (1.07 € en fichas)",
      "Asiento 2: durahimovic (5.66 € en fichas)",
      "Asiento 3: davinci1962 (2.72 € en fichas)",
      "Asiento 5: Andark47 (3.76 € en fichas)",
      "Asiento 6: SrLyce (1.99 € en fichas)",
      "davinci1962: pone la ciega pequeña 0.01 €",
      "BuXHexter: está ausente",
      "Andark47: pone la ciega grande 0.02 €",
      "SrLyce: se retira",
      "practikal_C23: se retira",
      "durahimovic: sube 0.04 € a 0.06 €",
      "davinci1962: se retira",
      "Andark47: se retira",
      "durahimovic: no muestra su mano",
      "Asiento 4: BuXHexter",
      "Asiento 1: practikal_C23 se retiró antes del Flop (no apostó)",
      "Asiento 2: durahimovic (botón) recaudó (0.05 €)",
      "Asiento 3: davinci1962 (ciega pequeña) se retiró antes del Flop",
      "Asiento 5: Andark47 (ciega grande) se retiró antes del Flop",
      "Asiento 6: SrLyce se retiró antes del Flop (no apostó)"
    ],
    "flop": [],
    "turn": [],
    "river": []
  },
  "board": [],
  "winner": "durahimovic",
  "win_amount": 2.5,
  "sb": 0.01,
  "bb": 0.02,
  "rake": 0.0,
  "raw_text": "Mano n.º 257238564167 de PokerStars:  Hold'em No Limit (0.01 €/0.02 € EUR) - 06-08-2025 19:10:23 CET [06-08-2025 13:10:23 ET]\nMesa \"Leonteus\" 6-max El asiento n.º 2 es el botón\nAsiento 4: BuXHexter (2.91 € en fichas) está ausente\nAsiento 1: practikal_C23 (1.07 € en fichas) \nAsiento 2: durahimovic (5.66 € en fichas) \nAsiento 3: davinci1962 (2.72 € en fichas) \nAsiento 5: Andark47 (3.76 € en fichas) \nAsiento 6: SrLyce (1.99 € en fichas) \ndavinci1962: pone la ciega pequeña 0.01 €\nBuXHexter: está ausente \nAndark47: pone la ciega grande 0.02 €\n*** CARTAS DE MANO ***\nRepartidas a SrLyce [6d Jc]\nSrLyce: se retira \npractikal_C23: se retira \ndurahimovic: sube 0.04 € a 0.06 €\ndavinci1962: se retira \nAndark47 ha agotado su tiempo\nAndark47: se retira \nLa apuesta no igualada (0.04 €) ha sido devuelta a durahimovic\ndurahimovic se lleva 0.05 € del bote \ndurahimovic: no muestra su mano \n*** RESUMEN ***\nBote total 0.05 € | Comisión 0 € \nAsiento 4: BuXHexter\nAsiento 1: practikal_C23 se retiró antes del Flop (no apostó)\nAsiento 2: durahimovic (botón) recaudó (0.05 €)\nAsiento 3: davinci1962 (ciega pequeña) se retiró antes del Flop\nAsiento 5: Andark47 (ciega grande) se retiró antes del Flop\nAsiento 6: SrLyce se retiró antes del Flop (no apostó)"
}