{
  "hand_id": "257168287175",
  "date": "01-08-2025 11:19:58",
  "table": "Atlas",
  "game_type": "holdem",
  "hero": "SrLyce",
  "hero_position": "",
  "hero_cards": [
    "5s",
    "6c"
  ],
  "stacks": {
    "SrLyce": 90.5,
    "Fharock": 91.0,
    "ecuinas": 98.5,
    "LxckxStrxkx": 106.5,
    "erCampos23": 39.0,
    "Akourdideh": 116.0
  },
  "actions": {
    "preflop": [
      "Asiento 1: SrLyce (1.81 € en fichas)",
      "Asiento 2: Fharock (1.82 € en fichas)",
      "Asiento 3: ecuinas (1.97 € en fichas)",
      "Asiento 4: LxckxStrxkx (2.13 € en fichas)",
      "Asiento 5: erCampos23 (0.78 € en fichas)",
      "Asiento 6: Akourdideh (2.32 € en fichas)",
      "Fharock: pone la ciega pequeña 0.01 €",
      "ecuinas: pone la ciega grande 0.02 €",
      "LxckxStrxkx: se retira",
      "erCampos23: sube 0.02 € a 0.04 €",
      "Akourdideh: se retira",
      "SrLyce: se retira",
      "Fharock: sube 0.06 € a 0.10 €",
      "ecuinas: se retira",
      "erCampos23: iguala 0.06 €"
    ],
    "flop": [
      "Fharock: apuesta 0.11 €",
      "erCampos23: se retira",
      "Fharock: no muestra su mano",
      "Asiento 1: SrLyce (botón) se retiró antes del Flop (no apostó)",
      "Asiento 2: Fharock (ciega pequeña) recaudó (0.21 €)",
      "Asiento 3: ecuinas (ciega grande) se retiró antes del Flop",
      "Asiento 4: LxckxStrxkx se retiró antes del Flop (no apostó)",
      "Asiento 5: erCampos23 se retiró en el Flop",
      "Asiento 6: Akourdideh se retiró antes del Flop (no apostó)"
    ],
    "turn": [],
    "river": []
  },
  "board": [
    "6d",
    "4h",
    "8d"
  ],
  "winner": "Fharock",
  "win_amount": 10.5,
  "sb": 0.01,
  "bb": 0.02,
  "rake": 0.5,
  "raw_text": "Mano n.º 257168287175 de PokerStars:  Hold'em No Limit (0.01 €/0.02 € EUR) - 01-08-2025 11:19:58 CET [01-08-2025 5:19:58 ET]\nMesa \"Atlas\" 6-max El asiento n.º 1 es el botón\nAsiento 1: SrLyce (1.81 € en fichas) \nAsiento 2: Fharock (1.82 € en fichas) \nAsiento 3: ecuinas (1.97 € en fichas) \nAsiento 4: LxckxStrxkx (2.13 € en fichas) \nAsiento 5: erCampos23 (0.78 € en fichas) \nAsiento 6: Akourdideh (2.32 € en fichas) \nFharock: pone la ciega pequeña 0.01 €\necuinas: pone la ciega grande 0.02 €\n*** CARTAS DE MANO ***\nRepartidas a SrLyce [5s 6c]\nLxckxStrxkx: se retira \nerCampos23: sube 0.02 € a 0.04 €\nAkourdideh: se retira \nSrLyce: se retira \nFharock: sube 0.06 € a 0.10 €\necuinas: se retira \nerCampos23: iguala 0.06 €\n*** FLOP *** [6d 4h 8d]\nFharock: apuesta 0.11 €\nerCampos23: se retira \nLa apuesta no igualada (0.11 €) ha sido devuelta a Fharock\nFharock se lleva 0.21 € del bote \nFharock: no muestra su mano \n*** RESUMEN ***\nBote total 0.22 € | Comisión 0.01 € \nComunitarias [6d 4h 8d]\nAsiento 1: SrLyce (botón) se retiró antes del Flop (no apostó)\nAsiento 2: Fharock (ciega pequeña) recaudó (0.21 €)\nAsiento 3: ecuinas (ciega grande) se retiró antes del Flop\nAsiento 4: LxckxStrxkx se retiró antes del Flop (no apostó)\nAsiento 5: erCampos23 se retiró en el Flop\nAsiento 6: Akourdideh se retiró antes del Flop (no apostó)"
}