{
  "hand_id": "257150091109",
  "date": "30-07-2025 23:17:40",
  "table": "Gilgamesh",
  "game_type": "holdem",
  "hero": "SrLyce",
  "hero_position": "",
  "hero_cards": [
    "5d",
    "6s"
  ],
  "stacks": {
    "riverrrrrrmagic": 127.0,
    "SrLyce": 97.0,
    "Jumby34": 100.0,
    "xapkk": 100.0,
    "samaritano34": 92.5,
    "Fretzo67500": 120.0
  },
  "actions": {
    "preflop": [
      "Asiento 1: riverrrrrrmagic (2.54 € en fichas)",
      "Asiento 2: SrLyce (1.94 € en fichas)",
      "Asiento 3: Jumby34 (2 € en fichas)",
      "Asiento 4: xapkk (2 € en fichas)",
      "Asiento 5: samaritano34 (1.85 € en fichas)",
      "Asiento 6: Fretzo67500 (2.40 € en fichas)",
      "SrLyce: pone la ciega pequeña 0.01 €",
      "Jumby34: pone la ciega grande 0.02 €",
      "xapkk: se retira",
      "samaritano34: se retira",
      "Fretzo67500: iguala 0.02 €",
      "riverrrrrrmagic: se retira",
      "SrLyce: iguala 0.01 €",
      "Jumby34: sube 0.16 € a 0.18 €",
      "Fretzo67500: se retira",
      "SrLyce: se retira",
      "Jumby34: no muestra su mano",
      "Asiento 1: riverrrrrrmagic (botón) se retiró antes del Flop (no apostó)",
      "Asiento 2: SrLyce (ciega pequeña) se retiró antes del Flop",
      "Asiento 3: Jumby34 (ciega grande) recaudó (0.06 €)",
      "Asiento 4: xapkk se retiró antes del Flop (no apostó)",
      "Asiento 5: samaritano34 se retiró antes del Flop (no apostó)",
      "Asiento 6: Fretzo67500 se retiró antes del Flop"
    ],
    "flop": [],
    "turn": [],
    "river": []
  },
  "board": [],
  "winner": "Jumby34",
  "win_amount": 3.0,
  "sb": 0.01,
  "bb": 0.02,
  "rake": 0.0,
  "raw_text": "Mano n.º 257150091109 de PokerStars:  Hold'em No Limit (0.01 €/0.02 € EUR) - 30-07-2025 23:17:40 CET [30-07-2025 17:17:40 ET]\nMesa \"Gilgamesh\" 6-max El asiento n.º 1 es el botón\nAsiento 1: riverrrrrrmagic (2.54 € en fichas) \nAsiento 2: SrLyce (1.94 € en fichas) \nAsiento 3: Jumby34 (2 € en fichas) \nAsiento 4: xapkk (2 € en fichas) \nAsiento 5: samaritano34 (1.85 € en fichas) \nAsiento 6: Fretzo67500 (2.40 € en fichas) \nSrLyce: pone la ciega pequeña 0.01 €\nJumby34: pone la ciega grande 0.02 €\n*** CARTAS DE MANO ***\nRepartidas a SrLyce [5d 6s]\nxapkk: se retira \nsamaritano34: se retira \nFretzo67500: iguala 0.02 €\nriverrrrrrmagic: se retira \nSrLyce: iguala 0.01 €\nJumby34: sube 0.16 € a 0.18 €\nFretzo67500: se retira \nSrLyce: se retira \nLa apuesta no igualada (0.16 €) ha sido devuelta a Jumby34\nJumby34 se lleva 0.06 € del bote \nJumby34: no muestra su mano \n*** RESUMEN ***\nBote total 0.06 € | Comisión 0 € \nAsiento 1: riverrrrrrmagic (botón) se retiró antes del Flop (no apostó)\nAsiento 2: SrLyce (ciega pequeña) se retiró antes del Flop\nAsiento 3: Jumby34 (ciega grande) recaudó (0.06 €)\nAsiento 4: xapkk se retiró antes del Flop (no apostó)\nAsiento 5: samaritano34 se retiró antes del Flop (no apostó)\nAsiento 6: Fretzo67500 se retiró antes del Flop"
}