{
  "hand_id": "257238657865",
  "date": "06-08-2025 19:18:14",
  "table": "Herculina II",
  "game_type": "holdem",
  "hero": "SrLyce",
  "hero_position": "",
  "hero_cards": [
    "Ac",
    "Kh"
  ],
  "stacks": {
    "Alceo27": 122.5,
    "David98X": 164.0,
    "JJer11": 192.0,
    "SrLyce": 99.0,
    "Macklemore0": 102.5,
    "ScarvBlack": 112.5
  },
  "actions": {
    "preflop": [
      "Asiento 1: Alceo27 (2.45 € en fichas)",
      "Asiento 2: David98X (3.28 € en fichas)",
      "Asiento 3: JJer11 (3.84 € en fichas)",
      "Asiento 4: SrLyce (1.98 € en fichas)",
      "Asiento 5: Macklemore0 (2.05 € en fichas)",
      "Asiento 6: ScarvBlack (2.25 € en fichas)",
      "Alceo27: pone la ciega pequeña 0.01 €",
      "David98X: pone la ciega grande 0.02 €",
      "Macklemore0: pone la ciega pequeña y la grande 0.03 €",
      "JJer11: se retira",
      "SrLyce: sube 0.03 € a 0.05 €",
      "Macklemore0: se retira",
      "ScarvBlack: iguala 0.05 €",
      "Alceo27: se retira",
      "David98X: iguala 0.03 €"
    ],
    "flop": [
      "David98X: pasa",
      "SrLyce: apuesta 0.06 €",
      "ScarvBlack: se retira",
      "David98X: iguala 0.06 €"
    ],
    "turn": [
      "David98X: pasa",
      "SrLyce: apuesta 0.15 €",
      "David98X: iguala 0.15 €"
    ],
    "river": [
      "David98X: pasa",
      "SrLyce: pasa",
      "David98X: muestra [Td Jc] (pareja de damas)",
      "SrLyce: muestra [Ac Kh] (pareja de damas - as kicker)",
      "Asiento 1: Alceo27 (ciega pequeña) se retiró antes del Flop",
      "Asiento 2: David98X (ciega grande) muestra [Td Jc] y perdió con pareja de damas",
      "Asiento 3: JJer11 se retiró antes del Flop (no apostó)",
      "Asiento 4: SrLyce muestra [Ac Kh] y ganó (0.57 €) con pareja de damas",
      "Asiento 5: Macklemore0 se retiró antes del Flop (no apostó)",
      "Asiento 6: ScarvBlack (botón) se retiró en el Flop"
    ]
  },
  "board": [
    "8c",
    "6c",
    "Qc",
    "7d",
    "Qd"
  ],
  "winner": "SrLyce",
  "win_amount": 28.5,
  "sb": 0.01,
  "bb": 0.02,
  "rake": 2.0,
  "raw_text": "Mano n.º 257238657865 de PokerStars:  Hold'em No Limit (0.01 €/0.02 € EUR) - 06-08-2025 19:18:14 CET [06-08-2025 13:18:14 ET]\nMesa \"Herculina II\" 6-max El asiento n.º 6 es el botón\nAsiento 1: Alceo27 (2.45 € en fichas) \nAsiento 2: David98X (3.28 € en fichas) \nAsiento 3: JJer11 (3.84 € en fichas) \nAsiento 4: SrLyce (1.98 € en fichas) \nAsiento 5: Macklemore0 (2.05 € en fichas) \nAsiento 6: ScarvBlack (2.25 € en fichas) \nAlceo27: pone la ciega pequeña 0.01 €\nDavid98X: pone la ciega grande 0.02 €\nMacklemore0: pone la ciega pequeña y la grande 0.03 €\n*** CARTAS DE MANO ***\nRepartidas a SrLyce [Ac Kh]\nJJer11: se retira \nSrLyce: sube 0.03 € a 0.05 €\nMacklemore0: se retira \nScarvBlack: iguala 0.05 €\nAlceo27: se retira \nDavid98X: iguala 0.03 €\n*** FLOP *** [8c 6c Qc]\nDavid98X: pasa \nSrLyce: apuesta 0.06 €\nScarvBlack: se retira \nDavid98X: iguala 0.06 €\n*** TURN *** [8c 6c Qc] [7d]\nDavid98X: pasa \nSrLyce: apuesta 0.15 €\nDavid98X: iguala 0.15 €\n*** RIVER *** [8c 6c Qc 7d] [Qd]\nDavid98X: pasa \nSrLyce: pasa \n*** SHOW DOWN ***\nDavid98X: muestra [Td Jc] (pareja de damas)\nSrLyce: muestra [Ac Kh] (pareja de damas - as kicker)\nSrLyce se lleva 0.57 € del bote \n*** RESUMEN ***\nBote total 0.61 € | Comisión 0.04 € \nComunitarias [8c 6c Qc 7d Qd]\nAsiento 1: Alceo27 (ciega pequeña) se retiró antes del Flop\nAsiento 2: David98X (ciega grande) muestra [Td Jc] y perdió con pareja de damas\nAsiento 3: JJer11 se retiró antes del Flop (no apostó)\nAsiento 4: SrLyce muestra [Ac Kh] y ganó (0.57 €) con pareja de damas\nAsiento 5: Macklemore0 se retiró antes del Flop (no apostó)\nAsiento 6: ScarvBlack (botón) se retiró en el Flop"
}