{
  "hand_id": "257238251984",
  "date": "06-08-2025 18:41:34",
  "table": "Alruccabah II",
  "game_type": "holdem",
  "hero": "SrLyce",
  "hero_position": "",
  "hero_cards": [
    "9d",
    "7c"
  ],
  "stacks": {
    "rayao32": 52.0,
    "SrLyce": 90.5,
    "Davdgoni": 265.5,
    "PerroBestia": 55.5,
    "Nicanor Cast": 52.0
  },
  "actions": {
    "preflop": [
      "Asiento 6: rayao32 (1.04 € en fichas) está ausente",
      "Asiento 1: SrLyce (1.81 € en fichas)",
      "Asiento 2: Davdgoni (5.31 € en fichas)",
      "Asiento 3: PerroBestia (1.11 € en fichas)",
      "Asiento 4: serviettski(fr) (2 € en fichas)",
      "Asiento 5: Nicanor Cast (1.04 € en fichas)",
      "Nicanor Cast: pone la ciega pequeña 0.01 €",
      "SrLyce: pone la ciega grande 0.02 €",
      "Davdgoni: se retira",
      "PerroBestia: se retira",
      "serviettski(fr): se retira",
      "Nicanor Cast: se retira",
      "SrLyce: no muestra su mano",
      "Asiento 6: rayao32",
      "Asiento 1: SrLyce (ciega grande) recaudó (0.02 €)",
      "Asiento 2: Davdgoni se retiró antes del Flop (no apostó)",
      "Asiento 3: PerroBestia se retiró antes del Flop (no apostó)",
      "Asiento 4: serviettski(fr) (botón) se retiró antes del Flop (no apostó)",
      "Asiento 5: Nicanor Cast (ciega pequeña) se retiró antes del Flop"
    ],
    "flop": [],
    "turn": [],
    "river": []
  },
  "board": [],
  "winner": "SrLyce",
  "win_amount": 1.0,
  "sb": 0.01,
  "bb": 0.02,
  "rake": 0.0,
  "raw_text": "Mano n.º 257238251984 de PokerStars:  Hold'em No Limit (0.01 €/0.02 € EUR) - 06-08-2025 18:41:34 CET [06-08-2025 12:41:34 ET]\nMesa \"Alruccabah II\" 6-max El asiento n.º 4 es el botón\nAsiento 6: rayao32 (1.04 € en fichas) está ausente\nAsiento 1: SrLyce (1.81 € en fichas) \nAsiento 2: Davdgoni (5.31 € en fichas) \nAsiento 3: PerroBestia (1.11 € en fichas) \nAsiento 4: serviettski(fr) (2 € en fichas) \nAsiento 5: Nicanor Cast (1.04 € en fichas) \nNicanor Cast: pone la ciega pequeña 0.01 €\nSrLyce: pone la ciega grande 0.02 €\n*** CARTAS DE MANO ***\nRepartidas a SrLyce [9d 7c]\nDavdgoni: se retira \nPerroBestia: se retira \nserviettski(fr): se retira \nNicanor Cast: se retira \nLa apuesta no igualada (0.01 €) ha sido devuelta a SrLyce\nSrLyce se lleva 0.02 € del bote \nSrLyce: no muestra su mano \n*** RESUMEN ***\nBote total 0.02 € | Comisión 0 € \nAsiento 6: rayao32\nAsiento 1: SrLyce (ciega grande) recaudó (0.02 €)\nAsiento 2: Davdgoni se retiró antes del Flop (no apostó)\nAsiento 3: PerroBestia se retiró antes del Flop (no apostó)\nAsiento 4: serviettski(fr) (botón) se retiró antes del Flop (no apostó)\nAsiento 5: Nicanor Cast (ciega pequeña) se retiró antes del Flop"
}