{
  "hand_id": "257150259070",
  "date": "30-07-2025 23:29:18",
  "table": "Gilgamesh",
  "game_type": "holdem",
  "hero": "SrLyce",
  "hero_position": "",
  "hero_cards": [
    "8c",
    "7s"
  ],
  "stacks": {
    "ozil111": 100.0,
    "riverrrrrrmagic": 126.5,
    "SrLyce": 107.5,
    "Jumby34": 101.5,
    "xapkk": 100.0,
    "Fretzo67500": 142.0
  },
  "actions": {
    "preflop": [
      "Asiento 5: ozil111 (2 € en fichas) está ausente",
      "Asiento 1: riverrrrrrmagic (2.53 € en fichas)",
      "Asiento 2: SrLyce (2.15 € en fichas)",
      "Asiento 3: Jumby34 (2.03 € en fichas)",
      "Asiento 4: xapkk (2 € en fichas)",
      "Asiento 6: Fretzo67500 (2.84 € en fichas)",
      "riverrrrrrmagic: pone la ciega pequeña 0.01 €",
      "SrLyce: pone la ciega grande 0.02 €",
      "ozil111: se ausenta",
      "Jumby34: se retira",
      "xapkk: se retira",
      "Fretzo67500: iguala 0.02 €",
      "riverrrrrrmagic: iguala 0.01 €",
      "SrLyce: pasa"
    ],
    "flop": [
      "riverrrrrrmagic: pasa",
      "SrLyce: pasa",
      "Fretzo67500: pasa"
    ],
    "turn": [
      "riverrrrrrmagic: pasa",
      "SrLyce: pasa",
      "Fretzo67500: pasa"
    ],
    "river": [
      "riverrrrrrmagic: pasa",
      "SrLyce: pasa",
      "Fretzo67500: apuesta 0.06 €",
      "riverrrrrrmagic: se retira",
      "SrLyce: se retira",
      "Asiento 5: ozil111",
      "Asiento 1: riverrrrrrmagic (ciega pequeña) se retiró en el River",
      "Asiento 2: SrLyce (ciega grande) se retiró en el River",
      "Asiento 3: Jumby34 se retiró antes del Flop (no apostó)",
      "Asiento 4: xapkk se retiró antes del Flop (no apostó)",
      "Asiento 6: Fretzo67500 (botón) recaudó (0.06 €)"
    ]
  },
  "board": [
    "3c",
    "Ah",
    "9d",
    "3s",
    "Kc"
  ],
  "winner": "Fretzo67500",
  "win_amount": 3.0,
  "sb": 0.01,
  "bb": 0.02,
  "rake": 0.0,
  "raw_text": "Mano n.º 257150259070 de PokerStars:  Hold'em No Limit (0.01 €/0.02 € EUR) - 30-07-2025 23:29:18 CET [30-07-2025 17:29:18 ET]\nMesa \"Gilgamesh\" 6-max El asiento n.º 6 es el botón\nAsiento 5: ozil111 (2 € en fichas) está ausente\nAsiento 1: riverrrrrrmagic (2.53 € en fichas) \nAsiento 2: SrLyce (2.15 € en fichas) \nAsiento 3: Jumby34 (2.03 € en fichas) \nAsiento 4: xapkk (2 € en fichas) \nAsiento 6: Fretzo67500 (2.84 € en fichas) \nriverrrrrrmagic: pone la ciega pequeña 0.01 €\nSrLyce: pone la ciega grande 0.02 €\nozil111: se ausenta \n*** CARTAS DE MANO ***\nRepartidas a SrLyce [8c 7s]\nJumby34: se retira \nxapkk ha agotado su tiempo\nxapkk: se retira \nFretzo67500: iguala 0.02 €\nriverrrrrrmagic: iguala 0.01 €\nSrLyce: pasa \n*** FLOP *** [3c Ah 9d]\nriverrrrrrmagic: pasa \nSrLyce: pasa \nFretzo67500: pasa \n*** TURN *** [3c Ah 9d] [3s]\nriverrrrrrmagic: pasa \nSrLyce: pasa \nFretzo67500: pasa \n*** RIVER *** [3c Ah 9d 3s] [Kc]\nriverrrrrrmagic: pasa \nSrLyce: pasa \nFretzo67500: apuesta 0.06 €\nriverrrrrrmagic: se retira \nSrLyce: se retira \nLa apuesta no igualada (0.06 €) ha sido devuelta a Fretzo67500\nFretzo67500 se lleva 0.06 € del bote \n*** RESUMEN ***\nBote total 0.06 € | Comisión 0 € \nComunitarias [3c Ah 9d 3s Kc]\nAsiento 5: ozil111\nAsiento 1: riverrrrrrmagic (ciega pequeña) se retiró en el River\nAsiento 2: SrLyce (ciega grande) se retiró en el River\nAsiento 3: Jumby34 se retiró antes del Flop (no apostó)\nAsiento 4: xapkk se retiró antes del Flop (no apostó)\nAsiento 6: Fretzo67500 (botón) recaudó (0.06 €)"
}