{
  "hand_id": "257149179514",
  "date": "30-07-2025 22:13:38",
  "table": "Sirona",
  "game_type": "holdem",
  "hero": "SrLyce",
  "hero_position": "",
  "hero_cards": [
    "Ts",
    "5d"
  ],
  "stacks": {
    "SrLyce": 254.5,
    "Tropki": 100.0,
    "christoph363": 91.0,
    "oliverdu70": 184.5,
    "hadhod1976": 38.5,
    "MitchATP65": 103.0
  },
  "actions": {
    "preflop": [
      "Asiento 1: SrLyce (5.09 € en fichas)",
      "Asiento 2: Tropki (2 € en fichas)",
      "Asiento 3: christoph363 (1.82 € en fichas)",
      "Asiento 4: oliverdu70 (3.69 € en fichas)",
      "Asiento 5: hadhod1976 (0.77 € en fichas)",
      "Asiento 6: MitchATP65 (2.06 € en fichas)",
      "Tropki: pone la ciega pequeña 0.01 €",
      "christoph363: pone la ciega grande 0.02 €",
      "oliverdu70: iguala 0.02 €",
      "hadhod1976: se retira",
      "MitchATP65: se retira",
      "SrLyce: se retira",
      "Tropki: iguala 0.01 €",
      "christoph363: pasa"
    ],
    "flop": [
      "Tropki: pasa",
      "christoph363: pasa",
      "oliverdu70: pasa"
    ],
    "turn": [
      "Tropki: pasa",
      "christoph363: apuesta 0.08 €",
      "oliverdu70: se retira",
      "Tropki: se retira",
      "Asiento 1: SrLyce (botón) se retiró antes del Flop (no apostó)",
      "Asiento 2: Tropki (ciega pequeña) se retiró en el Turn",
      "Asiento 3: christoph363 (ciega grande) recaudó (0.06 €)",
      "Asiento 4: oliverdu70 se retiró en el Turn",
      "Asiento 5: hadhod1976 se retiró antes del Flop (no apostó)",
      "Asiento 6: MitchATP65 se retiró antes del Flop (no apostó)"
    ],
    "river": []
  },
  "board": [
    "3h",
    "6h",
    "8d",
    "3d"
  ],
  "winner": "christoph363",
  "win_amount": 3.0,
  "sb": 0.01,
  "bb": 0.02,
  "rake": 0.0,
  "raw_text": "Mano n.º 257149179514 de PokerStars:  Hold'em No Limit (0.01 €/0.02 € EUR) - 30-07-2025 22:13:38 CET [30-07-2025 16:13:38 ET]\nMesa \"Sirona\" 6-max El asiento n.º 1 es el botón\nAsiento 1: SrLyce (5.09 € en fichas) \nAsiento 2: Tropki (2 € en fichas) \nAsiento 3: christoph363 (1.82 € en fichas) \nAsiento 4: oliverdu70 (3.69 € en fichas) \nAsiento 5: hadhod1976 (0.77 € en fichas) \nAsiento 6: MitchATP65 (2.06 € en fichas) \nTropki: pone la ciega pequeña 0.01 €\nchristoph363: pone la ciega grande 0.02 €\n*** CARTAS DE MANO ***\nRepartidas a SrLyce [Ts 5d]\noliverdu70: iguala 0.02 €\nhadhod1976: se retira \nMitchATP65: se retira \nSrLyce: se retira \nTropki: iguala 0.01 €\nchristoph363: pasa \n*** FLOP *** [3h 6h 8d]\nTropki: pasa \nchristoph363: pasa \noliverdu70: pasa \n*** TURN *** [3h 6h 8d] [3d]\nTropki: pasa \nchristoph363: apuesta 0.08 €\noliverdu70: se retira \nTropki: se retira \nLa apuesta no igualada (0.08 €) ha sido devuelta a christoph363\nchristoph363 se lleva 0.06 € del bote \n*** RESUMEN ***\nBote total 0.06 € | Comisión 0 € \nComunitarias [3h 6h 8d 3d]\nAsiento 1: SrLyce (botón) se retiró antes del Flop (no apostó)\nAsiento 2: Tropki (ciega pequeña) se retiró en el Turn\nAsiento 3: christoph363 (ciega grande) recaudó (0.06 €)\nAsiento 4: oliverdu70 se retiró en el Turn\nAsiento 5: hadhod1976 se retiró antes del Flop (no apostó)\nAsiento 6: MitchATP65 se retiró antes del Flop (no apostó)"
}