{
  "hand_id": "257238423497",
  "date": "06-08-2025 18:57:08",
  "table": "Alruccabah II",
  "game_type": "holdem",
  "hero": "SrLyce",
  "hero_position": "",
  "hero_cards": [
    "3h",
    "2c"
  ],
  "stacks": {
    "SrLyce": 136.0,
    "zoioachado": 40.0,
    "yonisanlu": 101.5,
    "Nicanor Cast": 52.5,
    "rayao32": 44.5
  },
  "actions": {
    "preflop": [
      "Asiento 1: SrLyce (2.72 € en fichas)",
      "Asiento 2: zoioachado (0.80 € en fichas)",
      "Asiento 3: yonisanlu (2.03 € en fichas)",
      "Asiento 4: serviettski(fr) (2.05 € en fichas)",
      "Asiento 5: Nicanor Cast (1.05 € en fichas)",
      "Asiento 6: rayao32 (0.89 € en fichas)",
      "rayao32: pone la ciega pequeña 0.01 €",
      "SrLyce: pone la ciega grande 0.02 €",
      "zoioachado: se retira",
      "yonisanlu: se retira",
      "serviettski(fr): se retira",
      "Nicanor Cast: se retira",
      "rayao32: iguala 0.01 €",
      "SrLyce: pasa"
    ],
    "flop": [
      "rayao32: pasa",
      "SrLyce: pasa"
    ],
    "turn": [
      "rayao32: pasa",
      "SrLyce: pasa"
    ],
    "river": [
      "rayao32: pasa",
      "SrLyce: apuesta 0.02 €",
      "rayao32: se retira",
      "SrLyce: no muestra su mano",
      "Asiento 1: SrLyce (ciega grande) recaudó (0.04 €)",
      "Asiento 2: zoioachado se retiró antes del Flop (no apostó)",
      "Asiento 3: yonisanlu se retiró antes del Flop (no apostó)",
      "Asiento 4: serviettski(fr) se retiró antes del Flop (no apostó)",
      "Asiento 5: Nicanor Cast (botón) se retiró antes del Flop (no apostó)",
      "Asiento 6: rayao32 (ciega pequeña) se retiró en el River"
    ]
  },
  "board": [
    "3c",
    "8s",
    "Qh",
    "Kc",
    "Qc"
  ],
  "winner": "SrLyce",
  "win_amount": 2.0,
  "sb": 0.01,
  "bb": 0.02,
  "rake": 0.0,
  "raw_text": "Mano n.º 257238423497 de PokerStars:  Hold'em No Limit (0.01 €/0.02 € EUR) - 06-08-2025 18:57:08 CET [06-08-2025 12:57:08 ET]\nMesa \"Alruccabah II\" 6-max El asiento n.º 5 es el botón\nAsiento 1: SrLyce (2.72 € en fichas) \nAsiento 2: zoioachado (0.80 € en fichas) \nAsiento 3: yonisanlu (2.03 € en fichas) \nAsiento 4: serviettski(fr) (2.05 € en fichas) \nAsiento 5: Nicanor Cast (1.05 € en fichas) \nAsiento 6: rayao32 (0.89 € en fichas) \nrayao32: pone la ciega pequeña 0.01 €\nSrLyce: pone la ciega grande 0.02 €\n*** CARTAS DE MANO ***\nRepartidas a SrLyce [3h 2c]\nzoioachado: se retira \nyonisanlu: se retira \nserviettski(fr): se retira \nNicanor Cast: se retira \nrayao32: iguala 0.01 €\nSrLyce: pasa \n*** FLOP *** [3c 8s Qh]\nrayao32: pasa \nSrLyce: pasa \n*** TURN *** [3c 8s Qh] [Kc]\nrayao32: pasa \nSrLyce: pasa \n*** RIVER *** [3c 8s Qh Kc] [Qc]\nrayao32: pasa \nSrLyce: apuesta 0.02 €\nrayao32: se retira \nLa apuesta no igualada (0.02 €) ha sido devuelta a SrLyce\nSrLyce se lleva 0.04 € del bote \nSrLyce: no muestra su mano \n*** RESUMEN ***\nBote total 0.04 € | Comisión 0 € \nComunitarias [3c 8s Qh Kc Qc]\nAsiento 1: SrLyce (ciega grande) recaudó (0.04 €)\nAsiento 2: zoioachado se retiró antes del Flop (no apostó)\nAsiento 3: yonisanlu se retiró antes del Flop (no apostó)\nAsiento 4: serviettski(fr) se retiró antes del Flop (no apostó)\nAsiento 5: Nicanor Cast (botón) se retiró antes del Flop (no apostó)\nAsiento 6: rayao32 (ciega pequeña) se retiró en el River"
}