{
  "hand_id": "257149985183",
  "date": "30-07-2025 23:10:24",
  "table": "Gilgamesh",
  "game_type": "holdem",
  "hero": "SrLyce",
  "hero_position": "",
  "hero_cards": [
    "Ad",
    "3h"
  ],
  "stacks": {
    "riverrrrrrmagic": 117.0,
    "SrLyce": 111.5,
    "Jumby34": 100.0,
    "xapkk": 100.0,
    "cbo54": 177.5,
    "Fretzo67500": 103.5
  },
  "actions": {
    "preflop": [
      "Asiento 1: riverrrrrrmagic (2.34 € en fichas)",
      "Asiento 2: SrLyce (2.23 € en fichas)",
      "Asiento 3: Jumby34 (2 € en fichas)",
      "Asiento 4: xapkk (2 € en fichas)",
      "Asiento 5: cbo54 (3.55 € en fichas)",
      "Asiento 6: Fretzo67500 (2.07 € en fichas)",
      "xapkk: pone la ciega pequeña 0.01 €",
      "cbo54: pone la ciega grande 0.02 €",
      "Fretzo67500: iguala 0.02 €",
      "riverrrrrrmagic: sube 0.02 € a 0.04 €",
      "SrLyce: se retira",
      "Jumby34: se retira",
      "xapkk: sube 0.12 € a 0.16 €",
      "cbo54: se retira",
      "Fretzo67500: se retira",
      "riverrrrrrmagic: se retira",
      "xapkk: no muestra su mano",
      "Asiento 1: riverrrrrrmagic se retiró antes del Flop",
      "Asiento 2: SrLyce se retiró antes del Flop (no apostó)",
      "Asiento 3: Jumby34 (botón) se retiró antes del Flop (no apostó)",
      "Asiento 4: xapkk (ciega pequeña) recaudó (0.12 €)",
      "Asiento 5: cbo54 (ciega grande) se retiró antes del Flop",
      "Asiento 6: Fretzo67500 se retiró antes del Flop"
    ],
    "flop": [],
    "turn": [],
    "river": []
  },
  "board": [],
  "winner": "xapkk",
  "win_amount": 6.0,
  "sb": 0.01,
  "bb": 0.02,
  "rake": 0.0,
  "raw_text": "Mano n.º 257149985183 de PokerStars:  Hold'em No Limit (0.01 €/0.02 € EUR) - 30-07-2025 23:10:24 CET [30-07-2025 17:10:24 ET]\nMesa \"Gilgamesh\" 6-max El asiento n.º 3 es el botón\nAsiento 1: riverrrrrrmagic (2.34 € en fichas) \nAsiento 2: SrLyce (2.23 € en fichas) \nAsiento 3: Jumby34 (2 € en fichas) \nAsiento 4: xapkk (2 € en fichas) \nAsiento 5: cbo54 (3.55 € en fichas) \nAsiento 6: Fretzo67500 (2.07 € en fichas) \nxapkk: pone la ciega pequeña 0.01 €\ncbo54: pone la ciega grande 0.02 €\n*** CARTAS DE MANO ***\nRepartidas a SrLyce [Ad 3h]\nFretzo67500: iguala 0.02 €\nriverrrrrrmagic: sube 0.02 € a 0.04 €\nSrLyce: se retira \nJumby34: se retira \nxapkk: sube 0.12 € a 0.16 €\ncbo54: se retira \nFretzo67500: se retira \nriverrrrrrmagic: se retira \nLa apuesta no igualada (0.12 €) ha sido devuelta a xapkk\ncbo54 deja la mesa\nxapkk se lleva 0.12 € del bote \nxapkk: no muestra su mano \n*** RESUMEN ***\nBote total 0.12 € | Comisión 0 € \nAsiento 1: riverrrrrrmagic se retiró antes del Flop\nAsiento 2: SrLyce se retiró antes del Flop (no apostó)\nAsiento 3: Jumby34 (botón) se retiró antes del Flop (no apostó)\nAsiento 4: xapkk (ciega pequeña) recaudó (0.12 €)\nAsiento 5: cbo54 (ciega grande) se retiró antes del Flop\nAsiento 6: Fretzo67500 se retiró antes del Flop"
}