{
  "hand_id": "257149143323",
  "date": "30-07-2025 22:11:04",
  "table": "Esclangona",
  "game_type": "holdem",
  "hero": "SrLyce",
  "hero_position": "",
  "hero_cards": [
    "Qc",
    "4s"
  ],
  "stacks": {
    "Zorgue1080": 56.5,
    "SrLyce": 100.0,
    "NoahBolete": 123.5,
    "Davdgoni": 224.0,
    "DiaZzZ1": 100.5,
    "elketefaka1": 100.0
  },
  "actions": {
    "preflop": [
      "Asiento 1: Zorgue1080 (1.13 € en fichas)",
      "Asiento 2: SrLyce (2 € en fichas)",
      "Asiento 3: NoahBolete (2.47 € en fichas)",
      "Asiento 4: Davdgoni (4.48 € en fichas)",
      "Asiento 5: DiaZzZ1 (2.01 € en fichas)",
      "Asiento 6: elketefaka1 (2 € en fichas)",
      "DiaZzZ1: pone la ciega pequeña 0.01 €",
      "elketefaka1: pone la ciega grande 0.02 €",
      "Zorgue1080: se retira",
      "SrLyce: se retira",
      "NoahBolete: sube 0.02 € a 0.04 €",
      "Davdgoni: se retira",
      "DiaZzZ1: se retira",
      "elketefaka1: iguala 0.02 €"
    ],
    "flop": [
      "elketefaka1: pasa",
      "NoahBolete: apuesta 0.04 €",
      "elketefaka1: iguala 0.04 €"
    ],
    "turn": [
      "elketefaka1: pasa",
      "NoahBolete: pasa"
    ],
    "river": [
      "elketefaka1: apuesta 0.16 €",
      "NoahBolete: iguala 0.16 €",
      "elketefaka1: muestra [7s Kh] (escalera, de diez a as)",
      "NoahBolete: muestra [Ad 5c] (escalera, de diez a as)",
      "Asiento 1: Zorgue1080 se retiró antes del Flop (no apostó)",
      "Asiento 2: SrLyce se retiró antes del Flop (no apostó)",
      "Asiento 3: NoahBolete muestra [Ad 5c] y ganó (0.23 €) con escalera, de diez a as",
      "Asiento 4: Davdgoni (botón) se retiró antes del Flop (no apostó)",
      "Asiento 5: DiaZzZ1 (ciega pequeña) se retiró antes del Flop",
      "Asiento 6: elketefaka1 (ciega grande) muestra [7s Kh] y ganó (0.23 €) con escalera, de diez a as"
    ]
  },
  "board": [
    "Ah",
    "Th",
    "Jh",
    "Kc",
    "Qd"
  ],
  "winner": "elketefaka1",
  "win_amount": 11.5,
  "sb": 0.01,
  "bb": 0.02,
  "rake": 1.5,
  "raw_text": "Mano n.º 257149143323 de PokerStars:  Hold'em No Limit (0.01 €/0.02 € EUR) - 30-07-2025 22:11:04 CET [30-07-2025 16:11:04 ET]\nMesa \"Esclangona\" 6-max El asiento n.º 4 es el botón\nAsiento 1: Zorgue1080 (1.13 € en fichas) \nAsiento 2: SrLyce (2 € en fichas) \nAsiento 3: NoahBolete (2.47 € en fichas) \nAsiento 4: Davdgoni (4.48 € en fichas) \nAsiento 5: DiaZzZ1 (2.01 € en fichas) \nAsiento 6: elketefaka1 (2 € en fichas) \nDiaZzZ1: pone la ciega pequeña 0.01 €\nelketefaka1: pone la ciega grande 0.02 €\n*** CARTAS DE MANO ***\nRepartidas a SrLyce [Qc 4s]\nZorgue1080: se retira \nSrLyce: se retira \nNoahBolete: sube 0.02 € a 0.04 €\nDavdgoni: se retira \nDiaZzZ1: se retira \nelketefaka1: iguala 0.02 €\n*** FLOP *** [Ah Th Jh]\nelketefaka1: pasa \nNoahBolete: apuesta 0.04 €\nelketefaka1: iguala 0.04 €\n*** TURN *** [Ah Th Jh] [Kc]\nelketefaka1: pasa \nNoahBolete: pasa \n*** RIVER *** [Ah Th Jh Kc] [Qd]\nelketefaka1: apuesta 0.16 €\nNoahBolete: iguala 0.16 €\n*** SHOW DOWN ***\nelketefaka1: muestra [7s Kh] (escalera, de diez a as)\nNoahBolete: muestra [Ad 5c] (escalera, de diez a as)\nelketefaka1 se lleva 0.23 € del bote \nNoahBolete se lleva 0.23 € del bote \n*** RESUMEN ***\nBote total 0.49 € | Comisión 0.03 € \nComunitarias [Ah Th Jh Kc Qd]\nAsiento 1: Zorgue1080 se retiró antes del Flop (no apostó)\nAsiento 2: SrLyce se retiró antes del Flop (no apostó)\nAsiento 3: NoahBolete muestra [Ad 5c] y ganó (0.23 €) con escalera, de diez a as\nAsiento 4: Davdgoni (botón) se retiró antes del Flop (no apostó)\nAsiento 5: DiaZzZ1 (ciega pequeña) se retiró antes del Flop\nAsiento 6: elketefaka1 (ciega grande) muestra [7s Kh] y ganó (0.23 €) con escalera, de diez a as"
}