{
  "hand_id": "257215184749",
  "date": "04-08-2025 22:29:39",
  "table": "Aldhafera II",
  "game_type": "holdem",
  "hero": "SrLyce",
  "hero_position": "",
  "hero_cards": [
    "Td",
    "6s"
  ],
  "stacks": {
    "wsx25": 88.0,
    "BudyXXIII": 293.0,
    "SrLyce": 97.0,
    "rhidoxxx": 66.5,
    "jte-ken": 105.5,
    "betterrrrrr": 180.5
  },
  "actions": {
    "preflop": [
      "Asiento 1: wsx25 (1.76 € en fichas)",
      "Asiento 2: BudyXXIII (5.86 € en fichas)",
      "Asiento 3: SrLyce (1.94 € en fichas)",
      "Asiento 4: rhidoxxx (1.33 € en fichas)",
      "Asiento 5: jte-ken (2.11 € en fichas)",
      "Asiento 6: betterrrrrr (3.61 € en fichas)",
      "BudyXXIII: pone la ciega pequeña 0.01 €",
      "SrLyce: pone la ciega grande 0.02 €",
      "rhidoxxx: se retira",
      "jte-ken: se retira",
      "betterrrrrr: se retira",
      "wsx25: se retira",
      "BudyXXIII: se retira",
      "SrLyce: no muestra su mano",
      "Asiento 1: wsx25 (botón) se retiró antes del Flop (no apostó)",
      "Asiento 2: BudyXXIII (ciega pequeña) se retiró antes del Flop",
      "Asiento 3: SrLyce (ciega grande) recaudó (0.02 €)",
      "Asiento 4: rhidoxxx se retiró antes del Flop (no apostó)",
      "Asiento 5: jte-ken se retiró antes del Flop (no apostó)",
      "Asiento 6: betterrrrrr se retiró antes del Flop (no apostó)"
    ],
    "flop": [],
    "turn": [],
    "river": []
  },
  "board": [],
  "winner": "SrLyce",
  "win_amount": 1.0,
  "sb": 0.01,
  "bb": 0.02,
  "rake": 0.0,
  "raw_text": "Mano n.º 257215184749 de PokerStars:  Hold'em No Limit (0.01 €/0.02 € EUR) - 04-08-2025 22:29:39 CET [04-08-2025 16:29:39 ET]\nMesa \"Aldhafera II\" 6-max El asiento n.º 1 es el botón\nAsiento 1: wsx25 (1.76 € en fichas) \nAsiento 2: BudyXXIII (5.86 € en fichas) \nAsiento 3: SrLyce (1.94 € en fichas) \nAsiento 4: rhidoxxx (1.33 € en fichas) \nAsiento 5: jte-ken (2.11 € en fichas) \nAsiento 6: betterrrrrr (3.61 € en fichas) \nBudyXXIII: pone la ciega pequeña 0.01 €\nSrLyce: pone la ciega grande 0.02 €\n*** CARTAS DE MANO ***\nRepartidas a SrLyce [Td 6s]\nrhidoxxx: se retira \njte-ken: se retira \nbetterrrrrr: se retira \nwsx25: se retira \nBudyXXIII: se retira \nLa apuesta no igualada (0.01 €) ha sido devuelta a SrLyce\nSrLyce se lleva 0.02 € del bote \nSrLyce: no muestra su mano \n*** RESUMEN ***\nBote total 0.02 € | Comisión 0 € \nAsiento 1: wsx25 (botón) se retiró antes del Flop (no apostó)\nAsiento 2: BudyXXIII (ciega pequeña) se retiró antes del Flop\nAsiento 3: SrLyce (ciega grande) recaudó (0.02 €)\nAsiento 4: rhidoxxx se retiró antes del Flop (no apostó)\nAsiento 5: jte-ken se retiró antes del Flop (no apostó)\nAsiento 6: betterrrrrr se retiró antes del Flop (no apostó)"
}