{
  "hand_id": "257150130295",
  "date": "30-07-2025 23:20:22",
  "table": "Gilgamesh",
  "game_type": "holdem",
  "hero": "SrLyce",
  "hero_position": "",
  "hero_cards": [
    "Qd",
    "Kc"
  ],
  "stacks": {
    "riverrrrrrmagic": 125.5,
    "SrLyce": 96.0,
    "Jumby34": 101.5,
    "xapkk": 100.0,
    "samaritano34": 92.0,
    "Fretzo67500": 122.5
  },
  "actions": {
    "preflop": [
      "Asiento 1: riverrrrrrmagic (2.51 € en fichas)",
      "Asiento 2: SrLyce (1.92 € en fichas)",
      "Asiento 3: Jumby34 (2.03 € en fichas)",
      "Asiento 4: xapkk (2 € en fichas)",
      "Asiento 5: samaritano34 (1.84 € en fichas)",
      "Asiento 6: Fretzo67500 (2.45 € en fichas)",
      "riverrrrrrmagic: pone la ciega pequeña 0.01 €",
      "SrLyce: pone la ciega grande 0.02 €",
      "Jumby34: se retira",
      "xapkk: se retira",
      "samaritano34: se retira",
      "Fretzo67500: se retira",
      "riverrrrrrmagic: iguala 0.01 €",
      "SrLyce: pasa"
    ],
    "flop": [
      "riverrrrrrmagic: pasa",
      "SrLyce: apuesta 0.04 €",
      "riverrrrrrmagic: iguala 0.04 €"
    ],
    "turn": [
      "riverrrrrrmagic: pasa",
      "SrLyce: apuesta 0.06 €",
      "riverrrrrrmagic: se retira",
      "SrLyce: no muestra su mano",
      "Asiento 1: riverrrrrrmagic (ciega pequeña) se retiró en el Turn",
      "Asiento 2: SrLyce (ciega grande) recaudó (0.11 €)",
      "Asiento 3: Jumby34 se retiró antes del Flop (no apostó)",
      "Asiento 4: xapkk se retiró antes del Flop (no apostó)",
      "Asiento 5: samaritano34 se retiró antes del Flop (no apostó)",
      "Asiento 6: Fretzo67500 (botón) se retiró antes del Flop (no apostó)"
    ],
    "river": []
  },
  "board": [
    "Th",
    "Ks",
    "8s",
    "Js"
  ],
  "winner": "SrLyce",
  "win_amount": 5.5,
  "sb": 0.01,
  "bb": 0.02,
  "rake": 0.5,
  "raw_text": "Mano n.º 257150130295 de PokerStars:  Hold'em No Limit (0.01 €/0.02 € EUR) - 30-07-2025 23:20:22 CET [30-07-2025 17:20:22 ET]\nMesa \"Gilgamesh\" 6-max El asiento n.º 6 es el botón\nAsiento 1: riverrrrrrmagic (2.51 € en fichas) \nAsiento 2: SrLyce (1.92 € en fichas) \nAsiento 3: Jumby34 (2.03 € en fichas) \nAsiento 4: xapkk (2 € en fichas) \nAsiento 5: samaritano34 (1.84 € en fichas) \nAsiento 6: Fretzo67500 (2.45 € en fichas) \nriverrrrrrmagic: pone la ciega pequeña 0.01 €\nSrLyce: pone la ciega grande 0.02 €\n*** CARTAS DE MANO ***\nRepartidas a SrLyce [Qd Kc]\nJumby34: se retira \nxapkk: se retira \nsamaritano34: se retira \nFretzo67500: se retira \nriverrrrrrmagic: iguala 0.01 €\nSrLyce: pasa \n*** FLOP *** [Th Ks 8s]\nriverrrrrrmagic: pasa \nSrLyce: apuesta 0.04 €\nriverrrrrrmagic: iguala 0.04 €\n*** TURN *** [Th Ks 8s] [Js]\nriverrrrrrmagic: pasa \nSrLyce: apuesta 0.06 €\nriverrrrrrmagic: se retira \nLa apuesta no igualada (0.06 €) ha sido devuelta a SrLyce\nSrLyce se lleva 0.11 € del bote \nSrLyce: no muestra su mano \n*** RESUMEN ***\nBote total 0.12 € | Comisión 0.01 € \nComunitarias [Th Ks 8s Js]\nAsiento 1: riverrrrrrmagic (ciega pequeña) se retiró en el Turn\nAsiento 2: SrLyce (ciega grande) recaudó (0.11 €)\nAsiento 3: Jumby34 se retiró antes del Flop (no apostó)\nAsiento 4: xapkk se retiró antes del Flop (no apostó)\nAsiento 5: samaritano34 se retiró antes del Flop (no apostó)\nAsiento 6: Fretzo67500 (botón) se retiró antes del Flop (no apostó)"
}