{
  "hand_id": "257215094611",
  "date": "04-08-2025 22:24:02",
  "table": "Anneliese II",
  "game_type": "holdem",
  "hero": "SrLyce",
  "hero_position": "",
  "hero_cards": [
    "3c",
    "9c"
  ],
  "stacks": {
    "ElManu62": 114.5,
    "betterrrrrr": 101.0,
    "piropanzer": 53.5,
    "SrLyce": 98.5,
    "Mr_Pkr98": 136.5,
    "Spotick": 116.5
  },
  "actions": {
    "preflop": [
      "Asiento 3: ElManu62 (2.29 € en fichas) está ausente",
      "Asiento 1: betterrrrrr (2.02 € en fichas)",
      "Asiento 2: piropanzer (1.07 € en fichas)",
      "Asiento 4: SrLyce (1.97 € en fichas)",
      "Asiento 5: Mr_Pkr98 (2.73 € en fichas)",
      "Asiento 6: Spotick (2.33 € en fichas)",
      "Mr_Pkr98: pone la ciega pequeña 0.01 €",
      "Spotick: pone la ciega grande 0.02 €",
      "betterrrrrr: se retira",
      "piropanzer: iguala 0.02 €",
      "SrLyce: se retira",
      "Mr_Pkr98: se retira",
      "Spotick: pasa"
    ],
    "flop": [
      "Spotick: apuesta 0.03 €",
      "piropanzer: se retira",
      "Spotick: no muestra su mano",
      "Asiento 3: ElManu62",
      "Asiento 1: betterrrrrr se retiró antes del Flop (no apostó)",
      "Asiento 2: piropanzer se retiró en el Flop",
      "Asiento 4: SrLyce (botón) se retiró antes del Flop (no apostó)",
      "Asiento 5: Mr_Pkr98 (ciega pequeña) se retiró antes del Flop",
      "Asiento 6: Spotick (ciega grande) recaudó (0.05 €)"
    ],
    "turn": [],
    "river": []
  },
  "board": [
    "Js",
    "Th",
    "7s"
  ],
  "winner": "Spotick",
  "win_amount": 2.5,
  "sb": 0.01,
  "bb": 0.02,
  "rake": 0.0,
  "raw_text": "Mano n.º 257215094611 de PokerStars:  Hold'em No Limit (0.01 €/0.02 € EUR) - 04-08-2025 22:24:02 CET [04-08-2025 16:24:02 ET]\nMesa \"Anneliese II\" 6-max El asiento n.º 4 es el botón\nAsiento 3: ElManu62 (2.29 € en fichas) está ausente\nAsiento 1: betterrrrrr (2.02 € en fichas) \nAsiento 2: piropanzer (1.07 € en fichas) \nAsiento 4: SrLyce (1.97 € en fichas) \nAsiento 5: Mr_Pkr98 (2.73 € en fichas) \nAsiento 6: Spotick (2.33 € en fichas) \nMr_Pkr98: pone la ciega pequeña 0.01 €\nSpotick: pone la ciega grande 0.02 €\n*** CARTAS DE MANO ***\nRepartidas a SrLyce [3c 9c]\nbetterrrrrr: se retira \npiropanzer: iguala 0.02 €\nSrLyce: se retira \nMr_Pkr98: se retira \nSpotick: pasa \n*** FLOP *** [Js Th 7s]\nSpotick: apuesta 0.03 €\npiropanzer: se retira \nLa apuesta no igualada (0.03 €) ha sido devuelta a Spotick\nSpotick se lleva 0.05 € del bote \nSpotick: no muestra su mano \n*** RESUMEN ***\nBote total 0.05 € | Comisión 0 € \nComunitarias [Js Th 7s]\nAsiento 3: ElManu62\nAsiento 1: betterrrrrr se retiró antes del Flop (no apostó)\nAsiento 2: piropanzer se retiró en el Flop\nAsiento 4: SrLyce (botón) se retiró antes del Flop (no apostó)\nAsiento 5: Mr_Pkr98 (ciega pequeña) se retiró antes del Flop\nAsiento 6: Spotick (ciega grande) recaudó (0.05 €)"
}