{
  "hand_id": "257238622517",
  "date": "06-08-2025 19:15:16",
  "table": "Herculina II",
  "game_type": "holdem",
  "hero": "SrLyce",
  "hero_position": "",
  "hero_cards": [
    "4c",
    "Td"
  ],
  "stacks": {
    "Macklemore0": 102.5,
    "Alceo27": 115.0,
    "David98X": 172.5,
    "JJer11": 199.5,
    "SrLyce": 97.5,
    "ScarvBlack": 107.5
  },
  "actions": {
    "preflop": [
      "Asiento 5: Macklemore0 (2.05 € en fichas) está ausente",
      "Asiento 1: Alceo27 (2.30 € en fichas)",
      "Asiento 2: David98X (3.45 € en fichas)",
      "Asiento 3: JJer11 (3.99 € en fichas)",
      "Asiento 4: SrLyce (1.95 € en fichas)",
      "Asiento 6: ScarvBlack (2.15 € en fichas)",
      "David98X: pone la ciega pequeña 0.01 €",
      "JJer11: pone la ciega grande 0.02 €",
      "SrLyce: se retira",
      "ScarvBlack: se retira",
      "Alceo27: iguala 0.02 €",
      "David98X: sube 0.08 € a 0.10 €",
      "JJer11: se retira",
      "Alceo27: iguala 0.08 €"
    ],
    "flop": [
      "David98X: apuesta 0.07 €",
      "Alceo27: iguala 0.07 €"
    ],
    "turn": [
      "David98X: pasa",
      "Alceo27: pasa"
    ],
    "river": [
      "David98X: pasa",
      "Alceo27: apuesta 0.11 €",
      "David98X: se retira",
      "Alceo27: no muestra su mano",
      "Asiento 5: Macklemore0",
      "Asiento 1: Alceo27 (botón) recaudó (0.34 €)",
      "Asiento 2: David98X (ciega pequeña) se retiró en el River",
      "Asiento 3: JJer11 (ciega grande) se retiró antes del Flop",
      "Asiento 4: SrLyce se retiró antes del Flop (no apostó)",
      "Asiento 6: ScarvBlack se retiró antes del Flop (no apostó)"
    ]
  },
  "board": [
    "5h",
    "6d",
    "6c",
    "Ac",
    "9d"
  ],
  "winner": "Alceo27",
  "win_amount": 17.0,
  "sb": 0.01,
  "bb": 0.02,
  "rake": 1.0,
  "raw_text": "Mano n.º 257238622517 de PokerStars:  Hold'em No Limit (0.01 €/0.02 € EUR) - 06-08-2025 19:15:16 CET [06-08-2025 13:15:16 ET]\nMesa \"Herculina II\" 6-max El asiento n.º 1 es el botón\nAsiento 5: Macklemore0 (2.05 € en fichas) está ausente\nAsiento 1: Alceo27 (2.30 € en fichas) \nAsiento 2: David98X (3.45 € en fichas) \nAsiento 3: JJer11 (3.99 € en fichas) \nAsiento 4: SrLyce (1.95 € en fichas) \nAsiento 6: ScarvBlack (2.15 € en fichas) \nDavid98X: pone la ciega pequeña 0.01 €\nJJer11: pone la ciega grande 0.02 €\n*** CARTAS DE MANO ***\nRepartidas a SrLyce [4c Td]\nSrLyce: se retira \nScarvBlack: se retira \nAlceo27: iguala 0.02 €\nDavid98X: sube 0.08 € a 0.10 €\nJJer11: se retira \nAlceo27: iguala 0.08 €\n*** FLOP *** [5h 6d 6c]\nDavid98X: apuesta 0.07 €\nAlceo27: iguala 0.07 €\n*** TURN *** [5h 6d 6c] [Ac]\nDavid98X: pasa \nAlceo27: pasa \n*** RIVER *** [5h 6d 6c Ac] [9d]\nDavid98X: pasa \nAlceo27: apuesta 0.11 €\nDavid98X: se retira \nLa apuesta no igualada (0.11 €) ha sido devuelta a Alceo27\nAlceo27 se lleva 0.34 € del bote \nAlceo27: no muestra su mano \n*** RESUMEN ***\nBote total 0.36 € | Comisión 0.02 € \nComunitarias [5h 6d 6c Ac 9d]\nAsiento 5: Macklemore0\nAsiento 1: Alceo27 (botón) recaudó (0.34 €)\nAsiento 2: David98X (ciega pequeña) se retiró en el River\nAsiento 3: JJer11 (ciega grande) se retiró antes del Flop\nAsiento 4: SrLyce se retiró antes del Flop (no apostó)\nAsiento 6: ScarvBlack se retiró antes del Flop (no apostó)"
}