{
  "hand_id": "257238608955",
  "date": "06-08-2025 19:14:08",
  "table": "Leonteus",
  "game_type": "holdem",
  "hero": "SrLyce",
  "hero_position": "",
  "hero_cards": [
    "8c",
    "5d"
  ],
  "stacks": {
    "BuXHexter": 145.5,
    "practikal_C23": 47.5,
    "davinci1962": 150.5,
    "Andark47": 166.0,
    "SrLyce": 108.0
  },
  "actions": {
    "preflop": [
      "Asiento 4: BuXHexter (2.91 € en fichas) está ausente",
      "Asiento 1: practikal_C23 (0.95 € en fichas)",
      "Asiento 3: davinci1962 (3.01 € en fichas)",
      "Asiento 5: Andark47 (3.32 € en fichas)",
      "Asiento 6: SrLyce (2.16 € en fichas)",
      "SrLyce: pone la ciega pequeña 0.01 €",
      "practikal_C23: pone la ciega grande 0.02 €",
      "BuXHexter: se ausenta",
      "davinci1962: se retira",
      "Andark47: se retira",
      "SrLyce: se retira",
      "Asiento 4: BuXHexter",
      "Asiento 1: practikal_C23 (ciega grande) recaudó (0.02 €)",
      "Asiento 3: davinci1962 se retiró antes del Flop (no apostó)",
      "Asiento 5: Andark47 (botón) se retiró antes del Flop (no apostó)",
      "Asiento 6: SrLyce (ciega pequeña) se retiró antes del Flop"
    ],
    "flop": [],
    "turn": [],
    "river": []
  },
  "board": [],
  "winner": "practikal_C23",
  "win_amount": 1.0,
  "sb": 0.01,
  "bb": 0.02,
  "rake": 0.0,
  "raw_text": "Mano n.º 257238608955 de PokerStars:  Hold'em No Limit (0.01 €/0.02 € EUR) - 06-08-2025 19:14:08 CET [06-08-2025 13:14:08 ET]\nMesa \"Leonteus\" 6-max El asiento n.º 5 es el botón\nAsiento 4: BuXHexter (2.91 € en fichas) está ausente\nAsiento 1: practikal_C23 (0.95 € en fichas) \nAsiento 3: davinci1962 (3.01 € en fichas) \nAsiento 5: Andark47 (3.32 € en fichas) \nAsiento 6: SrLyce (2.16 € en fichas) \nSrLyce: pone la ciega pequeña 0.01 €\npractikal_C23: pone la ciega grande 0.02 €\nBuXHexter: se ausenta \n*** CARTAS DE MANO ***\nRepartidas a SrLyce [8c 5d]\ndavinci1962: se retira \nAndark47: se retira \nSrLyce: se retira \nLa apuesta no igualada (0.01 €) ha sido devuelta a practikal_C23\npractikal_C23 se lleva 0.02 € del bote \n*** RESUMEN ***\nBote total 0.02 € | Comisión 0 € \nAsiento 4: BuXHexter\nAsiento 1: practikal_C23 (ciega grande) recaudó (0.02 €)\nAsiento 3: davinci1962 se retiró antes del Flop (no apostó)\nAsiento 5: Andark47 (botón) se retiró antes del Flop (no apostó)\nAsiento 6: SrLyce (ciega pequeña) se retiró antes del Flop"
}