{
  "hand_id": "257215288864",
  "date": "04-08-2025 22:36:05",
  "table": "Aldhafera II",
  "game_type": "holdem",
  "hero": "SrLyce",
  "hero_position": "",
  "hero_cards": [
    "3s",
    "8h"
  ],
  "stacks": {
    "BudyXXIII": 292.5,
    "wsx25": 62.5,
    "SrLyce": 98.5,
    "rhidoxxx": 75.5,
    "jte-ken": 124.0,
    "betterrrrrr": 171.5
  },
  "actions": {
    "preflop": [
      "Asiento 2: BudyXXIII (5.85 € en fichas) está ausente",
      "Asiento 1: wsx25 (1.25 € en fichas)",
      "Asiento 3: SrLyce (1.97 € en fichas)",
      "Asiento 4: rhidoxxx (1.51 € en fichas)",
      "Asiento 5: jte-ken (2.48 € en fichas)",
      "Asiento 6: betterrrrrr (3.43 € en fichas)",
      "wsx25: pone la ciega pequeña 0.01 €",
      "BudyXXIII: está ausente",
      "SrLyce: pone la ciega grande 0.02 €",
      "rhidoxxx: se retira",
      "jte-ken: se retira",
      "betterrrrrr: se retira",
      "wsx25: sube 0.04 € a 0.06 €",
      "SrLyce: se retira",
      "wsx25: no muestra su mano",
      "Asiento 2: BudyXXIII",
      "Asiento 1: wsx25 (ciega pequeña) recaudó (0.04 €)",
      "Asiento 3: SrLyce (ciega grande) se retiró antes del Flop",
      "Asiento 4: rhidoxxx se retiró antes del Flop (no apostó)",
      "Asiento 5: jte-ken se retiró antes del Flop (no apostó)",
      "Asiento 6: betterrrrrr (botón) se retiró antes del Flop (no apostó)"
    ],
    "flop": [],
    "turn": [],
    "river": []
  },
  "board": [],
  "winner": "wsx25",
  "win_amount": 2.0,
  "sb": 0.01,
  "bb": 0.02,
  "rake": 0.0,
  "raw_text": "Mano n.º 257215288864 de PokerStars:  Hold'em No Limit (0.01 €/0.02 € EUR) - 04-08-2025 22:36:05 CET [04-08-2025 16:36:05 ET]\nMesa \"Aldhafera II\" 6-max El asiento n.º 6 es el botón\nAsiento 2: BudyXXIII (5.85 € en fichas) está ausente\nAsiento 1: wsx25 (1.25 € en fichas) \nAsiento 3: SrLyce (1.97 € en fichas) \nAsiento 4: rhidoxxx (1.51 € en fichas) \nAsiento 5: jte-ken (2.48 € en fichas) \nAsiento 6: betterrrrrr (3.43 € en fichas) \nwsx25: pone la ciega pequeña 0.01 €\nBudyXXIII: está ausente \nSrLyce: pone la ciega grande 0.02 €\n*** CARTAS DE MANO ***\nRepartidas a SrLyce [3s 8h]\nrhidoxxx: se retira \njte-ken: se retira \nbetterrrrrr ha agotado su tiempo\nbetterrrrrr: se retira \nwsx25: sube 0.04 € a 0.06 €\nSrLyce: se retira \nLa apuesta no igualada (0.04 €) ha sido devuelta a wsx25\nwsx25 se lleva 0.04 € del bote \nwsx25: no muestra su mano \n*** RESUMEN ***\nBote total 0.04 € | Comisión 0 € \nAsiento 2: BudyXXIII\nAsiento 1: wsx25 (ciega pequeña) recaudó (0.04 €)\nAsiento 3: SrLyce (ciega grande) se retiró antes del Flop\nAsiento 4: rhidoxxx se retiró antes del Flop (no apostó)\nAsiento 5: jte-ken se retiró antes del Flop (no apostó)\nAsiento 6: betterrrrrr (botón) se retiró antes del Flop (no apostó)"
}