{
  "hand_id": "257168304272",
  "date": "01-08-2025 11:23:11",
  "table": "Jupiter",
  "game_type": "holdem",
  "hero": "SrLyce",
  "hero_position": "",
  "hero_cards": [
    "4h",
    "Ah"
  ],
  "stacks": {
    "sifilis5": 95.0,
    "Filou203": 113.0,
    "SrLyce": 113.5,
    "LOLA19711971": 31.0,
    "dadou13mars": 219.5,
    "Alvii37": 108.0
  },
  "actions": {
    "preflop": [
      "Asiento 1: sifilis5 (1.90 € en fichas)",
      "Asiento 2: Filou203 (2.26 € en fichas)",
      "Asiento 3: SrLyce (2.27 € en fichas)",
      "Asiento 4: LOLA19711971 (0.62 € en fichas)",
      "Asiento 5: dadou13mars (4.39 € en fichas)",
      "Asiento 6: Alvii37 (2.16 € en fichas)",
      "LOLA19711971: pone la ciega pequeña 0.01 €",
      "dadou13mars: pone la ciega grande 0.02 €",
      "Alvii37: se retira",
      "sifilis5: se retira",
      "Filou203: se retira",
      "SrLyce: sube 0.04 € a 0.06 €",
      "LOLA19711971: se retira",
      "dadou13mars: iguala 0.04 €"
    ],
    "flop": [
      "dadou13mars: pasa",
      "SrLyce: apuesta 0.04 €",
      "dadou13mars: iguala 0.04 €"
    ],
    "turn": [
      "dadou13mars: pasa",
      "SrLyce: pasa"
    ],
    "river": [
      "dadou13mars: pasa",
      "SrLyce: apuesta 0.10 €",
      "dadou13mars: se retira",
      "SrLyce: no muestra su mano",
      "Asiento 1: sifilis5 se retiró antes del Flop (no apostó)",
      "Asiento 2: Filou203 se retiró antes del Flop (no apostó)",
      "Asiento 3: SrLyce (botón) recaudó (0.20 €)",
      "Asiento 4: LOLA19711971 (ciega pequeña) se retiró antes del Flop",
      "Asiento 5: dadou13mars (ciega grande) se retiró en el River",
      "Asiento 6: Alvii37 se retiró antes del Flop (no apostó)"
    ]
  },
  "board": [
    "6c",
    "8s",
    "Qd",
    "Ac",
    "2c"
  ],
  "winner": "SrLyce",
  "win_amount": 10.0,
  "sb": 0.01,
  "bb": 0.02,
  "rake": 0.5,
  "raw_text": "Mano n.º 257168304272 de PokerStars:  Hold'em No Limit (0.01 €/0.02 € EUR) - 01-08-2025 11:23:11 CET [01-08-2025 5:23:11 ET]\nMesa \"Jupiter\" 6-max El asiento n.º 3 es el botón\nAsiento 1: sifilis5 (1.90 € en fichas) \nAsiento 2: Filou203 (2.26 € en fichas) \nAsiento 3: SrLyce (2.27 € en fichas) \nAsiento 4: LOLA19711971 (0.62 € en fichas) \nAsiento 5: dadou13mars (4.39 € en fichas) \nAsiento 6: Alvii37 (2.16 € en fichas) \nLOLA19711971: pone la ciega pequeña 0.01 €\ndadou13mars: pone la ciega grande 0.02 €\n*** CARTAS DE MANO ***\nRepartidas a SrLyce [4h Ah]\nAlvii37: se retira \nsifilis5: se retira \nFilou203 ha agotado su tiempo\nFilou203: se retira \nSrLyce: sube 0.04 € a 0.06 €\nLOLA19711971: se retira \ndadou13mars: iguala 0.04 €\n*** FLOP *** [6c 8s Qd]\ndadou13mars: pasa \nSrLyce: apuesta 0.04 €\ndadou13mars: iguala 0.04 €\n*** TURN *** [6c 8s Qd] [Ac]\ndadou13mars: pasa \nSrLyce: pasa \n*** RIVER *** [6c 8s Qd Ac] [2c]\ndadou13mars: pasa \nSrLyce: apuesta 0.10 €\ndadou13mars: se retira \nLa apuesta no igualada (0.10 €) ha sido devuelta a SrLyce\nSrLyce se lleva 0.20 € del bote \nSrLyce: no muestra su mano \n*** RESUMEN ***\nBote total 0.21 € | Comisión 0.01 € \nComunitarias [6c 8s Qd Ac 2c]\nAsiento 1: sifilis5 se retiró antes del Flop (no apostó)\nAsiento 2: Filou203 se retiró antes del Flop (no apostó)\nAsiento 3: SrLyce (botón) recaudó (0.20 €)\nAsiento 4: LOLA19711971 (ciega pequeña) se retiró antes del Flop\nAsiento 5: dadou13mars (ciega grande) se retiró en el River\nAsiento 6: Alvii37 se retiró antes del Flop (no apostó)"
}