{
  "hand_id": "257168266298",
  "date": "01-08-2025 11:15:57",
  "table": "Jupiter",
  "game_type": "holdem",
  "hero": "SrLyce",
  "hero_position": "",
  "hero_cards": [
    "Jc",
    "8c"
  ],
  "stacks": {
    "sifilis5": 99.0,
    "Filou203": 113.5,
    "SrLyce": 110.5,
    "LOLA19711971": 32.0,
    "dadou13mars": 228.5,
    "Alvii37": 100.0
  },
  "actions": {
    "preflop": [
      "Asiento 1: sifilis5 (1.98 € en fichas)",
      "Asiento 2: Filou203 (2.27 € en fichas)",
      "Asiento 3: SrLyce (2.21 € en fichas)",
      "Asiento 4: LOLA19711971 (0.64 € en fichas)",
      "Asiento 5: dadou13mars (4.57 € en fichas)",
      "Asiento 6: Alvii37 (2 € en fichas)",
      "sifilis5: pone la ciega pequeña 0.01 €",
      "Filou203: pone la ciega grande 0.02 €",
      "SrLyce: iguala 0.02 €",
      "LOLA19711971: se retira",
      "dadou13mars: se retira",
      "Alvii37: se retira",
      "sifilis5: se retira",
      "Filou203: sube 0.05 € a 0.07 €",
      "SrLyce: iguala 0.05 €"
    ],
    "flop": [
      "Filou203: pasa",
      "SrLyce: pasa"
    ],
    "turn": [
      "Filou203: apuesta 0.08 €",
      "SrLyce: se retira",
      "Filou203: no muestra su mano",
      "Asiento 1: sifilis5 (ciega pequeña) se retiró antes del Flop",
      "Asiento 2: Filou203 (ciega grande) recaudó (0.14 €)",
      "Asiento 3: SrLyce se retiró en el Turn",
      "Asiento 4: LOLA19711971 se retiró antes del Flop (no apostó)",
      "Asiento 5: dadou13mars se retiró antes del Flop (no apostó)",
      "Asiento 6: Alvii37 (botón) se retiró antes del Flop (no apostó)"
    ],
    "river": []
  },
  "board": [
    "9h",
    "5d",
    "4h",
    "3d"
  ],
  "winner": "Filou203",
  "win_amount": 7.0,
  "sb": 0.01,
  "bb": 0.02,
  "rake": 0.5,
  "raw_text": "Mano n.º 257168266298 de PokerStars:  Hold'em No Limit (0.01 €/0.02 € EUR) - 01-08-2025 11:15:57 CET [01-08-2025 5:15:57 ET]\nMesa \"Jupiter\" 6-max El asiento n.º 6 es el botón\nAsiento 1: sifilis5 (1.98 € en fichas) \nAsiento 2: Filou203 (2.27 € en fichas) \nAsiento 3: SrLyce (2.21 € en fichas) \nAsiento 4: LOLA19711971 (0.64 € en fichas) \nAsiento 5: dadou13mars (4.57 € en fichas) \nAsiento 6: Alvii37 (2 € en fichas) \nsifilis5: pone la ciega pequeña 0.01 €\nFilou203: pone la ciega grande 0.02 €\n*** CARTAS DE MANO ***\nRepartidas a SrLyce [Jc 8c]\nSrLyce: iguala 0.02 €\nLOLA19711971: se retira \ndadou13mars: se retira \nAlvii37: se retira \nsifilis5: se retira \nFilou203: sube 0.05 € a 0.07 €\nSrLyce: iguala 0.05 €\n*** FLOP *** [9h 5d 4h]\nFilou203: pasa \nSrLyce: pasa \n*** TURN *** [9h 5d 4h] [3d]\nFilou203: apuesta 0.08 €\nSrLyce: se retira \nLa apuesta no igualada (0.08 €) ha sido devuelta a Filou203\nFilou203 se lleva 0.14 € del bote \nFilou203: no muestra su mano \n*** RESUMEN ***\nBote total 0.15 € | Comisión 0.01 € \nComunitarias [9h 5d 4h 3d]\nAsiento 1: sifilis5 (ciega pequeña) se retiró antes del Flop\nAsiento 2: Filou203 (ciega grande) recaudó (0.14 €)\nAsiento 3: SrLyce se retiró en el Turn\nAsiento 4: LOLA19711971 se retiró antes del Flop (no apostó)\nAsiento 5: dadou13mars se retiró antes del Flop (no apostó)\nAsiento 6: Alvii37 (botón) se retiró antes del Flop (no apostó)"
}