{
  "hand_id": "257150277010",
  "date": "30-07-2025 23:30:32",
  "table": "Gilgamesh",
  "game_type": "holdem",
  "hero": "SrLyce",
  "hero_position": "",
  "hero_cards": [
    "9d",
    "8c"
  ],
  "stacks": {
    "ozil111": 100.0,
    "riverrrrrrmagic": 125.5,
    "SrLyce": 106.0,
    "Jumby34": 103.0,
    "xapkk": 100.0,
    "Fretzo67500": 143.0
  },
  "actions": {
    "preflop": [
      "Asiento 5: ozil111 (2 € en fichas) está ausente",
      "Asiento 1: riverrrrrrmagic (2.51 € en fichas)",
      "Asiento 2: SrLyce (2.12 € en fichas)",
      "Asiento 3: Jumby34 (2.06 € en fichas)",
      "Asiento 4: xapkk (2 € en fichas)",
      "Asiento 6: Fretzo67500 (2.86 € en fichas)",
      "Jumby34: pone la ciega pequeña 0.01 €",
      "xapkk: pone la ciega grande 0.02 €",
      "ozil111: se ausenta",
      "Fretzo67500: sube 0.02 € a 0.04 €",
      "riverrrrrrmagic: sube 0.04 € a 0.08 €",
      "SrLyce: se retira",
      "Jumby34: se retira",
      "xapkk: sube 0.21 € a 0.29 €",
      "Fretzo67500: se retira",
      "riverrrrrrmagic: iguala 0.21 €"
    ],
    "flop": [
      "xapkk: pasa",
      "riverrrrrrmagic: apuesta 2.22 € y está all-in",
      "xapkk: se retira",
      "Asiento 5: ozil111",
      "Asiento 1: riverrrrrrmagic recaudó (0.59 €)",
      "Asiento 2: SrLyce (botón) se retiró antes del Flop (no apostó)",
      "Asiento 3: Jumby34 (ciega pequeña) se retiró antes del Flop",
      "Asiento 4: xapkk (ciega grande) se retiró en el Flop",
      "Asiento 6: Fretzo67500 se retiró antes del Flop"
    ],
    "turn": [],
    "river": []
  },
  "board": [
    "3s",
    "4d",
    "7h"
  ],
  "winner": "riverrrrrrmagic",
  "win_amount": 29.5,
  "sb": 0.01,
  "bb": 0.02,
  "rake": 2.0,
  "raw_text": "Mano n.º 257150277010 de PokerStars:  Hold'em No Limit (0.01 €/0.02 € EUR) - 30-07-2025 23:30:32 CET [30-07-2025 17:30:32 ET]\nMesa \"Gilgamesh\" 6-max El asiento n.º 2 es el botón\nAsiento 5: ozil111 (2 € en fichas) está ausente\nAsiento 1: riverrrrrrmagic (2.51 € en fichas) \nAsiento 2: SrLyce (2.12 € en fichas) \nAsiento 3: Jumby34 (2.06 € en fichas) \nAsiento 4: xapkk (2 € en fichas) \nAsiento 6: Fretzo67500 (2.86 € en fichas) \nJumby34: pone la ciega pequeña 0.01 €\nxapkk: pone la ciega grande 0.02 €\nozil111: se ausenta \n*** CARTAS DE MANO ***\nRepartidas a SrLyce [9d 8c]\nFretzo67500: sube 0.02 € a 0.04 €\nriverrrrrrmagic: sube 0.04 € a 0.08 €\nSrLyce: se retira \nJumby34: se retira \nxapkk: sube 0.21 € a 0.29 €\nFretzo67500: se retira \nriverrrrrrmagic: iguala 0.21 €\n*** FLOP *** [3s 4d 7h]\nxapkk: pasa \nriverrrrrrmagic: apuesta 2.22 € y está all-in\nxapkk: se retira \nLa apuesta no igualada (2.22 €) ha sido devuelta a riverrrrrrmagic\nriverrrrrrmagic se lleva 0.59 € del bote \n*** RESUMEN ***\nBote total 0.63 € | Comisión 0.04 € \nComunitarias [3s 4d 7h]\nAsiento 5: ozil111\nAsiento 1: riverrrrrrmagic recaudó (0.59 €)\nAsiento 2: SrLyce (botón) se retiró antes del Flop (no apostó)\nAsiento 3: Jumby34 (ciega pequeña) se retiró antes del Flop\nAsiento 4: xapkk (ciega grande) se retiró en el Flop\nAsiento 6: Fretzo67500 se retiró antes del Flop"
}