{
  "hand_id": "257238413830",
  "date": "06-08-2025 18:55:58",
  "table": "Adelaide III",
  "game_type": "holdem",
  "hero": "SrLyce",
  "hero_position": "",
  "hero_cards": [
    "Th",
    "Ah"
  ],
  "stacks": {
    "Macklemore0": 100.0,
    "N3xtTIm35": 137.0,
    "aliendee07": 58.0,
    "SrLyce": 90.0,
    "ismagonzalez7": 58.5,
    "pauquair5": 67.5
  },
  "actions": {
    "preflop": [
      "Asiento 3: Macklemore0 (2 € en fichas) está ausente",
      "Asiento 1: N3xtTIm35 (2.74 € en fichas)",
      "Asiento 2: aliendee07 (1.16 € en fichas)",
      "Asiento 4: SrLyce (1.80 € en fichas)",
      "Asiento 5: ismagonzalez7 (1.17 € en fichas)",
      "Asiento 6: pauquair5 (1.35 € en fichas)",
      "N3xtTIm35: pone la ciega pequeña 0.01 €",
      "aliendee07: pone la ciega grande 0.02 €",
      "Macklemore0: se ausenta",
      "SrLyce: sube 0.03 € a 0.05 €",
      "ismagonzalez7: se retira",
      "pauquair5: iguala 0.05 €",
      "N3xtTIm35: iguala 0.04 €",
      "aliendee07: se retira"
    ],
    "flop": [
      "N3xtTIm35: pasa",
      "SrLyce: apuesta 0.05 €",
      "pauquair5: iguala 0.05 €",
      "N3xtTIm35: iguala 0.05 €"
    ],
    "turn": [
      "N3xtTIm35: pasa",
      "SrLyce: apuesta 0.15 €",
      "pauquair5: se retira",
      "N3xtTIm35: iguala 0.15 €"
    ],
    "river": [
      "N3xtTIm35: pasa",
      "SrLyce: apuesta 1.55 € y está all-in",
      "N3xtTIm35: se retira",
      "SrLyce: no muestra su mano",
      "Asiento 3: Macklemore0",
      "Asiento 1: N3xtTIm35 (ciega pequeña) se retiró en el River",
      "Asiento 2: aliendee07 (ciega grande) se retiró antes del Flop",
      "Asiento 4: SrLyce recaudó (0.58 €)",
      "Asiento 5: ismagonzalez7 se retiró antes del Flop (no apostó)",
      "Asiento 6: pauquair5 (botón) se retiró en el Turn"
    ]
  },
  "board": [
    "4s",
    "Kh",
    "5c",
    "Ac",
    "Td"
  ],
  "winner": "SrLyce",
  "win_amount": 29.0,
  "sb": 0.01,
  "bb": 0.02,
  "rake": 2.0,
  "raw_text": "Mano n.º 257238413830 de PokerStars:  Hold'em No Limit (0.01 €/0.02 € EUR) - 06-08-2025 18:55:58 CET [06-08-2025 12:55:58 ET]\nMesa \"Adelaide III\" 6-max El asiento n.º 6 es el botón\nAsiento 3: Macklemore0 (2 € en fichas) está ausente\nAsiento 1: N3xtTIm35 (2.74 € en fichas) \nAsiento 2: aliendee07 (1.16 € en fichas) \nAsiento 4: SrLyce (1.80 € en fichas) \nAsiento 5: ismagonzalez7 (1.17 € en fichas) \nAsiento 6: pauquair5 (1.35 € en fichas) \nN3xtTIm35: pone la ciega pequeña 0.01 €\naliendee07: pone la ciega grande 0.02 €\nMacklemore0: se ausenta \n*** CARTAS DE MANO ***\nRepartidas a SrLyce [Th Ah]\nSrLyce: sube 0.03 € a 0.05 €\nismagonzalez7: se retira \npauquair5: iguala 0.05 €\nN3xtTIm35: iguala 0.04 €\naliendee07: se retira \n*** FLOP *** [4s Kh 5c]\nN3xtTIm35: pasa \nSrLyce: apuesta 0.05 €\npauquair5: iguala 0.05 €\nN3xtTIm35: iguala 0.05 €\n*** TURN *** [4s Kh 5c] [Ac]\nN3xtTIm35: pasa \nSrLyce: apuesta 0.15 €\npauquair5: se retira \nN3xtTIm35: iguala 0.15 €\n*** RIVER *** [4s Kh 5c Ac] [Td]\nN3xtTIm35: pasa \nSrLyce: apuesta 1.55 € y está all-in\nN3xtTIm35: se retira \nLa apuesta no igualada (1.55 €) ha sido devuelta a SrLyce\nSrLyce se lleva 0.58 € del bote \nSrLyce: no muestra su mano \n*** RESUMEN ***\nBote total 0.62 € | Comisión 0.04 € \nComunitarias [4s Kh 5c Ac Td]\nAsiento 3: Macklemore0\nAsiento 1: N3xtTIm35 (ciega pequeña) se retiró en el River\nAsiento 2: aliendee07 (ciega grande) se retiró antes del Flop\nAsiento 4: SrLyce recaudó (0.58 €)\nAsiento 5: ismagonzalez7 se retiró antes del Flop (no apostó)\nAsiento 6: pauquair5 (botón) se retiró en el Turn"
}