{
  "hand_id": "257168317380",
  "date": "01-08-2025 11:25:37",
  "table": "Jupiter",
  "game_type": "holdem",
  "hero": "SrLyce",
  "hero_position": "",
  "hero_cards": [
    "7c",
    "3d"
  ],
  "stacks": {
    "sifilis5": 93.5,
    "Filou203": 112.0,
    "SrLyce": 120.0,
    "LOLA19711971": 30.5,
    "dadou13mars": 215.5,
    "Alvii37": 108.0
  },
  "actions": {
    "preflop": [
      "Asiento 1: sifilis5 (1.87 € en fichas)",
      "Asiento 2: Filou203 (2.24 € en fichas)",
      "Asiento 3: SrLyce (2.40 € en fichas)",
      "Asiento 4: LOLA19711971 (0.61 € en fichas)",
      "Asiento 5: dadou13mars (4.31 € en fichas)",
      "Asiento 6: Alvii37 (2.16 € en fichas)",
      "Filou203: pone la ciega pequeña 0.01 €",
      "SrLyce: pone la ciega grande 0.02 €",
      "LOLA19711971: se retira",
      "dadou13mars: se retira",
      "Alvii37: se retira",
      "sifilis5: sube 0.04 € a 0.06 €",
      "Filou203: se retira",
      "SrLyce: se retira",
      "sifilis5: no muestra su mano",
      "Asiento 1: sifilis5 (botón) recaudó (0.05 €)",
      "Asiento 2: Filou203 (ciega pequeña) se retiró antes del Flop",
      "Asiento 3: SrLyce (ciega grande) se retiró antes del Flop",
      "Asiento 4: LOLA19711971 se retiró antes del Flop (no apostó)",
      "Asiento 5: dadou13mars se retiró antes del Flop (no apostó)",
      "Asiento 6: Alvii37 se retiró antes del Flop (no apostó)"
    ],
    "flop": [],
    "turn": [],
    "river": []
  },
  "board": [],
  "winner": "sifilis5",
  "win_amount": 2.5,
  "sb": 0.01,
  "bb": 0.02,
  "rake": 0.0,
  "raw_text": "Mano n.º 257168317380 de PokerStars:  Hold'em No Limit (0.01 €/0.02 € EUR) - 01-08-2025 11:25:37 CET [01-08-2025 5:25:37 ET]\nMesa \"Jupiter\" 6-max El asiento n.º 1 es el botón\nAsiento 1: sifilis5 (1.87 € en fichas) \nAsiento 2: Filou203 (2.24 € en fichas) \nAsiento 3: SrLyce (2.40 € en fichas) \nAsiento 4: LOLA19711971 (0.61 € en fichas) \nAsiento 5: dadou13mars (4.31 € en fichas) \nAsiento 6: Alvii37 (2.16 € en fichas) \nFilou203: pone la ciega pequeña 0.01 €\nSrLyce: pone la ciega grande 0.02 €\n*** CARTAS DE MANO ***\nRepartidas a SrLyce [7c 3d]\nLOLA19711971: se retira \ndadou13mars: se retira \nAlvii37: se retira \nsifilis5: sube 0.04 € a 0.06 €\nFilou203: se retira \nSrLyce: se retira \nLa apuesta no igualada (0.04 €) ha sido devuelta a sifilis5\nsifilis5 se lleva 0.05 € del bote \nsifilis5: no muestra su mano \n*** RESUMEN ***\nBote total 0.05 € | Comisión 0 € \nAsiento 1: sifilis5 (botón) recaudó (0.05 €)\nAsiento 2: Filou203 (ciega pequeña) se retiró antes del Flop\nAsiento 3: SrLyce (ciega grande) se retiró antes del Flop\nAsiento 4: LOLA19711971 se retiró antes del Flop (no apostó)\nAsiento 5: dadou13mars se retiró antes del Flop (no apostó)\nAsiento 6: Alvii37 se retiró antes del Flop (no apostó)"
}