{
  "hand_id": "257238643852",
  "date": "06-08-2025 19:17:04",
  "table": "Leonteus",
  "game_type": "holdem",
  "hero": "SrLyce",
  "hero_position": "",
  "hero_cards": [
    "4h",
    "5s"
  ],
  "stacks": {
    "practikal_C23": 47.5,
    "niyomalo": 97.5,
    "davinci1962": 144.5,
    "BuXHexter": 145.5,
    "Andark47": 214.0,
    "SrLyce": 103.0
  },
  "actions": {
    "preflop": [
      "Asiento 1: practikal_C23 (0.95 € en fichas) está ausente",
      "Asiento 2: niyomalo (1.95 € en fichas)",
      "Asiento 3: davinci1962 (2.89 € en fichas)",
      "Asiento 4: BuXHexter (2.91 € en fichas)",
      "Asiento 5: Andark47 (4.28 € en fichas)",
      "Asiento 6: SrLyce (2.06 € en fichas)",
      "davinci1962: pone la ciega pequeña 0.01 €",
      "BuXHexter: pone la ciega grande 0.02 €",
      "Andark47: se retira",
      "SrLyce: se retira",
      "niyomalo: se retira",
      "davinci1962: sube 0.03 € a 0.05 €",
      "BuXHexter: se retira",
      "davinci1962: no muestra su mano",
      "Asiento 1: practikal_C23",
      "Asiento 2: niyomalo (botón) se retiró antes del Flop (no apostó)",
      "Asiento 3: davinci1962 (ciega pequeña) recaudó (0.04 €)",
      "Asiento 4: BuXHexter (ciega grande) se retiró antes del Flop",
      "Asiento 5: Andark47 se retiró antes del Flop (no apostó)",
      "Asiento 6: SrLyce se retiró antes del Flop (no apostó)"
    ],
    "flop": [],
    "turn": [],
    "river": []
  },
  "board": [],
  "winner": "davinci1962",
  "win_amount": 2.0,
  "sb": 0.01,
  "bb": 0.02,
  "rake": 0.0,
  "raw_text": "Mano n.º 257238643852 de PokerStars:  Hold'em No Limit (0.01 €/0.02 € EUR) - 06-08-2025 19:17:04 CET [06-08-2025 13:17:04 ET]\nMesa \"Leonteus\" 6-max El asiento n.º 2 es el botón\nAsiento 1: practikal_C23 (0.95 € en fichas) está ausente\nAsiento 2: niyomalo (1.95 € en fichas) \nAsiento 3: davinci1962 (2.89 € en fichas) \nAsiento 4: BuXHexter (2.91 € en fichas) \nAsiento 5: Andark47 (4.28 € en fichas) \nAsiento 6: SrLyce (2.06 € en fichas) \ndavinci1962: pone la ciega pequeña 0.01 €\nBuXHexter: pone la ciega grande 0.02 €\n*** CARTAS DE MANO ***\nRepartidas a SrLyce [4h 5s]\nAndark47 ha agotado su tiempo\nAndark47: se retira \nSrLyce: se retira \nniyomalo: se retira \ndavinci1962: sube 0.03 € a 0.05 €\nBuXHexter: se retira \nLa apuesta no igualada (0.03 €) ha sido devuelta a davinci1962\ndavinci1962 se lleva 0.04 € del bote \ndavinci1962: no muestra su mano \n*** RESUMEN ***\nBote total 0.04 € | Comisión 0 € \nAsiento 1: practikal_C23\nAsiento 2: niyomalo (botón) se retiró antes del Flop (no apostó)\nAsiento 3: davinci1962 (ciega pequeña) recaudó (0.04 €)\nAsiento 4: BuXHexter (ciega grande) se retiró antes del Flop\nAsiento 5: Andark47 se retiró antes del Flop (no apostó)\nAsiento 6: SrLyce se retiró antes del Flop (no apostó)"
}