{
  "hand_id": "257148684680",
  "date": "30-07-2025 21:36:45",
  "table": "Sirona",
  "game_type": "holdem",
  "hero": "SrLyce",
  "hero_position": "",
  "hero_cards": [
    "4h",
    "2c"
  ],
  "stacks": {
    "SrLyce": 96.5,
    "lecontrebandier": 98.5,
    "christoph363": 179.5,
    "oliverdu70": 100.0,
    "olibellier": 32.5,
    "Dakoo44": 108.0
  },
  "actions": {
    "preflop": [
      "Asiento 1: SrLyce (1.93 € en fichas)",
      "Asiento 2: lecontrebandier (1.97 € en fichas)",
      "Asiento 3: christoph363 (3.59 € en fichas)",
      "Asiento 4: oliverdu70 (2 € en fichas)",
      "Asiento 5: olibellier (0.65 € en fichas)",
      "Asiento 6: Dakoo44 (2.16 € en fichas)",
      "Dakoo44: pone la ciega pequeña 0.01 €",
      "SrLyce: pone la ciega grande 0.02 €",
      "lecontrebandier: se retira",
      "christoph363: se retira",
      "oliverdu70: se retira",
      "olibellier: se retira",
      "Dakoo44: sube 0.04 € a 0.06 €",
      "SrLyce: se retira",
      "Dakoo44: no muestra su mano",
      "Asiento 1: SrLyce (ciega grande) se retiró antes del Flop",
      "Asiento 2: lecontrebandier se retiró antes del Flop (no apostó)",
      "Asiento 3: christoph363 se retiró antes del Flop (no apostó)",
      "Asiento 4: oliverdu70 se retiró antes del Flop (no apostó)",
      "Asiento 5: olibellier (botón) se retiró antes del Flop (no apostó)",
      "Asiento 6: Dakoo44 (ciega pequeña) recaudó (0.04 €)"
    ],
    "flop": [],
    "turn": [],
    "river": []
  },
  "board": [],
  "winner": "Dakoo44",
  "win_amount": 2.0,
  "sb": 0.01,
  "bb": 0.02,
  "rake": 0.0,
  "raw_text": "Mano n.º 257148684680 de PokerStars:  Hold'em No Limit (0.01 €/0.02 € EUR) - 30-07-2025 21:36:45 CET [30-07-2025 15:36:45 ET]\nMesa \"Sirona\" 6-max El asiento n.º 5 es el botón\nAsiento 1: SrLyce (1.93 € en fichas) \nAsiento 2: lecontrebandier (1.97 € en fichas) \nAsiento 3: christoph363 (3.59 € en fichas) \nAsiento 4: oliverdu70 (2 € en fichas) \nAsiento 5: olibellier (0.65 € en fichas) \nAsiento 6: Dakoo44 (2.16 € en fichas) \nDakoo44: pone la ciega pequeña 0.01 €\nSrLyce: pone la ciega grande 0.02 €\n*** CARTAS DE MANO ***\nRepartidas a SrLyce [4h 2c]\nlecontrebandier: se retira \nchristoph363: se retira \noliverdu70: se retira \nolibellier: se retira \nDakoo44: sube 0.04 € a 0.06 €\nSrLyce: se retira \nLa apuesta no igualada (0.04 €) ha sido devuelta a Dakoo44\nDakoo44 se lleva 0.04 € del bote \nDakoo44: no muestra su mano \n*** RESUMEN ***\nBote total 0.04 € | Comisión 0 € \nAsiento 1: SrLyce (ciega grande) se retiró antes del Flop\nAsiento 2: lecontrebandier se retiró antes del Flop (no apostó)\nAsiento 3: christoph363 se retiró antes del Flop (no apostó)\nAsiento 4: oliverdu70 se retiró antes del Flop (no apostó)\nAsiento 5: olibellier (botón) se retiró antes del Flop (no apostó)\nAsiento 6: Dakoo44 (ciega pequeña) recaudó (0.04 €)"
}