{
  "hand_id": "257214943815",
  "date": "04-08-2025 22:14:27",
  "table": "Anneliese II",
  "game_type": "holdem",
  "hero": "SrLyce",
  "hero_position": "",
  "hero_cards": [
    "Jd",
    "5d"
  ],
  "stacks": {
    "betterrrrrr": 101.5,
    "niyomalo": 91.0,
    "ElManu62": 113.0,
    "SrLyce": 101.5,
    "Mr_Pkr98": 143.0,
    "Spotick": 114.0
  },
  "actions": {
    "preflop": [
      "Asiento 1: betterrrrrr (2.03 € en fichas)",
      "Asiento 2: niyomalo (1.82 € en fichas)",
      "Asiento 3: ElManu62 (2.26 € en fichas)",
      "Asiento 4: SrLyce (2.03 € en fichas)",
      "Asiento 5: Mr_Pkr98 (2.86 € en fichas)",
      "Asiento 6: Spotick (2.28 € en fichas)",
      "Spotick: pone la ciega pequeña 0.01 €",
      "betterrrrrr: pone la ciega grande 0.02 €",
      "niyomalo: iguala 0.02 €",
      "ElManu62: se retira",
      "SrLyce: se retira",
      "Mr_Pkr98: se retira",
      "Spotick: sube 0.04 € a 0.06 €",
      "betterrrrrr: se retira",
      "niyomalo: iguala 0.04 €"
    ],
    "flop": [
      "Spotick: pasa",
      "niyomalo: apuesta 0.13 €",
      "Spotick: se retira",
      "niyomalo: no muestra su mano",
      "Asiento 1: betterrrrrr (ciega grande) se retiró antes del Flop",
      "Asiento 2: niyomalo recaudó (0.13 €)",
      "Asiento 3: ElManu62 se retiró antes del Flop (no apostó)",
      "Asiento 4: SrLyce se retiró antes del Flop (no apostó)",
      "Asiento 5: Mr_Pkr98 (botón) se retiró antes del Flop (no apostó)",
      "Asiento 6: Spotick (ciega pequeña) se retiró en el Flop"
    ],
    "turn": [],
    "river": []
  },
  "board": [
    "Kd",
    "Td",
    "8d"
  ],
  "winner": "niyomalo",
  "win_amount": 6.5,
  "sb": 0.01,
  "bb": 0.02,
  "rake": 0.5,
  "raw_text": "Mano n.º 257214943815 de PokerStars:  Hold'em No Limit (0.01 €/0.02 € EUR) - 04-08-2025 22:14:27 CET [04-08-2025 16:14:27 ET]\nMesa \"Anneliese II\" 6-max El asiento n.º 5 es el botón\nAsiento 1: betterrrrrr (2.03 € en fichas) \nAsiento 2: niyomalo (1.82 € en fichas) \nAsiento 3: ElManu62 (2.26 € en fichas) \nAsiento 4: SrLyce (2.03 € en fichas) \nAsiento 5: Mr_Pkr98 (2.86 € en fichas) \nAsiento 6: Spotick (2.28 € en fichas) \nSpotick: pone la ciega pequeña 0.01 €\nbetterrrrrr: pone la ciega grande 0.02 €\n*** CARTAS DE MANO ***\nRepartidas a SrLyce [Jd 5d]\nniyomalo: iguala 0.02 €\nElManu62 ha agotado su tiempo\nElManu62: se retira \nSrLyce: se retira \nMr_Pkr98: se retira \nSpotick: sube 0.04 € a 0.06 €\nbetterrrrrr: se retira \nniyomalo: iguala 0.04 €\n*** FLOP *** [Kd Td 8d]\nSpotick: pasa \nniyomalo: apuesta 0.13 €\nSpotick: se retira \nLa apuesta no igualada (0.13 €) ha sido devuelta a niyomalo\nniyomalo se lleva 0.13 € del bote \nniyomalo: no muestra su mano \n*** RESUMEN ***\nBote total 0.14 € | Comisión 0.01 € \nComunitarias [Kd Td 8d]\nAsiento 1: betterrrrrr (ciega grande) se retiró antes del Flop\nAsiento 2: niyomalo recaudó (0.13 €)\nAsiento 3: ElManu62 se retiró antes del Flop (no apostó)\nAsiento 4: SrLyce se retiró antes del Flop (no apostó)\nAsiento 5: Mr_Pkr98 (botón) se retiró antes del Flop (no apostó)\nAsiento 6: Spotick (ciega pequeña) se retiró en el Flop"
}