{
  "hand_id": "257168231445",
  "date": "01-08-2025 11:09:04",
  "table": "Sekanina",
  "game_type": "holdem",
  "hero": "SrLyce",
  "hero_position": "",
  "hero_cards": [
    "Kh",
    "7d"
  ],
  "stacks": {
    "DagonBZH56": 80.0,
    "practikal_C23": 81.5,
    "Alvii37": 102.0,
    "SrLyce": 92.0,
    "davinci1962": 106.5,
    "Elministrelas": 96.0
  },
  "actions": {
    "preflop": [
      "Asiento 1: DagonBZH56 (1.60 € en fichas) está ausente",
      "Asiento 2: practikal_C23 (1.63 € en fichas)",
      "Asiento 3: Alvii37 (2.04 € en fichas)",
      "Asiento 4: SrLyce (1.84 € en fichas)",
      "Asiento 5: davinci1962 (2.13 € en fichas)",
      "Asiento 6: Elministrelas (1.92 € en fichas)",
      "practikal_C23: pone la ciega pequeña 0.01 €",
      "Alvii37: pone la ciega grande 0.02 €",
      "SrLyce: se retira",
      "davinci1962: se retira",
      "Elministrelas: se retira",
      "practikal_C23: iguala 0.01 €",
      "Alvii37: pasa"
    ],
    "flop": [
      "practikal_C23: apuesta 0.02 €",
      "Alvii37: se retira",
      "Asiento 1: DagonBZH56",
      "Asiento 2: practikal_C23 (ciega pequeña) recaudó (0.04 €)",
      "Asiento 3: Alvii37 (ciega grande) se retiró en el Flop",
      "Asiento 4: SrLyce se retiró antes del Flop (no apostó)",
      "Asiento 5: davinci1962 se retiró antes del Flop (no apostó)",
      "Asiento 6: Elministrelas (botón) se retiró antes del Flop (no apostó)"
    ],
    "turn": [],
    "river": []
  },
  "board": [
    "Th",
    "Jd",
    "9s"
  ],
  "winner": "practikal_C23",
  "win_amount": 2.0,
  "sb": 0.01,
  "bb": 0.02,
  "rake": 0.0,
  "raw_text": "Mano n.º 257168231445 de PokerStars:  Hold'em No Limit (0.01 €/0.02 € EUR) - 01-08-2025 11:09:04 CET [01-08-2025 5:09:04 ET]\nMesa \"Sekanina\" 6-max El asiento n.º 6 es el botón\nAsiento 1: DagonBZH56 (1.60 € en fichas) está ausente\nAsiento 2: practikal_C23 (1.63 € en fichas) \nAsiento 3: Alvii37 (2.04 € en fichas) \nAsiento 4: SrLyce (1.84 € en fichas) \nAsiento 5: davinci1962 (2.13 € en fichas) \nAsiento 6: Elministrelas (1.92 € en fichas) \npractikal_C23: pone la ciega pequeña 0.01 €\nAlvii37: pone la ciega grande 0.02 €\n*** CARTAS DE MANO ***\nRepartidas a SrLyce [Kh 7d]\nSrLyce: se retira \ndavinci1962: se retira \nElministrelas: se retira \npractikal_C23: iguala 0.01 €\nAlvii37: pasa \n*** FLOP *** [Th Jd 9s]\npractikal_C23: apuesta 0.02 €\nAlvii37: se retira \nLa apuesta no igualada (0.02 €) ha sido devuelta a practikal_C23\npractikal_C23 se lleva 0.04 € del bote \n*** RESUMEN ***\nBote total 0.04 € | Comisión 0 € \nComunitarias [Th Jd 9s]\nAsiento 1: DagonBZH56\nAsiento 2: practikal_C23 (ciega pequeña) recaudó (0.04 €)\nAsiento 3: Alvii37 (ciega grande) se retiró en el Flop\nAsiento 4: SrLyce se retiró antes del Flop (no apostó)\nAsiento 5: davinci1962 se retiró antes del Flop (no apostó)\nAsiento 6: Elministrelas (botón) se retiró antes del Flop (no apostó)"
}