{
  "hand_id": "257150182511",
  "date": "30-07-2025 23:24:00",
  "table": "Gilgamesh",
  "game_type": "holdem",
  "hero": "SrLyce",
  "hero_position": "",
  "hero_cards": [
    "Kh",
    "8h"
  ],
  "stacks": {
    "riverrrrrrmagic": 121.5,
    "SrLyce": 113.0,
    "Jumby34": 100.0,
    "xapkk": 100.0,
    "samaritano34": 91.0,
    "Fretzo67500": 126.0
  },
  "actions": {
    "preflop": [
      "Asiento 1: riverrrrrrmagic (2.43 € en fichas)",
      "Asiento 2: SrLyce (2.26 € en fichas)",
      "Asiento 3: Jumby34 (2 € en fichas)",
      "Asiento 4: xapkk (2 € en fichas)",
      "Asiento 5: samaritano34 (1.82 € en fichas)",
      "Asiento 6: Fretzo67500 (2.52 € en fichas)",
      "samaritano34: pone la ciega pequeña 0.01 €",
      "Fretzo67500: pone la ciega grande 0.02 €",
      "riverrrrrrmagic: iguala 0.02 €",
      "SrLyce: iguala 0.02 €",
      "Jumby34: se retira",
      "xapkk: se retira",
      "samaritano34: se retira",
      "Fretzo67500: pasa"
    ],
    "flop": [
      "Fretzo67500: apuesta 0.02 €",
      "riverrrrrrmagic: se retira",
      "SrLyce: se retira",
      "Asiento 1: riverrrrrrmagic se retiró en el Flop",
      "Asiento 2: SrLyce se retiró en el Flop",
      "Asiento 3: Jumby34 se retiró antes del Flop (no apostó)",
      "Asiento 4: xapkk (botón) se retiró antes del Flop (no apostó)",
      "Asiento 5: samaritano34 (ciega pequeña) se retiró antes del Flop",
      "Asiento 6: Fretzo67500 (ciega grande) recaudó (0.07 €)"
    ],
    "turn": [],
    "river": []
  },
  "board": [
    "7d",
    "Jd",
    "7c"
  ],
  "winner": "Fretzo67500",
  "win_amount": 3.5,
  "sb": 0.01,
  "bb": 0.02,
  "rake": 0.0,
  "raw_text": "Mano n.º 257150182511 de PokerStars:  Hold'em No Limit (0.01 €/0.02 € EUR) - 30-07-2025 23:24:00 CET [30-07-2025 17:24:00 ET]\nMesa \"Gilgamesh\" 6-max El asiento n.º 4 es el botón\nAsiento 1: riverrrrrrmagic (2.43 € en fichas) \nAsiento 2: SrLyce (2.26 € en fichas) \nAsiento 3: Jumby34 (2 € en fichas) \nAsiento 4: xapkk (2 € en fichas) \nAsiento 5: samaritano34 (1.82 € en fichas) \nAsiento 6: Fretzo67500 (2.52 € en fichas) \nsamaritano34: pone la ciega pequeña 0.01 €\nFretzo67500: pone la ciega grande 0.02 €\n*** CARTAS DE MANO ***\nRepartidas a SrLyce [Kh 8h]\nriverrrrrrmagic: iguala 0.02 €\nSrLyce: iguala 0.02 €\nJumby34: se retira \nxapkk: se retira \nsamaritano34: se retira \nFretzo67500: pasa \n*** FLOP *** [7d Jd 7c]\nFretzo67500: apuesta 0.02 €\nriverrrrrrmagic: se retira \nSrLyce: se retira \nLa apuesta no igualada (0.02 €) ha sido devuelta a Fretzo67500\nFretzo67500 se lleva 0.07 € del bote \n*** RESUMEN ***\nBote total 0.07 € | Comisión 0 € \nComunitarias [7d Jd 7c]\nAsiento 1: riverrrrrrmagic se retiró en el Flop\nAsiento 2: SrLyce se retiró en el Flop\nAsiento 3: Jumby34 se retiró antes del Flop (no apostó)\nAsiento 4: xapkk (botón) se retiró antes del Flop (no apostó)\nAsiento 5: samaritano34 (ciega pequeña) se retiró antes del Flop\nAsiento 6: Fretzo67500 (ciega grande) recaudó (0.07 €)"
}