{
  "hand_id": "257168340207",
  "date": "01-08-2025 11:29:55",
  "table": "Atlas",
  "game_type": "holdem",
  "hero": "SrLyce",
  "hero_position": "",
  "hero_cards": [
    "4c",
    "8h"
  ],
  "stacks": {
    "SrLyce": 105.0,
    "Fharock": 91.0,
    "ecuinas": 107.0,
    "LxckxStrxkx": 113.5,
    "Akourdideh": 115.0
  },
  "actions": {
    "preflop": [
      "Asiento 1: SrLyce (2.10 € en fichas)",
      "Asiento 2: Fharock (1.82 € en fichas)",
      "Asiento 3: ecuinas (2.14 € en fichas)",
      "Asiento 4: LxckxStrxkx (2.27 € en fichas)",
      "Asiento 6: Akourdideh (2.30 € en fichas)",
      "Fharock: pone la ciega pequeña 0.01 €",
      "ecuinas: pone la ciega grande 0.02 €",
      "LxckxStrxkx: se retira",
      "Akourdideh: se retira",
      "SrLyce: se retira",
      "Fharock: sube 0.04 € a 0.06 €",
      "ecuinas: se retira",
      "Fharock: no muestra su mano",
      "Asiento 1: SrLyce (botón) se retiró antes del Flop (no apostó)",
      "Asiento 2: Fharock (ciega pequeña) recaudó (0.04 €)",
      "Asiento 3: ecuinas (ciega grande) se retiró antes del Flop",
      "Asiento 4: LxckxStrxkx se retiró antes del Flop (no apostó)",
      "Asiento 6: Akourdideh se retiró antes del Flop (no apostó)"
    ],
    "flop": [],
    "turn": [],
    "river": []
  },
  "board": [],
  "winner": "Fharock",
  "win_amount": 2.0,
  "sb": 0.01,
  "bb": 0.02,
  "rake": 0.0,
  "raw_text": "Mano n.º 257168340207 de PokerStars:  Hold'em No Limit (0.01 €/0.02 € EUR) - 01-08-2025 11:29:55 CET [01-08-2025 5:29:55 ET]\nMesa \"Atlas\" 6-max El asiento n.º 1 es el botón\nAsiento 1: SrLyce (2.10 € en fichas) \nAsiento 2: Fharock (1.82 € en fichas) \nAsiento 3: ecuinas (2.14 € en fichas) \nAsiento 4: LxckxStrxkx (2.27 € en fichas) \nAsiento 6: Akourdideh (2.30 € en fichas) \nFharock: pone la ciega pequeña 0.01 €\necuinas: pone la ciega grande 0.02 €\n*** CARTAS DE MANO ***\nRepartidas a SrLyce [4c 8h]\nLxckxStrxkx: se retira \nsoy_cule74 se une a la mesa en el asiento n.º 5 \nAkourdideh: se retira \nSrLyce: se retira \nFharock: sube 0.04 € a 0.06 €\necuinas: se retira \nLa apuesta no igualada (0.04 €) ha sido devuelta a Fharock\nFharock se lleva 0.04 € del bote \nFharock: no muestra su mano \n*** RESUMEN ***\nBote total 0.04 € | Comisión 0 € \nAsiento 1: SrLyce (botón) se retiró antes del Flop (no apostó)\nAsiento 2: Fharock (ciega pequeña) recaudó (0.04 €)\nAsiento 3: ecuinas (ciega grande) se retiró antes del Flop\nAsiento 4: LxckxStrxkx se retiró antes del Flop (no apostó)\nAsiento 6: Akourdideh se retiró antes del Flop (no apostó)"
}