{
  "hand_id": "257238546807",
  "date": "06-08-2025 19:08:55",
  "table": "Adelaide III",
  "game_type": "holdem",
  "hero": "SrLyce",
  "hero_position": "",
  "hero_cards": [
    "2c",
    "Th"
  ],
  "stacks": {
    "Macklemore0": 100.0,
    "N3xtTIm35": 124.0,
    "aliendee07": 60.0,
    "SrLyce": 89.5,
    "ismagonzalez7": 68.0,
    "pauquair5": 71.5
  },
  "actions": {
    "preflop": [
      "Asiento 3: Macklemore0 (2 € en fichas) está ausente",
      "Asiento 1: N3xtTIm35 (2.48 € en fichas)",
      "Asiento 2: aliendee07 (1.20 € en fichas)",
      "Asiento 4: SrLyce (1.79 € en fichas)",
      "Asiento 5: ismagonzalez7 (1.36 € en fichas)",
      "Asiento 6: pauquair5 (1.43 € en fichas)",
      "ismagonzalez7: pone la ciega pequeña 0.01 €",
      "pauquair5: pone la ciega grande 0.02 €",
      "Macklemore0: se ausenta",
      "N3xtTIm35: se retira",
      "aliendee07: iguala 0.02 €",
      "SrLyce: se retira",
      "ismagonzalez7: se retira",
      "pauquair5: sube 0.04 € a 0.06 €",
      "aliendee07: iguala 0.04 €"
    ],
    "flop": [
      "pauquair5: apuesta 0.04 €",
      "aliendee07: iguala 0.04 €"
    ],
    "turn": [
      "pauquair5: pasa",
      "aliendee07: pasa"
    ],
    "river": [
      "pauquair5: pasa",
      "aliendee07: apuesta 0.10 €",
      "pauquair5: iguala 0.10 €",
      "aliendee07: muestra [Td As] (pareja de ases)",
      "pauquair5: descarta su mano sin mostrar",
      "Asiento 3: Macklemore0",
      "Asiento 1: N3xtTIm35 se retiró antes del Flop (no apostó)",
      "Asiento 2: aliendee07 muestra [Td As] y ganó (0.39 €) con pareja de ases",
      "Asiento 4: SrLyce (botón) se retiró antes del Flop (no apostó)",
      "Asiento 5: ismagonzalez7 (ciega pequeña) se retiró antes del Flop",
      "Asiento 6: pauquair5 (ciega grande) descartó sin mostrar [Kh Ks]"
    ]
  },
  "board": [
    "9s",
    "Qs",
    "Js",
    "Ac",
    "7d"
  ],
  "winner": "aliendee07",
  "win_amount": 19.5,
  "sb": 0.01,
  "bb": 0.02,
  "rake": 1.0,
  "raw_text": "Mano n.º 257238546807 de PokerStars:  Hold'em No Limit (0.01 €/0.02 € EUR) - 06-08-2025 19:08:55 CET [06-08-2025 13:08:55 ET]\nMesa \"Adelaide III\" 6-max El asiento n.º 4 es el botón\nAsiento 3: Macklemore0 (2 € en fichas) está ausente\nAsiento 1: N3xtTIm35 (2.48 € en fichas) \nAsiento 2: aliendee07 (1.20 € en fichas) \nAsiento 4: SrLyce (1.79 € en fichas) \nAsiento 5: ismagonzalez7 (1.36 € en fichas) \nAsiento 6: pauquair5 (1.43 € en fichas) \nismagonzalez7: pone la ciega pequeña 0.01 €\npauquair5: pone la ciega grande 0.02 €\nMacklemore0: se ausenta \n*** CARTAS DE MANO ***\nRepartidas a SrLyce [2c Th]\nN3xtTIm35: se retira \naliendee07: iguala 0.02 €\nSrLyce: se retira \nismagonzalez7: se retira \npauquair5: sube 0.04 € a 0.06 €\naliendee07: iguala 0.04 €\n*** FLOP *** [9s Qs Js]\npauquair5: apuesta 0.04 €\naliendee07: iguala 0.04 €\n*** TURN *** [9s Qs Js] [Ac]\npauquair5: pasa \naliendee07: pasa \n*** RIVER *** [9s Qs Js Ac] [7d]\npauquair5: pasa \naliendee07: apuesta 0.10 €\npauquair5: iguala 0.10 €\n*** SHOW DOWN ***\naliendee07: muestra [Td As] (pareja de ases)\npauquair5: descarta su mano sin mostrar \naliendee07 se lleva 0.39 € del bote \n*** RESUMEN ***\nBote total 0.41 € | Comisión 0.02 € \nComunitarias [9s Qs Js Ac 7d]\nAsiento 3: Macklemore0\nAsiento 1: N3xtTIm35 se retiró antes del Flop (no apostó)\nAsiento 2: aliendee07 muestra [Td As] y ganó (0.39 €) con pareja de ases\nAsiento 4: SrLyce (botón) se retiró antes del Flop (no apostó)\nAsiento 5: ismagonzalez7 (ciega pequeña) se retiró antes del Flop\nAsiento 6: pauquair5 (ciega grande) descartó sin mostrar [Kh Ks]"
}