{
  "hand_id": "257168274408",
  "date": "01-08-2025 11:17:31",
  "table": "Atlas",
  "game_type": "holdem",
  "hero": "SrLyce",
  "hero_position": "",
  "hero_cards": [
    "Kc",
    "5d"
  ],
  "stacks": {
    "erCampos23": 42.5,
    "SrLyce": 94.5,
    "Fharock": 92.0,
    "ecuinas": 97.5,
    "LxckxStrxkx": 100.0,
    "Akourdideh": 115.5
  },
  "actions": {
    "preflop": [
      "Asiento 5: erCampos23 (0.85 € en fichas) está ausente",
      "Asiento 1: SrLyce (1.89 € en fichas)",
      "Asiento 2: Fharock (1.84 € en fichas)",
      "Asiento 3: ecuinas (1.95 € en fichas)",
      "Asiento 4: LxckxStrxkx (2 € en fichas)",
      "Asiento 6: Akourdideh (2.31 € en fichas)",
      "ecuinas: pone la ciega pequeña 0.01 €",
      "LxckxStrxkx: pone la ciega grande 0.02 €",
      "erCampos23: se ausenta",
      "Akourdideh: se retira",
      "SrLyce: se retira",
      "Fharock: se retira",
      "ecuinas: se retira",
      "LxckxStrxkx: no muestra su mano",
      "Asiento 5: erCampos23",
      "Asiento 1: SrLyce se retiró antes del Flop (no apostó)",
      "Asiento 2: Fharock (botón) se retiró antes del Flop (no apostó)",
      "Asiento 3: ecuinas (ciega pequeña) se retiró antes del Flop",
      "Asiento 4: LxckxStrxkx (ciega grande) recaudó (0.02 €)",
      "Asiento 6: Akourdideh se retiró antes del Flop (no apostó)"
    ],
    "flop": [],
    "turn": [],
    "river": []
  },
  "board": [],
  "winner": "LxckxStrxkx",
  "win_amount": 1.0,
  "sb": 0.01,
  "bb": 0.02,
  "rake": 0.0,
  "raw_text": "Mano n.º 257168274408 de PokerStars:  Hold'em No Limit (0.01 €/0.02 € EUR) - 01-08-2025 11:17:31 CET [01-08-2025 5:17:31 ET]\nMesa \"Atlas\" 6-max El asiento n.º 2 es el botón\nAsiento 5: erCampos23 (0.85 € en fichas) está ausente\nAsiento 1: SrLyce (1.89 € en fichas) \nAsiento 2: Fharock (1.84 € en fichas) \nAsiento 3: ecuinas (1.95 € en fichas) \nAsiento 4: LxckxStrxkx (2 € en fichas) \nAsiento 6: Akourdideh (2.31 € en fichas) \necuinas: pone la ciega pequeña 0.01 €\nLxckxStrxkx: pone la ciega grande 0.02 €\nerCampos23: se ausenta \n*** CARTAS DE MANO ***\nRepartidas a SrLyce [Kc 5d]\nAkourdideh: se retira \nSrLyce: se retira \nFharock ha agotado su tiempo\nFharock: se retira \necuinas: se retira \nLa apuesta no igualada (0.01 €) ha sido devuelta a LxckxStrxkx\nLxckxStrxkx se lleva 0.02 € del bote \nLxckxStrxkx: no muestra su mano \n*** RESUMEN ***\nBote total 0.02 € | Comisión 0 € \nAsiento 5: erCampos23\nAsiento 1: SrLyce se retiró antes del Flop (no apostó)\nAsiento 2: Fharock (botón) se retiró antes del Flop (no apostó)\nAsiento 3: ecuinas (ciega pequeña) se retiró antes del Flop\nAsiento 4: LxckxStrxkx (ciega grande) recaudó (0.02 €)\nAsiento 6: Akourdideh se retiró antes del Flop (no apostó)"
}