{
  "hand_id": "257150211266",
  "date": "30-07-2025 23:26:00",
  "table": "Gilgamesh",
  "game_type": "holdem",
  "hero": "SrLyce",
  "hero_position": "",
  "hero_cards": [
    "3c",
    "3h"
  ],
  "stacks": {
    "riverrrrrrmagic": 124.0,
    "SrLyce": 112.0,
    "Jumby34": 100.0,
    "xapkk": 100.0,
    "samaritano34": 90.5,
    "Fretzo67500": 124.5
  },
  "actions": {
    "preflop": [
      "Asiento 1: riverrrrrrmagic (2.48 € en fichas)",
      "Asiento 2: SrLyce (2.24 € en fichas)",
      "Asiento 3: Jumby34 (2 € en fichas)",
      "Asiento 4: xapkk (2 € en fichas)",
      "Asiento 5: samaritano34 (1.81 € en fichas)",
      "Asiento 6: Fretzo67500 (2.49 € en fichas)",
      "riverrrrrrmagic: pone la ciega pequeña 0.01 €",
      "SrLyce: pone la ciega grande 0.02 €",
      "Jumby34: se retira",
      "xapkk: se retira",
      "samaritano34: se retira",
      "Fretzo67500: sube 0.02 € a 0.04 €",
      "riverrrrrrmagic: se retira",
      "SrLyce: iguala 0.02 €"
    ],
    "flop": [
      "SrLyce: pasa",
      "Fretzo67500: pasa"
    ],
    "turn": [
      "SrLyce: pasa",
      "Fretzo67500: pasa"
    ],
    "river": [
      "SrLyce: apuesta 0.04 €",
      "Fretzo67500: iguala 0.04 €",
      "SrLyce: muestra [3c 3h] (doble pareja, reyes y treses)",
      "Fretzo67500: muestra [4d Ad] (doble pareja, reyes y cuatros)",
      "Asiento 1: riverrrrrrmagic (ciega pequeña) se retiró antes del Flop",
      "Asiento 2: SrLyce (ciega grande) muestra [3c 3h] y perdió con doble pareja, reyes y treses",
      "Asiento 3: Jumby34 se retiró antes del Flop (no apostó)",
      "Asiento 4: xapkk se retiró antes del Flop (no apostó)",
      "Asiento 5: samaritano34 se retiró antes del Flop (no apostó)",
      "Asiento 6: Fretzo67500 (botón) muestra [4d Ad] y ganó (0.16 €) con doble pareja, reyes y cuatros"
    ]
  },
  "board": [
    "Ks",
    "2c",
    "Kh",
    "Qd",
    "4s"
  ],
  "winner": "Fretzo67500",
  "win_amount": 8.0,
  "sb": 0.01,
  "bb": 0.02,
  "rake": 0.5,
  "raw_text": "Mano n.º 257150211266 de PokerStars:  Hold'em No Limit (0.01 €/0.02 € EUR) - 30-07-2025 23:26:00 CET [30-07-2025 17:26:00 ET]\nMesa \"Gilgamesh\" 6-max El asiento n.º 6 es el botón\nAsiento 1: riverrrrrrmagic (2.48 € en fichas) \nAsiento 2: SrLyce (2.24 € en fichas) \nAsiento 3: Jumby34 (2 € en fichas) \nAsiento 4: xapkk (2 € en fichas) \nAsiento 5: samaritano34 (1.81 € en fichas) \nAsiento 6: Fretzo67500 (2.49 € en fichas) \nriverrrrrrmagic: pone la ciega pequeña 0.01 €\nSrLyce: pone la ciega grande 0.02 €\n*** CARTAS DE MANO ***\nRepartidas a SrLyce [3c 3h]\nJumby34: se retira \nxapkk: se retira \nsamaritano34: se retira \nFretzo67500: sube 0.02 € a 0.04 €\nriverrrrrrmagic: se retira \nSrLyce: iguala 0.02 €\n*** FLOP *** [Ks 2c Kh]\nSrLyce: pasa \nFretzo67500: pasa \n*** TURN *** [Ks 2c Kh] [Qd]\nSrLyce: pasa \nFretzo67500: pasa \n*** RIVER *** [Ks 2c Kh Qd] [4s]\nSrLyce: apuesta 0.04 €\nFretzo67500: iguala 0.04 €\n*** SHOW DOWN ***\nSrLyce: muestra [3c 3h] (doble pareja, reyes y treses)\nFretzo67500: muestra [4d Ad] (doble pareja, reyes y cuatros)\nFretzo67500 se lleva 0.16 € del bote \n*** RESUMEN ***\nBote total 0.17 € | Comisión 0.01 € \nComunitarias [Ks 2c Kh Qd 4s]\nAsiento 1: riverrrrrrmagic (ciega pequeña) se retiró antes del Flop\nAsiento 2: SrLyce (ciega grande) muestra [3c 3h] y perdió con doble pareja, reyes y treses\nAsiento 3: Jumby34 se retiró antes del Flop (no apostó)\nAsiento 4: xapkk se retiró antes del Flop (no apostó)\nAsiento 5: samaritano34 se retiró antes del Flop (no apostó)\nAsiento 6: Fretzo67500 (botón) muestra [4d Ad] y ganó (0.16 €) con doble pareja, reyes y cuatros"
}