{
  "hand_id": "257215033743",
  "date": "04-08-2025 22:20:13",
  "table": "Aldhafera II",
  "game_type": "holdem",
  "hero": "SrLyce",
  "hero_position": "",
  "hero_cards": [
    "Ts",
    "3c"
  ],
  "stacks": {
    "wsx25": 95.5,
    "BudyXXIII": 268.0,
    "SrLyce": 96.0,
    "rhidoxxx": 100.5,
    "jte-ken": 110.0,
    "betterrrrrr": 106.5
  },
  "actions": {
    "preflop": [
      "Asiento 1: wsx25 (1.91 € en fichas)",
      "Asiento 2: BudyXXIII (5.36 € en fichas)",
      "Asiento 3: SrLyce (1.92 € en fichas)",
      "Asiento 4: rhidoxxx (2.01 € en fichas)",
      "Asiento 5: jte-ken (2.20 € en fichas)",
      "Asiento 6: betterrrrrr (2.13 € en fichas)",
      "wsx25: pone la ciega pequeña 0.01 €",
      "BudyXXIII: pone la ciega grande 0.02 €",
      "SrLyce: se retira",
      "rhidoxxx: sube 0.04 € a 0.06 €",
      "jte-ken: iguala 0.06 €",
      "betterrrrrr: se retira",
      "wsx25: se retira",
      "BudyXXIII: se retira"
    ],
    "flop": [
      "rhidoxxx: apuesta 0.07 €",
      "jte-ken: sube 0.14 € a 0.21 €",
      "rhidoxxx: iguala 0.14 €"
    ],
    "turn": [
      "rhidoxxx: pasa",
      "jte-ken: apuesta 0.29 €",
      "rhidoxxx: se retira",
      "Asiento 1: wsx25 (ciega pequeña) se retiró antes del Flop",
      "Asiento 2: BudyXXIII (ciega grande) se retiró antes del Flop",
      "Asiento 3: SrLyce se retiró antes del Flop (no apostó)",
      "Asiento 4: rhidoxxx se retiró en el Turn",
      "Asiento 5: jte-ken recaudó (0.54 €)",
      "Asiento 6: betterrrrrr (botón) se retiró antes del Flop (no apostó)"
    ],
    "river": []
  },
  "board": [
    "2c",
    "5d",
    "Kc",
    "Ks"
  ],
  "winner": "jte-ken",
  "win_amount": 27.0,
  "sb": 0.01,
  "bb": 0.02,
  "rake": 1.5,
  "raw_text": "Mano n.º 257215033743 de PokerStars:  Hold'em No Limit (0.01 €/0.02 € EUR) - 04-08-2025 22:20:13 CET [04-08-2025 16:20:13 ET]\nMesa \"Aldhafera II\" 6-max El asiento n.º 6 es el botón\nAsiento 1: wsx25 (1.91 € en fichas) \nAsiento 2: BudyXXIII (5.36 € en fichas) \nAsiento 3: SrLyce (1.92 € en fichas) \nAsiento 4: rhidoxxx (2.01 € en fichas) \nAsiento 5: jte-ken (2.20 € en fichas) \nAsiento 6: betterrrrrr (2.13 € en fichas) \nwsx25: pone la ciega pequeña 0.01 €\nBudyXXIII: pone la ciega grande 0.02 €\n*** CARTAS DE MANO ***\nRepartidas a SrLyce [Ts 3c]\nSrLyce: se retira \nrhidoxxx: sube 0.04 € a 0.06 €\njte-ken: iguala 0.06 €\nbetterrrrrr: se retira \nwsx25: se retira \nBudyXXIII: se retira \n*** FLOP *** [2c 5d Kc]\nrhidoxxx: apuesta 0.07 €\njte-ken: sube 0.14 € a 0.21 €\nrhidoxxx: iguala 0.14 €\n*** TURN *** [2c 5d Kc] [Ks]\nrhidoxxx: pasa \njte-ken: apuesta 0.29 €\nrhidoxxx: se retira \nLa apuesta no igualada (0.29 €) ha sido devuelta a jte-ken\njte-ken se lleva 0.54 € del bote \n*** RESUMEN ***\nBote total 0.57 € | Comisión 0.03 € \nComunitarias [2c 5d Kc Ks]\nAsiento 1: wsx25 (ciega pequeña) se retiró antes del Flop\nAsiento 2: BudyXXIII (ciega grande) se retiró antes del Flop\nAsiento 3: SrLyce se retiró antes del Flop (no apostó)\nAsiento 4: rhidoxxx se retiró en el Turn\nAsiento 5: jte-ken recaudó (0.54 €)\nAsiento 6: betterrrrrr (botón) se retiró antes del Flop (no apostó)"
}