{
  "hand_id": "257150394833",
  "date": "30-07-2025 23:38:45",
  "table": "Lobelia",
  "game_type": "holdem",
  "hero": "SrLyce",
  "hero_position": "",
  "hero_cards": [
    "5h",
    "3c"
  ],
  "stacks": {
    "LeVbks": 119.0,
    "fcis666": 42.0,
    "Dlaguancha": 131.5,
    "SrLyce": 80.0,
    "riverluck444": 84.5,
    "javipondio": 42.0
  },
  "actions": {
    "preflop": [
      "Asiento 1: LeVbks (2.38 € en fichas)",
      "Asiento 2: fcis666 (0.84 € en fichas)",
      "Asiento 3: Dlaguancha (2.63 € en fichas)",
      "Asiento 4: SrLyce (1.60 € en fichas)",
      "Asiento 5: riverluck444 (1.69 € en fichas)",
      "Asiento 6: javipondio (0.84 € en fichas)",
      "Dlaguancha: pone la ciega pequeña 0.01 €",
      "SrLyce: pone la ciega grande 0.02 €",
      "riverluck444: sube 0.04 € a 0.06 €",
      "javipondio: iguala 0.06 €",
      "LeVbks: se retira",
      "fcis666: se retira",
      "Dlaguancha: iguala 0.05 €",
      "SrLyce: se retira"
    ],
    "flop": [
      "Dlaguancha: pasa",
      "riverluck444: pasa",
      "javipondio: pasa"
    ],
    "turn": [
      "Dlaguancha: pasa",
      "riverluck444: pasa",
      "javipondio: pasa"
    ],
    "river": [
      "Dlaguancha: apuesta 0.02 €",
      "riverluck444: se retira",
      "javipondio: iguala 0.02 €",
      "Dlaguancha: muestra [Qd Ad] (escalera, de as a cinco)",
      "javipondio: muestra [Qs Ah] (escalera, de as a cinco)",
      "Asiento 1: LeVbks se retiró antes del Flop (no apostó)",
      "Asiento 2: fcis666 (botón) se retiró antes del Flop (no apostó)",
      "Asiento 3: Dlaguancha (ciega pequeña) muestra [Qd Ad] y ganó (0.12 €) con escalera, de as a cinco",
      "Asiento 4: SrLyce (ciega grande) se retiró antes del Flop",
      "Asiento 5: riverluck444 se retiró en el River",
      "Asiento 6: javipondio muestra [Qs Ah] y ganó (0.11 €) con escalera, de as a cinco"
    ]
  },
  "board": [
    "7h",
    "2c",
    "5c",
    "4s",
    "3d"
  ],
  "winner": "Dlaguancha",
  "win_amount": 6.0,
  "sb": 0.01,
  "bb": 0.02,
  "rake": 0.5,
  "raw_text": "Mano n.º 257150394833 de PokerStars:  Hold'em No Limit (0.01 €/0.02 € EUR) - 30-07-2025 23:38:45 CET [30-07-2025 17:38:45 ET]\nMesa \"Lobelia\" 6-max El asiento n.º 2 es el botón\nAsiento 1: LeVbks (2.38 € en fichas) \nAsiento 2: fcis666 (0.84 € en fichas) \nAsiento 3: Dlaguancha (2.63 € en fichas) \nAsiento 4: SrLyce (1.60 € en fichas) \nAsiento 5: riverluck444 (1.69 € en fichas) \nAsiento 6: javipondio (0.84 € en fichas) \nDlaguancha: pone la ciega pequeña 0.01 €\nSrLyce: pone la ciega grande 0.02 €\n*** CARTAS DE MANO ***\nRepartidas a SrLyce [5h 3c]\nriverluck444: sube 0.04 € a 0.06 €\njavipondio: iguala 0.06 €\nLeVbks: se retira \nfcis666: se retira \nDlaguancha: iguala 0.05 €\nSrLyce: se retira \n*** FLOP *** [7h 2c 5c]\nDlaguancha: pasa \nriverluck444: pasa \njavipondio: pasa \n*** TURN *** [7h 2c 5c] [4s]\nDlaguancha: pasa \nriverluck444: pasa \njavipondio: pasa \n*** RIVER *** [7h 2c 5c 4s] [3d]\nDlaguancha: apuesta 0.02 €\nriverluck444: se retira \njavipondio: iguala 0.02 €\n*** SHOW DOWN ***\nDlaguancha: muestra [Qd Ad] (escalera, de as a cinco)\njavipondio: muestra [Qs Ah] (escalera, de as a cinco)\nDlaguancha se lleva 0.12 € del bote \njavipondio se lleva 0.11 € del bote \n*** RESUMEN ***\nBote total 0.24 € | Comisión 0.01 € \nComunitarias [7h 2c 5c 4s 3d]\nAsiento 1: LeVbks se retiró antes del Flop (no apostó)\nAsiento 2: fcis666 (botón) se retiró antes del Flop (no apostó)\nAsiento 3: Dlaguancha (ciega pequeña) muestra [Qd Ad] y ganó (0.12 €) con escalera, de as a cinco\nAsiento 4: SrLyce (ciega grande) se retiró antes del Flop\nAsiento 5: riverluck444 se retiró en el River\nAsiento 6: javipondio muestra [Qs Ah] y ganó (0.11 €) con escalera, de as a cinco"
}