{
  "hand_id": "257150285154",
  "date": "30-07-2025 23:31:07",
  "table": "Gilgamesh",
  "game_type": "holdem",
  "hero": "SrLyce",
  "hero_position": "",
  "hero_cards": [
    "2c",
    "Ts"
  ],
  "stacks": {
    "riverrrrrrmagic": 140.5,
    "SrLyce": 106.0,
    "Jumby34": 102.5,
    "xapkk": 100.0,
    "ozil111": 100.0,
    "Fretzo67500": 141.0
  },
  "actions": {
    "preflop": [
      "Asiento 1: riverrrrrrmagic (2.81 € en fichas)",
      "Asiento 2: SrLyce (2.12 € en fichas)",
      "Asiento 3: Jumby34 (2.05 € en fichas)",
      "Asiento 4: xapkk (2 € en fichas)",
      "Asiento 5: ozil111 (2 € en fichas)",
      "Asiento 6: Fretzo67500 (2.82 € en fichas)",
      "xapkk: pone la ciega pequeña 0.01 €",
      "ozil111: pone la ciega grande 0.02 €",
      "Fretzo67500: se retira",
      "riverrrrrrmagic: iguala 0.02 €",
      "SrLyce: se retira",
      "Jumby34: se retira",
      "xapkk: sube 0.03 € a 0.05 €",
      "ozil111: se retira",
      "riverrrrrrmagic: iguala 0.03 €"
    ],
    "flop": [
      "xapkk: apuesta 0.06 €",
      "riverrrrrrmagic: se retira",
      "xapkk: no muestra su mano",
      "Asiento 1: riverrrrrrmagic se retiró en el Flop",
      "Asiento 2: SrLyce se retiró antes del Flop (no apostó)",
      "Asiento 3: Jumby34 (botón) se retiró antes del Flop (no apostó)",
      "Asiento 4: xapkk (ciega pequeña) recaudó (0.11 €)",
      "Asiento 5: ozil111 (ciega grande) se retiró antes del Flop",
      "Asiento 6: Fretzo67500 se retiró antes del Flop (no apostó)"
    ],
    "turn": [],
    "river": []
  },
  "board": [
    "Kc",
    "6s",
    "7c"
  ],
  "winner": "xapkk",
  "win_amount": 5.5,
  "sb": 0.01,
  "bb": 0.02,
  "rake": 0.5,
  "raw_text": "Mano n.º 257150285154 de PokerStars:  Hold'em No Limit (0.01 €/0.02 € EUR) - 30-07-2025 23:31:07 CET [30-07-2025 17:31:07 ET]\nMesa \"Gilgamesh\" 6-max El asiento n.º 3 es el botón\nAsiento 1: riverrrrrrmagic (2.81 € en fichas) \nAsiento 2: SrLyce (2.12 € en fichas) \nAsiento 3: Jumby34 (2.05 € en fichas) \nAsiento 4: xapkk (2 € en fichas) \nAsiento 5: ozil111 (2 € en fichas) \nAsiento 6: Fretzo67500 (2.82 € en fichas) \nxapkk: pone la ciega pequeña 0.01 €\nozil111: pone la ciega grande 0.02 €\n*** CARTAS DE MANO ***\nRepartidas a SrLyce [2c Ts]\nFretzo67500: se retira \nriverrrrrrmagic: iguala 0.02 €\nFretzo67500 deja la mesa\nSrLyce: se retira \nJumby34: se retira \nxapkk: sube 0.03 € a 0.05 €\nozil111: se retira \nriverrrrrrmagic: iguala 0.03 €\n*** FLOP *** [Kc 6s 7c]\nxapkk: apuesta 0.06 €\nJumby34 deja la mesa\nriverrrrrrmagic: se retira \nLa apuesta no igualada (0.06 €) ha sido devuelta a xapkk\nxapkk se lleva 0.11 € del bote \nxapkk: no muestra su mano \n*** RESUMEN ***\nBote total 0.12 € | Comisión 0.01 € \nComunitarias [Kc 6s 7c]\nAsiento 1: riverrrrrrmagic se retiró en el Flop\nAsiento 2: SrLyce se retiró antes del Flop (no apostó)\nAsiento 3: Jumby34 (botón) se retiró antes del Flop (no apostó)\nAsiento 4: xapkk (ciega pequeña) recaudó (0.11 €)\nAsiento 5: ozil111 (ciega grande) se retiró antes del Flop\nAsiento 6: Fretzo67500 se retiró antes del Flop (no apostó)"
}