{
  "hand_id": "257148990413",
  "date": "30-07-2025 21:59:51",
  "table": "Sirona",
  "game_type": "holdem",
  "hero": "SrLyce",
  "hero_position": "",
  "hero_cards": [
    "7h",
    "Jc"
  ],
  "stacks": {
    "SrLyce": 114.0,
    "lecontrebandier": 88.5,
    "christoph363": 207.0,
    "oliverdu70": 132.0,
    "NaruchoH1": 100.0,
    "Dakoo44": 79.5
  },
  "actions": {
    "preflop": [
      "Asiento 1: SrLyce (2.28 € en fichas)",
      "Asiento 2: lecontrebandier (1.77 € en fichas)",
      "Asiento 3: christoph363 (4.14 € en fichas)",
      "Asiento 4: oliverdu70 (2.64 € en fichas)",
      "Asiento 5: NaruchoH1 (2 € en fichas)",
      "Asiento 6: Dakoo44 (1.59 € en fichas)",
      "NaruchoH1: pone la ciega pequeña 0.01 €",
      "Dakoo44: pone la ciega grande 0.02 €",
      "SrLyce: se retira",
      "lecontrebandier: sube 0.04 € a 0.06 €",
      "christoph363: se retira",
      "oliverdu70: iguala 0.06 €",
      "NaruchoH1: se retira",
      "Dakoo44: iguala 0.04 €"
    ],
    "flop": [
      "Dakoo44: pasa",
      "lecontrebandier: apuesta 0.32 €",
      "oliverdu70: se retira",
      "Dakoo44: se retira",
      "lecontrebandier: no muestra su mano",
      "Asiento 1: SrLyce se retiró antes del Flop (no apostó)",
      "Asiento 2: lecontrebandier recaudó (0.18 €)",
      "Asiento 3: christoph363 se retiró antes del Flop (no apostó)",
      "Asiento 4: oliverdu70 (botón) se retiró en el Flop",
      "Asiento 5: NaruchoH1 (ciega pequeña) se retiró antes del Flop",
      "Asiento 6: Dakoo44 (ciega grande) se retiró en el Flop"
    ],
    "turn": [],
    "river": []
  },
  "board": [
    "7s",
    "6d",
    "3h"
  ],
  "winner": "lecontrebandier",
  "win_amount": 9.0,
  "sb": 0.01,
  "bb": 0.02,
  "rake": 0.5,
  "raw_text": "Mano n.º 257148990413 de PokerStars:  Hold'em No Limit (0.01 €/0.02 € EUR) - 30-07-2025 21:59:51 CET [30-07-2025 15:59:51 ET]\nMesa \"Sirona\" 6-max El asiento n.º 4 es el botón\nAsiento 1: SrLyce (2.28 € en fichas) \nAsiento 2: lecontrebandier (1.77 € en fichas) \nAsiento 3: christoph363 (4.14 € en fichas) \nAsiento 4: oliverdu70 (2.64 € en fichas) \nAsiento 5: NaruchoH1 (2 € en fichas) \nAsiento 6: Dakoo44 (1.59 € en fichas) \nNaruchoH1: pone la ciega pequeña 0.01 €\nDakoo44: pone la ciega grande 0.02 €\n*** CARTAS DE MANO ***\nRepartidas a SrLyce [7h Jc]\nSrLyce: se retira \nlecontrebandier: sube 0.04 € a 0.06 €\nchristoph363: se retira \noliverdu70: iguala 0.06 €\nNaruchoH1: se retira \nDakoo44: iguala 0.04 €\n*** FLOP *** [7s 6d 3h]\nDakoo44: pasa \nlecontrebandier: apuesta 0.32 €\noliverdu70: se retira \nDakoo44: se retira \nLa apuesta no igualada (0.32 €) ha sido devuelta a lecontrebandier\nlecontrebandier se lleva 0.18 € del bote \nlecontrebandier: no muestra su mano \n*** RESUMEN ***\nBote total 0.19 € | Comisión 0.01 € \nComunitarias [7s 6d 3h]\nAsiento 1: SrLyce se retiró antes del Flop (no apostó)\nAsiento 2: lecontrebandier recaudó (0.18 €)\nAsiento 3: christoph363 se retiró antes del Flop (no apostó)\nAsiento 4: oliverdu70 (botón) se retiró en el Flop\nAsiento 5: NaruchoH1 (ciega pequeña) se retiró antes del Flop\nAsiento 6: Dakoo44 (ciega grande) se retiró en el Flop"
}