{
  "hand_id": "257238302644",
  "date": "06-08-2025 18:46:00",
  "table": "Herculina II",
  "game_type": "holdem",
  "hero": "SrLyce",
  "hero_position": "",
  "hero_cards": [
    "5h",
    "5s"
  ],
  "stacks": {
    "koldipk": 173.5,
    "David98X": 109.5,
    "JJer11": 100.0,
    "SrLyce": 95.5,
    "El Calvo 65": 227.5
  },
  "actions": {
    "preflop": [
      "Asiento 1: koldipk (3.47 € en fichas)",
      "Asiento 2: David98X (2.19 € en fichas)",
      "Asiento 3: JJer11 (2 € en fichas)",
      "Asiento 4: SrLyce (1.91 € en fichas)",
      "Asiento 5: El Calvo 65 (4.55 € en fichas)",
      "koldipk: pone la ciega pequeña 0.01 €",
      "David98X: pone la ciega grande 0.02 €",
      "JJer11: se retira",
      "SrLyce: sube 0.03 € a 0.05 €",
      "El Calvo 65: se retira",
      "koldipk: se retira",
      "David98X: se retira",
      "SrLyce: no muestra su mano",
      "Asiento 1: koldipk (ciega pequeña) se retiró antes del Flop",
      "Asiento 2: David98X (ciega grande) se retiró antes del Flop",
      "Asiento 3: JJer11 se retiró antes del Flop (no apostó)",
      "Asiento 4: SrLyce recaudó (0.05 €)",
      "Asiento 5: El Calvo 65 (botón) se retiró antes del Flop (no apostó)"
    ],
    "flop": [],
    "turn": [],
    "river": []
  },
  "board": [],
  "winner": "SrLyce",
  "win_amount": 2.5,
  "sb": 0.01,
  "bb": 0.02,
  "rake": 0.0,
  "raw_text": "Mano n.º 257238302644 de PokerStars:  Hold'em No Limit (0.01 €/0.02 € EUR) - 06-08-2025 18:46:00 CET [06-08-2025 12:46:00 ET]\nMesa \"Herculina II\" 6-max El asiento n.º 5 es el botón\nAsiento 1: koldipk (3.47 € en fichas) \nAsiento 2: David98X (2.19 € en fichas) \nAsiento 3: JJer11 (2 € en fichas) \nAsiento 4: SrLyce (1.91 € en fichas) \nAsiento 5: El Calvo 65 (4.55 € en fichas) \nkoldipk: pone la ciega pequeña 0.01 €\nDavid98X: pone la ciega grande 0.02 €\n*** CARTAS DE MANO ***\nRepartidas a SrLyce [5h 5s]\nJJer11: se retira \nSrLyce: sube 0.03 € a 0.05 €\nEl Calvo 65: se retira \nkoldipk: se retira \nDavid98X: se retira \nLa apuesta no igualada (0.03 €) ha sido devuelta a SrLyce\nScarvBlack se une a la mesa en el asiento n.º 6 \nSrLyce se lleva 0.05 € del bote \nSrLyce: no muestra su mano \n*** RESUMEN ***\nBote total 0.05 € | Comisión 0 € \nAsiento 1: koldipk (ciega pequeña) se retiró antes del Flop\nAsiento 2: David98X (ciega grande) se retiró antes del Flop\nAsiento 3: JJer11 se retiró antes del Flop (no apostó)\nAsiento 4: SrLyce recaudó (0.05 €)\nAsiento 5: El Calvo 65 (botón) se retiró antes del Flop (no apostó)"
}