{
  "hand_id": "257238430191",
  "date": "06-08-2025 18:57:56",
  "table": "Alruccabah II",
  "game_type": "holdem",
  "hero": "SrLyce",
  "hero_position": "",
  "hero_cards": [
    "3s",
    "Js"
  ],
  "stacks": {
    "SrLyce": 137.0,
    "zoioachado": 40.0,
    "yonisanlu": 101.5,
    "Nicanor Cast": 52.5,
    "rayao32": 43.5
  },
  "actions": {
    "preflop": [
      "Asiento 1: SrLyce (2.74 € en fichas)",
      "Asiento 2: zoioachado (0.80 € en fichas)",
      "Asiento 3: yonisanlu (2.03 € en fichas)",
      "Asiento 4: serviettski(fr) (2.05 € en fichas)",
      "Asiento 5: Nicanor Cast (1.05 € en fichas)",
      "Asiento 6: rayao32 (0.87 € en fichas)",
      "SrLyce: pone la ciega pequeña 0.01 €",
      "zoioachado: pone la ciega grande 0.02 €",
      "yonisanlu: sube 0.03 € a 0.05 €",
      "serviettski(fr): se retira",
      "Nicanor Cast: se retira",
      "rayao32: se retira",
      "SrLyce: se retira",
      "zoioachado: sube 0.11 € a 0.16 €",
      "yonisanlu: iguala 0.11 €"
    ],
    "flop": [
      "zoioachado: pasa",
      "yonisanlu: pasa"
    ],
    "turn": [
      "zoioachado: apuesta 0.64 € y está all-in",
      "yonisanlu: se retira",
      "Asiento 1: SrLyce (ciega pequeña) se retiró antes del Flop",
      "Asiento 2: zoioachado (ciega grande) recaudó (0.31 €)",
      "Asiento 3: yonisanlu se retiró en el Turn",
      "Asiento 4: serviettski(fr) se retiró antes del Flop (no apostó)",
      "Asiento 5: Nicanor Cast se retiró antes del Flop (no apostó)",
      "Asiento 6: rayao32 (botón) se retiró antes del Flop (no apostó)"
    ],
    "river": []
  },
  "board": [
    "Jh",
    "7d",
    "6d",
    "2c"
  ],
  "winner": "zoioachado",
  "win_amount": 15.5,
  "sb": 0.01,
  "bb": 0.02,
  "rake": 1.0,
  "raw_text": "Mano n.º 257238430191 de PokerStars:  Hold'em No Limit (0.01 €/0.02 € EUR) - 06-08-2025 18:57:56 CET [06-08-2025 12:57:56 ET]\nMesa \"Alruccabah II\" 6-max El asiento n.º 6 es el botón\nAsiento 1: SrLyce (2.74 € en fichas) \nAsiento 2: zoioachado (0.80 € en fichas) \nAsiento 3: yonisanlu (2.03 € en fichas) \nAsiento 4: serviettski(fr) (2.05 € en fichas) \nAsiento 5: Nicanor Cast (1.05 € en fichas) \nAsiento 6: rayao32 (0.87 € en fichas) \nSrLyce: pone la ciega pequeña 0.01 €\nzoioachado: pone la ciega grande 0.02 €\n*** CARTAS DE MANO ***\nRepartidas a SrLyce [3s Js]\nyonisanlu: sube 0.03 € a 0.05 €\nserviettski(fr): se retira \nNicanor Cast: se retira \nrayao32: se retira \nSrLyce: se retira \nzoioachado: sube 0.11 € a 0.16 €\nyonisanlu: iguala 0.11 €\n*** FLOP *** [Jh 7d 6d]\nzoioachado: pasa \nyonisanlu: pasa \n*** TURN *** [Jh 7d 6d] [2c]\nzoioachado: apuesta 0.64 € y está all-in\nyonisanlu: se retira \nLa apuesta no igualada (0.64 €) ha sido devuelta a zoioachado\nzoioachado se lleva 0.31 € del bote \n*** RESUMEN ***\nBote total 0.33 € | Comisión 0.02 € \nComunitarias [Jh 7d 6d 2c]\nAsiento 1: SrLyce (ciega pequeña) se retiró antes del Flop\nAsiento 2: zoioachado (ciega grande) recaudó (0.31 €)\nAsiento 3: yonisanlu se retiró en el Turn\nAsiento 4: serviettski(fr) se retiró antes del Flop (no apostó)\nAsiento 5: Nicanor Cast se retiró antes del Flop (no apostó)\nAsiento 6: rayao32 (botón) se retiró antes del Flop (no apostó)"
}