{
  "hand_id": "257150437555",
  "date": "30-07-2025 23:41:48",
  "table": "Lobelia",
  "game_type": "holdem",
  "hero": "SrLyce",
  "hero_position": "",
  "hero_cards": [
    "Qc",
    "2s"
  ],
  "stacks": {
    "LeVbks": 115.0,
    "fcis666": 41.0,
    "Dlaguancha": 133.5,
    "SrLyce": 104.5,
    "riverluck444": 82.5,
    "javipondio": 40.0
  },
  "actions": {
    "preflop": [
      "Asiento 1: LeVbks (2.30 € en fichas)",
      "Asiento 2: fcis666 (0.82 € en fichas)",
      "Asiento 3: Dlaguancha (2.67 € en fichas)",
      "Asiento 4: SrLyce (2.09 € en fichas)",
      "Asiento 5: riverluck444 (1.65 € en fichas)",
      "Asiento 6: javipondio (0.80 € en fichas)",
      "LeVbks: pone la ciega pequeña 0.01 €",
      "fcis666: pone la ciega grande 0.02 €",
      "Dlaguancha: se retira",
      "SrLyce: se retira",
      "riverluck444: se retira",
      "javipondio: se retira",
      "LeVbks: sube 0.04 € a 0.06 €",
      "fcis666: iguala 0.04 €"
    ],
    "flop": [
      "LeVbks: pasa",
      "fcis666: pasa"
    ],
    "turn": [
      "LeVbks: apuesta 0.06 €",
      "fcis666: se retira",
      "LeVbks: no muestra su mano",
      "Asiento 1: LeVbks (ciega pequeña) recaudó (0.11 €)",
      "Asiento 2: fcis666 (ciega grande) se retiró en el Turn",
      "Asiento 3: Dlaguancha se retiró antes del Flop (no apostó)",
      "Asiento 4: SrLyce se retiró antes del Flop (no apostó)",
      "Asiento 5: riverluck444 se retiró antes del Flop (no apostó)",
      "Asiento 6: javipondio (botón) se retiró antes del Flop (no apostó)"
    ],
    "river": []
  },
  "board": [
    "4d",
    "3h",
    "5d",
    "Qd"
  ],
  "winner": "LeVbks",
  "win_amount": 5.5,
  "sb": 0.01,
  "bb": 0.02,
  "rake": 0.5,
  "raw_text": "Mano n.º 257150437555 de PokerStars:  Hold'em No Limit (0.01 €/0.02 € EUR) - 30-07-2025 23:41:48 CET [30-07-2025 17:41:48 ET]\nMesa \"Lobelia\" 6-max El asiento n.º 6 es el botón\nAsiento 1: LeVbks (2.30 € en fichas) \nAsiento 2: fcis666 (0.82 € en fichas) \nAsiento 3: Dlaguancha (2.67 € en fichas) \nAsiento 4: SrLyce (2.09 € en fichas) \nAsiento 5: riverluck444 (1.65 € en fichas) \nAsiento 6: javipondio (0.80 € en fichas) \nLeVbks: pone la ciega pequeña 0.01 €\nfcis666: pone la ciega grande 0.02 €\n*** CARTAS DE MANO ***\nRepartidas a SrLyce [Qc 2s]\nDlaguancha: se retira \nSrLyce: se retira \nriverluck444: se retira \njavipondio: se retira \nLeVbks: sube 0.04 € a 0.06 €\nfcis666: iguala 0.04 €\n*** FLOP *** [4d 3h 5d]\nLeVbks: pasa \nfcis666: pasa \n*** TURN *** [4d 3h 5d] [Qd]\nLeVbks: apuesta 0.06 €\nfcis666: se retira \nLa apuesta no igualada (0.06 €) ha sido devuelta a LeVbks\nLeVbks se lleva 0.11 € del bote \nLeVbks: no muestra su mano \n*** RESUMEN ***\nBote total 0.12 € | Comisión 0.01 € \nComunitarias [4d 3h 5d Qd]\nAsiento 1: LeVbks (ciega pequeña) recaudó (0.11 €)\nAsiento 2: fcis666 (ciega grande) se retiró en el Turn\nAsiento 3: Dlaguancha se retiró antes del Flop (no apostó)\nAsiento 4: SrLyce se retiró antes del Flop (no apostó)\nAsiento 5: riverluck444 se retiró antes del Flop (no apostó)\nAsiento 6: javipondio (botón) se retiró antes del Flop (no apostó)"
}