{
  "hand_id": "257238050813",
  "date": "06-08-2025 18:23:41",
  "table": "Atreus",
  "game_type": "holdem",
  "hero": "SrLyce",
  "hero_position": "",
  "hero_cards": [
    "Jd",
    "Kc"
  ],
  "stacks": {
    "PrendsCa": 105.0,
    "NRules82": 58.0,
    "JENOFONTE73": 140.0,
    "Fharock": 87.5,
    "SrLyce": 127.0,
    "FishamanReggae": 36.0
  },
  "actions": {
    "preflop": [
      "Asiento 1: PrendsCa (2.10 € en fichas)",
      "Asiento 2: NRules82 (1.16 € en fichas)",
      "Asiento 3: JENOFONTE73 (2.80 € en fichas)",
      "Asiento 4: Fharock (1.75 € en fichas)",
      "Asiento 5: SrLyce (2.54 € en fichas)",
      "Asiento 6: FishamanReggae (0.72 € en fichas)",
      "JENOFONTE73: pone la ciega pequeña 0.01 €",
      "Fharock: pone la ciega grande 0.02 €",
      "SrLyce: sube 0.03 € a 0.05 €",
      "FishamanReggae: se retira",
      "PrendsCa: se retira",
      "NRules82: iguala 0.05 €",
      "JENOFONTE73: se retira",
      "Fharock: iguala 0.03 €"
    ],
    "flop": [
      "Fharock: pasa",
      "SrLyce: apuesta 0.05 €",
      "NRules82: se retira",
      "Fharock: se retira",
      "SrLyce: no muestra su mano",
      "Asiento 1: PrendsCa se retiró antes del Flop (no apostó)",
      "Asiento 2: NRules82 (botón) se retiró en el Flop",
      "Asiento 3: JENOFONTE73 (ciega pequeña) se retiró antes del Flop",
      "Asiento 4: Fharock (ciega grande) se retiró en el Flop",
      "Asiento 5: SrLyce recaudó (0.15 €)",
      "Asiento 6: FishamanReggae se retiró antes del Flop (no apostó)"
    ],
    "turn": [],
    "river": []
  },
  "board": [
    "Td",
    "Js",
    "5s"
  ],
  "winner": "SrLyce",
  "win_amount": 7.5,
  "sb": 0.01,
  "bb": 0.02,
  "rake": 0.5,
  "raw_text": "Mano n.º 257238050813 de PokerStars:  Hold'em No Limit (0.01 €/0.02 € EUR) - 06-08-2025 18:23:41 CET [06-08-2025 12:23:41 ET]\nMesa \"Atreus\" 6-max El asiento n.º 2 es el botón\nAsiento 1: PrendsCa (2.10 € en fichas) \nAsiento 2: NRules82 (1.16 € en fichas) \nAsiento 3: JENOFONTE73 (2.80 € en fichas) \nAsiento 4: Fharock (1.75 € en fichas) \nAsiento 5: SrLyce (2.54 € en fichas) \nAsiento 6: FishamanReggae (0.72 € en fichas) \nJENOFONTE73: pone la ciega pequeña 0.01 €\nFharock: pone la ciega grande 0.02 €\n*** CARTAS DE MANO ***\nRepartidas a SrLyce [Jd Kc]\nSrLyce: sube 0.03 € a 0.05 €\nFishamanReggae: se retira \nPrendsCa: se retira \nNRules82: iguala 0.05 €\nJENOFONTE73: se retira \nFharock: iguala 0.03 €\n*** FLOP *** [Td Js 5s]\nFharock: pasa \nSrLyce: apuesta 0.05 €\nNRules82: se retira \nFharock: se retira \nLa apuesta no igualada (0.05 €) ha sido devuelta a SrLyce\nSrLyce se lleva 0.15 € del bote \nSrLyce: no muestra su mano \n*** RESUMEN ***\nBote total 0.16 € | Comisión 0.01 € \nComunitarias [Td Js 5s]\nAsiento 1: PrendsCa se retiró antes del Flop (no apostó)\nAsiento 2: NRules82 (botón) se retiró en el Flop\nAsiento 3: JENOFONTE73 (ciega pequeña) se retiró antes del Flop\nAsiento 4: Fharock (ciega grande) se retiró en el Flop\nAsiento 5: SrLyce recaudó (0.15 €)\nAsiento 6: FishamanReggae se retiró antes del Flop (no apostó)"
}