{
  "hand_id": "257238185386",
  "date": "06-08-2025 18:35:39",
  "table": "Atreus",
  "game_type": "holdem",
  "hero": "SrLyce",
  "hero_position": "",
  "hero_cards": [
    "7c",
    "8s"
  ],
  "stacks": {
    "PrendsCa": 101.0,
    "JENOFONTE73": 163.5,
    "Fharock": 86.0,
    "SrLyce": 139.5,
    "FishamanReggae": 33.0
  },
  "actions": {
    "preflop": [
      "Asiento 1: PrendsCa (2.02 € en fichas)",
      "Asiento 3: JENOFONTE73 (3.27 € en fichas)",
      "Asiento 4: Fharock (1.72 € en fichas)",
      "Asiento 5: SrLyce (2.79 € en fichas)",
      "Asiento 6: FishamanReggae (0.66 € en fichas)",
      "FishamanReggae: pone la ciega pequeña 0.01 €",
      "PrendsCa: pone la ciega grande 0.02 €",
      "JENOFONTE73: se retira",
      "Fharock: iguala 0.02 €",
      "SrLyce: iguala 0.02 €",
      "FishamanReggae: iguala 0.01 €",
      "PrendsCa: pasa"
    ],
    "flop": [
      "FishamanReggae: apuesta 0.02 €",
      "PrendsCa: se retira",
      "Fharock: se retira",
      "SrLyce: sube 0.04 € a 0.06 €",
      "FishamanReggae: se retira",
      "SrLyce: no muestra su mano",
      "Asiento 1: PrendsCa (ciega grande) se retiró en el Flop",
      "Asiento 3: JENOFONTE73 se retiró antes del Flop (no apostó)",
      "Asiento 4: Fharock se retiró en el Flop",
      "Asiento 5: SrLyce (botón) recaudó (0.11 €)",
      "Asiento 6: FishamanReggae (ciega pequeña) se retiró en el Flop"
    ],
    "turn": [],
    "river": []
  },
  "board": [
    "7h",
    "7d",
    "Kh"
  ],
  "winner": "SrLyce",
  "win_amount": 5.5,
  "sb": 0.01,
  "bb": 0.02,
  "rake": 0.5,
  "raw_text": "Mano n.º 257238185386 de PokerStars:  Hold'em No Limit (0.01 €/0.02 € EUR) - 06-08-2025 18:35:39 CET [06-08-2025 12:35:39 ET]\nMesa \"Atreus\" 6-max El asiento n.º 5 es el botón\nAsiento 1: PrendsCa (2.02 € en fichas) \nAsiento 3: JENOFONTE73 (3.27 € en fichas) \nAsiento 4: Fharock (1.72 € en fichas) \nAsiento 5: SrLyce (2.79 € en fichas) \nAsiento 6: FishamanReggae (0.66 € en fichas) \nFishamanReggae: pone la ciega pequeña 0.01 €\nPrendsCa: pone la ciega grande 0.02 €\n*** CARTAS DE MANO ***\nRepartidas a SrLyce [7c 8s]\nHomerob1987 se une a la mesa en el asiento n.º 2 \nJENOFONTE73: se retira \nFharock: iguala 0.02 €\nSrLyce: iguala 0.02 €\nFishamanReggae: iguala 0.01 €\nPrendsCa: pasa \n*** FLOP *** [7h 7d Kh]\nFishamanReggae: apuesta 0.02 €\nPrendsCa: se retira \nFharock: se retira \nSrLyce: sube 0.04 € a 0.06 €\nFishamanReggae: se retira \nLa apuesta no igualada (0.04 €) ha sido devuelta a SrLyce\nSrLyce se lleva 0.11 € del bote \nSrLyce: no muestra su mano \n*** RESUMEN ***\nBote total 0.12 € | Comisión 0.01 € \nComunitarias [7h 7d Kh]\nAsiento 1: PrendsCa (ciega grande) se retiró en el Flop\nAsiento 3: JENOFONTE73 se retiró antes del Flop (no apostó)\nAsiento 4: Fharock se retiró en el Flop\nAsiento 5: SrLyce (botón) recaudó (0.11 €)\nAsiento 6: FishamanReggae (ciega pequeña) se retiró en el Flop"
}