{
  "hand_id": "257149846845",
  "date": "30-07-2025 23:00:52",
  "table": "Gilgamesh",
  "game_type": "holdem",
  "hero": "SrLyce",
  "hero_position": "",
  "hero_cards": [
    "Jc",
    "8d"
  ],
  "stacks": {
    "riverrrrrrmagic": 116.5,
    "SrLyce": 98.0,
    "Jumby34": 113.5,
    "Fluxy123": 109.5,
    "cbo54": 81.5,
    "Fretzo67500": 112.0
  },
  "actions": {
    "preflop": [
      "Asiento 1: riverrrrrrmagic (2.33 € en fichas)",
      "Asiento 2: SrLyce (1.96 € en fichas)",
      "Asiento 3: Jumby34 (2.27 € en fichas)",
      "Asiento 4: Fluxy123 (2.19 € en fichas)",
      "Asiento 5: cbo54 (1.63 € en fichas)",
      "Asiento 6: Fretzo67500 (2.24 € en fichas)",
      "SrLyce: pone la ciega pequeña 0.01 €",
      "Jumby34: pone la ciega grande 0.02 €",
      "Fluxy123: se retira",
      "cbo54: sube 0.02 € a 0.04 €",
      "Fretzo67500: se retira",
      "riverrrrrrmagic: se retira",
      "SrLyce: se retira",
      "Jumby34: se retira",
      "cbo54: no muestra su mano",
      "Asiento 1: riverrrrrrmagic (botón) se retiró antes del Flop (no apostó)",
      "Asiento 2: SrLyce (ciega pequeña) se retiró antes del Flop",
      "Asiento 3: Jumby34 (ciega grande) se retiró antes del Flop",
      "Asiento 4: Fluxy123 se retiró antes del Flop (no apostó)",
      "Asiento 5: cbo54 recaudó (0.05 €)",
      "Asiento 6: Fretzo67500 se retiró antes del Flop (no apostó)"
    ],
    "flop": [],
    "turn": [],
    "river": []
  },
  "board": [],
  "winner": "cbo54",
  "win_amount": 2.5,
  "sb": 0.01,
  "bb": 0.02,
  "rake": 0.0,
  "raw_text": "Mano n.º 257149846845 de PokerStars:  Hold'em No Limit (0.01 €/0.02 € EUR) - 30-07-2025 23:00:52 CET [30-07-2025 17:00:52 ET]\nMesa \"Gilgamesh\" 6-max El asiento n.º 1 es el botón\nAsiento 1: riverrrrrrmagic (2.33 € en fichas) \nAsiento 2: SrLyce (1.96 € en fichas) \nAsiento 3: Jumby34 (2.27 € en fichas) \nAsiento 4: Fluxy123 (2.19 € en fichas) \nAsiento 5: cbo54 (1.63 € en fichas) \nAsiento 6: Fretzo67500 (2.24 € en fichas) \nSrLyce: pone la ciega pequeña 0.01 €\nJumby34: pone la ciega grande 0.02 €\n*** CARTAS DE MANO ***\nRepartidas a SrLyce [Jc 8d]\nFluxy123: se retira \ncbo54: sube 0.02 € a 0.04 €\nFretzo67500: se retira \nriverrrrrrmagic: se retira \nSrLyce: se retira \nJumby34: se retira \nLa apuesta no igualada (0.02 €) ha sido devuelta a cbo54\ncbo54 se lleva 0.05 € del bote \ncbo54: no muestra su mano \n*** RESUMEN ***\nBote total 0.05 € | Comisión 0 € \nAsiento 1: riverrrrrrmagic (botón) se retiró antes del Flop (no apostó)\nAsiento 2: SrLyce (ciega pequeña) se retiró antes del Flop\nAsiento 3: Jumby34 (ciega grande) se retiró antes del Flop\nAsiento 4: Fluxy123 se retiró antes del Flop (no apostó)\nAsiento 5: cbo54 recaudó (0.05 €)\nAsiento 6: Fretzo67500 se retiró antes del Flop (no apostó)"
}