{
  "hand_id": "257237800904",
  "date": "06-08-2025 18:00:25",
  "table": "Euneus III",
  "game_type": "holdem",
  "hero": "SrLyce",
  "hero_position": "",
  "hero_cards": [
    "7s",
    "9h"
  ],
  "stacks": {
    "DeMula62": 100.0,
    "Il_BM00": 106.5,
    "djrojas9": 140.0,
    "SrLyce": 124.5
  },
  "actions": {
    "preflop": [
      "Asiento 1: DeMula62 (2 € en fichas)",
      "Asiento 2: Il_BM00 (2.13 € en fichas)",
      "Asiento 3: djrojas9 (2.80 € en fichas)",
      "Asiento 5: SrLyce (2.49 € en fichas)",
      "DeMula62: pone la ciega pequeña 0.01 €",
      "Il_BM00: pone la ciega grande 0.02 €",
      "djrojas9: se retira",
      "SrLyce: sube 0.03 € a 0.05 €",
      "DeMula62: sube 0.15 € a 0.20 €",
      "Il_BM00: se retira",
      "SrLyce: se retira",
      "DeMula62: no muestra su mano",
      "Asiento 1: DeMula62 (ciega pequeña) recaudó (0.12 €)",
      "Asiento 2: Il_BM00 (ciega grande) se retiró antes del Flop",
      "Asiento 3: djrojas9 se retiró antes del Flop (no apostó)",
      "Asiento 5: SrLyce (botón) se retiró antes del Flop"
    ],
    "flop": [],
    "turn": [],
    "river": []
  },
  "board": [],
  "winner": "DeMula62",
  "win_amount": 6.0,
  "sb": 0.01,
  "bb": 0.02,
  "rake": 0.0,
  "raw_text": "Mano n.º 257237800904 de PokerStars:  Hold'em No Limit (0.01 €/0.02 € EUR) - 06-08-2025 18:00:25 CET [06-08-2025 12:00:25 ET]\nMesa \"Euneus III\" 6-max El asiento n.º 5 es el botón\nAsiento 1: DeMula62 (2 € en fichas) \nAsiento 2: Il_BM00 (2.13 € en fichas) \nAsiento 3: djrojas9 (2.80 € en fichas) \nAsiento 5: SrLyce (2.49 € en fichas) \nDeMula62: pone la ciega pequeña 0.01 €\nIl_BM00: pone la ciega grande 0.02 €\n*** CARTAS DE MANO ***\nRepartidas a SrLyce [7s 9h]\ndjrojas9: se retira \nSrLyce: sube 0.03 € a 0.05 €\nDeMula62: sube 0.15 € a 0.20 €\nIl_BM00: se retira \nSrLyce: se retira \nLa apuesta no igualada (0.15 €) ha sido devuelta a DeMula62\nDeMula62 se lleva 0.12 € del bote \nDeMula62: no muestra su mano \n*** RESUMEN ***\nBote total 0.12 € | Comisión 0 € \nAsiento 1: DeMula62 (ciega pequeña) recaudó (0.12 €)\nAsiento 2: Il_BM00 (ciega grande) se retiró antes del Flop\nAsiento 3: djrojas9 se retiró antes del Flop (no apostó)\nAsiento 5: SrLyce (botón) se retiró antes del Flop"
}