{
  "hand_id": "257215200661",
  "date": "04-08-2025 22:30:37",
  "table": "Anneliese II",
  "game_type": "holdem",
  "hero": "SrLyce",
  "hero_position": "",
  "hero_cards": [
    "Jd",
    "8s"
  ],
  "stacks": {
    "ElManu62": 122.0,
    "betterrrrrr": 104.0,
    "piropanzer": 36.5,
    "SrLyce": 98.5,
    "Mr_Pkr98": 143.0,
    "Spotick": 114.0
  },
  "actions": {
    "preflop": [
      "Asiento 3: ElManu62 (2.44 € en fichas) está ausente",
      "Asiento 1: betterrrrrr (2.08 € en fichas)",
      "Asiento 2: piropanzer (0.73 € en fichas)",
      "Asiento 4: SrLyce (1.97 € en fichas)",
      "Asiento 5: Mr_Pkr98 (2.86 € en fichas)",
      "Asiento 6: Spotick (2.28 € en fichas)",
      "Spotick: pone la ciega pequeña 0.01 €",
      "betterrrrrr: pone la ciega grande 0.02 €",
      "piropanzer: iguala 0.02 €",
      "SrLyce: se retira",
      "Mr_Pkr98: se retira",
      "Spotick: sube 0.04 € a 0.06 €",
      "betterrrrrr: se retira",
      "piropanzer: iguala 0.04 €"
    ],
    "flop": [
      "Spotick: apuesta 0.06 €",
      "piropanzer: se retira",
      "Spotick: no muestra su mano",
      "Asiento 3: ElManu62",
      "Asiento 1: betterrrrrr (ciega grande) se retiró antes del Flop",
      "Asiento 2: piropanzer se retiró en el Flop",
      "Asiento 4: SrLyce se retiró antes del Flop (no apostó)",
      "Asiento 5: Mr_Pkr98 (botón) se retiró antes del Flop (no apostó)",
      "Asiento 6: Spotick (ciega pequeña) recaudó (0.13 €)"
    ],
    "turn": [],
    "river": []
  },
  "board": [
    "Tc",
    "5s",
    "Kh"
  ],
  "winner": "Spotick",
  "win_amount": 6.5,
  "sb": 0.01,
  "bb": 0.02,
  "rake": 0.5,
  "raw_text": "Mano n.º 257215200661 de PokerStars:  Hold'em No Limit (0.01 €/0.02 € EUR) - 04-08-2025 22:30:37 CET [04-08-2025 16:30:37 ET]\nMesa \"Anneliese II\" 6-max El asiento n.º 5 es el botón\nAsiento 3: ElManu62 (2.44 € en fichas) está ausente\nAsiento 1: betterrrrrr (2.08 € en fichas) \nAsiento 2: piropanzer (0.73 € en fichas) \nAsiento 4: SrLyce (1.97 € en fichas) \nAsiento 5: Mr_Pkr98 (2.86 € en fichas) \nAsiento 6: Spotick (2.28 € en fichas) \nSpotick: pone la ciega pequeña 0.01 €\nbetterrrrrr: pone la ciega grande 0.02 €\n*** CARTAS DE MANO ***\nRepartidas a SrLyce [Jd 8s]\npiropanzer: iguala 0.02 €\nSrLyce: se retira \nMr_Pkr98: se retira \nSpotick: sube 0.04 € a 0.06 €\nbetterrrrrr: se retira \npiropanzer: iguala 0.04 €\n*** FLOP *** [Tc 5s Kh]\nSpotick: apuesta 0.06 €\npiropanzer: se retira \nLa apuesta no igualada (0.06 €) ha sido devuelta a Spotick\nSpotick se lleva 0.13 € del bote \nSpotick: no muestra su mano \n*** RESUMEN ***\nBote total 0.14 € | Comisión 0.01 € \nComunitarias [Tc 5s Kh]\nAsiento 3: ElManu62\nAsiento 1: betterrrrrr (ciega grande) se retiró antes del Flop\nAsiento 2: piropanzer se retiró en el Flop\nAsiento 4: SrLyce se retiró antes del Flop (no apostó)\nAsiento 5: Mr_Pkr98 (botón) se retiró antes del Flop (no apostó)\nAsiento 6: Spotick (ciega pequeña) recaudó (0.13 €)"
}