{
  "hand_id": "257150155781",
  "date": "30-07-2025 23:22:09",
  "table": "Lobelia",
  "game_type": "holdem",
  "hero": "SrLyce",
  "hero_position": "",
  "hero_cards": [
    "Kd",
    "9d"
  ],
  "stacks": {
    "LeVbks": 116.5,
    "fcis666": 49.0,
    "Dlaguancha": 112.5,
    "SrLyce": 105.5,
    "riverluck444": 96.0,
    "javipondio": 14.5
  },
  "actions": {
    "preflop": [
      "Asiento 1: LeVbks (2.33 € en fichas)",
      "Asiento 2: fcis666 (0.98 € en fichas)",
      "Asiento 3: Dlaguancha (2.25 € en fichas)",
      "Asiento 4: SrLyce (2.11 € en fichas)",
      "Asiento 5: riverluck444 (1.92 € en fichas)",
      "Asiento 6: javipondio (0.29 € en fichas)",
      "fcis666: pone la ciega pequeña 0.01 €",
      "Dlaguancha: pone la ciega grande 0.02 €",
      "SrLyce: se retira",
      "riverluck444: se retira",
      "javipondio: iguala 0.02 €",
      "LeVbks: se retira",
      "fcis666: se retira",
      "Dlaguancha: pasa"
    ],
    "flop": [
      "Dlaguancha: pasa",
      "javipondio: apuesta 0.05 €",
      "Dlaguancha: se retira",
      "Asiento 1: LeVbks (botón) se retiró antes del Flop (no apostó)",
      "Asiento 2: fcis666 (ciega pequeña) se retiró antes del Flop",
      "Asiento 3: Dlaguancha (ciega grande) se retiró en el Flop",
      "Asiento 4: SrLyce se retiró antes del Flop (no apostó)",
      "Asiento 5: riverluck444 se retiró antes del Flop (no apostó)",
      "Asiento 6: javipondio recaudó (0.05 €)"
    ],
    "turn": [],
    "river": []
  },
  "board": [
    "6d",
    "8h",
    "Qd"
  ],
  "winner": "javipondio",
  "win_amount": 2.5,
  "sb": 0.01,
  "bb": 0.02,
  "rake": 0.0,
  "raw_text": "Mano n.º 257150155781 de PokerStars:  Hold'em No Limit (0.01 €/0.02 € EUR) - 30-07-2025 23:22:09 CET [30-07-2025 17:22:09 ET]\nMesa \"Lobelia\" 6-max El asiento n.º 1 es el botón\nAsiento 1: LeVbks (2.33 € en fichas) \nAsiento 2: fcis666 (0.98 € en fichas) \nAsiento 3: Dlaguancha (2.25 € en fichas) \nAsiento 4: SrLyce (2.11 € en fichas) \nAsiento 5: riverluck444 (1.92 € en fichas) \nAsiento 6: javipondio (0.29 € en fichas) \nfcis666: pone la ciega pequeña 0.01 €\nDlaguancha: pone la ciega grande 0.02 €\n*** CARTAS DE MANO ***\nRepartidas a SrLyce [Kd 9d]\nSrLyce: se retira \nriverluck444: se retira \njavipondio: iguala 0.02 €\nLeVbks: se retira \nfcis666: se retira \nDlaguancha: pasa \n*** FLOP *** [6d 8h Qd]\nDlaguancha: pasa \njavipondio: apuesta 0.05 €\nDlaguancha: se retira \nLa apuesta no igualada (0.05 €) ha sido devuelta a javipondio\njavipondio se lleva 0.05 € del bote \n*** RESUMEN ***\nBote total 0.05 € | Comisión 0 € \nComunitarias [6d 8h Qd]\nAsiento 1: LeVbks (botón) se retiró antes del Flop (no apostó)\nAsiento 2: fcis666 (ciega pequeña) se retiró antes del Flop\nAsiento 3: Dlaguancha (ciega grande) se retiró en el Flop\nAsiento 4: SrLyce se retiró antes del Flop (no apostó)\nAsiento 5: riverluck444 se retiró antes del Flop (no apostó)\nAsiento 6: javipondio recaudó (0.05 €)"
}