{
  "hand_id": "257238032749",
  "date": "06-08-2025 18:22:03",
  "table": "Atreus",
  "game_type": "holdem",
  "hero": "SrLyce",
  "hero_position": "",
  "hero_cards": [
    "4d",
    "Qh"
  ],
  "stacks": {
    "PrendsCa": 107.0,
    "NRules82": 66.5,
    "JENOFONTE73": 143.0,
    "Fharock": 87.5,
    "SrLyce": 127.0,
    "FishamanReggae": 24.5
  },
  "actions": {
    "preflop": [
      "Asiento 1: PrendsCa (2.14 € en fichas)",
      "Asiento 2: NRules82 (1.33 € en fichas)",
      "Asiento 3: JENOFONTE73 (2.86 € en fichas)",
      "Asiento 4: Fharock (1.75 € en fichas)",
      "Asiento 5: SrLyce (2.54 € en fichas)",
      "Asiento 6: FishamanReggae (0.49 € en fichas)",
      "PrendsCa: pone la ciega pequeña 0.01 €",
      "NRules82: pone la ciega grande 0.02 €",
      "JENOFONTE73: se retira",
      "Fharock: se retira",
      "SrLyce: se retira",
      "FishamanReggae: iguala 0.02 €",
      "PrendsCa: sube 0.02 € a 0.04 €",
      "NRules82: sube 0.08 € a 0.12 €",
      "FishamanReggae: iguala 0.10 €",
      "PrendsCa: se retira"
    ],
    "flop": [
      "NRules82: apuesta 0.10 €",
      "FishamanReggae: sube 0.12 € a 0.22 €",
      "NRules82: se retira",
      "Asiento 1: PrendsCa (ciega pequeña) se retiró antes del Flop",
      "Asiento 2: NRules82 (ciega grande) se retiró en el Flop",
      "Asiento 3: JENOFONTE73 se retiró antes del Flop (no apostó)",
      "Asiento 4: Fharock se retiró antes del Flop (no apostó)",
      "Asiento 5: SrLyce se retiró antes del Flop (no apostó)",
      "Asiento 6: FishamanReggae (botón) recaudó (0.45 €)"
    ],
    "turn": [],
    "river": []
  },
  "board": [
    "8c",
    "2h",
    "4s"
  ],
  "winner": "FishamanReggae",
  "win_amount": 22.5,
  "sb": 0.01,
  "bb": 0.02,
  "rake": 1.5,
  "raw_text": "Mano n.º 257238032749 de PokerStars:  Hold'em No Limit (0.01 €/0.02 € EUR) - 06-08-2025 18:22:03 CET [06-08-2025 12:22:03 ET]\nMesa \"Atreus\" 6-max El asiento n.º 6 es el botón\nAsiento 1: PrendsCa (2.14 € en fichas) \nAsiento 2: NRules82 (1.33 € en fichas) \nAsiento 3: JENOFONTE73 (2.86 € en fichas) \nAsiento 4: Fharock (1.75 € en fichas) \nAsiento 5: SrLyce (2.54 € en fichas) \nAsiento 6: FishamanReggae (0.49 € en fichas) \nPrendsCa: pone la ciega pequeña 0.01 €\nNRules82: pone la ciega grande 0.02 €\n*** CARTAS DE MANO ***\nRepartidas a SrLyce [4d Qh]\nJENOFONTE73: se retira \nFharock: se retira \nSrLyce: se retira \nFishamanReggae: iguala 0.02 €\nPrendsCa: sube 0.02 € a 0.04 €\nNRules82: sube 0.08 € a 0.12 €\nFishamanReggae: iguala 0.10 €\nPrendsCa: se retira \n*** FLOP *** [8c 2h 4s]\nNRules82: apuesta 0.10 €\nFishamanReggae: sube 0.12 € a 0.22 €\nNRules82: se retira \nLa apuesta no igualada (0.12 €) ha sido devuelta a FishamanReggae\nFishamanReggae se lleva 0.45 € del bote \n*** RESUMEN ***\nBote total 0.48 € | Comisión 0.03 € \nComunitarias [8c 2h 4s]\nAsiento 1: PrendsCa (ciega pequeña) se retiró antes del Flop\nAsiento 2: NRules82 (ciega grande) se retiró en el Flop\nAsiento 3: JENOFONTE73 se retiró antes del Flop (no apostó)\nAsiento 4: Fharock se retiró antes del Flop (no apostó)\nAsiento 5: SrLyce se retiró antes del Flop (no apostó)\nAsiento 6: FishamanReggae (botón) recaudó (0.45 €)"
}