{
  "hand_id": "257237931029",
  "date": "06-08-2025 18:12:56",
  "table": "Euneus III",
  "game_type": "holdem",
  "hero": "SrLyce",
  "hero_position": "",
  "hero_cards": [
    "Kh",
    "3d"
  ],
  "stacks": {
    "djrojas9": 153.0,
    "lol-in 2000": 100.0,
    "christgear": 102.5,
    "Il_BM00": 129.5,
    "SrLyce": 106.5,
    "kcg_rm": 98.5
  },
  "actions": {
    "preflop": [
      "Asiento 3: djrojas9 (3.06 € en fichas) está ausente",
      "Asiento 4: lol-in 2000 (2 € en fichas) está ausente",
      "Asiento 1: christgear (2.05 € en fichas)",
      "Asiento 2: Il_BM00 (2.59 € en fichas)",
      "Asiento 5: SrLyce (2.13 € en fichas)",
      "Asiento 6: kcg_rm (1.97 € en fichas)",
      "christgear: pone la ciega pequeña 0.01 €",
      "Il_BM00: pone la ciega grande 0.02 €",
      "djrojas9: se ausenta",
      "lol-in 2000: se ausenta",
      "SrLyce: se retira",
      "kcg_rm: sube 0.04 € a 0.06 €",
      "christgear: sube 0.16 € a 0.22 €",
      "Il_BM00: se retira",
      "kcg_rm: sube 0.26 € a 0.48 €",
      "christgear: se retira",
      "kcg_rm: no muestra su mano",
      "Asiento 3: djrojas9",
      "Asiento 4: lol-in 2000",
      "Asiento 1: christgear (ciega pequeña) se retiró antes del Flop",
      "Asiento 2: Il_BM00 (ciega grande) se retiró antes del Flop",
      "Asiento 5: SrLyce se retiró antes del Flop (no apostó)",
      "Asiento 6: kcg_rm (botón) recaudó (0.46 €)"
    ],
    "flop": [],
    "turn": [],
    "river": []
  },
  "board": [],
  "winner": "kcg_rm",
  "win_amount": 23.0,
  "sb": 0.01,
  "bb": 0.02,
  "rake": 0.0,
  "raw_text": "Mano n.º 257237931029 de PokerStars:  Hold'em No Limit (0.01 €/0.02 € EUR) - 06-08-2025 18:12:56 CET [06-08-2025 12:12:56 ET]\nMesa \"Euneus III\" 6-max El asiento n.º 6 es el botón\nAsiento 3: djrojas9 (3.06 € en fichas) está ausente\nAsiento 4: lol-in 2000 (2 € en fichas) está ausente\nAsiento 1: christgear (2.05 € en fichas) \nAsiento 2: Il_BM00 (2.59 € en fichas) \nAsiento 5: SrLyce (2.13 € en fichas) \nAsiento 6: kcg_rm (1.97 € en fichas) \nchristgear: pone la ciega pequeña 0.01 €\nIl_BM00: pone la ciega grande 0.02 €\ndjrojas9: se ausenta \nlol-in 2000: se ausenta \n*** CARTAS DE MANO ***\nRepartidas a SrLyce [Kh 3d]\nSrLyce: se retira \nkcg_rm: sube 0.04 € a 0.06 €\nchristgear: sube 0.16 € a 0.22 €\nIl_BM00: se retira \nkcg_rm: sube 0.26 € a 0.48 €\nchristgear: se retira \nLa apuesta no igualada (0.26 €) ha sido devuelta a kcg_rm\nkcg_rm se lleva 0.46 € del bote \nkcg_rm: no muestra su mano \n*** RESUMEN ***\nBote total 0.46 € | Comisión 0 € \nAsiento 3: djrojas9\nAsiento 4: lol-in 2000\nAsiento 1: christgear (ciega pequeña) se retiró antes del Flop\nAsiento 2: Il_BM00 (ciega grande) se retiró antes del Flop\nAsiento 5: SrLyce se retiró antes del Flop (no apostó)\nAsiento 6: kcg_rm (botón) recaudó (0.46 €)"
}