{
  "hand_id": "257238640374",
  "date": "06-08-2025 19:16:46",
  "table": "Leonteus",
  "game_type": "holdem",
  "hero": "SrLyce",
  "hero_position": "",
  "hero_cards": [
    "6c",
    "2s"
  ],
  "stacks": {
    "practikal_C23": 47.5,
    "BuXHexter": 145.5,
    "niyomalo": 98.0,
    "davinci1962": 144.0,
    "Andark47": 214.0,
    "SrLyce": 103.0
  },
  "actions": {
    "preflop": [
      "Asiento 1: practikal_C23 (0.95 € en fichas) está ausente",
      "Asiento 4: BuXHexter (2.91 € en fichas) está ausente",
      "Asiento 2: niyomalo (1.96 € en fichas)",
      "Asiento 3: davinci1962 (2.88 € en fichas)",
      "Asiento 5: Andark47 (4.28 € en fichas)",
      "Asiento 6: SrLyce (2.06 € en fichas)",
      "niyomalo: pone la ciega pequeña 0.01 €",
      "davinci1962: pone la ciega grande 0.02 €",
      "BuXHexter: se ausenta",
      "Andark47: se retira",
      "SrLyce: se retira",
      "niyomalo: se retira",
      "davinci1962: no muestra su mano",
      "Asiento 1: practikal_C23",
      "Asiento 4: BuXHexter",
      "Asiento 2: niyomalo (ciega pequeña) se retiró antes del Flop",
      "Asiento 3: davinci1962 (ciega grande) recaudó (0.02 €)",
      "Asiento 5: Andark47 se retiró antes del Flop (no apostó)",
      "Asiento 6: SrLyce (botón) se retiró antes del Flop (no apostó)"
    ],
    "flop": [],
    "turn": [],
    "river": []
  },
  "board": [],
  "winner": "davinci1962",
  "win_amount": 1.0,
  "sb": 0.01,
  "bb": 0.02,
  "rake": 0.0,
  "raw_text": "Mano n.º 257238640374 de PokerStars:  Hold'em No Limit (0.01 €/0.02 € EUR) - 06-08-2025 19:16:46 CET [06-08-2025 13:16:46 ET]\nMesa \"Leonteus\" 6-max El asiento n.º 6 es el botón\nAsiento 1: practikal_C23 (0.95 € en fichas) está ausente\nAsiento 4: BuXHexter (2.91 € en fichas) está ausente\nAsiento 2: niyomalo (1.96 € en fichas) \nAsiento 3: davinci1962 (2.88 € en fichas) \nAsiento 5: Andark47 (4.28 € en fichas) \nAsiento 6: SrLyce (2.06 € en fichas) \nniyomalo: pone la ciega pequeña 0.01 €\ndavinci1962: pone la ciega grande 0.02 €\nBuXHexter: se ausenta \n*** CARTAS DE MANO ***\nRepartidas a SrLyce [6c 2s]\nAndark47: se retira \nSrLyce: se retira \nniyomalo: se retira \nLa apuesta no igualada (0.01 €) ha sido devuelta a davinci1962\ndavinci1962 se lleva 0.02 € del bote \ndavinci1962: no muestra su mano \n*** RESUMEN ***\nBote total 0.02 € | Comisión 0 € \nAsiento 1: practikal_C23\nAsiento 4: BuXHexter\nAsiento 2: niyomalo (ciega pequeña) se retiró antes del Flop\nAsiento 3: davinci1962 (ciega grande) recaudó (0.02 €)\nAsiento 5: Andark47 se retiró antes del Flop (no apostó)\nAsiento 6: SrLyce (botón) se retiró antes del Flop (no apostó)"
}