{
  "hand_id": "257215253426",
  "date": "04-08-2025 22:33:53",
  "table": "Aldhafera II",
  "game_type": "holdem",
  "hero": "SrLyce",
  "hero_position": "",
  "hero_cards": [
    "4s",
    "Jc"
  ],
  "stacks": {
    "wsx25": 67.5,
    "BudyXXIII": 292.5,
    "SrLyce": 98.5,
    "rhidoxxx": 88.0,
    "jte-ken": 110.0,
    "betterrrrrr": 170.0
  },
  "actions": {
    "preflop": [
      "Asiento 1: wsx25 (1.35 € en fichas)",
      "Asiento 2: BudyXXIII (5.85 € en fichas)",
      "Asiento 3: SrLyce (1.97 € en fichas)",
      "Asiento 4: rhidoxxx (1.76 € en fichas)",
      "Asiento 5: jte-ken (2.20 € en fichas)",
      "Asiento 6: betterrrrrr (3.40 € en fichas)",
      "rhidoxxx: pone la ciega pequeña 0.01 €",
      "jte-ken: pone la ciega grande 0.02 €",
      "betterrrrrr: se retira",
      "wsx25: sube 0.02 € a 0.04 €",
      "BudyXXIII: se retira",
      "SrLyce: se retira",
      "rhidoxxx: sube 0.08 € a 0.12 €",
      "jte-ken: iguala 0.10 €",
      "wsx25: se retira"
    ],
    "flop": [
      "rhidoxxx: apuesta 0.13 €",
      "jte-ken: iguala 0.13 €"
    ],
    "turn": [
      "rhidoxxx: pasa",
      "jte-ken: apuesta 0.39 €",
      "rhidoxxx: se retira",
      "Asiento 1: wsx25 se retiró antes del Flop",
      "Asiento 2: BudyXXIII se retiró antes del Flop (no apostó)",
      "Asiento 3: SrLyce (botón) se retiró antes del Flop (no apostó)",
      "Asiento 4: rhidoxxx (ciega pequeña) se retiró en el Turn",
      "Asiento 5: jte-ken (ciega grande) recaudó (0.51 €)",
      "Asiento 6: betterrrrrr se retiró antes del Flop (no apostó)"
    ],
    "river": []
  },
  "board": [
    "7h",
    "Kc",
    "4h",
    "Ks"
  ],
  "winner": "jte-ken",
  "win_amount": 25.5,
  "sb": 0.01,
  "bb": 0.02,
  "rake": 1.5,
  "raw_text": "Mano n.º 257215253426 de PokerStars:  Hold'em No Limit (0.01 €/0.02 € EUR) - 04-08-2025 22:33:53 CET [04-08-2025 16:33:53 ET]\nMesa \"Aldhafera II\" 6-max El asiento n.º 3 es el botón\nAsiento 1: wsx25 (1.35 € en fichas) \nAsiento 2: BudyXXIII (5.85 € en fichas) \nAsiento 3: SrLyce (1.97 € en fichas) \nAsiento 4: rhidoxxx (1.76 € en fichas) \nAsiento 5: jte-ken (2.20 € en fichas) \nAsiento 6: betterrrrrr (3.40 € en fichas) \nrhidoxxx: pone la ciega pequeña 0.01 €\njte-ken: pone la ciega grande 0.02 €\n*** CARTAS DE MANO ***\nRepartidas a SrLyce [4s Jc]\nbetterrrrrr: se retira \nwsx25: sube 0.02 € a 0.04 €\nBudyXXIII: se retira \nSrLyce: se retira \nrhidoxxx: sube 0.08 € a 0.12 €\njte-ken: iguala 0.10 €\nwsx25: se retira \n*** FLOP *** [7h Kc 4h]\nrhidoxxx: apuesta 0.13 €\njte-ken: iguala 0.13 €\n*** TURN *** [7h Kc 4h] [Ks]\nrhidoxxx: pasa \njte-ken: apuesta 0.39 €\nrhidoxxx: se retira \nLa apuesta no igualada (0.39 €) ha sido devuelta a jte-ken\njte-ken se lleva 0.51 € del bote \n*** RESUMEN ***\nBote total 0.54 € | Comisión 0.03 € \nComunitarias [7h Kc 4h Ks]\nAsiento 1: wsx25 se retiró antes del Flop\nAsiento 2: BudyXXIII se retiró antes del Flop (no apostó)\nAsiento 3: SrLyce (botón) se retiró antes del Flop (no apostó)\nAsiento 4: rhidoxxx (ciega pequeña) se retiró en el Turn\nAsiento 5: jte-ken (ciega grande) recaudó (0.51 €)\nAsiento 6: betterrrrrr se retiró antes del Flop (no apostó)"
}