{
  "hand_id": "257238321454",
  "date": "06-08-2025 18:47:40",
  "table": "Alruccabah II",
  "game_type": "holdem",
  "hero": "SrLyce",
  "hero_position": "",
  "hero_cards": [
    "4d",
    "4h"
  ],
  "stacks": {
    "rayao32": 52.0,
    "SrLyce": 95.5,
    "Davdgoni": 282.0,
    "tatinette35": 100.0,
    "Nicanor Cast": 57.0
  },
  "actions": {
    "preflop": [
      "Asiento 6: rayao32 (1.04 € en fichas) está ausente",
      "Asiento 1: SrLyce (1.91 € en fichas)",
      "Asiento 2: Davdgoni (5.64 € en fichas)",
      "Asiento 3: tatinette35 (2 € en fichas)",
      "Asiento 4: serviettski(fr) (2 € en fichas)",
      "Asiento 5: Nicanor Cast (1.14 € en fichas)",
      "serviettski(fr): pone la ciega pequeña 0.01 €",
      "Nicanor Cast: pone la ciega grande 0.02 €",
      "SrLyce: sube 0.03 € a 0.05 €",
      "Davdgoni: se retira",
      "tatinette35: se retira",
      "serviettski(fr): se retira",
      "Nicanor Cast: se retira",
      "SrLyce: no muestra su mano",
      "Asiento 6: rayao32",
      "Asiento 1: SrLyce recaudó (0.05 €)",
      "Asiento 2: Davdgoni se retiró antes del Flop (no apostó)",
      "Asiento 3: tatinette35 (botón) se retiró antes del Flop (no apostó)",
      "Asiento 4: serviettski(fr) (ciega pequeña) se retiró antes del Flop",
      "Asiento 5: Nicanor Cast (ciega grande) se retiró antes del Flop"
    ],
    "flop": [],
    "turn": [],
    "river": []
  },
  "board": [],
  "winner": "SrLyce",
  "win_amount": 2.5,
  "sb": 0.01,
  "bb": 0.02,
  "rake": 0.0,
  "raw_text": "Mano n.º 257238321454 de PokerStars:  Hold'em No Limit (0.01 €/0.02 € EUR) - 06-08-2025 18:47:40 CET [06-08-2025 12:47:40 ET]\nMesa \"Alruccabah II\" 6-max El asiento n.º 3 es el botón\nAsiento 6: rayao32 (1.04 € en fichas) está ausente\nAsiento 1: SrLyce (1.91 € en fichas) \nAsiento 2: Davdgoni (5.64 € en fichas) \nAsiento 3: tatinette35 (2 € en fichas) \nAsiento 4: serviettski(fr) (2 € en fichas) \nAsiento 5: Nicanor Cast (1.14 € en fichas) \nserviettski(fr): pone la ciega pequeña 0.01 €\nNicanor Cast: pone la ciega grande 0.02 €\n*** CARTAS DE MANO ***\nRepartidas a SrLyce [4d 4h]\nSrLyce: sube 0.03 € a 0.05 €\nDavdgoni: se retira \ntatinette35: se retira \nserviettski(fr): se retira \nNicanor Cast: se retira \nLa apuesta no igualada (0.03 €) ha sido devuelta a SrLyce\nSrLyce se lleva 0.05 € del bote \nSrLyce: no muestra su mano \n*** RESUMEN ***\nBote total 0.05 € | Comisión 0 € \nAsiento 6: rayao32\nAsiento 1: SrLyce recaudó (0.05 €)\nAsiento 2: Davdgoni se retiró antes del Flop (no apostó)\nAsiento 3: tatinette35 (botón) se retiró antes del Flop (no apostó)\nAsiento 4: serviettski(fr) (ciega pequeña) se retiró antes del Flop\nAsiento 5: Nicanor Cast (ciega grande) se retiró antes del Flop"
}