{
  "hand_id": "257237751720",
  "date": "06-08-2025 17:54:29",
  "table": "Virtus",
  "game_type": "holdem",
  "hero": "SrLyce",
  "hero_position": "",
  "hero_cards": [
    "6d",
    "Tc"
  ],
  "stacks": {
    "pullup0": 40.0,
    "Kingzilla87": 170.5,
    "SrLyce": 107.5,
    "JGDOBLAS": 99.5,
    "don.corle": 142.0,
    "rudik34385": 78.0
  },
  "actions": {
    "preflop": [
      "Asiento 3: pullup0 (0.80 € en fichas) está ausente",
      "Asiento 1: Kingzilla87 (3.41 € en fichas)",
      "Asiento 2: SrLyce (2.15 € en fichas)",
      "Asiento 4: JGDOBLAS (1.99 € en fichas)",
      "Asiento 5: don.corle (2.84 € en fichas)",
      "Asiento 6: rudik34385 (1.56 € en fichas)",
      "don.corle: pone la ciega pequeña 0.01 €",
      "rudik34385: pone la ciega grande 0.02 €",
      "pullup0: se ausenta",
      "Kingzilla87: se retira",
      "SrLyce: se retira",
      "JGDOBLAS: se retira",
      "don.corle: se retira",
      "Asiento 3: pullup0",
      "Asiento 1: Kingzilla87 se retiró antes del Flop (no apostó)",
      "Asiento 2: SrLyce se retiró antes del Flop (no apostó)",
      "Asiento 4: JGDOBLAS (botón) se retiró antes del Flop (no apostó)",
      "Asiento 5: don.corle (ciega pequeña) se retiró antes del Flop",
      "Asiento 6: rudik34385 (ciega grande) recaudó (0.02 €)"
    ],
    "flop": [],
    "turn": [],
    "river": []
  },
  "board": [],
  "winner": "rudik34385",
  "win_amount": 1.0,
  "sb": 0.01,
  "bb": 0.02,
  "rake": 0.0,
  "raw_text": "Mano n.º 257237751720 de PokerStars:  Hold'em No Limit (0.01 €/0.02 € EUR) - 06-08-2025 17:54:29 CET [06-08-2025 11:54:29 ET]\nMesa \"Virtus\" 6-max El asiento n.º 4 es el botón\nAsiento 3: pullup0 (0.80 € en fichas) está ausente\nAsiento 1: Kingzilla87 (3.41 € en fichas) \nAsiento 2: SrLyce (2.15 € en fichas) \nAsiento 4: JGDOBLAS (1.99 € en fichas) \nAsiento 5: don.corle (2.84 € en fichas) \nAsiento 6: rudik34385 (1.56 € en fichas) \ndon.corle: pone la ciega pequeña 0.01 €\nrudik34385: pone la ciega grande 0.02 €\npullup0: se ausenta \n*** CARTAS DE MANO ***\nRepartidas a SrLyce [6d Tc]\nKingzilla87: se retira \nSrLyce: se retira \nJGDOBLAS: se retira \ndon.corle: se retira \nLa apuesta no igualada (0.01 €) ha sido devuelta a rudik34385\nrudik34385 se lleva 0.02 € del bote \n*** RESUMEN ***\nBote total 0.02 € | Comisión 0 € \nAsiento 3: pullup0\nAsiento 1: Kingzilla87 se retiró antes del Flop (no apostó)\nAsiento 2: SrLyce se retiró antes del Flop (no apostó)\nAsiento 4: JGDOBLAS (botón) se retiró antes del Flop (no apostó)\nAsiento 5: don.corle (ciega pequeña) se retiró antes del Flop\nAsiento 6: rudik34385 (ciega grande) recaudó (0.02 €)"
}