{
  "hand_id": "257237889936",
  "date": "06-08-2025 18:09:08",
  "table": "Nuwa III",
  "game_type": "holdem",
  "hero": "SrLyce",
  "hero_position": "",
  "hero_cards": [
    "Qh",
    "2c"
  ],
  "stacks": {
    "BuXHexter": 100.0,
    "kcg_rm": 104.5,
    "SrLyce": 101.5,
    "acavada": 106.5
  },
  "actions": {
    "preflop": [
      "Asiento 2: BuXHexter (2 € en fichas)",
      "Asiento 3: kcg_rm (2.09 € en fichas)",
      "Asiento 4: SrLyce (2.03 € en fichas)",
      "Asiento 6: acavada (2.13 € en fichas)",
      "acavada: pone la ciega pequeña 0.01 €",
      "BuXHexter: pone la ciega grande 0.02 €",
      "kcg_rm: sube 0.02 € a 0.04 €",
      "SrLyce: se retira",
      "acavada: se retira",
      "BuXHexter: se retira",
      "kcg_rm: no muestra su mano",
      "Asiento 2: BuXHexter (ciega grande) se retiró antes del Flop",
      "Asiento 3: kcg_rm recaudó (0.05 €)",
      "Asiento 4: SrLyce (botón) se retiró antes del Flop (no apostó)",
      "Asiento 6: acavada (ciega pequeña) se retiró antes del Flop"
    ],
    "flop": [],
    "turn": [],
    "river": []
  },
  "board": [],
  "winner": "kcg_rm",
  "win_amount": 2.5,
  "sb": 0.01,
  "bb": 0.02,
  "rake": 0.0,
  "raw_text": "Mano n.º 257237889936 de PokerStars:  Hold'em No Limit (0.01 €/0.02 € EUR) - 06-08-2025 18:09:08 CET [06-08-2025 12:09:08 ET]\nMesa \"Nuwa III\" 6-max El asiento n.º 4 es el botón\nAsiento 2: BuXHexter (2 € en fichas) \nAsiento 3: kcg_rm (2.09 € en fichas) \nAsiento 4: SrLyce (2.03 € en fichas) \nAsiento 6: acavada (2.13 € en fichas) \nacavada: pone la ciega pequeña 0.01 €\nBuXHexter: pone la ciega grande 0.02 €\n*** CARTAS DE MANO ***\nRepartidas a SrLyce [Qh 2c]\nkcg_rm: sube 0.02 € a 0.04 €\nSrLyce: se retira \nacavada: se retira \nBuXHexter: se retira \nLa apuesta no igualada (0.02 €) ha sido devuelta a kcg_rm\nkcg_rm se lleva 0.05 € del bote \nkcg_rm: no muestra su mano \n*** RESUMEN ***\nBote total 0.05 € | Comisión 0 € \nAsiento 2: BuXHexter (ciega grande) se retiró antes del Flop\nAsiento 3: kcg_rm recaudó (0.05 €)\nAsiento 4: SrLyce (botón) se retiró antes del Flop (no apostó)\nAsiento 6: acavada (ciega pequeña) se retiró antes del Flop"
}