{
  "hand_id": "257238708027",
  "date": "06-08-2025 19:22:26",
  "table": "Herculina II",
  "game_type": "holdem",
  "hero": "SrLyce",
  "hero_position": "",
  "hero_cards": [
    "3d",
    "9h"
  ],
  "stacks": {
    "Alceo27": 122.0,
    "David98X": 150.5,
    "JJer11": 192.0,
    "SrLyce": 137.0,
    "Macklemore0": 100.0,
    "ScarvBlack": 100.0
  },
  "actions": {
    "preflop": [
      "Asiento 1: Alceo27 (2.44 € en fichas)",
      "Asiento 2: David98X (3.01 € en fichas)",
      "Asiento 3: JJer11 (3.84 € en fichas)",
      "Asiento 4: SrLyce (2.74 € en fichas)",
      "Asiento 5: Macklemore0 (2 € en fichas)",
      "Asiento 6: ScarvBlack (2 € en fichas)",
      "ScarvBlack: pone la ciega pequeña 0.01 €",
      "Alceo27: pone la ciega grande 0.02 €",
      "David98X: sube 0.04 € a 0.06 €",
      "JJer11: se retira",
      "SrLyce: se retira",
      "Macklemore0: se retira",
      "ScarvBlack: iguala 0.05 €",
      "Alceo27: se retira"
    ],
    "flop": [
      "ScarvBlack: pasa",
      "David98X: apuesta 0.04 €",
      "ScarvBlack: se retira",
      "David98X: no muestra su mano",
      "Asiento 1: Alceo27 (ciega grande) se retiró antes del Flop",
      "Asiento 2: David98X recaudó (0.13 €)",
      "Asiento 3: JJer11 se retiró antes del Flop (no apostó)",
      "Asiento 4: SrLyce se retiró antes del Flop (no apostó)",
      "Asiento 5: Macklemore0 (botón) se retiró antes del Flop (no apostó)",
      "Asiento 6: ScarvBlack (ciega pequeña) se retiró en el Flop"
    ],
    "turn": [],
    "river": []
  },
  "board": [
    "7h",
    "Jd",
    "2h"
  ],
  "winner": "David98X",
  "win_amount": 6.5,
  "sb": 0.01,
  "bb": 0.02,
  "rake": 0.5,
  "raw_text": "Mano n.º 257238708027 de PokerStars:  Hold'em No Limit (0.01 €/0.02 € EUR) - 06-08-2025 19:22:26 CET [06-08-2025 13:22:26 ET]\nMesa \"Herculina II\" 6-max El asiento n.º 5 es el botón\nAsiento 1: Alceo27 (2.44 € en fichas) \nAsiento 2: David98X (3.01 € en fichas) \nAsiento 3: JJer11 (3.84 € en fichas) \nAsiento 4: SrLyce (2.74 € en fichas) \nAsiento 5: Macklemore0 (2 € en fichas) \nAsiento 6: ScarvBlack (2 € en fichas) \nScarvBlack: pone la ciega pequeña 0.01 €\nAlceo27: pone la ciega grande 0.02 €\n*** CARTAS DE MANO ***\nRepartidas a SrLyce [3d 9h]\nDavid98X: sube 0.04 € a 0.06 €\nJJer11: se retira \nSrLyce: se retira \nMacklemore0: se retira \nScarvBlack: iguala 0.05 €\nAlceo27: se retira \n*** FLOP *** [7h Jd 2h]\nScarvBlack: pasa \nDavid98X: apuesta 0.04 €\nScarvBlack: se retira \nLa apuesta no igualada (0.04 €) ha sido devuelta a David98X\nDavid98X se lleva 0.13 € del bote \nDavid98X: no muestra su mano \n*** RESUMEN ***\nBote total 0.14 € | Comisión 0.01 € \nComunitarias [7h Jd 2h]\nAsiento 1: Alceo27 (ciega grande) se retiró antes del Flop\nAsiento 2: David98X recaudó (0.13 €)\nAsiento 3: JJer11 se retiró antes del Flop (no apostó)\nAsiento 4: SrLyce se retiró antes del Flop (no apostó)\nAsiento 5: Macklemore0 (botón) se retiró antes del Flop (no apostó)\nAsiento 6: ScarvBlack (ciega pequeña) se retiró en el Flop"
}