{
  "hand_id": "257149107124",
  "date": "30-07-2025 22:08:30",
  "table": "Sirona",
  "game_type": "holdem",
  "hero": "SrLyce",
  "hero_position": "",
  "hero_cards": [
    "7h",
    "3d"
  ],
  "stacks": {
    "oliverdu70": 186.0,
    "SrLyce": 140.5,
    "lecontrebandier": 79.0,
    "christoph363": 213.0,
    "MitchATP65": 100.0
  },
  "actions": {
    "preflop": [
      "Asiento 4: oliverdu70 (3.72 € en fichas) está ausente",
      "Asiento 1: SrLyce (2.81 € en fichas)",
      "Asiento 2: lecontrebandier (1.58 € en fichas)",
      "Asiento 3: christoph363 (4.26 € en fichas)",
      "Asiento 6: MitchATP65 (2 € en fichas)",
      "MitchATP65: pone la ciega pequeña 0.01 €",
      "SrLyce: pone la ciega grande 0.02 €",
      "lecontrebandier: sube 0.02 € a 0.04 €",
      "christoph363: se retira",
      "MitchATP65: se retira",
      "SrLyce: se retira",
      "lecontrebandier: no muestra su mano",
      "Asiento 4: oliverdu70",
      "Asiento 1: SrLyce (ciega grande) se retiró antes del Flop",
      "Asiento 2: lecontrebandier recaudó (0.05 €)",
      "Asiento 3: christoph363 (botón) se retiró antes del Flop (no apostó)",
      "Asiento 6: MitchATP65 (ciega pequeña) se retiró antes del Flop"
    ],
    "flop": [],
    "turn": [],
    "river": []
  },
  "board": [],
  "winner": "lecontrebandier",
  "win_amount": 2.5,
  "sb": 0.01,
  "bb": 0.02,
  "rake": 0.0,
  "raw_text": "Mano n.º 257149107124 de PokerStars:  Hold'em No Limit (0.01 €/0.02 € EUR) - 30-07-2025 22:08:30 CET [30-07-2025 16:08:30 ET]\nMesa \"Sirona\" 6-max El asiento n.º 3 es el botón\nAsiento 4: oliverdu70 (3.72 € en fichas) está ausente\nAsiento 1: SrLyce (2.81 € en fichas) \nAsiento 2: lecontrebandier (1.58 € en fichas) \nAsiento 3: christoph363 (4.26 € en fichas) \nAsiento 6: MitchATP65 (2 € en fichas) \nMitchATP65: pone la ciega pequeña 0.01 €\nSrLyce: pone la ciega grande 0.02 €\n*** CARTAS DE MANO ***\nRepartidas a SrLyce [7h 3d]\nlecontrebandier: sube 0.02 € a 0.04 €\nchristoph363: se retira \nMitchATP65: se retira \nSrLyce: se retira \nLa apuesta no igualada (0.02 €) ha sido devuelta a lecontrebandier\nlecontrebandier se lleva 0.05 € del bote \nlecontrebandier: no muestra su mano \n*** RESUMEN ***\nBote total 0.05 € | Comisión 0 € \nAsiento 4: oliverdu70\nAsiento 1: SrLyce (ciega grande) se retiró antes del Flop\nAsiento 2: lecontrebandier recaudó (0.05 €)\nAsiento 3: christoph363 (botón) se retiró antes del Flop (no apostó)\nAsiento 6: MitchATP65 (ciega pequeña) se retiró antes del Flop"
}