{
  "hand_id": "257237828806",
  "date": "06-08-2025 18:03:19",
  "table": "Atreus",
  "game_type": "holdem",
  "hero": "SrLyce",
  "hero_position": "",
  "hero_cards": [
    "Kc",
    "4c"
  ],
  "stacks": {
    "PrendsCa": 112.0,
    "NRules82": 43.0,
    "JENOFONTE73": 123.0,
    "JGDOBLAS": 201.5,
    "SrLyce": 67.0,
    "FishamanReggae": 48.0
  },
  "actions": {
    "preflop": [
      "Asiento 1: PrendsCa (2.24 € en fichas)",
      "Asiento 2: NRules82 (0.86 € en fichas)",
      "Asiento 3: JENOFONTE73 (2.46 € en fichas)",
      "Asiento 4: JGDOBLAS (4.03 € en fichas)",
      "Asiento 5: SrLyce (1.34 € en fichas)",
      "Asiento 6: FishamanReggae (0.96 € en fichas)",
      "PrendsCa: pone la ciega pequeña 0.01 €",
      "NRules82: pone la ciega grande 0.02 €",
      "JENOFONTE73: se retira",
      "JGDOBLAS: se retira",
      "SrLyce: sube 0.03 € a 0.05 €",
      "FishamanReggae: se retira",
      "PrendsCa: se retira",
      "NRules82: iguala 0.03 €"
    ],
    "flop": [
      "NRules82: pasa",
      "SrLyce: apuesta 0.03 €",
      "NRules82: iguala 0.03 €"
    ],
    "turn": [
      "NRules82: pasa",
      "SrLyce: pasa"
    ],
    "river": [
      "NRules82: pasa",
      "SrLyce: apuesta 0.07 €",
      "NRules82: iguala 0.07 €",
      "SrLyce: muestra [Kc 4c] (pareja de ochos)",
      "NRules82: muestra [5h As] (pareja de ochos - as kicker)",
      "Asiento 1: PrendsCa (ciega pequeña) se retiró antes del Flop",
      "Asiento 2: NRules82 (ciega grande) muestra [5h As] y ganó (0.29 €) con pareja de ochos",
      "Asiento 3: JENOFONTE73 se retiró antes del Flop (no apostó)",
      "Asiento 4: JGDOBLAS se retiró antes del Flop (no apostó)",
      "Asiento 5: SrLyce muestra [Kc 4c] y perdió con pareja de ochos",
      "Asiento 6: FishamanReggae (botón) se retiró antes del Flop (no apostó)"
    ]
  },
  "board": [
    "9h",
    "2h",
    "Qc",
    "8h",
    "8s"
  ],
  "winner": "NRules82",
  "win_amount": 14.5,
  "sb": 0.01,
  "bb": 0.02,
  "rake": 1.0,
  "raw_text": "Mano n.º 257237828806 de PokerStars:  Hold'em No Limit (0.01 €/0.02 € EUR) - 06-08-2025 18:03:19 CET [06-08-2025 12:03:19 ET]\nMesa \"Atreus\" 6-max El asiento n.º 6 es el botón\nAsiento 1: PrendsCa (2.24 € en fichas) \nAsiento 2: NRules82 (0.86 € en fichas) \nAsiento 3: JENOFONTE73 (2.46 € en fichas) \nAsiento 4: JGDOBLAS (4.03 € en fichas) \nAsiento 5: SrLyce (1.34 € en fichas) \nAsiento 6: FishamanReggae (0.96 € en fichas) \nPrendsCa: pone la ciega pequeña 0.01 €\nNRules82: pone la ciega grande 0.02 €\n*** CARTAS DE MANO ***\nRepartidas a SrLyce [Kc 4c]\nJENOFONTE73: se retira \nJGDOBLAS: se retira \nSrLyce: sube 0.03 € a 0.05 €\nFishamanReggae: se retira \nPrendsCa: se retira \nNRules82: iguala 0.03 €\n*** FLOP *** [9h 2h Qc]\nNRules82: pasa \nSrLyce: apuesta 0.03 €\nNRules82: iguala 0.03 €\n*** TURN *** [9h 2h Qc] [8h]\nNRules82: pasa \nSrLyce: pasa \n*** RIVER *** [9h 2h Qc 8h] [8s]\nNRules82: pasa \nSrLyce: apuesta 0.07 €\nNRules82: iguala 0.07 €\n*** SHOW DOWN ***\nSrLyce: muestra [Kc 4c] (pareja de ochos)\nNRules82: muestra [5h As] (pareja de ochos - as kicker)\nNRules82 se lleva 0.29 € del bote \n*** RESUMEN ***\nBote total 0.31 € | Comisión 0.02 € \nComunitarias [9h 2h Qc 8h 8s]\nAsiento 1: PrendsCa (ciega pequeña) se retiró antes del Flop\nAsiento 2: NRules82 (ciega grande) muestra [5h As] y ganó (0.29 €) con pareja de ochos\nAsiento 3: JENOFONTE73 se retiró antes del Flop (no apostó)\nAsiento 4: JGDOBLAS se retiró antes del Flop (no apostó)\nAsiento 5: SrLyce muestra [Kc 4c] y perdió con pareja de ochos\nAsiento 6: FishamanReggae (botón) se retiró antes del Flop (no apostó)"
}