{
  "hand_id": "257237736358",
  "date": "06-08-2025 17:53:01",
  "table": "Virtus",
  "game_type": "holdem",
  "hero": "SrLyce",
  "hero_position": "",
  "hero_cards": [
    "4d",
    "9c"
  ],
  "stacks": {
    "Kingzilla87": 171.0,
    "SrLyce": 103.5,
    "zzranger_03": 180.5,
    "JGDOBLAS": 90.0,
    "don.corle": 141.5,
    "rudik34385": 88.0
  },
  "actions": {
    "preflop": [
      "Asiento 1: Kingzilla87 (3.42 € en fichas)",
      "Asiento 2: SrLyce (2.07 € en fichas)",
      "Asiento 3: zzranger_03 (3.61 € en fichas)",
      "Asiento 4: JGDOBLAS (1.80 € en fichas)",
      "Asiento 5: don.corle (2.83 € en fichas)",
      "Asiento 6: rudik34385 (1.76 € en fichas)",
      "Kingzilla87: pone la ciega pequeña 0.01 €",
      "SrLyce: pone la ciega grande 0.02 €",
      "zzranger_03: sube 0.04 € a 0.06 €",
      "JGDOBLAS: se retira",
      "don.corle: se retira",
      "rudik34385: iguala 0.06 €",
      "Kingzilla87: se retira",
      "SrLyce: se retira"
    ],
    "flop": [
      "zzranger_03: apuesta 0.05 €",
      "rudik34385: iguala 0.05 €"
    ],
    "turn": [
      "zzranger_03: apuesta 0.17 €",
      "rudik34385: se retira",
      "zzranger_03: no muestra su mano",
      "Asiento 1: Kingzilla87 (ciega pequeña) se retiró antes del Flop",
      "Asiento 2: SrLyce (ciega grande) se retiró antes del Flop",
      "Asiento 3: zzranger_03 recaudó (0.23 €)",
      "Asiento 4: JGDOBLAS se retiró antes del Flop (no apostó)",
      "Asiento 5: don.corle se retiró antes del Flop (no apostó)",
      "Asiento 6: rudik34385 (botón) se retiró en el Turn"
    ],
    "river": []
  },
  "board": [
    "Ad",
    "2s",
    "2h",
    "4c"
  ],
  "winner": "zzranger_03",
  "win_amount": 11.5,
  "sb": 0.01,
  "bb": 0.02,
  "rake": 1.0,
  "raw_text": "Mano n.º 257237736358 de PokerStars:  Hold'em No Limit (0.01 €/0.02 € EUR) - 06-08-2025 17:53:01 CET [06-08-2025 11:53:01 ET]\nMesa \"Virtus\" 6-max El asiento n.º 6 es el botón\nAsiento 1: Kingzilla87 (3.42 € en fichas) \nAsiento 2: SrLyce (2.07 € en fichas) \nAsiento 3: zzranger_03 (3.61 € en fichas) \nAsiento 4: JGDOBLAS (1.80 € en fichas) \nAsiento 5: don.corle (2.83 € en fichas) \nAsiento 6: rudik34385 (1.76 € en fichas) \nKingzilla87: pone la ciega pequeña 0.01 €\nSrLyce: pone la ciega grande 0.02 €\n*** CARTAS DE MANO ***\nRepartidas a SrLyce [4d 9c]\nzzranger_03: sube 0.04 € a 0.06 €\nJGDOBLAS: se retira \ndon.corle: se retira \nrudik34385: iguala 0.06 €\nKingzilla87: se retira \nSrLyce: se retira \n*** FLOP *** [Ad 2s 2h]\nzzranger_03: apuesta 0.05 €\nrudik34385: iguala 0.05 €\n*** TURN *** [Ad 2s 2h] [4c]\nzzranger_03: apuesta 0.17 €\nrudik34385: se retira \nLa apuesta no igualada (0.17 €) ha sido devuelta a zzranger_03\nzzranger_03 se lleva 0.23 € del bote \nzzranger_03: no muestra su mano \n*** RESUMEN ***\nBote total 0.25 € | Comisión 0.02 € \nComunitarias [Ad 2s 2h 4c]\nAsiento 1: Kingzilla87 (ciega pequeña) se retiró antes del Flop\nAsiento 2: SrLyce (ciega grande) se retiró antes del Flop\nAsiento 3: zzranger_03 recaudó (0.23 €)\nAsiento 4: JGDOBLAS se retiró antes del Flop (no apostó)\nAsiento 5: don.corle se retiró antes del Flop (no apostó)\nAsiento 6: rudik34385 (botón) se retiró en el Turn"
}