{
  "hand_id": "257168299291",
  "date": "01-08-2025 11:22:15",
  "table": "Atlas",
  "game_type": "holdem",
  "hero": "SrLyce",
  "hero_position": "",
  "hero_cards": [
    "5d",
    "3c"
  ],
  "stacks": {
    "SrLyce": 92.0,
    "Fharock": 92.0,
    "ecuinas": 102.5,
    "LxckxStrxkx": 105.0,
    "erCampos23": 33.0,
    "Akourdideh": 116.0
  },
  "actions": {
    "preflop": [
      "Asiento 1: SrLyce (1.84 € en fichas)",
      "Asiento 2: Fharock (1.84 € en fichas)",
      "Asiento 3: ecuinas (2.05 € en fichas)",
      "Asiento 4: LxckxStrxkx (2.10 € en fichas)",
      "Asiento 5: erCampos23 (0.66 € en fichas)",
      "Asiento 6: Akourdideh (2.32 € en fichas)",
      "erCampos23: pone la ciega pequeña 0.01 €",
      "Akourdideh: pone la ciega grande 0.02 €",
      "SrLyce: se retira",
      "Fharock: sube 0.02 € a 0.04 €",
      "ecuinas: se retira",
      "LxckxStrxkx: se retira",
      "erCampos23: se retira",
      "Akourdideh: iguala 0.02 €"
    ],
    "flop": [
      "Akourdideh: pasa",
      "Fharock: apuesta 0.04 €",
      "Akourdideh: iguala 0.04 €"
    ],
    "turn": [
      "Akourdideh: pasa",
      "Fharock: pasa"
    ],
    "river": [
      "Akourdideh: pasa",
      "Fharock: pasa",
      "Akourdideh: muestra [7h As] (pareja de ases)",
      "Fharock: descarta su mano sin mostrar",
      "Asiento 1: SrLyce se retiró antes del Flop (no apostó)",
      "Asiento 2: Fharock descartó sin mostrar [4c 4h]",
      "Asiento 3: ecuinas se retiró antes del Flop (no apostó)",
      "Asiento 4: LxckxStrxkx (botón) se retiró antes del Flop (no apostó)",
      "Asiento 5: erCampos23 (ciega pequeña) se retiró antes del Flop",
      "Asiento 6: Akourdideh (ciega grande) muestra [7h As] y ganó (0.16 €) con pareja de ases"
    ]
  },
  "board": [
    "Js",
    "Ah",
    "8c",
    "9s",
    "6c"
  ],
  "winner": "Akourdideh",
  "win_amount": 8.0,
  "sb": 0.01,
  "bb": 0.02,
  "rake": 0.5,
  "raw_text": "Mano n.º 257168299291 de PokerStars:  Hold'em No Limit (0.01 €/0.02 € EUR) - 01-08-2025 11:22:15 CET [01-08-2025 5:22:15 ET]\nMesa \"Atlas\" 6-max El asiento n.º 4 es el botón\nAsiento 1: SrLyce (1.84 € en fichas) \nAsiento 2: Fharock (1.84 € en fichas) \nAsiento 3: ecuinas (2.05 € en fichas) \nAsiento 4: LxckxStrxkx (2.10 € en fichas) \nAsiento 5: erCampos23 (0.66 € en fichas) \nAsiento 6: Akourdideh (2.32 € en fichas) \nerCampos23: pone la ciega pequeña 0.01 €\nAkourdideh: pone la ciega grande 0.02 €\n*** CARTAS DE MANO ***\nRepartidas a SrLyce [5d 3c]\nSrLyce: se retira \nFharock: sube 0.02 € a 0.04 €\necuinas: se retira \nLxckxStrxkx: se retira \nerCampos23: se retira \nAkourdideh: iguala 0.02 €\n*** FLOP *** [Js Ah 8c]\nAkourdideh: pasa \nFharock: apuesta 0.04 €\nAkourdideh: iguala 0.04 €\n*** TURN *** [Js Ah 8c] [9s]\nAkourdideh: pasa \nFharock: pasa \n*** RIVER *** [Js Ah 8c 9s] [6c]\nAkourdideh: pasa \nFharock: pasa \n*** SHOW DOWN ***\nAkourdideh: muestra [7h As] (pareja de ases)\nFharock: descarta su mano sin mostrar \nAkourdideh se lleva 0.16 € del bote \n*** RESUMEN ***\nBote total 0.17 € | Comisión 0.01 € \nComunitarias [Js Ah 8c 9s 6c]\nAsiento 1: SrLyce se retiró antes del Flop (no apostó)\nAsiento 2: Fharock descartó sin mostrar [4c 4h]\nAsiento 3: ecuinas se retiró antes del Flop (no apostó)\nAsiento 4: LxckxStrxkx (botón) se retiró antes del Flop (no apostó)\nAsiento 5: erCampos23 (ciega pequeña) se retiró antes del Flop\nAsiento 6: Akourdideh (ciega grande) muestra [7h As] y ganó (0.16 €) con pareja de ases"
}