{
  "hand_id": "257149952673",
  "date": "30-07-2025 23:08:10",
  "table": "Lobelia",
  "game_type": "holdem",
  "hero": "SrLyce",
  "hero_position": "",
  "hero_cards": [
    "4s",
    "Ad"
  ],
  "stacks": {
    "LeVbks": 91.5,
    "fcis666": 72.0,
    "Dlaguancha": 73.5,
    "SrLyce": 91.5,
    "riverluck444": 72.5,
    "Kiffou39": 52.5
  },
  "actions": {
    "preflop": [
      "Asiento 1: LeVbks (1.83 € en fichas)",
      "Asiento 2: fcis666 (1.44 € en fichas)",
      "Asiento 3: Dlaguancha (1.47 € en fichas)",
      "Asiento 4: SrLyce (1.83 € en fichas)",
      "Asiento 5: riverluck444 (1.45 € en fichas)",
      "Asiento 6: Kiffou39 (1.05 € en fichas)",
      "riverluck444: pone la ciega pequeña 0.01 €",
      "Kiffou39: pone la ciega grande 0.02 €",
      "LeVbks: se retira",
      "fcis666: sube 0.04 € a 0.06 €",
      "Dlaguancha: se retira",
      "SrLyce: se retira",
      "riverluck444: sube 0.11 € a 0.17 €",
      "Kiffou39: se retira",
      "fcis666: iguala 0.11 €"
    ],
    "flop": [
      "riverluck444: pasa",
      "fcis666: pasa"
    ],
    "turn": [
      "riverluck444: apuesta 0.26 €",
      "fcis666: iguala 0.26 €"
    ],
    "river": [
      "riverluck444: apuesta 1.02 € y está all-in",
      "fcis666: se retira",
      "riverluck444: no muestra su mano",
      "Asiento 1: LeVbks se retiró antes del Flop (no apostó)",
      "Asiento 2: fcis666 se retiró en el River",
      "Asiento 3: Dlaguancha se retiró antes del Flop (no apostó)",
      "Asiento 4: SrLyce (botón) se retiró antes del Flop (no apostó)",
      "Asiento 5: riverluck444 (ciega pequeña) recaudó (0.83 €)",
      "Asiento 6: Kiffou39 (ciega grande) se retiró antes del Flop"
    ]
  },
  "board": [
    "4h",
    "2s",
    "Qc",
    "Ts",
    "6h"
  ],
  "winner": "riverluck444",
  "win_amount": 41.5,
  "sb": 0.01,
  "bb": 0.02,
  "rake": 2.5,
  "raw_text": "Mano n.º 257149952673 de PokerStars:  Hold'em No Limit (0.01 €/0.02 € EUR) - 30-07-2025 23:08:10 CET [30-07-2025 17:08:10 ET]\nMesa \"Lobelia\" 6-max El asiento n.º 4 es el botón\nAsiento 1: LeVbks (1.83 € en fichas) \nAsiento 2: fcis666 (1.44 € en fichas) \nAsiento 3: Dlaguancha (1.47 € en fichas) \nAsiento 4: SrLyce (1.83 € en fichas) \nAsiento 5: riverluck444 (1.45 € en fichas) \nAsiento 6: Kiffou39 (1.05 € en fichas) \nriverluck444: pone la ciega pequeña 0.01 €\nKiffou39: pone la ciega grande 0.02 €\n*** CARTAS DE MANO ***\nRepartidas a SrLyce [4s Ad]\nLeVbks: se retira \nfcis666: sube 0.04 € a 0.06 €\nDlaguancha: se retira \nSrLyce: se retira \nriverluck444: sube 0.11 € a 0.17 €\nKiffou39: se retira \nfcis666: iguala 0.11 €\n*** FLOP *** [4h 2s Qc]\nriverluck444: pasa \nfcis666: pasa \n*** TURN *** [4h 2s Qc] [Ts]\nriverluck444: apuesta 0.26 €\nfcis666: iguala 0.26 €\n*** RIVER *** [4h 2s Qc Ts] [6h]\nriverluck444: apuesta 1.02 € y está all-in\nfcis666: se retira \nLa apuesta no igualada (1.02 €) ha sido devuelta a riverluck444\nriverluck444 se lleva 0.83 € del bote \nriverluck444: no muestra su mano \n*** RESUMEN ***\nBote total 0.88 € | Comisión 0.05 € \nComunitarias [4h 2s Qc Ts 6h]\nAsiento 1: LeVbks se retiró antes del Flop (no apostó)\nAsiento 2: fcis666 se retiró en el River\nAsiento 3: Dlaguancha se retiró antes del Flop (no apostó)\nAsiento 4: SrLyce (botón) se retiró antes del Flop (no apostó)\nAsiento 5: riverluck444 (ciega pequeña) recaudó (0.83 €)\nAsiento 6: Kiffou39 (ciega grande) se retiró antes del Flop"
}