{
  "hand_id": "257238356219",
  "date": "06-08-2025 18:50:42",
  "table": "Herculina II",
  "game_type": "holdem",
  "hero": "SrLyce",
  "hero_position": "",
  "hero_cards": [
    "Ad",
    "3s"
  ],
  "stacks": {
    "koldipk": 102.0,
    "David98X": 108.5,
    "JJer11": 196.5,
    "SrLyce": 90.5,
    "El Calvo 65": 201.0,
    "ScarvBlack": 100.0
  },
  "actions": {
    "preflop": [
      "Asiento 1: koldipk (2.04 € en fichas)",
      "Asiento 2: David98X (2.17 € en fichas)",
      "Asiento 3: JJer11 (3.93 € en fichas)",
      "Asiento 4: SrLyce (1.81 € en fichas)",
      "Asiento 5: El Calvo 65 (4.02 € en fichas)",
      "Asiento 6: ScarvBlack (2 € en fichas)",
      "David98X: pone la ciega pequeña 0.01 €",
      "JJer11: pone la ciega grande 0.02 €",
      "SrLyce: se retira",
      "El Calvo 65: se retira",
      "ScarvBlack: se retira",
      "koldipk: iguala 0.02 €",
      "David98X: sube 0.09 € a 0.11 €",
      "JJer11: se retira",
      "koldipk: se retira",
      "David98X: no muestra su mano",
      "Asiento 1: koldipk (botón) se retiró antes del Flop",
      "Asiento 2: David98X (ciega pequeña) recaudó (0.06 €)",
      "Asiento 3: JJer11 (ciega grande) se retiró antes del Flop",
      "Asiento 4: SrLyce se retiró antes del Flop (no apostó)",
      "Asiento 5: El Calvo 65 se retiró antes del Flop (no apostó)",
      "Asiento 6: ScarvBlack se retiró antes del Flop (no apostó)"
    ],
    "flop": [],
    "turn": [],
    "river": []
  },
  "board": [],
  "winner": "David98X",
  "win_amount": 3.0,
  "sb": 0.01,
  "bb": 0.02,
  "rake": 0.0,
  "raw_text": "Mano n.º 257238356219 de PokerStars:  Hold'em No Limit (0.01 €/0.02 € EUR) - 06-08-2025 18:50:42 CET [06-08-2025 12:50:42 ET]\nMesa \"Herculina II\" 6-max El asiento n.º 1 es el botón\nAsiento 1: koldipk (2.04 € en fichas) \nAsiento 2: David98X (2.17 € en fichas) \nAsiento 3: JJer11 (3.93 € en fichas) \nAsiento 4: SrLyce (1.81 € en fichas) \nAsiento 5: El Calvo 65 (4.02 € en fichas) \nAsiento 6: ScarvBlack (2 € en fichas) \nDavid98X: pone la ciega pequeña 0.01 €\nJJer11: pone la ciega grande 0.02 €\n*** CARTAS DE MANO ***\nRepartidas a SrLyce [Ad 3s]\nSrLyce: se retira \nEl Calvo 65: se retira \nScarvBlack: se retira \nkoldipk: iguala 0.02 €\nDavid98X: sube 0.09 € a 0.11 €\nJJer11: se retira \nkoldipk: se retira \nLa apuesta no igualada (0.09 €) ha sido devuelta a David98X\nDavid98X se lleva 0.06 € del bote \nDavid98X: no muestra su mano \n*** RESUMEN ***\nBote total 0.06 € | Comisión 0 € \nAsiento 1: koldipk (botón) se retiró antes del Flop\nAsiento 2: David98X (ciega pequeña) recaudó (0.06 €)\nAsiento 3: JJer11 (ciega grande) se retiró antes del Flop\nAsiento 4: SrLyce se retiró antes del Flop (no apostó)\nAsiento 5: El Calvo 65 se retiró antes del Flop (no apostó)\nAsiento 6: ScarvBlack se retiró antes del Flop (no apostó)"
}