{
  "hand_id": "257237600079",
  "date": "06-08-2025 17:39:55",
  "table": "Kale III",
  "game_type": "holdem",
  "hero": "SrLyce",
  "hero_position": "",
  "hero_cards": [
    "5s",
    "7h"
  ],
  "stacks": {
    "x__Nest__x": 93.0,
    "SrLyce": 121.0,
    "Dracoline000": 108.0,
    "jeffounet33": 97.5,
    "Begoton": 100.0,
    "juanmemol": 104.0
  },
  "actions": {
    "preflop": [
      "Asiento 1: x__Nest__x (1.86 € en fichas)",
      "Asiento 2: SrLyce (2.42 € en fichas)",
      "Asiento 3: Dracoline000 (2.16 € en fichas)",
      "Asiento 4: jeffounet33 (1.95 € en fichas)",
      "Asiento 5: Begoton (2 € en fichas)",
      "Asiento 6: juanmemol (2.08 € en fichas)",
      "Begoton: pone la ciega pequeña 0.01 €",
      "juanmemol: pone la ciega grande 0.02 €",
      "x__Nest__x: se retira",
      "SrLyce: se retira",
      "Dracoline000: se retira",
      "jeffounet33: se retira",
      "Begoton: sube 0.04 € a 0.06 €",
      "juanmemol: se retira",
      "Begoton: no muestra su mano",
      "Asiento 1: x__Nest__x se retiró antes del Flop (no apostó)",
      "Asiento 2: SrLyce se retiró antes del Flop (no apostó)",
      "Asiento 3: Dracoline000 se retiró antes del Flop (no apostó)",
      "Asiento 4: jeffounet33 (botón) se retiró antes del Flop (no apostó)",
      "Asiento 5: Begoton (ciega pequeña) recaudó (0.04 €)",
      "Asiento 6: juanmemol (ciega grande) se retiró antes del Flop"
    ],
    "flop": [],
    "turn": [],
    "river": []
  },
  "board": [],
  "winner": "Begoton",
  "win_amount": 2.0,
  "sb": 0.01,
  "bb": 0.02,
  "rake": 0.0,
  "raw_text": "Mano n.º 257237600079 de PokerStars:  Hold'em No Limit (0.01 €/0.02 € EUR) - 06-08-2025 17:39:55 CET [06-08-2025 11:39:55 ET]\nMesa \"Kale III\" 6-max El asiento n.º 4 es el botón\nAsiento 1: x__Nest__x (1.86 € en fichas) \nAsiento 2: SrLyce (2.42 € en fichas) \nAsiento 3: Dracoline000 (2.16 € en fichas) \nAsiento 4: jeffounet33 (1.95 € en fichas) \nAsiento 5: Begoton (2 € en fichas) \nAsiento 6: juanmemol (2.08 € en fichas) \nBegoton: pone la ciega pequeña 0.01 €\njuanmemol: pone la ciega grande 0.02 €\n*** CARTAS DE MANO ***\nRepartidas a SrLyce [5s 7h]\nx__Nest__x: se retira \nSrLyce: se retira \nDracoline000: se retira \njeffounet33: se retira \nBegoton: sube 0.04 € a 0.06 €\njuanmemol: se retira \nLa apuesta no igualada (0.04 €) ha sido devuelta a Begoton\nBegoton se lleva 0.04 € del bote \nBegoton: no muestra su mano \n*** RESUMEN ***\nBote total 0.04 € | Comisión 0 € \nAsiento 1: x__Nest__x se retiró antes del Flop (no apostó)\nAsiento 2: SrLyce se retiró antes del Flop (no apostó)\nAsiento 3: Dracoline000 se retiró antes del Flop (no apostó)\nAsiento 4: jeffounet33 (botón) se retiró antes del Flop (no apostó)\nAsiento 5: Begoton (ciega pequeña) recaudó (0.04 €)\nAsiento 6: juanmemol (ciega grande) se retiró antes del Flop"
}