{
  "hand_id": "257237762406",
  "date": "06-08-2025 17:55:37",
  "table": "Atreus",
  "game_type": "holdem",
  "hero": "SrLyce",
  "hero_position": "",
  "hero_cards": [
    "6s",
    "3s"
  ],
  "stacks": {
    "PrendsCa": 103.5,
    "NRules82": 78.0,
    "JENOFONTE73": 133.0,
    "JGDOBLAS": 94.5,
    "SrLyce": 114.0,
    "psycadra": 7.0
  },
  "actions": {
    "preflop": [
      "Asiento 1: PrendsCa (2.07 € en fichas)",
      "Asiento 2: NRules82 (1.56 € en fichas)",
      "Asiento 3: JENOFONTE73 (2.66 € en fichas)",
      "Asiento 4: JGDOBLAS (1.89 € en fichas)",
      "Asiento 5: SrLyce (2.28 € en fichas)",
      "Asiento 6: psycadra (0.14 € en fichas)",
      "JENOFONTE73: pone la ciega pequeña 0.01 €",
      "JGDOBLAS: pone la ciega grande 0.02 €",
      "SrLyce: se retira",
      "psycadra: se retira",
      "PrendsCa: sube 0.05 € a 0.07 €",
      "NRules82: iguala 0.07 €",
      "JENOFONTE73: se retira",
      "JGDOBLAS: se retira"
    ],
    "flop": [
      "PrendsCa: apuesta 0.08 €",
      "NRules82: se retira",
      "PrendsCa: no muestra su mano",
      "Asiento 1: PrendsCa recaudó (0.16 €)",
      "Asiento 2: NRules82 (botón) se retiró en el Flop",
      "Asiento 3: JENOFONTE73 (ciega pequeña) se retiró antes del Flop",
      "Asiento 4: JGDOBLAS (ciega grande) se retiró antes del Flop",
      "Asiento 5: SrLyce se retiró antes del Flop (no apostó)",
      "Asiento 6: psycadra se retiró antes del Flop (no apostó)"
    ],
    "turn": [],
    "river": []
  },
  "board": [
    "8d",
    "Ks",
    "6c"
  ],
  "winner": "PrendsCa",
  "win_amount": 8.0,
  "sb": 0.01,
  "bb": 0.02,
  "rake": 0.5,
  "raw_text": "Mano n.º 257237762406 de PokerStars:  Hold'em No Limit (0.01 €/0.02 € EUR) - 06-08-2025 17:55:37 CET [06-08-2025 11:55:37 ET]\nMesa \"Atreus\" 6-max El asiento n.º 2 es el botón\nAsiento 1: PrendsCa (2.07 € en fichas) \nAsiento 2: NRules82 (1.56 € en fichas) \nAsiento 3: JENOFONTE73 (2.66 € en fichas) \nAsiento 4: JGDOBLAS (1.89 € en fichas) \nAsiento 5: SrLyce (2.28 € en fichas) \nAsiento 6: psycadra (0.14 € en fichas) \nJENOFONTE73: pone la ciega pequeña 0.01 €\nJGDOBLAS: pone la ciega grande 0.02 €\n*** CARTAS DE MANO ***\nRepartidas a SrLyce [6s 3s]\nSrLyce: se retira \npsycadra: se retira \nPrendsCa: sube 0.05 € a 0.07 €\npsycadra deja la mesa\nNRules82: iguala 0.07 €\nJENOFONTE73: se retira \nJGDOBLAS: se retira \n*** FLOP *** [8d Ks 6c]\nPrendsCa: apuesta 0.08 €\nNRules82: se retira \nLa apuesta no igualada (0.08 €) ha sido devuelta a PrendsCa\nPrendsCa se lleva 0.16 € del bote \nPrendsCa: no muestra su mano \n*** RESUMEN ***\nBote total 0.17 € | Comisión 0.01 € \nComunitarias [8d Ks 6c]\nAsiento 1: PrendsCa recaudó (0.16 €)\nAsiento 2: NRules82 (botón) se retiró en el Flop\nAsiento 3: JENOFONTE73 (ciega pequeña) se retiró antes del Flop\nAsiento 4: JGDOBLAS (ciega grande) se retiró antes del Flop\nAsiento 5: SrLyce se retiró antes del Flop (no apostó)\nAsiento 6: psycadra se retiró antes del Flop (no apostó)"
}