{
  "hand_id": "257148987853",
  "date": "30-07-2025 21:59:35",
  "table": "Esclangona",
  "game_type": "holdem",
  "hero": "SrLyce",
  "hero_position": "",
  "hero_cards": [
    "Tc",
    "Qs"
  ],
  "stacks": {
    "Zorgue1080": 72.5,
    "SrLyce": 177.5,
    "NoahBolete": 96.5,
    "Davdgoni": 104.5,
    "DiaZzZ1": 101.5,
    "berlcht403": 37.0
  },
  "actions": {
    "preflop": [
      "Asiento 1: Zorgue1080 (1.45 € en fichas)",
      "Asiento 2: SrLyce (3.55 € en fichas)",
      "Asiento 3: NoahBolete (1.93 € en fichas)",
      "Asiento 4: Davdgoni (2.09 € en fichas)",
      "Asiento 5: DiaZzZ1 (2.03 € en fichas)",
      "Asiento 6: berlcht403 (0.74 € en fichas)",
      "Davdgoni: pone la ciega pequeña 0.01 €",
      "DiaZzZ1: pone la ciega grande 0.02 €",
      "berlcht403: se retira",
      "Zorgue1080: se retira",
      "SrLyce: sube 0.04 € a 0.06 €",
      "NoahBolete: se retira",
      "Davdgoni: se retira",
      "DiaZzZ1: se retira",
      "SrLyce: no muestra su mano",
      "Asiento 1: Zorgue1080 se retiró antes del Flop (no apostó)",
      "Asiento 2: SrLyce recaudó (0.05 €)",
      "Asiento 3: NoahBolete (botón) se retiró antes del Flop (no apostó)",
      "Asiento 4: Davdgoni (ciega pequeña) se retiró antes del Flop",
      "Asiento 5: DiaZzZ1 (ciega grande) se retiró antes del Flop",
      "Asiento 6: berlcht403 se retiró antes del Flop (no apostó)"
    ],
    "flop": [],
    "turn": [],
    "river": []
  },
  "board": [],
  "winner": "SrLyce",
  "win_amount": 2.5,
  "sb": 0.01,
  "bb": 0.02,
  "rake": 0.0,
  "raw_text": "Mano n.º 257148987853 de PokerStars:  Hold'em No Limit (0.01 €/0.02 € EUR) - 30-07-2025 21:59:35 CET [30-07-2025 15:59:35 ET]\nMesa \"Esclangona\" 6-max El asiento n.º 3 es el botón\nAsiento 1: Zorgue1080 (1.45 € en fichas) \nAsiento 2: SrLyce (3.55 € en fichas) \nAsiento 3: NoahBolete (1.93 € en fichas) \nAsiento 4: Davdgoni (2.09 € en fichas) \nAsiento 5: DiaZzZ1 (2.03 € en fichas) \nAsiento 6: berlcht403 (0.74 € en fichas) \nDavdgoni: pone la ciega pequeña 0.01 €\nDiaZzZ1: pone la ciega grande 0.02 €\n*** CARTAS DE MANO ***\nRepartidas a SrLyce [Tc Qs]\nberlcht403: se retira \nZorgue1080: se retira \nSrLyce: sube 0.04 € a 0.06 €\nNoahBolete: se retira \nDavdgoni: se retira \nDiaZzZ1: se retira \nLa apuesta no igualada (0.04 €) ha sido devuelta a SrLyce\nSrLyce se lleva 0.05 € del bote \nSrLyce: no muestra su mano \n*** RESUMEN ***\nBote total 0.05 € | Comisión 0 € \nAsiento 1: Zorgue1080 se retiró antes del Flop (no apostó)\nAsiento 2: SrLyce recaudó (0.05 €)\nAsiento 3: NoahBolete (botón) se retiró antes del Flop (no apostó)\nAsiento 4: Davdgoni (ciega pequeña) se retiró antes del Flop\nAsiento 5: DiaZzZ1 (ciega grande) se retiró antes del Flop\nAsiento 6: berlcht403 se retiró antes del Flop (no apostó)"
}