{
  "hand_id": "257238723914",
  "date": "06-08-2025 19:23:45",
  "table": "Adelaide III",
  "game_type": "holdem",
  "hero": "SrLyce",
  "hero_position": "",
  "hero_cards": [
    "3c",
    "7d"
  ],
  "stacks": {
    "Alceo27": 111.0,
    "aliendee07": 43.0,
    "Macklemore0": 107.0,
    "SrLyce": 132.5,
    "ismagonzalez7": 100.0,
    "McFlash3": 142.0
  },
  "actions": {
    "preflop": [
      "Asiento 1: Alceo27 (2.22 € en fichas)",
      "Asiento 2: aliendee07 (0.86 € en fichas)",
      "Asiento 3: Macklemore0 (2.14 € en fichas)",
      "Asiento 4: SrLyce (2.65 € en fichas)",
      "Asiento 5: ismagonzalez7 (2 € en fichas)",
      "Asiento 6: McFlash3 (2.84 € en fichas)",
      "SrLyce: pone la ciega pequeña 0.01 €",
      "ismagonzalez7: pone la ciega grande 0.02 €",
      "McFlash3: se retira",
      "Alceo27: se retira",
      "aliendee07: se retira",
      "Macklemore0: sube 0.04 € a 0.06 €",
      "SrLyce: se retira",
      "ismagonzalez7: iguala 0.04 €"
    ],
    "flop": [
      "ismagonzalez7: apuesta 0.06 €",
      "Macklemore0: se retira",
      "ismagonzalez7: no muestra su mano",
      "Asiento 1: Alceo27 se retiró antes del Flop (no apostó)",
      "Asiento 2: aliendee07 se retiró antes del Flop (no apostó)",
      "Asiento 3: Macklemore0 (botón) se retiró en el Flop",
      "Asiento 4: SrLyce (ciega pequeña) se retiró antes del Flop",
      "Asiento 5: ismagonzalez7 (ciega grande) recaudó (0.12 €)",
      "Asiento 6: McFlash3 se retiró antes del Flop (no apostó)"
    ],
    "turn": [],
    "river": []
  },
  "board": [
    "8d",
    "As",
    "Kc"
  ],
  "winner": "ismagonzalez7",
  "win_amount": 6.0,
  "sb": 0.01,
  "bb": 0.02,
  "rake": 0.5,
  "raw_text": "Mano n.º 257238723914 de PokerStars:  Hold'em No Limit (0.01 €/0.02 € EUR) - 06-08-2025 19:23:45 CET [06-08-2025 13:23:45 ET]\nMesa \"Adelaide III\" 6-max El asiento n.º 3 es el botón\nAsiento 1: Alceo27 (2.22 € en fichas) \nAsiento 2: aliendee07 (0.86 € en fichas) \nAsiento 3: Macklemore0 (2.14 € en fichas) \nAsiento 4: SrLyce (2.65 € en fichas) \nAsiento 5: ismagonzalez7 (2 € en fichas) \nAsiento 6: McFlash3 (2.84 € en fichas) \nSrLyce: pone la ciega pequeña 0.01 €\nismagonzalez7: pone la ciega grande 0.02 €\n*** CARTAS DE MANO ***\nRepartidas a SrLyce [3c 7d]\nMcFlash3: se retira \nAlceo27: se retira \naliendee07: se retira \nMacklemore0: sube 0.04 € a 0.06 €\nSrLyce: se retira \nismagonzalez7: iguala 0.04 €\n*** FLOP *** [8d As Kc]\nismagonzalez7: apuesta 0.06 €\nMacklemore0: se retira \nLa apuesta no igualada (0.06 €) ha sido devuelta a ismagonzalez7\nismagonzalez7 se lleva 0.12 € del bote \nismagonzalez7: no muestra su mano \n*** RESUMEN ***\nBote total 0.13 € | Comisión 0.01 € \nComunitarias [8d As Kc]\nAsiento 1: Alceo27 se retiró antes del Flop (no apostó)\nAsiento 2: aliendee07 se retiró antes del Flop (no apostó)\nAsiento 3: Macklemore0 (botón) se retiró en el Flop\nAsiento 4: SrLyce (ciega pequeña) se retiró antes del Flop\nAsiento 5: ismagonzalez7 (ciega grande) recaudó (0.12 €)\nAsiento 6: McFlash3 se retiró antes del Flop (no apostó)"
}