{
  "hand_id": "257238754087",
  "date": "06-08-2025 19:26:14",
  "table": "Leonteus",
  "game_type": "holdem",
  "hero": "SrLyce",
  "hero_position": "",
  "hero_cards": [
    "4s",
    "4d"
  ],
  "stacks": {
    "Andark47": 207.5,
    "practikal_C23": 52.0,
    "niyomalo": 94.5,
    "davinci1962": 151.0,
    "BuXHexter": 163.0,
    "SrLyce": 78.0
  },
  "actions": {
    "preflop": [
      "Asiento 5: Andark47 (4.15 € en fichas) está ausente",
      "Asiento 1: practikal_C23 (1.04 € en fichas)",
      "Asiento 2: niyomalo (1.89 € en fichas)",
      "Asiento 3: davinci1962 (3.02 € en fichas)",
      "Asiento 4: BuXHexter (3.26 € en fichas)",
      "Asiento 6: SrLyce (1.56 € en fichas)",
      "SrLyce: pone la ciega pequeña 0.01 €",
      "practikal_C23: pone la ciega grande 0.02 €",
      "niyomalo: sube 0.05 € a 0.07 €",
      "davinci1962: se retira",
      "BuXHexter: se retira",
      "SrLyce: iguala 0.06 €",
      "practikal_C23: se retira"
    ],
    "flop": [
      "SrLyce: pasa",
      "niyomalo: apuesta 0.15 €",
      "SrLyce: se retira",
      "niyomalo: no muestra su mano",
      "Asiento 5: Andark47",
      "Asiento 1: practikal_C23 (ciega grande) se retiró antes del Flop",
      "Asiento 2: niyomalo recaudó (0.15 €)",
      "Asiento 3: davinci1962 se retiró antes del Flop (no apostó)",
      "Asiento 4: BuXHexter (botón) se retiró antes del Flop (no apostó)",
      "Asiento 6: SrLyce (ciega pequeña) se retiró en el Flop"
    ],
    "turn": [],
    "river": []
  },
  "board": [
    "8c",
    "Kc",
    "3c"
  ],
  "winner": "niyomalo",
  "win_amount": 7.5,
  "sb": 0.01,
  "bb": 0.02,
  "rake": 0.5,
  "raw_text": "Mano n.º 257238754087 de PokerStars:  Hold'em No Limit (0.01 €/0.02 € EUR) - 06-08-2025 19:26:14 CET [06-08-2025 13:26:14 ET]\nMesa \"Leonteus\" 6-max El asiento n.º 4 es el botón\nAsiento 5: Andark47 (4.15 € en fichas) está ausente\nAsiento 1: practikal_C23 (1.04 € en fichas) \nAsiento 2: niyomalo (1.89 € en fichas) \nAsiento 3: davinci1962 (3.02 € en fichas) \nAsiento 4: BuXHexter (3.26 € en fichas) \nAsiento 6: SrLyce (1.56 € en fichas) \nSrLyce: pone la ciega pequeña 0.01 €\npractikal_C23: pone la ciega grande 0.02 €\n*** CARTAS DE MANO ***\nRepartidas a SrLyce [4s 4d]\nniyomalo: sube 0.05 € a 0.07 €\ndavinci1962: se retira \nBuXHexter: se retira \nSrLyce: iguala 0.06 €\npractikal_C23: se retira \n*** FLOP *** [8c Kc 3c]\nSrLyce: pasa \nniyomalo: apuesta 0.15 €\nSrLyce: se retira \nLa apuesta no igualada (0.15 €) ha sido devuelta a niyomalo\nniyomalo se lleva 0.15 € del bote \nniyomalo: no muestra su mano \n*** RESUMEN ***\nBote total 0.16 € | Comisión 0.01 € \nComunitarias [8c Kc 3c]\nAsiento 5: Andark47\nAsiento 1: practikal_C23 (ciega grande) se retiró antes del Flop\nAsiento 2: niyomalo recaudó (0.15 €)\nAsiento 3: davinci1962 se retiró antes del Flop (no apostó)\nAsiento 4: BuXHexter (botón) se retiró antes del Flop (no apostó)\nAsiento 6: SrLyce (ciega pequeña) se retiró en el Flop"
}