{
  "hand_id": "257168225455",
  "date": "01-08-2025 11:07:55",
  "table": "Sekanina",
  "game_type": "holdem",
  "hero": "SrLyce",
  "hero_position": "",
  "hero_cards": [
    "Qd",
    "8s"
  ],
  "stacks": {
    "practikal_C23": 82.5,
    "Alvii37": 92.0,
    "SrLyce": 102.0,
    "davinci1962": 107.0,
    "Elministrelas": 96.0
  },
  "actions": {
    "preflop": [
      "Asiento 2: practikal_C23 (1.65 € en fichas)",
      "Asiento 3: Alvii37 (1.84 € en fichas)",
      "Asiento 4: SrLyce (2.04 € en fichas)",
      "Asiento 5: davinci1962 (2.14 € en fichas)",
      "Asiento 6: Elministrelas (1.92 € en fichas)",
      "davinci1962: pone la ciega pequeña 0.01 €",
      "Elministrelas: pone la ciega grande 0.02 €",
      "practikal_C23: se retira",
      "Alvii37: se retira",
      "SrLyce: se retira",
      "davinci1962: se retira",
      "Asiento 2: practikal_C23 se retiró antes del Flop (no apostó)",
      "Asiento 3: Alvii37 se retiró antes del Flop (no apostó)",
      "Asiento 4: SrLyce (botón) se retiró antes del Flop (no apostó)",
      "Asiento 5: davinci1962 (ciega pequeña) se retiró antes del Flop",
      "Asiento 6: Elministrelas (ciega grande) recaudó (0.02 €)"
    ],
    "flop": [],
    "turn": [],
    "river": []
  },
  "board": [],
  "winner": "Elministrelas",
  "win_amount": 1.0,
  "sb": 0.01,
  "bb": 0.02,
  "rake": 0.0,
  "raw_text": "Mano n.º 257168225455 de PokerStars:  Hold'em No Limit (0.01 €/0.02 € EUR) - 01-08-2025 11:07:55 CET [01-08-2025 5:07:55 ET]\nMesa \"Sekanina\" 6-max El asiento n.º 4 es el botón\nAsiento 2: practikal_C23 (1.65 € en fichas) \nAsiento 3: Alvii37 (1.84 € en fichas) \nAsiento 4: SrLyce (2.04 € en fichas) \nAsiento 5: davinci1962 (2.14 € en fichas) \nAsiento 6: Elministrelas (1.92 € en fichas) \ndavinci1962: pone la ciega pequeña 0.01 €\nElministrelas: pone la ciega grande 0.02 €\n*** CARTAS DE MANO ***\nRepartidas a SrLyce [Qd 8s]\npractikal_C23: se retira \nAlvii37: se retira \nSrLyce: se retira \ndavinci1962: se retira \nLa apuesta no igualada (0.01 €) ha sido devuelta a Elministrelas\nElministrelas se lleva 0.02 € del bote \n*** RESUMEN ***\nBote total 0.02 € | Comisión 0 € \nAsiento 2: practikal_C23 se retiró antes del Flop (no apostó)\nAsiento 3: Alvii37 se retiró antes del Flop (no apostó)\nAsiento 4: SrLyce (botón) se retiró antes del Flop (no apostó)\nAsiento 5: davinci1962 (ciega pequeña) se retiró antes del Flop\nAsiento 6: Elministrelas (ciega grande) recaudó (0.02 €)"
}