{
  "hand_id": "257150452925",
  "date": "30-07-2025 23:42:54",
  "table": "Mizuho",
  "game_type": "holdem",
  "hero": "SrLyce",
  "hero_position": "",
  "hero_cards": [
    "8s",
    "Td"
  ],
  "stacks": {
    "benipoker123": 109.5,
    "SrLyce": 95.0,
    "JstLeonel": 117.0,
    "Ozzy3110": 243.5,
    "toonsy2010": 146.5,
    "mivipkr": 166.5
  },
  "actions": {
    "preflop": [
      "Asiento 1: benipoker123 (2.19 € en fichas)",
      "Asiento 2: SrLyce (1.90 € en fichas)",
      "Asiento 3: JstLeonel (2.34 € en fichas)",
      "Asiento 4: Ozzy3110 (4.87 € en fichas)",
      "Asiento 5: toonsy2010 (2.93 € en fichas)",
      "Asiento 6: mivipkr (3.33 € en fichas)",
      "toonsy2010: pone la ciega pequeña 0.01 €",
      "mivipkr: pone la ciega grande 0.02 €",
      "benipoker123: se retira",
      "SrLyce: se retira",
      "JstLeonel: se retira",
      "Ozzy3110: se retira",
      "toonsy2010: se retira",
      "mivipkr: no muestra su mano",
      "Asiento 1: benipoker123 se retiró antes del Flop (no apostó)",
      "Asiento 2: SrLyce se retiró antes del Flop (no apostó)",
      "Asiento 3: JstLeonel se retiró antes del Flop (no apostó)",
      "Asiento 4: Ozzy3110 (botón) se retiró antes del Flop (no apostó)",
      "Asiento 5: toonsy2010 (ciega pequeña) se retiró antes del Flop",
      "Asiento 6: mivipkr (ciega grande) recaudó (0.02 €)"
    ],
    "flop": [],
    "turn": [],
    "river": []
  },
  "board": [],
  "winner": "mivipkr",
  "win_amount": 1.0,
  "sb": 0.01,
  "bb": 0.02,
  "rake": 0.0,
  "raw_text": "Mano n.º 257150452925 de PokerStars:  Hold'em No Limit (0.01 €/0.02 € EUR) - 30-07-2025 23:42:54 CET [30-07-2025 17:42:54 ET]\nMesa \"Mizuho\" 6-max El asiento n.º 4 es el botón\nAsiento 1: benipoker123 (2.19 € en fichas) \nAsiento 2: SrLyce (1.90 € en fichas) \nAsiento 3: JstLeonel (2.34 € en fichas) \nAsiento 4: Ozzy3110 (4.87 € en fichas) \nAsiento 5: toonsy2010 (2.93 € en fichas) \nAsiento 6: mivipkr (3.33 € en fichas) \ntoonsy2010: pone la ciega pequeña 0.01 €\nmivipkr: pone la ciega grande 0.02 €\n*** CARTAS DE MANO ***\nRepartidas a SrLyce [8s Td]\nbenipoker123: se retira \nSrLyce: se retira \nJstLeonel: se retira \nOzzy3110: se retira \ntoonsy2010: se retira \nLa apuesta no igualada (0.01 €) ha sido devuelta a mivipkr\nmivipkr se lleva 0.02 € del bote \nmivipkr: no muestra su mano \n*** RESUMEN ***\nBote total 0.02 € | Comisión 0 € \nAsiento 1: benipoker123 se retiró antes del Flop (no apostó)\nAsiento 2: SrLyce se retiró antes del Flop (no apostó)\nAsiento 3: JstLeonel se retiró antes del Flop (no apostó)\nAsiento 4: Ozzy3110 (botón) se retiró antes del Flop (no apostó)\nAsiento 5: toonsy2010 (ciega pequeña) se retiró antes del Flop\nAsiento 6: mivipkr (ciega grande) recaudó (0.02 €)"
}