{
  "hand_id": "257150238985",
  "date": "30-07-2025 23:27:54",
  "table": "Lobelia",
  "game_type": "holdem",
  "hero": "SrLyce",
  "hero_position": "",
  "hero_cards": [
    "2c",
    "Td"
  ],
  "stacks": {
    "LeVbks": 111.5,
    "fcis666": 49.0,
    "Dlaguancha": 116.0,
    "SrLyce": 107.0,
    "riverluck444": 94.5,
    "javipondio": 13.0
  },
  "actions": {
    "preflop": [
      "Asiento 1: LeVbks (2.23 € en fichas)",
      "Asiento 2: fcis666 (0.98 € en fichas)",
      "Asiento 3: Dlaguancha (2.32 € en fichas)",
      "Asiento 4: SrLyce (2.14 € en fichas)",
      "Asiento 5: riverluck444 (1.89 € en fichas)",
      "Asiento 6: javipondio (0.26 € en fichas)",
      "Dlaguancha: pone la ciega pequeña 0.01 €",
      "SrLyce: pone la ciega grande 0.02 €",
      "riverluck444: se retira",
      "javipondio: iguala 0.02 €",
      "LeVbks: se retira",
      "fcis666: se retira",
      "Dlaguancha: se retira",
      "SrLyce: pasa"
    ],
    "flop": [
      "SrLyce: pasa",
      "javipondio: apuesta 0.05 €",
      "SrLyce: se retira",
      "Asiento 1: LeVbks se retiró antes del Flop (no apostó)",
      "Asiento 2: fcis666 (botón) se retiró antes del Flop (no apostó)",
      "Asiento 3: Dlaguancha (ciega pequeña) se retiró antes del Flop",
      "Asiento 4: SrLyce (ciega grande) se retiró en el Flop",
      "Asiento 5: riverluck444 se retiró antes del Flop (no apostó)",
      "Asiento 6: javipondio recaudó (0.05 €)"
    ],
    "turn": [],
    "river": []
  },
  "board": [
    "Kc",
    "6c",
    "8h"
  ],
  "winner": "javipondio",
  "win_amount": 2.5,
  "sb": 0.01,
  "bb": 0.02,
  "rake": 0.0,
  "raw_text": "Mano n.º 257150238985 de PokerStars:  Hold'em No Limit (0.01 €/0.02 € EUR) - 30-07-2025 23:27:54 CET [30-07-2025 17:27:54 ET]\nMesa \"Lobelia\" 6-max El asiento n.º 2 es el botón\nAsiento 1: LeVbks (2.23 € en fichas) \nAsiento 2: fcis666 (0.98 € en fichas) \nAsiento 3: Dlaguancha (2.32 € en fichas) \nAsiento 4: SrLyce (2.14 € en fichas) \nAsiento 5: riverluck444 (1.89 € en fichas) \nAsiento 6: javipondio (0.26 € en fichas) \nDlaguancha: pone la ciega pequeña 0.01 €\nSrLyce: pone la ciega grande 0.02 €\n*** CARTAS DE MANO ***\nRepartidas a SrLyce [2c Td]\nriverluck444: se retira \njavipondio: iguala 0.02 €\nLeVbks: se retira \nfcis666: se retira \nDlaguancha: se retira \nSrLyce: pasa \n*** FLOP *** [Kc 6c 8h]\nSrLyce: pasa \njavipondio: apuesta 0.05 €\nSrLyce: se retira \nLa apuesta no igualada (0.05 €) ha sido devuelta a javipondio\njavipondio se lleva 0.05 € del bote \n*** RESUMEN ***\nBote total 0.05 € | Comisión 0 € \nComunitarias [Kc 6c 8h]\nAsiento 1: LeVbks se retiró antes del Flop (no apostó)\nAsiento 2: fcis666 (botón) se retiró antes del Flop (no apostó)\nAsiento 3: Dlaguancha (ciega pequeña) se retiró antes del Flop\nAsiento 4: SrLyce (ciega grande) se retiró en el Flop\nAsiento 5: riverluck444 se retiró antes del Flop (no apostó)\nAsiento 6: javipondio recaudó (0.05 €)"
}