{
  "hand_id": "257148904098",
  "date": "30-07-2025 21:52:14",
  "table": "Esclangona",
  "game_type": "holdem",
  "hero": "SrLyce",
  "hero_position": "",
  "hero_cards": [
    "Kh",
    "9c"
  ],
  "stacks": {
    "Zorgue1080": 89.5,
    "SrLyce": 159.0,
    "NoahBolete": 101.0,
    "Davdgoni": 100.0,
    "DiaZzZ1": 105.5,
    "berlcht403": 32.5
  },
  "actions": {
    "preflop": [
      "Asiento 1: Zorgue1080 (1.79 € en fichas)",
      "Asiento 2: SrLyce (3.18 € en fichas)",
      "Asiento 3: NoahBolete (2.02 € en fichas)",
      "Asiento 4: Davdgoni (2 € en fichas)",
      "Asiento 5: DiaZzZ1 (2.11 € en fichas)",
      "Asiento 6: berlcht403 (0.65 € en fichas)",
      "NoahBolete: pone la ciega pequeña 0.01 €",
      "Davdgoni: pone la ciega grande 0.02 €",
      "DiaZzZ1: se retira",
      "berlcht403: iguala 0.02 €",
      "Zorgue1080: se retira",
      "SrLyce: iguala 0.02 €",
      "NoahBolete: se retira",
      "Davdgoni: sube 0.07 € a 0.09 €",
      "berlcht403: iguala 0.07 €",
      "SrLyce: se retira"
    ],
    "flop": [
      "Davdgoni: pasa",
      "berlcht403: pasa"
    ],
    "turn": [
      "Davdgoni: pasa",
      "berlcht403: pasa"
    ],
    "river": [
      "Davdgoni: pasa",
      "berlcht403: apuesta 0.02 €",
      "Davdgoni: se retira",
      "Asiento 1: Zorgue1080 se retiró antes del Flop (no apostó)",
      "Asiento 2: SrLyce (botón) se retiró antes del Flop",
      "Asiento 3: NoahBolete (ciega pequeña) se retiró antes del Flop",
      "Asiento 4: Davdgoni (ciega grande) se retiró en el River",
      "Asiento 5: DiaZzZ1 se retiró antes del Flop (no apostó)",
      "Asiento 6: berlcht403 recaudó (0.20 €)"
    ]
  },
  "board": [
    "7c",
    "5s",
    "Ts",
    "6c",
    "8c"
  ],
  "winner": "berlcht403",
  "win_amount": 10.0,
  "sb": 0.01,
  "bb": 0.02,
  "rake": 0.5,
  "raw_text": "Mano n.º 257148904098 de PokerStars:  Hold'em No Limit (0.01 €/0.02 € EUR) - 30-07-2025 21:52:14 CET [30-07-2025 15:52:14 ET]\nMesa \"Esclangona\" 6-max El asiento n.º 2 es el botón\nAsiento 1: Zorgue1080 (1.79 € en fichas) \nAsiento 2: SrLyce (3.18 € en fichas) \nAsiento 3: NoahBolete (2.02 € en fichas) \nAsiento 4: Davdgoni (2 € en fichas) \nAsiento 5: DiaZzZ1 (2.11 € en fichas) \nAsiento 6: berlcht403 (0.65 € en fichas) \nNoahBolete: pone la ciega pequeña 0.01 €\nDavdgoni: pone la ciega grande 0.02 €\n*** CARTAS DE MANO ***\nRepartidas a SrLyce [Kh 9c]\nDiaZzZ1: se retira \nberlcht403: iguala 0.02 €\nZorgue1080: se retira \nSrLyce: iguala 0.02 €\nNoahBolete: se retira \nDavdgoni: sube 0.07 € a 0.09 €\nberlcht403: iguala 0.07 €\nSrLyce: se retira \n*** FLOP *** [7c 5s Ts]\nDavdgoni: pasa \nberlcht403: pasa \n*** TURN *** [7c 5s Ts] [6c]\nDavdgoni: pasa \nberlcht403: pasa \n*** RIVER *** [7c 5s Ts 6c] [8c]\nDavdgoni: pasa \nberlcht403: apuesta 0.02 €\nDavdgoni: se retira \nLa apuesta no igualada (0.02 €) ha sido devuelta a berlcht403\nberlcht403 se lleva 0.20 € del bote \n*** RESUMEN ***\nBote total 0.21 € | Comisión 0.01 € \nComunitarias [7c 5s Ts 6c 8c]\nAsiento 1: Zorgue1080 se retiró antes del Flop (no apostó)\nAsiento 2: SrLyce (botón) se retiró antes del Flop\nAsiento 3: NoahBolete (ciega pequeña) se retiró antes del Flop\nAsiento 4: Davdgoni (ciega grande) se retiró en el River\nAsiento 5: DiaZzZ1 se retiró antes del Flop (no apostó)\nAsiento 6: berlcht403 recaudó (0.20 €)"
}