{
  "hand_id": "257237809190",
  "date": "06-08-2025 18:01:21",
  "table": "Nuwa III",
  "game_type": "holdem",
  "hero": "SrLyce",
  "hero_position": "",
  "hero_cards": [
    "8h",
    "Kh"
  ],
  "stacks": {
    "davinci1962": 118.0,
    "BuXHexter": 104.5,
    "kcg_rm": 99.5,
    "SrLyce": 97.0,
    "RiskAllinkali": 116.0,
    "acavada": 106.5
  },
  "actions": {
    "preflop": [
      "Asiento 1: davinci1962 (2.36 € en fichas)",
      "Asiento 2: BuXHexter (2.09 € en fichas)",
      "Asiento 3: kcg_rm (1.99 € en fichas)",
      "Asiento 4: SrLyce (1.94 € en fichas)",
      "Asiento 5: RiskAllinkali (2.32 € en fichas)",
      "Asiento 6: acavada (2.13 € en fichas)",
      "SrLyce: pone la ciega pequeña 0.01 €",
      "RiskAllinkali: pone la ciega grande 0.02 €",
      "acavada: sube 0.02 € a 0.04 €",
      "davinci1962: se retira",
      "BuXHexter: se retira",
      "kcg_rm: iguala 0.04 €",
      "SrLyce: iguala 0.03 €",
      "RiskAllinkali: se retira"
    ],
    "flop": [
      "SrLyce: pasa",
      "acavada: apuesta 0.02 €",
      "kcg_rm: iguala 0.02 €",
      "SrLyce: iguala 0.02 €"
    ],
    "turn": [
      "SrLyce: pasa",
      "acavada: apuesta 0.02 €",
      "kcg_rm: sube 0.08 € a 0.10 €",
      "SrLyce: se retira",
      "acavada: se retira",
      "kcg_rm: no muestra su mano",
      "Asiento 1: davinci1962 se retiró antes del Flop (no apostó)",
      "Asiento 2: BuXHexter se retiró antes del Flop (no apostó)",
      "Asiento 3: kcg_rm (botón) recaudó (0.23 €)",
      "Asiento 4: SrLyce (ciega pequeña) se retiró en el Turn",
      "Asiento 5: RiskAllinkali (ciega grande) se retiró antes del Flop",
      "Asiento 6: acavada se retiró en el Turn"
    ],
    "river": []
  },
  "board": [
    "Qs",
    "7s",
    "4c",
    "Tc"
  ],
  "winner": "kcg_rm",
  "win_amount": 11.5,
  "sb": 0.01,
  "bb": 0.02,
  "rake": 0.5,
  "raw_text": "Mano n.º 257237809190 de PokerStars:  Hold'em No Limit (0.01 €/0.02 € EUR) - 06-08-2025 18:01:21 CET [06-08-2025 12:01:21 ET]\nMesa \"Nuwa III\" 6-max El asiento n.º 3 es el botón\nAsiento 1: davinci1962 (2.36 € en fichas) \nAsiento 2: BuXHexter (2.09 € en fichas) \nAsiento 3: kcg_rm (1.99 € en fichas) \nAsiento 4: SrLyce (1.94 € en fichas) \nAsiento 5: RiskAllinkali (2.32 € en fichas) \nAsiento 6: acavada (2.13 € en fichas) \nSrLyce: pone la ciega pequeña 0.01 €\nRiskAllinkali: pone la ciega grande 0.02 €\n*** CARTAS DE MANO ***\nRepartidas a SrLyce [8h Kh]\nacavada: sube 0.02 € a 0.04 €\ndavinci1962: se retira \nBuXHexter: se retira \nkcg_rm: iguala 0.04 €\nSrLyce: iguala 0.03 €\nRiskAllinkali: se retira \n*** FLOP *** [Qs 7s 4c]\nSrLyce: pasa \nacavada: apuesta 0.02 €\nkcg_rm: iguala 0.02 €\nSrLyce: iguala 0.02 €\n*** TURN *** [Qs 7s 4c] [Tc]\nSrLyce: pasa \nacavada: apuesta 0.02 €\nkcg_rm: sube 0.08 € a 0.10 €\nSrLyce: se retira \nacavada: se retira \nLa apuesta no igualada (0.08 €) ha sido devuelta a kcg_rm\nkcg_rm se lleva 0.23 € del bote \nkcg_rm: no muestra su mano \n*** RESUMEN ***\nBote total 0.24 € | Comisión 0.01 € \nComunitarias [Qs 7s 4c Tc]\nAsiento 1: davinci1962 se retiró antes del Flop (no apostó)\nAsiento 2: BuXHexter se retiró antes del Flop (no apostó)\nAsiento 3: kcg_rm (botón) recaudó (0.23 €)\nAsiento 4: SrLyce (ciega pequeña) se retiró en el Turn\nAsiento 5: RiskAllinkali (ciega grande) se retiró antes del Flop\nAsiento 6: acavada se retiró en el Turn"
}