{
  "hand_id": "257150103018",
  "date": "30-07-2025 23:18:30",
  "table": "Gilgamesh",
  "game_type": "holdem",
  "hero": "SrLyce",
  "hero_position": "",
  "hero_cards": [
    "Js",
    "3s"
  ],
  "stacks": {
    "riverrrrrrmagic": 128.5,
    "SrLyce": 96.0,
    "Jumby34": 101.5,
    "xapkk": 100.0,
    "samaritano34": 92.5,
    "Fretzo67500": 119.0
  },
  "actions": {
    "preflop": [
      "Asiento 1: riverrrrrrmagic (2.57 € en fichas)",
      "Asiento 2: SrLyce (1.92 € en fichas)",
      "Asiento 3: Jumby34 (2.03 € en fichas)",
      "Asiento 4: xapkk (2 € en fichas)",
      "Asiento 5: samaritano34 (1.85 € en fichas)",
      "Asiento 6: Fretzo67500 (2.38 € en fichas)",
      "xapkk: pone la ciega pequeña 0.01 €",
      "samaritano34: pone la ciega grande 0.02 €",
      "Fretzo67500: iguala 0.02 €",
      "riverrrrrrmagic: iguala 0.02 €",
      "SrLyce: se retira",
      "Jumby34: se retira",
      "xapkk: se retira",
      "samaritano34: sube 0.08 € a 0.10 €",
      "Fretzo67500: se retira",
      "riverrrrrrmagic: se retira",
      "samaritano34: no muestra su mano",
      "Asiento 1: riverrrrrrmagic se retiró antes del Flop",
      "Asiento 2: SrLyce se retiró antes del Flop (no apostó)",
      "Asiento 3: Jumby34 (botón) se retiró antes del Flop (no apostó)",
      "Asiento 4: xapkk (ciega pequeña) se retiró antes del Flop",
      "Asiento 5: samaritano34 (ciega grande) recaudó (0.07 €)",
      "Asiento 6: Fretzo67500 se retiró antes del Flop"
    ],
    "flop": [],
    "turn": [],
    "river": []
  },
  "board": [],
  "winner": "samaritano34",
  "win_amount": 3.5,
  "sb": 0.01,
  "bb": 0.02,
  "rake": 0.0,
  "raw_text": "Mano n.º 257150103018 de PokerStars:  Hold'em No Limit (0.01 €/0.02 € EUR) - 30-07-2025 23:18:30 CET [30-07-2025 17:18:30 ET]\nMesa \"Gilgamesh\" 6-max El asiento n.º 3 es el botón\nAsiento 1: riverrrrrrmagic (2.57 € en fichas) \nAsiento 2: SrLyce (1.92 € en fichas) \nAsiento 3: Jumby34 (2.03 € en fichas) \nAsiento 4: xapkk (2 € en fichas) \nAsiento 5: samaritano34 (1.85 € en fichas) \nAsiento 6: Fretzo67500 (2.38 € en fichas) \nxapkk: pone la ciega pequeña 0.01 €\nsamaritano34: pone la ciega grande 0.02 €\n*** CARTAS DE MANO ***\nRepartidas a SrLyce [Js 3s]\nFretzo67500: iguala 0.02 €\nriverrrrrrmagic: iguala 0.02 €\nSrLyce: se retira \nJumby34: se retira \nxapkk: se retira \nsamaritano34: sube 0.08 € a 0.10 €\nFretzo67500: se retira \nriverrrrrrmagic: se retira \nLa apuesta no igualada (0.08 €) ha sido devuelta a samaritano34\nsamaritano34 se lleva 0.07 € del bote \nsamaritano34: no muestra su mano \n*** RESUMEN ***\nBote total 0.07 € | Comisión 0 € \nAsiento 1: riverrrrrrmagic se retiró antes del Flop\nAsiento 2: SrLyce se retiró antes del Flop (no apostó)\nAsiento 3: Jumby34 (botón) se retiró antes del Flop (no apostó)\nAsiento 4: xapkk (ciega pequeña) se retiró antes del Flop\nAsiento 5: samaritano34 (ciega grande) recaudó (0.07 €)\nAsiento 6: Fretzo67500 se retiró antes del Flop"
}