{
  "hand_id": "257238323747",
  "date": "06-08-2025 18:47:52",
  "table": "Herculina II",
  "game_type": "holdem",
  "hero": "SrLyce",
  "hero_position": "",
  "hero_cards": [
    "Th",
    "3d"
  ],
  "stacks": {
    "koldipk": 73.0,
    "David98X": 109.5,
    "JJer11": 196.5,
    "SrLyce": 93.0,
    "El Calvo 65": 226.5,
    "ScarvBlack": 100.0
  },
  "actions": {
    "preflop": [
      "Asiento 1: koldipk (1.46 € en fichas)",
      "Asiento 2: David98X (2.19 € en fichas)",
      "Asiento 3: JJer11 (3.93 € en fichas)",
      "Asiento 4: SrLyce (1.86 € en fichas)",
      "Asiento 5: El Calvo 65 (4.53 € en fichas)",
      "Asiento 6: ScarvBlack (2 € en fichas)",
      "El Calvo 65: pone la ciega pequeña 0.01 €",
      "ScarvBlack: pone la ciega grande 0.02 €",
      "koldipk: sube 0.09 € a 0.11 €",
      "David98X: se retira",
      "JJer11: se retira",
      "SrLyce: se retira",
      "El Calvo 65: se retira",
      "ScarvBlack: se retira",
      "Asiento 1: koldipk recaudó (0.05 €)",
      "Asiento 2: David98X se retiró antes del Flop (no apostó)",
      "Asiento 3: JJer11 se retiró antes del Flop (no apostó)",
      "Asiento 4: SrLyce (botón) se retiró antes del Flop (no apostó)",
      "Asiento 5: El Calvo 65 (ciega pequeña) se retiró antes del Flop",
      "Asiento 6: ScarvBlack (ciega grande) se retiró antes del Flop"
    ],
    "flop": [],
    "turn": [],
    "river": []
  },
  "board": [],
  "winner": "koldipk",
  "win_amount": 2.5,
  "sb": 0.01,
  "bb": 0.02,
  "rake": 0.0,
  "raw_text": "Mano n.º 257238323747 de PokerStars:  Hold'em No Limit (0.01 €/0.02 € EUR) - 06-08-2025 18:47:52 CET [06-08-2025 12:47:52 ET]\nMesa \"Herculina II\" 6-max El asiento n.º 4 es el botón\nAsiento 1: koldipk (1.46 € en fichas) \nAsiento 2: David98X (2.19 € en fichas) \nAsiento 3: JJer11 (3.93 € en fichas) \nAsiento 4: SrLyce (1.86 € en fichas) \nAsiento 5: El Calvo 65 (4.53 € en fichas) \nAsiento 6: ScarvBlack (2 € en fichas) \nEl Calvo 65: pone la ciega pequeña 0.01 €\nScarvBlack: pone la ciega grande 0.02 €\n*** CARTAS DE MANO ***\nRepartidas a SrLyce [Th 3d]\nkoldipk: sube 0.09 € a 0.11 €\nDavid98X: se retira \nJJer11: se retira \nSrLyce: se retira \nEl Calvo 65: se retira \nScarvBlack: se retira \nLa apuesta no igualada (0.09 €) ha sido devuelta a koldipk\nkoldipk se lleva 0.05 € del bote \n*** RESUMEN ***\nBote total 0.05 € | Comisión 0 € \nAsiento 1: koldipk recaudó (0.05 €)\nAsiento 2: David98X se retiró antes del Flop (no apostó)\nAsiento 3: JJer11 se retiró antes del Flop (no apostó)\nAsiento 4: SrLyce (botón) se retiró antes del Flop (no apostó)\nAsiento 5: El Calvo 65 (ciega pequeña) se retiró antes del Flop\nAsiento 6: ScarvBlack (ciega grande) se retiró antes del Flop"
}