{
  "hand_id": "257238001355",
  "date": "06-08-2025 18:19:14",
  "table": "Euneus III",
  "game_type": "holdem",
  "hero": "SrLyce",
  "hero_position": "",
  "hero_cards": [
    "6h",
    "4c"
  ],
  "stacks": {
    "christgear": 102.5,
    "Il_BM00": 119.5,
    "djrojas9": 134.0,
    "lol-in 2000": 97.5,
    "SrLyce": 135.5,
    "kcg_rm": 107.0
  },
  "actions": {
    "preflop": [
      "Asiento 1: christgear (2.05 € en fichas)",
      "Asiento 2: Il_BM00 (2.39 € en fichas)",
      "Asiento 3: djrojas9 (2.68 € en fichas)",
      "Asiento 4: lol-in 2000 (1.95 € en fichas)",
      "Asiento 5: SrLyce (2.71 € en fichas)",
      "Asiento 6: kcg_rm (2.14 € en fichas)",
      "djrojas9: pone la ciega pequeña 0.01 €",
      "lol-in 2000: pone la ciega grande 0.02 €",
      "SrLyce: se retira",
      "kcg_rm: se retira",
      "christgear: sube 0.04 € a 0.06 €",
      "Il_BM00: se retira",
      "djrojas9: iguala 0.05 €",
      "lol-in 2000: se retira"
    ],
    "flop": [
      "djrojas9: pasa",
      "christgear: pasa"
    ],
    "turn": [
      "djrojas9: apuesta 0.07 €",
      "christgear: iguala 0.07 €"
    ],
    "river": [
      "djrojas9: apuesta 0.13 €",
      "christgear: se retira",
      "djrojas9: no muestra su mano",
      "Asiento 1: christgear se retiró en el River",
      "Asiento 2: Il_BM00 (botón) se retiró antes del Flop (no apostó)",
      "Asiento 3: djrojas9 (ciega pequeña) recaudó (0.26 €)",
      "Asiento 4: lol-in 2000 (ciega grande) se retiró antes del Flop",
      "Asiento 5: SrLyce se retiró antes del Flop (no apostó)",
      "Asiento 6: kcg_rm se retiró antes del Flop (no apostó)"
    ]
  },
  "board": [
    "9h",
    "3s",
    "4d",
    "4s",
    "8d"
  ],
  "winner": "djrojas9",
  "win_amount": 13.0,
  "sb": 0.01,
  "bb": 0.02,
  "rake": 1.0,
  "raw_text": "Mano n.º 257238001355 de PokerStars:  Hold'em No Limit (0.01 €/0.02 € EUR) - 06-08-2025 18:19:14 CET [06-08-2025 12:19:14 ET]\nMesa \"Euneus III\" 6-max El asiento n.º 2 es el botón\nAsiento 1: christgear (2.05 € en fichas) \nAsiento 2: Il_BM00 (2.39 € en fichas) \nAsiento 3: djrojas9 (2.68 € en fichas) \nAsiento 4: lol-in 2000 (1.95 € en fichas) \nAsiento 5: SrLyce (2.71 € en fichas) \nAsiento 6: kcg_rm (2.14 € en fichas) \ndjrojas9: pone la ciega pequeña 0.01 €\nlol-in 2000: pone la ciega grande 0.02 €\n*** CARTAS DE MANO ***\nRepartidas a SrLyce [6h 4c]\nSrLyce: se retira \nkcg_rm: se retira \nchristgear: sube 0.04 € a 0.06 €\nIl_BM00: se retira \ndjrojas9: iguala 0.05 €\nlol-in 2000: se retira \n*** FLOP *** [9h 3s 4d]\ndjrojas9: pasa \nchristgear: pasa \n*** TURN *** [9h 3s 4d] [4s]\ndjrojas9: apuesta 0.07 €\nchristgear: iguala 0.07 €\n*** RIVER *** [9h 3s 4d 4s] [8d]\ndjrojas9: apuesta 0.13 €\nchristgear: se retira \nLa apuesta no igualada (0.13 €) ha sido devuelta a djrojas9\ndjrojas9 se lleva 0.26 € del bote \ndjrojas9: no muestra su mano \n*** RESUMEN ***\nBote total 0.28 € | Comisión 0.02 € \nComunitarias [9h 3s 4d 4s 8d]\nAsiento 1: christgear se retiró en el River\nAsiento 2: Il_BM00 (botón) se retiró antes del Flop (no apostó)\nAsiento 3: djrojas9 (ciega pequeña) recaudó (0.26 €)\nAsiento 4: lol-in 2000 (ciega grande) se retiró antes del Flop\nAsiento 5: SrLyce se retiró antes del Flop (no apostó)\nAsiento 6: kcg_rm se retiró antes del Flop (no apostó)"
}