{
  "hand_id": "257238369838",
  "date": "06-08-2025 18:51:54",
  "table": "Alruccabah II",
  "game_type": "holdem",
  "hero": "SrLyce",
  "hero_position": "",
  "hero_cards": [
    "7h",
    "2c"
  ],
  "stacks": {
    "SrLyce": 100.0,
    "Davdgoni": 286.0,
    "tatinette35": 100.0,
    "Nicanor Cast": 54.5,
    "rayao32": 48.0
  },
  "actions": {
    "preflop": [
      "Asiento 1: SrLyce (2 € en fichas)",
      "Asiento 2: Davdgoni (5.72 € en fichas)",
      "Asiento 3: tatinette35 (2 € en fichas)",
      "Asiento 4: serviettski(fr) (2 € en fichas)",
      "Asiento 5: Nicanor Cast (1.09 € en fichas)",
      "Asiento 6: rayao32 (0.96 € en fichas)",
      "Nicanor Cast: pone la ciega pequeña 0.01 €",
      "rayao32: pone la ciega grande 0.02 €",
      "SrLyce: se retira",
      "Davdgoni: se retira",
      "tatinette35: se retira",
      "serviettski(fr): sube 0.04 € a 0.06 €",
      "Nicanor Cast: se retira",
      "rayao32: se retira",
      "serviettski(fr): no muestra su mano",
      "Asiento 1: SrLyce se retiró antes del Flop (no apostó)",
      "Asiento 2: Davdgoni se retiró antes del Flop (no apostó)",
      "Asiento 3: tatinette35 se retiró antes del Flop (no apostó)",
      "Asiento 4: serviettski(fr) (botón) recaudó (0.05 €)",
      "Asiento 5: Nicanor Cast (ciega pequeña) se retiró antes del Flop",
      "Asiento 6: rayao32 (ciega grande) se retiró antes del Flop"
    ],
    "flop": [],
    "turn": [],
    "river": []
  },
  "board": [],
  "winner": "serviettski(fr)",
  "win_amount": 2.5,
  "sb": 0.01,
  "bb": 0.02,
  "rake": 0.0,
  "raw_text": "Mano n.º 257238369838 de PokerStars:  Hold'em No Limit (0.01 €/0.02 € EUR) - 06-08-2025 18:51:54 CET [06-08-2025 12:51:54 ET]\nMesa \"Alruccabah II\" 6-max El asiento n.º 4 es el botón\nAsiento 1: SrLyce (2 € en fichas) \nAsiento 2: Davdgoni (5.72 € en fichas) \nAsiento 3: tatinette35 (2 € en fichas) \nAsiento 4: serviettski(fr) (2 € en fichas) \nAsiento 5: Nicanor Cast (1.09 € en fichas) \nAsiento 6: rayao32 (0.96 € en fichas) \nNicanor Cast: pone la ciega pequeña 0.01 €\nrayao32: pone la ciega grande 0.02 €\n*** CARTAS DE MANO ***\nRepartidas a SrLyce [7h 2c]\nSrLyce: se retira \nDavdgoni: se retira \ntatinette35: se retira \ntatinette35 deja la mesa\nserviettski(fr): sube 0.04 € a 0.06 €\nNicanor Cast: se retira \nrayao32: se retira \nLa apuesta no igualada (0.04 €) ha sido devuelta a serviettski(fr)\nserviettski(fr) se lleva 0.05 € del bote \nserviettski(fr): no muestra su mano \n*** RESUMEN ***\nBote total 0.05 € | Comisión 0 € \nAsiento 1: SrLyce se retiró antes del Flop (no apostó)\nAsiento 2: Davdgoni se retiró antes del Flop (no apostó)\nAsiento 3: tatinette35 se retiró antes del Flop (no apostó)\nAsiento 4: serviettski(fr) (botón) recaudó (0.05 €)\nAsiento 5: Nicanor Cast (ciega pequeña) se retiró antes del Flop\nAsiento 6: rayao32 (ciega grande) se retiró antes del Flop"
}