{
  "hand_id": "257237899729",
  "date": "06-08-2025 18:10:03",
  "table": "Atreus",
  "game_type": "holdem",
  "hero": "SrLyce",
  "hero_position": "",
  "hero_cards": [
    "3c",
    "2c"
  ],
  "stacks": {
    "PrendsCa": 108.0,
    "NRules82": 85.5,
    "JENOFONTE73": 116.5,
    "Fharock": 102.0,
    "SrLyce": 98.5,
    "FishamanReggae": 39.0
  },
  "actions": {
    "preflop": [
      "Asiento 1: PrendsCa (2.16 € en fichas)",
      "Asiento 2: NRules82 (1.71 € en fichas)",
      "Asiento 3: JENOFONTE73 (2.33 € en fichas)",
      "Asiento 4: Fharock (2.04 € en fichas)",
      "Asiento 5: SrLyce (1.97 € en fichas)",
      "Asiento 6: FishamanReggae (0.78 € en fichas)",
      "Fharock: pone la ciega pequeña 0.01 €",
      "SrLyce: pone la ciega grande 0.02 €",
      "FishamanReggae: iguala 0.02 €",
      "PrendsCa: se retira",
      "NRules82: se retira",
      "JENOFONTE73: sube 0.03 € a 0.05 €",
      "Fharock: se retira",
      "SrLyce: iguala 0.03 €",
      "FishamanReggae: iguala 0.03 €"
    ],
    "flop": [
      "SrLyce: pasa",
      "FishamanReggae: apuesta 0.02 €",
      "JENOFONTE73: iguala 0.02 €",
      "SrLyce: iguala 0.02 €"
    ],
    "turn": [
      "SrLyce: pasa",
      "FishamanReggae: apuesta 0.02 €",
      "JENOFONTE73: sube 0.13 € a 0.15 €",
      "SrLyce: se retira",
      "FishamanReggae: se retira [2d]",
      "JENOFONTE73: no muestra su mano",
      "Asiento 1: PrendsCa se retiró antes del Flop (no apostó)",
      "Asiento 2: NRules82 se retiró antes del Flop (no apostó)",
      "Asiento 3: JENOFONTE73 (botón) recaudó (0.24 €)",
      "Asiento 4: Fharock (ciega pequeña) se retiró antes del Flop",
      "Asiento 5: SrLyce (ciega grande) se retiró en el Turn",
      "Asiento 6: FishamanReggae se retiró en el Turn"
    ],
    "river": []
  },
  "board": [
    "2h",
    "Td",
    "Tc",
    "8h"
  ],
  "winner": "JENOFONTE73",
  "win_amount": 12.0,
  "sb": 0.01,
  "bb": 0.02,
  "rake": 1.0,
  "raw_text": "Mano n.º 257237899729 de PokerStars:  Hold'em No Limit (0.01 €/0.02 € EUR) - 06-08-2025 18:10:03 CET [06-08-2025 12:10:03 ET]\nMesa \"Atreus\" 6-max El asiento n.º 3 es el botón\nAsiento 1: PrendsCa (2.16 € en fichas) \nAsiento 2: NRules82 (1.71 € en fichas) \nAsiento 3: JENOFONTE73 (2.33 € en fichas) \nAsiento 4: Fharock (2.04 € en fichas) \nAsiento 5: SrLyce (1.97 € en fichas) \nAsiento 6: FishamanReggae (0.78 € en fichas) \nFharock: pone la ciega pequeña 0.01 €\nSrLyce: pone la ciega grande 0.02 €\n*** CARTAS DE MANO ***\nRepartidas a SrLyce [3c 2c]\nFishamanReggae: iguala 0.02 €\nPrendsCa: se retira \nNRules82: se retira \nJENOFONTE73: sube 0.03 € a 0.05 €\nFharock: se retira \nSrLyce: iguala 0.03 €\nFishamanReggae: iguala 0.03 €\n*** FLOP *** [2h Td Tc]\nSrLyce: pasa \nFishamanReggae: apuesta 0.02 €\nJENOFONTE73: iguala 0.02 €\nSrLyce: iguala 0.02 €\n*** TURN *** [2h Td Tc] [8h]\nSrLyce: pasa \nFishamanReggae: apuesta 0.02 €\nJENOFONTE73: sube 0.13 € a 0.15 €\nSrLyce: se retira \nFishamanReggae: se retira [2d]\nLa apuesta no igualada (0.13 €) ha sido devuelta a JENOFONTE73\nJENOFONTE73 se lleva 0.24 € del bote \nJENOFONTE73: no muestra su mano \n*** RESUMEN ***\nBote total 0.26 € | Comisión 0.02 € \nComunitarias [2h Td Tc 8h]\nAsiento 1: PrendsCa se retiró antes del Flop (no apostó)\nAsiento 2: NRules82 se retiró antes del Flop (no apostó)\nAsiento 3: JENOFONTE73 (botón) recaudó (0.24 €)\nAsiento 4: Fharock (ciega pequeña) se retiró antes del Flop\nAsiento 5: SrLyce (ciega grande) se retiró en el Turn\nAsiento 6: FishamanReggae se retiró en el Turn"
}