{
  "hand_id": "257238714110",
  "date": "06-08-2025 19:22:56",
  "table": "Herculina II",
  "game_type": "holdem",
  "hero": "SrLyce",
  "hero_position": "",
  "hero_cards": [
    "7s",
    "5s"
  ],
  "stacks": {
    "Alceo27": 121.0,
    "David98X": 154.0,
    "JJer11": 192.0,
    "SrLyce": 137.0,
    "Macklemore0": 100.0,
    "ScarvBlack": 100.0
  },
  "actions": {
    "preflop": [
      "Asiento 1: Alceo27 (2.42 € en fichas)",
      "Asiento 2: David98X (3.08 € en fichas)",
      "Asiento 3: JJer11 (3.84 € en fichas)",
      "Asiento 4: SrLyce (2.74 € en fichas)",
      "Asiento 5: Macklemore0 (2 € en fichas)",
      "Asiento 6: ScarvBlack (2 € en fichas)",
      "Alceo27: pone la ciega pequeña 0.01 €",
      "David98X: pone la ciega grande 0.02 €",
      "JJer11: se retira",
      "SrLyce: sube 0.03 € a 0.05 €",
      "Macklemore0: sube 0.11 € a 0.16 €",
      "ScarvBlack: se retira",
      "Alceo27: se retira",
      "David98X: se retira",
      "SrLyce: se retira",
      "Macklemore0: no muestra su mano",
      "Asiento 1: Alceo27 (ciega pequeña) se retiró antes del Flop",
      "Asiento 2: David98X (ciega grande) se retiró antes del Flop",
      "Asiento 3: JJer11 se retiró antes del Flop (no apostó)",
      "Asiento 4: SrLyce se retiró antes del Flop",
      "Asiento 5: Macklemore0 recaudó (0.13 €)",
      "Asiento 6: ScarvBlack (botón) se retiró antes del Flop (no apostó)"
    ],
    "flop": [],
    "turn": [],
    "river": []
  },
  "board": [],
  "winner": "Macklemore0",
  "win_amount": 6.5,
  "sb": 0.01,
  "bb": 0.02,
  "rake": 0.0,
  "raw_text": "Mano n.º 257238714110 de PokerStars:  Hold'em No Limit (0.01 €/0.02 € EUR) - 06-08-2025 19:22:56 CET [06-08-2025 13:22:56 ET]\nMesa \"Herculina II\" 6-max El asiento n.º 6 es el botón\nAsiento 1: Alceo27 (2.42 € en fichas) \nAsiento 2: David98X (3.08 € en fichas) \nAsiento 3: JJer11 (3.84 € en fichas) \nAsiento 4: SrLyce (2.74 € en fichas) \nAsiento 5: Macklemore0 (2 € en fichas) \nAsiento 6: ScarvBlack (2 € en fichas) \nAlceo27: pone la ciega pequeña 0.01 €\nDavid98X: pone la ciega grande 0.02 €\n*** CARTAS DE MANO ***\nRepartidas a SrLyce [7s 5s]\nJJer11: se retira \nSrLyce: sube 0.03 € a 0.05 €\nMacklemore0: sube 0.11 € a 0.16 €\nScarvBlack: se retira \nAlceo27: se retira \nDavid98X: se retira \nSrLyce: se retira \nLa apuesta no igualada (0.11 €) ha sido devuelta a Macklemore0\nMacklemore0 se lleva 0.13 € del bote \nMacklemore0: no muestra su mano \n*** RESUMEN ***\nBote total 0.13 € | Comisión 0 € \nAsiento 1: Alceo27 (ciega pequeña) se retiró antes del Flop\nAsiento 2: David98X (ciega grande) se retiró antes del Flop\nAsiento 3: JJer11 se retiró antes del Flop (no apostó)\nAsiento 4: SrLyce se retiró antes del Flop\nAsiento 5: Macklemore0 recaudó (0.13 €)\nAsiento 6: ScarvBlack (botón) se retiró antes del Flop (no apostó)"
}