{
  "hand_id": "257148945517",
  "date": "30-07-2025 21:55:09",
  "table": "Esclangona",
  "game_type": "holdem",
  "hero": "SrLyce",
  "hero_position": "",
  "hero_cards": [
    "3c",
    "4s"
  ],
  "stacks": {
    "Zorgue1080": 85.0,
    "SrLyce": 157.5,
    "NoahBolete": 99.5,
    "Davdgoni": 103.0,
    "DiaZzZ1": 105.5,
    "berlcht403": 40.5
  },
  "actions": {
    "preflop": [
      "Asiento 1: Zorgue1080 (1.70 € en fichas)",
      "Asiento 2: SrLyce (3.15 € en fichas)",
      "Asiento 3: NoahBolete (1.99 € en fichas)",
      "Asiento 4: Davdgoni (2.06 € en fichas)",
      "Asiento 5: DiaZzZ1 (2.11 € en fichas)",
      "Asiento 6: berlcht403 (0.81 € en fichas)",
      "NoahBolete: pone la ciega pequeña 0.01 €",
      "Davdgoni: pone la ciega grande 0.02 €",
      "DiaZzZ1: se retira",
      "berlcht403: iguala 0.02 €",
      "Zorgue1080: se retira",
      "SrLyce: se retira",
      "NoahBolete: iguala 0.01 €",
      "Davdgoni: sube 0.08 € a 0.10 €",
      "berlcht403: se retira",
      "NoahBolete: se retira",
      "Davdgoni: no muestra su mano",
      "Asiento 1: Zorgue1080 se retiró antes del Flop (no apostó)",
      "Asiento 2: SrLyce (botón) se retiró antes del Flop (no apostó)",
      "Asiento 3: NoahBolete (ciega pequeña) se retiró antes del Flop",
      "Asiento 4: Davdgoni (ciega grande) recaudó (0.06 €)",
      "Asiento 5: DiaZzZ1 se retiró antes del Flop (no apostó)",
      "Asiento 6: berlcht403 se retiró antes del Flop"
    ],
    "flop": [],
    "turn": [],
    "river": []
  },
  "board": [],
  "winner": "Davdgoni",
  "win_amount": 3.0,
  "sb": 0.01,
  "bb": 0.02,
  "rake": 0.0,
  "raw_text": "Mano n.º 257148945517 de PokerStars:  Hold'em No Limit (0.01 €/0.02 € EUR) - 30-07-2025 21:55:09 CET [30-07-2025 15:55:09 ET]\nMesa \"Esclangona\" 6-max El asiento n.º 2 es el botón\nAsiento 1: Zorgue1080 (1.70 € en fichas) \nAsiento 2: SrLyce (3.15 € en fichas) \nAsiento 3: NoahBolete (1.99 € en fichas) \nAsiento 4: Davdgoni (2.06 € en fichas) \nAsiento 5: DiaZzZ1 (2.11 € en fichas) \nAsiento 6: berlcht403 (0.81 € en fichas) \nNoahBolete: pone la ciega pequeña 0.01 €\nDavdgoni: pone la ciega grande 0.02 €\n*** CARTAS DE MANO ***\nRepartidas a SrLyce [3c 4s]\nDiaZzZ1: se retira \nberlcht403: iguala 0.02 €\nZorgue1080: se retira \nSrLyce: se retira \nNoahBolete: iguala 0.01 €\nDavdgoni: sube 0.08 € a 0.10 €\nberlcht403: se retira \nNoahBolete: se retira \nLa apuesta no igualada (0.08 €) ha sido devuelta a Davdgoni\nDavdgoni se lleva 0.06 € del bote \nDavdgoni: no muestra su mano \n*** RESUMEN ***\nBote total 0.06 € | Comisión 0 € \nAsiento 1: Zorgue1080 se retiró antes del Flop (no apostó)\nAsiento 2: SrLyce (botón) se retiró antes del Flop (no apostó)\nAsiento 3: NoahBolete (ciega pequeña) se retiró antes del Flop\nAsiento 4: Davdgoni (ciega grande) recaudó (0.06 €)\nAsiento 5: DiaZzZ1 se retiró antes del Flop (no apostó)\nAsiento 6: berlcht403 se retiró antes del Flop"
}