{
  "hand_id": "257148935927",
  "date": "30-07-2025 21:54:28",
  "table": "Sirona",
  "game_type": "holdem",
  "hero": "SrLyce",
  "hero_position": "",
  "hero_cards": [
    "Jc",
    "Th"
  ],
  "stacks": {
    "SrLyce": 113.0,
    "lecontrebandier": 98.0,
    "christoph363": 206.5,
    "oliverdu70": 141.0,
    "NachoAlmirante": 104.5,
    "Dakoo44": 71.0
  },
  "actions": {
    "preflop": [
      "Asiento 1: SrLyce (2.26 € en fichas)",
      "Asiento 2: lecontrebandier (1.96 € en fichas)",
      "Asiento 3: christoph363 (4.13 € en fichas)",
      "Asiento 4: oliverdu70 (2.82 € en fichas)",
      "Asiento 5: NachoAlmirante (2.09 € en fichas)",
      "Asiento 6: Dakoo44 (1.42 € en fichas)",
      "Dakoo44: pone la ciega pequeña 0.01 €",
      "SrLyce: pone la ciega grande 0.02 €",
      "lecontrebandier: se retira",
      "christoph363: se retira",
      "oliverdu70: se retira",
      "NachoAlmirante: sube 0.04 € a 0.06 €",
      "Dakoo44: se retira",
      "SrLyce: iguala 0.04 €"
    ],
    "flop": [
      "SrLyce: pasa",
      "NachoAlmirante: pasa"
    ],
    "turn": [
      "SrLyce: pasa",
      "NachoAlmirante: pasa"
    ],
    "river": [
      "SrLyce: pasa",
      "NachoAlmirante: apuesta 0.08 €",
      "SrLyce: se retira",
      "NachoAlmirante: no muestra su mano",
      "Asiento 1: SrLyce (ciega grande) se retiró en el River",
      "Asiento 2: lecontrebandier se retiró antes del Flop (no apostó)",
      "Asiento 3: christoph363 se retiró antes del Flop (no apostó)",
      "Asiento 4: oliverdu70 se retiró antes del Flop (no apostó)",
      "Asiento 5: NachoAlmirante (botón) recaudó (0.12 €)",
      "Asiento 6: Dakoo44 (ciega pequeña) se retiró antes del Flop"
    ]
  },
  "board": [
    "9d",
    "As",
    "6d",
    "5s",
    "9c"
  ],
  "winner": "NachoAlmirante",
  "win_amount": 6.0,
  "sb": 0.01,
  "bb": 0.02,
  "rake": 0.5,
  "raw_text": "Mano n.º 257148935927 de PokerStars:  Hold'em No Limit (0.01 €/0.02 € EUR) - 30-07-2025 21:54:28 CET [30-07-2025 15:54:28 ET]\nMesa \"Sirona\" 6-max El asiento n.º 5 es el botón\nAsiento 1: SrLyce (2.26 € en fichas) \nAsiento 2: lecontrebandier (1.96 € en fichas) \nAsiento 3: christoph363 (4.13 € en fichas) \nAsiento 4: oliverdu70 (2.82 € en fichas) \nAsiento 5: NachoAlmirante (2.09 € en fichas) \nAsiento 6: Dakoo44 (1.42 € en fichas) \nDakoo44: pone la ciega pequeña 0.01 €\nSrLyce: pone la ciega grande 0.02 €\n*** CARTAS DE MANO ***\nRepartidas a SrLyce [Jc Th]\nlecontrebandier: se retira \nchristoph363: se retira \noliverdu70: se retira \nNachoAlmirante: sube 0.04 € a 0.06 €\nDakoo44: se retira \nSrLyce: iguala 0.04 €\n*** FLOP *** [9d As 6d]\nSrLyce: pasa \nNachoAlmirante: pasa \n*** TURN *** [9d As 6d] [5s]\nSrLyce: pasa \nNachoAlmirante: pasa \n*** RIVER *** [9d As 6d 5s] [9c]\nSrLyce: pasa \nNachoAlmirante: apuesta 0.08 €\nSrLyce: se retira \nLa apuesta no igualada (0.08 €) ha sido devuelta a NachoAlmirante\nNachoAlmirante se lleva 0.12 € del bote \nNachoAlmirante: no muestra su mano \n*** RESUMEN ***\nBote total 0.13 € | Comisión 0.01 € \nComunitarias [9d As 6d 5s 9c]\nAsiento 1: SrLyce (ciega grande) se retiró en el River\nAsiento 2: lecontrebandier se retiró antes del Flop (no apostó)\nAsiento 3: christoph363 se retiró antes del Flop (no apostó)\nAsiento 4: oliverdu70 se retiró antes del Flop (no apostó)\nAsiento 5: NachoAlmirante (botón) recaudó (0.12 €)\nAsiento 6: Dakoo44 (ciega pequeña) se retiró antes del Flop"
}