{
  "hand_id": "257148957573",
  "date": "30-07-2025 21:56:25",
  "table": "Sirona",
  "game_type": "holdem",
  "hero": "SrLyce",
  "hero_position": "",
  "hero_cards": [
    "5s",
    "3s"
  ],
  "stacks": {
    "SrLyce": 109.5,
    "lecontrebandier": 96.5,
    "christoph363": 209.5,
    "oliverdu70": 137.0,
    "NachoAlmirante": 110.0,
    "Dakoo44": 70.5
  },
  "actions": {
    "preflop": [
      "Asiento 1: SrLyce (2.19 € en fichas)",
      "Asiento 2: lecontrebandier (1.93 € en fichas)",
      "Asiento 3: christoph363 (4.19 € en fichas)",
      "Asiento 4: oliverdu70 (2.74 € en fichas)",
      "Asiento 5: NachoAlmirante (2.20 € en fichas)",
      "Asiento 6: Dakoo44 (1.41 € en fichas)",
      "christoph363: pone la ciega pequeña 0.01 €",
      "oliverdu70: pone la ciega grande 0.02 €",
      "NachoAlmirante: se retira",
      "Dakoo44: se retira",
      "SrLyce: se retira",
      "lecontrebandier: se retira",
      "christoph363: se retira",
      "Asiento 1: SrLyce se retiró antes del Flop (no apostó)",
      "Asiento 2: lecontrebandier (botón) se retiró antes del Flop (no apostó)",
      "Asiento 3: christoph363 (ciega pequeña) se retiró antes del Flop",
      "Asiento 4: oliverdu70 (ciega grande) recaudó (0.02 €)",
      "Asiento 5: NachoAlmirante se retiró antes del Flop (no apostó)",
      "Asiento 6: Dakoo44 se retiró antes del Flop (no apostó)"
    ],
    "flop": [],
    "turn": [],
    "river": []
  },
  "board": [],
  "winner": "oliverdu70",
  "win_amount": 1.0,
  "sb": 0.01,
  "bb": 0.02,
  "rake": 0.0,
  "raw_text": "Mano n.º 257148957573 de PokerStars:  Hold'em No Limit (0.01 €/0.02 € EUR) - 30-07-2025 21:56:25 CET [30-07-2025 15:56:25 ET]\nMesa \"Sirona\" 6-max El asiento n.º 2 es el botón\nAsiento 1: SrLyce (2.19 € en fichas) \nAsiento 2: lecontrebandier (1.93 € en fichas) \nAsiento 3: christoph363 (4.19 € en fichas) \nAsiento 4: oliverdu70 (2.74 € en fichas) \nAsiento 5: NachoAlmirante (2.20 € en fichas) \nAsiento 6: Dakoo44 (1.41 € en fichas) \nchristoph363: pone la ciega pequeña 0.01 €\noliverdu70: pone la ciega grande 0.02 €\n*** CARTAS DE MANO ***\nRepartidas a SrLyce [5s 3s]\nNachoAlmirante: se retira \nDakoo44: se retira \nSrLyce: se retira \nlecontrebandier: se retira \nchristoph363: se retira \nLa apuesta no igualada (0.01 €) ha sido devuelta a oliverdu70\noliverdu70 se lleva 0.02 € del bote \n*** RESUMEN ***\nBote total 0.02 € | Comisión 0 € \nAsiento 1: SrLyce se retiró antes del Flop (no apostó)\nAsiento 2: lecontrebandier (botón) se retiró antes del Flop (no apostó)\nAsiento 3: christoph363 (ciega pequeña) se retiró antes del Flop\nAsiento 4: oliverdu70 (ciega grande) recaudó (0.02 €)\nAsiento 5: NachoAlmirante se retiró antes del Flop (no apostó)\nAsiento 6: Dakoo44 se retiró antes del Flop (no apostó)"
}