{
  "hand_id": "257215161750",
  "date": "04-08-2025 22:28:13",
  "table": "Aldhafera II",
  "game_type": "holdem",
  "hero": "SrLyce",
  "hero_position": "",
  "hero_cards": [
    "Jc",
    "2h"
  ],
  "stacks": {
    "wsx25": 93.5,
    "BudyXXIII": 294.0,
    "SrLyce": 97.0,
    "rhidoxxx": 66.5,
    "jte-ken": 108.5,
    "betterrrrrr": 172.0
  },
  "actions": {
    "preflop": [
      "Asiento 1: wsx25 (1.87 € en fichas)",
      "Asiento 2: BudyXXIII (5.88 € en fichas)",
      "Asiento 3: SrLyce (1.94 € en fichas)",
      "Asiento 4: rhidoxxx (1.33 € en fichas)",
      "Asiento 5: jte-ken (2.17 € en fichas)",
      "Asiento 6: betterrrrrr (3.44 € en fichas)",
      "betterrrrrr: pone la ciega pequeña 0.01 €",
      "wsx25: pone la ciega grande 0.02 €",
      "BudyXXIII: se retira",
      "SrLyce: se retira",
      "rhidoxxx: se retira",
      "jte-ken: se retira",
      "betterrrrrr: sube 0.04 € a 0.06 €",
      "wsx25: iguala 0.04 €"
    ],
    "flop": [
      "betterrrrrr: apuesta 0.04 €",
      "wsx25: iguala 0.04 €"
    ],
    "turn": [
      "betterrrrrr: apuesta 0.29 €",
      "wsx25: se retira",
      "betterrrrrr: no muestra su mano",
      "Asiento 1: wsx25 (ciega grande) se retiró en el Turn",
      "Asiento 2: BudyXXIII se retiró antes del Flop (no apostó)",
      "Asiento 3: SrLyce se retiró antes del Flop (no apostó)",
      "Asiento 4: rhidoxxx se retiró antes del Flop (no apostó)",
      "Asiento 5: jte-ken (botón) se retiró antes del Flop (no apostó)",
      "Asiento 6: betterrrrrr (ciega pequeña) recaudó (0.19 €)"
    ],
    "river": []
  },
  "board": [
    "2d",
    "8h",
    "6c",
    "Ah"
  ],
  "winner": "betterrrrrr",
  "win_amount": 9.5,
  "sb": 0.01,
  "bb": 0.02,
  "rake": 0.5,
  "raw_text": "Mano n.º 257215161750 de PokerStars:  Hold'em No Limit (0.01 €/0.02 € EUR) - 04-08-2025 22:28:13 CET [04-08-2025 16:28:13 ET]\nMesa \"Aldhafera II\" 6-max El asiento n.º 5 es el botón\nAsiento 1: wsx25 (1.87 € en fichas) \nAsiento 2: BudyXXIII (5.88 € en fichas) \nAsiento 3: SrLyce (1.94 € en fichas) \nAsiento 4: rhidoxxx (1.33 € en fichas) \nAsiento 5: jte-ken (2.17 € en fichas) \nAsiento 6: betterrrrrr (3.44 € en fichas) \nbetterrrrrr: pone la ciega pequeña 0.01 €\nwsx25: pone la ciega grande 0.02 €\n*** CARTAS DE MANO ***\nRepartidas a SrLyce [Jc 2h]\nBudyXXIII: se retira \nSrLyce: se retira \nrhidoxxx: se retira \njte-ken: se retira \nbetterrrrrr: sube 0.04 € a 0.06 €\nwsx25: iguala 0.04 €\n*** FLOP *** [2d 8h 6c]\nbetterrrrrr: apuesta 0.04 €\nwsx25: iguala 0.04 €\n*** TURN *** [2d 8h 6c] [Ah]\nbetterrrrrr: apuesta 0.29 €\nwsx25: se retira \nLa apuesta no igualada (0.29 €) ha sido devuelta a betterrrrrr\nbetterrrrrr se lleva 0.19 € del bote \nbetterrrrrr: no muestra su mano \n*** RESUMEN ***\nBote total 0.20 € | Comisión 0.01 € \nComunitarias [2d 8h 6c Ah]\nAsiento 1: wsx25 (ciega grande) se retiró en el Turn\nAsiento 2: BudyXXIII se retiró antes del Flop (no apostó)\nAsiento 3: SrLyce se retiró antes del Flop (no apostó)\nAsiento 4: rhidoxxx se retiró antes del Flop (no apostó)\nAsiento 5: jte-ken (botón) se retiró antes del Flop (no apostó)\nAsiento 6: betterrrrrr (ciega pequeña) recaudó (0.19 €)"
}