{
  "hand_id": "257168252678",
  "date": "01-08-2025 11:13:15",
  "table": "Jupiter",
  "game_type": "holdem",
  "hero": "SrLyce",
  "hero_position": "",
  "hero_cards": [
    "6s",
    "6d"
  ],
  "stacks": {
    "sifilis5": 100.0,
    "Filou203": 116.0,
    "SrLyce": 115.5,
    "LOLA19711971": 32.0,
    "dadou13mars": 225.0,
    "Alvii37": 96.0
  },
  "actions": {
    "preflop": [
      "Asiento 1: sifilis5 (2 € en fichas)",
      "Asiento 2: Filou203 (2.32 € en fichas)",
      "Asiento 3: SrLyce (2.31 € en fichas)",
      "Asiento 4: LOLA19711971 (0.64 € en fichas)",
      "Asiento 5: dadou13mars (4.50 € en fichas)",
      "Asiento 6: Alvii37 (1.92 € en fichas)",
      "SrLyce: pone la ciega pequeña 0.01 €",
      "LOLA19711971: pone la ciega grande 0.02 €",
      "dadou13mars: se retira",
      "Alvii37: se retira",
      "sifilis5: se retira",
      "Filou203: se retira",
      "SrLyce: sube 0.04 € a 0.06 €",
      "LOLA19711971: iguala 0.04 €"
    ],
    "flop": [
      "SrLyce: apuesta 0.04 €",
      "LOLA19711971: iguala 0.04 €"
    ],
    "turn": [
      "SrLyce: pasa",
      "LOLA19711971: apuesta 0.19 €",
      "SrLyce: se retira",
      "Asiento 1: sifilis5 se retiró antes del Flop (no apostó)",
      "Asiento 2: Filou203 (botón) se retiró antes del Flop (no apostó)",
      "Asiento 3: SrLyce (ciega pequeña) se retiró en el Turn",
      "Asiento 4: LOLA19711971 (ciega grande) recaudó (0.19 €)",
      "Asiento 5: dadou13mars se retiró antes del Flop (no apostó)",
      "Asiento 6: Alvii37 se retiró antes del Flop (no apostó)"
    ],
    "river": []
  },
  "board": [
    "3d",
    "2c",
    "Js",
    "Kc"
  ],
  "winner": "LOLA19711971",
  "win_amount": 9.5,
  "sb": 0.01,
  "bb": 0.02,
  "rake": 0.5,
  "raw_text": "Mano n.º 257168252678 de PokerStars:  Hold'em No Limit (0.01 €/0.02 € EUR) - 01-08-2025 11:13:15 CET [01-08-2025 5:13:15 ET]\nMesa \"Jupiter\" 6-max El asiento n.º 2 es el botón\nAsiento 1: sifilis5 (2 € en fichas) \nAsiento 2: Filou203 (2.32 € en fichas) \nAsiento 3: SrLyce (2.31 € en fichas) \nAsiento 4: LOLA19711971 (0.64 € en fichas) \nAsiento 5: dadou13mars (4.50 € en fichas) \nAsiento 6: Alvii37 (1.92 € en fichas) \nSrLyce: pone la ciega pequeña 0.01 €\nLOLA19711971: pone la ciega grande 0.02 €\n*** CARTAS DE MANO ***\nRepartidas a SrLyce [6s 6d]\ndadou13mars: se retira \nAlvii37: se retira \nsifilis5: se retira \nFilou203: se retira \nSrLyce: sube 0.04 € a 0.06 €\nLOLA19711971: iguala 0.04 €\n*** FLOP *** [3d 2c Js]\nSrLyce: apuesta 0.04 €\nLOLA19711971: iguala 0.04 €\n*** TURN *** [3d 2c Js] [Kc]\nSrLyce: pasa \nLOLA19711971: apuesta 0.19 €\nSrLyce: se retira \nLa apuesta no igualada (0.19 €) ha sido devuelta a LOLA19711971\nLOLA19711971 se lleva 0.19 € del bote \n*** RESUMEN ***\nBote total 0.20 € | Comisión 0.01 € \nComunitarias [3d 2c Js Kc]\nAsiento 1: sifilis5 se retiró antes del Flop (no apostó)\nAsiento 2: Filou203 (botón) se retiró antes del Flop (no apostó)\nAsiento 3: SrLyce (ciega pequeña) se retiró en el Turn\nAsiento 4: LOLA19711971 (ciega grande) recaudó (0.19 €)\nAsiento 5: dadou13mars se retiró antes del Flop (no apostó)\nAsiento 6: Alvii37 se retiró antes del Flop (no apostó)"
}