{
  "hand_id": "257168320398",
  "date": "01-08-2025 11:26:12",
  "table": "Atlas",
  "game_type": "holdem",
  "hero": "SrLyce",
  "hero_position": "",
  "hero_cards": [
    "Th",
    "8s"
  ],
  "stacks": {
    "SrLyce": 102.5,
    "Fharock": 87.5,
    "ecuinas": 96.5,
    "LxckxStrxkx": 105.0,
    "erCampos23": 26.5,
    "Akourdideh": 119.0
  },
  "actions": {
    "preflop": [
      "Asiento 1: SrLyce (2.05 € en fichas)",
      "Asiento 2: Fharock (1.75 € en fichas)",
      "Asiento 3: ecuinas (1.93 € en fichas)",
      "Asiento 4: LxckxStrxkx (2.10 € en fichas)",
      "Asiento 5: erCampos23 (0.53 € en fichas)",
      "Asiento 6: Akourdideh (2.38 € en fichas)",
      "ecuinas: pone la ciega pequeña 0.01 €",
      "LxckxStrxkx: pone la ciega grande 0.02 €",
      "erCampos23: iguala 0.02 €",
      "Akourdideh: se retira",
      "SrLyce: iguala 0.02 €",
      "Fharock: iguala 0.02 €",
      "ecuinas: se retira",
      "LxckxStrxkx: pasa"
    ],
    "flop": [
      "LxckxStrxkx: pasa",
      "erCampos23: apuesta 0.04 €",
      "SrLyce: se retira",
      "Fharock: iguala 0.04 €",
      "LxckxStrxkx: se retira"
    ],
    "turn": [
      "erCampos23: apuesta 0.08 €",
      "Fharock: iguala 0.08 €"
    ],
    "river": [
      "erCampos23: pasa",
      "Fharock: apuesta 0.16 €",
      "erCampos23: iguala 0.16 €",
      "Fharock: muestra [Tc Ah] (doble pareja, ases y seises)",
      "erCampos23: descarta su mano sin mostrar",
      "Asiento 1: SrLyce se retiró en el Flop",
      "Asiento 2: Fharock (botón) muestra [Tc Ah] y ganó (0.61 €) con doble pareja, ases y seises",
      "Asiento 3: ecuinas (ciega pequeña) se retiró antes del Flop",
      "Asiento 4: LxckxStrxkx (ciega grande) se retiró en el Flop",
      "Asiento 5: erCampos23 descartó sin mostrar [Qc Qh]",
      "Asiento 6: Akourdideh se retiró antes del Flop (no apostó)"
    ]
  },
  "board": [
    "6d",
    "3c",
    "As",
    "2h",
    "6s"
  ],
  "winner": "Fharock",
  "win_amount": 30.5,
  "sb": 0.01,
  "bb": 0.02,
  "rake": 2.0,
  "raw_text": "Mano n.º 257168320398 de PokerStars:  Hold'em No Limit (0.01 €/0.02 € EUR) - 01-08-2025 11:26:12 CET [01-08-2025 5:26:12 ET]\nMesa \"Atlas\" 6-max El asiento n.º 2 es el botón\nAsiento 1: SrLyce (2.05 € en fichas) \nAsiento 2: Fharock (1.75 € en fichas) \nAsiento 3: ecuinas (1.93 € en fichas) \nAsiento 4: LxckxStrxkx (2.10 € en fichas) \nAsiento 5: erCampos23 (0.53 € en fichas) \nAsiento 6: Akourdideh (2.38 € en fichas) \necuinas: pone la ciega pequeña 0.01 €\nLxckxStrxkx: pone la ciega grande 0.02 €\n*** CARTAS DE MANO ***\nRepartidas a SrLyce [Th 8s]\nerCampos23: iguala 0.02 €\nAkourdideh: se retira \nSrLyce: iguala 0.02 €\nFharock: iguala 0.02 €\necuinas: se retira \nLxckxStrxkx: pasa \n*** FLOP *** [6d 3c As]\nLxckxStrxkx: pasa \nerCampos23: apuesta 0.04 €\nSrLyce: se retira \nFharock: iguala 0.04 €\nLxckxStrxkx: se retira \n*** TURN *** [6d 3c As] [2h]\nerCampos23: apuesta 0.08 €\nFharock: iguala 0.08 €\n*** RIVER *** [6d 3c As 2h] [6s]\nerCampos23: pasa \nFharock: apuesta 0.16 €\nerCampos23: iguala 0.16 €\n*** SHOW DOWN ***\nFharock: muestra [Tc Ah] (doble pareja, ases y seises)\nerCampos23: descarta su mano sin mostrar \nFharock se lleva 0.61 € del bote \n*** RESUMEN ***\nBote total 0.65 € | Comisión 0.04 € \nComunitarias [6d 3c As 2h 6s]\nAsiento 1: SrLyce se retiró en el Flop\nAsiento 2: Fharock (botón) muestra [Tc Ah] y ganó (0.61 €) con doble pareja, ases y seises\nAsiento 3: ecuinas (ciega pequeña) se retiró antes del Flop\nAsiento 4: LxckxStrxkx (ciega grande) se retiró en el Flop\nAsiento 5: erCampos23 descartó sin mostrar [Qc Qh]\nAsiento 6: Akourdideh se retiró antes del Flop (no apostó)"
}