{
  "hand_id": "257215200154",
  "date": "04-08-2025 22:30:35",
  "table": "Aldhafera II",
  "game_type": "holdem",
  "hero": "SrLyce",
  "hero_position": "",
  "hero_cards": [
    "5d",
    "4c"
  ],
  "stacks": {
    "wsx25": 88.0,
    "BudyXXIII": 292.5,
    "SrLyce": 98.5,
    "rhidoxxx": 65.5,
    "jte-ken": 105.5,
    "betterrrrrr": 180.5
  },
  "actions": {
    "preflop": [
      "Asiento 1: wsx25 (1.76 € en fichas)",
      "Asiento 2: BudyXXIII (5.85 € en fichas)",
      "Asiento 3: SrLyce (1.97 € en fichas)",
      "Asiento 4: rhidoxxx (1.31 € en fichas)",
      "Asiento 5: jte-ken (2.11 € en fichas)",
      "Asiento 6: betterrrrrr (3.61 € en fichas)",
      "rhidoxxx: pone la ciega pequeña 0.01 €",
      "jte-ken: pone la ciega grande 0.02 €",
      "betterrrrrr: se retira",
      "wsx25: sube 0.02 € a 0.04 €",
      "BudyXXIII: se retira",
      "SrLyce: se retira",
      "rhidoxxx: iguala 0.03 €",
      "jte-ken: iguala 0.02 €"
    ],
    "flop": [
      "rhidoxxx: apuesta 0.06 €",
      "jte-ken: iguala 0.06 €",
      "wsx25: iguala 0.06 €"
    ],
    "turn": [
      "rhidoxxx: pasa",
      "jte-ken: pasa",
      "wsx25: pasa"
    ],
    "river": [
      "rhidoxxx: apuesta 0.28 €",
      "jte-ken: se retira",
      "wsx25: iguala 0.28 €",
      "rhidoxxx: muestra [Th 7d] (full de sietes y dieces)",
      "wsx25: descarta su mano sin mostrar",
      "Asiento 1: wsx25 descartó sin mostrar [6h 6d]",
      "Asiento 2: BudyXXIII se retiró antes del Flop (no apostó)",
      "Asiento 3: SrLyce (botón) se retiró antes del Flop (no apostó)",
      "Asiento 4: rhidoxxx (ciega pequeña) muestra [Th 7d] y ganó (0.81 €) con full de sietes y dieces",
      "Asiento 5: jte-ken (ciega grande) se retiró en el River",
      "Asiento 6: betterrrrrr se retiró antes del Flop (no apostó)"
    ]
  },
  "board": [
    "7c",
    "Ts",
    "8h",
    "9s",
    "7s"
  ],
  "winner": "rhidoxxx",
  "win_amount": 40.5,
  "sb": 0.01,
  "bb": 0.02,
  "rake": 2.5,
  "raw_text": "Mano n.º 257215200154 de PokerStars:  Hold'em No Limit (0.01 €/0.02 € EUR) - 04-08-2025 22:30:35 CET [04-08-2025 16:30:35 ET]\nMesa \"Aldhafera II\" 6-max El asiento n.º 3 es el botón\nAsiento 1: wsx25 (1.76 € en fichas) \nAsiento 2: BudyXXIII (5.85 € en fichas) \nAsiento 3: SrLyce (1.97 € en fichas) \nAsiento 4: rhidoxxx (1.31 € en fichas) \nAsiento 5: jte-ken (2.11 € en fichas) \nAsiento 6: betterrrrrr (3.61 € en fichas) \nrhidoxxx: pone la ciega pequeña 0.01 €\njte-ken: pone la ciega grande 0.02 €\n*** CARTAS DE MANO ***\nRepartidas a SrLyce [5d 4c]\nbetterrrrrr: se retira \nwsx25: sube 0.02 € a 0.04 €\nBudyXXIII: se retira \nSrLyce: se retira \nrhidoxxx: iguala 0.03 €\njte-ken: iguala 0.02 €\n*** FLOP *** [7c Ts 8h]\nrhidoxxx: apuesta 0.06 €\njte-ken: iguala 0.06 €\nwsx25: iguala 0.06 €\n*** TURN *** [7c Ts 8h] [9s]\nrhidoxxx: pasa \njte-ken: pasa \nwsx25: pasa \n*** RIVER *** [7c Ts 8h 9s] [7s]\nrhidoxxx: apuesta 0.28 €\njte-ken: se retira \nwsx25: iguala 0.28 €\n*** SHOW DOWN ***\nrhidoxxx: muestra [Th 7d] (full de sietes y dieces)\nwsx25: descarta su mano sin mostrar \nrhidoxxx se lleva 0.81 € del bote \n*** RESUMEN ***\nBote total 0.86 € | Comisión 0.05 € \nComunitarias [7c Ts 8h 9s 7s]\nAsiento 1: wsx25 descartó sin mostrar [6h 6d]\nAsiento 2: BudyXXIII se retiró antes del Flop (no apostó)\nAsiento 3: SrLyce (botón) se retiró antes del Flop (no apostó)\nAsiento 4: rhidoxxx (ciega pequeña) muestra [Th 7d] y ganó (0.81 €) con full de sietes y dieces\nAsiento 5: jte-ken (ciega grande) se retiró en el River\nAsiento 6: betterrrrrr se retiró antes del Flop (no apostó)"
}