{
  "hand_id": "257168277580",
  "date": "01-08-2025 11:18:08",
  "table": "Atlas",
  "game_type": "holdem",
  "hero": "SrLyce",
  "hero_position": "",
  "hero_cards": [
    "3d",
    "9c"
  ],
  "stacks": {
    "SrLyce": 94.5,
    "Fharock": 92.0,
    "ecuinas": 97.0,
    "LxckxStrxkx": 100.0,
    "erCampos23": 43.0,
    "Akourdideh": 115.5
  },
  "actions": {
    "preflop": [
      "Asiento 1: SrLyce (1.89 € en fichas)",
      "Asiento 2: Fharock (1.84 € en fichas)",
      "Asiento 3: ecuinas (1.94 € en fichas)",
      "Asiento 4: LxckxStrxkx (2 € en fichas)",
      "Asiento 5: erCampos23 (0.86 € en fichas)",
      "Asiento 6: Akourdideh (2.31 € en fichas)",
      "erCampos23: pone la ciega pequeña 0.01 €",
      "Akourdideh: pone la ciega grande 0.02 €",
      "SrLyce: se retira",
      "Fharock: se retira",
      "ecuinas: se retira",
      "LxckxStrxkx: se retira",
      "erCampos23: iguala 0.01 €",
      "Akourdideh: pasa"
    ],
    "flop": [
      "erCampos23: pasa",
      "Akourdideh: pasa"
    ],
    "turn": [
      "erCampos23: pasa",
      "Akourdideh: pasa"
    ],
    "river": [
      "erCampos23: pasa",
      "Akourdideh: pasa",
      "erCampos23: muestra [8c Qs] (pareja de jotas)",
      "Akourdideh: muestra [5s 2h] (doble pareja, jotas y doses)",
      "Asiento 1: SrLyce se retiró antes del Flop (no apostó)",
      "Asiento 2: Fharock se retiró antes del Flop (no apostó)",
      "Asiento 3: ecuinas se retiró antes del Flop (no apostó)",
      "Asiento 4: LxckxStrxkx (botón) se retiró antes del Flop (no apostó)",
      "Asiento 5: erCampos23 (ciega pequeña) muestra [8c Qs] y perdió con pareja de jotas",
      "Asiento 6: Akourdideh (ciega grande) muestra [5s 2h] y ganó (0.04 €) con doble pareja, jotas y doses"
    ]
  },
  "board": [
    "6s",
    "Jh",
    "3h",
    "Jc",
    "2d"
  ],
  "winner": "Akourdideh",
  "win_amount": 2.0,
  "sb": 0.01,
  "bb": 0.02,
  "rake": 0.0,
  "raw_text": "Mano n.º 257168277580 de PokerStars:  Hold'em No Limit (0.01 €/0.02 € EUR) - 01-08-2025 11:18:08 CET [01-08-2025 5:18:08 ET]\nMesa \"Atlas\" 6-max El asiento n.º 4 es el botón\nAsiento 1: SrLyce (1.89 € en fichas) \nAsiento 2: Fharock (1.84 € en fichas) \nAsiento 3: ecuinas (1.94 € en fichas) \nAsiento 4: LxckxStrxkx (2 € en fichas) \nAsiento 5: erCampos23 (0.86 € en fichas) \nAsiento 6: Akourdideh (2.31 € en fichas) \nerCampos23: pone la ciega pequeña 0.01 €\nAkourdideh: pone la ciega grande 0.02 €\n*** CARTAS DE MANO ***\nRepartidas a SrLyce [3d 9c]\nSrLyce: se retira \nFharock ha agotado su tiempo\nFharock: se retira \necuinas: se retira \nLxckxStrxkx: se retira \nerCampos23: iguala 0.01 €\nAkourdideh: pasa \n*** FLOP *** [6s Jh 3h]\nerCampos23: pasa \nAkourdideh: pasa \n*** TURN *** [6s Jh 3h] [Jc]\nerCampos23: pasa \nAkourdideh: pasa \n*** RIVER *** [6s Jh 3h Jc] [2d]\nerCampos23: pasa \nAkourdideh: pasa \n*** SHOW DOWN ***\nerCampos23: muestra [8c Qs] (pareja de jotas)\nAkourdideh: muestra [5s 2h] (doble pareja, jotas y doses)\nAkourdideh se lleva 0.04 € del bote \n*** RESUMEN ***\nBote total 0.04 € | Comisión 0 € \nComunitarias [6s Jh 3h Jc 2d]\nAsiento 1: SrLyce se retiró antes del Flop (no apostó)\nAsiento 2: Fharock se retiró antes del Flop (no apostó)\nAsiento 3: ecuinas se retiró antes del Flop (no apostó)\nAsiento 4: LxckxStrxkx (botón) se retiró antes del Flop (no apostó)\nAsiento 5: erCampos23 (ciega pequeña) muestra [8c Qs] y perdió con pareja de jotas\nAsiento 6: Akourdideh (ciega grande) muestra [5s 2h] y ganó (0.04 €) con doble pareja, jotas y doses"
}