{
  "hand_id": "257190008237",
  "date": "03-08-2025 1:01:45",
  "table": "Polydoros II",
  "game_type": "holdem",
  "hero": "SrLyce",
  "hero_position": "",
  "hero_cards": [
    "4h",
    "Jc"
  ],
  "stacks": {
    "JIglesias37": 100.0,
    "SrLyce": 144.0,
    "djulkk421": 80.5
  },
  "actions": {
    "preflop": [
      "Asiento 1: JIglesias37 (2 € en fichas)",
      "Asiento 4: SrLyce (2.88 € en fichas)",
      "Asiento 6: djulkk421 (1.61 € en fichas)",
      "SrLyce: pone la ciega pequeña 0.01 €",
      "djulkk421: pone la ciega grande 0.02 €",
      "JIglesias37: se retira",
      "SrLyce: se retira",
      "Asiento 1: JIglesias37 (botón) se retiró antes del Flop (no apostó)",
      "Asiento 4: SrLyce (ciega pequeña) se retiró antes del Flop",
      "Asiento 6: djulkk421 (ciega grande) recaudó (0.02 €)"
    ],
    "flop": [],
    "turn": [],
    "river": []
  },
  "board": [],
  "winner": "djulkk421",
  "win_amount": 1.0,
  "sb": 0.01,
  "bb": 0.02,
  "rake": 0.0,
  "raw_text": "Mano n.º 257190008237 de PokerStars:  Hold'em No Limit (0.01 €/0.02 € EUR) - 03-08-2025 1:01:45 CET [02-08-2025 19:01:45 ET]\nMesa \"Polydoros II\" 6-max El asiento n.º 1 es el botón\nAsiento 1: JIglesias37 (2 € en fichas) \nAsiento 4: SrLyce (2.88 € en fichas) \nAsiento 6: djulkk421 (1.61 € en fichas) \nSrLyce: pone la ciega pequeña 0.01 €\ndjulkk421: pone la ciega grande 0.02 €\n*** CARTAS DE MANO ***\nRepartidas a SrLyce [4h Jc]\nJIglesias37: se retira \nSrLyce: se retira \nLa apuesta no igualada (0.01 €) ha sido devuelta a djulkk421\ndjulkk421 se lleva 0.02 € del bote \nJIglesias37 deja la mesa\n*** RESUMEN ***\nBote total 0.02 € | Comisión 0 € \nAsiento 1: JIglesias37 (botón) se retiró antes del Flop (no apostó)\nAsiento 4: SrLyce (ciega pequeña) se retiró antes del Flop\nAsiento 6: djulkk421 (ciega grande) recaudó (0.02 €)"
}