{
  "hand_id": "257148703594",
  "date": "30-07-2025 21:38:05",
  "table": "Sirona",
  "game_type": "holdem",
  "hero": "SrLyce",
  "hero_position": "",
  "hero_cards": [
    "Kd",
    "2h"
  ],
  "stacks": {
    "SrLyce": 91.5,
    "lecontrebandier": 97.5,
    "christoph363": 179.5,
    "oliverdu70": 104.5,
    "olibellier": 32.5,
    "Dakoo44": 109.0
  },
  "actions": {
    "preflop": [
      "Asiento 1: SrLyce (1.83 € en fichas)",
      "Asiento 2: lecontrebandier (1.95 € en fichas)",
      "Asiento 3: christoph363 (3.59 € en fichas)",
      "Asiento 4: oliverdu70 (2.09 € en fichas)",
      "Asiento 5: olibellier (0.65 € en fichas)",
      "Asiento 6: Dakoo44 (2.18 € en fichas)",
      "lecontrebandier: pone la ciega pequeña 0.01 €",
      "christoph363: pone la ciega grande 0.02 €",
      "oliverdu70: se retira",
      "olibellier: se retira",
      "Dakoo44: se retira",
      "SrLyce: se retira",
      "lecontrebandier: se retira",
      "Asiento 1: SrLyce (botón) se retiró antes del Flop (no apostó)",
      "Asiento 2: lecontrebandier (ciega pequeña) se retiró antes del Flop",
      "Asiento 3: christoph363 (ciega grande) recaudó (0.02 €)",
      "Asiento 4: oliverdu70 se retiró antes del Flop (no apostó)",
      "Asiento 5: olibellier se retiró antes del Flop (no apostó)",
      "Asiento 6: Dakoo44 se retiró antes del Flop (no apostó)"
    ],
    "flop": [],
    "turn": [],
    "river": []
  },
  "board": [],
  "winner": "christoph363",
  "win_amount": 1.0,
  "sb": 0.01,
  "bb": 0.02,
  "rake": 0.0,
  "raw_text": "Mano n.º 257148703594 de PokerStars:  Hold'em No Limit (0.01 €/0.02 € EUR) - 30-07-2025 21:38:05 CET [30-07-2025 15:38:05 ET]\nMesa \"Sirona\" 6-max El asiento n.º 1 es el botón\nAsiento 1: SrLyce (1.83 € en fichas) \nAsiento 2: lecontrebandier (1.95 € en fichas) \nAsiento 3: christoph363 (3.59 € en fichas) \nAsiento 4: oliverdu70 (2.09 € en fichas) \nAsiento 5: olibellier (0.65 € en fichas) \nAsiento 6: Dakoo44 (2.18 € en fichas) \nlecontrebandier: pone la ciega pequeña 0.01 €\nchristoph363: pone la ciega grande 0.02 €\n*** CARTAS DE MANO ***\nRepartidas a SrLyce [Kd 2h]\noliverdu70: se retira \nolibellier: se retira \nDakoo44: se retira \nSrLyce: se retira \nlecontrebandier: se retira \nLa apuesta no igualada (0.01 €) ha sido devuelta a christoph363\nchristoph363 se lleva 0.02 € del bote \n*** RESUMEN ***\nBote total 0.02 € | Comisión 0 € \nAsiento 1: SrLyce (botón) se retiró antes del Flop (no apostó)\nAsiento 2: lecontrebandier (ciega pequeña) se retiró antes del Flop\nAsiento 3: christoph363 (ciega grande) recaudó (0.02 €)\nAsiento 4: oliverdu70 se retiró antes del Flop (no apostó)\nAsiento 5: olibellier se retiró antes del Flop (no apostó)\nAsiento 6: Dakoo44 se retiró antes del Flop (no apostó)"
}