{
  "hand_id": "257150459224",
  "date": "30-07-2025 23:43:21",
  "table": "Lobelia",
  "game_type": "holdem",
  "hero": "SrLyce",
  "hero_position": "",
  "hero_cards": [
    "Ks",
    "4d"
  ],
  "stacks": {
    "LeVbks": 119.0,
    "fcis666": 37.5,
    "Dlaguancha": 134.5,
    "SrLyce": 102.5,
    "riverluck444": 82.5,
    "javipondio": 40.0
  },
  "actions": {
    "preflop": [
      "Asiento 1: LeVbks (2.38 € en fichas)",
      "Asiento 2: fcis666 (0.75 € en fichas)",
      "Asiento 3: Dlaguancha (2.69 € en fichas)",
      "Asiento 4: SrLyce (2.05 € en fichas)",
      "Asiento 5: riverluck444 (1.65 € en fichas)",
      "Asiento 6: javipondio (0.80 € en fichas)",
      "SrLyce: pone la ciega pequeña 0.01 €",
      "riverluck444: pone la ciega grande 0.02 €",
      "javipondio: se retira",
      "LeVbks: se retira",
      "fcis666: se retira",
      "Dlaguancha: iguala 0.02 €",
      "SrLyce: se retira",
      "riverluck444: pasa"
    ],
    "flop": [
      "riverluck444: pasa",
      "Dlaguancha: apuesta 0.02 €",
      "riverluck444: se retira",
      "Asiento 1: LeVbks se retiró antes del Flop (no apostó)",
      "Asiento 2: fcis666 se retiró antes del Flop (no apostó)",
      "Asiento 3: Dlaguancha (botón) recaudó (0.05 €)",
      "Asiento 4: SrLyce (ciega pequeña) se retiró antes del Flop",
      "Asiento 5: riverluck444 (ciega grande) se retiró en el Flop",
      "Asiento 6: javipondio se retiró antes del Flop (no apostó)"
    ],
    "turn": [],
    "river": []
  },
  "board": [
    "Th",
    "3d",
    "2d"
  ],
  "winner": "Dlaguancha",
  "win_amount": 2.5,
  "sb": 0.01,
  "bb": 0.02,
  "rake": 0.0,
  "raw_text": "Mano n.º 257150459224 de PokerStars:  Hold'em No Limit (0.01 €/0.02 € EUR) - 30-07-2025 23:43:21 CET [30-07-2025 17:43:21 ET]\nMesa \"Lobelia\" 6-max El asiento n.º 3 es el botón\nAsiento 1: LeVbks (2.38 € en fichas) \nAsiento 2: fcis666 (0.75 € en fichas) \nAsiento 3: Dlaguancha (2.69 € en fichas) \nAsiento 4: SrLyce (2.05 € en fichas) \nAsiento 5: riverluck444 (1.65 € en fichas) \nAsiento 6: javipondio (0.80 € en fichas) \nSrLyce: pone la ciega pequeña 0.01 €\nriverluck444: pone la ciega grande 0.02 €\n*** CARTAS DE MANO ***\nRepartidas a SrLyce [Ks 4d]\njavipondio: se retira \nLeVbks: se retira \nfcis666: se retira \nDlaguancha: iguala 0.02 €\nSrLyce: se retira \nriverluck444: pasa \n*** FLOP *** [Th 3d 2d]\nriverluck444: pasa \nDlaguancha: apuesta 0.02 €\nriverluck444: se retira \nLa apuesta no igualada (0.02 €) ha sido devuelta a Dlaguancha\nDlaguancha se lleva 0.05 € del bote \n*** RESUMEN ***\nBote total 0.05 € | Comisión 0 € \nComunitarias [Th 3d 2d]\nAsiento 1: LeVbks se retiró antes del Flop (no apostó)\nAsiento 2: fcis666 se retiró antes del Flop (no apostó)\nAsiento 3: Dlaguancha (botón) recaudó (0.05 €)\nAsiento 4: SrLyce (ciega pequeña) se retiró antes del Flop\nAsiento 5: riverluck444 (ciega grande) se retiró en el Flop\nAsiento 6: javipondio se retiró antes del Flop (no apostó)"
}