{
  "hand_id": "257168276164",
  "date": "01-08-2025 11:17:52",
  "table": "Atlas",
  "game_type": "holdem",
  "hero": "SrLyce",
  "hero_position": "",
  "hero_cards": [
    "7s",
    "5c"
  ],
  "stacks": {
    "SrLyce": 94.5,
    "Fharock": 92.0,
    "ecuinas": 97.0,
    "LxckxStrxkx": 100.5,
    "erCampos23": 42.5,
    "Akourdideh": 115.5
  },
  "actions": {
    "preflop": [
      "Asiento 1: SrLyce (1.89 € en fichas)",
      "Asiento 2: Fharock (1.84 € en fichas)",
      "Asiento 3: ecuinas (1.94 € en fichas)",
      "Asiento 4: LxckxStrxkx (2.01 € en fichas)",
      "Asiento 5: erCampos23 (0.85 € en fichas)",
      "Asiento 6: Akourdideh (2.31 € en fichas)",
      "LxckxStrxkx: pone la ciega pequeña 0.01 €",
      "erCampos23: pone la ciega grande 0.02 €",
      "Akourdideh: se retira",
      "SrLyce: se retira",
      "Fharock: se retira",
      "ecuinas: se retira",
      "LxckxStrxkx: se retira",
      "Asiento 1: SrLyce se retiró antes del Flop (no apostó)",
      "Asiento 2: Fharock se retiró antes del Flop (no apostó)",
      "Asiento 3: ecuinas (botón) se retiró antes del Flop (no apostó)",
      "Asiento 4: LxckxStrxkx (ciega pequeña) se retiró antes del Flop",
      "Asiento 5: erCampos23 (ciega grande) recaudó (0.02 €)",
      "Asiento 6: Akourdideh se retiró antes del Flop (no apostó)"
    ],
    "flop": [],
    "turn": [],
    "river": []
  },
  "board": [],
  "winner": "erCampos23",
  "win_amount": 1.0,
  "sb": 0.01,
  "bb": 0.02,
  "rake": 0.0,
  "raw_text": "Mano n.º 257168276164 de PokerStars:  Hold'em No Limit (0.01 €/0.02 € EUR) - 01-08-2025 11:17:52 CET [01-08-2025 5:17:52 ET]\nMesa \"Atlas\" 6-max El asiento n.º 3 es el botón\nAsiento 1: SrLyce (1.89 € en fichas) \nAsiento 2: Fharock (1.84 € en fichas) \nAsiento 3: ecuinas (1.94 € en fichas) \nAsiento 4: LxckxStrxkx (2.01 € en fichas) \nAsiento 5: erCampos23 (0.85 € en fichas) \nAsiento 6: Akourdideh (2.31 € en fichas) \nLxckxStrxkx: pone la ciega pequeña 0.01 €\nerCampos23: pone la ciega grande 0.02 €\n*** CARTAS DE MANO ***\nRepartidas a SrLyce [7s 5c]\nAkourdideh: se retira \nSrLyce: se retira \nFharock: se retira \necuinas: se retira \nLxckxStrxkx: se retira \nLa apuesta no igualada (0.01 €) ha sido devuelta a erCampos23\nerCampos23 se lleva 0.02 € del bote \n*** RESUMEN ***\nBote total 0.02 € | Comisión 0 € \nAsiento 1: SrLyce se retiró antes del Flop (no apostó)\nAsiento 2: Fharock se retiró antes del Flop (no apostó)\nAsiento 3: ecuinas (botón) se retiró antes del Flop (no apostó)\nAsiento 4: LxckxStrxkx (ciega pequeña) se retiró antes del Flop\nAsiento 5: erCampos23 (ciega grande) recaudó (0.02 €)\nAsiento 6: Akourdideh se retiró antes del Flop (no apostó)"
}