{
  "hand_id": "257237611143",
  "date": "06-08-2025 17:40:59",
  "table": "Vanadis II",
  "game_type": "holdem",
  "hero": "SrLyce",
  "hero_position": "",
  "hero_cards": [
    "Kd",
    "As"
  ],
  "stacks": {
    "SrLyce": 103.0,
    "djrojas9": 95.0,
    "noreihh": 171.5,
    "chordewman": 138.5,
    "sarabiagar": 96.5,
    "idigon": 132.5
  },
  "actions": {
    "preflop": [
      "Asiento 1: SrLyce (2.06 € en fichas)",
      "Asiento 2: djrojas9 (1.90 € en fichas)",
      "Asiento 3: noreihh (3.43 € en fichas)",
      "Asiento 4: chordewman (2.77 € en fichas)",
      "Asiento 5: sarabiagar (1.93 € en fichas)",
      "Asiento 6: idigon (2.65 € en fichas)",
      "noreihh: pone la ciega pequeña 0.01 €",
      "chordewman: pone la ciega grande 0.02 €",
      "sarabiagar: se retira",
      "idigon: sube 0.02 € a 0.04 €",
      "SrLyce: sube 0.08 € a 0.12 €",
      "djrojas9: se retira",
      "noreihh: se retira",
      "chordewman: se retira",
      "idigon: iguala 0.08 €"
    ],
    "flop": [
      "idigon: pasa",
      "SrLyce: apuesta 0.09 €",
      "idigon: iguala 0.09 €"
    ],
    "turn": [
      "idigon: pasa",
      "SrLyce: apuesta 0.17 €",
      "idigon: iguala 0.17 €"
    ],
    "river": [
      "idigon: apuesta 0.10 €",
      "SrLyce: iguala 0.10 €",
      "idigon: muestra [Th Ts] (doble pareja, dieces y ochos)",
      "SrLyce: muestra [Kd As] (doble pareja, ases y ochos)",
      "Asiento 1: SrLyce muestra [Kd As] y ganó (0.93 €) con doble pareja, ases y ochos",
      "Asiento 2: djrojas9 (botón) se retiró antes del Flop (no apostó)",
      "Asiento 3: noreihh (ciega pequeña) se retiró antes del Flop",
      "Asiento 4: chordewman (ciega grande) se retiró antes del Flop",
      "Asiento 5: sarabiagar se retiró antes del Flop (no apostó)",
      "Asiento 6: idigon muestra [Th Ts] y perdió con doble pareja, dieces y ochos"
    ]
  },
  "board": [
    "Ac",
    "8s",
    "5c",
    "8c",
    "3h"
  ],
  "winner": "SrLyce",
  "win_amount": 46.5,
  "sb": 0.01,
  "bb": 0.02,
  "rake": 3.0,
  "raw_text": "Mano n.º 257237611143 de PokerStars:  Hold'em No Limit (0.01 €/0.02 € EUR) - 06-08-2025 17:40:59 CET [06-08-2025 11:40:59 ET]\nMesa \"Vanadis II\" 6-max El asiento n.º 2 es el botón\nAsiento 1: SrLyce (2.06 € en fichas) \nAsiento 2: djrojas9 (1.90 € en fichas) \nAsiento 3: noreihh (3.43 € en fichas) \nAsiento 4: chordewman (2.77 € en fichas) \nAsiento 5: sarabiagar (1.93 € en fichas) \nAsiento 6: idigon (2.65 € en fichas) \nnoreihh: pone la ciega pequeña 0.01 €\nchordewman: pone la ciega grande 0.02 €\n*** CARTAS DE MANO ***\nRepartidas a SrLyce [Kd As]\nsarabiagar: se retira \nidigon: sube 0.02 € a 0.04 €\nSrLyce: sube 0.08 € a 0.12 €\ndjrojas9: se retira \nnoreihh: se retira \nchordewman: se retira \nidigon: iguala 0.08 €\n*** FLOP *** [Ac 8s 5c]\nidigon: pasa \nSrLyce: apuesta 0.09 €\nidigon: iguala 0.09 €\n*** TURN *** [Ac 8s 5c] [8c]\nidigon: pasa \nSrLyce: apuesta 0.17 €\nidigon: iguala 0.17 €\n*** RIVER *** [Ac 8s 5c 8c] [3h]\nidigon: apuesta 0.10 €\nSrLyce: iguala 0.10 €\n*** SHOW DOWN ***\nidigon: muestra [Th Ts] (doble pareja, dieces y ochos)\nSrLyce: muestra [Kd As] (doble pareja, ases y ochos)\nSrLyce se lleva 0.93 € del bote \n*** RESUMEN ***\nBote total 0.99 € | Comisión 0.06 € \nComunitarias [Ac 8s 5c 8c 3h]\nAsiento 1: SrLyce muestra [Kd As] y ganó (0.93 €) con doble pareja, ases y ochos\nAsiento 2: djrojas9 (botón) se retiró antes del Flop (no apostó)\nAsiento 3: noreihh (ciega pequeña) se retiró antes del Flop\nAsiento 4: chordewman (ciega grande) se retiró antes del Flop\nAsiento 5: sarabiagar se retiró antes del Flop (no apostó)\nAsiento 6: idigon muestra [Th Ts] y perdió con doble pareja, dieces y ochos"
}