{
  "hand_id": "257238429636",
  "date": "06-08-2025 18:57:52",
  "table": "Herculina II",
  "game_type": "holdem",
  "hero": "SrLyce",
  "hero_position": "",
  "hero_cards": [
    "7h",
    "5s"
  ],
  "stacks": {
    "koldipk": 175.5,
    "David98X": 117.0,
    "JJer11": 209.0,
    "SrLyce": 104.5,
    "Macklemore0": 100.0,
    "ScarvBlack": 101.5
  },
  "actions": {
    "preflop": [
      "Asiento 1: koldipk (3.51 € en fichas)",
      "Asiento 2: David98X (2.34 € en fichas)",
      "Asiento 3: JJer11 (4.18 € en fichas)",
      "Asiento 4: SrLyce (2.09 € en fichas)",
      "Asiento 5: Macklemore0 (2 € en fichas)",
      "Asiento 6: ScarvBlack (2.03 € en fichas)",
      "Macklemore0: pone la ciega pequeña 0.01 €",
      "ScarvBlack: pone la ciega grande 0.02 €",
      "koldipk: se retira",
      "David98X: sube 0.04 € a 0.06 €",
      "JJer11: se retira",
      "SrLyce: se retira",
      "Macklemore0: iguala 0.05 €",
      "ScarvBlack: sube 0.28 € a 0.34 €",
      "David98X: iguala 0.28 €",
      "Macklemore0: se retira"
    ],
    "flop": [
      "ScarvBlack: apuesta 0.37 €",
      "David98X: se retira",
      "ScarvBlack: no muestra su mano",
      "Asiento 1: koldipk se retiró antes del Flop (no apostó)",
      "Asiento 2: David98X se retiró en el Flop",
      "Asiento 3: JJer11 se retiró antes del Flop (no apostó)",
      "Asiento 4: SrLyce (botón) se retiró antes del Flop (no apostó)",
      "Asiento 5: Macklemore0 (ciega pequeña) se retiró antes del Flop",
      "Asiento 6: ScarvBlack (ciega grande) recaudó (0.70 €)"
    ],
    "turn": [],
    "river": []
  },
  "board": [
    "2s",
    "6s",
    "6h"
  ],
  "winner": "ScarvBlack",
  "win_amount": 35.0,
  "sb": 0.01,
  "bb": 0.02,
  "rake": 2.0,
  "raw_text": "Mano n.º 257238429636 de PokerStars:  Hold'em No Limit (0.01 €/0.02 € EUR) - 06-08-2025 18:57:52 CET [06-08-2025 12:57:52 ET]\nMesa \"Herculina II\" 6-max El asiento n.º 4 es el botón\nAsiento 1: koldipk (3.51 € en fichas) \nAsiento 2: David98X (2.34 € en fichas) \nAsiento 3: JJer11 (4.18 € en fichas) \nAsiento 4: SrLyce (2.09 € en fichas) \nAsiento 5: Macklemore0 (2 € en fichas) \nAsiento 6: ScarvBlack (2.03 € en fichas) \nMacklemore0: pone la ciega pequeña 0.01 €\nScarvBlack: pone la ciega grande 0.02 €\n*** CARTAS DE MANO ***\nRepartidas a SrLyce [7h 5s]\nkoldipk: se retira \nDavid98X: sube 0.04 € a 0.06 €\nJJer11: se retira \nSrLyce: se retira \nMacklemore0: iguala 0.05 €\nScarvBlack: sube 0.28 € a 0.34 €\nDavid98X: iguala 0.28 €\nMacklemore0: se retira \n*** FLOP *** [2s 6s 6h]\nScarvBlack: apuesta 0.37 €\nDavid98X: se retira \nLa apuesta no igualada (0.37 €) ha sido devuelta a ScarvBlack\nScarvBlack se lleva 0.70 € del bote \nScarvBlack: no muestra su mano \n*** RESUMEN ***\nBote total 0.74 € | Comisión 0.04 € \nComunitarias [2s 6s 6h]\nAsiento 1: koldipk se retiró antes del Flop (no apostó)\nAsiento 2: David98X se retiró en el Flop\nAsiento 3: JJer11 se retiró antes del Flop (no apostó)\nAsiento 4: SrLyce (botón) se retiró antes del Flop (no apostó)\nAsiento 5: Macklemore0 (ciega pequeña) se retiró antes del Flop\nAsiento 6: ScarvBlack (ciega grande) recaudó (0.70 €)"
}