{
  "hand_id": "257238500206",
  "date": "06-08-2025 19:04:54",
  "table": "Alruccabah II",
  "game_type": "holdem",
  "hero": "SrLyce",
  "hero_position": "",
  "hero_cards": [
    "8s",
    "Kd"
  ],
  "stacks": {
    "zoioachado": 0.0,
    "SrLyce": 149.5,
    "yonisanlu": 139.0,
    "Nicanor Cast": 48.0,
    "rayao32": 42.5
  },
  "actions": {
    "preflop": [
      "Asiento 2: zoioachado (0 € en fichas) está ausente",
      "Asiento 1: SrLyce (2.99 € en fichas)",
      "Asiento 3: yonisanlu (2.78 € en fichas)",
      "Asiento 4: serviettski(fr) (2 € en fichas)",
      "Asiento 5: Nicanor Cast (0.96 € en fichas)",
      "Asiento 6: rayao32 (0.85 € en fichas)",
      "Nicanor Cast: pone la ciega pequeña 0.01 €",
      "rayao32: pone la ciega grande 0.02 €",
      "SrLyce: se retira",
      "yonisanlu: se retira",
      "serviettski(fr): se retira",
      "Nicanor Cast: se retira",
      "Asiento 2: zoioachado",
      "Asiento 1: SrLyce se retiró antes del Flop (no apostó)",
      "Asiento 3: yonisanlu se retiró antes del Flop (no apostó)",
      "Asiento 4: serviettski(fr) (botón) se retiró antes del Flop (no apostó)",
      "Asiento 5: Nicanor Cast (ciega pequeña) se retiró antes del Flop",
      "Asiento 6: rayao32 (ciega grande) recaudó (0.02 €)"
    ],
    "flop": [],
    "turn": [],
    "river": []
  },
  "board": [],
  "winner": "rayao32",
  "win_amount": 1.0,
  "sb": 0.01,
  "bb": 0.02,
  "rake": 0.0,
  "raw_text": "Mano n.º 257238500206 de PokerStars:  Hold'em No Limit (0.01 €/0.02 € EUR) - 06-08-2025 19:04:54 CET [06-08-2025 13:04:54 ET]\nMesa \"Alruccabah II\" 6-max El asiento n.º 4 es el botón\nAsiento 2: zoioachado (0 € en fichas) está ausente\nAsiento 1: SrLyce (2.99 € en fichas) \nAsiento 3: yonisanlu (2.78 € en fichas) \nAsiento 4: serviettski(fr) (2 € en fichas) \nAsiento 5: Nicanor Cast (0.96 € en fichas) \nAsiento 6: rayao32 (0.85 € en fichas) \nNicanor Cast: pone la ciega pequeña 0.01 €\nrayao32: pone la ciega grande 0.02 €\n*** CARTAS DE MANO ***\nRepartidas a SrLyce [8s Kd]\nSrLyce: se retira \nyonisanlu: se retira \nserviettski(fr): se retira \nNicanor Cast: se retira \nLa apuesta no igualada (0.01 €) ha sido devuelta a rayao32\nrayao32 se lleva 0.02 € del bote \n*** RESUMEN ***\nBote total 0.02 € | Comisión 0 € \nAsiento 2: zoioachado\nAsiento 1: SrLyce se retiró antes del Flop (no apostó)\nAsiento 3: yonisanlu se retiró antes del Flop (no apostó)\nAsiento 4: serviettski(fr) (botón) se retiró antes del Flop (no apostó)\nAsiento 5: Nicanor Cast (ciega pequeña) se retiró antes del Flop\nAsiento 6: rayao32 (ciega grande) recaudó (0.02 €)"
}