{
  "hand_id": "257168344401",
  "date": "01-08-2025 11:30:41",
  "table": "Jupiter",
  "game_type": "holdem",
  "hero": "SrLyce",
  "hero_position": "",
  "hero_cards": [
    "3c",
    "6c"
  ],
  "stacks": {
    "sifilis5": 109.0,
    "Filou203": 106.0,
    "SrLyce": 106.0,
    "LOLA19711971": 32.5,
    "dadou13mars": 214.0,
    "Alvii37": 109.5
  },
  "actions": {
    "preflop": [
      "Asiento 1: sifilis5 (2.18 € en fichas)",
      "Asiento 2: Filou203 (2.12 € en fichas)",
      "Asiento 3: SrLyce (2.12 € en fichas)",
      "Asiento 4: LOLA19711971 (0.65 € en fichas)",
      "Asiento 5: dadou13mars (4.28 € en fichas)",
      "Asiento 6: Alvii37 (2.19 € en fichas)",
      "LOLA19711971: pone la ciega pequeña 0.01 €",
      "dadou13mars: pone la ciega grande 0.02 €",
      "Alvii37: sube 0.04 € a 0.06 €",
      "sifilis5: se retira",
      "Filou203: se retira",
      "SrLyce: se retira",
      "LOLA19711971: se retira",
      "dadou13mars: iguala 0.04 €"
    ],
    "flop": [
      "dadou13mars: pasa",
      "Alvii37: apuesta 0.04 €",
      "dadou13mars: se retira",
      "Alvii37: no muestra su mano",
      "Asiento 1: sifilis5 se retiró antes del Flop (no apostó)",
      "Asiento 2: Filou203 se retiró antes del Flop (no apostó)",
      "Asiento 3: SrLyce (botón) se retiró antes del Flop (no apostó)",
      "Asiento 4: LOLA19711971 (ciega pequeña) se retiró antes del Flop",
      "Asiento 5: dadou13mars (ciega grande) se retiró en el Flop",
      "Asiento 6: Alvii37 recaudó (0.12 €)"
    ],
    "turn": [],
    "river": []
  },
  "board": [
    "5c",
    "Ac",
    "Js"
  ],
  "winner": "Alvii37",
  "win_amount": 6.0,
  "sb": 0.01,
  "bb": 0.02,
  "rake": 0.5,
  "raw_text": "Mano n.º 257168344401 de PokerStars:  Hold'em No Limit (0.01 €/0.02 € EUR) - 01-08-2025 11:30:41 CET [01-08-2025 5:30:41 ET]\nMesa \"Jupiter\" 6-max El asiento n.º 3 es el botón\nAsiento 1: sifilis5 (2.18 € en fichas) \nAsiento 2: Filou203 (2.12 € en fichas) \nAsiento 3: SrLyce (2.12 € en fichas) \nAsiento 4: LOLA19711971 (0.65 € en fichas) \nAsiento 5: dadou13mars (4.28 € en fichas) \nAsiento 6: Alvii37 (2.19 € en fichas) \nLOLA19711971: pone la ciega pequeña 0.01 €\ndadou13mars: pone la ciega grande 0.02 €\n*** CARTAS DE MANO ***\nRepartidas a SrLyce [3c 6c]\nAlvii37: sube 0.04 € a 0.06 €\nsifilis5: se retira \nFilou203: se retira \nSrLyce: se retira \nLOLA19711971: se retira \ndadou13mars: iguala 0.04 €\n*** FLOP *** [5c Ac Js]\ndadou13mars: pasa \nAlvii37: apuesta 0.04 €\ndadou13mars: se retira \nLa apuesta no igualada (0.04 €) ha sido devuelta a Alvii37\nAlvii37 se lleva 0.12 € del bote \nAlvii37: no muestra su mano \n*** RESUMEN ***\nBote total 0.13 € | Comisión 0.01 € \nComunitarias [5c Ac Js]\nAsiento 1: sifilis5 se retiró antes del Flop (no apostó)\nAsiento 2: Filou203 se retiró antes del Flop (no apostó)\nAsiento 3: SrLyce (botón) se retiró antes del Flop (no apostó)\nAsiento 4: LOLA19711971 (ciega pequeña) se retiró antes del Flop\nAsiento 5: dadou13mars (ciega grande) se retiró en el Flop\nAsiento 6: Alvii37 recaudó (0.12 €)"
}