{
  "hand_id": "257238395315",
  "date": "06-08-2025 18:54:08",
  "table": "Alruccabah II",
  "game_type": "holdem",
  "hero": "SrLyce",
  "hero_position": "",
  "hero_cards": [
    "3d",
    "7h"
  ],
  "stacks": {
    "zoioachado": 40.0,
    "SrLyce": 97.0,
    "yonisanlu": 102.0,
    "Nicanor Cast": 54.0,
    "rayao32": 48.0
  },
  "actions": {
    "preflop": [
      "Asiento 2: zoioachado (0.80 € en fichas) está ausente",
      "Asiento 1: SrLyce (1.94 € en fichas)",
      "Asiento 3: yonisanlu (2.04 € en fichas)",
      "Asiento 4: serviettski(fr) (2.03 € en fichas)",
      "Asiento 5: Nicanor Cast (1.08 € en fichas)",
      "Asiento 6: rayao32 (0.96 € en fichas)",
      "yonisanlu: pone la ciega pequeña 0.01 €",
      "serviettski(fr): pone la ciega grande 0.02 €",
      "Nicanor Cast: se retira",
      "rayao32: iguala 0.02 €",
      "SrLyce: se retira",
      "yonisanlu: se retira",
      "serviettski(fr): pasa"
    ],
    "flop": [
      "serviettski(fr): pasa",
      "rayao32: pasa"
    ],
    "turn": [
      "serviettski(fr): pasa",
      "rayao32: pasa"
    ],
    "river": [
      "serviettski(fr): apuesta 0.02 €",
      "rayao32: se retira",
      "serviettski(fr): no muestra su mano",
      "Asiento 2: zoioachado",
      "Asiento 1: SrLyce (botón) se retiró antes del Flop (no apostó)",
      "Asiento 3: yonisanlu (ciega pequeña) se retiró antes del Flop",
      "Asiento 4: serviettski(fr) (ciega grande) recaudó (0.05 €)",
      "Asiento 5: Nicanor Cast se retiró antes del Flop (no apostó)",
      "Asiento 6: rayao32 se retiró en el River"
    ]
  },
  "board": [
    "Js",
    "7s",
    "Ts",
    "5h",
    "2h"
  ],
  "winner": "serviettski(fr)",
  "win_amount": 2.5,
  "sb": 0.01,
  "bb": 0.02,
  "rake": 0.0,
  "raw_text": "Mano n.º 257238395315 de PokerStars:  Hold'em No Limit (0.01 €/0.02 € EUR) - 06-08-2025 18:54:08 CET [06-08-2025 12:54:08 ET]\nMesa \"Alruccabah II\" 6-max El asiento n.º 1 es el botón\nAsiento 2: zoioachado (0.80 € en fichas) está ausente\nAsiento 1: SrLyce (1.94 € en fichas) \nAsiento 3: yonisanlu (2.04 € en fichas) \nAsiento 4: serviettski(fr) (2.03 € en fichas) \nAsiento 5: Nicanor Cast (1.08 € en fichas) \nAsiento 6: rayao32 (0.96 € en fichas) \nyonisanlu: pone la ciega pequeña 0.01 €\nserviettski(fr): pone la ciega grande 0.02 €\n*** CARTAS DE MANO ***\nRepartidas a SrLyce [3d 7h]\nNicanor Cast: se retira \nrayao32: iguala 0.02 €\nSrLyce: se retira \nyonisanlu: se retira \nserviettski(fr): pasa \n*** FLOP *** [Js 7s Ts]\nserviettski(fr): pasa \nrayao32: pasa \n*** TURN *** [Js 7s Ts] [5h]\nserviettski(fr): pasa \nrayao32: pasa \n*** RIVER *** [Js 7s Ts 5h] [2h]\nserviettski(fr): apuesta 0.02 €\nrayao32: se retira \nLa apuesta no igualada (0.02 €) ha sido devuelta a serviettski(fr)\nserviettski(fr) se lleva 0.05 € del bote \nserviettski(fr): no muestra su mano \n*** RESUMEN ***\nBote total 0.05 € | Comisión 0 € \nComunitarias [Js 7s Ts 5h 2h]\nAsiento 2: zoioachado\nAsiento 1: SrLyce (botón) se retiró antes del Flop (no apostó)\nAsiento 3: yonisanlu (ciega pequeña) se retiró antes del Flop\nAsiento 4: serviettski(fr) (ciega grande) recaudó (0.05 €)\nAsiento 5: Nicanor Cast se retiró antes del Flop (no apostó)\nAsiento 6: rayao32 se retiró en el River"
}