{
  "hand_id": "257148562890",
  "date": "30-07-2025 21:28:08",
  "table": "Sirona",
  "game_type": "holdem",
  "hero": "SrLyce",
  "hero_position": "",
  "hero_cards": [
    "Js",
    "Qc"
  ],
  "stacks": {
    "Alfi11111": 100.0,
    "SrLyce": 87.0,
    "christoph363": 182.5,
    "varvase": 200.5,
    "Dakoo44": 50.5
  },
  "actions": {
    "preflop": [
      "Asiento 2: Alfi11111 (2 € en fichas) está ausente",
      "Asiento 1: SrLyce (1.74 € en fichas)",
      "Asiento 3: christoph363 (3.65 € en fichas)",
      "Asiento 5: varvase (4.01 € en fichas)",
      "Asiento 6: Dakoo44 (1.01 € en fichas)",
      "SrLyce: pone la ciega pequeña 0.01 €",
      "Alfi11111: está ausente",
      "christoph363: pone la ciega grande 0.02 €",
      "varvase: sube 0.02 € a 0.04 €",
      "Dakoo44: se retira",
      "SrLyce: sube 0.08 € a 0.12 €",
      "christoph363: se retira",
      "varvase: iguala 0.08 €"
    ],
    "flop": [
      "SrLyce: apuesta 0.08 €",
      "varvase: se retira",
      "SrLyce: no muestra su mano",
      "Asiento 2: Alfi11111",
      "Asiento 1: SrLyce (ciega pequeña) recaudó (0.24 €)",
      "Asiento 3: christoph363 (ciega grande) se retiró antes del Flop",
      "Asiento 5: varvase se retiró en el Flop",
      "Asiento 6: Dakoo44 (botón) se retiró antes del Flop (no apostó)"
    ],
    "turn": [],
    "river": []
  },
  "board": [
    "7c",
    "2s",
    "Qh"
  ],
  "winner": "SrLyce",
  "win_amount": 12.0,
  "sb": 0.01,
  "bb": 0.02,
  "rake": 1.0,
  "raw_text": "Mano n.º 257148562890 de PokerStars:  Hold'em No Limit (0.01 €/0.02 € EUR) - 30-07-2025 21:28:08 CET [30-07-2025 15:28:08 ET]\nMesa \"Sirona\" 6-max El asiento n.º 6 es el botón\nAsiento 2: Alfi11111 (2 € en fichas) está ausente\nAsiento 1: SrLyce (1.74 € en fichas) \nAsiento 3: christoph363 (3.65 € en fichas) \nAsiento 5: varvase (4.01 € en fichas) \nAsiento 6: Dakoo44 (1.01 € en fichas) \nSrLyce: pone la ciega pequeña 0.01 €\noliverdu70 se une a la mesa en el asiento n.º 4 \nAlfi11111 ha agotado su tiempo\nAlfi11111: está ausente \nchristoph363: pone la ciega grande 0.02 €\n*** CARTAS DE MANO ***\nRepartidas a SrLyce [Js Qc]\nvarvase: sube 0.02 € a 0.04 €\nDakoo44: se retira \nSrLyce: sube 0.08 € a 0.12 €\nchristoph363: se retira \nvarvase: iguala 0.08 €\n*** FLOP *** [7c 2s Qh]\nAlfi11111 no tiene conexión \nAlfi11111 deja la mesa\nSrLyce: apuesta 0.08 €\nvarvase: se retira \nLa apuesta no igualada (0.08 €) ha sido devuelta a SrLyce\nSrLyce se lleva 0.24 € del bote \nSrLyce: no muestra su mano \n*** RESUMEN ***\nBote total 0.26 € | Comisión 0.02 € \nComunitarias [7c 2s Qh]\nAsiento 2: Alfi11111\nAsiento 1: SrLyce (ciega pequeña) recaudó (0.24 €)\nAsiento 3: christoph363 (ciega grande) se retiró antes del Flop\nAsiento 5: varvase se retiró en el Flop\nAsiento 6: Dakoo44 (botón) se retiró antes del Flop (no apostó)"
}