{
  "hand_id": "257215157581",
  "date": "04-08-2025 22:27:57",
  "table": "Aldhafera II",
  "game_type": "holdem",
  "hero": "SrLyce",
  "hero_position": "",
  "hero_cards": [
    "2c",
    "8h"
  ],
  "stacks": {
    "wsx25": 93.5,
    "BudyXXIII": 294.0,
    "SrLyce": 97.0,
    "rhidoxxx": 65.0,
    "jte-ken": 109.0,
    "betterrrrrr": 173.0
  },
  "actions": {
    "preflop": [
      "Asiento 1: wsx25 (1.87 € en fichas)",
      "Asiento 2: BudyXXIII (5.88 € en fichas)",
      "Asiento 3: SrLyce (1.94 € en fichas)",
      "Asiento 4: rhidoxxx (1.30 € en fichas)",
      "Asiento 5: jte-ken (2.18 € en fichas)",
      "Asiento 6: betterrrrrr (3.46 € en fichas)",
      "jte-ken: pone la ciega pequeña 0.01 €",
      "betterrrrrr: pone la ciega grande 0.02 €",
      "wsx25: se retira",
      "BudyXXIII: se retira",
      "SrLyce: se retira",
      "rhidoxxx: sube 0.04 € a 0.06 €",
      "jte-ken: se retira",
      "betterrrrrr: se retira",
      "rhidoxxx: no muestra su mano",
      "Asiento 1: wsx25 se retiró antes del Flop (no apostó)",
      "Asiento 2: BudyXXIII se retiró antes del Flop (no apostó)",
      "Asiento 3: SrLyce se retiró antes del Flop (no apostó)",
      "Asiento 4: rhidoxxx (botón) recaudó (0.05 €)",
      "Asiento 5: jte-ken (ciega pequeña) se retiró antes del Flop",
      "Asiento 6: betterrrrrr (ciega grande) se retiró antes del Flop"
    ],
    "flop": [],
    "turn": [],
    "river": []
  },
  "board": [],
  "winner": "rhidoxxx",
  "win_amount": 2.5,
  "sb": 0.01,
  "bb": 0.02,
  "rake": 0.0,
  "raw_text": "Mano n.º 257215157581 de PokerStars:  Hold'em No Limit (0.01 €/0.02 € EUR) - 04-08-2025 22:27:57 CET [04-08-2025 16:27:57 ET]\nMesa \"Aldhafera II\" 6-max El asiento n.º 4 es el botón\nAsiento 1: wsx25 (1.87 € en fichas) \nAsiento 2: BudyXXIII (5.88 € en fichas) \nAsiento 3: SrLyce (1.94 € en fichas) \nAsiento 4: rhidoxxx (1.30 € en fichas) \nAsiento 5: jte-ken (2.18 € en fichas) \nAsiento 6: betterrrrrr (3.46 € en fichas) \njte-ken: pone la ciega pequeña 0.01 €\nbetterrrrrr: pone la ciega grande 0.02 €\n*** CARTAS DE MANO ***\nRepartidas a SrLyce [2c 8h]\nwsx25: se retira \nBudyXXIII: se retira \nSrLyce: se retira \nrhidoxxx: sube 0.04 € a 0.06 €\njte-ken: se retira \nbetterrrrrr: se retira \nLa apuesta no igualada (0.04 €) ha sido devuelta a rhidoxxx\nrhidoxxx se lleva 0.05 € del bote \nrhidoxxx: no muestra su mano \n*** RESUMEN ***\nBote total 0.05 € | Comisión 0 € \nAsiento 1: wsx25 se retiró antes del Flop (no apostó)\nAsiento 2: BudyXXIII se retiró antes del Flop (no apostó)\nAsiento 3: SrLyce se retiró antes del Flop (no apostó)\nAsiento 4: rhidoxxx (botón) recaudó (0.05 €)\nAsiento 5: jte-ken (ciega pequeña) se retiró antes del Flop\nAsiento 6: betterrrrrr (ciega grande) se retiró antes del Flop"
}