{
  "hand_id": "257237928495",
  "date": "06-08-2025 18:12:42",
  "table": "Nuwa III",
  "game_type": "holdem",
  "hero": "SrLyce",
  "hero_position": "",
  "hero_cards": [
    "9c",
    "8s"
  ],
  "stacks": {
    "xododo": 39.0,
    "BuXHexter": 101.0,
    "kcg_rm": 103.5,
    "SrLyce": 106.0,
    "acavada": 104.5
  },
  "actions": {
    "preflop": [
      "Asiento 1: xododo (0.78 € en fichas)",
      "Asiento 2: BuXHexter (2.02 € en fichas)",
      "Asiento 3: kcg_rm (2.07 € en fichas)",
      "Asiento 4: SrLyce (2.12 € en fichas)",
      "Asiento 6: acavada (2.09 € en fichas)",
      "SrLyce: pone la ciega pequeña 0.01 €",
      "acavada: pone la ciega grande 0.02 €",
      "xododo: se retira",
      "BuXHexter: se retira",
      "kcg_rm: se retira",
      "SrLyce: sube 0.03 € a 0.05 €",
      "acavada: se retira",
      "SrLyce: no muestra su mano",
      "Asiento 1: xododo se retiró antes del Flop (no apostó)",
      "Asiento 2: BuXHexter se retiró antes del Flop (no apostó)",
      "Asiento 3: kcg_rm (botón) se retiró antes del Flop (no apostó)",
      "Asiento 4: SrLyce (ciega pequeña) recaudó (0.04 €)",
      "Asiento 6: acavada (ciega grande) se retiró antes del Flop"
    ],
    "flop": [],
    "turn": [],
    "river": []
  },
  "board": [],
  "winner": "SrLyce",
  "win_amount": 2.0,
  "sb": 0.01,
  "bb": 0.02,
  "rake": 0.0,
  "raw_text": "Mano n.º 257237928495 de PokerStars:  Hold'em No Limit (0.01 €/0.02 € EUR) - 06-08-2025 18:12:42 CET [06-08-2025 12:12:42 ET]\nMesa \"Nuwa III\" 6-max El asiento n.º 3 es el botón\nAsiento 1: xododo (0.78 € en fichas) \nAsiento 2: BuXHexter (2.02 € en fichas) \nAsiento 3: kcg_rm (2.07 € en fichas) \nAsiento 4: SrLyce (2.12 € en fichas) \nAsiento 6: acavada (2.09 € en fichas) \nSrLyce: pone la ciega pequeña 0.01 €\nacavada: pone la ciega grande 0.02 €\n*** CARTAS DE MANO ***\nRepartidas a SrLyce [9c 8s]\nxododo: se retira \nBuXHexter: se retira \nkcg_rm: se retira \nserviettski(fr) se une a la mesa en el asiento n.º 5 \nSrLyce: sube 0.03 € a 0.05 €\nacavada: se retira \nLa apuesta no igualada (0.03 €) ha sido devuelta a SrLyce\nSrLyce se lleva 0.04 € del bote \nSrLyce: no muestra su mano \n*** RESUMEN ***\nBote total 0.04 € | Comisión 0 € \nAsiento 1: xododo se retiró antes del Flop (no apostó)\nAsiento 2: BuXHexter se retiró antes del Flop (no apostó)\nAsiento 3: kcg_rm (botón) se retiró antes del Flop (no apostó)\nAsiento 4: SrLyce (ciega pequeña) recaudó (0.04 €)\nAsiento 6: acavada (ciega grande) se retiró antes del Flop"
}