{
  "hand_id": "257237821356",
  "date": "06-08-2025 18:02:36",
  "table": "Nuwa III",
  "game_type": "holdem",
  "hero": "SrLyce",
  "hero_position": "",
  "hero_cards": [
    "Qh",
    "7c"
  ],
  "stacks": {
    "davinci1962": 118.0,
    "BuXHexter": 104.5,
    "kcg_rm": 107.0,
    "SrLyce": 94.0,
    "RiskAllinkali": 115.0,
    "acavada": 102.5
  },
  "actions": {
    "preflop": [
      "Asiento 1: davinci1962 (2.36 € en fichas)",
      "Asiento 2: BuXHexter (2.09 € en fichas)",
      "Asiento 3: kcg_rm (2.14 € en fichas)",
      "Asiento 4: SrLyce (1.88 € en fichas)",
      "Asiento 5: RiskAllinkali (2.30 € en fichas)",
      "Asiento 6: acavada (2.05 € en fichas)",
      "RiskAllinkali: pone la ciega pequeña 0.01 €",
      "acavada: pone la ciega grande 0.02 €",
      "davinci1962: se retira",
      "BuXHexter: se retira",
      "kcg_rm: se retira",
      "SrLyce: sube 0.03 € a 0.05 €",
      "RiskAllinkali: se retira",
      "acavada: se retira",
      "SrLyce: no muestra su mano",
      "Asiento 1: davinci1962 se retiró antes del Flop (no apostó)",
      "Asiento 2: BuXHexter se retiró antes del Flop (no apostó)",
      "Asiento 3: kcg_rm se retiró antes del Flop (no apostó)",
      "Asiento 4: SrLyce (botón) recaudó (0.05 €)",
      "Asiento 5: RiskAllinkali (ciega pequeña) se retiró antes del Flop",
      "Asiento 6: acavada (ciega grande) se retiró antes del Flop"
    ],
    "flop": [],
    "turn": [],
    "river": []
  },
  "board": [],
  "winner": "SrLyce",
  "win_amount": 2.5,
  "sb": 0.01,
  "bb": 0.02,
  "rake": 0.0,
  "raw_text": "Mano n.º 257237821356 de PokerStars:  Hold'em No Limit (0.01 €/0.02 € EUR) - 06-08-2025 18:02:36 CET [06-08-2025 12:02:36 ET]\nMesa \"Nuwa III\" 6-max El asiento n.º 4 es el botón\nAsiento 1: davinci1962 (2.36 € en fichas) \nAsiento 2: BuXHexter (2.09 € en fichas) \nAsiento 3: kcg_rm (2.14 € en fichas) \nAsiento 4: SrLyce (1.88 € en fichas) \nAsiento 5: RiskAllinkali (2.30 € en fichas) \nAsiento 6: acavada (2.05 € en fichas) \nRiskAllinkali: pone la ciega pequeña 0.01 €\nacavada: pone la ciega grande 0.02 €\n*** CARTAS DE MANO ***\nRepartidas a SrLyce [Qh 7c]\ndavinci1962: se retira \nBuXHexter: se retira \nkcg_rm: se retira \nSrLyce: sube 0.03 € a 0.05 €\nRiskAllinkali: se retira \nacavada: se retira \nLa apuesta no igualada (0.03 €) ha sido devuelta a SrLyce\nSrLyce se lleva 0.05 € del bote \nSrLyce: no muestra su mano \n*** RESUMEN ***\nBote total 0.05 € | Comisión 0 € \nAsiento 1: davinci1962 se retiró antes del Flop (no apostó)\nAsiento 2: BuXHexter se retiró antes del Flop (no apostó)\nAsiento 3: kcg_rm se retiró antes del Flop (no apostó)\nAsiento 4: SrLyce (botón) recaudó (0.05 €)\nAsiento 5: RiskAllinkali (ciega pequeña) se retiró antes del Flop\nAsiento 6: acavada (ciega grande) se retiró antes del Flop"
}