{
  "hand_id": "257149164206",
  "date": "30-07-2025 22:12:34",
  "table": "Esclangona",
  "game_type": "holdem",
  "hero": "SrLyce",
  "hero_position": "",
  "hero_cards": [
    "5d",
    "5s"
  ],
  "stacks": {
    "SrLyce": 97.0,
    "NoahBolete": 123.0,
    "Davdgoni": 227.0,
    "DiaZzZ1": 100.0,
    "elketefaka1": 99.0
  },
  "actions": {
    "preflop": [
      "Asiento 2: SrLyce (1.94 € en fichas)",
      "Asiento 3: NoahBolete (2.46 € en fichas)",
      "Asiento 4: Davdgoni (4.54 € en fichas)",
      "Asiento 5: DiaZzZ1 (2 € en fichas)",
      "Asiento 6: elketefaka1 (1.98 € en fichas)",
      "SrLyce: pone la ciega pequeña 0.01 €",
      "NoahBolete: pone la ciega grande 0.02 €",
      "Davdgoni: sube 0.04 € a 0.06 €",
      "DiaZzZ1: se retira",
      "elketefaka1: se retira",
      "SrLyce: iguala 0.05 €",
      "NoahBolete: iguala 0.04 €"
    ],
    "flop": [
      "SrLyce: pasa",
      "NoahBolete: pasa",
      "Davdgoni: pasa"
    ],
    "turn": [
      "SrLyce: apuesta 0.06 €",
      "NoahBolete: iguala 0.06 €",
      "Davdgoni: sube 0.18 € a 0.24 €",
      "SrLyce: se retira",
      "NoahBolete: se retira",
      "Davdgoni: no muestra su mano",
      "Asiento 2: SrLyce (ciega pequeña) se retiró en el Turn",
      "Asiento 3: NoahBolete (ciega grande) se retiró en el Turn",
      "Asiento 4: Davdgoni recaudó (0.34 €)",
      "Asiento 5: DiaZzZ1 se retiró antes del Flop (no apostó)",
      "Asiento 6: elketefaka1 (botón) se retiró antes del Flop (no apostó)"
    ],
    "river": []
  },
  "board": [
    "4d",
    "9h",
    "Ts",
    "Js"
  ],
  "winner": "Davdgoni",
  "win_amount": 17.0,
  "sb": 0.01,
  "bb": 0.02,
  "rake": 1.0,
  "raw_text": "Mano n.º 257149164206 de PokerStars:  Hold'em No Limit (0.01 €/0.02 € EUR) - 30-07-2025 22:12:34 CET [30-07-2025 16:12:34 ET]\nMesa \"Esclangona\" 6-max El asiento n.º 6 es el botón\nAsiento 2: SrLyce (1.94 € en fichas) \nAsiento 3: NoahBolete (2.46 € en fichas) \nAsiento 4: Davdgoni (4.54 € en fichas) \nAsiento 5: DiaZzZ1 (2 € en fichas) \nAsiento 6: elketefaka1 (1.98 € en fichas) \nSrLyce: pone la ciega pequeña 0.01 €\nNoahBolete: pone la ciega grande 0.02 €\n*** CARTAS DE MANO ***\nRepartidas a SrLyce [5d 5s]\nDavdgoni: sube 0.04 € a 0.06 €\nDiaZzZ1: se retira \nansiedadd se une a la mesa en el asiento n.º 1 \nelketefaka1: se retira \nSrLyce: iguala 0.05 €\nNoahBolete: iguala 0.04 €\n*** FLOP *** [4d 9h Ts]\nSrLyce: pasa \nNoahBolete: pasa \nDavdgoni: pasa \n*** TURN *** [4d 9h Ts] [Js]\nSrLyce: apuesta 0.06 €\nNoahBolete: iguala 0.06 €\nDavdgoni: sube 0.18 € a 0.24 €\nSrLyce: se retira \nNoahBolete: se retira \nLa apuesta no igualada (0.18 €) ha sido devuelta a Davdgoni\nDavdgoni se lleva 0.34 € del bote \nDavdgoni: no muestra su mano \n*** RESUMEN ***\nBote total 0.36 € | Comisión 0.02 € \nComunitarias [4d 9h Ts Js]\nAsiento 2: SrLyce (ciega pequeña) se retiró en el Turn\nAsiento 3: NoahBolete (ciega grande) se retiró en el Turn\nAsiento 4: Davdgoni recaudó (0.34 €)\nAsiento 5: DiaZzZ1 se retiró antes del Flop (no apostó)\nAsiento 6: elketefaka1 (botón) se retiró antes del Flop (no apostó)"
}