{
  "hand_id": "257168256388",
  "date": "01-08-2025 11:14:00",
  "table": "Jupiter",
  "game_type": "holdem",
  "hero": "SrLyce",
  "hero_position": "",
  "hero_cards": [
    "Tc",
    "8h"
  ],
  "stacks": {
    "sifilis5": 100.0,
    "Filou203": 116.0,
    "SrLyce": 110.5,
    "LOLA19711971": 36.5,
    "dadou13mars": 225.0,
    "Alvii37": 96.0
  },
  "actions": {
    "preflop": [
      "Asiento 1: sifilis5 (2 € en fichas)",
      "Asiento 2: Filou203 (2.32 € en fichas)",
      "Asiento 3: SrLyce (2.21 € en fichas)",
      "Asiento 4: LOLA19711971 (0.73 € en fichas)",
      "Asiento 5: dadou13mars (4.50 € en fichas)",
      "Asiento 6: Alvii37 (1.92 € en fichas)",
      "LOLA19711971: pone la ciega pequeña 0.01 €",
      "dadou13mars: pone la ciega grande 0.02 €",
      "Alvii37: sube 0.04 € a 0.06 €",
      "sifilis5: se retira",
      "Filou203: se retira",
      "SrLyce: se retira",
      "LOLA19711971: se retira",
      "dadou13mars: se retira",
      "Alvii37: no muestra su mano",
      "Asiento 1: sifilis5 se retiró antes del Flop (no apostó)",
      "Asiento 2: Filou203 se retiró antes del Flop (no apostó)",
      "Asiento 3: SrLyce (botón) se retiró antes del Flop (no apostó)",
      "Asiento 4: LOLA19711971 (ciega pequeña) se retiró antes del Flop",
      "Asiento 5: dadou13mars (ciega grande) se retiró antes del Flop",
      "Asiento 6: Alvii37 recaudó (0.05 €)"
    ],
    "flop": [],
    "turn": [],
    "river": []
  },
  "board": [],
  "winner": "Alvii37",
  "win_amount": 2.5,
  "sb": 0.01,
  "bb": 0.02,
  "rake": 0.0,
  "raw_text": "Mano n.º 257168256388 de PokerStars:  Hold'em No Limit (0.01 €/0.02 € EUR) - 01-08-2025 11:14:00 CET [01-08-2025 5:14:00 ET]\nMesa \"Jupiter\" 6-max El asiento n.º 3 es el botón\nAsiento 1: sifilis5 (2 € en fichas) \nAsiento 2: Filou203 (2.32 € en fichas) \nAsiento 3: SrLyce (2.21 € en fichas) \nAsiento 4: LOLA19711971 (0.73 € en fichas) \nAsiento 5: dadou13mars (4.50 € en fichas) \nAsiento 6: Alvii37 (1.92 € en fichas) \nLOLA19711971: pone la ciega pequeña 0.01 €\ndadou13mars: pone la ciega grande 0.02 €\n*** CARTAS DE MANO ***\nRepartidas a SrLyce [Tc 8h]\nAlvii37: sube 0.04 € a 0.06 €\nsifilis5: se retira \nFilou203: se retira \nSrLyce: se retira \nLOLA19711971: se retira \ndadou13mars: se retira \nLa apuesta no igualada (0.04 €) ha sido devuelta a Alvii37\nAlvii37 se lleva 0.05 € del bote \nAlvii37: no muestra su mano \n*** RESUMEN ***\nBote total 0.05 € | Comisión 0 € \nAsiento 1: sifilis5 se retiró antes del Flop (no apostó)\nAsiento 2: Filou203 se retiró antes del Flop (no apostó)\nAsiento 3: SrLyce (botón) se retiró antes del Flop (no apostó)\nAsiento 4: LOLA19711971 (ciega pequeña) se retiró antes del Flop\nAsiento 5: dadou13mars (ciega grande) se retiró antes del Flop\nAsiento 6: Alvii37 recaudó (0.05 €)"
}