{
  "hand_id": "257168413899",
  "date": "01-08-2025 11:43:21",
  "table": "Jupiter",
  "game_type": "holdem",
  "hero": "SrLyce",
  "hero_position": "",
  "hero_cards": [
    "8s",
    "4d"
  ],
  "stacks": {
    "sifilis5": 98.5,
    "Tuerno": 100.0,
    "SrLyce": 112.5,
    "LOLA19711971": 40.5,
    "dadou13mars": 206.5,
    "Alvii37": 134.0
  },
  "actions": {
    "preflop": [
      "Asiento 1: sifilis5 (1.97 € en fichas)",
      "Asiento 2: Tuerno (2 € en fichas)",
      "Asiento 3: SrLyce (2.25 € en fichas)",
      "Asiento 4: LOLA19711971 (0.81 € en fichas)",
      "Asiento 5: dadou13mars (4.13 € en fichas)",
      "Asiento 6: Alvii37 (2.68 € en fichas)",
      "dadou13mars: pone la ciega pequeña 0.01 €",
      "Alvii37: pone la ciega grande 0.02 €",
      "Tuerno: pone la ciega grande 0.02 €",
      "sifilis5: se retira",
      "Tuerno: pasa",
      "SrLyce: se retira",
      "LOLA19711971: iguala 0.02 €",
      "dadou13mars: se retira",
      "Alvii37: pasa"
    ],
    "flop": [
      "Alvii37: pasa",
      "Tuerno: apuesta 0.10 €",
      "LOLA19711971: iguala 0.10 €",
      "Alvii37: se retira"
    ],
    "turn": [
      "Tuerno: pasa",
      "LOLA19711971: apuesta 0.25 €",
      "Tuerno: se retira",
      "Asiento 1: sifilis5 se retiró antes del Flop (no apostó)",
      "Asiento 2: Tuerno se retiró en el Turn",
      "Asiento 3: SrLyce se retiró antes del Flop (no apostó)",
      "Asiento 4: LOLA19711971 (botón) recaudó (0.25 €)",
      "Asiento 5: dadou13mars (ciega pequeña) se retiró antes del Flop",
      "Asiento 6: Alvii37 (ciega grande) se retiró en el Flop"
    ],
    "river": []
  },
  "board": [
    "Ks",
    "Tc",
    "Jc",
    "Qs"
  ],
  "winner": "LOLA19711971",
  "win_amount": 12.5,
  "sb": 0.01,
  "bb": 0.02,
  "rake": 1.0,
  "raw_text": "Mano n.º 257168413899 de PokerStars:  Hold'em No Limit (0.01 €/0.02 € EUR) - 01-08-2025 11:43:21 CET [01-08-2025 5:43:21 ET]\nMesa \"Jupiter\" 6-max El asiento n.º 4 es el botón\nAsiento 1: sifilis5 (1.97 € en fichas) \nAsiento 2: Tuerno (2 € en fichas) \nAsiento 3: SrLyce (2.25 € en fichas) \nAsiento 4: LOLA19711971 (0.81 € en fichas) \nAsiento 5: dadou13mars (4.13 € en fichas) \nAsiento 6: Alvii37 (2.68 € en fichas) \ndadou13mars: pone la ciega pequeña 0.01 €\nAlvii37: pone la ciega grande 0.02 €\nTuerno: pone la ciega grande 0.02 €\n*** CARTAS DE MANO ***\nRepartidas a SrLyce [8s 4d]\nsifilis5: se retira \nTuerno: pasa \nSrLyce: se retira \nLOLA19711971: iguala 0.02 €\ndadou13mars: se retira \nAlvii37: pasa \n*** FLOP *** [Ks Tc Jc]\nAlvii37: pasa \nTuerno: apuesta 0.10 €\nLOLA19711971: iguala 0.10 €\nAlvii37: se retira \n*** TURN *** [Ks Tc Jc] [Qs]\nTuerno: pasa \nLOLA19711971: apuesta 0.25 €\nTuerno: se retira \nLa apuesta no igualada (0.25 €) ha sido devuelta a LOLA19711971\nLOLA19711971 se lleva 0.25 € del bote \n*** RESUMEN ***\nBote total 0.27 € | Comisión 0.02 € \nComunitarias [Ks Tc Jc Qs]\nAsiento 1: sifilis5 se retiró antes del Flop (no apostó)\nAsiento 2: Tuerno se retiró en el Turn\nAsiento 3: SrLyce se retiró antes del Flop (no apostó)\nAsiento 4: LOLA19711971 (botón) recaudó (0.25 €)\nAsiento 5: dadou13mars (ciega pequeña) se retiró antes del Flop\nAsiento 6: Alvii37 (ciega grande) se retiró en el Flop"
}