{
  "hand_id": "257237774023",
  "date": "06-08-2025 17:57:04",
  "table": "Atreus",
  "game_type": "holdem",
  "hero": "SrLyce",
  "hero_position": "",
  "hero_cards": [
    "8d",
    "Qh"
  ],
  "stacks": {
    "PrendsCa": 108.0,
    "NRules82": 80.0,
    "JENOFONTE73": 132.5,
    "JGDOBLAS": 93.0,
    "SrLyce": 108.0
  },
  "actions": {
    "preflop": [
      "Asiento 1: PrendsCa (2.16 € en fichas)",
      "Asiento 2: NRules82 (1.60 € en fichas)",
      "Asiento 3: JENOFONTE73 (2.65 € en fichas)",
      "Asiento 4: JGDOBLAS (1.86 € en fichas)",
      "Asiento 5: SrLyce (2.16 € en fichas)",
      "SrLyce: pone la ciega pequeña 0.01 €",
      "PrendsCa: pone la ciega grande 0.02 €",
      "NRules82: se retira",
      "JENOFONTE73: se retira",
      "JGDOBLAS: sube 0.03 € a 0.05 €",
      "SrLyce: iguala 0.04 €",
      "PrendsCa: se retira"
    ],
    "flop": [
      "SrLyce: pasa",
      "JGDOBLAS: apuesta 0.07 €",
      "SrLyce: se retira",
      "JGDOBLAS: no muestra su mano",
      "Asiento 1: PrendsCa (ciega grande) se retiró antes del Flop",
      "Asiento 2: NRules82 se retiró antes del Flop (no apostó)",
      "Asiento 3: JENOFONTE73 se retiró antes del Flop (no apostó)",
      "Asiento 4: JGDOBLAS (botón) recaudó (0.11 €)",
      "Asiento 5: SrLyce (ciega pequeña) se retiró en el Flop"
    ],
    "turn": [],
    "river": []
  },
  "board": [
    "4s",
    "Tc",
    "3d"
  ],
  "winner": "JGDOBLAS",
  "win_amount": 5.5,
  "sb": 0.01,
  "bb": 0.02,
  "rake": 0.5,
  "raw_text": "Mano n.º 257237774023 de PokerStars:  Hold'em No Limit (0.01 €/0.02 € EUR) - 06-08-2025 17:57:04 CET [06-08-2025 11:57:04 ET]\nMesa \"Atreus\" 6-max El asiento n.º 4 es el botón\nAsiento 1: PrendsCa (2.16 € en fichas) \nAsiento 2: NRules82 (1.60 € en fichas) \nAsiento 3: JENOFONTE73 (2.65 € en fichas) \nAsiento 4: JGDOBLAS (1.86 € en fichas) \nAsiento 5: SrLyce (2.16 € en fichas) \nSrLyce: pone la ciega pequeña 0.01 €\nPrendsCa: pone la ciega grande 0.02 €\n*** CARTAS DE MANO ***\nRepartidas a SrLyce [8d Qh]\nNRules82: se retira \nJENOFONTE73: se retira \nJGDOBLAS: sube 0.03 € a 0.05 €\nSrLyce: iguala 0.04 €\nPrendsCa: se retira \n*** FLOP *** [4s Tc 3d]\nSrLyce: pasa \nJGDOBLAS: apuesta 0.07 €\nSrLyce: se retira \nLa apuesta no igualada (0.07 €) ha sido devuelta a JGDOBLAS\nJGDOBLAS se lleva 0.11 € del bote \nJGDOBLAS: no muestra su mano \n*** RESUMEN ***\nBote total 0.12 € | Comisión 0.01 € \nComunitarias [4s Tc 3d]\nAsiento 1: PrendsCa (ciega grande) se retiró antes del Flop\nAsiento 2: NRules82 se retiró antes del Flop (no apostó)\nAsiento 3: JENOFONTE73 se retiró antes del Flop (no apostó)\nAsiento 4: JGDOBLAS (botón) recaudó (0.11 €)\nAsiento 5: SrLyce (ciega pequeña) se retiró en el Flop"
}