{
  "hand_id": "257237059863",
  "date": "06-08-2025 17:36:00",
  "table": "Vanadis II",
  "game_type": "holdem",
  "hero": "SrLyce",
  "hero_position": "",
  "hero_cards": [
    "4h",
    "Qd"
  ],
  "stacks": {
    "sarabiagar": 98.0,
    "SrLyce": 97.0,
    "djrojas9": 97.0,
    "noreihh": 173.0,
    "chordewman": 111.5,
    "idigon": 148.5
  },
  "actions": {
    "preflop": [
      "Asiento 5: sarabiagar (1.96 € en fichas) está ausente",
      "Asiento 1: SrLyce (1.94 € en fichas)",
      "Asiento 2: djrojas9 (1.94 € en fichas)",
      "Asiento 3: noreihh (3.46 € en fichas)",
      "Asiento 4: chordewman (2.23 € en fichas)",
      "Asiento 6: idigon (2.97 € en fichas)",
      "noreihh: pone la ciega pequeña 0.01 €",
      "chordewman: pone la ciega grande 0.02 €",
      "sarabiagar: se ausenta",
      "idigon: se retira",
      "SrLyce: se retira",
      "djrojas9: sube 0.04 € a 0.06 €",
      "noreihh: se retira",
      "chordewman: se retira",
      "djrojas9: no muestra su mano",
      "Asiento 5: sarabiagar",
      "Asiento 1: SrLyce se retiró antes del Flop (no apostó)",
      "Asiento 2: djrojas9 (botón) recaudó (0.05 €)",
      "Asiento 3: noreihh (ciega pequeña) se retiró antes del Flop",
      "Asiento 4: chordewman (ciega grande) se retiró antes del Flop",
      "Asiento 6: idigon se retiró antes del Flop (no apostó)"
    ],
    "flop": [],
    "turn": [],
    "river": []
  },
  "board": [],
  "winner": "djrojas9",
  "win_amount": 2.5,
  "sb": 0.01,
  "bb": 0.02,
  "rake": 0.0,
  "raw_text": "Mano n.º 257237059863 de PokerStars:  Hold'em No Limit (0.01 €/0.02 € EUR) - 06-08-2025 17:36:00 CET [06-08-2025 11:36:00 ET]\nMesa \"Vanadis II\" 6-max El asiento n.º 2 es el botón\nAsiento 5: sarabiagar (1.96 € en fichas) está ausente\nAsiento 1: SrLyce (1.94 € en fichas) \nAsiento 2: djrojas9 (1.94 € en fichas) \nAsiento 3: noreihh (3.46 € en fichas) \nAsiento 4: chordewman (2.23 € en fichas) \nAsiento 6: idigon (2.97 € en fichas) \nnoreihh: pone la ciega pequeña 0.01 €\nchordewman: pone la ciega grande 0.02 €\nsarabiagar: se ausenta \n*** CARTAS DE MANO ***\nRepartidas a SrLyce [4h Qd]\nidigon: se retira \nSrLyce: se retira \ndjrojas9: sube 0.04 € a 0.06 €\nnoreihh: se retira \nchordewman: se retira \nLa apuesta no igualada (0.04 €) ha sido devuelta a djrojas9\ndjrojas9 se lleva 0.05 € del bote \ndjrojas9: no muestra su mano \n*** RESUMEN ***\nBote total 0.05 € | Comisión 0 € \nAsiento 5: sarabiagar\nAsiento 1: SrLyce se retiró antes del Flop (no apostó)\nAsiento 2: djrojas9 (botón) recaudó (0.05 €)\nAsiento 3: noreihh (ciega pequeña) se retiró antes del Flop\nAsiento 4: chordewman (ciega grande) se retiró antes del Flop\nAsiento 6: idigon se retiró antes del Flop (no apostó)"
}