{
  "hand_id": "257238603975",
  "date": "06-08-2025 19:13:44",
  "table": "Adelaide III",
  "game_type": "holdem",
  "hero": "SrLyce",
  "hero_position": "",
  "hero_cards": [
    "8s",
    "3s"
  ],
  "stacks": {
    "Alceo27": 100.0,
    "aliendee07": 66.0,
    "Macklemore0": 107.5,
    "SrLyce": 125.0,
    "ismagonzalez7": 43.0,
    "pauquair5": 46.0
  },
  "actions": {
    "preflop": [
      "Asiento 1: Alceo27 (2 € en fichas)",
      "Asiento 2: aliendee07 (1.32 € en fichas)",
      "Asiento 3: Macklemore0 (2.15 € en fichas)",
      "Asiento 4: SrLyce (2.50 € en fichas)",
      "Asiento 5: ismagonzalez7 (0.86 € en fichas)",
      "Asiento 6: pauquair5 (0.92 € en fichas)",
      "aliendee07: pone la ciega pequeña 0.01 €",
      "Macklemore0: pone la ciega grande 0.02 €",
      "SrLyce: se retira",
      "ismagonzalez7: sube 0.02 € a 0.04 €",
      "pauquair5: se retira",
      "Alceo27: se retira",
      "aliendee07: sube 0.02 € a 0.06 €",
      "Macklemore0: se retira",
      "ismagonzalez7: iguala 0.02 €"
    ],
    "flop": [
      "aliendee07: apuesta 1.26 € y está all-in",
      "ismagonzalez7: se retira",
      "aliendee07: no muestra su mano",
      "Asiento 1: Alceo27 (botón) se retiró antes del Flop (no apostó)",
      "Asiento 2: aliendee07 (ciega pequeña) recaudó (0.13 €)",
      "Asiento 3: Macklemore0 (ciega grande) se retiró antes del Flop",
      "Asiento 4: SrLyce se retiró antes del Flop (no apostó)",
      "Asiento 5: ismagonzalez7 se retiró en el Flop",
      "Asiento 6: pauquair5 se retiró antes del Flop (no apostó)"
    ],
    "turn": [],
    "river": []
  },
  "board": [
    "5c",
    "3d",
    "9h"
  ],
  "winner": "aliendee07",
  "win_amount": 6.5,
  "sb": 0.01,
  "bb": 0.02,
  "rake": 0.5,
  "raw_text": "Mano n.º 257238603975 de PokerStars:  Hold'em No Limit (0.01 €/0.02 € EUR) - 06-08-2025 19:13:44 CET [06-08-2025 13:13:44 ET]\nMesa \"Adelaide III\" 6-max El asiento n.º 1 es el botón\nAsiento 1: Alceo27 (2 € en fichas) \nAsiento 2: aliendee07 (1.32 € en fichas) \nAsiento 3: Macklemore0 (2.15 € en fichas) \nAsiento 4: SrLyce (2.50 € en fichas) \nAsiento 5: ismagonzalez7 (0.86 € en fichas) \nAsiento 6: pauquair5 (0.92 € en fichas) \naliendee07: pone la ciega pequeña 0.01 €\nMacklemore0: pone la ciega grande 0.02 €\n*** CARTAS DE MANO ***\nRepartidas a SrLyce [8s 3s]\nSrLyce: se retira \nismagonzalez7: sube 0.02 € a 0.04 €\npauquair5: se retira \nAlceo27: se retira \npauquair5 deja la mesa\naliendee07: sube 0.02 € a 0.06 €\nMacklemore0: se retira \nismagonzalez7: iguala 0.02 €\n*** FLOP *** [5c 3d 9h]\naliendee07: apuesta 1.26 € y está all-in\nismagonzalez7: se retira \nLa apuesta no igualada (1.26 €) ha sido devuelta a aliendee07\naliendee07 se lleva 0.13 € del bote \naliendee07: no muestra su mano \n*** RESUMEN ***\nBote total 0.14 € | Comisión 0.01 € \nComunitarias [5c 3d 9h]\nAsiento 1: Alceo27 (botón) se retiró antes del Flop (no apostó)\nAsiento 2: aliendee07 (ciega pequeña) recaudó (0.13 €)\nAsiento 3: Macklemore0 (ciega grande) se retiró antes del Flop\nAsiento 4: SrLyce se retiró antes del Flop (no apostó)\nAsiento 5: ismagonzalez7 se retiró en el Flop\nAsiento 6: pauquair5 se retiró antes del Flop (no apostó)"
}