{
  "hand_id": "257214909013",
  "date": "04-08-2025 22:12:11",
  "table": "Lycomedes III",
  "game_type": "holdem",
  "hero": "SrLyce",
  "hero_position": "",
  "hero_cards": [
    "9c",
    "Ah"
  ],
  "stacks": {
    "ranton77": 100.0,
    "SrLyce": 100.0
  },
  "actions": {
    "preflop": [
      "﻿Mano n.º 257214909013 de PokerStars:  Hold'em No Limit (0.01 €/0.02 € EUR) - 04-08-2025 22:12:11 CET [04-08-2025 16:12:11 ET]",
      "Asiento 1: ranton77 (2 € en fichas)",
      "Asiento 4: SrLyce (2 € en fichas)",
      "ranton77: pone la ciega pequeña 0.01 €",
      "SrLyce: pone la ciega grande 0.02 €",
      "ranton77: se retira",
      "SrLyce: no muestra su mano",
      "Asiento 1: ranton77 (botón) (ciega pequeña) se retiró antes del Flop",
      "Asiento 4: SrLyce (ciega grande) recaudó (0.02 €)"
    ],
    "flop": [],
    "turn": [],
    "river": []
  },
  "board": [],
  "winner": "SrLyce",
  "win_amount": 1.0,
  "sb": 0.01,
  "bb": 0.02,
  "rake": 0.0,
  "raw_text": "﻿Mano n.º 257214909013 de PokerStars:  Hold'em No Limit (0.01 €/0.02 € EUR) - 04-08-2025 22:12:11 CET [04-08-2025 16:12:11 ET]\nMesa \"Lycomedes III\" 6-max El asiento n.º 1 es el botón\nAsiento 1: ranton77 (2 € en fichas) \nAsiento 4: SrLyce (2 € en fichas) \nranton77: pone la ciega pequeña 0.01 €\nSrLyce: pone la ciega grande 0.02 €\n*** CARTAS DE MANO ***\nRepartidas a SrLyce [9c Ah]\nranton77: se retira \nLa apuesta no igualada (0.01 €) ha sido devuelta a SrLyce\nranton77 deja la mesa\nSrLyce se lleva 0.02 € del bote \nSrLyce: no muestra su mano \n*** RESUMEN ***\nBote total 0.02 € | Comisión 0 € \nAsiento 1: ranton77 (botón) (ciega pequeña) se retiró antes del Flop\nAsiento 4: SrLyce (ciega grande) recaudó (0.02 €)"
}