{
  "hand_id": "257150439097",
  "date": "30-07-2025 23:41:55",
  "table": "Mizuho",
  "game_type": "holdem",
  "hero": "SrLyce",
  "hero_position": "",
  "hero_cards": [
    "Ad",
    "Kd"
  ],
  "stacks": {
    "benipoker123": 109.5,
    "SrLyce": 96.5,
    "JstLeonel": 125.0,
    "Ozzy3110": 245.0,
    "toonsy2010": 136.5,
    "mivipkr": 166.5
  },
  "actions": {
    "preflop": [
      "Asiento 1: benipoker123 (2.19 € en fichas)",
      "Asiento 2: SrLyce (1.93 € en fichas)",
      "Asiento 3: JstLeonel (2.50 € en fichas)",
      "Asiento 4: Ozzy3110 (4.90 € en fichas)",
      "Asiento 5: toonsy2010 (2.73 € en fichas)",
      "Asiento 6: mivipkr (3.33 € en fichas)",
      "JstLeonel: pone la ciega pequeña 0.01 €",
      "Ozzy3110: pone la ciega grande 0.02 €",
      "toonsy2010: se retira",
      "mivipkr: se retira",
      "benipoker123: se retira",
      "SrLyce: sube 0.04 € a 0.06 €",
      "JstLeonel: se retira",
      "Ozzy3110: se retira",
      "SrLyce: no muestra su mano",
      "Asiento 1: benipoker123 se retiró antes del Flop (no apostó)",
      "Asiento 2: SrLyce (botón) recaudó (0.05 €)",
      "Asiento 3: JstLeonel (ciega pequeña) se retiró antes del Flop",
      "Asiento 4: Ozzy3110 (ciega grande) se retiró antes del Flop",
      "Asiento 5: toonsy2010 se retiró antes del Flop (no apostó)",
      "Asiento 6: mivipkr se retiró antes del Flop (no apostó)"
    ],
    "flop": [],
    "turn": [],
    "river": []
  },
  "board": [],
  "winner": "SrLyce",
  "win_amount": 2.5,
  "sb": 0.01,
  "bb": 0.02,
  "rake": 0.0,
  "raw_text": "Mano n.º 257150439097 de PokerStars:  Hold'em No Limit (0.01 €/0.02 € EUR) - 30-07-2025 23:41:55 CET [30-07-2025 17:41:55 ET]\nMesa \"Mizuho\" 6-max El asiento n.º 2 es el botón\nAsiento 1: benipoker123 (2.19 € en fichas) \nAsiento 2: SrLyce (1.93 € en fichas) \nAsiento 3: JstLeonel (2.50 € en fichas) \nAsiento 4: Ozzy3110 (4.90 € en fichas) \nAsiento 5: toonsy2010 (2.73 € en fichas) \nAsiento 6: mivipkr (3.33 € en fichas) \nJstLeonel: pone la ciega pequeña 0.01 €\nOzzy3110: pone la ciega grande 0.02 €\n*** CARTAS DE MANO ***\nRepartidas a SrLyce [Ad Kd]\ntoonsy2010: se retira \nmivipkr: se retira \nbenipoker123: se retira \nSrLyce: sube 0.04 € a 0.06 €\nJstLeonel: se retira \nOzzy3110: se retira \nLa apuesta no igualada (0.04 €) ha sido devuelta a SrLyce\nSrLyce se lleva 0.05 € del bote \nSrLyce: no muestra su mano \n*** RESUMEN ***\nBote total 0.05 € | Comisión 0 € \nAsiento 1: benipoker123 se retiró antes del Flop (no apostó)\nAsiento 2: SrLyce (botón) recaudó (0.05 €)\nAsiento 3: JstLeonel (ciega pequeña) se retiró antes del Flop\nAsiento 4: Ozzy3110 (ciega grande) se retiró antes del Flop\nAsiento 5: toonsy2010 se retiró antes del Flop (no apostó)\nAsiento 6: mivipkr se retiró antes del Flop (no apostó)"
}