{
  "hand_id": "257238629028",
  "date": "06-08-2025 19:15:49",
  "table": "Leonteus",
  "game_type": "holdem",
  "hero": "SrLyce",
  "hero_position": "",
  "hero_cards": [
    "3h",
    "4s"
  ],
  "stacks": {
    "practikal_C23": 47.5,
    "BuXHexter": 145.5,
    "niyomalo": 100.0,
    "davinci1962": 149.5,
    "Andark47": 211.0,
    "SrLyce": 59.0
  },
  "actions": {
    "preflop": [
      "Asiento 1: practikal_C23 (0.95 € en fichas) está ausente",
      "Asiento 4: BuXHexter (2.91 € en fichas) está ausente",
      "Asiento 2: niyomalo (2 € en fichas)",
      "Asiento 3: davinci1962 (2.99 € en fichas)",
      "Asiento 5: Andark47 (4.22 € en fichas)",
      "Asiento 6: SrLyce (1.18 € en fichas)",
      "Andark47: pone la ciega pequeña 0.01 €",
      "SrLyce: pone la ciega grande 0.02 €",
      "niyomalo: pone la ciega grande 0.02 €",
      "niyomalo: pasa",
      "davinci1962: iguala 0.02 €",
      "Andark47: sube 0.12 € a 0.14 €",
      "SrLyce: se retira",
      "niyomalo: se retira",
      "davinci1962: se retira",
      "Andark47: no muestra su mano",
      "Asiento 1: practikal_C23",
      "Asiento 4: BuXHexter",
      "Asiento 2: niyomalo se retiró antes del Flop (no apostó)",
      "Asiento 3: davinci1962 (botón) se retiró antes del Flop",
      "Asiento 5: Andark47 (ciega pequeña) recaudó (0.08 €)",
      "Asiento 6: SrLyce (ciega grande) se retiró antes del Flop"
    ],
    "flop": [],
    "turn": [],
    "river": []
  },
  "board": [],
  "winner": "Andark47",
  "win_amount": 4.0,
  "sb": 0.01,
  "bb": 0.02,
  "rake": 0.0,
  "raw_text": "Mano n.º 257238629028 de PokerStars:  Hold'em No Limit (0.01 €/0.02 € EUR) - 06-08-2025 19:15:49 CET [06-08-2025 13:15:49 ET]\nMesa \"Leonteus\" 6-max El asiento n.º 3 es el botón\nAsiento 1: practikal_C23 (0.95 € en fichas) está ausente\nAsiento 4: BuXHexter (2.91 € en fichas) está ausente\nAsiento 2: niyomalo (2 € en fichas) \nAsiento 3: davinci1962 (2.99 € en fichas) \nAsiento 5: Andark47 (4.22 € en fichas) \nAsiento 6: SrLyce (1.18 € en fichas) \nAndark47: pone la ciega pequeña 0.01 €\nSrLyce: pone la ciega grande 0.02 €\nniyomalo: pone la ciega grande 0.02 €\n*** CARTAS DE MANO ***\nRepartidas a SrLyce [3h 4s]\nniyomalo: pasa \ndavinci1962: iguala 0.02 €\nAndark47: sube 0.12 € a 0.14 €\nSrLyce: se retira \nniyomalo: se retira \ndavinci1962: se retira \nLa apuesta no igualada (0.12 €) ha sido devuelta a Andark47\nAndark47 se lleva 0.08 € del bote \nAndark47: no muestra su mano \n*** RESUMEN ***\nBote total 0.08 € | Comisión 0 € \nAsiento 1: practikal_C23\nAsiento 4: BuXHexter\nAsiento 2: niyomalo se retiró antes del Flop (no apostó)\nAsiento 3: davinci1962 (botón) se retiró antes del Flop\nAsiento 5: Andark47 (ciega pequeña) recaudó (0.08 €)\nAsiento 6: SrLyce (ciega grande) se retiró antes del Flop"
}