{
  "hand_id": "257168222853",
  "date": "01-08-2025 11:07:25",
  "table": "Jupiter",
  "game_type": "holdem",
  "hero": "SrLyce",
  "hero_position": "",
  "hero_cards": [
    "8c",
    "9d"
  ],
  "stacks": {
    "sifilis5": 100.0,
    "Filou203": 117.0,
    "SrLyce": 100.5,
    "LOLA19711971": 27.5,
    "dadou13mars": 229.5,
    "Alvii37": 95.5
  },
  "actions": {
    "preflop": [
      "Asiento 1: sifilis5 (2 € en fichas)",
      "Asiento 2: Filou203 (2.34 € en fichas)",
      "Asiento 3: SrLyce (2.01 € en fichas)",
      "Asiento 4: LOLA19711971 (0.55 € en fichas)",
      "Asiento 5: dadou13mars (4.59 € en fichas)",
      "Asiento 6: Alvii37 (1.91 € en fichas)",
      "SrLyce: pone la ciega pequeña 0.01 €",
      "LOLA19711971: pone la ciega grande 0.02 €",
      "dadou13mars: sube 0.04 € a 0.06 €",
      "Alvii37: sube 0.12 € a 0.18 €",
      "sifilis5: se retira",
      "Filou203: se retira",
      "SrLyce: se retira",
      "LOLA19711971: se retira",
      "dadou13mars: se retira",
      "Alvii37: no muestra su mano",
      "Asiento 1: sifilis5 se retiró antes del Flop (no apostó)",
      "Asiento 2: Filou203 (botón) se retiró antes del Flop (no apostó)",
      "Asiento 3: SrLyce (ciega pequeña) se retiró antes del Flop",
      "Asiento 4: LOLA19711971 (ciega grande) se retiró antes del Flop",
      "Asiento 5: dadou13mars se retiró antes del Flop",
      "Asiento 6: Alvii37 recaudó (0.15 €)"
    ],
    "flop": [],
    "turn": [],
    "river": []
  },
  "board": [],
  "winner": "Alvii37",
  "win_amount": 7.5,
  "sb": 0.01,
  "bb": 0.02,
  "rake": 0.0,
  "raw_text": "Mano n.º 257168222853 de PokerStars:  Hold'em No Limit (0.01 €/0.02 € EUR) - 01-08-2025 11:07:25 CET [01-08-2025 5:07:25 ET]\nMesa \"Jupiter\" 6-max El asiento n.º 2 es el botón\nAsiento 1: sifilis5 (2 € en fichas) \nAsiento 2: Filou203 (2.34 € en fichas) \nAsiento 3: SrLyce (2.01 € en fichas) \nAsiento 4: LOLA19711971 (0.55 € en fichas) \nAsiento 5: dadou13mars (4.59 € en fichas) \nAsiento 6: Alvii37 (1.91 € en fichas) \nSrLyce: pone la ciega pequeña 0.01 €\nLOLA19711971: pone la ciega grande 0.02 €\n*** CARTAS DE MANO ***\nRepartidas a SrLyce [8c 9d]\ndadou13mars: sube 0.04 € a 0.06 €\nAlvii37: sube 0.12 € a 0.18 €\nsifilis5: se retira \nFilou203: se retira \nSrLyce: se retira \nLOLA19711971: se retira \ndadou13mars: se retira \nLa apuesta no igualada (0.12 €) ha sido devuelta a Alvii37\nAlvii37 se lleva 0.15 € del bote \nAlvii37: no muestra su mano \n*** RESUMEN ***\nBote total 0.15 € | Comisión 0 € \nAsiento 1: sifilis5 se retiró antes del Flop (no apostó)\nAsiento 2: Filou203 (botón) se retiró antes del Flop (no apostó)\nAsiento 3: SrLyce (ciega pequeña) se retiró antes del Flop\nAsiento 4: LOLA19711971 (ciega grande) se retiró antes del Flop\nAsiento 5: dadou13mars se retiró antes del Flop\nAsiento 6: Alvii37 recaudó (0.15 €)"
}