{
  "hand_id": "257148605169",
  "date": "30-07-2025 21:31:09",
  "table": "Sirona",
  "game_type": "holdem",
  "hero": "SrLyce",
  "hero_position": "",
  "hero_cards": [
    "5s",
    "7d"
  ],
  "stacks": {
    "olibellier": 40.0,
    "SrLyce": 36.5,
    "lecontrebandier": 99.0,
    "christoph363": 181.0,
    "oliverdu70": 97.5,
    "Dakoo44": 101.5
  },
  "actions": {
    "preflop": [
      "Asiento 5: olibellier (0.80 € en fichas) está ausente",
      "Asiento 1: SrLyce (0.73 € en fichas)",
      "Asiento 2: lecontrebandier (1.98 € en fichas)",
      "Asiento 3: christoph363 (3.62 € en fichas)",
      "Asiento 4: oliverdu70 (1.95 € en fichas)",
      "Asiento 6: Dakoo44 (2.03 € en fichas)",
      "lecontrebandier: pone la ciega pequeña 0.01 €",
      "christoph363: pone la ciega grande 0.02 €",
      "olibellier: se ausenta",
      "oliverdu70: se retira",
      "Dakoo44: se retira",
      "SrLyce: se retira",
      "lecontrebandier: sube 0.02 € a 0.04 €",
      "christoph363: se retira",
      "lecontrebandier: no muestra su mano",
      "Asiento 5: olibellier",
      "Asiento 1: SrLyce (botón) se retiró antes del Flop (no apostó)",
      "Asiento 2: lecontrebandier (ciega pequeña) recaudó (0.04 €)",
      "Asiento 3: christoph363 (ciega grande) se retiró antes del Flop",
      "Asiento 4: oliverdu70 se retiró antes del Flop (no apostó)",
      "Asiento 6: Dakoo44 se retiró antes del Flop (no apostó)"
    ],
    "flop": [],
    "turn": [],
    "river": []
  },
  "board": [],
  "winner": "lecontrebandier",
  "win_amount": 2.0,
  "sb": 0.01,
  "bb": 0.02,
  "rake": 0.0,
  "raw_text": "Mano n.º 257148605169 de PokerStars:  Hold'em No Limit (0.01 €/0.02 € EUR) - 30-07-2025 21:31:09 CET [30-07-2025 15:31:09 ET]\nMesa \"Sirona\" 6-max El asiento n.º 1 es el botón\nAsiento 5: olibellier (0.80 € en fichas) está ausente\nAsiento 1: SrLyce (0.73 € en fichas) \nAsiento 2: lecontrebandier (1.98 € en fichas) \nAsiento 3: christoph363 (3.62 € en fichas) \nAsiento 4: oliverdu70 (1.95 € en fichas) \nAsiento 6: Dakoo44 (2.03 € en fichas) \nlecontrebandier: pone la ciega pequeña 0.01 €\nchristoph363: pone la ciega grande 0.02 €\nolibellier: se ausenta \n*** CARTAS DE MANO ***\nRepartidas a SrLyce [5s 7d]\noliverdu70: se retira \nDakoo44: se retira \nSrLyce: se retira \nlecontrebandier: sube 0.02 € a 0.04 €\nchristoph363: se retira \nLa apuesta no igualada (0.02 €) ha sido devuelta a lecontrebandier\nlecontrebandier se lleva 0.04 € del bote \nlecontrebandier: no muestra su mano \n*** RESUMEN ***\nBote total 0.04 € | Comisión 0 € \nAsiento 5: olibellier\nAsiento 1: SrLyce (botón) se retiró antes del Flop (no apostó)\nAsiento 2: lecontrebandier (ciega pequeña) recaudó (0.04 €)\nAsiento 3: christoph363 (ciega grande) se retiró antes del Flop\nAsiento 4: oliverdu70 se retiró antes del Flop (no apostó)\nAsiento 6: Dakoo44 se retiró antes del Flop (no apostó)"
}