{
  "hand_id": "257238118645",
  "date": "06-08-2025 18:29:44",
  "table": "Atreus",
  "game_type": "holdem",
  "hero": "SrLyce",
  "hero_position": "",
  "hero_cards": [
    "7s",
    "Jc"
  ],
  "stacks": {
    "PrendsCa": 102.5,
    "NRules82": 30.0,
    "JENOFONTE73": 167.0,
    "Fharock": 89.5,
    "SrLyce": 127.0,
    "FishamanReggae": 31.0
  },
  "actions": {
    "preflop": [
      "Asiento 1: PrendsCa (2.05 € en fichas)",
      "Asiento 2: NRules82 (0.60 € en fichas)",
      "Asiento 3: JENOFONTE73 (3.34 € en fichas)",
      "Asiento 4: Fharock (1.79 € en fichas)",
      "Asiento 5: SrLyce (2.54 € en fichas)",
      "Asiento 6: FishamanReggae (0.62 € en fichas)",
      "Fharock: pone la ciega pequeña 0.01 €",
      "SrLyce: pone la ciega grande 0.02 €",
      "FishamanReggae: iguala 0.02 €",
      "PrendsCa: se retira",
      "NRules82: sube 0.02 € a 0.04 €",
      "JENOFONTE73: iguala 0.04 €",
      "Fharock: se retira",
      "SrLyce: iguala 0.02 €",
      "FishamanReggae: iguala 0.02 €"
    ],
    "flop": [
      "SrLyce: pasa",
      "FishamanReggae: pasa",
      "NRules82: apuesta 0.06 €",
      "JENOFONTE73: se retira",
      "SrLyce: se retira",
      "FishamanReggae: se retira",
      "Asiento 1: PrendsCa se retiró antes del Flop (no apostó)",
      "Asiento 2: NRules82 recaudó (0.16 €)",
      "Asiento 3: JENOFONTE73 (botón) se retiró en el Flop",
      "Asiento 4: Fharock (ciega pequeña) se retiró antes del Flop",
      "Asiento 5: SrLyce (ciega grande) se retiró en el Flop",
      "Asiento 6: FishamanReggae se retiró en el Flop"
    ],
    "turn": [],
    "river": []
  },
  "board": [
    "6h",
    "5s",
    "9d"
  ],
  "winner": "NRules82",
  "win_amount": 8.0,
  "sb": 0.01,
  "bb": 0.02,
  "rake": 0.5,
  "raw_text": "Mano n.º 257238118645 de PokerStars:  Hold'em No Limit (0.01 €/0.02 € EUR) - 06-08-2025 18:29:44 CET [06-08-2025 12:29:44 ET]\nMesa \"Atreus\" 6-max El asiento n.º 3 es el botón\nAsiento 1: PrendsCa (2.05 € en fichas) \nAsiento 2: NRules82 (0.60 € en fichas) \nAsiento 3: JENOFONTE73 (3.34 € en fichas) \nAsiento 4: Fharock (1.79 € en fichas) \nAsiento 5: SrLyce (2.54 € en fichas) \nAsiento 6: FishamanReggae (0.62 € en fichas) \nFharock: pone la ciega pequeña 0.01 €\nSrLyce: pone la ciega grande 0.02 €\n*** CARTAS DE MANO ***\nRepartidas a SrLyce [7s Jc]\nFishamanReggae: iguala 0.02 €\nPrendsCa: se retira \nNRules82: sube 0.02 € a 0.04 €\nJENOFONTE73: iguala 0.04 €\nFharock: se retira \nSrLyce: iguala 0.02 €\nFishamanReggae: iguala 0.02 €\n*** FLOP *** [6h 5s 9d]\nSrLyce: pasa \nFishamanReggae: pasa \nNRules82: apuesta 0.06 €\nJENOFONTE73: se retira \nSrLyce: se retira \nFishamanReggae: se retira \nLa apuesta no igualada (0.06 €) ha sido devuelta a NRules82\nNRules82 se lleva 0.16 € del bote \n*** RESUMEN ***\nBote total 0.17 € | Comisión 0.01 € \nComunitarias [6h 5s 9d]\nAsiento 1: PrendsCa se retiró antes del Flop (no apostó)\nAsiento 2: NRules82 recaudó (0.16 €)\nAsiento 3: JENOFONTE73 (botón) se retiró en el Flop\nAsiento 4: Fharock (ciega pequeña) se retiró antes del Flop\nAsiento 5: SrLyce (ciega grande) se retiró en el Flop\nAsiento 6: FishamanReggae se retiró en el Flop"
}