{
  "hand_id": "257149151048",
  "date": "30-07-2025 22:11:37",
  "table": "Sirona",
  "game_type": "holdem",
  "hero": "SrLyce",
  "hero_position": "",
  "hero_cards": [
    "Kd",
    "6s"
  ],
  "stacks": {
    "oliverdu70": 186.0,
    "hadhod1976": 40.0,
    "SrLyce": 132.5,
    "Tropki": 100.5,
    "christoph363": 218.5,
    "MitchATP65": 103.0
  },
  "actions": {
    "preflop": [
      "Asiento 4: oliverdu70 (3.72 € en fichas) está ausente",
      "Asiento 5: hadhod1976 (0.80 € en fichas) está ausente",
      "Asiento 1: SrLyce (2.65 € en fichas)",
      "Asiento 2: Tropki (2.01 € en fichas)",
      "Asiento 3: christoph363 (4.37 € en fichas)",
      "Asiento 6: MitchATP65 (2.06 € en fichas)",
      "Tropki: pone la ciega pequeña 0.01 €",
      "christoph363: pone la ciega grande 0.02 €",
      "MitchATP65: se retira",
      "SrLyce: se retira",
      "Tropki: se retira",
      "Asiento 4: oliverdu70",
      "Asiento 5: hadhod1976",
      "Asiento 1: SrLyce (botón) se retiró antes del Flop (no apostó)",
      "Asiento 2: Tropki (ciega pequeña) se retiró antes del Flop",
      "Asiento 3: christoph363 (ciega grande) recaudó (0.02 €)",
      "Asiento 6: MitchATP65 se retiró antes del Flop (no apostó)"
    ],
    "flop": [],
    "turn": [],
    "river": []
  },
  "board": [],
  "winner": "christoph363",
  "win_amount": 1.0,
  "sb": 0.01,
  "bb": 0.02,
  "rake": 0.0,
  "raw_text": "Mano n.º 257149151048 de PokerStars:  Hold'em No Limit (0.01 €/0.02 € EUR) - 30-07-2025 22:11:37 CET [30-07-2025 16:11:37 ET]\nMesa \"Sirona\" 6-max El asiento n.º 1 es el botón\nAsiento 4: oliverdu70 (3.72 € en fichas) está ausente\nAsiento 5: hadhod1976 (0.80 € en fichas) está ausente\nAsiento 1: SrLyce (2.65 € en fichas) \nAsiento 2: Tropki (2.01 € en fichas) \nAsiento 3: christoph363 (4.37 € en fichas) \nAsiento 6: MitchATP65 (2.06 € en fichas) \nTropki: pone la ciega pequeña 0.01 €\nchristoph363: pone la ciega grande 0.02 €\n*** CARTAS DE MANO ***\nRepartidas a SrLyce [Kd 6s]\nMitchATP65: se retira \nSrLyce: se retira \nTropki: se retira \nLa apuesta no igualada (0.01 €) ha sido devuelta a christoph363\nchristoph363 se lleva 0.02 € del bote \n*** RESUMEN ***\nBote total 0.02 € | Comisión 0 € \nAsiento 4: oliverdu70\nAsiento 5: hadhod1976\nAsiento 1: SrLyce (botón) se retiró antes del Flop (no apostó)\nAsiento 2: Tropki (ciega pequeña) se retiró antes del Flop\nAsiento 3: christoph363 (ciega grande) recaudó (0.02 €)\nAsiento 6: MitchATP65 se retiró antes del Flop (no apostó)"
}