{
  "hand_id": "257215302267",
  "date": "04-08-2025 22:36:55",
  "table": "Anneliese II",
  "game_type": "holdem",
  "hero": "SrLyce",
  "hero_position": "",
  "hero_cards": [
    "4c",
    "7s"
  ],
  "stacks": {
    "betterrrrrr": 107.0,
    "Aadivinas": 100.0,
    "piropanzer": 35.5,
    "SrLyce": 89.5,
    "Mr_Pkr98": 154.0,
    "Spotick": 128.5
  },
  "actions": {
    "preflop": [
      "Asiento 1: betterrrrrr (2.14 € en fichas) está ausente",
      "Asiento 3: Aadivinas (2 € en fichas) está ausente",
      "Asiento 2: piropanzer (0.71 € en fichas)",
      "Asiento 4: SrLyce (1.79 € en fichas)",
      "Asiento 5: Mr_Pkr98 (3.08 € en fichas)",
      "Asiento 6: Spotick (2.57 € en fichas)",
      "SrLyce: pone la ciega pequeña 0.01 €",
      "Mr_Pkr98: pone la ciega grande 0.02 €",
      "Spotick: se retira",
      "piropanzer: se retira",
      "SrLyce: se retira",
      "Mr_Pkr98: no muestra su mano",
      "Asiento 1: betterrrrrr",
      "Asiento 3: Aadivinas",
      "Asiento 2: piropanzer (botón) se retiró antes del Flop (no apostó)",
      "Asiento 4: SrLyce (ciega pequeña) se retiró antes del Flop",
      "Asiento 5: Mr_Pkr98 (ciega grande) recaudó (0.02 €)",
      "Asiento 6: Spotick se retiró antes del Flop (no apostó)"
    ],
    "flop": [],
    "turn": [],
    "river": []
  },
  "board": [],
  "winner": "Mr_Pkr98",
  "win_amount": 1.0,
  "sb": 0.01,
  "bb": 0.02,
  "rake": 0.0,
  "raw_text": "Mano n.º 257215302267 de PokerStars:  Hold'em No Limit (0.01 €/0.02 € EUR) - 04-08-2025 22:36:55 CET [04-08-2025 16:36:55 ET]\nMesa \"Anneliese II\" 6-max El asiento n.º 2 es el botón\nAsiento 1: betterrrrrr (2.14 € en fichas) está ausente\nAsiento 3: Aadivinas (2 € en fichas) está ausente\nAsiento 2: piropanzer (0.71 € en fichas) \nAsiento 4: SrLyce (1.79 € en fichas) \nAsiento 5: Mr_Pkr98 (3.08 € en fichas) \nAsiento 6: Spotick (2.57 € en fichas) \nSrLyce: pone la ciega pequeña 0.01 €\nMr_Pkr98: pone la ciega grande 0.02 €\n*** CARTAS DE MANO ***\nRepartidas a SrLyce [4c 7s]\nSpotick: se retira \npiropanzer: se retira \nSrLyce: se retira \nLa apuesta no igualada (0.01 €) ha sido devuelta a Mr_Pkr98\nMr_Pkr98 se lleva 0.02 € del bote \nMr_Pkr98: no muestra su mano \n*** RESUMEN ***\nBote total 0.02 € | Comisión 0 € \nAsiento 1: betterrrrrr\nAsiento 3: Aadivinas\nAsiento 2: piropanzer (botón) se retiró antes del Flop (no apostó)\nAsiento 4: SrLyce (ciega pequeña) se retiró antes del Flop\nAsiento 5: Mr_Pkr98 (ciega grande) recaudó (0.02 €)\nAsiento 6: Spotick se retiró antes del Flop (no apostó)"
}