{
  "hand_id": "257150455947",
  "date": "30-07-2025 23:43:07",
  "table": "Mizuho",
  "game_type": "holdem",
  "hero": "SrLyce",
  "hero_position": "",
  "hero_cards": [
    "3d",
    "2s"
  ],
  "stacks": {
    "benipoker123": 109.5,
    "SrLyce": 95.0,
    "JstLeonel": 117.0,
    "Ozzy3110": 243.5,
    "toonsy2010": 146.0,
    "mivipkr": 167.0
  },
  "actions": {
    "preflop": [
      "Asiento 1: benipoker123 (2.19 € en fichas)",
      "Asiento 2: SrLyce (1.90 € en fichas)",
      "Asiento 3: JstLeonel (2.34 € en fichas)",
      "Asiento 4: Ozzy3110 (4.87 € en fichas)",
      "Asiento 5: toonsy2010 (2.92 € en fichas)",
      "Asiento 6: mivipkr (3.34 € en fichas)",
      "mivipkr: pone la ciega pequeña 0.01 €",
      "benipoker123: pone la ciega grande 0.02 €",
      "SrLyce: se retira",
      "JstLeonel: se retira",
      "Ozzy3110: sube 0.03 € a 0.05 €",
      "toonsy2010: iguala 0.05 €",
      "mivipkr: se retira",
      "benipoker123: iguala 0.03 €"
    ],
    "flop": [
      "benipoker123: pasa",
      "Ozzy3110: apuesta 0.05 €",
      "toonsy2010: sube 0.13 € a 0.18 €",
      "benipoker123: iguala 0.18 €",
      "Ozzy3110: se retira"
    ],
    "turn": [
      "benipoker123: pasa",
      "toonsy2010: pasa"
    ],
    "river": [
      "benipoker123: apuesta 0.04 €",
      "toonsy2010: iguala 0.04 €",
      "benipoker123: muestra [Ks 3s] (doble pareja, damas y treses)",
      "toonsy2010: muestra [9h Ad] (doble pareja, ases y damas)",
      "Asiento 1: benipoker123 (ciega grande) muestra [Ks 3s] y perdió con doble pareja, damas y treses",
      "Asiento 2: SrLyce se retiró antes del Flop (no apostó)",
      "Asiento 3: JstLeonel se retiró antes del Flop (no apostó)",
      "Asiento 4: Ozzy3110 se retiró en el Flop",
      "Asiento 5: toonsy2010 (botón) muestra [9h Ad] y ganó (0.61 €) con doble pareja, ases y damas",
      "Asiento 6: mivipkr (ciega pequeña) se retiró antes del Flop"
    ]
  },
  "board": [
    "3h",
    "Qc",
    "Qd",
    "6c",
    "Ah"
  ],
  "winner": "toonsy2010",
  "win_amount": 30.5,
  "sb": 0.01,
  "bb": 0.02,
  "rake": 2.0,
  "raw_text": "Mano n.º 257150455947 de PokerStars:  Hold'em No Limit (0.01 €/0.02 € EUR) - 30-07-2025 23:43:07 CET [30-07-2025 17:43:07 ET]\nMesa \"Mizuho\" 6-max El asiento n.º 5 es el botón\nAsiento 1: benipoker123 (2.19 € en fichas) \nAsiento 2: SrLyce (1.90 € en fichas) \nAsiento 3: JstLeonel (2.34 € en fichas) \nAsiento 4: Ozzy3110 (4.87 € en fichas) \nAsiento 5: toonsy2010 (2.92 € en fichas) \nAsiento 6: mivipkr (3.34 € en fichas) \nmivipkr: pone la ciega pequeña 0.01 €\nbenipoker123: pone la ciega grande 0.02 €\n*** CARTAS DE MANO ***\nRepartidas a SrLyce [3d 2s]\nSrLyce: se retira \nJstLeonel: se retira \nOzzy3110: sube 0.03 € a 0.05 €\ntoonsy2010: iguala 0.05 €\nmivipkr: se retira \nbenipoker123: iguala 0.03 €\n*** FLOP *** [3h Qc Qd]\nbenipoker123: pasa \nOzzy3110: apuesta 0.05 €\ntoonsy2010: sube 0.13 € a 0.18 €\nbenipoker123: iguala 0.18 €\nOzzy3110: se retira \n*** TURN *** [3h Qc Qd] [6c]\nbenipoker123: pasa \ntoonsy2010: pasa \n*** RIVER *** [3h Qc Qd 6c] [Ah]\nbenipoker123: apuesta 0.04 €\ntoonsy2010: iguala 0.04 €\n*** SHOW DOWN ***\nbenipoker123: muestra [Ks 3s] (doble pareja, damas y treses)\ntoonsy2010: muestra [9h Ad] (doble pareja, ases y damas)\ntoonsy2010 se lleva 0.61 € del bote \n*** RESUMEN ***\nBote total 0.65 € | Comisión 0.04 € \nComunitarias [3h Qc Qd 6c Ah]\nAsiento 1: benipoker123 (ciega grande) muestra [Ks 3s] y perdió con doble pareja, damas y treses\nAsiento 2: SrLyce se retiró antes del Flop (no apostó)\nAsiento 3: JstLeonel se retiró antes del Flop (no apostó)\nAsiento 4: Ozzy3110 se retiró en el Flop\nAsiento 5: toonsy2010 (botón) muestra [9h Ad] y ganó (0.61 €) con doble pareja, ases y damas\nAsiento 6: mivipkr (ciega pequeña) se retiró antes del Flop"
}