{
  "hand_id": "257168365253",
  "date": "01-08-2025 11:34:30",
  "table": "Atlas",
  "game_type": "holdem",
  "hero": "SrLyce",
  "hero_position": "",
  "hero_cards": [
    "Kd",
    "As"
  ],
  "stacks": {
    "SrLyce": 90.5,
    "Fharock": 114.0,
    "ecuinas": 103.5,
    "LxckxStrxkx": 113.5,
    "soy_cule74": 100.0,
    "Akourdideh": 108.0
  },
  "actions": {
    "preflop": [
      "Asiento 1: SrLyce (1.81 € en fichas)",
      "Asiento 2: Fharock (2.28 € en fichas)",
      "Asiento 3: ecuinas (2.07 € en fichas)",
      "Asiento 4: LxckxStrxkx (2.27 € en fichas)",
      "Asiento 5: soy_cule74 (2 € en fichas)",
      "Asiento 6: Akourdideh (2.16 € en fichas)",
      "ecuinas: pone la ciega pequeña 0.01 €",
      "LxckxStrxkx: pone la ciega grande 0.02 €",
      "soy_cule74: se retira",
      "Akourdideh: se retira",
      "SrLyce: sube 0.04 € a 0.06 €",
      "Fharock: se retira",
      "ecuinas: iguala 0.05 €",
      "LxckxStrxkx: iguala 0.04 €"
    ],
    "flop": [
      "ecuinas: pasa",
      "LxckxStrxkx: pasa",
      "SrLyce: apuesta 0.07 €",
      "ecuinas: iguala 0.07 €",
      "LxckxStrxkx: se retira"
    ],
    "turn": [
      "ecuinas: pasa",
      "SrLyce: apuesta 0.21 €",
      "ecuinas: iguala 0.21 €"
    ],
    "river": [
      "ecuinas: pasa",
      "SrLyce: apuesta 1.47 € y está all-in",
      "ecuinas: se retira [Qd]",
      "SrLyce: no muestra su mano",
      "Asiento 1: SrLyce recaudó (0.70 €)",
      "Asiento 2: Fharock (botón) se retiró antes del Flop (no apostó)",
      "Asiento 3: ecuinas (ciega pequeña) se retiró en el River",
      "Asiento 4: LxckxStrxkx (ciega grande) se retiró en el Flop",
      "Asiento 5: soy_cule74 se retiró antes del Flop (no apostó)",
      "Asiento 6: Akourdideh se retiró antes del Flop (no apostó)"
    ]
  },
  "board": [
    "Jd",
    "Qs",
    "Ts",
    "4h",
    "2d"
  ],
  "winner": "SrLyce",
  "win_amount": 35.0,
  "sb": 0.01,
  "bb": 0.02,
  "rake": 2.0,
  "raw_text": "Mano n.º 257168365253 de PokerStars:  Hold'em No Limit (0.01 €/0.02 € EUR) - 01-08-2025 11:34:30 CET [01-08-2025 5:34:30 ET]\nMesa \"Atlas\" 6-max El asiento n.º 2 es el botón\nAsiento 1: SrLyce (1.81 € en fichas) \nAsiento 2: Fharock (2.28 € en fichas) \nAsiento 3: ecuinas (2.07 € en fichas) \nAsiento 4: LxckxStrxkx (2.27 € en fichas) \nAsiento 5: soy_cule74 (2 € en fichas) \nAsiento 6: Akourdideh (2.16 € en fichas) \necuinas: pone la ciega pequeña 0.01 €\nLxckxStrxkx: pone la ciega grande 0.02 €\n*** CARTAS DE MANO ***\nRepartidas a SrLyce [Kd As]\nsoy_cule74: se retira \nAkourdideh: se retira \nSrLyce: sube 0.04 € a 0.06 €\nFharock: se retira \necuinas: iguala 0.05 €\nLxckxStrxkx: iguala 0.04 €\n*** FLOP *** [Jd Qs Ts]\necuinas: pasa \nLxckxStrxkx: pasa \nSrLyce: apuesta 0.07 €\necuinas: iguala 0.07 €\nLxckxStrxkx: se retira \n*** TURN *** [Jd Qs Ts] [4h]\necuinas: pasa \nSrLyce: apuesta 0.21 €\necuinas: iguala 0.21 €\n*** RIVER *** [Jd Qs Ts 4h] [2d]\necuinas: pasa \nSrLyce: apuesta 1.47 € y está all-in\necuinas: se retira [Qd]\nLa apuesta no igualada (1.47 €) ha sido devuelta a SrLyce\nSrLyce se lleva 0.70 € del bote \nSrLyce: no muestra su mano \n*** RESUMEN ***\nBote total 0.74 € | Comisión 0.04 € \nComunitarias [Jd Qs Ts 4h 2d]\nAsiento 1: SrLyce recaudó (0.70 €)\nAsiento 2: Fharock (botón) se retiró antes del Flop (no apostó)\nAsiento 3: ecuinas (ciega pequeña) se retiró en el River\nAsiento 4: LxckxStrxkx (ciega grande) se retiró en el Flop\nAsiento 5: soy_cule74 se retiró antes del Flop (no apostó)\nAsiento 6: Akourdideh se retiró antes del Flop (no apostó)"
}