{
  "hand_id": "257238646703",
  "date": "06-08-2025 19:17:18",
  "table": "Adelaide III",
  "game_type": "holdem",
  "hero": "SrLyce",
  "hero_position": "",
  "hero_cards": [
    "3h",
    "4s"
  ],
  "stacks": {
    "Macklemore0": 106.5,
    "Alceo27": 105.0,
    "aliendee07": 68.0,
    "SrLyce": 130.0,
    "ismagonzalez7": 29.0,
    "McFlash3": 100.0
  },
  "actions": {
    "preflop": [
      "Asiento 3: Macklemore0 (2.13 € en fichas) está ausente",
      "Asiento 1: Alceo27 (2.10 € en fichas)",
      "Asiento 2: aliendee07 (1.36 € en fichas)",
      "Asiento 4: SrLyce (2.60 € en fichas)",
      "Asiento 5: ismagonzalez7 (0.58 € en fichas)",
      "Asiento 6: McFlash3 (2 € en fichas)",
      "ismagonzalez7: pone la ciega pequeña 0.01 €",
      "McFlash3: pone la ciega grande 0.02 €",
      "Alceo27: se retira",
      "aliendee07: se retira",
      "SrLyce: se retira",
      "ismagonzalez7: se retira",
      "McFlash3: no muestra su mano",
      "Asiento 3: Macklemore0",
      "Asiento 1: Alceo27 se retiró antes del Flop (no apostó)",
      "Asiento 2: aliendee07 se retiró antes del Flop (no apostó)",
      "Asiento 4: SrLyce (botón) se retiró antes del Flop (no apostó)",
      "Asiento 5: ismagonzalez7 (ciega pequeña) se retiró antes del Flop",
      "Asiento 6: McFlash3 (ciega grande) recaudó (0.02 €)"
    ],
    "flop": [],
    "turn": [],
    "river": []
  },
  "board": [],
  "winner": "McFlash3",
  "win_amount": 1.0,
  "sb": 0.01,
  "bb": 0.02,
  "rake": 0.0,
  "raw_text": "Mano n.º 257238646703 de PokerStars:  Hold'em No Limit (0.01 €/0.02 € EUR) - 06-08-2025 19:17:18 CET [06-08-2025 13:17:18 ET]\nMesa \"Adelaide III\" 6-max El asiento n.º 4 es el botón\nAsiento 3: Macklemore0 (2.13 € en fichas) está ausente\nAsiento 1: Alceo27 (2.10 € en fichas) \nAsiento 2: aliendee07 (1.36 € en fichas) \nAsiento 4: SrLyce (2.60 € en fichas) \nAsiento 5: ismagonzalez7 (0.58 € en fichas) \nAsiento 6: McFlash3 (2 € en fichas) \nismagonzalez7: pone la ciega pequeña 0.01 €\nMcFlash3: pone la ciega grande 0.02 €\n*** CARTAS DE MANO ***\nRepartidas a SrLyce [3h 4s]\nAlceo27: se retira \naliendee07: se retira \nSrLyce: se retira \nismagonzalez7: se retira \nLa apuesta no igualada (0.01 €) ha sido devuelta a McFlash3\nMcFlash3 se lleva 0.02 € del bote \nMcFlash3: no muestra su mano \n*** RESUMEN ***\nBote total 0.02 € | Comisión 0 € \nAsiento 3: Macklemore0\nAsiento 1: Alceo27 se retiró antes del Flop (no apostó)\nAsiento 2: aliendee07 se retiró antes del Flop (no apostó)\nAsiento 4: SrLyce (botón) se retiró antes del Flop (no apostó)\nAsiento 5: ismagonzalez7 (ciega pequeña) se retiró antes del Flop\nAsiento 6: McFlash3 (ciega grande) recaudó (0.02 €)"
}