{
  "hand_id": "257168372450",
  "date": "01-08-2025 11:35:48",
  "table": "Atlas",
  "game_type": "holdem",
  "hero": "SrLyce",
  "hero_position": "",
  "hero_cards": [
    "Qs",
    "2h"
  ],
  "stacks": {
    "SrLyce": 108.5,
    "Fharock": 114.0,
    "ecuinas": 86.5,
    "LxckxStrxkx": 110.5,
    "soy_cule74": 100.0,
    "Akourdideh": 108.0
  },
  "actions": {
    "preflop": [
      "Asiento 1: SrLyce (2.17 € en fichas)",
      "Asiento 2: Fharock (2.28 € en fichas)",
      "Asiento 3: ecuinas (1.73 € en fichas)",
      "Asiento 4: LxckxStrxkx (2.21 € en fichas)",
      "Asiento 5: soy_cule74 (2 € en fichas)",
      "Asiento 6: Akourdideh (2.16 € en fichas)",
      "LxckxStrxkx: pone la ciega pequeña 0.01 €",
      "soy_cule74: pone la ciega grande 0.02 €",
      "Akourdideh: se retira",
      "SrLyce: se retira",
      "Fharock: sube 0.04 € a 0.06 €",
      "ecuinas: sube 0.15 € a 0.21 €",
      "LxckxStrxkx: se retira",
      "soy_cule74: se retira",
      "Fharock: se retira",
      "ecuinas: no muestra su mano",
      "Asiento 1: SrLyce se retiró antes del Flop (no apostó)",
      "Asiento 2: Fharock se retiró antes del Flop",
      "Asiento 3: ecuinas (botón) recaudó (0.15 €)",
      "Asiento 4: LxckxStrxkx (ciega pequeña) se retiró antes del Flop",
      "Asiento 5: soy_cule74 (ciega grande) se retiró antes del Flop",
      "Asiento 6: Akourdideh se retiró antes del Flop (no apostó)"
    ],
    "flop": [],
    "turn": [],
    "river": []
  },
  "board": [],
  "winner": "ecuinas",
  "win_amount": 7.5,
  "sb": 0.01,
  "bb": 0.02,
  "rake": 0.0,
  "raw_text": "Mano n.º 257168372450 de PokerStars:  Hold'em No Limit (0.01 €/0.02 € EUR) - 01-08-2025 11:35:48 CET [01-08-2025 5:35:48 ET]\nMesa \"Atlas\" 6-max El asiento n.º 3 es el botón\nAsiento 1: SrLyce (2.17 € en fichas) \nAsiento 2: Fharock (2.28 € en fichas) \nAsiento 3: ecuinas (1.73 € en fichas) \nAsiento 4: LxckxStrxkx (2.21 € en fichas) \nAsiento 5: soy_cule74 (2 € en fichas) \nAsiento 6: Akourdideh (2.16 € en fichas) \nLxckxStrxkx: pone la ciega pequeña 0.01 €\nsoy_cule74: pone la ciega grande 0.02 €\n*** CARTAS DE MANO ***\nRepartidas a SrLyce [Qs 2h]\nAkourdideh: se retira \nSrLyce: se retira \nFharock: sube 0.04 € a 0.06 €\necuinas: sube 0.15 € a 0.21 €\nLxckxStrxkx: se retira \nsoy_cule74: se retira \nFharock: se retira \nLa apuesta no igualada (0.15 €) ha sido devuelta a ecuinas\necuinas se lleva 0.15 € del bote \necuinas: no muestra su mano \n*** RESUMEN ***\nBote total 0.15 € | Comisión 0 € \nAsiento 1: SrLyce se retiró antes del Flop (no apostó)\nAsiento 2: Fharock se retiró antes del Flop\nAsiento 3: ecuinas (botón) recaudó (0.15 €)\nAsiento 4: LxckxStrxkx (ciega pequeña) se retiró antes del Flop\nAsiento 5: soy_cule74 (ciega grande) se retiró antes del Flop\nAsiento 6: Akourdideh se retiró antes del Flop (no apostó)"
}