{
  "hand_id": "257150487425",
  "date": "30-07-2025 23:45:25",
  "table": "Mizuho",
  "game_type": "holdem",
  "hero": "SrLyce",
  "hero_position": "",
  "hero_cards": [
    "2c",
    "9s"
  ],
  "stacks": {
    "benipoker123": 99.5,
    "SrLyce": 75.5,
    "JstLeonel": 117.0,
    "Ozzy3110": 311.0,
    "toonsy2010": 102.0,
    "mivipkr": 166.5
  },
  "actions": {
    "preflop": [
      "Asiento 1: benipoker123 (1.99 € en fichas)",
      "Asiento 2: SrLyce (1.51 € en fichas)",
      "Asiento 3: JstLeonel (2.34 € en fichas)",
      "Asiento 4: Ozzy3110 (6.22 € en fichas)",
      "Asiento 5: toonsy2010 (2.04 € en fichas)",
      "Asiento 6: mivipkr (3.33 € en fichas)",
      "SrLyce: pone la ciega pequeña 0.01 €",
      "JstLeonel: pone la ciega grande 0.02 €",
      "Ozzy3110: se retira",
      "toonsy2010: iguala 0.02 €",
      "mivipkr: se retira",
      "benipoker123: se retira",
      "SrLyce: se retira",
      "JstLeonel: pasa"
    ],
    "flop": [
      "JstLeonel: pasa",
      "toonsy2010: apuesta 0.05 €",
      "JstLeonel: iguala 0.05 €"
    ],
    "turn": [
      "JstLeonel: pasa",
      "toonsy2010: pasa"
    ],
    "river": [
      "JstLeonel: pasa",
      "toonsy2010: pasa",
      "JstLeonel: muestra [Ad 6s] (doble pareja, ases y nueves)",
      "toonsy2010: descarta su mano sin mostrar",
      "Asiento 1: benipoker123 (botón) se retiró antes del Flop (no apostó)",
      "Asiento 2: SrLyce (ciega pequeña) se retiró antes del Flop",
      "Asiento 3: JstLeonel (ciega grande) muestra [Ad 6s] y ganó (0.14 €) con doble pareja, ases y nueves",
      "Asiento 4: Ozzy3110 se retiró antes del Flop (no apostó)",
      "Asiento 5: toonsy2010 descartó sin mostrar [8s 6h]",
      "Asiento 6: mivipkr se retiró antes del Flop (no apostó)"
    ]
  },
  "board": [
    "Ah",
    "7s",
    "9c",
    "Qd",
    "9h"
  ],
  "winner": "JstLeonel",
  "win_amount": 7.0,
  "sb": 0.01,
  "bb": 0.02,
  "rake": 0.5,
  "raw_text": "Mano n.º 257150487425 de PokerStars:  Hold'em No Limit (0.01 €/0.02 € EUR) - 30-07-2025 23:45:25 CET [30-07-2025 17:45:25 ET]\nMesa \"Mizuho\" 6-max El asiento n.º 1 es el botón\nAsiento 1: benipoker123 (1.99 € en fichas) \nAsiento 2: SrLyce (1.51 € en fichas) \nAsiento 3: JstLeonel (2.34 € en fichas) \nAsiento 4: Ozzy3110 (6.22 € en fichas) \nAsiento 5: toonsy2010 (2.04 € en fichas) \nAsiento 6: mivipkr (3.33 € en fichas) \nSrLyce: pone la ciega pequeña 0.01 €\nJstLeonel: pone la ciega grande 0.02 €\n*** CARTAS DE MANO ***\nRepartidas a SrLyce [2c 9s]\nOzzy3110: se retira \ntoonsy2010: iguala 0.02 €\nmivipkr: se retira \nbenipoker123 ha agotado su tiempo\nbenipoker123: se retira \nSrLyce: se retira \nJstLeonel: pasa \n*** FLOP *** [Ah 7s 9c]\nJstLeonel: pasa \ntoonsy2010: apuesta 0.05 €\nJstLeonel: iguala 0.05 €\n*** TURN *** [Ah 7s 9c] [Qd]\nJstLeonel: pasa \ntoonsy2010: pasa \n*** RIVER *** [Ah 7s 9c Qd] [9h]\nJstLeonel: pasa \ntoonsy2010: pasa \n*** SHOW DOWN ***\nJstLeonel: muestra [Ad 6s] (doble pareja, ases y nueves)\ntoonsy2010: descarta su mano sin mostrar \nJstLeonel se lleva 0.14 € del bote \n*** RESUMEN ***\nBote total 0.15 € | Comisión 0.01 € \nComunitarias [Ah 7s 9c Qd 9h]\nAsiento 1: benipoker123 (botón) se retiró antes del Flop (no apostó)\nAsiento 2: SrLyce (ciega pequeña) se retiró antes del Flop\nAsiento 3: JstLeonel (ciega grande) muestra [Ad 6s] y ganó (0.14 €) con doble pareja, ases y nueves\nAsiento 4: Ozzy3110 se retiró antes del Flop (no apostó)\nAsiento 5: toonsy2010 descartó sin mostrar [8s 6h]\nAsiento 6: mivipkr se retiró antes del Flop (no apostó)"
}