{
  "hand_id": "257215207168",
  "date": "04-08-2025 22:31:01",
  "table": "Anneliese II",
  "game_type": "holdem",
  "hero": "SrLyce",
  "hero_position": "",
  "hero_cards": [
    "Tc",
    "Ts"
  ],
  "stacks": {
    "ElManu62": 122.0,
    "betterrrrrr": 103.0,
    "piropanzer": 33.5,
    "SrLyce": 98.5,
    "Mr_Pkr98": 143.0,
    "Spotick": 117.5
  },
  "actions": {
    "preflop": [
      "Asiento 3: ElManu62 (2.44 € en fichas) está ausente",
      "Asiento 1: betterrrrrr (2.06 € en fichas)",
      "Asiento 2: piropanzer (0.67 € en fichas)",
      "Asiento 4: SrLyce (1.97 € en fichas)",
      "Asiento 5: Mr_Pkr98 (2.86 € en fichas)",
      "Asiento 6: Spotick (2.35 € en fichas)",
      "betterrrrrr: pone la ciega pequeña 0.01 €",
      "piropanzer: pone la ciega grande 0.02 €",
      "SrLyce: sube 0.04 € a 0.06 €",
      "Mr_Pkr98: se retira",
      "Spotick: sube 0.11 € a 0.17 €",
      "betterrrrrr: se retira",
      "piropanzer: se retira",
      "SrLyce: iguala 0.11 €"
    ],
    "flop": [
      "SrLyce: pasa",
      "Spotick: pasa"
    ],
    "turn": [
      "SrLyce: apuesta 0.14 €",
      "Spotick: iguala 0.14 €"
    ],
    "river": [
      "SrLyce: pasa",
      "Spotick: apuesta 0.31 €",
      "SrLyce: se retira",
      "Spotick: no muestra su mano",
      "Asiento 3: ElManu62",
      "Asiento 1: betterrrrrr (ciega pequeña) se retiró antes del Flop",
      "Asiento 2: piropanzer (ciega grande) se retiró antes del Flop",
      "Asiento 4: SrLyce se retiró en el River",
      "Asiento 5: Mr_Pkr98 se retiró antes del Flop (no apostó)",
      "Asiento 6: Spotick (botón) recaudó (0.61 €)"
    ]
  },
  "board": [
    "Ad",
    "5h",
    "9c",
    "Jc",
    "Qd"
  ],
  "winner": "Spotick",
  "win_amount": 30.5,
  "sb": 0.01,
  "bb": 0.02,
  "rake": 2.0,
  "raw_text": "Mano n.º 257215207168 de PokerStars:  Hold'em No Limit (0.01 €/0.02 € EUR) - 04-08-2025 22:31:01 CET [04-08-2025 16:31:01 ET]\nMesa \"Anneliese II\" 6-max El asiento n.º 6 es el botón\nAsiento 3: ElManu62 (2.44 € en fichas) está ausente\nAsiento 1: betterrrrrr (2.06 € en fichas) \nAsiento 2: piropanzer (0.67 € en fichas) \nAsiento 4: SrLyce (1.97 € en fichas) \nAsiento 5: Mr_Pkr98 (2.86 € en fichas) \nAsiento 6: Spotick (2.35 € en fichas) \nbetterrrrrr: pone la ciega pequeña 0.01 €\npiropanzer: pone la ciega grande 0.02 €\n*** CARTAS DE MANO ***\nRepartidas a SrLyce [Tc Ts]\nSrLyce: sube 0.04 € a 0.06 €\nMr_Pkr98: se retira \nSpotick: sube 0.11 € a 0.17 €\nbetterrrrrr: se retira \npiropanzer: se retira \nSrLyce: iguala 0.11 €\n*** FLOP *** [Ad 5h 9c]\nSrLyce: pasa \nSpotick: pasa \n*** TURN *** [Ad 5h 9c] [Jc]\nSrLyce: apuesta 0.14 €\nSpotick: iguala 0.14 €\n*** RIVER *** [Ad 5h 9c Jc] [Qd]\nSrLyce: pasa \nSpotick: apuesta 0.31 €\nSrLyce: se retira \nLa apuesta no igualada (0.31 €) ha sido devuelta a Spotick\nSpotick se lleva 0.61 € del bote \nSpotick: no muestra su mano \n*** RESUMEN ***\nBote total 0.65 € | Comisión 0.04 € \nComunitarias [Ad 5h 9c Jc Qd]\nAsiento 3: ElManu62\nAsiento 1: betterrrrrr (ciega pequeña) se retiró antes del Flop\nAsiento 2: piropanzer (ciega grande) se retiró antes del Flop\nAsiento 4: SrLyce se retiró en el River\nAsiento 5: Mr_Pkr98 se retiró antes del Flop (no apostó)\nAsiento 6: Spotick (botón) recaudó (0.61 €)"
}