{
  "hand_id": "257150461463",
  "date": "30-07-2025 23:43:31",
  "table": "Martha",
  "game_type": "holdem",
  "hero": "SrLyce",
  "hero_position": "",
  "hero_cards": [
    "9h",
    "8c"
  ],
  "stacks": {
    "mivipkr": 106.0,
    "NovacaineZxc": 120.0,
    "BudyXXIII": 111.0,
    "Sigiilo": 100.0,
    "SrLyce": 98.0,
    "alexfw300": 104.5
  },
  "actions": {
    "preflop": [
      "Asiento 1: mivipkr (2.12 € en fichas)",
      "Asiento 2: NovacaineZxc (2.40 € en fichas)",
      "Asiento 3: BudyXXIII (2.22 € en fichas)",
      "Asiento 4: Sigiilo (2 € en fichas)",
      "Asiento 5: SrLyce (1.96 € en fichas)",
      "Asiento 6: alexfw300 (2.09 € en fichas)",
      "BudyXXIII: pone la ciega pequeña 0.01 €",
      "Sigiilo: pone la ciega grande 0.02 €",
      "SrLyce: se retira",
      "alexfw300: sube 0.03 € a 0.05 €",
      "mivipkr: se retira",
      "NovacaineZxc: se retira",
      "BudyXXIII: se retira",
      "Sigiilo: sube 0.19 € a 0.24 €",
      "alexfw300: se retira",
      "Sigiilo: no muestra su mano",
      "Asiento 1: mivipkr se retiró antes del Flop (no apostó)",
      "Asiento 2: NovacaineZxc (botón) se retiró antes del Flop (no apostó)",
      "Asiento 3: BudyXXIII (ciega pequeña) se retiró antes del Flop",
      "Asiento 4: Sigiilo (ciega grande) recaudó (0.11 €)",
      "Asiento 5: SrLyce se retiró antes del Flop (no apostó)",
      "Asiento 6: alexfw300 se retiró antes del Flop"
    ],
    "flop": [],
    "turn": [],
    "river": []
  },
  "board": [],
  "winner": "Sigiilo",
  "win_amount": 5.5,
  "sb": 0.01,
  "bb": 0.02,
  "rake": 0.0,
  "raw_text": "Mano n.º 257150461463 de PokerStars:  Hold'em No Limit (0.01 €/0.02 € EUR) - 30-07-2025 23:43:31 CET [30-07-2025 17:43:31 ET]\nMesa \"Martha\" 6-max El asiento n.º 2 es el botón\nAsiento 1: mivipkr (2.12 € en fichas) \nAsiento 2: NovacaineZxc (2.40 € en fichas) \nAsiento 3: BudyXXIII (2.22 € en fichas) \nAsiento 4: Sigiilo (2 € en fichas) \nAsiento 5: SrLyce (1.96 € en fichas) \nAsiento 6: alexfw300 (2.09 € en fichas) \nBudyXXIII: pone la ciega pequeña 0.01 €\nSigiilo: pone la ciega grande 0.02 €\n*** CARTAS DE MANO ***\nRepartidas a SrLyce [9h 8c]\nSrLyce: se retira \nalexfw300: sube 0.03 € a 0.05 €\nmivipkr: se retira \nNovacaineZxc: se retira \nBudyXXIII: se retira \nSigiilo: sube 0.19 € a 0.24 €\nalexfw300: se retira \nLa apuesta no igualada (0.19 €) ha sido devuelta a Sigiilo\nSigiilo se lleva 0.11 € del bote \nSigiilo: no muestra su mano \n*** RESUMEN ***\nBote total 0.11 € | Comisión 0 € \nAsiento 1: mivipkr se retiró antes del Flop (no apostó)\nAsiento 2: NovacaineZxc (botón) se retiró antes del Flop (no apostó)\nAsiento 3: BudyXXIII (ciega pequeña) se retiró antes del Flop\nAsiento 4: Sigiilo (ciega grande) recaudó (0.11 €)\nAsiento 5: SrLyce se retiró antes del Flop (no apostó)\nAsiento 6: alexfw300 se retiró antes del Flop"
}