{
  "hand_id": "257150453263",
  "date": "30-07-2025 23:42:55",
  "table": "Lobelia",
  "game_type": "holdem",
  "hero": "SrLyce",
  "hero_position": "",
  "hero_cards": [
    "6s",
    "Qh"
  ],
  "stacks": {
    "LeVbks": 119.0,
    "fcis666": 37.5,
    "Dlaguancha": 132.5,
    "SrLyce": 104.5,
    "riverluck444": 82.5,
    "javipondio": 40.0
  },
  "actions": {
    "preflop": [
      "Asiento 1: LeVbks (2.38 € en fichas)",
      "Asiento 2: fcis666 (0.75 € en fichas)",
      "Asiento 3: Dlaguancha (2.65 € en fichas)",
      "Asiento 4: SrLyce (2.09 € en fichas)",
      "Asiento 5: riverluck444 (1.65 € en fichas)",
      "Asiento 6: javipondio (0.80 € en fichas)",
      "Dlaguancha: pone la ciega pequeña 0.01 €",
      "SrLyce: pone la ciega grande 0.02 €",
      "riverluck444: se retira",
      "javipondio: se retira",
      "LeVbks: se retira",
      "fcis666: se retira",
      "Dlaguancha: iguala 0.01 €",
      "SrLyce: pasa"
    ],
    "flop": [
      "Dlaguancha: pasa",
      "SrLyce: pasa"
    ],
    "turn": [
      "Dlaguancha: apuesta 0.02 €",
      "SrLyce: iguala 0.02 €"
    ],
    "river": [
      "Dlaguancha: apuesta 0.08 €",
      "SrLyce: se retira",
      "Asiento 1: LeVbks se retiró antes del Flop (no apostó)",
      "Asiento 2: fcis666 (botón) se retiró antes del Flop (no apostó)",
      "Asiento 3: Dlaguancha (ciega pequeña) recaudó (0.08 €)",
      "Asiento 4: SrLyce (ciega grande) se retiró en el River",
      "Asiento 5: riverluck444 se retiró antes del Flop (no apostó)",
      "Asiento 6: javipondio se retiró antes del Flop (no apostó)"
    ]
  },
  "board": [
    "Jh",
    "3s",
    "Ts",
    "9c",
    "4c"
  ],
  "winner": "Dlaguancha",
  "win_amount": 4.0,
  "sb": 0.01,
  "bb": 0.02,
  "rake": 0.0,
  "raw_text": "Mano n.º 257150453263 de PokerStars:  Hold'em No Limit (0.01 €/0.02 € EUR) - 30-07-2025 23:42:55 CET [30-07-2025 17:42:55 ET]\nMesa \"Lobelia\" 6-max El asiento n.º 2 es el botón\nAsiento 1: LeVbks (2.38 € en fichas) \nAsiento 2: fcis666 (0.75 € en fichas) \nAsiento 3: Dlaguancha (2.65 € en fichas) \nAsiento 4: SrLyce (2.09 € en fichas) \nAsiento 5: riverluck444 (1.65 € en fichas) \nAsiento 6: javipondio (0.80 € en fichas) \nDlaguancha: pone la ciega pequeña 0.01 €\nSrLyce: pone la ciega grande 0.02 €\n*** CARTAS DE MANO ***\nRepartidas a SrLyce [6s Qh]\nriverluck444: se retira \njavipondio: se retira \nLeVbks: se retira \nfcis666: se retira \nDlaguancha: iguala 0.01 €\nSrLyce: pasa \n*** FLOP *** [Jh 3s Ts]\nDlaguancha: pasa \nSrLyce: pasa \n*** TURN *** [Jh 3s Ts] [9c]\nDlaguancha: apuesta 0.02 €\nSrLyce: iguala 0.02 €\n*** RIVER *** [Jh 3s Ts 9c] [4c]\nDlaguancha: apuesta 0.08 €\nSrLyce: se retira \nLa apuesta no igualada (0.08 €) ha sido devuelta a Dlaguancha\nDlaguancha se lleva 0.08 € del bote \n*** RESUMEN ***\nBote total 0.08 € | Comisión 0 € \nComunitarias [Jh 3s Ts 9c 4c]\nAsiento 1: LeVbks se retiró antes del Flop (no apostó)\nAsiento 2: fcis666 (botón) se retiró antes del Flop (no apostó)\nAsiento 3: Dlaguancha (ciega pequeña) recaudó (0.08 €)\nAsiento 4: SrLyce (ciega grande) se retiró en el River\nAsiento 5: riverluck444 se retiró antes del Flop (no apostó)\nAsiento 6: javipondio se retiró antes del Flop (no apostó)"
}