{
  "hand_id": "257238438446",
  "date": "06-08-2025 18:58:54",
  "table": "Alruccabah II",
  "game_type": "holdem",
  "hero": "SrLyce",
  "hero_position": "",
  "hero_cards": [
    "Tc",
    "Ts"
  ],
  "stacks": {
    "SrLyce": 136.5,
    "zoioachado": 47.5,
    "yonisanlu": 100.0,
    "Nicanor Cast": 52.5,
    "rayao32": 43.5
  },
  "actions": {
    "preflop": [
      "Asiento 1: SrLyce (2.73 € en fichas)",
      "Asiento 2: zoioachado (0.95 € en fichas)",
      "Asiento 3: yonisanlu (2 € en fichas)",
      "Asiento 4: serviettski(fr) (2.05 € en fichas)",
      "Asiento 5: Nicanor Cast (1.05 € en fichas)",
      "Asiento 6: rayao32 (0.87 € en fichas)",
      "zoioachado: pone la ciega pequeña 0.01 €",
      "yonisanlu: pone la ciega grande 0.02 €",
      "serviettski(fr): se retira",
      "Nicanor Cast: se retira",
      "rayao32: se retira",
      "SrLyce: sube 0.03 € a 0.05 €",
      "zoioachado: se retira",
      "yonisanlu: se retira",
      "SrLyce: no muestra su mano",
      "Asiento 1: SrLyce (botón) recaudó (0.05 €)",
      "Asiento 2: zoioachado (ciega pequeña) se retiró antes del Flop",
      "Asiento 3: yonisanlu (ciega grande) se retiró antes del Flop",
      "Asiento 4: serviettski(fr) se retiró antes del Flop (no apostó)",
      "Asiento 5: Nicanor Cast se retiró antes del Flop (no apostó)",
      "Asiento 6: rayao32 se retiró antes del Flop (no apostó)"
    ],
    "flop": [],
    "turn": [],
    "river": []
  },
  "board": [],
  "winner": "SrLyce",
  "win_amount": 2.5,
  "sb": 0.01,
  "bb": 0.02,
  "rake": 0.0,
  "raw_text": "Mano n.º 257238438446 de PokerStars:  Hold'em No Limit (0.01 €/0.02 € EUR) - 06-08-2025 18:58:54 CET [06-08-2025 12:58:54 ET]\nMesa \"Alruccabah II\" 6-max El asiento n.º 1 es el botón\nAsiento 1: SrLyce (2.73 € en fichas) \nAsiento 2: zoioachado (0.95 € en fichas) \nAsiento 3: yonisanlu (2 € en fichas) \nAsiento 4: serviettski(fr) (2.05 € en fichas) \nAsiento 5: Nicanor Cast (1.05 € en fichas) \nAsiento 6: rayao32 (0.87 € en fichas) \nzoioachado: pone la ciega pequeña 0.01 €\nyonisanlu: pone la ciega grande 0.02 €\n*** CARTAS DE MANO ***\nRepartidas a SrLyce [Tc Ts]\nserviettski(fr): se retira \nNicanor Cast: se retira \nrayao32 ha agotado su tiempo\nrayao32: se retira \nSrLyce: sube 0.03 € a 0.05 €\nzoioachado: se retira \nyonisanlu: se retira \nLa apuesta no igualada (0.03 €) ha sido devuelta a SrLyce\nSrLyce se lleva 0.05 € del bote \nSrLyce: no muestra su mano \n*** RESUMEN ***\nBote total 0.05 € | Comisión 0 € \nAsiento 1: SrLyce (botón) recaudó (0.05 €)\nAsiento 2: zoioachado (ciega pequeña) se retiró antes del Flop\nAsiento 3: yonisanlu (ciega grande) se retiró antes del Flop\nAsiento 4: serviettski(fr) se retiró antes del Flop (no apostó)\nAsiento 5: Nicanor Cast se retiró antes del Flop (no apostó)\nAsiento 6: rayao32 se retiró antes del Flop (no apostó)"
}