{
  "hand_id": "257238491415",
  "date": "06-08-2025 19:04:08",
  "table": "Alruccabah II",
  "game_type": "holdem",
  "hero": "SrLyce",
  "hero_position": "",
  "hero_cards": [
    "6c",
    "Jh"
  ],
  "stacks": {
    "zoioachado": 0.0,
    "SrLyce": 148.0,
    "yonisanlu": 138.0,
    "Nicanor Cast": 49.0,
    "rayao32": 42.5
  },
  "actions": {
    "preflop": [
      "Asiento 2: zoioachado (0 € en fichas) está ausente",
      "Asiento 1: SrLyce (2.96 € en fichas)",
      "Asiento 3: yonisanlu (2.76 € en fichas)",
      "Asiento 4: serviettski(fr) (2 € en fichas)",
      "Asiento 5: Nicanor Cast (0.98 € en fichas)",
      "Asiento 6: rayao32 (0.85 € en fichas)",
      "yonisanlu: pone la ciega pequeña 0.01 €",
      "serviettski(fr): pone la ciega grande 0.02 €",
      "Nicanor Cast: se retira",
      "rayao32: se retira",
      "SrLyce: se retira",
      "yonisanlu: sube 0.03 € a 0.05 €",
      "serviettski(fr): se retira",
      "yonisanlu: no muestra su mano",
      "Asiento 2: zoioachado",
      "Asiento 1: SrLyce (botón) se retiró antes del Flop (no apostó)",
      "Asiento 3: yonisanlu (ciega pequeña) recaudó (0.04 €)",
      "Asiento 4: serviettski(fr) (ciega grande) se retiró antes del Flop",
      "Asiento 5: Nicanor Cast se retiró antes del Flop (no apostó)",
      "Asiento 6: rayao32 se retiró antes del Flop (no apostó)"
    ],
    "flop": [],
    "turn": [],
    "river": []
  },
  "board": [],
  "winner": "yonisanlu",
  "win_amount": 2.0,
  "sb": 0.01,
  "bb": 0.02,
  "rake": 0.0,
  "raw_text": "Mano n.º 257238491415 de PokerStars:  Hold'em No Limit (0.01 €/0.02 € EUR) - 06-08-2025 19:04:08 CET [06-08-2025 13:04:08 ET]\nMesa \"Alruccabah II\" 6-max El asiento n.º 1 es el botón\nAsiento 2: zoioachado (0 € en fichas) está ausente\nAsiento 1: SrLyce (2.96 € en fichas) \nAsiento 3: yonisanlu (2.76 € en fichas) \nAsiento 4: serviettski(fr) (2 € en fichas) \nAsiento 5: Nicanor Cast (0.98 € en fichas) \nAsiento 6: rayao32 (0.85 € en fichas) \nyonisanlu: pone la ciega pequeña 0.01 €\nserviettski(fr): pone la ciega grande 0.02 €\n*** CARTAS DE MANO ***\nRepartidas a SrLyce [6c Jh]\nNicanor Cast: se retira \nrayao32: se retira \nSrLyce: se retira \nyonisanlu: sube 0.03 € a 0.05 €\nserviettski(fr): se retira \nLa apuesta no igualada (0.03 €) ha sido devuelta a yonisanlu\nyonisanlu se lleva 0.04 € del bote \nyonisanlu: no muestra su mano \n*** RESUMEN ***\nBote total 0.04 € | Comisión 0 € \nAsiento 2: zoioachado\nAsiento 1: SrLyce (botón) se retiró antes del Flop (no apostó)\nAsiento 3: yonisanlu (ciega pequeña) recaudó (0.04 €)\nAsiento 4: serviettski(fr) (ciega grande) se retiró antes del Flop\nAsiento 5: Nicanor Cast se retiró antes del Flop (no apostó)\nAsiento 6: rayao32 se retiró antes del Flop (no apostó)"
}