{
  "hand_id": "257168261455",
  "date": "01-08-2025 11:15:00",
  "table": "Jupiter",
  "game_type": "holdem",
  "hero": "SrLyce",
  "hero_position": "",
  "hero_cards": [
    "6d",
    "Jh"
  ],
  "stacks": {
    "sifilis5": 100.0,
    "Filou203": 113.5,
    "SrLyce": 110.5,
    "LOLA19711971": 36.0,
    "dadou13mars": 223.5,
    "Alvii37": 100.5
  },
  "actions": {
    "preflop": [
      "Asiento 1: sifilis5 (2 € en fichas)",
      "Asiento 2: Filou203 (2.27 € en fichas)",
      "Asiento 3: SrLyce (2.21 € en fichas)",
      "Asiento 4: LOLA19711971 (0.72 € en fichas)",
      "Asiento 5: dadou13mars (4.47 € en fichas)",
      "Asiento 6: Alvii37 (2.01 € en fichas)",
      "Alvii37: pone la ciega pequeña 0.01 €",
      "sifilis5: pone la ciega grande 0.02 €",
      "Filou203: se retira",
      "SrLyce: se retira",
      "LOLA19711971: iguala 0.02 €",
      "dadou13mars: sube 0.06 € a 0.08 €",
      "Alvii37: se retira",
      "sifilis5: se retira",
      "LOLA19711971: iguala 0.06 €"
    ],
    "flop": [
      "LOLA19711971: pasa",
      "dadou13mars: pasa"
    ],
    "turn": [
      "LOLA19711971: pasa",
      "dadou13mars: apuesta 0.06 €",
      "LOLA19711971: se retira",
      "dadou13mars: no muestra su mano",
      "Asiento 1: sifilis5 (ciega grande) se retiró antes del Flop",
      "Asiento 2: Filou203 se retiró antes del Flop (no apostó)",
      "Asiento 3: SrLyce se retiró antes del Flop (no apostó)",
      "Asiento 4: LOLA19711971 se retiró en el Turn",
      "Asiento 5: dadou13mars (botón) recaudó (0.18 €)",
      "Asiento 6: Alvii37 (ciega pequeña) se retiró antes del Flop"
    ],
    "river": []
  },
  "board": [
    "2d",
    "Qh",
    "4d",
    "2c"
  ],
  "winner": "dadou13mars",
  "win_amount": 9.0,
  "sb": 0.01,
  "bb": 0.02,
  "rake": 0.5,
  "raw_text": "Mano n.º 257168261455 de PokerStars:  Hold'em No Limit (0.01 €/0.02 € EUR) - 01-08-2025 11:15:00 CET [01-08-2025 5:15:00 ET]\nMesa \"Jupiter\" 6-max El asiento n.º 5 es el botón\nAsiento 1: sifilis5 (2 € en fichas) \nAsiento 2: Filou203 (2.27 € en fichas) \nAsiento 3: SrLyce (2.21 € en fichas) \nAsiento 4: LOLA19711971 (0.72 € en fichas) \nAsiento 5: dadou13mars (4.47 € en fichas) \nAsiento 6: Alvii37 (2.01 € en fichas) \nAlvii37: pone la ciega pequeña 0.01 €\nsifilis5: pone la ciega grande 0.02 €\n*** CARTAS DE MANO ***\nRepartidas a SrLyce [6d Jh]\nFilou203: se retira \nSrLyce: se retira \nLOLA19711971: iguala 0.02 €\ndadou13mars: sube 0.06 € a 0.08 €\nAlvii37: se retira \nsifilis5: se retira \nLOLA19711971: iguala 0.06 €\n*** FLOP *** [2d Qh 4d]\nLOLA19711971: pasa \ndadou13mars: pasa \n*** TURN *** [2d Qh 4d] [2c]\nLOLA19711971: pasa \ndadou13mars: apuesta 0.06 €\nLOLA19711971: se retira \nLa apuesta no igualada (0.06 €) ha sido devuelta a dadou13mars\ndadou13mars se lleva 0.18 € del bote \ndadou13mars: no muestra su mano \n*** RESUMEN ***\nBote total 0.19 € | Comisión 0.01 € \nComunitarias [2d Qh 4d 2c]\nAsiento 1: sifilis5 (ciega grande) se retiró antes del Flop\nAsiento 2: Filou203 se retiró antes del Flop (no apostó)\nAsiento 3: SrLyce se retiró antes del Flop (no apostó)\nAsiento 4: LOLA19711971 se retiró en el Turn\nAsiento 5: dadou13mars (botón) recaudó (0.18 €)\nAsiento 6: Alvii37 (ciega pequeña) se retiró antes del Flop"
}