{
  "hand_id": "257149139076",
  "date": "30-07-2025 22:10:46",
  "table": "Sirona",
  "game_type": "holdem",
  "hero": "SrLyce",
  "hero_position": "",
  "hero_cards": [
    "9c",
    "2s"
  ],
  "stacks": {
    "oliverdu70": 186.0,
    "hadhod1976": 40.0,
    "SrLyce": 136.0,
    "christoph363": 219.0,
    "MitchATP65": 100.0
  },
  "actions": {
    "preflop": [
      "Asiento 4: oliverdu70 (3.72 € en fichas) está ausente",
      "Asiento 5: hadhod1976 (0.80 € en fichas) está ausente",
      "Asiento 1: SrLyce (2.72 € en fichas)",
      "Asiento 3: christoph363 (4.38 € en fichas)",
      "Asiento 6: MitchATP65 (2 € en fichas)",
      "christoph363: pone la ciega pequeña 0.01 €",
      "MitchATP65: pone la ciega grande 0.02 €",
      "SrLyce: se retira",
      "christoph363: se retira",
      "MitchATP65: no muestra su mano",
      "Asiento 4: oliverdu70",
      "Asiento 5: hadhod1976",
      "Asiento 1: SrLyce (botón) se retiró antes del Flop (no apostó)",
      "Asiento 3: christoph363 (ciega pequeña) se retiró antes del Flop",
      "Asiento 6: MitchATP65 (ciega grande) recaudó (0.02 €)"
    ],
    "flop": [],
    "turn": [],
    "river": []
  },
  "board": [],
  "winner": "MitchATP65",
  "win_amount": 1.0,
  "sb": 0.01,
  "bb": 0.02,
  "rake": 0.0,
  "raw_text": "Mano n.º 257149139076 de PokerStars:  Hold'em No Limit (0.01 €/0.02 € EUR) - 30-07-2025 22:10:46 CET [30-07-2025 16:10:46 ET]\nMesa \"Sirona\" 6-max El asiento n.º 1 es el botón\nAsiento 4: oliverdu70 (3.72 € en fichas) está ausente\nAsiento 5: hadhod1976 (0.80 € en fichas) está ausente\nAsiento 1: SrLyce (2.72 € en fichas) \nAsiento 3: christoph363 (4.38 € en fichas) \nAsiento 6: MitchATP65 (2 € en fichas) \nchristoph363: pone la ciega pequeña 0.01 €\nMitchATP65: pone la ciega grande 0.02 €\n*** CARTAS DE MANO ***\nRepartidas a SrLyce [9c 2s]\nSrLyce: se retira \nchristoph363: se retira \nLa apuesta no igualada (0.01 €) ha sido devuelta a MitchATP65\nMitchATP65 se lleva 0.02 € del bote \nMitchATP65: no muestra su mano \n*** RESUMEN ***\nBote total 0.02 € | Comisión 0 € \nAsiento 4: oliverdu70\nAsiento 5: hadhod1976\nAsiento 1: SrLyce (botón) se retiró antes del Flop (no apostó)\nAsiento 3: christoph363 (ciega pequeña) se retiró antes del Flop\nAsiento 6: MitchATP65 (ciega grande) recaudó (0.02 €)"
}