{
  "hand_id": "257237596578",
  "date": "06-08-2025 17:39:35",
  "table": "Kale III",
  "game_type": "holdem",
  "hero": "SrLyce",
  "hero_position": "",
  "hero_cards": [
    "3h",
    "Jc"
  ],
  "stacks": {
    "x__Nest__x": 91.5,
    "SrLyce": 121.0,
    "Dracoline000": 108.0,
    "jeffounet33": 98.0,
    "Begoton": 101.0,
    "juanmemol": 104.0
  },
  "actions": {
    "preflop": [
      "Asiento 1: x__Nest__x (1.83 € en fichas)",
      "Asiento 2: SrLyce (2.42 € en fichas)",
      "Asiento 3: Dracoline000 (2.16 € en fichas)",
      "Asiento 4: jeffounet33 (1.96 € en fichas)",
      "Asiento 5: Begoton (2.02 € en fichas)",
      "Asiento 6: juanmemol (2.08 € en fichas)",
      "jeffounet33: pone la ciega pequeña 0.01 €",
      "Begoton: pone la ciega grande 0.02 €",
      "juanmemol: se retira",
      "x__Nest__x: sube 0.04 € a 0.06 €",
      "SrLyce: se retira",
      "Dracoline000: se retira",
      "jeffounet33: se retira",
      "Begoton: se retira",
      "x__Nest__x: no muestra su mano",
      "Asiento 1: x__Nest__x recaudó (0.05 €)",
      "Asiento 2: SrLyce se retiró antes del Flop (no apostó)",
      "Asiento 3: Dracoline000 (botón) se retiró antes del Flop (no apostó)",
      "Asiento 4: jeffounet33 (ciega pequeña) se retiró antes del Flop",
      "Asiento 5: Begoton (ciega grande) se retiró antes del Flop",
      "Asiento 6: juanmemol se retiró antes del Flop (no apostó)"
    ],
    "flop": [],
    "turn": [],
    "river": []
  },
  "board": [],
  "winner": "x__Nest__x",
  "win_amount": 2.5,
  "sb": 0.01,
  "bb": 0.02,
  "rake": 0.0,
  "raw_text": "Mano n.º 257237596578 de PokerStars:  Hold'em No Limit (0.01 €/0.02 € EUR) - 06-08-2025 17:39:35 CET [06-08-2025 11:39:35 ET]\nMesa \"Kale III\" 6-max El asiento n.º 3 es el botón\nAsiento 1: x__Nest__x (1.83 € en fichas) \nAsiento 2: SrLyce (2.42 € en fichas) \nAsiento 3: Dracoline000 (2.16 € en fichas) \nAsiento 4: jeffounet33 (1.96 € en fichas) \nAsiento 5: Begoton (2.02 € en fichas) \nAsiento 6: juanmemol (2.08 € en fichas) \njeffounet33: pone la ciega pequeña 0.01 €\nBegoton: pone la ciega grande 0.02 €\n*** CARTAS DE MANO ***\nRepartidas a SrLyce [3h Jc]\njuanmemol: se retira \nx__Nest__x: sube 0.04 € a 0.06 €\nSrLyce: se retira \nDracoline000: se retira \njeffounet33: se retira \nBegoton: se retira \nLa apuesta no igualada (0.04 €) ha sido devuelta a x__Nest__x\nx__Nest__x se lleva 0.05 € del bote \nx__Nest__x: no muestra su mano \n*** RESUMEN ***\nBote total 0.05 € | Comisión 0 € \nAsiento 1: x__Nest__x recaudó (0.05 €)\nAsiento 2: SrLyce se retiró antes del Flop (no apostó)\nAsiento 3: Dracoline000 (botón) se retiró antes del Flop (no apostó)\nAsiento 4: jeffounet33 (ciega pequeña) se retiró antes del Flop\nAsiento 5: Begoton (ciega grande) se retiró antes del Flop\nAsiento 6: juanmemol se retiró antes del Flop (no apostó)"
}