{
  "hand_id": "257237717747",
  "date": "06-08-2025 17:51:13",
  "table": "Virtus",
  "game_type": "holdem",
  "hero": "SrLyce",
  "hero_position": "",
  "hero_cards": [
    "4d",
    "Qc"
  ],
  "stacks": {
    "Kingzilla87": 164.5,
    "SrLyce": 98.5,
    "zzranger_03": 180.5,
    "JGDOBLAS": 90.5,
    "don.corle": 143.0,
    "rudik34385": 98.5
  },
  "actions": {
    "preflop": [
      "Asiento 1: Kingzilla87 (3.29 € en fichas)",
      "Asiento 2: SrLyce (1.97 € en fichas)",
      "Asiento 3: zzranger_03 (3.61 € en fichas)",
      "Asiento 4: JGDOBLAS (1.81 € en fichas)",
      "Asiento 5: don.corle (2.86 € en fichas)",
      "Asiento 6: rudik34385 (1.97 € en fichas)",
      "JGDOBLAS: pone la ciega pequeña 0.01 €",
      "don.corle: pone la ciega grande 0.02 €",
      "rudik34385: iguala 0.02 €",
      "Kingzilla87: sube 0.08 € a 0.10 €",
      "SrLyce: se retira",
      "zzranger_03: se retira",
      "JGDOBLAS: se retira",
      "don.corle: se retira",
      "rudik34385: se retira",
      "Kingzilla87: no muestra su mano",
      "Asiento 1: Kingzilla87 recaudó (0.07 €)",
      "Asiento 2: SrLyce se retiró antes del Flop (no apostó)",
      "Asiento 3: zzranger_03 (botón) se retiró antes del Flop (no apostó)",
      "Asiento 4: JGDOBLAS (ciega pequeña) se retiró antes del Flop",
      "Asiento 5: don.corle (ciega grande) se retiró antes del Flop",
      "Asiento 6: rudik34385 se retiró antes del Flop"
    ],
    "flop": [],
    "turn": [],
    "river": []
  },
  "board": [],
  "winner": "Kingzilla87",
  "win_amount": 3.5,
  "sb": 0.01,
  "bb": 0.02,
  "rake": 0.0,
  "raw_text": "Mano n.º 257237717747 de PokerStars:  Hold'em No Limit (0.01 €/0.02 € EUR) - 06-08-2025 17:51:13 CET [06-08-2025 11:51:13 ET]\nMesa \"Virtus\" 6-max El asiento n.º 3 es el botón\nAsiento 1: Kingzilla87 (3.29 € en fichas) \nAsiento 2: SrLyce (1.97 € en fichas) \nAsiento 3: zzranger_03 (3.61 € en fichas) \nAsiento 4: JGDOBLAS (1.81 € en fichas) \nAsiento 5: don.corle (2.86 € en fichas) \nAsiento 6: rudik34385 (1.97 € en fichas) \nJGDOBLAS: pone la ciega pequeña 0.01 €\ndon.corle: pone la ciega grande 0.02 €\n*** CARTAS DE MANO ***\nRepartidas a SrLyce [4d Qc]\nrudik34385: iguala 0.02 €\nKingzilla87: sube 0.08 € a 0.10 €\nSrLyce: se retira \nzzranger_03: se retira \nJGDOBLAS: se retira \ndon.corle: se retira \nrudik34385: se retira \nLa apuesta no igualada (0.08 €) ha sido devuelta a Kingzilla87\nKingzilla87 se lleva 0.07 € del bote \nKingzilla87: no muestra su mano \n*** RESUMEN ***\nBote total 0.07 € | Comisión 0 € \nAsiento 1: Kingzilla87 recaudó (0.07 €)\nAsiento 2: SrLyce se retiró antes del Flop (no apostó)\nAsiento 3: zzranger_03 (botón) se retiró antes del Flop (no apostó)\nAsiento 4: JGDOBLAS (ciega pequeña) se retiró antes del Flop\nAsiento 5: don.corle (ciega grande) se retiró antes del Flop\nAsiento 6: rudik34385 se retiró antes del Flop"
}