{
  "hand_id": "257215069177",
  "date": "04-08-2025 22:22:26",
  "table": "Anneliese II",
  "game_type": "holdem",
  "hero": "SrLyce",
  "hero_position": "",
  "hero_cards": [
    "Kc",
    "8d"
  ],
  "stacks": {
    "betterrrrrr": 100.0,
    "piropanzer": 55.0,
    "ElManu62": 116.0,
    "SrLyce": 98.5,
    "Mr_Pkr98": 137.5,
    "Spotick": 113.5
  },
  "actions": {
    "preflop": [
      "Asiento 1: betterrrrrr (2 € en fichas)",
      "Asiento 2: piropanzer (1.10 € en fichas)",
      "Asiento 3: ElManu62 (2.32 € en fichas)",
      "Asiento 4: SrLyce (1.97 € en fichas)",
      "Asiento 5: Mr_Pkr98 (2.75 € en fichas)",
      "Asiento 6: Spotick (2.27 € en fichas)",
      "betterrrrrr: pone la ciega pequeña 0.01 €",
      "piropanzer: pone la ciega grande 0.02 €",
      "ElManu62: se retira",
      "SrLyce: se retira",
      "Mr_Pkr98: se retira",
      "Spotick: se retira",
      "betterrrrrr: sube 0.16 € a 0.18 €",
      "piropanzer: se retira",
      "betterrrrrr: no muestra su mano",
      "Asiento 1: betterrrrrr (ciega pequeña) recaudó (0.04 €)",
      "Asiento 2: piropanzer (ciega grande) se retiró antes del Flop",
      "Asiento 3: ElManu62 se retiró antes del Flop (no apostó)",
      "Asiento 4: SrLyce se retiró antes del Flop (no apostó)",
      "Asiento 5: Mr_Pkr98 se retiró antes del Flop (no apostó)",
      "Asiento 6: Spotick (botón) se retiró antes del Flop (no apostó)"
    ],
    "flop": [],
    "turn": [],
    "river": []
  },
  "board": [],
  "winner": "betterrrrrr",
  "win_amount": 2.0,
  "sb": 0.01,
  "bb": 0.02,
  "rake": 0.0,
  "raw_text": "Mano n.º 257215069177 de PokerStars:  Hold'em No Limit (0.01 €/0.02 € EUR) - 04-08-2025 22:22:26 CET [04-08-2025 16:22:26 ET]\nMesa \"Anneliese II\" 6-max El asiento n.º 6 es el botón\nAsiento 1: betterrrrrr (2 € en fichas) \nAsiento 2: piropanzer (1.10 € en fichas) \nAsiento 3: ElManu62 (2.32 € en fichas) \nAsiento 4: SrLyce (1.97 € en fichas) \nAsiento 5: Mr_Pkr98 (2.75 € en fichas) \nAsiento 6: Spotick (2.27 € en fichas) \nbetterrrrrr: pone la ciega pequeña 0.01 €\npiropanzer: pone la ciega grande 0.02 €\n*** CARTAS DE MANO ***\nRepartidas a SrLyce [Kc 8d]\nElManu62: se retira \nSrLyce ha agotado su tiempo\nSrLyce: se retira \nMr_Pkr98: se retira \nSpotick: se retira \nbetterrrrrr: sube 0.16 € a 0.18 €\npiropanzer: se retira \nLa apuesta no igualada (0.16 €) ha sido devuelta a betterrrrrr\nbetterrrrrr se lleva 0.04 € del bote \nbetterrrrrr: no muestra su mano \n*** RESUMEN ***\nBote total 0.04 € | Comisión 0 € \nAsiento 1: betterrrrrr (ciega pequeña) recaudó (0.04 €)\nAsiento 2: piropanzer (ciega grande) se retiró antes del Flop\nAsiento 3: ElManu62 se retiró antes del Flop (no apostó)\nAsiento 4: SrLyce se retiró antes del Flop (no apostó)\nAsiento 5: Mr_Pkr98 se retiró antes del Flop (no apostó)\nAsiento 6: Spotick (botón) se retiró antes del Flop (no apostó)"
}