{
  "hand_id": "257237982975",
  "date": "06-08-2025 18:17:36",
  "table": "Nuwa III",
  "game_type": "holdem",
  "hero": "SrLyce",
  "hero_position": "",
  "hero_cards": [
    "4c",
    "5d"
  ],
  "stacks": {
    "BuXHexter": 101.0,
    "xododo": 37.0,
    "kcg_rm": 103.0,
    "SrLyce": 148.5,
    "acavada": 101.5
  },
  "actions": {
    "preflop": [
      "Asiento 2: BuXHexter (2.02 € en fichas) está ausente",
      "Asiento 1: xododo (0.74 € en fichas)",
      "Asiento 3: kcg_rm (2.06 € en fichas)",
      "Asiento 4: SrLyce (2.97 € en fichas)",
      "Asiento 5: serviettski(fr) (2 € en fichas)",
      "Asiento 6: acavada (2.03 € en fichas)",
      "xododo: pone la ciega pequeña 0.01 €",
      "kcg_rm: pone la ciega grande 0.02 €",
      "SrLyce: se retira",
      "serviettski(fr): se retira",
      "acavada: se retira",
      "xododo: se retira",
      "kcg_rm: no muestra su mano",
      "Asiento 2: BuXHexter",
      "Asiento 1: xododo (ciega pequeña) se retiró antes del Flop",
      "Asiento 3: kcg_rm (ciega grande) recaudó (0.02 €)",
      "Asiento 4: SrLyce se retiró antes del Flop (no apostó)",
      "Asiento 5: serviettski(fr) se retiró antes del Flop (no apostó)",
      "Asiento 6: acavada (botón) se retiró antes del Flop (no apostó)"
    ],
    "flop": [],
    "turn": [],
    "river": []
  },
  "board": [],
  "winner": "kcg_rm",
  "win_amount": 1.0,
  "sb": 0.01,
  "bb": 0.02,
  "rake": 0.0,
  "raw_text": "Mano n.º 257237982975 de PokerStars:  Hold'em No Limit (0.01 €/0.02 € EUR) - 06-08-2025 18:17:36 CET [06-08-2025 12:17:36 ET]\nMesa \"Nuwa III\" 6-max El asiento n.º 6 es el botón\nAsiento 2: BuXHexter (2.02 € en fichas) está ausente\nAsiento 1: xododo (0.74 € en fichas) \nAsiento 3: kcg_rm (2.06 € en fichas) \nAsiento 4: SrLyce (2.97 € en fichas) \nAsiento 5: serviettski(fr) (2 € en fichas) \nAsiento 6: acavada (2.03 € en fichas) \nxododo: pone la ciega pequeña 0.01 €\nkcg_rm: pone la ciega grande 0.02 €\n*** CARTAS DE MANO ***\nRepartidas a SrLyce [4c 5d]\nSrLyce: se retira \nserviettski(fr): se retira \nacavada: se retira \nxododo: se retira \nLa apuesta no igualada (0.01 €) ha sido devuelta a kcg_rm\nkcg_rm se lleva 0.02 € del bote \nkcg_rm: no muestra su mano \n*** RESUMEN ***\nBote total 0.02 € | Comisión 0 € \nAsiento 2: BuXHexter\nAsiento 1: xododo (ciega pequeña) se retiró antes del Flop\nAsiento 3: kcg_rm (ciega grande) recaudó (0.02 €)\nAsiento 4: SrLyce se retiró antes del Flop (no apostó)\nAsiento 5: serviettski(fr) se retiró antes del Flop (no apostó)\nAsiento 6: acavada (botón) se retiró antes del Flop (no apostó)"
}