{
  "hand_id": "257168370922",
  "date": "01-08-2025 11:35:32",
  "table": "Jupiter",
  "game_type": "holdem",
  "hero": "SrLyce",
  "hero_position": "",
  "hero_cards": [
    "Jh",
    "Ah"
  ],
  "stacks": {
    "sifilis5": 98.5,
    "Filou203": 105.5,
    "SrLyce": 106.5,
    "LOLA19711971": 41.0,
    "dadou13mars": 209.5,
    "Alvii37": 112.5
  },
  "actions": {
    "preflop": [
      "Asiento 1: sifilis5 (1.97 € en fichas)",
      "Asiento 2: Filou203 (2.11 € en fichas)",
      "Asiento 3: SrLyce (2.13 € en fichas)",
      "Asiento 4: LOLA19711971 (0.82 € en fichas)",
      "Asiento 5: dadou13mars (4.19 € en fichas)",
      "Asiento 6: Alvii37 (2.25 € en fichas)",
      "dadou13mars: pone la ciega pequeña 0.01 €",
      "Alvii37: pone la ciega grande 0.02 €",
      "sifilis5: se retira",
      "Filou203: se retira",
      "SrLyce: sube 0.04 € a 0.06 €",
      "LOLA19711971: se retira",
      "dadou13mars: se retira",
      "Alvii37: se retira",
      "SrLyce: no muestra su mano",
      "Asiento 1: sifilis5 se retiró antes del Flop (no apostó)",
      "Asiento 2: Filou203 se retiró antes del Flop (no apostó)",
      "Asiento 3: SrLyce recaudó (0.05 €)",
      "Asiento 4: LOLA19711971 (botón) se retiró antes del Flop (no apostó)",
      "Asiento 5: dadou13mars (ciega pequeña) se retiró antes del Flop",
      "Asiento 6: Alvii37 (ciega grande) se retiró antes del Flop"
    ],
    "flop": [],
    "turn": [],
    "river": []
  },
  "board": [],
  "winner": "SrLyce",
  "win_amount": 2.5,
  "sb": 0.01,
  "bb": 0.02,
  "rake": 0.0,
  "raw_text": "Mano n.º 257168370922 de PokerStars:  Hold'em No Limit (0.01 €/0.02 € EUR) - 01-08-2025 11:35:32 CET [01-08-2025 5:35:32 ET]\nMesa \"Jupiter\" 6-max El asiento n.º 4 es el botón\nAsiento 1: sifilis5 (1.97 € en fichas) \nAsiento 2: Filou203 (2.11 € en fichas) \nAsiento 3: SrLyce (2.13 € en fichas) \nAsiento 4: LOLA19711971 (0.82 € en fichas) \nAsiento 5: dadou13mars (4.19 € en fichas) \nAsiento 6: Alvii37 (2.25 € en fichas) \ndadou13mars: pone la ciega pequeña 0.01 €\nAlvii37: pone la ciega grande 0.02 €\n*** CARTAS DE MANO ***\nRepartidas a SrLyce [Jh Ah]\nsifilis5: se retira \nFilou203: se retira \nSrLyce: sube 0.04 € a 0.06 €\nLOLA19711971: se retira \ndadou13mars: se retira \nAlvii37: se retira \nLa apuesta no igualada (0.04 €) ha sido devuelta a SrLyce\nSrLyce se lleva 0.05 € del bote \nSrLyce: no muestra su mano \n*** RESUMEN ***\nBote total 0.05 € | Comisión 0 € \nAsiento 1: sifilis5 se retiró antes del Flop (no apostó)\nAsiento 2: Filou203 se retiró antes del Flop (no apostó)\nAsiento 3: SrLyce recaudó (0.05 €)\nAsiento 4: LOLA19711971 (botón) se retiró antes del Flop (no apostó)\nAsiento 5: dadou13mars (ciega pequeña) se retiró antes del Flop\nAsiento 6: Alvii37 (ciega grande) se retiró antes del Flop"
}