{
  "hand_id": "257149124392",
  "date": "30-07-2025 22:09:44",
  "table": "Esclangona",
  "game_type": "holdem",
  "hero": "SrLyce",
  "hero_position": "",
  "hero_cards": [
    "Td",
    "9c"
  ],
  "stacks": {
    "elketefaka1": 100.0,
    "Zorgue1080": 66.0,
    "SrLyce": 34.0,
    "NoahBolete": 124.0,
    "Davdgoni": 225.5,
    "DiaZzZ1": 93.0
  },
  "actions": {
    "preflop": [
      "Asiento 6: elketefaka1 (2 € en fichas) está ausente",
      "Asiento 1: Zorgue1080 (1.32 € en fichas)",
      "Asiento 2: SrLyce (0.68 € en fichas)",
      "Asiento 3: NoahBolete (2.48 € en fichas)",
      "Asiento 4: Davdgoni (4.51 € en fichas)",
      "Asiento 5: DiaZzZ1 (1.86 € en fichas)",
      "NoahBolete: pone la ciega pequeña 0.01 €",
      "Davdgoni: pone la ciega grande 0.02 €",
      "elketefaka1: se ausenta",
      "DiaZzZ1: se retira",
      "Zorgue1080: sube 0.03 € a 0.05 €",
      "SrLyce: iguala 0.05 €",
      "NoahBolete: se retira",
      "Davdgoni: se retira"
    ],
    "flop": [
      "Zorgue1080: pasa",
      "SrLyce: apuesta 0.04 €",
      "Zorgue1080: iguala 0.04 €"
    ],
    "turn": [
      "Zorgue1080: pasa",
      "SrLyce: apuesta 0.10 €",
      "Zorgue1080: iguala 0.10 €"
    ],
    "river": [
      "Zorgue1080: pasa",
      "SrLyce: apuesta 0.20 €",
      "Zorgue1080: se retira",
      "SrLyce: no muestra su mano",
      "Asiento 6: elketefaka1",
      "Asiento 1: Zorgue1080 se retiró en el River",
      "Asiento 2: SrLyce (botón) recaudó (0.39 €)",
      "Asiento 3: NoahBolete (ciega pequeña) se retiró antes del Flop",
      "Asiento 4: Davdgoni (ciega grande) se retiró antes del Flop",
      "Asiento 5: DiaZzZ1 se retiró antes del Flop (no apostó)"
    ]
  },
  "board": [
    "8d",
    "Js",
    "Ah",
    "9s",
    "8s"
  ],
  "winner": "SrLyce",
  "win_amount": 19.5,
  "sb": 0.01,
  "bb": 0.02,
  "rake": 1.0,
  "raw_text": "Mano n.º 257149124392 de PokerStars:  Hold'em No Limit (0.01 €/0.02 € EUR) - 30-07-2025 22:09:44 CET [30-07-2025 16:09:44 ET]\nMesa \"Esclangona\" 6-max El asiento n.º 2 es el botón\nAsiento 6: elketefaka1 (2 € en fichas) está ausente\nAsiento 1: Zorgue1080 (1.32 € en fichas) \nAsiento 2: SrLyce (0.68 € en fichas) \nAsiento 3: NoahBolete (2.48 € en fichas) \nAsiento 4: Davdgoni (4.51 € en fichas) \nAsiento 5: DiaZzZ1 (1.86 € en fichas) \nNoahBolete: pone la ciega pequeña 0.01 €\nDavdgoni: pone la ciega grande 0.02 €\nelketefaka1: se ausenta \n*** CARTAS DE MANO ***\nRepartidas a SrLyce [Td 9c]\nDiaZzZ1: se retira \nZorgue1080: sube 0.03 € a 0.05 €\nSrLyce: iguala 0.05 €\nNoahBolete: se retira \nDavdgoni: se retira \n*** FLOP *** [8d Js Ah]\nZorgue1080: pasa \nSrLyce: apuesta 0.04 €\nZorgue1080: iguala 0.04 €\n*** TURN *** [8d Js Ah] [9s]\nZorgue1080: pasa \nSrLyce: apuesta 0.10 €\nZorgue1080: iguala 0.10 €\n*** RIVER *** [8d Js Ah 9s] [8s]\nZorgue1080: pasa \nSrLyce: apuesta 0.20 €\nZorgue1080: se retira \nLa apuesta no igualada (0.20 €) ha sido devuelta a SrLyce\nSrLyce se lleva 0.39 € del bote \nSrLyce: no muestra su mano \n*** RESUMEN ***\nBote total 0.41 € | Comisión 0.02 € \nComunitarias [8d Js Ah 9s 8s]\nAsiento 6: elketefaka1\nAsiento 1: Zorgue1080 se retiró en el River\nAsiento 2: SrLyce (botón) recaudó (0.39 €)\nAsiento 3: NoahBolete (ciega pequeña) se retiró antes del Flop\nAsiento 4: Davdgoni (ciega grande) se retiró antes del Flop\nAsiento 5: DiaZzZ1 se retiró antes del Flop (no apostó)"
}