{
  "hand_id": "257238436335",
  "date": "06-08-2025 18:58:39",
  "table": "Herculina II",
  "game_type": "holdem",
  "hero": "SrLyce",
  "hero_position": "",
  "hero_cards": [
    "Ad",
    "3h"
  ],
  "stacks": {
    "koldipk": 175.5,
    "David98X": 100.0,
    "JJer11": 209.0,
    "SrLyce": 104.5,
    "Macklemore0": 100.0,
    "ScarvBlack": 119.5
  },
  "actions": {
    "preflop": [
      "Asiento 1: koldipk (3.51 € en fichas)",
      "Asiento 2: David98X (2 € en fichas)",
      "Asiento 3: JJer11 (4.18 € en fichas)",
      "Asiento 4: SrLyce (2.09 € en fichas)",
      "Asiento 5: Macklemore0 (2 € en fichas)",
      "Asiento 6: ScarvBlack (2.39 € en fichas)",
      "ScarvBlack: pone la ciega pequeña 0.01 €",
      "koldipk: pone la ciega grande 0.02 €",
      "David98X: se retira",
      "JJer11: sube 0.04 € a 0.06 €",
      "SrLyce: se retira",
      "Macklemore0: se retira",
      "ScarvBlack: se retira",
      "koldipk: iguala 0.04 €"
    ],
    "flop": [
      "koldipk: apuesta 0.12 €",
      "JJer11: iguala 0.12 €"
    ],
    "turn": [
      "koldipk: pasa",
      "JJer11: pasa"
    ],
    "river": [
      "koldipk: apuesta 0.35 €",
      "JJer11: se retira",
      "Asiento 1: koldipk (ciega grande) recaudó (0.35 €)",
      "Asiento 2: David98X se retiró antes del Flop (no apostó)",
      "Asiento 3: JJer11 se retiró en el River",
      "Asiento 4: SrLyce se retiró antes del Flop (no apostó)",
      "Asiento 5: Macklemore0 (botón) se retiró antes del Flop (no apostó)",
      "Asiento 6: ScarvBlack (ciega pequeña) se retiró antes del Flop"
    ]
  },
  "board": [
    "Qc",
    "6d",
    "5c",
    "As",
    "7s"
  ],
  "winner": "koldipk",
  "win_amount": 17.5,
  "sb": 0.01,
  "bb": 0.02,
  "rake": 1.0,
  "raw_text": "Mano n.º 257238436335 de PokerStars:  Hold'em No Limit (0.01 €/0.02 € EUR) - 06-08-2025 18:58:39 CET [06-08-2025 12:58:39 ET]\nMesa \"Herculina II\" 6-max El asiento n.º 5 es el botón\nAsiento 1: koldipk (3.51 € en fichas) \nAsiento 2: David98X (2 € en fichas) \nAsiento 3: JJer11 (4.18 € en fichas) \nAsiento 4: SrLyce (2.09 € en fichas) \nAsiento 5: Macklemore0 (2 € en fichas) \nAsiento 6: ScarvBlack (2.39 € en fichas) \nScarvBlack: pone la ciega pequeña 0.01 €\nkoldipk: pone la ciega grande 0.02 €\n*** CARTAS DE MANO ***\nRepartidas a SrLyce [Ad 3h]\nDavid98X: se retira \nJJer11: sube 0.04 € a 0.06 €\nSrLyce: se retira \nMacklemore0: se retira \nScarvBlack: se retira \nkoldipk: iguala 0.04 €\n*** FLOP *** [Qc 6d 5c]\nkoldipk: apuesta 0.12 €\nJJer11: iguala 0.12 €\n*** TURN *** [Qc 6d 5c] [As]\nkoldipk: pasa \nJJer11: pasa \n*** RIVER *** [Qc 6d 5c As] [7s]\nkoldipk: apuesta 0.35 €\nJJer11: se retira \nLa apuesta no igualada (0.35 €) ha sido devuelta a koldipk\nkoldipk se lleva 0.35 € del bote \n*** RESUMEN ***\nBote total 0.37 € | Comisión 0.02 € \nComunitarias [Qc 6d 5c As 7s]\nAsiento 1: koldipk (ciega grande) recaudó (0.35 €)\nAsiento 2: David98X se retiró antes del Flop (no apostó)\nAsiento 3: JJer11 se retiró en el River\nAsiento 4: SrLyce se retiró antes del Flop (no apostó)\nAsiento 5: Macklemore0 (botón) se retiró antes del Flop (no apostó)\nAsiento 6: ScarvBlack (ciega pequeña) se retiró antes del Flop"
}