{
  "hand_id": "257168382795",
  "date": "01-08-2025 11:37:42",
  "table": "Atlas",
  "game_type": "holdem",
  "hero": "SrLyce",
  "hero_position": "",
  "hero_cards": [
    "Jd",
    "6h"
  ],
  "stacks": {
    "SrLyce": 119.0,
    "Fharock": 110.0,
    "ecuinas": 91.0,
    "LxckxStrxkx": 101.5,
    "soy_cule74": 100.0,
    "Akourdideh": 106.5
  },
  "actions": {
    "preflop": [
      "Asiento 1: SrLyce (2.38 € en fichas)",
      "Asiento 2: Fharock (2.20 € en fichas)",
      "Asiento 3: ecuinas (1.82 € en fichas)",
      "Asiento 4: LxckxStrxkx (2.03 € en fichas)",
      "Asiento 5: soy_cule74 (2 € en fichas)",
      "Asiento 6: Akourdideh (2.13 € en fichas)",
      "Fharock: pone la ciega pequeña 0.01 €",
      "ecuinas: pone la ciega grande 0.02 €",
      "LxckxStrxkx: sube 0.04 € a 0.06 €",
      "soy_cule74: se retira",
      "Akourdideh: iguala 0.06 €",
      "SrLyce: se retira",
      "Fharock: se retira",
      "ecuinas: se retira"
    ],
    "flop": [
      "LxckxStrxkx: pasa",
      "Akourdideh: apuesta 0.07 €",
      "LxckxStrxkx: se retira",
      "Asiento 1: SrLyce (botón) se retiró antes del Flop (no apostó)",
      "Asiento 2: Fharock (ciega pequeña) se retiró antes del Flop",
      "Asiento 3: ecuinas (ciega grande) se retiró antes del Flop",
      "Asiento 4: LxckxStrxkx se retiró en el Flop",
      "Asiento 5: soy_cule74 se retiró antes del Flop (no apostó)",
      "Asiento 6: Akourdideh recaudó (0.14 €)"
    ],
    "turn": [],
    "river": []
  },
  "board": [
    "Td",
    "7d",
    "Qs"
  ],
  "winner": "Akourdideh",
  "win_amount": 7.0,
  "sb": 0.01,
  "bb": 0.02,
  "rake": 0.5,
  "raw_text": "Mano n.º 257168382795 de PokerStars:  Hold'em No Limit (0.01 €/0.02 € EUR) - 01-08-2025 11:37:42 CET [01-08-2025 5:37:42 ET]\nMesa \"Atlas\" 6-max El asiento n.º 1 es el botón\nAsiento 1: SrLyce (2.38 € en fichas) \nAsiento 2: Fharock (2.20 € en fichas) \nAsiento 3: ecuinas (1.82 € en fichas) \nAsiento 4: LxckxStrxkx (2.03 € en fichas) \nAsiento 5: soy_cule74 (2 € en fichas) \nAsiento 6: Akourdideh (2.13 € en fichas) \nFharock: pone la ciega pequeña 0.01 €\necuinas: pone la ciega grande 0.02 €\n*** CARTAS DE MANO ***\nRepartidas a SrLyce [Jd 6h]\nLxckxStrxkx: sube 0.04 € a 0.06 €\nsoy_cule74: se retira \nAkourdideh: iguala 0.06 €\nSrLyce: se retira \nFharock: se retira \necuinas: se retira \n*** FLOP *** [Td 7d Qs]\nLxckxStrxkx: pasa \nAkourdideh: apuesta 0.07 €\nLxckxStrxkx: se retira \nLa apuesta no igualada (0.07 €) ha sido devuelta a Akourdideh\nAkourdideh se lleva 0.14 € del bote \n*** RESUMEN ***\nBote total 0.15 € | Comisión 0.01 € \nComunitarias [Td 7d Qs]\nAsiento 1: SrLyce (botón) se retiró antes del Flop (no apostó)\nAsiento 2: Fharock (ciega pequeña) se retiró antes del Flop\nAsiento 3: ecuinas (ciega grande) se retiró antes del Flop\nAsiento 4: LxckxStrxkx se retiró en el Flop\nAsiento 5: soy_cule74 se retiró antes del Flop (no apostó)\nAsiento 6: Akourdideh recaudó (0.14 €)"
}