{
  "hand_id": "257238306805",
  "date": "06-08-2025 18:46:22",
  "table": "Alruccabah II",
  "game_type": "holdem",
  "hero": "SrLyce",
  "hero_position": "",
  "hero_cards": [
    "Tc",
    "As"
  ],
  "stacks": {
    "rayao32": 52.0,
    "SrLyce": 98.0,
    "Davdgoni": 283.0,
    "tatinette35": 100.0,
    "Nicanor Cast": 51.5
  },
  "actions": {
    "preflop": [
      "Asiento 6: rayao32 (1.04 € en fichas) está ausente",
      "Asiento 1: SrLyce (1.96 € en fichas)",
      "Asiento 2: Davdgoni (5.66 € en fichas)",
      "Asiento 3: tatinette35 (2 € en fichas)",
      "Asiento 4: serviettski(fr) (2 € en fichas)",
      "Asiento 5: Nicanor Cast (1.03 € en fichas)",
      "Davdgoni: pone la ciega pequeña 0.01 €",
      "tatinette35: pone la ciega grande 0.02 €",
      "serviettski(fr): se retira",
      "Nicanor Cast: sube 0.03 € a 0.05 €",
      "SrLyce: iguala 0.05 €",
      "Davdgoni: iguala 0.04 €",
      "tatinette35: se retira"
    ],
    "flop": [
      "Davdgoni: pasa",
      "Nicanor Cast: pasa",
      "SrLyce: pasa"
    ],
    "turn": [
      "Davdgoni: pasa",
      "Nicanor Cast: pasa",
      "SrLyce: pasa"
    ],
    "river": [
      "Davdgoni: pasa",
      "Nicanor Cast: apuesta 0.16 €",
      "SrLyce: se retira",
      "Davdgoni: se retira",
      "Nicanor Cast: no muestra su mano",
      "Asiento 6: rayao32",
      "Asiento 1: SrLyce (botón) se retiró en el River",
      "Asiento 2: Davdgoni (ciega pequeña) se retiró en el River",
      "Asiento 3: tatinette35 (ciega grande) se retiró antes del Flop",
      "Asiento 4: serviettski(fr) se retiró antes del Flop (no apostó)",
      "Asiento 5: Nicanor Cast recaudó (0.16 €)"
    ]
  },
  "board": [
    "4h",
    "5d",
    "Qh",
    "2h",
    "3s"
  ],
  "winner": "Cast",
  "win_amount": 8.0,
  "sb": 0.01,
  "bb": 0.02,
  "rake": 0.5,
  "raw_text": "Mano n.º 257238306805 de PokerStars:  Hold'em No Limit (0.01 €/0.02 € EUR) - 06-08-2025 18:46:22 CET [06-08-2025 12:46:22 ET]\nMesa \"Alruccabah II\" 6-max El asiento n.º 1 es el botón\nAsiento 6: rayao32 (1.04 € en fichas) está ausente\nAsiento 1: SrLyce (1.96 € en fichas) \nAsiento 2: Davdgoni (5.66 € en fichas) \nAsiento 3: tatinette35 (2 € en fichas) \nAsiento 4: serviettski(fr) (2 € en fichas) \nAsiento 5: Nicanor Cast (1.03 € en fichas) \nDavdgoni: pone la ciega pequeña 0.01 €\ntatinette35: pone la ciega grande 0.02 €\n*** CARTAS DE MANO ***\nRepartidas a SrLyce [Tc As]\nserviettski(fr): se retira \nNicanor Cast: sube 0.03 € a 0.05 €\nSrLyce: iguala 0.05 €\nDavdgoni: iguala 0.04 €\ntatinette35: se retira \n*** FLOP *** [4h 5d Qh]\nDavdgoni: pasa \nNicanor Cast: pasa \nSrLyce: pasa \n*** TURN *** [4h 5d Qh] [2h]\nDavdgoni: pasa \nNicanor Cast: pasa \nSrLyce: pasa \n*** RIVER *** [4h 5d Qh 2h] [3s]\nDavdgoni: pasa \nNicanor Cast: apuesta 0.16 €\nSrLyce: se retira \nDavdgoni: se retira \nLa apuesta no igualada (0.16 €) ha sido devuelta a Nicanor Cast\nNicanor Cast se lleva 0.16 € del bote \nNicanor Cast: no muestra su mano \n*** RESUMEN ***\nBote total 0.17 € | Comisión 0.01 € \nComunitarias [4h 5d Qh 2h 3s]\nAsiento 6: rayao32\nAsiento 1: SrLyce (botón) se retiró en el River\nAsiento 2: Davdgoni (ciega pequeña) se retiró en el River\nAsiento 3: tatinette35 (ciega grande) se retiró antes del Flop\nAsiento 4: serviettski(fr) se retiró antes del Flop (no apostó)\nAsiento 5: Nicanor Cast recaudó (0.16 €)"
}