{
  "hand_id": "257238014233",
  "date": "06-08-2025 18:20:23",
  "table": "Euneus III",
  "game_type": "holdem",
  "hero": "SrLyce",
  "hero_position": "",
  "hero_cards": [
    "9d",
    "Td"
  ],
  "stacks": {
    "christgear": 100.0,
    "Il_BM00": 119.5,
    "djrojas9": 140.5,
    "lol-in 2000": 96.5,
    "SrLyce": 135.5,
    "kcg_rm": 107.0
  },
  "actions": {
    "preflop": [
      "Asiento 1: christgear (2 € en fichas)",
      "Asiento 2: Il_BM00 (2.39 € en fichas)",
      "Asiento 3: djrojas9 (2.81 € en fichas)",
      "Asiento 4: lol-in 2000 (1.93 € en fichas)",
      "Asiento 5: SrLyce (2.71 € en fichas)",
      "Asiento 6: kcg_rm (2.14 € en fichas)",
      "lol-in 2000: pone la ciega pequeña 0.01 €",
      "SrLyce: pone la ciega grande 0.02 €",
      "kcg_rm: sube 0.02 € a 0.04 €",
      "christgear: se retira",
      "Il_BM00: se retira",
      "djrojas9: se retira",
      "lol-in 2000: se retira",
      "SrLyce: iguala 0.02 €"
    ],
    "flop": [
      "SrLyce: pasa",
      "kcg_rm: apuesta 0.03 €",
      "SrLyce: se retira",
      "kcg_rm: no muestra su mano",
      "Asiento 1: christgear se retiró antes del Flop (no apostó)",
      "Asiento 2: Il_BM00 se retiró antes del Flop (no apostó)",
      "Asiento 3: djrojas9 (botón) se retiró antes del Flop (no apostó)",
      "Asiento 4: lol-in 2000 (ciega pequeña) se retiró antes del Flop",
      "Asiento 5: SrLyce (ciega grande) se retiró en el Flop",
      "Asiento 6: kcg_rm recaudó (0.08 €)"
    ],
    "turn": [],
    "river": []
  },
  "board": [
    "Ac",
    "6s",
    "Qh"
  ],
  "winner": "kcg_rm",
  "win_amount": 4.0,
  "sb": 0.01,
  "bb": 0.02,
  "rake": 0.5,
  "raw_text": "Mano n.º 257238014233 de PokerStars:  Hold'em No Limit (0.01 €/0.02 € EUR) - 06-08-2025 18:20:23 CET [06-08-2025 12:20:23 ET]\nMesa \"Euneus III\" 6-max El asiento n.º 3 es el botón\nAsiento 1: christgear (2 € en fichas) \nAsiento 2: Il_BM00 (2.39 € en fichas) \nAsiento 3: djrojas9 (2.81 € en fichas) \nAsiento 4: lol-in 2000 (1.93 € en fichas) \nAsiento 5: SrLyce (2.71 € en fichas) \nAsiento 6: kcg_rm (2.14 € en fichas) \nlol-in 2000: pone la ciega pequeña 0.01 €\nSrLyce: pone la ciega grande 0.02 €\n*** CARTAS DE MANO ***\nRepartidas a SrLyce [9d Td]\nkcg_rm: sube 0.02 € a 0.04 €\nchristgear: se retira \nIl_BM00: se retira \ndjrojas9: se retira \nlol-in 2000: se retira \nSrLyce: iguala 0.02 €\n*** FLOP *** [Ac 6s Qh]\nSrLyce: pasa \nkcg_rm: apuesta 0.03 €\nSrLyce: se retira \nLa apuesta no igualada (0.03 €) ha sido devuelta a kcg_rm\nkcg_rm se lleva 0.08 € del bote \nkcg_rm: no muestra su mano \n*** RESUMEN ***\nBote total 0.09 € | Comisión 0.01 € \nComunitarias [Ac 6s Qh]\nAsiento 1: christgear se retiró antes del Flop (no apostó)\nAsiento 2: Il_BM00 se retiró antes del Flop (no apostó)\nAsiento 3: djrojas9 (botón) se retiró antes del Flop (no apostó)\nAsiento 4: lol-in 2000 (ciega pequeña) se retiró antes del Flop\nAsiento 5: SrLyce (ciega grande) se retiró en el Flop\nAsiento 6: kcg_rm recaudó (0.08 €)"
}