{
  "hand_id": "257238762889",
  "date": "06-08-2025 19:26:58",
  "table": "Leonteus",
  "game_type": "holdem",
  "hero": "SrLyce",
  "hero_position": "",
  "hero_cards": [
    "6c",
    "3s"
  ],
  "stacks": {
    "davinci1962": 151.0,
    "Andark47": 207.5,
    "practikal_C23": 50.5,
    "niyomalo": 99.0,
    "BuXHexter": 163.0,
    "SrLyce": 74.5
  },
  "actions": {
    "preflop": [
      "Asiento 3: davinci1962 (3.02 € en fichas) está ausente",
      "Asiento 5: Andark47 (4.15 € en fichas) está ausente",
      "Asiento 1: practikal_C23 (1.01 € en fichas)",
      "Asiento 2: niyomalo (1.98 € en fichas)",
      "Asiento 4: BuXHexter (3.26 € en fichas)",
      "Asiento 6: SrLyce (1.49 € en fichas)",
      "niyomalo: pone la ciega pequeña 0.01 €",
      "davinci1962: está ausente",
      "BuXHexter: pone la ciega grande 0.02 €",
      "Andark47: se ausenta",
      "SrLyce: se retira",
      "practikal_C23: iguala 0.02 €",
      "niyomalo: iguala 0.01 €",
      "BuXHexter: pasa"
    ],
    "flop": [
      "niyomalo: pasa",
      "BuXHexter: pasa",
      "practikal_C23: pasa"
    ],
    "turn": [
      "niyomalo: pasa",
      "BuXHexter: pasa",
      "practikal_C23: apuesta 0.02 €",
      "niyomalo: iguala 0.02 €",
      "BuXHexter: se retira"
    ],
    "river": [
      "niyomalo: apuesta 1.94 € y está all-in",
      "practikal_C23: se retira",
      "niyomalo: no muestra su mano",
      "Asiento 3: davinci1962",
      "Asiento 5: Andark47",
      "Asiento 1: practikal_C23 (botón) se retiró en el River",
      "Asiento 2: niyomalo (ciega pequeña) recaudó (0.09 €)",
      "Asiento 4: BuXHexter (ciega grande) se retiró en el Turn",
      "Asiento 6: SrLyce se retiró antes del Flop (no apostó)"
    ]
  },
  "board": [
    "Qd",
    "8h",
    "Jd",
    "5s",
    "5h"
  ],
  "winner": "niyomalo",
  "win_amount": 4.5,
  "sb": 0.01,
  "bb": 0.02,
  "rake": 0.5,
  "raw_text": "Mano n.º 257238762889 de PokerStars:  Hold'em No Limit (0.01 €/0.02 € EUR) - 06-08-2025 19:26:58 CET [06-08-2025 13:26:58 ET]\nMesa \"Leonteus\" 6-max El asiento n.º 1 es el botón\nAsiento 3: davinci1962 (3.02 € en fichas) está ausente\nAsiento 5: Andark47 (4.15 € en fichas) está ausente\nAsiento 1: practikal_C23 (1.01 € en fichas) \nAsiento 2: niyomalo (1.98 € en fichas) \nAsiento 4: BuXHexter (3.26 € en fichas) \nAsiento 6: SrLyce (1.49 € en fichas) \nniyomalo: pone la ciega pequeña 0.01 €\ndavinci1962: está ausente \nBuXHexter: pone la ciega grande 0.02 €\nAndark47: se ausenta \n*** CARTAS DE MANO ***\nRepartidas a SrLyce [6c 3s]\nSrLyce: se retira \npractikal_C23: iguala 0.02 €\nniyomalo: iguala 0.01 €\nBuXHexter: pasa \n*** FLOP *** [Qd 8h Jd]\nniyomalo: pasa \nBuXHexter: pasa \npractikal_C23: pasa \n*** TURN *** [Qd 8h Jd] [5s]\nniyomalo: pasa \nBuXHexter: pasa \npractikal_C23: apuesta 0.02 €\nniyomalo: iguala 0.02 €\ndavinci1962 deja la mesa\nBuXHexter: se retira \n*** RIVER *** [Qd 8h Jd 5s] [5h]\nniyomalo: apuesta 1.94 € y está all-in\npractikal_C23: se retira \nLa apuesta no igualada (1.94 €) ha sido devuelta a niyomalo\nniyomalo se lleva 0.09 € del bote \nniyomalo: no muestra su mano \nFalcoNaumani se une a la mesa en el asiento n.º 3 \n*** RESUMEN ***\nBote total 0.10 € | Comisión 0.01 € \nComunitarias [Qd 8h Jd 5s 5h]\nAsiento 3: davinci1962\nAsiento 5: Andark47\nAsiento 1: practikal_C23 (botón) se retiró en el River\nAsiento 2: niyomalo (ciega pequeña) recaudó (0.09 €)\nAsiento 4: BuXHexter (ciega grande) se retiró en el Turn\nAsiento 6: SrLyce se retiró antes del Flop (no apostó)"
}