{
  "hand_id": "257238441966",
  "date": "06-08-2025 18:59:19",
  "table": "Alruccabah II",
  "game_type": "holdem",
  "hero": "SrLyce",
  "hero_position": "",
  "hero_cards": [
    "5c",
    "9c"
  ],
  "stacks": {
    "SrLyce": 138.0,
    "zoioachado": 47.0,
    "yonisanlu": 100.0,
    "Nicanor Cast": 52.5,
    "rayao32": 43.5
  },
  "actions": {
    "preflop": [
      "Asiento 1: SrLyce (2.76 € en fichas)",
      "Asiento 2: zoioachado (0.94 € en fichas)",
      "Asiento 3: yonisanlu (2 € en fichas)",
      "Asiento 4: serviettski(fr) (2.05 € en fichas)",
      "Asiento 5: Nicanor Cast (1.05 € en fichas)",
      "Asiento 6: rayao32 (0.87 € en fichas)",
      "yonisanlu: pone la ciega pequeña 0.01 €",
      "serviettski(fr): pone la ciega grande 0.02 €",
      "Nicanor Cast: se retira",
      "rayao32: iguala 0.02 €",
      "SrLyce: se retira",
      "zoioachado: sube 0.07 € a 0.09 €",
      "yonisanlu: sube 0.17 € a 0.26 €",
      "serviettski(fr): se retira",
      "rayao32: se retira",
      "zoioachado: sube 0.68 € a 0.94 € y está all-in",
      "yonisanlu: iguala 0.68 €"
    ],
    "flop": [],
    "turn": [],
    "river": [
      "yonisanlu: muestra [Kh Ac] (escalera, de as a cinco)",
      "zoioachado: muestra [Js Jd] (pareja de jotas)",
      "Asiento 1: SrLyce se retiró antes del Flop (no apostó)",
      "Asiento 2: zoioachado (botón) muestra [Js Jd] y perdió con pareja de jotas",
      "Asiento 3: yonisanlu (ciega pequeña) muestra [Kh Ac] y ganó (1.80 €) con escalera, de as a cinco",
      "Asiento 4: serviettski(fr) (ciega grande) se retiró antes del Flop",
      "Asiento 5: Nicanor Cast se retiró antes del Flop (no apostó)",
      "Asiento 6: rayao32 se retiró antes del Flop"
    ]
  },
  "board": [
    "5d",
    "2d",
    "Ks",
    "3d",
    "4s"
  ],
  "winner": "yonisanlu",
  "win_amount": 90.0,
  "sb": 0.01,
  "bb": 0.02,
  "rake": 6.0,
  "raw_text": "Mano n.º 257238441966 de PokerStars:  Hold'em No Limit (0.01 €/0.02 € EUR) - 06-08-2025 18:59:19 CET [06-08-2025 12:59:19 ET]\nMesa \"Alruccabah II\" 6-max El asiento n.º 2 es el botón\nAsiento 1: SrLyce (2.76 € en fichas) \nAsiento 2: zoioachado (0.94 € en fichas) \nAsiento 3: yonisanlu (2 € en fichas) \nAsiento 4: serviettski(fr) (2.05 € en fichas) \nAsiento 5: Nicanor Cast (1.05 € en fichas) \nAsiento 6: rayao32 (0.87 € en fichas) \nyonisanlu: pone la ciega pequeña 0.01 €\nserviettski(fr): pone la ciega grande 0.02 €\n*** CARTAS DE MANO ***\nRepartidas a SrLyce [5c 9c]\nNicanor Cast: se retira \nrayao32: iguala 0.02 €\nSrLyce: se retira \nzoioachado: sube 0.07 € a 0.09 €\nyonisanlu: sube 0.17 € a 0.26 €\nserviettski(fr): se retira \nrayao32: se retira \nzoioachado: sube 0.68 € a 0.94 € y está all-in\nyonisanlu: iguala 0.68 €\n*** FLOP *** [5d 2d Ks]\n*** TURN *** [5d 2d Ks] [3d]\n*** RIVER *** [5d 2d Ks 3d] [4s]\n*** SHOW DOWN ***\nyonisanlu: muestra [Kh Ac] (escalera, de as a cinco)\nzoioachado: muestra [Js Jd] (pareja de jotas)\nyonisanlu se lleva 1.80 € del bote \nzoioachado no tiene conexión \n*** RESUMEN ***\nBote total 1.92 € | Comisión 0.12 € \nComunitarias [5d 2d Ks 3d 4s]\nAsiento 1: SrLyce se retiró antes del Flop (no apostó)\nAsiento 2: zoioachado (botón) muestra [Js Jd] y perdió con pareja de jotas\nAsiento 3: yonisanlu (ciega pequeña) muestra [Kh Ac] y ganó (1.80 €) con escalera, de as a cinco\nAsiento 4: serviettski(fr) (ciega grande) se retiró antes del Flop\nAsiento 5: Nicanor Cast se retiró antes del Flop (no apostó)\nAsiento 6: rayao32 se retiró antes del Flop"
}