{
  "hand_id": "257238456446",
  "date": "06-08-2025 19:00:59",
  "table": "Adelaide III",
  "game_type": "holdem",
  "hero": "SrLyce",
  "hero_position": "",
  "hero_cards": [
    "Ts",
    "Jd"
  ],
  "stacks": {
    "N3xtTIm35": 124.5,
    "aliendee07": 64.5,
    "Macklemore0": 100.0,
    "SrLyce": 98.0,
    "ismagonzalez7": 51.0,
    "pauquair5": 69.0
  },
  "actions": {
    "preflop": [
      "Asiento 1: N3xtTIm35 (2.49 € en fichas)",
      "Asiento 2: aliendee07 (1.29 € en fichas)",
      "Asiento 3: Macklemore0 (2 € en fichas)",
      "Asiento 4: SrLyce (1.96 € en fichas)",
      "Asiento 5: ismagonzalez7 (1.02 € en fichas)",
      "Asiento 6: pauquair5 (1.38 € en fichas)",
      "pauquair5: pone la ciega pequeña 0.01 €",
      "N3xtTIm35: pone la ciega grande 0.02 €",
      "aliendee07: se retira",
      "Macklemore0: sube 0.04 € a 0.06 €",
      "SrLyce: iguala 0.06 €",
      "ismagonzalez7: se retira",
      "pauquair5: se retira",
      "N3xtTIm35: se retira"
    ],
    "flop": [
      "Macklemore0: pasa",
      "SrLyce: pasa"
    ],
    "turn": [
      "Macklemore0: pasa",
      "SrLyce: apuesta 0.05 €",
      "Macklemore0: se retira",
      "SrLyce: no muestra su mano",
      "Asiento 1: N3xtTIm35 (ciega grande) se retiró antes del Flop",
      "Asiento 2: aliendee07 se retiró antes del Flop (no apostó)",
      "Asiento 3: Macklemore0 se retiró en el Turn",
      "Asiento 4: SrLyce recaudó (0.14 €)",
      "Asiento 5: ismagonzalez7 (botón) se retiró antes del Flop (no apostó)",
      "Asiento 6: pauquair5 (ciega pequeña) se retiró antes del Flop"
    ],
    "river": []
  },
  "board": [
    "6c",
    "Qd",
    "2c",
    "2d"
  ],
  "winner": "SrLyce",
  "win_amount": 7.0,
  "sb": 0.01,
  "bb": 0.02,
  "rake": 0.5,
  "raw_text": "Mano n.º 257238456446 de PokerStars:  Hold'em No Limit (0.01 €/0.02 € EUR) - 06-08-2025 19:00:59 CET [06-08-2025 13:00:59 ET]\nMesa \"Adelaide III\" 6-max El asiento n.º 5 es el botón\nAsiento 1: N3xtTIm35 (2.49 € en fichas) \nAsiento 2: aliendee07 (1.29 € en fichas) \nAsiento 3: Macklemore0 (2 € en fichas) \nAsiento 4: SrLyce (1.96 € en fichas) \nAsiento 5: ismagonzalez7 (1.02 € en fichas) \nAsiento 6: pauquair5 (1.38 € en fichas) \npauquair5: pone la ciega pequeña 0.01 €\nN3xtTIm35: pone la ciega grande 0.02 €\n*** CARTAS DE MANO ***\nRepartidas a SrLyce [Ts Jd]\naliendee07: se retira \nMacklemore0: sube 0.04 € a 0.06 €\nSrLyce: iguala 0.06 €\nismagonzalez7: se retira \npauquair5: se retira \nN3xtTIm35: se retira \n*** FLOP *** [6c Qd 2c]\nMacklemore0: pasa \nSrLyce: pasa \n*** TURN *** [6c Qd 2c] [2d]\nMacklemore0: pasa \nSrLyce: apuesta 0.05 €\nMacklemore0: se retira \nLa apuesta no igualada (0.05 €) ha sido devuelta a SrLyce\nSrLyce se lleva 0.14 € del bote \nSrLyce: no muestra su mano \n*** RESUMEN ***\nBote total 0.15 € | Comisión 0.01 € \nComunitarias [6c Qd 2c 2d]\nAsiento 1: N3xtTIm35 (ciega grande) se retiró antes del Flop\nAsiento 2: aliendee07 se retiró antes del Flop (no apostó)\nAsiento 3: Macklemore0 se retiró en el Turn\nAsiento 4: SrLyce recaudó (0.14 €)\nAsiento 5: ismagonzalez7 (botón) se retiró antes del Flop (no apostó)\nAsiento 6: pauquair5 (ciega pequeña) se retiró antes del Flop"
}