{
  "hand_id": "257149139322",
  "date": "30-07-2025 22:10:47",
  "table": "Esclangona",
  "game_type": "holdem",
  "hero": "SrLyce",
  "hero_position": "",
  "hero_cards": [
    "7c",
    "8h"
  ],
  "stacks": {
    "elketefaka1": 100.0,
    "Zorgue1080": 56.5,
    "SrLyce": 44.0,
    "NoahBolete": 123.5,
    "Davdgoni": 224.5,
    "DiaZzZ1": 100.0
  },
  "actions": {
    "preflop": [
      "Asiento 6: elketefaka1 (2 € en fichas) está ausente",
      "Asiento 1: Zorgue1080 (1.13 € en fichas)",
      "Asiento 2: SrLyce (0.88 € en fichas)",
      "Asiento 3: NoahBolete (2.47 € en fichas)",
      "Asiento 4: Davdgoni (4.49 € en fichas)",
      "Asiento 5: DiaZzZ1 (2 € en fichas)",
      "Davdgoni: pone la ciega pequeña 0.01 €",
      "DiaZzZ1: pone la ciega grande 0.02 €",
      "elketefaka1: se ausenta",
      "Zorgue1080: se retira",
      "SrLyce: se retira",
      "NoahBolete: se retira",
      "Davdgoni: se retira",
      "DiaZzZ1: no muestra su mano",
      "Asiento 6: elketefaka1",
      "Asiento 1: Zorgue1080 se retiró antes del Flop (no apostó)",
      "Asiento 2: SrLyce se retiró antes del Flop (no apostó)",
      "Asiento 3: NoahBolete (botón) se retiró antes del Flop (no apostó)",
      "Asiento 4: Davdgoni (ciega pequeña) se retiró antes del Flop",
      "Asiento 5: DiaZzZ1 (ciega grande) recaudó (0.02 €)"
    ],
    "flop": [],
    "turn": [],
    "river": []
  },
  "board": [],
  "winner": "DiaZzZ1",
  "win_amount": 1.0,
  "sb": 0.01,
  "bb": 0.02,
  "rake": 0.0,
  "raw_text": "Mano n.º 257149139322 de PokerStars:  Hold'em No Limit (0.01 €/0.02 € EUR) - 30-07-2025 22:10:47 CET [30-07-2025 16:10:47 ET]\nMesa \"Esclangona\" 6-max El asiento n.º 3 es el botón\nAsiento 6: elketefaka1 (2 € en fichas) está ausente\nAsiento 1: Zorgue1080 (1.13 € en fichas) \nAsiento 2: SrLyce (0.88 € en fichas) \nAsiento 3: NoahBolete (2.47 € en fichas) \nAsiento 4: Davdgoni (4.49 € en fichas) \nAsiento 5: DiaZzZ1 (2 € en fichas) \nDavdgoni: pone la ciega pequeña 0.01 €\nDiaZzZ1: pone la ciega grande 0.02 €\nelketefaka1: se ausenta \n*** CARTAS DE MANO ***\nRepartidas a SrLyce [7c 8h]\nZorgue1080: se retira \nSrLyce: se retira \nNoahBolete: se retira \nDavdgoni: se retira \nLa apuesta no igualada (0.01 €) ha sido devuelta a DiaZzZ1\nDiaZzZ1 se lleva 0.02 € del bote \nDiaZzZ1: no muestra su mano \n*** RESUMEN ***\nBote total 0.02 € | Comisión 0 € \nAsiento 6: elketefaka1\nAsiento 1: Zorgue1080 se retiró antes del Flop (no apostó)\nAsiento 2: SrLyce se retiró antes del Flop (no apostó)\nAsiento 3: NoahBolete (botón) se retiró antes del Flop (no apostó)\nAsiento 4: Davdgoni (ciega pequeña) se retiró antes del Flop\nAsiento 5: DiaZzZ1 (ciega grande) recaudó (0.02 €)"
}