{
  "hand_id": "257150561197",
  "date": "30-07-2025 23:50:49",
  "table": "Lobelia",
  "game_type": "holdem",
  "hero": "SrLyce",
  "hero_position": "",
  "hero_cards": [
    "5h",
    "5c"
  ],
  "stacks": {
    "LeVbks": 157.0,
    "fcis666": 20.5,
    "Dlaguancha": 119.5,
    "SrLyce": 99.0,
    "riverluck444": 70.0,
    "javipondio": 44.5
  },
  "actions": {
    "preflop": [
      "Asiento 1: LeVbks (3.14 € en fichas)",
      "Asiento 2: fcis666 (0.41 € en fichas)",
      "Asiento 3: Dlaguancha (2.39 € en fichas)",
      "Asiento 4: SrLyce (1.98 € en fichas)",
      "Asiento 5: riverluck444 (1.40 € en fichas)",
      "Asiento 6: javipondio (0.89 € en fichas)",
      "riverluck444: pone la ciega pequeña 0.01 €",
      "javipondio: pone la ciega grande 0.02 €",
      "LeVbks: iguala 0.02 €",
      "fcis666: iguala 0.02 €",
      "Dlaguancha: se retira",
      "SrLyce: iguala 0.02 €",
      "riverluck444: se retira",
      "javipondio: pasa"
    ],
    "flop": [
      "javipondio: pasa",
      "LeVbks: pasa",
      "fcis666: pasa",
      "SrLyce: pasa"
    ],
    "turn": [
      "javipondio: apuesta 0.02 €",
      "LeVbks: se retira",
      "fcis666: iguala 0.02 €",
      "SrLyce: iguala 0.02 €"
    ],
    "river": [
      "javipondio: apuesta 0.02 €",
      "fcis666: se retira",
      "SrLyce: iguala 0.02 €",
      "javipondio: muestra [Jc 2h] (doble pareja, cuatros y doses)",
      "SrLyce: muestra [5h 5c] (doble pareja, cincos y cuatros)",
      "Asiento 1: LeVbks se retiró en el Turn",
      "Asiento 2: fcis666 se retiró en el River",
      "Asiento 3: Dlaguancha se retiró antes del Flop (no apostó)",
      "Asiento 4: SrLyce (botón) muestra [5h 5c] y ganó (0.18 €) con doble pareja, cincos y cuatros",
      "Asiento 5: riverluck444 (ciega pequeña) se retiró antes del Flop",
      "Asiento 6: javipondio (ciega grande) muestra [Jc 2h] y perdió con doble pareja, cuatros y doses"
    ]
  },
  "board": [
    "4c",
    "4d",
    "7s",
    "2d",
    "6d"
  ],
  "winner": "SrLyce",
  "win_amount": 9.0,
  "sb": 0.01,
  "bb": 0.02,
  "rake": 0.5,
  "raw_text": "Mano n.º 257150561197 de PokerStars:  Hold'em No Limit (0.01 €/0.02 € EUR) - 30-07-2025 23:50:49 CET [30-07-2025 17:50:49 ET]\nMesa \"Lobelia\" 6-max El asiento n.º 4 es el botón\nAsiento 1: LeVbks (3.14 € en fichas) \nAsiento 2: fcis666 (0.41 € en fichas) \nAsiento 3: Dlaguancha (2.39 € en fichas) \nAsiento 4: SrLyce (1.98 € en fichas) \nAsiento 5: riverluck444 (1.40 € en fichas) \nAsiento 6: javipondio (0.89 € en fichas) \nriverluck444: pone la ciega pequeña 0.01 €\njavipondio: pone la ciega grande 0.02 €\n*** CARTAS DE MANO ***\nRepartidas a SrLyce [5h 5c]\nLeVbks: iguala 0.02 €\nfcis666: iguala 0.02 €\nDlaguancha: se retira \nSrLyce: iguala 0.02 €\nriverluck444: se retira \njavipondio: pasa \n*** FLOP *** [4c 4d 7s]\njavipondio: pasa \nLeVbks: pasa \nfcis666: pasa \nSrLyce: pasa \n*** TURN *** [4c 4d 7s] [2d]\njavipondio: apuesta 0.02 €\nLeVbks: se retira \nfcis666: iguala 0.02 €\nSrLyce: iguala 0.02 €\n*** RIVER *** [4c 4d 7s 2d] [6d]\njavipondio: apuesta 0.02 €\nfcis666: se retira \nSrLyce: iguala 0.02 €\n*** SHOW DOWN ***\njavipondio: muestra [Jc 2h] (doble pareja, cuatros y doses)\nSrLyce: muestra [5h 5c] (doble pareja, cincos y cuatros)\nSrLyce se lleva 0.18 € del bote \n*** RESUMEN ***\nBote total 0.19 € | Comisión 0.01 € \nComunitarias [4c 4d 7s 2d 6d]\nAsiento 1: LeVbks se retiró en el Turn\nAsiento 2: fcis666 se retiró en el River\nAsiento 3: Dlaguancha se retiró antes del Flop (no apostó)\nAsiento 4: SrLyce (botón) muestra [5h 5c] y ganó (0.18 €) con doble pareja, cincos y cuatros\nAsiento 5: riverluck444 (ciega pequeña) se retiró antes del Flop\nAsiento 6: javipondio (ciega grande) muestra [Jc 2h] y perdió con doble pareja, cuatros y doses"
}