{
  "hand_id": "257168246459",
  "date": "01-08-2025 11:12:01",
  "table": "Sekanina",
  "game_type": "holdem",
  "hero": "SrLyce",
  "hero_position": "",
  "hero_cards": [
    "5d",
    "5h"
  ],
  "stacks": {
    "DagonBZH56": 80.0,
    "practikal_C23": 98.0,
    "Alvii37": 104.0,
    "SrLyce": 164.5,
    "davinci1962": 105.0,
    "Elministrelas": 98.0
  },
  "actions": {
    "preflop": [
      "Asiento 1: DagonBZH56 (1.60 € en fichas)",
      "Asiento 2: practikal_C23 (1.96 € en fichas)",
      "Asiento 3: Alvii37 (2.08 € en fichas)",
      "Asiento 4: SrLyce (3.29 € en fichas)",
      "Asiento 5: davinci1962 (2.10 € en fichas)",
      "Asiento 6: Elministrelas (1.96 € en fichas)",
      "Elministrelas: pone la ciega pequeña 0.01 €",
      "DagonBZH56: pone la ciega grande 0.02 €",
      "practikal_C23: iguala 0.02 €",
      "Alvii37: se retira",
      "SrLyce: sube 0.04 € a 0.06 €",
      "davinci1962: sube 0.19 € a 0.25 €",
      "Elministrelas: se retira",
      "DagonBZH56: se retira",
      "practikal_C23: se retira",
      "SrLyce: se retira",
      "davinci1962: no muestra su mano",
      "Asiento 1: DagonBZH56 (ciega grande) se retiró antes del Flop",
      "Asiento 2: practikal_C23 se retiró antes del Flop",
      "Asiento 3: Alvii37 se retiró antes del Flop (no apostó)",
      "Asiento 4: SrLyce se retiró antes del Flop",
      "Asiento 5: davinci1962 (botón) recaudó (0.17 €)",
      "Asiento 6: Elministrelas (ciega pequeña) se retiró antes del Flop"
    ],
    "flop": [],
    "turn": [],
    "river": []
  },
  "board": [],
  "winner": "davinci1962",
  "win_amount": 8.5,
  "sb": 0.01,
  "bb": 0.02,
  "rake": 0.0,
  "raw_text": "Mano n.º 257168246459 de PokerStars:  Hold'em No Limit (0.01 €/0.02 € EUR) - 01-08-2025 11:12:01 CET [01-08-2025 5:12:01 ET]\nMesa \"Sekanina\" 6-max El asiento n.º 5 es el botón\nAsiento 1: DagonBZH56 (1.60 € en fichas) \nAsiento 2: practikal_C23 (1.96 € en fichas) \nAsiento 3: Alvii37 (2.08 € en fichas) \nAsiento 4: SrLyce (3.29 € en fichas) \nAsiento 5: davinci1962 (2.10 € en fichas) \nAsiento 6: Elministrelas (1.96 € en fichas) \nElministrelas: pone la ciega pequeña 0.01 €\nDagonBZH56: pone la ciega grande 0.02 €\n*** CARTAS DE MANO ***\nRepartidas a SrLyce [5d 5h]\npractikal_C23: iguala 0.02 €\nAlvii37: se retira \nSrLyce: sube 0.04 € a 0.06 €\ndavinci1962: sube 0.19 € a 0.25 €\nElministrelas: se retira \nDagonBZH56: se retira \npractikal_C23: se retira \nSrLyce: se retira \nLa apuesta no igualada (0.19 €) ha sido devuelta a davinci1962\ndavinci1962 se lleva 0.17 € del bote \ndavinci1962: no muestra su mano \n*** RESUMEN ***\nBote total 0.17 € | Comisión 0 € \nAsiento 1: DagonBZH56 (ciega grande) se retiró antes del Flop\nAsiento 2: practikal_C23 se retiró antes del Flop\nAsiento 3: Alvii37 se retiró antes del Flop (no apostó)\nAsiento 4: SrLyce se retiró antes del Flop\nAsiento 5: davinci1962 (botón) recaudó (0.17 €)\nAsiento 6: Elministrelas (ciega pequeña) se retiró antes del Flop"
}