{
  "hand_id": "257148646369",
  "date": "30-07-2025 21:34:03",
  "table": "Esclangona",
  "game_type": "holdem",
  "hero": "SrLyce",
  "hero_position": "",
  "hero_cards": [
    "4h",
    "8d"
  ],
  "stacks": {
    "gabriella657": 285.0,
    "Zorgue1080": 96.0,
    "SrLyce": 95.5,
    "Davdgoni": 168.0,
    "DiaZzZ1": 104.0,
    "berlcht403": 43.0
  },
  "actions": {
    "preflop": [
      "Asiento 3: gabriella657 (5.70 € en fichas) está ausente",
      "Asiento 1: Zorgue1080 (1.92 € en fichas)",
      "Asiento 2: SrLyce (1.91 € en fichas)",
      "Asiento 4: Davdgoni (3.36 € en fichas)",
      "Asiento 5: DiaZzZ1 (2.08 € en fichas)",
      "Asiento 6: berlcht403 (0.86 € en fichas)",
      "Zorgue1080: pone la ciega pequeña 0.01 €",
      "SrLyce: pone la ciega grande 0.02 €",
      "Davdgoni: se retira",
      "DiaZzZ1: se retira",
      "berlcht403: se retira",
      "Zorgue1080: se retira",
      "SrLyce: no muestra su mano",
      "Asiento 3: gabriella657",
      "Asiento 1: Zorgue1080 (ciega pequeña) se retiró antes del Flop",
      "Asiento 2: SrLyce (ciega grande) recaudó (0.02 €)",
      "Asiento 4: Davdgoni se retiró antes del Flop (no apostó)",
      "Asiento 5: DiaZzZ1 se retiró antes del Flop (no apostó)",
      "Asiento 6: berlcht403 (botón) se retiró antes del Flop (no apostó)"
    ],
    "flop": [],
    "turn": [],
    "river": []
  },
  "board": [],
  "winner": "SrLyce",
  "win_amount": 1.0,
  "sb": 0.01,
  "bb": 0.02,
  "rake": 0.0,
  "raw_text": "Mano n.º 257148646369 de PokerStars:  Hold'em No Limit (0.01 €/0.02 € EUR) - 30-07-2025 21:34:03 CET [30-07-2025 15:34:03 ET]\nMesa \"Esclangona\" 6-max El asiento n.º 6 es el botón\nAsiento 3: gabriella657 (5.70 € en fichas) está ausente\nAsiento 1: Zorgue1080 (1.92 € en fichas) \nAsiento 2: SrLyce (1.91 € en fichas) \nAsiento 4: Davdgoni (3.36 € en fichas) \nAsiento 5: DiaZzZ1 (2.08 € en fichas) \nAsiento 6: berlcht403 (0.86 € en fichas) \nZorgue1080: pone la ciega pequeña 0.01 €\nSrLyce: pone la ciega grande 0.02 €\n*** CARTAS DE MANO ***\nRepartidas a SrLyce [4h 8d]\nDavdgoni: se retira \nDiaZzZ1: se retira \nberlcht403: se retira \nZorgue1080: se retira \nLa apuesta no igualada (0.01 €) ha sido devuelta a SrLyce\nSrLyce se lleva 0.02 € del bote \nSrLyce: no muestra su mano \n*** RESUMEN ***\nBote total 0.02 € | Comisión 0 € \nAsiento 3: gabriella657\nAsiento 1: Zorgue1080 (ciega pequeña) se retiró antes del Flop\nAsiento 2: SrLyce (ciega grande) recaudó (0.02 €)\nAsiento 4: Davdgoni se retiró antes del Flop (no apostó)\nAsiento 5: DiaZzZ1 se retiró antes del Flop (no apostó)\nAsiento 6: berlcht403 (botón) se retiró antes del Flop (no apostó)"
}