{
  "hand_id": "257237909139",
  "date": "06-08-2025 18:10:56",
  "table": "Nuwa III",
  "game_type": "holdem",
  "hero": "SrLyce",
  "hero_position": "",
  "hero_cards": [
    "5s",
    "8d"
  ],
  "stacks": {
    "BuXHexter": 100.0,
    "kcg_rm": 107.0,
    "SrLyce": 104.5,
    "acavada": 102.0
  },
  "actions": {
    "preflop": [
      "Asiento 2: BuXHexter (2 € en fichas)",
      "Asiento 3: kcg_rm (2.14 € en fichas)",
      "Asiento 4: SrLyce (2.09 € en fichas)",
      "Asiento 6: acavada (2.04 € en fichas)",
      "acavada: pone la ciega pequeña 0.01 €",
      "BuXHexter: pone la ciega grande 0.02 €",
      "kcg_rm: sube 0.02 € a 0.04 €",
      "SrLyce: se retira",
      "acavada: iguala 0.03 €",
      "BuXHexter: se retira"
    ],
    "flop": [
      "acavada: apuesta 0.05 €",
      "kcg_rm: se retira",
      "acavada: no muestra su mano",
      "Asiento 2: BuXHexter (ciega grande) se retiró antes del Flop",
      "Asiento 3: kcg_rm se retiró en el Flop",
      "Asiento 4: SrLyce (botón) se retiró antes del Flop (no apostó)",
      "Asiento 6: acavada (ciega pequeña) recaudó (0.09 €)"
    ],
    "turn": [],
    "river": []
  },
  "board": [
    "Qs",
    "6h",
    "Tc"
  ],
  "winner": "acavada",
  "win_amount": 4.5,
  "sb": 0.01,
  "bb": 0.02,
  "rake": 0.5,
  "raw_text": "Mano n.º 257237909139 de PokerStars:  Hold'em No Limit (0.01 €/0.02 € EUR) - 06-08-2025 18:10:56 CET [06-08-2025 12:10:56 ET]\nMesa \"Nuwa III\" 6-max El asiento n.º 4 es el botón\nAsiento 2: BuXHexter (2 € en fichas) \nAsiento 3: kcg_rm (2.14 € en fichas) \nAsiento 4: SrLyce (2.09 € en fichas) \nAsiento 6: acavada (2.04 € en fichas) \nacavada: pone la ciega pequeña 0.01 €\nBuXHexter: pone la ciega grande 0.02 €\n*** CARTAS DE MANO ***\nRepartidas a SrLyce [5s 8d]\nkcg_rm: sube 0.02 € a 0.04 €\nSrLyce: se retira \nacavada: iguala 0.03 €\nxododo se une a la mesa en el asiento n.º 1 \nJGDOBLAS se une a la mesa en el asiento n.º 5 \nBuXHexter: se retira \n*** FLOP *** [Qs 6h Tc]\nacavada: apuesta 0.05 €\nkcg_rm: se retira \nLa apuesta no igualada (0.05 €) ha sido devuelta a acavada\nacavada se lleva 0.09 € del bote \nacavada: no muestra su mano \n*** RESUMEN ***\nBote total 0.10 € | Comisión 0.01 € \nComunitarias [Qs 6h Tc]\nAsiento 2: BuXHexter (ciega grande) se retiró antes del Flop\nAsiento 3: kcg_rm se retiró en el Flop\nAsiento 4: SrLyce (botón) se retiró antes del Flop (no apostó)\nAsiento 6: acavada (ciega pequeña) recaudó (0.09 €)"
}