{
  "hand_id": "257168375057",
  "date": "01-08-2025 11:36:17",
  "table": "Jupiter",
  "game_type": "holdem",
  "hero": "SrLyce",
  "hero_position": "",
  "hero_cards": [
    "4s",
    "8d"
  ],
  "stacks": {
    "sifilis5": 97.5,
    "Filou203": 105.5,
    "SrLyce": 109.5,
    "LOLA19711971": 41.0,
    "dadou13mars": 209.0,
    "Alvii37": 111.0
  },
  "actions": {
    "preflop": [
      "Asiento 1: sifilis5 (1.95 € en fichas)",
      "Asiento 2: Filou203 (2.11 € en fichas)",
      "Asiento 3: SrLyce (2.19 € en fichas)",
      "Asiento 4: LOLA19711971 (0.82 € en fichas)",
      "Asiento 5: dadou13mars (4.18 € en fichas)",
      "Asiento 6: Alvii37 (2.22 € en fichas)",
      "sifilis5: pone la ciega pequeña 0.01 €",
      "Filou203: pone la ciega grande 0.02 €",
      "SrLyce: se retira",
      "LOLA19711971: iguala 0.02 €",
      "dadou13mars: se retira",
      "Alvii37: sube 0.08 € a 0.10 €",
      "sifilis5: iguala 0.09 €",
      "Filou203: se retira",
      "LOLA19711971: se retira"
    ],
    "flop": [
      "sifilis5: pasa",
      "Alvii37: apuesta 0.07 €",
      "sifilis5: iguala 0.07 €"
    ],
    "turn": [
      "sifilis5: pasa",
      "Alvii37: apuesta 0.27 €",
      "sifilis5: se retira",
      "Alvii37: no muestra su mano",
      "Asiento 1: sifilis5 (ciega pequeña) se retiró en el Turn",
      "Asiento 2: Filou203 (ciega grande) se retiró antes del Flop",
      "Asiento 3: SrLyce se retiró antes del Flop (no apostó)",
      "Asiento 4: LOLA19711971 se retiró antes del Flop",
      "Asiento 5: dadou13mars se retiró antes del Flop (no apostó)",
      "Asiento 6: Alvii37 (botón) recaudó (0.36 €)"
    ],
    "river": []
  },
  "board": [
    "6d",
    "2c",
    "8c",
    "Ks"
  ],
  "winner": "Alvii37",
  "win_amount": 18.0,
  "sb": 0.01,
  "bb": 0.02,
  "rake": 1.0,
  "raw_text": "Mano n.º 257168375057 de PokerStars:  Hold'em No Limit (0.01 €/0.02 € EUR) - 01-08-2025 11:36:17 CET [01-08-2025 5:36:17 ET]\nMesa \"Jupiter\" 6-max El asiento n.º 6 es el botón\nAsiento 1: sifilis5 (1.95 € en fichas) \nAsiento 2: Filou203 (2.11 € en fichas) \nAsiento 3: SrLyce (2.19 € en fichas) \nAsiento 4: LOLA19711971 (0.82 € en fichas) \nAsiento 5: dadou13mars (4.18 € en fichas) \nAsiento 6: Alvii37 (2.22 € en fichas) \nsifilis5: pone la ciega pequeña 0.01 €\nFilou203: pone la ciega grande 0.02 €\n*** CARTAS DE MANO ***\nRepartidas a SrLyce [4s 8d]\nSrLyce: se retira \nLOLA19711971: iguala 0.02 €\ndadou13mars: se retira \nAlvii37: sube 0.08 € a 0.10 €\nsifilis5: iguala 0.09 €\nFilou203: se retira \nLOLA19711971: se retira \n*** FLOP *** [6d 2c 8c]\nsifilis5: pasa \nAlvii37: apuesta 0.07 €\nsifilis5: iguala 0.07 €\n*** TURN *** [6d 2c 8c] [Ks]\nsifilis5: pasa \nAlvii37: apuesta 0.27 €\nsifilis5: se retira \nLa apuesta no igualada (0.27 €) ha sido devuelta a Alvii37\nAlvii37 se lleva 0.36 € del bote \nAlvii37: no muestra su mano \n*** RESUMEN ***\nBote total 0.38 € | Comisión 0.02 € \nComunitarias [6d 2c 8c Ks]\nAsiento 1: sifilis5 (ciega pequeña) se retiró en el Turn\nAsiento 2: Filou203 (ciega grande) se retiró antes del Flop\nAsiento 3: SrLyce se retiró antes del Flop (no apostó)\nAsiento 4: LOLA19711971 se retiró antes del Flop\nAsiento 5: dadou13mars se retiró antes del Flop (no apostó)\nAsiento 6: Alvii37 (botón) recaudó (0.36 €)"
}