{
  "hand_id": "257238038301",
  "date": "06-08-2025 18:22:33",
  "table": "Euneus III",
  "game_type": "holdem",
  "hero": "SrLyce",
  "hero_position": "",
  "hero_cards": [
    "7c",
    "Js"
  ],
  "stacks": {
    "christgear": 100.0,
    "Il_BM00": 119.5,
    "djrojas9": 140.5,
    "lol-in 2000": 95.5,
    "SrLyce": 133.0,
    "kcg_rm": 108.0
  },
  "actions": {
    "preflop": [
      "Asiento 1: christgear (2 € en fichas)",
      "Asiento 2: Il_BM00 (2.39 € en fichas)",
      "Asiento 3: djrojas9 (2.81 € en fichas)",
      "Asiento 4: lol-in 2000 (1.91 € en fichas)",
      "Asiento 5: SrLyce (2.66 € en fichas)",
      "Asiento 6: kcg_rm (2.16 € en fichas)",
      "kcg_rm: pone la ciega pequeña 0.01 €",
      "christgear: pone la ciega grande 0.02 €",
      "Il_BM00: se retira",
      "djrojas9: se retira",
      "lol-in 2000: se retira",
      "SrLyce: se retira",
      "kcg_rm: sube 0.02 € a 0.04 €",
      "christgear: se retira",
      "kcg_rm: no muestra su mano",
      "Asiento 1: christgear (ciega grande) se retiró antes del Flop",
      "Asiento 2: Il_BM00 se retiró antes del Flop (no apostó)",
      "Asiento 3: djrojas9 se retiró antes del Flop (no apostó)",
      "Asiento 4: lol-in 2000 se retiró antes del Flop (no apostó)",
      "Asiento 5: SrLyce (botón) se retiró antes del Flop (no apostó)",
      "Asiento 6: kcg_rm (ciega pequeña) recaudó (0.04 €)"
    ],
    "flop": [],
    "turn": [],
    "river": []
  },
  "board": [],
  "winner": "kcg_rm",
  "win_amount": 2.0,
  "sb": 0.01,
  "bb": 0.02,
  "rake": 0.0,
  "raw_text": "Mano n.º 257238038301 de PokerStars:  Hold'em No Limit (0.01 €/0.02 € EUR) - 06-08-2025 18:22:33 CET [06-08-2025 12:22:33 ET]\nMesa \"Euneus III\" 6-max El asiento n.º 5 es el botón\nAsiento 1: christgear (2 € en fichas) \nAsiento 2: Il_BM00 (2.39 € en fichas) \nAsiento 3: djrojas9 (2.81 € en fichas) \nAsiento 4: lol-in 2000 (1.91 € en fichas) \nAsiento 5: SrLyce (2.66 € en fichas) \nAsiento 6: kcg_rm (2.16 € en fichas) \nkcg_rm: pone la ciega pequeña 0.01 €\nchristgear: pone la ciega grande 0.02 €\n*** CARTAS DE MANO ***\nRepartidas a SrLyce [7c Js]\nIl_BM00: se retira \ndjrojas9: se retira \nlol-in 2000: se retira \nSrLyce: se retira \nkcg_rm: sube 0.02 € a 0.04 €\nchristgear: se retira \nLa apuesta no igualada (0.02 €) ha sido devuelta a kcg_rm\nkcg_rm se lleva 0.04 € del bote \nkcg_rm: no muestra su mano \n*** RESUMEN ***\nBote total 0.04 € | Comisión 0 € \nAsiento 1: christgear (ciega grande) se retiró antes del Flop\nAsiento 2: Il_BM00 se retiró antes del Flop (no apostó)\nAsiento 3: djrojas9 se retiró antes del Flop (no apostó)\nAsiento 4: lol-in 2000 se retiró antes del Flop (no apostó)\nAsiento 5: SrLyce (botón) se retiró antes del Flop (no apostó)\nAsiento 6: kcg_rm (ciega pequeña) recaudó (0.04 €)"
}