{
  "hand_id": "257237598728",
  "date": "06-08-2025 17:39:47",
  "table": "Themisto III",
  "game_type": "holdem",
  "hero": "SrLyce",
  "hero_position": "",
  "hero_cards": [
    "2s",
    "7s"
  ],
  "stacks": {
    "SrLyce": 131.5,
    "idigon": 5.5,
    "fred2d23po": 83.0,
    "mivipkr": 108.0,
    "marignamo": 89.5
  },
  "actions": {
    "preflop": [
      "Asiento 2: SrLyce (2.63 € en fichas)",
      "Asiento 3: idigon (0.11 € en fichas)",
      "Asiento 4: fred2d23po (1.66 € en fichas)",
      "Asiento 5: mivipkr (2.16 € en fichas)",
      "Asiento 6: marignamo (1.79 € en fichas)",
      "marignamo: pone la ciega pequeña 0.01 €",
      "SrLyce: pone la ciega grande 0.02 €",
      "idigon: se retira",
      "fred2d23po: se retira",
      "mivipkr: se retira",
      "marignamo: iguala 0.01 €",
      "SrLyce: pasa"
    ],
    "flop": [
      "marignamo: pasa",
      "SrLyce: apuesta 0.02 €",
      "marignamo: se retira",
      "SrLyce: no muestra su mano",
      "Asiento 2: SrLyce (ciega grande) recaudó (0.04 €)",
      "Asiento 3: idigon se retiró antes del Flop (no apostó)",
      "Asiento 4: fred2d23po se retiró antes del Flop (no apostó)",
      "Asiento 5: mivipkr (botón) se retiró antes del Flop (no apostó)",
      "Asiento 6: marignamo (ciega pequeña) se retiró en el Flop"
    ],
    "turn": [],
    "river": []
  },
  "board": [
    "9c",
    "9h",
    "7h"
  ],
  "winner": "SrLyce",
  "win_amount": 2.0,
  "sb": 0.01,
  "bb": 0.02,
  "rake": 0.0,
  "raw_text": "Mano n.º 257237598728 de PokerStars:  Hold'em No Limit (0.01 €/0.02 € EUR) - 06-08-2025 17:39:47 CET [06-08-2025 11:39:47 ET]\nMesa \"Themisto III\" 6-max El asiento n.º 5 es el botón\nAsiento 2: SrLyce (2.63 € en fichas) \nAsiento 3: idigon (0.11 € en fichas) \nAsiento 4: fred2d23po (1.66 € en fichas) \nAsiento 5: mivipkr (2.16 € en fichas) \nAsiento 6: marignamo (1.79 € en fichas) \nmarignamo: pone la ciega pequeña 0.01 €\nSrLyce: pone la ciega grande 0.02 €\n*** CARTAS DE MANO ***\nRepartidas a SrLyce [2s 7s]\nidigon: se retira \nfred2d23po: se retira \nmivipkr: se retira \nmarignamo: iguala 0.01 €\nSrLyce: pasa \n*** FLOP *** [9c 9h 7h]\nmarignamo: pasa \nSrLyce: apuesta 0.02 €\nmarignamo: se retira \nLa apuesta no igualada (0.02 €) ha sido devuelta a SrLyce\nSrLyce se lleva 0.04 € del bote \nSrLyce: no muestra su mano \n*** RESUMEN ***\nBote total 0.04 € | Comisión 0 € \nComunitarias [9c 9h 7h]\nAsiento 2: SrLyce (ciega grande) recaudó (0.04 €)\nAsiento 3: idigon se retiró antes del Flop (no apostó)\nAsiento 4: fred2d23po se retiró antes del Flop (no apostó)\nAsiento 5: mivipkr (botón) se retiró antes del Flop (no apostó)\nAsiento 6: marignamo (ciega pequeña) se retiró en el Flop"
}