{
  "hand_id": "257237966132",
  "date": "06-08-2025 18:16:07",
  "table": "Atreus",
  "game_type": "holdem",
  "hero": "SrLyce",
  "hero_position": "",
  "hero_cards": [
    "7h",
    "7s"
  ],
  "stacks": {
    "PrendsCa": 100.0,
    "NRules82": 62.0,
    "JENOFONTE73": 135.5,
    "Fharock": 105.5,
    "SrLyce": 118.5,
    "FishamanReggae": 33.0
  },
  "actions": {
    "preflop": [
      "Asiento 1: PrendsCa (2 € en fichas)",
      "Asiento 2: NRules82 (1.24 € en fichas)",
      "Asiento 3: JENOFONTE73 (2.71 € en fichas)",
      "Asiento 4: Fharock (2.11 € en fichas)",
      "Asiento 5: SrLyce (2.37 € en fichas)",
      "Asiento 6: FishamanReggae (0.66 € en fichas)",
      "SrLyce: pone la ciega pequeña 0.01 €",
      "FishamanReggae: pone la ciega grande 0.02 €",
      "PrendsCa: se retira",
      "NRules82: se retira",
      "JENOFONTE73: sube 0.02 € a 0.04 €",
      "Fharock: iguala 0.04 €",
      "SrLyce: iguala 0.03 €",
      "FishamanReggae: iguala 0.02 €"
    ],
    "flop": [
      "SrLyce: apuesta 0.08 €",
      "FishamanReggae: se retira",
      "JENOFONTE73: se retira",
      "Fharock: se retira",
      "SrLyce: no muestra su mano",
      "Asiento 1: PrendsCa se retiró antes del Flop (no apostó)",
      "Asiento 2: NRules82 se retiró antes del Flop (no apostó)",
      "Asiento 3: JENOFONTE73 se retiró en el Flop",
      "Asiento 4: Fharock (botón) se retiró en el Flop",
      "Asiento 5: SrLyce (ciega pequeña) recaudó (0.15 €)",
      "Asiento 6: FishamanReggae (ciega grande) se retiró en el Flop"
    ],
    "turn": [],
    "river": []
  },
  "board": [
    "7c",
    "Kc",
    "6d"
  ],
  "winner": "SrLyce",
  "win_amount": 7.5,
  "sb": 0.01,
  "bb": 0.02,
  "rake": 0.5,
  "raw_text": "Mano n.º 257237966132 de PokerStars:  Hold'em No Limit (0.01 €/0.02 € EUR) - 06-08-2025 18:16:07 CET [06-08-2025 12:16:07 ET]\nMesa \"Atreus\" 6-max El asiento n.º 4 es el botón\nAsiento 1: PrendsCa (2 € en fichas) \nAsiento 2: NRules82 (1.24 € en fichas) \nAsiento 3: JENOFONTE73 (2.71 € en fichas) \nAsiento 4: Fharock (2.11 € en fichas) \nAsiento 5: SrLyce (2.37 € en fichas) \nAsiento 6: FishamanReggae (0.66 € en fichas) \nSrLyce: pone la ciega pequeña 0.01 €\nFishamanReggae: pone la ciega grande 0.02 €\n*** CARTAS DE MANO ***\nRepartidas a SrLyce [7h 7s]\nPrendsCa: se retira \nNRules82: se retira \nJENOFONTE73: sube 0.02 € a 0.04 €\nFharock: iguala 0.04 €\nSrLyce: iguala 0.03 €\nFishamanReggae: iguala 0.02 €\n*** FLOP *** [7c Kc 6d]\nSrLyce: apuesta 0.08 €\nFishamanReggae: se retira \nJENOFONTE73: se retira \nFharock: se retira \nLa apuesta no igualada (0.08 €) ha sido devuelta a SrLyce\nSrLyce se lleva 0.15 € del bote \nSrLyce: no muestra su mano \n*** RESUMEN ***\nBote total 0.16 € | Comisión 0.01 € \nComunitarias [7c Kc 6d]\nAsiento 1: PrendsCa se retiró antes del Flop (no apostó)\nAsiento 2: NRules82 se retiró antes del Flop (no apostó)\nAsiento 3: JENOFONTE73 se retiró en el Flop\nAsiento 4: Fharock (botón) se retiró en el Flop\nAsiento 5: SrLyce (ciega pequeña) recaudó (0.15 €)\nAsiento 6: FishamanReggae (ciega grande) se retiró en el Flop"
}