{
  "hand_id": "257237632929",
  "date": "06-08-2025 17:43:06",
  "table": "Kale III",
  "game_type": "holdem",
  "hero": "SrLyce",
  "hero_position": "",
  "hero_cards": [
    "Qh",
    "9d"
  ],
  "stacks": {
    "Begoton": 102.5,
    "x__Nest__x": 91.0,
    "SrLyce": 117.0,
    "Dracoline000": 116.0,
    "jeffounet33": 94.0,
    "juanmemol": 102.5
  },
  "actions": {
    "preflop": [
      "Asiento 5: Begoton (2.05 € en fichas) está ausente",
      "Asiento 1: x__Nest__x (1.82 € en fichas)",
      "Asiento 2: SrLyce (2.34 € en fichas)",
      "Asiento 3: Dracoline000 (2.32 € en fichas)",
      "Asiento 4: jeffounet33 (1.88 € en fichas)",
      "Asiento 6: juanmemol (2.05 € en fichas)",
      "jeffounet33: pone la ciega pequeña 0.01 €",
      "Begoton: está ausente",
      "juanmemol: pone la ciega grande 0.02 €",
      "x__Nest__x: se retira",
      "SrLyce: se retira",
      "Dracoline000: se retira",
      "jeffounet33: iguala 0.01 €",
      "juanmemol: pasa"
    ],
    "flop": [
      "jeffounet33: pasa",
      "juanmemol: pasa"
    ],
    "turn": [
      "jeffounet33: pasa",
      "juanmemol: apuesta 0.02 €",
      "jeffounet33: se retira",
      "juanmemol: no muestra su mano",
      "Asiento 5: Begoton",
      "Asiento 1: x__Nest__x se retiró antes del Flop (no apostó)",
      "Asiento 2: SrLyce se retiró antes del Flop (no apostó)",
      "Asiento 3: Dracoline000 (botón) se retiró antes del Flop (no apostó)",
      "Asiento 4: jeffounet33 (ciega pequeña) se retiró en el Turn",
      "Asiento 6: juanmemol (ciega grande) recaudó (0.04 €)"
    ],
    "river": []
  },
  "board": [
    "Ad",
    "9s",
    "Qd",
    "5c"
  ],
  "winner": "juanmemol",
  "win_amount": 2.0,
  "sb": 0.01,
  "bb": 0.02,
  "rake": 0.0,
  "raw_text": "Mano n.º 257237632929 de PokerStars:  Hold'em No Limit (0.01 €/0.02 € EUR) - 06-08-2025 17:43:06 CET [06-08-2025 11:43:06 ET]\nMesa \"Kale III\" 6-max El asiento n.º 3 es el botón\nAsiento 5: Begoton (2.05 € en fichas) está ausente\nAsiento 1: x__Nest__x (1.82 € en fichas) \nAsiento 2: SrLyce (2.34 € en fichas) \nAsiento 3: Dracoline000 (2.32 € en fichas) \nAsiento 4: jeffounet33 (1.88 € en fichas) \nAsiento 6: juanmemol (2.05 € en fichas) \njeffounet33: pone la ciega pequeña 0.01 €\nBegoton: está ausente \njuanmemol: pone la ciega grande 0.02 €\n*** CARTAS DE MANO ***\nRepartidas a SrLyce [Qh 9d]\nBegoton deja la mesa\nx__Nest__x: se retira \nSrLyce: se retira \nDracoline000: se retira \njeffounet33: iguala 0.01 €\njuanmemol: pasa \n*** FLOP *** [Ad 9s Qd]\njeffounet33: pasa \njuanmemol: pasa \n*** TURN *** [Ad 9s Qd] [5c]\njeffounet33: pasa \njuanmemol: apuesta 0.02 €\njeffounet33: se retira \nLa apuesta no igualada (0.02 €) ha sido devuelta a juanmemol\njuanmemol se lleva 0.04 € del bote \njuanmemol: no muestra su mano \n*** RESUMEN ***\nBote total 0.04 € | Comisión 0 € \nComunitarias [Ad 9s Qd 5c]\nAsiento 5: Begoton\nAsiento 1: x__Nest__x se retiró antes del Flop (no apostó)\nAsiento 2: SrLyce se retiró antes del Flop (no apostó)\nAsiento 3: Dracoline000 (botón) se retiró antes del Flop (no apostó)\nAsiento 4: jeffounet33 (ciega pequeña) se retiró en el Turn\nAsiento 6: juanmemol (ciega grande) recaudó (0.04 €)"
}