{
  "hand_id": "257168271751",
  "date": "01-08-2025 11:17:00",
  "table": "Atlas",
  "game_type": "holdem",
  "hero": "SrLyce",
  "hero_position": "",
  "hero_cards": [
    "7s",
    "6h"
  ],
  "stacks": {
    "erCampos23": 42.5,
    "SrLyce": 93.0,
    "Fharock": 92.5,
    "ecuinas": 98.5,
    "LxckxStrxkx": 100.0,
    "Akourdideh": 115.5
  },
  "actions": {
    "preflop": [
      "Asiento 5: erCampos23 (0.85 € en fichas) está ausente",
      "Asiento 1: SrLyce (1.86 € en fichas)",
      "Asiento 2: Fharock (1.85 € en fichas)",
      "Asiento 3: ecuinas (1.97 € en fichas)",
      "Asiento 4: LxckxStrxkx (2 € en fichas)",
      "Asiento 6: Akourdideh (2.31 € en fichas)",
      "Fharock: pone la ciega pequeña 0.01 €",
      "ecuinas: pone la ciega grande 0.02 €",
      "erCampos23: se ausenta",
      "LxckxStrxkx: se retira",
      "Akourdideh: se retira",
      "SrLyce: sube 0.04 € a 0.06 €",
      "Fharock: se retira",
      "ecuinas: se retira",
      "SrLyce: no muestra su mano",
      "Asiento 5: erCampos23",
      "Asiento 1: SrLyce (botón) recaudó (0.05 €)",
      "Asiento 2: Fharock (ciega pequeña) se retiró antes del Flop",
      "Asiento 3: ecuinas (ciega grande) se retiró antes del Flop",
      "Asiento 4: LxckxStrxkx se retiró antes del Flop (no apostó)",
      "Asiento 6: Akourdideh se retiró antes del Flop (no apostó)"
    ],
    "flop": [],
    "turn": [],
    "river": []
  },
  "board": [],
  "winner": "SrLyce",
  "win_amount": 2.5,
  "sb": 0.01,
  "bb": 0.02,
  "rake": 0.0,
  "raw_text": "Mano n.º 257168271751 de PokerStars:  Hold'em No Limit (0.01 €/0.02 € EUR) - 01-08-2025 11:17:00 CET [01-08-2025 5:17:00 ET]\nMesa \"Atlas\" 6-max El asiento n.º 1 es el botón\nAsiento 5: erCampos23 (0.85 € en fichas) está ausente\nAsiento 1: SrLyce (1.86 € en fichas) \nAsiento 2: Fharock (1.85 € en fichas) \nAsiento 3: ecuinas (1.97 € en fichas) \nAsiento 4: LxckxStrxkx (2 € en fichas) \nAsiento 6: Akourdideh (2.31 € en fichas) \nFharock: pone la ciega pequeña 0.01 €\necuinas: pone la ciega grande 0.02 €\nerCampos23: se ausenta \n*** CARTAS DE MANO ***\nRepartidas a SrLyce [7s 6h]\nLxckxStrxkx: se retira \nAkourdideh: se retira \nSrLyce: sube 0.04 € a 0.06 €\nFharock: se retira \necuinas: se retira \nLa apuesta no igualada (0.04 €) ha sido devuelta a SrLyce\nSrLyce se lleva 0.05 € del bote \nSrLyce: no muestra su mano \n*** RESUMEN ***\nBote total 0.05 € | Comisión 0 € \nAsiento 5: erCampos23\nAsiento 1: SrLyce (botón) recaudó (0.05 €)\nAsiento 2: Fharock (ciega pequeña) se retiró antes del Flop\nAsiento 3: ecuinas (ciega grande) se retiró antes del Flop\nAsiento 4: LxckxStrxkx se retiró antes del Flop (no apostó)\nAsiento 6: Akourdideh se retiró antes del Flop (no apostó)"
}