{
  "hand_id": "257168292331",
  "date": "01-08-2025 11:20:57",
  "table": "Jupiter",
  "game_type": "holdem",
  "hero": "SrLyce",
  "hero_position": "",
  "hero_cards": [
    "7d",
    "Qh"
  ],
  "stacks": {
    "LOLA19711971": 30.5,
    "sifilis5": 92.5,
    "Filou203": 110.0,
    "SrLyce": 115.5,
    "dadou13mars": 224.0,
    "Alvii37": 108.0
  },
  "actions": {
    "preflop": [
      "Asiento 4: LOLA19711971 (0.61 € en fichas) está ausente",
      "Asiento 1: sifilis5 (1.85 € en fichas)",
      "Asiento 2: Filou203 (2.20 € en fichas)",
      "Asiento 3: SrLyce (2.31 € en fichas)",
      "Asiento 5: dadou13mars (4.48 € en fichas)",
      "Asiento 6: Alvii37 (2.16 € en fichas)",
      "SrLyce: pone la ciega pequeña 0.01 €",
      "dadou13mars: pone la ciega grande 0.02 €",
      "Alvii37: sube 0.04 € a 0.06 €",
      "sifilis5: se retira",
      "Filou203: se retira",
      "SrLyce: se retira",
      "dadou13mars: se retira",
      "Alvii37: no muestra su mano",
      "Asiento 4: LOLA19711971",
      "Asiento 1: sifilis5 se retiró antes del Flop (no apostó)",
      "Asiento 2: Filou203 (botón) se retiró antes del Flop (no apostó)",
      "Asiento 3: SrLyce (ciega pequeña) se retiró antes del Flop",
      "Asiento 5: dadou13mars (ciega grande) se retiró antes del Flop",
      "Asiento 6: Alvii37 recaudó (0.05 €)"
    ],
    "flop": [],
    "turn": [],
    "river": []
  },
  "board": [],
  "winner": "Alvii37",
  "win_amount": 2.5,
  "sb": 0.01,
  "bb": 0.02,
  "rake": 0.0,
  "raw_text": "Mano n.º 257168292331 de PokerStars:  Hold'em No Limit (0.01 €/0.02 € EUR) - 01-08-2025 11:20:57 CET [01-08-2025 5:20:57 ET]\nMesa \"Jupiter\" 6-max El asiento n.º 2 es el botón\nAsiento 4: LOLA19711971 (0.61 € en fichas) está ausente\nAsiento 1: sifilis5 (1.85 € en fichas) \nAsiento 2: Filou203 (2.20 € en fichas) \nAsiento 3: SrLyce (2.31 € en fichas) \nAsiento 5: dadou13mars (4.48 € en fichas) \nAsiento 6: Alvii37 (2.16 € en fichas) \nSrLyce: pone la ciega pequeña 0.01 €\ndadou13mars: pone la ciega grande 0.02 €\n*** CARTAS DE MANO ***\nRepartidas a SrLyce [7d Qh]\nAlvii37: sube 0.04 € a 0.06 €\nsifilis5: se retira \nFilou203: se retira \nSrLyce: se retira \ndadou13mars: se retira \nLa apuesta no igualada (0.04 €) ha sido devuelta a Alvii37\nAlvii37 se lleva 0.05 € del bote \nAlvii37: no muestra su mano \n*** RESUMEN ***\nBote total 0.05 € | Comisión 0 € \nAsiento 4: LOLA19711971\nAsiento 1: sifilis5 se retiró antes del Flop (no apostó)\nAsiento 2: Filou203 (botón) se retiró antes del Flop (no apostó)\nAsiento 3: SrLyce (ciega pequeña) se retiró antes del Flop\nAsiento 5: dadou13mars (ciega grande) se retiró antes del Flop\nAsiento 6: Alvii37 recaudó (0.05 €)"
}