{
  "hand_id": "257238476311",
  "date": "06-08-2025 19:02:49",
  "table": "Herculina II",
  "game_type": "holdem",
  "hero": "SrLyce",
  "hero_position": "",
  "hero_cards": [
    "5h",
    "8s"
  ],
  "stacks": {
    "koldipk": 156.0,
    "David98X": 129.0,
    "JJer11": 207.5,
    "SrLyce": 101.0,
    "Macklemore0": 100.0,
    "ScarvBlack": 120.5
  },
  "actions": {
    "preflop": [
      "Asiento 1: koldipk (3.12 € en fichas)",
      "Asiento 2: David98X (2.58 € en fichas)",
      "Asiento 3: JJer11 (4.15 € en fichas)",
      "Asiento 4: SrLyce (2.02 € en fichas)",
      "Asiento 5: Macklemore0 (2 € en fichas)",
      "Asiento 6: ScarvBlack (2.41 € en fichas)",
      "Macklemore0: pone la ciega pequeña 0.01 €",
      "ScarvBlack: pone la ciega grande 0.02 €",
      "koldipk: se retira",
      "David98X: se retira",
      "JJer11: sube 0.04 € a 0.06 €",
      "SrLyce: se retira",
      "Macklemore0: se retira",
      "ScarvBlack: se retira",
      "JJer11: no muestra su mano",
      "Asiento 1: koldipk se retiró antes del Flop (no apostó)",
      "Asiento 2: David98X se retiró antes del Flop (no apostó)",
      "Asiento 3: JJer11 recaudó (0.05 €)",
      "Asiento 4: SrLyce (botón) se retiró antes del Flop (no apostó)",
      "Asiento 5: Macklemore0 (ciega pequeña) se retiró antes del Flop",
      "Asiento 6: ScarvBlack (ciega grande) se retiró antes del Flop"
    ],
    "flop": [],
    "turn": [],
    "river": []
  },
  "board": [],
  "winner": "JJer11",
  "win_amount": 2.5,
  "sb": 0.01,
  "bb": 0.02,
  "rake": 0.0,
  "raw_text": "Mano n.º 257238476311 de PokerStars:  Hold'em No Limit (0.01 €/0.02 € EUR) - 06-08-2025 19:02:49 CET [06-08-2025 13:02:49 ET]\nMesa \"Herculina II\" 6-max El asiento n.º 4 es el botón\nAsiento 1: koldipk (3.12 € en fichas) \nAsiento 2: David98X (2.58 € en fichas) \nAsiento 3: JJer11 (4.15 € en fichas) \nAsiento 4: SrLyce (2.02 € en fichas) \nAsiento 5: Macklemore0 (2 € en fichas) \nAsiento 6: ScarvBlack (2.41 € en fichas) \nMacklemore0: pone la ciega pequeña 0.01 €\nScarvBlack: pone la ciega grande 0.02 €\n*** CARTAS DE MANO ***\nRepartidas a SrLyce [5h 8s]\nkoldipk: se retira \nDavid98X: se retira \nJJer11: sube 0.04 € a 0.06 €\nSrLyce: se retira \nMacklemore0: se retira \nScarvBlack: se retira \nLa apuesta no igualada (0.04 €) ha sido devuelta a JJer11\nJJer11 se lleva 0.05 € del bote \nJJer11: no muestra su mano \n*** RESUMEN ***\nBote total 0.05 € | Comisión 0 € \nAsiento 1: koldipk se retiró antes del Flop (no apostó)\nAsiento 2: David98X se retiró antes del Flop (no apostó)\nAsiento 3: JJer11 recaudó (0.05 €)\nAsiento 4: SrLyce (botón) se retiró antes del Flop (no apostó)\nAsiento 5: Macklemore0 (ciega pequeña) se retiró antes del Flop\nAsiento 6: ScarvBlack (ciega grande) se retiró antes del Flop"
}