{
  "hand_id": "257190041717",
  "date": "03-08-2025 1:04:35",
  "table": "Tamariwa",
  "game_type": "holdem",
  "hero": "SrLyce",
  "hero_position": "",
  "hero_cards": [
    "7s",
    "7d"
  ],
  "stacks": {
    "datmawi": 59.5,
    "BluesMyWay": 216.0,
    "arthurtfa": 33.0,
    "toonsy2010": 168.5,
    "SrLyce": 110.5,
    "DiaZzZ1": 143.0
  },
  "actions": {
    "preflop": [
      "Asiento 1: datmawi (1.19 € en fichas)",
      "Asiento 2: BluesMyWay (4.32 € en fichas)",
      "Asiento 3: arthurtfa (0.66 € en fichas)",
      "Asiento 4: toonsy2010 (3.37 € en fichas)",
      "Asiento 5: SrLyce (2.21 € en fichas)",
      "Asiento 6: DiaZzZ1 (2.86 € en fichas)",
      "datmawi: pone la ciega pequeña 0.01 €",
      "BluesMyWay: pone la ciega grande 0.02 €",
      "arthurtfa: se retira",
      "toonsy2010: iguala 0.02 €",
      "SrLyce: sube 0.04 € a 0.06 €",
      "DiaZzZ1: se retira",
      "datmawi: se retira",
      "BluesMyWay: se retira",
      "toonsy2010: iguala 0.04 €"
    ],
    "flop": [
      "toonsy2010: pasa",
      "SrLyce: pasa"
    ],
    "turn": [
      "toonsy2010: apuesta 0.14 €",
      "SrLyce: se retira",
      "toonsy2010: no muestra su mano",
      "Asiento 1: datmawi (ciega pequeña) se retiró antes del Flop",
      "Asiento 2: BluesMyWay (ciega grande) se retiró antes del Flop",
      "Asiento 3: arthurtfa se retiró antes del Flop (no apostó)",
      "Asiento 4: toonsy2010 recaudó (0.14 €)",
      "Asiento 5: SrLyce se retiró en el Turn",
      "Asiento 6: DiaZzZ1 (botón) se retiró antes del Flop (no apostó)"
    ],
    "river": []
  },
  "board": [
    "8d",
    "8c",
    "Ac",
    "6c"
  ],
  "winner": "toonsy2010",
  "win_amount": 7.0,
  "sb": 0.01,
  "bb": 0.02,
  "rake": 0.5,
  "raw_text": "Mano n.º 257190041717 de PokerStars:  Hold'em No Limit (0.01 €/0.02 € EUR) - 03-08-2025 1:04:35 CET [02-08-2025 19:04:35 ET]\nMesa \"Tamariwa\" 6-max El asiento n.º 6 es el botón\nAsiento 1: datmawi (1.19 € en fichas) \nAsiento 2: BluesMyWay (4.32 € en fichas) \nAsiento 3: arthurtfa (0.66 € en fichas) \nAsiento 4: toonsy2010 (3.37 € en fichas) \nAsiento 5: SrLyce (2.21 € en fichas) \nAsiento 6: DiaZzZ1 (2.86 € en fichas) \ndatmawi: pone la ciega pequeña 0.01 €\nBluesMyWay: pone la ciega grande 0.02 €\n*** CARTAS DE MANO ***\nRepartidas a SrLyce [7s 7d]\narthurtfa: se retira \ntoonsy2010: iguala 0.02 €\nSrLyce: sube 0.04 € a 0.06 €\nDiaZzZ1: se retira \ndatmawi: se retira \nBluesMyWay: se retira \ntoonsy2010: iguala 0.04 €\n*** FLOP *** [8d 8c Ac]\ntoonsy2010: pasa \nSrLyce: pasa \n*** TURN *** [8d 8c Ac] [6c]\ntoonsy2010: apuesta 0.14 €\nSrLyce: se retira \nLa apuesta no igualada (0.14 €) ha sido devuelta a toonsy2010\ntoonsy2010 se lleva 0.14 € del bote \ntoonsy2010: no muestra su mano \n*** RESUMEN ***\nBote total 0.15 € | Comisión 0.01 € \nComunitarias [8d 8c Ac 6c]\nAsiento 1: datmawi (ciega pequeña) se retiró antes del Flop\nAsiento 2: BluesMyWay (ciega grande) se retiró antes del Flop\nAsiento 3: arthurtfa se retiró antes del Flop (no apostó)\nAsiento 4: toonsy2010 recaudó (0.14 €)\nAsiento 5: SrLyce se retiró en el Turn\nAsiento 6: DiaZzZ1 (botón) se retiró antes del Flop (no apostó)"
}