{
  "hand_id": "257238421079",
  "date": "06-08-2025 18:56:51",
  "table": "Herculina II",
  "game_type": "holdem",
  "hero": "SrLyce",
  "hero_position": "",
  "hero_cards": [
    "Qc",
    "Ks"
  ],
  "stacks": {
    "koldipk": 175.5,
    "David98X": 117.0,
    "JJer11": 212.0,
    "SrLyce": 99.0,
    "Macklemore0": 100.0,
    "ScarvBlack": 101.5
  },
  "actions": {
    "preflop": [
      "Asiento 1: koldipk (3.51 € en fichas)",
      "Asiento 2: David98X (2.34 € en fichas)",
      "Asiento 3: JJer11 (4.24 € en fichas)",
      "Asiento 4: SrLyce (1.98 € en fichas)",
      "Asiento 5: Macklemore0 (2 € en fichas)",
      "Asiento 6: ScarvBlack (2.03 € en fichas)",
      "SrLyce: pone la ciega pequeña 0.01 €",
      "Macklemore0: pone la ciega grande 0.02 €",
      "ScarvBlack: se retira",
      "koldipk: se retira",
      "David98X: se retira",
      "JJer11: sube 0.04 € a 0.06 €",
      "SrLyce: iguala 0.05 €",
      "Macklemore0: iguala 0.04 €"
    ],
    "flop": [
      "SrLyce: apuesta 0.06 €",
      "Macklemore0: se retira",
      "JJer11: se retira",
      "SrLyce: no muestra su mano",
      "Asiento 1: koldipk se retiró antes del Flop (no apostó)",
      "Asiento 2: David98X se retiró antes del Flop (no apostó)",
      "Asiento 3: JJer11 (botón) se retiró en el Flop",
      "Asiento 4: SrLyce (ciega pequeña) recaudó (0.17 €)",
      "Asiento 5: Macklemore0 (ciega grande) se retiró en el Flop",
      "Asiento 6: ScarvBlack se retiró antes del Flop (no apostó)"
    ],
    "turn": [],
    "river": []
  },
  "board": [
    "8s",
    "6c",
    "Qd"
  ],
  "winner": "SrLyce",
  "win_amount": 8.5,
  "sb": 0.01,
  "bb": 0.02,
  "rake": 0.5,
  "raw_text": "Mano n.º 257238421079 de PokerStars:  Hold'em No Limit (0.01 €/0.02 € EUR) - 06-08-2025 18:56:51 CET [06-08-2025 12:56:51 ET]\nMesa \"Herculina II\" 6-max El asiento n.º 3 es el botón\nAsiento 1: koldipk (3.51 € en fichas) \nAsiento 2: David98X (2.34 € en fichas) \nAsiento 3: JJer11 (4.24 € en fichas) \nAsiento 4: SrLyce (1.98 € en fichas) \nAsiento 5: Macklemore0 (2 € en fichas) \nAsiento 6: ScarvBlack (2.03 € en fichas) \nSrLyce: pone la ciega pequeña 0.01 €\nMacklemore0: pone la ciega grande 0.02 €\n*** CARTAS DE MANO ***\nRepartidas a SrLyce [Qc Ks]\nScarvBlack: se retira \nkoldipk: se retira \nDavid98X: se retira \nJJer11: sube 0.04 € a 0.06 €\nSrLyce: iguala 0.05 €\nMacklemore0: iguala 0.04 €\n*** FLOP *** [8s 6c Qd]\nSrLyce: apuesta 0.06 €\nMacklemore0: se retira \nJJer11: se retira \nLa apuesta no igualada (0.06 €) ha sido devuelta a SrLyce\nSrLyce se lleva 0.17 € del bote \nSrLyce: no muestra su mano \n*** RESUMEN ***\nBote total 0.18 € | Comisión 0.01 € \nComunitarias [8s 6c Qd]\nAsiento 1: koldipk se retiró antes del Flop (no apostó)\nAsiento 2: David98X se retiró antes del Flop (no apostó)\nAsiento 3: JJer11 (botón) se retiró en el Flop\nAsiento 4: SrLyce (ciega pequeña) recaudó (0.17 €)\nAsiento 5: Macklemore0 (ciega grande) se retiró en el Flop\nAsiento 6: ScarvBlack se retiró antes del Flop (no apostó)"
}