{
  "hand_id": "257237900157",
  "date": "06-08-2025 18:10:06",
  "table": "Euneus III",
  "game_type": "holdem",
  "hero": "SrLyce",
  "hero_position": "",
  "hero_cards": [
    "7h",
    "Ah"
  ],
  "stacks": {
    "JGDOBLAS": 96.0,
    "christgear": 103.5,
    "Il_BM00": 99.5,
    "djrojas9": 153.5,
    "SrLyce": 110.0,
    "Begoton": 100.0
  },
  "actions": {
    "preflop": [
      "Asiento 4: JGDOBLAS (1.92 € en fichas) está ausente",
      "Asiento 1: christgear (2.07 € en fichas)",
      "Asiento 2: Il_BM00 (1.99 € en fichas)",
      "Asiento 3: djrojas9 (3.07 € en fichas)",
      "Asiento 5: SrLyce (2.20 € en fichas)",
      "Asiento 6: Begoton (2 € en fichas)",
      "djrojas9: pone la ciega pequeña 0.01 €",
      "JGDOBLAS: está ausente",
      "SrLyce: pone la ciega grande 0.02 €",
      "Begoton: se retira",
      "christgear: se retira",
      "Il_BM00: se retira",
      "djrojas9: se retira",
      "SrLyce: no muestra su mano",
      "Asiento 4: JGDOBLAS",
      "Asiento 1: christgear se retiró antes del Flop (no apostó)",
      "Asiento 2: Il_BM00 (botón) se retiró antes del Flop (no apostó)",
      "Asiento 3: djrojas9 (ciega pequeña) se retiró antes del Flop",
      "Asiento 5: SrLyce (ciega grande) recaudó (0.02 €)",
      "Asiento 6: Begoton se retiró antes del Flop (no apostó)"
    ],
    "flop": [],
    "turn": [],
    "river": []
  },
  "board": [],
  "winner": "SrLyce",
  "win_amount": 1.0,
  "sb": 0.01,
  "bb": 0.02,
  "rake": 0.0,
  "raw_text": "Mano n.º 257237900157 de PokerStars:  Hold'em No Limit (0.01 €/0.02 € EUR) - 06-08-2025 18:10:06 CET [06-08-2025 12:10:06 ET]\nMesa \"Euneus III\" 6-max El asiento n.º 2 es el botón\nAsiento 4: JGDOBLAS (1.92 € en fichas) está ausente\nAsiento 1: christgear (2.07 € en fichas) \nAsiento 2: Il_BM00 (1.99 € en fichas) \nAsiento 3: djrojas9 (3.07 € en fichas) \nAsiento 5: SrLyce (2.20 € en fichas) \nAsiento 6: Begoton (2 € en fichas) \ndjrojas9: pone la ciega pequeña 0.01 €\nJGDOBLAS: está ausente \nSrLyce: pone la ciega grande 0.02 €\n*** CARTAS DE MANO ***\nRepartidas a SrLyce [7h Ah]\nJGDOBLAS deja la mesa\nBegoton: se retira \nchristgear: se retira \nIl_BM00: se retira \ndjrojas9: se retira \nLa apuesta no igualada (0.01 €) ha sido devuelta a SrLyce\nSrLyce se lleva 0.02 € del bote \nSrLyce: no muestra su mano \n*** RESUMEN ***\nBote total 0.02 € | Comisión 0 € \nAsiento 4: JGDOBLAS\nAsiento 1: christgear se retiró antes del Flop (no apostó)\nAsiento 2: Il_BM00 (botón) se retiró antes del Flop (no apostó)\nAsiento 3: djrojas9 (ciega pequeña) se retiró antes del Flop\nAsiento 5: SrLyce (ciega grande) recaudó (0.02 €)\nAsiento 6: Begoton se retiró antes del Flop (no apostó)"
}