{
  "hand_id": "257238659720",
  "date": "06-08-2025 19:18:23",
  "table": "Leonteus",
  "game_type": "holdem",
  "hero": "SrLyce",
  "hero_position": "",
  "hero_cards": [
    "8c",
    "3s"
  ],
  "stacks": {
    "practikal_C23": 47.5,
    "niyomalo": 97.5,
    "davinci1962": 145.5,
    "BuXHexter": 154.0,
    "Andark47": 203.0,
    "SrLyce": 103.0
  },
  "actions": {
    "preflop": [
      "Asiento 1: practikal_C23 (0.95 € en fichas) está ausente",
      "Asiento 2: niyomalo (1.95 € en fichas)",
      "Asiento 3: davinci1962 (2.91 € en fichas)",
      "Asiento 4: BuXHexter (3.08 € en fichas)",
      "Asiento 5: Andark47 (4.06 € en fichas)",
      "Asiento 6: SrLyce (2.06 € en fichas)",
      "Andark47: pone la ciega pequeña 0.01 €",
      "SrLyce: pone la ciega grande 0.02 €",
      "niyomalo: se retira",
      "davinci1962: se retira",
      "BuXHexter: se retira",
      "Andark47: sube 0.04 € a 0.06 €",
      "SrLyce: se retira",
      "Andark47: no muestra su mano",
      "Asiento 1: practikal_C23",
      "Asiento 2: niyomalo se retiró antes del Flop (no apostó)",
      "Asiento 3: davinci1962 se retiró antes del Flop (no apostó)",
      "Asiento 4: BuXHexter (botón) se retiró antes del Flop (no apostó)",
      "Asiento 5: Andark47 (ciega pequeña) recaudó (0.04 €)",
      "Asiento 6: SrLyce (ciega grande) se retiró antes del Flop"
    ],
    "flop": [],
    "turn": [],
    "river": []
  },
  "board": [],
  "winner": "Andark47",
  "win_amount": 2.0,
  "sb": 0.01,
  "bb": 0.02,
  "rake": 0.0,
  "raw_text": "Mano n.º 257238659720 de PokerStars:  Hold'em No Limit (0.01 €/0.02 € EUR) - 06-08-2025 19:18:23 CET [06-08-2025 13:18:23 ET]\nMesa \"Leonteus\" 6-max El asiento n.º 4 es el botón\nAsiento 1: practikal_C23 (0.95 € en fichas) está ausente\nAsiento 2: niyomalo (1.95 € en fichas) \nAsiento 3: davinci1962 (2.91 € en fichas) \nAsiento 4: BuXHexter (3.08 € en fichas) \nAsiento 5: Andark47 (4.06 € en fichas) \nAsiento 6: SrLyce (2.06 € en fichas) \nAndark47: pone la ciega pequeña 0.01 €\nSrLyce: pone la ciega grande 0.02 €\n*** CARTAS DE MANO ***\nRepartidas a SrLyce [8c 3s]\nniyomalo: se retira \ndavinci1962: se retira \nBuXHexter: se retira \nAndark47: sube 0.04 € a 0.06 €\nSrLyce: se retira \nLa apuesta no igualada (0.04 €) ha sido devuelta a Andark47\nAndark47 se lleva 0.04 € del bote \nAndark47: no muestra su mano \n*** RESUMEN ***\nBote total 0.04 € | Comisión 0 € \nAsiento 1: practikal_C23\nAsiento 2: niyomalo se retiró antes del Flop (no apostó)\nAsiento 3: davinci1962 se retiró antes del Flop (no apostó)\nAsiento 4: BuXHexter (botón) se retiró antes del Flop (no apostó)\nAsiento 5: Andark47 (ciega pequeña) recaudó (0.04 €)\nAsiento 6: SrLyce (ciega grande) se retiró antes del Flop"
}