{
  "hand_id": "257149120058",
  "date": "30-07-2025 22:09:25",
  "table": "Sirona",
  "game_type": "holdem",
  "hero": "SrLyce",
  "hero_position": "",
  "hero_cards": [
    "3d",
    "7s"
  ],
  "stacks": {
    "oliverdu70": 186.0,
    "SrLyce": 136.5,
    "christoph363": 213.0,
    "hadhod1976": 40.0,
    "MitchATP65": 103.5
  },
  "actions": {
    "preflop": [
      "Asiento 4: oliverdu70 (3.72 € en fichas) está ausente",
      "Asiento 1: SrLyce (2.73 € en fichas)",
      "Asiento 3: christoph363 (4.26 € en fichas)",
      "Asiento 5: hadhod1976 (0.80 € en fichas)",
      "Asiento 6: MitchATP65 (2.07 € en fichas)",
      "christoph363: pone la ciega pequeña 0.01 €",
      "hadhod1976: pone la ciega grande 0.02 €",
      "MitchATP65: se retira",
      "SrLyce: se retira",
      "christoph363: se retira",
      "hadhod1976: no muestra su mano",
      "Asiento 4: oliverdu70",
      "Asiento 1: SrLyce (botón) se retiró antes del Flop (no apostó)",
      "Asiento 3: christoph363 (ciega pequeña) se retiró antes del Flop",
      "Asiento 5: hadhod1976 (ciega grande) recaudó (0.02 €)",
      "Asiento 6: MitchATP65 se retiró antes del Flop (no apostó)"
    ],
    "flop": [],
    "turn": [],
    "river": []
  },
  "board": [],
  "winner": "hadhod1976",
  "win_amount": 1.0,
  "sb": 0.01,
  "bb": 0.02,
  "rake": 0.0,
  "raw_text": "Mano n.º 257149120058 de PokerStars:  Hold'em No Limit (0.01 €/0.02 € EUR) - 30-07-2025 22:09:25 CET [30-07-2025 16:09:25 ET]\nMesa \"Sirona\" 6-max El asiento n.º 1 es el botón\nAsiento 4: oliverdu70 (3.72 € en fichas) está ausente\nAsiento 1: SrLyce (2.73 € en fichas) \nAsiento 3: christoph363 (4.26 € en fichas) \nAsiento 5: hadhod1976 (0.80 € en fichas) \nAsiento 6: MitchATP65 (2.07 € en fichas) \nchristoph363: pone la ciega pequeña 0.01 €\nhadhod1976: pone la ciega grande 0.02 €\n*** CARTAS DE MANO ***\nRepartidas a SrLyce [3d 7s]\nMitchATP65: se retira \nSrLyce: se retira \nchristoph363: se retira \nLa apuesta no igualada (0.01 €) ha sido devuelta a hadhod1976\nhadhod1976 se lleva 0.02 € del bote \nhadhod1976: no muestra su mano \n*** RESUMEN ***\nBote total 0.02 € | Comisión 0 € \nAsiento 4: oliverdu70\nAsiento 1: SrLyce (botón) se retiró antes del Flop (no apostó)\nAsiento 3: christoph363 (ciega pequeña) se retiró antes del Flop\nAsiento 5: hadhod1976 (ciega grande) recaudó (0.02 €)\nAsiento 6: MitchATP65 se retiró antes del Flop (no apostó)"
}