{
  "hand_id": "257150402768",
  "date": "30-07-2025 23:39:19",
  "table": "Martha",
  "game_type": "holdem",
  "hero": "SrLyce",
  "hero_position": "",
  "hero_cards": [
    "Th",
    "2s"
  ],
  "stacks": {
    "mivipkr": 103.0,
    "NovacaineZxc": 126.5,
    "BudyXXIII": 106.5,
    "Sigiilo": 98.5,
    "SrLyce": 99.5,
    "alexfw300": 100.0
  },
  "actions": {
    "preflop": [
      "Asiento 1: mivipkr (2.06 € en fichas)",
      "Asiento 2: NovacaineZxc (2.53 € en fichas)",
      "Asiento 3: BudyXXIII (2.13 € en fichas)",
      "Asiento 4: Sigiilo (1.97 € en fichas)",
      "Asiento 5: SrLyce (1.99 € en fichas)",
      "Asiento 6: alexfw300 (2 € en fichas)",
      "alexfw300: pone la ciega pequeña 0.01 €",
      "mivipkr: pone la ciega grande 0.02 €",
      "NovacaineZxc: se retira",
      "BudyXXIII: se retira",
      "Sigiilo: se retira",
      "SrLyce: se retira",
      "alexfw300: sube 0.04 € a 0.06 €",
      "mivipkr: se retira",
      "alexfw300: no muestra su mano",
      "Asiento 1: mivipkr (ciega grande) se retiró antes del Flop",
      "Asiento 2: NovacaineZxc se retiró antes del Flop (no apostó)",
      "Asiento 3: BudyXXIII se retiró antes del Flop (no apostó)",
      "Asiento 4: Sigiilo se retiró antes del Flop (no apostó)",
      "Asiento 5: SrLyce (botón) se retiró antes del Flop (no apostó)",
      "Asiento 6: alexfw300 (ciega pequeña) recaudó (0.04 €)"
    ],
    "flop": [],
    "turn": [],
    "river": []
  },
  "board": [],
  "winner": "alexfw300",
  "win_amount": 2.0,
  "sb": 0.01,
  "bb": 0.02,
  "rake": 0.0,
  "raw_text": "Mano n.º 257150402768 de PokerStars:  Hold'em No Limit (0.01 €/0.02 € EUR) - 30-07-2025 23:39:19 CET [30-07-2025 17:39:19 ET]\nMesa \"Martha\" 6-max El asiento n.º 5 es el botón\nAsiento 1: mivipkr (2.06 € en fichas) \nAsiento 2: NovacaineZxc (2.53 € en fichas) \nAsiento 3: BudyXXIII (2.13 € en fichas) \nAsiento 4: Sigiilo (1.97 € en fichas) \nAsiento 5: SrLyce (1.99 € en fichas) \nAsiento 6: alexfw300 (2 € en fichas) \nalexfw300: pone la ciega pequeña 0.01 €\nmivipkr: pone la ciega grande 0.02 €\n*** CARTAS DE MANO ***\nRepartidas a SrLyce [Th 2s]\nNovacaineZxc: se retira \nBudyXXIII: se retira \nSigiilo: se retira \nSrLyce: se retira \nalexfw300: sube 0.04 € a 0.06 €\nmivipkr: se retira \nLa apuesta no igualada (0.04 €) ha sido devuelta a alexfw300\nalexfw300 se lleva 0.04 € del bote \nalexfw300: no muestra su mano \n*** RESUMEN ***\nBote total 0.04 € | Comisión 0 € \nAsiento 1: mivipkr (ciega grande) se retiró antes del Flop\nAsiento 2: NovacaineZxc se retiró antes del Flop (no apostó)\nAsiento 3: BudyXXIII se retiró antes del Flop (no apostó)\nAsiento 4: Sigiilo se retiró antes del Flop (no apostó)\nAsiento 5: SrLyce (botón) se retiró antes del Flop (no apostó)\nAsiento 6: alexfw300 (ciega pequeña) recaudó (0.04 €)"
}