{
  "hand_id": "257238757089",
  "date": "06-08-2025 19:26:30",
  "table": "Herculina II",
  "game_type": "holdem",
  "hero": "SrLyce",
  "hero_position": "",
  "hero_cards": [
    "8d",
    "6d"
  ],
  "stacks": {
    "Alceo27": 119.0,
    "David98X": 139.0,
    "JJer11": 190.5,
    "SrLyce": 141.5,
    "Macklemore0": 104.0,
    "ScarvBlack": 107.0
  },
  "actions": {
    "preflop": [
      "Asiento 1: Alceo27 (2.38 € en fichas)",
      "Asiento 2: David98X (2.78 € en fichas)",
      "Asiento 3: JJer11 (3.81 € en fichas)",
      "Asiento 4: SrLyce (2.83 € en fichas)",
      "Asiento 5: Macklemore0 (2.08 € en fichas)",
      "Asiento 6: ScarvBlack (2.14 € en fichas)",
      "David98X: pone la ciega pequeña 0.01 €",
      "JJer11: pone la ciega grande 0.02 €",
      "SrLyce: sube 0.03 € a 0.05 €",
      "Macklemore0: se retira",
      "ScarvBlack: iguala 0.05 €",
      "Alceo27: se retira",
      "David98X: se retira",
      "JJer11: iguala 0.03 €"
    ],
    "flop": [
      "JJer11: pasa",
      "SrLyce: pasa",
      "ScarvBlack: apuesta 0.10 €",
      "JJer11: se retira",
      "SrLyce: se retira",
      "ScarvBlack: no muestra su mano",
      "Asiento 1: Alceo27 (botón) se retiró antes del Flop (no apostó)",
      "Asiento 2: David98X (ciega pequeña) se retiró antes del Flop",
      "Asiento 3: JJer11 (ciega grande) se retiró en el Flop",
      "Asiento 4: SrLyce se retiró en el Flop",
      "Asiento 5: Macklemore0 se retiró antes del Flop (no apostó)",
      "Asiento 6: ScarvBlack recaudó (0.15 €)"
    ],
    "turn": [],
    "river": []
  },
  "board": [
    "Qc",
    "7c",
    "3s"
  ],
  "winner": "ScarvBlack",
  "win_amount": 7.5,
  "sb": 0.01,
  "bb": 0.02,
  "rake": 0.5,
  "raw_text": "Mano n.º 257238757089 de PokerStars:  Hold'em No Limit (0.01 €/0.02 € EUR) - 06-08-2025 19:26:30 CET [06-08-2025 13:26:30 ET]\nMesa \"Herculina II\" 6-max El asiento n.º 1 es el botón\nAsiento 1: Alceo27 (2.38 € en fichas) \nAsiento 2: David98X (2.78 € en fichas) \nAsiento 3: JJer11 (3.81 € en fichas) \nAsiento 4: SrLyce (2.83 € en fichas) \nAsiento 5: Macklemore0 (2.08 € en fichas) \nAsiento 6: ScarvBlack (2.14 € en fichas) \nDavid98X: pone la ciega pequeña 0.01 €\nJJer11: pone la ciega grande 0.02 €\n*** CARTAS DE MANO ***\nRepartidas a SrLyce [8d 6d]\nSrLyce: sube 0.03 € a 0.05 €\nMacklemore0: se retira \nScarvBlack: iguala 0.05 €\nAlceo27: se retira \nDavid98X: se retira \nJJer11: iguala 0.03 €\n*** FLOP *** [Qc 7c 3s]\nJJer11: pasa \nSrLyce: pasa \nScarvBlack: apuesta 0.10 €\nJJer11: se retira \nSrLyce: se retira \nLa apuesta no igualada (0.10 €) ha sido devuelta a ScarvBlack\nScarvBlack se lleva 0.15 € del bote \nScarvBlack: no muestra su mano \n*** RESUMEN ***\nBote total 0.16 € | Comisión 0.01 € \nComunitarias [Qc 7c 3s]\nAsiento 1: Alceo27 (botón) se retiró antes del Flop (no apostó)\nAsiento 2: David98X (ciega pequeña) se retiró antes del Flop\nAsiento 3: JJer11 (ciega grande) se retiró en el Flop\nAsiento 4: SrLyce se retiró en el Flop\nAsiento 5: Macklemore0 se retiró antes del Flop (no apostó)\nAsiento 6: ScarvBlack recaudó (0.15 €)"
}