{
  "hand_id": "257238127447",
  "date": "06-08-2025 18:30:30",
  "table": "Alruccabah II",
  "game_type": "holdem",
  "hero": "SrLyce",
  "hero_position": "",
  "hero_cards": [
    "Js",
    "2c"
  ],
  "stacks": {
    "SrLyce": 97.0,
    "Davdgoni": 258.0,
    "PerroBestia": 41.5,
    "Nicanor Cast": 53.0,
    "THEBLACK972": 173.5
  },
  "actions": {
    "preflop": [
      "Asiento 1: SrLyce (1.94 € en fichas)",
      "Asiento 2: Davdgoni (5.16 € en fichas)",
      "Asiento 3: PerroBestia (0.83 € en fichas)",
      "Asiento 4: serviettski(fr) (2.13 € en fichas)",
      "Asiento 5: Nicanor Cast (1.06 € en fichas)",
      "Asiento 6: THEBLACK972 (3.47 € en fichas)",
      "Nicanor Cast: pone la ciega pequeña 0.01 €",
      "THEBLACK972: pone la ciega grande 0.02 €",
      "SrLyce: se retira",
      "Davdgoni: sube 0.04 € a 0.06 €",
      "PerroBestia: se retira",
      "serviettski(fr): se retira",
      "Nicanor Cast: se retira",
      "THEBLACK972: se retira",
      "Davdgoni: no muestra su mano",
      "Asiento 1: SrLyce se retiró antes del Flop (no apostó)",
      "Asiento 2: Davdgoni recaudó (0.05 €)",
      "Asiento 3: PerroBestia se retiró antes del Flop (no apostó)",
      "Asiento 4: serviettski(fr) (botón) se retiró antes del Flop (no apostó)",
      "Asiento 5: Nicanor Cast (ciega pequeña) se retiró antes del Flop",
      "Asiento 6: THEBLACK972 (ciega grande) se retiró antes del Flop"
    ],
    "flop": [],
    "turn": [],
    "river": []
  },
  "board": [],
  "winner": "Davdgoni",
  "win_amount": 2.5,
  "sb": 0.01,
  "bb": 0.02,
  "rake": 0.0,
  "raw_text": "Mano n.º 257238127447 de PokerStars:  Hold'em No Limit (0.01 €/0.02 € EUR) - 06-08-2025 18:30:30 CET [06-08-2025 12:30:30 ET]\nMesa \"Alruccabah II\" 6-max El asiento n.º 4 es el botón\nAsiento 1: SrLyce (1.94 € en fichas) \nAsiento 2: Davdgoni (5.16 € en fichas) \nAsiento 3: PerroBestia (0.83 € en fichas) \nAsiento 4: serviettski(fr) (2.13 € en fichas) \nAsiento 5: Nicanor Cast (1.06 € en fichas) \nAsiento 6: THEBLACK972 (3.47 € en fichas) \nNicanor Cast: pone la ciega pequeña 0.01 €\nTHEBLACK972: pone la ciega grande 0.02 €\n*** CARTAS DE MANO ***\nRepartidas a SrLyce [Js 2c]\nSrLyce: se retira \nDavdgoni: sube 0.04 € a 0.06 €\nPerroBestia: se retira \nserviettski(fr): se retira \nNicanor Cast: se retira \nTHEBLACK972: se retira \nLa apuesta no igualada (0.04 €) ha sido devuelta a Davdgoni\nDavdgoni se lleva 0.05 € del bote \nDavdgoni: no muestra su mano \n*** RESUMEN ***\nBote total 0.05 € | Comisión 0 € \nAsiento 1: SrLyce se retiró antes del Flop (no apostó)\nAsiento 2: Davdgoni recaudó (0.05 €)\nAsiento 3: PerroBestia se retiró antes del Flop (no apostó)\nAsiento 4: serviettski(fr) (botón) se retiró antes del Flop (no apostó)\nAsiento 5: Nicanor Cast (ciega pequeña) se retiró antes del Flop\nAsiento 6: THEBLACK972 (ciega grande) se retiró antes del Flop"
}