{
  "hand_id": "257237900952",
  "date": "06-08-2025 18:10:10",
  "table": "Nuwa III",
  "game_type": "holdem",
  "hero": "SrLyce",
  "hero_position": "",
  "hero_cards": [
    "Ks",
    "3d"
  ],
  "stacks": {
    "Begoton": 100.0,
    "BuXHexter": 100.0,
    "kcg_rm": 109.0,
    "SrLyce": 101.5,
    "acavada": 103.0
  },
  "actions": {
    "preflop": [
      "Asiento 1: Begoton (2 € en fichas) está ausente",
      "Asiento 2: BuXHexter (2 € en fichas)",
      "Asiento 3: kcg_rm (2.18 € en fichas)",
      "Asiento 4: SrLyce (2.03 € en fichas)",
      "Asiento 6: acavada (2.06 € en fichas)",
      "kcg_rm: pone la ciega pequeña 0.01 €",
      "SrLyce: pone la ciega grande 0.02 €",
      "Begoton: se ausenta",
      "acavada: se retira",
      "BuXHexter: se retira",
      "kcg_rm: sube 0.02 € a 0.04 €",
      "SrLyce: iguala 0.02 €"
    ],
    "flop": [
      "kcg_rm: pasa",
      "SrLyce: apuesta 0.03 €",
      "kcg_rm: se retira",
      "SrLyce: no muestra su mano",
      "Asiento 1: Begoton",
      "Asiento 2: BuXHexter (botón) se retiró antes del Flop (no apostó)",
      "Asiento 3: kcg_rm (ciega pequeña) se retiró en el Flop",
      "Asiento 4: SrLyce (ciega grande) recaudó (0.08 €)",
      "Asiento 6: acavada se retiró antes del Flop (no apostó)"
    ],
    "turn": [],
    "river": []
  },
  "board": [
    "2s",
    "Qh",
    "Kh"
  ],
  "winner": "SrLyce",
  "win_amount": 4.0,
  "sb": 0.01,
  "bb": 0.02,
  "rake": 0.0,
  "raw_text": "Mano n.º 257237900952 de PokerStars:  Hold'em No Limit (0.01 €/0.02 € EUR) - 06-08-2025 18:10:10 CET [06-08-2025 12:10:10 ET]\nMesa \"Nuwa III\" 6-max El asiento n.º 2 es el botón\nAsiento 1: Begoton (2 € en fichas) está ausente\nAsiento 2: BuXHexter (2 € en fichas) \nAsiento 3: kcg_rm (2.18 € en fichas) \nAsiento 4: SrLyce (2.03 € en fichas) \nAsiento 6: acavada (2.06 € en fichas) \nkcg_rm: pone la ciega pequeña 0.01 €\nSrLyce: pone la ciega grande 0.02 €\nBegoton: se ausenta \n*** CARTAS DE MANO ***\nRepartidas a SrLyce [Ks 3d]\nacavada: se retira \nBuXHexter: se retira \nkcg_rm: sube 0.02 € a 0.04 €\nSrLyce: iguala 0.02 €\n*** FLOP *** [2s Qh Kh]\nkcg_rm: pasa \nSrLyce: apuesta 0.03 €\nkcg_rm: se retira \nLa apuesta no igualada (0.03 €) ha sido devuelta a SrLyce\nSrLyce se lleva 0.08 € del bote \nSrLyce: no muestra su mano \n*** RESUMEN ***\nBote total 0.08 € | Comisión 0 € \nComunitarias [2s Qh Kh]\nAsiento 1: Begoton\nAsiento 2: BuXHexter (botón) se retiró antes del Flop (no apostó)\nAsiento 3: kcg_rm (ciega pequeña) se retiró en el Flop\nAsiento 4: SrLyce (ciega grande) recaudó (0.08 €)\nAsiento 6: acavada se retiró antes del Flop (no apostó)"
}