{
  "hand_id": "257237050042",
  "date": "06-08-2025 17:35:02",
  "table": "Themisto III",
  "game_type": "holdem",
  "hero": "SrLyce",
  "hero_position": "",
  "hero_cards": [
    "Kc",
    "3d"
  ],
  "stacks": {
    "elso253": 67.5,
    "SrLyce": 119.0,
    "idigon": 21.5,
    "fred2d23po": 77.0,
    "mivipkr": 124.0,
    "marignamo": 90.5
  },
  "actions": {
    "preflop": [
      "Asiento 1: elso253 (1.35 € en fichas)",
      "Asiento 2: SrLyce (2.38 € en fichas)",
      "Asiento 3: idigon (0.43 € en fichas)",
      "Asiento 4: fred2d23po (1.54 € en fichas)",
      "Asiento 5: mivipkr (2.48 € en fichas)",
      "Asiento 6: marignamo (1.81 € en fichas)",
      "elso253: pone la ciega pequeña 0.01 €",
      "SrLyce: pone la ciega grande 0.02 €",
      "idigon: se retira",
      "fred2d23po: se retira",
      "mivipkr: se retira",
      "marignamo: se retira",
      "elso253: se retira",
      "SrLyce: no muestra su mano",
      "Asiento 1: elso253 (ciega pequeña) se retiró antes del Flop",
      "Asiento 2: SrLyce (ciega grande) recaudó (0.02 €)",
      "Asiento 3: idigon se retiró antes del Flop (no apostó)",
      "Asiento 4: fred2d23po se retiró antes del Flop (no apostó)",
      "Asiento 5: mivipkr se retiró antes del Flop (no apostó)",
      "Asiento 6: marignamo (botón) se retiró antes del Flop (no apostó)"
    ],
    "flop": [],
    "turn": [],
    "river": []
  },
  "board": [],
  "winner": "SrLyce",
  "win_amount": 1.0,
  "sb": 0.01,
  "bb": 0.02,
  "rake": 0.0,
  "raw_text": "Mano n.º 257237050042 de PokerStars:  Hold'em No Limit (0.01 €/0.02 € EUR) - 06-08-2025 17:35:02 CET [06-08-2025 11:35:02 ET]\nMesa \"Themisto III\" 6-max El asiento n.º 6 es el botón\nAsiento 1: elso253 (1.35 € en fichas) \nAsiento 2: SrLyce (2.38 € en fichas) \nAsiento 3: idigon (0.43 € en fichas) \nAsiento 4: fred2d23po (1.54 € en fichas) \nAsiento 5: mivipkr (2.48 € en fichas) \nAsiento 6: marignamo (1.81 € en fichas) \nelso253: pone la ciega pequeña 0.01 €\nSrLyce: pone la ciega grande 0.02 €\n*** CARTAS DE MANO ***\nRepartidas a SrLyce [Kc 3d]\nidigon: se retira \nfred2d23po: se retira \nmivipkr: se retira \nmarignamo: se retira \nelso253: se retira \nLa apuesta no igualada (0.01 €) ha sido devuelta a SrLyce\nSrLyce se lleva 0.02 € del bote \nSrLyce: no muestra su mano \n*** RESUMEN ***\nBote total 0.02 € | Comisión 0 € \nAsiento 1: elso253 (ciega pequeña) se retiró antes del Flop\nAsiento 2: SrLyce (ciega grande) recaudó (0.02 €)\nAsiento 3: idigon se retiró antes del Flop (no apostó)\nAsiento 4: fred2d23po se retiró antes del Flop (no apostó)\nAsiento 5: mivipkr se retiró antes del Flop (no apostó)\nAsiento 6: marignamo (botón) se retiró antes del Flop (no apostó)"
}