{
  "hand_id": "257215119785",
  "date": "04-08-2025 22:25:36",
  "table": "Aldhafera II",
  "game_type": "holdem",
  "hero": "SrLyce",
  "hero_position": "",
  "hero_cards": [
    "8s",
    "Qd"
  ],
  "stacks": {
    "wsx25": 94.0,
    "BudyXXIII": 271.5,
    "SrLyce": 97.0,
    "rhidoxxx": 85.5,
    "jte-ken": 120.5,
    "betterrrrrr": 166.5
  },
  "actions": {
    "preflop": [
      "Asiento 1: wsx25 (1.88 € en fichas)",
      "Asiento 2: BudyXXIII (5.43 € en fichas)",
      "Asiento 3: SrLyce (1.94 € en fichas)",
      "Asiento 4: rhidoxxx (1.71 € en fichas)",
      "Asiento 5: jte-ken (2.41 € en fichas)",
      "Asiento 6: betterrrrrr (3.33 € en fichas)",
      "wsx25: pone la ciega pequeña 0.01 €",
      "BudyXXIII: pone la ciega grande 0.02 €",
      "SrLyce: se retira",
      "rhidoxxx: sube 0.04 € a 0.06 €",
      "jte-ken: iguala 0.06 €",
      "betterrrrrr: se retira",
      "wsx25: se retira",
      "BudyXXIII: iguala 0.04 €"
    ],
    "flop": [
      "BudyXXIII: apuesta 0.06 €",
      "rhidoxxx: iguala 0.06 €",
      "jte-ken: iguala 0.06 €"
    ],
    "turn": [
      "BudyXXIII: apuesta 0.26 €",
      "rhidoxxx: iguala 0.26 €",
      "jte-ken: se retira"
    ],
    "river": [
      "BudyXXIII: apuesta 1.31 €",
      "rhidoxxx: se retira",
      "BudyXXIII: no muestra su mano",
      "Asiento 1: wsx25 (ciega pequeña) se retiró antes del Flop",
      "Asiento 2: BudyXXIII (ciega grande) recaudó (0.84 €)",
      "Asiento 3: SrLyce se retiró antes del Flop (no apostó)",
      "Asiento 4: rhidoxxx se retiró en el River",
      "Asiento 5: jte-ken se retiró en el Turn",
      "Asiento 6: betterrrrrr (botón) se retiró antes del Flop (no apostó)"
    ]
  },
  "board": [
    "Ks",
    "9c",
    "Qc",
    "Qh",
    "4h"
  ],
  "winner": "BudyXXIII",
  "win_amount": 42.0,
  "sb": 0.01,
  "bb": 0.02,
  "rake": 2.5,
  "raw_text": "Mano n.º 257215119785 de PokerStars:  Hold'em No Limit (0.01 €/0.02 € EUR) - 04-08-2025 22:25:36 CET [04-08-2025 16:25:36 ET]\nMesa \"Aldhafera II\" 6-max El asiento n.º 6 es el botón\nAsiento 1: wsx25 (1.88 € en fichas) \nAsiento 2: BudyXXIII (5.43 € en fichas) \nAsiento 3: SrLyce (1.94 € en fichas) \nAsiento 4: rhidoxxx (1.71 € en fichas) \nAsiento 5: jte-ken (2.41 € en fichas) \nAsiento 6: betterrrrrr (3.33 € en fichas) \nwsx25: pone la ciega pequeña 0.01 €\nBudyXXIII: pone la ciega grande 0.02 €\n*** CARTAS DE MANO ***\nRepartidas a SrLyce [8s Qd]\nSrLyce ha agotado su tiempo\nSrLyce: se retira \nrhidoxxx: sube 0.04 € a 0.06 €\njte-ken: iguala 0.06 €\nbetterrrrrr: se retira \nwsx25: se retira \nBudyXXIII: iguala 0.04 €\n*** FLOP *** [Ks 9c Qc]\nBudyXXIII: apuesta 0.06 €\nrhidoxxx: iguala 0.06 €\njte-ken: iguala 0.06 €\n*** TURN *** [Ks 9c Qc] [Qh]\nBudyXXIII: apuesta 0.26 €\nrhidoxxx: iguala 0.26 €\njte-ken: se retira \n*** RIVER *** [Ks 9c Qc Qh] [4h]\nBudyXXIII: apuesta 1.31 €\nrhidoxxx: se retira \nLa apuesta no igualada (1.31 €) ha sido devuelta a BudyXXIII\nBudyXXIII se lleva 0.84 € del bote \nBudyXXIII: no muestra su mano \n*** RESUMEN ***\nBote total 0.89 € | Comisión 0.05 € \nComunitarias [Ks 9c Qc Qh 4h]\nAsiento 1: wsx25 (ciega pequeña) se retiró antes del Flop\nAsiento 2: BudyXXIII (ciega grande) recaudó (0.84 €)\nAsiento 3: SrLyce se retiró antes del Flop (no apostó)\nAsiento 4: rhidoxxx se retiró en el River\nAsiento 5: jte-ken se retiró en el Turn\nAsiento 6: betterrrrrr (botón) se retiró antes del Flop (no apostó)"
}