{
  "hand_id": "257238515026",
  "date": "06-08-2025 19:06:11",
  "table": "Adelaide III",
  "game_type": "holdem",
  "hero": "SrLyce",
  "hero_position": "",
  "hero_cards": [
    "Ts",
    "5h"
  ],
  "stacks": {
    "N3xtTIm35": 124.5,
    "aliendee07": 66.0,
    "Macklemore0": 100.0,
    "SrLyce": 97.5,
    "ismagonzalez7": 61.0,
    "pauquair5": 65.5
  },
  "actions": {
    "preflop": [
      "Asiento 1: N3xtTIm35 (2.49 € en fichas)",
      "Asiento 2: aliendee07 (1.32 € en fichas)",
      "Asiento 3: Macklemore0 (2 € en fichas)",
      "Asiento 4: SrLyce (1.95 € en fichas)",
      "Asiento 5: ismagonzalez7 (1.22 € en fichas)",
      "Asiento 6: pauquair5 (1.31 € en fichas)",
      "N3xtTIm35: pone la ciega pequeña 0.01 €",
      "aliendee07: pone la ciega grande 0.02 €",
      "Macklemore0: se retira",
      "SrLyce: se retira",
      "ismagonzalez7: se retira",
      "pauquair5: sube 0.02 € a 0.04 €",
      "N3xtTIm35: se retira",
      "aliendee07: iguala 0.02 €"
    ],
    "flop": [
      "aliendee07: pasa",
      "pauquair5: pasa"
    ],
    "turn": [
      "aliendee07: apuesta 0.04 €",
      "pauquair5: se retira",
      "aliendee07: no muestra su mano",
      "Asiento 1: N3xtTIm35 (ciega pequeña) se retiró antes del Flop",
      "Asiento 2: aliendee07 (ciega grande) recaudó (0.08 €)",
      "Asiento 3: Macklemore0 se retiró antes del Flop (no apostó)",
      "Asiento 4: SrLyce se retiró antes del Flop (no apostó)",
      "Asiento 5: ismagonzalez7 se retiró antes del Flop (no apostó)",
      "Asiento 6: pauquair5 (botón) se retiró en el Turn"
    ],
    "river": []
  },
  "board": [
    "3s",
    "Jh",
    "Kc",
    "6h"
  ],
  "winner": "aliendee07",
  "win_amount": 4.0,
  "sb": 0.01,
  "bb": 0.02,
  "rake": 0.5,
  "raw_text": "Mano n.º 257238515026 de PokerStars:  Hold'em No Limit (0.01 €/0.02 € EUR) - 06-08-2025 19:06:11 CET [06-08-2025 13:06:11 ET]\nMesa \"Adelaide III\" 6-max El asiento n.º 6 es el botón\nAsiento 1: N3xtTIm35 (2.49 € en fichas) \nAsiento 2: aliendee07 (1.32 € en fichas) \nAsiento 3: Macklemore0 (2 € en fichas) \nAsiento 4: SrLyce (1.95 € en fichas) \nAsiento 5: ismagonzalez7 (1.22 € en fichas) \nAsiento 6: pauquair5 (1.31 € en fichas) \nN3xtTIm35: pone la ciega pequeña 0.01 €\naliendee07: pone la ciega grande 0.02 €\n*** CARTAS DE MANO ***\nRepartidas a SrLyce [Ts 5h]\nMacklemore0: se retira \nSrLyce: se retira \nismagonzalez7: se retira \npauquair5: sube 0.02 € a 0.04 €\nN3xtTIm35: se retira \naliendee07: iguala 0.02 €\n*** FLOP *** [3s Jh Kc]\naliendee07: pasa \npauquair5: pasa \n*** TURN *** [3s Jh Kc] [6h]\naliendee07: apuesta 0.04 €\npauquair5: se retira \nLa apuesta no igualada (0.04 €) ha sido devuelta a aliendee07\naliendee07 se lleva 0.08 € del bote \naliendee07: no muestra su mano \n*** RESUMEN ***\nBote total 0.09 € | Comisión 0.01 € \nComunitarias [3s Jh Kc 6h]\nAsiento 1: N3xtTIm35 (ciega pequeña) se retiró antes del Flop\nAsiento 2: aliendee07 (ciega grande) recaudó (0.08 €)\nAsiento 3: Macklemore0 se retiró antes del Flop (no apostó)\nAsiento 4: SrLyce se retiró antes del Flop (no apostó)\nAsiento 5: ismagonzalez7 se retiró antes del Flop (no apostó)\nAsiento 6: pauquair5 (botón) se retiró en el Turn"
}