{
  "hand_id": "257238297570",
  "date": "06-08-2025 18:45:33",
  "table": "Alruccabah II",
  "game_type": "holdem",
  "hero": "SrLyce",
  "hero_position": "",
  "hero_cards": [
    "4d",
    "Kh"
  ],
  "stacks": {
    "rayao32": 52.0,
    "SrLyce": 100.0,
    "Davdgoni": 280.5,
    "tatinette35": 100.0,
    "Nicanor Cast": 51.5
  },
  "actions": {
    "preflop": [
      "Asiento 6: rayao32 (1.04 € en fichas) está ausente",
      "Asiento 1: SrLyce (2 € en fichas)",
      "Asiento 2: Davdgoni (5.61 € en fichas)",
      "Asiento 3: tatinette35 (2 € en fichas)",
      "Asiento 4: serviettski(fr) (2 € en fichas)",
      "Asiento 5: Nicanor Cast (1.03 € en fichas)",
      "SrLyce: pone la ciega pequeña 0.01 €",
      "Davdgoni: pone la ciega grande 0.02 €",
      "tatinette35: pone la ciega grande 0.02 €",
      "tatinette35: pasa",
      "serviettski(fr): se retira",
      "Nicanor Cast: se retira",
      "SrLyce: iguala 0.01 €",
      "Davdgoni: pasa"
    ],
    "flop": [
      "SrLyce: pasa",
      "Davdgoni: pasa",
      "tatinette35: pasa"
    ],
    "turn": [
      "SrLyce: pasa",
      "Davdgoni: pasa",
      "tatinette35: pasa"
    ],
    "river": [
      "SrLyce: apuesta 0.02 €",
      "Davdgoni: iguala 0.02 €",
      "tatinette35: se retira",
      "SrLyce: muestra [4d Kh] (doble pareja, sietes y cuatros)",
      "Davdgoni: muestra [As 5s] (doble pareja, sietes y cincos)",
      "Asiento 6: rayao32",
      "Asiento 1: SrLyce (ciega pequeña) muestra [4d Kh] y perdió con doble pareja, sietes y cuatros",
      "Asiento 2: Davdgoni (ciega grande) muestra [As 5s] y ganó (0.09 €) con doble pareja, sietes y cincos",
      "Asiento 3: tatinette35 se retiró en el River (no apostó)",
      "Asiento 4: serviettski(fr) se retiró antes del Flop (no apostó)",
      "Asiento 5: Nicanor Cast (botón) se retiró antes del Flop (no apostó)"
    ]
  },
  "board": [
    "5c",
    "7s",
    "Th",
    "7c",
    "4s"
  ],
  "winner": "Davdgoni",
  "win_amount": 4.5,
  "sb": 0.01,
  "bb": 0.02,
  "rake": 0.5,
  "raw_text": "Mano n.º 257238297570 de PokerStars:  Hold'em No Limit (0.01 €/0.02 € EUR) - 06-08-2025 18:45:33 CET [06-08-2025 12:45:33 ET]\nMesa \"Alruccabah II\" 6-max El asiento n.º 5 es el botón\nAsiento 6: rayao32 (1.04 € en fichas) está ausente\nAsiento 1: SrLyce (2 € en fichas) \nAsiento 2: Davdgoni (5.61 € en fichas) \nAsiento 3: tatinette35 (2 € en fichas) \nAsiento 4: serviettski(fr) (2 € en fichas) \nAsiento 5: Nicanor Cast (1.03 € en fichas) \nSrLyce: pone la ciega pequeña 0.01 €\nDavdgoni: pone la ciega grande 0.02 €\ntatinette35: pone la ciega grande 0.02 €\n*** CARTAS DE MANO ***\nRepartidas a SrLyce [4d Kh]\ntatinette35: pasa \nserviettski(fr): se retira \nNicanor Cast: se retira \nSrLyce: iguala 0.01 €\nDavdgoni: pasa \n*** FLOP *** [5c 7s Th]\nSrLyce: pasa \nDavdgoni: pasa \ntatinette35: pasa \n*** TURN *** [5c 7s Th] [7c]\nSrLyce: pasa \nDavdgoni: pasa \ntatinette35: pasa \n*** RIVER *** [5c 7s Th 7c] [4s]\nSrLyce: apuesta 0.02 €\nDavdgoni: iguala 0.02 €\ntatinette35: se retira \n*** SHOW DOWN ***\nSrLyce: muestra [4d Kh] (doble pareja, sietes y cuatros)\nDavdgoni: muestra [As 5s] (doble pareja, sietes y cincos)\nDavdgoni se lleva 0.09 € del bote \n*** RESUMEN ***\nBote total 0.10 € | Comisión 0.01 € \nComunitarias [5c 7s Th 7c 4s]\nAsiento 6: rayao32\nAsiento 1: SrLyce (ciega pequeña) muestra [4d Kh] y perdió con doble pareja, sietes y cuatros\nAsiento 2: Davdgoni (ciega grande) muestra [As 5s] y ganó (0.09 €) con doble pareja, sietes y cincos\nAsiento 3: tatinette35 se retiró en el River (no apostó)\nAsiento 4: serviettski(fr) se retiró antes del Flop (no apostó)\nAsiento 5: Nicanor Cast (botón) se retiró antes del Flop (no apostó)"
}