{
  "hand_id": "257215279664",
  "date": "04-08-2025 22:35:31",
  "table": "Aldhafera II",
  "game_type": "holdem",
  "hero": "SrLyce",
  "hero_position": "",
  "hero_cards": [
    "6h",
    "Ac"
  ],
  "stacks": {
    "wsx25": 65.5,
    "BudyXXIII": 292.5,
    "SrLyce": 98.5,
    "rhidoxxx": 75.5,
    "jte-ken": 121.0,
    "betterrrrrr": 172.0
  },
  "actions": {
    "preflop": [
      "Asiento 1: wsx25 (1.31 € en fichas)",
      "Asiento 2: BudyXXIII (5.85 € en fichas)",
      "Asiento 3: SrLyce (1.97 € en fichas)",
      "Asiento 4: rhidoxxx (1.51 € en fichas)",
      "Asiento 5: jte-ken (2.42 € en fichas)",
      "Asiento 6: betterrrrrr (3.44 € en fichas)",
      "betterrrrrr: pone la ciega pequeña 0.01 €",
      "wsx25: pone la ciega grande 0.02 €",
      "BudyXXIII: se retira",
      "SrLyce: se retira",
      "rhidoxxx: se retira",
      "jte-ken: sube 0.04 € a 0.06 €",
      "betterrrrrr: se retira",
      "wsx25: iguala 0.04 €"
    ],
    "flop": [
      "wsx25: pasa",
      "jte-ken: pasa"
    ],
    "turn": [
      "wsx25: pasa",
      "jte-ken: apuesta 0.06 €",
      "wsx25: se retira",
      "Asiento 1: wsx25 (ciega grande) se retiró en el Turn",
      "Asiento 2: BudyXXIII se retiró antes del Flop (no apostó)",
      "Asiento 3: SrLyce se retiró antes del Flop (no apostó)",
      "Asiento 4: rhidoxxx se retiró antes del Flop (no apostó)",
      "Asiento 5: jte-ken (botón) recaudó (0.12 €)",
      "Asiento 6: betterrrrrr (ciega pequeña) se retiró antes del Flop"
    ],
    "river": []
  },
  "board": [
    "4c",
    "3c",
    "6s",
    "As"
  ],
  "winner": "jte-ken",
  "win_amount": 6.0,
  "sb": 0.01,
  "bb": 0.02,
  "rake": 0.5,
  "raw_text": "Mano n.º 257215279664 de PokerStars:  Hold'em No Limit (0.01 €/0.02 € EUR) - 04-08-2025 22:35:31 CET [04-08-2025 16:35:31 ET]\nMesa \"Aldhafera II\" 6-max El asiento n.º 5 es el botón\nAsiento 1: wsx25 (1.31 € en fichas) \nAsiento 2: BudyXXIII (5.85 € en fichas) \nAsiento 3: SrLyce (1.97 € en fichas) \nAsiento 4: rhidoxxx (1.51 € en fichas) \nAsiento 5: jte-ken (2.42 € en fichas) \nAsiento 6: betterrrrrr (3.44 € en fichas) \nbetterrrrrr: pone la ciega pequeña 0.01 €\nwsx25: pone la ciega grande 0.02 €\n*** CARTAS DE MANO ***\nRepartidas a SrLyce [6h Ac]\nBudyXXIII: se retira \nSrLyce: se retira \nrhidoxxx: se retira \njte-ken: sube 0.04 € a 0.06 €\nbetterrrrrr: se retira \nwsx25: iguala 0.04 €\n*** FLOP *** [4c 3c 6s]\nwsx25: pasa \njte-ken: pasa \n*** TURN *** [4c 3c 6s] [As]\nwsx25: pasa \njte-ken: apuesta 0.06 €\nwsx25: se retira \nLa apuesta no igualada (0.06 €) ha sido devuelta a jte-ken\njte-ken se lleva 0.12 € del bote \n*** RESUMEN ***\nBote total 0.13 € | Comisión 0.01 € \nComunitarias [4c 3c 6s As]\nAsiento 1: wsx25 (ciega grande) se retiró en el Turn\nAsiento 2: BudyXXIII se retiró antes del Flop (no apostó)\nAsiento 3: SrLyce se retiró antes del Flop (no apostó)\nAsiento 4: rhidoxxx se retiró antes del Flop (no apostó)\nAsiento 5: jte-ken (botón) recaudó (0.12 €)\nAsiento 6: betterrrrrr (ciega pequeña) se retiró antes del Flop"
}