{
  "hand_id": "257238702461",
  "date": "06-08-2025 19:21:58",
  "table": "Adelaide III",
  "game_type": "holdem",
  "hero": "SrLyce",
  "hero_position": "",
  "hero_cards": [
    "5h",
    "Jd"
  ],
  "stacks": {
    "Alceo27": 110.0,
    "aliendee07": 43.0,
    "Macklemore0": 108.5,
    "SrLyce": 133.5,
    "ismagonzalez7": 46.0,
    "McFlash3": 100.0
  },
  "actions": {
    "preflop": [
      "Asiento 1: Alceo27 (2.20 € en fichas)",
      "Asiento 2: aliendee07 (0.86 € en fichas)",
      "Asiento 3: Macklemore0 (2.17 € en fichas)",
      "Asiento 4: SrLyce (2.67 € en fichas)",
      "Asiento 5: ismagonzalez7 (0.92 € en fichas)",
      "Asiento 6: McFlash3 (2 € en fichas)",
      "Alceo27: pone la ciega pequeña 0.01 €",
      "aliendee07: pone la ciega grande 0.02 €",
      "Macklemore0: se retira",
      "SrLyce: se retira",
      "ismagonzalez7: se retira",
      "McFlash3: se retira",
      "Alceo27: sube 0.04 € a 0.06 €",
      "aliendee07: se retira",
      "Alceo27: no muestra su mano",
      "Asiento 1: Alceo27 (ciega pequeña) recaudó (0.04 €)",
      "Asiento 2: aliendee07 (ciega grande) se retiró antes del Flop",
      "Asiento 3: Macklemore0 se retiró antes del Flop (no apostó)",
      "Asiento 4: SrLyce se retiró antes del Flop (no apostó)",
      "Asiento 5: ismagonzalez7 se retiró antes del Flop (no apostó)",
      "Asiento 6: McFlash3 (botón) se retiró antes del Flop (no apostó)"
    ],
    "flop": [],
    "turn": [],
    "river": []
  },
  "board": [],
  "winner": "Alceo27",
  "win_amount": 2.0,
  "sb": 0.01,
  "bb": 0.02,
  "rake": 0.0,
  "raw_text": "Mano n.º 257238702461 de PokerStars:  Hold'em No Limit (0.01 €/0.02 € EUR) - 06-08-2025 19:21:58 CET [06-08-2025 13:21:58 ET]\nMesa \"Adelaide III\" 6-max El asiento n.º 6 es el botón\nAsiento 1: Alceo27 (2.20 € en fichas) \nAsiento 2: aliendee07 (0.86 € en fichas) \nAsiento 3: Macklemore0 (2.17 € en fichas) \nAsiento 4: SrLyce (2.67 € en fichas) \nAsiento 5: ismagonzalez7 (0.92 € en fichas) \nAsiento 6: McFlash3 (2 € en fichas) \nAlceo27: pone la ciega pequeña 0.01 €\naliendee07: pone la ciega grande 0.02 €\n*** CARTAS DE MANO ***\nRepartidas a SrLyce [5h Jd]\nMacklemore0: se retira \nSrLyce: se retira \nismagonzalez7: se retira \nMcFlash3: se retira \nAlceo27: sube 0.04 € a 0.06 €\naliendee07: se retira \nLa apuesta no igualada (0.04 €) ha sido devuelta a Alceo27\nAlceo27 se lleva 0.04 € del bote \nAlceo27: no muestra su mano \n*** RESUMEN ***\nBote total 0.04 € | Comisión 0 € \nAsiento 1: Alceo27 (ciega pequeña) recaudó (0.04 €)\nAsiento 2: aliendee07 (ciega grande) se retiró antes del Flop\nAsiento 3: Macklemore0 se retiró antes del Flop (no apostó)\nAsiento 4: SrLyce se retiró antes del Flop (no apostó)\nAsiento 5: ismagonzalez7 se retiró antes del Flop (no apostó)\nAsiento 6: McFlash3 (botón) se retiró antes del Flop (no apostó)"
}