{
  "hand_id": "257237911133",
  "date": "06-08-2025 18:11:06",
  "table": "Atreus",
  "game_type": "holdem",
  "hero": "SrLyce",
  "hero_position": "",
  "hero_cards": [
    "Kh",
    "8s"
  ],
  "stacks": {
    "PrendsCa": 108.0,
    "NRules82": 85.5,
    "JENOFONTE73": 124.0,
    "Fharock": 101.5,
    "SrLyce": 95.0,
    "FishamanReggae": 34.5
  },
  "actions": {
    "preflop": [
      "Asiento 1: PrendsCa (2.16 € en fichas)",
      "Asiento 2: NRules82 (1.71 € en fichas)",
      "Asiento 3: JENOFONTE73 (2.48 € en fichas)",
      "Asiento 4: Fharock (2.03 € en fichas)",
      "Asiento 5: SrLyce (1.90 € en fichas)",
      "Asiento 6: FishamanReggae (0.69 € en fichas)",
      "SrLyce: pone la ciega pequeña 0.01 €",
      "FishamanReggae: pone la ciega grande 0.02 €",
      "PrendsCa: sube 0.02 € a 0.04 €",
      "NRules82: se retira",
      "JENOFONTE73: se retira",
      "Fharock: se retira",
      "SrLyce: iguala 0.03 €",
      "FishamanReggae: se retira"
    ],
    "flop": [
      "SrLyce: apuesta 0.03 €",
      "PrendsCa: se retira",
      "SrLyce: no muestra su mano",
      "Asiento 1: PrendsCa se retiró en el Flop",
      "Asiento 2: NRules82 se retiró antes del Flop (no apostó)",
      "Asiento 3: JENOFONTE73 se retiró antes del Flop (no apostó)",
      "Asiento 4: Fharock (botón) se retiró antes del Flop (no apostó)",
      "Asiento 5: SrLyce (ciega pequeña) recaudó (0.09 €)",
      "Asiento 6: FishamanReggae (ciega grande) se retiró antes del Flop"
    ],
    "turn": [],
    "river": []
  },
  "board": [
    "Kc",
    "4s",
    "6s"
  ],
  "winner": "SrLyce",
  "win_amount": 4.5,
  "sb": 0.01,
  "bb": 0.02,
  "rake": 0.5,
  "raw_text": "Mano n.º 257237911133 de PokerStars:  Hold'em No Limit (0.01 €/0.02 € EUR) - 06-08-2025 18:11:06 CET [06-08-2025 12:11:06 ET]\nMesa \"Atreus\" 6-max El asiento n.º 4 es el botón\nAsiento 1: PrendsCa (2.16 € en fichas) \nAsiento 2: NRules82 (1.71 € en fichas) \nAsiento 3: JENOFONTE73 (2.48 € en fichas) \nAsiento 4: Fharock (2.03 € en fichas) \nAsiento 5: SrLyce (1.90 € en fichas) \nAsiento 6: FishamanReggae (0.69 € en fichas) \nSrLyce: pone la ciega pequeña 0.01 €\nFishamanReggae: pone la ciega grande 0.02 €\n*** CARTAS DE MANO ***\nRepartidas a SrLyce [Kh 8s]\nPrendsCa: sube 0.02 € a 0.04 €\nNRules82: se retira \nJENOFONTE73: se retira \nFharock: se retira \nSrLyce: iguala 0.03 €\nFishamanReggae: se retira \n*** FLOP *** [Kc 4s 6s]\nSrLyce: apuesta 0.03 €\nPrendsCa: se retira \nLa apuesta no igualada (0.03 €) ha sido devuelta a SrLyce\nSrLyce se lleva 0.09 € del bote \nSrLyce: no muestra su mano \n*** RESUMEN ***\nBote total 0.10 € | Comisión 0.01 € \nComunitarias [Kc 4s 6s]\nAsiento 1: PrendsCa se retiró en el Flop\nAsiento 2: NRules82 se retiró antes del Flop (no apostó)\nAsiento 3: JENOFONTE73 se retiró antes del Flop (no apostó)\nAsiento 4: Fharock (botón) se retiró antes del Flop (no apostó)\nAsiento 5: SrLyce (ciega pequeña) recaudó (0.09 €)\nAsiento 6: FishamanReggae (ciega grande) se retiró antes del Flop"
}