{
  "hand_id": "257238578135",
  "date": "06-08-2025 19:11:34",
  "table": "Herculina II",
  "game_type": "holdem",
  "hero": "SrLyce",
  "hero_position": "",
  "hero_cards": [
    "8s",
    "Jh"
  ],
  "stacks": {
    "Alceo27": 100.0,
    "David98X": 177.0,
    "JJer11": 204.5,
    "SrLyce": 95.5,
    "Macklemore0": 100.0,
    "ScarvBlack": 120.5
  },
  "actions": {
    "preflop": [
      "Asiento 1: Alceo27 (2 € en fichas)",
      "Asiento 2: David98X (3.54 € en fichas)",
      "Asiento 3: JJer11 (4.09 € en fichas)",
      "Asiento 4: SrLyce (1.91 € en fichas)",
      "Asiento 5: Macklemore0 (2 € en fichas)",
      "Asiento 6: ScarvBlack (2.41 € en fichas)",
      "David98X: pone la ciega pequeña 0.01 €",
      "JJer11: pone la ciega grande 0.02 €",
      "SrLyce: se retira",
      "Macklemore0: se retira",
      "ScarvBlack: se retira",
      "Alceo27: se retira",
      "David98X: se retira",
      "JJer11: no muestra su mano",
      "Asiento 1: Alceo27 (botón) se retiró antes del Flop (no apostó)",
      "Asiento 2: David98X (ciega pequeña) se retiró antes del Flop",
      "Asiento 3: JJer11 (ciega grande) recaudó (0.02 €)",
      "Asiento 4: SrLyce se retiró antes del Flop (no apostó)",
      "Asiento 5: Macklemore0 se retiró antes del Flop (no apostó)",
      "Asiento 6: ScarvBlack se retiró antes del Flop (no apostó)"
    ],
    "flop": [],
    "turn": [],
    "river": []
  },
  "board": [],
  "winner": "JJer11",
  "win_amount": 1.0,
  "sb": 0.01,
  "bb": 0.02,
  "rake": 0.0,
  "raw_text": "Mano n.º 257238578135 de PokerStars:  Hold'em No Limit (0.01 €/0.02 € EUR) - 06-08-2025 19:11:34 CET [06-08-2025 13:11:34 ET]\nMesa \"Herculina II\" 6-max El asiento n.º 1 es el botón\nAsiento 1: Alceo27 (2 € en fichas) \nAsiento 2: David98X (3.54 € en fichas) \nAsiento 3: JJer11 (4.09 € en fichas) \nAsiento 4: SrLyce (1.91 € en fichas) \nAsiento 5: Macklemore0 (2 € en fichas) \nAsiento 6: ScarvBlack (2.41 € en fichas) \nDavid98X: pone la ciega pequeña 0.01 €\nJJer11: pone la ciega grande 0.02 €\n*** CARTAS DE MANO ***\nRepartidas a SrLyce [8s Jh]\nSrLyce: se retira \nMacklemore0: se retira \nScarvBlack: se retira \nAlceo27: se retira \nDavid98X: se retira \nLa apuesta no igualada (0.01 €) ha sido devuelta a JJer11\nJJer11 se lleva 0.02 € del bote \nJJer11: no muestra su mano \n*** RESUMEN ***\nBote total 0.02 € | Comisión 0 € \nAsiento 1: Alceo27 (botón) se retiró antes del Flop (no apostó)\nAsiento 2: David98X (ciega pequeña) se retiró antes del Flop\nAsiento 3: JJer11 (ciega grande) recaudó (0.02 €)\nAsiento 4: SrLyce se retiró antes del Flop (no apostó)\nAsiento 5: Macklemore0 se retiró antes del Flop (no apostó)\nAsiento 6: ScarvBlack se retiró antes del Flop (no apostó)"
}