{
  "hand_id": "257150470655",
  "date": "30-07-2025 23:44:11",
  "table": "Mizuho",
  "game_type": "holdem",
  "hero": "SrLyce",
  "hero_position": "",
  "hero_cards": [
    "Qc",
    "As"
  ],
  "stacks": {
    "benipoker123": 96.0,
    "SrLyce": 95.0,
    "JstLeonel": 117.0,
    "Ozzy3110": 238.5,
    "toonsy2010": 163.0,
    "mivipkr": 166.5
  },
  "actions": {
    "preflop": [
      "Asiento 1: benipoker123 (1.92 € en fichas)",
      "Asiento 2: SrLyce (1.90 € en fichas)",
      "Asiento 3: JstLeonel (2.34 € en fichas)",
      "Asiento 4: Ozzy3110 (4.77 € en fichas)",
      "Asiento 5: toonsy2010 (3.26 € en fichas)",
      "Asiento 6: mivipkr (3.33 € en fichas)",
      "benipoker123: pone la ciega pequeña 0.01 €",
      "SrLyce: pone la ciega grande 0.02 €",
      "JstLeonel: se retira",
      "Ozzy3110: sube 0.03 € a 0.05 €",
      "toonsy2010: iguala 0.05 €",
      "mivipkr: se retira",
      "benipoker123: se retira",
      "SrLyce: sube 0.05 € a 0.10 €",
      "Ozzy3110: iguala 0.05 €",
      "toonsy2010: iguala 0.05 €"
    ],
    "flop": [
      "SrLyce: pasa",
      "Ozzy3110: apuesta 0.10 €",
      "toonsy2010: iguala 0.10 €",
      "SrLyce: iguala 0.10 €"
    ],
    "turn": [
      "SrLyce: pasa",
      "Ozzy3110: apuesta 0.19 €",
      "toonsy2010: iguala 0.19 €",
      "SrLyce: iguala 0.19 €"
    ],
    "river": [
      "SrLyce: pasa",
      "Ozzy3110: apuesta 0.83 €",
      "toonsy2010: iguala 0.83 €",
      "SrLyce: se retira",
      "Ozzy3110: muestra [Jc Qh] (trío de jotas)",
      "toonsy2010: descarta su mano sin mostrar",
      "Asiento 1: benipoker123 (ciega pequeña) se retiró antes del Flop",
      "Asiento 2: SrLyce (ciega grande) se retiró en el River",
      "Asiento 3: JstLeonel se retiró antes del Flop (no apostó)",
      "Asiento 4: Ozzy3110 muestra [Jc Qh] y ganó (2.67 €) con trío de jotas",
      "Asiento 5: toonsy2010 descartó sin mostrar [Jh 8d]",
      "Asiento 6: mivipkr (botón) se retiró antes del Flop (no apostó)"
    ]
  },
  "board": [
    "5c",
    "Jd",
    "9d",
    "Js",
    "3h"
  ],
  "winner": "Ozzy3110",
  "win_amount": 133.5,
  "sb": 0.01,
  "bb": 0.02,
  "rake": 8.5,
  "raw_text": "Mano n.º 257150470655 de PokerStars:  Hold'em No Limit (0.01 €/0.02 € EUR) - 30-07-2025 23:44:11 CET [30-07-2025 17:44:11 ET]\nMesa \"Mizuho\" 6-max El asiento n.º 6 es el botón\nAsiento 1: benipoker123 (1.92 € en fichas) \nAsiento 2: SrLyce (1.90 € en fichas) \nAsiento 3: JstLeonel (2.34 € en fichas) \nAsiento 4: Ozzy3110 (4.77 € en fichas) \nAsiento 5: toonsy2010 (3.26 € en fichas) \nAsiento 6: mivipkr (3.33 € en fichas) \nbenipoker123: pone la ciega pequeña 0.01 €\nSrLyce: pone la ciega grande 0.02 €\n*** CARTAS DE MANO ***\nRepartidas a SrLyce [Qc As]\nJstLeonel: se retira \nOzzy3110: sube 0.03 € a 0.05 €\ntoonsy2010: iguala 0.05 €\nmivipkr: se retira \nbenipoker123: se retira \nSrLyce: sube 0.05 € a 0.10 €\nOzzy3110: iguala 0.05 €\ntoonsy2010: iguala 0.05 €\n*** FLOP *** [5c Jd 9d]\nSrLyce: pasa \nOzzy3110: apuesta 0.10 €\ntoonsy2010: iguala 0.10 €\nSrLyce: iguala 0.10 €\n*** TURN *** [5c Jd 9d] [Js]\nSrLyce: pasa \nOzzy3110: apuesta 0.19 €\ntoonsy2010: iguala 0.19 €\nSrLyce: iguala 0.19 €\n*** RIVER *** [5c Jd 9d Js] [3h]\nSrLyce: pasa \nOzzy3110: apuesta 0.83 €\ntoonsy2010: iguala 0.83 €\nSrLyce: se retira \n*** SHOW DOWN ***\nOzzy3110: muestra [Jc Qh] (trío de jotas)\ntoonsy2010: descarta su mano sin mostrar \nOzzy3110 se lleva 2.67 € del bote \n*** RESUMEN ***\nBote total 2.84 € | Comisión 0.17 € \nComunitarias [5c Jd 9d Js 3h]\nAsiento 1: benipoker123 (ciega pequeña) se retiró antes del Flop\nAsiento 2: SrLyce (ciega grande) se retiró en el River\nAsiento 3: JstLeonel se retiró antes del Flop (no apostó)\nAsiento 4: Ozzy3110 muestra [Jc Qh] y ganó (2.67 €) con trío de jotas\nAsiento 5: toonsy2010 descartó sin mostrar [Jh 8d]\nAsiento 6: mivipkr (botón) se retiró antes del Flop (no apostó)"
}