{
  "hand_id": "257148878579",
  "date": "30-07-2025 21:50:26",
  "table": "Esclangona",
  "game_type": "holdem",
  "hero": "SrLyce",
  "hero_position": "",
  "hero_cards": [
    "6c",
    "7d"
  ],
  "stacks": {
    "Zorgue1080": 85.0,
    "SrLyce": 159.0,
    "NoahBolete": 100.5,
    "Davdgoni": 106.5,
    "DiaZzZ1": 98.0,
    "berlcht403": 39.0
  },
  "actions": {
    "preflop": [
      "Asiento 1: Zorgue1080 (1.70 € en fichas)",
      "Asiento 2: SrLyce (3.18 € en fichas)",
      "Asiento 3: NoahBolete (2.01 € en fichas)",
      "Asiento 4: Davdgoni (2.13 € en fichas)",
      "Asiento 5: DiaZzZ1 (1.96 € en fichas)",
      "Asiento 6: berlcht403 (0.78 € en fichas)",
      "DiaZzZ1: pone la ciega pequeña 0.01 €",
      "berlcht403: pone la ciega grande 0.02 €",
      "Zorgue1080: se retira",
      "SrLyce: se retira",
      "NoahBolete: sube 0.04 € a 0.06 €",
      "Davdgoni: se retira",
      "DiaZzZ1: se retira",
      "berlcht403: se retira",
      "NoahBolete: no muestra su mano",
      "Asiento 1: Zorgue1080 se retiró antes del Flop (no apostó)",
      "Asiento 2: SrLyce se retiró antes del Flop (no apostó)",
      "Asiento 3: NoahBolete recaudó (0.05 €)",
      "Asiento 4: Davdgoni (botón) se retiró antes del Flop (no apostó)",
      "Asiento 5: DiaZzZ1 (ciega pequeña) se retiró antes del Flop",
      "Asiento 6: berlcht403 (ciega grande) se retiró antes del Flop"
    ],
    "flop": [],
    "turn": [],
    "river": []
  },
  "board": [],
  "winner": "NoahBolete",
  "win_amount": 2.5,
  "sb": 0.01,
  "bb": 0.02,
  "rake": 0.0,
  "raw_text": "Mano n.º 257148878579 de PokerStars:  Hold'em No Limit (0.01 €/0.02 € EUR) - 30-07-2025 21:50:26 CET [30-07-2025 15:50:26 ET]\nMesa \"Esclangona\" 6-max El asiento n.º 4 es el botón\nAsiento 1: Zorgue1080 (1.70 € en fichas) \nAsiento 2: SrLyce (3.18 € en fichas) \nAsiento 3: NoahBolete (2.01 € en fichas) \nAsiento 4: Davdgoni (2.13 € en fichas) \nAsiento 5: DiaZzZ1 (1.96 € en fichas) \nAsiento 6: berlcht403 (0.78 € en fichas) \nDiaZzZ1: pone la ciega pequeña 0.01 €\nberlcht403: pone la ciega grande 0.02 €\n*** CARTAS DE MANO ***\nRepartidas a SrLyce [6c 7d]\nZorgue1080: se retira \nSrLyce: se retira \nNoahBolete: sube 0.04 € a 0.06 €\nDavdgoni: se retira \nDiaZzZ1: se retira \nberlcht403: se retira \nLa apuesta no igualada (0.04 €) ha sido devuelta a NoahBolete\nNoahBolete se lleva 0.05 € del bote \nNoahBolete: no muestra su mano \n*** RESUMEN ***\nBote total 0.05 € | Comisión 0 € \nAsiento 1: Zorgue1080 se retiró antes del Flop (no apostó)\nAsiento 2: SrLyce se retiró antes del Flop (no apostó)\nAsiento 3: NoahBolete recaudó (0.05 €)\nAsiento 4: Davdgoni (botón) se retiró antes del Flop (no apostó)\nAsiento 5: DiaZzZ1 (ciega pequeña) se retiró antes del Flop\nAsiento 6: berlcht403 (ciega grande) se retiró antes del Flop"
}