{
  "hand_id": "257168410294",
  "date": "01-08-2025 11:42:41",
  "table": "Atlas",
  "game_type": "holdem",
  "hero": "SrLyce",
  "hero_position": "",
  "hero_cards": [
    "9d",
    "Ks"
  ],
  "stacks": {
    "SrLyce": 113.0,
    "Fharock": 128.0,
    "ecuinas": 79.5,
    "LxckxStrxkx": 120.5,
    "soy_cule74": 97.0,
    "Akourdideh": 90.5
  },
  "actions": {
    "preflop": [
      "Asiento 1: SrLyce (2.26 € en fichas)",
      "Asiento 2: Fharock (2.56 € en fichas)",
      "Asiento 3: ecuinas (1.59 € en fichas)",
      "Asiento 4: LxckxStrxkx (2.41 € en fichas)",
      "Asiento 5: soy_cule74 (1.94 € en fichas)",
      "Asiento 6: Akourdideh (1.81 € en fichas)",
      "ecuinas: pone la ciega pequeña 0.01 €",
      "LxckxStrxkx: pone la ciega grande 0.02 €",
      "soy_cule74: se retira",
      "Akourdideh: sube 0.04 € a 0.06 €",
      "SrLyce: se retira",
      "Fharock: se retira",
      "ecuinas: se retira",
      "LxckxStrxkx: iguala 0.04 €"
    ],
    "flop": [
      "LxckxStrxkx: pasa",
      "Akourdideh: pasa"
    ],
    "turn": [
      "LxckxStrxkx: apuesta 0.06 €",
      "Akourdideh: iguala 0.06 €"
    ],
    "river": [
      "LxckxStrxkx: apuesta 0.12 €",
      "Akourdideh: se retira",
      "LxckxStrxkx: no muestra su mano",
      "Asiento 1: SrLyce se retiró antes del Flop (no apostó)",
      "Asiento 2: Fharock (botón) se retiró antes del Flop (no apostó)",
      "Asiento 3: ecuinas (ciega pequeña) se retiró antes del Flop",
      "Asiento 4: LxckxStrxkx (ciega grande) recaudó (0.23 €)",
      "Asiento 5: soy_cule74 se retiró antes del Flop (no apostó)",
      "Asiento 6: Akourdideh se retiró en el River"
    ]
  },
  "board": [
    "6c",
    "2h",
    "Ts",
    "8c",
    "4c"
  ],
  "winner": "LxckxStrxkx",
  "win_amount": 11.5,
  "sb": 0.01,
  "bb": 0.02,
  "rake": 1.0,
  "raw_text": "Mano n.º 257168410294 de PokerStars:  Hold'em No Limit (0.01 €/0.02 € EUR) - 01-08-2025 11:42:41 CET [01-08-2025 5:42:41 ET]\nMesa \"Atlas\" 6-max El asiento n.º 2 es el botón\nAsiento 1: SrLyce (2.26 € en fichas) \nAsiento 2: Fharock (2.56 € en fichas) \nAsiento 3: ecuinas (1.59 € en fichas) \nAsiento 4: LxckxStrxkx (2.41 € en fichas) \nAsiento 5: soy_cule74 (1.94 € en fichas) \nAsiento 6: Akourdideh (1.81 € en fichas) \necuinas: pone la ciega pequeña 0.01 €\nLxckxStrxkx: pone la ciega grande 0.02 €\n*** CARTAS DE MANO ***\nRepartidas a SrLyce [9d Ks]\nsoy_cule74: se retira \nAkourdideh: sube 0.04 € a 0.06 €\nSrLyce: se retira \nFharock: se retira \necuinas: se retira \nLxckxStrxkx: iguala 0.04 €\n*** FLOP *** [6c 2h Ts]\nLxckxStrxkx: pasa \nAkourdideh: pasa \n*** TURN *** [6c 2h Ts] [8c]\nLxckxStrxkx: apuesta 0.06 €\nAkourdideh: iguala 0.06 €\n*** RIVER *** [6c 2h Ts 8c] [4c]\nLxckxStrxkx: apuesta 0.12 €\nAkourdideh: se retira \nLa apuesta no igualada (0.12 €) ha sido devuelta a LxckxStrxkx\nLxckxStrxkx se lleva 0.23 € del bote \nLxckxStrxkx: no muestra su mano \n*** RESUMEN ***\nBote total 0.25 € | Comisión 0.02 € \nComunitarias [6c 2h Ts 8c 4c]\nAsiento 1: SrLyce se retiró antes del Flop (no apostó)\nAsiento 2: Fharock (botón) se retiró antes del Flop (no apostó)\nAsiento 3: ecuinas (ciega pequeña) se retiró antes del Flop\nAsiento 4: LxckxStrxkx (ciega grande) recaudó (0.23 €)\nAsiento 5: soy_cule74 se retiró antes del Flop (no apostó)\nAsiento 6: Akourdideh se retiró en el River"
}