{
  "hand_id": "257168332591",
  "date": "01-08-2025 11:28:29",
  "table": "Atlas",
  "game_type": "holdem",
  "hero": "SrLyce",
  "hero_position": "",
  "hero_cards": [
    "4d",
    "Td"
  ],
  "stacks": {
    "erCampos23": 0.0,
    "SrLyce": 105.5,
    "Fharock": 103.0,
    "ecuinas": 93.0,
    "LxckxStrxkx": 113.5,
    "Akourdideh": 118.0
  },
  "actions": {
    "preflop": [
      "Asiento 5: erCampos23 (0 € en fichas) está ausente",
      "Asiento 1: SrLyce (2.11 € en fichas)",
      "Asiento 2: Fharock (2.06 € en fichas)",
      "Asiento 3: ecuinas (1.86 € en fichas)",
      "Asiento 4: LxckxStrxkx (2.27 € en fichas)",
      "Asiento 6: Akourdideh (2.36 € en fichas)",
      "SrLyce: pone la ciega pequeña 0.01 €",
      "Fharock: pone la ciega grande 0.02 €",
      "ecuinas: sube 0.04 € a 0.06 €",
      "LxckxStrxkx: se retira",
      "Akourdideh: iguala 0.06 €",
      "SrLyce: se retira",
      "Fharock: iguala 0.04 €"
    ],
    "flop": [
      "Fharock: pasa",
      "ecuinas: pasa",
      "Akourdideh: pasa"
    ],
    "turn": [
      "Fharock: apuesta 0.18 €",
      "ecuinas: iguala 0.18 €",
      "Akourdideh: se retira"
    ],
    "river": [
      "Fharock: pasa",
      "ecuinas: apuesta 0.22 €",
      "Fharock: se retira",
      "ecuinas: no muestra su mano",
      "Asiento 5: erCampos23",
      "Asiento 1: SrLyce (ciega pequeña) se retiró antes del Flop",
      "Asiento 2: Fharock (ciega grande) se retiró en el River",
      "Asiento 3: ecuinas recaudó (0.52 €)",
      "Asiento 4: LxckxStrxkx se retiró antes del Flop (no apostó)",
      "Asiento 6: Akourdideh (botón) se retiró en el Turn"
    ]
  },
  "board": [
    "3s",
    "2d",
    "Qd",
    "Jd",
    "Ah"
  ],
  "winner": "ecuinas",
  "win_amount": 26.0,
  "sb": 0.01,
  "bb": 0.02,
  "rake": 1.5,
  "raw_text": "Mano n.º 257168332591 de PokerStars:  Hold'em No Limit (0.01 €/0.02 € EUR) - 01-08-2025 11:28:29 CET [01-08-2025 5:28:29 ET]\nMesa \"Atlas\" 6-max El asiento n.º 6 es el botón\nAsiento 5: erCampos23 (0 € en fichas) está ausente\nAsiento 1: SrLyce (2.11 € en fichas) \nAsiento 2: Fharock (2.06 € en fichas) \nAsiento 3: ecuinas (1.86 € en fichas) \nAsiento 4: LxckxStrxkx (2.27 € en fichas) \nAsiento 6: Akourdideh (2.36 € en fichas) \nSrLyce: pone la ciega pequeña 0.01 €\nFharock: pone la ciega grande 0.02 €\n*** CARTAS DE MANO ***\nRepartidas a SrLyce [4d Td]\necuinas: sube 0.04 € a 0.06 €\nLxckxStrxkx: se retira \nerCampos23 deja la mesa\nAkourdideh: iguala 0.06 €\nSrLyce: se retira \nFharock: iguala 0.04 €\n*** FLOP *** [3s 2d Qd]\nFharock: pasa \necuinas: pasa \nAkourdideh: pasa \n*** TURN *** [3s 2d Qd] [Jd]\nFharock: apuesta 0.18 €\necuinas: iguala 0.18 €\nAkourdideh: se retira \n*** RIVER *** [3s 2d Qd Jd] [Ah]\nFharock: pasa \necuinas: apuesta 0.22 €\nFharock: se retira \nLa apuesta no igualada (0.22 €) ha sido devuelta a ecuinas\necuinas se lleva 0.52 € del bote \necuinas: no muestra su mano \n*** RESUMEN ***\nBote total 0.55 € | Comisión 0.03 € \nComunitarias [3s 2d Qd Jd Ah]\nAsiento 5: erCampos23\nAsiento 1: SrLyce (ciega pequeña) se retiró antes del Flop\nAsiento 2: Fharock (ciega grande) se retiró en el River\nAsiento 3: ecuinas recaudó (0.52 €)\nAsiento 4: LxckxStrxkx se retiró antes del Flop (no apostó)\nAsiento 6: Akourdideh (botón) se retiró en el Turn"
}