{
  "hand_id": "257237970394",
  "date": "06-08-2025 18:16:29",
  "table": "Nuwa III",
  "game_type": "holdem",
  "hero": "SrLyce",
  "hero_position": "",
  "hero_cards": [
    "Qc",
    "9s"
  ],
  "stacks": {
    "BuXHexter": 101.0,
    "xododo": 38.0,
    "kcg_rm": 59.5,
    "SrLyce": 147.5,
    "acavada": 103.0
  },
  "actions": {
    "preflop": [
      "Asiento 2: BuXHexter (2.02 € en fichas) está ausente",
      "Asiento 1: xododo (0.76 € en fichas)",
      "Asiento 3: kcg_rm (1.19 € en fichas)",
      "Asiento 4: SrLyce (2.95 € en fichas)",
      "Asiento 5: serviettski(fr) (2 € en fichas)",
      "Asiento 6: acavada (2.06 € en fichas)",
      "SrLyce: pone la ciega pequeña 0.01 €",
      "serviettski(fr): pone la ciega grande 0.02 €",
      "acavada: se retira",
      "xododo: se retira",
      "kcg_rm: se retira",
      "SrLyce: sube 0.03 € a 0.05 €",
      "serviettski(fr): se retira",
      "SrLyce: no muestra su mano",
      "Asiento 2: BuXHexter",
      "Asiento 1: xododo se retiró antes del Flop (no apostó)",
      "Asiento 3: kcg_rm (botón) se retiró antes del Flop (no apostó)",
      "Asiento 4: SrLyce (ciega pequeña) recaudó (0.04 €)",
      "Asiento 5: serviettski(fr) (ciega grande) se retiró antes del Flop",
      "Asiento 6: acavada se retiró antes del Flop (no apostó)"
    ],
    "flop": [],
    "turn": [],
    "river": []
  },
  "board": [],
  "winner": "SrLyce",
  "win_amount": 2.0,
  "sb": 0.01,
  "bb": 0.02,
  "rake": 0.0,
  "raw_text": "Mano n.º 257237970394 de PokerStars:  Hold'em No Limit (0.01 €/0.02 € EUR) - 06-08-2025 18:16:29 CET [06-08-2025 12:16:29 ET]\nMesa \"Nuwa III\" 6-max El asiento n.º 3 es el botón\nAsiento 2: BuXHexter (2.02 € en fichas) está ausente\nAsiento 1: xododo (0.76 € en fichas) \nAsiento 3: kcg_rm (1.19 € en fichas) \nAsiento 4: SrLyce (2.95 € en fichas) \nAsiento 5: serviettski(fr) (2 € en fichas) \nAsiento 6: acavada (2.06 € en fichas) \nSrLyce: pone la ciega pequeña 0.01 €\nserviettski(fr): pone la ciega grande 0.02 €\n*** CARTAS DE MANO ***\nRepartidas a SrLyce [Qc 9s]\nacavada: se retira \nxododo: se retira \nkcg_rm: se retira \nSrLyce: sube 0.03 € a 0.05 €\nserviettski(fr): se retira \nLa apuesta no igualada (0.03 €) ha sido devuelta a SrLyce\nSrLyce se lleva 0.04 € del bote \nSrLyce: no muestra su mano \n*** RESUMEN ***\nBote total 0.04 € | Comisión 0 € \nAsiento 2: BuXHexter\nAsiento 1: xododo se retiró antes del Flop (no apostó)\nAsiento 3: kcg_rm (botón) se retiró antes del Flop (no apostó)\nAsiento 4: SrLyce (ciega pequeña) recaudó (0.04 €)\nAsiento 5: serviettski(fr) (ciega grande) se retiró antes del Flop\nAsiento 6: acavada se retiró antes del Flop (no apostó)"
}