{
  "hand_id": "257214979332",
  "date": "04-08-2025 22:16:42",
  "table": "Anneliese II",
  "game_type": "holdem",
  "hero": "SrLyce",
  "hero_position": "",
  "hero_cards": [
    "Qs",
    "4c"
  ],
  "stacks": {
    "betterrrrrr": 100.0,
    "niyomalo": 104.0,
    "ElManu62": 116.0,
    "SrLyce": 98.5,
    "Mr_Pkr98": 143.0,
    "Spotick": 109.0
  },
  "actions": {
    "preflop": [
      "Asiento 1: betterrrrrr (2 € en fichas)",
      "Asiento 2: niyomalo (2.08 € en fichas)",
      "Asiento 3: ElManu62 (2.32 € en fichas)",
      "Asiento 4: SrLyce (1.97 € en fichas)",
      "Asiento 5: Mr_Pkr98 (2.86 € en fichas)",
      "Asiento 6: Spotick (2.18 € en fichas)",
      "ElManu62: pone la ciega pequeña 0.01 €",
      "SrLyce: pone la ciega grande 0.02 €",
      "Mr_Pkr98: se retira",
      "Spotick: se retira",
      "betterrrrrr: se retira",
      "niyomalo: iguala 0.02 €",
      "ElManu62: iguala 0.01 €",
      "SrLyce: pasa"
    ],
    "flop": [
      "ElManu62: pasa",
      "SrLyce: pasa",
      "niyomalo: pasa"
    ],
    "turn": [
      "ElManu62: pasa",
      "SrLyce: pasa",
      "niyomalo: pasa"
    ],
    "river": [
      "ElManu62: apuesta 0.06 €",
      "SrLyce: se retira",
      "niyomalo: se retira",
      "ElManu62: no muestra su mano",
      "Asiento 1: betterrrrrr se retiró antes del Flop (no apostó)",
      "Asiento 2: niyomalo (botón) se retiró en el River",
      "Asiento 3: ElManu62 (ciega pequeña) recaudó (0.06 €)",
      "Asiento 4: SrLyce (ciega grande) se retiró en el River",
      "Asiento 5: Mr_Pkr98 se retiró antes del Flop (no apostó)",
      "Asiento 6: Spotick se retiró antes del Flop (no apostó)"
    ]
  },
  "board": [
    "5d",
    "6s",
    "5c",
    "8d",
    "Jc"
  ],
  "winner": "ElManu62",
  "win_amount": 3.0,
  "sb": 0.01,
  "bb": 0.02,
  "rake": 0.0,
  "raw_text": "Mano n.º 257214979332 de PokerStars:  Hold'em No Limit (0.01 €/0.02 € EUR) - 04-08-2025 22:16:42 CET [04-08-2025 16:16:42 ET]\nMesa \"Anneliese II\" 6-max El asiento n.º 2 es el botón\nAsiento 1: betterrrrrr (2 € en fichas) \nAsiento 2: niyomalo (2.08 € en fichas) \nAsiento 3: ElManu62 (2.32 € en fichas) \nAsiento 4: SrLyce (1.97 € en fichas) \nAsiento 5: Mr_Pkr98 (2.86 € en fichas) \nAsiento 6: Spotick (2.18 € en fichas) \nElManu62: pone la ciega pequeña 0.01 €\nSrLyce: pone la ciega grande 0.02 €\n*** CARTAS DE MANO ***\nRepartidas a SrLyce [Qs 4c]\nMr_Pkr98: se retira \nSpotick: se retira \nbetterrrrrr: se retira \nniyomalo: iguala 0.02 €\nElManu62: iguala 0.01 €\nSrLyce: pasa \n*** FLOP *** [5d 6s 5c]\nElManu62: pasa \nSrLyce: pasa \nniyomalo: pasa \n*** TURN *** [5d 6s 5c] [8d]\nElManu62: pasa \nSrLyce: pasa \nniyomalo: pasa \n*** RIVER *** [5d 6s 5c 8d] [Jc]\nElManu62: apuesta 0.06 €\nSrLyce: se retira \nniyomalo: se retira \nLa apuesta no igualada (0.06 €) ha sido devuelta a ElManu62\nElManu62 se lleva 0.06 € del bote \nElManu62: no muestra su mano \n*** RESUMEN ***\nBote total 0.06 € | Comisión 0 € \nComunitarias [5d 6s 5c 8d Jc]\nAsiento 1: betterrrrrr se retiró antes del Flop (no apostó)\nAsiento 2: niyomalo (botón) se retiró en el River\nAsiento 3: ElManu62 (ciega pequeña) recaudó (0.06 €)\nAsiento 4: SrLyce (ciega grande) se retiró en el River\nAsiento 5: Mr_Pkr98 se retiró antes del Flop (no apostó)\nAsiento 6: Spotick se retiró antes del Flop (no apostó)"
}