{
  "hand_id": "257215222360",
  "date": "04-08-2025 22:31:58",
  "table": "Aldhafera II",
  "game_type": "holdem",
  "hero": "SrLyce",
  "hero_position": "",
  "hero_cards": [
    "5c",
    "8d"
  ],
  "stacks": {
    "wsx25": 69.0,
    "BudyXXIII": 292.5,
    "SrLyce": 100.0,
    "rhidoxxx": 87.0,
    "jte-ken": 100.0,
    "betterrrrrr": 179.5
  },
  "actions": {
    "preflop": [
      "Asiento 1: wsx25 (1.38 € en fichas)",
      "Asiento 2: BudyXXIII (5.85 € en fichas)",
      "Asiento 3: SrLyce (2 € en fichas)",
      "Asiento 4: rhidoxxx (1.74 € en fichas)",
      "Asiento 5: jte-ken (2 € en fichas)",
      "Asiento 6: betterrrrrr (3.59 € en fichas)",
      "betterrrrrr: pone la ciega pequeña 0.01 €",
      "wsx25: pone la ciega grande 0.02 €",
      "BudyXXIII: sube 0.04 € a 0.06 €",
      "SrLyce: se retira",
      "rhidoxxx: se retira",
      "jte-ken: se retira",
      "betterrrrrr: se retira",
      "wsx25: se retira",
      "BudyXXIII: no muestra su mano",
      "Asiento 1: wsx25 (ciega grande) se retiró antes del Flop",
      "Asiento 2: BudyXXIII recaudó (0.05 €)",
      "Asiento 3: SrLyce se retiró antes del Flop (no apostó)",
      "Asiento 4: rhidoxxx se retiró antes del Flop (no apostó)",
      "Asiento 5: jte-ken (botón) se retiró antes del Flop (no apostó)",
      "Asiento 6: betterrrrrr (ciega pequeña) se retiró antes del Flop"
    ],
    "flop": [],
    "turn": [],
    "river": []
  },
  "board": [],
  "winner": "BudyXXIII",
  "win_amount": 2.5,
  "sb": 0.01,
  "bb": 0.02,
  "rake": 0.0,
  "raw_text": "Mano n.º 257215222360 de PokerStars:  Hold'em No Limit (0.01 €/0.02 € EUR) - 04-08-2025 22:31:58 CET [04-08-2025 16:31:58 ET]\nMesa \"Aldhafera II\" 6-max El asiento n.º 5 es el botón\nAsiento 1: wsx25 (1.38 € en fichas) \nAsiento 2: BudyXXIII (5.85 € en fichas) \nAsiento 3: SrLyce (2 € en fichas) \nAsiento 4: rhidoxxx (1.74 € en fichas) \nAsiento 5: jte-ken (2 € en fichas) \nAsiento 6: betterrrrrr (3.59 € en fichas) \nbetterrrrrr: pone la ciega pequeña 0.01 €\nwsx25: pone la ciega grande 0.02 €\n*** CARTAS DE MANO ***\nRepartidas a SrLyce [5c 8d]\nBudyXXIII: sube 0.04 € a 0.06 €\nSrLyce: se retira \nrhidoxxx: se retira \njte-ken: se retira \nbetterrrrrr: se retira \nwsx25: se retira \nLa apuesta no igualada (0.04 €) ha sido devuelta a BudyXXIII\nBudyXXIII se lleva 0.05 € del bote \nBudyXXIII: no muestra su mano \n*** RESUMEN ***\nBote total 0.05 € | Comisión 0 € \nAsiento 1: wsx25 (ciega grande) se retiró antes del Flop\nAsiento 2: BudyXXIII recaudó (0.05 €)\nAsiento 3: SrLyce se retiró antes del Flop (no apostó)\nAsiento 4: rhidoxxx se retiró antes del Flop (no apostó)\nAsiento 5: jte-ken (botón) se retiró antes del Flop (no apostó)\nAsiento 6: betterrrrrr (ciega pequeña) se retiró antes del Flop"
}