{
  "hand_id": "257150030784",
  "date": "30-07-2025 23:13:31",
  "table": "Gilgamesh",
  "game_type": "holdem",
  "hero": "SrLyce",
  "hero_position": "",
  "hero_cards": [
    "6d",
    "2d"
  ],
  "stacks": {
    "samaritano34": 50.0,
    "riverrrrrrmagic": 126.0,
    "SrLyce": 107.5,
    "Jumby34": 100.0,
    "xapkk": 104.0,
    "Fretzo67500": 94.0
  },
  "actions": {
    "preflop": [
      "Asiento 5: samaritano34 (1 € en fichas) está ausente",
      "Asiento 1: riverrrrrrmagic (2.52 € en fichas)",
      "Asiento 2: SrLyce (2.15 € en fichas)",
      "Asiento 3: Jumby34 (2 € en fichas)",
      "Asiento 4: xapkk (2.08 € en fichas)",
      "Asiento 6: Fretzo67500 (1.88 € en fichas)",
      "Jumby34: pone la ciega pequeña 0.01 €",
      "xapkk: pone la ciega grande 0.02 €",
      "samaritano34: se ausenta",
      "Fretzo67500: se retira",
      "riverrrrrrmagic: se retira",
      "SrLyce: se retira",
      "Jumby34: se retira",
      "xapkk: no muestra su mano",
      "Asiento 5: samaritano34",
      "Asiento 1: riverrrrrrmagic se retiró antes del Flop (no apostó)",
      "Asiento 2: SrLyce (botón) se retiró antes del Flop (no apostó)",
      "Asiento 3: Jumby34 (ciega pequeña) se retiró antes del Flop",
      "Asiento 4: xapkk (ciega grande) recaudó (0.02 €)",
      "Asiento 6: Fretzo67500 se retiró antes del Flop (no apostó)"
    ],
    "flop": [],
    "turn": [],
    "river": []
  },
  "board": [],
  "winner": "xapkk",
  "win_amount": 1.0,
  "sb": 0.01,
  "bb": 0.02,
  "rake": 0.0,
  "raw_text": "Mano n.º 257150030784 de PokerStars:  Hold'em No Limit (0.01 €/0.02 € EUR) - 30-07-2025 23:13:31 CET [30-07-2025 17:13:31 ET]\nMesa \"Gilgamesh\" 6-max El asiento n.º 2 es el botón\nAsiento 5: samaritano34 (1 € en fichas) está ausente\nAsiento 1: riverrrrrrmagic (2.52 € en fichas) \nAsiento 2: SrLyce (2.15 € en fichas) \nAsiento 3: Jumby34 (2 € en fichas) \nAsiento 4: xapkk (2.08 € en fichas) \nAsiento 6: Fretzo67500 (1.88 € en fichas) \nJumby34: pone la ciega pequeña 0.01 €\nxapkk: pone la ciega grande 0.02 €\nsamaritano34: se ausenta \n*** CARTAS DE MANO ***\nRepartidas a SrLyce [6d 2d]\nFretzo67500: se retira \nriverrrrrrmagic: se retira \nSrLyce: se retira \nJumby34: se retira \nLa apuesta no igualada (0.01 €) ha sido devuelta a xapkk\nxapkk se lleva 0.02 € del bote \nxapkk: no muestra su mano \n*** RESUMEN ***\nBote total 0.02 € | Comisión 0 € \nAsiento 5: samaritano34\nAsiento 1: riverrrrrrmagic se retiró antes del Flop (no apostó)\nAsiento 2: SrLyce (botón) se retiró antes del Flop (no apostó)\nAsiento 3: Jumby34 (ciega pequeña) se retiró antes del Flop\nAsiento 4: xapkk (ciega grande) recaudó (0.02 €)\nAsiento 6: Fretzo67500 se retiró antes del Flop (no apostó)"
}