{
  "hand_id": "257149153416",
  "date": "30-07-2025 22:11:48",
  "table": "Sirona",
  "game_type": "holdem",
  "hero": "SrLyce",
  "hero_position": "",
  "hero_cards": [
    "2s",
    "8h"
  ],
  "stacks": {
    "oliverdu70": 186.0,
    "hadhod1976": 40.0,
    "SrLyce": 132.5,
    "Tropki": 100.0,
    "christoph363": 219.0,
    "MitchATP65": 103.0
  },
  "actions": {
    "preflop": [
      "Asiento 4: oliverdu70 (3.72 € en fichas) está ausente",
      "Asiento 5: hadhod1976 (0.80 € en fichas) está ausente",
      "Asiento 1: SrLyce (2.65 € en fichas)",
      "Asiento 2: Tropki (2 € en fichas)",
      "Asiento 3: christoph363 (4.38 € en fichas)",
      "Asiento 6: MitchATP65 (2.06 € en fichas)",
      "christoph363: pone la ciega pequeña 0.01 €",
      "MitchATP65: pone la ciega grande 0.02 €",
      "SrLyce: se retira",
      "Tropki: sube 0.04 € a 0.06 €",
      "christoph363: iguala 0.05 €",
      "MitchATP65: se retira"
    ],
    "flop": [
      "christoph363: apuesta 0.02 €",
      "Tropki: se retira",
      "Asiento 4: oliverdu70",
      "Asiento 5: hadhod1976",
      "Asiento 1: SrLyce se retiró antes del Flop (no apostó)",
      "Asiento 2: Tropki (botón) se retiró en el Flop",
      "Asiento 3: christoph363 (ciega pequeña) recaudó (0.13 €)",
      "Asiento 6: MitchATP65 (ciega grande) se retiró antes del Flop"
    ],
    "turn": [],
    "river": []
  },
  "board": [
    "Kh",
    "Td",
    "7s"
  ],
  "winner": "christoph363",
  "win_amount": 6.5,
  "sb": 0.01,
  "bb": 0.02,
  "rake": 0.5,
  "raw_text": "Mano n.º 257149153416 de PokerStars:  Hold'em No Limit (0.01 €/0.02 € EUR) - 30-07-2025 22:11:48 CET [30-07-2025 16:11:48 ET]\nMesa \"Sirona\" 6-max El asiento n.º 2 es el botón\nAsiento 4: oliverdu70 (3.72 € en fichas) está ausente\nAsiento 5: hadhod1976 (0.80 € en fichas) está ausente\nAsiento 1: SrLyce (2.65 € en fichas) \nAsiento 2: Tropki (2 € en fichas) \nAsiento 3: christoph363 (4.38 € en fichas) \nAsiento 6: MitchATP65 (2.06 € en fichas) \nchristoph363: pone la ciega pequeña 0.01 €\nMitchATP65: pone la ciega grande 0.02 €\n*** CARTAS DE MANO ***\nRepartidas a SrLyce [2s 8h]\nSrLyce: se retira \nTropki: sube 0.04 € a 0.06 €\nchristoph363: iguala 0.05 €\nMitchATP65: se retira \n*** FLOP *** [Kh Td 7s]\nchristoph363: apuesta 0.02 €\nTropki: se retira \nLa apuesta no igualada (0.02 €) ha sido devuelta a christoph363\nchristoph363 se lleva 0.13 € del bote \n*** RESUMEN ***\nBote total 0.14 € | Comisión 0.01 € \nComunitarias [Kh Td 7s]\nAsiento 4: oliverdu70\nAsiento 5: hadhod1976\nAsiento 1: SrLyce se retiró antes del Flop (no apostó)\nAsiento 2: Tropki (botón) se retiró en el Flop\nAsiento 3: christoph363 (ciega pequeña) recaudó (0.13 €)\nAsiento 6: MitchATP65 (ciega grande) se retiró antes del Flop"
}