{
  "hand_id": "257168218277",
  "date": "01-08-2025 11:06:31",
  "table": "Sekanina",
  "game_type": "holdem",
  "hero": "SrLyce",
  "hero_position": "",
  "hero_cards": [
    "4d",
    "6s"
  ],
  "stacks": {
    "practikal_C23": 87.5,
    "Alvii37": 95.0,
    "SrLyce": 103.5,
    "davinci1962": 101.5,
    "Elministrelas": 93.5
  },
  "actions": {
    "preflop": [
      "Asiento 2: practikal_C23 (1.75 € en fichas)",
      "Asiento 3: Alvii37 (1.90 € en fichas)",
      "Asiento 4: SrLyce (2.07 € en fichas)",
      "Asiento 5: davinci1962 (2.03 € en fichas)",
      "Asiento 6: Elministrelas (1.87 € en fichas)",
      "practikal_C23: pone la ciega pequeña 0.01 €",
      "Alvii37: pone la ciega grande 0.02 €",
      "SrLyce: se retira",
      "davinci1962: sube 0.03 € a 0.05 €",
      "Elministrelas: se retira",
      "practikal_C23: iguala 0.04 €",
      "Alvii37: iguala 0.03 €"
    ],
    "flop": [
      "practikal_C23: pasa",
      "Alvii37: pasa",
      "davinci1962: apuesta 0.05 €",
      "practikal_C23: se retira",
      "Alvii37: se retira",
      "davinci1962: no muestra su mano",
      "Asiento 2: practikal_C23 (ciega pequeña) se retiró en el Flop",
      "Asiento 3: Alvii37 (ciega grande) se retiró en el Flop",
      "Asiento 4: SrLyce se retiró antes del Flop (no apostó)",
      "Asiento 5: davinci1962 recaudó (0.14 €)",
      "Asiento 6: Elministrelas (botón) se retiró antes del Flop (no apostó)"
    ],
    "turn": [],
    "river": []
  },
  "board": [
    "5h",
    "Jd",
    "Ah"
  ],
  "winner": "davinci1962",
  "win_amount": 7.0,
  "sb": 0.01,
  "bb": 0.02,
  "rake": 0.5,
  "raw_text": "Mano n.º 257168218277 de PokerStars:  Hold'em No Limit (0.01 €/0.02 € EUR) - 01-08-2025 11:06:31 CET [01-08-2025 5:06:31 ET]\nMesa \"Sekanina\" 6-max El asiento n.º 6 es el botón\nAsiento 2: practikal_C23 (1.75 € en fichas) \nAsiento 3: Alvii37 (1.90 € en fichas) \nAsiento 4: SrLyce (2.07 € en fichas) \nAsiento 5: davinci1962 (2.03 € en fichas) \nAsiento 6: Elministrelas (1.87 € en fichas) \npractikal_C23: pone la ciega pequeña 0.01 €\nAlvii37: pone la ciega grande 0.02 €\n*** CARTAS DE MANO ***\nRepartidas a SrLyce [4d 6s]\nSrLyce: se retira \ndavinci1962: sube 0.03 € a 0.05 €\nElministrelas: se retira \npractikal_C23: iguala 0.04 €\nAlvii37: iguala 0.03 €\n*** FLOP *** [5h Jd Ah]\npractikal_C23: pasa \nAlvii37: pasa \ndavinci1962: apuesta 0.05 €\npractikal_C23: se retira \nAlvii37: se retira \nLa apuesta no igualada (0.05 €) ha sido devuelta a davinci1962\ndavinci1962 se lleva 0.14 € del bote \ndavinci1962: no muestra su mano \n*** RESUMEN ***\nBote total 0.15 € | Comisión 0.01 € \nComunitarias [5h Jd Ah]\nAsiento 2: practikal_C23 (ciega pequeña) se retiró en el Flop\nAsiento 3: Alvii37 (ciega grande) se retiró en el Flop\nAsiento 4: SrLyce se retiró antes del Flop (no apostó)\nAsiento 5: davinci1962 recaudó (0.14 €)\nAsiento 6: Elministrelas (botón) se retiró antes del Flop (no apostó)"
}