{
  "hand_id": "257148916163",
  "date": "30-07-2025 21:53:05",
  "table": "Esclangona",
  "game_type": "holdem",
  "hero": "SrLyce",
  "hero_position": "",
  "hero_cards": [
    "Kc",
    "8d"
  ],
  "stacks": {
    "Zorgue1080": 89.5,
    "SrLyce": 158.0,
    "NoahBolete": 100.5,
    "Davdgoni": 100.0,
    "DiaZzZ1": 105.5,
    "berlcht403": 38.0
  },
  "actions": {
    "preflop": [
      "Asiento 1: Zorgue1080 (1.79 € en fichas)",
      "Asiento 2: SrLyce (3.16 € en fichas)",
      "Asiento 3: NoahBolete (2.01 € en fichas)",
      "Asiento 4: Davdgoni (2 € en fichas)",
      "Asiento 5: DiaZzZ1 (2.11 € en fichas)",
      "Asiento 6: berlcht403 (0.76 € en fichas)",
      "Davdgoni: pone la ciega pequeña 0.01 €",
      "DiaZzZ1: pone la ciega grande 0.02 €",
      "berlcht403: se retira",
      "Zorgue1080: se retira",
      "SrLyce: se retira",
      "NoahBolete: se retira",
      "Davdgoni: se retira",
      "DiaZzZ1: no muestra su mano",
      "Asiento 1: Zorgue1080 se retiró antes del Flop (no apostó)",
      "Asiento 2: SrLyce se retiró antes del Flop (no apostó)",
      "Asiento 3: NoahBolete (botón) se retiró antes del Flop (no apostó)",
      "Asiento 4: Davdgoni (ciega pequeña) se retiró antes del Flop",
      "Asiento 5: DiaZzZ1 (ciega grande) recaudó (0.02 €)",
      "Asiento 6: berlcht403 se retiró antes del Flop (no apostó)"
    ],
    "flop": [],
    "turn": [],
    "river": []
  },
  "board": [],
  "winner": "DiaZzZ1",
  "win_amount": 1.0,
  "sb": 0.01,
  "bb": 0.02,
  "rake": 0.0,
  "raw_text": "Mano n.º 257148916163 de PokerStars:  Hold'em No Limit (0.01 €/0.02 € EUR) - 30-07-2025 21:53:05 CET [30-07-2025 15:53:05 ET]\nMesa \"Esclangona\" 6-max El asiento n.º 3 es el botón\nAsiento 1: Zorgue1080 (1.79 € en fichas) \nAsiento 2: SrLyce (3.16 € en fichas) \nAsiento 3: NoahBolete (2.01 € en fichas) \nAsiento 4: Davdgoni (2 € en fichas) \nAsiento 5: DiaZzZ1 (2.11 € en fichas) \nAsiento 6: berlcht403 (0.76 € en fichas) \nDavdgoni: pone la ciega pequeña 0.01 €\nDiaZzZ1: pone la ciega grande 0.02 €\n*** CARTAS DE MANO ***\nRepartidas a SrLyce [Kc 8d]\nberlcht403: se retira \nZorgue1080: se retira \nSrLyce: se retira \nNoahBolete: se retira \nDavdgoni: se retira \nLa apuesta no igualada (0.01 €) ha sido devuelta a DiaZzZ1\nDiaZzZ1 se lleva 0.02 € del bote \nDiaZzZ1: no muestra su mano \n*** RESUMEN ***\nBote total 0.02 € | Comisión 0 € \nAsiento 1: Zorgue1080 se retiró antes del Flop (no apostó)\nAsiento 2: SrLyce se retiró antes del Flop (no apostó)\nAsiento 3: NoahBolete (botón) se retiró antes del Flop (no apostó)\nAsiento 4: Davdgoni (ciega pequeña) se retiró antes del Flop\nAsiento 5: DiaZzZ1 (ciega grande) recaudó (0.02 €)\nAsiento 6: berlcht403 se retiró antes del Flop (no apostó)"
}