{
  "hand_id": "257238464175",
  "date": "06-08-2025 19:01:43",
  "table": "Herculina II",
  "game_type": "holdem",
  "hero": "SrLyce",
  "hero_position": "",
  "hero_cards": [
    "8d",
    "As"
  ],
  "stacks": {
    "koldipk": 158.0,
    "David98X": 116.5,
    "JJer11": 207.5,
    "SrLyce": 101.5,
    "Macklemore0": 100.0,
    "ScarvBlack": 120.5
  },
  "actions": {
    "preflop": [
      "Asiento 1: koldipk (3.16 € en fichas)",
      "Asiento 2: David98X (2.33 € en fichas)",
      "Asiento 3: JJer11 (4.15 € en fichas)",
      "Asiento 4: SrLyce (2.03 € en fichas)",
      "Asiento 5: Macklemore0 (2 € en fichas)",
      "Asiento 6: ScarvBlack (2.41 € en fichas)",
      "SrLyce: pone la ciega pequeña 0.01 €",
      "Macklemore0: pone la ciega grande 0.02 €",
      "ScarvBlack: se retira",
      "koldipk: sube 0.02 € a 0.04 €",
      "David98X: sube 0.09 € a 0.13 €",
      "JJer11: se retira",
      "SrLyce: se retira",
      "Macklemore0: iguala 0.11 €",
      "koldipk: se retira"
    ],
    "flop": [
      "Macklemore0: pasa",
      "David98X: apuesta 0.10 €",
      "Macklemore0: iguala 0.10 €"
    ],
    "turn": [
      "Macklemore0: pasa",
      "David98X: apuesta 0.38 €",
      "Macklemore0: se retira",
      "David98X: no muestra su mano",
      "Asiento 1: koldipk se retiró antes del Flop",
      "Asiento 2: David98X recaudó (0.48 €)",
      "Asiento 3: JJer11 (botón) se retiró antes del Flop (no apostó)",
      "Asiento 4: SrLyce (ciega pequeña) se retiró antes del Flop",
      "Asiento 5: Macklemore0 (ciega grande) se retiró en el Turn",
      "Asiento 6: ScarvBlack se retiró antes del Flop (no apostó)"
    ],
    "river": []
  },
  "board": [
    "5d",
    "Ad",
    "3d",
    "2c"
  ],
  "winner": "David98X",
  "win_amount": 24.0,
  "sb": 0.01,
  "bb": 0.02,
  "rake": 1.5,
  "raw_text": "Mano n.º 257238464175 de PokerStars:  Hold'em No Limit (0.01 €/0.02 € EUR) - 06-08-2025 19:01:43 CET [06-08-2025 13:01:43 ET]\nMesa \"Herculina II\" 6-max El asiento n.º 3 es el botón\nAsiento 1: koldipk (3.16 € en fichas) \nAsiento 2: David98X (2.33 € en fichas) \nAsiento 3: JJer11 (4.15 € en fichas) \nAsiento 4: SrLyce (2.03 € en fichas) \nAsiento 5: Macklemore0 (2 € en fichas) \nAsiento 6: ScarvBlack (2.41 € en fichas) \nSrLyce: pone la ciega pequeña 0.01 €\nMacklemore0: pone la ciega grande 0.02 €\n*** CARTAS DE MANO ***\nRepartidas a SrLyce [8d As]\nScarvBlack: se retira \nkoldipk: sube 0.02 € a 0.04 €\nDavid98X: sube 0.09 € a 0.13 €\nJJer11: se retira \nSrLyce: se retira \nMacklemore0: iguala 0.11 €\nkoldipk: se retira \n*** FLOP *** [5d Ad 3d]\nMacklemore0: pasa \nDavid98X: apuesta 0.10 €\nMacklemore0: iguala 0.10 €\n*** TURN *** [5d Ad 3d] [2c]\nMacklemore0: pasa \nDavid98X: apuesta 0.38 €\nMacklemore0: se retira \nLa apuesta no igualada (0.38 €) ha sido devuelta a David98X\nDavid98X se lleva 0.48 € del bote \nDavid98X: no muestra su mano \n*** RESUMEN ***\nBote total 0.51 € | Comisión 0.03 € \nComunitarias [5d Ad 3d 2c]\nAsiento 1: koldipk se retiró antes del Flop\nAsiento 2: David98X recaudó (0.48 €)\nAsiento 3: JJer11 (botón) se retiró antes del Flop (no apostó)\nAsiento 4: SrLyce (ciega pequeña) se retiró antes del Flop\nAsiento 5: Macklemore0 (ciega grande) se retiró en el Turn\nAsiento 6: ScarvBlack se retiró antes del Flop (no apostó)"
}