{
  "hand_id": "257168250089",
  "date": "01-08-2025 11:12:44",
  "table": "Atlas",
  "game_type": "holdem",
  "hero": "SrLyce",
  "hero_position": "",
  "hero_cards": [
    "2h",
    "9h"
  ],
  "stacks": {
    "ecuinas": 100.0,
    "SrLyce": 100.0
  },
  "actions": {
    "preflop": [
      "﻿Mano n.º 257168250089 de PokerStars:  Hold'em No Limit (0.01 €/0.02 € EUR) - 01-08-2025 11:12:44 CET [01-08-2025 5:12:44 ET]",
      "Asiento 2: ecuinas (2 € en fichas)",
      "Asiento 3: SrLyce (2 € en fichas)",
      "ecuinas: pone la ciega pequeña 0.01 €",
      "SrLyce: pone la ciega grande 0.02 €",
      "ecuinas: sube 0.04 € a 0.06 €",
      "SrLyce: se retira",
      "ecuinas: no muestra su mano",
      "Asiento 2: ecuinas (botón) (ciega pequeña) recaudó (0.04 €)",
      "Asiento 3: SrLyce (ciega grande) se retiró antes del Flop"
    ],
    "flop": [],
    "turn": [],
    "river": []
  },
  "board": [],
  "winner": "ecuinas",
  "win_amount": 2.0,
  "sb": 0.01,
  "bb": 0.02,
  "rake": 0.0,
  "raw_text": "﻿Mano n.º 257168250089 de PokerStars:  Hold'em No Limit (0.01 €/0.02 € EUR) - 01-08-2025 11:12:44 CET [01-08-2025 5:12:44 ET]\nMesa \"Atlas\" 6-max El asiento n.º 2 es el botón\nAsiento 2: ecuinas (2 € en fichas) \nAsiento 3: SrLyce (2 € en fichas) \necuinas: pone la ciega pequeña 0.01 €\nSrLyce: pone la ciega grande 0.02 €\n*** CARTAS DE MANO ***\nRepartidas a SrLyce [2h 9h]\necuinas: sube 0.04 € a 0.06 €\nSrLyce: se retira \nLa apuesta no igualada (0.04 €) ha sido devuelta a ecuinas\necuinas se lleva 0.04 € del bote \necuinas: no muestra su mano \n*** RESUMEN ***\nBote total 0.04 € | Comisión 0 € \nAsiento 2: ecuinas (botón) (ciega pequeña) recaudó (0.04 €)\nAsiento 3: SrLyce (ciega grande) se retiró antes del Flop"
}