{
  "hand_id": "257150486600",
  "date": "30-07-2025 23:45:21",
  "table": "Martha",
  "game_type": "holdem",
  "hero": "SrLyce",
  "hero_position": "",
  "hero_cards": [
    "2c",
    "Qd"
  ],
  "stacks": {
    "mivipkr": 105.0,
    "NovacaineZxc": 117.0,
    "BudyXXIII": 113.5,
    "Sigiilo": 102.5,
    "SrLyce": 100.5,
    "alexfw300": 100.5
  },
  "actions": {
    "preflop": [
      "Asiento 1: mivipkr (2.10 € en fichas)",
      "Asiento 2: NovacaineZxc (2.34 € en fichas)",
      "Asiento 3: BudyXXIII (2.27 € en fichas)",
      "Asiento 4: Sigiilo (2.05 € en fichas)",
      "Asiento 5: SrLyce (2.01 € en fichas)",
      "Asiento 6: alexfw300 (2.01 € en fichas)",
      "mivipkr: pone la ciega pequeña 0.01 €",
      "NovacaineZxc: pone la ciega grande 0.02 €",
      "BudyXXIII: se retira",
      "Sigiilo: se retira",
      "SrLyce: se retira",
      "alexfw300: se retira",
      "mivipkr: se retira",
      "NovacaineZxc: no muestra su mano",
      "Asiento 1: mivipkr (ciega pequeña) se retiró antes del Flop",
      "Asiento 2: NovacaineZxc (ciega grande) recaudó (0.02 €)",
      "Asiento 3: BudyXXIII se retiró antes del Flop (no apostó)",
      "Asiento 4: Sigiilo se retiró antes del Flop (no apostó)",
      "Asiento 5: SrLyce se retiró antes del Flop (no apostó)",
      "Asiento 6: alexfw300 (botón) se retiró antes del Flop (no apostó)"
    ],
    "flop": [],
    "turn": [],
    "river": []
  },
  "board": [],
  "winner": "NovacaineZxc",
  "win_amount": 1.0,
  "sb": 0.01,
  "bb": 0.02,
  "rake": 0.0,
  "raw_text": "Mano n.º 257150486600 de PokerStars:  Hold'em No Limit (0.01 €/0.02 € EUR) - 30-07-2025 23:45:21 CET [30-07-2025 17:45:21 ET]\nMesa \"Martha\" 6-max El asiento n.º 6 es el botón\nAsiento 1: mivipkr (2.10 € en fichas) \nAsiento 2: NovacaineZxc (2.34 € en fichas) \nAsiento 3: BudyXXIII (2.27 € en fichas) \nAsiento 4: Sigiilo (2.05 € en fichas) \nAsiento 5: SrLyce (2.01 € en fichas) \nAsiento 6: alexfw300 (2.01 € en fichas) \nmivipkr: pone la ciega pequeña 0.01 €\nNovacaineZxc: pone la ciega grande 0.02 €\n*** CARTAS DE MANO ***\nRepartidas a SrLyce [2c Qd]\nBudyXXIII: se retira \nSigiilo: se retira \nSrLyce: se retira \nalexfw300: se retira \nmivipkr: se retira \nLa apuesta no igualada (0.01 €) ha sido devuelta a NovacaineZxc\nNovacaineZxc se lleva 0.02 € del bote \nNovacaineZxc: no muestra su mano \n*** RESUMEN ***\nBote total 0.02 € | Comisión 0 € \nAsiento 1: mivipkr (ciega pequeña) se retiró antes del Flop\nAsiento 2: NovacaineZxc (ciega grande) recaudó (0.02 €)\nAsiento 3: BudyXXIII se retiró antes del Flop (no apostó)\nAsiento 4: Sigiilo se retiró antes del Flop (no apostó)\nAsiento 5: SrLyce se retiró antes del Flop (no apostó)\nAsiento 6: alexfw300 (botón) se retiró antes del Flop (no apostó)"
}