{
  "hand_id": "257237630303",
  "date": "06-08-2025 17:42:50",
  "table": "Kale III",
  "game_type": "holdem",
  "hero": "SrLyce",
  "hero_position": "",
  "hero_cards": [
    "Kd",
    "3c"
  ],
  "stacks": {
    "x__Nest__x": 91.0,
    "SrLyce": 117.0,
    "Dracoline000": 116.5,
    "jeffounet33": 95.0,
    "Begoton": 101.0,
    "juanmemol": 102.5
  },
  "actions": {
    "preflop": [
      "Asiento 1: x__Nest__x (1.82 € en fichas)",
      "Asiento 2: SrLyce (2.34 € en fichas)",
      "Asiento 3: Dracoline000 (2.33 € en fichas)",
      "Asiento 4: jeffounet33 (1.90 € en fichas)",
      "Asiento 5: Begoton (2.02 € en fichas)",
      "Asiento 6: juanmemol (2.05 € en fichas)",
      "Dracoline000: pone la ciega pequeña 0.01 €",
      "jeffounet33: pone la ciega grande 0.02 €",
      "Begoton: sube 0.04 € a 0.06 €",
      "juanmemol: se retira",
      "x__Nest__x: se retira",
      "SrLyce: se retira",
      "Dracoline000: se retira",
      "jeffounet33: se retira",
      "Begoton: no muestra su mano",
      "Asiento 1: x__Nest__x se retiró antes del Flop (no apostó)",
      "Asiento 2: SrLyce (botón) se retiró antes del Flop (no apostó)",
      "Asiento 3: Dracoline000 (ciega pequeña) se retiró antes del Flop",
      "Asiento 4: jeffounet33 (ciega grande) se retiró antes del Flop",
      "Asiento 5: Begoton recaudó (0.05 €)",
      "Asiento 6: juanmemol se retiró antes del Flop (no apostó)"
    ],
    "flop": [],
    "turn": [],
    "river": []
  },
  "board": [],
  "winner": "Begoton",
  "win_amount": 2.5,
  "sb": 0.01,
  "bb": 0.02,
  "rake": 0.0,
  "raw_text": "Mano n.º 257237630303 de PokerStars:  Hold'em No Limit (0.01 €/0.02 € EUR) - 06-08-2025 17:42:50 CET [06-08-2025 11:42:50 ET]\nMesa \"Kale III\" 6-max El asiento n.º 2 es el botón\nAsiento 1: x__Nest__x (1.82 € en fichas) \nAsiento 2: SrLyce (2.34 € en fichas) \nAsiento 3: Dracoline000 (2.33 € en fichas) \nAsiento 4: jeffounet33 (1.90 € en fichas) \nAsiento 5: Begoton (2.02 € en fichas) \nAsiento 6: juanmemol (2.05 € en fichas) \nDracoline000: pone la ciega pequeña 0.01 €\njeffounet33: pone la ciega grande 0.02 €\n*** CARTAS DE MANO ***\nRepartidas a SrLyce [Kd 3c]\nBegoton: sube 0.04 € a 0.06 €\njuanmemol: se retira \nx__Nest__x: se retira \nSrLyce: se retira \nDracoline000: se retira \njeffounet33: se retira \nLa apuesta no igualada (0.04 €) ha sido devuelta a Begoton\nBegoton se lleva 0.05 € del bote \nBegoton: no muestra su mano \n*** RESUMEN ***\nBote total 0.05 € | Comisión 0 € \nAsiento 1: x__Nest__x se retiró antes del Flop (no apostó)\nAsiento 2: SrLyce (botón) se retiró antes del Flop (no apostó)\nAsiento 3: Dracoline000 (ciega pequeña) se retiró antes del Flop\nAsiento 4: jeffounet33 (ciega grande) se retiró antes del Flop\nAsiento 5: Begoton recaudó (0.05 €)\nAsiento 6: juanmemol se retiró antes del Flop (no apostó)"
}