{
  "hand_id": "257237819436",
  "date": "06-08-2025 18:02:24",
  "table": "Atreus",
  "game_type": "holdem",
  "hero": "SrLyce",
  "hero_position": "",
  "hero_cards": [
    "6s",
    "4c"
  ],
  "stacks": {
    "PrendsCa": 112.0,
    "NRules82": 43.0,
    "JENOFONTE73": 123.0,
    "JGDOBLAS": 201.5,
    "SrLyce": 27.0,
    "FishamanReggae": 48.0
  },
  "actions": {
    "preflop": [
      "Asiento 1: PrendsCa (2.24 € en fichas)",
      "Asiento 2: NRules82 (0.86 € en fichas)",
      "Asiento 3: JENOFONTE73 (2.46 € en fichas)",
      "Asiento 4: JGDOBLAS (4.03 € en fichas)",
      "Asiento 5: SrLyce (0.54 € en fichas)",
      "Asiento 6: FishamanReggae (0.96 € en fichas)",
      "FishamanReggae: pone la ciega pequeña 0.01 €",
      "PrendsCa: pone la ciega grande 0.02 €",
      "NRules82: se retira",
      "JENOFONTE73: se retira",
      "JGDOBLAS: se retira",
      "SrLyce: se retira",
      "FishamanReggae: iguala 0.01 €",
      "PrendsCa: pasa"
    ],
    "flop": [
      "FishamanReggae: pasa",
      "PrendsCa: pasa"
    ],
    "turn": [
      "FishamanReggae: pasa",
      "PrendsCa: pasa"
    ],
    "river": [
      "FishamanReggae: pasa",
      "PrendsCa: pasa",
      "FishamanReggae: muestra [6h 8c] (pareja de jotas)",
      "PrendsCa: muestra [2h 7c] (pareja de jotas)",
      "Asiento 1: PrendsCa (ciega grande) muestra [2h 7c] y ganó (0.02 €) con pareja de jotas",
      "Asiento 2: NRules82 se retiró antes del Flop (no apostó)",
      "Asiento 3: JENOFONTE73 se retiró antes del Flop (no apostó)",
      "Asiento 4: JGDOBLAS se retiró antes del Flop (no apostó)",
      "Asiento 5: SrLyce (botón) se retiró antes del Flop (no apostó)",
      "Asiento 6: FishamanReggae (ciega pequeña) muestra [6h 8c] y ganó (0.02 €) con pareja de jotas"
    ]
  },
  "board": [
    "Qc",
    "Th",
    "Ad",
    "Jd",
    "Js"
  ],
  "winner": "FishamanReggae",
  "win_amount": 1.0,
  "sb": 0.01,
  "bb": 0.02,
  "rake": 0.0,
  "raw_text": "Mano n.º 257237819436 de PokerStars:  Hold'em No Limit (0.01 €/0.02 € EUR) - 06-08-2025 18:02:24 CET [06-08-2025 12:02:24 ET]\nMesa \"Atreus\" 6-max El asiento n.º 5 es el botón\nAsiento 1: PrendsCa (2.24 € en fichas) \nAsiento 2: NRules82 (0.86 € en fichas) \nAsiento 3: JENOFONTE73 (2.46 € en fichas) \nAsiento 4: JGDOBLAS (4.03 € en fichas) \nAsiento 5: SrLyce (0.54 € en fichas) \nAsiento 6: FishamanReggae (0.96 € en fichas) \nFishamanReggae: pone la ciega pequeña 0.01 €\nPrendsCa: pone la ciega grande 0.02 €\n*** CARTAS DE MANO ***\nRepartidas a SrLyce [6s 4c]\nNRules82: se retira \nJENOFONTE73: se retira \nJGDOBLAS: se retira \nSrLyce: se retira \nFishamanReggae: iguala 0.01 €\nPrendsCa: pasa \n*** FLOP *** [Qc Th Ad]\nFishamanReggae: pasa \nPrendsCa: pasa \n*** TURN *** [Qc Th Ad] [Jd]\nFishamanReggae: pasa \nPrendsCa: pasa \n*** RIVER *** [Qc Th Ad Jd] [Js]\nFishamanReggae: pasa \nPrendsCa: pasa \n*** SHOW DOWN ***\nFishamanReggae: muestra [6h 8c] (pareja de jotas)\nPrendsCa: muestra [2h 7c] (pareja de jotas)\nFishamanReggae se lleva 0.02 € del bote \nPrendsCa se lleva 0.02 € del bote \n*** RESUMEN ***\nBote total 0.04 € | Comisión 0 € \nComunitarias [Qc Th Ad Jd Js]\nAsiento 1: PrendsCa (ciega grande) muestra [2h 7c] y ganó (0.02 €) con pareja de jotas\nAsiento 2: NRules82 se retiró antes del Flop (no apostó)\nAsiento 3: JENOFONTE73 se retiró antes del Flop (no apostó)\nAsiento 4: JGDOBLAS se retiró antes del Flop (no apostó)\nAsiento 5: SrLyce (botón) se retiró antes del Flop (no apostó)\nAsiento 6: FishamanReggae (ciega pequeña) muestra [6h 8c] y ganó (0.02 €) con pareja de jotas"
}