{
  "hand_id": "257237037798",
  "date": "06-08-2025 17:33:50",
  "table": "Vanadis II",
  "game_type": "holdem",
  "hero": "SrLyce",
  "hero_position": "",
  "hero_cards": [
    "8c",
    "3c"
  ],
  "stacks": {
    "sarabiagar": 98.0,
    "SrLyce": 97.5,
    "djrojas9": 100.0,
    "noreihh": 149.0,
    "chordewman": 108.0,
    "idigon": 176.0
  },
  "actions": {
    "preflop": [
      "Asiento 5: sarabiagar (1.96 € en fichas) está ausente",
      "Asiento 1: SrLyce (1.95 € en fichas)",
      "Asiento 2: djrojas9 (2 € en fichas)",
      "Asiento 3: noreihh (2.98 € en fichas)",
      "Asiento 4: chordewman (2.16 € en fichas)",
      "Asiento 6: idigon (3.52 € en fichas)",
      "SrLyce: pone la ciega pequeña 0.01 €",
      "djrojas9: pone la ciega grande 0.02 €",
      "sarabiagar: se ausenta",
      "noreihh: se retira",
      "chordewman: sube 0.03 € a 0.05 €",
      "idigon: iguala 0.05 €",
      "SrLyce: se retira",
      "djrojas9: se retira"
    ],
    "flop": [
      "chordewman: apuesta 0.03 €",
      "idigon: se retira",
      "chordewman: no muestra su mano",
      "Asiento 5: sarabiagar",
      "Asiento 1: SrLyce (ciega pequeña) se retiró antes del Flop",
      "Asiento 2: djrojas9 (ciega grande) se retiró antes del Flop",
      "Asiento 3: noreihh se retiró antes del Flop (no apostó)",
      "Asiento 4: chordewman recaudó (0.12 €)",
      "Asiento 6: idigon (botón) se retiró en el Flop"
    ],
    "turn": [],
    "river": []
  },
  "board": [
    "Qc",
    "Ks",
    "Qd"
  ],
  "winner": "chordewman",
  "win_amount": 6.0,
  "sb": 0.01,
  "bb": 0.02,
  "rake": 0.5,
  "raw_text": "Mano n.º 257237037798 de PokerStars:  Hold'em No Limit (0.01 €/0.02 € EUR) - 06-08-2025 17:33:50 CET [06-08-2025 11:33:50 ET]\nMesa \"Vanadis II\" 6-max El asiento n.º 6 es el botón\nAsiento 5: sarabiagar (1.96 € en fichas) está ausente\nAsiento 1: SrLyce (1.95 € en fichas) \nAsiento 2: djrojas9 (2 € en fichas) \nAsiento 3: noreihh (2.98 € en fichas) \nAsiento 4: chordewman (2.16 € en fichas) \nAsiento 6: idigon (3.52 € en fichas) \nSrLyce: pone la ciega pequeña 0.01 €\ndjrojas9: pone la ciega grande 0.02 €\nsarabiagar: se ausenta \n*** CARTAS DE MANO ***\nRepartidas a SrLyce [8c 3c]\nnoreihh: se retira \nchordewman: sube 0.03 € a 0.05 €\nidigon: iguala 0.05 €\nSrLyce: se retira \ndjrojas9: se retira \n*** FLOP *** [Qc Ks Qd]\nchordewman: apuesta 0.03 €\nidigon: se retira \nLa apuesta no igualada (0.03 €) ha sido devuelta a chordewman\nchordewman se lleva 0.12 € del bote \nchordewman: no muestra su mano \n*** RESUMEN ***\nBote total 0.13 € | Comisión 0.01 € \nComunitarias [Qc Ks Qd]\nAsiento 5: sarabiagar\nAsiento 1: SrLyce (ciega pequeña) se retiró antes del Flop\nAsiento 2: djrojas9 (ciega grande) se retiró antes del Flop\nAsiento 3: noreihh se retiró antes del Flop (no apostó)\nAsiento 4: chordewman recaudó (0.12 €)\nAsiento 6: idigon (botón) se retiró en el Flop"
}