{
  "hand_id": "257238583624",
  "date": "06-08-2025 19:12:01",
  "table": "Leonteus",
  "game_type": "holdem",
  "hero": "SrLyce",
  "hero_position": "",
  "hero_cards": [
    "9d",
    "Ks"
  ],
  "stacks": {
    "durahimovic": 284.5,
    "BuXHexter": 145.5,
    "practikal_C23": 47.0,
    "davinci1962": 132.0,
    "Andark47": 186.5,
    "SrLyce": 109.0
  },
  "actions": {
    "preflop": [
      "Asiento 2: durahimovic (5.69 € en fichas) está ausente",
      "Asiento 4: BuXHexter (2.91 € en fichas) está ausente",
      "Asiento 1: practikal_C23 (0.94 € en fichas)",
      "Asiento 3: davinci1962 (2.64 € en fichas)",
      "Asiento 5: Andark47 (3.73 € en fichas)",
      "Asiento 6: SrLyce (2.18 € en fichas)",
      "davinci1962: pone la ciega pequeña 0.01 €",
      "Andark47: pone la ciega grande 0.02 €",
      "SrLyce: se retira",
      "practikal_C23: iguala 0.02 €",
      "davinci1962: se retira",
      "Andark47: pasa"
    ],
    "flop": [
      "Andark47: pasa",
      "practikal_C23: apuesta 0.02 €",
      "Andark47: se retira",
      "Asiento 2: durahimovic",
      "Asiento 4: BuXHexter",
      "Asiento 1: practikal_C23 (botón) recaudó (0.05 €)",
      "Asiento 3: davinci1962 (ciega pequeña) se retiró antes del Flop",
      "Asiento 5: Andark47 (ciega grande) se retiró en el Flop",
      "Asiento 6: SrLyce se retiró antes del Flop (no apostó)"
    ],
    "turn": [],
    "river": []
  },
  "board": [
    "As",
    "2s",
    "Kd"
  ],
  "winner": "practikal_C23",
  "win_amount": 2.5,
  "sb": 0.01,
  "bb": 0.02,
  "rake": 0.0,
  "raw_text": "Mano n.º 257238583624 de PokerStars:  Hold'em No Limit (0.01 €/0.02 € EUR) - 06-08-2025 19:12:01 CET [06-08-2025 13:12:01 ET]\nMesa \"Leonteus\" 6-max El asiento n.º 1 es el botón\nAsiento 2: durahimovic (5.69 € en fichas) está ausente\nAsiento 4: BuXHexter (2.91 € en fichas) está ausente\nAsiento 1: practikal_C23 (0.94 € en fichas) \nAsiento 3: davinci1962 (2.64 € en fichas) \nAsiento 5: Andark47 (3.73 € en fichas) \nAsiento 6: SrLyce (2.18 € en fichas) \ndavinci1962: pone la ciega pequeña 0.01 €\nAndark47: pone la ciega grande 0.02 €\n*** CARTAS DE MANO ***\nRepartidas a SrLyce [9d Ks]\nSrLyce: se retira \npractikal_C23: iguala 0.02 €\ndavinci1962: se retira \nAndark47: pasa \n*** FLOP *** [As 2s Kd]\nAndark47: pasa \npractikal_C23: apuesta 0.02 €\ndurahimovic deja la mesa\nAndark47: se retira \nLa apuesta no igualada (0.02 €) ha sido devuelta a practikal_C23\npractikal_C23 se lleva 0.05 € del bote \n*** RESUMEN ***\nBote total 0.05 € | Comisión 0 € \nComunitarias [As 2s Kd]\nAsiento 2: durahimovic\nAsiento 4: BuXHexter\nAsiento 1: practikal_C23 (botón) recaudó (0.05 €)\nAsiento 3: davinci1962 (ciega pequeña) se retiró antes del Flop\nAsiento 5: Andark47 (ciega grande) se retiró en el Flop\nAsiento 6: SrLyce se retiró antes del Flop (no apostó)"
}