{
  "hand_id": "257215337420",
  "date": "04-08-2025 22:39:04",
  "table": "Aldhafera II",
  "game_type": "holdem",
  "hero": "SrLyce",
  "hero_position": "",
  "hero_cards": [
    "Ts",
    "9c"
  ],
  "stacks": {
    "BudyXXIII": 292.5,
    "betterrrrrr": 171.5,
    "wsx25": 51.5,
    "SrLyce": 179.0,
    "rhidoxxx": 105.0,
    "jte-ken": 119.0
  },
  "actions": {
    "preflop": [
      "Asiento 2: BudyXXIII (5.85 € en fichas) está ausente",
      "Asiento 6: betterrrrrr (3.43 € en fichas) está ausente",
      "Asiento 1: wsx25 (1.03 € en fichas)",
      "Asiento 3: SrLyce (3.58 € en fichas)",
      "Asiento 4: rhidoxxx (2.10 € en fichas)",
      "Asiento 5: jte-ken (2.38 € en fichas)",
      "rhidoxxx: pone la ciega pequeña 0.01 €",
      "jte-ken: pone la ciega grande 0.02 €",
      "wsx25: se retira",
      "SrLyce: sube 0.04 € a 0.06 €",
      "rhidoxxx: se retira",
      "jte-ken: sube 2.32 € a 2.38 € y está all-in",
      "SrLyce: se retira",
      "Asiento 2: BudyXXIII",
      "Asiento 6: betterrrrrr",
      "Asiento 1: wsx25 se retiró antes del Flop (no apostó)",
      "Asiento 3: SrLyce (botón) se retiró antes del Flop",
      "Asiento 4: rhidoxxx (ciega pequeña) se retiró antes del Flop",
      "Asiento 5: jte-ken (ciega grande) recaudó (0.13 €)"
    ],
    "flop": [],
    "turn": [],
    "river": []
  },
  "board": [],
  "winner": "jte-ken",
  "win_amount": 6.5,
  "sb": 0.01,
  "bb": 0.02,
  "rake": 0.0,
  "raw_text": "Mano n.º 257215337420 de PokerStars:  Hold'em No Limit (0.01 €/0.02 € EUR) - 04-08-2025 22:39:04 CET [04-08-2025 16:39:04 ET]\nMesa \"Aldhafera II\" 6-max El asiento n.º 3 es el botón\nAsiento 2: BudyXXIII (5.85 € en fichas) está ausente\nAsiento 6: betterrrrrr (3.43 € en fichas) está ausente\nAsiento 1: wsx25 (1.03 € en fichas) \nAsiento 3: SrLyce (3.58 € en fichas) \nAsiento 4: rhidoxxx (2.10 € en fichas) \nAsiento 5: jte-ken (2.38 € en fichas) \nrhidoxxx: pone la ciega pequeña 0.01 €\njte-ken: pone la ciega grande 0.02 €\n*** CARTAS DE MANO ***\nRepartidas a SrLyce [Ts 9c]\nwsx25: se retira \nSrLyce: sube 0.04 € a 0.06 €\nrhidoxxx: se retira \njte-ken: sube 2.32 € a 2.38 € y está all-in\nSrLyce: se retira \nLa apuesta no igualada (2.32 €) ha sido devuelta a jte-ken\njte-ken se lleva 0.13 € del bote \n*** RESUMEN ***\nBote total 0.13 € | Comisión 0 € \nAsiento 2: BudyXXIII\nAsiento 6: betterrrrrr\nAsiento 1: wsx25 se retiró antes del Flop (no apostó)\nAsiento 3: SrLyce (botón) se retiró antes del Flop\nAsiento 4: rhidoxxx (ciega pequeña) se retiró antes del Flop\nAsiento 5: jte-ken (ciega grande) recaudó (0.13 €)"
}