{
  "hand_id": "257238110830",
  "date": "06-08-2025 18:29:02",
  "table": "Atreus",
  "game_type": "holdem",
  "hero": "SrLyce",
  "hero_position": "",
  "hero_cards": [
    "9h",
    "Ah"
  ],
  "stacks": {
    "PrendsCa": 102.5,
    "NRules82": 32.5,
    "JENOFONTE73": 167.5,
    "Fharock": 90.5,
    "SrLyce": 121.0,
    "FishamanReggae": 33.5
  },
  "actions": {
    "preflop": [
      "Asiento 1: PrendsCa (2.05 € en fichas)",
      "Asiento 2: NRules82 (0.65 € en fichas)",
      "Asiento 3: JENOFONTE73 (3.35 € en fichas)",
      "Asiento 4: Fharock (1.81 € en fichas)",
      "Asiento 5: SrLyce (2.42 € en fichas)",
      "Asiento 6: FishamanReggae (0.67 € en fichas)",
      "JENOFONTE73: pone la ciega pequeña 0.01 €",
      "Fharock: pone la ciega grande 0.02 €",
      "SrLyce: sube 0.03 € a 0.05 €",
      "FishamanReggae: iguala 0.05 €",
      "PrendsCa: se retira",
      "NRules82: iguala 0.05 €",
      "JENOFONTE73: se retira",
      "Fharock: se retira"
    ],
    "flop": [
      "SrLyce: pasa",
      "FishamanReggae: pasa",
      "NRules82: pasa"
    ],
    "turn": [
      "SrLyce: apuesta 0.06 €",
      "FishamanReggae: se retira",
      "NRules82: se retira",
      "SrLyce: no muestra su mano",
      "Asiento 1: PrendsCa se retiró antes del Flop (no apostó)",
      "Asiento 2: NRules82 (botón) se retiró en el Turn",
      "Asiento 3: JENOFONTE73 (ciega pequeña) se retiró antes del Flop",
      "Asiento 4: Fharock (ciega grande) se retiró antes del Flop",
      "Asiento 5: SrLyce recaudó (0.17 €)",
      "Asiento 6: FishamanReggae se retiró en el Turn"
    ],
    "river": []
  },
  "board": [
    "Ks",
    "Qd",
    "4d",
    "3s"
  ],
  "winner": "SrLyce",
  "win_amount": 8.5,
  "sb": 0.01,
  "bb": 0.02,
  "rake": 0.5,
  "raw_text": "Mano n.º 257238110830 de PokerStars:  Hold'em No Limit (0.01 €/0.02 € EUR) - 06-08-2025 18:29:02 CET [06-08-2025 12:29:02 ET]\nMesa \"Atreus\" 6-max El asiento n.º 2 es el botón\nAsiento 1: PrendsCa (2.05 € en fichas) \nAsiento 2: NRules82 (0.65 € en fichas) \nAsiento 3: JENOFONTE73 (3.35 € en fichas) \nAsiento 4: Fharock (1.81 € en fichas) \nAsiento 5: SrLyce (2.42 € en fichas) \nAsiento 6: FishamanReggae (0.67 € en fichas) \nJENOFONTE73: pone la ciega pequeña 0.01 €\nFharock: pone la ciega grande 0.02 €\n*** CARTAS DE MANO ***\nRepartidas a SrLyce [9h Ah]\nSrLyce: sube 0.03 € a 0.05 €\nFishamanReggae: iguala 0.05 €\nPrendsCa: se retira \nNRules82: iguala 0.05 €\nJENOFONTE73: se retira \nFharock: se retira \n*** FLOP *** [Ks Qd 4d]\nSrLyce: pasa \nFishamanReggae: pasa \nNRules82: pasa \n*** TURN *** [Ks Qd 4d] [3s]\nSrLyce: apuesta 0.06 €\nFishamanReggae: se retira \nNRules82: se retira \nLa apuesta no igualada (0.06 €) ha sido devuelta a SrLyce\nSrLyce se lleva 0.17 € del bote \nSrLyce: no muestra su mano \n*** RESUMEN ***\nBote total 0.18 € | Comisión 0.01 € \nComunitarias [Ks Qd 4d 3s]\nAsiento 1: PrendsCa se retiró antes del Flop (no apostó)\nAsiento 2: NRules82 (botón) se retiró en el Turn\nAsiento 3: JENOFONTE73 (ciega pequeña) se retiró antes del Flop\nAsiento 4: Fharock (ciega grande) se retiró antes del Flop\nAsiento 5: SrLyce recaudó (0.17 €)\nAsiento 6: FishamanReggae se retiró en el Turn"
}