{
  "hand_id": "257237763206",
  "date": "06-08-2025 17:55:43",
  "table": "Virtus",
  "game_type": "holdem",
  "hero": "SrLyce",
  "hero_position": "",
  "hero_cards": [
    "9s",
    "9h"
  ],
  "stacks": {
    "Kingzilla87": 169.5,
    "SrLyce": 109.5,
    "pullup0": 38.0,
    "JGDOBLAS": 101.0,
    "don.corle": 141.5,
    "rudik34385": 78.0
  },
  "actions": {
    "preflop": [
      "Asiento 1: Kingzilla87 (3.39 € en fichas) está ausente",
      "Asiento 2: SrLyce (2.19 € en fichas)",
      "Asiento 3: pullup0 (0.76 € en fichas)",
      "Asiento 4: JGDOBLAS (2.02 € en fichas)",
      "Asiento 5: don.corle (2.83 € en fichas)",
      "Asiento 6: rudik34385 (1.56 € en fichas)",
      "pullup0: pone la ciega pequeña 0.01 €",
      "JGDOBLAS: pone la ciega grande 0.02 €",
      "don.corle: se retira",
      "rudik34385: iguala 0.02 €",
      "SrLyce: sube 0.06 € a 0.08 €",
      "pullup0: se retira",
      "JGDOBLAS: se retira",
      "rudik34385: iguala 0.06 €"
    ],
    "flop": [
      "rudik34385: apuesta 0.18 €",
      "SrLyce: iguala 0.18 €"
    ],
    "turn": [
      "rudik34385: apuesta 0.52 €",
      "SrLyce: se retira",
      "Asiento 1: Kingzilla87",
      "Asiento 2: SrLyce (botón) se retiró en el Turn",
      "Asiento 3: pullup0 (ciega pequeña) se retiró antes del Flop",
      "Asiento 4: JGDOBLAS (ciega grande) se retiró antes del Flop",
      "Asiento 5: don.corle se retiró antes del Flop (no apostó)",
      "Asiento 6: rudik34385 recaudó (0.52 €)"
    ],
    "river": []
  },
  "board": [
    "7h",
    "As",
    "6s",
    "Kh"
  ],
  "winner": "rudik34385",
  "win_amount": 26.0,
  "sb": 0.01,
  "bb": 0.02,
  "rake": 1.5,
  "raw_text": "Mano n.º 257237763206 de PokerStars:  Hold'em No Limit (0.01 €/0.02 € EUR) - 06-08-2025 17:55:43 CET [06-08-2025 11:55:43 ET]\nMesa \"Virtus\" 6-max El asiento n.º 2 es el botón\nAsiento 1: Kingzilla87 (3.39 € en fichas) está ausente\nAsiento 2: SrLyce (2.19 € en fichas) \nAsiento 3: pullup0 (0.76 € en fichas) \nAsiento 4: JGDOBLAS (2.02 € en fichas) \nAsiento 5: don.corle (2.83 € en fichas) \nAsiento 6: rudik34385 (1.56 € en fichas) \npullup0: pone la ciega pequeña 0.01 €\nJGDOBLAS: pone la ciega grande 0.02 €\n*** CARTAS DE MANO ***\nRepartidas a SrLyce [9s 9h]\ndon.corle: se retira \nrudik34385: iguala 0.02 €\nSrLyce: sube 0.06 € a 0.08 €\npullup0: se retira \nJGDOBLAS: se retira \nrudik34385: iguala 0.06 €\n*** FLOP *** [7h As 6s]\nrudik34385: apuesta 0.18 €\nSrLyce: iguala 0.18 €\n*** TURN *** [7h As 6s] [Kh]\nrudik34385: apuesta 0.52 €\nSrLyce: se retira \nLa apuesta no igualada (0.52 €) ha sido devuelta a rudik34385\nrudik34385 se lleva 0.52 € del bote \n*** RESUMEN ***\nBote total 0.55 € | Comisión 0.03 € \nComunitarias [7h As 6s Kh]\nAsiento 1: Kingzilla87\nAsiento 2: SrLyce (botón) se retiró en el Turn\nAsiento 3: pullup0 (ciega pequeña) se retiró antes del Flop\nAsiento 4: JGDOBLAS (ciega grande) se retiró antes del Flop\nAsiento 5: don.corle se retiró antes del Flop (no apostó)\nAsiento 6: rudik34385 recaudó (0.52 €)"
}