{
  "hand_id": "257149866161",
  "date": "30-07-2025 23:02:15",
  "table": "Gilgamesh",
  "game_type": "holdem",
  "hero": "SrLyce",
  "hero_position": "",
  "hero_cards": [
    "4h",
    "5c"
  ],
  "stacks": {
    "riverrrrrrmagic": 115.5,
    "SrLyce": 99.0,
    "Jumby34": 112.0,
    "Fluxy123": 110.5,
    "cbo54": 82.0,
    "Fretzo67500": 112.0
  },
  "actions": {
    "preflop": [
      "Asiento 1: riverrrrrrmagic (2.31 € en fichas)",
      "Asiento 2: SrLyce (1.98 € en fichas)",
      "Asiento 3: Jumby34 (2.24 € en fichas)",
      "Asiento 4: Fluxy123 (2.21 € en fichas)",
      "Asiento 5: cbo54 (1.64 € en fichas)",
      "Asiento 6: Fretzo67500 (2.24 € en fichas)",
      "cbo54: pone la ciega pequeña 0.01 €",
      "Fretzo67500: pone la ciega grande 0.02 €",
      "riverrrrrrmagic: iguala 0.02 €",
      "SrLyce: se retira",
      "Jumby34: se retira",
      "Fluxy123: se retira",
      "cbo54: iguala 0.01 €",
      "Fretzo67500: sube 0.06 € a 0.08 €",
      "riverrrrrrmagic: se retira",
      "cbo54: se retira",
      "Asiento 1: riverrrrrrmagic se retiró antes del Flop",
      "Asiento 2: SrLyce se retiró antes del Flop (no apostó)",
      "Asiento 3: Jumby34 se retiró antes del Flop (no apostó)",
      "Asiento 4: Fluxy123 (botón) se retiró antes del Flop (no apostó)",
      "Asiento 5: cbo54 (ciega pequeña) se retiró antes del Flop",
      "Asiento 6: Fretzo67500 (ciega grande) recaudó (0.06 €)"
    ],
    "flop": [],
    "turn": [],
    "river": []
  },
  "board": [],
  "winner": "Fretzo67500",
  "win_amount": 3.0,
  "sb": 0.01,
  "bb": 0.02,
  "rake": 0.0,
  "raw_text": "Mano n.º 257149866161 de PokerStars:  Hold'em No Limit (0.01 €/0.02 € EUR) - 30-07-2025 23:02:15 CET [30-07-2025 17:02:15 ET]\nMesa \"Gilgamesh\" 6-max El asiento n.º 4 es el botón\nAsiento 1: riverrrrrrmagic (2.31 € en fichas) \nAsiento 2: SrLyce (1.98 € en fichas) \nAsiento 3: Jumby34 (2.24 € en fichas) \nAsiento 4: Fluxy123 (2.21 € en fichas) \nAsiento 5: cbo54 (1.64 € en fichas) \nAsiento 6: Fretzo67500 (2.24 € en fichas) \ncbo54: pone la ciega pequeña 0.01 €\nFretzo67500: pone la ciega grande 0.02 €\n*** CARTAS DE MANO ***\nRepartidas a SrLyce [4h 5c]\nriverrrrrrmagic: iguala 0.02 €\nSrLyce: se retira \nJumby34: se retira \nFluxy123: se retira \ncbo54: iguala 0.01 €\nFretzo67500: sube 0.06 € a 0.08 €\nriverrrrrrmagic: se retira \ncbo54: se retira \nLa apuesta no igualada (0.06 €) ha sido devuelta a Fretzo67500\nFretzo67500 se lleva 0.06 € del bote \n*** RESUMEN ***\nBote total 0.06 € | Comisión 0 € \nAsiento 1: riverrrrrrmagic se retiró antes del Flop\nAsiento 2: SrLyce se retiró antes del Flop (no apostó)\nAsiento 3: Jumby34 se retiró antes del Flop (no apostó)\nAsiento 4: Fluxy123 (botón) se retiró antes del Flop (no apostó)\nAsiento 5: cbo54 (ciega pequeña) se retiró antes del Flop\nAsiento 6: Fretzo67500 (ciega grande) recaudó (0.06 €)"
}