{
  "hand_id": "257149869248",
  "date": "30-07-2025 23:02:28",
  "table": "Lobelia",
  "game_type": "holdem",
  "hero": "SrLyce",
  "hero_position": "",
  "hero_cards": [
    "As",
    "6s"
  ],
  "stacks": {
    "LeVbks": 95.0,
    "fcis666": 60.5,
    "Dlaguancha": 66.0,
    "SrLyce": 111.0,
    "riverluck444": 76.5,
    "Kiffou39": 50.0
  },
  "actions": {
    "preflop": [
      "Asiento 1: LeVbks (1.90 € en fichas)",
      "Asiento 2: fcis666 (1.21 € en fichas)",
      "Asiento 3: Dlaguancha (1.32 € en fichas)",
      "Asiento 4: SrLyce (2.22 € en fichas)",
      "Asiento 5: riverluck444 (1.53 € en fichas)",
      "Asiento 6: Kiffou39 (1 € en fichas)",
      "riverluck444: pone la ciega pequeña 0.01 €",
      "Kiffou39: pone la ciega grande 0.02 €",
      "LeVbks: se retira",
      "fcis666: se retira",
      "Dlaguancha: iguala 0.02 €",
      "SrLyce: sube 0.04 € a 0.06 €",
      "riverluck444: iguala 0.05 €",
      "Kiffou39: se retira",
      "Dlaguancha: iguala 0.04 €"
    ],
    "flop": [
      "riverluck444: pasa",
      "Dlaguancha: pasa",
      "SrLyce: pasa"
    ],
    "turn": [
      "riverluck444: pasa",
      "Dlaguancha: pasa",
      "SrLyce: pasa"
    ],
    "river": [
      "riverluck444: pasa",
      "Dlaguancha: pasa",
      "SrLyce: pasa",
      "riverluck444: muestra [Ks Js] (pareja de cincos)",
      "Dlaguancha: descarta su mano sin mostrar",
      "SrLyce: muestra [As 6s] (doble pareja, seises y cincos)",
      "Asiento 1: LeVbks se retiró antes del Flop (no apostó)",
      "Asiento 2: fcis666 se retiró antes del Flop (no apostó)",
      "Asiento 3: Dlaguancha descartó sin mostrar [Ts Jd]",
      "Asiento 4: SrLyce (botón) muestra [As 6s] y ganó (0.19 €) con doble pareja, seises y cincos",
      "Asiento 5: riverluck444 (ciega pequeña) muestra [Ks Js] y perdió con pareja de cincos",
      "Asiento 6: Kiffou39 (ciega grande) se retiró antes del Flop"
    ]
  },
  "board": [
    "9s",
    "5c",
    "6d",
    "Qs",
    "5d"
  ],
  "winner": "SrLyce",
  "win_amount": 9.5,
  "sb": 0.01,
  "bb": 0.02,
  "rake": 0.5,
  "raw_text": "Mano n.º 257149869248 de PokerStars:  Hold'em No Limit (0.01 €/0.02 € EUR) - 30-07-2025 23:02:28 CET [30-07-2025 17:02:28 ET]\nMesa \"Lobelia\" 6-max El asiento n.º 4 es el botón\nAsiento 1: LeVbks (1.90 € en fichas) \nAsiento 2: fcis666 (1.21 € en fichas) \nAsiento 3: Dlaguancha (1.32 € en fichas) \nAsiento 4: SrLyce (2.22 € en fichas) \nAsiento 5: riverluck444 (1.53 € en fichas) \nAsiento 6: Kiffou39 (1 € en fichas) \nriverluck444: pone la ciega pequeña 0.01 €\nKiffou39: pone la ciega grande 0.02 €\n*** CARTAS DE MANO ***\nRepartidas a SrLyce [As 6s]\nLeVbks: se retira \nfcis666: se retira \nDlaguancha: iguala 0.02 €\nSrLyce: sube 0.04 € a 0.06 €\nriverluck444: iguala 0.05 €\nKiffou39: se retira \nDlaguancha: iguala 0.04 €\n*** FLOP *** [9s 5c 6d]\nriverluck444: pasa \nDlaguancha: pasa \nSrLyce: pasa \n*** TURN *** [9s 5c 6d] [Qs]\nriverluck444: pasa \nDlaguancha: pasa \nSrLyce: pasa \n*** RIVER *** [9s 5c 6d Qs] [5d]\nriverluck444: pasa \nDlaguancha: pasa \nSrLyce: pasa \n*** SHOW DOWN ***\nriverluck444: muestra [Ks Js] (pareja de cincos)\nDlaguancha: descarta su mano sin mostrar \nSrLyce: muestra [As 6s] (doble pareja, seises y cincos)\nSrLyce se lleva 0.19 € del bote \n*** RESUMEN ***\nBote total 0.20 € | Comisión 0.01 € \nComunitarias [9s 5c 6d Qs 5d]\nAsiento 1: LeVbks se retiró antes del Flop (no apostó)\nAsiento 2: fcis666 se retiró antes del Flop (no apostó)\nAsiento 3: Dlaguancha descartó sin mostrar [Ts Jd]\nAsiento 4: SrLyce (botón) muestra [As 6s] y ganó (0.19 €) con doble pareja, seises y cincos\nAsiento 5: riverluck444 (ciega pequeña) muestra [Ks Js] y perdió con pareja de cincos\nAsiento 6: Kiffou39 (ciega grande) se retiró antes del Flop"
}