{
  "hand_id": "257168349955",
  "date": "01-08-2025 11:31:41",
  "table": "Atlas",
  "game_type": "holdem",
  "hero": "SrLyce",
  "hero_position": "",
  "hero_cards": [
    "Ah",
    "4s"
  ],
  "stacks": {
    "SrLyce": 88.0,
    "Fharock": 89.0,
    "ecuinas": 104.0,
    "LxckxStrxkx": 113.5,
    "soy_cule74": 120.5,
    "Akourdideh": 114.0
  },
  "actions": {
    "preflop": [
      "Asiento 1: SrLyce (1.76 € en fichas)",
      "Asiento 2: Fharock (1.78 € en fichas)",
      "Asiento 3: ecuinas (2.08 € en fichas)",
      "Asiento 4: LxckxStrxkx (2.27 € en fichas)",
      "Asiento 5: soy_cule74 (2.41 € en fichas)",
      "Asiento 6: Akourdideh (2.28 € en fichas)",
      "Akourdideh: pone la ciega pequeña 0.01 €",
      "SrLyce: pone la ciega grande 0.02 €",
      "Fharock: se retira",
      "ecuinas: se retira",
      "LxckxStrxkx: se retira",
      "soy_cule74: se retira",
      "Akourdideh: sube 0.04 € a 0.06 €",
      "SrLyce: iguala 0.04 €"
    ],
    "flop": [
      "Akourdideh: pasa",
      "SrLyce: apuesta 0.06 €",
      "Akourdideh: iguala 0.06 €"
    ],
    "turn": [
      "Akourdideh: pasa",
      "SrLyce: apuesta 0.14 €",
      "Akourdideh: se retira",
      "SrLyce: no muestra su mano",
      "Asiento 1: SrLyce (ciega grande) recaudó (0.23 €)",
      "Asiento 2: Fharock se retiró antes del Flop (no apostó)",
      "Asiento 3: ecuinas se retiró antes del Flop (no apostó)",
      "Asiento 4: LxckxStrxkx se retiró antes del Flop (no apostó)",
      "Asiento 5: soy_cule74 (botón) se retiró antes del Flop (no apostó)",
      "Asiento 6: Akourdideh (ciega pequeña) se retiró en el Turn"
    ],
    "river": []
  },
  "board": [
    "4d",
    "6h",
    "4c",
    "7d"
  ],
  "winner": "SrLyce",
  "win_amount": 11.5,
  "sb": 0.01,
  "bb": 0.02,
  "rake": 0.5,
  "raw_text": "Mano n.º 257168349955 de PokerStars:  Hold'em No Limit (0.01 €/0.02 € EUR) - 01-08-2025 11:31:41 CET [01-08-2025 5:31:41 ET]\nMesa \"Atlas\" 6-max El asiento n.º 5 es el botón\nAsiento 1: SrLyce (1.76 € en fichas) \nAsiento 2: Fharock (1.78 € en fichas) \nAsiento 3: ecuinas (2.08 € en fichas) \nAsiento 4: LxckxStrxkx (2.27 € en fichas) \nAsiento 5: soy_cule74 (2.41 € en fichas) \nAsiento 6: Akourdideh (2.28 € en fichas) \nAkourdideh: pone la ciega pequeña 0.01 €\nSrLyce: pone la ciega grande 0.02 €\n*** CARTAS DE MANO ***\nRepartidas a SrLyce [Ah 4s]\nFharock: se retira \necuinas: se retira \nLxckxStrxkx: se retira \nsoy_cule74: se retira \nAkourdideh: sube 0.04 € a 0.06 €\nSrLyce: iguala 0.04 €\n*** FLOP *** [4d 6h 4c]\nAkourdideh: pasa \nSrLyce: apuesta 0.06 €\nAkourdideh: iguala 0.06 €\n*** TURN *** [4d 6h 4c] [7d]\nAkourdideh: pasa \nSrLyce: apuesta 0.14 €\nAkourdideh: se retira \nLa apuesta no igualada (0.14 €) ha sido devuelta a SrLyce\nSrLyce se lleva 0.23 € del bote \nSrLyce: no muestra su mano \n*** RESUMEN ***\nBote total 0.24 € | Comisión 0.01 € \nComunitarias [4d 6h 4c 7d]\nAsiento 1: SrLyce (ciega grande) recaudó (0.23 €)\nAsiento 2: Fharock se retiró antes del Flop (no apostó)\nAsiento 3: ecuinas se retiró antes del Flop (no apostó)\nAsiento 4: LxckxStrxkx se retiró antes del Flop (no apostó)\nAsiento 5: soy_cule74 (botón) se retiró antes del Flop (no apostó)\nAsiento 6: Akourdideh (ciega pequeña) se retiró en el Turn"
}