{
  "hand_id": "257168282369",
  "date": "01-08-2025 11:19:03",
  "table": "Atlas",
  "game_type": "holdem",
  "hero": "SrLyce",
  "hero_position": "",
  "hero_cards": [
    "5c",
    "9d"
  ],
  "stacks": {
    "SrLyce": 94.5,
    "Fharock": 92.0,
    "ecuinas": 97.0,
    "LxckxStrxkx": 100.0,
    "erCampos23": 42.0,
    "Akourdideh": 116.5
  },
  "actions": {
    "preflop": [
      "Asiento 1: SrLyce (1.89 € en fichas)",
      "Asiento 2: Fharock (1.84 € en fichas)",
      "Asiento 3: ecuinas (1.94 € en fichas)",
      "Asiento 4: LxckxStrxkx (2 € en fichas)",
      "Asiento 5: erCampos23 (0.84 € en fichas)",
      "Asiento 6: Akourdideh (2.33 € en fichas)",
      "Akourdideh: pone la ciega pequeña 0.01 €",
      "SrLyce: pone la ciega grande 0.02 €",
      "Fharock: se retira",
      "ecuinas: sube 0.04 € a 0.06 €",
      "LxckxStrxkx: se retira",
      "erCampos23: se retira",
      "Akourdideh: se retira",
      "SrLyce: se retira",
      "ecuinas: no muestra su mano",
      "Asiento 1: SrLyce (ciega grande) se retiró antes del Flop",
      "Asiento 2: Fharock se retiró antes del Flop (no apostó)",
      "Asiento 3: ecuinas recaudó (0.05 €)",
      "Asiento 4: LxckxStrxkx se retiró antes del Flop (no apostó)",
      "Asiento 5: erCampos23 (botón) se retiró antes del Flop (no apostó)",
      "Asiento 6: Akourdideh (ciega pequeña) se retiró antes del Flop"
    ],
    "flop": [],
    "turn": [],
    "river": []
  },
  "board": [],
  "winner": "ecuinas",
  "win_amount": 2.5,
  "sb": 0.01,
  "bb": 0.02,
  "rake": 0.0,
  "raw_text": "Mano n.º 257168282369 de PokerStars:  Hold'em No Limit (0.01 €/0.02 € EUR) - 01-08-2025 11:19:03 CET [01-08-2025 5:19:03 ET]\nMesa \"Atlas\" 6-max El asiento n.º 5 es el botón\nAsiento 1: SrLyce (1.89 € en fichas) \nAsiento 2: Fharock (1.84 € en fichas) \nAsiento 3: ecuinas (1.94 € en fichas) \nAsiento 4: LxckxStrxkx (2 € en fichas) \nAsiento 5: erCampos23 (0.84 € en fichas) \nAsiento 6: Akourdideh (2.33 € en fichas) \nAkourdideh: pone la ciega pequeña 0.01 €\nSrLyce: pone la ciega grande 0.02 €\n*** CARTAS DE MANO ***\nRepartidas a SrLyce [5c 9d]\nFharock: se retira \necuinas: sube 0.04 € a 0.06 €\nLxckxStrxkx: se retira \nerCampos23: se retira \nAkourdideh: se retira \nSrLyce: se retira \nLa apuesta no igualada (0.04 €) ha sido devuelta a ecuinas\necuinas se lleva 0.05 € del bote \necuinas: no muestra su mano \n*** RESUMEN ***\nBote total 0.05 € | Comisión 0 € \nAsiento 1: SrLyce (ciega grande) se retiró antes del Flop\nAsiento 2: Fharock se retiró antes del Flop (no apostó)\nAsiento 3: ecuinas recaudó (0.05 €)\nAsiento 4: LxckxStrxkx se retiró antes del Flop (no apostó)\nAsiento 5: erCampos23 (botón) se retiró antes del Flop (no apostó)\nAsiento 6: Akourdideh (ciega pequeña) se retiró antes del Flop"
}