{
  "hand_id": "257215153402",
  "date": "04-08-2025 22:27:41",
  "table": "Aldhafera II",
  "game_type": "holdem",
  "hero": "SrLyce",
  "hero_position": "",
  "hero_cards": [
    "Ks",
    "6c"
  ],
  "stacks": {
    "wsx25": 93.5,
    "BudyXXIII": 294.0,
    "SrLyce": 95.5,
    "rhidoxxx": 65.5,
    "jte-ken": 110.0,
    "betterrrrrr": 173.0
  },
  "actions": {
    "preflop": [
      "Asiento 1: wsx25 (1.87 € en fichas)",
      "Asiento 2: BudyXXIII (5.88 € en fichas)",
      "Asiento 3: SrLyce (1.91 € en fichas)",
      "Asiento 4: rhidoxxx (1.31 € en fichas)",
      "Asiento 5: jte-ken (2.20 € en fichas)",
      "Asiento 6: betterrrrrr (3.46 € en fichas)",
      "rhidoxxx: pone la ciega pequeña 0.01 €",
      "jte-ken: pone la ciega grande 0.02 €",
      "betterrrrrr: se retira",
      "wsx25: se retira",
      "BudyXXIII: se retira",
      "SrLyce: sube 0.04 € a 0.06 €",
      "rhidoxxx: se retira",
      "jte-ken: se retira",
      "SrLyce: no muestra su mano",
      "Asiento 1: wsx25 se retiró antes del Flop (no apostó)",
      "Asiento 2: BudyXXIII se retiró antes del Flop (no apostó)",
      "Asiento 3: SrLyce (botón) recaudó (0.05 €)",
      "Asiento 4: rhidoxxx (ciega pequeña) se retiró antes del Flop",
      "Asiento 5: jte-ken (ciega grande) se retiró antes del Flop",
      "Asiento 6: betterrrrrr se retiró antes del Flop (no apostó)"
    ],
    "flop": [],
    "turn": [],
    "river": []
  },
  "board": [],
  "winner": "SrLyce",
  "win_amount": 2.5,
  "sb": 0.01,
  "bb": 0.02,
  "rake": 0.0,
  "raw_text": "Mano n.º 257215153402 de PokerStars:  Hold'em No Limit (0.01 €/0.02 € EUR) - 04-08-2025 22:27:41 CET [04-08-2025 16:27:41 ET]\nMesa \"Aldhafera II\" 6-max El asiento n.º 3 es el botón\nAsiento 1: wsx25 (1.87 € en fichas) \nAsiento 2: BudyXXIII (5.88 € en fichas) \nAsiento 3: SrLyce (1.91 € en fichas) \nAsiento 4: rhidoxxx (1.31 € en fichas) \nAsiento 5: jte-ken (2.20 € en fichas) \nAsiento 6: betterrrrrr (3.46 € en fichas) \nrhidoxxx: pone la ciega pequeña 0.01 €\njte-ken: pone la ciega grande 0.02 €\n*** CARTAS DE MANO ***\nRepartidas a SrLyce [Ks 6c]\nbetterrrrrr: se retira \nwsx25: se retira \nBudyXXIII: se retira \nSrLyce: sube 0.04 € a 0.06 €\nrhidoxxx: se retira \njte-ken: se retira \nLa apuesta no igualada (0.04 €) ha sido devuelta a SrLyce\nSrLyce se lleva 0.05 € del bote \nSrLyce: no muestra su mano \n*** RESUMEN ***\nBote total 0.05 € | Comisión 0 € \nAsiento 1: wsx25 se retiró antes del Flop (no apostó)\nAsiento 2: BudyXXIII se retiró antes del Flop (no apostó)\nAsiento 3: SrLyce (botón) recaudó (0.05 €)\nAsiento 4: rhidoxxx (ciega pequeña) se retiró antes del Flop\nAsiento 5: jte-ken (ciega grande) se retiró antes del Flop\nAsiento 6: betterrrrrr se retiró antes del Flop (no apostó)"
}