{
  "hand_id": "257189994406",
  "date": "03-08-2025 1:00:31",
  "table": "Polydoros II",
  "game_type": "holdem",
  "hero": "SrLyce",
  "hero_position": "",
  "hero_cards": [
    "4d",
    "9s"
  ],
  "stacks": {
    "etiz870": 0.0,
    "SrLyce": 144.5,
    "djulkk421": 80.0
  },
  "actions": {
    "preflop": [
      "Asiento 5: etiz870 (0 € en fichas) está ausente",
      "Asiento 4: SrLyce (2.89 € en fichas)",
      "Asiento 6: djulkk421 (1.60 € en fichas)",
      "SrLyce: pone la ciega pequeña 0.01 €",
      "djulkk421: pone la ciega grande 0.02 €",
      "SrLyce: se retira",
      "Asiento 5: etiz870",
      "Asiento 4: SrLyce (botón) (ciega pequeña) se retiró antes del Flop",
      "Asiento 6: djulkk421 (ciega grande) recaudó (0.02 €)"
    ],
    "flop": [],
    "turn": [],
    "river": []
  },
  "board": [],
  "winner": "djulkk421",
  "win_amount": 1.0,
  "sb": 0.01,
  "bb": 0.02,
  "rake": 0.0,
  "raw_text": "Mano n.º 257189994406 de PokerStars:  Hold'em No Limit (0.01 €/0.02 € EUR) - 03-08-2025 1:00:31 CET [02-08-2025 19:00:31 ET]\nMesa \"Polydoros II\" 6-max El asiento n.º 4 es el botón\nAsiento 5: etiz870 (0 € en fichas) está ausente\nAsiento 4: SrLyce (2.89 € en fichas) \nAsiento 6: djulkk421 (1.60 € en fichas) \nSrLyce: pone la ciega pequeña 0.01 €\ndjulkk421: pone la ciega grande 0.02 €\n*** CARTAS DE MANO ***\nRepartidas a SrLyce [4d 9s]\nSrLyce: se retira \nLa apuesta no igualada (0.01 €) ha sido devuelta a djulkk421\ndjulkk421 se lleva 0.02 € del bote \n*** RESUMEN ***\nBote total 0.02 € | Comisión 0 € \nAsiento 5: etiz870\nAsiento 4: SrLyce (botón) (ciega pequeña) se retiró antes del Flop\nAsiento 6: djulkk421 (ciega grande) recaudó (0.02 €)"
}