{
  "hand_id": "257168362301",
  "date": "01-08-2025 11:33:57",
  "table": "Jupiter",
  "game_type": "holdem",
  "hero": "SrLyce",
  "hero_position": "",
  "hero_cards": [
    "Td",
    "5h"
  ],
  "stacks": {
    "sifilis5": 109.0,
    "Filou203": 105.5,
    "SrLyce": 106.5,
    "LOLA19711971": 31.0,
    "dadou13mars": 210.5,
    "Alvii37": 112.5
  },
  "actions": {
    "preflop": [
      "Asiento 1: sifilis5 (2.18 € en fichas)",
      "Asiento 2: Filou203 (2.11 € en fichas)",
      "Asiento 3: SrLyce (2.13 € en fichas)",
      "Asiento 4: LOLA19711971 (0.62 € en fichas)",
      "Asiento 5: dadou13mars (4.21 € en fichas)",
      "Asiento 6: Alvii37 (2.25 € en fichas)",
      "LOLA19711971: pone la ciega pequeña 0.01 €",
      "dadou13mars: pone la ciega grande 0.02 €",
      "Alvii37: se retira",
      "sifilis5: sube 0.04 € a 0.06 €",
      "Filou203: se retira",
      "SrLyce: se retira",
      "LOLA19711971: iguala 0.05 €",
      "dadou13mars: se retira"
    ],
    "flop": [
      "LOLA19711971: pasa",
      "sifilis5: apuesta 0.04 €",
      "LOLA19711971: iguala 0.04 €"
    ],
    "turn": [
      "LOLA19711971: apuesta 0.11 €",
      "sifilis5: iguala 0.11 €"
    ],
    "river": [
      "LOLA19711971: pasa",
      "sifilis5: pasa",
      "LOLA19711971: muestra [Qh Th] (escalera, de nueve a rey)",
      "sifilis5: descarta su mano sin mostrar",
      "Asiento 1: sifilis5 descartó sin mostrar [Qc Ks]",
      "Asiento 2: Filou203 se retiró antes del Flop (no apostó)",
      "Asiento 3: SrLyce (botón) se retiró antes del Flop (no apostó)",
      "Asiento 4: LOLA19711971 (ciega pequeña) muestra [Qh Th] y ganó (0.41 €) con escalera, de nueve a rey",
      "Asiento 5: dadou13mars (ciega grande) se retiró antes del Flop",
      "Asiento 6: Alvii37 se retiró antes del Flop (no apostó)"
    ]
  },
  "board": [
    "Jd",
    "Kc",
    "Jh",
    "9s",
    "5d"
  ],
  "winner": "LOLA19711971",
  "win_amount": 20.5,
  "sb": 0.01,
  "bb": 0.02,
  "rake": 1.5,
  "raw_text": "Mano n.º 257168362301 de PokerStars:  Hold'em No Limit (0.01 €/0.02 € EUR) - 01-08-2025 11:33:57 CET [01-08-2025 5:33:57 ET]\nMesa \"Jupiter\" 6-max El asiento n.º 3 es el botón\nAsiento 1: sifilis5 (2.18 € en fichas) \nAsiento 2: Filou203 (2.11 € en fichas) \nAsiento 3: SrLyce (2.13 € en fichas) \nAsiento 4: LOLA19711971 (0.62 € en fichas) \nAsiento 5: dadou13mars (4.21 € en fichas) \nAsiento 6: Alvii37 (2.25 € en fichas) \nLOLA19711971: pone la ciega pequeña 0.01 €\ndadou13mars: pone la ciega grande 0.02 €\n*** CARTAS DE MANO ***\nRepartidas a SrLyce [Td 5h]\nAlvii37: se retira \nsifilis5: sube 0.04 € a 0.06 €\nFilou203: se retira \nSrLyce: se retira \nLOLA19711971: iguala 0.05 €\ndadou13mars: se retira \n*** FLOP *** [Jd Kc Jh]\nLOLA19711971: pasa \nsifilis5: apuesta 0.04 €\nLOLA19711971: iguala 0.04 €\n*** TURN *** [Jd Kc Jh] [9s]\nLOLA19711971: apuesta 0.11 €\nsifilis5: iguala 0.11 €\n*** RIVER *** [Jd Kc Jh 9s] [5d]\nLOLA19711971: pasa \nsifilis5: pasa \n*** SHOW DOWN ***\nLOLA19711971: muestra [Qh Th] (escalera, de nueve a rey)\nsifilis5: descarta su mano sin mostrar \nLOLA19711971 se lleva 0.41 € del bote \n*** RESUMEN ***\nBote total 0.44 € | Comisión 0.03 € \nComunitarias [Jd Kc Jh 9s 5d]\nAsiento 1: sifilis5 descartó sin mostrar [Qc Ks]\nAsiento 2: Filou203 se retiró antes del Flop (no apostó)\nAsiento 3: SrLyce (botón) se retiró antes del Flop (no apostó)\nAsiento 4: LOLA19711971 (ciega pequeña) muestra [Qh Th] y ganó (0.41 €) con escalera, de nueve a rey\nAsiento 5: dadou13mars (ciega grande) se retiró antes del Flop\nAsiento 6: Alvii37 se retiró antes del Flop (no apostó)"
}