{
  "hand_id": "257149896266",
  "date": "30-07-2025 23:04:19",
  "table": "Lobelia",
  "game_type": "holdem",
  "hero": "SrLyce",
  "hero_position": "",
  "hero_cards": [
    "Td",
    "5d"
  ],
  "stacks": {
    "LeVbks": 89.0,
    "fcis666": 60.5,
    "Dlaguancha": 63.0,
    "SrLyce": 117.5,
    "riverluck444": 73.5,
    "Kiffou39": 54.5
  },
  "actions": {
    "preflop": [
      "Asiento 1: LeVbks (1.78 € en fichas)",
      "Asiento 2: fcis666 (1.21 € en fichas)",
      "Asiento 3: Dlaguancha (1.26 € en fichas)",
      "Asiento 4: SrLyce (2.35 € en fichas)",
      "Asiento 5: riverluck444 (1.47 € en fichas)",
      "Asiento 6: Kiffou39 (1.09 € en fichas)",
      "LeVbks: pone la ciega pequeña 0.01 €",
      "fcis666: pone la ciega grande 0.02 €",
      "Dlaguancha: se retira",
      "SrLyce: se retira",
      "riverluck444: se retira",
      "Kiffou39: se retira",
      "LeVbks: iguala 0.01 €",
      "fcis666: pasa"
    ],
    "flop": [
      "LeVbks: pasa",
      "fcis666: apuesta 0.02 €",
      "LeVbks: iguala 0.02 €"
    ],
    "turn": [
      "LeVbks: pasa",
      "fcis666: apuesta 0.02 €",
      "LeVbks: iguala 0.02 €"
    ],
    "river": [
      "LeVbks: pasa",
      "fcis666: pasa",
      "LeVbks: muestra [6d 7c] (pareja de seises)",
      "fcis666: descarta su mano sin mostrar",
      "Asiento 1: LeVbks (ciega pequeña) muestra [6d 7c] y ganó (0.11 €) con pareja de seises",
      "Asiento 2: fcis666 (ciega grande) descartó sin mostrar [2c 6c]",
      "Asiento 3: Dlaguancha se retiró antes del Flop (no apostó)",
      "Asiento 4: SrLyce se retiró antes del Flop (no apostó)",
      "Asiento 5: riverluck444 se retiró antes del Flop (no apostó)",
      "Asiento 6: Kiffou39 (botón) se retiró antes del Flop (no apostó)"
    ]
  },
  "board": [
    "4s",
    "6s",
    "5s",
    "9c",
    "Qh"
  ],
  "winner": "LeVbks",
  "win_amount": 5.5,
  "sb": 0.01,
  "bb": 0.02,
  "rake": 0.5,
  "raw_text": "Mano n.º 257149896266 de PokerStars:  Hold'em No Limit (0.01 €/0.02 € EUR) - 30-07-2025 23:04:19 CET [30-07-2025 17:04:19 ET]\nMesa \"Lobelia\" 6-max El asiento n.º 6 es el botón\nAsiento 1: LeVbks (1.78 € en fichas) \nAsiento 2: fcis666 (1.21 € en fichas) \nAsiento 3: Dlaguancha (1.26 € en fichas) \nAsiento 4: SrLyce (2.35 € en fichas) \nAsiento 5: riverluck444 (1.47 € en fichas) \nAsiento 6: Kiffou39 (1.09 € en fichas) \nLeVbks: pone la ciega pequeña 0.01 €\nfcis666: pone la ciega grande 0.02 €\n*** CARTAS DE MANO ***\nRepartidas a SrLyce [Td 5d]\nDlaguancha: se retira \nSrLyce: se retira \nriverluck444: se retira \nKiffou39: se retira \nLeVbks: iguala 0.01 €\nfcis666: pasa \n*** FLOP *** [4s 6s 5s]\nLeVbks: pasa \nfcis666: apuesta 0.02 €\nLeVbks: iguala 0.02 €\n*** TURN *** [4s 6s 5s] [9c]\nLeVbks: pasa \nfcis666: apuesta 0.02 €\nLeVbks: iguala 0.02 €\n*** RIVER *** [4s 6s 5s 9c] [Qh]\nLeVbks: pasa \nfcis666: pasa \n*** SHOW DOWN ***\nLeVbks: muestra [6d 7c] (pareja de seises)\nfcis666: descarta su mano sin mostrar \nLeVbks se lleva 0.11 € del bote \n*** RESUMEN ***\nBote total 0.12 € | Comisión 0.01 € \nComunitarias [4s 6s 5s 9c Qh]\nAsiento 1: LeVbks (ciega pequeña) muestra [6d 7c] y ganó (0.11 €) con pareja de seises\nAsiento 2: fcis666 (ciega grande) descartó sin mostrar [2c 6c]\nAsiento 3: Dlaguancha se retiró antes del Flop (no apostó)\nAsiento 4: SrLyce se retiró antes del Flop (no apostó)\nAsiento 5: riverluck444 se retiró antes del Flop (no apostó)\nAsiento 6: Kiffou39 (botón) se retiró antes del Flop (no apostó)"
}