{
  "hand_id": "257238212879",
  "date": "06-08-2025 18:38:07",
  "table": "Aidamina II",
  "game_type": "holdem",
  "hero": "SrLyce",
  "hero_position": "",
  "hero_cards": [
    "5s",
    "3d"
  ],
  "stacks": {
    "74SKY": 27.5,
    "erdillu": 105.0,
    "niyomalo": 115.5,
    "durahimovic": 133.0,
    "Abrelatas787": 153.5,
    "SrLyce": 99.0
  },
  "actions": {
    "preflop": [
      "Asiento 1: 74SKY (0.55 € en fichas)",
      "Asiento 2: erdillu (2.10 € en fichas)",
      "Asiento 3: niyomalo (2.31 € en fichas)",
      "Asiento 4: durahimovic (2.66 € en fichas)",
      "Asiento 5: Abrelatas787 (3.07 € en fichas)",
      "Asiento 6: SrLyce (1.98 € en fichas)",
      "SrLyce: pone la ciega pequeña 0.01 €",
      "74SKY: pone la ciega grande 0.02 €",
      "erdillu: se retira",
      "niyomalo: se retira",
      "durahimovic: se retira",
      "Abrelatas787: se retira",
      "SrLyce: se retira",
      "74SKY: no muestra su mano",
      "Asiento 1: 74SKY (ciega grande) recaudó (0.02 €)",
      "Asiento 2: erdillu se retiró antes del Flop (no apostó)",
      "Asiento 3: niyomalo se retiró antes del Flop (no apostó)",
      "Asiento 4: durahimovic se retiró antes del Flop (no apostó)",
      "Asiento 5: Abrelatas787 (botón) se retiró antes del Flop (no apostó)",
      "Asiento 6: SrLyce (ciega pequeña) se retiró antes del Flop"
    ],
    "flop": [],
    "turn": [],
    "river": []
  },
  "board": [],
  "winner": "74SKY",
  "win_amount": 1.0,
  "sb": 0.01,
  "bb": 0.02,
  "rake": 0.0,
  "raw_text": "Mano n.º 257238212879 de PokerStars:  Hold'em No Limit (0.01 €/0.02 € EUR) - 06-08-2025 18:38:07 CET [06-08-2025 12:38:07 ET]\nMesa \"Aidamina II\" 6-max El asiento n.º 5 es el botón\nAsiento 1: 74SKY (0.55 € en fichas) \nAsiento 2: erdillu (2.10 € en fichas) \nAsiento 3: niyomalo (2.31 € en fichas) \nAsiento 4: durahimovic (2.66 € en fichas) \nAsiento 5: Abrelatas787 (3.07 € en fichas) \nAsiento 6: SrLyce (1.98 € en fichas) \nSrLyce: pone la ciega pequeña 0.01 €\n74SKY: pone la ciega grande 0.02 €\n*** CARTAS DE MANO ***\nRepartidas a SrLyce [5s 3d]\nerdillu: se retira \nniyomalo: se retira \ndurahimovic: se retira \nAbrelatas787: se retira \nSrLyce: se retira \nLa apuesta no igualada (0.01 €) ha sido devuelta a 74SKY\n74SKY se lleva 0.02 € del bote \n74SKY: no muestra su mano \n*** RESUMEN ***\nBote total 0.02 € | Comisión 0 € \nAsiento 1: 74SKY (ciega grande) recaudó (0.02 €)\nAsiento 2: erdillu se retiró antes del Flop (no apostó)\nAsiento 3: niyomalo se retiró antes del Flop (no apostó)\nAsiento 4: durahimovic se retiró antes del Flop (no apostó)\nAsiento 5: Abrelatas787 (botón) se retiró antes del Flop (no apostó)\nAsiento 6: SrLyce (ciega pequeña) se retiró antes del Flop"
}