{
  "hand_id": "257237565246",
  "date": "06-08-2025 17:36:32",
  "table": "Kale III",
  "game_type": "holdem",
  "hero": "SrLyce",
  "hero_position": "",
  "hero_cards": [
    "Ah",
    "3h"
  ],
  "stacks": {
    "x__Nest__x": 86.5,
    "SrLyce": 120.5,
    "Dracoline000": 111.0,
    "Begoton": 104.5,
    "juanmemol": 100.0
  },
  "actions": {
    "preflop": [
      "Asiento 1: x__Nest__x (1.73 € en fichas)",
      "Asiento 2: SrLyce (2.41 € en fichas)",
      "Asiento 3: Dracoline000 (2.22 € en fichas)",
      "Asiento 5: Begoton (2.09 € en fichas)",
      "Asiento 6: juanmemol (2 € en fichas)",
      "Begoton: pone la ciega pequeña 0.01 €",
      "juanmemol: pone la ciega grande 0.02 €",
      "x__Nest__x: se retira",
      "SrLyce: sube 0.02 € a 0.04 €",
      "Dracoline000: se retira",
      "Begoton: se retira",
      "juanmemol: iguala 0.02 €"
    ],
    "flop": [
      "juanmemol: pasa",
      "SrLyce: apuesta 0.04 €",
      "juanmemol: se retira",
      "SrLyce: no muestra su mano",
      "Asiento 1: x__Nest__x se retiró antes del Flop (no apostó)",
      "Asiento 2: SrLyce recaudó (0.08 €)",
      "Asiento 3: Dracoline000 (botón) se retiró antes del Flop (no apostó)",
      "Asiento 5: Begoton (ciega pequeña) se retiró antes del Flop",
      "Asiento 6: juanmemol (ciega grande) se retiró en el Flop"
    ],
    "turn": [],
    "river": []
  },
  "board": [
    "4s",
    "8s",
    "Ad"
  ],
  "winner": "SrLyce",
  "win_amount": 4.0,
  "sb": 0.01,
  "bb": 0.02,
  "rake": 0.5,
  "raw_text": "Mano n.º 257237565246 de PokerStars:  Hold'em No Limit (0.01 €/0.02 € EUR) - 06-08-2025 17:36:32 CET [06-08-2025 11:36:32 ET]\nMesa \"Kale III\" 6-max El asiento n.º 3 es el botón\nAsiento 1: x__Nest__x (1.73 € en fichas) \nAsiento 2: SrLyce (2.41 € en fichas) \nAsiento 3: Dracoline000 (2.22 € en fichas) \nAsiento 5: Begoton (2.09 € en fichas) \nAsiento 6: juanmemol (2 € en fichas) \nBegoton: pone la ciega pequeña 0.01 €\njuanmemol: pone la ciega grande 0.02 €\n*** CARTAS DE MANO ***\nRepartidas a SrLyce [Ah 3h]\nx__Nest__x: se retira \nSrLyce: sube 0.02 € a 0.04 €\nDracoline000: se retira \nBegoton: se retira \njuanmemol: iguala 0.02 €\n*** FLOP *** [4s 8s Ad]\njuanmemol: pasa \nSrLyce: apuesta 0.04 €\njuanmemol: se retira \nLa apuesta no igualada (0.04 €) ha sido devuelta a SrLyce\nSrLyce se lleva 0.08 € del bote \nSrLyce: no muestra su mano \n*** RESUMEN ***\nBote total 0.09 € | Comisión 0.01 € \nComunitarias [4s 8s Ad]\nAsiento 1: x__Nest__x se retiró antes del Flop (no apostó)\nAsiento 2: SrLyce recaudó (0.08 €)\nAsiento 3: Dracoline000 (botón) se retiró antes del Flop (no apostó)\nAsiento 5: Begoton (ciega pequeña) se retiró antes del Flop\nAsiento 6: juanmemol (ciega grande) se retiró en el Flop"
}