{
  "hand_id": "257148686290",
  "date": "30-07-2025 21:36:52",
  "table": "Esclangona",
  "game_type": "holdem",
  "hero": "SrLyce",
  "hero_position": "",
  "hero_cards": [
    "Jc",
    "Js"
  ],
  "stacks": {
    "gabriella657": 285.0,
    "Zorgue1080": 104.0,
    "SrLyce": 95.5,
    "Davdgoni": 159.5,
    "DiaZzZ1": 115.5,
    "berlcht403": 29.0
  },
  "actions": {
    "preflop": [
      "Asiento 3: gabriella657 (5.70 € en fichas) está ausente",
      "Asiento 1: Zorgue1080 (2.08 € en fichas)",
      "Asiento 2: SrLyce (1.91 € en fichas)",
      "Asiento 4: Davdgoni (3.19 € en fichas)",
      "Asiento 5: DiaZzZ1 (2.31 € en fichas)",
      "Asiento 6: berlcht403 (0.58 € en fichas)",
      "Zorgue1080: pone la ciega pequeña 0.01 €",
      "SrLyce: pone la ciega grande 0.02 €",
      "Davdgoni: sube 0.04 € a 0.06 €",
      "DiaZzZ1: se retira",
      "berlcht403: se retira",
      "Zorgue1080: iguala 0.05 €",
      "SrLyce: sube 0.12 € a 0.18 €",
      "Davdgoni: iguala 0.12 €",
      "Zorgue1080: iguala 0.12 €"
    ],
    "flop": [
      "Zorgue1080: pasa",
      "SrLyce: apuesta 0.16 €",
      "Davdgoni: iguala 0.16 €",
      "Zorgue1080: se retira"
    ],
    "turn": [
      "SrLyce: apuesta 0.41 €",
      "Davdgoni: iguala 0.41 €"
    ],
    "river": [
      "SrLyce: apuesta 1.16 € y está all-in",
      "Davdgoni: se retira",
      "SrLyce: no muestra su mano",
      "Asiento 3: gabriella657",
      "Asiento 1: Zorgue1080 (ciega pequeña) se retiró en el Flop",
      "Asiento 2: SrLyce (ciega grande) recaudó (1.58 €)",
      "Asiento 4: Davdgoni se retiró en el River",
      "Asiento 5: DiaZzZ1 se retiró antes del Flop (no apostó)",
      "Asiento 6: berlcht403 (botón) se retiró antes del Flop (no apostó)"
    ]
  },
  "board": [
    "5d",
    "Td",
    "5s",
    "9c",
    "2c"
  ],
  "winner": "SrLyce",
  "win_amount": 79.0,
  "sb": 0.01,
  "bb": 0.02,
  "rake": 5.0,
  "raw_text": "Mano n.º 257148686290 de PokerStars:  Hold'em No Limit (0.01 €/0.02 € EUR) - 30-07-2025 21:36:52 CET [30-07-2025 15:36:52 ET]\nMesa \"Esclangona\" 6-max El asiento n.º 6 es el botón\nAsiento 3: gabriella657 (5.70 € en fichas) está ausente\nAsiento 1: Zorgue1080 (2.08 € en fichas) \nAsiento 2: SrLyce (1.91 € en fichas) \nAsiento 4: Davdgoni (3.19 € en fichas) \nAsiento 5: DiaZzZ1 (2.31 € en fichas) \nAsiento 6: berlcht403 (0.58 € en fichas) \nZorgue1080: pone la ciega pequeña 0.01 €\nSrLyce: pone la ciega grande 0.02 €\n*** CARTAS DE MANO ***\nRepartidas a SrLyce [Jc Js]\nDavdgoni: sube 0.04 € a 0.06 €\nDiaZzZ1: se retira \nberlcht403: se retira \nZorgue1080: iguala 0.05 €\nSrLyce: sube 0.12 € a 0.18 €\nDavdgoni: iguala 0.12 €\nZorgue1080: iguala 0.12 €\n*** FLOP *** [5d Td 5s]\nZorgue1080: pasa \nSrLyce: apuesta 0.16 €\nDavdgoni: iguala 0.16 €\nZorgue1080: se retira \n*** TURN *** [5d Td 5s] [9c]\nSrLyce: apuesta 0.41 €\nDavdgoni: iguala 0.41 €\n*** RIVER *** [5d Td 5s 9c] [2c]\nSrLyce: apuesta 1.16 € y está all-in\nDavdgoni: se retira \nLa apuesta no igualada (1.16 €) ha sido devuelta a SrLyce\nSrLyce se lleva 1.58 € del bote \nSrLyce: no muestra su mano \n*** RESUMEN ***\nBote total 1.68 € | Comisión 0.10 € \nComunitarias [5d Td 5s 9c 2c]\nAsiento 3: gabriella657\nAsiento 1: Zorgue1080 (ciega pequeña) se retiró en el Flop\nAsiento 2: SrLyce (ciega grande) recaudó (1.58 €)\nAsiento 4: Davdgoni se retiró en el River\nAsiento 5: DiaZzZ1 se retiró antes del Flop (no apostó)\nAsiento 6: berlcht403 (botón) se retiró antes del Flop (no apostó)"
}