{
  "hand_id": "257150442392",
  "date": "30-07-2025 23:42:09",
  "table": "Mizuho",
  "game_type": "holdem",
  "hero": "SrLyce",
  "hero_position": "",
  "hero_cards": [
    "Td",
    "Qc"
  ],
  "stacks": {
    "benipoker123": 109.5,
    "SrLyce": 98.0,
    "JstLeonel": 124.5,
    "Ozzy3110": 244.0,
    "toonsy2010": 136.5,
    "mivipkr": 166.5
  },
  "actions": {
    "preflop": [
      "Asiento 1: benipoker123 (2.19 € en fichas)",
      "Asiento 2: SrLyce (1.96 € en fichas)",
      "Asiento 3: JstLeonel (2.49 € en fichas)",
      "Asiento 4: Ozzy3110 (4.88 € en fichas)",
      "Asiento 5: toonsy2010 (2.73 € en fichas)",
      "Asiento 6: mivipkr (3.33 € en fichas)",
      "Ozzy3110: pone la ciega pequeña 0.01 €",
      "toonsy2010: pone la ciega grande 0.02 €",
      "mivipkr: se retira",
      "benipoker123: se retira",
      "SrLyce: sube 0.04 € a 0.06 €",
      "JstLeonel: iguala 0.06 €",
      "Ozzy3110: se retira",
      "toonsy2010: iguala 0.04 €"
    ],
    "flop": [
      "toonsy2010: pasa",
      "SrLyce: pasa",
      "JstLeonel: pasa"
    ],
    "turn": [
      "toonsy2010: apuesta 0.09 €",
      "SrLyce: se retira",
      "JstLeonel: iguala 0.09 €"
    ],
    "river": [
      "toonsy2010: pasa",
      "JstLeonel: pasa",
      "toonsy2010: muestra [3s 5s] (doble pareja, cincos y treses)",
      "JstLeonel: descarta su mano sin mostrar",
      "Asiento 1: benipoker123 se retiró antes del Flop (no apostó)",
      "Asiento 2: SrLyce se retiró en el Turn",
      "Asiento 3: JstLeonel (botón) descartó sin mostrar [Ah 5h]",
      "Asiento 4: Ozzy3110 (ciega pequeña) se retiró antes del Flop",
      "Asiento 5: toonsy2010 (ciega grande) muestra [3s 5s] y ganó (0.35 €) con doble pareja, cincos y treses",
      "Asiento 6: mivipkr se retiró antes del Flop (no apostó)"
    ]
  },
  "board": [
    "7s",
    "2d",
    "5d",
    "3c",
    "Jd"
  ],
  "winner": "toonsy2010",
  "win_amount": 17.5,
  "sb": 0.01,
  "bb": 0.02,
  "rake": 1.0,
  "raw_text": "Mano n.º 257150442392 de PokerStars:  Hold'em No Limit (0.01 €/0.02 € EUR) - 30-07-2025 23:42:09 CET [30-07-2025 17:42:09 ET]\nMesa \"Mizuho\" 6-max El asiento n.º 3 es el botón\nAsiento 1: benipoker123 (2.19 € en fichas) \nAsiento 2: SrLyce (1.96 € en fichas) \nAsiento 3: JstLeonel (2.49 € en fichas) \nAsiento 4: Ozzy3110 (4.88 € en fichas) \nAsiento 5: toonsy2010 (2.73 € en fichas) \nAsiento 6: mivipkr (3.33 € en fichas) \nOzzy3110: pone la ciega pequeña 0.01 €\ntoonsy2010: pone la ciega grande 0.02 €\n*** CARTAS DE MANO ***\nRepartidas a SrLyce [Td Qc]\nmivipkr: se retira \nbenipoker123: se retira \nSrLyce: sube 0.04 € a 0.06 €\nJstLeonel: iguala 0.06 €\nOzzy3110: se retira \ntoonsy2010: iguala 0.04 €\n*** FLOP *** [7s 2d 5d]\ntoonsy2010: pasa \nSrLyce: pasa \nJstLeonel: pasa \n*** TURN *** [7s 2d 5d] [3c]\ntoonsy2010: apuesta 0.09 €\nSrLyce: se retira \nJstLeonel: iguala 0.09 €\n*** RIVER *** [7s 2d 5d 3c] [Jd]\ntoonsy2010: pasa \nJstLeonel: pasa \n*** SHOW DOWN ***\ntoonsy2010: muestra [3s 5s] (doble pareja, cincos y treses)\nJstLeonel: descarta su mano sin mostrar \ntoonsy2010 se lleva 0.35 € del bote \n*** RESUMEN ***\nBote total 0.37 € | Comisión 0.02 € \nComunitarias [7s 2d 5d 3c Jd]\nAsiento 1: benipoker123 se retiró antes del Flop (no apostó)\nAsiento 2: SrLyce se retiró en el Turn\nAsiento 3: JstLeonel (botón) descartó sin mostrar [Ah 5h]\nAsiento 4: Ozzy3110 (ciega pequeña) se retiró antes del Flop\nAsiento 5: toonsy2010 (ciega grande) muestra [3s 5s] y ganó (0.35 €) con doble pareja, cincos y treses\nAsiento 6: mivipkr se retiró antes del Flop (no apostó)"
}