{
  "hand_id": "257168391991",
  "date": "01-08-2025 11:39:21",
  "table": "Jupiter",
  "game_type": "holdem",
  "hero": "SrLyce",
  "hero_position": "",
  "hero_cards": [
    "5c",
    "7h"
  ],
  "stacks": {
    "sifilis5": 100.0,
    "Filou203": 105.5,
    "SrLyce": 112.0,
    "LOLA19711971": 38.5,
    "dadou13mars": 209.5,
    "Alvii37": 117.5
  },
  "actions": {
    "preflop": [
      "Asiento 1: sifilis5 (2 € en fichas)",
      "Asiento 2: Filou203 (2.11 € en fichas)",
      "Asiento 3: SrLyce (2.24 € en fichas)",
      "Asiento 4: LOLA19711971 (0.77 € en fichas)",
      "Asiento 5: dadou13mars (4.19 € en fichas)",
      "Asiento 6: Alvii37 (2.35 € en fichas)",
      "dadou13mars: pone la ciega pequeña 0.01 €",
      "Alvii37: pone la ciega grande 0.02 €",
      "sifilis5: se retira",
      "Filou203: se retira",
      "SrLyce: se retira",
      "LOLA19711971: sube 0.02 € a 0.04 €",
      "dadou13mars: iguala 0.03 €",
      "Alvii37: se retira"
    ],
    "flop": [
      "dadou13mars: pasa",
      "LOLA19711971: apuesta 0.73 € y está all-in",
      "dadou13mars: se retira",
      "Asiento 1: sifilis5 se retiró antes del Flop (no apostó)",
      "Asiento 2: Filou203 se retiró antes del Flop (no apostó)",
      "Asiento 3: SrLyce se retiró antes del Flop (no apostó)",
      "Asiento 4: LOLA19711971 (botón) recaudó (0.09 €)",
      "Asiento 5: dadou13mars (ciega pequeña) se retiró en el Flop",
      "Asiento 6: Alvii37 (ciega grande) se retiró antes del Flop"
    ],
    "turn": [],
    "river": []
  },
  "board": [
    "Ac",
    "Kh",
    "Kd"
  ],
  "winner": "LOLA19711971",
  "win_amount": 4.5,
  "sb": 0.01,
  "bb": 0.02,
  "rake": 0.5,
  "raw_text": "Mano n.º 257168391991 de PokerStars:  Hold'em No Limit (0.01 €/0.02 € EUR) - 01-08-2025 11:39:21 CET [01-08-2025 5:39:21 ET]\nMesa \"Jupiter\" 6-max El asiento n.º 4 es el botón\nAsiento 1: sifilis5 (2 € en fichas) \nAsiento 2: Filou203 (2.11 € en fichas) \nAsiento 3: SrLyce (2.24 € en fichas) \nAsiento 4: LOLA19711971 (0.77 € en fichas) \nAsiento 5: dadou13mars (4.19 € en fichas) \nAsiento 6: Alvii37 (2.35 € en fichas) \ndadou13mars: pone la ciega pequeña 0.01 €\nAlvii37: pone la ciega grande 0.02 €\n*** CARTAS DE MANO ***\nRepartidas a SrLyce [5c 7h]\nsifilis5: se retira \nFilou203: se retira \nSrLyce: se retira \nLOLA19711971: sube 0.02 € a 0.04 €\ndadou13mars: iguala 0.03 €\nAlvii37: se retira \n*** FLOP *** [Ac Kh Kd]\ndadou13mars: pasa \nLOLA19711971: apuesta 0.73 € y está all-in\ndadou13mars: se retira \nLa apuesta no igualada (0.73 €) ha sido devuelta a LOLA19711971\nLOLA19711971 se lleva 0.09 € del bote \n*** RESUMEN ***\nBote total 0.10 € | Comisión 0.01 € \nComunitarias [Ac Kh Kd]\nAsiento 1: sifilis5 se retiró antes del Flop (no apostó)\nAsiento 2: Filou203 se retiró antes del Flop (no apostó)\nAsiento 3: SrLyce se retiró antes del Flop (no apostó)\nAsiento 4: LOLA19711971 (botón) recaudó (0.09 €)\nAsiento 5: dadou13mars (ciega pequeña) se retiró en el Flop\nAsiento 6: Alvii37 (ciega grande) se retiró antes del Flop"
}