{
  "hand_id": "257237908336",
  "date": "06-08-2025 18:10:51",
  "table": "Euneus III",
  "game_type": "holdem",
  "hero": "SrLyce",
  "hero_position": "",
  "hero_cards": [
    "Ts",
    "4d"
  ],
  "stacks": {
    "christgear": 102.5,
    "Il_BM00": 101.0,
    "djrojas9": 153.0,
    "SrLyce": 110.0
  },
  "actions": {
    "preflop": [
      "Asiento 1: christgear (2.05 € en fichas)",
      "Asiento 2: Il_BM00 (2.02 € en fichas)",
      "Asiento 3: djrojas9 (3.06 € en fichas)",
      "Asiento 5: SrLyce (2.20 € en fichas)",
      "christgear: pone la ciega pequeña 0.01 €",
      "Il_BM00: pone la ciega grande 0.02 €",
      "djrojas9: se retira",
      "SrLyce: se retira",
      "christgear: se retira",
      "Il_BM00: no muestra su mano",
      "Asiento 1: christgear (ciega pequeña) se retiró antes del Flop",
      "Asiento 2: Il_BM00 (ciega grande) recaudó (0.02 €)",
      "Asiento 3: djrojas9 se retiró antes del Flop (no apostó)",
      "Asiento 5: SrLyce (botón) se retiró antes del Flop (no apostó)"
    ],
    "flop": [],
    "turn": [],
    "river": []
  },
  "board": [],
  "winner": "Il_BM00",
  "win_amount": 1.0,
  "sb": 0.01,
  "bb": 0.02,
  "rake": 0.0,
  "raw_text": "Mano n.º 257237908336 de PokerStars:  Hold'em No Limit (0.01 €/0.02 € EUR) - 06-08-2025 18:10:51 CET [06-08-2025 12:10:51 ET]\nMesa \"Euneus III\" 6-max El asiento n.º 5 es el botón\nAsiento 1: christgear (2.05 € en fichas) \nAsiento 2: Il_BM00 (2.02 € en fichas) \nAsiento 3: djrojas9 (3.06 € en fichas) \nAsiento 5: SrLyce (2.20 € en fichas) \nchristgear: pone la ciega pequeña 0.01 €\nIl_BM00: pone la ciega grande 0.02 €\n*** CARTAS DE MANO ***\nRepartidas a SrLyce [Ts 4d]\ndjrojas9 ha agotado su tiempo\ndjrojas9: se retira \nSrLyce: se retira \nchristgear: se retira \nLa apuesta no igualada (0.01 €) ha sido devuelta a Il_BM00\nIl_BM00 se lleva 0.02 € del bote \nIl_BM00: no muestra su mano \n*** RESUMEN ***\nBote total 0.02 € | Comisión 0 € \nAsiento 1: christgear (ciega pequeña) se retiró antes del Flop\nAsiento 2: Il_BM00 (ciega grande) recaudó (0.02 €)\nAsiento 3: djrojas9 se retiró antes del Flop (no apostó)\nAsiento 5: SrLyce (botón) se retiró antes del Flop (no apostó)"
}