{
  "hand_id": "257150525704",
  "date": "30-07-2025 23:48:12",
  "table": "Mizuho",
  "game_type": "holdem",
  "hero": "SrLyce",
  "hero_position": "",
  "hero_cards": [
    "7s",
    "Ks"
  ],
  "stacks": {
    "benipoker123": 127.5,
    "SrLyce": 94.5,
    "JstLeonel": 115.0,
    "Ozzy3110": 297.5,
    "toonsy2010": 93.5,
    "mivipkr": 166.5
  },
  "actions": {
    "preflop": [
      "Asiento 1: benipoker123 (2.55 € en fichas)",
      "Asiento 2: SrLyce (1.89 € en fichas)",
      "Asiento 3: JstLeonel (2.30 € en fichas)",
      "Asiento 4: Ozzy3110 (5.95 € en fichas)",
      "Asiento 5: toonsy2010 (1.87 € en fichas)",
      "Asiento 6: mivipkr (3.33 € en fichas)",
      "toonsy2010: pone la ciega pequeña 0.01 €",
      "mivipkr: pone la ciega grande 0.02 €",
      "benipoker123: sube 0.04 € a 0.06 €",
      "SrLyce: se retira",
      "JstLeonel: se retira",
      "Ozzy3110: se retira",
      "toonsy2010: se retira",
      "mivipkr: se retira",
      "benipoker123: no muestra su mano",
      "Asiento 1: benipoker123 recaudó (0.05 €)",
      "Asiento 2: SrLyce se retiró antes del Flop (no apostó)",
      "Asiento 3: JstLeonel se retiró antes del Flop (no apostó)",
      "Asiento 4: Ozzy3110 (botón) se retiró antes del Flop (no apostó)",
      "Asiento 5: toonsy2010 (ciega pequeña) se retiró antes del Flop",
      "Asiento 6: mivipkr (ciega grande) se retiró antes del Flop"
    ],
    "flop": [],
    "turn": [],
    "river": []
  },
  "board": [],
  "winner": "benipoker123",
  "win_amount": 2.5,
  "sb": 0.01,
  "bb": 0.02,
  "rake": 0.0,
  "raw_text": "Mano n.º 257150525704 de PokerStars:  Hold'em No Limit (0.01 €/0.02 € EUR) - 30-07-2025 23:48:12 CET [30-07-2025 17:48:12 ET]\nMesa \"Mizuho\" 6-max El asiento n.º 4 es el botón\nAsiento 1: benipoker123 (2.55 € en fichas) \nAsiento 2: SrLyce (1.89 € en fichas) \nAsiento 3: JstLeonel (2.30 € en fichas) \nAsiento 4: Ozzy3110 (5.95 € en fichas) \nAsiento 5: toonsy2010 (1.87 € en fichas) \nAsiento 6: mivipkr (3.33 € en fichas) \ntoonsy2010: pone la ciega pequeña 0.01 €\nmivipkr: pone la ciega grande 0.02 €\n*** CARTAS DE MANO ***\nRepartidas a SrLyce [7s Ks]\nbenipoker123: sube 0.04 € a 0.06 €\nSrLyce: se retira \nJstLeonel: se retira \nOzzy3110: se retira \ntoonsy2010: se retira \nmivipkr: se retira \nLa apuesta no igualada (0.04 €) ha sido devuelta a benipoker123\nbenipoker123 se lleva 0.05 € del bote \nbenipoker123: no muestra su mano \n*** RESUMEN ***\nBote total 0.05 € | Comisión 0 € \nAsiento 1: benipoker123 recaudó (0.05 €)\nAsiento 2: SrLyce se retiró antes del Flop (no apostó)\nAsiento 3: JstLeonel se retiró antes del Flop (no apostó)\nAsiento 4: Ozzy3110 (botón) se retiró antes del Flop (no apostó)\nAsiento 5: toonsy2010 (ciega pequeña) se retiró antes del Flop\nAsiento 6: mivipkr (ciega grande) se retiró antes del Flop"
}