{
  "hand_id": "257238152048",
  "date": "06-08-2025 18:32:41",
  "table": "Atreus",
  "game_type": "holdem",
  "hero": "SrLyce",
  "hero_position": "",
  "hero_cards": [
    "3h",
    "7h"
  ],
  "stacks": {
    "PrendsCa": 101.0,
    "NRules82": 30.0,
    "JENOFONTE73": 165.0,
    "Fharock": 92.5,
    "SrLyce": 121.0,
    "FishamanReggae": 35.5
  },
  "actions": {
    "preflop": [
      "Asiento 1: PrendsCa (2.02 € en fichas)",
      "Asiento 2: NRules82 (0.60 € en fichas)",
      "Asiento 3: JENOFONTE73 (3.30 € en fichas)",
      "Asiento 4: Fharock (1.85 € en fichas)",
      "Asiento 5: SrLyce (2.42 € en fichas)",
      "Asiento 6: FishamanReggae (0.71 € en fichas)",
      "NRules82: pone la ciega pequeña 0.01 €",
      "JENOFONTE73: pone la ciega grande 0.02 €",
      "Fharock: se retira",
      "SrLyce: se retira",
      "FishamanReggae: iguala 0.02 €",
      "PrendsCa: se retira",
      "NRules82: sube 0.04 € a 0.06 €",
      "JENOFONTE73: se retira",
      "FishamanReggae: iguala 0.04 €"
    ],
    "flop": [
      "NRules82: pasa",
      "FishamanReggae: pasa"
    ],
    "turn": [
      "NRules82: apuesta 0.04 €",
      "FishamanReggae: sube 0.04 € a 0.08 €",
      "NRules82: iguala 0.04 €"
    ],
    "river": [
      "NRules82: pasa",
      "FishamanReggae: apuesta 0.10 €",
      "NRules82: iguala 0.10 €",
      "FishamanReggae: muestra [Qh 9s] (poker de nueves)",
      "NRules82: descarta su mano sin mostrar",
      "Asiento 1: PrendsCa (botón) se retiró antes del Flop (no apostó)",
      "Asiento 2: NRules82 (ciega pequeña) descartó sin mostrar [As Qs]",
      "Asiento 3: JENOFONTE73 (ciega grande) se retiró antes del Flop",
      "Asiento 4: Fharock se retiró antes del Flop (no apostó)",
      "Asiento 5: SrLyce se retiró antes del Flop (no apostó)",
      "Asiento 6: FishamanReggae muestra [Qh 9s] y ganó (0.47 €) con poker de nueves"
    ]
  },
  "board": [
    "9c",
    "8s",
    "9d",
    "4h",
    "9h"
  ],
  "winner": "FishamanReggae",
  "win_amount": 23.5,
  "sb": 0.01,
  "bb": 0.02,
  "rake": 1.5,
  "raw_text": "Mano n.º 257238152048 de PokerStars:  Hold'em No Limit (0.01 €/0.02 € EUR) - 06-08-2025 18:32:41 CET [06-08-2025 12:32:41 ET]\nMesa \"Atreus\" 6-max El asiento n.º 1 es el botón\nAsiento 1: PrendsCa (2.02 € en fichas) \nAsiento 2: NRules82 (0.60 € en fichas) \nAsiento 3: JENOFONTE73 (3.30 € en fichas) \nAsiento 4: Fharock (1.85 € en fichas) \nAsiento 5: SrLyce (2.42 € en fichas) \nAsiento 6: FishamanReggae (0.71 € en fichas) \nNRules82: pone la ciega pequeña 0.01 €\nJENOFONTE73: pone la ciega grande 0.02 €\n*** CARTAS DE MANO ***\nRepartidas a SrLyce [3h 7h]\nFharock: se retira \nSrLyce: se retira \nFishamanReggae: iguala 0.02 €\nPrendsCa ha agotado su tiempo\nPrendsCa: se retira \nNRules82: sube 0.04 € a 0.06 €\nJENOFONTE73: se retira \nFishamanReggae: iguala 0.04 €\n*** FLOP *** [9c 8s 9d]\nNRules82: pasa \nFishamanReggae: pasa \n*** TURN *** [9c 8s 9d] [4h]\nNRules82: apuesta 0.04 €\nFishamanReggae: sube 0.04 € a 0.08 €\nNRules82: iguala 0.04 €\n*** RIVER *** [9c 8s 9d 4h] [9h]\nNRules82: pasa \nFishamanReggae: apuesta 0.10 €\nNRules82: iguala 0.10 €\n*** SHOW DOWN ***\nFishamanReggae: muestra [Qh 9s] (poker de nueves)\nNRules82: descarta su mano sin mostrar \nFishamanReggae se lleva 0.47 € del bote \n*** RESUMEN ***\nBote total 0.50 € | Comisión 0.03 € \nComunitarias [9c 8s 9d 4h 9h]\nAsiento 1: PrendsCa (botón) se retiró antes del Flop (no apostó)\nAsiento 2: NRules82 (ciega pequeña) descartó sin mostrar [As Qs]\nAsiento 3: JENOFONTE73 (ciega grande) se retiró antes del Flop\nAsiento 4: Fharock se retiró antes del Flop (no apostó)\nAsiento 5: SrLyce se retiró antes del Flop (no apostó)\nAsiento 6: FishamanReggae muestra [Qh 9s] y ganó (0.47 €) con poker de nueves"
}