{
  "hand_id": "257238412022",
  "date": "06-08-2025 18:55:45",
  "table": "Herculina II",
  "game_type": "holdem",
  "hero": "SrLyce",
  "hero_position": "",
  "hero_cards": [
    "7s",
    "3s"
  ],
  "stacks": {
    "Macklemore0": 100.0,
    "koldipk": 170.5,
    "David98X": 117.5,
    "JJer11": 217.5,
    "SrLyce": 100.0,
    "ScarvBlack": 100.0
  },
  "actions": {
    "preflop": [
      "Asiento 5: Macklemore0 (2 € en fichas) está ausente",
      "Asiento 1: koldipk (3.41 € en fichas)",
      "Asiento 2: David98X (2.35 € en fichas)",
      "Asiento 3: JJer11 (4.35 € en fichas)",
      "Asiento 4: SrLyce (2 € en fichas)",
      "Asiento 6: ScarvBlack (2 € en fichas)",
      "David98X: pone la ciega pequeña 0.01 €",
      "JJer11: pone la ciega grande 0.02 €",
      "Macklemore0: se ausenta",
      "SrLyce: se retira",
      "ScarvBlack: se retira",
      "koldipk: sube 0.04 € a 0.06 €",
      "David98X: se retira",
      "JJer11: iguala 0.04 €"
    ],
    "flop": [
      "JJer11: pasa",
      "koldipk: apuesta 0.04 €",
      "JJer11: iguala 0.04 €"
    ],
    "turn": [
      "JJer11: pasa",
      "koldipk: apuesta 0.20 €",
      "JJer11: se retira",
      "Asiento 5: Macklemore0",
      "Asiento 1: koldipk (botón) recaudó (0.20 €)",
      "Asiento 2: David98X (ciega pequeña) se retiró antes del Flop",
      "Asiento 3: JJer11 (ciega grande) se retiró en el Turn",
      "Asiento 4: SrLyce se retiró antes del Flop (no apostó)",
      "Asiento 6: ScarvBlack se retiró antes del Flop (no apostó)"
    ],
    "river": []
  },
  "board": [
    "Jc",
    "Ad",
    "Qs",
    "Td"
  ],
  "winner": "koldipk",
  "win_amount": 10.0,
  "sb": 0.01,
  "bb": 0.02,
  "rake": 0.5,
  "raw_text": "Mano n.º 257238412022 de PokerStars:  Hold'em No Limit (0.01 €/0.02 € EUR) - 06-08-2025 18:55:45 CET [06-08-2025 12:55:45 ET]\nMesa \"Herculina II\" 6-max El asiento n.º 1 es el botón\nAsiento 5: Macklemore0 (2 € en fichas) está ausente\nAsiento 1: koldipk (3.41 € en fichas) \nAsiento 2: David98X (2.35 € en fichas) \nAsiento 3: JJer11 (4.35 € en fichas) \nAsiento 4: SrLyce (2 € en fichas) \nAsiento 6: ScarvBlack (2 € en fichas) \nDavid98X: pone la ciega pequeña 0.01 €\nJJer11: pone la ciega grande 0.02 €\nMacklemore0: se ausenta \n*** CARTAS DE MANO ***\nRepartidas a SrLyce [7s 3s]\nSrLyce: se retira \nScarvBlack: se retira \nkoldipk: sube 0.04 € a 0.06 €\nDavid98X: se retira \nJJer11: iguala 0.04 €\n*** FLOP *** [Jc Ad Qs]\nJJer11: pasa \nkoldipk: apuesta 0.04 €\nJJer11: iguala 0.04 €\n*** TURN *** [Jc Ad Qs] [Td]\nJJer11: pasa \nkoldipk: apuesta 0.20 €\nJJer11: se retira \nLa apuesta no igualada (0.20 €) ha sido devuelta a koldipk\nkoldipk se lleva 0.20 € del bote \n*** RESUMEN ***\nBote total 0.21 € | Comisión 0.01 € \nComunitarias [Jc Ad Qs Td]\nAsiento 5: Macklemore0\nAsiento 1: koldipk (botón) recaudó (0.20 €)\nAsiento 2: David98X (ciega pequeña) se retiró antes del Flop\nAsiento 3: JJer11 (ciega grande) se retiró en el Turn\nAsiento 4: SrLyce se retiró antes del Flop (no apostó)\nAsiento 6: ScarvBlack se retiró antes del Flop (no apostó)"
}