{
  "hand_id": "257237615463",
  "date": "06-08-2025 17:41:24",
  "table": "Themisto III",
  "game_type": "holdem",
  "hero": "SrLyce",
  "hero_position": "",
  "hero_cards": [
    "5c",
    "2s"
  ],
  "stacks": {
    "chordewman": 100.0,
    "SrLyce": 122.5,
    "idigon": 4.5,
    "fred2d23po": 83.0,
    "mivipkr": 108.0,
    "marignamo": 98.0
  },
  "actions": {
    "preflop": [
      "Asiento 1: chordewman (2 € en fichas) está ausente",
      "Asiento 2: SrLyce (2.45 € en fichas)",
      "Asiento 3: idigon (0.09 € en fichas)",
      "Asiento 4: fred2d23po (1.66 € en fichas)",
      "Asiento 5: mivipkr (2.16 € en fichas)",
      "Asiento 6: marignamo (1.96 € en fichas)",
      "idigon: pone la ciega pequeña 0.01 €",
      "fred2d23po: pone la ciega grande 0.02 €",
      "chordewman: se ausenta",
      "mivipkr: se retira",
      "marignamo: sube 0.04 € a 0.06 €",
      "SrLyce: se retira",
      "idigon: se retira",
      "fred2d23po: iguala 0.04 €"
    ],
    "flop": [
      "fred2d23po: pasa",
      "marignamo: apuesta 0.08 €",
      "fred2d23po: se retira",
      "marignamo: no muestra su mano",
      "Asiento 1: chordewman",
      "Asiento 2: SrLyce (botón) se retiró antes del Flop (no apostó)",
      "Asiento 3: idigon (ciega pequeña) se retiró antes del Flop",
      "Asiento 4: fred2d23po (ciega grande) se retiró en el Flop",
      "Asiento 5: mivipkr se retiró antes del Flop (no apostó)",
      "Asiento 6: marignamo recaudó (0.12 €)"
    ],
    "turn": [],
    "river": []
  },
  "board": [
    "Ah",
    "9c",
    "Qd"
  ],
  "winner": "marignamo",
  "win_amount": 6.0,
  "sb": 0.01,
  "bb": 0.02,
  "rake": 0.5,
  "raw_text": "Mano n.º 257237615463 de PokerStars:  Hold'em No Limit (0.01 €/0.02 € EUR) - 06-08-2025 17:41:24 CET [06-08-2025 11:41:24 ET]\nMesa \"Themisto III\" 6-max El asiento n.º 2 es el botón\nAsiento 1: chordewman (2 € en fichas) está ausente\nAsiento 2: SrLyce (2.45 € en fichas) \nAsiento 3: idigon (0.09 € en fichas) \nAsiento 4: fred2d23po (1.66 € en fichas) \nAsiento 5: mivipkr (2.16 € en fichas) \nAsiento 6: marignamo (1.96 € en fichas) \nidigon: pone la ciega pequeña 0.01 €\nfred2d23po: pone la ciega grande 0.02 €\nchordewman: se ausenta \n*** CARTAS DE MANO ***\nRepartidas a SrLyce [5c 2s]\nmivipkr: se retira \nmarignamo: sube 0.04 € a 0.06 €\nSrLyce: se retira \nidigon: se retira \nfred2d23po: iguala 0.04 €\n*** FLOP *** [Ah 9c Qd]\nfred2d23po: pasa \nmarignamo: apuesta 0.08 €\nfred2d23po: se retira \nLa apuesta no igualada (0.08 €) ha sido devuelta a marignamo\nmarignamo se lleva 0.12 € del bote \nmarignamo: no muestra su mano \n*** RESUMEN ***\nBote total 0.13 € | Comisión 0.01 € \nComunitarias [Ah 9c Qd]\nAsiento 1: chordewman\nAsiento 2: SrLyce (botón) se retiró antes del Flop (no apostó)\nAsiento 3: idigon (ciega pequeña) se retiró antes del Flop\nAsiento 4: fred2d23po (ciega grande) se retiró en el Flop\nAsiento 5: mivipkr se retiró antes del Flop (no apostó)\nAsiento 6: marignamo recaudó (0.12 €)"
}