{
  "hand_id": "257149088816",
  "date": "30-07-2025 22:07:12",
  "table": "Sirona",
  "game_type": "holdem",
  "hero": "SrLyce",
  "hero_position": "",
  "hero_cards": [
    "Ad",
    "8h"
  ],
  "stacks": {
    "SrLyce": 140.5,
    "lecontrebandier": 73.5,
    "christoph363": 213.0,
    "oliverdu70": 186.0,
    "MitchATP65": 100.0
  },
  "actions": {
    "preflop": [
      "Asiento 1: SrLyce (2.81 € en fichas)",
      "Asiento 2: lecontrebandier (1.47 € en fichas)",
      "Asiento 3: christoph363 (4.26 € en fichas)",
      "Asiento 4: oliverdu70 (3.72 € en fichas)",
      "Asiento 6: MitchATP65 (2 € en fichas)",
      "MitchATP65: pone la ciega pequeña 0.01 €",
      "SrLyce: pone la ciega grande 0.02 €",
      "lecontrebandier: se retira",
      "christoph363: se retira",
      "oliverdu70: se retira",
      "MitchATP65: se retira",
      "SrLyce: no muestra su mano",
      "Asiento 1: SrLyce (ciega grande) recaudó (0.02 €)",
      "Asiento 2: lecontrebandier se retiró antes del Flop (no apostó)",
      "Asiento 3: christoph363 se retiró antes del Flop (no apostó)",
      "Asiento 4: oliverdu70 (botón) se retiró antes del Flop (no apostó)",
      "Asiento 6: MitchATP65 (ciega pequeña) se retiró antes del Flop"
    ],
    "flop": [],
    "turn": [],
    "river": []
  },
  "board": [],
  "winner": "SrLyce",
  "win_amount": 1.0,
  "sb": 0.01,
  "bb": 0.02,
  "rake": 0.0,
  "raw_text": "Mano n.º 257149088816 de PokerStars:  Hold'em No Limit (0.01 €/0.02 € EUR) - 30-07-2025 22:07:12 CET [30-07-2025 16:07:12 ET]\nMesa \"Sirona\" 6-max El asiento n.º 4 es el botón\nAsiento 1: SrLyce (2.81 € en fichas) \nAsiento 2: lecontrebandier (1.47 € en fichas) \nAsiento 3: christoph363 (4.26 € en fichas) \nAsiento 4: oliverdu70 (3.72 € en fichas) \nAsiento 6: MitchATP65 (2 € en fichas) \nMitchATP65: pone la ciega pequeña 0.01 €\nSrLyce: pone la ciega grande 0.02 €\n*** CARTAS DE MANO ***\nRepartidas a SrLyce [Ad 8h]\nlecontrebandier: se retira \nchristoph363: se retira \noliverdu70: se retira \nMitchATP65: se retira \nLa apuesta no igualada (0.01 €) ha sido devuelta a SrLyce\nSrLyce se lleva 0.02 € del bote \nSrLyce: no muestra su mano \n*** RESUMEN ***\nBote total 0.02 € | Comisión 0 € \nAsiento 1: SrLyce (ciega grande) recaudó (0.02 €)\nAsiento 2: lecontrebandier se retiró antes del Flop (no apostó)\nAsiento 3: christoph363 se retiró antes del Flop (no apostó)\nAsiento 4: oliverdu70 (botón) se retiró antes del Flop (no apostó)\nAsiento 6: MitchATP65 (ciega pequeña) se retiró antes del Flop"
}