{
  "hand_id": "257237850717",
  "date": "06-08-2025 18:05:26",
  "table": "Euneus III",
  "game_type": "holdem",
  "hero": "SrLyce",
  "hero_position": "",
  "hero_cards": [
    "Qc",
    "9d"
  ],
  "stacks": {
    "Il_BM00": 106.5,
    "djrojas9": 149.0,
    "SrLyce": 108.0
  },
  "actions": {
    "preflop": [
      "Asiento 2: Il_BM00 (2.13 € en fichas)",
      "Asiento 3: djrojas9 (2.98 € en fichas)",
      "Asiento 5: SrLyce (2.16 € en fichas)",
      "SrLyce: pone la ciega pequeña 0.01 €",
      "Il_BM00: pone la ciega grande 0.02 €",
      "djrojas9: se retira",
      "SrLyce: sube 0.03 € a 0.05 €",
      "Il_BM00: iguala 0.03 €"
    ],
    "flop": [
      "SrLyce: pasa",
      "Il_BM00: pasa"
    ],
    "turn": [
      "SrLyce: pasa",
      "Il_BM00: apuesta 0.09 €",
      "SrLyce: se retira",
      "Il_BM00: no muestra su mano",
      "Asiento 2: Il_BM00 (ciega grande) recaudó (0.09 €)",
      "Asiento 3: djrojas9 (botón) se retiró antes del Flop (no apostó)",
      "Asiento 5: SrLyce (ciega pequeña) se retiró en el Turn"
    ],
    "river": []
  },
  "board": [
    "Ac",
    "8s",
    "8d",
    "6c"
  ],
  "winner": "Il_BM00",
  "win_amount": 4.5,
  "sb": 0.01,
  "bb": 0.02,
  "rake": 0.5,
  "raw_text": "Mano n.º 257237850717 de PokerStars:  Hold'em No Limit (0.01 €/0.02 € EUR) - 06-08-2025 18:05:26 CET [06-08-2025 12:05:26 ET]\nMesa \"Euneus III\" 6-max El asiento n.º 3 es el botón\nAsiento 2: Il_BM00 (2.13 € en fichas) \nAsiento 3: djrojas9 (2.98 € en fichas) \nAsiento 5: SrLyce (2.16 € en fichas) \nSrLyce: pone la ciega pequeña 0.01 €\nIl_BM00: pone la ciega grande 0.02 €\n*** CARTAS DE MANO ***\nRepartidas a SrLyce [Qc 9d]\ndjrojas9 ha agotado su tiempo\ndjrojas9: se retira \nSrLyce: sube 0.03 € a 0.05 €\nIl_BM00: iguala 0.03 €\n*** FLOP *** [Ac 8s 8d]\nSrLyce: pasa \nIl_BM00: pasa \n*** TURN *** [Ac 8s 8d] [6c]\nSrLyce: pasa \nJGDOBLAS se une a la mesa en el asiento n.º 4 \nchristgear se une a la mesa en el asiento n.º 1 \nIl_BM00: apuesta 0.09 €\nBegoton se une a la mesa en el asiento n.º 6 \nSrLyce: se retira \nLa apuesta no igualada (0.09 €) ha sido devuelta a Il_BM00\nIl_BM00 se lleva 0.09 € del bote \nIl_BM00: no muestra su mano \n*** RESUMEN ***\nBote total 0.10 € | Comisión 0.01 € \nComunitarias [Ac 8s 8d 6c]\nAsiento 2: Il_BM00 (ciega grande) recaudó (0.09 €)\nAsiento 3: djrojas9 (botón) se retiró antes del Flop (no apostó)\nAsiento 5: SrLyce (ciega pequeña) se retiró en el Turn"
}