{
  "hand_id": "257148919614",
  "date": "30-07-2025 21:53:19",
  "table": "Esclangona",
  "game_type": "holdem",
  "hero": "SrLyce",
  "hero_position": "",
  "hero_cards": [
    "Qc",
    "Js"
  ],
  "stacks": {
    "Zorgue1080": 89.5,
    "SrLyce": 158.0,
    "NoahBolete": 100.5,
    "Davdgoni": 100.0,
    "DiaZzZ1": 106.0,
    "berlcht403": 38.0
  },
  "actions": {
    "preflop": [
      "Asiento 1: Zorgue1080 (1.79 € en fichas)",
      "Asiento 2: SrLyce (3.16 € en fichas)",
      "Asiento 3: NoahBolete (2.01 € en fichas)",
      "Asiento 4: Davdgoni (2 € en fichas)",
      "Asiento 5: DiaZzZ1 (2.12 € en fichas)",
      "Asiento 6: berlcht403 (0.76 € en fichas)",
      "DiaZzZ1: pone la ciega pequeña 0.01 €",
      "berlcht403: pone la ciega grande 0.02 €",
      "Zorgue1080: se retira",
      "SrLyce: sube 0.04 € a 0.06 €",
      "NoahBolete: se retira",
      "Davdgoni: se retira",
      "DiaZzZ1: se retira",
      "berlcht403: se retira",
      "SrLyce: no muestra su mano",
      "Asiento 1: Zorgue1080 se retiró antes del Flop (no apostó)",
      "Asiento 2: SrLyce recaudó (0.05 €)",
      "Asiento 3: NoahBolete se retiró antes del Flop (no apostó)",
      "Asiento 4: Davdgoni (botón) se retiró antes del Flop (no apostó)",
      "Asiento 5: DiaZzZ1 (ciega pequeña) se retiró antes del Flop",
      "Asiento 6: berlcht403 (ciega grande) se retiró antes del Flop"
    ],
    "flop": [],
    "turn": [],
    "river": []
  },
  "board": [],
  "winner": "SrLyce",
  "win_amount": 2.5,
  "sb": 0.01,
  "bb": 0.02,
  "rake": 0.0,
  "raw_text": "Mano n.º 257148919614 de PokerStars:  Hold'em No Limit (0.01 €/0.02 € EUR) - 30-07-2025 21:53:19 CET [30-07-2025 15:53:19 ET]\nMesa \"Esclangona\" 6-max El asiento n.º 4 es el botón\nAsiento 1: Zorgue1080 (1.79 € en fichas) \nAsiento 2: SrLyce (3.16 € en fichas) \nAsiento 3: NoahBolete (2.01 € en fichas) \nAsiento 4: Davdgoni (2 € en fichas) \nAsiento 5: DiaZzZ1 (2.12 € en fichas) \nAsiento 6: berlcht403 (0.76 € en fichas) \nDiaZzZ1: pone la ciega pequeña 0.01 €\nberlcht403: pone la ciega grande 0.02 €\n*** CARTAS DE MANO ***\nRepartidas a SrLyce [Qc Js]\nZorgue1080: se retira \nSrLyce: sube 0.04 € a 0.06 €\nNoahBolete: se retira \nDavdgoni: se retira \nDiaZzZ1: se retira \nberlcht403: se retira \nLa apuesta no igualada (0.04 €) ha sido devuelta a SrLyce\nSrLyce se lleva 0.05 € del bote \nSrLyce: no muestra su mano \n*** RESUMEN ***\nBote total 0.05 € | Comisión 0 € \nAsiento 1: Zorgue1080 se retiró antes del Flop (no apostó)\nAsiento 2: SrLyce recaudó (0.05 €)\nAsiento 3: NoahBolete se retiró antes del Flop (no apostó)\nAsiento 4: Davdgoni (botón) se retiró antes del Flop (no apostó)\nAsiento 5: DiaZzZ1 (ciega pequeña) se retiró antes del Flop\nAsiento 6: berlcht403 (ciega grande) se retiró antes del Flop"
}