{
  "hand_id": "257238200383",
  "date": "06-08-2025 18:36:59",
  "table": "Atreus",
  "game_type": "holdem",
  "hero": "SrLyce",
  "hero_position": "",
  "hero_cards": [
    "4h",
    "Qh"
  ],
  "stacks": {
    "PrendsCa": 100.0,
    "Homerob1987": 37.0,
    "JENOFONTE73": 163.5,
    "Fharock": 85.0,
    "SrLyce": 143.0,
    "FishamanReggae": 34.0
  },
  "actions": {
    "preflop": [
      "Asiento 1: PrendsCa (2 € en fichas)",
      "Asiento 2: Homerob1987 (0.74 € en fichas)",
      "Asiento 3: JENOFONTE73 (3.27 € en fichas)",
      "Asiento 4: Fharock (1.70 € en fichas)",
      "Asiento 5: SrLyce (2.86 € en fichas)",
      "Asiento 6: FishamanReggae (0.68 € en fichas)",
      "Homerob1987: pone la ciega pequeña 0.01 €",
      "JENOFONTE73: pone la ciega grande 0.02 €",
      "Fharock: sube 0.04 € a 0.06 €",
      "SrLyce: se retira",
      "FishamanReggae: iguala 0.06 €",
      "PrendsCa: se retira",
      "Homerob1987: se retira",
      "JENOFONTE73: se retira"
    ],
    "flop": [
      "Fharock: pasa",
      "FishamanReggae: pasa"
    ],
    "turn": [
      "Fharock: apuesta 0.07 €",
      "FishamanReggae: se retira",
      "Asiento 1: PrendsCa (botón) se retiró antes del Flop (no apostó)",
      "Asiento 2: Homerob1987 (ciega pequeña) se retiró antes del Flop",
      "Asiento 3: JENOFONTE73 (ciega grande) se retiró antes del Flop",
      "Asiento 4: Fharock recaudó (0.14 €)",
      "Asiento 5: SrLyce se retiró antes del Flop (no apostó)",
      "Asiento 6: FishamanReggae se retiró en el Turn"
    ],
    "river": []
  },
  "board": [
    "3s",
    "3h",
    "6h",
    "9d"
  ],
  "winner": "Fharock",
  "win_amount": 7.0,
  "sb": 0.01,
  "bb": 0.02,
  "rake": 0.5,
  "raw_text": "Mano n.º 257238200383 de PokerStars:  Hold'em No Limit (0.01 €/0.02 € EUR) - 06-08-2025 18:36:59 CET [06-08-2025 12:36:59 ET]\nMesa \"Atreus\" 6-max El asiento n.º 1 es el botón\nAsiento 1: PrendsCa (2 € en fichas) \nAsiento 2: Homerob1987 (0.74 € en fichas) \nAsiento 3: JENOFONTE73 (3.27 € en fichas) \nAsiento 4: Fharock (1.70 € en fichas) \nAsiento 5: SrLyce (2.86 € en fichas) \nAsiento 6: FishamanReggae (0.68 € en fichas) \nHomerob1987: pone la ciega pequeña 0.01 €\nJENOFONTE73: pone la ciega grande 0.02 €\n*** CARTAS DE MANO ***\nRepartidas a SrLyce [4h Qh]\nFharock: sube 0.04 € a 0.06 €\nSrLyce: se retira \nFishamanReggae: iguala 0.06 €\nPrendsCa: se retira \nHomerob1987: se retira \nJENOFONTE73: se retira \n*** FLOP *** [3s 3h 6h]\nFharock: pasa \nFishamanReggae: pasa \n*** TURN *** [3s 3h 6h] [9d]\nFharock: apuesta 0.07 €\nFishamanReggae: se retira \nLa apuesta no igualada (0.07 €) ha sido devuelta a Fharock\nFharock se lleva 0.14 € del bote \n*** RESUMEN ***\nBote total 0.15 € | Comisión 0.01 € \nComunitarias [3s 3h 6h 9d]\nAsiento 1: PrendsCa (botón) se retiró antes del Flop (no apostó)\nAsiento 2: Homerob1987 (ciega pequeña) se retiró antes del Flop\nAsiento 3: JENOFONTE73 (ciega grande) se retiró antes del Flop\nAsiento 4: Fharock recaudó (0.14 €)\nAsiento 5: SrLyce se retiró antes del Flop (no apostó)\nAsiento 6: FishamanReggae se retiró en el Turn"
}