{
  "hand_id": "257238170592",
  "date": "06-08-2025 18:34:20",
  "table": "Patientia III",
  "game_type": "holdem",
  "hero": "SrLyce",
  "hero_position": "",
  "hero_cards": [
    "9d",
    "As"
  ],
  "stacks": {
    "Phryxz": 122.5,
    "SrLyce": 100.0,
    "chordewman": 106.5,
    "lehamock": 105.0,
    "niyomalo": 85.0
  },
  "actions": {
    "preflop": [
      "Asiento 1: Phryxz (2.45 € en fichas)",
      "Asiento 2: serviettski(fr) (2.51 € en fichas)",
      "Asiento 3: SrLyce (2 € en fichas)",
      "Asiento 4: chordewman (2.13 € en fichas)",
      "Asiento 5: lehamock (2.10 € en fichas)",
      "Asiento 6: niyomalo (1.70 € en fichas)",
      "serviettski(fr): pone la ciega pequeña 0.01 €",
      "SrLyce: pone la ciega grande 0.02 €",
      "chordewman: se retira",
      "lehamock: se retira",
      "niyomalo: se retira",
      "Phryxz: se retira",
      "serviettski(fr): sube 0.06 € a 0.08 €",
      "SrLyce: iguala 0.06 €"
    ],
    "flop": [
      "serviettski(fr): apuesta 0.05 €",
      "SrLyce: iguala 0.05 €"
    ],
    "turn": [
      "serviettski(fr): pasa",
      "SrLyce: apuesta 0.12 €",
      "serviettski(fr): iguala 0.12 €"
    ],
    "river": [
      "serviettski(fr): pasa",
      "SrLyce: apuesta 0.38 €",
      "serviettski(fr): iguala 0.38 €",
      "SrLyce: muestra [9d As] (carta alta as)",
      "serviettski(fr): muestra [7s 7d] (pareja de sietes)",
      "Asiento 1: Phryxz (botón) se retiró antes del Flop (no apostó)",
      "Asiento 2: serviettski(fr) (ciega pequeña) muestra [7s 7d] y ganó (1.18 €) con pareja de sietes",
      "Asiento 3: SrLyce (ciega grande) muestra [9d As] y perdió con carta alta as",
      "Asiento 4: chordewman se retiró antes del Flop (no apostó)",
      "Asiento 5: lehamock se retiró antes del Flop (no apostó)",
      "Asiento 6: niyomalo se retiró antes del Flop (no apostó)"
    ]
  },
  "board": [
    "6s",
    "3c",
    "Td",
    "8d",
    "4c"
  ],
  "winner": "serviettski(fr)",
  "win_amount": 59.0,
  "sb": 0.01,
  "bb": 0.02,
  "rake": 4.0,
  "raw_text": "Mano n.º 257238170592 de PokerStars:  Hold'em No Limit (0.01 €/0.02 € EUR) - 06-08-2025 18:34:20 CET [06-08-2025 12:34:20 ET]\nMesa \"Patientia III\" 6-max El asiento n.º 1 es el botón\nAsiento 1: Phryxz (2.45 € en fichas) \nAsiento 2: serviettski(fr) (2.51 € en fichas) \nAsiento 3: SrLyce (2 € en fichas) \nAsiento 4: chordewman (2.13 € en fichas) \nAsiento 5: lehamock (2.10 € en fichas) \nAsiento 6: niyomalo (1.70 € en fichas) \nserviettski(fr): pone la ciega pequeña 0.01 €\nSrLyce: pone la ciega grande 0.02 €\n*** CARTAS DE MANO ***\nRepartidas a SrLyce [9d As]\nchordewman: se retira \nlehamock: se retira \nniyomalo: se retira \nPhryxz: se retira \nserviettski(fr): sube 0.06 € a 0.08 €\nSrLyce: iguala 0.06 €\n*** FLOP *** [6s 3c Td]\nserviettski(fr): apuesta 0.05 €\nSrLyce: iguala 0.05 €\n*** TURN *** [6s 3c Td] [8d]\nserviettski(fr): pasa \nSrLyce: apuesta 0.12 €\nserviettski(fr): iguala 0.12 €\n*** RIVER *** [6s 3c Td 8d] [4c]\nserviettski(fr): pasa \nSrLyce: apuesta 0.38 €\nserviettski(fr): iguala 0.38 €\n*** SHOW DOWN ***\nSrLyce: muestra [9d As] (carta alta as)\nserviettski(fr): muestra [7s 7d] (pareja de sietes)\nserviettski(fr) se lleva 1.18 € del bote \n*** RESUMEN ***\nBote total 1.26 € | Comisión 0.08 € \nComunitarias [6s 3c Td 8d 4c]\nAsiento 1: Phryxz (botón) se retiró antes del Flop (no apostó)\nAsiento 2: serviettski(fr) (ciega pequeña) muestra [7s 7d] y ganó (1.18 €) con pareja de sietes\nAsiento 3: SrLyce (ciega grande) muestra [9d As] y perdió con carta alta as\nAsiento 4: chordewman se retiró antes del Flop (no apostó)\nAsiento 5: lehamock se retiró antes del Flop (no apostó)\nAsiento 6: niyomalo se retiró antes del Flop (no apostó)"
}