{
  "hand_id": "257150267065",
  "date": "30-07-2025 23:29:51",
  "table": "Lobelia",
  "game_type": "holdem",
  "hero": "SrLyce",
  "hero_position": "",
  "hero_cards": [
    "3c",
    "2d"
  ],
  "stacks": {
    "LeVbks": 124.0,
    "fcis666": 47.0,
    "Dlaguancha": 113.5,
    "SrLyce": 105.5,
    "riverluck444": 86.0,
    "javipondio": 13.5
  },
  "actions": {
    "preflop": [
      "Asiento 1: LeVbks (2.48 € en fichas)",
      "Asiento 2: fcis666 (0.94 € en fichas)",
      "Asiento 3: Dlaguancha (2.27 € en fichas)",
      "Asiento 4: SrLyce (2.11 € en fichas)",
      "Asiento 5: riverluck444 (1.72 € en fichas)",
      "Asiento 6: javipondio (0.27 € en fichas)",
      "javipondio: pone la ciega pequeña 0.01 €",
      "LeVbks: pone la ciega grande 0.02 €",
      "fcis666: se retira",
      "Dlaguancha: iguala 0.02 €",
      "SrLyce: se retira",
      "riverluck444: se retira",
      "javipondio: sube 0.02 € a 0.04 €",
      "LeVbks: iguala 0.02 €",
      "Dlaguancha: iguala 0.02 €"
    ],
    "flop": [
      "javipondio: pasa",
      "LeVbks: apuesta 2.44 € y está all-in",
      "Dlaguancha: se retira",
      "javipondio: se retira",
      "LeVbks: no muestra su mano",
      "Asiento 1: LeVbks (ciega grande) recaudó (0.11 €)",
      "Asiento 2: fcis666 se retiró antes del Flop (no apostó)",
      "Asiento 3: Dlaguancha se retiró en el Flop",
      "Asiento 4: SrLyce se retiró antes del Flop (no apostó)",
      "Asiento 5: riverluck444 (botón) se retiró antes del Flop (no apostó)",
      "Asiento 6: javipondio (ciega pequeña) se retiró en el Flop"
    ],
    "turn": [],
    "river": []
  },
  "board": [
    "Jh",
    "8s",
    "Js"
  ],
  "winner": "LeVbks",
  "win_amount": 5.5,
  "sb": 0.01,
  "bb": 0.02,
  "rake": 0.5,
  "raw_text": "Mano n.º 257150267065 de PokerStars:  Hold'em No Limit (0.01 €/0.02 € EUR) - 30-07-2025 23:29:51 CET [30-07-2025 17:29:51 ET]\nMesa \"Lobelia\" 6-max El asiento n.º 5 es el botón\nAsiento 1: LeVbks (2.48 € en fichas) \nAsiento 2: fcis666 (0.94 € en fichas) \nAsiento 3: Dlaguancha (2.27 € en fichas) \nAsiento 4: SrLyce (2.11 € en fichas) \nAsiento 5: riverluck444 (1.72 € en fichas) \nAsiento 6: javipondio (0.27 € en fichas) \njavipondio: pone la ciega pequeña 0.01 €\nLeVbks: pone la ciega grande 0.02 €\n*** CARTAS DE MANO ***\nRepartidas a SrLyce [3c 2d]\nfcis666: se retira \nDlaguancha: iguala 0.02 €\nSrLyce: se retira \nriverluck444: se retira \njavipondio: sube 0.02 € a 0.04 €\nLeVbks: iguala 0.02 €\nDlaguancha: iguala 0.02 €\n*** FLOP *** [Jh 8s Js]\njavipondio: pasa \nLeVbks: apuesta 2.44 € y está all-in\nDlaguancha: se retira \njavipondio: se retira \nLa apuesta no igualada (2.44 €) ha sido devuelta a LeVbks\nLeVbks se lleva 0.11 € del bote \nLeVbks: no muestra su mano \n*** RESUMEN ***\nBote total 0.12 € | Comisión 0.01 € \nComunitarias [Jh 8s Js]\nAsiento 1: LeVbks (ciega grande) recaudó (0.11 €)\nAsiento 2: fcis666 se retiró antes del Flop (no apostó)\nAsiento 3: Dlaguancha se retiró en el Flop\nAsiento 4: SrLyce se retiró antes del Flop (no apostó)\nAsiento 5: riverluck444 (botón) se retiró antes del Flop (no apostó)\nAsiento 6: javipondio (ciega pequeña) se retiró en el Flop"
}