{
  "hand_id": "257238298161",
  "date": "06-08-2025 18:45:37",
  "table": "Aidamina II",
  "game_type": "holdem",
  "hero": "SrLyce",
  "hero_position": "",
  "hero_cards": [
    "8c",
    "Ad"
  ],
  "stacks": {
    "GarciaTT416": 104.0,
    "McFlash3": 104.0,
    "niyomalo": 126.5,
    "durahimovic": 127.5,
    "JustWin9960": 100.0,
    "SrLyce": 92.5
  },
  "actions": {
    "preflop": [
      "Asiento 1: GarciaTT416 (2.08 € en fichas)",
      "Asiento 2: McFlash3 (2.08 € en fichas)",
      "Asiento 3: niyomalo (2.53 € en fichas)",
      "Asiento 4: durahimovic (2.55 € en fichas)",
      "Asiento 5: JustWin9960 (2 € en fichas)",
      "Asiento 6: SrLyce (1.85 € en fichas)",
      "GarciaTT416: pone la ciega pequeña 0.01 €",
      "McFlash3: pone la ciega grande 0.02 €",
      "JustWin9960: pone la ciega grande 0.02 €",
      "niyomalo: se retira",
      "durahimovic: se retira",
      "JustWin9960: pasa",
      "SrLyce: sube 0.04 € a 0.06 €",
      "GarciaTT416: iguala 0.05 €",
      "McFlash3: se retira",
      "JustWin9960: iguala 0.04 €"
    ],
    "flop": [
      "GarciaTT416: pasa",
      "JustWin9960: apuesta 0.02 €",
      "SrLyce: iguala 0.02 €",
      "GarciaTT416: iguala 0.02 €"
    ],
    "turn": [
      "GarciaTT416: pasa",
      "JustWin9960: apuesta 0.06 €",
      "SrLyce: se retira",
      "GarciaTT416: se retira",
      "JustWin9960: no muestra su mano",
      "Asiento 1: GarciaTT416 (ciega pequeña) se retiró en el Turn",
      "Asiento 2: McFlash3 (ciega grande) se retiró antes del Flop",
      "Asiento 3: niyomalo se retiró antes del Flop (no apostó)",
      "Asiento 4: durahimovic se retiró antes del Flop (no apostó)",
      "Asiento 5: JustWin9960 recaudó (0.24 €)",
      "Asiento 6: SrLyce (botón) se retiró en el Turn"
    ],
    "river": []
  },
  "board": [
    "9h",
    "5d",
    "3d",
    "Js"
  ],
  "winner": "JustWin9960",
  "win_amount": 12.0,
  "sb": 0.01,
  "bb": 0.02,
  "rake": 1.0,
  "raw_text": "Mano n.º 257238298161 de PokerStars:  Hold'em No Limit (0.01 €/0.02 € EUR) - 06-08-2025 18:45:37 CET [06-08-2025 12:45:37 ET]\nMesa \"Aidamina II\" 6-max El asiento n.º 6 es el botón\nAsiento 1: GarciaTT416 (2.08 € en fichas) \nAsiento 2: McFlash3 (2.08 € en fichas) \nAsiento 3: niyomalo (2.53 € en fichas) \nAsiento 4: durahimovic (2.55 € en fichas) \nAsiento 5: JustWin9960 (2 € en fichas) \nAsiento 6: SrLyce (1.85 € en fichas) \nGarciaTT416: pone la ciega pequeña 0.01 €\nMcFlash3: pone la ciega grande 0.02 €\nJustWin9960: pone la ciega grande 0.02 €\n*** CARTAS DE MANO ***\nRepartidas a SrLyce [8c Ad]\nniyomalo: se retira \ndurahimovic: se retira \nJustWin9960: pasa \nSrLyce: sube 0.04 € a 0.06 €\nGarciaTT416: iguala 0.05 €\nMcFlash3: se retira \nJustWin9960: iguala 0.04 €\n*** FLOP *** [9h 5d 3d]\nGarciaTT416: pasa \nJustWin9960: apuesta 0.02 €\nSrLyce: iguala 0.02 €\nGarciaTT416: iguala 0.02 €\n*** TURN *** [9h 5d 3d] [Js]\nGarciaTT416: pasa \nJustWin9960: apuesta 0.06 €\nSrLyce: se retira \nGarciaTT416: se retira \nLa apuesta no igualada (0.06 €) ha sido devuelta a JustWin9960\nJustWin9960 se lleva 0.24 € del bote \nJustWin9960: no muestra su mano \n*** RESUMEN ***\nBote total 0.26 € | Comisión 0.02 € \nComunitarias [9h 5d 3d Js]\nAsiento 1: GarciaTT416 (ciega pequeña) se retiró en el Turn\nAsiento 2: McFlash3 (ciega grande) se retiró antes del Flop\nAsiento 3: niyomalo se retiró antes del Flop (no apostó)\nAsiento 4: durahimovic se retiró antes del Flop (no apostó)\nAsiento 5: JustWin9960 recaudó (0.24 €)\nAsiento 6: SrLyce (botón) se retiró en el Turn"
}