{
  "hand_id": "257238581869",
  "date": "06-08-2025 19:11:52",
  "table": "Herculina II",
  "game_type": "holdem",
  "hero": "SrLyce",
  "hero_position": "",
  "hero_cards": [
    "8h",
    "2c"
  ],
  "stacks": {
    "Alceo27": 100.0,
    "David98X": 176.5,
    "JJer11": 205.0,
    "SrLyce": 95.5,
    "Macklemore0": 100.0,
    "ScarvBlack": 120.5
  },
  "actions": {
    "preflop": [
      "Asiento 1: Alceo27 (2 € en fichas)",
      "Asiento 2: David98X (3.53 € en fichas)",
      "Asiento 3: JJer11 (4.10 € en fichas)",
      "Asiento 4: SrLyce (1.91 € en fichas)",
      "Asiento 5: Macklemore0 (2 € en fichas)",
      "Asiento 6: ScarvBlack (2.41 € en fichas)",
      "JJer11: pone la ciega pequeña 0.01 €",
      "SrLyce: pone la ciega grande 0.02 €",
      "Macklemore0: sube 0.04 € a 0.06 €",
      "ScarvBlack: se retira",
      "Alceo27: se retira",
      "David98X: iguala 0.06 €",
      "JJer11: se retira",
      "SrLyce: se retira"
    ],
    "flop": [
      "Macklemore0: pasa",
      "David98X: pasa"
    ],
    "turn": [
      "Macklemore0: apuesta 0.11 €",
      "David98X: se retira",
      "Macklemore0: no muestra su mano",
      "Asiento 1: Alceo27 se retiró antes del Flop (no apostó)",
      "Asiento 2: David98X (botón) se retiró en el Turn",
      "Asiento 3: JJer11 (ciega pequeña) se retiró antes del Flop",
      "Asiento 4: SrLyce (ciega grande) se retiró antes del Flop",
      "Asiento 5: Macklemore0 recaudó (0.14 €)",
      "Asiento 6: ScarvBlack se retiró antes del Flop (no apostó)"
    ],
    "river": []
  },
  "board": [
    "5s",
    "6d",
    "9c",
    "5d"
  ],
  "winner": "Macklemore0",
  "win_amount": 7.0,
  "sb": 0.01,
  "bb": 0.02,
  "rake": 0.5,
  "raw_text": "Mano n.º 257238581869 de PokerStars:  Hold'em No Limit (0.01 €/0.02 € EUR) - 06-08-2025 19:11:52 CET [06-08-2025 13:11:52 ET]\nMesa \"Herculina II\" 6-max El asiento n.º 2 es el botón\nAsiento 1: Alceo27 (2 € en fichas) \nAsiento 2: David98X (3.53 € en fichas) \nAsiento 3: JJer11 (4.10 € en fichas) \nAsiento 4: SrLyce (1.91 € en fichas) \nAsiento 5: Macklemore0 (2 € en fichas) \nAsiento 6: ScarvBlack (2.41 € en fichas) \nJJer11: pone la ciega pequeña 0.01 €\nSrLyce: pone la ciega grande 0.02 €\n*** CARTAS DE MANO ***\nRepartidas a SrLyce [8h 2c]\nMacklemore0: sube 0.04 € a 0.06 €\nScarvBlack: se retira \nAlceo27: se retira \nDavid98X: iguala 0.06 €\nJJer11: se retira \nSrLyce: se retira \n*** FLOP *** [5s 6d 9c]\nMacklemore0: pasa \nDavid98X: pasa \n*** TURN *** [5s 6d 9c] [5d]\nMacklemore0: apuesta 0.11 €\nDavid98X: se retira \nLa apuesta no igualada (0.11 €) ha sido devuelta a Macklemore0\nMacklemore0 se lleva 0.14 € del bote \nMacklemore0: no muestra su mano \n*** RESUMEN ***\nBote total 0.15 € | Comisión 0.01 € \nComunitarias [5s 6d 9c 5d]\nAsiento 1: Alceo27 se retiró antes del Flop (no apostó)\nAsiento 2: David98X (botón) se retiró en el Turn\nAsiento 3: JJer11 (ciega pequeña) se retiró antes del Flop\nAsiento 4: SrLyce (ciega grande) se retiró antes del Flop\nAsiento 5: Macklemore0 recaudó (0.14 €)\nAsiento 6: ScarvBlack se retiró antes del Flop (no apostó)"
}