{
  "hand_id": "257149142407",
  "date": "30-07-2025 22:11:00",
  "table": "Sirona",
  "game_type": "holdem",
  "hero": "SrLyce",
  "hero_position": "",
  "hero_cards": [
    "4s",
    "6s"
  ],
  "stacks": {
    "oliverdu70": 186.0,
    "hadhod1976": 40.0,
    "SrLyce": 136.0,
    "christoph363": 218.5,
    "MitchATP65": 100.5
  },
  "actions": {
    "preflop": [
      "Asiento 4: oliverdu70 (3.72 € en fichas) está ausente",
      "Asiento 5: hadhod1976 (0.80 € en fichas) está ausente",
      "Asiento 1: SrLyce (2.72 € en fichas)",
      "Asiento 3: christoph363 (4.37 € en fichas)",
      "Asiento 6: MitchATP65 (2.01 € en fichas)",
      "MitchATP65: pone la ciega pequeña 0.01 €",
      "SrLyce: pone la ciega grande 0.02 €",
      "christoph363: se retira",
      "MitchATP65: sube 0.04 € a 0.06 €",
      "SrLyce: iguala 0.04 €"
    ],
    "flop": [
      "MitchATP65: pasa",
      "SrLyce: pasa"
    ],
    "turn": [
      "MitchATP65: apuesta 0.06 €",
      "SrLyce: se retira",
      "MitchATP65: no muestra su mano",
      "Asiento 4: oliverdu70",
      "Asiento 5: hadhod1976",
      "Asiento 1: SrLyce (ciega grande) se retiró en el Turn",
      "Asiento 3: christoph363 (botón) se retiró antes del Flop (no apostó)",
      "Asiento 6: MitchATP65 (ciega pequeña) recaudó (0.11 €)"
    ],
    "river": []
  },
  "board": [
    "Ad",
    "Kd",
    "Qh",
    "2h"
  ],
  "winner": "MitchATP65",
  "win_amount": 5.5,
  "sb": 0.01,
  "bb": 0.02,
  "rake": 0.5,
  "raw_text": "Mano n.º 257149142407 de PokerStars:  Hold'em No Limit (0.01 €/0.02 € EUR) - 30-07-2025 22:11:00 CET [30-07-2025 16:11:00 ET]\nMesa \"Sirona\" 6-max El asiento n.º 3 es el botón\nAsiento 4: oliverdu70 (3.72 € en fichas) está ausente\nAsiento 5: hadhod1976 (0.80 € en fichas) está ausente\nAsiento 1: SrLyce (2.72 € en fichas) \nAsiento 3: christoph363 (4.37 € en fichas) \nAsiento 6: MitchATP65 (2.01 € en fichas) \nMitchATP65: pone la ciega pequeña 0.01 €\nSrLyce: pone la ciega grande 0.02 €\n*** CARTAS DE MANO ***\nRepartidas a SrLyce [4s 6s]\nchristoph363: se retira \nMitchATP65: sube 0.04 € a 0.06 €\nSrLyce: iguala 0.04 €\n*** FLOP *** [Ad Kd Qh]\nMitchATP65: pasa \nSrLyce: pasa \n*** TURN *** [Ad Kd Qh] [2h]\nTropki se une a la mesa en el asiento n.º 2 \nMitchATP65: apuesta 0.06 €\nSrLyce: se retira \nLa apuesta no igualada (0.06 €) ha sido devuelta a MitchATP65\nMitchATP65 se lleva 0.11 € del bote \nMitchATP65: no muestra su mano \n*** RESUMEN ***\nBote total 0.12 € | Comisión 0.01 € \nComunitarias [Ad Kd Qh 2h]\nAsiento 4: oliverdu70\nAsiento 5: hadhod1976\nAsiento 1: SrLyce (ciega grande) se retiró en el Turn\nAsiento 3: christoph363 (botón) se retiró antes del Flop (no apostó)\nAsiento 6: MitchATP65 (ciega pequeña) recaudó (0.11 €)"
}