{
  "hand_id": "257238010766",
  "date": "06-08-2025 18:20:04",
  "table": "Atreus",
  "game_type": "holdem",
  "hero": "SrLyce",
  "hero_position": "",
  "hero_cards": [
    "As",
    "5c"
  ],
  "stacks": {
    "PrendsCa": 100.0,
    "NRules82": 62.5,
    "JENOFONTE73": 145.0,
    "Fharock": 90.0,
    "SrLyce": 129.5,
    "FishamanReggae": 29.5
  },
  "actions": {
    "preflop": [
      "Asiento 1: PrendsCa (2 € en fichas)",
      "Asiento 2: NRules82 (1.25 € en fichas)",
      "Asiento 3: JENOFONTE73 (2.90 € en fichas)",
      "Asiento 4: Fharock (1.80 € en fichas)",
      "Asiento 5: SrLyce (2.59 € en fichas)",
      "Asiento 6: FishamanReggae (0.59 € en fichas)",
      "Fharock: pone la ciega pequeña 0.01 €",
      "SrLyce: pone la ciega grande 0.02 €",
      "FishamanReggae: iguala 0.02 €",
      "PrendsCa: sube 0.02 € a 0.04 €",
      "NRules82: se retira",
      "JENOFONTE73: iguala 0.04 €",
      "Fharock: se retira",
      "SrLyce: iguala 0.02 €",
      "FishamanReggae: iguala 0.02 €"
    ],
    "flop": [
      "SrLyce: pasa",
      "FishamanReggae: pasa",
      "PrendsCa: apuesta 0.16 €",
      "JENOFONTE73: se retira",
      "SrLyce: se retira",
      "FishamanReggae: se retira",
      "PrendsCa: no muestra su mano",
      "Asiento 1: PrendsCa recaudó (0.16 €)",
      "Asiento 2: NRules82 se retiró antes del Flop (no apostó)",
      "Asiento 3: JENOFONTE73 (botón) se retiró en el Flop",
      "Asiento 4: Fharock (ciega pequeña) se retiró antes del Flop",
      "Asiento 5: SrLyce (ciega grande) se retiró en el Flop",
      "Asiento 6: FishamanReggae se retiró en el Flop"
    ],
    "turn": [],
    "river": []
  },
  "board": [
    "4h",
    "7s",
    "Qd"
  ],
  "winner": "PrendsCa",
  "win_amount": 8.0,
  "sb": 0.01,
  "bb": 0.02,
  "rake": 0.5,
  "raw_text": "Mano n.º 257238010766 de PokerStars:  Hold'em No Limit (0.01 €/0.02 € EUR) - 06-08-2025 18:20:04 CET [06-08-2025 12:20:04 ET]\nMesa \"Atreus\" 6-max El asiento n.º 3 es el botón\nAsiento 1: PrendsCa (2 € en fichas) \nAsiento 2: NRules82 (1.25 € en fichas) \nAsiento 3: JENOFONTE73 (2.90 € en fichas) \nAsiento 4: Fharock (1.80 € en fichas) \nAsiento 5: SrLyce (2.59 € en fichas) \nAsiento 6: FishamanReggae (0.59 € en fichas) \nFharock: pone la ciega pequeña 0.01 €\nSrLyce: pone la ciega grande 0.02 €\n*** CARTAS DE MANO ***\nRepartidas a SrLyce [As 5c]\nFishamanReggae: iguala 0.02 €\nPrendsCa: sube 0.02 € a 0.04 €\nNRules82: se retira \nJENOFONTE73: iguala 0.04 €\nFharock: se retira \nSrLyce: iguala 0.02 €\nFishamanReggae: iguala 0.02 €\n*** FLOP *** [4h 7s Qd]\nSrLyce: pasa \nFishamanReggae: pasa \nPrendsCa: apuesta 0.16 €\nJENOFONTE73: se retira \nSrLyce: se retira \nFishamanReggae: se retira \nLa apuesta no igualada (0.16 €) ha sido devuelta a PrendsCa\nPrendsCa se lleva 0.16 € del bote \nPrendsCa: no muestra su mano \n*** RESUMEN ***\nBote total 0.17 € | Comisión 0.01 € \nComunitarias [4h 7s Qd]\nAsiento 1: PrendsCa recaudó (0.16 €)\nAsiento 2: NRules82 se retiró antes del Flop (no apostó)\nAsiento 3: JENOFONTE73 (botón) se retiró en el Flop\nAsiento 4: Fharock (ciega pequeña) se retiró antes del Flop\nAsiento 5: SrLyce (ciega grande) se retiró en el Flop\nAsiento 6: FishamanReggae se retiró en el Flop"
}