{
  "hand_id": "257238792996",
  "date": "06-08-2025 19:29:29",
  "table": "Herculina II",
  "game_type": "holdem",
  "hero": "SrLyce",
  "hero_position": "",
  "hero_cards": [
    "9d",
    "Ac"
  ],
  "stacks": {
    "Alceo27": 118.0,
    "David98X": 132.0,
    "JJer11": 187.5,
    "SrLyce": 143.0,
    "Macklemore0": 102.5,
    "ScarvBlack": 116.0
  },
  "actions": {
    "preflop": [
      "Asiento 1: Alceo27 (2.36 € en fichas)",
      "Asiento 2: David98X (2.64 € en fichas)",
      "Asiento 3: JJer11 (3.75 € en fichas)",
      "Asiento 4: SrLyce (2.86 € en fichas)",
      "Asiento 5: Macklemore0 (2.05 € en fichas)",
      "Asiento 6: ScarvBlack (2.32 € en fichas)",
      "Alceo27: pone la ciega pequeña 0.01 €",
      "David98X: pone la ciega grande 0.02 €",
      "JJer11: se retira",
      "SrLyce: sube 0.03 € a 0.05 €",
      "Macklemore0: se retira",
      "ScarvBlack: iguala 0.05 €",
      "Alceo27: se retira",
      "David98X: iguala 0.03 €"
    ],
    "flop": [
      "David98X: pasa",
      "SrLyce: pasa",
      "ScarvBlack: apuesta 0.08 €",
      "David98X: se retira",
      "SrLyce: iguala 0.08 €"
    ],
    "turn": [
      "SrLyce: pasa",
      "ScarvBlack: pasa"
    ],
    "river": [
      "SrLyce: apuesta 0.15 €",
      "ScarvBlack: sube 0.60 € a 0.75 €",
      "SrLyce: se retira",
      "ScarvBlack: no muestra su mano",
      "Asiento 1: Alceo27 (ciega pequeña) se retiró antes del Flop",
      "Asiento 2: David98X (ciega grande) se retiró en el Flop",
      "Asiento 3: JJer11 se retiró antes del Flop (no apostó)",
      "Asiento 4: SrLyce se retiró en el River",
      "Asiento 5: Macklemore0 se retiró antes del Flop (no apostó)",
      "Asiento 6: ScarvBlack (botón) recaudó (0.58 €)"
    ]
  },
  "board": [
    "7h",
    "Th",
    "5s",
    "3c",
    "6s"
  ],
  "winner": "ScarvBlack",
  "win_amount": 29.0,
  "sb": 0.01,
  "bb": 0.02,
  "rake": 2.0,
  "raw_text": "Mano n.º 257238792996 de PokerStars:  Hold'em No Limit (0.01 €/0.02 € EUR) - 06-08-2025 19:29:29 CET [06-08-2025 13:29:29 ET]\nMesa \"Herculina II\" 6-max El asiento n.º 6 es el botón\nAsiento 1: Alceo27 (2.36 € en fichas) \nAsiento 2: David98X (2.64 € en fichas) \nAsiento 3: JJer11 (3.75 € en fichas) \nAsiento 4: SrLyce (2.86 € en fichas) \nAsiento 5: Macklemore0 (2.05 € en fichas) \nAsiento 6: ScarvBlack (2.32 € en fichas) \nAlceo27: pone la ciega pequeña 0.01 €\nDavid98X: pone la ciega grande 0.02 €\n*** CARTAS DE MANO ***\nRepartidas a SrLyce [9d Ac]\nJJer11: se retira \nSrLyce: sube 0.03 € a 0.05 €\nMacklemore0: se retira \nScarvBlack: iguala 0.05 €\nAlceo27: se retira \nDavid98X: iguala 0.03 €\n*** FLOP *** [7h Th 5s]\nDavid98X: pasa \nSrLyce: pasa \nScarvBlack: apuesta 0.08 €\nDavid98X: se retira \nSrLyce: iguala 0.08 €\n*** TURN *** [7h Th 5s] [3c]\nSrLyce: pasa \nScarvBlack: pasa \n*** RIVER *** [7h Th 5s 3c] [6s]\nSrLyce: apuesta 0.15 €\nScarvBlack: sube 0.60 € a 0.75 €\nSrLyce: se retira \nLa apuesta no igualada (0.60 €) ha sido devuelta a ScarvBlack\nScarvBlack se lleva 0.58 € del bote \nScarvBlack: no muestra su mano \n*** RESUMEN ***\nBote total 0.62 € | Comisión 0.04 € \nComunitarias [7h Th 5s 3c 6s]\nAsiento 1: Alceo27 (ciega pequeña) se retiró antes del Flop\nAsiento 2: David98X (ciega grande) se retiró en el Flop\nAsiento 3: JJer11 se retiró antes del Flop (no apostó)\nAsiento 4: SrLyce se retiró en el River\nAsiento 5: Macklemore0 se retiró antes del Flop (no apostó)\nAsiento 6: ScarvBlack (botón) recaudó (0.58 €)"
}