{
  "hand_id": "257148726535",
  "date": "30-07-2025 21:39:42",
  "table": "Sirona",
  "game_type": "holdem",
  "hero": "SrLyce",
  "hero_position": "",
  "hero_cards": [
    "9c",
    "7c"
  ],
  "stacks": {
    "SrLyce": 91.5,
    "lecontrebandier": 97.0,
    "christoph363": 180.5,
    "oliverdu70": 105.0,
    "olibellier": 31.0,
    "Dakoo44": 109.5
  },
  "actions": {
    "preflop": [
      "Asiento 1: SrLyce (1.83 € en fichas)",
      "Asiento 2: lecontrebandier (1.94 € en fichas)",
      "Asiento 3: christoph363 (3.61 € en fichas)",
      "Asiento 4: oliverdu70 (2.10 € en fichas)",
      "Asiento 5: olibellier (0.62 € en fichas)",
      "Asiento 6: Dakoo44 (2.19 € en fichas)",
      "Dakoo44: pone la ciega pequeña 0.01 €",
      "SrLyce: pone la ciega grande 0.02 €",
      "lecontrebandier: se retira",
      "christoph363: se retira",
      "oliverdu70: iguala 0.02 €",
      "olibellier: iguala 0.02 €",
      "Dakoo44: iguala 0.01 €",
      "SrLyce: pasa"
    ],
    "flop": [
      "Dakoo44: pasa",
      "SrLyce: pasa",
      "oliverdu70: pasa",
      "olibellier: pasa"
    ],
    "turn": [
      "Dakoo44: pasa",
      "SrLyce: pasa",
      "oliverdu70: pasa",
      "olibellier: pasa"
    ],
    "river": [
      "Dakoo44: apuesta 0.06 €",
      "SrLyce: se retira",
      "oliverdu70: se retira",
      "olibellier: se retira",
      "Dakoo44: no muestra su mano",
      "Asiento 1: SrLyce (ciega grande) se retiró en el River",
      "Asiento 2: lecontrebandier se retiró antes del Flop (no apostó)",
      "Asiento 3: christoph363 se retiró antes del Flop (no apostó)",
      "Asiento 4: oliverdu70 se retiró en el River",
      "Asiento 5: olibellier (botón) se retiró en el River",
      "Asiento 6: Dakoo44 (ciega pequeña) recaudó (0.08 €)"
    ]
  },
  "board": [
    "6s",
    "Jh",
    "6c",
    "2d",
    "Qd"
  ],
  "winner": "Dakoo44",
  "win_amount": 4.0,
  "sb": 0.01,
  "bb": 0.02,
  "rake": 0.0,
  "raw_text": "Mano n.º 257148726535 de PokerStars:  Hold'em No Limit (0.01 €/0.02 € EUR) - 30-07-2025 21:39:42 CET [30-07-2025 15:39:42 ET]\nMesa \"Sirona\" 6-max El asiento n.º 5 es el botón\nAsiento 1: SrLyce (1.83 € en fichas) \nAsiento 2: lecontrebandier (1.94 € en fichas) \nAsiento 3: christoph363 (3.61 € en fichas) \nAsiento 4: oliverdu70 (2.10 € en fichas) \nAsiento 5: olibellier (0.62 € en fichas) \nAsiento 6: Dakoo44 (2.19 € en fichas) \nDakoo44: pone la ciega pequeña 0.01 €\nSrLyce: pone la ciega grande 0.02 €\n*** CARTAS DE MANO ***\nRepartidas a SrLyce [9c 7c]\nlecontrebandier: se retira \nchristoph363: se retira \noliverdu70: iguala 0.02 €\nolibellier: iguala 0.02 €\nDakoo44: iguala 0.01 €\nSrLyce: pasa \n*** FLOP *** [6s Jh 6c]\nDakoo44: pasa \nSrLyce: pasa \noliverdu70: pasa \nolibellier: pasa \n*** TURN *** [6s Jh 6c] [2d]\nDakoo44: pasa \nSrLyce: pasa \noliverdu70: pasa \nolibellier: pasa \n*** RIVER *** [6s Jh 6c 2d] [Qd]\nDakoo44: apuesta 0.06 €\nSrLyce: se retira \noliverdu70: se retira \nolibellier: se retira \nLa apuesta no igualada (0.06 €) ha sido devuelta a Dakoo44\nDakoo44 se lleva 0.08 € del bote \nDakoo44: no muestra su mano \n*** RESUMEN ***\nBote total 0.08 € | Comisión 0 € \nComunitarias [6s Jh 6c 2d Qd]\nAsiento 1: SrLyce (ciega grande) se retiró en el River\nAsiento 2: lecontrebandier se retiró antes del Flop (no apostó)\nAsiento 3: christoph363 se retiró antes del Flop (no apostó)\nAsiento 4: oliverdu70 se retiró en el River\nAsiento 5: olibellier (botón) se retiró en el River\nAsiento 6: Dakoo44 (ciega pequeña) recaudó (0.08 €)"
}