{
  "hand_id": "257238122481",
  "date": "06-08-2025 18:30:03",
  "table": "Alruccabah II",
  "game_type": "holdem",
  "hero": "SrLyce",
  "hero_position": "",
  "hero_cards": [
    "Jd",
    "8c"
  ],
  "stacks": {
    "SrLyce": 97.0,
    "Davdgoni": 256.5,
    "PerroBestia": 41.5,
    "Nicanor Cast": 54.0,
    "THEBLACK972": 173.5
  },
  "actions": {
    "preflop": [
      "Asiento 1: SrLyce (1.94 € en fichas)",
      "Asiento 2: Davdgoni (5.13 € en fichas)",
      "Asiento 3: PerroBestia (0.83 € en fichas)",
      "Asiento 4: serviettski(fr) (2.14 € en fichas)",
      "Asiento 5: Nicanor Cast (1.08 € en fichas)",
      "Asiento 6: THEBLACK972 (3.47 € en fichas)",
      "serviettski(fr): pone la ciega pequeña 0.01 €",
      "Nicanor Cast: pone la ciega grande 0.02 €",
      "THEBLACK972: se retira",
      "SrLyce: se retira",
      "Davdgoni: sube 0.04 € a 0.06 €",
      "PerroBestia: se retira",
      "serviettski(fr): se retira",
      "Nicanor Cast: se retira",
      "Davdgoni: no muestra su mano",
      "Asiento 1: SrLyce se retiró antes del Flop (no apostó)",
      "Asiento 2: Davdgoni recaudó (0.05 €)",
      "Asiento 3: PerroBestia (botón) se retiró antes del Flop (no apostó)",
      "Asiento 4: serviettski(fr) (ciega pequeña) se retiró antes del Flop",
      "Asiento 5: Nicanor Cast (ciega grande) se retiró antes del Flop",
      "Asiento 6: THEBLACK972 se retiró antes del Flop (no apostó)"
    ],
    "flop": [],
    "turn": [],
    "river": []
  },
  "board": [],
  "winner": "Davdgoni",
  "win_amount": 2.5,
  "sb": 0.01,
  "bb": 0.02,
  "rake": 0.0,
  "raw_text": "Mano n.º 257238122481 de PokerStars:  Hold'em No Limit (0.01 €/0.02 € EUR) - 06-08-2025 18:30:03 CET [06-08-2025 12:30:03 ET]\nMesa \"Alruccabah II\" 6-max El asiento n.º 3 es el botón\nAsiento 1: SrLyce (1.94 € en fichas) \nAsiento 2: Davdgoni (5.13 € en fichas) \nAsiento 3: PerroBestia (0.83 € en fichas) \nAsiento 4: serviettski(fr) (2.14 € en fichas) \nAsiento 5: Nicanor Cast (1.08 € en fichas) \nAsiento 6: THEBLACK972 (3.47 € en fichas) \nserviettski(fr): pone la ciega pequeña 0.01 €\nNicanor Cast: pone la ciega grande 0.02 €\n*** CARTAS DE MANO ***\nRepartidas a SrLyce [Jd 8c]\nTHEBLACK972: se retira \nSrLyce: se retira \nDavdgoni: sube 0.04 € a 0.06 €\nPerroBestia: se retira \nserviettski(fr): se retira \nNicanor Cast: se retira \nLa apuesta no igualada (0.04 €) ha sido devuelta a Davdgoni\nDavdgoni se lleva 0.05 € del bote \nDavdgoni: no muestra su mano \n*** RESUMEN ***\nBote total 0.05 € | Comisión 0 € \nAsiento 1: SrLyce se retiró antes del Flop (no apostó)\nAsiento 2: Davdgoni recaudó (0.05 €)\nAsiento 3: PerroBestia (botón) se retiró antes del Flop (no apostó)\nAsiento 4: serviettski(fr) (ciega pequeña) se retiró antes del Flop\nAsiento 5: Nicanor Cast (ciega grande) se retiró antes del Flop\nAsiento 6: THEBLACK972 se retiró antes del Flop (no apostó)"
}