{
  "hand_id": "257237749011",
  "date": "06-08-2025 17:54:14",
  "table": "Freia III",
  "game_type": "holdem",
  "hero": "SrLyce",
  "hero_position": "",
  "hero_cards": [
    "7c",
    "3h"
  ],
  "stacks": {
    "SrLyce": 114.0,
    "Dralex777978": 37.5,
    "psycadra": 31.5
  },
  "actions": {
    "preflop": [
      "Asiento 1: SrLyce (2.28 € en fichas)",
      "Asiento 4: Dralex777978 (0.75 € en fichas)",
      "Asiento 6: psycadra (0.63 € en fichas)",
      "Dralex777978: pone la ciega pequeña 0.01 €",
      "psycadra: pone la ciega grande 0.02 €",
      "SrLyce: se retira",
      "Dralex777978: se retira",
      "Asiento 1: SrLyce (botón) se retiró antes del Flop (no apostó)",
      "Asiento 4: Dralex777978 (ciega pequeña) se retiró antes del Flop",
      "Asiento 6: psycadra (ciega grande) recaudó (0.02 €)"
    ],
    "flop": [],
    "turn": [],
    "river": []
  },
  "board": [],
  "winner": "psycadra",
  "win_amount": 1.0,
  "sb": 0.01,
  "bb": 0.02,
  "rake": 0.0,
  "raw_text": "Mano n.º 257237749011 de PokerStars:  Hold'em No Limit (0.01 €/0.02 € EUR) - 06-08-2025 17:54:14 CET [06-08-2025 11:54:14 ET]\nMesa \"Freia III\" 6-max El asiento n.º 1 es el botón\nAsiento 1: SrLyce (2.28 € en fichas) \nAsiento 4: Dralex777978 (0.75 € en fichas) \nAsiento 6: psycadra (0.63 € en fichas) \nDralex777978: pone la ciega pequeña 0.01 €\npsycadra: pone la ciega grande 0.02 €\n*** CARTAS DE MANO ***\nRepartidas a SrLyce [7c 3h]\nSrLyce: se retira \nDralex777978: se retira \nLa apuesta no igualada (0.01 €) ha sido devuelta a psycadra\nDralex777978 deja la mesa\npsycadra se lleva 0.02 € del bote \n*** RESUMEN ***\nBote total 0.02 € | Comisión 0 € \nAsiento 1: SrLyce (botón) se retiró antes del Flop (no apostó)\nAsiento 4: Dralex777978 (ciega pequeña) se retiró antes del Flop\nAsiento 6: psycadra (ciega grande) recaudó (0.02 €)"
}