{
  "hand_id": "257237591687",
  "date": "06-08-2025 17:39:06",
  "table": "Vanadis II",
  "game_type": "holdem",
  "hero": "SrLyce",
  "hero_position": "",
  "hero_cards": [
    "8c",
    "Qh"
  ],
  "stacks": {
    "SrLyce": 98.0,
    "djrojas9": 100.5,
    "noreihh": 172.5,
    "chordewman": 127.0,
    "sarabiagar": 96.5,
    "idigon": 145.0
  },
  "actions": {
    "preflop": [
      "Asiento 1: SrLyce (1.96 € en fichas)",
      "Asiento 2: djrojas9 (2.01 € en fichas)",
      "Asiento 3: noreihh (3.45 € en fichas)",
      "Asiento 4: chordewman (2.54 € en fichas)",
      "Asiento 5: sarabiagar (1.93 € en fichas)",
      "Asiento 6: idigon (2.90 € en fichas)",
      "SrLyce: pone la ciega pequeña 0.01 €",
      "djrojas9: pone la ciega grande 0.02 €",
      "noreihh: se retira",
      "chordewman: sube 0.03 € a 0.05 €",
      "sarabiagar: se retira",
      "idigon: iguala 0.05 €",
      "SrLyce: iguala 0.04 €",
      "djrojas9: iguala 0.03 €"
    ],
    "flop": [
      "SrLyce: pasa",
      "djrojas9: pasa",
      "chordewman: apuesta 0.05 €",
      "idigon: se retira",
      "SrLyce: iguala 0.05 €",
      "djrojas9: iguala 0.05 €"
    ],
    "turn": [
      "SrLyce: pasa",
      "djrojas9: pasa",
      "chordewman: apuesta 0.50 €",
      "SrLyce: se retira",
      "djrojas9: se retira",
      "chordewman: no muestra su mano",
      "Asiento 1: SrLyce (ciega pequeña) se retiró en el Turn",
      "Asiento 2: djrojas9 (ciega grande) se retiró en el Turn",
      "Asiento 3: noreihh se retiró antes del Flop (no apostó)",
      "Asiento 4: chordewman recaudó (0.33 €)",
      "Asiento 5: sarabiagar se retiró antes del Flop (no apostó)",
      "Asiento 6: idigon (botón) se retiró en el Flop"
    ],
    "river": []
  },
  "board": [
    "Kh",
    "Jc",
    "Qc",
    "9h"
  ],
  "winner": "chordewman",
  "win_amount": 16.5,
  "sb": 0.01,
  "bb": 0.02,
  "rake": 1.0,
  "raw_text": "Mano n.º 257237591687 de PokerStars:  Hold'em No Limit (0.01 €/0.02 € EUR) - 06-08-2025 17:39:06 CET [06-08-2025 11:39:06 ET]\nMesa \"Vanadis II\" 6-max El asiento n.º 6 es el botón\nAsiento 1: SrLyce (1.96 € en fichas) \nAsiento 2: djrojas9 (2.01 € en fichas) \nAsiento 3: noreihh (3.45 € en fichas) \nAsiento 4: chordewman (2.54 € en fichas) \nAsiento 5: sarabiagar (1.93 € en fichas) \nAsiento 6: idigon (2.90 € en fichas) \nSrLyce: pone la ciega pequeña 0.01 €\ndjrojas9: pone la ciega grande 0.02 €\n*** CARTAS DE MANO ***\nRepartidas a SrLyce [8c Qh]\nnoreihh ha agotado su tiempo\nnoreihh: se retira \nchordewman: sube 0.03 € a 0.05 €\nsarabiagar: se retira \nidigon: iguala 0.05 €\nSrLyce: iguala 0.04 €\ndjrojas9: iguala 0.03 €\n*** FLOP *** [Kh Jc Qc]\nSrLyce: pasa \ndjrojas9: pasa \nchordewman: apuesta 0.05 €\nidigon: se retira \nSrLyce: iguala 0.05 €\ndjrojas9: iguala 0.05 €\n*** TURN *** [Kh Jc Qc] [9h]\nSrLyce: pasa \ndjrojas9: pasa \nchordewman: apuesta 0.50 €\nSrLyce: se retira \ndjrojas9: se retira \nLa apuesta no igualada (0.50 €) ha sido devuelta a chordewman\nchordewman se lleva 0.33 € del bote \nchordewman: no muestra su mano \n*** RESUMEN ***\nBote total 0.35 € | Comisión 0.02 € \nComunitarias [Kh Jc Qc 9h]\nAsiento 1: SrLyce (ciega pequeña) se retiró en el Turn\nAsiento 2: djrojas9 (ciega grande) se retiró en el Turn\nAsiento 3: noreihh se retiró antes del Flop (no apostó)\nAsiento 4: chordewman recaudó (0.33 €)\nAsiento 5: sarabiagar se retiró antes del Flop (no apostó)\nAsiento 6: idigon (botón) se retiró en el Flop"
}