{
  "hand_id": "257238573050",
  "date": "06-08-2025 19:11:08",
  "table": "Herculina II",
  "game_type": "holdem",
  "hero": "SrLyce",
  "hero_position": "",
  "hero_cards": [
    "9h",
    "8s"
  ],
  "stacks": {
    "Alceo27": 100.0,
    "David98X": 178.0,
    "JJer11": 203.0,
    "SrLyce": 95.5,
    "Macklemore0": 100.0,
    "ScarvBlack": 120.5
  },
  "actions": {
    "preflop": [
      "Asiento 1: Alceo27 (2 € en fichas)",
      "Asiento 2: David98X (3.56 € en fichas)",
      "Asiento 3: JJer11 (4.06 € en fichas)",
      "Asiento 4: SrLyce (1.91 € en fichas)",
      "Asiento 5: Macklemore0 (2 € en fichas)",
      "Asiento 6: ScarvBlack (2.41 € en fichas)",
      "Alceo27: pone la ciega pequeña 0.01 €",
      "David98X: pone la ciega grande 0.02 €",
      "JJer11: sube 0.04 € a 0.06 €",
      "SrLyce: se retira",
      "Macklemore0: se retira",
      "ScarvBlack: se retira",
      "Alceo27: se retira",
      "David98X: se retira",
      "JJer11: no muestra su mano",
      "Asiento 1: Alceo27 (ciega pequeña) se retiró antes del Flop",
      "Asiento 2: David98X (ciega grande) se retiró antes del Flop",
      "Asiento 3: JJer11 recaudó (0.05 €)",
      "Asiento 4: SrLyce se retiró antes del Flop (no apostó)",
      "Asiento 5: Macklemore0 se retiró antes del Flop (no apostó)",
      "Asiento 6: ScarvBlack (botón) se retiró antes del Flop (no apostó)"
    ],
    "flop": [],
    "turn": [],
    "river": []
  },
  "board": [],
  "winner": "JJer11",
  "win_amount": 2.5,
  "sb": 0.01,
  "bb": 0.02,
  "rake": 0.0,
  "raw_text": "Mano n.º 257238573050 de PokerStars:  Hold'em No Limit (0.01 €/0.02 € EUR) - 06-08-2025 19:11:08 CET [06-08-2025 13:11:08 ET]\nMesa \"Herculina II\" 6-max El asiento n.º 6 es el botón\nAsiento 1: Alceo27 (2 € en fichas) \nAsiento 2: David98X (3.56 € en fichas) \nAsiento 3: JJer11 (4.06 € en fichas) \nAsiento 4: SrLyce (1.91 € en fichas) \nAsiento 5: Macklemore0 (2 € en fichas) \nAsiento 6: ScarvBlack (2.41 € en fichas) \nAlceo27: pone la ciega pequeña 0.01 €\nDavid98X: pone la ciega grande 0.02 €\n*** CARTAS DE MANO ***\nRepartidas a SrLyce [9h 8s]\nJJer11: sube 0.04 € a 0.06 €\nSrLyce: se retira \nMacklemore0: se retira \nScarvBlack: se retira \nAlceo27: se retira \nDavid98X: se retira \nLa apuesta no igualada (0.04 €) ha sido devuelta a JJer11\nJJer11 se lleva 0.05 € del bote \nJJer11: no muestra su mano \n*** RESUMEN ***\nBote total 0.05 € | Comisión 0 € \nAsiento 1: Alceo27 (ciega pequeña) se retiró antes del Flop\nAsiento 2: David98X (ciega grande) se retiró antes del Flop\nAsiento 3: JJer11 recaudó (0.05 €)\nAsiento 4: SrLyce se retiró antes del Flop (no apostó)\nAsiento 5: Macklemore0 se retiró antes del Flop (no apostó)\nAsiento 6: ScarvBlack (botón) se retiró antes del Flop (no apostó)"
}