{
  "hand_id": "257238215367",
  "date": "06-08-2025 18:38:20",
  "table": "Aidamina II",
  "game_type": "holdem",
  "hero": "SrLyce",
  "hero_position": "",
  "hero_cards": [
    "Kh",
    "Ac"
  ],
  "stacks": {
    "74SKY": 28.0,
    "erdillu": 105.0,
    "niyomalo": 115.5,
    "durahimovic": 133.0,
    "Abrelatas787": 153.5,
    "SrLyce": 98.5
  },
  "actions": {
    "preflop": [
      "Asiento 1: 74SKY (0.56 € en fichas)",
      "Asiento 2: erdillu (2.10 € en fichas)",
      "Asiento 3: niyomalo (2.31 € en fichas)",
      "Asiento 4: durahimovic (2.66 € en fichas)",
      "Asiento 5: Abrelatas787 (3.07 € en fichas)",
      "Asiento 6: SrLyce (1.97 € en fichas)",
      "74SKY: pone la ciega pequeña 0.01 €",
      "erdillu: pone la ciega grande 0.02 €",
      "niyomalo: se retira",
      "durahimovic: se retira",
      "Abrelatas787: se retira",
      "SrLyce: sube 0.03 € a 0.05 €",
      "74SKY: iguala 0.04 €",
      "erdillu: se retira"
    ],
    "flop": [
      "74SKY: apuesta 0.11 €",
      "SrLyce: iguala 0.11 €"
    ],
    "turn": [
      "74SKY: pasa",
      "SrLyce: pasa"
    ],
    "river": [
      "74SKY: apuesta 0.40 € y está all-in",
      "SrLyce: iguala 0.40 €",
      "74SKY: muestra [Qh As] (pareja de dieces)",
      "SrLyce: muestra [Kh Ac] (pareja de dieces - as+rey kicker)",
      "Asiento 1: 74SKY (ciega pequeña) muestra [Qh As] y perdió con pareja de dieces",
      "Asiento 2: erdillu (ciega grande) se retiró antes del Flop",
      "Asiento 3: niyomalo se retiró antes del Flop (no apostó)",
      "Asiento 4: durahimovic se retiró antes del Flop (no apostó)",
      "Asiento 5: Abrelatas787 se retiró antes del Flop (no apostó)",
      "Asiento 6: SrLyce (botón) muestra [Kh Ac] y ganó (1.07 €) con pareja de dieces"
    ]
  },
  "board": [
    "3s",
    "Ts",
    "6c",
    "Tc",
    "2h"
  ],
  "winner": "SrLyce",
  "win_amount": 53.5,
  "sb": 0.01,
  "bb": 0.02,
  "rake": 3.5,
  "raw_text": "Mano n.º 257238215367 de PokerStars:  Hold'em No Limit (0.01 €/0.02 € EUR) - 06-08-2025 18:38:20 CET [06-08-2025 12:38:20 ET]\nMesa \"Aidamina II\" 6-max El asiento n.º 6 es el botón\nAsiento 1: 74SKY (0.56 € en fichas) \nAsiento 2: erdillu (2.10 € en fichas) \nAsiento 3: niyomalo (2.31 € en fichas) \nAsiento 4: durahimovic (2.66 € en fichas) \nAsiento 5: Abrelatas787 (3.07 € en fichas) \nAsiento 6: SrLyce (1.97 € en fichas) \n74SKY: pone la ciega pequeña 0.01 €\nerdillu: pone la ciega grande 0.02 €\n*** CARTAS DE MANO ***\nRepartidas a SrLyce [Kh Ac]\nniyomalo: se retira \ndurahimovic: se retira \nAbrelatas787: se retira \nSrLyce: sube 0.03 € a 0.05 €\n74SKY: iguala 0.04 €\nerdillu: se retira \n*** FLOP *** [3s Ts 6c]\n74SKY: apuesta 0.11 €\nSrLyce: iguala 0.11 €\n*** TURN *** [3s Ts 6c] [Tc]\nniyomalo no tiene conexión \n74SKY: pasa \nSrLyce: pasa \n*** RIVER *** [3s Ts 6c Tc] [2h]\n74SKY: apuesta 0.40 € y está all-in\nSrLyce: iguala 0.40 €\n*** SHOW DOWN ***\n74SKY: muestra [Qh As] (pareja de dieces)\nSrLyce: muestra [Kh Ac] (pareja de dieces - as+rey kicker)\nSrLyce se lleva 1.07 € del bote \n*** RESUMEN ***\nBote total 1.14 € | Comisión 0.07 € \nComunitarias [3s Ts 6c Tc 2h]\nAsiento 1: 74SKY (ciega pequeña) muestra [Qh As] y perdió con pareja de dieces\nAsiento 2: erdillu (ciega grande) se retiró antes del Flop\nAsiento 3: niyomalo se retiró antes del Flop (no apostó)\nAsiento 4: durahimovic se retiró antes del Flop (no apostó)\nAsiento 5: Abrelatas787 se retiró antes del Flop (no apostó)\nAsiento 6: SrLyce (botón) muestra [Kh Ac] y ganó (1.07 €) con pareja de dieces"
}