{
  "hand_id": "257150185048",
  "date": "30-07-2025 23:24:10",
  "table": "Lobelia",
  "game_type": "holdem",
  "hero": "SrLyce",
  "hero_position": "",
  "hero_cards": [
    "9d",
    "2d"
  ],
  "stacks": {
    "LeVbks": 111.0,
    "fcis666": 57.0,
    "Dlaguancha": 109.5,
    "SrLyce": 103.5,
    "riverluck444": 96.0,
    "javipondio": 16.0
  },
  "actions": {
    "preflop": [
      "Asiento 1: LeVbks (2.22 € en fichas)",
      "Asiento 2: fcis666 (1.14 € en fichas)",
      "Asiento 3: Dlaguancha (2.19 € en fichas)",
      "Asiento 4: SrLyce (2.07 € en fichas)",
      "Asiento 5: riverluck444 (1.92 € en fichas)",
      "Asiento 6: javipondio (0.32 € en fichas)",
      "SrLyce: pone la ciega pequeña 0.01 €",
      "riverluck444: pone la ciega grande 0.02 €",
      "javipondio: se retira",
      "LeVbks: sube 0.02 € a 0.04 €",
      "fcis666: se retira",
      "Dlaguancha: se retira",
      "SrLyce: se retira",
      "riverluck444: se retira",
      "LeVbks: no muestra su mano",
      "Asiento 1: LeVbks recaudó (0.05 €)",
      "Asiento 2: fcis666 se retiró antes del Flop (no apostó)",
      "Asiento 3: Dlaguancha (botón) se retiró antes del Flop (no apostó)",
      "Asiento 4: SrLyce (ciega pequeña) se retiró antes del Flop",
      "Asiento 5: riverluck444 (ciega grande) se retiró antes del Flop",
      "Asiento 6: javipondio se retiró antes del Flop (no apostó)"
    ],
    "flop": [],
    "turn": [],
    "river": []
  },
  "board": [],
  "winner": "LeVbks",
  "win_amount": 2.5,
  "sb": 0.01,
  "bb": 0.02,
  "rake": 0.0,
  "raw_text": "Mano n.º 257150185048 de PokerStars:  Hold'em No Limit (0.01 €/0.02 € EUR) - 30-07-2025 23:24:10 CET [30-07-2025 17:24:10 ET]\nMesa \"Lobelia\" 6-max El asiento n.º 3 es el botón\nAsiento 1: LeVbks (2.22 € en fichas) \nAsiento 2: fcis666 (1.14 € en fichas) \nAsiento 3: Dlaguancha (2.19 € en fichas) \nAsiento 4: SrLyce (2.07 € en fichas) \nAsiento 5: riverluck444 (1.92 € en fichas) \nAsiento 6: javipondio (0.32 € en fichas) \nSrLyce: pone la ciega pequeña 0.01 €\nriverluck444: pone la ciega grande 0.02 €\n*** CARTAS DE MANO ***\nRepartidas a SrLyce [9d 2d]\njavipondio: se retira \nLeVbks: sube 0.02 € a 0.04 €\nfcis666: se retira \nDlaguancha: se retira \nSrLyce: se retira \nriverluck444: se retira \nLa apuesta no igualada (0.02 €) ha sido devuelta a LeVbks\nLeVbks se lleva 0.05 € del bote \nLeVbks: no muestra su mano \n*** RESUMEN ***\nBote total 0.05 € | Comisión 0 € \nAsiento 1: LeVbks recaudó (0.05 €)\nAsiento 2: fcis666 se retiró antes del Flop (no apostó)\nAsiento 3: Dlaguancha (botón) se retiró antes del Flop (no apostó)\nAsiento 4: SrLyce (ciega pequeña) se retiró antes del Flop\nAsiento 5: riverluck444 (ciega grande) se retiró antes del Flop\nAsiento 6: javipondio se retiró antes del Flop (no apostó)"
}