{
  "hand_id": "257148887527",
  "date": "30-07-2025 21:51:04",
  "table": "Sirona",
  "game_type": "holdem",
  "hero": "SrLyce",
  "hero_position": "",
  "hero_cards": [
    "6s",
    "8s"
  ],
  "stacks": {
    "SrLyce": 110.5,
    "lecontrebandier": 101.5,
    "christoph363": 186.5,
    "oliverdu70": 140.5,
    "olibellier": 22.0,
    "Dakoo44": 77.0
  },
  "actions": {
    "preflop": [
      "Asiento 1: SrLyce (2.21 € en fichas)",
      "Asiento 2: lecontrebandier (2.03 € en fichas)",
      "Asiento 3: christoph363 (3.73 € en fichas)",
      "Asiento 4: oliverdu70 (2.81 € en fichas)",
      "Asiento 5: olibellier (0.44 € en fichas)",
      "Asiento 6: Dakoo44 (1.54 € en fichas)",
      "olibellier: pone la ciega pequeña 0.01 €",
      "Dakoo44: pone la ciega grande 0.02 €",
      "SrLyce: se retira",
      "lecontrebandier: se retira",
      "christoph363: se retira",
      "oliverdu70: se retira",
      "olibellier: iguala 0.01 €",
      "Dakoo44: sube 0.06 € a 0.08 €",
      "olibellier: se retira",
      "Dakoo44: no muestra su mano",
      "Asiento 1: SrLyce se retiró antes del Flop (no apostó)",
      "Asiento 2: lecontrebandier se retiró antes del Flop (no apostó)",
      "Asiento 3: christoph363 se retiró antes del Flop (no apostó)",
      "Asiento 4: oliverdu70 (botón) se retiró antes del Flop (no apostó)",
      "Asiento 5: olibellier (ciega pequeña) se retiró antes del Flop",
      "Asiento 6: Dakoo44 (ciega grande) recaudó (0.04 €)"
    ],
    "flop": [],
    "turn": [],
    "river": []
  },
  "board": [],
  "winner": "Dakoo44",
  "win_amount": 2.0,
  "sb": 0.01,
  "bb": 0.02,
  "rake": 0.0,
  "raw_text": "Mano n.º 257148887527 de PokerStars:  Hold'em No Limit (0.01 €/0.02 € EUR) - 30-07-2025 21:51:04 CET [30-07-2025 15:51:04 ET]\nMesa \"Sirona\" 6-max El asiento n.º 4 es el botón\nAsiento 1: SrLyce (2.21 € en fichas) \nAsiento 2: lecontrebandier (2.03 € en fichas) \nAsiento 3: christoph363 (3.73 € en fichas) \nAsiento 4: oliverdu70 (2.81 € en fichas) \nAsiento 5: olibellier (0.44 € en fichas) \nAsiento 6: Dakoo44 (1.54 € en fichas) \nolibellier: pone la ciega pequeña 0.01 €\nDakoo44: pone la ciega grande 0.02 €\n*** CARTAS DE MANO ***\nRepartidas a SrLyce [6s 8s]\nSrLyce: se retira \nlecontrebandier: se retira \nchristoph363: se retira \noliverdu70: se retira \nolibellier: iguala 0.01 €\nDakoo44: sube 0.06 € a 0.08 €\nolibellier: se retira \nLa apuesta no igualada (0.06 €) ha sido devuelta a Dakoo44\nDakoo44 se lleva 0.04 € del bote \nDakoo44: no muestra su mano \n*** RESUMEN ***\nBote total 0.04 € | Comisión 0 € \nAsiento 1: SrLyce se retiró antes del Flop (no apostó)\nAsiento 2: lecontrebandier se retiró antes del Flop (no apostó)\nAsiento 3: christoph363 se retiró antes del Flop (no apostó)\nAsiento 4: oliverdu70 (botón) se retiró antes del Flop (no apostó)\nAsiento 5: olibellier (ciega pequeña) se retiró antes del Flop\nAsiento 6: Dakoo44 (ciega grande) recaudó (0.04 €)"
}