{
  "hand_id": "257237633301",
  "date": "06-08-2025 17:43:08",
  "table": "Themisto III",
  "game_type": "holdem",
  "hero": "SrLyce",
  "hero_position": "",
  "hero_cards": [
    "7c",
    "6h"
  ],
  "stacks": {
    "idigon": 0.0,
    "chordewman": 100.0,
    "SrLyce": 122.5,
    "fred2d23po": 86.0,
    "mivipkr": 106.5,
    "marignamo": 100.0
  },
  "actions": {
    "preflop": [
      "Asiento 3: idigon (0 € en fichas) está ausente",
      "Asiento 1: chordewman (2 € en fichas)",
      "Asiento 2: SrLyce (2.45 € en fichas)",
      "Asiento 4: fred2d23po (1.72 € en fichas)",
      "Asiento 5: mivipkr (2.13 € en fichas)",
      "Asiento 6: marignamo (2 € en fichas)",
      "marignamo: pone la ciega pequeña 0.01 €",
      "chordewman: pone la ciega grande 0.02 €",
      "SrLyce: se retira",
      "fred2d23po: sube 0.04 € a 0.06 €",
      "mivipkr: se retira",
      "marignamo: se retira",
      "chordewman: se retira",
      "Asiento 3: idigon",
      "Asiento 1: chordewman (ciega grande) se retiró antes del Flop",
      "Asiento 2: SrLyce se retiró antes del Flop (no apostó)",
      "Asiento 4: fred2d23po recaudó (0.05 €)",
      "Asiento 5: mivipkr (botón) se retiró antes del Flop (no apostó)",
      "Asiento 6: marignamo (ciega pequeña) se retiró antes del Flop"
    ],
    "flop": [],
    "turn": [],
    "river": []
  },
  "board": [],
  "winner": "fred2d23po",
  "win_amount": 2.5,
  "sb": 0.01,
  "bb": 0.02,
  "rake": 0.0,
  "raw_text": "Mano n.º 257237633301 de PokerStars:  Hold'em No Limit (0.01 €/0.02 € EUR) - 06-08-2025 17:43:08 CET [06-08-2025 11:43:08 ET]\nMesa \"Themisto III\" 6-max El asiento n.º 5 es el botón\nAsiento 3: idigon (0 € en fichas) está ausente\nAsiento 1: chordewman (2 € en fichas) \nAsiento 2: SrLyce (2.45 € en fichas) \nAsiento 4: fred2d23po (1.72 € en fichas) \nAsiento 5: mivipkr (2.13 € en fichas) \nAsiento 6: marignamo (2 € en fichas) \nmarignamo: pone la ciega pequeña 0.01 €\nchordewman: pone la ciega grande 0.02 €\n*** CARTAS DE MANO ***\nRepartidas a SrLyce [7c 6h]\nSrLyce ha agotado su tiempo\nSrLyce: se retira \nidigon deja la mesa\nfred2d23po: sube 0.04 € a 0.06 €\nmivipkr: se retira \nmarignamo: se retira \nchordewman: se retira \nLa apuesta no igualada (0.04 €) ha sido devuelta a fred2d23po\nfred2d23po se lleva 0.05 € del bote \n*** RESUMEN ***\nBote total 0.05 € | Comisión 0 € \nAsiento 3: idigon\nAsiento 1: chordewman (ciega grande) se retiró antes del Flop\nAsiento 2: SrLyce se retiró antes del Flop (no apostó)\nAsiento 4: fred2d23po recaudó (0.05 €)\nAsiento 5: mivipkr (botón) se retiró antes del Flop (no apostó)\nAsiento 6: marignamo (ciega pequeña) se retiró antes del Flop"
}