{
  "hand_id": "257238405832",
  "date": "06-08-2025 18:55:04",
  "table": "Alruccabah II",
  "game_type": "holdem",
  "hero": "SrLyce",
  "hero_position": "",
  "hero_cards": [
    "8h",
    "Qh"
  ],
  "stacks": {
    "SrLyce": 97.0,
    "zoioachado": 40.0,
    "yonisanlu": 101.5,
    "Nicanor Cast": 54.0,
    "rayao32": 47.0
  },
  "actions": {
    "preflop": [
      "Asiento 1: SrLyce (1.94 € en fichas)",
      "Asiento 2: zoioachado (0.80 € en fichas)",
      "Asiento 3: yonisanlu (2.03 € en fichas)",
      "Asiento 4: serviettski(fr) (2.06 € en fichas)",
      "Asiento 5: Nicanor Cast (1.08 € en fichas)",
      "Asiento 6: rayao32 (0.94 € en fichas)",
      "serviettski(fr): pone la ciega pequeña 0.01 €",
      "Nicanor Cast: pone la ciega grande 0.02 €",
      "zoioachado: pone la ciega grande 0.02 €",
      "rayao32: se retira",
      "SrLyce: sube 0.03 € a 0.05 €",
      "zoioachado: sube 0.09 € a 0.14 €",
      "yonisanlu: se retira",
      "serviettski(fr): se retira",
      "Nicanor Cast: se retira",
      "SrLyce: iguala 0.09 €"
    ],
    "flop": [
      "SrLyce: pasa",
      "zoioachado: apuesta 0.08 €",
      "SrLyce: iguala 0.08 €"
    ],
    "turn": [
      "SrLyce: pasa",
      "zoioachado: apuesta 0.10 €",
      "SrLyce: sube 0.64 € a 0.74 €",
      "zoioachado: iguala 0.48 € y está all-in"
    ],
    "river": [
      "SrLyce: muestra [8h Qh] (doble pareja, ochos y sietes)",
      "zoioachado: muestra [Qd 5d] (pareja de sietes)",
      "Asiento 1: SrLyce muestra [8h Qh] y ganó (1.53 €) con doble pareja, ochos y sietes",
      "Asiento 2: zoioachado muestra [Qd 5d] y perdió con pareja de sietes",
      "Asiento 3: yonisanlu (botón) se retiró antes del Flop (no apostó)",
      "Asiento 4: serviettski(fr) (ciega pequeña) se retiró antes del Flop",
      "Asiento 5: Nicanor Cast (ciega grande) se retiró antes del Flop",
      "Asiento 6: rayao32 se retiró antes del Flop (no apostó)"
    ]
  },
  "board": [
    "7h",
    "8c",
    "9d",
    "3c",
    "7d"
  ],
  "winner": "SrLyce",
  "win_amount": 76.5,
  "sb": 0.01,
  "bb": 0.02,
  "rake": 5.0,
  "raw_text": "Mano n.º 257238405832 de PokerStars:  Hold'em No Limit (0.01 €/0.02 € EUR) - 06-08-2025 18:55:04 CET [06-08-2025 12:55:04 ET]\nMesa \"Alruccabah II\" 6-max El asiento n.º 3 es el botón\nAsiento 1: SrLyce (1.94 € en fichas) \nAsiento 2: zoioachado (0.80 € en fichas) \nAsiento 3: yonisanlu (2.03 € en fichas) \nAsiento 4: serviettski(fr) (2.06 € en fichas) \nAsiento 5: Nicanor Cast (1.08 € en fichas) \nAsiento 6: rayao32 (0.94 € en fichas) \nserviettski(fr): pone la ciega pequeña 0.01 €\nNicanor Cast: pone la ciega grande 0.02 €\nzoioachado: pone la ciega grande 0.02 €\n*** CARTAS DE MANO ***\nRepartidas a SrLyce [8h Qh]\nrayao32 ha agotado su tiempo\nrayao32: se retira \nSrLyce: sube 0.03 € a 0.05 €\nzoioachado: sube 0.09 € a 0.14 €\nyonisanlu: se retira \nserviettski(fr): se retira \nNicanor Cast: se retira \nSrLyce: iguala 0.09 €\n*** FLOP *** [7h 8c 9d]\nSrLyce: pasa \nzoioachado: apuesta 0.08 €\nSrLyce: iguala 0.08 €\n*** TURN *** [7h 8c 9d] [3c]\nSrLyce: pasa \nzoioachado: apuesta 0.10 €\nSrLyce: sube 0.64 € a 0.74 €\nzoioachado: iguala 0.48 € y está all-in\nLa apuesta no igualada (0.16 €) ha sido devuelta a SrLyce\n*** RIVER *** [7h 8c 9d 3c] [7d]\n*** SHOW DOWN ***\nSrLyce: muestra [8h Qh] (doble pareja, ochos y sietes)\nzoioachado: muestra [Qd 5d] (pareja de sietes)\nSrLyce se lleva 1.53 € del bote \n*** RESUMEN ***\nBote total 1.63 € | Comisión 0.10 € \nComunitarias [7h 8c 9d 3c 7d]\nAsiento 1: SrLyce muestra [8h Qh] y ganó (1.53 €) con doble pareja, ochos y sietes\nAsiento 2: zoioachado muestra [Qd 5d] y perdió con pareja de sietes\nAsiento 3: yonisanlu (botón) se retiró antes del Flop (no apostó)\nAsiento 4: serviettski(fr) (ciega pequeña) se retiró antes del Flop\nAsiento 5: Nicanor Cast (ciega grande) se retiró antes del Flop\nAsiento 6: rayao32 se retiró antes del Flop (no apostó)"
}