{
  "hand_id": "257238746553",
  "date": "06-08-2025 19:25:37",
  "table": "Herculina II",
  "game_type": "holdem",
  "hero": "SrLyce",
  "hero_position": "",
  "hero_cards": [
    "Kd",
    "3d"
  ],
  "stacks": {
    "Alceo27": 120.5,
    "David98X": 135.0,
    "JJer11": 190.5,
    "SrLyce": 144.0,
    "Macklemore0": 104.0,
    "ScarvBlack": 107.5
  },
  "actions": {
    "preflop": [
      "Asiento 1: Alceo27 (2.41 € en fichas)",
      "Asiento 2: David98X (2.70 € en fichas)",
      "Asiento 3: JJer11 (3.81 € en fichas)",
      "Asiento 4: SrLyce (2.88 € en fichas)",
      "Asiento 5: Macklemore0 (2.08 € en fichas)",
      "Asiento 6: ScarvBlack (2.15 € en fichas)",
      "ScarvBlack: pone la ciega pequeña 0.01 €",
      "Alceo27: pone la ciega grande 0.02 €",
      "David98X: se retira",
      "JJer11: se retira",
      "SrLyce: sube 0.03 € a 0.05 €",
      "Macklemore0: se retira",
      "ScarvBlack: se retira",
      "Alceo27: se retira",
      "SrLyce: no muestra su mano",
      "Asiento 1: Alceo27 (ciega grande) se retiró antes del Flop",
      "Asiento 2: David98X se retiró antes del Flop (no apostó)",
      "Asiento 3: JJer11 se retiró antes del Flop (no apostó)",
      "Asiento 4: SrLyce recaudó (0.05 €)",
      "Asiento 5: Macklemore0 (botón) se retiró antes del Flop (no apostó)",
      "Asiento 6: ScarvBlack (ciega pequeña) se retiró antes del Flop"
    ],
    "flop": [],
    "turn": [],
    "river": []
  },
  "board": [],
  "winner": "SrLyce",
  "win_amount": 2.5,
  "sb": 0.01,
  "bb": 0.02,
  "rake": 0.0,
  "raw_text": "Mano n.º 257238746553 de PokerStars:  Hold'em No Limit (0.01 €/0.02 € EUR) - 06-08-2025 19:25:37 CET [06-08-2025 13:25:37 ET]\nMesa \"Herculina II\" 6-max El asiento n.º 5 es el botón\nAsiento 1: Alceo27 (2.41 € en fichas) \nAsiento 2: David98X (2.70 € en fichas) \nAsiento 3: JJer11 (3.81 € en fichas) \nAsiento 4: SrLyce (2.88 € en fichas) \nAsiento 5: Macklemore0 (2.08 € en fichas) \nAsiento 6: ScarvBlack (2.15 € en fichas) \nScarvBlack: pone la ciega pequeña 0.01 €\nAlceo27: pone la ciega grande 0.02 €\n*** CARTAS DE MANO ***\nRepartidas a SrLyce [Kd 3d]\nDavid98X: se retira \nJJer11: se retira \nSrLyce: sube 0.03 € a 0.05 €\nMacklemore0: se retira \nScarvBlack: se retira \nAlceo27: se retira \nLa apuesta no igualada (0.03 €) ha sido devuelta a SrLyce\nSrLyce se lleva 0.05 € del bote \nSrLyce: no muestra su mano \n*** RESUMEN ***\nBote total 0.05 € | Comisión 0 € \nAsiento 1: Alceo27 (ciega grande) se retiró antes del Flop\nAsiento 2: David98X se retiró antes del Flop (no apostó)\nAsiento 3: JJer11 se retiró antes del Flop (no apostó)\nAsiento 4: SrLyce recaudó (0.05 €)\nAsiento 5: Macklemore0 (botón) se retiró antes del Flop (no apostó)\nAsiento 6: ScarvBlack (ciega pequeña) se retiró antes del Flop"
}