{
  "hand_id": "257148583879",
  "date": "30-07-2025 21:29:38",
  "table": "Sirona",
  "game_type": "holdem",
  "hero": "SrLyce",
  "hero_position": "",
  "hero_cards": [
    "7s",
    "5s"
  ],
  "stacks": {
    "lecontrebandier": 100.0,
    "SrLyce": 93.0,
    "christoph363": 181.0,
    "oliverdu70": 97.5,
    "Dakoo44": 51.0
  },
  "actions": {
    "preflop": [
      "Asiento 2: lecontrebandier (2 € en fichas) está ausente",
      "Asiento 1: SrLyce (1.86 € en fichas)",
      "Asiento 3: christoph363 (3.62 € en fichas)",
      "Asiento 4: oliverdu70 (1.95 € en fichas)",
      "Asiento 6: Dakoo44 (1.02 € en fichas)",
      "Dakoo44: pone la ciega pequeña 0.01 €",
      "SrLyce: pone la ciega grande 0.02 €",
      "lecontrebandier: se ausenta",
      "christoph363: se retira",
      "oliverdu70: se retira",
      "Dakoo44: iguala 0.01 €",
      "SrLyce: pasa"
    ],
    "flop": [
      "Dakoo44: apuesta 0.02 €",
      "SrLyce: iguala 0.02 €"
    ],
    "turn": [
      "Dakoo44: apuesta 0.02 €",
      "SrLyce: iguala 0.02 €"
    ],
    "river": [
      "Dakoo44: apuesta 0.06 €",
      "SrLyce: se retira",
      "Dakoo44: no muestra su mano",
      "Asiento 2: lecontrebandier",
      "Asiento 1: SrLyce (ciega grande) se retiró en el River",
      "Asiento 3: christoph363 se retiró antes del Flop (no apostó)",
      "Asiento 4: oliverdu70 (botón) se retiró antes del Flop (no apostó)",
      "Asiento 6: Dakoo44 (ciega pequeña) recaudó (0.11 €)"
    ]
  },
  "board": [
    "Ts",
    "9h",
    "8c",
    "2h",
    "8h"
  ],
  "winner": "Dakoo44",
  "win_amount": 5.5,
  "sb": 0.01,
  "bb": 0.02,
  "rake": 0.5,
  "raw_text": "Mano n.º 257148583879 de PokerStars:  Hold'em No Limit (0.01 €/0.02 € EUR) - 30-07-2025 21:29:38 CET [30-07-2025 15:29:38 ET]\nMesa \"Sirona\" 6-max El asiento n.º 4 es el botón\nAsiento 2: lecontrebandier (2 € en fichas) está ausente\nAsiento 1: SrLyce (1.86 € en fichas) \nAsiento 3: christoph363 (3.62 € en fichas) \nAsiento 4: oliverdu70 (1.95 € en fichas) \nAsiento 6: Dakoo44 (1.02 € en fichas) \nDakoo44: pone la ciega pequeña 0.01 €\nSrLyce: pone la ciega grande 0.02 €\nlecontrebandier: se ausenta \n*** CARTAS DE MANO ***\nRepartidas a SrLyce [7s 5s]\nchristoph363: se retira \noliverdu70: se retira \nDakoo44: iguala 0.01 €\nolibellier se une a la mesa en el asiento n.º 5 \nSrLyce: pasa \n*** FLOP *** [Ts 9h 8c]\nDakoo44: apuesta 0.02 €\nSrLyce: iguala 0.02 €\n*** TURN *** [Ts 9h 8c] [2h]\nDakoo44: apuesta 0.02 €\nSrLyce: iguala 0.02 €\n*** RIVER *** [Ts 9h 8c 2h] [8h]\nDakoo44: apuesta 0.06 €\nSrLyce: se retira \nLa apuesta no igualada (0.06 €) ha sido devuelta a Dakoo44\nDakoo44 se lleva 0.11 € del bote \nDakoo44: no muestra su mano \n*** RESUMEN ***\nBote total 0.12 € | Comisión 0.01 € \nComunitarias [Ts 9h 8c 2h 8h]\nAsiento 2: lecontrebandier\nAsiento 1: SrLyce (ciega grande) se retiró en el River\nAsiento 3: christoph363 se retiró antes del Flop (no apostó)\nAsiento 4: oliverdu70 (botón) se retiró antes del Flop (no apostó)\nAsiento 6: Dakoo44 (ciega pequeña) recaudó (0.11 €)"
}