{
  "hand_id": "257150244536",
  "date": "30-07-2025 23:28:17",
  "table": "Gilgamesh",
  "game_type": "holdem",
  "hero": "SrLyce",
  "hero_position": "",
  "hero_cards": [
    "8d",
    "2d"
  ],
  "stacks": {
    "riverrrrrrmagic": 123.5,
    "SrLyce": 107.5,
    "Jumby34": 100.0,
    "xapkk": 100.0,
    "Fretzo67500": 146.5
  },
  "actions": {
    "preflop": [
      "Asiento 1: riverrrrrrmagic (2.47 € en fichas)",
      "Asiento 2: SrLyce (2.15 € en fichas)",
      "Asiento 3: Jumby34 (2 € en fichas)",
      "Asiento 4: xapkk (2 € en fichas)",
      "Asiento 6: Fretzo67500 (2.93 € en fichas)",
      "xapkk: pone la ciega pequeña 0.01 €",
      "Fretzo67500: pone la ciega grande 0.02 €",
      "riverrrrrrmagic: iguala 0.02 €",
      "SrLyce: se retira",
      "Jumby34: se retira",
      "xapkk: se retira",
      "Fretzo67500: pasa"
    ],
    "flop": [
      "Fretzo67500: pasa",
      "riverrrrrrmagic: pasa"
    ],
    "turn": [
      "Fretzo67500: apuesta 0.02 €",
      "riverrrrrrmagic: iguala 0.02 €"
    ],
    "river": [
      "Fretzo67500: apuesta 0.02 €",
      "riverrrrrrmagic: sube 0.02 € a 0.04 €",
      "Fretzo67500: iguala 0.02 €",
      "riverrrrrrmagic: muestra [9c 7h] (escalera, de seis a diez)",
      "Fretzo67500: descarta su mano sin mostrar",
      "Asiento 1: riverrrrrrmagic muestra [9c 7h] y ganó (0.16 €) con escalera, de seis a diez",
      "Asiento 2: SrLyce se retiró antes del Flop (no apostó)",
      "Asiento 3: Jumby34 (botón) se retiró antes del Flop (no apostó)",
      "Asiento 4: xapkk (ciega pequeña) se retiró antes del Flop",
      "Asiento 6: Fretzo67500 (ciega grande) descartó sin mostrar [Qd 5s]"
    ]
  },
  "board": [
    "Tc",
    "6d",
    "5h",
    "8h",
    "Ac"
  ],
  "winner": "riverrrrrrmagic",
  "win_amount": 8.0,
  "sb": 0.01,
  "bb": 0.02,
  "rake": 0.5,
  "raw_text": "Mano n.º 257150244536 de PokerStars:  Hold'em No Limit (0.01 €/0.02 € EUR) - 30-07-2025 23:28:17 CET [30-07-2025 17:28:17 ET]\nMesa \"Gilgamesh\" 6-max El asiento n.º 3 es el botón\nAsiento 1: riverrrrrrmagic (2.47 € en fichas) \nAsiento 2: SrLyce (2.15 € en fichas) \nAsiento 3: Jumby34 (2 € en fichas) \nAsiento 4: xapkk (2 € en fichas) \nAsiento 6: Fretzo67500 (2.93 € en fichas) \nxapkk: pone la ciega pequeña 0.01 €\nFretzo67500: pone la ciega grande 0.02 €\n*** CARTAS DE MANO ***\nRepartidas a SrLyce [8d 2d]\nriverrrrrrmagic: iguala 0.02 €\nSrLyce: se retira \nJumby34: se retira \nxapkk: se retira \nFretzo67500: pasa \n*** FLOP *** [Tc 6d 5h]\nFretzo67500: pasa \nriverrrrrrmagic: pasa \n*** TURN *** [Tc 6d 5h] [8h]\nFretzo67500: apuesta 0.02 €\nriverrrrrrmagic: iguala 0.02 €\n*** RIVER *** [Tc 6d 5h 8h] [Ac]\nFretzo67500: apuesta 0.02 €\nriverrrrrrmagic: sube 0.02 € a 0.04 €\nFretzo67500: iguala 0.02 €\n*** SHOW DOWN ***\nriverrrrrrmagic: muestra [9c 7h] (escalera, de seis a diez)\nFretzo67500: descarta su mano sin mostrar \nriverrrrrrmagic se lleva 0.16 € del bote \nozil111 se une a la mesa en el asiento n.º 5 \n*** RESUMEN ***\nBote total 0.17 € | Comisión 0.01 € \nComunitarias [Tc 6d 5h 8h Ac]\nAsiento 1: riverrrrrrmagic muestra [9c 7h] y ganó (0.16 €) con escalera, de seis a diez\nAsiento 2: SrLyce se retiró antes del Flop (no apostó)\nAsiento 3: Jumby34 (botón) se retiró antes del Flop (no apostó)\nAsiento 4: xapkk (ciega pequeña) se retiró antes del Flop\nAsiento 6: Fretzo67500 (ciega grande) descartó sin mostrar [Qd 5s]"
}