{
  "hand_id": "257238399023",
  "date": "06-08-2025 18:54:28",
  "table": "Adelaide III",
  "game_type": "holdem",
  "hero": "SrLyce",
  "hero_position": "",
  "hero_cards": [
    "3s",
    "Jh"
  ],
  "stacks": {
    "Ischadia": 90.5,
    "N3xtTIm35": 102.0,
    "aliendee07": 58.0,
    "SrLyce": 90.0,
    "ismagonzalez7": 91.0,
    "pauquair5": 75.0
  },
  "actions": {
    "preflop": [
      "Asiento 3: Ischadia (1.81 € en fichas) está ausente",
      "Asiento 1: N3xtTIm35 (2.04 € en fichas)",
      "Asiento 2: aliendee07 (1.16 € en fichas)",
      "Asiento 4: SrLyce (1.80 € en fichas)",
      "Asiento 5: ismagonzalez7 (1.82 € en fichas)",
      "Asiento 6: pauquair5 (1.50 € en fichas)",
      "ismagonzalez7: pone la ciega pequeña 0.01 €",
      "pauquair5: pone la ciega grande 0.02 €",
      "N3xtTIm35: sube 0.04 € a 0.06 €",
      "aliendee07: se retira",
      "SrLyce: se retira",
      "ismagonzalez7: iguala 0.05 €",
      "pauquair5: iguala 0.04 €"
    ],
    "flop": [
      "ismagonzalez7: pasa",
      "pauquair5: pasa",
      "N3xtTIm35: apuesta 0.09 €",
      "ismagonzalez7: iguala 0.09 €",
      "pauquair5: se retira"
    ],
    "turn": [
      "ismagonzalez7: apuesta 0.13 €",
      "N3xtTIm35: sube 0.47 € a 0.60 €",
      "ismagonzalez7: iguala 0.47 €"
    ],
    "river": [
      "ismagonzalez7: pasa",
      "N3xtTIm35: apuesta 1.29 € y está all-in",
      "ismagonzalez7: se retira",
      "N3xtTIm35: no muestra su mano",
      "Asiento 3: Ischadia",
      "Asiento 1: N3xtTIm35 recaudó (1.47 €)",
      "Asiento 2: aliendee07 se retiró antes del Flop (no apostó)",
      "Asiento 4: SrLyce (botón) se retiró antes del Flop (no apostó)",
      "Asiento 5: ismagonzalez7 (ciega pequeña) se retiró en el River",
      "Asiento 6: pauquair5 (ciega grande) se retiró en el Flop"
    ]
  },
  "board": [
    "Ad",
    "Jc",
    "Td",
    "8s",
    "2d"
  ],
  "winner": "N3xtTIm35",
  "win_amount": 73.5,
  "sb": 0.01,
  "bb": 0.02,
  "rake": 4.5,
  "raw_text": "Mano n.º 257238399023 de PokerStars:  Hold'em No Limit (0.01 €/0.02 € EUR) - 06-08-2025 18:54:28 CET [06-08-2025 12:54:28 ET]\nMesa \"Adelaide III\" 6-max El asiento n.º 4 es el botón\nAsiento 3: Ischadia (1.81 € en fichas) está ausente\nAsiento 1: N3xtTIm35 (2.04 € en fichas) \nAsiento 2: aliendee07 (1.16 € en fichas) \nAsiento 4: SrLyce (1.80 € en fichas) \nAsiento 5: ismagonzalez7 (1.82 € en fichas) \nAsiento 6: pauquair5 (1.50 € en fichas) \nismagonzalez7: pone la ciega pequeña 0.01 €\npauquair5: pone la ciega grande 0.02 €\n*** CARTAS DE MANO ***\nRepartidas a SrLyce [3s Jh]\nIschadia deja la mesa\nN3xtTIm35: sube 0.04 € a 0.06 €\naliendee07: se retira \nSrLyce: se retira \nismagonzalez7: iguala 0.05 €\npauquair5: iguala 0.04 €\n*** FLOP *** [Ad Jc Td]\nismagonzalez7: pasa \npauquair5: pasa \nN3xtTIm35: apuesta 0.09 €\nismagonzalez7: iguala 0.09 €\npauquair5: se retira \n*** TURN *** [Ad Jc Td] [8s]\nismagonzalez7: apuesta 0.13 €\nN3xtTIm35: sube 0.47 € a 0.60 €\nismagonzalez7: iguala 0.47 €\n*** RIVER *** [Ad Jc Td 8s] [2d]\nismagonzalez7: pasa \nN3xtTIm35: apuesta 1.29 € y está all-in\nismagonzalez7: se retira \nLa apuesta no igualada (1.29 €) ha sido devuelta a N3xtTIm35\nN3xtTIm35 se lleva 1.47 € del bote \nN3xtTIm35: no muestra su mano \nMacklemore0 se une a la mesa en el asiento n.º 3 \n*** RESUMEN ***\nBote total 1.56 € | Comisión 0.09 € \nComunitarias [Ad Jc Td 8s 2d]\nAsiento 3: Ischadia\nAsiento 1: N3xtTIm35 recaudó (1.47 €)\nAsiento 2: aliendee07 se retiró antes del Flop (no apostó)\nAsiento 4: SrLyce (botón) se retiró antes del Flop (no apostó)\nAsiento 5: ismagonzalez7 (ciega pequeña) se retiró en el River\nAsiento 6: pauquair5 (ciega grande) se retiró en el Flop"
}