{
  "hand_id": "257168396391",
  "date": "01-08-2025 11:40:09",
  "table": "Jupiter",
  "game_type": "holdem",
  "hero": "SrLyce",
  "hero_position": "",
  "hero_cards": [
    "2c",
    "6c"
  ],
  "stacks": {
    "sifilis5": 100.0,
    "Filou203": 105.5,
    "SrLyce": 112.0,
    "LOLA19711971": 41.0,
    "dadou13mars": 207.5,
    "Alvii37": 116.5
  },
  "actions": {
    "preflop": [
      "Asiento 1: sifilis5 (2 € en fichas)",
      "Asiento 2: Filou203 (2.11 € en fichas)",
      "Asiento 3: SrLyce (2.24 € en fichas)",
      "Asiento 4: LOLA19711971 (0.82 € en fichas)",
      "Asiento 5: dadou13mars (4.15 € en fichas)",
      "Asiento 6: Alvii37 (2.33 € en fichas)",
      "Alvii37: pone la ciega pequeña 0.01 €",
      "sifilis5: pone la ciega grande 0.02 €",
      "Filou203: sube 0.03 € a 0.05 €",
      "SrLyce: se retira",
      "LOLA19711971: iguala 0.05 €",
      "dadou13mars: se retira",
      "Alvii37: sube 0.17 € a 0.22 €",
      "sifilis5: se retira",
      "Filou203: iguala 0.17 €",
      "LOLA19711971: se retira"
    ],
    "flop": [
      "Alvii37: apuesta 0.14 €",
      "Filou203: iguala 0.14 €"
    ],
    "turn": [
      "Alvii37: apuesta 0.56 €",
      "Filou203: se retira",
      "Alvii37: no muestra su mano",
      "Asiento 1: sifilis5 (ciega grande) se retiró antes del Flop",
      "Asiento 2: Filou203 se retiró en el Turn",
      "Asiento 3: SrLyce se retiró antes del Flop (no apostó)",
      "Asiento 4: LOLA19711971 se retiró antes del Flop",
      "Asiento 5: dadou13mars (botón) se retiró antes del Flop (no apostó)",
      "Asiento 6: Alvii37 (ciega pequeña) recaudó (0.74 €)"
    ],
    "river": []
  },
  "board": [
    "5h",
    "8s",
    "Kc",
    "5c"
  ],
  "winner": "Alvii37",
  "win_amount": 37.0,
  "sb": 0.01,
  "bb": 0.02,
  "rake": 2.5,
  "raw_text": "Mano n.º 257168396391 de PokerStars:  Hold'em No Limit (0.01 €/0.02 € EUR) - 01-08-2025 11:40:09 CET [01-08-2025 5:40:09 ET]\nMesa \"Jupiter\" 6-max El asiento n.º 5 es el botón\nAsiento 1: sifilis5 (2 € en fichas) \nAsiento 2: Filou203 (2.11 € en fichas) \nAsiento 3: SrLyce (2.24 € en fichas) \nAsiento 4: LOLA19711971 (0.82 € en fichas) \nAsiento 5: dadou13mars (4.15 € en fichas) \nAsiento 6: Alvii37 (2.33 € en fichas) \nAlvii37: pone la ciega pequeña 0.01 €\nsifilis5: pone la ciega grande 0.02 €\n*** CARTAS DE MANO ***\nRepartidas a SrLyce [2c 6c]\nFilou203: sube 0.03 € a 0.05 €\nSrLyce: se retira \nLOLA19711971: iguala 0.05 €\ndadou13mars: se retira \nAlvii37: sube 0.17 € a 0.22 €\nsifilis5: se retira \nFilou203: iguala 0.17 €\nLOLA19711971: se retira \n*** FLOP *** [5h 8s Kc]\nAlvii37: apuesta 0.14 €\nFilou203: iguala 0.14 €\n*** TURN *** [5h 8s Kc] [5c]\nAlvii37: apuesta 0.56 €\nFilou203: se retira \nLa apuesta no igualada (0.56 €) ha sido devuelta a Alvii37\nAlvii37 se lleva 0.74 € del bote \nAlvii37: no muestra su mano \n*** RESUMEN ***\nBote total 0.79 € | Comisión 0.05 € \nComunitarias [5h 8s Kc 5c]\nAsiento 1: sifilis5 (ciega grande) se retiró antes del Flop\nAsiento 2: Filou203 se retiró en el Turn\nAsiento 3: SrLyce se retiró antes del Flop (no apostó)\nAsiento 4: LOLA19711971 se retiró antes del Flop\nAsiento 5: dadou13mars (botón) se retiró antes del Flop (no apostó)\nAsiento 6: Alvii37 (ciega pequeña) recaudó (0.74 €)"
}