{
  "hand_id": "257150117058",
  "date": "30-07-2025 23:19:28",
  "table": "Gilgamesh",
  "game_type": "holdem",
  "hero": "SrLyce",
  "hero_position": "",
  "hero_cards": [
    "Ah",
    "5d"
  ],
  "stacks": {
    "riverrrrrrmagic": 126.5,
    "SrLyce": 96.0,
    "Jumby34": 101.5,
    "xapkk": 100.0,
    "samaritano34": 94.5,
    "Fretzo67500": 119.5
  },
  "actions": {
    "preflop": [
      "Asiento 1: riverrrrrrmagic (2.53 € en fichas)",
      "Asiento 2: SrLyce (1.92 € en fichas)",
      "Asiento 3: Jumby34 (2.03 € en fichas)",
      "Asiento 4: xapkk (2 € en fichas)",
      "Asiento 5: samaritano34 (1.89 € en fichas)",
      "Asiento 6: Fretzo67500 (2.39 € en fichas)",
      "Fretzo67500: pone la ciega pequeña 0.01 €",
      "riverrrrrrmagic: pone la ciega grande 0.02 €",
      "SrLyce: se retira",
      "Jumby34: se retira",
      "xapkk: se retira",
      "samaritano34: sube 0.03 € a 0.05 €",
      "Fretzo67500: iguala 0.04 €",
      "riverrrrrrmagic: se retira"
    ],
    "flop": [
      "Fretzo67500: pasa",
      "samaritano34: pasa"
    ],
    "turn": [
      "Fretzo67500: pasa",
      "samaritano34: pasa"
    ],
    "river": [
      "Fretzo67500: apuesta 0.02 €",
      "samaritano34: se retira",
      "Asiento 1: riverrrrrrmagic (ciega grande) se retiró antes del Flop",
      "Asiento 2: SrLyce se retiró antes del Flop (no apostó)",
      "Asiento 3: Jumby34 se retiró antes del Flop (no apostó)",
      "Asiento 4: xapkk se retiró antes del Flop (no apostó)",
      "Asiento 5: samaritano34 (botón) se retiró en el River",
      "Asiento 6: Fretzo67500 (ciega pequeña) recaudó (0.11 €)"
    ]
  },
  "board": [
    "3c",
    "Kd",
    "Td",
    "Ad",
    "Qd"
  ],
  "winner": "Fretzo67500",
  "win_amount": 5.5,
  "sb": 0.01,
  "bb": 0.02,
  "rake": 0.5,
  "raw_text": "Mano n.º 257150117058 de PokerStars:  Hold'em No Limit (0.01 €/0.02 € EUR) - 30-07-2025 23:19:28 CET [30-07-2025 17:19:28 ET]\nMesa \"Gilgamesh\" 6-max El asiento n.º 5 es el botón\nAsiento 1: riverrrrrrmagic (2.53 € en fichas) \nAsiento 2: SrLyce (1.92 € en fichas) \nAsiento 3: Jumby34 (2.03 € en fichas) \nAsiento 4: xapkk (2 € en fichas) \nAsiento 5: samaritano34 (1.89 € en fichas) \nAsiento 6: Fretzo67500 (2.39 € en fichas) \nFretzo67500: pone la ciega pequeña 0.01 €\nriverrrrrrmagic: pone la ciega grande 0.02 €\n*** CARTAS DE MANO ***\nRepartidas a SrLyce [Ah 5d]\nSrLyce: se retira \nJumby34: se retira \nxapkk: se retira \nsamaritano34: sube 0.03 € a 0.05 €\nFretzo67500: iguala 0.04 €\nriverrrrrrmagic: se retira \n*** FLOP *** [3c Kd Td]\nFretzo67500: pasa \nsamaritano34: pasa \n*** TURN *** [3c Kd Td] [Ad]\nFretzo67500: pasa \nsamaritano34: pasa \n*** RIVER *** [3c Kd Td Ad] [Qd]\nFretzo67500: apuesta 0.02 €\nsamaritano34: se retira \nLa apuesta no igualada (0.02 €) ha sido devuelta a Fretzo67500\nFretzo67500 se lleva 0.11 € del bote \n*** RESUMEN ***\nBote total 0.12 € | Comisión 0.01 € \nComunitarias [3c Kd Td Ad Qd]\nAsiento 1: riverrrrrrmagic (ciega grande) se retiró antes del Flop\nAsiento 2: SrLyce se retiró antes del Flop (no apostó)\nAsiento 3: Jumby34 se retiró antes del Flop (no apostó)\nAsiento 4: xapkk se retiró antes del Flop (no apostó)\nAsiento 5: samaritano34 (botón) se retiró en el River\nAsiento 6: Fretzo67500 (ciega pequeña) recaudó (0.11 €)"
}