{
  "hand_id": "257238283144",
  "date": "06-08-2025 18:44:18",
  "table": "Alruccabah II",
  "game_type": "holdem",
  "hero": "SrLyce",
  "hero_position": "",
  "hero_cards": [
    "9c",
    "9h"
  ],
  "stacks": {
    "rayao32": 52.0,
    "SrLyce": 77.0,
    "Davdgoni": 281.0,
    "Nicanor Cast": 51.5
  },
  "actions": {
    "preflop": [
      "Asiento 6: rayao32 (1.04 € en fichas) está ausente",
      "Asiento 1: SrLyce (1.54 € en fichas)",
      "Asiento 2: Davdgoni (5.62 € en fichas)",
      "Asiento 4: serviettski(fr) (2 € en fichas)",
      "Asiento 5: Nicanor Cast (1.03 € en fichas)",
      "Davdgoni: pone la ciega pequeña 0.01 €",
      "serviettski(fr): pone la ciega grande 0.02 €",
      "Nicanor Cast: se retira",
      "SrLyce: sube 0.03 € a 0.05 €",
      "Davdgoni: se retira",
      "serviettski(fr): se retira",
      "SrLyce: no muestra su mano",
      "Asiento 6: rayao32",
      "Asiento 1: SrLyce (botón) recaudó (0.05 €)",
      "Asiento 2: Davdgoni (ciega pequeña) se retiró antes del Flop",
      "Asiento 4: serviettski(fr) (ciega grande) se retiró antes del Flop",
      "Asiento 5: Nicanor Cast se retiró antes del Flop (no apostó)"
    ],
    "flop": [],
    "turn": [],
    "river": []
  },
  "board": [],
  "winner": "SrLyce",
  "win_amount": 2.5,
  "sb": 0.01,
  "bb": 0.02,
  "rake": 0.0,
  "raw_text": "Mano n.º 257238283144 de PokerStars:  Hold'em No Limit (0.01 €/0.02 € EUR) - 06-08-2025 18:44:18 CET [06-08-2025 12:44:18 ET]\nMesa \"Alruccabah II\" 6-max El asiento n.º 1 es el botón\nAsiento 6: rayao32 (1.04 € en fichas) está ausente\nAsiento 1: SrLyce (1.54 € en fichas) \nAsiento 2: Davdgoni (5.62 € en fichas) \nAsiento 4: serviettski(fr) (2 € en fichas) \nAsiento 5: Nicanor Cast (1.03 € en fichas) \nDavdgoni: pone la ciega pequeña 0.01 €\nserviettski(fr): pone la ciega grande 0.02 €\n*** CARTAS DE MANO ***\nRepartidas a SrLyce [9c 9h]\nNicanor Cast: se retira \nSrLyce: sube 0.03 € a 0.05 €\nDavdgoni: se retira \nserviettski(fr): se retira \nLa apuesta no igualada (0.03 €) ha sido devuelta a SrLyce\nSrLyce se lleva 0.05 € del bote \nSrLyce: no muestra su mano \n*** RESUMEN ***\nBote total 0.05 € | Comisión 0 € \nAsiento 6: rayao32\nAsiento 1: SrLyce (botón) recaudó (0.05 €)\nAsiento 2: Davdgoni (ciega pequeña) se retiró antes del Flop\nAsiento 4: serviettski(fr) (ciega grande) se retiró antes del Flop\nAsiento 5: Nicanor Cast se retiró antes del Flop (no apostó)"
}