{
  "hand_id": "257148866954",
  "date": "30-07-2025 21:49:37",
  "table": "Sirona",
  "game_type": "holdem",
  "hero": "SrLyce",
  "hero_position": "",
  "hero_cards": [
    "Qh",
    "3c"
  ],
  "stacks": {
    "SrLyce": 110.5,
    "lecontrebandier": 101.5,
    "christoph363": 178.0,
    "oliverdu70": 131.5,
    "olibellier": 24.5,
    "Dakoo44": 94.0
  },
  "actions": {
    "preflop": [
      "Asiento 1: SrLyce (2.21 € en fichas)",
      "Asiento 2: lecontrebandier (2.03 € en fichas)",
      "Asiento 3: christoph363 (3.56 € en fichas)",
      "Asiento 4: oliverdu70 (2.63 € en fichas)",
      "Asiento 5: olibellier (0.49 € en fichas)",
      "Asiento 6: Dakoo44 (1.88 € en fichas)",
      "christoph363: pone la ciega pequeña 0.01 €",
      "oliverdu70: pone la ciega grande 0.02 €",
      "olibellier: se retira",
      "Dakoo44: sube 0.03 € a 0.05 €",
      "SrLyce: se retira",
      "lecontrebandier: se retira",
      "christoph363: se retira",
      "oliverdu70: iguala 0.03 €"
    ],
    "flop": [
      "oliverdu70: pasa",
      "Dakoo44: apuesta 0.05 €",
      "oliverdu70: iguala 0.05 €"
    ],
    "turn": [
      "oliverdu70: pasa",
      "Dakoo44: apuesta 0.10 €",
      "oliverdu70: iguala 0.10 €"
    ],
    "river": [
      "oliverdu70: pasa",
      "Dakoo44: pasa",
      "oliverdu70: muestra [8h 8c] (pareja de ochos)",
      "Dakoo44: descarta su mano sin mostrar",
      "Asiento 1: SrLyce se retiró antes del Flop (no apostó)",
      "Asiento 2: lecontrebandier (botón) se retiró antes del Flop (no apostó)",
      "Asiento 3: christoph363 (ciega pequeña) se retiró antes del Flop",
      "Asiento 4: oliverdu70 (ciega grande) muestra [8h 8c] y ganó (0.39 €) con pareja de ochos",
      "Asiento 5: olibellier se retiró antes del Flop (no apostó)",
      "Asiento 6: Dakoo44 descartó sin mostrar [9s 7s]"
    ]
  },
  "board": [
    "7h",
    "4h",
    "Js",
    "6c",
    "2c"
  ],
  "winner": "oliverdu70",
  "win_amount": 19.5,
  "sb": 0.01,
  "bb": 0.02,
  "rake": 1.0,
  "raw_text": "Mano n.º 257148866954 de PokerStars:  Hold'em No Limit (0.01 €/0.02 € EUR) - 30-07-2025 21:49:37 CET [30-07-2025 15:49:37 ET]\nMesa \"Sirona\" 6-max El asiento n.º 2 es el botón\nAsiento 1: SrLyce (2.21 € en fichas) \nAsiento 2: lecontrebandier (2.03 € en fichas) \nAsiento 3: christoph363 (3.56 € en fichas) \nAsiento 4: oliverdu70 (2.63 € en fichas) \nAsiento 5: olibellier (0.49 € en fichas) \nAsiento 6: Dakoo44 (1.88 € en fichas) \nchristoph363: pone la ciega pequeña 0.01 €\noliverdu70: pone la ciega grande 0.02 €\n*** CARTAS DE MANO ***\nRepartidas a SrLyce [Qh 3c]\nolibellier: se retira \nDakoo44: sube 0.03 € a 0.05 €\nSrLyce: se retira \nlecontrebandier: se retira \nchristoph363: se retira \noliverdu70: iguala 0.03 €\n*** FLOP *** [7h 4h Js]\noliverdu70: pasa \nDakoo44: apuesta 0.05 €\noliverdu70: iguala 0.05 €\n*** TURN *** [7h 4h Js] [6c]\noliverdu70: pasa \nDakoo44: apuesta 0.10 €\noliverdu70: iguala 0.10 €\n*** RIVER *** [7h 4h Js 6c] [2c]\noliverdu70: pasa \nDakoo44: pasa \n*** SHOW DOWN ***\noliverdu70: muestra [8h 8c] (pareja de ochos)\nDakoo44: descarta su mano sin mostrar \noliverdu70 se lleva 0.39 € del bote \n*** RESUMEN ***\nBote total 0.41 € | Comisión 0.02 € \nComunitarias [7h 4h Js 6c 2c]\nAsiento 1: SrLyce se retiró antes del Flop (no apostó)\nAsiento 2: lecontrebandier (botón) se retiró antes del Flop (no apostó)\nAsiento 3: christoph363 (ciega pequeña) se retiró antes del Flop\nAsiento 4: oliverdu70 (ciega grande) muestra [8h 8c] y ganó (0.39 €) con pareja de ochos\nAsiento 5: olibellier se retiró antes del Flop (no apostó)\nAsiento 6: Dakoo44 descartó sin mostrar [9s 7s]"
}