{
  "hand_id": "257148883976",
  "date": "30-07-2025 21:50:49",
  "table": "Esclangona",
  "game_type": "holdem",
  "hero": "SrLyce",
  "hero_position": "",
  "hero_cards": [
    "7c",
    "8s"
  ],
  "stacks": {
    "Zorgue1080": 85.0,
    "SrLyce": 159.0,
    "NoahBolete": 102.0,
    "Davdgoni": 106.5,
    "DiaZzZ1": 97.5,
    "berlcht403": 38.0
  },
  "actions": {
    "preflop": [
      "Asiento 1: Zorgue1080 (1.70 € en fichas)",
      "Asiento 2: SrLyce (3.18 € en fichas)",
      "Asiento 3: NoahBolete (2.04 € en fichas)",
      "Asiento 4: Davdgoni (2.13 € en fichas)",
      "Asiento 5: DiaZzZ1 (1.95 € en fichas)",
      "Asiento 6: berlcht403 (0.76 € en fichas)",
      "berlcht403: pone la ciega pequeña 0.01 €",
      "Zorgue1080: pone la ciega grande 0.02 €",
      "SrLyce: se retira",
      "NoahBolete: se retira",
      "Davdgoni: sube 0.04 € a 0.06 €",
      "DiaZzZ1: sube 0.09 € a 0.15 €",
      "berlcht403: se retira",
      "Zorgue1080: se retira",
      "Davdgoni: iguala 0.09 €"
    ],
    "flop": [
      "Davdgoni: pasa",
      "DiaZzZ1: apuesta 0.16 €",
      "Davdgoni: se retira",
      "DiaZzZ1: no muestra su mano",
      "Asiento 1: Zorgue1080 (ciega grande) se retiró antes del Flop",
      "Asiento 2: SrLyce se retiró antes del Flop (no apostó)",
      "Asiento 3: NoahBolete se retiró antes del Flop (no apostó)",
      "Asiento 4: Davdgoni se retiró en el Flop",
      "Asiento 5: DiaZzZ1 (botón) recaudó (0.31 €)",
      "Asiento 6: berlcht403 (ciega pequeña) se retiró antes del Flop"
    ],
    "turn": [],
    "river": []
  },
  "board": [
    "5d",
    "7d",
    "Kh"
  ],
  "winner": "DiaZzZ1",
  "win_amount": 15.5,
  "sb": 0.01,
  "bb": 0.02,
  "rake": 1.0,
  "raw_text": "Mano n.º 257148883976 de PokerStars:  Hold'em No Limit (0.01 €/0.02 € EUR) - 30-07-2025 21:50:49 CET [30-07-2025 15:50:49 ET]\nMesa \"Esclangona\" 6-max El asiento n.º 5 es el botón\nAsiento 1: Zorgue1080 (1.70 € en fichas) \nAsiento 2: SrLyce (3.18 € en fichas) \nAsiento 3: NoahBolete (2.04 € en fichas) \nAsiento 4: Davdgoni (2.13 € en fichas) \nAsiento 5: DiaZzZ1 (1.95 € en fichas) \nAsiento 6: berlcht403 (0.76 € en fichas) \nberlcht403: pone la ciega pequeña 0.01 €\nZorgue1080: pone la ciega grande 0.02 €\n*** CARTAS DE MANO ***\nRepartidas a SrLyce [7c 8s]\nSrLyce: se retira \nNoahBolete: se retira \nDavdgoni: sube 0.04 € a 0.06 €\nDiaZzZ1: sube 0.09 € a 0.15 €\nberlcht403: se retira \nZorgue1080: se retira \nDavdgoni: iguala 0.09 €\n*** FLOP *** [5d 7d Kh]\nDavdgoni: pasa \nDiaZzZ1: apuesta 0.16 €\nDavdgoni: se retira \nLa apuesta no igualada (0.16 €) ha sido devuelta a DiaZzZ1\nDiaZzZ1 se lleva 0.31 € del bote \nDiaZzZ1: no muestra su mano \n*** RESUMEN ***\nBote total 0.33 € | Comisión 0.02 € \nComunitarias [5d 7d Kh]\nAsiento 1: Zorgue1080 (ciega grande) se retiró antes del Flop\nAsiento 2: SrLyce se retiró antes del Flop (no apostó)\nAsiento 3: NoahBolete se retiró antes del Flop (no apostó)\nAsiento 4: Davdgoni se retiró en el Flop\nAsiento 5: DiaZzZ1 (botón) recaudó (0.31 €)\nAsiento 6: berlcht403 (ciega pequeña) se retiró antes del Flop"
}