{
  "hand_id": "257237050273",
  "date": "06-08-2025 17:35:03",
  "table": "Kale III",
  "game_type": "holdem",
  "hero": "SrLyce",
  "hero_position": "",
  "hero_cards": [
    "Qd",
    "2s"
  ],
  "stacks": {
    "x__Nest__x": 86.5,
    "SrLyce": 111.5,
    "Dracoline000": 112.5,
    "Doblea315": 167.0,
    "Begoton": 114.5,
    "juanmemol": 100.0
  },
  "actions": {
    "preflop": [
      "Asiento 1: x__Nest__x (1.73 € en fichas)",
      "Asiento 2: SrLyce (2.23 € en fichas)",
      "Asiento 3: Dracoline000 (2.25 € en fichas)",
      "Asiento 4: Doblea315 (3.34 € en fichas)",
      "Asiento 5: Begoton (2.29 € en fichas)",
      "Asiento 6: juanmemol (2 € en fichas)",
      "SrLyce: pone la ciega pequeña 0.01 €",
      "Dracoline000: pone la ciega grande 0.02 €",
      "Doblea315: sube 0.03 € a 0.05 €",
      "Begoton: se retira",
      "juanmemol: se retira",
      "x__Nest__x: se retira",
      "SrLyce: se retira",
      "Dracoline000: se retira",
      "Doblea315: no muestra su mano",
      "Asiento 1: x__Nest__x (botón) se retiró antes del Flop (no apostó)",
      "Asiento 2: SrLyce (ciega pequeña) se retiró antes del Flop",
      "Asiento 3: Dracoline000 (ciega grande) se retiró antes del Flop",
      "Asiento 4: Doblea315 recaudó (0.05 €)",
      "Asiento 5: Begoton se retiró antes del Flop (no apostó)",
      "Asiento 6: juanmemol se retiró antes del Flop (no apostó)"
    ],
    "flop": [],
    "turn": [],
    "river": []
  },
  "board": [],
  "winner": "Doblea315",
  "win_amount": 2.5,
  "sb": 0.01,
  "bb": 0.02,
  "rake": 0.0,
  "raw_text": "Mano n.º 257237050273 de PokerStars:  Hold'em No Limit (0.01 €/0.02 € EUR) - 06-08-2025 17:35:03 CET [06-08-2025 11:35:03 ET]\nMesa \"Kale III\" 6-max El asiento n.º 1 es el botón\nAsiento 1: x__Nest__x (1.73 € en fichas) \nAsiento 2: SrLyce (2.23 € en fichas) \nAsiento 3: Dracoline000 (2.25 € en fichas) \nAsiento 4: Doblea315 (3.34 € en fichas) \nAsiento 5: Begoton (2.29 € en fichas) \nAsiento 6: juanmemol (2 € en fichas) \nSrLyce: pone la ciega pequeña 0.01 €\nDracoline000: pone la ciega grande 0.02 €\n*** CARTAS DE MANO ***\nRepartidas a SrLyce [Qd 2s]\nDoblea315: sube 0.03 € a 0.05 €\nBegoton: se retira \njuanmemol: se retira \nx__Nest__x: se retira \nSrLyce: se retira \nDracoline000: se retira \nLa apuesta no igualada (0.03 €) ha sido devuelta a Doblea315\nDoblea315 se lleva 0.05 € del bote \nDoblea315: no muestra su mano \n*** RESUMEN ***\nBote total 0.05 € | Comisión 0 € \nAsiento 1: x__Nest__x (botón) se retiró antes del Flop (no apostó)\nAsiento 2: SrLyce (ciega pequeña) se retiró antes del Flop\nAsiento 3: Dracoline000 (ciega grande) se retiró antes del Flop\nAsiento 4: Doblea315 recaudó (0.05 €)\nAsiento 5: Begoton se retiró antes del Flop (no apostó)\nAsiento 6: juanmemol se retiró antes del Flop (no apostó)"
}