{
  "hand_id": "257238282716",
  "date": "06-08-2025 18:44:15",
  "table": "Aidamina II",
  "game_type": "holdem",
  "hero": "SrLyce",
  "hero_position": "",
  "hero_cards": [
    "3h",
    "Kh"
  ],
  "stacks": {
    "GarciaTT416": 98.5,
    "McFlash3": 104.0,
    "niyomalo": 126.5,
    "durahimovic": 127.5,
    "SrLyce": 99.0
  },
  "actions": {
    "preflop": [
      "Asiento 1: GarciaTT416 (1.97 € en fichas)",
      "Asiento 2: McFlash3 (2.08 € en fichas)",
      "Asiento 3: niyomalo (2.53 € en fichas)",
      "Asiento 4: durahimovic (2.55 € en fichas)",
      "Asiento 6: SrLyce (1.98 € en fichas)",
      "SrLyce: pone la ciega pequeña 0.01 €",
      "GarciaTT416: pone la ciega grande 0.02 €",
      "McFlash3: se retira",
      "niyomalo: se retira",
      "durahimovic: se retira",
      "SrLyce: sube 0.03 € a 0.05 €",
      "GarciaTT416: iguala 0.03 €"
    ],
    "flop": [
      "SrLyce: apuesta 0.03 €",
      "GarciaTT416: sube 0.05 € a 0.08 €",
      "SrLyce: iguala 0.05 €"
    ],
    "turn": [
      "SrLyce: pasa",
      "GarciaTT416: apuesta 0.18 €",
      "SrLyce: se retira",
      "Asiento 1: GarciaTT416 (ciega grande) recaudó (0.24 €)",
      "Asiento 2: McFlash3 se retiró antes del Flop (no apostó)",
      "Asiento 3: niyomalo se retiró antes del Flop (no apostó)",
      "Asiento 4: durahimovic (botón) se retiró antes del Flop (no apostó)",
      "Asiento 6: SrLyce (ciega pequeña) se retiró en el Turn"
    ],
    "river": []
  },
  "board": [
    "Ts",
    "Js",
    "Kd",
    "Ac"
  ],
  "winner": "GarciaTT416",
  "win_amount": 12.0,
  "sb": 0.01,
  "bb": 0.02,
  "rake": 1.0,
  "raw_text": "Mano n.º 257238282716 de PokerStars:  Hold'em No Limit (0.01 €/0.02 € EUR) - 06-08-2025 18:44:15 CET [06-08-2025 12:44:15 ET]\nMesa \"Aidamina II\" 6-max El asiento n.º 4 es el botón\nAsiento 1: GarciaTT416 (1.97 € en fichas) \nAsiento 2: McFlash3 (2.08 € en fichas) \nAsiento 3: niyomalo (2.53 € en fichas) \nAsiento 4: durahimovic (2.55 € en fichas) \nAsiento 6: SrLyce (1.98 € en fichas) \nSrLyce: pone la ciega pequeña 0.01 €\nGarciaTT416: pone la ciega grande 0.02 €\n*** CARTAS DE MANO ***\nRepartidas a SrLyce [3h Kh]\nMcFlash3: se retira \nniyomalo: se retira \ndurahimovic: se retira \nJustWin9960 se une a la mesa en el asiento n.º 5 \nSrLyce: sube 0.03 € a 0.05 €\nGarciaTT416: iguala 0.03 €\n*** FLOP *** [Ts Js Kd]\nSrLyce: apuesta 0.03 €\nGarciaTT416: sube 0.05 € a 0.08 €\nSrLyce: iguala 0.05 €\n*** TURN *** [Ts Js Kd] [Ac]\nSrLyce: pasa \nGarciaTT416: apuesta 0.18 €\nSrLyce: se retira \nLa apuesta no igualada (0.18 €) ha sido devuelta a GarciaTT416\nGarciaTT416 se lleva 0.24 € del bote \n*** RESUMEN ***\nBote total 0.26 € | Comisión 0.02 € \nComunitarias [Ts Js Kd Ac]\nAsiento 1: GarciaTT416 (ciega grande) recaudó (0.24 €)\nAsiento 2: McFlash3 se retiró antes del Flop (no apostó)\nAsiento 3: niyomalo se retiró antes del Flop (no apostó)\nAsiento 4: durahimovic (botón) se retiró antes del Flop (no apostó)\nAsiento 6: SrLyce (ciega pequeña) se retiró en el Turn"
}