{
  "hand_id": "257238616991",
  "date": "06-08-2025 19:14:49",
  "table": "Herculina II",
  "game_type": "holdem",
  "hero": "SrLyce",
  "hero_position": "",
  "hero_cards": [
    "6h",
    "Qc"
  ],
  "stacks": {
    "Macklemore0": 102.5,
    "Alceo27": 115.5,
    "David98X": 173.5,
    "JJer11": 199.5,
    "SrLyce": 97.5,
    "ScarvBlack": 106.0
  },
  "actions": {
    "preflop": [
      "Asiento 5: Macklemore0 (2.05 € en fichas) está ausente",
      "Asiento 1: Alceo27 (2.31 € en fichas)",
      "Asiento 2: David98X (3.47 € en fichas)",
      "Asiento 3: JJer11 (3.99 € en fichas)",
      "Asiento 4: SrLyce (1.95 € en fichas)",
      "Asiento 6: ScarvBlack (2.12 € en fichas)",
      "Alceo27: pone la ciega pequeña 0.01 €",
      "David98X: pone la ciega grande 0.02 €",
      "JJer11: se retira",
      "SrLyce: se retira",
      "ScarvBlack: sube 0.04 € a 0.06 €",
      "Alceo27: se retira",
      "David98X: se retira",
      "ScarvBlack: no muestra su mano",
      "Asiento 5: Macklemore0",
      "Asiento 1: Alceo27 (ciega pequeña) se retiró antes del Flop",
      "Asiento 2: David98X (ciega grande) se retiró antes del Flop",
      "Asiento 3: JJer11 se retiró antes del Flop (no apostó)",
      "Asiento 4: SrLyce se retiró antes del Flop (no apostó)",
      "Asiento 6: ScarvBlack (botón) recaudó (0.05 €)"
    ],
    "flop": [],
    "turn": [],
    "river": []
  },
  "board": [],
  "winner": "ScarvBlack",
  "win_amount": 2.5,
  "sb": 0.01,
  "bb": 0.02,
  "rake": 0.0,
  "raw_text": "Mano n.º 257238616991 de PokerStars:  Hold'em No Limit (0.01 €/0.02 € EUR) - 06-08-2025 19:14:49 CET [06-08-2025 13:14:49 ET]\nMesa \"Herculina II\" 6-max El asiento n.º 6 es el botón\nAsiento 5: Macklemore0 (2.05 € en fichas) está ausente\nAsiento 1: Alceo27 (2.31 € en fichas) \nAsiento 2: David98X (3.47 € en fichas) \nAsiento 3: JJer11 (3.99 € en fichas) \nAsiento 4: SrLyce (1.95 € en fichas) \nAsiento 6: ScarvBlack (2.12 € en fichas) \nAlceo27: pone la ciega pequeña 0.01 €\nDavid98X: pone la ciega grande 0.02 €\n*** CARTAS DE MANO ***\nRepartidas a SrLyce [6h Qc]\nJJer11: se retira \nSrLyce: se retira \nScarvBlack: sube 0.04 € a 0.06 €\nAlceo27: se retira \nDavid98X: se retira \nLa apuesta no igualada (0.04 €) ha sido devuelta a ScarvBlack\nScarvBlack se lleva 0.05 € del bote \nScarvBlack: no muestra su mano \n*** RESUMEN ***\nBote total 0.05 € | Comisión 0 € \nAsiento 5: Macklemore0\nAsiento 1: Alceo27 (ciega pequeña) se retiró antes del Flop\nAsiento 2: David98X (ciega grande) se retiró antes del Flop\nAsiento 3: JJer11 se retiró antes del Flop (no apostó)\nAsiento 4: SrLyce se retiró antes del Flop (no apostó)\nAsiento 6: ScarvBlack (botón) recaudó (0.05 €)"
}