{
  "hand_id": "257149110067",
  "date": "30-07-2025 22:08:43",
  "table": "Sirona",
  "game_type": "holdem",
  "hero": "SrLyce",
  "hero_position": "",
  "hero_cards": [
    "Tc",
    "Jd"
  ],
  "stacks": {
    "oliverdu70": 186.0,
    "SrLyce": 139.5,
    "lecontrebandier": 80.5,
    "christoph363": 213.0,
    "MitchATP65": 100.0
  },
  "actions": {
    "preflop": [
      "Asiento 4: oliverdu70 (3.72 € en fichas) está ausente",
      "Asiento 1: SrLyce (2.79 € en fichas)",
      "Asiento 2: lecontrebandier (1.61 € en fichas)",
      "Asiento 3: christoph363 (4.26 € en fichas)",
      "Asiento 6: MitchATP65 (2 € en fichas)",
      "SrLyce: pone la ciega pequeña 0.01 €",
      "lecontrebandier: pone la ciega grande 0.02 €",
      "christoph363: se retira",
      "MitchATP65: sube 0.04 € a 0.06 €",
      "SrLyce: iguala 0.05 €",
      "lecontrebandier: se retira"
    ],
    "flop": [
      "SrLyce: pasa",
      "MitchATP65: apuesta 0.07 €",
      "SrLyce: se retira",
      "MitchATP65: no muestra su mano",
      "Asiento 4: oliverdu70",
      "Asiento 1: SrLyce (ciega pequeña) se retiró en el Flop",
      "Asiento 2: lecontrebandier (ciega grande) se retiró antes del Flop",
      "Asiento 3: christoph363 se retiró antes del Flop (no apostó)",
      "Asiento 6: MitchATP65 (botón) recaudó (0.13 €)"
    ],
    "turn": [],
    "river": []
  },
  "board": [
    "7s",
    "Qh",
    "8s"
  ],
  "winner": "MitchATP65",
  "win_amount": 6.5,
  "sb": 0.01,
  "bb": 0.02,
  "rake": 0.5,
  "raw_text": "Mano n.º 257149110067 de PokerStars:  Hold'em No Limit (0.01 €/0.02 € EUR) - 30-07-2025 22:08:43 CET [30-07-2025 16:08:43 ET]\nMesa \"Sirona\" 6-max El asiento n.º 6 es el botón\nAsiento 4: oliverdu70 (3.72 € en fichas) está ausente\nAsiento 1: SrLyce (2.79 € en fichas) \nAsiento 2: lecontrebandier (1.61 € en fichas) \nAsiento 3: christoph363 (4.26 € en fichas) \nAsiento 6: MitchATP65 (2 € en fichas) \nSrLyce: pone la ciega pequeña 0.01 €\nlecontrebandier: pone la ciega grande 0.02 €\n*** CARTAS DE MANO ***\nRepartidas a SrLyce [Tc Jd]\nchristoph363: se retira \nMitchATP65: sube 0.04 € a 0.06 €\nSrLyce: iguala 0.05 €\nlecontrebandier: se retira \n*** FLOP *** [7s Qh 8s]\nSrLyce: pasa \nlecontrebandier deja la mesa\nMitchATP65: apuesta 0.07 €\nhadhod1976 se une a la mesa en el asiento n.º 5 \nSrLyce: se retira \nLa apuesta no igualada (0.07 €) ha sido devuelta a MitchATP65\nMitchATP65 se lleva 0.13 € del bote \nMitchATP65: no muestra su mano \n*** RESUMEN ***\nBote total 0.14 € | Comisión 0.01 € \nComunitarias [7s Qh 8s]\nAsiento 4: oliverdu70\nAsiento 1: SrLyce (ciega pequeña) se retiró en el Flop\nAsiento 2: lecontrebandier (ciega grande) se retiró antes del Flop\nAsiento 3: christoph363 se retiró antes del Flop (no apostó)\nAsiento 6: MitchATP65 (botón) recaudó (0.13 €)"
}