{
  "hand_id": "257168397604",
  "date": "01-08-2025 11:40:22",
  "table": "Atlas",
  "game_type": "holdem",
  "hero": "SrLyce",
  "hero_position": "",
  "hero_cards": [
    "2d",
    "3c"
  ],
  "stacks": {
    "SrLyce": 119.0,
    "Fharock": 111.0,
    "ecuinas": 89.5,
    "LxckxStrxkx": 100.0,
    "soy_cule74": 96.5,
    "Akourdideh": 113.5
  },
  "actions": {
    "preflop": [
      "Asiento 1: SrLyce (2.38 € en fichas)",
      "Asiento 2: Fharock (2.22 € en fichas)",
      "Asiento 3: ecuinas (1.79 € en fichas)",
      "Asiento 4: LxckxStrxkx (2 € en fichas)",
      "Asiento 5: soy_cule74 (1.93 € en fichas)",
      "Asiento 6: Akourdideh (2.27 € en fichas)",
      "Akourdideh: pone la ciega pequeña 0.01 €",
      "SrLyce: pone la ciega grande 0.02 €",
      "Fharock: se retira",
      "ecuinas: se retira",
      "LxckxStrxkx: sube 0.04 € a 0.06 €",
      "soy_cule74: se retira",
      "Akourdideh: iguala 0.05 €",
      "SrLyce: iguala 0.04 €"
    ],
    "flop": [
      "Akourdideh: pasa",
      "SrLyce: pasa",
      "LxckxStrxkx: apuesta 0.14 €",
      "Akourdideh: iguala 0.14 €",
      "SrLyce: se retira"
    ],
    "turn": [
      "Akourdideh: pasa",
      "LxckxStrxkx: apuesta 0.20 €",
      "Akourdideh: se retira",
      "LxckxStrxkx: no muestra su mano",
      "Asiento 1: SrLyce (ciega grande) se retiró en el Flop",
      "Asiento 2: Fharock se retiró antes del Flop (no apostó)",
      "Asiento 3: ecuinas se retiró antes del Flop (no apostó)",
      "Asiento 4: LxckxStrxkx recaudó (0.43 €)",
      "Asiento 5: soy_cule74 (botón) se retiró antes del Flop (no apostó)",
      "Asiento 6: Akourdideh (ciega pequeña) se retiró en el Turn"
    ],
    "river": []
  },
  "board": [
    "7s",
    "5c",
    "Th",
    "6h"
  ],
  "winner": "LxckxStrxkx",
  "win_amount": 21.5,
  "sb": 0.01,
  "bb": 0.02,
  "rake": 1.5,
  "raw_text": "Mano n.º 257168397604 de PokerStars:  Hold'em No Limit (0.01 €/0.02 € EUR) - 01-08-2025 11:40:22 CET [01-08-2025 5:40:22 ET]\nMesa \"Atlas\" 6-max El asiento n.º 5 es el botón\nAsiento 1: SrLyce (2.38 € en fichas) \nAsiento 2: Fharock (2.22 € en fichas) \nAsiento 3: ecuinas (1.79 € en fichas) \nAsiento 4: LxckxStrxkx (2 € en fichas) \nAsiento 5: soy_cule74 (1.93 € en fichas) \nAsiento 6: Akourdideh (2.27 € en fichas) \nAkourdideh: pone la ciega pequeña 0.01 €\nSrLyce: pone la ciega grande 0.02 €\n*** CARTAS DE MANO ***\nRepartidas a SrLyce [2d 3c]\nFharock: se retira \necuinas: se retira \nLxckxStrxkx: sube 0.04 € a 0.06 €\nsoy_cule74: se retira \nAkourdideh: iguala 0.05 €\nSrLyce: iguala 0.04 €\n*** FLOP *** [7s 5c Th]\nAkourdideh: pasa \nSrLyce: pasa \nLxckxStrxkx: apuesta 0.14 €\nAkourdideh: iguala 0.14 €\nSrLyce: se retira \n*** TURN *** [7s 5c Th] [6h]\nAkourdideh: pasa \nLxckxStrxkx: apuesta 0.20 €\nAkourdideh: se retira \nLa apuesta no igualada (0.20 €) ha sido devuelta a LxckxStrxkx\nLxckxStrxkx se lleva 0.43 € del bote \nLxckxStrxkx: no muestra su mano \n*** RESUMEN ***\nBote total 0.46 € | Comisión 0.03 € \nComunitarias [7s 5c Th 6h]\nAsiento 1: SrLyce (ciega grande) se retiró en el Flop\nAsiento 2: Fharock se retiró antes del Flop (no apostó)\nAsiento 3: ecuinas se retiró antes del Flop (no apostó)\nAsiento 4: LxckxStrxkx recaudó (0.43 €)\nAsiento 5: soy_cule74 (botón) se retiró antes del Flop (no apostó)\nAsiento 6: Akourdideh (ciega pequeña) se retiró en el Turn"
}