{
  "hand_id": "257238587835",
  "date": "06-08-2025 19:12:22",
  "table": "Adelaide III",
  "game_type": "holdem",
  "hero": "SrLyce",
  "hero_position": "",
  "hero_cards": [
    "9s",
    "7s"
  ],
  "stacks": {
    "Alceo27": 100.0,
    "aliendee07": 67.0,
    "Macklemore0": 107.5,
    "SrLyce": 95.0,
    "ismagonzalez7": 66.0,
    "pauquair5": 53.0
  },
  "actions": {
    "preflop": [
      "Asiento 1: Alceo27 (2 € en fichas)",
      "Asiento 2: aliendee07 (1.34 € en fichas)",
      "Asiento 3: Macklemore0 (2.15 € en fichas)",
      "Asiento 4: SrLyce (1.90 € en fichas)",
      "Asiento 5: ismagonzalez7 (1.32 € en fichas)",
      "Asiento 6: pauquair5 (1.06 € en fichas)",
      "pauquair5: pone la ciega pequeña 0.01 €",
      "Alceo27: pone la ciega grande 0.02 €",
      "aliendee07: se retira",
      "Macklemore0: se retira",
      "SrLyce: sube 0.03 € a 0.05 €",
      "ismagonzalez7: iguala 0.05 €",
      "pauquair5: iguala 0.04 €",
      "Alceo27: iguala 0.03 €"
    ],
    "flop": [
      "pauquair5: pasa",
      "Alceo27: pasa",
      "SrLyce: apuesta 0.06 €",
      "ismagonzalez7: sube 0.16 € a 0.22 €",
      "pauquair5: se retira",
      "Alceo27: se retira",
      "SrLyce: iguala 0.16 €"
    ],
    "turn": [
      "SrLyce: pasa",
      "ismagonzalez7: apuesta 0.30 €",
      "SrLyce: iguala 0.30 €"
    ],
    "river": [
      "SrLyce: pasa",
      "ismagonzalez7: pasa",
      "SrLyce: muestra [9s 7s] (doble pareja, nueves y sietes)",
      "ismagonzalez7: descarta su mano sin mostrar",
      "Asiento 1: Alceo27 (ciega grande) se retiró en el Flop",
      "Asiento 2: aliendee07 se retiró antes del Flop (no apostó)",
      "Asiento 3: Macklemore0 se retiró antes del Flop (no apostó)",
      "Asiento 4: SrLyce muestra [9s 7s] y ganó (1.17 €) con doble pareja, nueves y sietes",
      "Asiento 5: ismagonzalez7 (botón) descartó sin mostrar [Kd 7d]",
      "Asiento 6: pauquair5 (ciega pequeña) se retiró en el Flop"
    ]
  },
  "board": [
    "9h",
    "7h",
    "5d",
    "6s",
    "Ad"
  ],
  "winner": "SrLyce",
  "win_amount": 58.5,
  "sb": 0.01,
  "bb": 0.02,
  "rake": 3.5,
  "raw_text": "Mano n.º 257238587835 de PokerStars:  Hold'em No Limit (0.01 €/0.02 € EUR) - 06-08-2025 19:12:22 CET [06-08-2025 13:12:22 ET]\nMesa \"Adelaide III\" 6-max El asiento n.º 5 es el botón\nAsiento 1: Alceo27 (2 € en fichas) \nAsiento 2: aliendee07 (1.34 € en fichas) \nAsiento 3: Macklemore0 (2.15 € en fichas) \nAsiento 4: SrLyce (1.90 € en fichas) \nAsiento 5: ismagonzalez7 (1.32 € en fichas) \nAsiento 6: pauquair5 (1.06 € en fichas) \npauquair5: pone la ciega pequeña 0.01 €\nAlceo27: pone la ciega grande 0.02 €\n*** CARTAS DE MANO ***\nRepartidas a SrLyce [9s 7s]\naliendee07: se retira \nMacklemore0: se retira \nSrLyce: sube 0.03 € a 0.05 €\nismagonzalez7: iguala 0.05 €\npauquair5: iguala 0.04 €\nAlceo27: iguala 0.03 €\n*** FLOP *** [9h 7h 5d]\npauquair5: pasa \nAlceo27: pasa \nSrLyce: apuesta 0.06 €\nismagonzalez7: sube 0.16 € a 0.22 €\npauquair5: se retira \nAlceo27: se retira \nSrLyce: iguala 0.16 €\n*** TURN *** [9h 7h 5d] [6s]\nSrLyce: pasa \nismagonzalez7: apuesta 0.30 €\nSrLyce: iguala 0.30 €\n*** RIVER *** [9h 7h 5d 6s] [Ad]\nSrLyce: pasa \nismagonzalez7: pasa \n*** SHOW DOWN ***\nSrLyce: muestra [9s 7s] (doble pareja, nueves y sietes)\nismagonzalez7: descarta su mano sin mostrar \nSrLyce se lleva 1.17 € del bote \n*** RESUMEN ***\nBote total 1.24 € | Comisión 0.07 € \nComunitarias [9h 7h 5d 6s Ad]\nAsiento 1: Alceo27 (ciega grande) se retiró en el Flop\nAsiento 2: aliendee07 se retiró antes del Flop (no apostó)\nAsiento 3: Macklemore0 se retiró antes del Flop (no apostó)\nAsiento 4: SrLyce muestra [9s 7s] y ganó (1.17 €) con doble pareja, nueves y sietes\nAsiento 5: ismagonzalez7 (botón) descartó sin mostrar [Kd 7d]\nAsiento 6: pauquair5 (ciega pequeña) se retiró en el Flop"
}