{
  "hand_id": "257238659935",
  "date": "06-08-2025 19:18:24",
  "table": "Adelaide III",
  "game_type": "holdem",
  "hero": "SrLyce",
  "hero_position": "",
  "hero_cards": [
    "7h",
    "Tc"
  ],
  "stacks": {
    "Alceo27": 103.5,
    "aliendee07": 38.0,
    "Macklemore0": 106.5,
    "SrLyce": 130.0,
    "ismagonzalez7": 62.5,
    "McFlash3": 100.0
  },
  "actions": {
    "preflop": [
      "Asiento 1: Alceo27 (2.07 € en fichas)",
      "Asiento 2: aliendee07 (0.76 € en fichas)",
      "Asiento 3: Macklemore0 (2.13 € en fichas)",
      "Asiento 4: SrLyce (2.60 € en fichas)",
      "Asiento 5: ismagonzalez7 (1.25 € en fichas)",
      "Asiento 6: McFlash3 (2 € en fichas)",
      "aliendee07: pone la ciega pequeña 0.01 €",
      "Macklemore0: pone la ciega grande 0.02 €",
      "SrLyce: se retira",
      "ismagonzalez7: sube 0.02 € a 0.04 €",
      "McFlash3: se retira",
      "Alceo27: se retira",
      "aliendee07: iguala 0.03 €",
      "Macklemore0: se retira"
    ],
    "flop": [
      "aliendee07: pasa",
      "ismagonzalez7: pasa"
    ],
    "turn": [
      "aliendee07: apuesta 0.05 €",
      "ismagonzalez7: iguala 0.05 €"
    ],
    "river": [
      "aliendee07: apuesta 0.10 €",
      "ismagonzalez7: se retira",
      "aliendee07: no muestra su mano",
      "Asiento 1: Alceo27 (botón) se retiró antes del Flop (no apostó)",
      "Asiento 2: aliendee07 (ciega pequeña) recaudó (0.19 €)",
      "Asiento 3: Macklemore0 (ciega grande) se retiró antes del Flop",
      "Asiento 4: SrLyce se retiró antes del Flop (no apostó)",
      "Asiento 5: ismagonzalez7 se retiró en el River",
      "Asiento 6: McFlash3 se retiró antes del Flop (no apostó)"
    ]
  },
  "board": [
    "6h",
    "Ac",
    "4h",
    "Ks",
    "2s"
  ],
  "winner": "aliendee07",
  "win_amount": 9.5,
  "sb": 0.01,
  "bb": 0.02,
  "rake": 0.5,
  "raw_text": "Mano n.º 257238659935 de PokerStars:  Hold'em No Limit (0.01 €/0.02 € EUR) - 06-08-2025 19:18:24 CET [06-08-2025 13:18:24 ET]\nMesa \"Adelaide III\" 6-max El asiento n.º 1 es el botón\nAsiento 1: Alceo27 (2.07 € en fichas) \nAsiento 2: aliendee07 (0.76 € en fichas) \nAsiento 3: Macklemore0 (2.13 € en fichas) \nAsiento 4: SrLyce (2.60 € en fichas) \nAsiento 5: ismagonzalez7 (1.25 € en fichas) \nAsiento 6: McFlash3 (2 € en fichas) \naliendee07: pone la ciega pequeña 0.01 €\nMacklemore0: pone la ciega grande 0.02 €\n*** CARTAS DE MANO ***\nRepartidas a SrLyce [7h Tc]\nSrLyce: se retira \nismagonzalez7: sube 0.02 € a 0.04 €\nMcFlash3: se retira \nAlceo27: se retira \naliendee07: iguala 0.03 €\nMacklemore0: se retira \n*** FLOP *** [6h Ac 4h]\naliendee07: pasa \nismagonzalez7: pasa \n*** TURN *** [6h Ac 4h] [Ks]\naliendee07: apuesta 0.05 €\nismagonzalez7: iguala 0.05 €\n*** RIVER *** [6h Ac 4h Ks] [2s]\naliendee07: apuesta 0.10 €\nismagonzalez7: se retira \nLa apuesta no igualada (0.10 €) ha sido devuelta a aliendee07\naliendee07 se lleva 0.19 € del bote \naliendee07: no muestra su mano \n*** RESUMEN ***\nBote total 0.20 € | Comisión 0.01 € \nComunitarias [6h Ac 4h Ks 2s]\nAsiento 1: Alceo27 (botón) se retiró antes del Flop (no apostó)\nAsiento 2: aliendee07 (ciega pequeña) recaudó (0.19 €)\nAsiento 3: Macklemore0 (ciega grande) se retiró antes del Flop\nAsiento 4: SrLyce se retiró antes del Flop (no apostó)\nAsiento 5: ismagonzalez7 se retiró en el River\nAsiento 6: McFlash3 se retiró antes del Flop (no apostó)"
}