{
  "hand_id": "257237042950",
  "date": "06-08-2025 17:34:20",
  "table": "Vanadis II",
  "game_type": "holdem",
  "hero": "SrLyce",
  "hero_position": "",
  "hero_cards": [
    "3d",
    "5s"
  ],
  "stacks": {
    "sarabiagar": 98.0,
    "SrLyce": 97.0,
    "djrojas9": 99.0,
    "noreihh": 149.0,
    "chordewman": 111.5,
    "idigon": 173.5
  },
  "actions": {
    "preflop": [
      "Asiento 5: sarabiagar (1.96 € en fichas) está ausente",
      "Asiento 1: SrLyce (1.94 € en fichas)",
      "Asiento 2: djrojas9 (1.98 € en fichas)",
      "Asiento 3: noreihh (2.98 € en fichas)",
      "Asiento 4: chordewman (2.23 € en fichas)",
      "Asiento 6: idigon (3.47 € en fichas)",
      "djrojas9: pone la ciega pequeña 0.01 €",
      "noreihh: pone la ciega grande 0.02 €",
      "sarabiagar: se ausenta",
      "chordewman: se retira",
      "idigon: sube 0.02 € a 0.04 €",
      "SrLyce: se retira",
      "djrojas9: iguala 0.03 €",
      "noreihh: iguala 0.02 €"
    ],
    "flop": [
      "djrojas9: pasa",
      "noreihh: apuesta 0.08 €",
      "idigon: iguala 0.08 €",
      "djrojas9: se retira"
    ],
    "turn": [
      "noreihh: apuesta 0.38 €",
      "idigon: iguala 0.38 €"
    ],
    "river": [
      "noreihh: apuesta 0.53 €",
      "idigon: se retira",
      "noreihh: no muestra su mano",
      "Asiento 5: sarabiagar",
      "Asiento 1: SrLyce (botón) se retiró antes del Flop (no apostó)",
      "Asiento 2: djrojas9 (ciega pequeña) se retiró en el Flop",
      "Asiento 3: noreihh (ciega grande) recaudó (0.98 €)",
      "Asiento 4: chordewman se retiró antes del Flop (no apostó)",
      "Asiento 6: idigon se retiró en el River"
    ]
  },
  "board": [
    "4c",
    "Qs",
    "3s",
    "2c",
    "Ad"
  ],
  "winner": "noreihh",
  "win_amount": 49.0,
  "sb": 0.01,
  "bb": 0.02,
  "rake": 3.0,
  "raw_text": "Mano n.º 257237042950 de PokerStars:  Hold'em No Limit (0.01 €/0.02 € EUR) - 06-08-2025 17:34:20 CET [06-08-2025 11:34:20 ET]\nMesa \"Vanadis II\" 6-max El asiento n.º 1 es el botón\nAsiento 5: sarabiagar (1.96 € en fichas) está ausente\nAsiento 1: SrLyce (1.94 € en fichas) \nAsiento 2: djrojas9 (1.98 € en fichas) \nAsiento 3: noreihh (2.98 € en fichas) \nAsiento 4: chordewman (2.23 € en fichas) \nAsiento 6: idigon (3.47 € en fichas) \ndjrojas9: pone la ciega pequeña 0.01 €\nnoreihh: pone la ciega grande 0.02 €\nsarabiagar: se ausenta \n*** CARTAS DE MANO ***\nRepartidas a SrLyce [3d 5s]\nchordewman: se retira \nidigon: sube 0.02 € a 0.04 €\nSrLyce: se retira \ndjrojas9: iguala 0.03 €\nnoreihh: iguala 0.02 €\n*** FLOP *** [4c Qs 3s]\ndjrojas9: pasa \nnoreihh: apuesta 0.08 €\nidigon: iguala 0.08 €\ndjrojas9: se retira \n*** TURN *** [4c Qs 3s] [2c]\nnoreihh: apuesta 0.38 €\nidigon: iguala 0.38 €\n*** RIVER *** [4c Qs 3s 2c] [Ad]\nnoreihh: apuesta 0.53 €\nidigon: se retira \nLa apuesta no igualada (0.53 €) ha sido devuelta a noreihh\nnoreihh se lleva 0.98 € del bote \nnoreihh: no muestra su mano \n*** RESUMEN ***\nBote total 1.04 € | Comisión 0.06 € \nComunitarias [4c Qs 3s 2c Ad]\nAsiento 5: sarabiagar\nAsiento 1: SrLyce (botón) se retiró antes del Flop (no apostó)\nAsiento 2: djrojas9 (ciega pequeña) se retiró en el Flop\nAsiento 3: noreihh (ciega grande) recaudó (0.98 €)\nAsiento 4: chordewman se retiró antes del Flop (no apostó)\nAsiento 6: idigon se retiró en el River"
}