{
  "hand_id": "257168354473",
  "date": "01-08-2025 11:32:30",
  "table": "Jupiter",
  "game_type": "holdem",
  "hero": "SrLyce",
  "hero_position": "",
  "hero_cards": [
    "Qd",
    "2h"
  ],
  "stacks": {
    "sifilis5": 108.0,
    "Filou203": 107.5,
    "SrLyce": 107.5,
    "LOLA19711971": 32.0,
    "dadou13mars": 210.5,
    "Alvii37": 111.0
  },
  "actions": {
    "preflop": [
      "Asiento 1: sifilis5 (2.16 € en fichas)",
      "Asiento 2: Filou203 (2.15 € en fichas)",
      "Asiento 3: SrLyce (2.15 € en fichas)",
      "Asiento 4: LOLA19711971 (0.64 € en fichas)",
      "Asiento 5: dadou13mars (4.21 € en fichas)",
      "Asiento 6: Alvii37 (2.22 € en fichas)",
      "sifilis5: pone la ciega pequeña 0.01 €",
      "Filou203: pone la ciega grande 0.02 €",
      "SrLyce: se retira",
      "LOLA19711971: se retira",
      "dadou13mars: se retira",
      "Alvii37: se retira",
      "sifilis5: sube 0.04 € a 0.06 €",
      "Filou203: se retira",
      "sifilis5: no muestra su mano",
      "Asiento 1: sifilis5 (ciega pequeña) recaudó (0.04 €)",
      "Asiento 2: Filou203 (ciega grande) se retiró antes del Flop",
      "Asiento 3: SrLyce se retiró antes del Flop (no apostó)",
      "Asiento 4: LOLA19711971 se retiró antes del Flop (no apostó)",
      "Asiento 5: dadou13mars se retiró antes del Flop (no apostó)",
      "Asiento 6: Alvii37 (botón) se retiró antes del Flop (no apostó)"
    ],
    "flop": [],
    "turn": [],
    "river": []
  },
  "board": [],
  "winner": "sifilis5",
  "win_amount": 2.0,
  "sb": 0.01,
  "bb": 0.02,
  "rake": 0.0,
  "raw_text": "Mano n.º 257168354473 de PokerStars:  Hold'em No Limit (0.01 €/0.02 € EUR) - 01-08-2025 11:32:30 CET [01-08-2025 5:32:30 ET]\nMesa \"Jupiter\" 6-max El asiento n.º 6 es el botón\nAsiento 1: sifilis5 (2.16 € en fichas) \nAsiento 2: Filou203 (2.15 € en fichas) \nAsiento 3: SrLyce (2.15 € en fichas) \nAsiento 4: LOLA19711971 (0.64 € en fichas) \nAsiento 5: dadou13mars (4.21 € en fichas) \nAsiento 6: Alvii37 (2.22 € en fichas) \nsifilis5: pone la ciega pequeña 0.01 €\nFilou203: pone la ciega grande 0.02 €\n*** CARTAS DE MANO ***\nRepartidas a SrLyce [Qd 2h]\nSrLyce: se retira \nLOLA19711971: se retira \ndadou13mars: se retira \nAlvii37: se retira \nsifilis5: sube 0.04 € a 0.06 €\nFilou203: se retira \nLa apuesta no igualada (0.04 €) ha sido devuelta a sifilis5\nsifilis5 se lleva 0.04 € del bote \nsifilis5: no muestra su mano \n*** RESUMEN ***\nBote total 0.04 € | Comisión 0 € \nAsiento 1: sifilis5 (ciega pequeña) recaudó (0.04 €)\nAsiento 2: Filou203 (ciega grande) se retiró antes del Flop\nAsiento 3: SrLyce se retiró antes del Flop (no apostó)\nAsiento 4: LOLA19711971 se retiró antes del Flop (no apostó)\nAsiento 5: dadou13mars se retiró antes del Flop (no apostó)\nAsiento 6: Alvii37 (botón) se retiró antes del Flop (no apostó)"
}