{
  "hand_id": "257168278355",
  "date": "01-08-2025 11:18:18",
  "table": "Jupiter",
  "game_type": "holdem",
  "hero": "SrLyce",
  "hero_position": "",
  "hero_cards": [
    "Js",
    "9s"
  ],
  "stacks": {
    "sifilis5": 98.5,
    "Filou203": 114.0,
    "SrLyce": 115.0,
    "LOLA19711971": 30.5,
    "dadou13mars": 227.5,
    "Alvii37": 97.0
  },
  "actions": {
    "preflop": [
      "Asiento 1: sifilis5 (1.97 € en fichas)",
      "Asiento 2: Filou203 (2.28 € en fichas)",
      "Asiento 3: SrLyce (2.30 € en fichas)",
      "Asiento 4: LOLA19711971 (0.61 € en fichas)",
      "Asiento 5: dadou13mars (4.55 € en fichas)",
      "Asiento 6: Alvii37 (1.94 € en fichas)",
      "dadou13mars: pone la ciega pequeña 0.01 €",
      "Alvii37: pone la ciega grande 0.02 €",
      "sifilis5: sube 0.04 € a 0.06 €",
      "Filou203: se retira",
      "SrLyce: se retira",
      "LOLA19711971: se retira",
      "dadou13mars: se retira",
      "Alvii37: iguala 0.04 €"
    ],
    "flop": [
      "Alvii37: pasa",
      "sifilis5: apuesta 0.04 €",
      "Alvii37: iguala 0.04 €"
    ],
    "turn": [
      "Alvii37: pasa",
      "sifilis5: apuesta 0.15 €",
      "Alvii37: iguala 0.15 €"
    ],
    "river": [
      "Alvii37: pasa",
      "sifilis5: pasa",
      "Alvii37: muestra [Ac 3c] (pareja de ochos)",
      "sifilis5: descarta su mano sin mostrar",
      "Asiento 1: sifilis5 descartó sin mostrar [Qd Jd]",
      "Asiento 2: Filou203 se retiró antes del Flop (no apostó)",
      "Asiento 3: SrLyce se retiró antes del Flop (no apostó)",
      "Asiento 4: LOLA19711971 (botón) se retiró antes del Flop (no apostó)",
      "Asiento 5: dadou13mars (ciega pequeña) se retiró antes del Flop",
      "Asiento 6: Alvii37 (ciega grande) muestra [Ac 3c] y ganó (0.48 €) con pareja de ochos"
    ]
  },
  "board": [
    "Th",
    "8s",
    "2s",
    "4d",
    "8d"
  ],
  "winner": "Alvii37",
  "win_amount": 24.0,
  "sb": 0.01,
  "bb": 0.02,
  "rake": 1.5,
  "raw_text": "Mano n.º 257168278355 de PokerStars:  Hold'em No Limit (0.01 €/0.02 € EUR) - 01-08-2025 11:18:18 CET [01-08-2025 5:18:18 ET]\nMesa \"Jupiter\" 6-max El asiento n.º 4 es el botón\nAsiento 1: sifilis5 (1.97 € en fichas) \nAsiento 2: Filou203 (2.28 € en fichas) \nAsiento 3: SrLyce (2.30 € en fichas) \nAsiento 4: LOLA19711971 (0.61 € en fichas) \nAsiento 5: dadou13mars (4.55 € en fichas) \nAsiento 6: Alvii37 (1.94 € en fichas) \ndadou13mars: pone la ciega pequeña 0.01 €\nAlvii37: pone la ciega grande 0.02 €\n*** CARTAS DE MANO ***\nRepartidas a SrLyce [Js 9s]\nsifilis5: sube 0.04 € a 0.06 €\nFilou203: se retira \nSrLyce: se retira \nLOLA19711971: se retira \ndadou13mars: se retira \nAlvii37: iguala 0.04 €\n*** FLOP *** [Th 8s 2s]\nAlvii37: pasa \nsifilis5: apuesta 0.04 €\nAlvii37: iguala 0.04 €\n*** TURN *** [Th 8s 2s] [4d]\nAlvii37: pasa \nsifilis5: apuesta 0.15 €\nAlvii37: iguala 0.15 €\n*** RIVER *** [Th 8s 2s 4d] [8d]\nAlvii37: pasa \nsifilis5: pasa \n*** SHOW DOWN ***\nAlvii37: muestra [Ac 3c] (pareja de ochos)\nsifilis5: descarta su mano sin mostrar \nAlvii37 se lleva 0.48 € del bote \n*** RESUMEN ***\nBote total 0.51 € | Comisión 0.03 € \nComunitarias [Th 8s 2s 4d 8d]\nAsiento 1: sifilis5 descartó sin mostrar [Qd Jd]\nAsiento 2: Filou203 se retiró antes del Flop (no apostó)\nAsiento 3: SrLyce se retiró antes del Flop (no apostó)\nAsiento 4: LOLA19711971 (botón) se retiró antes del Flop (no apostó)\nAsiento 5: dadou13mars (ciega pequeña) se retiró antes del Flop\nAsiento 6: Alvii37 (ciega grande) muestra [Ac 3c] y ganó (0.48 €) con pareja de ochos"
}