{
  "hand_id": "257238550840",
  "date": "06-08-2025 19:09:16",
  "table": "Herculina II",
  "game_type": "holdem",
  "hero": "SrLyce",
  "hero_position": "",
  "hero_cards": [
    "4s",
    "6h"
  ],
  "stacks": {
    "koldipk": 206.5,
    "David98X": 176.5,
    "JJer11": 207.5,
    "SrLyce": 98.5,
    "Macklemore0": 100.0,
    "ScarvBlack": 113.5
  },
  "actions": {
    "preflop": [
      "Asiento 1: koldipk (4.13 € en fichas) está ausente",
      "Asiento 2: David98X (3.53 € en fichas)",
      "Asiento 3: JJer11 (4.15 € en fichas)",
      "Asiento 4: SrLyce (1.97 € en fichas)",
      "Asiento 5: Macklemore0 (2 € en fichas)",
      "Asiento 6: ScarvBlack (2.27 € en fichas)",
      "ScarvBlack: pone la ciega pequeña 0.01 €",
      "koldipk: está ausente",
      "David98X: pone la ciega grande 0.02 €",
      "JJer11: se retira",
      "SrLyce: se retira",
      "Macklemore0: se retira",
      "ScarvBlack: se retira",
      "David98X: no muestra su mano",
      "Asiento 1: koldipk",
      "Asiento 2: David98X (ciega grande) recaudó (0.02 €)",
      "Asiento 3: JJer11 se retiró antes del Flop (no apostó)",
      "Asiento 4: SrLyce se retiró antes del Flop (no apostó)",
      "Asiento 5: Macklemore0 (botón) se retiró antes del Flop (no apostó)",
      "Asiento 6: ScarvBlack (ciega pequeña) se retiró antes del Flop"
    ],
    "flop": [],
    "turn": [],
    "river": []
  },
  "board": [],
  "winner": "David98X",
  "win_amount": 1.0,
  "sb": 0.01,
  "bb": 0.02,
  "rake": 0.0,
  "raw_text": "Mano n.º 257238550840 de PokerStars:  Hold'em No Limit (0.01 €/0.02 € EUR) - 06-08-2025 19:09:16 CET [06-08-2025 13:09:16 ET]\nMesa \"Herculina II\" 6-max El asiento n.º 5 es el botón\nAsiento 1: koldipk (4.13 € en fichas) está ausente\nAsiento 2: David98X (3.53 € en fichas) \nAsiento 3: JJer11 (4.15 € en fichas) \nAsiento 4: SrLyce (1.97 € en fichas) \nAsiento 5: Macklemore0 (2 € en fichas) \nAsiento 6: ScarvBlack (2.27 € en fichas) \nScarvBlack: pone la ciega pequeña 0.01 €\nkoldipk: está ausente \nDavid98X: pone la ciega grande 0.02 €\n*** CARTAS DE MANO ***\nRepartidas a SrLyce [4s 6h]\nJJer11: se retira \nSrLyce: se retira \nkoldipk deja la mesa\nMacklemore0: se retira \nScarvBlack: se retira \nLa apuesta no igualada (0.01 €) ha sido devuelta a David98X\nDavid98X se lleva 0.02 € del bote \nDavid98X: no muestra su mano \n*** RESUMEN ***\nBote total 0.02 € | Comisión 0 € \nAsiento 1: koldipk\nAsiento 2: David98X (ciega grande) recaudó (0.02 €)\nAsiento 3: JJer11 se retiró antes del Flop (no apostó)\nAsiento 4: SrLyce se retiró antes del Flop (no apostó)\nAsiento 5: Macklemore0 (botón) se retiró antes del Flop (no apostó)\nAsiento 6: ScarvBlack (ciega pequeña) se retiró antes del Flop"
}