{
  "hand_id": "257148728226",
  "date": "30-07-2025 21:39:50",
  "table": "Esclangona",
  "game_type": "holdem",
  "hero": "SrLyce",
  "hero_position": "",
  "hero_cards": [
    "9s",
    "Ks"
  ],
  "stacks": {
    "NoahBolete": 100.0,
    "Zorgue1080": 95.0,
    "SrLyce": 136.0,
    "Davdgoni": 117.5,
    "DiaZzZ1": 114.5,
    "berlcht403": 35.0
  },
  "actions": {
    "preflop": [
      "Asiento 3: NoahBolete (2 € en fichas) está ausente",
      "Asiento 1: Zorgue1080 (1.90 € en fichas)",
      "Asiento 2: SrLyce (2.72 € en fichas)",
      "Asiento 4: Davdgoni (2.35 € en fichas)",
      "Asiento 5: DiaZzZ1 (2.29 € en fichas)",
      "Asiento 6: berlcht403 (0.70 € en fichas)",
      "DiaZzZ1: pone la ciega pequeña 0.01 €",
      "berlcht403: pone la ciega grande 0.02 €",
      "NoahBolete: se ausenta",
      "Zorgue1080: se retira",
      "SrLyce: sube 0.04 € a 0.06 €",
      "Davdgoni: se retira",
      "DiaZzZ1: iguala 0.05 €",
      "berlcht403: se retira"
    ],
    "flop": [
      "DiaZzZ1: pasa",
      "SrLyce: apuesta 0.05 €",
      "DiaZzZ1: iguala 0.05 €"
    ],
    "turn": [
      "DiaZzZ1: pasa",
      "SrLyce: pasa"
    ],
    "river": [
      "DiaZzZ1: pasa",
      "SrLyce: apuesta 0.12 €",
      "DiaZzZ1: iguala 0.12 €",
      "SrLyce: muestra [9s Ks] (doble pareja, nueves y treses)",
      "DiaZzZ1: descarta su mano sin mostrar",
      "Asiento 3: NoahBolete",
      "Asiento 1: Zorgue1080 se retiró antes del Flop (no apostó)",
      "Asiento 2: SrLyce muestra [9s Ks] y ganó (0.45 €) con doble pareja, nueves y treses",
      "Asiento 4: Davdgoni (botón) se retiró antes del Flop (no apostó)",
      "Asiento 5: DiaZzZ1 (ciega pequeña) descartó sin mostrar [Qh Ad]",
      "Asiento 6: berlcht403 (ciega grande) se retiró antes del Flop"
    ]
  },
  "board": [
    "6c",
    "3d",
    "9c",
    "5s",
    "3s"
  ],
  "winner": "SrLyce",
  "win_amount": 22.5,
  "sb": 0.01,
  "bb": 0.02,
  "rake": 1.5,
  "raw_text": "Mano n.º 257148728226 de PokerStars:  Hold'em No Limit (0.01 €/0.02 € EUR) - 30-07-2025 21:39:50 CET [30-07-2025 15:39:50 ET]\nMesa \"Esclangona\" 6-max El asiento n.º 4 es el botón\nAsiento 3: NoahBolete (2 € en fichas) está ausente\nAsiento 1: Zorgue1080 (1.90 € en fichas) \nAsiento 2: SrLyce (2.72 € en fichas) \nAsiento 4: Davdgoni (2.35 € en fichas) \nAsiento 5: DiaZzZ1 (2.29 € en fichas) \nAsiento 6: berlcht403 (0.70 € en fichas) \nDiaZzZ1: pone la ciega pequeña 0.01 €\nberlcht403: pone la ciega grande 0.02 €\nNoahBolete: se ausenta \n*** CARTAS DE MANO ***\nRepartidas a SrLyce [9s Ks]\nZorgue1080: se retira \nSrLyce: sube 0.04 € a 0.06 €\nDavdgoni: se retira \nDiaZzZ1: iguala 0.05 €\nberlcht403: se retira \n*** FLOP *** [6c 3d 9c]\nDiaZzZ1: pasa \nSrLyce: apuesta 0.05 €\nDiaZzZ1: iguala 0.05 €\n*** TURN *** [6c 3d 9c] [5s]\nDiaZzZ1: pasa \nSrLyce: pasa \n*** RIVER *** [6c 3d 9c 5s] [3s]\nDiaZzZ1: pasa \nSrLyce: apuesta 0.12 €\nDiaZzZ1: iguala 0.12 €\n*** SHOW DOWN ***\nSrLyce: muestra [9s Ks] (doble pareja, nueves y treses)\nDiaZzZ1: descarta su mano sin mostrar \nSrLyce se lleva 0.45 € del bote \n*** RESUMEN ***\nBote total 0.48 € | Comisión 0.03 € \nComunitarias [6c 3d 9c 5s 3s]\nAsiento 3: NoahBolete\nAsiento 1: Zorgue1080 se retiró antes del Flop (no apostó)\nAsiento 2: SrLyce muestra [9s Ks] y ganó (0.45 €) con doble pareja, nueves y treses\nAsiento 4: Davdgoni (botón) se retiró antes del Flop (no apostó)\nAsiento 5: DiaZzZ1 (ciega pequeña) descartó sin mostrar [Qh Ad]\nAsiento 6: berlcht403 (ciega grande) se retiró antes del Flop"
}