{
  "hand_id": "257237619777",
  "date": "06-08-2025 17:41:49",
  "table": "Kale III",
  "game_type": "holdem",
  "hero": "SrLyce",
  "hero_position": "",
  "hero_cards": [
    "2c",
    "2h"
  ],
  "stacks": {
    "x__Nest__x": 94.0,
    "SrLyce": 120.0,
    "Dracoline000": 108.0,
    "jeffounet33": 98.0,
    "Begoton": 101.0,
    "juanmemol": 102.5
  },
  "actions": {
    "preflop": [
      "Asiento 1: x__Nest__x (1.88 € en fichas)",
      "Asiento 2: SrLyce (2.40 € en fichas)",
      "Asiento 3: Dracoline000 (2.16 € en fichas)",
      "Asiento 4: jeffounet33 (1.96 € en fichas)",
      "Asiento 5: Begoton (2.02 € en fichas)",
      "Asiento 6: juanmemol (2.05 € en fichas)",
      "SrLyce: pone la ciega pequeña 0.01 €",
      "Dracoline000: pone la ciega grande 0.02 €",
      "jeffounet33: iguala 0.02 €",
      "Begoton: se retira",
      "juanmemol: se retira",
      "x__Nest__x: sube 0.04 € a 0.06 €",
      "SrLyce: iguala 0.05 €",
      "Dracoline000: iguala 0.04 €",
      "jeffounet33: iguala 0.04 €"
    ],
    "flop": [
      "SrLyce: pasa",
      "Dracoline000: apuesta 0.08 €",
      "jeffounet33: se retira",
      "x__Nest__x: se retira",
      "SrLyce: se retira",
      "Dracoline000: no muestra su mano",
      "Asiento 1: x__Nest__x (botón) se retiró en el Flop",
      "Asiento 2: SrLyce (ciega pequeña) se retiró en el Flop",
      "Asiento 3: Dracoline000 (ciega grande) recaudó (0.23 €)",
      "Asiento 4: jeffounet33 se retiró en el Flop",
      "Asiento 5: Begoton se retiró antes del Flop (no apostó)",
      "Asiento 6: juanmemol se retiró antes del Flop (no apostó)"
    ],
    "turn": [],
    "river": []
  },
  "board": [
    "6h",
    "4c",
    "Kh"
  ],
  "winner": "Dracoline000",
  "win_amount": 11.5,
  "sb": 0.01,
  "bb": 0.02,
  "rake": 0.5,
  "raw_text": "Mano n.º 257237619777 de PokerStars:  Hold'em No Limit (0.01 €/0.02 € EUR) - 06-08-2025 17:41:49 CET [06-08-2025 11:41:49 ET]\nMesa \"Kale III\" 6-max El asiento n.º 1 es el botón\nAsiento 1: x__Nest__x (1.88 € en fichas) \nAsiento 2: SrLyce (2.40 € en fichas) \nAsiento 3: Dracoline000 (2.16 € en fichas) \nAsiento 4: jeffounet33 (1.96 € en fichas) \nAsiento 5: Begoton (2.02 € en fichas) \nAsiento 6: juanmemol (2.05 € en fichas) \nSrLyce: pone la ciega pequeña 0.01 €\nDracoline000: pone la ciega grande 0.02 €\n*** CARTAS DE MANO ***\nRepartidas a SrLyce [2c 2h]\njeffounet33: iguala 0.02 €\nBegoton: se retira \njuanmemol: se retira \nx__Nest__x: sube 0.04 € a 0.06 €\nSrLyce: iguala 0.05 €\nDracoline000: iguala 0.04 €\njeffounet33: iguala 0.04 €\n*** FLOP *** [6h 4c Kh]\nSrLyce: pasa \nDracoline000: apuesta 0.08 €\njeffounet33: se retira \nx__Nest__x: se retira \nSrLyce: se retira \nLa apuesta no igualada (0.08 €) ha sido devuelta a Dracoline000\nDracoline000 se lleva 0.23 € del bote \nDracoline000: no muestra su mano \n*** RESUMEN ***\nBote total 0.24 € | Comisión 0.01 € \nComunitarias [6h 4c Kh]\nAsiento 1: x__Nest__x (botón) se retiró en el Flop\nAsiento 2: SrLyce (ciega pequeña) se retiró en el Flop\nAsiento 3: Dracoline000 (ciega grande) recaudó (0.23 €)\nAsiento 4: jeffounet33 se retiró en el Flop\nAsiento 5: Begoton se retiró antes del Flop (no apostó)\nAsiento 6: juanmemol se retiró antes del Flop (no apostó)"
}