{
  "hand_id": "257238648566",
  "date": "06-08-2025 19:17:27",
  "table": "Adelaide III",
  "game_type": "holdem",
  "hero": "SrLyce",
  "hero_position": "",
  "hero_cards": [
    "Kh",
    "2h"
  ],
  "stacks": {
    "Macklemore0": 106.5,
    "Alceo27": 105.0,
    "aliendee07": 68.0,
    "SrLyce": 130.0,
    "ismagonzalez7": 28.5,
    "McFlash3": 100.5
  },
  "actions": {
    "preflop": [
      "Asiento 3: Macklemore0 (2.13 € en fichas) está ausente",
      "Asiento 1: Alceo27 (2.10 € en fichas)",
      "Asiento 2: aliendee07 (1.36 € en fichas)",
      "Asiento 4: SrLyce (2.60 € en fichas)",
      "Asiento 5: ismagonzalez7 (0.57 € en fichas)",
      "Asiento 6: McFlash3 (2.01 € en fichas)",
      "McFlash3: pone la ciega pequeña 0.01 €",
      "Alceo27: pone la ciega grande 0.02 €",
      "Macklemore0: se ausenta",
      "aliendee07: se retira",
      "SrLyce: se retira",
      "ismagonzalez7: sube 0.02 € a 0.04 €",
      "McFlash3: se retira",
      "Alceo27: se retira",
      "ismagonzalez7: no muestra su mano",
      "Asiento 3: Macklemore0",
      "Asiento 1: Alceo27 (ciega grande) se retiró antes del Flop",
      "Asiento 2: aliendee07 se retiró antes del Flop (no apostó)",
      "Asiento 4: SrLyce se retiró antes del Flop (no apostó)",
      "Asiento 5: ismagonzalez7 (botón) recaudó (0.05 €)",
      "Asiento 6: McFlash3 (ciega pequeña) se retiró antes del Flop"
    ],
    "flop": [],
    "turn": [],
    "river": []
  },
  "board": [],
  "winner": "ismagonzalez7",
  "win_amount": 2.5,
  "sb": 0.01,
  "bb": 0.02,
  "rake": 0.0,
  "raw_text": "Mano n.º 257238648566 de PokerStars:  Hold'em No Limit (0.01 €/0.02 € EUR) - 06-08-2025 19:17:27 CET [06-08-2025 13:17:27 ET]\nMesa \"Adelaide III\" 6-max El asiento n.º 5 es el botón\nAsiento 3: Macklemore0 (2.13 € en fichas) está ausente\nAsiento 1: Alceo27 (2.10 € en fichas) \nAsiento 2: aliendee07 (1.36 € en fichas) \nAsiento 4: SrLyce (2.60 € en fichas) \nAsiento 5: ismagonzalez7 (0.57 € en fichas) \nAsiento 6: McFlash3 (2.01 € en fichas) \nMcFlash3: pone la ciega pequeña 0.01 €\nAlceo27: pone la ciega grande 0.02 €\nMacklemore0: se ausenta \n*** CARTAS DE MANO ***\nRepartidas a SrLyce [Kh 2h]\naliendee07: se retira \nSrLyce: se retira \nismagonzalez7: sube 0.02 € a 0.04 €\nMcFlash3: se retira \nAlceo27: se retira \nLa apuesta no igualada (0.02 €) ha sido devuelta a ismagonzalez7\nismagonzalez7 se lleva 0.05 € del bote \nismagonzalez7: no muestra su mano \n*** RESUMEN ***\nBote total 0.05 € | Comisión 0 € \nAsiento 3: Macklemore0\nAsiento 1: Alceo27 (ciega grande) se retiró antes del Flop\nAsiento 2: aliendee07 se retiró antes del Flop (no apostó)\nAsiento 4: SrLyce se retiró antes del Flop (no apostó)\nAsiento 5: ismagonzalez7 (botón) recaudó (0.05 €)\nAsiento 6: McFlash3 (ciega pequeña) se retiró antes del Flop"
}