{
  "hand_id": "257150372218",
  "date": "30-07-2025 23:37:09",
  "table": "Martha",
  "game_type": "holdem",
  "hero": "SrLyce",
  "hero_position": "",
  "hero_cards": [
    "As",
    "4s"
  ],
  "stacks": {
    "Sigiilo": 100.0,
    "mivipkr": 100.0,
    "NovacaineZxc": 128.0,
    "BudyXXIII": 105.5,
    "SrLyce": 97.0,
    "coyallen": 94.0
  },
  "actions": {
    "preflop": [
      "Asiento 4: Sigiilo (2 € en fichas) está ausente",
      "Asiento 1: mivipkr (2 € en fichas)",
      "Asiento 2: NovacaineZxc (2.56 € en fichas)",
      "Asiento 3: BudyXXIII (2.11 € en fichas)",
      "Asiento 5: SrLyce (1.94 € en fichas)",
      "Asiento 6: coyallen (1.88 € en fichas)",
      "mivipkr: pone la ciega pequeña 0.01 €",
      "NovacaineZxc: pone la ciega grande 0.02 €",
      "Sigiilo: se ausenta",
      "BudyXXIII: se retira",
      "SrLyce: sube 0.04 € a 0.06 €",
      "coyallen: iguala 0.06 €",
      "mivipkr: se retira",
      "NovacaineZxc: se retira"
    ],
    "flop": [
      "SrLyce: apuesta 0.06 €",
      "coyallen: se retira",
      "SrLyce: no muestra su mano",
      "Asiento 4: Sigiilo",
      "Asiento 1: mivipkr (ciega pequeña) se retiró antes del Flop",
      "Asiento 2: NovacaineZxc (ciega grande) se retiró antes del Flop",
      "Asiento 3: BudyXXIII se retiró antes del Flop (no apostó)",
      "Asiento 5: SrLyce recaudó (0.14 €)",
      "Asiento 6: coyallen (botón) se retiró en el Flop"
    ],
    "turn": [],
    "river": []
  },
  "board": [
    "7h",
    "Qs",
    "6s"
  ],
  "winner": "SrLyce",
  "win_amount": 7.0,
  "sb": 0.01,
  "bb": 0.02,
  "rake": 0.5,
  "raw_text": "Mano n.º 257150372218 de PokerStars:  Hold'em No Limit (0.01 €/0.02 € EUR) - 30-07-2025 23:37:09 CET [30-07-2025 17:37:09 ET]\nMesa \"Martha\" 6-max El asiento n.º 6 es el botón\nAsiento 4: Sigiilo (2 € en fichas) está ausente\nAsiento 1: mivipkr (2 € en fichas) \nAsiento 2: NovacaineZxc (2.56 € en fichas) \nAsiento 3: BudyXXIII (2.11 € en fichas) \nAsiento 5: SrLyce (1.94 € en fichas) \nAsiento 6: coyallen (1.88 € en fichas) \nmivipkr: pone la ciega pequeña 0.01 €\nNovacaineZxc: pone la ciega grande 0.02 €\nSigiilo: se ausenta \n*** CARTAS DE MANO ***\nRepartidas a SrLyce [As 4s]\nBudyXXIII: se retira \nSrLyce: sube 0.04 € a 0.06 €\ncoyallen: iguala 0.06 €\nmivipkr: se retira \nNovacaineZxc: se retira \n*** FLOP *** [7h Qs 6s]\nSrLyce: apuesta 0.06 €\ncoyallen: se retira \nLa apuesta no igualada (0.06 €) ha sido devuelta a SrLyce\nSrLyce se lleva 0.14 € del bote \nSrLyce: no muestra su mano \ncoyallen deja la mesa\n*** RESUMEN ***\nBote total 0.15 € | Comisión 0.01 € \nComunitarias [7h Qs 6s]\nAsiento 4: Sigiilo\nAsiento 1: mivipkr (ciega pequeña) se retiró antes del Flop\nAsiento 2: NovacaineZxc (ciega grande) se retiró antes del Flop\nAsiento 3: BudyXXIII se retiró antes del Flop (no apostó)\nAsiento 5: SrLyce recaudó (0.14 €)\nAsiento 6: coyallen (botón) se retiró en el Flop"
}