{
  "hand_id": "257238448777",
  "date": "06-08-2025 19:00:08",
  "table": "Adelaide III",
  "game_type": "holdem",
  "hero": "SrLyce",
  "hero_position": "",
  "hero_cards": [
    "2c",
    "Qc"
  ],
  "stacks": {
    "N3xtTIm35": 124.5,
    "aliendee07": 64.5,
    "Macklemore0": 100.0,
    "SrLyce": 98.0,
    "ismagonzalez7": 59.0,
    "pauquair5": 62.0
  },
  "actions": {
    "preflop": [
      "Asiento 1: N3xtTIm35 (2.49 € en fichas)",
      "Asiento 2: aliendee07 (1.29 € en fichas)",
      "Asiento 3: Macklemore0 (2 € en fichas)",
      "Asiento 4: SrLyce (1.96 € en fichas)",
      "Asiento 5: ismagonzalez7 (1.18 € en fichas)",
      "Asiento 6: pauquair5 (1.24 € en fichas)",
      "ismagonzalez7: pone la ciega pequeña 0.01 €",
      "pauquair5: pone la ciega grande 0.02 €",
      "N3xtTIm35: se retira",
      "aliendee07: se retira",
      "Macklemore0: se retira",
      "SrLyce: se retira",
      "ismagonzalez7: sube 0.02 € a 0.04 €",
      "pauquair5: iguala 0.02 €"
    ],
    "flop": [
      "ismagonzalez7: apuesta 0.04 €",
      "pauquair5: iguala 0.04 €"
    ],
    "turn": [
      "ismagonzalez7: apuesta 0.08 €",
      "pauquair5: iguala 0.08 €"
    ],
    "river": [
      "ismagonzalez7: pasa",
      "pauquair5: pasa",
      "ismagonzalez7: muestra [As 4d] (carta alta as)",
      "pauquair5: muestra [7c 2s] (pareja de sietes)",
      "Asiento 1: N3xtTIm35 se retiró antes del Flop (no apostó)",
      "Asiento 2: aliendee07 se retiró antes del Flop (no apostó)",
      "Asiento 3: Macklemore0 se retiró antes del Flop (no apostó)",
      "Asiento 4: SrLyce (botón) se retiró antes del Flop (no apostó)",
      "Asiento 5: ismagonzalez7 (ciega pequeña) muestra [As 4d] y perdió con carta alta as",
      "Asiento 6: pauquair5 (ciega grande) muestra [7c 2s] y ganó (0.30 €) con pareja de sietes"
    ]
  },
  "board": [
    "5s",
    "9d",
    "7d",
    "Ts",
    "3c"
  ],
  "winner": "pauquair5",
  "win_amount": 15.0,
  "sb": 0.01,
  "bb": 0.02,
  "rake": 1.0,
  "raw_text": "Mano n.º 257238448777 de PokerStars:  Hold'em No Limit (0.01 €/0.02 € EUR) - 06-08-2025 19:00:08 CET [06-08-2025 13:00:08 ET]\nMesa \"Adelaide III\" 6-max El asiento n.º 4 es el botón\nAsiento 1: N3xtTIm35 (2.49 € en fichas) \nAsiento 2: aliendee07 (1.29 € en fichas) \nAsiento 3: Macklemore0 (2 € en fichas) \nAsiento 4: SrLyce (1.96 € en fichas) \nAsiento 5: ismagonzalez7 (1.18 € en fichas) \nAsiento 6: pauquair5 (1.24 € en fichas) \nismagonzalez7: pone la ciega pequeña 0.01 €\npauquair5: pone la ciega grande 0.02 €\n*** CARTAS DE MANO ***\nRepartidas a SrLyce [2c Qc]\nN3xtTIm35: se retira \naliendee07 ha agotado su tiempo\naliendee07: se retira \nMacklemore0: se retira \nSrLyce: se retira \nismagonzalez7: sube 0.02 € a 0.04 €\npauquair5: iguala 0.02 €\n*** FLOP *** [5s 9d 7d]\nismagonzalez7: apuesta 0.04 €\npauquair5: iguala 0.04 €\n*** TURN *** [5s 9d 7d] [Ts]\nismagonzalez7: apuesta 0.08 €\npauquair5: iguala 0.08 €\n*** RIVER *** [5s 9d 7d Ts] [3c]\nismagonzalez7: pasa \npauquair5: pasa \n*** SHOW DOWN ***\nismagonzalez7: muestra [As 4d] (carta alta as)\npauquair5: muestra [7c 2s] (pareja de sietes)\npauquair5 se lleva 0.30 € del bote \n*** RESUMEN ***\nBote total 0.32 € | Comisión 0.02 € \nComunitarias [5s 9d 7d Ts 3c]\nAsiento 1: N3xtTIm35 se retiró antes del Flop (no apostó)\nAsiento 2: aliendee07 se retiró antes del Flop (no apostó)\nAsiento 3: Macklemore0 se retiró antes del Flop (no apostó)\nAsiento 4: SrLyce (botón) se retiró antes del Flop (no apostó)\nAsiento 5: ismagonzalez7 (ciega pequeña) muestra [As 4d] y perdió con carta alta as\nAsiento 6: pauquair5 (ciega grande) muestra [7c 2s] y ganó (0.30 €) con pareja de sietes"
}