{
  "hand_id": "257238287981",
  "date": "06-08-2025 18:44:43",
  "table": "Herculina II",
  "game_type": "holdem",
  "hero": "SrLyce",
  "hero_position": "",
  "hero_cards": [
    "2h",
    "Qd"
  ],
  "stacks": {
    "koldipk": 168.0,
    "David98X": 109.5,
    "JJer11": 100.0,
    "SrLyce": 95.5,
    "El Calvo 65": 232.5,
    "dragonfly2467": 100.0
  },
  "actions": {
    "preflop": [
      "Asiento 1: koldipk (3.36 € en fichas)",
      "Asiento 2: David98X (2.19 € en fichas)",
      "Asiento 3: JJer11 (2 € en fichas)",
      "Asiento 4: SrLyce (1.91 € en fichas)",
      "Asiento 5: El Calvo 65 (4.65 € en fichas)",
      "Asiento 6: dragonfly2467 (2 € en fichas)",
      "El Calvo 65: pone la ciega pequeña 0.01 €",
      "dragonfly2467: pone la ciega grande 0.02 €",
      "koldipk: sube 0.04 € a 0.06 €",
      "David98X: se retira",
      "JJer11: se retira",
      "SrLyce: se retira",
      "El Calvo 65: iguala 0.05 €",
      "dragonfly2467: se retira"
    ],
    "flop": [
      "El Calvo 65: pasa",
      "koldipk: pasa"
    ],
    "turn": [
      "El Calvo 65: apuesta 0.04 €",
      "koldipk: iguala 0.04 €"
    ],
    "river": [
      "El Calvo 65: pasa",
      "koldipk: apuesta 0.10 €",
      "El Calvo 65: se retira",
      "Asiento 1: koldipk recaudó (0.21 €)",
      "Asiento 2: David98X se retiró antes del Flop (no apostó)",
      "Asiento 3: JJer11 se retiró antes del Flop (no apostó)",
      "Asiento 4: SrLyce (botón) se retiró antes del Flop (no apostó)",
      "Asiento 5: El Calvo 65 (ciega pequeña) se retiró en el River",
      "Asiento 6: dragonfly2467 (ciega grande) se retiró antes del Flop"
    ]
  },
  "board": [
    "4s",
    "6s",
    "Ah",
    "4h",
    "9s"
  ],
  "winner": "koldipk",
  "win_amount": 10.5,
  "sb": 0.01,
  "bb": 0.02,
  "rake": 0.5,
  "raw_text": "Mano n.º 257238287981 de PokerStars:  Hold'em No Limit (0.01 €/0.02 € EUR) - 06-08-2025 18:44:43 CET [06-08-2025 12:44:43 ET]\nMesa \"Herculina II\" 6-max El asiento n.º 4 es el botón\nAsiento 1: koldipk (3.36 € en fichas) \nAsiento 2: David98X (2.19 € en fichas) \nAsiento 3: JJer11 (2 € en fichas) \nAsiento 4: SrLyce (1.91 € en fichas) \nAsiento 5: El Calvo 65 (4.65 € en fichas) \nAsiento 6: dragonfly2467 (2 € en fichas) \nEl Calvo 65: pone la ciega pequeña 0.01 €\ndragonfly2467: pone la ciega grande 0.02 €\n*** CARTAS DE MANO ***\nRepartidas a SrLyce [2h Qd]\nkoldipk: sube 0.04 € a 0.06 €\nDavid98X: se retira \nJJer11: se retira \nSrLyce: se retira \nEl Calvo 65: iguala 0.05 €\ndragonfly2467: se retira \n*** FLOP *** [4s 6s Ah]\ndragonfly2467 deja la mesa\nEl Calvo 65: pasa \nkoldipk tiene conexión \nkoldipk: pasa \n*** TURN *** [4s 6s Ah] [4h]\nEl Calvo 65: apuesta 0.04 €\nkoldipk: iguala 0.04 €\n*** RIVER *** [4s 6s Ah 4h] [9s]\nEl Calvo 65: pasa \nkoldipk: apuesta 0.10 €\nEl Calvo 65: se retira \nLa apuesta no igualada (0.10 €) ha sido devuelta a koldipk\nkoldipk se lleva 0.21 € del bote \n*** RESUMEN ***\nBote total 0.22 € | Comisión 0.01 € \nComunitarias [4s 6s Ah 4h 9s]\nAsiento 1: koldipk recaudó (0.21 €)\nAsiento 2: David98X se retiró antes del Flop (no apostó)\nAsiento 3: JJer11 se retiró antes del Flop (no apostó)\nAsiento 4: SrLyce (botón) se retiró antes del Flop (no apostó)\nAsiento 5: El Calvo 65 (ciega pequeña) se retiró en el River\nAsiento 6: dragonfly2467 (ciega grande) se retiró antes del Flop"
}