{
  "hand_id": "257168352130",
  "date": "01-08-2025 11:32:04",
  "table": "Jupiter",
  "game_type": "holdem",
  "hero": "SrLyce",
  "hero_position": "",
  "hero_cards": [
    "2h",
    "5h"
  ],
  "stacks": {
    "sifilis5": 109.0,
    "Filou203": 106.0,
    "SrLyce": 107.5,
    "LOLA19711971": 32.0,
    "dadou13mars": 210.5,
    "Alvii37": 111.5
  },
  "actions": {
    "preflop": [
      "Asiento 1: sifilis5 (2.18 € en fichas)",
      "Asiento 2: Filou203 (2.12 € en fichas)",
      "Asiento 3: SrLyce (2.15 € en fichas)",
      "Asiento 4: LOLA19711971 (0.64 € en fichas)",
      "Asiento 5: dadou13mars (4.21 € en fichas)",
      "Asiento 6: Alvii37 (2.23 € en fichas)",
      "Alvii37: pone la ciega pequeña 0.01 €",
      "sifilis5: pone la ciega grande 0.02 €",
      "Filou203: sube 0.03 € a 0.05 €",
      "SrLyce: se retira",
      "LOLA19711971: se retira",
      "dadou13mars: se retira",
      "Alvii37: se retira",
      "sifilis5: se retira",
      "Filou203: no muestra su mano",
      "Asiento 1: sifilis5 (ciega grande) se retiró antes del Flop",
      "Asiento 2: Filou203 recaudó (0.05 €)",
      "Asiento 3: SrLyce se retiró antes del Flop (no apostó)",
      "Asiento 4: LOLA19711971 se retiró antes del Flop (no apostó)",
      "Asiento 5: dadou13mars (botón) se retiró antes del Flop (no apostó)",
      "Asiento 6: Alvii37 (ciega pequeña) se retiró antes del Flop"
    ],
    "flop": [],
    "turn": [],
    "river": []
  },
  "board": [],
  "winner": "Filou203",
  "win_amount": 2.5,
  "sb": 0.01,
  "bb": 0.02,
  "rake": 0.0,
  "raw_text": "Mano n.º 257168352130 de PokerStars:  Hold'em No Limit (0.01 €/0.02 € EUR) - 01-08-2025 11:32:04 CET [01-08-2025 5:32:04 ET]\nMesa \"Jupiter\" 6-max El asiento n.º 5 es el botón\nAsiento 1: sifilis5 (2.18 € en fichas) \nAsiento 2: Filou203 (2.12 € en fichas) \nAsiento 3: SrLyce (2.15 € en fichas) \nAsiento 4: LOLA19711971 (0.64 € en fichas) \nAsiento 5: dadou13mars (4.21 € en fichas) \nAsiento 6: Alvii37 (2.23 € en fichas) \nAlvii37: pone la ciega pequeña 0.01 €\nsifilis5: pone la ciega grande 0.02 €\n*** CARTAS DE MANO ***\nRepartidas a SrLyce [2h 5h]\nFilou203: sube 0.03 € a 0.05 €\nSrLyce: se retira \nLOLA19711971: se retira \ndadou13mars: se retira \nAlvii37: se retira \nsifilis5: se retira \nLa apuesta no igualada (0.03 €) ha sido devuelta a Filou203\nFilou203 se lleva 0.05 € del bote \nFilou203: no muestra su mano \n*** RESUMEN ***\nBote total 0.05 € | Comisión 0 € \nAsiento 1: sifilis5 (ciega grande) se retiró antes del Flop\nAsiento 2: Filou203 recaudó (0.05 €)\nAsiento 3: SrLyce se retiró antes del Flop (no apostó)\nAsiento 4: LOLA19711971 se retiró antes del Flop (no apostó)\nAsiento 5: dadou13mars (botón) se retiró antes del Flop (no apostó)\nAsiento 6: Alvii37 (ciega pequeña) se retiró antes del Flop"
}