{
  "hand_id": "257149938900",
  "date": "30-07-2025 23:07:14",
  "table": "Gilgamesh",
  "game_type": "holdem",
  "hero": "SrLyce",
  "hero_position": "",
  "hero_cards": [
    "3d",
    "Qc"
  ],
  "stacks": {
    "xapkk": 100.0,
    "riverrrrrrmagic": 120.5,
    "SrLyce": 115.0,
    "Jumby34": 100.0,
    "cbo54": 91.0,
    "Fretzo67500": 105.0
  },
  "actions": {
    "preflop": [
      "Asiento 4: xapkk (2 € en fichas) está ausente",
      "Asiento 1: riverrrrrrmagic (2.41 € en fichas)",
      "Asiento 2: SrLyce (2.30 € en fichas)",
      "Asiento 3: Jumby34 (2 € en fichas)",
      "Asiento 5: cbo54 (1.82 € en fichas)",
      "Asiento 6: Fretzo67500 (2.10 € en fichas)",
      "Fretzo67500: pone la ciega pequeña 0.01 €",
      "riverrrrrrmagic: pone la ciega grande 0.02 €",
      "xapkk: se ausenta",
      "SrLyce: se retira",
      "Jumby34: se retira",
      "cbo54: iguala 0.02 €",
      "Fretzo67500: se retira",
      "riverrrrrrmagic: pasa"
    ],
    "flop": [
      "riverrrrrrmagic: pasa",
      "cbo54: apuesta 0.04 €",
      "riverrrrrrmagic: se retira",
      "cbo54: no muestra su mano",
      "Asiento 4: xapkk",
      "Asiento 1: riverrrrrrmagic (ciega grande) se retiró en el Flop",
      "Asiento 2: SrLyce se retiró antes del Flop (no apostó)",
      "Asiento 3: Jumby34 se retiró antes del Flop (no apostó)",
      "Asiento 5: cbo54 (botón) recaudó (0.05 €)",
      "Asiento 6: Fretzo67500 (ciega pequeña) se retiró antes del Flop"
    ],
    "turn": [],
    "river": []
  },
  "board": [
    "Kh",
    "Th",
    "7d"
  ],
  "winner": "cbo54",
  "win_amount": 2.5,
  "sb": 0.01,
  "bb": 0.02,
  "rake": 0.0,
  "raw_text": "Mano n.º 257149938900 de PokerStars:  Hold'em No Limit (0.01 €/0.02 € EUR) - 30-07-2025 23:07:14 CET [30-07-2025 17:07:14 ET]\nMesa \"Gilgamesh\" 6-max El asiento n.º 5 es el botón\nAsiento 4: xapkk (2 € en fichas) está ausente\nAsiento 1: riverrrrrrmagic (2.41 € en fichas) \nAsiento 2: SrLyce (2.30 € en fichas) \nAsiento 3: Jumby34 (2 € en fichas) \nAsiento 5: cbo54 (1.82 € en fichas) \nAsiento 6: Fretzo67500 (2.10 € en fichas) \nFretzo67500: pone la ciega pequeña 0.01 €\nriverrrrrrmagic: pone la ciega grande 0.02 €\nxapkk: se ausenta \n*** CARTAS DE MANO ***\nRepartidas a SrLyce [3d Qc]\nSrLyce: se retira \nJumby34: se retira \ncbo54: iguala 0.02 €\nFretzo67500: se retira \nriverrrrrrmagic: pasa \n*** FLOP *** [Kh Th 7d]\nriverrrrrrmagic: pasa \ncbo54: apuesta 0.04 €\nriverrrrrrmagic: se retira \nLa apuesta no igualada (0.04 €) ha sido devuelta a cbo54\ncbo54 se lleva 0.05 € del bote \ncbo54: no muestra su mano \n*** RESUMEN ***\nBote total 0.05 € | Comisión 0 € \nComunitarias [Kh Th 7d]\nAsiento 4: xapkk\nAsiento 1: riverrrrrrmagic (ciega grande) se retiró en el Flop\nAsiento 2: SrLyce se retiró antes del Flop (no apostó)\nAsiento 3: Jumby34 se retiró antes del Flop (no apostó)\nAsiento 5: cbo54 (botón) recaudó (0.05 €)\nAsiento 6: Fretzo67500 (ciega pequeña) se retiró antes del Flop"
}