{
  "hand_id": "257149147951",
  "date": "30-07-2025 22:11:24",
  "table": "Sirona",
  "game_type": "holdem",
  "hero": "SrLyce",
  "hero_position": "",
  "hero_cards": [
    "8h",
    "4h"
  ],
  "stacks": {
    "oliverdu70": 186.0,
    "hadhod1976": 40.0,
    "SrLyce": 133.0,
    "Tropki": 100.0,
    "christoph363": 218.5,
    "MitchATP65": 103.0
  },
  "actions": {
    "preflop": [
      "Asiento 4: oliverdu70 (3.72 € en fichas) está ausente",
      "Asiento 5: hadhod1976 (0.80 € en fichas) está ausente",
      "Asiento 1: SrLyce (2.66 € en fichas)",
      "Asiento 2: Tropki (2 € en fichas)",
      "Asiento 3: christoph363 (4.37 € en fichas)",
      "Asiento 6: MitchATP65 (2.06 € en fichas)",
      "SrLyce: pone la ciega pequeña 0.01 €",
      "Tropki: pone la ciega grande 0.02 €",
      "christoph363: se retira",
      "MitchATP65: se retira",
      "SrLyce: se retira",
      "Tropki: no muestra su mano",
      "Asiento 4: oliverdu70",
      "Asiento 5: hadhod1976",
      "Asiento 1: SrLyce (ciega pequeña) se retiró antes del Flop",
      "Asiento 2: Tropki (ciega grande) recaudó (0.02 €)",
      "Asiento 3: christoph363 se retiró antes del Flop (no apostó)",
      "Asiento 6: MitchATP65 (botón) se retiró antes del Flop (no apostó)"
    ],
    "flop": [],
    "turn": [],
    "river": []
  },
  "board": [],
  "winner": "Tropki",
  "win_amount": 1.0,
  "sb": 0.01,
  "bb": 0.02,
  "rake": 0.0,
  "raw_text": "Mano n.º 257149147951 de PokerStars:  Hold'em No Limit (0.01 €/0.02 € EUR) - 30-07-2025 22:11:24 CET [30-07-2025 16:11:24 ET]\nMesa \"Sirona\" 6-max El asiento n.º 6 es el botón\nAsiento 4: oliverdu70 (3.72 € en fichas) está ausente\nAsiento 5: hadhod1976 (0.80 € en fichas) está ausente\nAsiento 1: SrLyce (2.66 € en fichas) \nAsiento 2: Tropki (2 € en fichas) \nAsiento 3: christoph363 (4.37 € en fichas) \nAsiento 6: MitchATP65 (2.06 € en fichas) \nSrLyce: pone la ciega pequeña 0.01 €\nTropki: pone la ciega grande 0.02 €\n*** CARTAS DE MANO ***\nRepartidas a SrLyce [8h 4h]\nchristoph363: se retira \nMitchATP65: se retira \nSrLyce: se retira \nLa apuesta no igualada (0.01 €) ha sido devuelta a Tropki\nTropki se lleva 0.02 € del bote \nTropki: no muestra su mano \n*** RESUMEN ***\nBote total 0.02 € | Comisión 0 € \nAsiento 4: oliverdu70\nAsiento 5: hadhod1976\nAsiento 1: SrLyce (ciega pequeña) se retiró antes del Flop\nAsiento 2: Tropki (ciega grande) recaudó (0.02 €)\nAsiento 3: christoph363 se retiró antes del Flop (no apostó)\nAsiento 6: MitchATP65 (botón) se retiró antes del Flop (no apostó)"
}