{
  "hand_id": "257149006966",
  "date": "30-07-2025 22:01:23",
  "table": "Esclangona",
  "game_type": "holdem",
  "hero": "SrLyce",
  "hero_position": "",
  "hero_cards": [
    "3s",
    "3c"
  ],
  "stacks": {
    "Zorgue1080": 71.0,
    "SrLyce": 184.5,
    "NoahBolete": 96.5,
    "Davdgoni": 104.0,
    "DiaZzZ1": 96.0,
    "berlcht403": 37.0
  },
  "actions": {
    "preflop": [
      "Asiento 1: Zorgue1080 (1.42 € en fichas)",
      "Asiento 2: SrLyce (3.69 € en fichas)",
      "Asiento 3: NoahBolete (1.93 € en fichas)",
      "Asiento 4: Davdgoni (2.08 € en fichas)",
      "Asiento 5: DiaZzZ1 (1.92 € en fichas)",
      "Asiento 6: berlcht403 (0.74 € en fichas)",
      "SrLyce: pone la ciega pequeña 0.01 €",
      "NoahBolete: pone la ciega grande 0.02 €",
      "Davdgoni: se retira",
      "DiaZzZ1: se retira",
      "berlcht403: iguala 0.02 €",
      "Zorgue1080: se retira",
      "SrLyce: se retira",
      "NoahBolete: sube 0.02 € a 0.04 €",
      "berlcht403: iguala 0.02 €"
    ],
    "flop": [
      "NoahBolete: pasa",
      "berlcht403: pasa"
    ],
    "turn": [
      "NoahBolete: pasa",
      "berlcht403: pasa"
    ],
    "river": [
      "NoahBolete: apuesta 0.10 €",
      "berlcht403: se retira",
      "NoahBolete: no muestra su mano",
      "Asiento 1: Zorgue1080 (botón) se retiró antes del Flop (no apostó)",
      "Asiento 2: SrLyce (ciega pequeña) se retiró antes del Flop",
      "Asiento 3: NoahBolete (ciega grande) recaudó (0.08 €)",
      "Asiento 4: Davdgoni se retiró antes del Flop (no apostó)",
      "Asiento 5: DiaZzZ1 se retiró antes del Flop (no apostó)",
      "Asiento 6: berlcht403 se retiró en el River"
    ]
  },
  "board": [
    "9h",
    "Ah",
    "7h",
    "Ad",
    "2h"
  ],
  "winner": "NoahBolete",
  "win_amount": 4.0,
  "sb": 0.01,
  "bb": 0.02,
  "rake": 0.5,
  "raw_text": "Mano n.º 257149006966 de PokerStars:  Hold'em No Limit (0.01 €/0.02 € EUR) - 30-07-2025 22:01:23 CET [30-07-2025 16:01:23 ET]\nMesa \"Esclangona\" 6-max El asiento n.º 1 es el botón\nAsiento 1: Zorgue1080 (1.42 € en fichas) \nAsiento 2: SrLyce (3.69 € en fichas) \nAsiento 3: NoahBolete (1.93 € en fichas) \nAsiento 4: Davdgoni (2.08 € en fichas) \nAsiento 5: DiaZzZ1 (1.92 € en fichas) \nAsiento 6: berlcht403 (0.74 € en fichas) \nSrLyce: pone la ciega pequeña 0.01 €\nNoahBolete: pone la ciega grande 0.02 €\n*** CARTAS DE MANO ***\nRepartidas a SrLyce [3s 3c]\nDavdgoni: se retira \nDiaZzZ1: se retira \nberlcht403: iguala 0.02 €\nZorgue1080: se retira \nSrLyce: se retira \nNoahBolete: sube 0.02 € a 0.04 €\nberlcht403: iguala 0.02 €\n*** FLOP *** [9h Ah 7h]\nNoahBolete: pasa \nberlcht403: pasa \n*** TURN *** [9h Ah 7h] [Ad]\nNoahBolete: pasa \nberlcht403: pasa \n*** RIVER *** [9h Ah 7h Ad] [2h]\nNoahBolete: apuesta 0.10 €\nberlcht403: se retira \nLa apuesta no igualada (0.10 €) ha sido devuelta a NoahBolete\nNoahBolete se lleva 0.08 € del bote \nNoahBolete: no muestra su mano \n*** RESUMEN ***\nBote total 0.09 € | Comisión 0.01 € \nComunitarias [9h Ah 7h Ad 2h]\nAsiento 1: Zorgue1080 (botón) se retiró antes del Flop (no apostó)\nAsiento 2: SrLyce (ciega pequeña) se retiró antes del Flop\nAsiento 3: NoahBolete (ciega grande) recaudó (0.08 €)\nAsiento 4: Davdgoni se retiró antes del Flop (no apostó)\nAsiento 5: DiaZzZ1 se retiró antes del Flop (no apostó)\nAsiento 6: berlcht403 se retiró en el River"
}