{
  "hand_id": "257215048814",
  "date": "04-08-2025 22:21:09",
  "table": "Anneliese II",
  "game_type": "holdem",
  "hero": "SrLyce",
  "hero_position": "",
  "hero_cards": [
    "3c",
    "6d"
  ],
  "stacks": {
    "betterrrrrr": 100.0,
    "niyomalo": 123.5,
    "ElManu62": 114.5,
    "SrLyce": 97.5,
    "Mr_Pkr98": 141.5,
    "Spotick": 111.0
  },
  "actions": {
    "preflop": [
      "Asiento 1: betterrrrrr (2 € en fichas)",
      "Asiento 2: niyomalo (2.47 € en fichas)",
      "Asiento 3: ElManu62 (2.29 € en fichas)",
      "Asiento 4: SrLyce (1.95 € en fichas)",
      "Asiento 5: Mr_Pkr98 (2.83 € en fichas)",
      "Asiento 6: Spotick (2.22 € en fichas)",
      "SrLyce: pone la ciega pequeña 0.01 €",
      "Mr_Pkr98: pone la ciega grande 0.02 €",
      "Spotick: se retira",
      "betterrrrrr: se retira",
      "niyomalo: se retira",
      "ElManu62: sube 0.02 € a 0.04 €",
      "SrLyce: se retira",
      "Mr_Pkr98: se retira",
      "ElManu62: no muestra su mano",
      "Asiento 1: betterrrrrr se retiró antes del Flop (no apostó)",
      "Asiento 2: niyomalo se retiró antes del Flop (no apostó)",
      "Asiento 3: ElManu62 (botón) recaudó (0.05 €)",
      "Asiento 4: SrLyce (ciega pequeña) se retiró antes del Flop",
      "Asiento 5: Mr_Pkr98 (ciega grande) se retiró antes del Flop",
      "Asiento 6: Spotick se retiró antes del Flop (no apostó)"
    ],
    "flop": [],
    "turn": [],
    "river": []
  },
  "board": [],
  "winner": "ElManu62",
  "win_amount": 2.5,
  "sb": 0.01,
  "bb": 0.02,
  "rake": 0.0,
  "raw_text": "Mano n.º 257215048814 de PokerStars:  Hold'em No Limit (0.01 €/0.02 € EUR) - 04-08-2025 22:21:09 CET [04-08-2025 16:21:09 ET]\nMesa \"Anneliese II\" 6-max El asiento n.º 3 es el botón\nAsiento 1: betterrrrrr (2 € en fichas) \nAsiento 2: niyomalo (2.47 € en fichas) \nAsiento 3: ElManu62 (2.29 € en fichas) \nAsiento 4: SrLyce (1.95 € en fichas) \nAsiento 5: Mr_Pkr98 (2.83 € en fichas) \nAsiento 6: Spotick (2.22 € en fichas) \nSrLyce: pone la ciega pequeña 0.01 €\nMr_Pkr98: pone la ciega grande 0.02 €\n*** CARTAS DE MANO ***\nRepartidas a SrLyce [3c 6d]\nSpotick: se retira \nbetterrrrrr: se retira \nniyomalo: se retira \nElManu62: sube 0.02 € a 0.04 €\nSrLyce: se retira \nniyomalo deja la mesa\nMr_Pkr98: se retira \nLa apuesta no igualada (0.02 €) ha sido devuelta a ElManu62\nElManu62 se lleva 0.05 € del bote \nSiveSinouts se une a la mesa en el asiento n.º 2 \nElManu62: no muestra su mano \n*** RESUMEN ***\nBote total 0.05 € | Comisión 0 € \nAsiento 1: betterrrrrr se retiró antes del Flop (no apostó)\nAsiento 2: niyomalo se retiró antes del Flop (no apostó)\nAsiento 3: ElManu62 (botón) recaudó (0.05 €)\nAsiento 4: SrLyce (ciega pequeña) se retiró antes del Flop\nAsiento 5: Mr_Pkr98 (ciega grande) se retiró antes del Flop\nAsiento 6: Spotick se retiró antes del Flop (no apostó)"
}