{
  "hand_id": "257238485452",
  "date": "06-08-2025 19:03:36",
  "table": "Adelaide III",
  "game_type": "holdem",
  "hero": "SrLyce",
  "hero_position": "",
  "hero_cards": [
    "9h",
    "5h"
  ],
  "stacks": {
    "N3xtTIm35": 123.0,
    "aliendee07": 68.5,
    "Macklemore0": 100.0,
    "SrLyce": 101.0,
    "ismagonzalez7": 51.0,
    "pauquair5": 65.5
  },
  "actions": {
    "preflop": [
      "Asiento 1: N3xtTIm35 (2.46 € en fichas)",
      "Asiento 2: aliendee07 (1.37 € en fichas)",
      "Asiento 3: Macklemore0 (2 € en fichas)",
      "Asiento 4: SrLyce (2.02 € en fichas)",
      "Asiento 5: ismagonzalez7 (1.02 € en fichas)",
      "Asiento 6: pauquair5 (1.31 € en fichas)",
      "aliendee07: pone la ciega pequeña 0.01 €",
      "Macklemore0: pone la ciega grande 0.02 €",
      "SrLyce: se retira",
      "ismagonzalez7: se retira",
      "pauquair5: sube 0.02 € a 0.04 €",
      "N3xtTIm35: se retira",
      "aliendee07: se retira",
      "Macklemore0: se retira",
      "pauquair5: no muestra su mano",
      "Asiento 1: N3xtTIm35 (botón) se retiró antes del Flop (no apostó)",
      "Asiento 2: aliendee07 (ciega pequeña) se retiró antes del Flop",
      "Asiento 3: Macklemore0 (ciega grande) se retiró antes del Flop",
      "Asiento 4: SrLyce se retiró antes del Flop (no apostó)",
      "Asiento 5: ismagonzalez7 se retiró antes del Flop (no apostó)",
      "Asiento 6: pauquair5 recaudó (0.05 €)"
    ],
    "flop": [],
    "turn": [],
    "river": []
  },
  "board": [],
  "winner": "pauquair5",
  "win_amount": 2.5,
  "sb": 0.01,
  "bb": 0.02,
  "rake": 0.0,
  "raw_text": "Mano n.º 257238485452 de PokerStars:  Hold'em No Limit (0.01 €/0.02 € EUR) - 06-08-2025 19:03:36 CET [06-08-2025 13:03:36 ET]\nMesa \"Adelaide III\" 6-max El asiento n.º 1 es el botón\nAsiento 1: N3xtTIm35 (2.46 € en fichas) \nAsiento 2: aliendee07 (1.37 € en fichas) \nAsiento 3: Macklemore0 (2 € en fichas) \nAsiento 4: SrLyce (2.02 € en fichas) \nAsiento 5: ismagonzalez7 (1.02 € en fichas) \nAsiento 6: pauquair5 (1.31 € en fichas) \naliendee07: pone la ciega pequeña 0.01 €\nMacklemore0: pone la ciega grande 0.02 €\n*** CARTAS DE MANO ***\nRepartidas a SrLyce [9h 5h]\nSrLyce: se retira \nismagonzalez7: se retira \npauquair5: sube 0.02 € a 0.04 €\nN3xtTIm35: se retira \naliendee07: se retira \nMacklemore0: se retira \nLa apuesta no igualada (0.02 €) ha sido devuelta a pauquair5\npauquair5 se lleva 0.05 € del bote \npauquair5: no muestra su mano \n*** RESUMEN ***\nBote total 0.05 € | Comisión 0 € \nAsiento 1: N3xtTIm35 (botón) se retiró antes del Flop (no apostó)\nAsiento 2: aliendee07 (ciega pequeña) se retiró antes del Flop\nAsiento 3: Macklemore0 (ciega grande) se retiró antes del Flop\nAsiento 4: SrLyce se retiró antes del Flop (no apostó)\nAsiento 5: ismagonzalez7 se retiró antes del Flop (no apostó)\nAsiento 6: pauquair5 recaudó (0.05 €)"
}