{
  "hand_id": "257168355912",
  "date": "01-08-2025 11:32:46",
  "table": "Jupiter",
  "game_type": "holdem",
  "hero": "SrLyce",
  "hero_position": "",
  "hero_cards": [
    "Jd",
    "5h"
  ],
  "stacks": {
    "sifilis5": 109.0,
    "Filou203": 106.5,
    "SrLyce": 107.5,
    "LOLA19711971": 32.0,
    "dadou13mars": 210.5,
    "Alvii37": 111.0
  },
  "actions": {
    "preflop": [
      "Asiento 1: sifilis5 (2.18 € en fichas)",
      "Asiento 2: Filou203 (2.13 € en fichas)",
      "Asiento 3: SrLyce (2.15 € en fichas)",
      "Asiento 4: LOLA19711971 (0.64 € en fichas)",
      "Asiento 5: dadou13mars (4.21 € en fichas)",
      "Asiento 6: Alvii37 (2.22 € en fichas)",
      "Filou203: pone la ciega pequeña 0.01 €",
      "SrLyce: pone la ciega grande 0.02 €",
      "LOLA19711971: se retira",
      "dadou13mars: se retira",
      "Alvii37: sube 0.04 € a 0.06 €",
      "sifilis5: se retira",
      "Filou203: se retira",
      "SrLyce: se retira",
      "Alvii37: no muestra su mano",
      "Asiento 1: sifilis5 (botón) se retiró antes del Flop (no apostó)",
      "Asiento 2: Filou203 (ciega pequeña) se retiró antes del Flop",
      "Asiento 3: SrLyce (ciega grande) se retiró antes del Flop",
      "Asiento 4: LOLA19711971 se retiró antes del Flop (no apostó)",
      "Asiento 5: dadou13mars se retiró antes del Flop (no apostó)",
      "Asiento 6: Alvii37 recaudó (0.05 €)"
    ],
    "flop": [],
    "turn": [],
    "river": []
  },
  "board": [],
  "winner": "Alvii37",
  "win_amount": 2.5,
  "sb": 0.01,
  "bb": 0.02,
  "rake": 0.0,
  "raw_text": "Mano n.º 257168355912 de PokerStars:  Hold'em No Limit (0.01 €/0.02 € EUR) - 01-08-2025 11:32:46 CET [01-08-2025 5:32:46 ET]\nMesa \"Jupiter\" 6-max El asiento n.º 1 es el botón\nAsiento 1: sifilis5 (2.18 € en fichas) \nAsiento 2: Filou203 (2.13 € en fichas) \nAsiento 3: SrLyce (2.15 € en fichas) \nAsiento 4: LOLA19711971 (0.64 € en fichas) \nAsiento 5: dadou13mars (4.21 € en fichas) \nAsiento 6: Alvii37 (2.22 € en fichas) \nFilou203: pone la ciega pequeña 0.01 €\nSrLyce: pone la ciega grande 0.02 €\n*** CARTAS DE MANO ***\nRepartidas a SrLyce [Jd 5h]\nLOLA19711971: se retira \ndadou13mars: se retira \nAlvii37: sube 0.04 € a 0.06 €\nsifilis5: se retira \nFilou203: se retira \nSrLyce: se retira \nLa apuesta no igualada (0.04 €) ha sido devuelta a Alvii37\nAlvii37 se lleva 0.05 € del bote \nAlvii37: no muestra su mano \n*** RESUMEN ***\nBote total 0.05 € | Comisión 0 € \nAsiento 1: sifilis5 (botón) se retiró antes del Flop (no apostó)\nAsiento 2: Filou203 (ciega pequeña) se retiró antes del Flop\nAsiento 3: SrLyce (ciega grande) se retiró antes del Flop\nAsiento 4: LOLA19711971 se retiró antes del Flop (no apostó)\nAsiento 5: dadou13mars se retiró antes del Flop (no apostó)\nAsiento 6: Alvii37 recaudó (0.05 €)"
}