{
  "hand_id": "257168233613",
  "date": "01-08-2025 11:09:30",
  "table": "Jupiter",
  "game_type": "holdem",
  "hero": "SrLyce",
  "hero_position": "",
  "hero_cards": [
    "Td",
    "9s"
  ],
  "stacks": {
    "sifilis5": 89.5,
    "Filou203": 117.0,
    "SrLyce": 110.5,
    "LOLA19711971": 26.0,
    "dadou13mars": 225.5,
    "Alvii37": 100.0
  },
  "actions": {
    "preflop": [
      "Asiento 1: sifilis5 (1.79 € en fichas)",
      "Asiento 2: Filou203 (2.34 € en fichas)",
      "Asiento 3: SrLyce (2.21 € en fichas)",
      "Asiento 4: LOLA19711971 (0.52 € en fichas)",
      "Asiento 5: dadou13mars (4.51 € en fichas)",
      "Asiento 6: Alvii37 (2 € en fichas)",
      "dadou13mars: pone la ciega pequeña 0.01 €",
      "Alvii37: pone la ciega grande 0.02 €",
      "sifilis5: se retira",
      "Filou203: se retira",
      "SrLyce: sube 0.04 € a 0.06 €",
      "LOLA19711971: se retira",
      "dadou13mars: se retira",
      "Alvii37: iguala 0.04 €"
    ],
    "flop": [
      "Alvii37: pasa",
      "SrLyce: apuesta 0.04 €",
      "Alvii37: iguala 0.04 €"
    ],
    "turn": [
      "Alvii37: pasa",
      "SrLyce: pasa"
    ],
    "river": [
      "Alvii37: pasa",
      "SrLyce: pasa",
      "Alvii37: muestra [8c Ah] (carta alta as)",
      "SrLyce: muestra [Td 9s] (pareja de nueves)",
      "Asiento 1: sifilis5 se retiró antes del Flop (no apostó)",
      "Asiento 2: Filou203 se retiró antes del Flop (no apostó)",
      "Asiento 3: SrLyce muestra [Td 9s] y ganó (0.20 €) con pareja de nueves",
      "Asiento 4: LOLA19711971 (botón) se retiró antes del Flop (no apostó)",
      "Asiento 5: dadou13mars (ciega pequeña) se retiró antes del Flop",
      "Asiento 6: Alvii37 (ciega grande) muestra [8c Ah] y perdió con carta alta as"
    ]
  },
  "board": [
    "Kh",
    "9c",
    "Jd",
    "6c",
    "3c"
  ],
  "winner": "SrLyce",
  "win_amount": 10.0,
  "sb": 0.01,
  "bb": 0.02,
  "rake": 0.5,
  "raw_text": "Mano n.º 257168233613 de PokerStars:  Hold'em No Limit (0.01 €/0.02 € EUR) - 01-08-2025 11:09:30 CET [01-08-2025 5:09:30 ET]\nMesa \"Jupiter\" 6-max El asiento n.º 4 es el botón\nAsiento 1: sifilis5 (1.79 € en fichas) \nAsiento 2: Filou203 (2.34 € en fichas) \nAsiento 3: SrLyce (2.21 € en fichas) \nAsiento 4: LOLA19711971 (0.52 € en fichas) \nAsiento 5: dadou13mars (4.51 € en fichas) \nAsiento 6: Alvii37 (2 € en fichas) \ndadou13mars: pone la ciega pequeña 0.01 €\nAlvii37: pone la ciega grande 0.02 €\n*** CARTAS DE MANO ***\nRepartidas a SrLyce [Td 9s]\nsifilis5: se retira \nFilou203: se retira \nSrLyce: sube 0.04 € a 0.06 €\nLOLA19711971: se retira \ndadou13mars: se retira \nAlvii37: iguala 0.04 €\n*** FLOP *** [Kh 9c Jd]\nAlvii37: pasa \nSrLyce: apuesta 0.04 €\nAlvii37 no tiene conexión \nAlvii37 tiene conexión \nAlvii37: iguala 0.04 €\n*** TURN *** [Kh 9c Jd] [6c]\nAlvii37: pasa \nSrLyce: pasa \n*** RIVER *** [Kh 9c Jd 6c] [3c]\nAlvii37: pasa \nSrLyce: pasa \n*** SHOW DOWN ***\nAlvii37: muestra [8c Ah] (carta alta as)\nSrLyce: muestra [Td 9s] (pareja de nueves)\nSrLyce se lleva 0.20 € del bote \n*** RESUMEN ***\nBote total 0.21 € | Comisión 0.01 € \nComunitarias [Kh 9c Jd 6c 3c]\nAsiento 1: sifilis5 se retiró antes del Flop (no apostó)\nAsiento 2: Filou203 se retiró antes del Flop (no apostó)\nAsiento 3: SrLyce muestra [Td 9s] y ganó (0.20 €) con pareja de nueves\nAsiento 4: LOLA19711971 (botón) se retiró antes del Flop (no apostó)\nAsiento 5: dadou13mars (ciega pequeña) se retiró antes del Flop\nAsiento 6: Alvii37 (ciega grande) muestra [8c Ah] y perdió con carta alta as"
}