{
  "hand_id": "257149932846",
  "date": "30-07-2025 23:06:49",
  "table": "Lobelia",
  "game_type": "holdem",
  "hero": "SrLyce",
  "hero_position": "",
  "hero_cards": [
    "9s",
    "Js"
  ],
  "stacks": {
    "LeVbks": 91.5,
    "fcis666": 57.0,
    "Dlaguancha": 73.5,
    "SrLyce": 107.5,
    "riverluck444": 73.5,
    "Kiffou39": 52.5
  },
  "actions": {
    "preflop": [
      "Asiento 1: LeVbks (1.83 € en fichas)",
      "Asiento 2: fcis666 (1.14 € en fichas)",
      "Asiento 3: Dlaguancha (1.47 € en fichas)",
      "Asiento 4: SrLyce (2.15 € en fichas)",
      "Asiento 5: riverluck444 (1.47 € en fichas)",
      "Asiento 6: Kiffou39 (1.05 € en fichas)",
      "SrLyce: pone la ciega pequeña 0.01 €",
      "riverluck444: pone la ciega grande 0.02 €",
      "Kiffou39: se retira",
      "LeVbks: se retira",
      "fcis666: sube 0.02 € a 0.04 €",
      "Dlaguancha: se retira",
      "SrLyce: iguala 0.03 €",
      "riverluck444: se retira"
    ],
    "flop": [
      "SrLyce: pasa",
      "fcis666: apuesta 0.04 €",
      "SrLyce: sube 0.08 € a 0.12 €",
      "fcis666: iguala 0.08 €"
    ],
    "turn": [
      "SrLyce: pasa",
      "fcis666: apuesta 0.16 €",
      "SrLyce: iguala 0.16 €"
    ],
    "river": [
      "SrLyce: pasa",
      "fcis666: pasa",
      "SrLyce: muestra [9s Js] (doble pareja, jotas y nueves)",
      "fcis666: muestra [Qh Qd] (trío de damas)",
      "Asiento 1: LeVbks se retiró antes del Flop (no apostó)",
      "Asiento 2: fcis666 muestra [Qh Qd] y ganó (0.62 €) con trío de damas",
      "Asiento 3: Dlaguancha (botón) se retiró antes del Flop (no apostó)",
      "Asiento 4: SrLyce (ciega pequeña) muestra [9s Js] y perdió con doble pareja, jotas y nueves",
      "Asiento 5: riverluck444 (ciega grande) se retiró antes del Flop",
      "Asiento 6: Kiffou39 se retiró antes del Flop (no apostó)"
    ]
  },
  "board": [
    "Jd",
    "9h",
    "Qs",
    "5d",
    "Td"
  ],
  "winner": "fcis666",
  "win_amount": 31.0,
  "sb": 0.01,
  "bb": 0.02,
  "rake": 2.0,
  "raw_text": "Mano n.º 257149932846 de PokerStars:  Hold'em No Limit (0.01 €/0.02 € EUR) - 30-07-2025 23:06:49 CET [30-07-2025 17:06:49 ET]\nMesa \"Lobelia\" 6-max El asiento n.º 3 es el botón\nAsiento 1: LeVbks (1.83 € en fichas) \nAsiento 2: fcis666 (1.14 € en fichas) \nAsiento 3: Dlaguancha (1.47 € en fichas) \nAsiento 4: SrLyce (2.15 € en fichas) \nAsiento 5: riverluck444 (1.47 € en fichas) \nAsiento 6: Kiffou39 (1.05 € en fichas) \nSrLyce: pone la ciega pequeña 0.01 €\nriverluck444: pone la ciega grande 0.02 €\n*** CARTAS DE MANO ***\nRepartidas a SrLyce [9s Js]\nKiffou39: se retira \nLeVbks: se retira \nfcis666: sube 0.02 € a 0.04 €\nDlaguancha: se retira \nSrLyce: iguala 0.03 €\nriverluck444: se retira \n*** FLOP *** [Jd 9h Qs]\nSrLyce: pasa \nfcis666: apuesta 0.04 €\nSrLyce: sube 0.08 € a 0.12 €\nfcis666: iguala 0.08 €\n*** TURN *** [Jd 9h Qs] [5d]\nSrLyce: pasa \nfcis666: apuesta 0.16 €\nSrLyce: iguala 0.16 €\n*** RIVER *** [Jd 9h Qs 5d] [Td]\nSrLyce: pasa \nfcis666: pasa \n*** SHOW DOWN ***\nSrLyce: muestra [9s Js] (doble pareja, jotas y nueves)\nfcis666: muestra [Qh Qd] (trío de damas)\nfcis666 se lleva 0.62 € del bote \n*** RESUMEN ***\nBote total 0.66 € | Comisión 0.04 € \nComunitarias [Jd 9h Qs 5d Td]\nAsiento 1: LeVbks se retiró antes del Flop (no apostó)\nAsiento 2: fcis666 muestra [Qh Qd] y ganó (0.62 €) con trío de damas\nAsiento 3: Dlaguancha (botón) se retiró antes del Flop (no apostó)\nAsiento 4: SrLyce (ciega pequeña) muestra [9s Js] y perdió con doble pareja, jotas y nueves\nAsiento 5: riverluck444 (ciega grande) se retiró antes del Flop\nAsiento 6: Kiffou39 se retiró antes del Flop (no apostó)"
}