{
  "hand_id": "257168336480",
  "date": "01-08-2025 11:29:13",
  "table": "Jupiter",
  "game_type": "holdem",
  "hero": "SrLyce",
  "hero_position": "",
  "hero_cards": [
    "9c",
    "5d"
  ],
  "stacks": {
    "sifilis5": 109.5,
    "Filou203": 111.5,
    "SrLyce": 107.5,
    "LOLA19711971": 28.5,
    "dadou13mars": 214.0,
    "Alvii37": 106.5
  },
  "actions": {
    "preflop": [
      "Asiento 1: sifilis5 (2.19 € en fichas)",
      "Asiento 2: Filou203 (2.23 € en fichas)",
      "Asiento 3: SrLyce (2.15 € en fichas)",
      "Asiento 4: LOLA19711971 (0.57 € en fichas)",
      "Asiento 5: dadou13mars (4.28 € en fichas)",
      "Asiento 6: Alvii37 (2.13 € en fichas)",
      "sifilis5: pone la ciega pequeña 0.01 €",
      "Filou203: pone la ciega grande 0.02 €",
      "SrLyce: se retira",
      "LOLA19711971: se retira",
      "dadou13mars: se retira",
      "Alvii37: sube 0.04 € a 0.06 €",
      "sifilis5: se retira",
      "Filou203: se retira",
      "Alvii37: no muestra su mano",
      "Asiento 1: sifilis5 (ciega pequeña) se retiró antes del Flop",
      "Asiento 2: Filou203 (ciega grande) se retiró antes del Flop",
      "Asiento 3: SrLyce se retiró antes del Flop (no apostó)",
      "Asiento 4: LOLA19711971 se retiró antes del Flop (no apostó)",
      "Asiento 5: dadou13mars se retiró antes del Flop (no apostó)",
      "Asiento 6: Alvii37 (botón) recaudó (0.05 €)"
    ],
    "flop": [],
    "turn": [],
    "river": []
  },
  "board": [],
  "winner": "Alvii37",
  "win_amount": 2.5,
  "sb": 0.01,
  "bb": 0.02,
  "rake": 0.0,
  "raw_text": "Mano n.º 257168336480 de PokerStars:  Hold'em No Limit (0.01 €/0.02 € EUR) - 01-08-2025 11:29:13 CET [01-08-2025 5:29:13 ET]\nMesa \"Jupiter\" 6-max El asiento n.º 6 es el botón\nAsiento 1: sifilis5 (2.19 € en fichas) \nAsiento 2: Filou203 (2.23 € en fichas) \nAsiento 3: SrLyce (2.15 € en fichas) \nAsiento 4: LOLA19711971 (0.57 € en fichas) \nAsiento 5: dadou13mars (4.28 € en fichas) \nAsiento 6: Alvii37 (2.13 € en fichas) \nsifilis5: pone la ciega pequeña 0.01 €\nFilou203: pone la ciega grande 0.02 €\n*** CARTAS DE MANO ***\nRepartidas a SrLyce [9c 5d]\nSrLyce: se retira \nLOLA19711971: se retira \ndadou13mars: se retira \nAlvii37: sube 0.04 € a 0.06 €\nsifilis5: se retira \nFilou203: se retira \nLa apuesta no igualada (0.04 €) ha sido devuelta a Alvii37\nAlvii37 se lleva 0.05 € del bote \nAlvii37: no muestra su mano \n*** RESUMEN ***\nBote total 0.05 € | Comisión 0 € \nAsiento 1: sifilis5 (ciega pequeña) se retiró antes del Flop\nAsiento 2: Filou203 (ciega grande) se retiró antes del Flop\nAsiento 3: SrLyce se retiró antes del Flop (no apostó)\nAsiento 4: LOLA19711971 se retiró antes del Flop (no apostó)\nAsiento 5: dadou13mars se retiró antes del Flop (no apostó)\nAsiento 6: Alvii37 (botón) recaudó (0.05 €)"
}