{
  "hand_id": "257238486019",
  "date": "06-08-2025 19:03:39",
  "table": "Herculina II",
  "game_type": "holdem",
  "hero": "SrLyce",
  "hero_position": "",
  "hero_cards": [
    "6d",
    "Js"
  ],
  "stacks": {
    "koldipk": 156.5,
    "David98X": 129.0,
    "JJer11": 209.0,
    "SrLyce": 101.0,
    "Macklemore0": 100.0,
    "ScarvBlack": 119.0
  },
  "actions": {
    "preflop": [
      "Asiento 1: koldipk (3.13 € en fichas)",
      "Asiento 2: David98X (2.58 € en fichas)",
      "Asiento 3: JJer11 (4.18 € en fichas)",
      "Asiento 4: SrLyce (2.02 € en fichas)",
      "Asiento 5: Macklemore0 (2 € en fichas)",
      "Asiento 6: ScarvBlack (2.38 € en fichas)",
      "koldipk: pone la ciega pequeña 0.01 €",
      "David98X: pone la ciega grande 0.02 €",
      "JJer11: se retira",
      "SrLyce: se retira",
      "Macklemore0: se retira",
      "ScarvBlack: sube 0.04 € a 0.06 €",
      "koldipk: iguala 0.05 €",
      "David98X: se retira"
    ],
    "flop": [
      "koldipk: apuesta 0.13 €",
      "ScarvBlack: se retira",
      "Asiento 1: koldipk (ciega pequeña) recaudó (0.13 €)",
      "Asiento 2: David98X (ciega grande) se retiró antes del Flop",
      "Asiento 3: JJer11 se retiró antes del Flop (no apostó)",
      "Asiento 4: SrLyce se retiró antes del Flop (no apostó)",
      "Asiento 5: Macklemore0 se retiró antes del Flop (no apostó)",
      "Asiento 6: ScarvBlack (botón) se retiró en el Flop"
    ],
    "turn": [],
    "river": []
  },
  "board": [
    "Ad",
    "Tc",
    "9d"
  ],
  "winner": "koldipk",
  "win_amount": 6.5,
  "sb": 0.01,
  "bb": 0.02,
  "rake": 0.5,
  "raw_text": "Mano n.º 257238486019 de PokerStars:  Hold'em No Limit (0.01 €/0.02 € EUR) - 06-08-2025 19:03:39 CET [06-08-2025 13:03:39 ET]\nMesa \"Herculina II\" 6-max El asiento n.º 6 es el botón\nAsiento 1: koldipk (3.13 € en fichas) \nAsiento 2: David98X (2.58 € en fichas) \nAsiento 3: JJer11 (4.18 € en fichas) \nAsiento 4: SrLyce (2.02 € en fichas) \nAsiento 5: Macklemore0 (2 € en fichas) \nAsiento 6: ScarvBlack (2.38 € en fichas) \nkoldipk: pone la ciega pequeña 0.01 €\nDavid98X: pone la ciega grande 0.02 €\n*** CARTAS DE MANO ***\nRepartidas a SrLyce [6d Js]\nJJer11: se retira \nSrLyce: se retira \nMacklemore0: se retira \nScarvBlack: sube 0.04 € a 0.06 €\nkoldipk: iguala 0.05 €\nDavid98X: se retira \n*** FLOP *** [Ad Tc 9d]\nkoldipk: apuesta 0.13 €\nScarvBlack: se retira \nLa apuesta no igualada (0.13 €) ha sido devuelta a koldipk\nkoldipk se lleva 0.13 € del bote \n*** RESUMEN ***\nBote total 0.14 € | Comisión 0.01 € \nComunitarias [Ad Tc 9d]\nAsiento 1: koldipk (ciega pequeña) recaudó (0.13 €)\nAsiento 2: David98X (ciega grande) se retiró antes del Flop\nAsiento 3: JJer11 se retiró antes del Flop (no apostó)\nAsiento 4: SrLyce se retiró antes del Flop (no apostó)\nAsiento 5: Macklemore0 se retiró antes del Flop (no apostó)\nAsiento 6: ScarvBlack (botón) se retiró en el Flop"
}