{
  "hand_id": "257238416145",
  "date": "06-08-2025 18:56:15",
  "table": "Alruccabah II",
  "game_type": "holdem",
  "hero": "SrLyce",
  "hero_position": "",
  "hero_cards": [
    "9c",
    "7c"
  ],
  "stacks": {
    "zoioachado": 0.0,
    "SrLyce": 133.5,
    "yonisanlu": 101.5,
    "Nicanor Cast": 53.0,
    "rayao32": 47.0
  },
  "actions": {
    "preflop": [
      "Asiento 2: zoioachado (0 € en fichas) está ausente",
      "Asiento 1: SrLyce (2.67 € en fichas)",
      "Asiento 3: yonisanlu (2.03 € en fichas)",
      "Asiento 4: serviettski(fr) (2.05 € en fichas)",
      "Asiento 5: Nicanor Cast (1.06 € en fichas)",
      "Asiento 6: rayao32 (0.94 € en fichas)",
      "Nicanor Cast: pone la ciega pequeña 0.01 €",
      "rayao32: pone la ciega grande 0.02 €",
      "SrLyce: sube 0.03 € a 0.05 €",
      "yonisanlu: se retira",
      "serviettski(fr): se retira",
      "Nicanor Cast: se retira",
      "rayao32: iguala 0.03 €"
    ],
    "flop": [
      "rayao32: pasa",
      "SrLyce: apuesta 0.03 €",
      "rayao32: se retira",
      "SrLyce: no muestra su mano",
      "Asiento 2: zoioachado",
      "Asiento 1: SrLyce recaudó (0.10 €)",
      "Asiento 3: yonisanlu se retiró antes del Flop (no apostó)",
      "Asiento 4: serviettski(fr) (botón) se retiró antes del Flop (no apostó)",
      "Asiento 5: Nicanor Cast (ciega pequeña) se retiró antes del Flop",
      "Asiento 6: rayao32 (ciega grande) se retiró en el Flop"
    ],
    "turn": [],
    "river": []
  },
  "board": [
    "Th",
    "Ts",
    "7s"
  ],
  "winner": "SrLyce",
  "win_amount": 5.0,
  "sb": 0.01,
  "bb": 0.02,
  "rake": 0.5,
  "raw_text": "Mano n.º 257238416145 de PokerStars:  Hold'em No Limit (0.01 €/0.02 € EUR) - 06-08-2025 18:56:15 CET [06-08-2025 12:56:15 ET]\nMesa \"Alruccabah II\" 6-max El asiento n.º 4 es el botón\nAsiento 2: zoioachado (0 € en fichas) está ausente\nAsiento 1: SrLyce (2.67 € en fichas) \nAsiento 3: yonisanlu (2.03 € en fichas) \nAsiento 4: serviettski(fr) (2.05 € en fichas) \nAsiento 5: Nicanor Cast (1.06 € en fichas) \nAsiento 6: rayao32 (0.94 € en fichas) \nNicanor Cast: pone la ciega pequeña 0.01 €\nrayao32: pone la ciega grande 0.02 €\n*** CARTAS DE MANO ***\nRepartidas a SrLyce [9c 7c]\nSrLyce: sube 0.03 € a 0.05 €\nyonisanlu: se retira \nserviettski(fr): se retira \nNicanor Cast: se retira \nrayao32: iguala 0.03 €\n*** FLOP *** [Th Ts 7s]\nrayao32 ha agotado su tiempo\nrayao32: pasa \nSrLyce: apuesta 0.03 €\nrayao32: se retira \nLa apuesta no igualada (0.03 €) ha sido devuelta a SrLyce\nSrLyce se lleva 0.10 € del bote \nSrLyce: no muestra su mano \n*** RESUMEN ***\nBote total 0.11 € | Comisión 0.01 € \nComunitarias [Th Ts 7s]\nAsiento 2: zoioachado\nAsiento 1: SrLyce recaudó (0.10 €)\nAsiento 3: yonisanlu se retiró antes del Flop (no apostó)\nAsiento 4: serviettski(fr) (botón) se retiró antes del Flop (no apostó)\nAsiento 5: Nicanor Cast (ciega pequeña) se retiró antes del Flop\nAsiento 6: rayao32 (ciega grande) se retiró en el Flop"
}