{
  "hand_id": "257215270169",
  "date": "04-08-2025 22:34:55",
  "table": "Anneliese II",
  "game_type": "holdem",
  "hero": "SrLyce",
  "hero_position": "",
  "hero_cards": [
    "Qd",
    "8s"
  ],
  "stacks": {
    "betterrrrrr": 102.5,
    "piropanzer": 31.5,
    "ElManu62": 120.5,
    "SrLyce": 89.5,
    "Mr_Pkr98": 154.5,
    "Spotick": 132.5
  },
  "actions": {
    "preflop": [
      "Asiento 1: betterrrrrr (2.05 € en fichas)",
      "Asiento 2: piropanzer (0.63 € en fichas)",
      "Asiento 3: ElManu62 (2.41 € en fichas)",
      "Asiento 4: SrLyce (1.79 € en fichas)",
      "Asiento 5: Mr_Pkr98 (3.09 € en fichas)",
      "Asiento 6: Spotick (2.65 € en fichas)",
      "Mr_Pkr98: pone la ciega pequeña 0.01 €",
      "Spotick: pone la ciega grande 0.02 €",
      "betterrrrrr: sube 0.04 € a 0.06 €",
      "piropanzer: se retira",
      "ElManu62: iguala 0.06 €",
      "SrLyce: se retira",
      "Mr_Pkr98: se retira",
      "Spotick: se retira"
    ],
    "flop": [
      "betterrrrrr: apuesta 0.05 €",
      "ElManu62: iguala 0.05 €"
    ],
    "turn": [
      "betterrrrrr: apuesta 0.35 €",
      "ElManu62: se retira",
      "betterrrrrr: no muestra su mano",
      "Asiento 1: betterrrrrr recaudó (0.23 €)",
      "Asiento 2: piropanzer se retiró antes del Flop (no apostó)",
      "Asiento 3: ElManu62 se retiró en el Turn",
      "Asiento 4: SrLyce (botón) se retiró antes del Flop (no apostó)",
      "Asiento 5: Mr_Pkr98 (ciega pequeña) se retiró antes del Flop",
      "Asiento 6: Spotick (ciega grande) se retiró antes del Flop"
    ],
    "river": []
  },
  "board": [
    "4h",
    "Qh",
    "2c",
    "9c"
  ],
  "winner": "betterrrrrr",
  "win_amount": 11.5,
  "sb": 0.01,
  "bb": 0.02,
  "rake": 1.0,
  "raw_text": "Mano n.º 257215270169 de PokerStars:  Hold'em No Limit (0.01 €/0.02 € EUR) - 04-08-2025 22:34:55 CET [04-08-2025 16:34:55 ET]\nMesa \"Anneliese II\" 6-max El asiento n.º 4 es el botón\nAsiento 1: betterrrrrr (2.05 € en fichas) \nAsiento 2: piropanzer (0.63 € en fichas) \nAsiento 3: ElManu62 (2.41 € en fichas) \nAsiento 4: SrLyce (1.79 € en fichas) \nAsiento 5: Mr_Pkr98 (3.09 € en fichas) \nAsiento 6: Spotick (2.65 € en fichas) \nMr_Pkr98: pone la ciega pequeña 0.01 €\nSpotick: pone la ciega grande 0.02 €\n*** CARTAS DE MANO ***\nRepartidas a SrLyce [Qd 8s]\nbetterrrrrr: sube 0.04 € a 0.06 €\npiropanzer: se retira \nElManu62: iguala 0.06 €\nSrLyce: se retira \nMr_Pkr98: se retira \nSpotick: se retira \n*** FLOP *** [4h Qh 2c]\nbetterrrrrr: apuesta 0.05 €\nElManu62: iguala 0.05 €\n*** TURN *** [4h Qh 2c] [9c]\nbetterrrrrr: apuesta 0.35 €\nElManu62: se retira \nLa apuesta no igualada (0.35 €) ha sido devuelta a betterrrrrr\nbetterrrrrr se lleva 0.23 € del bote \nbetterrrrrr: no muestra su mano \n*** RESUMEN ***\nBote total 0.25 € | Comisión 0.02 € \nComunitarias [4h Qh 2c 9c]\nAsiento 1: betterrrrrr recaudó (0.23 €)\nAsiento 2: piropanzer se retiró antes del Flop (no apostó)\nAsiento 3: ElManu62 se retiró en el Turn\nAsiento 4: SrLyce (botón) se retiró antes del Flop (no apostó)\nAsiento 5: Mr_Pkr98 (ciega pequeña) se retiró antes del Flop\nAsiento 6: Spotick (ciega grande) se retiró antes del Flop"
}