{
  "hand_id": "257215331739",
  "date": "04-08-2025 22:38:43",
  "table": "Aldhafera II",
  "game_type": "holdem",
  "hero": "SrLyce",
  "hero_position": "",
  "hero_cards": [
    "5h",
    "Th"
  ],
  "stacks": {
    "BudyXXIII": 292.5,
    "betterrrrrr": 171.5,
    "wsx25": 51.5,
    "SrLyce": 181.0,
    "rhidoxxx": 106.0,
    "jte-ken": 116.5
  },
  "actions": {
    "preflop": [
      "Asiento 2: BudyXXIII (5.85 € en fichas) está ausente",
      "Asiento 6: betterrrrrr (3.43 € en fichas) está ausente",
      "Asiento 1: wsx25 (1.03 € en fichas)",
      "Asiento 3: SrLyce (3.62 € en fichas)",
      "Asiento 4: rhidoxxx (2.12 € en fichas)",
      "Asiento 5: jte-ken (2.33 € en fichas)",
      "SrLyce: pone la ciega pequeña 0.01 €",
      "rhidoxxx: pone la ciega grande 0.02 €",
      "jte-ken: sube 0.02 € a 0.04 €",
      "wsx25: se retira",
      "SrLyce: iguala 0.03 €",
      "rhidoxxx: se retira"
    ],
    "flop": [
      "SrLyce: pasa",
      "jte-ken: apuesta 0.09 €",
      "SrLyce: se retira",
      "Asiento 2: BudyXXIII",
      "Asiento 6: betterrrrrr",
      "Asiento 1: wsx25 (botón) se retiró antes del Flop (no apostó)",
      "Asiento 3: SrLyce (ciega pequeña) se retiró en el Flop",
      "Asiento 4: rhidoxxx (ciega grande) se retiró antes del Flop",
      "Asiento 5: jte-ken recaudó (0.09 €)"
    ],
    "turn": [],
    "river": []
  },
  "board": [
    "2c",
    "As",
    "4d"
  ],
  "winner": "jte-ken",
  "win_amount": 4.5,
  "sb": 0.01,
  "bb": 0.02,
  "rake": 0.5,
  "raw_text": "Mano n.º 257215331739 de PokerStars:  Hold'em No Limit (0.01 €/0.02 € EUR) - 04-08-2025 22:38:43 CET [04-08-2025 16:38:43 ET]\nMesa \"Aldhafera II\" 6-max El asiento n.º 1 es el botón\nAsiento 2: BudyXXIII (5.85 € en fichas) está ausente\nAsiento 6: betterrrrrr (3.43 € en fichas) está ausente\nAsiento 1: wsx25 (1.03 € en fichas) \nAsiento 3: SrLyce (3.62 € en fichas) \nAsiento 4: rhidoxxx (2.12 € en fichas) \nAsiento 5: jte-ken (2.33 € en fichas) \nSrLyce: pone la ciega pequeña 0.01 €\nrhidoxxx: pone la ciega grande 0.02 €\n*** CARTAS DE MANO ***\nRepartidas a SrLyce [5h Th]\njte-ken: sube 0.02 € a 0.04 €\nwsx25: se retira \nSrLyce: iguala 0.03 €\nrhidoxxx: se retira \n*** FLOP *** [2c As 4d]\nSrLyce: pasa \njte-ken: apuesta 0.09 €\nSrLyce: se retira \nLa apuesta no igualada (0.09 €) ha sido devuelta a jte-ken\njte-ken se lleva 0.09 € del bote \n*** RESUMEN ***\nBote total 0.10 € | Comisión 0.01 € \nComunitarias [2c As 4d]\nAsiento 2: BudyXXIII\nAsiento 6: betterrrrrr\nAsiento 1: wsx25 (botón) se retiró antes del Flop (no apostó)\nAsiento 3: SrLyce (ciega pequeña) se retiró en el Flop\nAsiento 4: rhidoxxx (ciega grande) se retiró antes del Flop\nAsiento 5: jte-ken recaudó (0.09 €)"
}