{
  "hand_id": "257238559293",
  "date": "06-08-2025 19:09:59",
  "table": "Adelaide III",
  "game_type": "holdem",
  "hero": "SrLyce",
  "hero_position": "",
  "hero_cards": [
    "Ah",
    "3d"
  ],
  "stacks": {
    "aliendee07": 68.5,
    "Macklemore0": 100.0,
    "SrLyce": 91.0,
    "ismagonzalez7": 67.5,
    "pauquair5": 61.0
  },
  "actions": {
    "preflop": [
      "Asiento 2: aliendee07 (1.37 € en fichas)",
      "Asiento 3: Macklemore0 (2 € en fichas)",
      "Asiento 4: SrLyce (1.82 € en fichas)",
      "Asiento 5: ismagonzalez7 (1.35 € en fichas)",
      "Asiento 6: pauquair5 (1.22 € en fichas)",
      "aliendee07: pone la ciega pequeña 0.01 €",
      "Macklemore0: pone la ciega grande 0.02 €",
      "SrLyce: sube 0.03 € a 0.05 €",
      "ismagonzalez7: se retira",
      "pauquair5: se retira",
      "aliendee07: se retira",
      "Macklemore0: sube 0.17 € a 0.22 €",
      "SrLyce: se retira",
      "Macklemore0: no muestra su mano",
      "Asiento 2: aliendee07 (ciega pequeña) se retiró antes del Flop",
      "Asiento 3: Macklemore0 (ciega grande) recaudó (0.11 €)",
      "Asiento 4: SrLyce se retiró antes del Flop",
      "Asiento 5: ismagonzalez7 se retiró antes del Flop (no apostó)",
      "Asiento 6: pauquair5 (botón) se retiró antes del Flop (no apostó)"
    ],
    "flop": [],
    "turn": [],
    "river": []
  },
  "board": [],
  "winner": "Macklemore0",
  "win_amount": 5.5,
  "sb": 0.01,
  "bb": 0.02,
  "rake": 0.0,
  "raw_text": "Mano n.º 257238559293 de PokerStars:  Hold'em No Limit (0.01 €/0.02 € EUR) - 06-08-2025 19:09:59 CET [06-08-2025 13:09:59 ET]\nMesa \"Adelaide III\" 6-max El asiento n.º 6 es el botón\nAsiento 2: aliendee07 (1.37 € en fichas) \nAsiento 3: Macklemore0 (2 € en fichas) \nAsiento 4: SrLyce (1.82 € en fichas) \nAsiento 5: ismagonzalez7 (1.35 € en fichas) \nAsiento 6: pauquair5 (1.22 € en fichas) \naliendee07: pone la ciega pequeña 0.01 €\nMacklemore0: pone la ciega grande 0.02 €\n*** CARTAS DE MANO ***\nRepartidas a SrLyce [Ah 3d]\nAlceo27 se une a la mesa en el asiento n.º 1 \nSrLyce: sube 0.03 € a 0.05 €\nismagonzalez7: se retira \npauquair5: se retira \naliendee07: se retira \nMacklemore0: sube 0.17 € a 0.22 €\nSrLyce: se retira \nLa apuesta no igualada (0.17 €) ha sido devuelta a Macklemore0\nMacklemore0 se lleva 0.11 € del bote \nMacklemore0: no muestra su mano \n*** RESUMEN ***\nBote total 0.11 € | Comisión 0 € \nAsiento 2: aliendee07 (ciega pequeña) se retiró antes del Flop\nAsiento 3: Macklemore0 (ciega grande) recaudó (0.11 €)\nAsiento 4: SrLyce se retiró antes del Flop\nAsiento 5: ismagonzalez7 se retiró antes del Flop (no apostó)\nAsiento 6: pauquair5 (botón) se retiró antes del Flop (no apostó)"
}