{
  "hand_id": "257238127596",
  "date": "06-08-2025 18:30:31",
  "table": "Atreus",
  "game_type": "holdem",
  "hero": "SrLyce",
  "hero_position": "",
  "hero_cards": [
    "Ks",
    "8s"
  ],
  "stacks": {
    "PrendsCa": 102.5,
    "NRules82": 36.0,
    "JENOFONTE73": 165.0,
    "Fharock": 89.0,
    "SrLyce": 125.0,
    "FishamanReggae": 29.0
  },
  "actions": {
    "preflop": [
      "Asiento 1: PrendsCa (2.05 € en fichas)",
      "Asiento 2: NRules82 (0.72 € en fichas)",
      "Asiento 3: JENOFONTE73 (3.30 € en fichas)",
      "Asiento 4: Fharock (1.78 € en fichas)",
      "Asiento 5: SrLyce (2.50 € en fichas)",
      "Asiento 6: FishamanReggae (0.58 € en fichas)",
      "SrLyce: pone la ciega pequeña 0.01 €",
      "FishamanReggae: pone la ciega grande 0.02 €",
      "PrendsCa: sube 0.02 € a 0.04 €",
      "NRules82: se retira",
      "JENOFONTE73: se retira",
      "Fharock: iguala 0.04 €",
      "SrLyce: iguala 0.03 €",
      "FishamanReggae: iguala 0.02 €"
    ],
    "flop": [
      "SrLyce: pasa",
      "FishamanReggae: pasa",
      "PrendsCa: pasa",
      "Fharock: apuesta 0.08 €",
      "SrLyce: se retira",
      "FishamanReggae: se retira",
      "PrendsCa: se retira",
      "Asiento 1: PrendsCa se retiró en el Flop",
      "Asiento 2: NRules82 se retiró antes del Flop (no apostó)",
      "Asiento 3: JENOFONTE73 se retiró antes del Flop (no apostó)",
      "Asiento 4: Fharock (botón) recaudó (0.15 €)",
      "Asiento 5: SrLyce (ciega pequeña) se retiró en el Flop",
      "Asiento 6: FishamanReggae (ciega grande) se retiró en el Flop"
    ],
    "turn": [],
    "river": []
  },
  "board": [
    "4d",
    "Jd",
    "5d"
  ],
  "winner": "Fharock",
  "win_amount": 7.5,
  "sb": 0.01,
  "bb": 0.02,
  "rake": 0.5,
  "raw_text": "Mano n.º 257238127596 de PokerStars:  Hold'em No Limit (0.01 €/0.02 € EUR) - 06-08-2025 18:30:31 CET [06-08-2025 12:30:31 ET]\nMesa \"Atreus\" 6-max El asiento n.º 4 es el botón\nAsiento 1: PrendsCa (2.05 € en fichas) \nAsiento 2: NRules82 (0.72 € en fichas) \nAsiento 3: JENOFONTE73 (3.30 € en fichas) \nAsiento 4: Fharock (1.78 € en fichas) \nAsiento 5: SrLyce (2.50 € en fichas) \nAsiento 6: FishamanReggae (0.58 € en fichas) \nSrLyce: pone la ciega pequeña 0.01 €\nFishamanReggae: pone la ciega grande 0.02 €\n*** CARTAS DE MANO ***\nRepartidas a SrLyce [Ks 8s]\nPrendsCa: sube 0.02 € a 0.04 €\nNRules82: se retira \nJENOFONTE73: se retira \nFharock: iguala 0.04 €\nSrLyce: iguala 0.03 €\nFishamanReggae: iguala 0.02 €\n*** FLOP *** [4d Jd 5d]\nSrLyce: pasa \nFishamanReggae: pasa \nPrendsCa: pasa \nFharock: apuesta 0.08 €\nSrLyce: se retira \nFishamanReggae: se retira \nPrendsCa: se retira \nLa apuesta no igualada (0.08 €) ha sido devuelta a Fharock\nFharock se lleva 0.15 € del bote \n*** RESUMEN ***\nBote total 0.16 € | Comisión 0.01 € \nComunitarias [4d Jd 5d]\nAsiento 1: PrendsCa se retiró en el Flop\nAsiento 2: NRules82 se retiró antes del Flop (no apostó)\nAsiento 3: JENOFONTE73 se retiró antes del Flop (no apostó)\nAsiento 4: Fharock (botón) recaudó (0.15 €)\nAsiento 5: SrLyce (ciega pequeña) se retiró en el Flop\nAsiento 6: FishamanReggae (ciega grande) se retiró en el Flop"
}