{
  "hand_id": "257215216669",
  "date": "04-08-2025 22:31:37",
  "table": "Aldhafera II",
  "game_type": "holdem",
  "hero": "SrLyce",
  "hero_position": "",
  "hero_cards": [
    "Ks",
    "Ac"
  ],
  "stacks": {
    "wsx25": 69.0,
    "BudyXXIII": 292.5,
    "SrLyce": 98.5,
    "rhidoxxx": 87.0,
    "jte-ken": 100.5,
    "betterrrrrr": 180.5
  },
  "actions": {
    "preflop": [
      "Asiento 1: wsx25 (1.38 € en fichas)",
      "Asiento 2: BudyXXIII (5.85 € en fichas)",
      "Asiento 3: SrLyce (1.97 € en fichas)",
      "Asiento 4: rhidoxxx (1.74 € en fichas)",
      "Asiento 5: jte-ken (2.01 € en fichas)",
      "Asiento 6: betterrrrrr (3.61 € en fichas)",
      "jte-ken: pone la ciega pequeña 0.01 €",
      "betterrrrrr: pone la ciega grande 0.02 €",
      "wsx25: se retira",
      "BudyXXIII: se retira",
      "SrLyce: sube 0.04 € a 0.06 €",
      "rhidoxxx: se retira",
      "jte-ken: se retira",
      "betterrrrrr: se retira",
      "SrLyce: no muestra su mano",
      "Asiento 1: wsx25 se retiró antes del Flop (no apostó)",
      "Asiento 2: BudyXXIII se retiró antes del Flop (no apostó)",
      "Asiento 3: SrLyce recaudó (0.05 €)",
      "Asiento 4: rhidoxxx (botón) se retiró antes del Flop (no apostó)",
      "Asiento 5: jte-ken (ciega pequeña) se retiró antes del Flop",
      "Asiento 6: betterrrrrr (ciega grande) se retiró antes del Flop"
    ],
    "flop": [],
    "turn": [],
    "river": []
  },
  "board": [],
  "winner": "SrLyce",
  "win_amount": 2.5,
  "sb": 0.01,
  "bb": 0.02,
  "rake": 0.0,
  "raw_text": "Mano n.º 257215216669 de PokerStars:  Hold'em No Limit (0.01 €/0.02 € EUR) - 04-08-2025 22:31:37 CET [04-08-2025 16:31:37 ET]\nMesa \"Aldhafera II\" 6-max El asiento n.º 4 es el botón\nAsiento 1: wsx25 (1.38 € en fichas) \nAsiento 2: BudyXXIII (5.85 € en fichas) \nAsiento 3: SrLyce (1.97 € en fichas) \nAsiento 4: rhidoxxx (1.74 € en fichas) \nAsiento 5: jte-ken (2.01 € en fichas) \nAsiento 6: betterrrrrr (3.61 € en fichas) \njte-ken: pone la ciega pequeña 0.01 €\nbetterrrrrr: pone la ciega grande 0.02 €\n*** CARTAS DE MANO ***\nRepartidas a SrLyce [Ks Ac]\nwsx25: se retira \nBudyXXIII: se retira \nSrLyce: sube 0.04 € a 0.06 €\nrhidoxxx: se retira \njte-ken: se retira \nbetterrrrrr: se retira \nLa apuesta no igualada (0.04 €) ha sido devuelta a SrLyce\nSrLyce se lleva 0.05 € del bote \nSrLyce: no muestra su mano \n*** RESUMEN ***\nBote total 0.05 € | Comisión 0 € \nAsiento 1: wsx25 se retiró antes del Flop (no apostó)\nAsiento 2: BudyXXIII se retiró antes del Flop (no apostó)\nAsiento 3: SrLyce recaudó (0.05 €)\nAsiento 4: rhidoxxx (botón) se retiró antes del Flop (no apostó)\nAsiento 5: jte-ken (ciega pequeña) se retiró antes del Flop\nAsiento 6: betterrrrrr (ciega grande) se retiró antes del Flop"
}