{
  "hand_id": "257168334635",
  "date": "01-08-2025 11:28:52",
  "table": "Jupiter",
  "game_type": "holdem",
  "hero": "SrLyce",
  "hero_position": "",
  "hero_cards": [
    "5c",
    "Kh"
  ],
  "stacks": {
    "sifilis5": 109.0,
    "Filou203": 111.5,
    "SrLyce": 107.5,
    "LOLA19711971": 28.5,
    "dadou13mars": 214.0,
    "Alvii37": 107.0
  },
  "actions": {
    "preflop": [
      "Asiento 1: sifilis5 (2.18 € en fichas)",
      "Asiento 2: Filou203 (2.23 € en fichas)",
      "Asiento 3: SrLyce (2.15 € en fichas)",
      "Asiento 4: LOLA19711971 (0.57 € en fichas)",
      "Asiento 5: dadou13mars (4.28 € en fichas)",
      "Asiento 6: Alvii37 (2.14 € en fichas)",
      "Alvii37: pone la ciega pequeña 0.01 €",
      "sifilis5: pone la ciega grande 0.02 €",
      "Filou203: se retira",
      "SrLyce: se retira",
      "LOLA19711971: se retira",
      "dadou13mars: se retira",
      "Alvii37: se retira",
      "sifilis5: no muestra su mano",
      "Asiento 1: sifilis5 (ciega grande) recaudó (0.02 €)",
      "Asiento 2: Filou203 se retiró antes del Flop (no apostó)",
      "Asiento 3: SrLyce se retiró antes del Flop (no apostó)",
      "Asiento 4: LOLA19711971 se retiró antes del Flop (no apostó)",
      "Asiento 5: dadou13mars (botón) se retiró antes del Flop (no apostó)",
      "Asiento 6: Alvii37 (ciega pequeña) se retiró antes del Flop"
    ],
    "flop": [],
    "turn": [],
    "river": []
  },
  "board": [],
  "winner": "sifilis5",
  "win_amount": 1.0,
  "sb": 0.01,
  "bb": 0.02,
  "rake": 0.0,
  "raw_text": "Mano n.º 257168334635 de PokerStars:  Hold'em No Limit (0.01 €/0.02 € EUR) - 01-08-2025 11:28:52 CET [01-08-2025 5:28:52 ET]\nMesa \"Jupiter\" 6-max El asiento n.º 5 es el botón\nAsiento 1: sifilis5 (2.18 € en fichas) \nAsiento 2: Filou203 (2.23 € en fichas) \nAsiento 3: SrLyce (2.15 € en fichas) \nAsiento 4: LOLA19711971 (0.57 € en fichas) \nAsiento 5: dadou13mars (4.28 € en fichas) \nAsiento 6: Alvii37 (2.14 € en fichas) \nAlvii37: pone la ciega pequeña 0.01 €\nsifilis5: pone la ciega grande 0.02 €\n*** CARTAS DE MANO ***\nRepartidas a SrLyce [5c Kh]\nFilou203: se retira \nSrLyce: se retira \nLOLA19711971: se retira \ndadou13mars: se retira \nAlvii37: se retira \nLa apuesta no igualada (0.01 €) ha sido devuelta a sifilis5\nsifilis5 se lleva 0.02 € del bote \nsifilis5: no muestra su mano \n*** RESUMEN ***\nBote total 0.02 € | Comisión 0 € \nAsiento 1: sifilis5 (ciega grande) recaudó (0.02 €)\nAsiento 2: Filou203 se retiró antes del Flop (no apostó)\nAsiento 3: SrLyce se retiró antes del Flop (no apostó)\nAsiento 4: LOLA19711971 se retiró antes del Flop (no apostó)\nAsiento 5: dadou13mars (botón) se retiró antes del Flop (no apostó)\nAsiento 6: Alvii37 (ciega pequeña) se retiró antes del Flop"
}