{
  "hand_id": "257237970944",
  "date": "06-08-2025 18:16:32",
  "table": "Euneus III",
  "game_type": "holdem",
  "hero": "SrLyce",
  "hero_position": "",
  "hero_cards": [
    "4h",
    "Ts"
  ],
  "stacks": {
    "christgear": 100.0,
    "Il_BM00": 128.0,
    "djrojas9": 133.5,
    "lol-in 2000": 98.5,
    "SrLyce": 125.5,
    "kcg_rm": 110.5
  },
  "actions": {
    "preflop": [
      "Asiento 1: christgear (2 € en fichas)",
      "Asiento 2: Il_BM00 (2.56 € en fichas)",
      "Asiento 3: djrojas9 (2.67 € en fichas)",
      "Asiento 4: lol-in 2000 (1.97 € en fichas)",
      "Asiento 5: SrLyce (2.51 € en fichas)",
      "Asiento 6: kcg_rm (2.21 € en fichas)",
      "SrLyce: pone la ciega pequeña 0.01 €",
      "kcg_rm: pone la ciega grande 0.02 €",
      "christgear: se retira",
      "Il_BM00: se retira",
      "djrojas9: sube 0.04 € a 0.06 €",
      "lol-in 2000: se retira",
      "SrLyce: se retira",
      "kcg_rm: se retira",
      "djrojas9: no muestra su mano",
      "Asiento 1: christgear se retiró antes del Flop (no apostó)",
      "Asiento 2: Il_BM00 se retiró antes del Flop (no apostó)",
      "Asiento 3: djrojas9 recaudó (0.05 €)",
      "Asiento 4: lol-in 2000 (botón) se retiró antes del Flop (no apostó)",
      "Asiento 5: SrLyce (ciega pequeña) se retiró antes del Flop",
      "Asiento 6: kcg_rm (ciega grande) se retiró antes del Flop"
    ],
    "flop": [],
    "turn": [],
    "river": []
  },
  "board": [],
  "winner": "djrojas9",
  "win_amount": 2.5,
  "sb": 0.01,
  "bb": 0.02,
  "rake": 0.0,
  "raw_text": "Mano n.º 257237970944 de PokerStars:  Hold'em No Limit (0.01 €/0.02 € EUR) - 06-08-2025 18:16:32 CET [06-08-2025 12:16:32 ET]\nMesa \"Euneus III\" 6-max El asiento n.º 4 es el botón\nAsiento 1: christgear (2 € en fichas) \nAsiento 2: Il_BM00 (2.56 € en fichas) \nAsiento 3: djrojas9 (2.67 € en fichas) \nAsiento 4: lol-in 2000 (1.97 € en fichas) \nAsiento 5: SrLyce (2.51 € en fichas) \nAsiento 6: kcg_rm (2.21 € en fichas) \nSrLyce: pone la ciega pequeña 0.01 €\nkcg_rm: pone la ciega grande 0.02 €\n*** CARTAS DE MANO ***\nRepartidas a SrLyce [4h Ts]\nchristgear: se retira \nIl_BM00: se retira \ndjrojas9: sube 0.04 € a 0.06 €\nlol-in 2000: se retira \nSrLyce: se retira \nkcg_rm: se retira \nLa apuesta no igualada (0.04 €) ha sido devuelta a djrojas9\ndjrojas9 se lleva 0.05 € del bote \ndjrojas9: no muestra su mano \n*** RESUMEN ***\nBote total 0.05 € | Comisión 0 € \nAsiento 1: christgear se retiró antes del Flop (no apostó)\nAsiento 2: Il_BM00 se retiró antes del Flop (no apostó)\nAsiento 3: djrojas9 recaudó (0.05 €)\nAsiento 4: lol-in 2000 (botón) se retiró antes del Flop (no apostó)\nAsiento 5: SrLyce (ciega pequeña) se retiró antes del Flop\nAsiento 6: kcg_rm (ciega grande) se retiró antes del Flop"
}