{
  "hand_id": "257237830380",
  "date": "06-08-2025 18:03:28",
  "table": "Nuwa III",
  "game_type": "holdem",
  "hero": "SrLyce",
  "hero_position": "",
  "hero_cards": [
    "Qd",
    "Qc"
  ],
  "stacks": {
    "davinci1962": 117.0,
    "BuXHexter": 104.5,
    "kcg_rm": 107.0,
    "SrLyce": 95.5,
    "RiskAllinkali": 116.0,
    "acavada": 101.0
  },
  "actions": {
    "preflop": [
      "Asiento 1: davinci1962 (2.34 € en fichas)",
      "Asiento 2: BuXHexter (2.09 € en fichas)",
      "Asiento 3: kcg_rm (2.14 € en fichas)",
      "Asiento 4: SrLyce (1.91 € en fichas)",
      "Asiento 5: RiskAllinkali (2.32 € en fichas)",
      "Asiento 6: acavada (2.02 € en fichas)",
      "davinci1962: pone la ciega pequeña 0.01 €",
      "BuXHexter: pone la ciega grande 0.02 €",
      "kcg_rm: se retira",
      "SrLyce: sube 0.03 € a 0.05 €",
      "RiskAllinkali: se retira",
      "acavada: se retira",
      "davinci1962: se retira",
      "BuXHexter: se retira",
      "SrLyce: no muestra su mano",
      "Asiento 1: davinci1962 (ciega pequeña) se retiró antes del Flop",
      "Asiento 2: BuXHexter (ciega grande) se retiró antes del Flop",
      "Asiento 3: kcg_rm se retiró antes del Flop (no apostó)",
      "Asiento 4: SrLyce recaudó (0.05 €)",
      "Asiento 5: RiskAllinkali se retiró antes del Flop (no apostó)",
      "Asiento 6: acavada (botón) se retiró antes del Flop (no apostó)"
    ],
    "flop": [],
    "turn": [],
    "river": []
  },
  "board": [],
  "winner": "SrLyce",
  "win_amount": 2.5,
  "sb": 0.01,
  "bb": 0.02,
  "rake": 0.0,
  "raw_text": "Mano n.º 257237830380 de PokerStars:  Hold'em No Limit (0.01 €/0.02 € EUR) - 06-08-2025 18:03:28 CET [06-08-2025 12:03:28 ET]\nMesa \"Nuwa III\" 6-max El asiento n.º 6 es el botón\nAsiento 1: davinci1962 (2.34 € en fichas) \nAsiento 2: BuXHexter (2.09 € en fichas) \nAsiento 3: kcg_rm (2.14 € en fichas) \nAsiento 4: SrLyce (1.91 € en fichas) \nAsiento 5: RiskAllinkali (2.32 € en fichas) \nAsiento 6: acavada (2.02 € en fichas) \ndavinci1962: pone la ciega pequeña 0.01 €\nBuXHexter: pone la ciega grande 0.02 €\n*** CARTAS DE MANO ***\nRepartidas a SrLyce [Qd Qc]\nkcg_rm: se retira \nSrLyce: sube 0.03 € a 0.05 €\nRiskAllinkali: se retira \nacavada: se retira \ndavinci1962: se retira \nBuXHexter: se retira \nLa apuesta no igualada (0.03 €) ha sido devuelta a SrLyce\nSrLyce se lleva 0.05 € del bote \nSrLyce: no muestra su mano \n*** RESUMEN ***\nBote total 0.05 € | Comisión 0 € \nAsiento 1: davinci1962 (ciega pequeña) se retiró antes del Flop\nAsiento 2: BuXHexter (ciega grande) se retiró antes del Flop\nAsiento 3: kcg_rm se retiró antes del Flop (no apostó)\nAsiento 4: SrLyce recaudó (0.05 €)\nAsiento 5: RiskAllinkali se retiró antes del Flop (no apostó)\nAsiento 6: acavada (botón) se retiró antes del Flop (no apostó)"
}