{
  "hand_id": "257149030815",
  "date": "30-07-2025 22:03:07",
  "table": "Sirona",
  "game_type": "holdem",
  "hero": "SrLyce",
  "hero_position": "",
  "hero_cards": [
    "Th",
    "5h"
  ],
  "stacks": {
    "SrLyce": 121.0,
    "lecontrebandier": 93.0,
    "christoph363": 209.5,
    "oliverdu70": 187.5,
    "NaruchoH1": 100.0
  },
  "actions": {
    "preflop": [
      "Asiento 1: SrLyce (2.42 € en fichas)",
      "Asiento 2: lecontrebandier (1.86 € en fichas)",
      "Asiento 3: christoph363 (4.19 € en fichas)",
      "Asiento 4: oliverdu70 (3.75 € en fichas)",
      "Asiento 5: NaruchoH1 (2 € en fichas)",
      "oliverdu70: pone la ciega pequeña 0.01 €",
      "NaruchoH1: pone la ciega grande 0.02 €",
      "SrLyce: se retira",
      "lecontrebandier: sube 0.02 € a 0.04 €",
      "christoph363: se retira",
      "oliverdu70: se retira",
      "NaruchoH1: se retira",
      "lecontrebandier: no muestra su mano",
      "Asiento 1: SrLyce se retiró antes del Flop (no apostó)",
      "Asiento 2: lecontrebandier recaudó (0.05 €)",
      "Asiento 3: christoph363 (botón) se retiró antes del Flop (no apostó)",
      "Asiento 4: oliverdu70 (ciega pequeña) se retiró antes del Flop",
      "Asiento 5: NaruchoH1 (ciega grande) se retiró antes del Flop"
    ],
    "flop": [],
    "turn": [],
    "river": []
  },
  "board": [],
  "winner": "lecontrebandier",
  "win_amount": 2.5,
  "sb": 0.01,
  "bb": 0.02,
  "rake": 0.0,
  "raw_text": "Mano n.º 257149030815 de PokerStars:  Hold'em No Limit (0.01 €/0.02 € EUR) - 30-07-2025 22:03:07 CET [30-07-2025 16:03:07 ET]\nMesa \"Sirona\" 6-max El asiento n.º 3 es el botón\nAsiento 1: SrLyce (2.42 € en fichas) \nAsiento 2: lecontrebandier (1.86 € en fichas) \nAsiento 3: christoph363 (4.19 € en fichas) \nAsiento 4: oliverdu70 (3.75 € en fichas) \nAsiento 5: NaruchoH1 (2 € en fichas) \noliverdu70: pone la ciega pequeña 0.01 €\nNaruchoH1: pone la ciega grande 0.02 €\n*** CARTAS DE MANO ***\nRepartidas a SrLyce [Th 5h]\nMitchATP65 se une a la mesa en el asiento n.º 6 \nSrLyce: se retira \nlecontrebandier: sube 0.02 € a 0.04 €\nchristoph363: se retira \noliverdu70: se retira \nNaruchoH1: se retira \nLa apuesta no igualada (0.02 €) ha sido devuelta a lecontrebandier\nlecontrebandier se lleva 0.05 € del bote \nlecontrebandier: no muestra su mano \n*** RESUMEN ***\nBote total 0.05 € | Comisión 0 € \nAsiento 1: SrLyce se retiró antes del Flop (no apostó)\nAsiento 2: lecontrebandier recaudó (0.05 €)\nAsiento 3: christoph363 (botón) se retiró antes del Flop (no apostó)\nAsiento 4: oliverdu70 (ciega pequeña) se retiró antes del Flop\nAsiento 5: NaruchoH1 (ciega grande) se retiró antes del Flop"
}