{
  "hand_id": "257237755910",
  "date": "06-08-2025 17:54:54",
  "table": "Euneus III",
  "game_type": "holdem",
  "hero": "SrLyce",
  "hero_position": "",
  "hero_cards": [
    "6h",
    "7c"
  ],
  "stacks": {
    "DeMula62": 107.0,
    "Il_BM00": 106.5,
    "djrojas9": 147.0,
    "eleuvehache": 92.5,
    "SrLyce": 116.5,
    "t053n": 52.5
  },
  "actions": {
    "preflop": [
      "Asiento 1: DeMula62 (2.14 € en fichas)",
      "Asiento 2: Il_BM00 (2.13 € en fichas)",
      "Asiento 3: djrojas9 (2.94 € en fichas)",
      "Asiento 4: eleuvehache (1.85 € en fichas)",
      "Asiento 5: SrLyce (2.33 € en fichas)",
      "Asiento 6: t053n (1.05 € en fichas)",
      "eleuvehache: pone la ciega pequeña 0.01 €",
      "SrLyce: pone la ciega grande 0.02 €",
      "t053n: se retira",
      "DeMula62: se retira",
      "Il_BM00: sube 0.04 € a 0.06 €",
      "djrojas9: se retira",
      "eleuvehache: iguala 0.05 €",
      "SrLyce: iguala 0.04 €"
    ],
    "flop": [
      "eleuvehache: pasa",
      "SrLyce: pasa",
      "Il_BM00: apuesta 0.08 €",
      "eleuvehache: se retira",
      "SrLyce: se retira",
      "Il_BM00: no muestra su mano",
      "Asiento 1: DeMula62 se retiró antes del Flop (no apostó)",
      "Asiento 2: Il_BM00 recaudó (0.17 €)",
      "Asiento 3: djrojas9 (botón) se retiró antes del Flop (no apostó)",
      "Asiento 4: eleuvehache (ciega pequeña) se retiró en el Flop",
      "Asiento 5: SrLyce (ciega grande) se retiró en el Flop",
      "Asiento 6: t053n se retiró antes del Flop (no apostó)"
    ],
    "turn": [],
    "river": []
  },
  "board": [
    "Jc",
    "8c",
    "3d"
  ],
  "winner": "Il_BM00",
  "win_amount": 8.5,
  "sb": 0.01,
  "bb": 0.02,
  "rake": 0.5,
  "raw_text": "Mano n.º 257237755910 de PokerStars:  Hold'em No Limit (0.01 €/0.02 € EUR) - 06-08-2025 17:54:54 CET [06-08-2025 11:54:54 ET]\nMesa \"Euneus III\" 6-max El asiento n.º 3 es el botón\nAsiento 1: DeMula62 (2.14 € en fichas) \nAsiento 2: Il_BM00 (2.13 € en fichas) \nAsiento 3: djrojas9 (2.94 € en fichas) \nAsiento 4: eleuvehache (1.85 € en fichas) \nAsiento 5: SrLyce (2.33 € en fichas) \nAsiento 6: t053n (1.05 € en fichas) \neleuvehache: pone la ciega pequeña 0.01 €\nSrLyce: pone la ciega grande 0.02 €\n*** CARTAS DE MANO ***\nRepartidas a SrLyce [6h 7c]\nt053n: se retira \nDeMula62: se retira \nIl_BM00: sube 0.04 € a 0.06 €\ndjrojas9: se retira \neleuvehache: iguala 0.05 €\nt053n deja la mesa\nSrLyce: iguala 0.04 €\n*** FLOP *** [Jc 8c 3d]\neleuvehache: pasa \nSrLyce: pasa \nIl_BM00: apuesta 0.08 €\neleuvehache: se retira \nSrLyce: se retira \nLa apuesta no igualada (0.08 €) ha sido devuelta a Il_BM00\nIl_BM00 se lleva 0.17 € del bote \nIl_BM00: no muestra su mano \n*** RESUMEN ***\nBote total 0.18 € | Comisión 0.01 € \nComunitarias [Jc 8c 3d]\nAsiento 1: DeMula62 se retiró antes del Flop (no apostó)\nAsiento 2: Il_BM00 recaudó (0.17 €)\nAsiento 3: djrojas9 (botón) se retiró antes del Flop (no apostó)\nAsiento 4: eleuvehache (ciega pequeña) se retiró en el Flop\nAsiento 5: SrLyce (ciega grande) se retiró en el Flop\nAsiento 6: t053n se retiró antes del Flop (no apostó)"
}