{
  "hand_id": "257237757326",
  "date": "06-08-2025 17:55:02",
  "table": "Virtus",
  "game_type": "holdem",
  "hero": "SrLyce",
  "hero_position": "",
  "hero_cards": [
    "9c",
    "7d"
  ],
  "stacks": {
    "Kingzilla87": 169.5,
    "SrLyce": 107.5,
    "pullup0": 40.0,
    "JGDOBLAS": 101.0,
    "don.corle": 141.5,
    "rudik34385": 78.0
  },
  "actions": {
    "preflop": [
      "Asiento 1: Kingzilla87 (3.39 € en fichas) está ausente",
      "Asiento 2: SrLyce (2.15 € en fichas)",
      "Asiento 3: pullup0 (0.80 € en fichas)",
      "Asiento 4: JGDOBLAS (2.02 € en fichas)",
      "Asiento 5: don.corle (2.83 € en fichas)",
      "Asiento 6: rudik34385 (1.56 € en fichas)",
      "SrLyce: pone la ciega pequeña 0.01 €",
      "pullup0: pone la ciega grande 0.02 €",
      "JGDOBLAS: se retira",
      "don.corle: se retira",
      "rudik34385: se retira",
      "SrLyce: sube 0.02 € a 0.04 €",
      "pullup0: iguala 0.02 €"
    ],
    "flop": [
      "SrLyce: apuesta 0.03 €",
      "pullup0: se retira",
      "SrLyce: no muestra su mano",
      "Asiento 1: Kingzilla87",
      "Asiento 2: SrLyce (ciega pequeña) recaudó (0.08 €)",
      "Asiento 3: pullup0 (ciega grande) se retiró en el Flop",
      "Asiento 4: JGDOBLAS se retiró antes del Flop (no apostó)",
      "Asiento 5: don.corle se retiró antes del Flop (no apostó)",
      "Asiento 6: rudik34385 (botón) se retiró antes del Flop (no apostó)"
    ],
    "turn": [],
    "river": []
  },
  "board": [
    "8c",
    "7s",
    "4s"
  ],
  "winner": "SrLyce",
  "win_amount": 4.0,
  "sb": 0.01,
  "bb": 0.02,
  "rake": 0.0,
  "raw_text": "Mano n.º 257237757326 de PokerStars:  Hold'em No Limit (0.01 €/0.02 € EUR) - 06-08-2025 17:55:02 CET [06-08-2025 11:55:02 ET]\nMesa \"Virtus\" 6-max El asiento n.º 6 es el botón\nAsiento 1: Kingzilla87 (3.39 € en fichas) está ausente\nAsiento 2: SrLyce (2.15 € en fichas) \nAsiento 3: pullup0 (0.80 € en fichas) \nAsiento 4: JGDOBLAS (2.02 € en fichas) \nAsiento 5: don.corle (2.83 € en fichas) \nAsiento 6: rudik34385 (1.56 € en fichas) \nSrLyce: pone la ciega pequeña 0.01 €\npullup0: pone la ciega grande 0.02 €\n*** CARTAS DE MANO ***\nRepartidas a SrLyce [9c 7d]\nJGDOBLAS: se retira \ndon.corle: se retira \nrudik34385: se retira \nSrLyce: sube 0.02 € a 0.04 €\npullup0: iguala 0.02 €\n*** FLOP *** [8c 7s 4s]\nSrLyce: apuesta 0.03 €\npullup0: se retira \nLa apuesta no igualada (0.03 €) ha sido devuelta a SrLyce\nSrLyce se lleva 0.08 € del bote \nSrLyce: no muestra su mano \n*** RESUMEN ***\nBote total 0.08 € | Comisión 0 € \nComunitarias [8c 7s 4s]\nAsiento 1: Kingzilla87\nAsiento 2: SrLyce (ciega pequeña) recaudó (0.08 €)\nAsiento 3: pullup0 (ciega grande) se retiró en el Flop\nAsiento 4: JGDOBLAS se retiró antes del Flop (no apostó)\nAsiento 5: don.corle se retiró antes del Flop (no apostó)\nAsiento 6: rudik34385 (botón) se retiró antes del Flop (no apostó)"
}