{
  "hand_id": "257168270491",
  "date": "01-08-2025 11:16:46",
  "table": "Jupiter",
  "game_type": "holdem",
  "hero": "SrLyce",
  "hero_position": "",
  "hero_cards": [
    "6d",
    "5s"
  ],
  "stacks": {
    "sifilis5": 98.5,
    "Filou203": 117.0,
    "SrLyce": 107.0,
    "LOLA19711971": 32.0,
    "dadou13mars": 228.5,
    "Alvii37": 100.0
  },
  "actions": {
    "preflop": [
      "Asiento 1: sifilis5 (1.97 € en fichas)",
      "Asiento 2: Filou203 (2.34 € en fichas)",
      "Asiento 3: SrLyce (2.14 € en fichas)",
      "Asiento 4: LOLA19711971 (0.64 € en fichas)",
      "Asiento 5: dadou13mars (4.57 € en fichas)",
      "Asiento 6: Alvii37 (2 € en fichas)",
      "Filou203: pone la ciega pequeña 0.01 €",
      "SrLyce: pone la ciega grande 0.02 €",
      "LOLA19711971: se retira",
      "dadou13mars: se retira",
      "Alvii37: sube 0.04 € a 0.06 €",
      "sifilis5: se retira",
      "Filou203: se retira",
      "SrLyce: iguala 0.04 €"
    ],
    "flop": [
      "SrLyce: pasa",
      "Alvii37: pasa"
    ],
    "turn": [
      "SrLyce: apuesta 0.04 €",
      "Alvii37: se retira",
      "SrLyce: no muestra su mano",
      "Asiento 1: sifilis5 (botón) se retiró antes del Flop (no apostó)",
      "Asiento 2: Filou203 (ciega pequeña) se retiró antes del Flop",
      "Asiento 3: SrLyce (ciega grande) recaudó (0.12 €)",
      "Asiento 4: LOLA19711971 se retiró antes del Flop (no apostó)",
      "Asiento 5: dadou13mars se retiró antes del Flop (no apostó)",
      "Asiento 6: Alvii37 se retiró en el Turn"
    ],
    "river": []
  },
  "board": [
    "5h",
    "8d",
    "5c",
    "6h"
  ],
  "winner": "SrLyce",
  "win_amount": 6.0,
  "sb": 0.01,
  "bb": 0.02,
  "rake": 0.5,
  "raw_text": "Mano n.º 257168270491 de PokerStars:  Hold'em No Limit (0.01 €/0.02 € EUR) - 01-08-2025 11:16:46 CET [01-08-2025 5:16:46 ET]\nMesa \"Jupiter\" 6-max El asiento n.º 1 es el botón\nAsiento 1: sifilis5 (1.97 € en fichas) \nAsiento 2: Filou203 (2.34 € en fichas) \nAsiento 3: SrLyce (2.14 € en fichas) \nAsiento 4: LOLA19711971 (0.64 € en fichas) \nAsiento 5: dadou13mars (4.57 € en fichas) \nAsiento 6: Alvii37 (2 € en fichas) \nFilou203: pone la ciega pequeña 0.01 €\nSrLyce: pone la ciega grande 0.02 €\n*** CARTAS DE MANO ***\nRepartidas a SrLyce [6d 5s]\nLOLA19711971: se retira \ndadou13mars: se retira \nAlvii37: sube 0.04 € a 0.06 €\nsifilis5: se retira \nFilou203: se retira \nSrLyce: iguala 0.04 €\n*** FLOP *** [5h 8d 5c]\nSrLyce: pasa \nAlvii37: pasa \n*** TURN *** [5h 8d 5c] [6h]\nSrLyce: apuesta 0.04 €\nAlvii37: se retira \nLa apuesta no igualada (0.04 €) ha sido devuelta a SrLyce\nSrLyce se lleva 0.12 € del bote \nSrLyce: no muestra su mano \n*** RESUMEN ***\nBote total 0.13 € | Comisión 0.01 € \nComunitarias [5h 8d 5c 6h]\nAsiento 1: sifilis5 (botón) se retiró antes del Flop (no apostó)\nAsiento 2: Filou203 (ciega pequeña) se retiró antes del Flop\nAsiento 3: SrLyce (ciega grande) recaudó (0.12 €)\nAsiento 4: LOLA19711971 se retiró antes del Flop (no apostó)\nAsiento 5: dadou13mars se retiró antes del Flop (no apostó)\nAsiento 6: Alvii37 se retiró en el Turn"
}