{
  "hand_id": "257150489892",
  "date": "30-07-2025 23:45:35",
  "table": "Martha",
  "game_type": "holdem",
  "hero": "SrLyce",
  "hero_position": "",
  "hero_cards": [
    "Ts",
    "Td"
  ],
  "stacks": {
    "mivipkr": 104.5,
    "NovacaineZxc": 117.5,
    "BudyXXIII": 113.5,
    "Sigiilo": 102.5,
    "SrLyce": 100.5,
    "alexfw300": 100.5
  },
  "actions": {
    "preflop": [
      "Asiento 1: mivipkr (2.09 € en fichas)",
      "Asiento 2: NovacaineZxc (2.35 € en fichas)",
      "Asiento 3: BudyXXIII (2.27 € en fichas)",
      "Asiento 4: Sigiilo (2.05 € en fichas)",
      "Asiento 5: SrLyce (2.01 € en fichas)",
      "Asiento 6: alexfw300 (2.01 € en fichas)",
      "NovacaineZxc: pone la ciega pequeña 0.01 €",
      "BudyXXIII: pone la ciega grande 0.02 €",
      "Sigiilo: se retira",
      "SrLyce: sube 0.04 € a 0.06 €",
      "alexfw300: se retira",
      "mivipkr: se retira",
      "NovacaineZxc: iguala 0.05 €",
      "BudyXXIII: se retira"
    ],
    "flop": [
      "NovacaineZxc: apuesta 0.06 €",
      "SrLyce: iguala 0.06 €"
    ],
    "turn": [
      "NovacaineZxc: apuesta 0.12 €",
      "SrLyce: iguala 0.12 €"
    ],
    "river": [
      "NovacaineZxc: pasa",
      "SrLyce: apuesta 0.28 €",
      "NovacaineZxc: iguala 0.28 €",
      "SrLyce: muestra [Ts Td] (pareja de dieces)",
      "NovacaineZxc: muestra [Js Kc] (pareja de jotas)",
      "Asiento 1: mivipkr (botón) se retiró antes del Flop (no apostó)",
      "Asiento 2: NovacaineZxc (ciega pequeña) muestra [Js Kc] y ganó (1 €) con pareja de jotas",
      "Asiento 3: BudyXXIII (ciega grande) se retiró antes del Flop",
      "Asiento 4: Sigiilo se retiró antes del Flop (no apostó)",
      "Asiento 5: SrLyce muestra [Ts Td] y perdió con pareja de dieces",
      "Asiento 6: alexfw300 se retiró antes del Flop (no apostó)"
    ]
  },
  "board": [
    "2h",
    "Jh",
    "8d",
    "7c",
    "3h"
  ],
  "winner": "NovacaineZxc",
  "win_amount": 50.0,
  "sb": 0.01,
  "bb": 0.02,
  "rake": 3.0,
  "raw_text": "Mano n.º 257150489892 de PokerStars:  Hold'em No Limit (0.01 €/0.02 € EUR) - 30-07-2025 23:45:35 CET [30-07-2025 17:45:35 ET]\nMesa \"Martha\" 6-max El asiento n.º 1 es el botón\nAsiento 1: mivipkr (2.09 € en fichas) \nAsiento 2: NovacaineZxc (2.35 € en fichas) \nAsiento 3: BudyXXIII (2.27 € en fichas) \nAsiento 4: Sigiilo (2.05 € en fichas) \nAsiento 5: SrLyce (2.01 € en fichas) \nAsiento 6: alexfw300 (2.01 € en fichas) \nNovacaineZxc: pone la ciega pequeña 0.01 €\nBudyXXIII: pone la ciega grande 0.02 €\n*** CARTAS DE MANO ***\nRepartidas a SrLyce [Ts Td]\nSigiilo: se retira \nSrLyce: sube 0.04 € a 0.06 €\nalexfw300: se retira \nmivipkr: se retira \nNovacaineZxc: iguala 0.05 €\nBudyXXIII: se retira \n*** FLOP *** [2h Jh 8d]\nNovacaineZxc: apuesta 0.06 €\nSrLyce: iguala 0.06 €\n*** TURN *** [2h Jh 8d] [7c]\nNovacaineZxc: apuesta 0.12 €\nSrLyce: iguala 0.12 €\n*** RIVER *** [2h Jh 8d 7c] [3h]\nNovacaineZxc: pasa \nSrLyce: apuesta 0.28 €\nNovacaineZxc: iguala 0.28 €\n*** SHOW DOWN ***\nSrLyce: muestra [Ts Td] (pareja de dieces)\nNovacaineZxc: muestra [Js Kc] (pareja de jotas)\nNovacaineZxc se lleva 1 € del bote \n*** RESUMEN ***\nBote total 1.06 € | Comisión 0.06 € \nComunitarias [2h Jh 8d 7c 3h]\nAsiento 1: mivipkr (botón) se retiró antes del Flop (no apostó)\nAsiento 2: NovacaineZxc (ciega pequeña) muestra [Js Kc] y ganó (1 €) con pareja de jotas\nAsiento 3: BudyXXIII (ciega grande) se retiró antes del Flop\nAsiento 4: Sigiilo se retiró antes del Flop (no apostó)\nAsiento 5: SrLyce muestra [Ts Td] y perdió con pareja de dieces\nAsiento 6: alexfw300 se retiró antes del Flop (no apostó)"
}