{
  "hand_id": "257238139795",
  "date": "06-08-2025 18:31:36",
  "table": "Atreus",
  "game_type": "holdem",
  "hero": "SrLyce",
  "hero_position": "",
  "hero_cards": [
    "2c",
    "2h"
  ],
  "stacks": {
    "PrendsCa": 101.5,
    "NRules82": 36.0,
    "JENOFONTE73": 165.0,
    "Fharock": 94.5,
    "SrLyce": 123.0,
    "FishamanReggae": 26.0
  },
  "actions": {
    "preflop": [
      "Asiento 1: PrendsCa (2.03 € en fichas)",
      "Asiento 2: NRules82 (0.72 € en fichas)",
      "Asiento 3: JENOFONTE73 (3.30 € en fichas)",
      "Asiento 4: Fharock (1.89 € en fichas)",
      "Asiento 5: SrLyce (2.46 € en fichas)",
      "Asiento 6: FishamanReggae (0.52 € en fichas)",
      "PrendsCa: pone la ciega pequeña 0.01 €",
      "NRules82: pone la ciega grande 0.02 €",
      "JENOFONTE73: se retira",
      "Fharock: sube 0.02 € a 0.04 €",
      "SrLyce: iguala 0.04 €",
      "FishamanReggae: iguala 0.04 €",
      "PrendsCa: se retira",
      "NRules82: iguala 0.02 €"
    ],
    "flop": [
      "NRules82: pasa",
      "Fharock: pasa",
      "SrLyce: pasa",
      "FishamanReggae: apuesta 0.08 €",
      "NRules82: iguala 0.08 €",
      "Fharock: se retira",
      "SrLyce: se retira"
    ],
    "turn": [
      "NRules82: pasa",
      "FishamanReggae: pasa"
    ],
    "river": [
      "NRules82: pasa",
      "FishamanReggae: pasa",
      "NRules82: muestra [Ts Jc] (doble pareja, jotas y dieces)",
      "FishamanReggae: muestra [3d 3h] (color, carta alta jota)",
      "Asiento 1: PrendsCa (ciega pequeña) se retiró antes del Flop",
      "Asiento 2: NRules82 (ciega grande) muestra [Ts Jc] y perdió con doble pareja, jotas y dieces",
      "Asiento 3: JENOFONTE73 se retiró antes del Flop (no apostó)",
      "Asiento 4: Fharock se retiró en el Flop",
      "Asiento 5: SrLyce se retiró en el Flop",
      "Asiento 6: FishamanReggae (botón) muestra [3d 3h] y ganó (0.31 €) con color, carta alta jota"
    ]
  },
  "board": [
    "Jh",
    "Th",
    "3s",
    "4h",
    "9h"
  ],
  "winner": "FishamanReggae",
  "win_amount": 15.5,
  "sb": 0.01,
  "bb": 0.02,
  "rake": 1.0,
  "raw_text": "Mano n.º 257238139795 de PokerStars:  Hold'em No Limit (0.01 €/0.02 € EUR) - 06-08-2025 18:31:36 CET [06-08-2025 12:31:36 ET]\nMesa \"Atreus\" 6-max El asiento n.º 6 es el botón\nAsiento 1: PrendsCa (2.03 € en fichas) \nAsiento 2: NRules82 (0.72 € en fichas) \nAsiento 3: JENOFONTE73 (3.30 € en fichas) \nAsiento 4: Fharock (1.89 € en fichas) \nAsiento 5: SrLyce (2.46 € en fichas) \nAsiento 6: FishamanReggae (0.52 € en fichas) \nPrendsCa: pone la ciega pequeña 0.01 €\nNRules82: pone la ciega grande 0.02 €\n*** CARTAS DE MANO ***\nRepartidas a SrLyce [2c 2h]\nJENOFONTE73: se retira \nFharock: sube 0.02 € a 0.04 €\nSrLyce: iguala 0.04 €\nFishamanReggae: iguala 0.04 €\nPrendsCa: se retira \nNRules82: iguala 0.02 €\n*** FLOP *** [Jh Th 3s]\nNRules82: pasa \nFharock: pasa \nSrLyce: pasa \nFishamanReggae: apuesta 0.08 €\nNRules82: iguala 0.08 €\nFharock: se retira \nSrLyce: se retira \n*** TURN *** [Jh Th 3s] [4h]\nNRules82: pasa \nFishamanReggae: pasa \n*** RIVER *** [Jh Th 3s 4h] [9h]\nNRules82: pasa \nFishamanReggae: pasa \n*** SHOW DOWN ***\nNRules82: muestra [Ts Jc] (doble pareja, jotas y dieces)\nFishamanReggae: muestra [3d 3h] (color, carta alta jota)\nFishamanReggae se lleva 0.31 € del bote \n*** RESUMEN ***\nBote total 0.33 € | Comisión 0.02 € \nComunitarias [Jh Th 3s 4h 9h]\nAsiento 1: PrendsCa (ciega pequeña) se retiró antes del Flop\nAsiento 2: NRules82 (ciega grande) muestra [Ts Jc] y perdió con doble pareja, jotas y dieces\nAsiento 3: JENOFONTE73 se retiró antes del Flop (no apostó)\nAsiento 4: Fharock se retiró en el Flop\nAsiento 5: SrLyce se retiró en el Flop\nAsiento 6: FishamanReggae (botón) muestra [3d 3h] y ganó (0.31 €) con color, carta alta jota"
}