{
  "hand_id": "257148788288",
  "date": "30-07-2025 21:44:03",
  "table": "Sirona",
  "game_type": "holdem",
  "hero": "SrLyce",
  "hero_position": "",
  "hero_cards": [
    "3c",
    "5h"
  ],
  "stacks": {
    "SrLyce": 64.5,
    "lecontrebandier": 95.5,
    "christoph363": 179.0,
    "oliverdu70": 128.5,
    "olibellier": 30.0,
    "Dakoo44": 113.0
  },
  "actions": {
    "preflop": [
      "Asiento 1: SrLyce (1.29 € en fichas)",
      "Asiento 2: lecontrebandier (1.91 € en fichas)",
      "Asiento 3: christoph363 (3.58 € en fichas)",
      "Asiento 4: oliverdu70 (2.57 € en fichas)",
      "Asiento 5: olibellier (0.60 € en fichas)",
      "Asiento 6: Dakoo44 (2.26 € en fichas)",
      "oliverdu70: pone la ciega pequeña 0.01 €",
      "olibellier: pone la ciega grande 0.02 €",
      "Dakoo44: sube 0.03 € a 0.05 €",
      "SrLyce: se retira",
      "lecontrebandier: se retira",
      "christoph363: se retira",
      "oliverdu70: se retira",
      "olibellier: iguala 0.03 €"
    ],
    "flop": [
      "olibellier: pasa",
      "Dakoo44: apuesta 0.04 €",
      "olibellier: se retira",
      "Dakoo44: no muestra su mano",
      "Asiento 1: SrLyce se retiró antes del Flop (no apostó)",
      "Asiento 2: lecontrebandier se retiró antes del Flop (no apostó)",
      "Asiento 3: christoph363 (botón) se retiró antes del Flop (no apostó)",
      "Asiento 4: oliverdu70 (ciega pequeña) se retiró antes del Flop",
      "Asiento 5: olibellier (ciega grande) se retiró en el Flop",
      "Asiento 6: Dakoo44 recaudó (0.10 €)"
    ],
    "turn": [],
    "river": []
  },
  "board": [
    "7c",
    "8d",
    "Kh"
  ],
  "winner": "Dakoo44",
  "win_amount": 5.0,
  "sb": 0.01,
  "bb": 0.02,
  "rake": 0.5,
  "raw_text": "Mano n.º 257148788288 de PokerStars:  Hold'em No Limit (0.01 €/0.02 € EUR) - 30-07-2025 21:44:03 CET [30-07-2025 15:44:03 ET]\nMesa \"Sirona\" 6-max El asiento n.º 3 es el botón\nAsiento 1: SrLyce (1.29 € en fichas) \nAsiento 2: lecontrebandier (1.91 € en fichas) \nAsiento 3: christoph363 (3.58 € en fichas) \nAsiento 4: oliverdu70 (2.57 € en fichas) \nAsiento 5: olibellier (0.60 € en fichas) \nAsiento 6: Dakoo44 (2.26 € en fichas) \noliverdu70: pone la ciega pequeña 0.01 €\nolibellier: pone la ciega grande 0.02 €\n*** CARTAS DE MANO ***\nRepartidas a SrLyce [3c 5h]\nDakoo44: sube 0.03 € a 0.05 €\nSrLyce: se retira \nlecontrebandier: se retira \nchristoph363: se retira \noliverdu70: se retira \nolibellier: iguala 0.03 €\n*** FLOP *** [7c 8d Kh]\nolibellier: pasa \nDakoo44: apuesta 0.04 €\nolibellier: se retira \nLa apuesta no igualada (0.04 €) ha sido devuelta a Dakoo44\nDakoo44 se lleva 0.10 € del bote \nDakoo44: no muestra su mano \n*** RESUMEN ***\nBote total 0.11 € | Comisión 0.01 € \nComunitarias [7c 8d Kh]\nAsiento 1: SrLyce se retiró antes del Flop (no apostó)\nAsiento 2: lecontrebandier se retiró antes del Flop (no apostó)\nAsiento 3: christoph363 (botón) se retiró antes del Flop (no apostó)\nAsiento 4: oliverdu70 (ciega pequeña) se retiró antes del Flop\nAsiento 5: olibellier (ciega grande) se retiró en el Flop\nAsiento 6: Dakoo44 recaudó (0.10 €)"
}