{
  "hand_id": "257238730482",
  "date": "06-08-2025 19:24:18",
  "table": "Adelaide III",
  "game_type": "holdem",
  "hero": "SrLyce",
  "hero_position": "",
  "hero_cards": [
    "Jh",
    "Td"
  ],
  "stacks": {
    "Alceo27": 111.0,
    "aliendee07": 43.0,
    "Macklemore0": 104.0,
    "SrLyce": 132.0,
    "ismagonzalez7": 103.0,
    "McFlash3": 142.0
  },
  "actions": {
    "preflop": [
      "Asiento 1: Alceo27 (2.22 € en fichas)",
      "Asiento 2: aliendee07 (0.86 € en fichas)",
      "Asiento 3: Macklemore0 (2.08 € en fichas)",
      "Asiento 4: SrLyce (2.64 € en fichas)",
      "Asiento 5: ismagonzalez7 (2.06 € en fichas)",
      "Asiento 6: McFlash3 (2.84 € en fichas)",
      "ismagonzalez7: pone la ciega pequeña 0.01 €",
      "McFlash3: pone la ciega grande 0.02 €",
      "Alceo27: sube 0.03 € a 0.05 €",
      "aliendee07: se retira",
      "Macklemore0: sube 0.11 € a 0.16 €",
      "SrLyce: se retira",
      "ismagonzalez7: se retira",
      "McFlash3: iguala 0.14 €",
      "Alceo27: iguala 0.11 €"
    ],
    "flop": [
      "McFlash3: pasa",
      "Alceo27: pasa",
      "Macklemore0: apuesta 0.14 €",
      "McFlash3: iguala 0.14 €",
      "Alceo27: iguala 0.14 €"
    ],
    "turn": [
      "McFlash3: pasa",
      "Alceo27: pasa",
      "Macklemore0: pasa"
    ],
    "river": [
      "McFlash3: pasa",
      "Alceo27: pasa",
      "Macklemore0: apuesta 0.22 €",
      "McFlash3: se retira",
      "Alceo27: se retira",
      "Macklemore0: no muestra su mano",
      "Asiento 1: Alceo27 se retiró en el River",
      "Asiento 2: aliendee07 se retiró antes del Flop (no apostó)",
      "Asiento 3: Macklemore0 recaudó (0.86 €)",
      "Asiento 4: SrLyce (botón) se retiró antes del Flop (no apostó)",
      "Asiento 5: ismagonzalez7 (ciega pequeña) se retiró antes del Flop",
      "Asiento 6: McFlash3 (ciega grande) se retiró en el River"
    ]
  },
  "board": [
    "8s",
    "4s",
    "3h",
    "5h",
    "Kc"
  ],
  "winner": "Macklemore0",
  "win_amount": 43.0,
  "sb": 0.01,
  "bb": 0.02,
  "rake": 2.5,
  "raw_text": "Mano n.º 257238730482 de PokerStars:  Hold'em No Limit (0.01 €/0.02 € EUR) - 06-08-2025 19:24:18 CET [06-08-2025 13:24:18 ET]\nMesa \"Adelaide III\" 6-max El asiento n.º 4 es el botón\nAsiento 1: Alceo27 (2.22 € en fichas) \nAsiento 2: aliendee07 (0.86 € en fichas) \nAsiento 3: Macklemore0 (2.08 € en fichas) \nAsiento 4: SrLyce (2.64 € en fichas) \nAsiento 5: ismagonzalez7 (2.06 € en fichas) \nAsiento 6: McFlash3 (2.84 € en fichas) \nismagonzalez7: pone la ciega pequeña 0.01 €\nMcFlash3: pone la ciega grande 0.02 €\n*** CARTAS DE MANO ***\nRepartidas a SrLyce [Jh Td]\nAlceo27: sube 0.03 € a 0.05 €\naliendee07: se retira \nMacklemore0: sube 0.11 € a 0.16 €\nSrLyce: se retira \nismagonzalez7: se retira \nMcFlash3: iguala 0.14 €\nAlceo27: iguala 0.11 €\n*** FLOP *** [8s 4s 3h]\nMcFlash3: pasa \nAlceo27: pasa \nMacklemore0: apuesta 0.14 €\nMcFlash3: iguala 0.14 €\nAlceo27: iguala 0.14 €\n*** TURN *** [8s 4s 3h] [5h]\nMcFlash3: pasa \nAlceo27: pasa \nMacklemore0: pasa \n*** RIVER *** [8s 4s 3h 5h] [Kc]\nMcFlash3: pasa \nAlceo27: pasa \nMacklemore0: apuesta 0.22 €\nMcFlash3: se retira \nAlceo27: se retira \nLa apuesta no igualada (0.22 €) ha sido devuelta a Macklemore0\nMacklemore0 se lleva 0.86 € del bote \nMacklemore0: no muestra su mano \n*** RESUMEN ***\nBote total 0.91 € | Comisión 0.05 € \nComunitarias [8s 4s 3h 5h Kc]\nAsiento 1: Alceo27 se retiró en el River\nAsiento 2: aliendee07 se retiró antes del Flop (no apostó)\nAsiento 3: Macklemore0 recaudó (0.86 €)\nAsiento 4: SrLyce (botón) se retiró antes del Flop (no apostó)\nAsiento 5: ismagonzalez7 (ciega pequeña) se retiró antes del Flop\nAsiento 6: McFlash3 (ciega grande) se retiró en el River"
}