{
  "hand_id": "257150448843",
  "date": "30-07-2025 23:42:36",
  "table": "Martha",
  "game_type": "holdem",
  "hero": "SrLyce",
  "hero_position": "",
  "hero_cards": [
    "3h",
    "2h"
  ],
  "stacks": {
    "mivipkr": 106.5,
    "NovacaineZxc": 120.0,
    "BudyXXIII": 112.0,
    "Sigiilo": 100.0,
    "SrLyce": 98.0,
    "alexfw300": 100.0
  },
  "actions": {
    "preflop": [
      "Asiento 1: mivipkr (2.13 € en fichas)",
      "Asiento 2: NovacaineZxc (2.40 € en fichas)",
      "Asiento 3: BudyXXIII (2.24 € en fichas)",
      "Asiento 4: Sigiilo (2 € en fichas)",
      "Asiento 5: SrLyce (1.96 € en fichas)",
      "Asiento 6: alexfw300 (2 € en fichas)",
      "mivipkr: pone la ciega pequeña 0.01 €",
      "NovacaineZxc: pone la ciega grande 0.02 €",
      "BudyXXIII: se retira",
      "Sigiilo: sube 0.04 € a 0.06 €",
      "SrLyce: se retira",
      "alexfw300: sube 0.12 € a 0.18 €",
      "mivipkr: se retira",
      "NovacaineZxc: se retira",
      "Sigiilo: se retira",
      "alexfw300: no muestra su mano",
      "Asiento 1: mivipkr (ciega pequeña) se retiró antes del Flop",
      "Asiento 2: NovacaineZxc (ciega grande) se retiró antes del Flop",
      "Asiento 3: BudyXXIII se retiró antes del Flop (no apostó)",
      "Asiento 4: Sigiilo se retiró antes del Flop",
      "Asiento 5: SrLyce se retiró antes del Flop (no apostó)",
      "Asiento 6: alexfw300 (botón) recaudó (0.15 €)"
    ],
    "flop": [],
    "turn": [],
    "river": []
  },
  "board": [],
  "winner": "alexfw300",
  "win_amount": 7.5,
  "sb": 0.01,
  "bb": 0.02,
  "rake": 0.0,
  "raw_text": "Mano n.º 257150448843 de PokerStars:  Hold'em No Limit (0.01 €/0.02 € EUR) - 30-07-2025 23:42:36 CET [30-07-2025 17:42:36 ET]\nMesa \"Martha\" 6-max El asiento n.º 6 es el botón\nAsiento 1: mivipkr (2.13 € en fichas) \nAsiento 2: NovacaineZxc (2.40 € en fichas) \nAsiento 3: BudyXXIII (2.24 € en fichas) \nAsiento 4: Sigiilo (2 € en fichas) \nAsiento 5: SrLyce (1.96 € en fichas) \nAsiento 6: alexfw300 (2 € en fichas) \nmivipkr: pone la ciega pequeña 0.01 €\nNovacaineZxc: pone la ciega grande 0.02 €\n*** CARTAS DE MANO ***\nRepartidas a SrLyce [3h 2h]\nBudyXXIII: se retira \nSigiilo: sube 0.04 € a 0.06 €\nSrLyce: se retira \nalexfw300: sube 0.12 € a 0.18 €\nmivipkr: se retira \nNovacaineZxc: se retira \nSigiilo: se retira \nLa apuesta no igualada (0.12 €) ha sido devuelta a alexfw300\nalexfw300 se lleva 0.15 € del bote \nalexfw300: no muestra su mano \n*** RESUMEN ***\nBote total 0.15 € | Comisión 0 € \nAsiento 1: mivipkr (ciega pequeña) se retiró antes del Flop\nAsiento 2: NovacaineZxc (ciega grande) se retiró antes del Flop\nAsiento 3: BudyXXIII se retiró antes del Flop (no apostó)\nAsiento 4: Sigiilo se retiró antes del Flop\nAsiento 5: SrLyce se retiró antes del Flop (no apostó)\nAsiento 6: alexfw300 (botón) recaudó (0.15 €)"
}