{
  "hand_id": "257238744813",
  "date": "06-08-2025 19:25:29",
  "table": "Leonteus",
  "game_type": "holdem",
  "hero": "SrLyce",
  "hero_position": "",
  "hero_cards": [
    "5c",
    "Th"
  ],
  "stacks": {
    "Andark47": 207.5,
    "practikal_C23": 47.5,
    "niyomalo": 94.5,
    "davinci1962": 154.5,
    "BuXHexter": 163.5,
    "SrLyce": 79.0
  },
  "actions": {
    "preflop": [
      "Asiento 5: Andark47 (4.15 € en fichas) está ausente",
      "Asiento 1: practikal_C23 (0.95 € en fichas)",
      "Asiento 2: niyomalo (1.89 € en fichas)",
      "Asiento 3: davinci1962 (3.09 € en fichas)",
      "Asiento 4: BuXHexter (3.27 € en fichas)",
      "Asiento 6: SrLyce (1.58 € en fichas)",
      "BuXHexter: pone la ciega pequeña 0.01 €",
      "SrLyce: pone la ciega grande 0.02 €",
      "practikal_C23: iguala 0.02 €",
      "niyomalo: se retira",
      "davinci1962: sube 0.03 € a 0.05 €",
      "BuXHexter: se retira",
      "SrLyce: se retira",
      "practikal_C23: iguala 0.03 €"
    ],
    "flop": [
      "practikal_C23: pasa",
      "davinci1962: pasa"
    ],
    "turn": [
      "practikal_C23: apuesta 0.02 €",
      "davinci1962: iguala 0.02 €"
    ],
    "river": [
      "practikal_C23: apuesta 0.04 €",
      "davinci1962: se retira",
      "Asiento 5: Andark47",
      "Asiento 1: practikal_C23 recaudó (0.16 €)",
      "Asiento 2: niyomalo se retiró antes del Flop (no apostó)",
      "Asiento 3: davinci1962 (botón) se retiró en el River",
      "Asiento 4: BuXHexter (ciega pequeña) se retiró antes del Flop",
      "Asiento 6: SrLyce (ciega grande) se retiró antes del Flop"
    ]
  },
  "board": [
    "4h",
    "6c",
    "8c",
    "4s",
    "Qh"
  ],
  "winner": "practikal_C23",
  "win_amount": 8.0,
  "sb": 0.01,
  "bb": 0.02,
  "rake": 0.5,
  "raw_text": "Mano n.º 257238744813 de PokerStars:  Hold'em No Limit (0.01 €/0.02 € EUR) - 06-08-2025 19:25:29 CET [06-08-2025 13:25:29 ET]\nMesa \"Leonteus\" 6-max El asiento n.º 3 es el botón\nAsiento 5: Andark47 (4.15 € en fichas) está ausente\nAsiento 1: practikal_C23 (0.95 € en fichas) \nAsiento 2: niyomalo (1.89 € en fichas) \nAsiento 3: davinci1962 (3.09 € en fichas) \nAsiento 4: BuXHexter (3.27 € en fichas) \nAsiento 6: SrLyce (1.58 € en fichas) \nBuXHexter: pone la ciega pequeña 0.01 €\nSrLyce: pone la ciega grande 0.02 €\n*** CARTAS DE MANO ***\nRepartidas a SrLyce [5c Th]\npractikal_C23: iguala 0.02 €\nniyomalo: se retira \ndavinci1962: sube 0.03 € a 0.05 €\nBuXHexter: se retira \nSrLyce: se retira \npractikal_C23: iguala 0.03 €\n*** FLOP *** [4h 6c 8c]\npractikal_C23: pasa \ndavinci1962: pasa \n*** TURN *** [4h 6c 8c] [4s]\npractikal_C23: apuesta 0.02 €\ndavinci1962: iguala 0.02 €\n*** RIVER *** [4h 6c 8c 4s] [Qh]\npractikal_C23: apuesta 0.04 €\ndavinci1962: se retira \nLa apuesta no igualada (0.04 €) ha sido devuelta a practikal_C23\npractikal_C23 se lleva 0.16 € del bote \n*** RESUMEN ***\nBote total 0.17 € | Comisión 0.01 € \nComunitarias [4h 6c 8c 4s Qh]\nAsiento 5: Andark47\nAsiento 1: practikal_C23 recaudó (0.16 €)\nAsiento 2: niyomalo se retiró antes del Flop (no apostó)\nAsiento 3: davinci1962 (botón) se retiró en el River\nAsiento 4: BuXHexter (ciega pequeña) se retiró antes del Flop\nAsiento 6: SrLyce (ciega grande) se retiró antes del Flop"
}