{
  "hand_id": "257238723106",
  "date": "06-08-2025 19:23:41",
  "table": "Herculina II",
  "game_type": "holdem",
  "hero": "SrLyce",
  "hero_position": "",
  "hero_cards": [
    "Ac",
    "Kh"
  ],
  "stacks": {
    "Alceo27": 120.5,
    "David98X": 153.0,
    "JJer11": 192.0,
    "SrLyce": 134.5,
    "Macklemore0": 104.0,
    "ScarvBlack": 100.0
  },
  "actions": {
    "preflop": [
      "Asiento 1: Alceo27 (2.41 € en fichas)",
      "Asiento 2: David98X (3.06 € en fichas)",
      "Asiento 3: JJer11 (3.84 € en fichas)",
      "Asiento 4: SrLyce (2.69 € en fichas)",
      "Asiento 5: Macklemore0 (2.08 € en fichas)",
      "Asiento 6: ScarvBlack (2 € en fichas)",
      "David98X: pone la ciega pequeña 0.01 €",
      "JJer11: pone la ciega grande 0.02 €",
      "SrLyce: sube 0.03 € a 0.05 €",
      "Macklemore0: se retira",
      "ScarvBlack: se retira",
      "Alceo27: se retira",
      "David98X: sube 0.15 € a 0.20 €",
      "JJer11: se retira",
      "SrLyce: iguala 0.15 €"
    ],
    "flop": [
      "David98X: pasa",
      "SrLyce: apuesta 0.16 €",
      "David98X: se retira",
      "SrLyce: no muestra su mano",
      "Asiento 1: Alceo27 (botón) se retiró antes del Flop (no apostó)",
      "Asiento 2: David98X (ciega pequeña) se retiró en el Flop",
      "Asiento 3: JJer11 (ciega grande) se retiró antes del Flop",
      "Asiento 4: SrLyce recaudó (0.39 €)",
      "Asiento 5: Macklemore0 se retiró antes del Flop (no apostó)",
      "Asiento 6: ScarvBlack se retiró antes del Flop (no apostó)"
    ],
    "turn": [],
    "river": []
  },
  "board": [
    "Kc",
    "5h",
    "7d"
  ],
  "winner": "SrLyce",
  "win_amount": 19.5,
  "sb": 0.01,
  "bb": 0.02,
  "rake": 1.5,
  "raw_text": "Mano n.º 257238723106 de PokerStars:  Hold'em No Limit (0.01 €/0.02 € EUR) - 06-08-2025 19:23:41 CET [06-08-2025 13:23:41 ET]\nMesa \"Herculina II\" 6-max El asiento n.º 1 es el botón\nAsiento 1: Alceo27 (2.41 € en fichas) \nAsiento 2: David98X (3.06 € en fichas) \nAsiento 3: JJer11 (3.84 € en fichas) \nAsiento 4: SrLyce (2.69 € en fichas) \nAsiento 5: Macklemore0 (2.08 € en fichas) \nAsiento 6: ScarvBlack (2 € en fichas) \nDavid98X: pone la ciega pequeña 0.01 €\nJJer11: pone la ciega grande 0.02 €\n*** CARTAS DE MANO ***\nRepartidas a SrLyce [Ac Kh]\nSrLyce: sube 0.03 € a 0.05 €\nMacklemore0: se retira \nScarvBlack: se retira \nAlceo27: se retira \nDavid98X: sube 0.15 € a 0.20 €\nJJer11: se retira \nSrLyce: iguala 0.15 €\n*** FLOP *** [Kc 5h 7d]\nDavid98X: pasa \nSrLyce: apuesta 0.16 €\nDavid98X: se retira \nLa apuesta no igualada (0.16 €) ha sido devuelta a SrLyce\nSrLyce se lleva 0.39 € del bote \nSrLyce: no muestra su mano \n*** RESUMEN ***\nBote total 0.42 € | Comisión 0.03 € \nComunitarias [Kc 5h 7d]\nAsiento 1: Alceo27 (botón) se retiró antes del Flop (no apostó)\nAsiento 2: David98X (ciega pequeña) se retiró en el Flop\nAsiento 3: JJer11 (ciega grande) se retiró antes del Flop\nAsiento 4: SrLyce recaudó (0.39 €)\nAsiento 5: Macklemore0 se retiró antes del Flop (no apostó)\nAsiento 6: ScarvBlack se retiró antes del Flop (no apostó)"
}