{
  "hand_id": "257215086089",
  "date": "04-08-2025 22:23:30",
  "table": "Anneliese II",
  "game_type": "holdem",
  "hero": "SrLyce",
  "hero_position": "",
  "hero_cards": [
    "7h",
    "Tc"
  ],
  "stacks": {
    "betterrrrrr": 101.0,
    "piropanzer": 53.5,
    "ElManu62": 114.5,
    "SrLyce": 97.5,
    "Mr_Pkr98": 137.5,
    "Spotick": 116.5
  },
  "actions": {
    "preflop": [
      "Asiento 1: betterrrrrr (2.02 € en fichas)",
      "Asiento 2: piropanzer (1.07 € en fichas)",
      "Asiento 3: ElManu62 (2.29 € en fichas)",
      "Asiento 4: SrLyce (1.95 € en fichas)",
      "Asiento 5: Mr_Pkr98 (2.75 € en fichas)",
      "Asiento 6: Spotick (2.33 € en fichas)",
      "SrLyce: pone la ciega pequeña 0.01 €",
      "Mr_Pkr98: pone la ciega grande 0.02 €",
      "Spotick: se retira",
      "betterrrrrr: se retira",
      "piropanzer: se retira",
      "ElManu62: se retira",
      "SrLyce: sube 0.04 € a 0.06 €",
      "Mr_Pkr98: se retira",
      "SrLyce: no muestra su mano",
      "Asiento 1: betterrrrrr se retiró antes del Flop (no apostó)",
      "Asiento 2: piropanzer se retiró antes del Flop (no apostó)",
      "Asiento 3: ElManu62 (botón) se retiró antes del Flop (no apostó)",
      "Asiento 4: SrLyce (ciega pequeña) recaudó (0.04 €)",
      "Asiento 5: Mr_Pkr98 (ciega grande) se retiró antes del Flop",
      "Asiento 6: Spotick se retiró antes del Flop (no apostó)"
    ],
    "flop": [],
    "turn": [],
    "river": []
  },
  "board": [],
  "winner": "SrLyce",
  "win_amount": 2.0,
  "sb": 0.01,
  "bb": 0.02,
  "rake": 0.0,
  "raw_text": "Mano n.º 257215086089 de PokerStars:  Hold'em No Limit (0.01 €/0.02 € EUR) - 04-08-2025 22:23:30 CET [04-08-2025 16:23:30 ET]\nMesa \"Anneliese II\" 6-max El asiento n.º 3 es el botón\nAsiento 1: betterrrrrr (2.02 € en fichas) \nAsiento 2: piropanzer (1.07 € en fichas) \nAsiento 3: ElManu62 (2.29 € en fichas) \nAsiento 4: SrLyce (1.95 € en fichas) \nAsiento 5: Mr_Pkr98 (2.75 € en fichas) \nAsiento 6: Spotick (2.33 € en fichas) \nSrLyce: pone la ciega pequeña 0.01 €\nMr_Pkr98: pone la ciega grande 0.02 €\n*** CARTAS DE MANO ***\nRepartidas a SrLyce [7h Tc]\nSpotick: se retira \nbetterrrrrr: se retira \npiropanzer: se retira \nElManu62 ha agotado su tiempo\nElManu62: se retira \nSrLyce: sube 0.04 € a 0.06 €\nMr_Pkr98: se retira \nLa apuesta no igualada (0.04 €) ha sido devuelta a SrLyce\nSrLyce se lleva 0.04 € del bote \nSrLyce: no muestra su mano \n*** RESUMEN ***\nBote total 0.04 € | Comisión 0 € \nAsiento 1: betterrrrrr se retiró antes del Flop (no apostó)\nAsiento 2: piropanzer se retiró antes del Flop (no apostó)\nAsiento 3: ElManu62 (botón) se retiró antes del Flop (no apostó)\nAsiento 4: SrLyce (ciega pequeña) recaudó (0.04 €)\nAsiento 5: Mr_Pkr98 (ciega grande) se retiró antes del Flop\nAsiento 6: Spotick se retiró antes del Flop (no apostó)"
}