{
  "hand_id": "257237778793",
  "date": "06-08-2025 17:57:41",
  "table": "Atreus",
  "game_type": "holdem",
  "hero": "SrLyce",
  "hero_position": "",
  "hero_cards": [
    "3c",
    "8s"
  ],
  "stacks": {
    "PrendsCa": 107.0,
    "NRules82": 80.0,
    "JENOFONTE73": 132.5,
    "JGDOBLAS": 96.0,
    "SrLyce": 105.5
  },
  "actions": {
    "preflop": [
      "Asiento 1: PrendsCa (2.14 € en fichas)",
      "Asiento 2: NRules82 (1.60 € en fichas)",
      "Asiento 3: JENOFONTE73 (2.65 € en fichas)",
      "Asiento 4: JGDOBLAS (1.92 € en fichas)",
      "Asiento 5: SrLyce (2.11 € en fichas)",
      "PrendsCa: pone la ciega pequeña 0.01 €",
      "NRules82: pone la ciega grande 0.02 €",
      "JENOFONTE73: se retira",
      "JGDOBLAS: sube 0.03 € a 0.05 €",
      "SrLyce: se retira",
      "PrendsCa: se retira",
      "NRules82: iguala 0.03 €"
    ],
    "flop": [
      "NRules82: pasa",
      "JGDOBLAS: pasa"
    ],
    "turn": [
      "NRules82: apuesta 0.02 €",
      "JGDOBLAS: se retira",
      "Asiento 1: PrendsCa (ciega pequeña) se retiró antes del Flop",
      "Asiento 2: NRules82 (ciega grande) recaudó (0.10 €)",
      "Asiento 3: JENOFONTE73 se retiró antes del Flop (no apostó)",
      "Asiento 4: JGDOBLAS se retiró en el Turn",
      "Asiento 5: SrLyce (botón) se retiró antes del Flop (no apostó)"
    ],
    "river": []
  },
  "board": [
    "4s",
    "3h",
    "7h",
    "6h"
  ],
  "winner": "NRules82",
  "win_amount": 5.0,
  "sb": 0.01,
  "bb": 0.02,
  "rake": 0.5,
  "raw_text": "Mano n.º 257237778793 de PokerStars:  Hold'em No Limit (0.01 €/0.02 € EUR) - 06-08-2025 17:57:41 CET [06-08-2025 11:57:41 ET]\nMesa \"Atreus\" 6-max El asiento n.º 5 es el botón\nAsiento 1: PrendsCa (2.14 € en fichas) \nAsiento 2: NRules82 (1.60 € en fichas) \nAsiento 3: JENOFONTE73 (2.65 € en fichas) \nAsiento 4: JGDOBLAS (1.92 € en fichas) \nAsiento 5: SrLyce (2.11 € en fichas) \nPrendsCa: pone la ciega pequeña 0.01 €\nNRules82: pone la ciega grande 0.02 €\n*** CARTAS DE MANO ***\nRepartidas a SrLyce [3c 8s]\nJENOFONTE73: se retira \nJGDOBLAS: sube 0.03 € a 0.05 €\nSrLyce: se retira \nPrendsCa: se retira \nNRules82: iguala 0.03 €\n*** FLOP *** [4s 3h 7h]\nNRules82: pasa \nJGDOBLAS: pasa \n*** TURN *** [4s 3h 7h] [6h]\nNRules82: apuesta 0.02 €\nJGDOBLAS: se retira \nLa apuesta no igualada (0.02 €) ha sido devuelta a NRules82\nNRules82 se lleva 0.10 € del bote \n*** RESUMEN ***\nBote total 0.11 € | Comisión 0.01 € \nComunitarias [4s 3h 7h 6h]\nAsiento 1: PrendsCa (ciega pequeña) se retiró antes del Flop\nAsiento 2: NRules82 (ciega grande) recaudó (0.10 €)\nAsiento 3: JENOFONTE73 se retiró antes del Flop (no apostó)\nAsiento 4: JGDOBLAS se retiró en el Turn\nAsiento 5: SrLyce (botón) se retiró antes del Flop (no apostó)"
}