{
  "hand_id": "257149255279",
  "date": "30-07-2025 22:18:58",
  "table": "Leverrier",
  "game_type": "holdem",
  "hero": "SrLyce",
  "hero_position": "",
  "hero_cards": [
    "4d",
    "Kc"
  ],
  "stacks": {
    "adrian15540": 93.0,
    "SrLyce": 99.5,
    "igonpar": 97.5,
    "futur64": 95.5,
    "denkweise": 102.0,
    "NaruchoH1": 115.5
  },
  "actions": {
    "preflop": [
      "Asiento 1: adrian15540 (1.86 € en fichas)",
      "Asiento 2: SrLyce (1.99 € en fichas)",
      "Asiento 3: igonpar (1.95 € en fichas)",
      "Asiento 4: futur64 (1.91 € en fichas)",
      "Asiento 5: denkweise (2.04 € en fichas)",
      "Asiento 6: NaruchoH1 (2.31 € en fichas)",
      "futur64: pone la ciega pequeña 0.01 €",
      "denkweise: pone la ciega grande 0.02 €",
      "NaruchoH1: sube 0.04 € a 0.06 €",
      "adrian15540: iguala 0.06 €",
      "SrLyce: se retira",
      "igonpar: se retira",
      "futur64: se retira",
      "denkweise: se retira"
    ],
    "flop": [
      "NaruchoH1: apuesta 0.05 €",
      "adrian15540: iguala 0.05 €"
    ],
    "turn": [
      "NaruchoH1: apuesta 0.12 €",
      "adrian15540: se retira",
      "NaruchoH1: no muestra su mano",
      "Asiento 1: adrian15540 se retiró en el Turn",
      "Asiento 2: SrLyce se retiró antes del Flop (no apostó)",
      "Asiento 3: igonpar (botón) se retiró antes del Flop (no apostó)",
      "Asiento 4: futur64 (ciega pequeña) se retiró antes del Flop",
      "Asiento 5: denkweise (ciega grande) se retiró antes del Flop",
      "Asiento 6: NaruchoH1 recaudó (0.23 €)"
    ],
    "river": []
  },
  "board": [
    "Qd",
    "4s",
    "9d",
    "Td"
  ],
  "winner": "NaruchoH1",
  "win_amount": 11.5,
  "sb": 0.01,
  "bb": 0.02,
  "rake": 1.0,
  "raw_text": "Mano n.º 257149255279 de PokerStars:  Hold'em No Limit (0.01 €/0.02 € EUR) - 30-07-2025 22:18:58 CET [30-07-2025 16:18:58 ET]\nMesa \"Leverrier\" 6-max El asiento n.º 3 es el botón\nAsiento 1: adrian15540 (1.86 € en fichas) \nAsiento 2: SrLyce (1.99 € en fichas) \nAsiento 3: igonpar (1.95 € en fichas) \nAsiento 4: futur64 (1.91 € en fichas) \nAsiento 5: denkweise (2.04 € en fichas) \nAsiento 6: NaruchoH1 (2.31 € en fichas) \nfutur64: pone la ciega pequeña 0.01 €\ndenkweise: pone la ciega grande 0.02 €\n*** CARTAS DE MANO ***\nRepartidas a SrLyce [4d Kc]\nNaruchoH1: sube 0.04 € a 0.06 €\nadrian15540: iguala 0.06 €\nSrLyce: se retira \nigonpar: se retira \nfutur64: se retira \ndenkweise: se retira \n*** FLOP *** [Qd 4s 9d]\nNaruchoH1: apuesta 0.05 €\nadrian15540: iguala 0.05 €\n*** TURN *** [Qd 4s 9d] [Td]\nNaruchoH1: apuesta 0.12 €\nadrian15540: se retira \nLa apuesta no igualada (0.12 €) ha sido devuelta a NaruchoH1\nNaruchoH1 se lleva 0.23 € del bote \nNaruchoH1: no muestra su mano \n*** RESUMEN ***\nBote total 0.25 € | Comisión 0.02 € \nComunitarias [Qd 4s 9d Td]\nAsiento 1: adrian15540 se retiró en el Turn\nAsiento 2: SrLyce se retiró antes del Flop (no apostó)\nAsiento 3: igonpar (botón) se retiró antes del Flop (no apostó)\nAsiento 4: futur64 (ciega pequeña) se retiró antes del Flop\nAsiento 5: denkweise (ciega grande) se retiró antes del Flop\nAsiento 6: NaruchoH1 recaudó (0.23 €)"
}