{
  "hand_id": "257238696410",
  "date": "06-08-2025 19:21:27",
  "table": "Leonteus",
  "game_type": "holdem",
  "hero": "SrLyce",
  "hero_position": "",
  "hero_cards": [
    "Ts",
    "3s"
  ],
  "stacks": {
    "practikal_C23": 46.0,
    "niyomalo": 96.0,
    "davinci1962": 156.0,
    "BuXHexter": 153.0,
    "Andark47": 204.0,
    "SrLyce": 94.0
  },
  "actions": {
    "preflop": [
      "Asiento 1: practikal_C23 (0.92 € en fichas)",
      "Asiento 2: niyomalo (1.92 € en fichas)",
      "Asiento 3: davinci1962 (3.12 € en fichas)",
      "Asiento 4: BuXHexter (3.06 € en fichas)",
      "Asiento 5: Andark47 (4.08 € en fichas)",
      "Asiento 6: SrLyce (1.88 € en fichas)",
      "BuXHexter: pone la ciega pequeña 0.01 €",
      "Andark47: pone la ciega grande 0.02 €",
      "SrLyce: se retira",
      "practikal_C23: iguala 0.02 €",
      "niyomalo: se retira",
      "davinci1962: se retira",
      "BuXHexter: sube 0.06 € a 0.08 €",
      "Andark47: se retira",
      "practikal_C23: se retira",
      "BuXHexter: no muestra su mano",
      "Asiento 1: practikal_C23 se retiró antes del Flop",
      "Asiento 2: niyomalo se retiró antes del Flop (no apostó)",
      "Asiento 3: davinci1962 (botón) se retiró antes del Flop (no apostó)",
      "Asiento 4: BuXHexter (ciega pequeña) recaudó (0.06 €)",
      "Asiento 5: Andark47 (ciega grande) se retiró antes del Flop",
      "Asiento 6: SrLyce se retiró antes del Flop (no apostó)"
    ],
    "flop": [],
    "turn": [],
    "river": []
  },
  "board": [],
  "winner": "BuXHexter",
  "win_amount": 3.0,
  "sb": 0.01,
  "bb": 0.02,
  "rake": 0.0,
  "raw_text": "Mano n.º 257238696410 de PokerStars:  Hold'em No Limit (0.01 €/0.02 € EUR) - 06-08-2025 19:21:27 CET [06-08-2025 13:21:27 ET]\nMesa \"Leonteus\" 6-max El asiento n.º 3 es el botón\nAsiento 1: practikal_C23 (0.92 € en fichas) \nAsiento 2: niyomalo (1.92 € en fichas) \nAsiento 3: davinci1962 (3.12 € en fichas) \nAsiento 4: BuXHexter (3.06 € en fichas) \nAsiento 5: Andark47 (4.08 € en fichas) \nAsiento 6: SrLyce (1.88 € en fichas) \nBuXHexter: pone la ciega pequeña 0.01 €\nAndark47: pone la ciega grande 0.02 €\n*** CARTAS DE MANO ***\nRepartidas a SrLyce [Ts 3s]\nSrLyce: se retira \npractikal_C23: iguala 0.02 €\nniyomalo: se retira \ndavinci1962: se retira \nBuXHexter: sube 0.06 € a 0.08 €\nAndark47: se retira \npractikal_C23: se retira \nLa apuesta no igualada (0.06 €) ha sido devuelta a BuXHexter\nBuXHexter se lleva 0.06 € del bote \nBuXHexter: no muestra su mano \n*** RESUMEN ***\nBote total 0.06 € | Comisión 0 € \nAsiento 1: practikal_C23 se retiró antes del Flop\nAsiento 2: niyomalo se retiró antes del Flop (no apostó)\nAsiento 3: davinci1962 (botón) se retiró antes del Flop (no apostó)\nAsiento 4: BuXHexter (ciega pequeña) recaudó (0.06 €)\nAsiento 5: Andark47 (ciega grande) se retiró antes del Flop\nAsiento 6: SrLyce se retiró antes del Flop (no apostó)"
}