{
  "hand_id": "257238349053",
  "date": "06-08-2025 18:50:04",
  "table": "Adelaide III",
  "game_type": "holdem",
  "hero": "SrLyce",
  "hero_position": "",
  "hero_cards": [
    "Td",
    "5s"
  ],
  "stacks": {
    "YopopMTG": 100.0,
    "N3xtTIm35": 100.5,
    "aliendee07": 52.5,
    "Ischadia": 96.0,
    "SrLyce": 102.5,
    "ismagonzalez7": 82.0
  },
  "actions": {
    "preflop": [
      "Asiento 6: YopopMTG (2 € en fichas) está ausente",
      "Asiento 1: N3xtTIm35 (2.01 € en fichas)",
      "Asiento 2: aliendee07 (1.05 € en fichas)",
      "Asiento 3: Ischadia (1.92 € en fichas)",
      "Asiento 4: SrLyce (2.05 € en fichas)",
      "Asiento 5: ismagonzalez7 (1.64 € en fichas)",
      "SrLyce: pone la ciega pequeña 0.01 €",
      "ismagonzalez7: pone la ciega grande 0.02 €",
      "YopopMTG: se ausenta",
      "N3xtTIm35: se retira",
      "aliendee07: iguala 0.02 €",
      "Ischadia: se retira",
      "SrLyce: iguala 0.01 €",
      "ismagonzalez7: pasa"
    ],
    "flop": [
      "SrLyce: pasa",
      "ismagonzalez7: apuesta 0.03 €",
      "aliendee07: se retira",
      "SrLyce: iguala 0.03 €"
    ],
    "turn": [
      "SrLyce: pasa",
      "ismagonzalez7: apuesta 0.06 €",
      "SrLyce: se retira",
      "ismagonzalez7: no muestra su mano",
      "Asiento 6: YopopMTG",
      "Asiento 1: N3xtTIm35 se retiró antes del Flop (no apostó)",
      "Asiento 2: aliendee07 se retiró en el Flop",
      "Asiento 3: Ischadia (botón) se retiró antes del Flop (no apostó)",
      "Asiento 4: SrLyce (ciega pequeña) se retiró en el Turn",
      "Asiento 5: ismagonzalez7 (ciega grande) recaudó (0.11 €)"
    ],
    "river": []
  },
  "board": [
    "3c",
    "5d",
    "6c",
    "4h"
  ],
  "winner": "ismagonzalez7",
  "win_amount": 5.5,
  "sb": 0.01,
  "bb": 0.02,
  "rake": 0.5,
  "raw_text": "Mano n.º 257238349053 de PokerStars:  Hold'em No Limit (0.01 €/0.02 € EUR) - 06-08-2025 18:50:04 CET [06-08-2025 12:50:04 ET]\nMesa \"Adelaide III\" 6-max El asiento n.º 3 es el botón\nAsiento 6: YopopMTG (2 € en fichas) está ausente\nAsiento 1: N3xtTIm35 (2.01 € en fichas) \nAsiento 2: aliendee07 (1.05 € en fichas) \nAsiento 3: Ischadia (1.92 € en fichas) \nAsiento 4: SrLyce (2.05 € en fichas) \nAsiento 5: ismagonzalez7 (1.64 € en fichas) \nSrLyce: pone la ciega pequeña 0.01 €\nismagonzalez7: pone la ciega grande 0.02 €\nYopopMTG: se ausenta \n*** CARTAS DE MANO ***\nRepartidas a SrLyce [Td 5s]\nYopopMTG no tiene conexión \nYopopMTG deja la mesa\nN3xtTIm35: se retira \naliendee07: iguala 0.02 €\nIschadia: se retira \nSrLyce: iguala 0.01 €\nismagonzalez7: pasa \n*** FLOP *** [3c 5d 6c]\nSrLyce: pasa \nismagonzalez7: apuesta 0.03 €\naliendee07: se retira \nSrLyce: iguala 0.03 €\n*** TURN *** [3c 5d 6c] [4h]\nSrLyce: pasa \nismagonzalez7: apuesta 0.06 €\nSrLyce: se retira \nLa apuesta no igualada (0.06 €) ha sido devuelta a ismagonzalez7\nismagonzalez7 se lleva 0.11 € del bote \nismagonzalez7: no muestra su mano \n*** RESUMEN ***\nBote total 0.12 € | Comisión 0.01 € \nComunitarias [3c 5d 6c 4h]\nAsiento 6: YopopMTG\nAsiento 1: N3xtTIm35 se retiró antes del Flop (no apostó)\nAsiento 2: aliendee07 se retiró en el Flop\nAsiento 3: Ischadia (botón) se retiró antes del Flop (no apostó)\nAsiento 4: SrLyce (ciega pequeña) se retiró en el Turn\nAsiento 5: ismagonzalez7 (ciega grande) recaudó (0.11 €)"
}