{
  "hand_id": "257237569116",
  "date": "06-08-2025 17:36:54",
  "table": "Vanadis II",
  "game_type": "holdem",
  "hero": "SrLyce",
  "hero_position": "",
  "hero_cards": [
    "Ad",
    "3h"
  ],
  "stacks": {
    "SrLyce": 100.5,
    "djrojas9": 98.5,
    "noreihh": 172.5,
    "chordewman": 110.0,
    "sarabiagar": 97.0,
    "idigon": 146.5
  },
  "actions": {
    "preflop": [
      "Asiento 1: SrLyce (2.01 € en fichas)",
      "Asiento 2: djrojas9 (1.97 € en fichas)",
      "Asiento 3: noreihh (3.45 € en fichas)",
      "Asiento 4: chordewman (2.20 € en fichas)",
      "Asiento 5: sarabiagar (1.94 € en fichas)",
      "Asiento 6: idigon (2.93 € en fichas)",
      "sarabiagar: pone la ciega pequeña 0.01 €",
      "idigon: pone la ciega grande 0.02 €",
      "SrLyce: iguala 0.02 €",
      "djrojas9: se retira",
      "noreihh: se retira",
      "chordewman: sube 0.08 € a 0.10 €",
      "sarabiagar: se retira",
      "idigon: se retira",
      "SrLyce: iguala 0.08 €"
    ],
    "flop": [
      "SrLyce: pasa",
      "chordewman: pasa"
    ],
    "turn": [
      "SrLyce: apuesta 0.07 €",
      "chordewman: iguala 0.07 €"
    ],
    "river": [
      "SrLyce: apuesta 0.18 €",
      "chordewman: iguala 0.18 €",
      "SrLyce: muestra [Ad 3h] (doble pareja, dieces y treses)",
      "chordewman: muestra [Qd Jh] (doble pareja, damas y dieces)",
      "Asiento 1: SrLyce muestra [Ad 3h] y perdió con doble pareja, dieces y treses",
      "Asiento 2: djrojas9 se retiró antes del Flop (no apostó)",
      "Asiento 3: noreihh se retiró antes del Flop (no apostó)",
      "Asiento 4: chordewman (botón) muestra [Qd Jh] y ganó (0.69 €) con doble pareja, damas y dieces",
      "Asiento 5: sarabiagar (ciega pequeña) se retiró antes del Flop",
      "Asiento 6: idigon (ciega grande) se retiró antes del Flop"
    ]
  },
  "board": [
    "2d",
    "Td",
    "3c",
    "Qs",
    "Ts"
  ],
  "winner": "chordewman",
  "win_amount": 34.5,
  "sb": 0.01,
  "bb": 0.02,
  "rake": 2.0,
  "raw_text": "Mano n.º 257237569116 de PokerStars:  Hold'em No Limit (0.01 €/0.02 € EUR) - 06-08-2025 17:36:54 CET [06-08-2025 11:36:54 ET]\nMesa \"Vanadis II\" 6-max El asiento n.º 4 es el botón\nAsiento 1: SrLyce (2.01 € en fichas) \nAsiento 2: djrojas9 (1.97 € en fichas) \nAsiento 3: noreihh (3.45 € en fichas) \nAsiento 4: chordewman (2.20 € en fichas) \nAsiento 5: sarabiagar (1.94 € en fichas) \nAsiento 6: idigon (2.93 € en fichas) \nsarabiagar: pone la ciega pequeña 0.01 €\nidigon: pone la ciega grande 0.02 €\n*** CARTAS DE MANO ***\nRepartidas a SrLyce [Ad 3h]\nSrLyce: iguala 0.02 €\ndjrojas9: se retira \nnoreihh: se retira \nchordewman: sube 0.08 € a 0.10 €\nsarabiagar: se retira \nidigon: se retira \nSrLyce: iguala 0.08 €\n*** FLOP *** [2d Td 3c]\nSrLyce: pasa \nchordewman: pasa \n*** TURN *** [2d Td 3c] [Qs]\nSrLyce: apuesta 0.07 €\nchordewman: iguala 0.07 €\n*** RIVER *** [2d Td 3c Qs] [Ts]\nSrLyce: apuesta 0.18 €\nchordewman: iguala 0.18 €\n*** SHOW DOWN ***\nSrLyce: muestra [Ad 3h] (doble pareja, dieces y treses)\nchordewman: muestra [Qd Jh] (doble pareja, damas y dieces)\nchordewman se lleva 0.69 € del bote \n*** RESUMEN ***\nBote total 0.73 € | Comisión 0.04 € \nComunitarias [2d Td 3c Qs Ts]\nAsiento 1: SrLyce muestra [Ad 3h] y perdió con doble pareja, dieces y treses\nAsiento 2: djrojas9 se retiró antes del Flop (no apostó)\nAsiento 3: noreihh se retiró antes del Flop (no apostó)\nAsiento 4: chordewman (botón) muestra [Qd Jh] y ganó (0.69 €) con doble pareja, damas y dieces\nAsiento 5: sarabiagar (ciega pequeña) se retiró antes del Flop\nAsiento 6: idigon (ciega grande) se retiró antes del Flop"
}