{
  "hand_id": "257150445574",
  "date": "30-07-2025 23:42:22",
  "table": "Martha",
  "game_type": "holdem",
  "hero": "SrLyce",
  "hero_position": "",
  "hero_cards": [
    "7c",
    "4d"
  ],
  "stacks": {
    "mivipkr": 107.5,
    "NovacaineZxc": 118.5,
    "BudyXXIII": 112.0,
    "Sigiilo": 100.0,
    "SrLyce": 98.0,
    "alexfw300": 100.0
  },
  "actions": {
    "preflop": [
      "Asiento 1: mivipkr (2.15 € en fichas)",
      "Asiento 2: NovacaineZxc (2.37 € en fichas)",
      "Asiento 3: BudyXXIII (2.24 € en fichas)",
      "Asiento 4: Sigiilo (2 € en fichas)",
      "Asiento 5: SrLyce (1.96 € en fichas)",
      "Asiento 6: alexfw300 (2 € en fichas)",
      "alexfw300: pone la ciega pequeña 0.01 €",
      "mivipkr: pone la ciega grande 0.02 €",
      "NovacaineZxc: sube 0.02 € a 0.04 €",
      "BudyXXIII: se retira",
      "Sigiilo: se retira",
      "SrLyce: se retira",
      "alexfw300: se retira",
      "mivipkr: se retira",
      "NovacaineZxc: no muestra su mano",
      "Asiento 1: mivipkr (ciega grande) se retiró antes del Flop",
      "Asiento 2: NovacaineZxc recaudó (0.05 €)",
      "Asiento 3: BudyXXIII se retiró antes del Flop (no apostó)",
      "Asiento 4: Sigiilo se retiró antes del Flop (no apostó)",
      "Asiento 5: SrLyce (botón) se retiró antes del Flop (no apostó)",
      "Asiento 6: alexfw300 (ciega pequeña) se retiró antes del Flop"
    ],
    "flop": [],
    "turn": [],
    "river": []
  },
  "board": [],
  "winner": "NovacaineZxc",
  "win_amount": 2.5,
  "sb": 0.01,
  "bb": 0.02,
  "rake": 0.0,
  "raw_text": "Mano n.º 257150445574 de PokerStars:  Hold'em No Limit (0.01 €/0.02 € EUR) - 30-07-2025 23:42:22 CET [30-07-2025 17:42:22 ET]\nMesa \"Martha\" 6-max El asiento n.º 5 es el botón\nAsiento 1: mivipkr (2.15 € en fichas) \nAsiento 2: NovacaineZxc (2.37 € en fichas) \nAsiento 3: BudyXXIII (2.24 € en fichas) \nAsiento 4: Sigiilo (2 € en fichas) \nAsiento 5: SrLyce (1.96 € en fichas) \nAsiento 6: alexfw300 (2 € en fichas) \nalexfw300: pone la ciega pequeña 0.01 €\nmivipkr: pone la ciega grande 0.02 €\n*** CARTAS DE MANO ***\nRepartidas a SrLyce [7c 4d]\nNovacaineZxc: sube 0.02 € a 0.04 €\nBudyXXIII: se retira \nSigiilo: se retira \nSrLyce: se retira \nalexfw300: se retira \nmivipkr: se retira \nLa apuesta no igualada (0.02 €) ha sido devuelta a NovacaineZxc\nNovacaineZxc se lleva 0.05 € del bote \nNovacaineZxc: no muestra su mano \n*** RESUMEN ***\nBote total 0.05 € | Comisión 0 € \nAsiento 1: mivipkr (ciega grande) se retiró antes del Flop\nAsiento 2: NovacaineZxc recaudó (0.05 €)\nAsiento 3: BudyXXIII se retiró antes del Flop (no apostó)\nAsiento 4: Sigiilo se retiró antes del Flop (no apostó)\nAsiento 5: SrLyce (botón) se retiró antes del Flop (no apostó)\nAsiento 6: alexfw300 (ciega pequeña) se retiró antes del Flop"
}