{
  "hand_id": "257150426182",
  "date": "30-07-2025 23:40:59",
  "table": "Mizuho",
  "game_type": "holdem",
  "hero": "SrLyce",
  "hero_position": "",
  "hero_cards": [
    "4h",
    "5h"
  ],
  "stacks": {
    "benipoker123": 109.5,
    "SrLyce": 99.0,
    "JstLeonel": 130.0,
    "Ozzy3110": 238.5,
    "toonsy2010": 136.5,
    "mivipkr": 166.5
  },
  "actions": {
    "preflop": [
      "Asiento 1: benipoker123 (2.19 € en fichas)",
      "Asiento 2: SrLyce (1.98 € en fichas)",
      "Asiento 3: JstLeonel (2.60 € en fichas)",
      "Asiento 4: Ozzy3110 (4.77 € en fichas)",
      "Asiento 5: toonsy2010 (2.73 € en fichas)",
      "Asiento 6: mivipkr (3.33 € en fichas)",
      "SrLyce: pone la ciega pequeña 0.01 €",
      "JstLeonel: pone la ciega grande 0.02 €",
      "Ozzy3110: sube 0.03 € a 0.05 €",
      "toonsy2010: se retira",
      "mivipkr: se retira",
      "benipoker123: se retira",
      "SrLyce: iguala 0.04 €",
      "JstLeonel: iguala 0.03 €"
    ],
    "flop": [
      "SrLyce: pasa",
      "JstLeonel: pasa",
      "Ozzy3110: apuesta 0.05 €",
      "SrLyce: se retira",
      "JstLeonel: iguala 0.05 €"
    ],
    "turn": [
      "JstLeonel: pasa",
      "Ozzy3110: apuesta 0.17 €",
      "JstLeonel: se retira",
      "Ozzy3110: no muestra su mano",
      "Asiento 1: benipoker123 (botón) se retiró antes del Flop (no apostó)",
      "Asiento 2: SrLyce (ciega pequeña) se retiró en el Flop",
      "Asiento 3: JstLeonel (ciega grande) se retiró en el Turn",
      "Asiento 4: Ozzy3110 recaudó (0.23 €)",
      "Asiento 5: toonsy2010 se retiró antes del Flop (no apostó)",
      "Asiento 6: mivipkr se retiró antes del Flop (no apostó)"
    ],
    "river": []
  },
  "board": [
    "As",
    "2s",
    "8s",
    "5c"
  ],
  "winner": "Ozzy3110",
  "win_amount": 11.5,
  "sb": 0.01,
  "bb": 0.02,
  "rake": 1.0,
  "raw_text": "Mano n.º 257150426182 de PokerStars:  Hold'em No Limit (0.01 €/0.02 € EUR) - 30-07-2025 23:40:59 CET [30-07-2025 17:40:59 ET]\nMesa \"Mizuho\" 6-max El asiento n.º 1 es el botón\nAsiento 1: benipoker123 (2.19 € en fichas) \nAsiento 2: SrLyce (1.98 € en fichas) \nAsiento 3: JstLeonel (2.60 € en fichas) \nAsiento 4: Ozzy3110 (4.77 € en fichas) \nAsiento 5: toonsy2010 (2.73 € en fichas) \nAsiento 6: mivipkr (3.33 € en fichas) \nSrLyce: pone la ciega pequeña 0.01 €\nJstLeonel: pone la ciega grande 0.02 €\n*** CARTAS DE MANO ***\nRepartidas a SrLyce [4h 5h]\nOzzy3110: sube 0.03 € a 0.05 €\ntoonsy2010: se retira \nmivipkr: se retira \nbenipoker123: se retira \nSrLyce: iguala 0.04 €\nJstLeonel: iguala 0.03 €\n*** FLOP *** [As 2s 8s]\nSrLyce: pasa \nJstLeonel: pasa \nOzzy3110: apuesta 0.05 €\nSrLyce: se retira \nJstLeonel: iguala 0.05 €\n*** TURN *** [As 2s 8s] [5c]\nJstLeonel: pasa \nOzzy3110: apuesta 0.17 €\nJstLeonel: se retira \nLa apuesta no igualada (0.17 €) ha sido devuelta a Ozzy3110\nOzzy3110 se lleva 0.23 € del bote \nOzzy3110: no muestra su mano \n*** RESUMEN ***\nBote total 0.25 € | Comisión 0.02 € \nComunitarias [As 2s 8s 5c]\nAsiento 1: benipoker123 (botón) se retiró antes del Flop (no apostó)\nAsiento 2: SrLyce (ciega pequeña) se retiró en el Flop\nAsiento 3: JstLeonel (ciega grande) se retiró en el Turn\nAsiento 4: Ozzy3110 recaudó (0.23 €)\nAsiento 5: toonsy2010 se retiró antes del Flop (no apostó)\nAsiento 6: mivipkr se retiró antes del Flop (no apostó)"
}