{
  "hand_id": "257237979633",
  "date": "06-08-2025 18:17:19",
  "table": "Euneus III",
  "game_type": "holdem",
  "hero": "SrLyce",
  "hero_position": "",
  "hero_cards": [
    "6c",
    "Qs"
  ],
  "stacks": {
    "christgear": 100.0,
    "Il_BM00": 128.0,
    "djrojas9": 135.0,
    "lol-in 2000": 98.5,
    "SrLyce": 125.0,
    "kcg_rm": 109.5
  },
  "actions": {
    "preflop": [
      "Asiento 1: christgear (2 € en fichas)",
      "Asiento 2: Il_BM00 (2.56 € en fichas)",
      "Asiento 3: djrojas9 (2.70 € en fichas)",
      "Asiento 4: lol-in 2000 (1.97 € en fichas)",
      "Asiento 5: SrLyce (2.50 € en fichas)",
      "Asiento 6: kcg_rm (2.19 € en fichas)",
      "kcg_rm: pone la ciega pequeña 0.01 €",
      "christgear: pone la ciega grande 0.02 €",
      "Il_BM00: se retira",
      "djrojas9: se retira",
      "lol-in 2000: se retira",
      "SrLyce: sube 0.03 € a 0.05 €",
      "kcg_rm: iguala 0.04 €",
      "christgear: se retira"
    ],
    "flop": [
      "kcg_rm: pasa",
      "SrLyce: apuesta 0.04 €",
      "kcg_rm: se retira",
      "SrLyce: no muestra su mano",
      "Asiento 1: christgear (ciega grande) se retiró antes del Flop",
      "Asiento 2: Il_BM00 se retiró antes del Flop (no apostó)",
      "Asiento 3: djrojas9 se retiró antes del Flop (no apostó)",
      "Asiento 4: lol-in 2000 se retiró antes del Flop (no apostó)",
      "Asiento 5: SrLyce (botón) recaudó (0.11 €)",
      "Asiento 6: kcg_rm (ciega pequeña) se retiró en el Flop"
    ],
    "turn": [],
    "river": []
  },
  "board": [
    "3d",
    "Qh",
    "9c"
  ],
  "winner": "SrLyce",
  "win_amount": 5.5,
  "sb": 0.01,
  "bb": 0.02,
  "rake": 0.5,
  "raw_text": "Mano n.º 257237979633 de PokerStars:  Hold'em No Limit (0.01 €/0.02 € EUR) - 06-08-2025 18:17:19 CET [06-08-2025 12:17:19 ET]\nMesa \"Euneus III\" 6-max El asiento n.º 5 es el botón\nAsiento 1: christgear (2 € en fichas) \nAsiento 2: Il_BM00 (2.56 € en fichas) \nAsiento 3: djrojas9 (2.70 € en fichas) \nAsiento 4: lol-in 2000 (1.97 € en fichas) \nAsiento 5: SrLyce (2.50 € en fichas) \nAsiento 6: kcg_rm (2.19 € en fichas) \nkcg_rm: pone la ciega pequeña 0.01 €\nchristgear: pone la ciega grande 0.02 €\n*** CARTAS DE MANO ***\nRepartidas a SrLyce [6c Qs]\nIl_BM00: se retira \ndjrojas9: se retira \nlol-in 2000: se retira \nSrLyce: sube 0.03 € a 0.05 €\nkcg_rm: iguala 0.04 €\nchristgear: se retira \n*** FLOP *** [3d Qh 9c]\nkcg_rm: pasa \nSrLyce: apuesta 0.04 €\nkcg_rm: se retira \nLa apuesta no igualada (0.04 €) ha sido devuelta a SrLyce\nSrLyce se lleva 0.11 € del bote \nSrLyce: no muestra su mano \n*** RESUMEN ***\nBote total 0.12 € | Comisión 0.01 € \nComunitarias [3d Qh 9c]\nAsiento 1: christgear (ciega grande) se retiró antes del Flop\nAsiento 2: Il_BM00 se retiró antes del Flop (no apostó)\nAsiento 3: djrojas9 se retiró antes del Flop (no apostó)\nAsiento 4: lol-in 2000 se retiró antes del Flop (no apostó)\nAsiento 5: SrLyce (botón) recaudó (0.11 €)\nAsiento 6: kcg_rm (ciega pequeña) se retiró en el Flop"
}