{
  "hand_id": "257168341656",
  "date": "01-08-2025 11:30:10",
  "table": "Atlas",
  "game_type": "holdem",
  "hero": "SrLyce",
  "hero_position": "",
  "hero_cards": [
    "9c",
    "2h"
  ],
  "stacks": {
    "soy_cule74": 100.0,
    "SrLyce": 105.0,
    "Fharock": 92.0,
    "ecuinas": 106.0,
    "LxckxStrxkx": 113.5,
    "Akourdideh": 115.0
  },
  "actions": {
    "preflop": [
      "Asiento 5: soy_cule74 (2 € en fichas) está ausente",
      "Asiento 1: SrLyce (2.10 € en fichas)",
      "Asiento 2: Fharock (1.84 € en fichas)",
      "Asiento 3: ecuinas (2.12 € en fichas)",
      "Asiento 4: LxckxStrxkx (2.27 € en fichas)",
      "Asiento 6: Akourdideh (2.30 € en fichas)",
      "ecuinas: pone la ciega pequeña 0.01 €",
      "LxckxStrxkx: pone la ciega grande 0.02 €",
      "soy_cule74: se ausenta",
      "Akourdideh: se retira",
      "SrLyce: se retira",
      "Fharock: se retira",
      "ecuinas: se retira",
      "LxckxStrxkx: no muestra su mano",
      "Asiento 5: soy_cule74",
      "Asiento 1: SrLyce se retiró antes del Flop (no apostó)",
      "Asiento 2: Fharock (botón) se retiró antes del Flop (no apostó)",
      "Asiento 3: ecuinas (ciega pequeña) se retiró antes del Flop",
      "Asiento 4: LxckxStrxkx (ciega grande) recaudó (0.02 €)",
      "Asiento 6: Akourdideh se retiró antes del Flop (no apostó)"
    ],
    "flop": [],
    "turn": [],
    "river": []
  },
  "board": [],
  "winner": "LxckxStrxkx",
  "win_amount": 1.0,
  "sb": 0.01,
  "bb": 0.02,
  "rake": 0.0,
  "raw_text": "Mano n.º 257168341656 de PokerStars:  Hold'em No Limit (0.01 €/0.02 € EUR) - 01-08-2025 11:30:10 CET [01-08-2025 5:30:10 ET]\nMesa \"Atlas\" 6-max El asiento n.º 2 es el botón\nAsiento 5: soy_cule74 (2 € en fichas) está ausente\nAsiento 1: SrLyce (2.10 € en fichas) \nAsiento 2: Fharock (1.84 € en fichas) \nAsiento 3: ecuinas (2.12 € en fichas) \nAsiento 4: LxckxStrxkx (2.27 € en fichas) \nAsiento 6: Akourdideh (2.30 € en fichas) \necuinas: pone la ciega pequeña 0.01 €\nLxckxStrxkx: pone la ciega grande 0.02 €\nsoy_cule74: se ausenta \n*** CARTAS DE MANO ***\nRepartidas a SrLyce [9c 2h]\nAkourdideh: se retira \nSrLyce: se retira \nFharock: se retira \necuinas: se retira \nLa apuesta no igualada (0.01 €) ha sido devuelta a LxckxStrxkx\nLxckxStrxkx se lleva 0.02 € del bote \nLxckxStrxkx: no muestra su mano \n*** RESUMEN ***\nBote total 0.02 € | Comisión 0 € \nAsiento 5: soy_cule74\nAsiento 1: SrLyce se retiró antes del Flop (no apostó)\nAsiento 2: Fharock (botón) se retiró antes del Flop (no apostó)\nAsiento 3: ecuinas (ciega pequeña) se retiró antes del Flop\nAsiento 4: LxckxStrxkx (ciega grande) recaudó (0.02 €)\nAsiento 6: Akourdideh se retiró antes del Flop (no apostó)"
}