{
  "hand_id": "257149207764",
  "date": "30-07-2025 22:15:37",
  "table": "Esclangona",
  "game_type": "holdem",
  "hero": "SrLyce",
  "hero_position": "",
  "hero_cards": [
    "Ah",
    "6c"
  ],
  "stacks": {
    "ansiedadd": 40.0,
    "SrLyce": 91.0,
    "NoahBolete": 130.5,
    "Davdgoni": 236.0,
    "DiaZzZ1": 98.5,
    "elketefaka1": 87.5
  },
  "actions": {
    "preflop": [
      "Asiento 1: ansiedadd (0.80 € en fichas)",
      "Asiento 2: SrLyce (1.82 € en fichas)",
      "Asiento 3: NoahBolete (2.61 € en fichas)",
      "Asiento 4: Davdgoni (4.72 € en fichas)",
      "Asiento 5: DiaZzZ1 (1.97 € en fichas)",
      "Asiento 6: elketefaka1 (1.75 € en fichas)",
      "elketefaka1: pone la ciega pequeña 0.01 €",
      "ansiedadd: pone la ciega grande 0.02 €",
      "SrLyce: se retira",
      "NoahBolete: se retira",
      "Davdgoni: se retira",
      "DiaZzZ1: se retira",
      "elketefaka1: iguala 0.01 €",
      "ansiedadd: pasa"
    ],
    "flop": [
      "elketefaka1: apuesta 0.02 €",
      "ansiedadd: se retira",
      "Asiento 1: ansiedadd (ciega grande) se retiró en el Flop",
      "Asiento 2: SrLyce se retiró antes del Flop (no apostó)",
      "Asiento 3: NoahBolete se retiró antes del Flop (no apostó)",
      "Asiento 4: Davdgoni se retiró antes del Flop (no apostó)",
      "Asiento 5: DiaZzZ1 (botón) se retiró antes del Flop (no apostó)",
      "Asiento 6: elketefaka1 (ciega pequeña) recaudó (0.04 €)"
    ],
    "turn": [],
    "river": []
  },
  "board": [
    "Qc",
    "7c",
    "4d"
  ],
  "winner": "elketefaka1",
  "win_amount": 2.0,
  "sb": 0.01,
  "bb": 0.02,
  "rake": 0.0,
  "raw_text": "Mano n.º 257149207764 de PokerStars:  Hold'em No Limit (0.01 €/0.02 € EUR) - 30-07-2025 22:15:37 CET [30-07-2025 16:15:37 ET]\nMesa \"Esclangona\" 6-max El asiento n.º 5 es el botón\nAsiento 1: ansiedadd (0.80 € en fichas) \nAsiento 2: SrLyce (1.82 € en fichas) \nAsiento 3: NoahBolete (2.61 € en fichas) \nAsiento 4: Davdgoni (4.72 € en fichas) \nAsiento 5: DiaZzZ1 (1.97 € en fichas) \nAsiento 6: elketefaka1 (1.75 € en fichas) \nelketefaka1: pone la ciega pequeña 0.01 €\nansiedadd: pone la ciega grande 0.02 €\n*** CARTAS DE MANO ***\nRepartidas a SrLyce [Ah 6c]\nSrLyce: se retira \nNoahBolete: se retira \nDavdgoni: se retira \nDiaZzZ1: se retira \nelketefaka1: iguala 0.01 €\nansiedadd: pasa \n*** FLOP *** [Qc 7c 4d]\nelketefaka1: apuesta 0.02 €\nansiedadd: se retira \nLa apuesta no igualada (0.02 €) ha sido devuelta a elketefaka1\nelketefaka1 se lleva 0.04 € del bote \n*** RESUMEN ***\nBote total 0.04 € | Comisión 0 € \nComunitarias [Qc 7c 4d]\nAsiento 1: ansiedadd (ciega grande) se retiró en el Flop\nAsiento 2: SrLyce se retiró antes del Flop (no apostó)\nAsiento 3: NoahBolete se retiró antes del Flop (no apostó)\nAsiento 4: Davdgoni se retiró antes del Flop (no apostó)\nAsiento 5: DiaZzZ1 (botón) se retiró antes del Flop (no apostó)\nAsiento 6: elketefaka1 (ciega pequeña) recaudó (0.04 €)"
}