{
  "hand_id": "257238144615",
  "date": "06-08-2025 18:32:02",
  "table": "Alruccabah II",
  "game_type": "holdem",
  "hero": "SrLyce",
  "hero_position": "",
  "hero_cards": [
    "5d",
    "9c"
  ],
  "stacks": {
    "SrLyce": 95.0,
    "Davdgoni": 259.5,
    "PerroBestia": 41.5,
    "Nicanor Cast": 54.5
  },
  "actions": {
    "preflop": [
      "Asiento 1: SrLyce (1.90 € en fichas)",
      "Asiento 2: Davdgoni (5.19 € en fichas)",
      "Asiento 3: PerroBestia (0.83 € en fichas)",
      "Asiento 4: serviettski(fr) (2.13 € en fichas)",
      "Asiento 5: Nicanor Cast (1.09 € en fichas)",
      "Davdgoni: pone la ciega pequeña 0.01 €",
      "PerroBestia: pone la ciega grande 0.02 €",
      "serviettski(fr): se retira",
      "Nicanor Cast: se retira",
      "SrLyce: se retira",
      "Davdgoni: sube 0.04 € a 0.06 €",
      "PerroBestia: se retira",
      "Davdgoni: no muestra su mano",
      "Asiento 1: SrLyce (botón) se retiró antes del Flop (no apostó)",
      "Asiento 2: Davdgoni (ciega pequeña) recaudó (0.04 €)",
      "Asiento 3: PerroBestia (ciega grande) se retiró antes del Flop",
      "Asiento 4: serviettski(fr) se retiró antes del Flop (no apostó)",
      "Asiento 5: Nicanor Cast se retiró antes del Flop (no apostó)"
    ],
    "flop": [],
    "turn": [],
    "river": []
  },
  "board": [],
  "winner": "Davdgoni",
  "win_amount": 2.0,
  "sb": 0.01,
  "bb": 0.02,
  "rake": 0.0,
  "raw_text": "Mano n.º 257238144615 de PokerStars:  Hold'em No Limit (0.01 €/0.02 € EUR) - 06-08-2025 18:32:02 CET [06-08-2025 12:32:02 ET]\nMesa \"Alruccabah II\" 6-max El asiento n.º 1 es el botón\nAsiento 1: SrLyce (1.90 € en fichas) \nAsiento 2: Davdgoni (5.19 € en fichas) \nAsiento 3: PerroBestia (0.83 € en fichas) \nAsiento 4: serviettski(fr) (2.13 € en fichas) \nAsiento 5: Nicanor Cast (1.09 € en fichas) \nDavdgoni: pone la ciega pequeña 0.01 €\nPerroBestia: pone la ciega grande 0.02 €\n*** CARTAS DE MANO ***\nRepartidas a SrLyce [5d 9c]\nserviettski(fr): se retira \nNicanor Cast: se retira \nrayao32 se une a la mesa en el asiento n.º 6 \nSrLyce: se retira \nDavdgoni: sube 0.04 € a 0.06 €\nPerroBestia: se retira \nLa apuesta no igualada (0.04 €) ha sido devuelta a Davdgoni\nDavdgoni se lleva 0.04 € del bote \nDavdgoni: no muestra su mano \n*** RESUMEN ***\nBote total 0.04 € | Comisión 0 € \nAsiento 1: SrLyce (botón) se retiró antes del Flop (no apostó)\nAsiento 2: Davdgoni (ciega pequeña) recaudó (0.04 €)\nAsiento 3: PerroBestia (ciega grande) se retiró antes del Flop\nAsiento 4: serviettski(fr) se retiró antes del Flop (no apostó)\nAsiento 5: Nicanor Cast se retiró antes del Flop (no apostó)"
}