{
  "hand_id": "257168347206",
  "date": "01-08-2025 11:31:11",
  "table": "Atlas",
  "game_type": "holdem",
  "hero": "SrLyce",
  "hero_position": "",
  "hero_cards": [
    "5d",
    "Ks"
  ],
  "stacks": {
    "SrLyce": 88.0,
    "Fharock": 89.0,
    "ecuinas": 102.5,
    "LxckxStrxkx": 113.5,
    "soy_cule74": 121.0,
    "Akourdideh": 115.0
  },
  "actions": {
    "preflop": [
      "Asiento 1: SrLyce (1.76 € en fichas)",
      "Asiento 2: Fharock (1.78 € en fichas)",
      "Asiento 3: ecuinas (2.05 € en fichas)",
      "Asiento 4: LxckxStrxkx (2.27 € en fichas)",
      "Asiento 5: soy_cule74 (2.42 € en fichas)",
      "Asiento 6: Akourdideh (2.30 € en fichas)",
      "soy_cule74: pone la ciega pequeña 0.01 €",
      "Akourdideh: pone la ciega grande 0.02 €",
      "SrLyce: se retira",
      "Fharock: se retira",
      "ecuinas: sube 0.04 € a 0.06 €",
      "LxckxStrxkx: se retira",
      "soy_cule74: se retira",
      "Akourdideh: se retira",
      "ecuinas: no muestra su mano",
      "Asiento 1: SrLyce se retiró antes del Flop (no apostó)",
      "Asiento 2: Fharock se retiró antes del Flop (no apostó)",
      "Asiento 3: ecuinas recaudó (0.05 €)",
      "Asiento 4: LxckxStrxkx (botón) se retiró antes del Flop (no apostó)",
      "Asiento 5: soy_cule74 (ciega pequeña) se retiró antes del Flop",
      "Asiento 6: Akourdideh (ciega grande) se retiró antes del Flop"
    ],
    "flop": [],
    "turn": [],
    "river": []
  },
  "board": [],
  "winner": "ecuinas",
  "win_amount": 2.5,
  "sb": 0.01,
  "bb": 0.02,
  "rake": 0.0,
  "raw_text": "Mano n.º 257168347206 de PokerStars:  Hold'em No Limit (0.01 €/0.02 € EUR) - 01-08-2025 11:31:11 CET [01-08-2025 5:31:11 ET]\nMesa \"Atlas\" 6-max El asiento n.º 4 es el botón\nAsiento 1: SrLyce (1.76 € en fichas) \nAsiento 2: Fharock (1.78 € en fichas) \nAsiento 3: ecuinas (2.05 € en fichas) \nAsiento 4: LxckxStrxkx (2.27 € en fichas) \nAsiento 5: soy_cule74 (2.42 € en fichas) \nAsiento 6: Akourdideh (2.30 € en fichas) \nsoy_cule74: pone la ciega pequeña 0.01 €\nAkourdideh: pone la ciega grande 0.02 €\n*** CARTAS DE MANO ***\nRepartidas a SrLyce [5d Ks]\nSrLyce: se retira \nFharock: se retira \necuinas: sube 0.04 € a 0.06 €\nLxckxStrxkx: se retira \nsoy_cule74: se retira \nAkourdideh: se retira \nLa apuesta no igualada (0.04 €) ha sido devuelta a ecuinas\necuinas se lleva 0.05 € del bote \necuinas: no muestra su mano \n*** RESUMEN ***\nBote total 0.05 € | Comisión 0 € \nAsiento 1: SrLyce se retiró antes del Flop (no apostó)\nAsiento 2: Fharock se retiró antes del Flop (no apostó)\nAsiento 3: ecuinas recaudó (0.05 €)\nAsiento 4: LxckxStrxkx (botón) se retiró antes del Flop (no apostó)\nAsiento 5: soy_cule74 (ciega pequeña) se retiró antes del Flop\nAsiento 6: Akourdideh (ciega grande) se retiró antes del Flop"
}