{
  "hand_id": "257168314817",
  "date": "01-08-2025 11:25:09",
  "table": "Jupiter",
  "game_type": "holdem",
  "hero": "SrLyce",
  "hero_position": "",
  "hero_cards": [
    "Ad",
    "6c"
  ],
  "stacks": {
    "sifilis5": 94.0,
    "Filou203": 113.0,
    "SrLyce": 120.0,
    "LOLA19711971": 30.5,
    "dadou13mars": 214.0,
    "Alvii37": 108.0
  },
  "actions": {
    "preflop": [
      "Asiento 1: sifilis5 (1.88 € en fichas)",
      "Asiento 2: Filou203 (2.26 € en fichas)",
      "Asiento 3: SrLyce (2.40 € en fichas)",
      "Asiento 4: LOLA19711971 (0.61 € en fichas)",
      "Asiento 5: dadou13mars (4.28 € en fichas)",
      "Asiento 6: Alvii37 (2.16 € en fichas)",
      "sifilis5: pone la ciega pequeña 0.01 €",
      "Filou203: pone la ciega grande 0.02 €",
      "SrLyce: se retira",
      "LOLA19711971: se retira",
      "dadou13mars: sube 0.04 € a 0.06 €",
      "Alvii37: se retira",
      "sifilis5: se retira",
      "Filou203: se retira",
      "dadou13mars: no muestra su mano",
      "Asiento 1: sifilis5 (ciega pequeña) se retiró antes del Flop",
      "Asiento 2: Filou203 (ciega grande) se retiró antes del Flop",
      "Asiento 3: SrLyce se retiró antes del Flop (no apostó)",
      "Asiento 4: LOLA19711971 se retiró antes del Flop (no apostó)",
      "Asiento 5: dadou13mars recaudó (0.05 €)",
      "Asiento 6: Alvii37 (botón) se retiró antes del Flop (no apostó)"
    ],
    "flop": [],
    "turn": [],
    "river": []
  },
  "board": [],
  "winner": "dadou13mars",
  "win_amount": 2.5,
  "sb": 0.01,
  "bb": 0.02,
  "rake": 0.0,
  "raw_text": "Mano n.º 257168314817 de PokerStars:  Hold'em No Limit (0.01 €/0.02 € EUR) - 01-08-2025 11:25:09 CET [01-08-2025 5:25:09 ET]\nMesa \"Jupiter\" 6-max El asiento n.º 6 es el botón\nAsiento 1: sifilis5 (1.88 € en fichas) \nAsiento 2: Filou203 (2.26 € en fichas) \nAsiento 3: SrLyce (2.40 € en fichas) \nAsiento 4: LOLA19711971 (0.61 € en fichas) \nAsiento 5: dadou13mars (4.28 € en fichas) \nAsiento 6: Alvii37 (2.16 € en fichas) \nsifilis5: pone la ciega pequeña 0.01 €\nFilou203: pone la ciega grande 0.02 €\n*** CARTAS DE MANO ***\nRepartidas a SrLyce [Ad 6c]\nSrLyce: se retira \nLOLA19711971: se retira \nAlvii37 no tiene conexión \ndadou13mars: sube 0.04 € a 0.06 €\nAlvii37: se retira \nsifilis5: se retira \nFilou203: se retira \nLa apuesta no igualada (0.04 €) ha sido devuelta a dadou13mars\ndadou13mars se lleva 0.05 € del bote \ndadou13mars: no muestra su mano \n*** RESUMEN ***\nBote total 0.05 € | Comisión 0 € \nAsiento 1: sifilis5 (ciega pequeña) se retiró antes del Flop\nAsiento 2: Filou203 (ciega grande) se retiró antes del Flop\nAsiento 3: SrLyce se retiró antes del Flop (no apostó)\nAsiento 4: LOLA19711971 se retiró antes del Flop (no apostó)\nAsiento 5: dadou13mars recaudó (0.05 €)\nAsiento 6: Alvii37 (botón) se retiró antes del Flop (no apostó)"
}