{
  "hand_id": "257168242005",
  "date": "01-08-2025 11:11:08",
  "table": "Jupiter",
  "game_type": "holdem",
  "hero": "SrLyce",
  "hero_position": "",
  "hero_cards": [
    "4d",
    "3d"
  ],
  "stacks": {
    "sifilis5": 88.5,
    "Filou203": 117.0,
    "SrLyce": 115.5,
    "LOLA19711971": 26.0,
    "dadou13mars": 225.0,
    "Alvii37": 96.0
  },
  "actions": {
    "preflop": [
      "Asiento 1: sifilis5 (1.77 € en fichas)",
      "Asiento 2: Filou203 (2.34 € en fichas)",
      "Asiento 3: SrLyce (2.31 € en fichas)",
      "Asiento 4: LOLA19711971 (0.52 € en fichas)",
      "Asiento 5: dadou13mars (4.50 € en fichas)",
      "Asiento 6: Alvii37 (1.92 € en fichas)",
      "sifilis5: pone la ciega pequeña 0.01 €",
      "Filou203: pone la ciega grande 0.02 €",
      "SrLyce: se retira",
      "LOLA19711971: iguala 0.02 €",
      "dadou13mars: se retira",
      "Alvii37: se retira",
      "sifilis5: iguala 0.01 €",
      "Filou203: pasa"
    ],
    "flop": [
      "sifilis5: pasa",
      "Filou203: pasa",
      "LOLA19711971: apuesta 0.03 €",
      "sifilis5: iguala 0.03 €",
      "Filou203: se retira"
    ],
    "turn": [
      "sifilis5: pasa",
      "LOLA19711971: apuesta 0.06 €",
      "sifilis5: iguala 0.06 €"
    ],
    "river": [
      "sifilis5: pasa",
      "LOLA19711971: apuesta 0.23 €",
      "sifilis5: se retira",
      "Asiento 1: sifilis5 (ciega pequeña) se retiró en el River",
      "Asiento 2: Filou203 (ciega grande) se retiró en el Flop",
      "Asiento 3: SrLyce se retiró antes del Flop (no apostó)",
      "Asiento 4: LOLA19711971 recaudó (0.23 €)",
      "Asiento 5: dadou13mars se retiró antes del Flop (no apostó)",
      "Asiento 6: Alvii37 (botón) se retiró antes del Flop (no apostó)"
    ]
  },
  "board": [
    "7h",
    "7s",
    "9h",
    "Th",
    "7c"
  ],
  "winner": "LOLA19711971",
  "win_amount": 11.5,
  "sb": 0.01,
  "bb": 0.02,
  "rake": 0.5,
  "raw_text": "Mano n.º 257168242005 de PokerStars:  Hold'em No Limit (0.01 €/0.02 € EUR) - 01-08-2025 11:11:08 CET [01-08-2025 5:11:08 ET]\nMesa \"Jupiter\" 6-max El asiento n.º 6 es el botón\nAsiento 1: sifilis5 (1.77 € en fichas) \nAsiento 2: Filou203 (2.34 € en fichas) \nAsiento 3: SrLyce (2.31 € en fichas) \nAsiento 4: LOLA19711971 (0.52 € en fichas) \nAsiento 5: dadou13mars (4.50 € en fichas) \nAsiento 6: Alvii37 (1.92 € en fichas) \nsifilis5: pone la ciega pequeña 0.01 €\nFilou203: pone la ciega grande 0.02 €\n*** CARTAS DE MANO ***\nRepartidas a SrLyce [4d 3d]\nSrLyce ha agotado su tiempo\nSrLyce: se retira \nLOLA19711971: iguala 0.02 €\ndadou13mars: se retira \nAlvii37: se retira \nsifilis5: iguala 0.01 €\nFilou203: pasa \n*** FLOP *** [7h 7s 9h]\nsifilis5: pasa \nFilou203: pasa \nLOLA19711971: apuesta 0.03 €\nsifilis5: iguala 0.03 €\nFilou203: se retira \n*** TURN *** [7h 7s 9h] [Th]\nsifilis5: pasa \nLOLA19711971: apuesta 0.06 €\nsifilis5: iguala 0.06 €\n*** RIVER *** [7h 7s 9h Th] [7c]\nsifilis5: pasa \nLOLA19711971: apuesta 0.23 €\nsifilis5: se retira \nLa apuesta no igualada (0.23 €) ha sido devuelta a LOLA19711971\nLOLA19711971 se lleva 0.23 € del bote \n*** RESUMEN ***\nBote total 0.24 € | Comisión 0.01 € \nComunitarias [7h 7s 9h Th 7c]\nAsiento 1: sifilis5 (ciega pequeña) se retiró en el River\nAsiento 2: Filou203 (ciega grande) se retiró en el Flop\nAsiento 3: SrLyce se retiró antes del Flop (no apostó)\nAsiento 4: LOLA19711971 recaudó (0.23 €)\nAsiento 5: dadou13mars se retiró antes del Flop (no apostó)\nAsiento 6: Alvii37 (botón) se retiró antes del Flop (no apostó)"
}