{
  "hand_id": "257150467077",
  "date": "30-07-2025 23:43:55",
  "table": "Martha",
  "game_type": "holdem",
  "hero": "SrLyce",
  "hero_position": "",
  "hero_cards": [
    "9s",
    "Tc"
  ],
  "stacks": {
    "mivipkr": 106.0,
    "NovacaineZxc": 120.0,
    "BudyXXIII": 110.5,
    "Sigiilo": 103.0,
    "SrLyce": 98.0,
    "alexfw300": 102.0
  },
  "actions": {
    "preflop": [
      "Asiento 1: mivipkr (2.12 € en fichas)",
      "Asiento 2: NovacaineZxc (2.40 € en fichas)",
      "Asiento 3: BudyXXIII (2.21 € en fichas)",
      "Asiento 4: Sigiilo (2.06 € en fichas)",
      "Asiento 5: SrLyce (1.96 € en fichas)",
      "Asiento 6: alexfw300 (2.04 € en fichas)",
      "Sigiilo: pone la ciega pequeña 0.01 €",
      "SrLyce: pone la ciega grande 0.02 €",
      "alexfw300: se retira",
      "mivipkr: se retira",
      "NovacaineZxc: sube 0.04 € a 0.06 €",
      "BudyXXIII: se retira",
      "Sigiilo: se retira",
      "SrLyce: iguala 0.04 €"
    ],
    "flop": [
      "SrLyce: pasa",
      "NovacaineZxc: pasa"
    ],
    "turn": [
      "SrLyce: apuesta 0.06 €",
      "NovacaineZxc: se retira",
      "SrLyce: no muestra su mano",
      "Asiento 1: mivipkr se retiró antes del Flop (no apostó)",
      "Asiento 2: NovacaineZxc se retiró en el Turn",
      "Asiento 3: BudyXXIII (botón) se retiró antes del Flop (no apostó)",
      "Asiento 4: Sigiilo (ciega pequeña) se retiró antes del Flop",
      "Asiento 5: SrLyce (ciega grande) recaudó (0.12 €)",
      "Asiento 6: alexfw300 se retiró antes del Flop (no apostó)"
    ],
    "river": []
  },
  "board": [
    "6c",
    "7c",
    "9h",
    "4h"
  ],
  "winner": "SrLyce",
  "win_amount": 6.0,
  "sb": 0.01,
  "bb": 0.02,
  "rake": 0.5,
  "raw_text": "Mano n.º 257150467077 de PokerStars:  Hold'em No Limit (0.01 €/0.02 € EUR) - 30-07-2025 23:43:55 CET [30-07-2025 17:43:55 ET]\nMesa \"Martha\" 6-max El asiento n.º 3 es el botón\nAsiento 1: mivipkr (2.12 € en fichas) \nAsiento 2: NovacaineZxc (2.40 € en fichas) \nAsiento 3: BudyXXIII (2.21 € en fichas) \nAsiento 4: Sigiilo (2.06 € en fichas) \nAsiento 5: SrLyce (1.96 € en fichas) \nAsiento 6: alexfw300 (2.04 € en fichas) \nSigiilo: pone la ciega pequeña 0.01 €\nSrLyce: pone la ciega grande 0.02 €\n*** CARTAS DE MANO ***\nRepartidas a SrLyce [9s Tc]\nalexfw300: se retira \nmivipkr: se retira \nNovacaineZxc: sube 0.04 € a 0.06 €\nBudyXXIII: se retira \nSigiilo: se retira \nSrLyce: iguala 0.04 €\n*** FLOP *** [6c 7c 9h]\nSrLyce: pasa \nNovacaineZxc: pasa \n*** TURN *** [6c 7c 9h] [4h]\nSrLyce: apuesta 0.06 €\nNovacaineZxc: se retira \nLa apuesta no igualada (0.06 €) ha sido devuelta a SrLyce\nSrLyce se lleva 0.12 € del bote \nSrLyce: no muestra su mano \n*** RESUMEN ***\nBote total 0.13 € | Comisión 0.01 € \nComunitarias [6c 7c 9h 4h]\nAsiento 1: mivipkr se retiró antes del Flop (no apostó)\nAsiento 2: NovacaineZxc se retiró en el Turn\nAsiento 3: BudyXXIII (botón) se retiró antes del Flop (no apostó)\nAsiento 4: Sigiilo (ciega pequeña) se retiró antes del Flop\nAsiento 5: SrLyce (ciega grande) recaudó (0.12 €)\nAsiento 6: alexfw300 se retiró antes del Flop (no apostó)"
}