{
  "hand_id": "257238520719",
  "date": "06-08-2025 19:06:41",
  "table": "Adelaide III",
  "game_type": "holdem",
  "hero": "SrLyce",
  "hero_position": "",
  "hero_cards": [
    "Kh",
    "7s"
  ],
  "stacks": {
    "N3xtTIm35": 124.0,
    "aliendee07": 68.0,
    "Macklemore0": 100.0,
    "SrLyce": 97.5,
    "ismagonzalez7": 61.0,
    "pauquair5": 63.5
  },
  "actions": {
    "preflop": [
      "Asiento 1: N3xtTIm35 (2.48 € en fichas)",
      "Asiento 2: aliendee07 (1.36 € en fichas)",
      "Asiento 3: Macklemore0 (2 € en fichas)",
      "Asiento 4: SrLyce (1.95 € en fichas)",
      "Asiento 5: ismagonzalez7 (1.22 € en fichas)",
      "Asiento 6: pauquair5 (1.27 € en fichas)",
      "aliendee07: pone la ciega pequeña 0.01 €",
      "Macklemore0: pone la ciega grande 0.02 €",
      "SrLyce: se retira",
      "ismagonzalez7: se retira",
      "pauquair5: sube 0.02 € a 0.04 €",
      "N3xtTIm35: se retira",
      "aliendee07: iguala 0.03 €",
      "Macklemore0: se retira"
    ],
    "flop": [
      "aliendee07: apuesta 0.04 €",
      "pauquair5: iguala 0.04 €"
    ],
    "turn": [
      "aliendee07: pasa",
      "pauquair5: apuesta 0.08 €",
      "aliendee07: iguala 0.08 €"
    ],
    "river": [
      "aliendee07: pasa",
      "pauquair5: pasa",
      "aliendee07: muestra [Qd Js] (carta alta rey)",
      "pauquair5: muestra [Ad As] (pareja de ases)",
      "Asiento 1: N3xtTIm35 (botón) se retiró antes del Flop (no apostó)",
      "Asiento 2: aliendee07 (ciega pequeña) muestra [Qd Js] y perdió con carta alta rey",
      "Asiento 3: Macklemore0 (ciega grande) se retiró antes del Flop",
      "Asiento 4: SrLyce se retiró antes del Flop (no apostó)",
      "Asiento 5: ismagonzalez7 se retiró antes del Flop (no apostó)",
      "Asiento 6: pauquair5 muestra [Ad As] y ganó (0.32 €) con pareja de ases"
    ]
  },
  "board": [
    "8s",
    "Ts",
    "Kc",
    "5d",
    "7c"
  ],
  "winner": "pauquair5",
  "win_amount": 16.0,
  "sb": 0.01,
  "bb": 0.02,
  "rake": 1.0,
  "raw_text": "Mano n.º 257238520719 de PokerStars:  Hold'em No Limit (0.01 €/0.02 € EUR) - 06-08-2025 19:06:41 CET [06-08-2025 13:06:41 ET]\nMesa \"Adelaide III\" 6-max El asiento n.º 1 es el botón\nAsiento 1: N3xtTIm35 (2.48 € en fichas) \nAsiento 2: aliendee07 (1.36 € en fichas) \nAsiento 3: Macklemore0 (2 € en fichas) \nAsiento 4: SrLyce (1.95 € en fichas) \nAsiento 5: ismagonzalez7 (1.22 € en fichas) \nAsiento 6: pauquair5 (1.27 € en fichas) \naliendee07: pone la ciega pequeña 0.01 €\nMacklemore0: pone la ciega grande 0.02 €\n*** CARTAS DE MANO ***\nRepartidas a SrLyce [Kh 7s]\nSrLyce: se retira \nismagonzalez7: se retira \npauquair5: sube 0.02 € a 0.04 €\nN3xtTIm35: se retira \naliendee07: iguala 0.03 €\nMacklemore0: se retira \n*** FLOP *** [8s Ts Kc]\naliendee07: apuesta 0.04 €\npauquair5: iguala 0.04 €\n*** TURN *** [8s Ts Kc] [5d]\naliendee07: pasa \npauquair5: apuesta 0.08 €\naliendee07: iguala 0.08 €\n*** RIVER *** [8s Ts Kc 5d] [7c]\naliendee07: pasa \npauquair5: pasa \n*** SHOW DOWN ***\naliendee07: muestra [Qd Js] (carta alta rey)\npauquair5: muestra [Ad As] (pareja de ases)\npauquair5 se lleva 0.32 € del bote \n*** RESUMEN ***\nBote total 0.34 € | Comisión 0.02 € \nComunitarias [8s Ts Kc 5d 7c]\nAsiento 1: N3xtTIm35 (botón) se retiró antes del Flop (no apostó)\nAsiento 2: aliendee07 (ciega pequeña) muestra [Qd Js] y perdió con carta alta rey\nAsiento 3: Macklemore0 (ciega grande) se retiró antes del Flop\nAsiento 4: SrLyce se retiró antes del Flop (no apostó)\nAsiento 5: ismagonzalez7 se retiró antes del Flop (no apostó)\nAsiento 6: pauquair5 muestra [Ad As] y ganó (0.32 €) con pareja de ases"
}