{
  "hand_id": "257237785782",
  "date": "06-08-2025 17:58:33",
  "table": "Euneus III",
  "game_type": "holdem",
  "hero": "SrLyce",
  "hero_position": "",
  "hero_cards": [
    "Ah",
    "Jh"
  ],
  "stacks": {
    "DeMula62": 100.0,
    "Il_BM00": 115.5,
    "djrojas9": 147.0,
    "eleuvehache": 124.0,
    "SrLyce": 108.0
  },
  "actions": {
    "preflop": [
      "Asiento 1: DeMula62 (2 € en fichas)",
      "Asiento 2: Il_BM00 (2.31 € en fichas)",
      "Asiento 3: djrojas9 (2.94 € en fichas)",
      "Asiento 4: eleuvehache (2.48 € en fichas)",
      "Asiento 5: SrLyce (2.16 € en fichas)",
      "Il_BM00: pone la ciega pequeña 0.01 €",
      "djrojas9: pone la ciega grande 0.02 €",
      "eleuvehache: se retira",
      "SrLyce: sube 0.03 € a 0.05 €",
      "DeMula62: se retira",
      "Il_BM00: sube 0.13 € a 0.18 €",
      "djrojas9: se retira",
      "SrLyce: sube 0.31 € a 0.49 €",
      "Il_BM00: se retira",
      "SrLyce: no muestra su mano",
      "Asiento 1: DeMula62 (botón) se retiró antes del Flop (no apostó)",
      "Asiento 2: Il_BM00 (ciega pequeña) se retiró antes del Flop",
      "Asiento 3: djrojas9 (ciega grande) se retiró antes del Flop",
      "Asiento 4: eleuvehache se retiró antes del Flop (no apostó)",
      "Asiento 5: SrLyce recaudó (0.38 €)"
    ],
    "flop": [],
    "turn": [],
    "river": []
  },
  "board": [],
  "winner": "SrLyce",
  "win_amount": 19.0,
  "sb": 0.01,
  "bb": 0.02,
  "rake": 0.0,
  "raw_text": "Mano n.º 257237785782 de PokerStars:  Hold'em No Limit (0.01 €/0.02 € EUR) - 06-08-2025 17:58:33 CET [06-08-2025 11:58:33 ET]\nMesa \"Euneus III\" 6-max El asiento n.º 1 es el botón\nAsiento 1: DeMula62 (2 € en fichas) \nAsiento 2: Il_BM00 (2.31 € en fichas) \nAsiento 3: djrojas9 (2.94 € en fichas) \nAsiento 4: eleuvehache (2.48 € en fichas) \nAsiento 5: SrLyce (2.16 € en fichas) \nIl_BM00: pone la ciega pequeña 0.01 €\ndjrojas9: pone la ciega grande 0.02 €\n*** CARTAS DE MANO ***\nRepartidas a SrLyce [Ah Jh]\neleuvehache: se retira \nSrLyce: sube 0.03 € a 0.05 €\nDeMula62: se retira \nIl_BM00: sube 0.13 € a 0.18 €\ndjrojas9: se retira \nSrLyce: sube 0.31 € a 0.49 €\nIl_BM00: se retira \nLa apuesta no igualada (0.31 €) ha sido devuelta a SrLyce\neleuvehache deja la mesa\nSrLyce se lleva 0.38 € del bote \nSrLyce: no muestra su mano \n*** RESUMEN ***\nBote total 0.38 € | Comisión 0 € \nAsiento 1: DeMula62 (botón) se retiró antes del Flop (no apostó)\nAsiento 2: Il_BM00 (ciega pequeña) se retiró antes del Flop\nAsiento 3: djrojas9 (ciega grande) se retiró antes del Flop\nAsiento 4: eleuvehache se retiró antes del Flop (no apostó)\nAsiento 5: SrLyce recaudó (0.38 €)"
}