{
  "hand_id": "257148985428",
  "date": "30-07-2025 21:59:19",
  "table": "Sirona",
  "game_type": "holdem",
  "hero": "SrLyce",
  "hero_position": "",
  "hero_cards": [
    "5s",
    "3h"
  ],
  "stacks": {
    "SrLyce": 114.0,
    "lecontrebandier": 95.0,
    "christoph363": 207.0,
    "oliverdu70": 132.5,
    "NaruchoH1": 100.0,
    "Dakoo44": 72.5
  },
  "actions": {
    "preflop": [
      "Asiento 1: SrLyce (2.28 € en fichas)",
      "Asiento 2: lecontrebandier (1.90 € en fichas)",
      "Asiento 3: christoph363 (4.14 € en fichas)",
      "Asiento 4: oliverdu70 (2.65 € en fichas)",
      "Asiento 5: NaruchoH1 (2 € en fichas)",
      "Asiento 6: Dakoo44 (1.45 € en fichas)",
      "oliverdu70: pone la ciega pequeña 0.01 €",
      "NaruchoH1: pone la ciega grande 0.02 €",
      "Dakoo44: sube 0.04 € a 0.06 €",
      "SrLyce: se retira",
      "lecontrebandier: iguala 0.06 €",
      "christoph363: se retira",
      "oliverdu70: se retira",
      "NaruchoH1: se retira"
    ],
    "flop": [
      "Dakoo44: apuesta 0.07 €",
      "lecontrebandier: iguala 0.07 €"
    ],
    "turn": [
      "Dakoo44: apuesta 0.16 €",
      "lecontrebandier: se retira",
      "Dakoo44: no muestra su mano",
      "Asiento 1: SrLyce se retiró antes del Flop (no apostó)",
      "Asiento 2: lecontrebandier se retiró en el Turn",
      "Asiento 3: christoph363 (botón) se retiró antes del Flop (no apostó)",
      "Asiento 4: oliverdu70 (ciega pequeña) se retiró antes del Flop",
      "Asiento 5: NaruchoH1 (ciega grande) se retiró antes del Flop",
      "Asiento 6: Dakoo44 recaudó (0.27 €)"
    ],
    "river": []
  },
  "board": [
    "Ts",
    "6d",
    "4c",
    "5d"
  ],
  "winner": "Dakoo44",
  "win_amount": 13.5,
  "sb": 0.01,
  "bb": 0.02,
  "rake": 1.0,
  "raw_text": "Mano n.º 257148985428 de PokerStars:  Hold'em No Limit (0.01 €/0.02 € EUR) - 30-07-2025 21:59:19 CET [30-07-2025 15:59:19 ET]\nMesa \"Sirona\" 6-max El asiento n.º 3 es el botón\nAsiento 1: SrLyce (2.28 € en fichas) \nAsiento 2: lecontrebandier (1.90 € en fichas) \nAsiento 3: christoph363 (4.14 € en fichas) \nAsiento 4: oliverdu70 (2.65 € en fichas) \nAsiento 5: NaruchoH1 (2 € en fichas) \nAsiento 6: Dakoo44 (1.45 € en fichas) \noliverdu70: pone la ciega pequeña 0.01 €\nNaruchoH1: pone la ciega grande 0.02 €\n*** CARTAS DE MANO ***\nRepartidas a SrLyce [5s 3h]\nDakoo44: sube 0.04 € a 0.06 €\nSrLyce: se retira \nlecontrebandier: iguala 0.06 €\nchristoph363: se retira \noliverdu70: se retira \nNaruchoH1: se retira \n*** FLOP *** [Ts 6d 4c]\nDakoo44: apuesta 0.07 €\nlecontrebandier: iguala 0.07 €\n*** TURN *** [Ts 6d 4c] [5d]\nDakoo44: apuesta 0.16 €\nlecontrebandier: se retira \nLa apuesta no igualada (0.16 €) ha sido devuelta a Dakoo44\nDakoo44 se lleva 0.27 € del bote \nDakoo44: no muestra su mano \n*** RESUMEN ***\nBote total 0.29 € | Comisión 0.02 € \nComunitarias [Ts 6d 4c 5d]\nAsiento 1: SrLyce se retiró antes del Flop (no apostó)\nAsiento 2: lecontrebandier se retiró en el Turn\nAsiento 3: christoph363 (botón) se retiró antes del Flop (no apostó)\nAsiento 4: oliverdu70 (ciega pequeña) se retiró antes del Flop\nAsiento 5: NaruchoH1 (ciega grande) se retiró antes del Flop\nAsiento 6: Dakoo44 recaudó (0.27 €)"
}