{
  "hand_id": "257150538041",
  "date": "30-07-2025 23:49:06",
  "table": "Lobelia",
  "game_type": "holdem",
  "hero": "SrLyce",
  "hero_position": "",
  "hero_cards": [
    "8s",
    "9d"
  ],
  "stacks": {
    "LeVbks": 143.5,
    "fcis666": 22.5,
    "Dlaguancha": 119.5,
    "SrLyce": 101.0,
    "riverluck444": 81.0,
    "javipondio": 44.5
  },
  "actions": {
    "preflop": [
      "Asiento 1: LeVbks (2.87 € en fichas)",
      "Asiento 2: fcis666 (0.45 € en fichas)",
      "Asiento 3: Dlaguancha (2.39 € en fichas)",
      "Asiento 4: SrLyce (2.02 € en fichas)",
      "Asiento 5: riverluck444 (1.62 € en fichas)",
      "Asiento 6: javipondio (0.89 € en fichas)",
      "SrLyce: pone la ciega pequeña 0.01 €",
      "riverluck444: pone la ciega grande 0.02 €",
      "javipondio: se retira",
      "LeVbks: sube 0.02 € a 0.04 €",
      "fcis666: iguala 0.04 €",
      "Dlaguancha: se retira",
      "SrLyce: iguala 0.03 €",
      "riverluck444: iguala 0.02 €"
    ],
    "flop": [
      "SrLyce: pasa",
      "riverluck444: pasa",
      "LeVbks: apuesta 0.07 €",
      "fcis666: se retira",
      "SrLyce: se retira",
      "riverluck444: iguala 0.07 €"
    ],
    "turn": [
      "riverluck444: pasa",
      "LeVbks: pasa"
    ],
    "river": [
      "riverluck444: pasa",
      "LeVbks: apuesta 0.11 €",
      "riverluck444: iguala 0.11 €",
      "LeVbks: muestra [Jd Qc] (doble pareja, jotas y treses)",
      "riverluck444: descarta su mano sin mostrar",
      "Asiento 1: LeVbks muestra [Jd Qc] y ganó (0.49 €) con doble pareja, jotas y treses",
      "Asiento 2: fcis666 se retiró en el Flop",
      "Asiento 3: Dlaguancha (botón) se retiró antes del Flop (no apostó)",
      "Asiento 4: SrLyce (ciega pequeña) se retiró en el Flop",
      "Asiento 5: riverluck444 (ciega grande) descartó sin mostrar [8c 8h]",
      "Asiento 6: javipondio se retiró antes del Flop (no apostó)"
    ]
  },
  "board": [
    "Jc",
    "4d",
    "3s",
    "Td",
    "3h"
  ],
  "winner": "LeVbks",
  "win_amount": 24.5,
  "sb": 0.01,
  "bb": 0.02,
  "rake": 1.5,
  "raw_text": "Mano n.º 257150538041 de PokerStars:  Hold'em No Limit (0.01 €/0.02 € EUR) - 30-07-2025 23:49:06 CET [30-07-2025 17:49:06 ET]\nMesa \"Lobelia\" 6-max El asiento n.º 3 es el botón\nAsiento 1: LeVbks (2.87 € en fichas) \nAsiento 2: fcis666 (0.45 € en fichas) \nAsiento 3: Dlaguancha (2.39 € en fichas) \nAsiento 4: SrLyce (2.02 € en fichas) \nAsiento 5: riverluck444 (1.62 € en fichas) \nAsiento 6: javipondio (0.89 € en fichas) \nSrLyce: pone la ciega pequeña 0.01 €\nriverluck444: pone la ciega grande 0.02 €\n*** CARTAS DE MANO ***\nRepartidas a SrLyce [8s 9d]\njavipondio: se retira \nLeVbks: sube 0.02 € a 0.04 €\nfcis666: iguala 0.04 €\nDlaguancha: se retira \nSrLyce: iguala 0.03 €\nriverluck444: iguala 0.02 €\n*** FLOP *** [Jc 4d 3s]\nSrLyce: pasa \nriverluck444: pasa \nLeVbks: apuesta 0.07 €\nfcis666: se retira \nSrLyce: se retira \nriverluck444: iguala 0.07 €\n*** TURN *** [Jc 4d 3s] [Td]\nriverluck444: pasa \nLeVbks: pasa \n*** RIVER *** [Jc 4d 3s Td] [3h]\nriverluck444: pasa \nLeVbks: apuesta 0.11 €\nriverluck444: iguala 0.11 €\n*** SHOW DOWN ***\nLeVbks: muestra [Jd Qc] (doble pareja, jotas y treses)\nriverluck444: descarta su mano sin mostrar \nLeVbks se lleva 0.49 € del bote \n*** RESUMEN ***\nBote total 0.52 € | Comisión 0.03 € \nComunitarias [Jc 4d 3s Td 3h]\nAsiento 1: LeVbks muestra [Jd Qc] y ganó (0.49 €) con doble pareja, jotas y treses\nAsiento 2: fcis666 se retiró en el Flop\nAsiento 3: Dlaguancha (botón) se retiró antes del Flop (no apostó)\nAsiento 4: SrLyce (ciega pequeña) se retiró en el Flop\nAsiento 5: riverluck444 (ciega grande) descartó sin mostrar [8c 8h]\nAsiento 6: javipondio se retiró antes del Flop (no apostó)"
}