{
  "hand_id": "257149858632",
  "date": "30-07-2025 23:01:44",
  "table": "Gilgamesh",
  "game_type": "holdem",
  "hero": "SrLyce",
  "hero_position": "",
  "hero_cards": [
    "Jd",
    "9c"
  ],
  "stacks": {
    "riverrrrrrmagic": 115.5,
    "SrLyce": 97.5,
    "Jumby34": 112.0,
    "Fluxy123": 111.0,
    "cbo54": 83.0,
    "Fretzo67500": 112.0
  },
  "actions": {
    "preflop": [
      "Asiento 1: riverrrrrrmagic (2.31 € en fichas)",
      "Asiento 2: SrLyce (1.95 € en fichas)",
      "Asiento 3: Jumby34 (2.24 € en fichas)",
      "Asiento 4: Fluxy123 (2.22 € en fichas)",
      "Asiento 5: cbo54 (1.66 € en fichas)",
      "Asiento 6: Fretzo67500 (2.24 € en fichas)",
      "Fluxy123: pone la ciega pequeña 0.01 €",
      "cbo54: pone la ciega grande 0.02 €",
      "Fretzo67500: se retira",
      "riverrrrrrmagic: se retira",
      "SrLyce: sube 0.04 € a 0.06 €",
      "Jumby34: se retira",
      "Fluxy123: se retira",
      "cbo54: se retira",
      "SrLyce: no muestra su mano",
      "Asiento 1: riverrrrrrmagic se retiró antes del Flop (no apostó)",
      "Asiento 2: SrLyce recaudó (0.05 €)",
      "Asiento 3: Jumby34 (botón) se retiró antes del Flop (no apostó)",
      "Asiento 4: Fluxy123 (ciega pequeña) se retiró antes del Flop",
      "Asiento 5: cbo54 (ciega grande) se retiró antes del Flop",
      "Asiento 6: Fretzo67500 se retiró antes del Flop (no apostó)"
    ],
    "flop": [],
    "turn": [],
    "river": []
  },
  "board": [],
  "winner": "SrLyce",
  "win_amount": 2.5,
  "sb": 0.01,
  "bb": 0.02,
  "rake": 0.0,
  "raw_text": "Mano n.º 257149858632 de PokerStars:  Hold'em No Limit (0.01 €/0.02 € EUR) - 30-07-2025 23:01:44 CET [30-07-2025 17:01:44 ET]\nMesa \"Gilgamesh\" 6-max El asiento n.º 3 es el botón\nAsiento 1: riverrrrrrmagic (2.31 € en fichas) \nAsiento 2: SrLyce (1.95 € en fichas) \nAsiento 3: Jumby34 (2.24 € en fichas) \nAsiento 4: Fluxy123 (2.22 € en fichas) \nAsiento 5: cbo54 (1.66 € en fichas) \nAsiento 6: Fretzo67500 (2.24 € en fichas) \nFluxy123: pone la ciega pequeña 0.01 €\ncbo54: pone la ciega grande 0.02 €\n*** CARTAS DE MANO ***\nRepartidas a SrLyce [Jd 9c]\nFretzo67500: se retira \nriverrrrrrmagic: se retira \nSrLyce: sube 0.04 € a 0.06 €\nJumby34: se retira \nFluxy123: se retira \ncbo54: se retira \nLa apuesta no igualada (0.04 €) ha sido devuelta a SrLyce\nSrLyce se lleva 0.05 € del bote \nSrLyce: no muestra su mano \n*** RESUMEN ***\nBote total 0.05 € | Comisión 0 € \nAsiento 1: riverrrrrrmagic se retiró antes del Flop (no apostó)\nAsiento 2: SrLyce recaudó (0.05 €)\nAsiento 3: Jumby34 (botón) se retiró antes del Flop (no apostó)\nAsiento 4: Fluxy123 (ciega pequeña) se retiró antes del Flop\nAsiento 5: cbo54 (ciega grande) se retiró antes del Flop\nAsiento 6: Fretzo67500 se retiró antes del Flop (no apostó)"
}