{
  "hand_id": "257238157585",
  "date": "06-08-2025 18:33:11",
  "table": "Patientia III",
  "game_type": "holdem",
  "hero": "SrLyce",
  "hero_position": "",
  "hero_cards": [
    "Td",
    "Tc"
  ],
  "stacks": {
    "lehamock": 100.0,
    "Phryxz": 101.0,
    "SrLyce": 93.5,
    "chordewman": 110.5,
    "niyomalo": 87.5
  },
  "actions": {
    "preflop": [
      "Asiento 5: lehamock (2 € en fichas) está ausente",
      "Asiento 1: Phryxz (2.02 € en fichas)",
      "Asiento 2: serviettski(fr) (2.53 € en fichas)",
      "Asiento 3: SrLyce (1.87 € en fichas)",
      "Asiento 4: chordewman (2.21 € en fichas)",
      "Asiento 6: niyomalo (1.75 € en fichas)",
      "niyomalo: pone la ciega pequeña 0.01 €",
      "Phryxz: pone la ciega grande 0.02 €",
      "serviettski(fr): se retira",
      "SrLyce: sube 0.03 € a 0.05 €",
      "chordewman: se retira",
      "niyomalo: iguala 0.04 €",
      "Phryxz: iguala 0.03 €"
    ],
    "flop": [
      "niyomalo: pasa",
      "Phryxz: apuesta 0.07 €",
      "SrLyce: iguala 0.07 €",
      "niyomalo: se retira"
    ],
    "turn": [
      "Phryxz: pasa",
      "SrLyce: pasa"
    ],
    "river": [
      "Phryxz: apuesta 0.33 €",
      "SrLyce: iguala 0.33 €",
      "Phryxz: muestra [9d Kd] (doble pareja, reyes y cincos)",
      "SrLyce: descarta su mano sin mostrar",
      "Asiento 5: lehamock",
      "Asiento 1: Phryxz (ciega grande) muestra [9d Kd] y ganó (0.89 €) con doble pareja, reyes y cincos",
      "Asiento 2: serviettski(fr) se retiró antes del Flop (no apostó)",
      "Asiento 3: SrLyce descartó sin mostrar [Td Tc]",
      "Asiento 4: chordewman (botón) se retiró antes del Flop (no apostó)",
      "Asiento 6: niyomalo (ciega pequeña) se retiró en el Flop"
    ]
  },
  "board": [
    "5d",
    "5h",
    "7s",
    "Kc",
    "4d"
  ],
  "winner": "Phryxz",
  "win_amount": 44.5,
  "sb": 0.01,
  "bb": 0.02,
  "rake": 3.0,
  "raw_text": "Mano n.º 257238157585 de PokerStars:  Hold'em No Limit (0.01 €/0.02 € EUR) - 06-08-2025 18:33:11 CET [06-08-2025 12:33:11 ET]\nMesa \"Patientia III\" 6-max El asiento n.º 4 es el botón\nAsiento 5: lehamock (2 € en fichas) está ausente\nAsiento 1: Phryxz (2.02 € en fichas) \nAsiento 2: serviettski(fr) (2.53 € en fichas) \nAsiento 3: SrLyce (1.87 € en fichas) \nAsiento 4: chordewman (2.21 € en fichas) \nAsiento 6: niyomalo (1.75 € en fichas) \nniyomalo: pone la ciega pequeña 0.01 €\nPhryxz: pone la ciega grande 0.02 €\n*** CARTAS DE MANO ***\nRepartidas a SrLyce [Td Tc]\nserviettski(fr): se retira \nSrLyce: sube 0.03 € a 0.05 €\nchordewman: se retira \nniyomalo: iguala 0.04 €\nPhryxz: iguala 0.03 €\n*** FLOP *** [5d 5h 7s]\nniyomalo: pasa \nPhryxz: apuesta 0.07 €\nSrLyce: iguala 0.07 €\nniyomalo: se retira \n*** TURN *** [5d 5h 7s] [Kc]\nPhryxz: pasa \nSrLyce: pasa \n*** RIVER *** [5d 5h 7s Kc] [4d]\nPhryxz: apuesta 0.33 €\nSrLyce: iguala 0.33 €\n*** SHOW DOWN ***\nPhryxz: muestra [9d Kd] (doble pareja, reyes y cincos)\nSrLyce: descarta su mano sin mostrar \nPhryxz se lleva 0.89 € del bote \n*** RESUMEN ***\nBote total 0.95 € | Comisión 0.06 € \nComunitarias [5d 5h 7s Kc 4d]\nAsiento 5: lehamock\nAsiento 1: Phryxz (ciega grande) muestra [9d Kd] y ganó (0.89 €) con doble pareja, reyes y cincos\nAsiento 2: serviettski(fr) se retiró antes del Flop (no apostó)\nAsiento 3: SrLyce descartó sin mostrar [Td Tc]\nAsiento 4: chordewman (botón) se retiró antes del Flop (no apostó)\nAsiento 6: niyomalo (ciega pequeña) se retiró en el Flop"
}