{
  "hand_id": "257237730051",
  "date": "06-08-2025 17:52:25",
  "table": "Euneus III",
  "game_type": "holdem",
  "hero": "SrLyce",
  "hero_position": "",
  "hero_cards": [
    "9s",
    "2c"
  ],
  "stacks": {
    "DeMula62": 100.0,
    "Il_BM00": 108.0,
    "djrojas9": 151.5,
    "eleuvehache": 95.5,
    "SrLyce": 98.5,
    "t053n": 71.5
  },
  "actions": {
    "preflop": [
      "Asiento 1: DeMula62 (2 € en fichas)",
      "Asiento 2: Il_BM00 (2.16 € en fichas)",
      "Asiento 3: djrojas9 (3.03 € en fichas)",
      "Asiento 4: eleuvehache (1.91 € en fichas)",
      "Asiento 5: SrLyce (1.97 € en fichas)",
      "Asiento 6: t053n (1.43 € en fichas)",
      "DeMula62: pone la ciega pequeña 0.01 €",
      "Il_BM00: pone la ciega grande 0.02 €",
      "djrojas9: sube 0.04 € a 0.06 €",
      "eleuvehache: se retira",
      "SrLyce: se retira",
      "t053n: iguala 0.06 €",
      "DeMula62: sube 0.22 € a 0.28 €",
      "Il_BM00: se retira",
      "djrojas9: se retira",
      "t053n: se retira",
      "DeMula62: no muestra su mano",
      "Asiento 1: DeMula62 (ciega pequeña) recaudó (0.20 €)",
      "Asiento 2: Il_BM00 (ciega grande) se retiró antes del Flop",
      "Asiento 3: djrojas9 se retiró antes del Flop",
      "Asiento 4: eleuvehache se retiró antes del Flop (no apostó)",
      "Asiento 5: SrLyce se retiró antes del Flop (no apostó)",
      "Asiento 6: t053n (botón) se retiró antes del Flop"
    ],
    "flop": [],
    "turn": [],
    "river": []
  },
  "board": [],
  "winner": "DeMula62",
  "win_amount": 10.0,
  "sb": 0.01,
  "bb": 0.02,
  "rake": 0.0,
  "raw_text": "Mano n.º 257237730051 de PokerStars:  Hold'em No Limit (0.01 €/0.02 € EUR) - 06-08-2025 17:52:25 CET [06-08-2025 11:52:25 ET]\nMesa \"Euneus III\" 6-max El asiento n.º 6 es el botón\nAsiento 1: DeMula62 (2 € en fichas) \nAsiento 2: Il_BM00 (2.16 € en fichas) \nAsiento 3: djrojas9 (3.03 € en fichas) \nAsiento 4: eleuvehache (1.91 € en fichas) \nAsiento 5: SrLyce (1.97 € en fichas) \nAsiento 6: t053n (1.43 € en fichas) \nDeMula62: pone la ciega pequeña 0.01 €\nIl_BM00: pone la ciega grande 0.02 €\n*** CARTAS DE MANO ***\nRepartidas a SrLyce [9s 2c]\ndjrojas9: sube 0.04 € a 0.06 €\neleuvehache: se retira \nSrLyce: se retira \nt053n: iguala 0.06 €\nDeMula62: sube 0.22 € a 0.28 €\nIl_BM00: se retira \ndjrojas9: se retira \nt053n: se retira \nLa apuesta no igualada (0.22 €) ha sido devuelta a DeMula62\nDeMula62 se lleva 0.20 € del bote \nDeMula62: no muestra su mano \n*** RESUMEN ***\nBote total 0.20 € | Comisión 0 € \nAsiento 1: DeMula62 (ciega pequeña) recaudó (0.20 €)\nAsiento 2: Il_BM00 (ciega grande) se retiró antes del Flop\nAsiento 3: djrojas9 se retiró antes del Flop\nAsiento 4: eleuvehache se retiró antes del Flop (no apostó)\nAsiento 5: SrLyce se retiró antes del Flop (no apostó)\nAsiento 6: t053n (botón) se retiró antes del Flop"
}