{
  "hand_id": "257238078188",
  "date": "06-08-2025 18:26:07",
  "table": "Alruccabah II",
  "game_type": "holdem",
  "hero": "SrLyce",
  "hero_position": "",
  "hero_cards": [
    "7h",
    "4s"
  ],
  "stacks": {
    "SrLyce": 99.0,
    "Davdgoni": 264.0,
    "PerroBestia": 41.5,
    "Nicanor Cast": 54.0,
    "THEBLACK972": 171.5
  },
  "actions": {
    "preflop": [
      "Asiento 1: SrLyce (1.98 € en fichas)",
      "Asiento 2: Davdgoni (5.28 € en fichas)",
      "Asiento 3: PerroBestia (0.83 € en fichas)",
      "Asiento 4: serviettski(fr) (2.03 € en fichas)",
      "Asiento 5: Nicanor Cast (1.08 € en fichas)",
      "Asiento 6: THEBLACK972 (3.43 € en fichas)",
      "THEBLACK972: pone la ciega pequeña 0.01 €",
      "SrLyce: pone la ciega grande 0.02 €",
      "Davdgoni: se retira",
      "PerroBestia: se retira",
      "serviettski(fr): se retira",
      "Nicanor Cast: se retira",
      "THEBLACK972: sube 0.02 € a 0.04 €",
      "SrLyce: iguala 0.02 €"
    ],
    "flop": [
      "THEBLACK972: pasa",
      "SrLyce: pasa"
    ],
    "turn": [
      "THEBLACK972: pasa",
      "SrLyce: pasa"
    ],
    "river": [
      "THEBLACK972: apuesta 0.02 €",
      "SrLyce: se retira",
      "THEBLACK972: no muestra su mano",
      "Asiento 1: SrLyce (ciega grande) se retiró en el River",
      "Asiento 2: Davdgoni se retiró antes del Flop (no apostó)",
      "Asiento 3: PerroBestia se retiró antes del Flop (no apostó)",
      "Asiento 4: serviettski(fr) se retiró antes del Flop (no apostó)",
      "Asiento 5: Nicanor Cast (botón) se retiró antes del Flop (no apostó)",
      "Asiento 6: THEBLACK972 (ciega pequeña) recaudó (0.08 €)"
    ]
  },
  "board": [
    "8h",
    "Qh",
    "9d",
    "2d",
    "As"
  ],
  "winner": "THEBLACK972",
  "win_amount": 4.0,
  "sb": 0.01,
  "bb": 0.02,
  "rake": 0.0,
  "raw_text": "Mano n.º 257238078188 de PokerStars:  Hold'em No Limit (0.01 €/0.02 € EUR) - 06-08-2025 18:26:07 CET [06-08-2025 12:26:07 ET]\nMesa \"Alruccabah II\" 6-max El asiento n.º 5 es el botón\nAsiento 1: SrLyce (1.98 € en fichas) \nAsiento 2: Davdgoni (5.28 € en fichas) \nAsiento 3: PerroBestia (0.83 € en fichas) \nAsiento 4: serviettski(fr) (2.03 € en fichas) \nAsiento 5: Nicanor Cast (1.08 € en fichas) \nAsiento 6: THEBLACK972 (3.43 € en fichas) \nTHEBLACK972: pone la ciega pequeña 0.01 €\nSrLyce: pone la ciega grande 0.02 €\n*** CARTAS DE MANO ***\nRepartidas a SrLyce [7h 4s]\nDavdgoni: se retira \nPerroBestia: se retira \nserviettski(fr) ha agotado su tiempo\nserviettski(fr): se retira \nNicanor Cast: se retira \nTHEBLACK972: sube 0.02 € a 0.04 €\nSrLyce: iguala 0.02 €\n*** FLOP *** [8h Qh 9d]\nTHEBLACK972: pasa \nSrLyce: pasa \n*** TURN *** [8h Qh 9d] [2d]\nTHEBLACK972: pasa \nSrLyce: pasa \n*** RIVER *** [8h Qh 9d 2d] [As]\nTHEBLACK972: apuesta 0.02 €\nSrLyce: se retira \nLa apuesta no igualada (0.02 €) ha sido devuelta a THEBLACK972\nTHEBLACK972 se lleva 0.08 € del bote \nTHEBLACK972: no muestra su mano \n*** RESUMEN ***\nBote total 0.08 € | Comisión 0 € \nComunitarias [8h Qh 9d 2d As]\nAsiento 1: SrLyce (ciega grande) se retiró en el River\nAsiento 2: Davdgoni se retiró antes del Flop (no apostó)\nAsiento 3: PerroBestia se retiró antes del Flop (no apostó)\nAsiento 4: serviettski(fr) se retiró antes del Flop (no apostó)\nAsiento 5: Nicanor Cast (botón) se retiró antes del Flop (no apostó)\nAsiento 6: THEBLACK972 (ciega pequeña) recaudó (0.08 €)"
}