{
  "hand_id": "257237783503",
  "date": "06-08-2025 17:58:16",
  "table": "Atreus",
  "game_type": "holdem",
  "hero": "SrLyce",
  "hero_position": "",
  "hero_cards": [
    "4h",
    "Jc"
  ],
  "stacks": {
    "PrendsCa": 106.5,
    "NRules82": 82.5,
    "JENOFONTE73": 132.5,
    "JGDOBLAS": 93.5,
    "SrLyce": 105.5
  },
  "actions": {
    "preflop": [
      "Asiento 1: PrendsCa (2.13 € en fichas)",
      "Asiento 2: NRules82 (1.65 € en fichas)",
      "Asiento 3: JENOFONTE73 (2.65 € en fichas)",
      "Asiento 4: JGDOBLAS (1.87 € en fichas)",
      "Asiento 5: SrLyce (2.11 € en fichas)",
      "NRules82: pone la ciega pequeña 0.01 €",
      "JENOFONTE73: pone la ciega grande 0.02 €",
      "JGDOBLAS: se retira",
      "SrLyce: se retira",
      "PrendsCa: sube 0.02 € a 0.04 €",
      "NRules82: se retira",
      "JENOFONTE73: iguala 0.02 €"
    ],
    "flop": [
      "JENOFONTE73: pasa",
      "PrendsCa: apuesta 0.08 €",
      "JENOFONTE73: iguala 0.08 €"
    ],
    "turn": [
      "JENOFONTE73: pasa",
      "PrendsCa: apuesta 2.01 € y está all-in",
      "JENOFONTE73: se retira",
      "PrendsCa: no muestra su mano",
      "Asiento 1: PrendsCa (botón) recaudó (0.23 €)",
      "Asiento 2: NRules82 (ciega pequeña) se retiró antes del Flop",
      "Asiento 3: JENOFONTE73 (ciega grande) se retiró en el Turn",
      "Asiento 4: JGDOBLAS se retiró antes del Flop (no apostó)",
      "Asiento 5: SrLyce se retiró antes del Flop (no apostó)"
    ],
    "river": []
  },
  "board": [
    "3d",
    "Th",
    "Qd",
    "9s"
  ],
  "winner": "PrendsCa",
  "win_amount": 11.5,
  "sb": 0.01,
  "bb": 0.02,
  "rake": 1.0,
  "raw_text": "Mano n.º 257237783503 de PokerStars:  Hold'em No Limit (0.01 €/0.02 € EUR) - 06-08-2025 17:58:16 CET [06-08-2025 11:58:16 ET]\nMesa \"Atreus\" 6-max El asiento n.º 1 es el botón\nAsiento 1: PrendsCa (2.13 € en fichas) \nAsiento 2: NRules82 (1.65 € en fichas) \nAsiento 3: JENOFONTE73 (2.65 € en fichas) \nAsiento 4: JGDOBLAS (1.87 € en fichas) \nAsiento 5: SrLyce (2.11 € en fichas) \nNRules82: pone la ciega pequeña 0.01 €\nJENOFONTE73: pone la ciega grande 0.02 €\n*** CARTAS DE MANO ***\nRepartidas a SrLyce [4h Jc]\nJGDOBLAS: se retira \nFishamanReggae se une a la mesa en el asiento n.º 6 \nSrLyce: se retira \nPrendsCa: sube 0.02 € a 0.04 €\nNRules82: se retira \nJENOFONTE73: iguala 0.02 €\n*** FLOP *** [3d Th Qd]\nJENOFONTE73: pasa \nPrendsCa: apuesta 0.08 €\nJENOFONTE73: iguala 0.08 €\n*** TURN *** [3d Th Qd] [9s]\nJENOFONTE73: pasa \nPrendsCa: apuesta 2.01 € y está all-in\nJENOFONTE73: se retira \nLa apuesta no igualada (2.01 €) ha sido devuelta a PrendsCa\nPrendsCa se lleva 0.23 € del bote \nPrendsCa: no muestra su mano \n*** RESUMEN ***\nBote total 0.25 € | Comisión 0.02 € \nComunitarias [3d Th Qd 9s]\nAsiento 1: PrendsCa (botón) recaudó (0.23 €)\nAsiento 2: NRules82 (ciega pequeña) se retiró antes del Flop\nAsiento 3: JENOFONTE73 (ciega grande) se retiró en el Turn\nAsiento 4: JGDOBLAS se retiró antes del Flop (no apostó)\nAsiento 5: SrLyce se retiró antes del Flop (no apostó)"
}