{
  "hand_id": "257148901369",
  "date": "30-07-2025 21:52:03",
  "table": "Sirona",
  "game_type": "holdem",
  "hero": "SrLyce",
  "hero_position": "",
  "hero_cards": [
    "3h",
    "Kc"
  ],
  "stacks": {
    "SrLyce": 107.5,
    "lecontrebandier": 101.5,
    "christoph363": 186.5,
    "oliverdu70": 146.5,
    "olibellier": 18.0,
    "Dakoo44": 77.5
  },
  "actions": {
    "preflop": [
      "Asiento 1: SrLyce (2.15 € en fichas)",
      "Asiento 2: lecontrebandier (2.03 € en fichas)",
      "Asiento 3: christoph363 (3.73 € en fichas)",
      "Asiento 4: oliverdu70 (2.93 € en fichas)",
      "Asiento 5: olibellier (0.36 € en fichas)",
      "Asiento 6: Dakoo44 (1.55 € en fichas)",
      "SrLyce: pone la ciega pequeña 0.01 €",
      "lecontrebandier: pone la ciega grande 0.02 €",
      "christoph363: se retira",
      "oliverdu70: se retira",
      "olibellier: se retira",
      "Dakoo44: sube 0.03 € a 0.05 €",
      "SrLyce: se retira",
      "lecontrebandier: se retira",
      "Dakoo44: no muestra su mano",
      "Asiento 1: SrLyce (ciega pequeña) se retiró antes del Flop",
      "Asiento 2: lecontrebandier (ciega grande) se retiró antes del Flop",
      "Asiento 3: christoph363 se retiró antes del Flop (no apostó)",
      "Asiento 4: oliverdu70 se retiró antes del Flop (no apostó)",
      "Asiento 5: olibellier se retiró antes del Flop (no apostó)",
      "Asiento 6: Dakoo44 (botón) recaudó (0.05 €)"
    ],
    "flop": [],
    "turn": [],
    "river": []
  },
  "board": [],
  "winner": "Dakoo44",
  "win_amount": 2.5,
  "sb": 0.01,
  "bb": 0.02,
  "rake": 0.0,
  "raw_text": "Mano n.º 257148901369 de PokerStars:  Hold'em No Limit (0.01 €/0.02 € EUR) - 30-07-2025 21:52:03 CET [30-07-2025 15:52:03 ET]\nMesa \"Sirona\" 6-max El asiento n.º 6 es el botón\nAsiento 1: SrLyce (2.15 € en fichas) \nAsiento 2: lecontrebandier (2.03 € en fichas) \nAsiento 3: christoph363 (3.73 € en fichas) \nAsiento 4: oliverdu70 (2.93 € en fichas) \nAsiento 5: olibellier (0.36 € en fichas) \nAsiento 6: Dakoo44 (1.55 € en fichas) \nSrLyce: pone la ciega pequeña 0.01 €\nlecontrebandier: pone la ciega grande 0.02 €\n*** CARTAS DE MANO ***\nRepartidas a SrLyce [3h Kc]\nchristoph363: se retira \noliverdu70: se retira \nolibellier: se retira \nDakoo44: sube 0.03 € a 0.05 €\nSrLyce: se retira \nlecontrebandier: se retira \nLa apuesta no igualada (0.03 €) ha sido devuelta a Dakoo44\nDakoo44 se lleva 0.05 € del bote \nDakoo44: no muestra su mano \n*** RESUMEN ***\nBote total 0.05 € | Comisión 0 € \nAsiento 1: SrLyce (ciega pequeña) se retiró antes del Flop\nAsiento 2: lecontrebandier (ciega grande) se retiró antes del Flop\nAsiento 3: christoph363 se retiró antes del Flop (no apostó)\nAsiento 4: oliverdu70 se retiró antes del Flop (no apostó)\nAsiento 5: olibellier se retiró antes del Flop (no apostó)\nAsiento 6: Dakoo44 (botón) recaudó (0.05 €)"
}