{
  "hand_id": "257238342810",
  "date": "06-08-2025 18:49:32",
  "table": "Adelaide III",
  "game_type": "holdem",
  "hero": "SrLyce",
  "hero_position": "",
  "hero_cards": [
    "2s",
    "As"
  ],
  "stacks": {
    "N3xtTIm35": 100.5,
    "aliendee07": 52.5,
    "Ischadia": 99.0,
    "SrLyce": 100.0,
    "ismagonzalez7": 82.0
  },
  "actions": {
    "preflop": [
      "﻿Mano n.º 257238342810 de PokerStars:  Hold'em No Limit (0.01 €/0.02 € EUR) - 06-08-2025 18:49:32 CET [06-08-2025 12:49:32 ET]",
      "Asiento 1: N3xtTIm35 (2.01 € en fichas)",
      "Asiento 2: aliendee07 (1.05 € en fichas)",
      "Asiento 3: Ischadia (1.98 € en fichas)",
      "Asiento 4: SrLyce (2 € en fichas)",
      "Asiento 5: ismagonzalez7 (1.64 € en fichas)",
      "Ischadia: pone la ciega pequeña 0.01 €",
      "SrLyce: pone la ciega grande 0.02 €",
      "ismagonzalez7: se retira",
      "N3xtTIm35: se retira",
      "aliendee07: se retira",
      "Ischadia: sube 0.04 € a 0.06 €",
      "SrLyce: iguala 0.04 €"
    ],
    "flop": [
      "Ischadia: pasa",
      "SrLyce: pasa"
    ],
    "turn": [
      "Ischadia: pasa",
      "SrLyce: apuesta 0.04 €",
      "Ischadia: se retira",
      "SrLyce: no muestra su mano",
      "Asiento 1: N3xtTIm35 se retiró antes del Flop (no apostó)",
      "Asiento 2: aliendee07 (botón) se retiró antes del Flop (no apostó)",
      "Asiento 3: Ischadia (ciega pequeña) se retiró en el Turn",
      "Asiento 4: SrLyce (ciega grande) recaudó (0.11 €)",
      "Asiento 5: ismagonzalez7 se retiró antes del Flop (no apostó)"
    ],
    "river": []
  },
  "board": [
    "Qs",
    "8c",
    "Kc",
    "7c"
  ],
  "winner": "SrLyce",
  "win_amount": 5.5,
  "sb": 0.01,
  "bb": 0.02,
  "rake": 0.5,
  "raw_text": "﻿Mano n.º 257238342810 de PokerStars:  Hold'em No Limit (0.01 €/0.02 € EUR) - 06-08-2025 18:49:32 CET [06-08-2025 12:49:32 ET]\nMesa \"Adelaide III\" 6-max El asiento n.º 2 es el botón\nAsiento 1: N3xtTIm35 (2.01 € en fichas) \nAsiento 2: aliendee07 (1.05 € en fichas) \nAsiento 3: Ischadia (1.98 € en fichas) \nAsiento 4: SrLyce (2 € en fichas) \nAsiento 5: ismagonzalez7 (1.64 € en fichas) \nIschadia: pone la ciega pequeña 0.01 €\nSrLyce: pone la ciega grande 0.02 €\n*** CARTAS DE MANO ***\nRepartidas a SrLyce [2s As]\nismagonzalez7: se retira \nN3xtTIm35: se retira \naliendee07: se retira \nYopopMTG se une a la mesa en el asiento n.º 6 \nIschadia: sube 0.04 € a 0.06 €\nSrLyce: iguala 0.04 €\n*** FLOP *** [Qs 8c Kc]\nIschadia: pasa \nSrLyce: pasa \n*** TURN *** [Qs 8c Kc] [7c]\nIschadia: pasa \nSrLyce: apuesta 0.04 €\nIschadia: se retira \nLa apuesta no igualada (0.04 €) ha sido devuelta a SrLyce\nSrLyce se lleva 0.11 € del bote \nSrLyce: no muestra su mano \n*** RESUMEN ***\nBote total 0.12 € | Comisión 0.01 € \nComunitarias [Qs 8c Kc 7c]\nAsiento 1: N3xtTIm35 se retiró antes del Flop (no apostó)\nAsiento 2: aliendee07 (botón) se retiró antes del Flop (no apostó)\nAsiento 3: Ischadia (ciega pequeña) se retiró en el Turn\nAsiento 4: SrLyce (ciega grande) recaudó (0.11 €)\nAsiento 5: ismagonzalez7 se retiró antes del Flop (no apostó)"
}