{
  "hand_id": "257238568617",
  "date": "06-08-2025 19:10:46",
  "table": "Adelaide III",
  "game_type": "holdem",
  "hero": "SrLyce",
  "hero_position": "",
  "hero_cards": [
    "Ac",
    "Ah"
  ],
  "stacks": {
    "Alceo27": 100.0,
    "aliendee07": 68.0,
    "Macklemore0": 102.5,
    "SrLyce": 89.0,
    "ismagonzalez7": 67.5,
    "pauquair5": 61.0
  },
  "actions": {
    "preflop": [
      "Asiento 1: Alceo27 (2 € en fichas) está ausente",
      "Asiento 2: aliendee07 (1.36 € en fichas)",
      "Asiento 3: Macklemore0 (2.05 € en fichas)",
      "Asiento 4: SrLyce (1.78 € en fichas)",
      "Asiento 5: ismagonzalez7 (1.35 € en fichas)",
      "Asiento 6: pauquair5 (1.22 € en fichas)",
      "SrLyce: pone la ciega pequeña 0.01 €",
      "ismagonzalez7: pone la ciega grande 0.02 €",
      "Alceo27: se ausenta",
      "pauquair5: se retira",
      "aliendee07: iguala 0.02 €",
      "Macklemore0: sube 0.06 € a 0.08 €",
      "SrLyce: sube 0.22 € a 0.30 €",
      "ismagonzalez7: se retira",
      "aliendee07: se retira",
      "Macklemore0: se retira",
      "SrLyce: no muestra su mano",
      "Asiento 1: Alceo27",
      "Asiento 2: aliendee07 se retiró antes del Flop",
      "Asiento 3: Macklemore0 (botón) se retiró antes del Flop",
      "Asiento 4: SrLyce (ciega pequeña) recaudó (0.20 €)",
      "Asiento 5: ismagonzalez7 (ciega grande) se retiró antes del Flop",
      "Asiento 6: pauquair5 se retiró antes del Flop (no apostó)"
    ],
    "flop": [],
    "turn": [],
    "river": []
  },
  "board": [],
  "winner": "SrLyce",
  "win_amount": 10.0,
  "sb": 0.01,
  "bb": 0.02,
  "rake": 0.0,
  "raw_text": "Mano n.º 257238568617 de PokerStars:  Hold'em No Limit (0.01 €/0.02 € EUR) - 06-08-2025 19:10:46 CET [06-08-2025 13:10:46 ET]\nMesa \"Adelaide III\" 6-max El asiento n.º 3 es el botón\nAsiento 1: Alceo27 (2 € en fichas) está ausente\nAsiento 2: aliendee07 (1.36 € en fichas) \nAsiento 3: Macklemore0 (2.05 € en fichas) \nAsiento 4: SrLyce (1.78 € en fichas) \nAsiento 5: ismagonzalez7 (1.35 € en fichas) \nAsiento 6: pauquair5 (1.22 € en fichas) \nSrLyce: pone la ciega pequeña 0.01 €\nismagonzalez7: pone la ciega grande 0.02 €\nAlceo27: se ausenta \n*** CARTAS DE MANO ***\nRepartidas a SrLyce [Ac Ah]\npauquair5: se retira \naliendee07: iguala 0.02 €\nMacklemore0: sube 0.06 € a 0.08 €\nSrLyce: sube 0.22 € a 0.30 €\nismagonzalez7: se retira \naliendee07: se retira \nMacklemore0: se retira \nLa apuesta no igualada (0.22 €) ha sido devuelta a SrLyce\nSrLyce se lleva 0.20 € del bote \nSrLyce: no muestra su mano \n*** RESUMEN ***\nBote total 0.20 € | Comisión 0 € \nAsiento 1: Alceo27\nAsiento 2: aliendee07 se retiró antes del Flop\nAsiento 3: Macklemore0 (botón) se retiró antes del Flop\nAsiento 4: SrLyce (ciega pequeña) recaudó (0.20 €)\nAsiento 5: ismagonzalez7 (ciega grande) se retiró antes del Flop\nAsiento 6: pauquair5 se retiró antes del Flop (no apostó)"
}