{
  "hand_id": "257149202002",
  "date": "30-07-2025 22:15:13",
  "table": "Sirona",
  "game_type": "holdem",
  "hero": "SrLyce",
  "hero_position": "",
  "hero_cards": [
    "5c",
    "9h"
  ],
  "stacks": {
    "SrLyce": 251.5,
    "Tropki": 100.0,
    "christoph363": 92.5,
    "oliverdu70": 186.5,
    "hadhod1976": 38.5,
    "MitchATP65": 103.0
  },
  "actions": {
    "preflop": [
      "Asiento 1: SrLyce (5.03 € en fichas)",
      "Asiento 2: Tropki (2 € en fichas)",
      "Asiento 3: christoph363 (1.85 € en fichas)",
      "Asiento 4: oliverdu70 (3.73 € en fichas)",
      "Asiento 5: hadhod1976 (0.77 € en fichas)",
      "Asiento 6: MitchATP65 (2.06 € en fichas)",
      "oliverdu70: pone la ciega pequeña 0.01 €",
      "hadhod1976: pone la ciega grande 0.02 €",
      "MitchATP65: se retira",
      "SrLyce: se retira",
      "Tropki: sube 0.04 € a 0.06 €",
      "christoph363: se retira",
      "oliverdu70: se retira",
      "hadhod1976: se retira",
      "Tropki: no muestra su mano",
      "Asiento 1: SrLyce se retiró antes del Flop (no apostó)",
      "Asiento 2: Tropki recaudó (0.05 €)",
      "Asiento 3: christoph363 (botón) se retiró antes del Flop (no apostó)",
      "Asiento 4: oliverdu70 (ciega pequeña) se retiró antes del Flop",
      "Asiento 5: hadhod1976 (ciega grande) se retiró antes del Flop",
      "Asiento 6: MitchATP65 se retiró antes del Flop (no apostó)"
    ],
    "flop": [],
    "turn": [],
    "river": []
  },
  "board": [],
  "winner": "Tropki",
  "win_amount": 2.5,
  "sb": 0.01,
  "bb": 0.02,
  "rake": 0.0,
  "raw_text": "Mano n.º 257149202002 de PokerStars:  Hold'em No Limit (0.01 €/0.02 € EUR) - 30-07-2025 22:15:13 CET [30-07-2025 16:15:13 ET]\nMesa \"Sirona\" 6-max El asiento n.º 3 es el botón\nAsiento 1: SrLyce (5.03 € en fichas) \nAsiento 2: Tropki (2 € en fichas) \nAsiento 3: christoph363 (1.85 € en fichas) \nAsiento 4: oliverdu70 (3.73 € en fichas) \nAsiento 5: hadhod1976 (0.77 € en fichas) \nAsiento 6: MitchATP65 (2.06 € en fichas) \noliverdu70: pone la ciega pequeña 0.01 €\nhadhod1976: pone la ciega grande 0.02 €\n*** CARTAS DE MANO ***\nRepartidas a SrLyce [5c 9h]\nMitchATP65: se retira \nSrLyce: se retira \nTropki: sube 0.04 € a 0.06 €\nchristoph363: se retira \noliverdu70: se retira \nhadhod1976: se retira \nLa apuesta no igualada (0.04 €) ha sido devuelta a Tropki\nTropki se lleva 0.05 € del bote \nTropki: no muestra su mano \n*** RESUMEN ***\nBote total 0.05 € | Comisión 0 € \nAsiento 1: SrLyce se retiró antes del Flop (no apostó)\nAsiento 2: Tropki recaudó (0.05 €)\nAsiento 3: christoph363 (botón) se retiró antes del Flop (no apostó)\nAsiento 4: oliverdu70 (ciega pequeña) se retiró antes del Flop\nAsiento 5: hadhod1976 (ciega grande) se retiró antes del Flop\nAsiento 6: MitchATP65 se retiró antes del Flop (no apostó)"
}