{
  "hand_id": "257215071723",
  "date": "04-08-2025 22:22:35",
  "table": "Aldhafera II",
  "game_type": "holdem",
  "hero": "SrLyce",
  "hero_position": "",
  "hero_cards": [
    "Jh",
    "7d"
  ],
  "stacks": {
    "wsx25": 95.0,
    "BudyXXIII": 266.5,
    "SrLyce": 34.0,
    "rhidoxxx": 87.0,
    "jte-ken": 123.5,
    "betterrrrrr": 161.5
  },
  "actions": {
    "preflop": [
      "Asiento 1: wsx25 (1.90 € en fichas)",
      "Asiento 2: BudyXXIII (5.33 € en fichas)",
      "Asiento 3: SrLyce (0.68 € en fichas)",
      "Asiento 4: rhidoxxx (1.74 € en fichas)",
      "Asiento 5: jte-ken (2.47 € en fichas)",
      "Asiento 6: betterrrrrr (3.23 € en fichas)",
      "SrLyce: pone la ciega pequeña 0.01 €",
      "rhidoxxx: pone la ciega grande 0.02 €",
      "jte-ken: se retira",
      "betterrrrrr: sube 0.04 € a 0.06 €",
      "wsx25: se retira",
      "BudyXXIII: se retira",
      "SrLyce: iguala 0.05 €",
      "rhidoxxx: se retira"
    ],
    "flop": [
      "SrLyce: pasa",
      "betterrrrrr: pasa"
    ],
    "turn": [
      "SrLyce: apuesta 0.07 €",
      "betterrrrrr: sube 0.13 € a 0.20 €",
      "SrLyce: se retira",
      "betterrrrrr: no muestra su mano",
      "Asiento 1: wsx25 se retiró antes del Flop (no apostó)",
      "Asiento 2: BudyXXIII (botón) se retiró antes del Flop (no apostó)",
      "Asiento 3: SrLyce (ciega pequeña) se retiró en el Turn",
      "Asiento 4: rhidoxxx (ciega grande) se retiró antes del Flop",
      "Asiento 5: jte-ken se retiró antes del Flop (no apostó)",
      "Asiento 6: betterrrrrr recaudó (0.26 €)"
    ],
    "river": []
  },
  "board": [
    "Ks",
    "3d",
    "4d",
    "Qs"
  ],
  "winner": "betterrrrrr",
  "win_amount": 13.0,
  "sb": 0.01,
  "bb": 0.02,
  "rake": 1.0,
  "raw_text": "Mano n.º 257215071723 de PokerStars:  Hold'em No Limit (0.01 €/0.02 € EUR) - 04-08-2025 22:22:35 CET [04-08-2025 16:22:35 ET]\nMesa \"Aldhafera II\" 6-max El asiento n.º 2 es el botón\nAsiento 1: wsx25 (1.90 € en fichas) \nAsiento 2: BudyXXIII (5.33 € en fichas) \nAsiento 3: SrLyce (0.68 € en fichas) \nAsiento 4: rhidoxxx (1.74 € en fichas) \nAsiento 5: jte-ken (2.47 € en fichas) \nAsiento 6: betterrrrrr (3.23 € en fichas) \nSrLyce: pone la ciega pequeña 0.01 €\nrhidoxxx: pone la ciega grande 0.02 €\n*** CARTAS DE MANO ***\nRepartidas a SrLyce [Jh 7d]\njte-ken: se retira \nbetterrrrrr: sube 0.04 € a 0.06 €\nwsx25: se retira \nBudyXXIII: se retira \nSrLyce: iguala 0.05 €\nrhidoxxx: se retira \n*** FLOP *** [Ks 3d 4d]\nSrLyce: pasa \nbetterrrrrr: pasa \n*** TURN *** [Ks 3d 4d] [Qs]\nSrLyce: apuesta 0.07 €\nbetterrrrrr: sube 0.13 € a 0.20 €\nSrLyce: se retira \nLa apuesta no igualada (0.13 €) ha sido devuelta a betterrrrrr\nbetterrrrrr se lleva 0.26 € del bote \nbetterrrrrr: no muestra su mano \n*** RESUMEN ***\nBote total 0.28 € | Comisión 0.02 € \nComunitarias [Ks 3d 4d Qs]\nAsiento 1: wsx25 se retiró antes del Flop (no apostó)\nAsiento 2: BudyXXIII (botón) se retiró antes del Flop (no apostó)\nAsiento 3: SrLyce (ciega pequeña) se retiró en el Turn\nAsiento 4: rhidoxxx (ciega grande) se retiró antes del Flop\nAsiento 5: jte-ken se retiró antes del Flop (no apostó)\nAsiento 6: betterrrrrr recaudó (0.26 €)"
}