{
  "hand_id": "257238548490",
  "date": "06-08-2025 19:09:04",
  "table": "Leonteus",
  "game_type": "holdem",
  "hero": "SrLyce",
  "hero_position": "",
  "hero_cards": [
    "8c",
    "2s"
  ],
  "stacks": {
    "practikal_C23": 41.5,
    "durahimovic": 295.5,
    "davinci1962": 137.0,
    "BuXHexter": 145.5,
    "Andark47": 188.0,
    "SrLyce": 99.5
  },
  "actions": {
    "preflop": [
      "Asiento 1: practikal_C23 (0.83 € en fichas)",
      "Asiento 2: durahimovic (5.91 € en fichas)",
      "Asiento 3: davinci1962 (2.74 € en fichas)",
      "Asiento 4: BuXHexter (2.91 € en fichas)",
      "Asiento 5: Andark47 (3.76 € en fichas)",
      "Asiento 6: SrLyce (1.99 € en fichas)",
      "practikal_C23: pone la ciega pequeña 0.01 €",
      "durahimovic: pone la ciega grande 0.02 €",
      "davinci1962: se retira",
      "BuXHexter: se retira",
      "Andark47: se retira",
      "SrLyce: se retira",
      "practikal_C23: se retira",
      "durahimovic: no muestra su mano",
      "Asiento 1: practikal_C23 (ciega pequeña) se retiró antes del Flop",
      "Asiento 2: durahimovic (ciega grande) recaudó (0.02 €)",
      "Asiento 3: davinci1962 se retiró antes del Flop (no apostó)",
      "Asiento 4: BuXHexter se retiró antes del Flop (no apostó)",
      "Asiento 5: Andark47 se retiró antes del Flop (no apostó)",
      "Asiento 6: SrLyce (botón) se retiró antes del Flop (no apostó)"
    ],
    "flop": [],
    "turn": [],
    "river": []
  },
  "board": [],
  "winner": "durahimovic",
  "win_amount": 1.0,
  "sb": 0.01,
  "bb": 0.02,
  "rake": 0.0,
  "raw_text": "Mano n.º 257238548490 de PokerStars:  Hold'em No Limit (0.01 €/0.02 € EUR) - 06-08-2025 19:09:04 CET [06-08-2025 13:09:04 ET]\nMesa \"Leonteus\" 6-max El asiento n.º 6 es el botón\nAsiento 1: practikal_C23 (0.83 € en fichas) \nAsiento 2: durahimovic (5.91 € en fichas) \nAsiento 3: davinci1962 (2.74 € en fichas) \nAsiento 4: BuXHexter (2.91 € en fichas) \nAsiento 5: Andark47 (3.76 € en fichas) \nAsiento 6: SrLyce (1.99 € en fichas) \npractikal_C23: pone la ciega pequeña 0.01 €\ndurahimovic: pone la ciega grande 0.02 €\n*** CARTAS DE MANO ***\nRepartidas a SrLyce [8c 2s]\ndavinci1962: se retira \nBuXHexter ha agotado su tiempo\nBuXHexter: se retira \nAndark47 ha agotado su tiempo\nAndark47: se retira \nSrLyce: se retira \npractikal_C23: se retira \nLa apuesta no igualada (0.01 €) ha sido devuelta a durahimovic\ndurahimovic se lleva 0.02 € del bote \ndurahimovic: no muestra su mano \n*** RESUMEN ***\nBote total 0.02 € | Comisión 0 € \nAsiento 1: practikal_C23 (ciega pequeña) se retiró antes del Flop\nAsiento 2: durahimovic (ciega grande) recaudó (0.02 €)\nAsiento 3: davinci1962 se retiró antes del Flop (no apostó)\nAsiento 4: BuXHexter se retiró antes del Flop (no apostó)\nAsiento 5: Andark47 se retiró antes del Flop (no apostó)\nAsiento 6: SrLyce (botón) se retiró antes del Flop (no apostó)"
}