{
  "hand_id": "257148932217",
  "date": "30-07-2025 21:54:12",
  "table": "Esclangona",
  "game_type": "holdem",
  "hero": "SrLyce",
  "hero_position": "",
  "hero_cards": [
    "7c",
    "Qh"
  ],
  "stacks": {
    "Zorgue1080": 85.5,
    "SrLyce": 159.5,
    "NoahBolete": 100.5,
    "Davdgoni": 100.0,
    "DiaZzZ1": 105.5,
    "berlcht403": 40.5
  },
  "actions": {
    "preflop": [
      "Asiento 1: Zorgue1080 (1.71 € en fichas)",
      "Asiento 2: SrLyce (3.19 € en fichas)",
      "Asiento 3: NoahBolete (2.01 € en fichas)",
      "Asiento 4: Davdgoni (2 € en fichas)",
      "Asiento 5: DiaZzZ1 (2.11 € en fichas)",
      "Asiento 6: berlcht403 (0.81 € en fichas)",
      "Zorgue1080: pone la ciega pequeña 0.01 €",
      "SrLyce: pone la ciega grande 0.02 €",
      "NoahBolete: se retira",
      "Davdgoni: sube 0.04 € a 0.06 €",
      "DiaZzZ1: se retira",
      "berlcht403: se retira",
      "Zorgue1080: se retira",
      "SrLyce: iguala 0.04 €"
    ],
    "flop": [
      "SrLyce: pasa",
      "Davdgoni: apuesta 0.06 €",
      "SrLyce: se retira",
      "Davdgoni: no muestra su mano",
      "Asiento 1: Zorgue1080 (ciega pequeña) se retiró antes del Flop",
      "Asiento 2: SrLyce (ciega grande) se retiró en el Flop",
      "Asiento 3: NoahBolete se retiró antes del Flop (no apostó)",
      "Asiento 4: Davdgoni recaudó (0.12 €)",
      "Asiento 5: DiaZzZ1 se retiró antes del Flop (no apostó)",
      "Asiento 6: berlcht403 (botón) se retiró antes del Flop (no apostó)"
    ],
    "turn": [],
    "river": []
  },
  "board": [
    "8d",
    "Ts",
    "Ac"
  ],
  "winner": "Davdgoni",
  "win_amount": 6.0,
  "sb": 0.01,
  "bb": 0.02,
  "rake": 0.5,
  "raw_text": "Mano n.º 257148932217 de PokerStars:  Hold'em No Limit (0.01 €/0.02 € EUR) - 30-07-2025 21:54:12 CET [30-07-2025 15:54:12 ET]\nMesa \"Esclangona\" 6-max El asiento n.º 6 es el botón\nAsiento 1: Zorgue1080 (1.71 € en fichas) \nAsiento 2: SrLyce (3.19 € en fichas) \nAsiento 3: NoahBolete (2.01 € en fichas) \nAsiento 4: Davdgoni (2 € en fichas) \nAsiento 5: DiaZzZ1 (2.11 € en fichas) \nAsiento 6: berlcht403 (0.81 € en fichas) \nZorgue1080: pone la ciega pequeña 0.01 €\nSrLyce: pone la ciega grande 0.02 €\n*** CARTAS DE MANO ***\nRepartidas a SrLyce [7c Qh]\nNoahBolete: se retira \nDavdgoni: sube 0.04 € a 0.06 €\nDiaZzZ1: se retira \nberlcht403: se retira \nZorgue1080: se retira \nSrLyce: iguala 0.04 €\n*** FLOP *** [8d Ts Ac]\nSrLyce: pasa \nDavdgoni: apuesta 0.06 €\nSrLyce: se retira \nLa apuesta no igualada (0.06 €) ha sido devuelta a Davdgoni\nDavdgoni se lleva 0.12 € del bote \nDavdgoni: no muestra su mano \n*** RESUMEN ***\nBote total 0.13 € | Comisión 0.01 € \nComunitarias [8d Ts Ac]\nAsiento 1: Zorgue1080 (ciega pequeña) se retiró antes del Flop\nAsiento 2: SrLyce (ciega grande) se retiró en el Flop\nAsiento 3: NoahBolete se retiró antes del Flop (no apostó)\nAsiento 4: Davdgoni recaudó (0.12 €)\nAsiento 5: DiaZzZ1 se retiró antes del Flop (no apostó)\nAsiento 6: berlcht403 (botón) se retiró antes del Flop (no apostó)"
}