{
  "hand_id": "257237838108",
  "date": "06-08-2025 18:04:13",
  "table": "Atreus",
  "game_type": "holdem",
  "hero": "SrLyce",
  "hero_position": "",
  "hero_cards": [
    "Qc",
    "9c"
  ],
  "stacks": {
    "PrendsCa": 111.5,
    "NRules82": 50.0,
    "JENOFONTE73": 123.0,
    "JGDOBLAS": 201.5,
    "SrLyce": 59.5,
    "FishamanReggae": 48.0
  },
  "actions": {
    "preflop": [
      "Asiento 1: PrendsCa (2.23 € en fichas)",
      "Asiento 2: NRules82 (1 € en fichas)",
      "Asiento 3: JENOFONTE73 (2.46 € en fichas)",
      "Asiento 4: JGDOBLAS (4.03 € en fichas)",
      "Asiento 5: SrLyce (1.19 € en fichas)",
      "Asiento 6: FishamanReggae (0.96 € en fichas)",
      "NRules82: pone la ciega pequeña 0.01 €",
      "JENOFONTE73: pone la ciega grande 0.02 €",
      "JGDOBLAS: se retira",
      "SrLyce: sube 0.03 € a 0.05 €",
      "FishamanReggae: se retira",
      "PrendsCa: se retira",
      "NRules82: iguala 0.04 €",
      "JENOFONTE73: iguala 0.03 €"
    ],
    "flop": [
      "NRules82: pasa",
      "JENOFONTE73: pasa",
      "SrLyce: apuesta 0.05 €",
      "NRules82: iguala 0.05 €",
      "JENOFONTE73: se retira"
    ],
    "turn": [
      "NRules82: pasa",
      "SrLyce: apuesta 0.12 €",
      "NRules82: iguala 0.12 €"
    ],
    "river": [
      "NRules82: pasa",
      "SrLyce: apuesta 0.37 €",
      "NRules82: iguala 0.37 €",
      "SrLyce: muestra [Qc 9c] (doble pareja, damas y nueves)",
      "NRules82: muestra [Ks Td] (color, carta alta dama)",
      "Asiento 1: PrendsCa (botón) se retiró antes del Flop (no apostó)",
      "Asiento 2: NRules82 (ciega pequeña) muestra [Ks Td] y ganó (1.16 €) con color, carta alta dama",
      "Asiento 3: JENOFONTE73 (ciega grande) se retiró en el Flop",
      "Asiento 4: JGDOBLAS se retiró antes del Flop (no apostó)",
      "Asiento 5: SrLyce muestra [Qc 9c] y perdió con doble pareja, damas y nueves",
      "Asiento 6: FishamanReggae se retiró antes del Flop (no apostó)"
    ]
  },
  "board": [
    "Jc",
    "7d",
    "9d",
    "Qd",
    "5d"
  ],
  "winner": "NRules82",
  "win_amount": 58.0,
  "sb": 0.01,
  "bb": 0.02,
  "rake": 3.5,
  "raw_text": "Mano n.º 257237838108 de PokerStars:  Hold'em No Limit (0.01 €/0.02 € EUR) - 06-08-2025 18:04:13 CET [06-08-2025 12:04:13 ET]\nMesa \"Atreus\" 6-max El asiento n.º 1 es el botón\nAsiento 1: PrendsCa (2.23 € en fichas) \nAsiento 2: NRules82 (1 € en fichas) \nAsiento 3: JENOFONTE73 (2.46 € en fichas) \nAsiento 4: JGDOBLAS (4.03 € en fichas) \nAsiento 5: SrLyce (1.19 € en fichas) \nAsiento 6: FishamanReggae (0.96 € en fichas) \nNRules82: pone la ciega pequeña 0.01 €\nJENOFONTE73: pone la ciega grande 0.02 €\n*** CARTAS DE MANO ***\nRepartidas a SrLyce [Qc 9c]\nJGDOBLAS: se retira \nSrLyce: sube 0.03 € a 0.05 €\nFishamanReggae: se retira \nPrendsCa: se retira \nNRules82: iguala 0.04 €\nJENOFONTE73: iguala 0.03 €\n*** FLOP *** [Jc 7d 9d]\nNRules82: pasa \nJENOFONTE73: pasa \nSrLyce: apuesta 0.05 €\nNRules82: iguala 0.05 €\nJENOFONTE73: se retira \n*** TURN *** [Jc 7d 9d] [Qd]\nNRules82: pasa \nSrLyce: apuesta 0.12 €\nNRules82: iguala 0.12 €\n*** RIVER *** [Jc 7d 9d Qd] [5d]\nNRules82: pasa \nSrLyce: apuesta 0.37 €\nNRules82: iguala 0.37 €\n*** SHOW DOWN ***\nSrLyce: muestra [Qc 9c] (doble pareja, damas y nueves)\nNRules82: muestra [Ks Td] (color, carta alta dama)\nNRules82 se lleva 1.16 € del bote \n*** RESUMEN ***\nBote total 1.23 € | Comisión 0.07 € \nComunitarias [Jc 7d 9d Qd 5d]\nAsiento 1: PrendsCa (botón) se retiró antes del Flop (no apostó)\nAsiento 2: NRules82 (ciega pequeña) muestra [Ks Td] y ganó (1.16 €) con color, carta alta dama\nAsiento 3: JENOFONTE73 (ciega grande) se retiró en el Flop\nAsiento 4: JGDOBLAS se retiró antes del Flop (no apostó)\nAsiento 5: SrLyce muestra [Qc 9c] y perdió con doble pareja, damas y nueves\nAsiento 6: FishamanReggae se retiró antes del Flop (no apostó)"
}