{
  "hand_id": "257168388883",
  "date": "01-08-2025 11:38:48",
  "table": "Jupiter",
  "game_type": "holdem",
  "hero": "SrLyce",
  "hero_position": "",
  "hero_cards": [
    "9c",
    "3s"
  ],
  "stacks": {
    "sifilis5": 100.0,
    "Filou203": 104.0,
    "SrLyce": 112.5,
    "LOLA19711971": 40.0,
    "dadou13mars": 209.0,
    "Alvii37": 117.5
  },
  "actions": {
    "preflop": [
      "Asiento 1: sifilis5 (2 € en fichas)",
      "Asiento 2: Filou203 (2.08 € en fichas)",
      "Asiento 3: SrLyce (2.25 € en fichas)",
      "Asiento 4: LOLA19711971 (0.80 € en fichas)",
      "Asiento 5: dadou13mars (4.18 € en fichas)",
      "Asiento 6: Alvii37 (2.35 € en fichas)",
      "SrLyce: pone la ciega pequeña 0.01 €",
      "LOLA19711971: pone la ciega grande 0.02 €",
      "dadou13mars: sube 0.04 € a 0.06 €",
      "Alvii37: se retira",
      "sifilis5: se retira",
      "Filou203: se retira",
      "SrLyce: se retira",
      "LOLA19711971: se retira",
      "dadou13mars: no muestra su mano",
      "Asiento 1: sifilis5 se retiró antes del Flop (no apostó)",
      "Asiento 2: Filou203 (botón) se retiró antes del Flop (no apostó)",
      "Asiento 3: SrLyce (ciega pequeña) se retiró antes del Flop",
      "Asiento 4: LOLA19711971 (ciega grande) se retiró antes del Flop",
      "Asiento 5: dadou13mars recaudó (0.05 €)",
      "Asiento 6: Alvii37 se retiró antes del Flop (no apostó)"
    ],
    "flop": [],
    "turn": [],
    "river": []
  },
  "board": [],
  "winner": "dadou13mars",
  "win_amount": 2.5,
  "sb": 0.01,
  "bb": 0.02,
  "rake": 0.0,
  "raw_text": "Mano n.º 257168388883 de PokerStars:  Hold'em No Limit (0.01 €/0.02 € EUR) - 01-08-2025 11:38:48 CET [01-08-2025 5:38:48 ET]\nMesa \"Jupiter\" 6-max El asiento n.º 2 es el botón\nAsiento 1: sifilis5 (2 € en fichas) \nAsiento 2: Filou203 (2.08 € en fichas) \nAsiento 3: SrLyce (2.25 € en fichas) \nAsiento 4: LOLA19711971 (0.80 € en fichas) \nAsiento 5: dadou13mars (4.18 € en fichas) \nAsiento 6: Alvii37 (2.35 € en fichas) \nSrLyce: pone la ciega pequeña 0.01 €\nLOLA19711971: pone la ciega grande 0.02 €\n*** CARTAS DE MANO ***\nRepartidas a SrLyce [9c 3s]\ndadou13mars: sube 0.04 € a 0.06 €\nAlvii37: se retira \nsifilis5: se retira \nFilou203: se retira \nSrLyce: se retira \nLOLA19711971: se retira \nLa apuesta no igualada (0.04 €) ha sido devuelta a dadou13mars\ndadou13mars se lleva 0.05 € del bote \ndadou13mars: no muestra su mano \n*** RESUMEN ***\nBote total 0.05 € | Comisión 0 € \nAsiento 1: sifilis5 se retiró antes del Flop (no apostó)\nAsiento 2: Filou203 (botón) se retiró antes del Flop (no apostó)\nAsiento 3: SrLyce (ciega pequeña) se retiró antes del Flop\nAsiento 4: LOLA19711971 (ciega grande) se retiró antes del Flop\nAsiento 5: dadou13mars recaudó (0.05 €)\nAsiento 6: Alvii37 se retiró antes del Flop (no apostó)"
}