{
  "hand_id": "257238383407",
  "date": "06-08-2025 18:53:06",
  "table": "Alruccabah II",
  "game_type": "holdem",
  "hero": "SrLyce",
  "hero_position": "",
  "hero_cards": [
    "7h",
    "Kd"
  ],
  "stacks": {
    "SrLyce": 98.0,
    "yonisanlu": 100.0,
    "Nicanor Cast": 54.0,
    "rayao32": 49.0
  },
  "actions": {
    "preflop": [
      "Asiento 1: SrLyce (1.96 € en fichas)",
      "Asiento 3: yonisanlu (2 € en fichas)",
      "Asiento 4: serviettski(fr) (2.03 € en fichas)",
      "Asiento 5: Nicanor Cast (1.08 € en fichas)",
      "Asiento 6: rayao32 (0.98 € en fichas)",
      "SrLyce: pone la ciega pequeña 0.01 €",
      "yonisanlu: pone la ciega grande 0.02 €",
      "serviettski(fr): se retira",
      "Nicanor Cast: se retira",
      "rayao32: iguala 0.02 €",
      "SrLyce: iguala 0.01 €",
      "yonisanlu: pasa"
    ],
    "flop": [
      "SrLyce: pasa",
      "yonisanlu: pasa",
      "rayao32: pasa"
    ],
    "turn": [
      "SrLyce: pasa",
      "yonisanlu: apuesta 0.03 €",
      "rayao32: se retira",
      "SrLyce: se retira",
      "yonisanlu: no muestra su mano",
      "Asiento 1: SrLyce (ciega pequeña) se retiró en el Turn",
      "Asiento 3: yonisanlu (ciega grande) recaudó (0.06 €)",
      "Asiento 4: serviettski(fr) se retiró antes del Flop (no apostó)",
      "Asiento 5: Nicanor Cast se retiró antes del Flop (no apostó)",
      "Asiento 6: rayao32 (botón) se retiró en el Turn"
    ],
    "river": []
  },
  "board": [
    "4h",
    "5d",
    "3c",
    "Qc"
  ],
  "winner": "yonisanlu",
  "win_amount": 3.0,
  "sb": 0.01,
  "bb": 0.02,
  "rake": 0.0,
  "raw_text": "Mano n.º 257238383407 de PokerStars:  Hold'em No Limit (0.01 €/0.02 € EUR) - 06-08-2025 18:53:06 CET [06-08-2025 12:53:06 ET]\nMesa \"Alruccabah II\" 6-max El asiento n.º 6 es el botón\nAsiento 1: SrLyce (1.96 € en fichas) \nAsiento 3: yonisanlu (2 € en fichas) \nAsiento 4: serviettski(fr) (2.03 € en fichas) \nAsiento 5: Nicanor Cast (1.08 € en fichas) \nAsiento 6: rayao32 (0.98 € en fichas) \nSrLyce: pone la ciega pequeña 0.01 €\nyonisanlu: pone la ciega grande 0.02 €\n*** CARTAS DE MANO ***\nRepartidas a SrLyce [7h Kd]\nzoioachado se une a la mesa en el asiento n.º 2 \nserviettski(fr): se retira \nNicanor Cast: se retira \nrayao32: iguala 0.02 €\nSrLyce: iguala 0.01 €\nyonisanlu: pasa \n*** FLOP *** [4h 5d 3c]\nSrLyce: pasa \nyonisanlu: pasa \nrayao32: pasa \n*** TURN *** [4h 5d 3c] [Qc]\nSrLyce: pasa \nyonisanlu: apuesta 0.03 €\nrayao32: se retira \nSrLyce: se retira \nLa apuesta no igualada (0.03 €) ha sido devuelta a yonisanlu\nyonisanlu se lleva 0.06 € del bote \nyonisanlu: no muestra su mano \n*** RESUMEN ***\nBote total 0.06 € | Comisión 0 € \nComunitarias [4h 5d 3c Qc]\nAsiento 1: SrLyce (ciega pequeña) se retiró en el Turn\nAsiento 3: yonisanlu (ciega grande) recaudó (0.06 €)\nAsiento 4: serviettski(fr) se retiró antes del Flop (no apostó)\nAsiento 5: Nicanor Cast se retiró antes del Flop (no apostó)\nAsiento 6: rayao32 (botón) se retiró en el Turn"
}