{
  "hand_id": "257150269477",
  "date": "30-07-2025 23:30:01",
  "table": "Gilgamesh",
  "game_type": "holdem",
  "hero": "SrLyce",
  "hero_position": "",
  "hero_cards": [
    "8d",
    "5c"
  ],
  "stacks": {
    "ozil111": 100.0,
    "riverrrrrrmagic": 125.5,
    "SrLyce": 106.5,
    "Jumby34": 101.5,
    "xapkk": 100.0,
    "Fretzo67500": 144.0
  },
  "actions": {
    "preflop": [
      "Asiento 5: ozil111 (2 € en fichas) está ausente",
      "Asiento 1: riverrrrrrmagic (2.51 € en fichas)",
      "Asiento 2: SrLyce (2.13 € en fichas)",
      "Asiento 3: Jumby34 (2.03 € en fichas)",
      "Asiento 4: xapkk (2 € en fichas)",
      "Asiento 6: Fretzo67500 (2.88 € en fichas)",
      "SrLyce: pone la ciega pequeña 0.01 €",
      "Jumby34: pone la ciega grande 0.02 €",
      "ozil111: se ausenta",
      "xapkk: se retira",
      "Fretzo67500: iguala 0.02 €",
      "riverrrrrrmagic: se retira",
      "SrLyce: se retira",
      "Jumby34: pasa"
    ],
    "flop": [
      "Jumby34: apuesta 0.04 €",
      "Fretzo67500: se retira",
      "Jumby34: no muestra su mano",
      "Asiento 5: ozil111",
      "Asiento 1: riverrrrrrmagic (botón) se retiró antes del Flop (no apostó)",
      "Asiento 2: SrLyce (ciega pequeña) se retiró antes del Flop",
      "Asiento 3: Jumby34 (ciega grande) recaudó (0.05 €)",
      "Asiento 4: xapkk se retiró antes del Flop (no apostó)",
      "Asiento 6: Fretzo67500 se retiró en el Flop"
    ],
    "turn": [],
    "river": []
  },
  "board": [
    "Ac",
    "Th",
    "Kc"
  ],
  "winner": "Jumby34",
  "win_amount": 2.5,
  "sb": 0.01,
  "bb": 0.02,
  "rake": 0.0,
  "raw_text": "Mano n.º 257150269477 de PokerStars:  Hold'em No Limit (0.01 €/0.02 € EUR) - 30-07-2025 23:30:01 CET [30-07-2025 17:30:01 ET]\nMesa \"Gilgamesh\" 6-max El asiento n.º 1 es el botón\nAsiento 5: ozil111 (2 € en fichas) está ausente\nAsiento 1: riverrrrrrmagic (2.51 € en fichas) \nAsiento 2: SrLyce (2.13 € en fichas) \nAsiento 3: Jumby34 (2.03 € en fichas) \nAsiento 4: xapkk (2 € en fichas) \nAsiento 6: Fretzo67500 (2.88 € en fichas) \nSrLyce: pone la ciega pequeña 0.01 €\nJumby34: pone la ciega grande 0.02 €\nozil111: se ausenta \n*** CARTAS DE MANO ***\nRepartidas a SrLyce [8d 5c]\nxapkk ha agotado su tiempo\nxapkk: se retira \nFretzo67500: iguala 0.02 €\nriverrrrrrmagic: se retira \nSrLyce: se retira \nJumby34: pasa \n*** FLOP *** [Ac Th Kc]\nJumby34: apuesta 0.04 €\nFretzo67500: se retira \nLa apuesta no igualada (0.04 €) ha sido devuelta a Jumby34\nJumby34 se lleva 0.05 € del bote \nJumby34: no muestra su mano \n*** RESUMEN ***\nBote total 0.05 € | Comisión 0 € \nComunitarias [Ac Th Kc]\nAsiento 5: ozil111\nAsiento 1: riverrrrrrmagic (botón) se retiró antes del Flop (no apostó)\nAsiento 2: SrLyce (ciega pequeña) se retiró antes del Flop\nAsiento 3: Jumby34 (ciega grande) recaudó (0.05 €)\nAsiento 4: xapkk se retiró antes del Flop (no apostó)\nAsiento 6: Fretzo67500 se retiró en el Flop"
}