{
  "hand_id": "257168308852",
  "date": "01-08-2025 11:24:02",
  "table": "Atlas",
  "game_type": "holdem",
  "hero": "SrLyce",
  "hero_position": "",
  "hero_cards": [
    "3d",
    "7c"
  ],
  "stacks": {
    "SrLyce": 92.0,
    "Fharock": 88.0,
    "ecuinas": 102.5,
    "LxckxStrxkx": 105.0,
    "erCampos23": 32.5,
    "Akourdideh": 119.0
  },
  "actions": {
    "preflop": [
      "Asiento 1: SrLyce (1.84 € en fichas)",
      "Asiento 2: Fharock (1.76 € en fichas)",
      "Asiento 3: ecuinas (2.05 € en fichas)",
      "Asiento 4: LxckxStrxkx (2.10 € en fichas)",
      "Asiento 5: erCampos23 (0.65 € en fichas)",
      "Asiento 6: Akourdideh (2.38 € en fichas)",
      "SrLyce: pone la ciega pequeña 0.01 €",
      "Fharock: pone la ciega grande 0.02 €",
      "ecuinas: se retira",
      "LxckxStrxkx: se retira",
      "erCampos23: iguala 0.02 €",
      "Akourdideh: se retira",
      "SrLyce: se retira",
      "Fharock: sube 0.04 € a 0.06 €",
      "erCampos23: iguala 0.04 €"
    ],
    "flop": [
      "Fharock: apuesta 0.06 €",
      "erCampos23: iguala 0.06 €"
    ],
    "turn": [
      "Fharock: pasa",
      "erCampos23: pasa"
    ],
    "river": [
      "Fharock: apuesta 0.12 €",
      "erCampos23: se retira",
      "Fharock: no muestra su mano",
      "Asiento 1: SrLyce (ciega pequeña) se retiró antes del Flop",
      "Asiento 2: Fharock (ciega grande) recaudó (0.23 €)",
      "Asiento 3: ecuinas se retiró antes del Flop (no apostó)",
      "Asiento 4: LxckxStrxkx se retiró antes del Flop (no apostó)",
      "Asiento 5: erCampos23 se retiró en el River",
      "Asiento 6: Akourdideh (botón) se retiró antes del Flop (no apostó)"
    ]
  },
  "board": [
    "Jd",
    "9s",
    "Qs",
    "Kd",
    "6d"
  ],
  "winner": "Fharock",
  "win_amount": 11.5,
  "sb": 0.01,
  "bb": 0.02,
  "rake": 1.0,
  "raw_text": "Mano n.º 257168308852 de PokerStars:  Hold'em No Limit (0.01 €/0.02 € EUR) - 01-08-2025 11:24:02 CET [01-08-2025 5:24:02 ET]\nMesa \"Atlas\" 6-max El asiento n.º 6 es el botón\nAsiento 1: SrLyce (1.84 € en fichas) \nAsiento 2: Fharock (1.76 € en fichas) \nAsiento 3: ecuinas (2.05 € en fichas) \nAsiento 4: LxckxStrxkx (2.10 € en fichas) \nAsiento 5: erCampos23 (0.65 € en fichas) \nAsiento 6: Akourdideh (2.38 € en fichas) \nSrLyce: pone la ciega pequeña 0.01 €\nFharock: pone la ciega grande 0.02 €\n*** CARTAS DE MANO ***\nRepartidas a SrLyce [3d 7c]\necuinas: se retira \nLxckxStrxkx: se retira \nerCampos23: iguala 0.02 €\nAkourdideh: se retira \nSrLyce: se retira \nFharock: sube 0.04 € a 0.06 €\nerCampos23: iguala 0.04 €\n*** FLOP *** [Jd 9s Qs]\nFharock: apuesta 0.06 €\nerCampos23: iguala 0.06 €\n*** TURN *** [Jd 9s Qs] [Kd]\nFharock: pasa \nerCampos23: pasa \n*** RIVER *** [Jd 9s Qs Kd] [6d]\nFharock: apuesta 0.12 €\nerCampos23: se retira \nLa apuesta no igualada (0.12 €) ha sido devuelta a Fharock\nFharock se lleva 0.23 € del bote \nFharock: no muestra su mano \n*** RESUMEN ***\nBote total 0.25 € | Comisión 0.02 € \nComunitarias [Jd 9s Qs Kd 6d]\nAsiento 1: SrLyce (ciega pequeña) se retiró antes del Flop\nAsiento 2: Fharock (ciega grande) recaudó (0.23 €)\nAsiento 3: ecuinas se retiró antes del Flop (no apostó)\nAsiento 4: LxckxStrxkx se retiró antes del Flop (no apostó)\nAsiento 5: erCampos23 se retiró en el River\nAsiento 6: Akourdideh (botón) se retiró antes del Flop (no apostó)"
}