{
  "hand_id": "257238095115",
  "date": "06-08-2025 18:27:38",
  "table": "Alruccabah II",
  "game_type": "holdem",
  "hero": "SrLyce",
  "hero_position": "",
  "hero_cards": [
    "Ad",
    "8c"
  ],
  "stacks": {
    "SrLyce": 97.0,
    "Davdgoni": 264.0,
    "PerroBestia": 41.5,
    "Nicanor Cast": 54.0,
    "THEBLACK972": 173.5
  },
  "actions": {
    "preflop": [
      "Asiento 1: SrLyce (1.94 € en fichas)",
      "Asiento 2: Davdgoni (5.28 € en fichas)",
      "Asiento 3: PerroBestia (0.83 € en fichas)",
      "Asiento 4: serviettski(fr) (2.03 € en fichas)",
      "Asiento 5: Nicanor Cast (1.08 € en fichas)",
      "Asiento 6: THEBLACK972 (3.47 € en fichas)",
      "SrLyce: pone la ciega pequeña 0.01 €",
      "Davdgoni: pone la ciega grande 0.02 €",
      "PerroBestia: sube 0.03 € a 0.05 €",
      "serviettski(fr): se retira",
      "Nicanor Cast: se retira",
      "THEBLACK972: se retira",
      "SrLyce: iguala 0.04 €",
      "Davdgoni: se retira"
    ],
    "flop": [
      "SrLyce: pasa",
      "PerroBestia: pasa"
    ],
    "turn": [
      "SrLyce: apuesta 0.04 €",
      "PerroBestia: iguala 0.04 €"
    ],
    "river": [
      "SrLyce: apuesta 0.10 €",
      "PerroBestia: iguala 0.10 €",
      "SrLyce: muestra [Ad 8c] (doble pareja, ases y sietes)",
      "PerroBestia: muestra [Ah Qd] (doble pareja, ases y sietes)",
      "Asiento 1: SrLyce (ciega pequeña) muestra [Ad 8c] y ganó (0.19 €) con doble pareja, ases y sietes",
      "Asiento 2: Davdgoni (ciega grande) se retiró antes del Flop",
      "Asiento 3: PerroBestia muestra [Ah Qd] y ganó (0.19 €) con doble pareja, ases y sietes",
      "Asiento 4: serviettski(fr) se retiró antes del Flop (no apostó)",
      "Asiento 5: Nicanor Cast se retiró antes del Flop (no apostó)",
      "Asiento 6: THEBLACK972 (botón) se retiró antes del Flop (no apostó)"
    ]
  },
  "board": [
    "Td",
    "Kh",
    "Ac",
    "7d",
    "7c"
  ],
  "winner": "SrLyce",
  "win_amount": 9.5,
  "sb": 0.01,
  "bb": 0.02,
  "rake": 1.0,
  "raw_text": "Mano n.º 257238095115 de PokerStars:  Hold'em No Limit (0.01 €/0.02 € EUR) - 06-08-2025 18:27:38 CET [06-08-2025 12:27:38 ET]\nMesa \"Alruccabah II\" 6-max El asiento n.º 6 es el botón\nAsiento 1: SrLyce (1.94 € en fichas) \nAsiento 2: Davdgoni (5.28 € en fichas) \nAsiento 3: PerroBestia (0.83 € en fichas) \nAsiento 4: serviettski(fr) (2.03 € en fichas) \nAsiento 5: Nicanor Cast (1.08 € en fichas) \nAsiento 6: THEBLACK972 (3.47 € en fichas) \nSrLyce: pone la ciega pequeña 0.01 €\nDavdgoni: pone la ciega grande 0.02 €\n*** CARTAS DE MANO ***\nRepartidas a SrLyce [Ad 8c]\nPerroBestia: sube 0.03 € a 0.05 €\nserviettski(fr): se retira \nNicanor Cast: se retira \nTHEBLACK972: se retira \nSrLyce: iguala 0.04 €\nDavdgoni: se retira \n*** FLOP *** [Td Kh Ac]\nSrLyce: pasa \nPerroBestia: pasa \n*** TURN *** [Td Kh Ac] [7d]\nSrLyce: apuesta 0.04 €\nPerroBestia: iguala 0.04 €\n*** RIVER *** [Td Kh Ac 7d] [7c]\nSrLyce: apuesta 0.10 €\nPerroBestia: iguala 0.10 €\n*** SHOW DOWN ***\nSrLyce: muestra [Ad 8c] (doble pareja, ases y sietes)\nPerroBestia: muestra [Ah Qd] (doble pareja, ases y sietes)\nSrLyce se lleva 0.19 € del bote \nPerroBestia se lleva 0.19 € del bote \n*** RESUMEN ***\nBote total 0.40 € | Comisión 0.02 € \nComunitarias [Td Kh Ac 7d 7c]\nAsiento 1: SrLyce (ciega pequeña) muestra [Ad 8c] y ganó (0.19 €) con doble pareja, ases y sietes\nAsiento 2: Davdgoni (ciega grande) se retiró antes del Flop\nAsiento 3: PerroBestia muestra [Ah Qd] y ganó (0.19 €) con doble pareja, ases y sietes\nAsiento 4: serviettski(fr) se retiró antes del Flop (no apostó)\nAsiento 5: Nicanor Cast se retiró antes del Flop (no apostó)\nAsiento 6: THEBLACK972 (botón) se retiró antes del Flop (no apostó)"
}