{
  "hand_id": "257238773683",
  "date": "06-08-2025 19:27:52",
  "table": "Herculina II",
  "game_type": "holdem",
  "hero": "SrLyce",
  "hero_position": "",
  "hero_cards": [
    "Jd",
    "Jc"
  ],
  "stacks": {
    "Alceo27": 119.0,
    "David98X": 138.5,
    "JJer11": 187.5,
    "SrLyce": 142.0,
    "Macklemore0": 104.0,
    "ScarvBlack": 109.0
  },
  "actions": {
    "preflop": [
      "Asiento 1: Alceo27 (2.38 € en fichas)",
      "Asiento 2: David98X (2.77 € en fichas)",
      "Asiento 3: JJer11 (3.75 € en fichas)",
      "Asiento 4: SrLyce (2.84 € en fichas)",
      "Asiento 5: Macklemore0 (2.08 € en fichas)",
      "Asiento 6: ScarvBlack (2.18 € en fichas)",
      "SrLyce: pone la ciega pequeña 0.01 €",
      "Macklemore0: pone la ciega grande 0.02 €",
      "ScarvBlack: se retira",
      "Alceo27: se retira",
      "David98X: se retira",
      "JJer11: se retira",
      "SrLyce: sube 0.03 € a 0.05 €",
      "Macklemore0: se retira",
      "SrLyce: no muestra su mano",
      "Asiento 1: Alceo27 se retiró antes del Flop (no apostó)",
      "Asiento 2: David98X se retiró antes del Flop (no apostó)",
      "Asiento 3: JJer11 (botón) se retiró antes del Flop (no apostó)",
      "Asiento 4: SrLyce (ciega pequeña) recaudó (0.04 €)",
      "Asiento 5: Macklemore0 (ciega grande) se retiró antes del Flop",
      "Asiento 6: ScarvBlack se retiró antes del Flop (no apostó)"
    ],
    "flop": [],
    "turn": [],
    "river": []
  },
  "board": [],
  "winner": "SrLyce",
  "win_amount": 2.0,
  "sb": 0.01,
  "bb": 0.02,
  "rake": 0.0,
  "raw_text": "Mano n.º 257238773683 de PokerStars:  Hold'em No Limit (0.01 €/0.02 € EUR) - 06-08-2025 19:27:52 CET [06-08-2025 13:27:52 ET]\nMesa \"Herculina II\" 6-max El asiento n.º 3 es el botón\nAsiento 1: Alceo27 (2.38 € en fichas) \nAsiento 2: David98X (2.77 € en fichas) \nAsiento 3: JJer11 (3.75 € en fichas) \nAsiento 4: SrLyce (2.84 € en fichas) \nAsiento 5: Macklemore0 (2.08 € en fichas) \nAsiento 6: ScarvBlack (2.18 € en fichas) \nSrLyce: pone la ciega pequeña 0.01 €\nMacklemore0: pone la ciega grande 0.02 €\n*** CARTAS DE MANO ***\nRepartidas a SrLyce [Jd Jc]\nScarvBlack: se retira \nAlceo27: se retira \nDavid98X: se retira \nJJer11: se retira \nSrLyce: sube 0.03 € a 0.05 €\nMacklemore0: se retira \nLa apuesta no igualada (0.03 €) ha sido devuelta a SrLyce\nSrLyce se lleva 0.04 € del bote \nSrLyce: no muestra su mano \n*** RESUMEN ***\nBote total 0.04 € | Comisión 0 € \nAsiento 1: Alceo27 se retiró antes del Flop (no apostó)\nAsiento 2: David98X se retiró antes del Flop (no apostó)\nAsiento 3: JJer11 (botón) se retiró antes del Flop (no apostó)\nAsiento 4: SrLyce (ciega pequeña) recaudó (0.04 €)\nAsiento 5: Macklemore0 (ciega grande) se retiró antes del Flop\nAsiento 6: ScarvBlack se retiró antes del Flop (no apostó)"
}