{
  "hand_id": "257168212955",
  "date": "01-08-2025 11:05:29",
  "table": "Sekanina",
  "game_type": "holdem",
  "hero": "SrLyce",
  "hero_position": "",
  "hero_cards": [
    "9c",
    "9s"
  ],
  "stacks": {
    "practikal_C23": 86.5,
    "Alvii37": 95.0,
    "SrLyce": 102.5,
    "davinci1962": 101.0,
    "Elministrelas": 96.0
  },
  "actions": {
    "preflop": [
      "Asiento 2: practikal_C23 (1.73 € en fichas)",
      "Asiento 3: Alvii37 (1.90 € en fichas)",
      "Asiento 4: SrLyce (2.05 € en fichas)",
      "Asiento 5: davinci1962 (2.02 € en fichas)",
      "Asiento 6: Elministrelas (1.92 € en fichas)",
      "SrLyce: pone la ciega pequeña 0.01 €",
      "davinci1962: pone la ciega grande 0.02 €",
      "Elministrelas: se retira",
      "practikal_C23: se retira",
      "Alvii37: se retira",
      "SrLyce: sube 0.04 € a 0.06 €",
      "davinci1962: se retira",
      "SrLyce: no muestra su mano",
      "Asiento 2: practikal_C23 se retiró antes del Flop (no apostó)",
      "Asiento 3: Alvii37 (botón) se retiró antes del Flop (no apostó)",
      "Asiento 4: SrLyce (ciega pequeña) recaudó (0.04 €)",
      "Asiento 5: davinci1962 (ciega grande) se retiró antes del Flop",
      "Asiento 6: Elministrelas se retiró antes del Flop (no apostó)"
    ],
    "flop": [],
    "turn": [],
    "river": []
  },
  "board": [],
  "winner": "SrLyce",
  "win_amount": 2.0,
  "sb": 0.01,
  "bb": 0.02,
  "rake": 0.0,
  "raw_text": "Mano n.º 257168212955 de PokerStars:  Hold'em No Limit (0.01 €/0.02 € EUR) - 01-08-2025 11:05:29 CET [01-08-2025 5:05:29 ET]\nMesa \"Sekanina\" 6-max El asiento n.º 3 es el botón\nAsiento 2: practikal_C23 (1.73 € en fichas) \nAsiento 3: Alvii37 (1.90 € en fichas) \nAsiento 4: SrLyce (2.05 € en fichas) \nAsiento 5: davinci1962 (2.02 € en fichas) \nAsiento 6: Elministrelas (1.92 € en fichas) \nSrLyce: pone la ciega pequeña 0.01 €\ndavinci1962: pone la ciega grande 0.02 €\n*** CARTAS DE MANO ***\nRepartidas a SrLyce [9c 9s]\nElministrelas: se retira \npractikal_C23: se retira \nAlvii37: se retira \nSrLyce: sube 0.04 € a 0.06 €\ndavinci1962: se retira \nLa apuesta no igualada (0.04 €) ha sido devuelta a SrLyce\nSrLyce se lleva 0.04 € del bote \nSrLyce: no muestra su mano \n*** RESUMEN ***\nBote total 0.04 € | Comisión 0 € \nAsiento 2: practikal_C23 se retiró antes del Flop (no apostó)\nAsiento 3: Alvii37 (botón) se retiró antes del Flop (no apostó)\nAsiento 4: SrLyce (ciega pequeña) recaudó (0.04 €)\nAsiento 5: davinci1962 (ciega grande) se retiró antes del Flop\nAsiento 6: Elministrelas se retiró antes del Flop (no apostó)"
}