{
  "hand_id": "257150234559",
  "date": "30-07-2025 23:27:36",
  "table": "Gilgamesh",
  "game_type": "holdem",
  "hero": "SrLyce",
  "hero_position": "",
  "hero_cards": [
    "2s",
    "Jc"
  ],
  "stacks": {
    "riverrrrrrmagic": 123.5,
    "SrLyce": 107.5,
    "Jumby34": 100.0,
    "xapkk": 100.0,
    "samaritano34": 90.5,
    "Fretzo67500": 145.0
  },
  "actions": {
    "preflop": [
      "Asiento 1: riverrrrrrmagic (2.47 € en fichas)",
      "Asiento 2: SrLyce (2.15 € en fichas)",
      "Asiento 3: Jumby34 (2 € en fichas)",
      "Asiento 4: xapkk (2 € en fichas)",
      "Asiento 5: samaritano34 (1.81 € en fichas)",
      "Asiento 6: Fretzo67500 (2.90 € en fichas)",
      "Jumby34: pone la ciega pequeña 0.01 €",
      "xapkk: pone la ciega grande 0.02 €",
      "samaritano34: se retira",
      "Fretzo67500: iguala 0.02 €",
      "riverrrrrrmagic: se retira",
      "SrLyce: se retira",
      "Jumby34: se retira",
      "xapkk: pasa"
    ],
    "flop": [
      "xapkk: pasa",
      "Fretzo67500: pasa"
    ],
    "turn": [
      "xapkk: pasa",
      "Fretzo67500: apuesta 0.02 €",
      "xapkk: se retira",
      "Asiento 1: riverrrrrrmagic se retiró antes del Flop (no apostó)",
      "Asiento 2: SrLyce (botón) se retiró antes del Flop (no apostó)",
      "Asiento 3: Jumby34 (ciega pequeña) se retiró antes del Flop",
      "Asiento 4: xapkk (ciega grande) se retiró en el Turn",
      "Asiento 5: samaritano34 se retiró antes del Flop (no apostó)",
      "Asiento 6: Fretzo67500 recaudó (0.05 €)"
    ],
    "river": []
  },
  "board": [
    "9d",
    "7s",
    "9h",
    "Jd"
  ],
  "winner": "Fretzo67500",
  "win_amount": 2.5,
  "sb": 0.01,
  "bb": 0.02,
  "rake": 0.0,
  "raw_text": "Mano n.º 257150234559 de PokerStars:  Hold'em No Limit (0.01 €/0.02 € EUR) - 30-07-2025 23:27:36 CET [30-07-2025 17:27:36 ET]\nMesa \"Gilgamesh\" 6-max El asiento n.º 2 es el botón\nAsiento 1: riverrrrrrmagic (2.47 € en fichas) \nAsiento 2: SrLyce (2.15 € en fichas) \nAsiento 3: Jumby34 (2 € en fichas) \nAsiento 4: xapkk (2 € en fichas) \nAsiento 5: samaritano34 (1.81 € en fichas) \nAsiento 6: Fretzo67500 (2.90 € en fichas) \nJumby34: pone la ciega pequeña 0.01 €\nxapkk: pone la ciega grande 0.02 €\n*** CARTAS DE MANO ***\nRepartidas a SrLyce [2s Jc]\nsamaritano34: se retira \nFretzo67500: iguala 0.02 €\nriverrrrrrmagic: se retira \nSrLyce: se retira \nJumby34: se retira \nxapkk: pasa \n*** FLOP *** [9d 7s 9h]\nxapkk: pasa \nsamaritano34 deja la mesa\nFretzo67500: pasa \n*** TURN *** [9d 7s 9h] [Jd]\nxapkk: pasa \nFretzo67500: apuesta 0.02 €\nxapkk: se retira \nLa apuesta no igualada (0.02 €) ha sido devuelta a Fretzo67500\nFretzo67500 se lleva 0.05 € del bote \n*** RESUMEN ***\nBote total 0.05 € | Comisión 0 € \nComunitarias [9d 7s 9h Jd]\nAsiento 1: riverrrrrrmagic se retiró antes del Flop (no apostó)\nAsiento 2: SrLyce (botón) se retiró antes del Flop (no apostó)\nAsiento 3: Jumby34 (ciega pequeña) se retiró antes del Flop\nAsiento 4: xapkk (ciega grande) se retiró en el Turn\nAsiento 5: samaritano34 se retiró antes del Flop (no apostó)\nAsiento 6: Fretzo67500 recaudó (0.05 €)"
}