{
  "hand_id": "257237027360",
  "date": "06-08-2025 17:32:48",
  "table": "Kale III",
  "game_type": "holdem",
  "hero": "SrLyce",
  "hero_position": "",
  "hero_cards": [
    "7s",
    "2c"
  ],
  "stacks": {
    "x__Nest__x": 88.0,
    "SrLyce": 109.5,
    "Dracoline000": 115.0,
    "Doblea315": 166.0,
    "Begoton": 112.0,
    "juanmemol": 100.0
  },
  "actions": {
    "preflop": [
      "Asiento 1: x__Nest__x (1.76 € en fichas)",
      "Asiento 2: SrLyce (2.19 € en fichas)",
      "Asiento 3: Dracoline000 (2.30 € en fichas)",
      "Asiento 4: Doblea315 (3.32 € en fichas)",
      "Asiento 5: Begoton (2.24 € en fichas)",
      "Asiento 6: juanmemol (2 € en fichas)",
      "Dracoline000: pone la ciega pequeña 0.01 €",
      "Doblea315: pone la ciega grande 0.02 €",
      "Begoton: se retira",
      "juanmemol: se retira",
      "x__Nest__x: se retira",
      "SrLyce: se retira",
      "Dracoline000: se retira",
      "Doblea315: no muestra su mano",
      "Asiento 1: x__Nest__x se retiró antes del Flop (no apostó)",
      "Asiento 2: SrLyce (botón) se retiró antes del Flop (no apostó)",
      "Asiento 3: Dracoline000 (ciega pequeña) se retiró antes del Flop",
      "Asiento 4: Doblea315 (ciega grande) recaudó (0.02 €)",
      "Asiento 5: Begoton se retiró antes del Flop (no apostó)",
      "Asiento 6: juanmemol se retiró antes del Flop (no apostó)"
    ],
    "flop": [],
    "turn": [],
    "river": []
  },
  "board": [],
  "winner": "Doblea315",
  "win_amount": 1.0,
  "sb": 0.01,
  "bb": 0.02,
  "rake": 0.0,
  "raw_text": "Mano n.º 257237027360 de PokerStars:  Hold'em No Limit (0.01 €/0.02 € EUR) - 06-08-2025 17:32:48 CET [06-08-2025 11:32:48 ET]\nMesa \"Kale III\" 6-max El asiento n.º 2 es el botón\nAsiento 1: x__Nest__x (1.76 € en fichas) \nAsiento 2: SrLyce (2.19 € en fichas) \nAsiento 3: Dracoline000 (2.30 € en fichas) \nAsiento 4: Doblea315 (3.32 € en fichas) \nAsiento 5: Begoton (2.24 € en fichas) \nAsiento 6: juanmemol (2 € en fichas) \nDracoline000: pone la ciega pequeña 0.01 €\nDoblea315: pone la ciega grande 0.02 €\n*** CARTAS DE MANO ***\nRepartidas a SrLyce [7s 2c]\nBegoton: se retira \njuanmemol: se retira \nx__Nest__x: se retira \nSrLyce: se retira \nDracoline000: se retira \nLa apuesta no igualada (0.01 €) ha sido devuelta a Doblea315\nDoblea315 se lleva 0.02 € del bote \nDoblea315: no muestra su mano \n*** RESUMEN ***\nBote total 0.02 € | Comisión 0 € \nAsiento 1: x__Nest__x se retiró antes del Flop (no apostó)\nAsiento 2: SrLyce (botón) se retiró antes del Flop (no apostó)\nAsiento 3: Dracoline000 (ciega pequeña) se retiró antes del Flop\nAsiento 4: Doblea315 (ciega grande) recaudó (0.02 €)\nAsiento 5: Begoton se retiró antes del Flop (no apostó)\nAsiento 6: juanmemol se retiró antes del Flop (no apostó)"
}