{
  "hand_id": "257168376501",
  "date": "01-08-2025 11:36:34",
  "table": "Atlas",
  "game_type": "holdem",
  "hero": "SrLyce",
  "hero_position": "",
  "hero_cards": [
    "Tc",
    "9c"
  ],
  "stacks": {
    "SrLyce": 108.5,
    "Fharock": 111.0,
    "ecuinas": 91.0,
    "LxckxStrxkx": 110.0,
    "soy_cule74": 100.0,
    "Akourdideh": 107.0
  },
  "actions": {
    "preflop": [
      "Asiento 1: SrLyce (2.17 € en fichas)",
      "Asiento 2: Fharock (2.22 € en fichas)",
      "Asiento 3: ecuinas (1.82 € en fichas)",
      "Asiento 4: LxckxStrxkx (2.20 € en fichas)",
      "Asiento 5: soy_cule74 (2 € en fichas)",
      "Asiento 6: Akourdideh (2.14 € en fichas)",
      "Akourdideh: pone la ciega pequeña 0.01 €",
      "SrLyce: pone la ciega grande 0.02 €",
      "Fharock: se retira",
      "ecuinas: se retira",
      "LxckxStrxkx: sube 0.04 € a 0.06 €",
      "soy_cule74: se retira",
      "Akourdideh: se retira",
      "SrLyce: iguala 0.04 €"
    ],
    "flop": [
      "SrLyce: pasa",
      "LxckxStrxkx: apuesta 0.04 €",
      "SrLyce: iguala 0.04 €"
    ],
    "turn": [
      "SrLyce: pasa",
      "LxckxStrxkx: apuesta 0.14 €",
      "SrLyce: iguala 0.14 €"
    ],
    "river": [
      "SrLyce: pasa",
      "LxckxStrxkx: pasa",
      "SrLyce: muestra [Tc 9c] (doble pareja, dieces y nueves)",
      "LxckxStrxkx: descarta su mano sin mostrar",
      "Asiento 1: SrLyce (ciega grande) muestra [Tc 9c] y ganó (0.46 €) con doble pareja, dieces y nueves",
      "Asiento 2: Fharock se retiró antes del Flop (no apostó)",
      "Asiento 3: ecuinas se retiró antes del Flop (no apostó)",
      "Asiento 4: LxckxStrxkx descartó sin mostrar [Qh Js]",
      "Asiento 5: soy_cule74 (botón) se retiró antes del Flop (no apostó)",
      "Asiento 6: Akourdideh (ciega pequeña) se retiró antes del Flop"
    ]
  },
  "board": [
    "9h",
    "Ac",
    "5h",
    "Th",
    "5d"
  ],
  "winner": "SrLyce",
  "win_amount": 23.0,
  "sb": 0.01,
  "bb": 0.02,
  "rake": 1.5,
  "raw_text": "Mano n.º 257168376501 de PokerStars:  Hold'em No Limit (0.01 €/0.02 € EUR) - 01-08-2025 11:36:34 CET [01-08-2025 5:36:34 ET]\nMesa \"Atlas\" 6-max El asiento n.º 5 es el botón\nAsiento 1: SrLyce (2.17 € en fichas) \nAsiento 2: Fharock (2.22 € en fichas) \nAsiento 3: ecuinas (1.82 € en fichas) \nAsiento 4: LxckxStrxkx (2.20 € en fichas) \nAsiento 5: soy_cule74 (2 € en fichas) \nAsiento 6: Akourdideh (2.14 € en fichas) \nAkourdideh: pone la ciega pequeña 0.01 €\nSrLyce: pone la ciega grande 0.02 €\n*** CARTAS DE MANO ***\nRepartidas a SrLyce [Tc 9c]\nFharock: se retira \necuinas ha agotado su tiempo\necuinas: se retira \nLxckxStrxkx: sube 0.04 € a 0.06 €\nsoy_cule74: se retira \nAkourdideh: se retira \nSrLyce: iguala 0.04 €\n*** FLOP *** [9h Ac 5h]\nSrLyce: pasa \nLxckxStrxkx: apuesta 0.04 €\nSrLyce: iguala 0.04 €\n*** TURN *** [9h Ac 5h] [Th]\nSrLyce: pasa \nLxckxStrxkx: apuesta 0.14 €\nSrLyce: iguala 0.14 €\n*** RIVER *** [9h Ac 5h Th] [5d]\nSrLyce: pasa \nLxckxStrxkx: pasa \n*** SHOW DOWN ***\nSrLyce: muestra [Tc 9c] (doble pareja, dieces y nueves)\nLxckxStrxkx: descarta su mano sin mostrar \nSrLyce se lleva 0.46 € del bote \n*** RESUMEN ***\nBote total 0.49 € | Comisión 0.03 € \nComunitarias [9h Ac 5h Th 5d]\nAsiento 1: SrLyce (ciega grande) muestra [Tc 9c] y ganó (0.46 €) con doble pareja, dieces y nueves\nAsiento 2: Fharock se retiró antes del Flop (no apostó)\nAsiento 3: ecuinas se retiró antes del Flop (no apostó)\nAsiento 4: LxckxStrxkx descartó sin mostrar [Qh Js]\nAsiento 5: soy_cule74 (botón) se retiró antes del Flop (no apostó)\nAsiento 6: Akourdideh (ciega pequeña) se retiró antes del Flop"
}