{
  "hand_id": "257238590302",
  "date": "06-08-2025 19:12:34",
  "table": "Herculina II",
  "game_type": "holdem",
  "hero": "SrLyce",
  "hero_position": "",
  "hero_cards": [
    "2h",
    "2d"
  ],
  "stacks": {
    "Alceo27": 100.0,
    "David98X": 173.5,
    "JJer11": 204.5,
    "SrLyce": 94.5,
    "Macklemore0": 104.0,
    "ScarvBlack": 120.5
  },
  "actions": {
    "preflop": [
      "Asiento 1: Alceo27 (2 € en fichas)",
      "Asiento 2: David98X (3.47 € en fichas)",
      "Asiento 3: JJer11 (4.09 € en fichas)",
      "Asiento 4: SrLyce (1.89 € en fichas)",
      "Asiento 5: Macklemore0 (2.08 € en fichas)",
      "Asiento 6: ScarvBlack (2.41 € en fichas)",
      "SrLyce: pone la ciega pequeña 0.01 €",
      "Macklemore0: pone la ciega grande 0.02 €",
      "ScarvBlack: se retira",
      "Alceo27: se retira",
      "David98X: se retira",
      "JJer11: sube 0.04 € a 0.06 €",
      "SrLyce: iguala 0.05 €",
      "Macklemore0: se retira"
    ],
    "flop": [
      "SrLyce: pasa",
      "JJer11: pasa"
    ],
    "turn": [
      "SrLyce: apuesta 0.04 €",
      "JJer11: iguala 0.04 €"
    ],
    "river": [
      "SrLyce: apuesta 0.17 €",
      "JJer11: se retira",
      "SrLyce: no muestra su mano",
      "Asiento 1: Alceo27 se retiró antes del Flop (no apostó)",
      "Asiento 2: David98X se retiró antes del Flop (no apostó)",
      "Asiento 3: JJer11 (botón) se retiró en el River",
      "Asiento 4: SrLyce (ciega pequeña) recaudó (0.21 €)",
      "Asiento 5: Macklemore0 (ciega grande) se retiró antes del Flop",
      "Asiento 6: ScarvBlack se retiró antes del Flop (no apostó)"
    ]
  },
  "board": [
    "5s",
    "8c",
    "4h",
    "9s",
    "9h"
  ],
  "winner": "SrLyce",
  "win_amount": 10.5,
  "sb": 0.01,
  "bb": 0.02,
  "rake": 0.5,
  "raw_text": "Mano n.º 257238590302 de PokerStars:  Hold'em No Limit (0.01 €/0.02 € EUR) - 06-08-2025 19:12:34 CET [06-08-2025 13:12:34 ET]\nMesa \"Herculina II\" 6-max El asiento n.º 3 es el botón\nAsiento 1: Alceo27 (2 € en fichas) \nAsiento 2: David98X (3.47 € en fichas) \nAsiento 3: JJer11 (4.09 € en fichas) \nAsiento 4: SrLyce (1.89 € en fichas) \nAsiento 5: Macklemore0 (2.08 € en fichas) \nAsiento 6: ScarvBlack (2.41 € en fichas) \nSrLyce: pone la ciega pequeña 0.01 €\nMacklemore0: pone la ciega grande 0.02 €\n*** CARTAS DE MANO ***\nRepartidas a SrLyce [2h 2d]\nScarvBlack: se retira \nAlceo27: se retira \nDavid98X: se retira \nJJer11: sube 0.04 € a 0.06 €\nSrLyce: iguala 0.05 €\nMacklemore0: se retira \n*** FLOP *** [5s 8c 4h]\nSrLyce: pasa \nJJer11: pasa \n*** TURN *** [5s 8c 4h] [9s]\nSrLyce: apuesta 0.04 €\nJJer11: iguala 0.04 €\n*** RIVER *** [5s 8c 4h 9s] [9h]\nSrLyce: apuesta 0.17 €\nJJer11: se retira \nLa apuesta no igualada (0.17 €) ha sido devuelta a SrLyce\nSrLyce se lleva 0.21 € del bote \nSrLyce: no muestra su mano \n*** RESUMEN ***\nBote total 0.22 € | Comisión 0.01 € \nComunitarias [5s 8c 4h 9s 9h]\nAsiento 1: Alceo27 se retiró antes del Flop (no apostó)\nAsiento 2: David98X se retiró antes del Flop (no apostó)\nAsiento 3: JJer11 (botón) se retiró en el River\nAsiento 4: SrLyce (ciega pequeña) recaudó (0.21 €)\nAsiento 5: Macklemore0 (ciega grande) se retiró antes del Flop\nAsiento 6: ScarvBlack se retiró antes del Flop (no apostó)"
}