{
  "hand_id": "257215001128",
  "date": "04-08-2025 22:18:07",
  "table": "Anneliese II",
  "game_type": "holdem",
  "hero": "SrLyce",
  "hero_position": "",
  "hero_cards": [
    "2c",
    "Qs"
  ],
  "stacks": {
    "betterrrrrr": 100.0,
    "niyomalo": 103.0,
    "ElManu62": 118.0,
    "SrLyce": 98.5,
    "Mr_Pkr98": 142.0,
    "Spotick": 109.0
  },
  "actions": {
    "preflop": [
      "Asiento 1: betterrrrrr (2 € en fichas)",
      "Asiento 2: niyomalo (2.06 € en fichas)",
      "Asiento 3: ElManu62 (2.36 € en fichas)",
      "Asiento 4: SrLyce (1.97 € en fichas)",
      "Asiento 5: Mr_Pkr98 (2.84 € en fichas)",
      "Asiento 6: Spotick (2.18 € en fichas)",
      "Mr_Pkr98: pone la ciega pequeña 0.01 €",
      "Spotick: pone la ciega grande 0.02 €",
      "betterrrrrr: se retira",
      "niyomalo: se retira",
      "ElManu62: se retira",
      "SrLyce: se retira",
      "Mr_Pkr98: se retira",
      "Spotick: no muestra su mano",
      "Asiento 1: betterrrrrr se retiró antes del Flop (no apostó)",
      "Asiento 2: niyomalo se retiró antes del Flop (no apostó)",
      "Asiento 3: ElManu62 se retiró antes del Flop (no apostó)",
      "Asiento 4: SrLyce (botón) se retiró antes del Flop (no apostó)",
      "Asiento 5: Mr_Pkr98 (ciega pequeña) se retiró antes del Flop",
      "Asiento 6: Spotick (ciega grande) recaudó (0.02 €)"
    ],
    "flop": [],
    "turn": [],
    "river": []
  },
  "board": [],
  "winner": "Spotick",
  "win_amount": 1.0,
  "sb": 0.01,
  "bb": 0.02,
  "rake": 0.0,
  "raw_text": "Mano n.º 257215001128 de PokerStars:  Hold'em No Limit (0.01 €/0.02 € EUR) - 04-08-2025 22:18:07 CET [04-08-2025 16:18:07 ET]\nMesa \"Anneliese II\" 6-max El asiento n.º 4 es el botón\nAsiento 1: betterrrrrr (2 € en fichas) \nAsiento 2: niyomalo (2.06 € en fichas) \nAsiento 3: ElManu62 (2.36 € en fichas) \nAsiento 4: SrLyce (1.97 € en fichas) \nAsiento 5: Mr_Pkr98 (2.84 € en fichas) \nAsiento 6: Spotick (2.18 € en fichas) \nMr_Pkr98: pone la ciega pequeña 0.01 €\nSpotick: pone la ciega grande 0.02 €\n*** CARTAS DE MANO ***\nRepartidas a SrLyce [2c Qs]\nbetterrrrrr: se retira \nniyomalo: se retira \nElManu62 ha agotado su tiempo\nElManu62: se retira \nSrLyce: se retira \nMr_Pkr98: se retira \nLa apuesta no igualada (0.01 €) ha sido devuelta a Spotick\nSpotick se lleva 0.02 € del bote \nSpotick: no muestra su mano \n*** RESUMEN ***\nBote total 0.02 € | Comisión 0 € \nAsiento 1: betterrrrrr se retiró antes del Flop (no apostó)\nAsiento 2: niyomalo se retiró antes del Flop (no apostó)\nAsiento 3: ElManu62 se retiró antes del Flop (no apostó)\nAsiento 4: SrLyce (botón) se retiró antes del Flop (no apostó)\nAsiento 5: Mr_Pkr98 (ciega pequeña) se retiró antes del Flop\nAsiento 6: Spotick (ciega grande) recaudó (0.02 €)"
}