{
  "hand_id": "257238555384",
  "date": "06-08-2025 19:09:39",
  "table": "Herculina II",
  "game_type": "holdem",
  "hero": "SrLyce",
  "hero_position": "",
  "hero_cards": [
    "2d",
    "Qh"
  ],
  "stacks": {
    "David98X": 177.0,
    "JJer11": 207.5,
    "SrLyce": 98.5,
    "Macklemore0": 100.0,
    "ScarvBlack": 113.0
  },
  "actions": {
    "preflop": [
      "Asiento 2: David98X (3.54 € en fichas)",
      "Asiento 3: JJer11 (4.15 € en fichas)",
      "Asiento 4: SrLyce (1.97 € en fichas)",
      "Asiento 5: Macklemore0 (2 € en fichas)",
      "Asiento 6: ScarvBlack (2.26 € en fichas)",
      "David98X: pone la ciega pequeña 0.01 €",
      "JJer11: pone la ciega grande 0.02 €",
      "SrLyce: se retira",
      "Macklemore0: se retira",
      "ScarvBlack: sube 0.04 € a 0.06 €",
      "David98X: se retira",
      "JJer11: se retira",
      "ScarvBlack: no muestra su mano",
      "Asiento 2: David98X (ciega pequeña) se retiró antes del Flop",
      "Asiento 3: JJer11 (ciega grande) se retiró antes del Flop",
      "Asiento 4: SrLyce se retiró antes del Flop (no apostó)",
      "Asiento 5: Macklemore0 se retiró antes del Flop (no apostó)",
      "Asiento 6: ScarvBlack (botón) recaudó (0.05 €)"
    ],
    "flop": [],
    "turn": [],
    "river": []
  },
  "board": [],
  "winner": "ScarvBlack",
  "win_amount": 2.5,
  "sb": 0.01,
  "bb": 0.02,
  "rake": 0.0,
  "raw_text": "Mano n.º 257238555384 de PokerStars:  Hold'em No Limit (0.01 €/0.02 € EUR) - 06-08-2025 19:09:39 CET [06-08-2025 13:09:39 ET]\nMesa \"Herculina II\" 6-max El asiento n.º 6 es el botón\nAsiento 2: David98X (3.54 € en fichas) \nAsiento 3: JJer11 (4.15 € en fichas) \nAsiento 4: SrLyce (1.97 € en fichas) \nAsiento 5: Macklemore0 (2 € en fichas) \nAsiento 6: ScarvBlack (2.26 € en fichas) \nDavid98X: pone la ciega pequeña 0.01 €\nJJer11: pone la ciega grande 0.02 €\n*** CARTAS DE MANO ***\nRepartidas a SrLyce [2d Qh]\nSrLyce: se retira \nMacklemore0: se retira \nScarvBlack: sube 0.04 € a 0.06 €\nDavid98X: se retira \nJJer11: se retira \nLa apuesta no igualada (0.04 €) ha sido devuelta a ScarvBlack\nScarvBlack se lleva 0.05 € del bote \nScarvBlack: no muestra su mano \n*** RESUMEN ***\nBote total 0.05 € | Comisión 0 € \nAsiento 2: David98X (ciega pequeña) se retiró antes del Flop\nAsiento 3: JJer11 (ciega grande) se retiró antes del Flop\nAsiento 4: SrLyce se retiró antes del Flop (no apostó)\nAsiento 5: Macklemore0 se retiró antes del Flop (no apostó)\nAsiento 6: ScarvBlack (botón) recaudó (0.05 €)"
}