{
  "hand_id": "257237868060",
  "date": "06-08-2025 18:07:04",
  "table": "Nuwa III",
  "game_type": "holdem",
  "hero": "SrLyce",
  "hero_position": "",
  "hero_cards": [
    "3s",
    "4d"
  ],
  "stacks": {
    "davinci1962": 205.0,
    "BuXHexter": 100.0,
    "kcg_rm": 109.0,
    "SrLyce": 100.0,
    "RiskAllinkali": 115.0,
    "acavada": 102.0
  },
  "actions": {
    "preflop": [
      "Asiento 1: davinci1962 (4.10 € en fichas)",
      "Asiento 2: BuXHexter (2 € en fichas)",
      "Asiento 3: kcg_rm (2.18 € en fichas)",
      "Asiento 4: SrLyce (2 € en fichas)",
      "Asiento 5: RiskAllinkali (2.30 € en fichas)",
      "Asiento 6: acavada (2.04 € en fichas)",
      "davinci1962: pone la ciega pequeña 0.01 €",
      "BuXHexter: pone la ciega grande 0.02 €",
      "kcg_rm: se retira",
      "SrLyce: se retira",
      "RiskAllinkali: se retira",
      "acavada: sube 0.04 € a 0.06 €",
      "davinci1962: se retira",
      "BuXHexter: se retira",
      "acavada: no muestra su mano",
      "Asiento 1: davinci1962 (ciega pequeña) se retiró antes del Flop",
      "Asiento 2: BuXHexter (ciega grande) se retiró antes del Flop",
      "Asiento 3: kcg_rm se retiró antes del Flop (no apostó)",
      "Asiento 4: SrLyce se retiró antes del Flop (no apostó)",
      "Asiento 5: RiskAllinkali se retiró antes del Flop (no apostó)",
      "Asiento 6: acavada (botón) recaudó (0.05 €)"
    ],
    "flop": [],
    "turn": [],
    "river": []
  },
  "board": [],
  "winner": "acavada",
  "win_amount": 2.5,
  "sb": 0.01,
  "bb": 0.02,
  "rake": 0.0,
  "raw_text": "Mano n.º 257237868060 de PokerStars:  Hold'em No Limit (0.01 €/0.02 € EUR) - 06-08-2025 18:07:04 CET [06-08-2025 12:07:04 ET]\nMesa \"Nuwa III\" 6-max El asiento n.º 6 es el botón\nAsiento 1: davinci1962 (4.10 € en fichas) \nAsiento 2: BuXHexter (2 € en fichas) \nAsiento 3: kcg_rm (2.18 € en fichas) \nAsiento 4: SrLyce (2 € en fichas) \nAsiento 5: RiskAllinkali (2.30 € en fichas) \nAsiento 6: acavada (2.04 € en fichas) \ndavinci1962: pone la ciega pequeña 0.01 €\nBuXHexter: pone la ciega grande 0.02 €\n*** CARTAS DE MANO ***\nRepartidas a SrLyce [3s 4d]\nkcg_rm: se retira \nSrLyce: se retira \nRiskAllinkali: se retira \nacavada: sube 0.04 € a 0.06 €\ndavinci1962: se retira \nBuXHexter: se retira \nLa apuesta no igualada (0.04 €) ha sido devuelta a acavada\nacavada se lleva 0.05 € del bote \nacavada: no muestra su mano \n*** RESUMEN ***\nBote total 0.05 € | Comisión 0 € \nAsiento 1: davinci1962 (ciega pequeña) se retiró antes del Flop\nAsiento 2: BuXHexter (ciega grande) se retiró antes del Flop\nAsiento 3: kcg_rm se retiró antes del Flop (no apostó)\nAsiento 4: SrLyce se retiró antes del Flop (no apostó)\nAsiento 5: RiskAllinkali se retiró antes del Flop (no apostó)\nAsiento 6: acavada (botón) recaudó (0.05 €)"
}