{
  "hand_id": "257238776258",
  "date": "06-08-2025 19:28:05",
  "table": "Adelaide III",
  "game_type": "holdem",
  "hero": "SrLyce",
  "hero_position": "",
  "hero_cards": [
    "Ks",
    "9h"
  ],
  "stacks": {
    "Alceo27": 100.0,
    "aliendee07": 48.0,
    "Macklemore0": 131.0,
    "SrLyce": 150.5,
    "ismagonzalez7": 75.0,
    "McFlash3": 130.0
  },
  "actions": {
    "preflop": [
      "Asiento 1: Alceo27 (2 € en fichas)",
      "Asiento 2: aliendee07 (0.96 € en fichas)",
      "Asiento 3: Macklemore0 (2.62 € en fichas)",
      "Asiento 4: SrLyce (3.01 € en fichas)",
      "Asiento 5: ismagonzalez7 (1.50 € en fichas)",
      "Asiento 6: McFlash3 (2.60 € en fichas)",
      "Macklemore0: pone la ciega pequeña 0.01 €",
      "SrLyce: pone la ciega grande 0.02 €",
      "ismagonzalez7: sube 0.02 € a 0.04 €",
      "McFlash3: se retira",
      "Alceo27: sube 0.08 € a 0.12 €",
      "aliendee07: se retira",
      "Macklemore0: se retira",
      "SrLyce: se retira",
      "ismagonzalez7: iguala 0.08 €"
    ],
    "flop": [
      "ismagonzalez7: apuesta 0.13 €",
      "Alceo27: se retira",
      "ismagonzalez7: no muestra su mano",
      "Asiento 1: Alceo27 se retiró en el Flop",
      "Asiento 2: aliendee07 (botón) se retiró antes del Flop (no apostó)",
      "Asiento 3: Macklemore0 (ciega pequeña) se retiró antes del Flop",
      "Asiento 4: SrLyce (ciega grande) se retiró antes del Flop",
      "Asiento 5: ismagonzalez7 recaudó (0.25 €)",
      "Asiento 6: McFlash3 se retiró antes del Flop (no apostó)"
    ],
    "turn": [],
    "river": []
  },
  "board": [
    "4d",
    "Qc",
    "9c"
  ],
  "winner": "ismagonzalez7",
  "win_amount": 12.5,
  "sb": 0.01,
  "bb": 0.02,
  "rake": 1.0,
  "raw_text": "Mano n.º 257238776258 de PokerStars:  Hold'em No Limit (0.01 €/0.02 € EUR) - 06-08-2025 19:28:05 CET [06-08-2025 13:28:05 ET]\nMesa \"Adelaide III\" 6-max El asiento n.º 2 es el botón\nAsiento 1: Alceo27 (2 € en fichas) \nAsiento 2: aliendee07 (0.96 € en fichas) \nAsiento 3: Macklemore0 (2.62 € en fichas) \nAsiento 4: SrLyce (3.01 € en fichas) \nAsiento 5: ismagonzalez7 (1.50 € en fichas) \nAsiento 6: McFlash3 (2.60 € en fichas) \nMacklemore0: pone la ciega pequeña 0.01 €\nSrLyce: pone la ciega grande 0.02 €\n*** CARTAS DE MANO ***\nRepartidas a SrLyce [Ks 9h]\nismagonzalez7: sube 0.02 € a 0.04 €\nMcFlash3: se retira \nAlceo27: sube 0.08 € a 0.12 €\naliendee07: se retira \nMacklemore0: se retira \nSrLyce: se retira \nismagonzalez7: iguala 0.08 €\n*** FLOP *** [4d Qc 9c]\nismagonzalez7: apuesta 0.13 €\nAlceo27: se retira \nLa apuesta no igualada (0.13 €) ha sido devuelta a ismagonzalez7\nismagonzalez7 se lleva 0.25 € del bote \nismagonzalez7: no muestra su mano \n*** RESUMEN ***\nBote total 0.27 € | Comisión 0.02 € \nComunitarias [4d Qc 9c]\nAsiento 1: Alceo27 se retiró en el Flop\nAsiento 2: aliendee07 (botón) se retiró antes del Flop (no apostó)\nAsiento 3: Macklemore0 (ciega pequeña) se retiró antes del Flop\nAsiento 4: SrLyce (ciega grande) se retiró antes del Flop\nAsiento 5: ismagonzalez7 recaudó (0.25 €)\nAsiento 6: McFlash3 se retiró antes del Flop (no apostó)"
}