{
  "hand_id": "257149892729",
  "date": "30-07-2025 23:04:05",
  "table": "Gilgamesh",
  "game_type": "holdem",
  "hero": "SrLyce",
  "hero_position": "",
  "hero_cards": [
    "5s",
    "Jd"
  ],
  "stacks": {
    "riverrrrrrmagic": 111.5,
    "SrLyce": 124.5,
    "Jumby34": 100.0,
    "Fluxy123": 110.5,
    "cbo54": 81.0,
    "Fretzo67500": 113.5
  },
  "actions": {
    "preflop": [
      "Asiento 1: riverrrrrrmagic (2.23 € en fichas)",
      "Asiento 2: SrLyce (2.49 € en fichas)",
      "Asiento 3: Jumby34 (2 € en fichas)",
      "Asiento 4: Fluxy123 (2.21 € en fichas)",
      "Asiento 5: cbo54 (1.62 € en fichas)",
      "Asiento 6: Fretzo67500 (2.27 € en fichas)",
      "riverrrrrrmagic: pone la ciega pequeña 0.01 €",
      "SrLyce: pone la ciega grande 0.02 €",
      "Jumby34: se retira",
      "Fluxy123: se retira",
      "cbo54: se retira",
      "Fretzo67500: sube 0.04 € a 0.06 €",
      "riverrrrrrmagic: iguala 0.05 €",
      "SrLyce: se retira"
    ],
    "flop": [
      "riverrrrrrmagic: pasa",
      "Fretzo67500: apuesta 0.04 €",
      "riverrrrrrmagic: se retira",
      "Asiento 1: riverrrrrrmagic (ciega pequeña) se retiró en el Flop",
      "Asiento 2: SrLyce (ciega grande) se retiró antes del Flop",
      "Asiento 3: Jumby34 se retiró antes del Flop (no apostó)",
      "Asiento 4: Fluxy123 se retiró antes del Flop (no apostó)",
      "Asiento 5: cbo54 se retiró antes del Flop (no apostó)",
      "Asiento 6: Fretzo67500 (botón) recaudó (0.13 €)"
    ],
    "turn": [],
    "river": []
  },
  "board": [
    "4h",
    "Kh",
    "4c"
  ],
  "winner": "Fretzo67500",
  "win_amount": 6.5,
  "sb": 0.01,
  "bb": 0.02,
  "rake": 0.5,
  "raw_text": "Mano n.º 257149892729 de PokerStars:  Hold'em No Limit (0.01 €/0.02 € EUR) - 30-07-2025 23:04:05 CET [30-07-2025 17:04:05 ET]\nMesa \"Gilgamesh\" 6-max El asiento n.º 6 es el botón\nAsiento 1: riverrrrrrmagic (2.23 € en fichas) \nAsiento 2: SrLyce (2.49 € en fichas) \nAsiento 3: Jumby34 (2 € en fichas) \nAsiento 4: Fluxy123 (2.21 € en fichas) \nAsiento 5: cbo54 (1.62 € en fichas) \nAsiento 6: Fretzo67500 (2.27 € en fichas) \nriverrrrrrmagic: pone la ciega pequeña 0.01 €\nSrLyce: pone la ciega grande 0.02 €\n*** CARTAS DE MANO ***\nRepartidas a SrLyce [5s Jd]\nJumby34: se retira \nFluxy123: se retira \ncbo54: se retira \nFretzo67500: sube 0.04 € a 0.06 €\nriverrrrrrmagic: iguala 0.05 €\nSrLyce: se retira \n*** FLOP *** [4h Kh 4c]\nriverrrrrrmagic: pasa \nFretzo67500: apuesta 0.04 €\nriverrrrrrmagic: se retira \nLa apuesta no igualada (0.04 €) ha sido devuelta a Fretzo67500\nFretzo67500 se lleva 0.13 € del bote \n*** RESUMEN ***\nBote total 0.14 € | Comisión 0.01 € \nComunitarias [4h Kh 4c]\nAsiento 1: riverrrrrrmagic (ciega pequeña) se retiró en el Flop\nAsiento 2: SrLyce (ciega grande) se retiró antes del Flop\nAsiento 3: Jumby34 se retiró antes del Flop (no apostó)\nAsiento 4: Fluxy123 se retiró antes del Flop (no apostó)\nAsiento 5: cbo54 se retiró antes del Flop (no apostó)\nAsiento 6: Fretzo67500 (botón) recaudó (0.13 €)"
}