{
  "hand_id": "257238482110",
  "date": "06-08-2025 19:03:19",
  "table": "Herculina II",
  "game_type": "holdem",
  "hero": "SrLyce",
  "hero_position": "",
  "hero_cards": [
    "6d",
    "Ks"
  ],
  "stacks": {
    "koldipk": 156.0,
    "David98X": 129.0,
    "JJer11": 209.0,
    "SrLyce": 101.0,
    "Macklemore0": 100.0,
    "ScarvBlack": 119.5
  },
  "actions": {
    "preflop": [
      "Asiento 1: koldipk (3.12 € en fichas)",
      "Asiento 2: David98X (2.58 € en fichas)",
      "Asiento 3: JJer11 (4.18 € en fichas)",
      "Asiento 4: SrLyce (2.02 € en fichas)",
      "Asiento 5: Macklemore0 (2 € en fichas)",
      "Asiento 6: ScarvBlack (2.39 € en fichas)",
      "ScarvBlack: pone la ciega pequeña 0.01 €",
      "koldipk: pone la ciega grande 0.02 €",
      "David98X: se retira",
      "JJer11: se retira",
      "SrLyce: se retira",
      "Macklemore0: se retira",
      "ScarvBlack: se retira",
      "Asiento 1: koldipk (ciega grande) recaudó (0.02 €)",
      "Asiento 2: David98X se retiró antes del Flop (no apostó)",
      "Asiento 3: JJer11 se retiró antes del Flop (no apostó)",
      "Asiento 4: SrLyce se retiró antes del Flop (no apostó)",
      "Asiento 5: Macklemore0 (botón) se retiró antes del Flop (no apostó)",
      "Asiento 6: ScarvBlack (ciega pequeña) se retiró antes del Flop"
    ],
    "flop": [],
    "turn": [],
    "river": []
  },
  "board": [],
  "winner": "koldipk",
  "win_amount": 1.0,
  "sb": 0.01,
  "bb": 0.02,
  "rake": 0.0,
  "raw_text": "Mano n.º 257238482110 de PokerStars:  Hold'em No Limit (0.01 €/0.02 € EUR) - 06-08-2025 19:03:19 CET [06-08-2025 13:03:19 ET]\nMesa \"Herculina II\" 6-max El asiento n.º 5 es el botón\nAsiento 1: koldipk (3.12 € en fichas) \nAsiento 2: David98X (2.58 € en fichas) \nAsiento 3: JJer11 (4.18 € en fichas) \nAsiento 4: SrLyce (2.02 € en fichas) \nAsiento 5: Macklemore0 (2 € en fichas) \nAsiento 6: ScarvBlack (2.39 € en fichas) \nScarvBlack: pone la ciega pequeña 0.01 €\nkoldipk: pone la ciega grande 0.02 €\n*** CARTAS DE MANO ***\nRepartidas a SrLyce [6d Ks]\nDavid98X: se retira \nJJer11: se retira \nSrLyce: se retira \nMacklemore0: se retira \nScarvBlack: se retira \nLa apuesta no igualada (0.01 €) ha sido devuelta a koldipk\nkoldipk se lleva 0.02 € del bote \n*** RESUMEN ***\nBote total 0.02 € | Comisión 0 € \nAsiento 1: koldipk (ciega grande) recaudó (0.02 €)\nAsiento 2: David98X se retiró antes del Flop (no apostó)\nAsiento 3: JJer11 se retiró antes del Flop (no apostó)\nAsiento 4: SrLyce se retiró antes del Flop (no apostó)\nAsiento 5: Macklemore0 (botón) se retiró antes del Flop (no apostó)\nAsiento 6: ScarvBlack (ciega pequeña) se retiró antes del Flop"
}