{
  "hand_id": "257237726389",
  "date": "06-08-2025 17:52:04",
  "table": "Euneus III",
  "game_type": "holdem",
  "hero": "SrLyce",
  "hero_position": "",
  "hero_cards": [
    "3d",
    "7s"
  ],
  "stacks": {
    "DeMula62": 100.0,
    "Il_BM00": 106.5,
    "djrojas9": 151.5,
    "eleuvehache": 95.5,
    "SrLyce": 98.5,
    "t053n": 72.0
  },
  "actions": {
    "preflop": [
      "Asiento 1: DeMula62 (2 € en fichas)",
      "Asiento 2: Il_BM00 (2.13 € en fichas)",
      "Asiento 3: djrojas9 (3.03 € en fichas)",
      "Asiento 4: eleuvehache (1.91 € en fichas)",
      "Asiento 5: SrLyce (1.97 € en fichas)",
      "Asiento 6: t053n (1.44 € en fichas)",
      "t053n: pone la ciega pequeña 0.01 €",
      "DeMula62: pone la ciega grande 0.02 €",
      "Il_BM00: sube 0.04 € a 0.06 €",
      "djrojas9: se retira",
      "eleuvehache: se retira",
      "SrLyce: se retira",
      "t053n: se retira",
      "DeMula62: se retira",
      "Il_BM00: no muestra su mano",
      "Asiento 1: DeMula62 (ciega grande) se retiró antes del Flop",
      "Asiento 2: Il_BM00 recaudó (0.05 €)",
      "Asiento 3: djrojas9 se retiró antes del Flop (no apostó)",
      "Asiento 4: eleuvehache se retiró antes del Flop (no apostó)",
      "Asiento 5: SrLyce (botón) se retiró antes del Flop (no apostó)",
      "Asiento 6: t053n (ciega pequeña) se retiró antes del Flop"
    ],
    "flop": [],
    "turn": [],
    "river": []
  },
  "board": [],
  "winner": "Il_BM00",
  "win_amount": 2.5,
  "sb": 0.01,
  "bb": 0.02,
  "rake": 0.0,
  "raw_text": "Mano n.º 257237726389 de PokerStars:  Hold'em No Limit (0.01 €/0.02 € EUR) - 06-08-2025 17:52:04 CET [06-08-2025 11:52:04 ET]\nMesa \"Euneus III\" 6-max El asiento n.º 5 es el botón\nAsiento 1: DeMula62 (2 € en fichas) \nAsiento 2: Il_BM00 (2.13 € en fichas) \nAsiento 3: djrojas9 (3.03 € en fichas) \nAsiento 4: eleuvehache (1.91 € en fichas) \nAsiento 5: SrLyce (1.97 € en fichas) \nAsiento 6: t053n (1.44 € en fichas) \nt053n: pone la ciega pequeña 0.01 €\nDeMula62: pone la ciega grande 0.02 €\n*** CARTAS DE MANO ***\nRepartidas a SrLyce [3d 7s]\nIl_BM00: sube 0.04 € a 0.06 €\ndjrojas9: se retira \neleuvehache: se retira \nSrLyce: se retira \nt053n: se retira \nDeMula62: se retira \nLa apuesta no igualada (0.04 €) ha sido devuelta a Il_BM00\nIl_BM00 se lleva 0.05 € del bote \nIl_BM00: no muestra su mano \n*** RESUMEN ***\nBote total 0.05 € | Comisión 0 € \nAsiento 1: DeMula62 (ciega grande) se retiró antes del Flop\nAsiento 2: Il_BM00 recaudó (0.05 €)\nAsiento 3: djrojas9 se retiró antes del Flop (no apostó)\nAsiento 4: eleuvehache se retiró antes del Flop (no apostó)\nAsiento 5: SrLyce (botón) se retiró antes del Flop (no apostó)\nAsiento 6: t053n (ciega pequeña) se retiró antes del Flop"
}