{
  "hand_id": "257238554740",
  "date": "06-08-2025 19:09:36",
  "table": "Leonteus",
  "game_type": "holdem",
  "hero": "SrLyce",
  "hero_position": "",
  "hero_cards": [
    "4d",
    "7h"
  ],
  "stacks": {
    "practikal_C23": 41.0,
    "durahimovic": 296.0,
    "davinci1962": 137.0,
    "BuXHexter": 145.5,
    "Andark47": 188.0,
    "SrLyce": 99.5
  },
  "actions": {
    "preflop": [
      "Asiento 1: practikal_C23 (0.82 € en fichas)",
      "Asiento 2: durahimovic (5.92 € en fichas)",
      "Asiento 3: davinci1962 (2.74 € en fichas)",
      "Asiento 4: BuXHexter (2.91 € en fichas)",
      "Asiento 5: Andark47 (3.76 € en fichas)",
      "Asiento 6: SrLyce (1.99 € en fichas)",
      "durahimovic: pone la ciega pequeña 0.01 €",
      "davinci1962: pone la ciega grande 0.02 €",
      "BuXHexter: se retira",
      "Andark47: se retira",
      "SrLyce: se retira",
      "practikal_C23: sube 0.02 € a 0.04 €",
      "durahimovic: sube 0.10 € a 0.14 €",
      "davinci1962: se retira",
      "practikal_C23: iguala 0.10 €"
    ],
    "flop": [
      "durahimovic: pasa",
      "practikal_C23: apuesta 0.12 €",
      "durahimovic: iguala 0.12 €"
    ],
    "turn": [
      "durahimovic: pasa",
      "practikal_C23: apuesta 0.18 €",
      "durahimovic: se retira",
      "Asiento 1: practikal_C23 (botón) recaudó (0.51 €)",
      "Asiento 2: durahimovic (ciega pequeña) se retiró en el Turn",
      "Asiento 3: davinci1962 (ciega grande) se retiró antes del Flop",
      "Asiento 4: BuXHexter se retiró antes del Flop (no apostó)",
      "Asiento 5: Andark47 se retiró antes del Flop (no apostó)",
      "Asiento 6: SrLyce se retiró antes del Flop (no apostó)"
    ],
    "river": []
  },
  "board": [
    "Qd",
    "7c",
    "7s",
    "5d"
  ],
  "winner": "practikal_C23",
  "win_amount": 25.5,
  "sb": 0.01,
  "bb": 0.02,
  "rake": 1.5,
  "raw_text": "Mano n.º 257238554740 de PokerStars:  Hold'em No Limit (0.01 €/0.02 € EUR) - 06-08-2025 19:09:36 CET [06-08-2025 13:09:36 ET]\nMesa \"Leonteus\" 6-max El asiento n.º 1 es el botón\nAsiento 1: practikal_C23 (0.82 € en fichas) \nAsiento 2: durahimovic (5.92 € en fichas) \nAsiento 3: davinci1962 (2.74 € en fichas) \nAsiento 4: BuXHexter (2.91 € en fichas) \nAsiento 5: Andark47 (3.76 € en fichas) \nAsiento 6: SrLyce (1.99 € en fichas) \ndurahimovic: pone la ciega pequeña 0.01 €\ndavinci1962: pone la ciega grande 0.02 €\n*** CARTAS DE MANO ***\nRepartidas a SrLyce [4d 7h]\nBuXHexter: se retira \nAndark47: se retira \nSrLyce: se retira \npractikal_C23: sube 0.02 € a 0.04 €\ndurahimovic: sube 0.10 € a 0.14 €\ndavinci1962: se retira \npractikal_C23: iguala 0.10 €\n*** FLOP *** [Qd 7c 7s]\ndurahimovic: pasa \npractikal_C23: apuesta 0.12 €\ndurahimovic: iguala 0.12 €\n*** TURN *** [Qd 7c 7s] [5d]\ndurahimovic: pasa \npractikal_C23: apuesta 0.18 €\ndurahimovic: se retira \nLa apuesta no igualada (0.18 €) ha sido devuelta a practikal_C23\npractikal_C23 se lleva 0.51 € del bote \n*** RESUMEN ***\nBote total 0.54 € | Comisión 0.03 € \nComunitarias [Qd 7c 7s 5d]\nAsiento 1: practikal_C23 (botón) recaudó (0.51 €)\nAsiento 2: durahimovic (ciega pequeña) se retiró en el Turn\nAsiento 3: davinci1962 (ciega grande) se retiró antes del Flop\nAsiento 4: BuXHexter se retiró antes del Flop (no apostó)\nAsiento 5: Andark47 se retiró antes del Flop (no apostó)\nAsiento 6: SrLyce se retiró antes del Flop (no apostó)"
}