{
  "hand_id": "257238192854",
  "date": "06-08-2025 18:36:19",
  "table": "Atreus",
  "game_type": "holdem",
  "hero": "SrLyce",
  "hero_position": "",
  "hero_cards": [
    "9h",
    "6s"
  ],
  "stacks": {
    "PrendsCa": 100.0,
    "Homerob1987": 40.0,
    "JENOFONTE73": 163.5,
    "Fharock": 85.0,
    "SrLyce": 143.0,
    "FishamanReggae": 31.0
  },
  "actions": {
    "preflop": [
      "Asiento 1: PrendsCa (2 € en fichas)",
      "Asiento 2: Homerob1987 (0.80 € en fichas)",
      "Asiento 3: JENOFONTE73 (3.27 € en fichas)",
      "Asiento 4: Fharock (1.70 € en fichas)",
      "Asiento 5: SrLyce (2.86 € en fichas)",
      "Asiento 6: FishamanReggae (0.62 € en fichas)",
      "PrendsCa: pone la ciega pequeña 0.01 €",
      "Homerob1987: pone la ciega grande 0.02 €",
      "JENOFONTE73: se retira",
      "Fharock: se retira",
      "SrLyce: se retira",
      "FishamanReggae: sube 0.04 € a 0.06 €",
      "PrendsCa: se retira",
      "Homerob1987: iguala 0.04 €"
    ],
    "flop": [
      "Homerob1987: pasa",
      "FishamanReggae: apuesta 0.02 €",
      "Homerob1987: se retira",
      "Asiento 1: PrendsCa (ciega pequeña) se retiró antes del Flop",
      "Asiento 2: Homerob1987 (ciega grande) se retiró en el Flop",
      "Asiento 3: JENOFONTE73 se retiró antes del Flop (no apostó)",
      "Asiento 4: Fharock se retiró antes del Flop (no apostó)",
      "Asiento 5: SrLyce se retiró antes del Flop (no apostó)",
      "Asiento 6: FishamanReggae (botón) recaudó (0.12 €)"
    ],
    "turn": [],
    "river": []
  },
  "board": [
    "3c",
    "8c",
    "7d"
  ],
  "winner": "FishamanReggae",
  "win_amount": 6.0,
  "sb": 0.01,
  "bb": 0.02,
  "rake": 0.5,
  "raw_text": "Mano n.º 257238192854 de PokerStars:  Hold'em No Limit (0.01 €/0.02 € EUR) - 06-08-2025 18:36:19 CET [06-08-2025 12:36:19 ET]\nMesa \"Atreus\" 6-max El asiento n.º 6 es el botón\nAsiento 1: PrendsCa (2 € en fichas) \nAsiento 2: Homerob1987 (0.80 € en fichas) \nAsiento 3: JENOFONTE73 (3.27 € en fichas) \nAsiento 4: Fharock (1.70 € en fichas) \nAsiento 5: SrLyce (2.86 € en fichas) \nAsiento 6: FishamanReggae (0.62 € en fichas) \nPrendsCa: pone la ciega pequeña 0.01 €\nHomerob1987: pone la ciega grande 0.02 €\n*** CARTAS DE MANO ***\nRepartidas a SrLyce [9h 6s]\nJENOFONTE73: se retira \nFharock: se retira \nSrLyce: se retira \nFishamanReggae: sube 0.04 € a 0.06 €\nPrendsCa: se retira \nHomerob1987: iguala 0.04 €\n*** FLOP *** [3c 8c 7d]\nHomerob1987: pasa \nFishamanReggae: apuesta 0.02 €\nHomerob1987: se retira \nLa apuesta no igualada (0.02 €) ha sido devuelta a FishamanReggae\nFishamanReggae se lleva 0.12 € del bote \n*** RESUMEN ***\nBote total 0.13 € | Comisión 0.01 € \nComunitarias [3c 8c 7d]\nAsiento 1: PrendsCa (ciega pequeña) se retiró antes del Flop\nAsiento 2: Homerob1987 (ciega grande) se retiró en el Flop\nAsiento 3: JENOFONTE73 se retiró antes del Flop (no apostó)\nAsiento 4: Fharock se retiró antes del Flop (no apostó)\nAsiento 5: SrLyce se retiró antes del Flop (no apostó)\nAsiento 6: FishamanReggae (botón) recaudó (0.12 €)"
}