{
  "hand_id": "257238216500",
  "date": "06-08-2025 18:38:26",
  "table": "Alruccabah II",
  "game_type": "holdem",
  "hero": "SrLyce",
  "hero_position": "",
  "hero_cards": [
    "6c",
    "3c"
  ],
  "stacks": {
    "rayao32": 52.0,
    "SrLyce": 90.5,
    "Davdgoni": 250.5,
    "PerroBestia": 43.5,
    "Nicanor Cast": 53.0
  },
  "actions": {
    "preflop": [
      "Asiento 6: rayao32 (1.04 € en fichas) está ausente",
      "Asiento 1: SrLyce (1.81 € en fichas)",
      "Asiento 2: Davdgoni (5.01 € en fichas)",
      "Asiento 3: PerroBestia (0.87 € en fichas)",
      "Asiento 4: serviettski(fr) (2.10 € en fichas)",
      "Asiento 5: Nicanor Cast (1.06 € en fichas)",
      "Davdgoni: pone la ciega pequeña 0.01 €",
      "PerroBestia: pone la ciega grande 0.02 €",
      "serviettski(fr): sube 0.04 € a 0.06 €",
      "Nicanor Cast: se retira",
      "SrLyce: se retira",
      "Davdgoni: iguala 0.05 €",
      "PerroBestia: se retira"
    ],
    "flop": [
      "Davdgoni: apuesta 0.07 €",
      "serviettski(fr): iguala 0.07 €"
    ],
    "turn": [
      "Davdgoni: apuesta 0.26 €",
      "serviettski(fr): iguala 0.26 €"
    ],
    "river": [
      "Davdgoni: apuesta 4.62 € y está all-in",
      "serviettski(fr): se retira",
      "Davdgoni: no muestra su mano",
      "Asiento 6: rayao32",
      "Asiento 1: SrLyce (botón) se retiró antes del Flop (no apostó)",
      "Asiento 2: Davdgoni (ciega pequeña) recaudó (0.75 €)",
      "Asiento 3: PerroBestia (ciega grande) se retiró antes del Flop",
      "Asiento 4: serviettski(fr) se retiró en el River",
      "Asiento 5: Nicanor Cast se retiró antes del Flop (no apostó)"
    ]
  },
  "board": [
    "4h",
    "Qc",
    "5d",
    "Jd",
    "6h"
  ],
  "winner": "Davdgoni",
  "win_amount": 37.5,
  "sb": 0.01,
  "bb": 0.02,
  "rake": 2.5,
  "raw_text": "Mano n.º 257238216500 de PokerStars:  Hold'em No Limit (0.01 €/0.02 € EUR) - 06-08-2025 18:38:26 CET [06-08-2025 12:38:26 ET]\nMesa \"Alruccabah II\" 6-max El asiento n.º 1 es el botón\nAsiento 6: rayao32 (1.04 € en fichas) está ausente\nAsiento 1: SrLyce (1.81 € en fichas) \nAsiento 2: Davdgoni (5.01 € en fichas) \nAsiento 3: PerroBestia (0.87 € en fichas) \nAsiento 4: serviettski(fr) (2.10 € en fichas) \nAsiento 5: Nicanor Cast (1.06 € en fichas) \nDavdgoni: pone la ciega pequeña 0.01 €\nPerroBestia: pone la ciega grande 0.02 €\n*** CARTAS DE MANO ***\nRepartidas a SrLyce [6c 3c]\nserviettski(fr): sube 0.04 € a 0.06 €\nNicanor Cast: se retira \nSrLyce: se retira \nDavdgoni: iguala 0.05 €\nPerroBestia: se retira \n*** FLOP *** [4h Qc 5d]\nDavdgoni: apuesta 0.07 €\nserviettski(fr): iguala 0.07 €\n*** TURN *** [4h Qc 5d] [Jd]\nDavdgoni: apuesta 0.26 €\nserviettski(fr): iguala 0.26 €\n*** RIVER *** [4h Qc 5d Jd] [6h]\nDavdgoni: apuesta 4.62 € y está all-in\nserviettski(fr): se retira \nLa apuesta no igualada (4.62 €) ha sido devuelta a Davdgoni\nDavdgoni se lleva 0.75 € del bote \nDavdgoni: no muestra su mano \n*** RESUMEN ***\nBote total 0.80 € | Comisión 0.05 € \nComunitarias [4h Qc 5d Jd 6h]\nAsiento 6: rayao32\nAsiento 1: SrLyce (botón) se retiró antes del Flop (no apostó)\nAsiento 2: Davdgoni (ciega pequeña) recaudó (0.75 €)\nAsiento 3: PerroBestia (ciega grande) se retiró antes del Flop\nAsiento 4: serviettski(fr) se retiró en el River\nAsiento 5: Nicanor Cast se retiró antes del Flop (no apostó)"
}