{
  "hand_id": "257237917132",
  "date": "06-08-2025 18:11:40",
  "table": "Atreus",
  "game_type": "holdem",
  "hero": "SrLyce",
  "hero_position": "",
  "hero_cards": [
    "5s",
    "7s"
  ],
  "stacks": {
    "PrendsCa": 106.0,
    "NRules82": 85.5,
    "JENOFONTE73": 124.0,
    "Fharock": 101.5,
    "SrLyce": 97.5,
    "FishamanReggae": 33.5
  },
  "actions": {
    "preflop": [
      "Asiento 1: PrendsCa (2.12 € en fichas)",
      "Asiento 2: NRules82 (1.71 € en fichas)",
      "Asiento 3: JENOFONTE73 (2.48 € en fichas)",
      "Asiento 4: Fharock (2.03 € en fichas)",
      "Asiento 5: SrLyce (1.95 € en fichas)",
      "Asiento 6: FishamanReggae (0.67 € en fichas)",
      "FishamanReggae: pone la ciega pequeña 0.01 €",
      "PrendsCa: pone la ciega grande 0.02 €",
      "NRules82: sube 0.02 € a 0.04 €",
      "JENOFONTE73: se retira",
      "Fharock: se retira",
      "SrLyce: iguala 0.04 €",
      "FishamanReggae: se retira",
      "PrendsCa: se retira"
    ],
    "flop": [
      "NRules82: apuesta 0.06 €",
      "SrLyce: se retira",
      "Asiento 1: PrendsCa (ciega grande) se retiró antes del Flop",
      "Asiento 2: NRules82 recaudó (0.10 €)",
      "Asiento 3: JENOFONTE73 se retiró antes del Flop (no apostó)",
      "Asiento 4: Fharock se retiró antes del Flop (no apostó)",
      "Asiento 5: SrLyce (botón) se retiró en el Flop",
      "Asiento 6: FishamanReggae (ciega pequeña) se retiró antes del Flop"
    ],
    "turn": [],
    "river": []
  },
  "board": [
    "Kh",
    "9s",
    "Qc"
  ],
  "winner": "NRules82",
  "win_amount": 5.0,
  "sb": 0.01,
  "bb": 0.02,
  "rake": 0.5,
  "raw_text": "Mano n.º 257237917132 de PokerStars:  Hold'em No Limit (0.01 €/0.02 € EUR) - 06-08-2025 18:11:40 CET [06-08-2025 12:11:40 ET]\nMesa \"Atreus\" 6-max El asiento n.º 5 es el botón\nAsiento 1: PrendsCa (2.12 € en fichas) \nAsiento 2: NRules82 (1.71 € en fichas) \nAsiento 3: JENOFONTE73 (2.48 € en fichas) \nAsiento 4: Fharock (2.03 € en fichas) \nAsiento 5: SrLyce (1.95 € en fichas) \nAsiento 6: FishamanReggae (0.67 € en fichas) \nFishamanReggae: pone la ciega pequeña 0.01 €\nPrendsCa: pone la ciega grande 0.02 €\n*** CARTAS DE MANO ***\nRepartidas a SrLyce [5s 7s]\nNRules82: sube 0.02 € a 0.04 €\nJENOFONTE73: se retira \nFharock: se retira \nSrLyce: iguala 0.04 €\nFishamanReggae: se retira \nPrendsCa: se retira \n*** FLOP *** [Kh 9s Qc]\nNRules82: apuesta 0.06 €\nSrLyce: se retira \nLa apuesta no igualada (0.06 €) ha sido devuelta a NRules82\nNRules82 se lleva 0.10 € del bote \n*** RESUMEN ***\nBote total 0.11 € | Comisión 0.01 € \nComunitarias [Kh 9s Qc]\nAsiento 1: PrendsCa (ciega grande) se retiró antes del Flop\nAsiento 2: NRules82 recaudó (0.10 €)\nAsiento 3: JENOFONTE73 se retiró antes del Flop (no apostó)\nAsiento 4: Fharock se retiró antes del Flop (no apostó)\nAsiento 5: SrLyce (botón) se retiró en el Flop\nAsiento 6: FishamanReggae (ciega pequeña) se retiró antes del Flop"
}