{
  "hand_id": "257238447976",
  "date": "06-08-2025 19:00:02",
  "table": "Alruccabah II",
  "game_type": "holdem",
  "hero": "SrLyce",
  "hero_position": "",
  "hero_cards": [
    "7d",
    "7s"
  ],
  "stacks": {
    "zoioachado": 0.0,
    "SrLyce": 138.0,
    "yonisanlu": 143.0,
    "Nicanor Cast": 52.5,
    "rayao32": 42.5
  },
  "actions": {
    "preflop": [
      "Asiento 2: zoioachado (0 € en fichas) está ausente",
      "Asiento 1: SrLyce (2.76 € en fichas)",
      "Asiento 3: yonisanlu (2.86 € en fichas)",
      "Asiento 4: serviettski(fr) (2.03 € en fichas)",
      "Asiento 5: Nicanor Cast (1.05 € en fichas)",
      "Asiento 6: rayao32 (0.85 € en fichas)",
      "serviettski(fr): pone la ciega pequeña 0.01 €",
      "Nicanor Cast: pone la ciega grande 0.02 €",
      "rayao32: se retira",
      "SrLyce: sube 0.03 € a 0.05 €",
      "yonisanlu: se retira",
      "serviettski(fr): iguala 0.04 €",
      "Nicanor Cast: se retira"
    ],
    "flop": [
      "serviettski(fr): pasa",
      "SrLyce: apuesta 0.04 €",
      "serviettski(fr): iguala 0.04 €"
    ],
    "turn": [
      "serviettski(fr): pasa",
      "SrLyce: pasa"
    ],
    "river": [
      "serviettski(fr): pasa",
      "SrLyce: apuesta 0.15 €",
      "serviettski(fr): se retira",
      "SrLyce: no muestra su mano",
      "Asiento 2: zoioachado",
      "Asiento 1: SrLyce recaudó (0.19 €)",
      "Asiento 3: yonisanlu (botón) se retiró antes del Flop (no apostó)",
      "Asiento 4: serviettski(fr) (ciega pequeña) se retiró en el River",
      "Asiento 5: Nicanor Cast (ciega grande) se retiró antes del Flop",
      "Asiento 6: rayao32 se retiró antes del Flop (no apostó)"
    ]
  },
  "board": [
    "7h",
    "2d",
    "Th",
    "Kh",
    "Ac"
  ],
  "winner": "SrLyce",
  "win_amount": 9.5,
  "sb": 0.01,
  "bb": 0.02,
  "rake": 0.5,
  "raw_text": "Mano n.º 257238447976 de PokerStars:  Hold'em No Limit (0.01 €/0.02 € EUR) - 06-08-2025 19:00:02 CET [06-08-2025 13:00:02 ET]\nMesa \"Alruccabah II\" 6-max El asiento n.º 3 es el botón\nAsiento 2: zoioachado (0 € en fichas) está ausente\nAsiento 1: SrLyce (2.76 € en fichas) \nAsiento 3: yonisanlu (2.86 € en fichas) \nAsiento 4: serviettski(fr) (2.03 € en fichas) \nAsiento 5: Nicanor Cast (1.05 € en fichas) \nAsiento 6: rayao32 (0.85 € en fichas) \nserviettski(fr): pone la ciega pequeña 0.01 €\nNicanor Cast: pone la ciega grande 0.02 €\n*** CARTAS DE MANO ***\nRepartidas a SrLyce [7d 7s]\nrayao32 ha agotado su tiempo\nrayao32: se retira \nSrLyce: sube 0.03 € a 0.05 €\nyonisanlu: se retira \nserviettski(fr): iguala 0.04 €\nNicanor Cast: se retira \n*** FLOP *** [7h 2d Th]\nserviettski(fr): pasa \nSrLyce: apuesta 0.04 €\nserviettski(fr): iguala 0.04 €\n*** TURN *** [7h 2d Th] [Kh]\nserviettski(fr): pasa \nSrLyce: pasa \n*** RIVER *** [7h 2d Th Kh] [Ac]\nserviettski(fr): pasa \nSrLyce: apuesta 0.15 €\nserviettski(fr): se retira \nLa apuesta no igualada (0.15 €) ha sido devuelta a SrLyce\nSrLyce se lleva 0.19 € del bote \nSrLyce: no muestra su mano \n*** RESUMEN ***\nBote total 0.20 € | Comisión 0.01 € \nComunitarias [7h 2d Th Kh Ac]\nAsiento 2: zoioachado\nAsiento 1: SrLyce recaudó (0.19 €)\nAsiento 3: yonisanlu (botón) se retiró antes del Flop (no apostó)\nAsiento 4: serviettski(fr) (ciega pequeña) se retiró en el River\nAsiento 5: Nicanor Cast (ciega grande) se retiró antes del Flop\nAsiento 6: rayao32 se retiró antes del Flop (no apostó)"
}