{
  "hand_id": "257150515252",
  "date": "30-07-2025 23:47:26",
  "table": "Martha",
  "game_type": "holdem",
  "hero": "SrLyce",
  "hero_position": "",
  "hero_cards": [
    "8d",
    "5d"
  ],
  "stacks": {
    "mivipkr": 104.5,
    "NovacaineZxc": 132.5,
    "BudyXXIII": 100.0,
    "SrLyce": 115.0,
    "alexfw300": 100.5
  },
  "actions": {
    "preflop": [
      "Asiento 1: mivipkr (2.09 € en fichas)",
      "Asiento 2: NovacaineZxc (2.65 € en fichas)",
      "Asiento 3: BudyXXIII (2 € en fichas)",
      "Asiento 5: SrLyce (2.30 € en fichas)",
      "Asiento 6: alexfw300 (2.01 € en fichas)",
      "SrLyce: pone la ciega pequeña 0.01 €",
      "alexfw300: pone la ciega grande 0.02 €",
      "mivipkr: se retira",
      "NovacaineZxc: se retira",
      "BudyXXIII: se retira",
      "SrLyce: sube 0.04 € a 0.06 €",
      "alexfw300: iguala 0.04 €"
    ],
    "flop": [
      "SrLyce: apuesta 0.11 €",
      "alexfw300: iguala 0.11 €"
    ],
    "turn": [
      "SrLyce: apuesta 0.32 €",
      "alexfw300: iguala 0.32 €"
    ],
    "river": [
      "SrLyce: apuesta 1.81 € y está all-in",
      "alexfw300: iguala 1.52 € y está all-in",
      "SrLyce: muestra [8d 5d] (color, carta alta dama)",
      "alexfw300: muestra [Ad 3d] (color, carta alta as)",
      "Asiento 1: mivipkr se retiró antes del Flop (no apostó)",
      "Asiento 2: NovacaineZxc se retiró antes del Flop (no apostó)",
      "Asiento 3: BudyXXIII (botón) se retiró antes del Flop (no apostó)",
      "Asiento 5: SrLyce (ciega pequeña) muestra [8d 5d] y perdió con color, carta alta dama",
      "Asiento 6: alexfw300 (ciega grande) muestra [Ad 3d] y ganó (3.87 €) con color, carta alta as"
    ]
  },
  "board": [
    "Qd",
    "Td",
    "7d",
    "6h",
    "Ah"
  ],
  "winner": "alexfw300",
  "win_amount": 193.5,
  "sb": 0.01,
  "bb": 0.02,
  "rake": 7.5,
  "raw_text": "Mano n.º 257150515252 de PokerStars:  Hold'em No Limit (0.01 €/0.02 € EUR) - 30-07-2025 23:47:26 CET [30-07-2025 17:47:26 ET]\nMesa \"Martha\" 6-max El asiento n.º 3 es el botón\nAsiento 1: mivipkr (2.09 € en fichas) \nAsiento 2: NovacaineZxc (2.65 € en fichas) \nAsiento 3: BudyXXIII (2 € en fichas) \nAsiento 5: SrLyce (2.30 € en fichas) \nAsiento 6: alexfw300 (2.01 € en fichas) \nSrLyce: pone la ciega pequeña 0.01 €\nalexfw300: pone la ciega grande 0.02 €\n*** CARTAS DE MANO ***\nRepartidas a SrLyce [8d 5d]\nmivipkr: se retira \nNovacaineZxc: se retira \nBudyXXIII ha agotado su tiempo\nBudyXXIII: se retira \nSrLyce: sube 0.04 € a 0.06 €\nalexfw300: iguala 0.04 €\n*** FLOP *** [Qd Td 7d]\nSrLyce: apuesta 0.11 €\nalexfw300: iguala 0.11 €\n*** TURN *** [Qd Td 7d] [6h]\nSrLyce: apuesta 0.32 €\nalexfw300: iguala 0.32 €\n*** RIVER *** [Qd Td 7d 6h] [Ah]\nSrLyce: apuesta 1.81 € y está all-in\nalexfw300: iguala 1.52 € y está all-in\nLa apuesta no igualada (0.29 €) ha sido devuelta a SrLyce\n*** SHOW DOWN ***\nSrLyce: muestra [8d 5d] (color, carta alta dama)\nalexfw300: muestra [Ad 3d] (color, carta alta as)\nalexfw300 se lleva 3.87 € del bote \n*** RESUMEN ***\nBote total 4.02 € | Comisión 0.15 € \nComunitarias [Qd Td 7d 6h Ah]\nAsiento 1: mivipkr se retiró antes del Flop (no apostó)\nAsiento 2: NovacaineZxc se retiró antes del Flop (no apostó)\nAsiento 3: BudyXXIII (botón) se retiró antes del Flop (no apostó)\nAsiento 5: SrLyce (ciega pequeña) muestra [8d 5d] y perdió con color, carta alta dama\nAsiento 6: alexfw300 (ciega grande) muestra [Ad 3d] y ganó (3.87 €) con color, carta alta as"
}