{
  "hand_id": "257215248501",
  "date": "04-08-2025 22:33:35",
  "table": "Aldhafera II",
  "game_type": "holdem",
  "hero": "SrLyce",
  "hero_position": "",
  "hero_cards": [
    "2d",
    "3s"
  ],
  "stacks": {
    "wsx25": 67.5,
    "BudyXXIII": 292.5,
    "SrLyce": 99.0,
    "rhidoxxx": 87.5,
    "jte-ken": 110.0,
    "betterrrrrr": 170.0
  },
  "actions": {
    "preflop": [
      "Asiento 1: wsx25 (1.35 € en fichas)",
      "Asiento 2: BudyXXIII (5.85 € en fichas)",
      "Asiento 3: SrLyce (1.98 € en fichas)",
      "Asiento 4: rhidoxxx (1.75 € en fichas)",
      "Asiento 5: jte-ken (2.20 € en fichas)",
      "Asiento 6: betterrrrrr (3.40 € en fichas)",
      "SrLyce: pone la ciega pequeña 0.01 €",
      "rhidoxxx: pone la ciega grande 0.02 €",
      "jte-ken: se retira",
      "betterrrrrr: se retira",
      "wsx25: se retira",
      "BudyXXIII: se retira",
      "SrLyce: se retira",
      "rhidoxxx: no muestra su mano",
      "Asiento 1: wsx25 se retiró antes del Flop (no apostó)",
      "Asiento 2: BudyXXIII (botón) se retiró antes del Flop (no apostó)",
      "Asiento 3: SrLyce (ciega pequeña) se retiró antes del Flop",
      "Asiento 4: rhidoxxx (ciega grande) recaudó (0.02 €)",
      "Asiento 5: jte-ken se retiró antes del Flop (no apostó)",
      "Asiento 6: betterrrrrr se retiró antes del Flop (no apostó)"
    ],
    "flop": [],
    "turn": [],
    "river": []
  },
  "board": [],
  "winner": "rhidoxxx",
  "win_amount": 1.0,
  "sb": 0.01,
  "bb": 0.02,
  "rake": 0.0,
  "raw_text": "Mano n.º 257215248501 de PokerStars:  Hold'em No Limit (0.01 €/0.02 € EUR) - 04-08-2025 22:33:35 CET [04-08-2025 16:33:35 ET]\nMesa \"Aldhafera II\" 6-max El asiento n.º 2 es el botón\nAsiento 1: wsx25 (1.35 € en fichas) \nAsiento 2: BudyXXIII (5.85 € en fichas) \nAsiento 3: SrLyce (1.98 € en fichas) \nAsiento 4: rhidoxxx (1.75 € en fichas) \nAsiento 5: jte-ken (2.20 € en fichas) \nAsiento 6: betterrrrrr (3.40 € en fichas) \nSrLyce: pone la ciega pequeña 0.01 €\nrhidoxxx: pone la ciega grande 0.02 €\n*** CARTAS DE MANO ***\nRepartidas a SrLyce [2d 3s]\njte-ken: se retira \nbetterrrrrr: se retira \nwsx25: se retira \nBudyXXIII: se retira \nSrLyce: se retira \nLa apuesta no igualada (0.01 €) ha sido devuelta a rhidoxxx\nrhidoxxx se lleva 0.02 € del bote \nrhidoxxx: no muestra su mano \n*** RESUMEN ***\nBote total 0.02 € | Comisión 0 € \nAsiento 1: wsx25 se retiró antes del Flop (no apostó)\nAsiento 2: BudyXXIII (botón) se retiró antes del Flop (no apostó)\nAsiento 3: SrLyce (ciega pequeña) se retiró antes del Flop\nAsiento 4: rhidoxxx (ciega grande) recaudó (0.02 €)\nAsiento 5: jte-ken se retiró antes del Flop (no apostó)\nAsiento 6: betterrrrrr se retiró antes del Flop (no apostó)"
}