{
  "hand_id": "257149190589",
  "date": "30-07-2025 22:14:25",
  "table": "Sirona",
  "game_type": "holdem",
  "hero": "SrLyce",
  "hero_position": "",
  "hero_cards": [
    "Qs",
    "9s"
  ],
  "stacks": {
    "SrLyce": 254.5,
    "Tropki": 100.0,
    "christoph363": 93.0,
    "oliverdu70": 183.5,
    "hadhod1976": 38.5,
    "MitchATP65": 103.0
  },
  "actions": {
    "preflop": [
      "Asiento 1: SrLyce (5.09 € en fichas)",
      "Asiento 2: Tropki (2 € en fichas)",
      "Asiento 3: christoph363 (1.86 € en fichas)",
      "Asiento 4: oliverdu70 (3.67 € en fichas)",
      "Asiento 5: hadhod1976 (0.77 € en fichas)",
      "Asiento 6: MitchATP65 (2.06 € en fichas)",
      "christoph363: pone la ciega pequeña 0.01 €",
      "oliverdu70: pone la ciega grande 0.02 €",
      "hadhod1976: se retira",
      "MitchATP65: se retira",
      "SrLyce: sube 0.04 € a 0.06 €",
      "Tropki: se retira",
      "christoph363: se retira",
      "oliverdu70: iguala 0.04 €"
    ],
    "flop": [
      "oliverdu70: pasa",
      "SrLyce: pasa"
    ],
    "turn": [
      "oliverdu70: pasa",
      "SrLyce: pasa"
    ],
    "river": [
      "oliverdu70: apuesta 0.04 €",
      "SrLyce: se retira",
      "Asiento 1: SrLyce se retiró en el River",
      "Asiento 2: Tropki (botón) se retiró antes del Flop (no apostó)",
      "Asiento 3: christoph363 (ciega pequeña) se retiró antes del Flop",
      "Asiento 4: oliverdu70 (ciega grande) recaudó (0.12 €)",
      "Asiento 5: hadhod1976 se retiró antes del Flop (no apostó)",
      "Asiento 6: MitchATP65 se retiró antes del Flop (no apostó)"
    ]
  },
  "board": [
    "5d",
    "2s",
    "Jh",
    "Ks",
    "3c"
  ],
  "winner": "oliverdu70",
  "win_amount": 6.0,
  "sb": 0.01,
  "bb": 0.02,
  "rake": 0.5,
  "raw_text": "Mano n.º 257149190589 de PokerStars:  Hold'em No Limit (0.01 €/0.02 € EUR) - 30-07-2025 22:14:25 CET [30-07-2025 16:14:25 ET]\nMesa \"Sirona\" 6-max El asiento n.º 2 es el botón\nAsiento 1: SrLyce (5.09 € en fichas) \nAsiento 2: Tropki (2 € en fichas) \nAsiento 3: christoph363 (1.86 € en fichas) \nAsiento 4: oliverdu70 (3.67 € en fichas) \nAsiento 5: hadhod1976 (0.77 € en fichas) \nAsiento 6: MitchATP65 (2.06 € en fichas) \nchristoph363: pone la ciega pequeña 0.01 €\noliverdu70: pone la ciega grande 0.02 €\n*** CARTAS DE MANO ***\nRepartidas a SrLyce [Qs 9s]\nhadhod1976: se retira \nMitchATP65: se retira \nSrLyce: sube 0.04 € a 0.06 €\nTropki: se retira \nchristoph363: se retira \noliverdu70: iguala 0.04 €\n*** FLOP *** [5d 2s Jh]\noliverdu70: pasa \nSrLyce: pasa \n*** TURN *** [5d 2s Jh] [Ks]\noliverdu70: pasa \nSrLyce: pasa \n*** RIVER *** [5d 2s Jh Ks] [3c]\noliverdu70: apuesta 0.04 €\nSrLyce: se retira \nLa apuesta no igualada (0.04 €) ha sido devuelta a oliverdu70\noliverdu70 se lleva 0.12 € del bote \n*** RESUMEN ***\nBote total 0.13 € | Comisión 0.01 € \nComunitarias [5d 2s Jh Ks 3c]\nAsiento 1: SrLyce se retiró en el River\nAsiento 2: Tropki (botón) se retiró antes del Flop (no apostó)\nAsiento 3: christoph363 (ciega pequeña) se retiró antes del Flop\nAsiento 4: oliverdu70 (ciega grande) recaudó (0.12 €)\nAsiento 5: hadhod1976 se retiró antes del Flop (no apostó)\nAsiento 6: MitchATP65 se retiró antes del Flop (no apostó)"
}