{
  "hand_id": "257215300684",
  "date": "04-08-2025 22:36:49",
  "table": "Aldhafera II",
  "game_type": "holdem",
  "hero": "SrLyce",
  "hero_position": "",
  "hero_cards": [
    "8h",
    "6c"
  ],
  "stacks": {
    "BudyXXIII": 292.5,
    "betterrrrrr": 171.5,
    "wsx25": 63.5,
    "SrLyce": 97.5,
    "rhidoxxx": 75.5,
    "jte-ken": 124.0
  },
  "actions": {
    "preflop": [
      "Asiento 2: BudyXXIII (5.85 € en fichas) está ausente",
      "Asiento 6: betterrrrrr (3.43 € en fichas) está ausente",
      "Asiento 1: wsx25 (1.27 € en fichas)",
      "Asiento 3: SrLyce (1.95 € en fichas)",
      "Asiento 4: rhidoxxx (1.51 € en fichas)",
      "Asiento 5: jte-ken (2.48 € en fichas)",
      "SrLyce: pone la ciega pequeña 0.01 €",
      "rhidoxxx: pone la ciega grande 0.02 €",
      "jte-ken: sube 0.02 € a 0.04 €",
      "wsx25: iguala 0.04 €",
      "SrLyce: iguala 0.03 €",
      "rhidoxxx: iguala 0.02 €"
    ],
    "flop": [
      "SrLyce: pasa",
      "rhidoxxx: apuesta 0.04 €",
      "jte-ken: se retira",
      "wsx25: iguala 0.04 €",
      "SrLyce: iguala 0.04 €"
    ],
    "turn": [
      "SrLyce: pasa",
      "rhidoxxx: apuesta 0.04 €",
      "wsx25: iguala 0.04 €",
      "SrLyce: sube 0.12 € a 0.16 €",
      "rhidoxxx: iguala 0.12 €",
      "wsx25: iguala 0.12 €"
    ],
    "river": [
      "SrLyce: apuesta 1.71 € y está all-in",
      "rhidoxxx: iguala 1.27 € y está all-in",
      "wsx25: se retira",
      "SrLyce: muestra [8h 6c] (escalera, de cinco a nueve)",
      "rhidoxxx: muestra [5c Ah] (doble pareja, ases y cincos)",
      "Asiento 2: BudyXXIII",
      "Asiento 6: betterrrrrr",
      "Asiento 1: wsx25 (botón) se retiró en el River",
      "Asiento 3: SrLyce (ciega pequeña) muestra [8h 6c] y ganó (3.20 €) con escalera, de cinco a nueve",
      "Asiento 4: rhidoxxx (ciega grande) muestra [5c Ah] y perdió con doble pareja, ases y cincos",
      "Asiento 5: jte-ken se retiró en el Flop"
    ]
  },
  "board": [
    "4c",
    "5h",
    "9h",
    "7s",
    "Ac"
  ],
  "winner": "SrLyce",
  "win_amount": 160.0,
  "sb": 0.01,
  "bb": 0.02,
  "rake": 5.0,
  "raw_text": "Mano n.º 257215300684 de PokerStars:  Hold'em No Limit (0.01 €/0.02 € EUR) - 04-08-2025 22:36:49 CET [04-08-2025 16:36:49 ET]\nMesa \"Aldhafera II\" 6-max El asiento n.º 1 es el botón\nAsiento 2: BudyXXIII (5.85 € en fichas) está ausente\nAsiento 6: betterrrrrr (3.43 € en fichas) está ausente\nAsiento 1: wsx25 (1.27 € en fichas) \nAsiento 3: SrLyce (1.95 € en fichas) \nAsiento 4: rhidoxxx (1.51 € en fichas) \nAsiento 5: jte-ken (2.48 € en fichas) \nSrLyce: pone la ciega pequeña 0.01 €\nrhidoxxx: pone la ciega grande 0.02 €\n*** CARTAS DE MANO ***\nRepartidas a SrLyce [8h 6c]\njte-ken: sube 0.02 € a 0.04 €\nwsx25: iguala 0.04 €\nSrLyce: iguala 0.03 €\nrhidoxxx: iguala 0.02 €\n*** FLOP *** [4c 5h 9h]\nSrLyce: pasa \nrhidoxxx: apuesta 0.04 €\njte-ken: se retira \nwsx25: iguala 0.04 €\nSrLyce: iguala 0.04 €\n*** TURN *** [4c 5h 9h] [7s]\nSrLyce: pasa \nrhidoxxx: apuesta 0.04 €\nwsx25: iguala 0.04 €\nSrLyce: sube 0.12 € a 0.16 €\nrhidoxxx: iguala 0.12 €\nwsx25: iguala 0.12 €\n*** RIVER *** [4c 5h 9h 7s] [Ac]\nSrLyce: apuesta 1.71 € y está all-in\nrhidoxxx: iguala 1.27 € y está all-in\nwsx25: se retira \nLa apuesta no igualada (0.44 €) ha sido devuelta a SrLyce\n*** SHOW DOWN ***\nSrLyce: muestra [8h 6c] (escalera, de cinco a nueve)\nrhidoxxx: muestra [5c Ah] (doble pareja, ases y cincos)\nSrLyce se lleva 3.20 € del bote \n*** RESUMEN ***\nBote total 3.30 € | Comisión 0.10 € \nComunitarias [4c 5h 9h 7s Ac]\nAsiento 2: BudyXXIII\nAsiento 6: betterrrrrr\nAsiento 1: wsx25 (botón) se retiró en el River\nAsiento 3: SrLyce (ciega pequeña) muestra [8h 6c] y ganó (3.20 €) con escalera, de cinco a nueve\nAsiento 4: rhidoxxx (ciega grande) muestra [5c Ah] y perdió con doble pareja, ases y cincos\nAsiento 5: jte-ken se retiró en el Flop"
}