{
  "hand_id": "257237589848",
  "date": "06-08-2025 17:38:56",
  "table": "Themisto III",
  "game_type": "holdem",
  "hero": "SrLyce",
  "hero_position": "",
  "hero_cards": [
    "Td",
    "2d"
  ],
  "stacks": {
    "elso253": 78.0,
    "SrLyce": 131.5,
    "idigon": 10.5,
    "fred2d23po": 77.0,
    "mivipkr": 108.5,
    "marignamo": 90.5
  },
  "actions": {
    "preflop": [
      "Asiento 1: elso253 (1.56 € en fichas)",
      "Asiento 2: SrLyce (2.63 € en fichas)",
      "Asiento 3: idigon (0.21 € en fichas)",
      "Asiento 4: fred2d23po (1.54 € en fichas)",
      "Asiento 5: mivipkr (2.17 € en fichas)",
      "Asiento 6: marignamo (1.81 € en fichas)",
      "mivipkr: pone la ciega pequeña 0.01 €",
      "marignamo: pone la ciega grande 0.02 €",
      "elso253: se retira",
      "SrLyce: se retira",
      "idigon: sube 0.02 € a 0.04 €",
      "fred2d23po: iguala 0.04 €",
      "mivipkr: se retira",
      "marignamo: se retira"
    ],
    "flop": [
      "idigon: apuesta 0.02 €",
      "fred2d23po: iguala 0.02 €"
    ],
    "turn": [
      "idigon: apuesta 0.02 €",
      "fred2d23po: iguala 0.02 €"
    ],
    "river": [
      "idigon: apuesta 0.02 €",
      "fred2d23po: sube 0.22 € a 0.24 €",
      "idigon: se retira",
      "Asiento 1: elso253 se retiró antes del Flop (no apostó)",
      "Asiento 2: SrLyce se retiró antes del Flop (no apostó)",
      "Asiento 3: idigon se retiró en el River",
      "Asiento 4: fred2d23po (botón) recaudó (0.22 €)",
      "Asiento 5: mivipkr (ciega pequeña) se retiró antes del Flop",
      "Asiento 6: marignamo (ciega grande) se retiró antes del Flop"
    ]
  },
  "board": [
    "8h",
    "9c",
    "2h",
    "7h",
    "Jh"
  ],
  "winner": "fred2d23po",
  "win_amount": 11.0,
  "sb": 0.01,
  "bb": 0.02,
  "rake": 0.5,
  "raw_text": "Mano n.º 257237589848 de PokerStars:  Hold'em No Limit (0.01 €/0.02 € EUR) - 06-08-2025 17:38:56 CET [06-08-2025 11:38:56 ET]\nMesa \"Themisto III\" 6-max El asiento n.º 4 es el botón\nAsiento 1: elso253 (1.56 € en fichas) \nAsiento 2: SrLyce (2.63 € en fichas) \nAsiento 3: idigon (0.21 € en fichas) \nAsiento 4: fred2d23po (1.54 € en fichas) \nAsiento 5: mivipkr (2.17 € en fichas) \nAsiento 6: marignamo (1.81 € en fichas) \nmivipkr: pone la ciega pequeña 0.01 €\nmarignamo: pone la ciega grande 0.02 €\n*** CARTAS DE MANO ***\nRepartidas a SrLyce [Td 2d]\nelso253: se retira \nelso253 deja la mesa\nSrLyce: se retira \nidigon: sube 0.02 € a 0.04 €\nfred2d23po: iguala 0.04 €\nmivipkr: se retira \nmarignamo: se retira \n*** FLOP *** [8h 9c 2h]\nidigon: apuesta 0.02 €\nfred2d23po: iguala 0.02 €\n*** TURN *** [8h 9c 2h] [7h]\nidigon: apuesta 0.02 €\nfred2d23po: iguala 0.02 €\n*** RIVER *** [8h 9c 2h 7h] [Jh]\nidigon: apuesta 0.02 €\nfred2d23po: sube 0.22 € a 0.24 €\nidigon: se retira \nLa apuesta no igualada (0.22 €) ha sido devuelta a fred2d23po\nfred2d23po se lleva 0.22 € del bote \n*** RESUMEN ***\nBote total 0.23 € | Comisión 0.01 € \nComunitarias [8h 9c 2h 7h Jh]\nAsiento 1: elso253 se retiró antes del Flop (no apostó)\nAsiento 2: SrLyce se retiró antes del Flop (no apostó)\nAsiento 3: idigon se retiró en el River\nAsiento 4: fred2d23po (botón) recaudó (0.22 €)\nAsiento 5: mivipkr (ciega pequeña) se retiró antes del Flop\nAsiento 6: marignamo (ciega grande) se retiró antes del Flop"
}