{
  "hand_id": "257238541819",
  "date": "06-08-2025 19:08:30",
  "table": "Leonteus",
  "game_type": "holdem",
  "hero": "SrLyce",
  "hero_position": "",
  "hero_cards": [
    "Kc",
    "3d"
  ],
  "stacks": {
    "practikal_C23": 42.5,
    "durahimovic": 294.0,
    "davinci1962": 137.0,
    "BuXHexter": 145.5,
    "Andark47": 188.0,
    "SrLyce": 75.0
  },
  "actions": {
    "preflop": [
      "Asiento 1: practikal_C23 (0.85 € en fichas)",
      "Asiento 2: durahimovic (5.88 € en fichas)",
      "Asiento 3: davinci1962 (2.74 € en fichas)",
      "Asiento 4: BuXHexter (2.91 € en fichas)",
      "Asiento 5: Andark47 (3.76 € en fichas)",
      "Asiento 6: SrLyce (1.50 € en fichas)",
      "SrLyce: pone la ciega pequeña 0.01 €",
      "practikal_C23: pone la ciega grande 0.02 €",
      "durahimovic: sube 0.04 € a 0.06 €",
      "davinci1962: se retira",
      "BuXHexter: se retira",
      "Andark47: se retira",
      "SrLyce: se retira",
      "practikal_C23: se retira",
      "durahimovic: no muestra su mano",
      "Asiento 1: practikal_C23 (ciega grande) se retiró antes del Flop",
      "Asiento 2: durahimovic recaudó (0.05 €)",
      "Asiento 3: davinci1962 se retiró antes del Flop (no apostó)",
      "Asiento 4: BuXHexter se retiró antes del Flop (no apostó)",
      "Asiento 5: Andark47 (botón) se retiró antes del Flop (no apostó)",
      "Asiento 6: SrLyce (ciega pequeña) se retiró antes del Flop"
    ],
    "flop": [],
    "turn": [],
    "river": []
  },
  "board": [],
  "winner": "durahimovic",
  "win_amount": 2.5,
  "sb": 0.01,
  "bb": 0.02,
  "rake": 0.0,
  "raw_text": "Mano n.º 257238541819 de PokerStars:  Hold'em No Limit (0.01 €/0.02 € EUR) - 06-08-2025 19:08:30 CET [06-08-2025 13:08:30 ET]\nMesa \"Leonteus\" 6-max El asiento n.º 5 es el botón\nAsiento 1: practikal_C23 (0.85 € en fichas) \nAsiento 2: durahimovic (5.88 € en fichas) \nAsiento 3: davinci1962 (2.74 € en fichas) \nAsiento 4: BuXHexter (2.91 € en fichas) \nAsiento 5: Andark47 (3.76 € en fichas) \nAsiento 6: SrLyce (1.50 € en fichas) \nSrLyce: pone la ciega pequeña 0.01 €\npractikal_C23: pone la ciega grande 0.02 €\n*** CARTAS DE MANO ***\nRepartidas a SrLyce [Kc 3d]\ndurahimovic: sube 0.04 € a 0.06 €\ndavinci1962: se retira \nBuXHexter: se retira \nAndark47: se retira \nSrLyce: se retira \npractikal_C23: se retira \nLa apuesta no igualada (0.04 €) ha sido devuelta a durahimovic\ndurahimovic se lleva 0.05 € del bote \ndurahimovic: no muestra su mano \n*** RESUMEN ***\nBote total 0.05 € | Comisión 0 € \nAsiento 1: practikal_C23 (ciega grande) se retiró antes del Flop\nAsiento 2: durahimovic recaudó (0.05 €)\nAsiento 3: davinci1962 se retiró antes del Flop (no apostó)\nAsiento 4: BuXHexter se retiró antes del Flop (no apostó)\nAsiento 5: Andark47 (botón) se retiró antes del Flop (no apostó)\nAsiento 6: SrLyce (ciega pequeña) se retiró antes del Flop"
}