{
  "hand_id": "257238631488",
  "date": "06-08-2025 19:16:01",
  "table": "Adelaide III",
  "game_type": "holdem",
  "hero": "SrLyce",
  "hero_position": "",
  "hero_cards": [
    "9s",
    "Kd"
  ],
  "stacks": {
    "Macklemore0": 106.5,
    "Alceo27": 100.0,
    "aliendee07": 68.5,
    "SrLyce": 130.5,
    "ismagonzalez7": 34.0
  },
  "actions": {
    "preflop": [
      "Asiento 3: Macklemore0 (2.13 € en fichas) está ausente",
      "Asiento 1: Alceo27 (2 € en fichas)",
      "Asiento 2: aliendee07 (1.37 € en fichas)",
      "Asiento 4: SrLyce (2.61 € en fichas)",
      "Asiento 5: ismagonzalez7 (0.68 € en fichas)",
      "aliendee07: pone la ciega pequeña 0.01 €",
      "SrLyce: pone la ciega grande 0.02 €",
      "ismagonzalez7: sube 0.02 € a 0.04 €",
      "Alceo27: se retira",
      "aliendee07: se retira",
      "SrLyce: iguala 0.02 €"
    ],
    "flop": [
      "SrLyce: pasa",
      "ismagonzalez7: apuesta 0.04 €",
      "SrLyce: iguala 0.04 €"
    ],
    "turn": [
      "SrLyce: apuesta 0.08 €",
      "ismagonzalez7: se retira",
      "SrLyce: no muestra su mano",
      "Asiento 3: Macklemore0",
      "Asiento 1: Alceo27 (botón) se retiró antes del Flop (no apostó)",
      "Asiento 2: aliendee07 (ciega pequeña) se retiró antes del Flop",
      "Asiento 4: SrLyce (ciega grande) recaudó (0.16 €)",
      "Asiento 5: ismagonzalez7 se retiró en el Turn"
    ],
    "river": []
  },
  "board": [
    "Jc",
    "Kh",
    "7c",
    "Kc"
  ],
  "winner": "SrLyce",
  "win_amount": 8.0,
  "sb": 0.01,
  "bb": 0.02,
  "rake": 0.5,
  "raw_text": "Mano n.º 257238631488 de PokerStars:  Hold'em No Limit (0.01 €/0.02 € EUR) - 06-08-2025 19:16:01 CET [06-08-2025 13:16:01 ET]\nMesa \"Adelaide III\" 6-max El asiento n.º 1 es el botón\nAsiento 3: Macklemore0 (2.13 € en fichas) está ausente\nAsiento 1: Alceo27 (2 € en fichas) \nAsiento 2: aliendee07 (1.37 € en fichas) \nAsiento 4: SrLyce (2.61 € en fichas) \nAsiento 5: ismagonzalez7 (0.68 € en fichas) \naliendee07: pone la ciega pequeña 0.01 €\nSrLyce: pone la ciega grande 0.02 €\n*** CARTAS DE MANO ***\nRepartidas a SrLyce [9s Kd]\nismagonzalez7: sube 0.02 € a 0.04 €\nAlceo27: se retira \naliendee07: se retira \nSrLyce: iguala 0.02 €\n*** FLOP *** [Jc Kh 7c]\nMcFlash3 se une a la mesa en el asiento n.º 6 \nSrLyce: pasa \nismagonzalez7: apuesta 0.04 €\nSrLyce: iguala 0.04 €\n*** TURN *** [Jc Kh 7c] [Kc]\nSrLyce: apuesta 0.08 €\nismagonzalez7: se retira \nLa apuesta no igualada (0.08 €) ha sido devuelta a SrLyce\nSrLyce se lleva 0.16 € del bote \nSrLyce: no muestra su mano \n*** RESUMEN ***\nBote total 0.17 € | Comisión 0.01 € \nComunitarias [Jc Kh 7c Kc]\nAsiento 3: Macklemore0\nAsiento 1: Alceo27 (botón) se retiró antes del Flop (no apostó)\nAsiento 2: aliendee07 (ciega pequeña) se retiró antes del Flop\nAsiento 4: SrLyce (ciega grande) recaudó (0.16 €)\nAsiento 5: ismagonzalez7 se retiró en el Turn"
}