{
  "hand_id": "257238207143",
  "date": "06-08-2025 18:37:36",
  "table": "Atreus",
  "game_type": "holdem",
  "hero": "SrLyce",
  "hero_position": "",
  "hero_cards": [
    "5h",
    "Ks"
  ],
  "stacks": {
    "PrendsCa": 100.0,
    "Homerob1987": 36.5,
    "JENOFONTE73": 162.5,
    "Fharock": 89.0,
    "SrLyce": 143.0,
    "FishamanReggae": 31.0
  },
  "actions": {
    "preflop": [
      "Asiento 1: PrendsCa (2 € en fichas)",
      "Asiento 2: Homerob1987 (0.73 € en fichas)",
      "Asiento 3: JENOFONTE73 (3.25 € en fichas)",
      "Asiento 4: Fharock (1.78 € en fichas)",
      "Asiento 5: SrLyce (2.86 € en fichas)",
      "Asiento 6: FishamanReggae (0.62 € en fichas)",
      "JENOFONTE73: pone la ciega pequeña 0.01 €",
      "Fharock: pone la ciega grande 0.02 €",
      "SrLyce: se retira",
      "FishamanReggae: iguala 0.02 €",
      "PrendsCa: se retira",
      "Homerob1987: iguala 0.02 €",
      "JENOFONTE73: sube 0.03 € a 0.05 €",
      "Fharock: se retira",
      "FishamanReggae: iguala 0.03 €",
      "Homerob1987: iguala 0.03 €"
    ],
    "flop": [
      "JENOFONTE73: apuesta 0.08 €",
      "FishamanReggae: iguala 0.08 €",
      "Homerob1987: iguala 0.08 €"
    ],
    "turn": [
      "JENOFONTE73: pasa",
      "FishamanReggae: apuesta 0.06 €",
      "Homerob1987: iguala 0.06 €",
      "JENOFONTE73: se retira"
    ],
    "river": [
      "FishamanReggae: apuesta 0.06 €",
      "Homerob1987: se retira",
      "Asiento 1: PrendsCa se retiró antes del Flop (no apostó)",
      "Asiento 2: Homerob1987 (botón) se retiró en el River",
      "Asiento 3: JENOFONTE73 (ciega pequeña) se retiró en el Turn",
      "Asiento 4: Fharock (ciega grande) se retiró antes del Flop",
      "Asiento 5: SrLyce se retiró antes del Flop (no apostó)",
      "Asiento 6: FishamanReggae recaudó (0.50 €)"
    ]
  },
  "board": [
    "7d",
    "Qc",
    "Kd",
    "Qh",
    "2c"
  ],
  "winner": "FishamanReggae",
  "win_amount": 25.0,
  "sb": 0.01,
  "bb": 0.02,
  "rake": 1.5,
  "raw_text": "Mano n.º 257238207143 de PokerStars:  Hold'em No Limit (0.01 €/0.02 € EUR) - 06-08-2025 18:37:36 CET [06-08-2025 12:37:36 ET]\nMesa \"Atreus\" 6-max El asiento n.º 2 es el botón\nAsiento 1: PrendsCa (2 € en fichas) \nAsiento 2: Homerob1987 (0.73 € en fichas) \nAsiento 3: JENOFONTE73 (3.25 € en fichas) \nAsiento 4: Fharock (1.78 € en fichas) \nAsiento 5: SrLyce (2.86 € en fichas) \nAsiento 6: FishamanReggae (0.62 € en fichas) \nJENOFONTE73: pone la ciega pequeña 0.01 €\nFharock: pone la ciega grande 0.02 €\n*** CARTAS DE MANO ***\nRepartidas a SrLyce [5h Ks]\nSrLyce: se retira \nFishamanReggae: iguala 0.02 €\nPrendsCa: se retira \nHomerob1987: iguala 0.02 €\nJENOFONTE73: sube 0.03 € a 0.05 €\nFharock: se retira \nFishamanReggae: iguala 0.03 €\nHomerob1987: iguala 0.03 €\n*** FLOP *** [7d Qc Kd]\nJENOFONTE73: apuesta 0.08 €\nFishamanReggae: iguala 0.08 €\nHomerob1987: iguala 0.08 €\n*** TURN *** [7d Qc Kd] [Qh]\nJENOFONTE73: pasa \nFishamanReggae: apuesta 0.06 €\nHomerob1987: iguala 0.06 €\nJENOFONTE73: se retira \n*** RIVER *** [7d Qc Kd Qh] [2c]\nFishamanReggae: apuesta 0.06 €\nHomerob1987: se retira \nLa apuesta no igualada (0.06 €) ha sido devuelta a FishamanReggae\nFishamanReggae se lleva 0.50 € del bote \n*** RESUMEN ***\nBote total 0.53 € | Comisión 0.03 € \nComunitarias [7d Qc Kd Qh 2c]\nAsiento 1: PrendsCa se retiró antes del Flop (no apostó)\nAsiento 2: Homerob1987 (botón) se retiró en el River\nAsiento 3: JENOFONTE73 (ciega pequeña) se retiró en el Turn\nAsiento 4: Fharock (ciega grande) se retiró antes del Flop\nAsiento 5: SrLyce se retiró antes del Flop (no apostó)\nAsiento 6: FishamanReggae recaudó (0.50 €)"
}