{
  "hand_id": "257215344996",
  "date": "04-08-2025 22:39:32",
  "table": "Aldhafera II",
  "game_type": "holdem",
  "hero": "SrLyce",
  "hero_position": "",
  "hero_cards": [
    "Kd",
    "8s"
  ],
  "stacks": {
    "BudyXXIII": 292.5,
    "betterrrrrr": 171.5,
    "wsx25": 91.5,
    "SrLyce": 176.0,
    "rhidoxxx": 104.5,
    "jte-ken": 122.5
  },
  "actions": {
    "preflop": [
      "Asiento 2: BudyXXIII (5.85 € en fichas) está ausente",
      "Asiento 6: betterrrrrr (3.43 € en fichas) está ausente",
      "Asiento 1: wsx25 (1.83 € en fichas)",
      "Asiento 3: SrLyce (3.52 € en fichas)",
      "Asiento 4: rhidoxxx (2.09 € en fichas)",
      "Asiento 5: jte-ken (2.45 € en fichas)",
      "jte-ken: pone la ciega pequeña 0.01 €",
      "wsx25: pone la ciega grande 0.02 €",
      "SrLyce: se retira",
      "rhidoxxx: sube 0.02 € a 0.04 €",
      "jte-ken: se retira",
      "wsx25: se retira",
      "rhidoxxx: no muestra su mano",
      "Asiento 2: BudyXXIII",
      "Asiento 6: betterrrrrr",
      "Asiento 1: wsx25 (ciega grande) se retiró antes del Flop",
      "Asiento 3: SrLyce se retiró antes del Flop (no apostó)",
      "Asiento 4: rhidoxxx (botón) recaudó (0.05 €)",
      "Asiento 5: jte-ken (ciega pequeña) se retiró antes del Flop"
    ],
    "flop": [],
    "turn": [],
    "river": []
  },
  "board": [],
  "winner": "rhidoxxx",
  "win_amount": 2.5,
  "sb": 0.01,
  "bb": 0.02,
  "rake": 0.0,
  "raw_text": "Mano n.º 257215344996 de PokerStars:  Hold'em No Limit (0.01 €/0.02 € EUR) - 04-08-2025 22:39:32 CET [04-08-2025 16:39:32 ET]\nMesa \"Aldhafera II\" 6-max El asiento n.º 4 es el botón\nAsiento 2: BudyXXIII (5.85 € en fichas) está ausente\nAsiento 6: betterrrrrr (3.43 € en fichas) está ausente\nAsiento 1: wsx25 (1.83 € en fichas) \nAsiento 3: SrLyce (3.52 € en fichas) \nAsiento 4: rhidoxxx (2.09 € en fichas) \nAsiento 5: jte-ken (2.45 € en fichas) \njte-ken: pone la ciega pequeña 0.01 €\nwsx25: pone la ciega grande 0.02 €\n*** CARTAS DE MANO ***\nRepartidas a SrLyce [Kd 8s]\nSrLyce: se retira \nrhidoxxx: sube 0.02 € a 0.04 €\njte-ken: se retira \nwsx25: se retira \nLa apuesta no igualada (0.02 €) ha sido devuelta a rhidoxxx\nrhidoxxx se lleva 0.05 € del bote \nrhidoxxx: no muestra su mano \n*** RESUMEN ***\nBote total 0.05 € | Comisión 0 € \nAsiento 2: BudyXXIII\nAsiento 6: betterrrrrr\nAsiento 1: wsx25 (ciega grande) se retiró antes del Flop\nAsiento 3: SrLyce se retiró antes del Flop (no apostó)\nAsiento 4: rhidoxxx (botón) recaudó (0.05 €)\nAsiento 5: jte-ken (ciega pequeña) se retiró antes del Flop"
}