{
  "hand_id": "257215140664",
  "date": "04-08-2025 22:26:54",
  "table": "Aldhafera II",
  "game_type": "holdem",
  "hero": "SrLyce",
  "hero_position": "",
  "hero_cards": [
    "2s",
    "9s"
  ],
  "stacks": {
    "wsx25": 93.5,
    "BudyXXIII": 294.5,
    "SrLyce": 97.0,
    "rhidoxxx": 66.5,
    "jte-ken": 114.5,
    "betterrrrrr": 166.5
  },
  "actions": {
    "preflop": [
      "Asiento 1: wsx25 (1.87 € en fichas)",
      "Asiento 2: BudyXXIII (5.89 € en fichas)",
      "Asiento 3: SrLyce (1.94 € en fichas)",
      "Asiento 4: rhidoxxx (1.33 € en fichas)",
      "Asiento 5: jte-ken (2.29 € en fichas)",
      "Asiento 6: betterrrrrr (3.33 € en fichas)",
      "BudyXXIII: pone la ciega pequeña 0.01 €",
      "SrLyce: pone la ciega grande 0.02 €",
      "rhidoxxx: se retira",
      "jte-ken: sube 0.04 € a 0.06 €",
      "betterrrrrr: se retira",
      "wsx25: se retira",
      "BudyXXIII: se retira",
      "SrLyce: se retira",
      "Asiento 1: wsx25 (botón) se retiró antes del Flop (no apostó)",
      "Asiento 2: BudyXXIII (ciega pequeña) se retiró antes del Flop",
      "Asiento 3: SrLyce (ciega grande) se retiró antes del Flop",
      "Asiento 4: rhidoxxx se retiró antes del Flop (no apostó)",
      "Asiento 5: jte-ken recaudó (0.05 €)",
      "Asiento 6: betterrrrrr se retiró antes del Flop (no apostó)"
    ],
    "flop": [],
    "turn": [],
    "river": []
  },
  "board": [],
  "winner": "jte-ken",
  "win_amount": 2.5,
  "sb": 0.01,
  "bb": 0.02,
  "rake": 0.0,
  "raw_text": "Mano n.º 257215140664 de PokerStars:  Hold'em No Limit (0.01 €/0.02 € EUR) - 04-08-2025 22:26:54 CET [04-08-2025 16:26:54 ET]\nMesa \"Aldhafera II\" 6-max El asiento n.º 1 es el botón\nAsiento 1: wsx25 (1.87 € en fichas) \nAsiento 2: BudyXXIII (5.89 € en fichas) \nAsiento 3: SrLyce (1.94 € en fichas) \nAsiento 4: rhidoxxx (1.33 € en fichas) \nAsiento 5: jte-ken (2.29 € en fichas) \nAsiento 6: betterrrrrr (3.33 € en fichas) \nBudyXXIII: pone la ciega pequeña 0.01 €\nSrLyce: pone la ciega grande 0.02 €\n*** CARTAS DE MANO ***\nRepartidas a SrLyce [2s 9s]\nrhidoxxx: se retira \njte-ken: sube 0.04 € a 0.06 €\nbetterrrrrr: se retira \nwsx25: se retira \nBudyXXIII: se retira \nSrLyce: se retira \nLa apuesta no igualada (0.04 €) ha sido devuelta a jte-ken\njte-ken se lleva 0.05 € del bote \n*** RESUMEN ***\nBote total 0.05 € | Comisión 0 € \nAsiento 1: wsx25 (botón) se retiró antes del Flop (no apostó)\nAsiento 2: BudyXXIII (ciega pequeña) se retiró antes del Flop\nAsiento 3: SrLyce (ciega grande) se retiró antes del Flop\nAsiento 4: rhidoxxx se retiró antes del Flop (no apostó)\nAsiento 5: jte-ken recaudó (0.05 €)\nAsiento 6: betterrrrrr se retiró antes del Flop (no apostó)"
}