{
  "hand_id": "257238760082",
  "date": "06-08-2025 19:26:45",
  "table": "Leonteus",
  "game_type": "holdem",
  "hero": "SrLyce",
  "hero_position": "",
  "hero_cards": [
    "6c",
    "9h"
  ],
  "stacks": {
    "Andark47": 207.5,
    "practikal_C23": 51.0,
    "niyomalo": 98.5,
    "davinci1962": 151.0,
    "BuXHexter": 163.0,
    "SrLyce": 74.5
  },
  "actions": {
    "preflop": [
      "Asiento 5: Andark47 (4.15 € en fichas) está ausente",
      "Asiento 1: practikal_C23 (1.02 € en fichas)",
      "Asiento 2: niyomalo (1.97 € en fichas)",
      "Asiento 3: davinci1962 (3.02 € en fichas)",
      "Asiento 4: BuXHexter (3.26 € en fichas)",
      "Asiento 6: SrLyce (1.49 € en fichas)",
      "practikal_C23: pone la ciega pequeña 0.01 €",
      "niyomalo: pone la ciega grande 0.02 €",
      "Andark47: se ausenta",
      "davinci1962: se retira",
      "BuXHexter: se retira",
      "SrLyce: se retira",
      "practikal_C23: se retira",
      "niyomalo: no muestra su mano",
      "Asiento 5: Andark47",
      "Asiento 1: practikal_C23 (ciega pequeña) se retiró antes del Flop",
      "Asiento 2: niyomalo (ciega grande) recaudó (0.02 €)",
      "Asiento 3: davinci1962 se retiró antes del Flop (no apostó)",
      "Asiento 4: BuXHexter se retiró antes del Flop (no apostó)",
      "Asiento 6: SrLyce (botón) se retiró antes del Flop (no apostó)"
    ],
    "flop": [],
    "turn": [],
    "river": []
  },
  "board": [],
  "winner": "niyomalo",
  "win_amount": 1.0,
  "sb": 0.01,
  "bb": 0.02,
  "rake": 0.0,
  "raw_text": "Mano n.º 257238760082 de PokerStars:  Hold'em No Limit (0.01 €/0.02 € EUR) - 06-08-2025 19:26:45 CET [06-08-2025 13:26:45 ET]\nMesa \"Leonteus\" 6-max El asiento n.º 6 es el botón\nAsiento 5: Andark47 (4.15 € en fichas) está ausente\nAsiento 1: practikal_C23 (1.02 € en fichas) \nAsiento 2: niyomalo (1.97 € en fichas) \nAsiento 3: davinci1962 (3.02 € en fichas) \nAsiento 4: BuXHexter (3.26 € en fichas) \nAsiento 6: SrLyce (1.49 € en fichas) \npractikal_C23: pone la ciega pequeña 0.01 €\nniyomalo: pone la ciega grande 0.02 €\nAndark47: se ausenta \n*** CARTAS DE MANO ***\nRepartidas a SrLyce [6c 9h]\ndavinci1962: se retira \nBuXHexter: se retira \nSrLyce: se retira \npractikal_C23: se retira \nLa apuesta no igualada (0.01 €) ha sido devuelta a niyomalo\nniyomalo se lleva 0.02 € del bote \nniyomalo: no muestra su mano \n*** RESUMEN ***\nBote total 0.02 € | Comisión 0 € \nAsiento 5: Andark47\nAsiento 1: practikal_C23 (ciega pequeña) se retiró antes del Flop\nAsiento 2: niyomalo (ciega grande) recaudó (0.02 €)\nAsiento 3: davinci1962 se retiró antes del Flop (no apostó)\nAsiento 4: BuXHexter se retiró antes del Flop (no apostó)\nAsiento 6: SrLyce (botón) se retiró antes del Flop (no apostó)"
}