{
  "hand_id": "257168243558",
  "date": "01-08-2025 11:11:27",
  "table": "Sekanina",
  "game_type": "holdem",
  "hero": "SrLyce",
  "hero_position": "",
  "hero_cards": [
    "Qd",
    "2h"
  ],
  "stacks": {
    "DagonBZH56": 80.0,
    "practikal_C23": 100.0,
    "Alvii37": 104.0,
    "SrLyce": 164.5,
    "davinci1962": 105.5,
    "Elministrelas": 96.0
  },
  "actions": {
    "preflop": [
      "Asiento 1: DagonBZH56 (1.60 € en fichas) está ausente",
      "Asiento 2: practikal_C23 (2 € en fichas)",
      "Asiento 3: Alvii37 (2.08 € en fichas)",
      "Asiento 4: SrLyce (3.29 € en fichas)",
      "Asiento 5: davinci1962 (2.11 € en fichas)",
      "Asiento 6: Elministrelas (1.92 € en fichas)",
      "davinci1962: pone la ciega pequeña 0.01 €",
      "Elministrelas: pone la ciega grande 0.02 €",
      "DagonBZH56: se ausenta",
      "practikal_C23: iguala 0.02 €",
      "Alvii37: se retira",
      "SrLyce: se retira",
      "davinci1962: se retira",
      "Elministrelas: pasa"
    ],
    "flop": [
      "Elministrelas: pasa",
      "practikal_C23: apuesta 0.02 €",
      "Elministrelas: iguala 0.02 €"
    ],
    "turn": [
      "Elministrelas: pasa",
      "practikal_C23: pasa"
    ],
    "river": [
      "Elministrelas: apuesta 0.04 €",
      "practikal_C23: se retira",
      "Asiento 1: DagonBZH56",
      "Asiento 2: practikal_C23 se retiró en el River",
      "Asiento 3: Alvii37 se retiró antes del Flop (no apostó)",
      "Asiento 4: SrLyce (botón) se retiró antes del Flop (no apostó)",
      "Asiento 5: davinci1962 (ciega pequeña) se retiró antes del Flop",
      "Asiento 6: Elministrelas (ciega grande) recaudó (0.08 €)"
    ]
  },
  "board": [
    "6h",
    "2c",
    "2s",
    "9s",
    "3d"
  ],
  "winner": "Elministrelas",
  "win_amount": 4.0,
  "sb": 0.01,
  "bb": 0.02,
  "rake": 0.5,
  "raw_text": "Mano n.º 257168243558 de PokerStars:  Hold'em No Limit (0.01 €/0.02 € EUR) - 01-08-2025 11:11:27 CET [01-08-2025 5:11:27 ET]\nMesa \"Sekanina\" 6-max El asiento n.º 4 es el botón\nAsiento 1: DagonBZH56 (1.60 € en fichas) está ausente\nAsiento 2: practikal_C23 (2 € en fichas) \nAsiento 3: Alvii37 (2.08 € en fichas) \nAsiento 4: SrLyce (3.29 € en fichas) \nAsiento 5: davinci1962 (2.11 € en fichas) \nAsiento 6: Elministrelas (1.92 € en fichas) \ndavinci1962: pone la ciega pequeña 0.01 €\nElministrelas: pone la ciega grande 0.02 €\nDagonBZH56: se ausenta \n*** CARTAS DE MANO ***\nRepartidas a SrLyce [Qd 2h]\npractikal_C23: iguala 0.02 €\nAlvii37: se retira \nSrLyce: se retira \ndavinci1962: se retira \nElministrelas: pasa \n*** FLOP *** [6h 2c 2s]\nElministrelas: pasa \npractikal_C23: apuesta 0.02 €\nElministrelas: iguala 0.02 €\n*** TURN *** [6h 2c 2s] [9s]\nElministrelas: pasa \npractikal_C23: pasa \n*** RIVER *** [6h 2c 2s 9s] [3d]\nElministrelas: apuesta 0.04 €\npractikal_C23: se retira \nLa apuesta no igualada (0.04 €) ha sido devuelta a Elministrelas\nElministrelas se lleva 0.08 € del bote \n*** RESUMEN ***\nBote total 0.09 € | Comisión 0.01 € \nComunitarias [6h 2c 2s 9s 3d]\nAsiento 1: DagonBZH56\nAsiento 2: practikal_C23 se retiró en el River\nAsiento 3: Alvii37 se retiró antes del Flop (no apostó)\nAsiento 4: SrLyce (botón) se retiró antes del Flop (no apostó)\nAsiento 5: davinci1962 (ciega pequeña) se retiró antes del Flop\nAsiento 6: Elministrelas (ciega grande) recaudó (0.08 €)"
}