{
  "hand_id": "257149215103",
  "date": "30-07-2025 22:16:08",
  "table": "Esclangona",
  "game_type": "holdem",
  "hero": "SrLyce",
  "hero_position": "",
  "hero_cards": [
    "5s",
    "5c"
  ],
  "stacks": {
    "ansiedadd": 39.0,
    "SrLyce": 91.0,
    "NoahBolete": 130.5,
    "Davdgoni": 236.0,
    "DiaZzZ1": 98.5,
    "elketefaka1": 88.5
  },
  "actions": {
    "preflop": [
      "Asiento 1: ansiedadd (0.78 € en fichas)",
      "Asiento 2: SrLyce (1.82 € en fichas)",
      "Asiento 3: NoahBolete (2.61 € en fichas)",
      "Asiento 4: Davdgoni (4.72 € en fichas)",
      "Asiento 5: DiaZzZ1 (1.97 € en fichas)",
      "Asiento 6: elketefaka1 (1.77 € en fichas)",
      "ansiedadd: pone la ciega pequeña 0.01 €",
      "SrLyce: pone la ciega grande 0.02 €",
      "NoahBolete: se retira",
      "Davdgoni: se retira",
      "DiaZzZ1: sube 0.02 € a 0.04 €",
      "elketefaka1: se retira",
      "ansiedadd: iguala 0.03 €",
      "SrLyce: iguala 0.02 €"
    ],
    "flop": [
      "ansiedadd: apuesta 0.04 €",
      "SrLyce: iguala 0.04 €",
      "DiaZzZ1: se retira"
    ],
    "turn": [
      "ansiedadd: apuesta 0.12 €",
      "SrLyce: se retira",
      "ansiedadd: no muestra su mano",
      "Asiento 1: ansiedadd (ciega pequeña) recaudó (0.19 €)",
      "Asiento 2: SrLyce (ciega grande) se retiró en el Turn",
      "Asiento 3: NoahBolete se retiró antes del Flop (no apostó)",
      "Asiento 4: Davdgoni se retiró antes del Flop (no apostó)",
      "Asiento 5: DiaZzZ1 se retiró en el Flop",
      "Asiento 6: elketefaka1 (botón) se retiró antes del Flop (no apostó)"
    ],
    "river": []
  },
  "board": [
    "Td",
    "9d",
    "2h",
    "6d"
  ],
  "winner": "ansiedadd",
  "win_amount": 9.5,
  "sb": 0.01,
  "bb": 0.02,
  "rake": 0.5,
  "raw_text": "Mano n.º 257149215103 de PokerStars:  Hold'em No Limit (0.01 €/0.02 € EUR) - 30-07-2025 22:16:08 CET [30-07-2025 16:16:08 ET]\nMesa \"Esclangona\" 6-max El asiento n.º 6 es el botón\nAsiento 1: ansiedadd (0.78 € en fichas) \nAsiento 2: SrLyce (1.82 € en fichas) \nAsiento 3: NoahBolete (2.61 € en fichas) \nAsiento 4: Davdgoni (4.72 € en fichas) \nAsiento 5: DiaZzZ1 (1.97 € en fichas) \nAsiento 6: elketefaka1 (1.77 € en fichas) \nansiedadd: pone la ciega pequeña 0.01 €\nSrLyce: pone la ciega grande 0.02 €\n*** CARTAS DE MANO ***\nRepartidas a SrLyce [5s 5c]\nNoahBolete: se retira \nDavdgoni: se retira \nDiaZzZ1: sube 0.02 € a 0.04 €\nelketefaka1: se retira \nansiedadd: iguala 0.03 €\nSrLyce: iguala 0.02 €\n*** FLOP *** [Td 9d 2h]\nansiedadd: apuesta 0.04 €\nSrLyce: iguala 0.04 €\nDiaZzZ1: se retira \n*** TURN *** [Td 9d 2h] [6d]\nansiedadd: apuesta 0.12 €\nSrLyce: se retira \nLa apuesta no igualada (0.12 €) ha sido devuelta a ansiedadd\nansiedadd se lleva 0.19 € del bote \nansiedadd: no muestra su mano \n*** RESUMEN ***\nBote total 0.20 € | Comisión 0.01 € \nComunitarias [Td 9d 2h 6d]\nAsiento 1: ansiedadd (ciega pequeña) recaudó (0.19 €)\nAsiento 2: SrLyce (ciega grande) se retiró en el Turn\nAsiento 3: NoahBolete se retiró antes del Flop (no apostó)\nAsiento 4: Davdgoni se retiró antes del Flop (no apostó)\nAsiento 5: DiaZzZ1 se retiró en el Flop\nAsiento 6: elketefaka1 (botón) se retiró antes del Flop (no apostó)"
}