{
  "hand_id": "257149255797",
  "date": "30-07-2025 22:19:00",
  "table": "Esclangona",
  "game_type": "holdem",
  "hero": "SrLyce",
  "hero_position": "",
  "hero_cards": [
    "3s",
    "9c"
  ],
  "stacks": {
    "ansiedadd": 41.0,
    "SrLyce": 196.0,
    "NoahBolete": 123.0,
    "DiaZzZ1": 96.5,
    "elketefaka1": 1.5
  },
  "actions": {
    "preflop": [
      "Asiento 1: ansiedadd (0.82 € en fichas)",
      "Asiento 2: SrLyce (3.92 € en fichas)",
      "Asiento 3: NoahBolete (2.46 € en fichas)",
      "Asiento 5: DiaZzZ1 (1.93 € en fichas)",
      "Asiento 6: elketefaka1 (0.03 € en fichas)",
      "NoahBolete: pone la ciega pequeña 0.01 €",
      "DiaZzZ1: pone la ciega grande 0.02 €",
      "elketefaka1: sube 0.01 € a 0.03 € y está all-in",
      "ansiedadd: sube 0.08 € a 0.11 €",
      "SrLyce: se retira",
      "NoahBolete: iguala 0.10 €",
      "DiaZzZ1: se retira"
    ],
    "flop": [
      "NoahBolete: pasa",
      "ansiedadd: apuesta 0.08 €",
      "NoahBolete: se retira"
    ],
    "turn": [],
    "river": [
      "ansiedadd: muestra [Ad 8s] (pareja de damas)",
      "elketefaka1: muestra [Kh 6h] (doble pareja, damas y seises)",
      "Asiento 1: ansiedadd muestra [Ad 8s] y ganó (0.15 €) con pareja de damas",
      "Asiento 2: SrLyce (botón) se retiró antes del Flop (no apostó)",
      "Asiento 3: NoahBolete (ciega pequeña) se retiró en el Flop",
      "Asiento 5: DiaZzZ1 (ciega grande) se retiró antes del Flop",
      "Asiento 6: elketefaka1 muestra [Kh 6h] y ganó (0.10 €) con doble pareja, damas y seises"
    ]
  },
  "board": [
    "9s",
    "2h",
    "6s",
    "Qh",
    "Qs"
  ],
  "winner": "ansiedadd",
  "win_amount": 7.5,
  "sb": 0.01,
  "bb": 0.02,
  "rake": 1.0,
  "raw_text": "Mano n.º 257149255797 de PokerStars:  Hold'em No Limit (0.01 €/0.02 € EUR) - 30-07-2025 22:19:00 CET [30-07-2025 16:19:00 ET]\nMesa \"Esclangona\" 6-max El asiento n.º 2 es el botón\nAsiento 1: ansiedadd (0.82 € en fichas) \nAsiento 2: SrLyce (3.92 € en fichas) \nAsiento 3: NoahBolete (2.46 € en fichas) \nAsiento 5: DiaZzZ1 (1.93 € en fichas) \nAsiento 6: elketefaka1 (0.03 € en fichas) \nNoahBolete: pone la ciega pequeña 0.01 €\nDiaZzZ1: pone la ciega grande 0.02 €\n*** CARTAS DE MANO ***\nRepartidas a SrLyce [3s 9c]\nBPEPMLP se une a la mesa en el asiento n.º 4 \nelketefaka1: sube 0.01 € a 0.03 € y está all-in\nansiedadd: sube 0.08 € a 0.11 €\nSrLyce: se retira \nNoahBolete: iguala 0.10 €\nDiaZzZ1: se retira \n*** FLOP *** [9s 2h 6s]\nNoahBolete: pasa \nansiedadd: apuesta 0.08 €\nNoahBolete: se retira \nLa apuesta no igualada (0.08 €) ha sido devuelta a ansiedadd\n*** TURN *** [9s 2h 6s] [Qh]\n*** RIVER *** [9s 2h 6s Qh] [Qs]\n*** SHOW DOWN ***\nansiedadd: muestra [Ad 8s] (pareja de damas)\nansiedadd se lleva 0.15 € del bote  secundario\nelketefaka1: muestra [Kh 6h] (doble pareja, damas y seises)\nelketefaka1 se lleva 0.10 € del bote  principal\n*** RESUMEN ***\nBote total 0.27 € Bote principal 0.10 €. Bote secundario 0.15 €. | Comisión 0.02 € \nComunitarias [9s 2h 6s Qh Qs]\nAsiento 1: ansiedadd muestra [Ad 8s] y ganó (0.15 €) con pareja de damas\nAsiento 2: SrLyce (botón) se retiró antes del Flop (no apostó)\nAsiento 3: NoahBolete (ciega pequeña) se retiró en el Flop\nAsiento 5: DiaZzZ1 (ciega grande) se retiró antes del Flop\nAsiento 6: elketefaka1 muestra [Kh 6h] y ganó (0.10 €) con doble pareja, damas y seises"
}