{
  "hand_id": "257149040224",
  "date": "30-07-2025 22:03:47",
  "table": "Esclangona",
  "game_type": "holdem",
  "hero": "SrLyce",
  "hero_position": "",
  "hero_cards": [
    "6c",
    "Kh"
  ],
  "stacks": {
    "Zorgue1080": 71.0,
    "SrLyce": 186.5,
    "NoahBolete": 99.5,
    "Davdgoni": 102.5,
    "DiaZzZ1": 94.5,
    "berlcht403": 34.5
  },
  "actions": {
    "preflop": [
      "Asiento 1: Zorgue1080 (1.42 € en fichas)",
      "Asiento 2: SrLyce (3.73 € en fichas)",
      "Asiento 3: NoahBolete (1.99 € en fichas)",
      "Asiento 4: Davdgoni (2.05 € en fichas)",
      "Asiento 5: DiaZzZ1 (1.89 € en fichas)",
      "Asiento 6: berlcht403 (0.69 € en fichas)",
      "berlcht403: pone la ciega pequeña 0.01 €",
      "Zorgue1080: pone la ciega grande 0.02 €",
      "SrLyce: se retira",
      "NoahBolete: se retira",
      "Davdgoni: se retira",
      "DiaZzZ1: se retira",
      "berlcht403: iguala 0.01 €",
      "Zorgue1080: pasa"
    ],
    "flop": [
      "berlcht403: apuesta 0.04 €",
      "Zorgue1080: se retira",
      "Asiento 1: Zorgue1080 (ciega grande) se retiró en el Flop",
      "Asiento 2: SrLyce se retiró antes del Flop (no apostó)",
      "Asiento 3: NoahBolete se retiró antes del Flop (no apostó)",
      "Asiento 4: Davdgoni se retiró antes del Flop (no apostó)",
      "Asiento 5: DiaZzZ1 (botón) se retiró antes del Flop (no apostó)",
      "Asiento 6: berlcht403 (ciega pequeña) recaudó (0.04 €)"
    ],
    "turn": [],
    "river": []
  },
  "board": [
    "4d",
    "Ts",
    "3d"
  ],
  "winner": "berlcht403",
  "win_amount": 2.0,
  "sb": 0.01,
  "bb": 0.02,
  "rake": 0.0,
  "raw_text": "Mano n.º 257149040224 de PokerStars:  Hold'em No Limit (0.01 €/0.02 € EUR) - 30-07-2025 22:03:47 CET [30-07-2025 16:03:47 ET]\nMesa \"Esclangona\" 6-max El asiento n.º 5 es el botón\nAsiento 1: Zorgue1080 (1.42 € en fichas) \nAsiento 2: SrLyce (3.73 € en fichas) \nAsiento 3: NoahBolete (1.99 € en fichas) \nAsiento 4: Davdgoni (2.05 € en fichas) \nAsiento 5: DiaZzZ1 (1.89 € en fichas) \nAsiento 6: berlcht403 (0.69 € en fichas) \nberlcht403: pone la ciega pequeña 0.01 €\nZorgue1080: pone la ciega grande 0.02 €\n*** CARTAS DE MANO ***\nRepartidas a SrLyce [6c Kh]\nSrLyce: se retira \nNoahBolete: se retira \nDavdgoni: se retira \nDiaZzZ1: se retira \nberlcht403: iguala 0.01 €\nZorgue1080: pasa \n*** FLOP *** [4d Ts 3d]\nberlcht403: apuesta 0.04 €\nZorgue1080: se retira \nLa apuesta no igualada (0.04 €) ha sido devuelta a berlcht403\nberlcht403 se lleva 0.04 € del bote \n*** RESUMEN ***\nBote total 0.04 € | Comisión 0 € \nComunitarias [4d Ts 3d]\nAsiento 1: Zorgue1080 (ciega grande) se retiró en el Flop\nAsiento 2: SrLyce se retiró antes del Flop (no apostó)\nAsiento 3: NoahBolete se retiró antes del Flop (no apostó)\nAsiento 4: Davdgoni se retiró antes del Flop (no apostó)\nAsiento 5: DiaZzZ1 (botón) se retiró antes del Flop (no apostó)\nAsiento 6: berlcht403 (ciega pequeña) recaudó (0.04 €)"
}