{
  "hand_id": "257238437602",
  "date": "06-08-2025 18:58:48",
  "table": "Adelaide III",
  "game_type": "holdem",
  "hero": "SrLyce",
  "hero_position": "",
  "hero_cards": [
    "4d",
    "7c"
  ],
  "stacks": {
    "N3xtTIm35": 124.5,
    "aliendee07": 57.0,
    "Macklemore0": 100.0,
    "SrLyce": 106.5,
    "ismagonzalez7": 58.5,
    "pauquair5": 62.0
  },
  "actions": {
    "preflop": [
      "Asiento 1: N3xtTIm35 (2.49 € en fichas)",
      "Asiento 2: aliendee07 (1.14 € en fichas)",
      "Asiento 3: Macklemore0 (2 € en fichas)",
      "Asiento 4: SrLyce (2.13 € en fichas)",
      "Asiento 5: ismagonzalez7 (1.17 € en fichas)",
      "Asiento 6: pauquair5 (1.24 € en fichas)",
      "Macklemore0: pone la ciega pequeña 0.01 €",
      "SrLyce: pone la ciega grande 0.02 €",
      "ismagonzalez7: se retira",
      "pauquair5: se retira",
      "N3xtTIm35: se retira",
      "aliendee07: sube 0.02 € a 0.04 €",
      "Macklemore0: se retira",
      "SrLyce: iguala 0.02 €"
    ],
    "flop": [
      "SrLyce: pasa",
      "aliendee07: pasa"
    ],
    "turn": [
      "SrLyce: pasa",
      "aliendee07: apuesta 0.04 €",
      "SrLyce: iguala 0.04 €"
    ],
    "river": [
      "SrLyce: pasa",
      "aliendee07: apuesta 0.08 €",
      "SrLyce: iguala 0.08 €",
      "aliendee07: muestra [Ad Jd] (trío de jotas)",
      "SrLyce: descarta su mano sin mostrar",
      "Asiento 1: N3xtTIm35 se retiró antes del Flop (no apostó)",
      "Asiento 2: aliendee07 (botón) muestra [Ad Jd] y ganó (0.31 €) con trío de jotas",
      "Asiento 3: Macklemore0 (ciega pequeña) se retiró antes del Flop",
      "Asiento 4: SrLyce (ciega grande) descartó sin mostrar [4d 7c]",
      "Asiento 5: ismagonzalez7 se retiró antes del Flop (no apostó)",
      "Asiento 6: pauquair5 se retiró antes del Flop (no apostó)"
    ]
  },
  "board": [
    "Js",
    "Tc",
    "7d",
    "Jc",
    "Qc"
  ],
  "winner": "aliendee07",
  "win_amount": 15.5,
  "sb": 0.01,
  "bb": 0.02,
  "rake": 1.0,
  "raw_text": "Mano n.º 257238437602 de PokerStars:  Hold'em No Limit (0.01 €/0.02 € EUR) - 06-08-2025 18:58:48 CET [06-08-2025 12:58:48 ET]\nMesa \"Adelaide III\" 6-max El asiento n.º 2 es el botón\nAsiento 1: N3xtTIm35 (2.49 € en fichas) \nAsiento 2: aliendee07 (1.14 € en fichas) \nAsiento 3: Macklemore0 (2 € en fichas) \nAsiento 4: SrLyce (2.13 € en fichas) \nAsiento 5: ismagonzalez7 (1.17 € en fichas) \nAsiento 6: pauquair5 (1.24 € en fichas) \nMacklemore0: pone la ciega pequeña 0.01 €\nSrLyce: pone la ciega grande 0.02 €\n*** CARTAS DE MANO ***\nRepartidas a SrLyce [4d 7c]\nismagonzalez7: se retira \npauquair5: se retira \nN3xtTIm35: se retira \naliendee07: sube 0.02 € a 0.04 €\nMacklemore0: se retira \nSrLyce: iguala 0.02 €\n*** FLOP *** [Js Tc 7d]\nSrLyce: pasa \naliendee07: pasa \n*** TURN *** [Js Tc 7d] [Jc]\nSrLyce: pasa \naliendee07: apuesta 0.04 €\nSrLyce: iguala 0.04 €\n*** RIVER *** [Js Tc 7d Jc] [Qc]\nSrLyce: pasa \naliendee07: apuesta 0.08 €\nSrLyce: iguala 0.08 €\n*** SHOW DOWN ***\naliendee07: muestra [Ad Jd] (trío de jotas)\nSrLyce: descarta su mano sin mostrar \naliendee07 se lleva 0.31 € del bote \n*** RESUMEN ***\nBote total 0.33 € | Comisión 0.02 € \nComunitarias [Js Tc 7d Jc Qc]\nAsiento 1: N3xtTIm35 se retiró antes del Flop (no apostó)\nAsiento 2: aliendee07 (botón) muestra [Ad Jd] y ganó (0.31 €) con trío de jotas\nAsiento 3: Macklemore0 (ciega pequeña) se retiró antes del Flop\nAsiento 4: SrLyce (ciega grande) descartó sin mostrar [4d 7c]\nAsiento 5: ismagonzalez7 se retiró antes del Flop (no apostó)\nAsiento 6: pauquair5 se retiró antes del Flop (no apostó)"
}