{
  "hand_id": "257150168254",
  "date": "30-07-2025 23:23:01",
  "table": "Gilgamesh",
  "game_type": "holdem",
  "hero": "SrLyce",
  "hero_position": "",
  "hero_cards": [
    "Ad",
    "9h"
  ],
  "stacks": {
    "riverrrrrrmagic": 121.5,
    "SrLyce": 97.5,
    "Jumby34": 100.0,
    "xapkk": 100.0,
    "samaritano34": 92.0,
    "Fretzo67500": 127.0
  },
  "actions": {
    "preflop": [
      "Asiento 1: riverrrrrrmagic (2.43 € en fichas)",
      "Asiento 2: SrLyce (1.95 € en fichas)",
      "Asiento 3: Jumby34 (2 € en fichas)",
      "Asiento 4: xapkk (2 € en fichas)",
      "Asiento 5: samaritano34 (1.84 € en fichas)",
      "Asiento 6: Fretzo67500 (2.54 € en fichas)",
      "xapkk: pone la ciega pequeña 0.01 €",
      "samaritano34: pone la ciega grande 0.02 €",
      "Fretzo67500: iguala 0.02 €",
      "riverrrrrrmagic: se retira",
      "SrLyce: sube 0.04 € a 0.06 €",
      "Jumby34: sube 0.04 € a 0.10 €",
      "xapkk: se retira",
      "samaritano34: se retira",
      "Fretzo67500: se retira",
      "SrLyce: iguala 0.04 €"
    ],
    "flop": [
      "SrLyce: pasa",
      "Jumby34: apuesta 0.20 €",
      "SrLyce: iguala 0.20 €"
    ],
    "turn": [
      "SrLyce: pasa",
      "Jumby34: pasa"
    ],
    "river": [
      "SrLyce: apuesta 0.31 €",
      "Jumby34: se retira",
      "SrLyce: no muestra su mano",
      "Asiento 1: riverrrrrrmagic se retiró antes del Flop (no apostó)",
      "Asiento 2: SrLyce recaudó (0.61 €)",
      "Asiento 3: Jumby34 (botón) se retiró en el River",
      "Asiento 4: xapkk (ciega pequeña) se retiró antes del Flop",
      "Asiento 5: samaritano34 (ciega grande) se retiró antes del Flop",
      "Asiento 6: Fretzo67500 se retiró antes del Flop"
    ]
  },
  "board": [
    "6h",
    "Ah",
    "4h",
    "2h",
    "5s"
  ],
  "winner": "SrLyce",
  "win_amount": 30.5,
  "sb": 0.01,
  "bb": 0.02,
  "rake": 2.0,
  "raw_text": "Mano n.º 257150168254 de PokerStars:  Hold'em No Limit (0.01 €/0.02 € EUR) - 30-07-2025 23:23:01 CET [30-07-2025 17:23:01 ET]\nMesa \"Gilgamesh\" 6-max El asiento n.º 3 es el botón\nAsiento 1: riverrrrrrmagic (2.43 € en fichas) \nAsiento 2: SrLyce (1.95 € en fichas) \nAsiento 3: Jumby34 (2 € en fichas) \nAsiento 4: xapkk (2 € en fichas) \nAsiento 5: samaritano34 (1.84 € en fichas) \nAsiento 6: Fretzo67500 (2.54 € en fichas) \nxapkk: pone la ciega pequeña 0.01 €\nsamaritano34: pone la ciega grande 0.02 €\n*** CARTAS DE MANO ***\nRepartidas a SrLyce [Ad 9h]\nFretzo67500: iguala 0.02 €\nriverrrrrrmagic: se retira \nSrLyce: sube 0.04 € a 0.06 €\nJumby34: sube 0.04 € a 0.10 €\nxapkk: se retira \nsamaritano34: se retira \nFretzo67500: se retira \nSrLyce: iguala 0.04 €\n*** FLOP *** [6h Ah 4h]\nSrLyce: pasa \nJumby34: apuesta 0.20 €\nSrLyce: iguala 0.20 €\n*** TURN *** [6h Ah 4h] [2h]\nSrLyce: pasa \nJumby34: pasa \n*** RIVER *** [6h Ah 4h 2h] [5s]\nSrLyce: apuesta 0.31 €\nJumby34: se retira \nLa apuesta no igualada (0.31 €) ha sido devuelta a SrLyce\nSrLyce se lleva 0.61 € del bote \nSrLyce: no muestra su mano \n*** RESUMEN ***\nBote total 0.65 € | Comisión 0.04 € \nComunitarias [6h Ah 4h 2h 5s]\nAsiento 1: riverrrrrrmagic se retiró antes del Flop (no apostó)\nAsiento 2: SrLyce recaudó (0.61 €)\nAsiento 3: Jumby34 (botón) se retiró en el River\nAsiento 4: xapkk (ciega pequeña) se retiró antes del Flop\nAsiento 5: samaritano34 (ciega grande) se retiró antes del Flop\nAsiento 6: Fretzo67500 se retiró antes del Flop"
}