{
  "hand_id": "257238028528",
  "date": "06-08-2025 18:21:40",
  "table": "Alruccabah II",
  "game_type": "holdem",
  "hero": "SrLyce",
  "hero_position": "",
  "hero_cards": [
    "Jh",
    "3h"
  ],
  "stacks": {
    "SrLyce": 99.0,
    "Davdgoni": 268.0,
    "PerroBestia": 33.5,
    "Nicanor Cast": 37.0,
    "THEBLACK972": 124.0
  },
  "actions": {
    "preflop": [
      "Asiento 1: SrLyce (1.98 € en fichas)",
      "Asiento 2: Davdgoni (5.36 € en fichas)",
      "Asiento 3: PerroBestia (0.67 € en fichas)",
      "Asiento 4: serviettski(fr) (2.06 € en fichas)",
      "Asiento 5: Nicanor Cast (0.74 € en fichas)",
      "Asiento 6: THEBLACK972 (2.48 € en fichas)",
      "SrLyce: pone la ciega pequeña 0.01 €",
      "Davdgoni: pone la ciega grande 0.02 €",
      "PerroBestia: sube 0.03 € a 0.05 €",
      "serviettski(fr): se retira",
      "Nicanor Cast: se retira",
      "THEBLACK972: se retira",
      "SrLyce: iguala 0.04 €",
      "Davdgoni: se retira"
    ],
    "flop": [
      "SrLyce: pasa",
      "PerroBestia: pasa"
    ],
    "turn": [
      "SrLyce: apuesta 0.04 €",
      "PerroBestia: se retira",
      "SrLyce: no muestra su mano",
      "Asiento 1: SrLyce (ciega pequeña) recaudó (0.11 €)",
      "Asiento 2: Davdgoni (ciega grande) se retiró antes del Flop",
      "Asiento 3: PerroBestia se retiró en el Turn",
      "Asiento 4: serviettski(fr) se retiró antes del Flop (no apostó)",
      "Asiento 5: Nicanor Cast se retiró antes del Flop (no apostó)",
      "Asiento 6: THEBLACK972 (botón) se retiró antes del Flop (no apostó)"
    ],
    "river": []
  },
  "board": [
    "4h",
    "8h",
    "2d",
    "8s"
  ],
  "winner": "SrLyce",
  "win_amount": 5.5,
  "sb": 0.01,
  "bb": 0.02,
  "rake": 0.5,
  "raw_text": "Mano n.º 257238028528 de PokerStars:  Hold'em No Limit (0.01 €/0.02 € EUR) - 06-08-2025 18:21:40 CET [06-08-2025 12:21:40 ET]\nMesa \"Alruccabah II\" 6-max El asiento n.º 6 es el botón\nAsiento 1: SrLyce (1.98 € en fichas) \nAsiento 2: Davdgoni (5.36 € en fichas) \nAsiento 3: PerroBestia (0.67 € en fichas) \nAsiento 4: serviettski(fr) (2.06 € en fichas) \nAsiento 5: Nicanor Cast (0.74 € en fichas) \nAsiento 6: THEBLACK972 (2.48 € en fichas) \nSrLyce: pone la ciega pequeña 0.01 €\nDavdgoni: pone la ciega grande 0.02 €\n*** CARTAS DE MANO ***\nRepartidas a SrLyce [Jh 3h]\nPerroBestia: sube 0.03 € a 0.05 €\nserviettski(fr): se retira \nNicanor Cast: se retira \nTHEBLACK972: se retira \nSrLyce: iguala 0.04 €\nDavdgoni: se retira \n*** FLOP *** [4h 8h 2d]\nSrLyce: pasa \nPerroBestia: pasa \n*** TURN *** [4h 8h 2d] [8s]\nSrLyce: apuesta 0.04 €\nPerroBestia: se retira \nLa apuesta no igualada (0.04 €) ha sido devuelta a SrLyce\nSrLyce se lleva 0.11 € del bote \nSrLyce: no muestra su mano \n*** RESUMEN ***\nBote total 0.12 € | Comisión 0.01 € \nComunitarias [4h 8h 2d 8s]\nAsiento 1: SrLyce (ciega pequeña) recaudó (0.11 €)\nAsiento 2: Davdgoni (ciega grande) se retiró antes del Flop\nAsiento 3: PerroBestia se retiró en el Turn\nAsiento 4: serviettski(fr) se retiró antes del Flop (no apostó)\nAsiento 5: Nicanor Cast se retiró antes del Flop (no apostó)\nAsiento 6: THEBLACK972 (botón) se retiró antes del Flop (no apostó)"
}