{
  "hand_id": "257237887256",
  "date": "06-08-2025 18:08:53",
  "table": "Nuwa III",
  "game_type": "holdem",
  "hero": "SrLyce",
  "hero_position": "",
  "hero_cards": [
    "9h",
    "4h"
  ],
  "stacks": {
    "davinci1962": 204.5,
    "BuXHexter": 100.0,
    "kcg_rm": 104.5,
    "SrLyce": 100.5,
    "acavada": 107.5
  },
  "actions": {
    "preflop": [
      "Asiento 1: davinci1962 (4.09 € en fichas)",
      "Asiento 2: BuXHexter (2 € en fichas)",
      "Asiento 3: kcg_rm (2.09 € en fichas)",
      "Asiento 4: SrLyce (2.01 € en fichas)",
      "Asiento 6: acavada (2.15 € en fichas)",
      "SrLyce: pone la ciega pequeña 0.01 €",
      "acavada: pone la ciega grande 0.02 €",
      "davinci1962: se retira",
      "BuXHexter: se retira",
      "kcg_rm: se retira",
      "SrLyce: sube 0.02 € a 0.04 €",
      "acavada: se retira",
      "SrLyce: no muestra su mano",
      "Asiento 1: davinci1962 se retiró antes del Flop (no apostó)",
      "Asiento 2: BuXHexter se retiró antes del Flop (no apostó)",
      "Asiento 3: kcg_rm (botón) se retiró antes del Flop (no apostó)",
      "Asiento 4: SrLyce (ciega pequeña) recaudó (0.04 €)",
      "Asiento 6: acavada (ciega grande) se retiró antes del Flop"
    ],
    "flop": [],
    "turn": [],
    "river": []
  },
  "board": [],
  "winner": "SrLyce",
  "win_amount": 2.0,
  "sb": 0.01,
  "bb": 0.02,
  "rake": 0.0,
  "raw_text": "Mano n.º 257237887256 de PokerStars:  Hold'em No Limit (0.01 €/0.02 € EUR) - 06-08-2025 18:08:53 CET [06-08-2025 12:08:53 ET]\nMesa \"Nuwa III\" 6-max El asiento n.º 3 es el botón\nAsiento 1: davinci1962 (4.09 € en fichas) \nAsiento 2: BuXHexter (2 € en fichas) \nAsiento 3: kcg_rm (2.09 € en fichas) \nAsiento 4: SrLyce (2.01 € en fichas) \nAsiento 6: acavada (2.15 € en fichas) \nSrLyce: pone la ciega pequeña 0.01 €\nacavada: pone la ciega grande 0.02 €\n*** CARTAS DE MANO ***\nRepartidas a SrLyce [9h 4h]\ndavinci1962: se retira \nBuXHexter: se retira \nkcg_rm: se retira \ndavinci1962 deja la mesa\nSrLyce: sube 0.02 € a 0.04 €\nacavada: se retira \nLa apuesta no igualada (0.02 €) ha sido devuelta a SrLyce\nSrLyce se lleva 0.04 € del bote \nSrLyce: no muestra su mano \n*** RESUMEN ***\nBote total 0.04 € | Comisión 0 € \nAsiento 1: davinci1962 se retiró antes del Flop (no apostó)\nAsiento 2: BuXHexter se retiró antes del Flop (no apostó)\nAsiento 3: kcg_rm (botón) se retiró antes del Flop (no apostó)\nAsiento 4: SrLyce (ciega pequeña) recaudó (0.04 €)\nAsiento 6: acavada (ciega grande) se retiró antes del Flop"
}