{
  "hand_id": "257149132770",
  "date": "30-07-2025 22:10:19",
  "table": "Sirona",
  "game_type": "holdem",
  "hero": "SrLyce",
  "hero_position": "",
  "hero_cards": [
    "2h",
    "7d"
  ],
  "stacks": {
    "oliverdu70": 186.0,
    "hadhod1976": 40.0,
    "SrLyce": 136.5,
    "christoph363": 214.0,
    "MitchATP65": 102.5
  },
  "actions": {
    "preflop": [
      "Asiento 4: oliverdu70 (3.72 € en fichas) está ausente",
      "Asiento 5: hadhod1976 (0.80 € en fichas) está ausente",
      "Asiento 1: SrLyce (2.73 € en fichas)",
      "Asiento 3: christoph363 (4.28 € en fichas)",
      "Asiento 6: MitchATP65 (2.05 € en fichas)",
      "SrLyce: pone la ciega pequeña 0.01 €",
      "christoph363: pone la ciega grande 0.02 €",
      "MitchATP65: sube 0.04 € a 0.06 €",
      "SrLyce: se retira",
      "christoph363: iguala 0.04 €"
    ],
    "flop": [
      "christoph363: apuesta 0.02 €",
      "MitchATP65: iguala 0.02 €"
    ],
    "turn": [
      "christoph363: apuesta 0.02 €",
      "MitchATP65: iguala 0.02 €"
    ],
    "river": [
      "christoph363: apuesta 0.20 €",
      "MitchATP65: se retira",
      "Asiento 4: oliverdu70",
      "Asiento 5: hadhod1976",
      "Asiento 1: SrLyce (ciega pequeña) se retiró antes del Flop",
      "Asiento 3: christoph363 (ciega grande) recaudó (0.20 €)",
      "Asiento 6: MitchATP65 (botón) se retiró en el River"
    ]
  },
  "board": [
    "6s",
    "Td",
    "4h",
    "7h",
    "Ks"
  ],
  "winner": "christoph363",
  "win_amount": 10.0,
  "sb": 0.01,
  "bb": 0.02,
  "rake": 0.5,
  "raw_text": "Mano n.º 257149132770 de PokerStars:  Hold'em No Limit (0.01 €/0.02 € EUR) - 30-07-2025 22:10:19 CET [30-07-2025 16:10:19 ET]\nMesa \"Sirona\" 6-max El asiento n.º 6 es el botón\nAsiento 4: oliverdu70 (3.72 € en fichas) está ausente\nAsiento 5: hadhod1976 (0.80 € en fichas) está ausente\nAsiento 1: SrLyce (2.73 € en fichas) \nAsiento 3: christoph363 (4.28 € en fichas) \nAsiento 6: MitchATP65 (2.05 € en fichas) \nSrLyce: pone la ciega pequeña 0.01 €\nchristoph363: pone la ciega grande 0.02 €\n*** CARTAS DE MANO ***\nRepartidas a SrLyce [2h 7d]\nMitchATP65: sube 0.04 € a 0.06 €\nSrLyce: se retira \nchristoph363: iguala 0.04 €\n*** FLOP *** [6s Td 4h]\nchristoph363: apuesta 0.02 €\nMitchATP65: iguala 0.02 €\n*** TURN *** [6s Td 4h] [7h]\nchristoph363: apuesta 0.02 €\nMitchATP65: iguala 0.02 €\n*** RIVER *** [6s Td 4h 7h] [Ks]\nchristoph363: apuesta 0.20 €\nMitchATP65: se retira \nLa apuesta no igualada (0.20 €) ha sido devuelta a christoph363\nchristoph363 se lleva 0.20 € del bote \n*** RESUMEN ***\nBote total 0.21 € | Comisión 0.01 € \nComunitarias [6s Td 4h 7h Ks]\nAsiento 4: oliverdu70\nAsiento 5: hadhod1976\nAsiento 1: SrLyce (ciega pequeña) se retiró antes del Flop\nAsiento 3: christoph363 (ciega grande) recaudó (0.20 €)\nAsiento 6: MitchATP65 (botón) se retiró en el River"
}