{
  "hand_id": "257238465967",
  "date": "06-08-2025 19:01:54",
  "table": "Adelaide III",
  "game_type": "holdem",
  "hero": "SrLyce",
  "hero_position": "",
  "hero_cards": [
    "Jd",
    "8h"
  ],
  "stacks": {
    "N3xtTIm35": 123.5,
    "aliendee07": 64.5,
    "Macklemore0": 100.0,
    "SrLyce": 102.0,
    "ismagonzalez7": 51.0,
    "pauquair5": 68.5
  },
  "actions": {
    "preflop": [
      "Asiento 1: N3xtTIm35 (2.47 € en fichas)",
      "Asiento 2: aliendee07 (1.29 € en fichas)",
      "Asiento 3: Macklemore0 (2 € en fichas)",
      "Asiento 4: SrLyce (2.04 € en fichas)",
      "Asiento 5: ismagonzalez7 (1.02 € en fichas)",
      "Asiento 6: pauquair5 (1.37 € en fichas)",
      "N3xtTIm35: pone la ciega pequeña 0.01 €",
      "aliendee07: pone la ciega grande 0.02 €",
      "Macklemore0: se retira",
      "SrLyce: iguala 0.02 €",
      "ismagonzalez7: se retira",
      "pauquair5: iguala 0.02 €",
      "N3xtTIm35: se retira",
      "aliendee07: pasa"
    ],
    "flop": [
      "aliendee07: pasa",
      "SrLyce: pasa",
      "pauquair5: pasa"
    ],
    "turn": [
      "aliendee07: pasa",
      "SrLyce: pasa",
      "pauquair5: apuesta 0.04 €",
      "aliendee07: iguala 0.04 €",
      "SrLyce: se retira"
    ],
    "river": [
      "aliendee07: pasa",
      "pauquair5: pasa",
      "aliendee07: muestra [8s Qh] (color, carta alta as)",
      "pauquair5: descarta su mano sin mostrar",
      "Asiento 1: N3xtTIm35 (ciega pequeña) se retiró antes del Flop",
      "Asiento 2: aliendee07 (ciega grande) muestra [8s Qh] y ganó (0.14 €) con color, carta alta as",
      "Asiento 3: Macklemore0 se retiró antes del Flop (no apostó)",
      "Asiento 4: SrLyce se retiró en el Turn",
      "Asiento 5: ismagonzalez7 se retiró antes del Flop (no apostó)",
      "Asiento 6: pauquair5 (botón) descartó sin mostrar [Kd 4d]"
    ]
  },
  "board": [
    "Ks",
    "5s",
    "Qs",
    "4c",
    "As"
  ],
  "winner": "aliendee07",
  "win_amount": 7.0,
  "sb": 0.01,
  "bb": 0.02,
  "rake": 0.5,
  "raw_text": "Mano n.º 257238465967 de PokerStars:  Hold'em No Limit (0.01 €/0.02 € EUR) - 06-08-2025 19:01:54 CET [06-08-2025 13:01:54 ET]\nMesa \"Adelaide III\" 6-max El asiento n.º 6 es el botón\nAsiento 1: N3xtTIm35 (2.47 € en fichas) \nAsiento 2: aliendee07 (1.29 € en fichas) \nAsiento 3: Macklemore0 (2 € en fichas) \nAsiento 4: SrLyce (2.04 € en fichas) \nAsiento 5: ismagonzalez7 (1.02 € en fichas) \nAsiento 6: pauquair5 (1.37 € en fichas) \nN3xtTIm35: pone la ciega pequeña 0.01 €\naliendee07: pone la ciega grande 0.02 €\n*** CARTAS DE MANO ***\nRepartidas a SrLyce [Jd 8h]\nMacklemore0: se retira \nSrLyce: iguala 0.02 €\nismagonzalez7: se retira \npauquair5: iguala 0.02 €\nN3xtTIm35: se retira \naliendee07: pasa \n*** FLOP *** [Ks 5s Qs]\naliendee07: pasa \nSrLyce: pasa \npauquair5: pasa \n*** TURN *** [Ks 5s Qs] [4c]\naliendee07: pasa \nSrLyce: pasa \npauquair5: apuesta 0.04 €\naliendee07: iguala 0.04 €\nSrLyce: se retira \n*** RIVER *** [Ks 5s Qs 4c] [As]\naliendee07: pasa \npauquair5: pasa \n*** SHOW DOWN ***\naliendee07: muestra [8s Qh] (color, carta alta as)\npauquair5: descarta su mano sin mostrar \naliendee07 se lleva 0.14 € del bote \n*** RESUMEN ***\nBote total 0.15 € | Comisión 0.01 € \nComunitarias [Ks 5s Qs 4c As]\nAsiento 1: N3xtTIm35 (ciega pequeña) se retiró antes del Flop\nAsiento 2: aliendee07 (ciega grande) muestra [8s Qh] y ganó (0.14 €) con color, carta alta as\nAsiento 3: Macklemore0 se retiró antes del Flop (no apostó)\nAsiento 4: SrLyce se retiró en el Turn\nAsiento 5: ismagonzalez7 se retiró antes del Flop (no apostó)\nAsiento 6: pauquair5 (botón) descartó sin mostrar [Kd 4d]"
}