{
  "hand_id": "257238765355",
  "date": "06-08-2025 19:27:11",
  "table": "Herculina II",
  "game_type": "holdem",
  "hero": "SrLyce",
  "hero_position": "",
  "hero_cards": [
    "6h",
    "Kd"
  ],
  "stacks": {
    "Alceo27": 119.0,
    "David98X": 138.5,
    "JJer11": 188.0,
    "SrLyce": 139.0,
    "Macklemore0": 104.0,
    "ScarvBlack": 112.0
  },
  "actions": {
    "preflop": [
      "Asiento 1: Alceo27 (2.38 € en fichas)",
      "Asiento 2: David98X (2.77 € en fichas)",
      "Asiento 3: JJer11 (3.76 € en fichas)",
      "Asiento 4: SrLyce (2.78 € en fichas)",
      "Asiento 5: Macklemore0 (2.08 € en fichas)",
      "Asiento 6: ScarvBlack (2.24 € en fichas)",
      "JJer11: pone la ciega pequeña 0.01 €",
      "SrLyce: pone la ciega grande 0.02 €",
      "Macklemore0: se retira",
      "ScarvBlack: sube 0.04 € a 0.06 €",
      "Alceo27: se retira",
      "David98X: se retira",
      "JJer11: se retira",
      "SrLyce: iguala 0.04 €"
    ],
    "flop": [
      "SrLyce: pasa",
      "ScarvBlack: pasa"
    ],
    "turn": [
      "SrLyce: apuesta 0.04 €",
      "ScarvBlack: se retira",
      "SrLyce: no muestra su mano",
      "Asiento 1: Alceo27 se retiró antes del Flop (no apostó)",
      "Asiento 2: David98X (botón) se retiró antes del Flop (no apostó)",
      "Asiento 3: JJer11 (ciega pequeña) se retiró antes del Flop",
      "Asiento 4: SrLyce (ciega grande) recaudó (0.12 €)",
      "Asiento 5: Macklemore0 se retiró antes del Flop (no apostó)",
      "Asiento 6: ScarvBlack se retiró en el Turn"
    ],
    "river": []
  },
  "board": [
    "Ks",
    "7h",
    "4h",
    "9h"
  ],
  "winner": "SrLyce",
  "win_amount": 6.0,
  "sb": 0.01,
  "bb": 0.02,
  "rake": 0.5,
  "raw_text": "Mano n.º 257238765355 de PokerStars:  Hold'em No Limit (0.01 €/0.02 € EUR) - 06-08-2025 19:27:11 CET [06-08-2025 13:27:11 ET]\nMesa \"Herculina II\" 6-max El asiento n.º 2 es el botón\nAsiento 1: Alceo27 (2.38 € en fichas) \nAsiento 2: David98X (2.77 € en fichas) \nAsiento 3: JJer11 (3.76 € en fichas) \nAsiento 4: SrLyce (2.78 € en fichas) \nAsiento 5: Macklemore0 (2.08 € en fichas) \nAsiento 6: ScarvBlack (2.24 € en fichas) \nJJer11: pone la ciega pequeña 0.01 €\nSrLyce: pone la ciega grande 0.02 €\n*** CARTAS DE MANO ***\nRepartidas a SrLyce [6h Kd]\nMacklemore0: se retira \nScarvBlack: sube 0.04 € a 0.06 €\nAlceo27: se retira \nDavid98X: se retira \nJJer11: se retira \nSrLyce: iguala 0.04 €\n*** FLOP *** [Ks 7h 4h]\nSrLyce: pasa \nScarvBlack: pasa \n*** TURN *** [Ks 7h 4h] [9h]\nSrLyce: apuesta 0.04 €\nScarvBlack: se retira \nLa apuesta no igualada (0.04 €) ha sido devuelta a SrLyce\nSrLyce se lleva 0.12 € del bote \nSrLyce: no muestra su mano \n*** RESUMEN ***\nBote total 0.13 € | Comisión 0.01 € \nComunitarias [Ks 7h 4h 9h]\nAsiento 1: Alceo27 se retiró antes del Flop (no apostó)\nAsiento 2: David98X (botón) se retiró antes del Flop (no apostó)\nAsiento 3: JJer11 (ciega pequeña) se retiró antes del Flop\nAsiento 4: SrLyce (ciega grande) recaudó (0.12 €)\nAsiento 5: Macklemore0 se retiró antes del Flop (no apostó)\nAsiento 6: ScarvBlack se retiró en el Turn"
}