{
  "hand_id": "257150501621",
  "date": "30-07-2025 23:46:26",
  "table": "Martha",
  "game_type": "holdem",
  "hero": "SrLyce",
  "hero_position": "",
  "hero_cards": [
    "2h",
    "Ah"
  ],
  "stacks": {
    "Sigiilo": 102.5,
    "mivipkr": 104.5,
    "NovacaineZxc": 141.5,
    "BudyXXIII": 112.5,
    "SrLyce": 74.5,
    "alexfw300": 100.5
  },
  "actions": {
    "preflop": [
      "Asiento 4: Sigiilo (2.05 € en fichas) está ausente",
      "Asiento 1: mivipkr (2.09 € en fichas)",
      "Asiento 2: NovacaineZxc (2.83 € en fichas)",
      "Asiento 3: BudyXXIII (2.25 € en fichas)",
      "Asiento 5: SrLyce (1.49 € en fichas)",
      "Asiento 6: alexfw300 (2.01 € en fichas)",
      "BudyXXIII: pone la ciega pequeña 0.01 €",
      "Sigiilo: está ausente",
      "SrLyce: pone la ciega grande 0.02 €",
      "alexfw300: se retira",
      "mivipkr: se retira",
      "NovacaineZxc: sube 0.06 € a 0.08 €",
      "BudyXXIII: sube 0.10 € a 0.18 €",
      "SrLyce: iguala 0.16 €",
      "NovacaineZxc: iguala 0.10 €"
    ],
    "flop": [
      "BudyXXIII: apuesta 0.15 €",
      "SrLyce: iguala 0.15 €",
      "NovacaineZxc: se retira"
    ],
    "turn": [
      "BudyXXIII: pasa",
      "SrLyce: apuesta 0.40 €",
      "BudyXXIII: iguala 0.40 €"
    ],
    "river": [
      "BudyXXIII: pasa",
      "SrLyce: apuesta 0.76 € y está all-in",
      "BudyXXIII: se retira",
      "SrLyce: no muestra su mano",
      "Asiento 4: Sigiilo",
      "Asiento 1: mivipkr se retiró antes del Flop (no apostó)",
      "Asiento 2: NovacaineZxc (botón) se retiró en el Flop",
      "Asiento 3: BudyXXIII (ciega pequeña) se retiró en el River",
      "Asiento 5: SrLyce (ciega grande) recaudó (1.54 €)",
      "Asiento 6: alexfw300 se retiró antes del Flop (no apostó)"
    ]
  },
  "board": [
    "5c",
    "7d",
    "4d",
    "3s",
    "7c"
  ],
  "winner": "SrLyce",
  "win_amount": 77.0,
  "sb": 0.01,
  "bb": 0.02,
  "rake": 5.0,
  "raw_text": "Mano n.º 257150501621 de PokerStars:  Hold'em No Limit (0.01 €/0.02 € EUR) - 30-07-2025 23:46:26 CET [30-07-2025 17:46:26 ET]\nMesa \"Martha\" 6-max El asiento n.º 2 es el botón\nAsiento 4: Sigiilo (2.05 € en fichas) está ausente\nAsiento 1: mivipkr (2.09 € en fichas) \nAsiento 2: NovacaineZxc (2.83 € en fichas) \nAsiento 3: BudyXXIII (2.25 € en fichas) \nAsiento 5: SrLyce (1.49 € en fichas) \nAsiento 6: alexfw300 (2.01 € en fichas) \nBudyXXIII: pone la ciega pequeña 0.01 €\nSigiilo: está ausente \nSrLyce: pone la ciega grande 0.02 €\n*** CARTAS DE MANO ***\nRepartidas a SrLyce [2h Ah]\nalexfw300: se retira \nmivipkr: se retira \nNovacaineZxc: sube 0.06 € a 0.08 €\nSigiilo deja la mesa\nBudyXXIII: sube 0.10 € a 0.18 €\nSrLyce: iguala 0.16 €\nNovacaineZxc: iguala 0.10 €\n*** FLOP *** [5c 7d 4d]\nBudyXXIII: apuesta 0.15 €\nSrLyce: iguala 0.15 €\nNovacaineZxc: se retira \n*** TURN *** [5c 7d 4d] [3s]\nBudyXXIII: pasa \nSrLyce: apuesta 0.40 €\nBudyXXIII: iguala 0.40 €\n*** RIVER *** [5c 7d 4d 3s] [7c]\nBudyXXIII: pasa \nSrLyce: apuesta 0.76 € y está all-in\nBudyXXIII: se retira \nLa apuesta no igualada (0.76 €) ha sido devuelta a SrLyce\nSrLyce se lleva 1.54 € del bote \nSrLyce: no muestra su mano \n*** RESUMEN ***\nBote total 1.64 € | Comisión 0.10 € \nComunitarias [5c 7d 4d 3s 7c]\nAsiento 4: Sigiilo\nAsiento 1: mivipkr se retiró antes del Flop (no apostó)\nAsiento 2: NovacaineZxc (botón) se retiró en el Flop\nAsiento 3: BudyXXIII (ciega pequeña) se retiró en el River\nAsiento 5: SrLyce (ciega grande) recaudó (1.54 €)\nAsiento 6: alexfw300 se retiró antes del Flop (no apostó)"
}