{
  "hand_id": "257238632260",
  "date": "06-08-2025 19:16:05",
  "table": "Leonteus",
  "game_type": "holdem",
  "hero": "SrLyce",
  "hero_position": "",
  "hero_cards": [
    "Ac",
    "8d"
  ],
  "stacks": {
    "practikal_C23": 47.5,
    "BuXHexter": 145.5,
    "niyomalo": 99.0,
    "davinci1962": 148.5,
    "Andark47": 214.0,
    "SrLyce": 98.0
  },
  "actions": {
    "preflop": [
      "Asiento 1: practikal_C23 (0.95 € en fichas) está ausente",
      "Asiento 4: BuXHexter (2.91 € en fichas) está ausente",
      "Asiento 2: niyomalo (1.98 € en fichas)",
      "Asiento 3: davinci1962 (2.97 € en fichas)",
      "Asiento 5: Andark47 (4.28 € en fichas)",
      "Asiento 6: SrLyce (1.96 € en fichas)",
      "SrLyce: pone la ciega pequeña 0.01 €",
      "niyomalo: pone la ciega grande 0.02 €",
      "BuXHexter: se ausenta",
      "davinci1962: sube 0.03 € a 0.05 €",
      "Andark47: se retira",
      "SrLyce: iguala 0.04 €",
      "niyomalo: se retira"
    ],
    "flop": [
      "SrLyce: apuesta 0.04 €",
      "davinci1962: iguala 0.04 €"
    ],
    "turn": [
      "SrLyce: apuesta 0.10 €",
      "davinci1962: se retira",
      "SrLyce: no muestra su mano",
      "Asiento 1: practikal_C23",
      "Asiento 4: BuXHexter",
      "Asiento 2: niyomalo (ciega grande) se retiró antes del Flop",
      "Asiento 3: davinci1962 se retiró en el Turn",
      "Asiento 5: Andark47 (botón) se retiró antes del Flop (no apostó)",
      "Asiento 6: SrLyce (ciega pequeña) recaudó (0.19 €)"
    ],
    "river": []
  },
  "board": [
    "2s",
    "7h",
    "8c",
    "7c"
  ],
  "winner": "SrLyce",
  "win_amount": 9.5,
  "sb": 0.01,
  "bb": 0.02,
  "rake": 0.5,
  "raw_text": "Mano n.º 257238632260 de PokerStars:  Hold'em No Limit (0.01 €/0.02 € EUR) - 06-08-2025 19:16:05 CET [06-08-2025 13:16:05 ET]\nMesa \"Leonteus\" 6-max El asiento n.º 5 es el botón\nAsiento 1: practikal_C23 (0.95 € en fichas) está ausente\nAsiento 4: BuXHexter (2.91 € en fichas) está ausente\nAsiento 2: niyomalo (1.98 € en fichas) \nAsiento 3: davinci1962 (2.97 € en fichas) \nAsiento 5: Andark47 (4.28 € en fichas) \nAsiento 6: SrLyce (1.96 € en fichas) \nSrLyce: pone la ciega pequeña 0.01 €\nniyomalo: pone la ciega grande 0.02 €\nBuXHexter: se ausenta \n*** CARTAS DE MANO ***\nRepartidas a SrLyce [Ac 8d]\ndavinci1962: sube 0.03 € a 0.05 €\nAndark47: se retira \nSrLyce: iguala 0.04 €\nniyomalo: se retira \n*** FLOP *** [2s 7h 8c]\nSrLyce: apuesta 0.04 €\ndavinci1962: iguala 0.04 €\n*** TURN *** [2s 7h 8c] [7c]\nSrLyce: apuesta 0.10 €\ndavinci1962: se retira \nLa apuesta no igualada (0.10 €) ha sido devuelta a SrLyce\nSrLyce se lleva 0.19 € del bote \nSrLyce: no muestra su mano \n*** RESUMEN ***\nBote total 0.20 € | Comisión 0.01 € \nComunitarias [2s 7h 8c 7c]\nAsiento 1: practikal_C23\nAsiento 4: BuXHexter\nAsiento 2: niyomalo (ciega grande) se retiró antes del Flop\nAsiento 3: davinci1962 se retiró en el Turn\nAsiento 5: Andark47 (botón) se retiró antes del Flop (no apostó)\nAsiento 6: SrLyce (ciega pequeña) recaudó (0.19 €)"
}