{
  "hand_id": "257215225118",
  "date": "04-08-2025 22:32:08",
  "table": "Aldhafera II",
  "game_type": "holdem",
  "hero": "SrLyce",
  "hero_position": "",
  "hero_cards": [
    "4c",
    "2c"
  ],
  "stacks": {
    "wsx25": 68.0,
    "BudyXXIII": 294.0,
    "SrLyce": 100.0,
    "rhidoxxx": 87.0,
    "jte-ken": 100.0,
    "betterrrrrr": 179.0
  },
  "actions": {
    "preflop": [
      "Asiento 1: wsx25 (1.36 € en fichas)",
      "Asiento 2: BudyXXIII (5.88 € en fichas)",
      "Asiento 3: SrLyce (2 € en fichas)",
      "Asiento 4: rhidoxxx (1.74 € en fichas)",
      "Asiento 5: jte-ken (2 € en fichas)",
      "Asiento 6: betterrrrrr (3.58 € en fichas)",
      "wsx25: pone la ciega pequeña 0.01 €",
      "BudyXXIII: pone la ciega grande 0.02 €",
      "SrLyce: se retira",
      "rhidoxxx: sube 0.02 € a 0.04 €",
      "jte-ken: iguala 0.04 €",
      "betterrrrrr: se retira",
      "wsx25: se retira",
      "BudyXXIII: se retira"
    ],
    "flop": [
      "rhidoxxx: pasa",
      "jte-ken: pasa"
    ],
    "turn": [
      "rhidoxxx: pasa",
      "jte-ken: pasa"
    ],
    "river": [
      "rhidoxxx: pasa",
      "jte-ken: pasa",
      "rhidoxxx: muestra [7h Jc] (doble pareja, dieces y cuatros)",
      "jte-ken: muestra [Jh 6h] (doble pareja, dieces y cuatros)",
      "Asiento 1: wsx25 (ciega pequeña) se retiró antes del Flop",
      "Asiento 2: BudyXXIII (ciega grande) se retiró antes del Flop",
      "Asiento 3: SrLyce se retiró antes del Flop (no apostó)",
      "Asiento 4: rhidoxxx muestra [7h Jc] y ganó (0.05 €) con doble pareja, dieces y cuatros",
      "Asiento 5: jte-ken muestra [Jh 6h] y ganó (0.05 €) con doble pareja, dieces y cuatros",
      "Asiento 6: betterrrrrr (botón) se retiró antes del Flop (no apostó)"
    ]
  },
  "board": [
    "Qs",
    "4s",
    "4h",
    "Ts",
    "Th"
  ],
  "winner": "rhidoxxx",
  "win_amount": 2.5,
  "sb": 0.01,
  "bb": 0.02,
  "rake": 0.5,
  "raw_text": "Mano n.º 257215225118 de PokerStars:  Hold'em No Limit (0.01 €/0.02 € EUR) - 04-08-2025 22:32:08 CET [04-08-2025 16:32:08 ET]\nMesa \"Aldhafera II\" 6-max El asiento n.º 6 es el botón\nAsiento 1: wsx25 (1.36 € en fichas) \nAsiento 2: BudyXXIII (5.88 € en fichas) \nAsiento 3: SrLyce (2 € en fichas) \nAsiento 4: rhidoxxx (1.74 € en fichas) \nAsiento 5: jte-ken (2 € en fichas) \nAsiento 6: betterrrrrr (3.58 € en fichas) \nwsx25: pone la ciega pequeña 0.01 €\nBudyXXIII: pone la ciega grande 0.02 €\n*** CARTAS DE MANO ***\nRepartidas a SrLyce [4c 2c]\nSrLyce: se retira \nrhidoxxx: sube 0.02 € a 0.04 €\njte-ken: iguala 0.04 €\nbetterrrrrr: se retira \nwsx25: se retira \nBudyXXIII: se retira \n*** FLOP *** [Qs 4s 4h]\nrhidoxxx: pasa \njte-ken: pasa \n*** TURN *** [Qs 4s 4h] [Ts]\nrhidoxxx: pasa \njte-ken: pasa \n*** RIVER *** [Qs 4s 4h Ts] [Th]\nrhidoxxx: pasa \njte-ken: pasa \n*** SHOW DOWN ***\nrhidoxxx: muestra [7h Jc] (doble pareja, dieces y cuatros)\njte-ken: muestra [Jh 6h] (doble pareja, dieces y cuatros)\nrhidoxxx se lleva 0.05 € del bote \njte-ken se lleva 0.05 € del bote \n*** RESUMEN ***\nBote total 0.11 € | Comisión 0.01 € \nComunitarias [Qs 4s 4h Ts Th]\nAsiento 1: wsx25 (ciega pequeña) se retiró antes del Flop\nAsiento 2: BudyXXIII (ciega grande) se retiró antes del Flop\nAsiento 3: SrLyce se retiró antes del Flop (no apostó)\nAsiento 4: rhidoxxx muestra [7h Jc] y ganó (0.05 €) con doble pareja, dieces y cuatros\nAsiento 5: jte-ken muestra [Jh 6h] y ganó (0.05 €) con doble pareja, dieces y cuatros\nAsiento 6: betterrrrrr (botón) se retiró antes del Flop (no apostó)"
}