{
  "hand_id": "257148774307",
  "date": "30-07-2025 21:43:04",
  "table": "Sirona",
  "game_type": "holdem",
  "hero": "SrLyce",
  "hero_position": "",
  "hero_cards": [
    "Kc",
    "Tc"
  ],
  "stacks": {
    "SrLyce": 88.0,
    "lecontrebandier": 95.5,
    "christoph363": 179.5,
    "oliverdu70": 107.5,
    "olibellier": 30.0,
    "Dakoo44": 113.0
  },
  "actions": {
    "preflop": [
      "Asiento 1: SrLyce (1.76 € en fichas)",
      "Asiento 2: lecontrebandier (1.91 € en fichas)",
      "Asiento 3: christoph363 (3.59 € en fichas)",
      "Asiento 4: oliverdu70 (2.15 € en fichas)",
      "Asiento 5: olibellier (0.60 € en fichas)",
      "Asiento 6: Dakoo44 (2.26 € en fichas)",
      "christoph363: pone la ciega pequeña 0.01 €",
      "oliverdu70: pone la ciega grande 0.02 €",
      "olibellier: se retira",
      "Dakoo44: se retira",
      "SrLyce: sube 0.04 € a 0.06 €",
      "lecontrebandier: se retira",
      "christoph363: se retira",
      "oliverdu70: iguala 0.04 €"
    ],
    "flop": [
      "oliverdu70: apuesta 0.06 €",
      "SrLyce: iguala 0.06 €"
    ],
    "turn": [
      "oliverdu70: pasa",
      "SrLyce: apuesta 0.12 €",
      "oliverdu70: iguala 0.12 €"
    ],
    "river": [
      "oliverdu70: apuesta 0.23 €",
      "SrLyce: iguala 0.23 €",
      "oliverdu70: muestra [Js Ks] (color, carta alta rey)",
      "SrLyce: descarta su mano sin mostrar",
      "Asiento 1: SrLyce descartó sin mostrar [Kc Tc]",
      "Asiento 2: lecontrebandier (botón) se retiró antes del Flop (no apostó)",
      "Asiento 3: christoph363 (ciega pequeña) se retiró antes del Flop",
      "Asiento 4: oliverdu70 (ciega grande) muestra [Js Ks] y ganó (0.89 €) con color, carta alta rey",
      "Asiento 5: olibellier se retiró antes del Flop (no apostó)",
      "Asiento 6: Dakoo44 se retiró antes del Flop (no apostó)"
    ]
  },
  "board": [
    "8s",
    "4s",
    "3d",
    "2s",
    "Kh"
  ],
  "winner": "oliverdu70",
  "win_amount": 44.5,
  "sb": 0.01,
  "bb": 0.02,
  "rake": 3.0,
  "raw_text": "Mano n.º 257148774307 de PokerStars:  Hold'em No Limit (0.01 €/0.02 € EUR) - 30-07-2025 21:43:04 CET [30-07-2025 15:43:04 ET]\nMesa \"Sirona\" 6-max El asiento n.º 2 es el botón\nAsiento 1: SrLyce (1.76 € en fichas) \nAsiento 2: lecontrebandier (1.91 € en fichas) \nAsiento 3: christoph363 (3.59 € en fichas) \nAsiento 4: oliverdu70 (2.15 € en fichas) \nAsiento 5: olibellier (0.60 € en fichas) \nAsiento 6: Dakoo44 (2.26 € en fichas) \nchristoph363: pone la ciega pequeña 0.01 €\noliverdu70: pone la ciega grande 0.02 €\n*** CARTAS DE MANO ***\nRepartidas a SrLyce [Kc Tc]\nolibellier: se retira \nDakoo44: se retira \nSrLyce: sube 0.04 € a 0.06 €\nlecontrebandier: se retira \nchristoph363: se retira \noliverdu70: iguala 0.04 €\n*** FLOP *** [8s 4s 3d]\noliverdu70: apuesta 0.06 €\nSrLyce: iguala 0.06 €\n*** TURN *** [8s 4s 3d] [2s]\noliverdu70: pasa \nSrLyce: apuesta 0.12 €\noliverdu70: iguala 0.12 €\n*** RIVER *** [8s 4s 3d 2s] [Kh]\noliverdu70: apuesta 0.23 €\nSrLyce: iguala 0.23 €\n*** SHOW DOWN ***\noliverdu70: muestra [Js Ks] (color, carta alta rey)\nSrLyce: descarta su mano sin mostrar \noliverdu70 se lleva 0.89 € del bote \n*** RESUMEN ***\nBote total 0.95 € | Comisión 0.06 € \nComunitarias [8s 4s 3d 2s Kh]\nAsiento 1: SrLyce descartó sin mostrar [Kc Tc]\nAsiento 2: lecontrebandier (botón) se retiró antes del Flop (no apostó)\nAsiento 3: christoph363 (ciega pequeña) se retiró antes del Flop\nAsiento 4: oliverdu70 (ciega grande) muestra [Js Ks] y ganó (0.89 €) con color, carta alta rey\nAsiento 5: olibellier se retiró antes del Flop (no apostó)\nAsiento 6: Dakoo44 se retiró antes del Flop (no apostó)"
}