{
  "hand_id": "257168220969",
  "date": "01-08-2025 11:07:02",
  "table": "Sekanina",
  "game_type": "holdem",
  "hero": "SrLyce",
  "hero_position": "",
  "hero_cards": [
    "8d",
    "3d"
  ],
  "stacks": {
    "practikal_C23": 85.0,
    "Alvii37": 92.5,
    "SrLyce": 103.5,
    "davinci1962": 106.0,
    "Elministrelas": 93.5
  },
  "actions": {
    "preflop": [
      "Asiento 2: practikal_C23 (1.70 € en fichas)",
      "Asiento 3: Alvii37 (1.85 € en fichas)",
      "Asiento 4: SrLyce (2.07 € en fichas)",
      "Asiento 5: davinci1962 (2.12 € en fichas)",
      "Asiento 6: Elministrelas (1.87 € en fichas)",
      "Alvii37: pone la ciega pequeña 0.01 €",
      "SrLyce: pone la ciega grande 0.02 €",
      "davinci1962: sube 0.03 € a 0.05 €",
      "Elministrelas: se retira",
      "practikal_C23: iguala 0.05 €",
      "Alvii37: se retira",
      "SrLyce: se retira"
    ],
    "flop": [
      "davinci1962: apuesta 0.09 €",
      "practikal_C23: se retira",
      "davinci1962: no muestra su mano",
      "Asiento 2: practikal_C23 (botón) se retiró en el Flop",
      "Asiento 3: Alvii37 (ciega pequeña) se retiró antes del Flop",
      "Asiento 4: SrLyce (ciega grande) se retiró antes del Flop",
      "Asiento 5: davinci1962 recaudó (0.12 €)",
      "Asiento 6: Elministrelas se retiró antes del Flop (no apostó)"
    ],
    "turn": [],
    "river": []
  },
  "board": [
    "6s",
    "3h",
    "4s"
  ],
  "winner": "davinci1962",
  "win_amount": 6.0,
  "sb": 0.01,
  "bb": 0.02,
  "rake": 0.5,
  "raw_text": "Mano n.º 257168220969 de PokerStars:  Hold'em No Limit (0.01 €/0.02 € EUR) - 01-08-2025 11:07:02 CET [01-08-2025 5:07:02 ET]\nMesa \"Sekanina\" 6-max El asiento n.º 2 es el botón\nAsiento 2: practikal_C23 (1.70 € en fichas) \nAsiento 3: Alvii37 (1.85 € en fichas) \nAsiento 4: SrLyce (2.07 € en fichas) \nAsiento 5: davinci1962 (2.12 € en fichas) \nAsiento 6: Elministrelas (1.87 € en fichas) \nAlvii37: pone la ciega pequeña 0.01 €\nSrLyce: pone la ciega grande 0.02 €\n*** CARTAS DE MANO ***\nRepartidas a SrLyce [8d 3d]\ndavinci1962: sube 0.03 € a 0.05 €\nElministrelas: se retira \npractikal_C23: iguala 0.05 €\nAlvii37: se retira \nSrLyce: se retira \n*** FLOP *** [6s 3h 4s]\ndavinci1962: apuesta 0.09 €\npractikal_C23: se retira \nLa apuesta no igualada (0.09 €) ha sido devuelta a davinci1962\ndavinci1962 se lleva 0.12 € del bote \ndavinci1962: no muestra su mano \n*** RESUMEN ***\nBote total 0.13 € | Comisión 0.01 € \nComunitarias [6s 3h 4s]\nAsiento 2: practikal_C23 (botón) se retiró en el Flop\nAsiento 3: Alvii37 (ciega pequeña) se retiró antes del Flop\nAsiento 4: SrLyce (ciega grande) se retiró antes del Flop\nAsiento 5: davinci1962 recaudó (0.12 €)\nAsiento 6: Elministrelas se retiró antes del Flop (no apostó)"
}