{
  "hand_id": "257215044642",
  "date": "04-08-2025 22:20:54",
  "table": "Aldhafera II",
  "game_type": "holdem",
  "hero": "SrLyce",
  "hero_position": "",
  "hero_cards": [
    "Kc",
    "9s"
  ],
  "stacks": {
    "wsx25": 95.0,
    "BudyXXIII": 267.0,
    "SrLyce": 96.0,
    "rhidoxxx": 87.0,
    "jte-ken": 123.5,
    "betterrrrrr": 106.5
  },
  "actions": {
    "preflop": [
      "Asiento 1: wsx25 (1.90 € en fichas)",
      "Asiento 2: BudyXXIII (5.34 € en fichas)",
      "Asiento 3: SrLyce (1.92 € en fichas)",
      "Asiento 4: rhidoxxx (1.74 € en fichas)",
      "Asiento 5: jte-ken (2.47 € en fichas)",
      "Asiento 6: betterrrrrr (2.13 € en fichas)",
      "BudyXXIII: pone la ciega pequeña 0.01 €",
      "SrLyce: pone la ciega grande 0.02 €",
      "rhidoxxx: se retira",
      "jte-ken: se retira",
      "betterrrrrr: sube 0.03 € a 0.05 €",
      "wsx25: se retira",
      "BudyXXIII: se retira",
      "SrLyce: iguala 0.03 €"
    ],
    "flop": [
      "SrLyce: pasa",
      "betterrrrrr: apuesta 0.03 €",
      "SrLyce: iguala 0.03 €"
    ],
    "turn": [
      "SrLyce: pasa",
      "betterrrrrr: apuesta 0.24 €",
      "SrLyce: iguala 0.24 €"
    ],
    "river": [
      "SrLyce: pasa",
      "betterrrrrr: apuesta 0.92 €",
      "SrLyce: iguala 0.92 €",
      "betterrrrrr: muestra [9c 7c] (color, carta alta as)",
      "SrLyce: descarta su mano sin mostrar",
      "Asiento 1: wsx25 (botón) se retiró antes del Flop (no apostó)",
      "Asiento 2: BudyXXIII (ciega pequeña) se retiró antes del Flop",
      "Asiento 3: SrLyce (ciega grande) descartó sin mostrar [Kc 9s]",
      "Asiento 4: rhidoxxx se retiró antes del Flop (no apostó)",
      "Asiento 5: jte-ken se retiró antes del Flop (no apostó)",
      "Asiento 6: betterrrrrr muestra [9c 7c] y ganó (2.34 €) con color, carta alta as"
    ]
  },
  "board": [
    "8h",
    "Ac",
    "Ks",
    "Qc",
    "Tc"
  ],
  "winner": "betterrrrrr",
  "win_amount": 117.0,
  "sb": 0.01,
  "bb": 0.02,
  "rake": 7.5,
  "raw_text": "Mano n.º 257215044642 de PokerStars:  Hold'em No Limit (0.01 €/0.02 € EUR) - 04-08-2025 22:20:54 CET [04-08-2025 16:20:54 ET]\nMesa \"Aldhafera II\" 6-max El asiento n.º 1 es el botón\nAsiento 1: wsx25 (1.90 € en fichas) \nAsiento 2: BudyXXIII (5.34 € en fichas) \nAsiento 3: SrLyce (1.92 € en fichas) \nAsiento 4: rhidoxxx (1.74 € en fichas) \nAsiento 5: jte-ken (2.47 € en fichas) \nAsiento 6: betterrrrrr (2.13 € en fichas) \nBudyXXIII: pone la ciega pequeña 0.01 €\nSrLyce: pone la ciega grande 0.02 €\n*** CARTAS DE MANO ***\nRepartidas a SrLyce [Kc 9s]\nrhidoxxx: se retira \njte-ken: se retira \nbetterrrrrr: sube 0.03 € a 0.05 €\nwsx25: se retira \nBudyXXIII: se retira \nSrLyce: iguala 0.03 €\n*** FLOP *** [8h Ac Ks]\nSrLyce: pasa \nbetterrrrrr: apuesta 0.03 €\nSrLyce: iguala 0.03 €\n*** TURN *** [8h Ac Ks] [Qc]\nSrLyce: pasa \nbetterrrrrr: apuesta 0.24 €\nSrLyce: iguala 0.24 €\n*** RIVER *** [8h Ac Ks Qc] [Tc]\nSrLyce: pasa \nbetterrrrrr: apuesta 0.92 €\nSrLyce: iguala 0.92 €\n*** SHOW DOWN ***\nbetterrrrrr: muestra [9c 7c] (color, carta alta as)\nSrLyce: descarta su mano sin mostrar \nbetterrrrrr se lleva 2.34 € del bote \n*** RESUMEN ***\nBote total 2.49 € | Comisión 0.15 € \nComunitarias [8h Ac Ks Qc Tc]\nAsiento 1: wsx25 (botón) se retiró antes del Flop (no apostó)\nAsiento 2: BudyXXIII (ciega pequeña) se retiró antes del Flop\nAsiento 3: SrLyce (ciega grande) descartó sin mostrar [Kc 9s]\nAsiento 4: rhidoxxx se retiró antes del Flop (no apostó)\nAsiento 5: jte-ken se retiró antes del Flop (no apostó)\nAsiento 6: betterrrrrr muestra [9c 7c] y ganó (2.34 €) con color, carta alta as"
}