{
  "hand_id": "257238700919",
  "date": "06-08-2025 19:21:50",
  "table": "Leonteus",
  "game_type": "holdem",
  "hero": "SrLyce",
  "hero_position": "",
  "hero_cards": [
    "Jc",
    "4d"
  ],
  "stacks": {
    "practikal_C23": 45.0,
    "niyomalo": 96.0,
    "davinci1962": 156.0,
    "BuXHexter": 155.0,
    "Andark47": 203.0,
    "SrLyce": 94.0
  },
  "actions": {
    "preflop": [
      "Asiento 1: practikal_C23 (0.90 € en fichas)",
      "Asiento 2: niyomalo (1.92 € en fichas)",
      "Asiento 3: davinci1962 (3.12 € en fichas)",
      "Asiento 4: BuXHexter (3.10 € en fichas)",
      "Asiento 5: Andark47 (4.06 € en fichas)",
      "Asiento 6: SrLyce (1.88 € en fichas)",
      "Andark47: pone la ciega pequeña 0.01 €",
      "SrLyce: pone la ciega grande 0.02 €",
      "practikal_C23: iguala 0.02 €",
      "niyomalo: se retira",
      "davinci1962: se retira",
      "BuXHexter: se retira",
      "Andark47: sube 0.06 € a 0.08 €",
      "SrLyce: se retira",
      "practikal_C23: iguala 0.06 €"
    ],
    "flop": [
      "Andark47: apuesta 0.06 €",
      "practikal_C23: se retira",
      "Andark47: no muestra su mano",
      "Asiento 1: practikal_C23 se retiró en el Flop",
      "Asiento 2: niyomalo se retiró antes del Flop (no apostó)",
      "Asiento 3: davinci1962 se retiró antes del Flop (no apostó)",
      "Asiento 4: BuXHexter (botón) se retiró antes del Flop (no apostó)",
      "Asiento 5: Andark47 (ciega pequeña) recaudó (0.17 €)",
      "Asiento 6: SrLyce (ciega grande) se retiró antes del Flop"
    ],
    "turn": [],
    "river": []
  },
  "board": [
    "6h",
    "7d",
    "2s"
  ],
  "winner": "Andark47",
  "win_amount": 8.5,
  "sb": 0.01,
  "bb": 0.02,
  "rake": 0.5,
  "raw_text": "Mano n.º 257238700919 de PokerStars:  Hold'em No Limit (0.01 €/0.02 € EUR) - 06-08-2025 19:21:50 CET [06-08-2025 13:21:50 ET]\nMesa \"Leonteus\" 6-max El asiento n.º 4 es el botón\nAsiento 1: practikal_C23 (0.90 € en fichas) \nAsiento 2: niyomalo (1.92 € en fichas) \nAsiento 3: davinci1962 (3.12 € en fichas) \nAsiento 4: BuXHexter (3.10 € en fichas) \nAsiento 5: Andark47 (4.06 € en fichas) \nAsiento 6: SrLyce (1.88 € en fichas) \nAndark47: pone la ciega pequeña 0.01 €\nSrLyce: pone la ciega grande 0.02 €\n*** CARTAS DE MANO ***\nRepartidas a SrLyce [Jc 4d]\npractikal_C23: iguala 0.02 €\nniyomalo: se retira \ndavinci1962: se retira \nBuXHexter: se retira \nAndark47: sube 0.06 € a 0.08 €\nSrLyce: se retira \npractikal_C23: iguala 0.06 €\n*** FLOP *** [6h 7d 2s]\nAndark47: apuesta 0.06 €\npractikal_C23: se retira \nLa apuesta no igualada (0.06 €) ha sido devuelta a Andark47\nAndark47 se lleva 0.17 € del bote \nAndark47: no muestra su mano \n*** RESUMEN ***\nBote total 0.18 € | Comisión 0.01 € \nComunitarias [6h 7d 2s]\nAsiento 1: practikal_C23 se retiró en el Flop\nAsiento 2: niyomalo se retiró antes del Flop (no apostó)\nAsiento 3: davinci1962 se retiró antes del Flop (no apostó)\nAsiento 4: BuXHexter (botón) se retiró antes del Flop (no apostó)\nAsiento 5: Andark47 (ciega pequeña) recaudó (0.17 €)\nAsiento 6: SrLyce (ciega grande) se retiró antes del Flop"
}