{
  "hand_id": "257238254179",
  "date": "06-08-2025 18:41:46",
  "table": "Aidamina II",
  "game_type": "holdem",
  "hero": "SrLyce",
  "hero_position": "",
  "hero_cards": [
    "9c",
    "2d"
  ],
  "stacks": {
    "GarciaTT416": 99.0,
    "McFlash3": 100.0,
    "niyomalo": 69.0,
    "durahimovic": 133.0,
    "Abrelatas787": 145.0,
    "SrLyce": 129.0
  },
  "actions": {
    "preflop": [
      "Asiento 1: GarciaTT416 (1.98 € en fichas)",
      "Asiento 2: McFlash3 (2 € en fichas)",
      "Asiento 3: niyomalo (1.38 € en fichas)",
      "Asiento 4: durahimovic (2.66 € en fichas)",
      "Asiento 5: Abrelatas787 (2.90 € en fichas)",
      "Asiento 6: SrLyce (2.58 € en fichas)",
      "GarciaTT416: pone la ciega pequeña 0.01 €",
      "McFlash3: pone la ciega grande 0.02 €",
      "niyomalo: se retira",
      "durahimovic: se retira",
      "Abrelatas787: sube 0.04 € a 0.06 €",
      "SrLyce: se retira",
      "GarciaTT416: se retira",
      "McFlash3: iguala 0.04 €"
    ],
    "flop": [
      "McFlash3: pasa",
      "Abrelatas787: pasa"
    ],
    "turn": [
      "McFlash3: pasa",
      "Abrelatas787: apuesta 0.06 €",
      "McFlash3: se retira",
      "Abrelatas787: no muestra su mano",
      "Asiento 1: GarciaTT416 (ciega pequeña) se retiró antes del Flop",
      "Asiento 2: McFlash3 (ciega grande) se retiró en el Turn",
      "Asiento 3: niyomalo se retiró antes del Flop (no apostó)",
      "Asiento 4: durahimovic se retiró antes del Flop (no apostó)",
      "Asiento 5: Abrelatas787 recaudó (0.12 €)",
      "Asiento 6: SrLyce (botón) se retiró antes del Flop (no apostó)"
    ],
    "river": []
  },
  "board": [
    "5s",
    "Ad",
    "9h",
    "4s"
  ],
  "winner": "Abrelatas787",
  "win_amount": 6.0,
  "sb": 0.01,
  "bb": 0.02,
  "rake": 0.5,
  "raw_text": "Mano n.º 257238254179 de PokerStars:  Hold'em No Limit (0.01 €/0.02 € EUR) - 06-08-2025 18:41:46 CET [06-08-2025 12:41:46 ET]\nMesa \"Aidamina II\" 6-max El asiento n.º 6 es el botón\nAsiento 1: GarciaTT416 (1.98 € en fichas) \nAsiento 2: McFlash3 (2 € en fichas) \nAsiento 3: niyomalo (1.38 € en fichas) \nAsiento 4: durahimovic (2.66 € en fichas) \nAsiento 5: Abrelatas787 (2.90 € en fichas) \nAsiento 6: SrLyce (2.58 € en fichas) \nGarciaTT416: pone la ciega pequeña 0.01 €\nMcFlash3: pone la ciega grande 0.02 €\n*** CARTAS DE MANO ***\nRepartidas a SrLyce [9c 2d]\nniyomalo: se retira \ndurahimovic: se retira \nAbrelatas787: sube 0.04 € a 0.06 €\nSrLyce: se retira \nGarciaTT416: se retira \nMcFlash3: iguala 0.04 €\n*** FLOP *** [5s Ad 9h]\nMcFlash3: pasa \nAbrelatas787: pasa \n*** TURN *** [5s Ad 9h] [4s]\nMcFlash3: pasa \nAbrelatas787: apuesta 0.06 €\nMcFlash3: se retira \nLa apuesta no igualada (0.06 €) ha sido devuelta a Abrelatas787\nAbrelatas787 se lleva 0.12 € del bote \nAbrelatas787: no muestra su mano \n*** RESUMEN ***\nBote total 0.13 € | Comisión 0.01 € \nComunitarias [5s Ad 9h 4s]\nAsiento 1: GarciaTT416 (ciega pequeña) se retiró antes del Flop\nAsiento 2: McFlash3 (ciega grande) se retiró en el Turn\nAsiento 3: niyomalo se retiró antes del Flop (no apostó)\nAsiento 4: durahimovic se retiró antes del Flop (no apostó)\nAsiento 5: Abrelatas787 recaudó (0.12 €)\nAsiento 6: SrLyce (botón) se retiró antes del Flop (no apostó)"
}