{
  "hand_id": "257237986724",
  "date": "06-08-2025 18:17:56",
  "table": "Atreus",
  "game_type": "holdem",
  "hero": "SrLyce",
  "hero_position": "",
  "hero_cards": [
    "Js",
    "5h"
  ],
  "stacks": {
    "PrendsCa": 100.0,
    "NRules82": 78.0,
    "JENOFONTE73": 133.5,
    "Fharock": 92.0,
    "SrLyce": 124.0,
    "FishamanReggae": 30.5
  },
  "actions": {
    "preflop": [
      "Asiento 1: PrendsCa (2 € en fichas)",
      "Asiento 2: NRules82 (1.56 € en fichas)",
      "Asiento 3: JENOFONTE73 (2.67 € en fichas)",
      "Asiento 4: Fharock (1.84 € en fichas)",
      "Asiento 5: SrLyce (2.48 € en fichas)",
      "Asiento 6: FishamanReggae (0.61 € en fichas)",
      "PrendsCa: pone la ciega pequeña 0.01 €",
      "NRules82: pone la ciega grande 0.02 €",
      "JENOFONTE73: se retira",
      "Fharock: iguala 0.02 €",
      "SrLyce: se retira",
      "FishamanReggae: iguala 0.02 €",
      "PrendsCa: se retira",
      "NRules82: sube 0.08 € a 0.10 €",
      "Fharock: se retira",
      "FishamanReggae: se retira",
      "Asiento 1: PrendsCa (ciega pequeña) se retiró antes del Flop",
      "Asiento 2: NRules82 (ciega grande) recaudó (0.07 €)",
      "Asiento 3: JENOFONTE73 se retiró antes del Flop (no apostó)",
      "Asiento 4: Fharock se retiró antes del Flop",
      "Asiento 5: SrLyce se retiró antes del Flop (no apostó)",
      "Asiento 6: FishamanReggae (botón) se retiró antes del Flop"
    ],
    "flop": [],
    "turn": [],
    "river": []
  },
  "board": [],
  "winner": "NRules82",
  "win_amount": 3.5,
  "sb": 0.01,
  "bb": 0.02,
  "rake": 0.0,
  "raw_text": "Mano n.º 257237986724 de PokerStars:  Hold'em No Limit (0.01 €/0.02 € EUR) - 06-08-2025 18:17:56 CET [06-08-2025 12:17:56 ET]\nMesa \"Atreus\" 6-max El asiento n.º 6 es el botón\nAsiento 1: PrendsCa (2 € en fichas) \nAsiento 2: NRules82 (1.56 € en fichas) \nAsiento 3: JENOFONTE73 (2.67 € en fichas) \nAsiento 4: Fharock (1.84 € en fichas) \nAsiento 5: SrLyce (2.48 € en fichas) \nAsiento 6: FishamanReggae (0.61 € en fichas) \nPrendsCa: pone la ciega pequeña 0.01 €\nNRules82: pone la ciega grande 0.02 €\n*** CARTAS DE MANO ***\nRepartidas a SrLyce [Js 5h]\nJENOFONTE73 ha agotado su tiempo\nJENOFONTE73: se retira \nFharock: iguala 0.02 €\nSrLyce: se retira \nFishamanReggae: iguala 0.02 €\nPrendsCa: se retira \nNRules82: sube 0.08 € a 0.10 €\nFharock: se retira \nFishamanReggae: se retira \nLa apuesta no igualada (0.08 €) ha sido devuelta a NRules82\nNRules82 se lleva 0.07 € del bote \n*** RESUMEN ***\nBote total 0.07 € | Comisión 0 € \nAsiento 1: PrendsCa (ciega pequeña) se retiró antes del Flop\nAsiento 2: NRules82 (ciega grande) recaudó (0.07 €)\nAsiento 3: JENOFONTE73 se retiró antes del Flop (no apostó)\nAsiento 4: Fharock se retiró antes del Flop\nAsiento 5: SrLyce se retiró antes del Flop (no apostó)\nAsiento 6: FishamanReggae (botón) se retiró antes del Flop"
}