{
  "hand_id": "257238686336",
  "date": "06-08-2025 19:20:37",
  "table": "Adelaide III",
  "game_type": "holdem",
  "hero": "SrLyce",
  "hero_position": "",
  "hero_cards": [
    "4d",
    "5h"
  ],
  "stacks": {
    "Alceo27": 111.0,
    "aliendee07": 43.0,
    "Macklemore0": 105.0,
    "SrLyce": 133.5,
    "ismagonzalez7": 45.0,
    "McFlash3": 100.0
  },
  "actions": {
    "preflop": [
      "Asiento 1: Alceo27 (2.22 € en fichas)",
      "Asiento 2: aliendee07 (0.86 € en fichas)",
      "Asiento 3: Macklemore0 (2.10 € en fichas)",
      "Asiento 4: SrLyce (2.67 € en fichas)",
      "Asiento 5: ismagonzalez7 (0.90 € en fichas)",
      "Asiento 6: McFlash3 (2 € en fichas)",
      "ismagonzalez7: pone la ciega pequeña 0.01 €",
      "McFlash3: pone la ciega grande 0.02 €",
      "Alceo27: se retira",
      "aliendee07: se retira",
      "Macklemore0: se retira",
      "SrLyce: se retira",
      "ismagonzalez7: iguala 0.01 €",
      "McFlash3: pasa"
    ],
    "flop": [
      "ismagonzalez7: apuesta 0.04 €",
      "McFlash3: se retira",
      "ismagonzalez7: no muestra su mano",
      "Asiento 1: Alceo27 se retiró antes del Flop (no apostó)",
      "Asiento 2: aliendee07 se retiró antes del Flop (no apostó)",
      "Asiento 3: Macklemore0 se retiró antes del Flop (no apostó)",
      "Asiento 4: SrLyce (botón) se retiró antes del Flop (no apostó)",
      "Asiento 5: ismagonzalez7 (ciega pequeña) recaudó (0.04 €)",
      "Asiento 6: McFlash3 (ciega grande) se retiró en el Flop"
    ],
    "turn": [],
    "river": []
  },
  "board": [
    "5s",
    "9h",
    "Ad"
  ],
  "winner": "ismagonzalez7",
  "win_amount": 2.0,
  "sb": 0.01,
  "bb": 0.02,
  "rake": 0.0,
  "raw_text": "Mano n.º 257238686336 de PokerStars:  Hold'em No Limit (0.01 €/0.02 € EUR) - 06-08-2025 19:20:37 CET [06-08-2025 13:20:37 ET]\nMesa \"Adelaide III\" 6-max El asiento n.º 4 es el botón\nAsiento 1: Alceo27 (2.22 € en fichas) \nAsiento 2: aliendee07 (0.86 € en fichas) \nAsiento 3: Macklemore0 (2.10 € en fichas) \nAsiento 4: SrLyce (2.67 € en fichas) \nAsiento 5: ismagonzalez7 (0.90 € en fichas) \nAsiento 6: McFlash3 (2 € en fichas) \nismagonzalez7: pone la ciega pequeña 0.01 €\nMcFlash3: pone la ciega grande 0.02 €\n*** CARTAS DE MANO ***\nRepartidas a SrLyce [4d 5h]\nAlceo27: se retira \naliendee07: se retira \nMacklemore0: se retira \nSrLyce: se retira \nismagonzalez7: iguala 0.01 €\nMcFlash3: pasa \n*** FLOP *** [5s 9h Ad]\nismagonzalez7: apuesta 0.04 €\nMcFlash3: se retira \nLa apuesta no igualada (0.04 €) ha sido devuelta a ismagonzalez7\nismagonzalez7 se lleva 0.04 € del bote \nismagonzalez7: no muestra su mano \n*** RESUMEN ***\nBote total 0.04 € | Comisión 0 € \nComunitarias [5s 9h Ad]\nAsiento 1: Alceo27 se retiró antes del Flop (no apostó)\nAsiento 2: aliendee07 se retiró antes del Flop (no apostó)\nAsiento 3: Macklemore0 se retiró antes del Flop (no apostó)\nAsiento 4: SrLyce (botón) se retiró antes del Flop (no apostó)\nAsiento 5: ismagonzalez7 (ciega pequeña) recaudó (0.04 €)\nAsiento 6: McFlash3 (ciega grande) se retiró en el Flop"
}