{
  "hand_id": "257168289552",
  "date": "01-08-2025 11:20:25",
  "table": "Jupiter",
  "game_type": "holdem",
  "hero": "SrLyce",
  "hero_position": "",
  "hero_cards": [
    "6s",
    "8s"
  ],
  "stacks": {
    "LOLA19711971": 30.5,
    "sifilis5": 88.0,
    "Filou203": 110.5,
    "SrLyce": 116.5,
    "dadou13mars": 227.0,
    "Alvii37": 108.0
  },
  "actions": {
    "preflop": [
      "Asiento 4: LOLA19711971 (0.61 € en fichas) está ausente",
      "Asiento 1: sifilis5 (1.76 € en fichas)",
      "Asiento 2: Filou203 (2.21 € en fichas)",
      "Asiento 3: SrLyce (2.33 € en fichas)",
      "Asiento 5: dadou13mars (4.54 € en fichas)",
      "Asiento 6: Alvii37 (2.16 € en fichas)",
      "Filou203: pone la ciega pequeña 0.01 €",
      "SrLyce: pone la ciega grande 0.02 €",
      "dadou13mars: sube 0.04 € a 0.06 €",
      "Alvii37: se retira",
      "sifilis5: sube 0.11 € a 0.17 €",
      "Filou203: se retira",
      "SrLyce: se retira",
      "dadou13mars: se retira",
      "sifilis5: no muestra su mano",
      "Asiento 4: LOLA19711971",
      "Asiento 1: sifilis5 (botón) recaudó (0.15 €)",
      "Asiento 2: Filou203 (ciega pequeña) se retiró antes del Flop",
      "Asiento 3: SrLyce (ciega grande) se retiró antes del Flop",
      "Asiento 5: dadou13mars se retiró antes del Flop",
      "Asiento 6: Alvii37 se retiró antes del Flop (no apostó)"
    ],
    "flop": [],
    "turn": [],
    "river": []
  },
  "board": [],
  "winner": "sifilis5",
  "win_amount": 7.5,
  "sb": 0.01,
  "bb": 0.02,
  "rake": 0.0,
  "raw_text": "Mano n.º 257168289552 de PokerStars:  Hold'em No Limit (0.01 €/0.02 € EUR) - 01-08-2025 11:20:25 CET [01-08-2025 5:20:25 ET]\nMesa \"Jupiter\" 6-max El asiento n.º 1 es el botón\nAsiento 4: LOLA19711971 (0.61 € en fichas) está ausente\nAsiento 1: sifilis5 (1.76 € en fichas) \nAsiento 2: Filou203 (2.21 € en fichas) \nAsiento 3: SrLyce (2.33 € en fichas) \nAsiento 5: dadou13mars (4.54 € en fichas) \nAsiento 6: Alvii37 (2.16 € en fichas) \nFilou203: pone la ciega pequeña 0.01 €\nSrLyce: pone la ciega grande 0.02 €\n*** CARTAS DE MANO ***\nRepartidas a SrLyce [6s 8s]\ndadou13mars: sube 0.04 € a 0.06 €\nAlvii37: se retira \nsifilis5: sube 0.11 € a 0.17 €\nFilou203: se retira \nSrLyce: se retira \ndadou13mars: se retira \nLa apuesta no igualada (0.11 €) ha sido devuelta a sifilis5\nsifilis5 se lleva 0.15 € del bote \nsifilis5: no muestra su mano \n*** RESUMEN ***\nBote total 0.15 € | Comisión 0 € \nAsiento 4: LOLA19711971\nAsiento 1: sifilis5 (botón) recaudó (0.15 €)\nAsiento 2: Filou203 (ciega pequeña) se retiró antes del Flop\nAsiento 3: SrLyce (ciega grande) se retiró antes del Flop\nAsiento 5: dadou13mars se retiró antes del Flop\nAsiento 6: Alvii37 se retiró antes del Flop (no apostó)"
}