{
  "hand_id": "257215176114",
  "date": "04-08-2025 22:29:07",
  "table": "Aldhafera II",
  "game_type": "holdem",
  "hero": "SrLyce",
  "hero_position": "",
  "hero_cards": [
    "5c",
    "Ad"
  ],
  "stacks": {
    "wsx25": 88.5,
    "BudyXXIII": 294.0,
    "SrLyce": 97.0,
    "rhidoxxx": 66.5,
    "jte-ken": 108.5,
    "betterrrrrr": 176.5
  },
  "actions": {
    "preflop": [
      "Asiento 1: wsx25 (1.77 € en fichas)",
      "Asiento 2: BudyXXIII (5.88 € en fichas)",
      "Asiento 3: SrLyce (1.94 € en fichas)",
      "Asiento 4: rhidoxxx (1.33 € en fichas)",
      "Asiento 5: jte-ken (2.17 € en fichas)",
      "Asiento 6: betterrrrrr (3.53 € en fichas)",
      "wsx25: pone la ciega pequeña 0.01 €",
      "BudyXXIII: pone la ciega grande 0.02 €",
      "SrLyce: se retira",
      "rhidoxxx: se retira",
      "jte-ken: sube 0.04 € a 0.06 €",
      "betterrrrrr: iguala 0.06 €",
      "wsx25: se retira",
      "BudyXXIII: se retira"
    ],
    "flop": [
      "jte-ken: pasa",
      "betterrrrrr: apuesta 0.21 €",
      "jte-ken: se retira",
      "betterrrrrr: no muestra su mano",
      "Asiento 1: wsx25 (ciega pequeña) se retiró antes del Flop",
      "Asiento 2: BudyXXIII (ciega grande) se retiró antes del Flop",
      "Asiento 3: SrLyce se retiró antes del Flop (no apostó)",
      "Asiento 4: rhidoxxx se retiró antes del Flop (no apostó)",
      "Asiento 5: jte-ken se retiró en el Flop",
      "Asiento 6: betterrrrrr (botón) recaudó (0.14 €)"
    ],
    "turn": [],
    "river": []
  },
  "board": [
    "6d",
    "9d",
    "2h"
  ],
  "winner": "betterrrrrr",
  "win_amount": 7.0,
  "sb": 0.01,
  "bb": 0.02,
  "rake": 0.5,
  "raw_text": "Mano n.º 257215176114 de PokerStars:  Hold'em No Limit (0.01 €/0.02 € EUR) - 04-08-2025 22:29:07 CET [04-08-2025 16:29:07 ET]\nMesa \"Aldhafera II\" 6-max El asiento n.º 6 es el botón\nAsiento 1: wsx25 (1.77 € en fichas) \nAsiento 2: BudyXXIII (5.88 € en fichas) \nAsiento 3: SrLyce (1.94 € en fichas) \nAsiento 4: rhidoxxx (1.33 € en fichas) \nAsiento 5: jte-ken (2.17 € en fichas) \nAsiento 6: betterrrrrr (3.53 € en fichas) \nwsx25: pone la ciega pequeña 0.01 €\nBudyXXIII: pone la ciega grande 0.02 €\n*** CARTAS DE MANO ***\nRepartidas a SrLyce [5c Ad]\nSrLyce: se retira \nrhidoxxx: se retira \njte-ken: sube 0.04 € a 0.06 €\nbetterrrrrr: iguala 0.06 €\nwsx25: se retira \nBudyXXIII: se retira \n*** FLOP *** [6d 9d 2h]\njte-ken: pasa \nbetterrrrrr: apuesta 0.21 €\njte-ken: se retira \nLa apuesta no igualada (0.21 €) ha sido devuelta a betterrrrrr\nbetterrrrrr se lleva 0.14 € del bote \nbetterrrrrr: no muestra su mano \n*** RESUMEN ***\nBote total 0.15 € | Comisión 0.01 € \nComunitarias [6d 9d 2h]\nAsiento 1: wsx25 (ciega pequeña) se retiró antes del Flop\nAsiento 2: BudyXXIII (ciega grande) se retiró antes del Flop\nAsiento 3: SrLyce se retiró antes del Flop (no apostó)\nAsiento 4: rhidoxxx se retiró antes del Flop (no apostó)\nAsiento 5: jte-ken se retiró en el Flop\nAsiento 6: betterrrrrr (botón) recaudó (0.14 €)"
}