{
  "hand_id": "257148763734",
  "date": "30-07-2025 21:42:19",
  "table": "Esclangona",
  "game_type": "holdem",
  "hero": "SrLyce",
  "hero_position": "",
  "hero_cards": [
    "5d",
    "4s"
  ],
  "stacks": {
    "NoahBolete": 100.0,
    "Zorgue1080": 96.0,
    "SrLyce": 147.0,
    "Davdgoni": 117.5,
    "DiaZzZ1": 103.0,
    "berlcht403": 33.0
  },
  "actions": {
    "preflop": [
      "Asiento 3: NoahBolete (2 € en fichas) está ausente",
      "Asiento 1: Zorgue1080 (1.92 € en fichas)",
      "Asiento 2: SrLyce (2.94 € en fichas)",
      "Asiento 4: Davdgoni (2.35 € en fichas)",
      "Asiento 5: DiaZzZ1 (2.06 € en fichas)",
      "Asiento 6: berlcht403 (0.66 € en fichas)",
      "Zorgue1080: pone la ciega pequeña 0.01 €",
      "SrLyce: pone la ciega grande 0.02 €",
      "NoahBolete: se ausenta",
      "Davdgoni: se retira",
      "DiaZzZ1: sube 0.02 € a 0.04 €",
      "berlcht403: iguala 0.04 €",
      "Zorgue1080: se retira",
      "SrLyce: iguala 0.02 €"
    ],
    "flop": [
      "SrLyce: pasa",
      "DiaZzZ1: pasa",
      "berlcht403: apuesta 0.12 €",
      "SrLyce: se retira",
      "DiaZzZ1: se retira",
      "Asiento 3: NoahBolete",
      "Asiento 1: Zorgue1080 (ciega pequeña) se retiró antes del Flop",
      "Asiento 2: SrLyce (ciega grande) se retiró en el Flop",
      "Asiento 4: Davdgoni se retiró antes del Flop (no apostó)",
      "Asiento 5: DiaZzZ1 se retiró en el Flop",
      "Asiento 6: berlcht403 (botón) recaudó (0.12 €)"
    ],
    "turn": [],
    "river": []
  },
  "board": [
    "2c",
    "2h",
    "Ts"
  ],
  "winner": "berlcht403",
  "win_amount": 6.0,
  "sb": 0.01,
  "bb": 0.02,
  "rake": 0.5,
  "raw_text": "Mano n.º 257148763734 de PokerStars:  Hold'em No Limit (0.01 €/0.02 € EUR) - 30-07-2025 21:42:19 CET [30-07-2025 15:42:19 ET]\nMesa \"Esclangona\" 6-max El asiento n.º 6 es el botón\nAsiento 3: NoahBolete (2 € en fichas) está ausente\nAsiento 1: Zorgue1080 (1.92 € en fichas) \nAsiento 2: SrLyce (2.94 € en fichas) \nAsiento 4: Davdgoni (2.35 € en fichas) \nAsiento 5: DiaZzZ1 (2.06 € en fichas) \nAsiento 6: berlcht403 (0.66 € en fichas) \nZorgue1080: pone la ciega pequeña 0.01 €\nSrLyce: pone la ciega grande 0.02 €\nNoahBolete: se ausenta \n*** CARTAS DE MANO ***\nRepartidas a SrLyce [5d 4s]\nDavdgoni: se retira \nDiaZzZ1: sube 0.02 € a 0.04 €\nberlcht403: iguala 0.04 €\nZorgue1080: se retira \nSrLyce: iguala 0.02 €\n*** FLOP *** [2c 2h Ts]\nSrLyce: pasa \nDiaZzZ1: pasa \nberlcht403: apuesta 0.12 €\nSrLyce: se retira \nDiaZzZ1: se retira \nLa apuesta no igualada (0.12 €) ha sido devuelta a berlcht403\nberlcht403 se lleva 0.12 € del bote \n*** RESUMEN ***\nBote total 0.13 € | Comisión 0.01 € \nComunitarias [2c 2h Ts]\nAsiento 3: NoahBolete\nAsiento 1: Zorgue1080 (ciega pequeña) se retiró antes del Flop\nAsiento 2: SrLyce (ciega grande) se retiró en el Flop\nAsiento 4: Davdgoni se retiró antes del Flop (no apostó)\nAsiento 5: DiaZzZ1 se retiró en el Flop\nAsiento 6: berlcht403 (botón) recaudó (0.12 €)"
}