{
  "hand_id": "257148759946",
  "date": "30-07-2025 21:42:03",
  "table": "Sirona",
  "game_type": "holdem",
  "hero": "SrLyce",
  "hero_position": "",
  "hero_cards": [
    "2h",
    "Ah"
  ],
  "stacks": {
    "SrLyce": 87.5,
    "lecontrebandier": 96.0,
    "christoph363": 180.5,
    "oliverdu70": 107.5,
    "olibellier": 30.0,
    "Dakoo44": 112.5
  },
  "actions": {
    "preflop": [
      "Asiento 1: SrLyce (1.75 € en fichas)",
      "Asiento 2: lecontrebandier (1.92 € en fichas)",
      "Asiento 3: christoph363 (3.61 € en fichas)",
      "Asiento 4: oliverdu70 (2.15 € en fichas)",
      "Asiento 5: olibellier (0.60 € en fichas)",
      "Asiento 6: Dakoo44 (2.25 € en fichas)",
      "lecontrebandier: pone la ciega pequeña 0.01 €",
      "christoph363: pone la ciega grande 0.02 €",
      "oliverdu70: se retira",
      "olibellier: se retira",
      "Dakoo44: sube 0.03 € a 0.05 €",
      "SrLyce: iguala 0.05 €",
      "lecontrebandier: se retira",
      "christoph363: se retira"
    ],
    "flop": [
      "Dakoo44: pasa",
      "SrLyce: apuesta 0.04 €",
      "Dakoo44: iguala 0.04 €"
    ],
    "turn": [
      "Dakoo44: pasa",
      "SrLyce: pasa"
    ],
    "river": [
      "Dakoo44: pasa",
      "SrLyce: pasa",
      "Dakoo44: muestra [5h Ac] (pareja de jotas)",
      "SrLyce: muestra [2h Ah] (pareja de jotas)",
      "Asiento 1: SrLyce (botón) muestra [2h Ah] y ganó (0.10 €) con pareja de jotas",
      "Asiento 2: lecontrebandier (ciega pequeña) se retiró antes del Flop",
      "Asiento 3: christoph363 (ciega grande) se retiró antes del Flop",
      "Asiento 4: oliverdu70 se retiró antes del Flop (no apostó)",
      "Asiento 5: olibellier se retiró antes del Flop (no apostó)",
      "Asiento 6: Dakoo44 muestra [5h Ac] y ganó (0.10 €) con pareja de jotas"
    ]
  },
  "board": [
    "Jh",
    "6d",
    "Jd",
    "4c",
    "Qc"
  ],
  "winner": "Dakoo44",
  "win_amount": 5.0,
  "sb": 0.01,
  "bb": 0.02,
  "rake": 0.5,
  "raw_text": "Mano n.º 257148759946 de PokerStars:  Hold'em No Limit (0.01 €/0.02 € EUR) - 30-07-2025 21:42:03 CET [30-07-2025 15:42:03 ET]\nMesa \"Sirona\" 6-max El asiento n.º 1 es el botón\nAsiento 1: SrLyce (1.75 € en fichas) \nAsiento 2: lecontrebandier (1.92 € en fichas) \nAsiento 3: christoph363 (3.61 € en fichas) \nAsiento 4: oliverdu70 (2.15 € en fichas) \nAsiento 5: olibellier (0.60 € en fichas) \nAsiento 6: Dakoo44 (2.25 € en fichas) \nlecontrebandier: pone la ciega pequeña 0.01 €\nchristoph363: pone la ciega grande 0.02 €\n*** CARTAS DE MANO ***\nRepartidas a SrLyce [2h Ah]\noliverdu70: se retira \nolibellier: se retira \nDakoo44: sube 0.03 € a 0.05 €\nSrLyce: iguala 0.05 €\nlecontrebandier: se retira \nchristoph363: se retira \n*** FLOP *** [Jh 6d Jd]\nDakoo44: pasa \nSrLyce: apuesta 0.04 €\nDakoo44: iguala 0.04 €\n*** TURN *** [Jh 6d Jd] [4c]\nDakoo44: pasa \nSrLyce: pasa \n*** RIVER *** [Jh 6d Jd 4c] [Qc]\nDakoo44: pasa \nSrLyce: pasa \n*** SHOW DOWN ***\nDakoo44: muestra [5h Ac] (pareja de jotas)\nSrLyce: muestra [2h Ah] (pareja de jotas)\nDakoo44 se lleva 0.10 € del bote \nSrLyce se lleva 0.10 € del bote \n*** RESUMEN ***\nBote total 0.21 € | Comisión 0.01 € \nComunitarias [Jh 6d Jd 4c Qc]\nAsiento 1: SrLyce (botón) muestra [2h Ah] y ganó (0.10 €) con pareja de jotas\nAsiento 2: lecontrebandier (ciega pequeña) se retiró antes del Flop\nAsiento 3: christoph363 (ciega grande) se retiró antes del Flop\nAsiento 4: oliverdu70 se retiró antes del Flop (no apostó)\nAsiento 5: olibellier se retiró antes del Flop (no apostó)\nAsiento 6: Dakoo44 muestra [5h Ac] y ganó (0.10 €) con pareja de jotas"
}