{
  "hand_id": "257150013470",
  "date": "30-07-2025 23:12:20",
  "table": "Gilgamesh",
  "game_type": "holdem",
  "hero": "SrLyce",
  "hero_position": "",
  "hero_cards": [
    "4h",
    "Jd"
  ],
  "stacks": {
    "riverrrrrrmagic": 112.5,
    "SrLyce": 109.5,
    "Jumby34": 100.0,
    "xapkk": 104.0,
    "Fretzo67500": 106.0
  },
  "actions": {
    "preflop": [
      "Asiento 1: riverrrrrrmagic (2.25 € en fichas)",
      "Asiento 2: SrLyce (2.19 € en fichas)",
      "Asiento 3: Jumby34 (2 € en fichas)",
      "Asiento 4: xapkk (2.08 € en fichas)",
      "Asiento 6: Fretzo67500 (2.12 € en fichas)",
      "SrLyce: pone la ciega pequeña 0.01 €",
      "Jumby34: pone la ciega grande 0.02 €",
      "xapkk: se retira",
      "Fretzo67500: iguala 0.02 €",
      "riverrrrrrmagic: sube 0.02 € a 0.04 €",
      "SrLyce: iguala 0.03 €",
      "Jumby34: se retira",
      "Fretzo67500: iguala 0.02 €"
    ],
    "flop": [
      "SrLyce: pasa",
      "Fretzo67500: apuesta 0.07 €",
      "riverrrrrrmagic: iguala 0.07 €",
      "SrLyce: se retira"
    ],
    "turn": [
      "Fretzo67500: apuesta 0.13 €",
      "riverrrrrrmagic: iguala 0.13 €"
    ],
    "river": [
      "Fretzo67500: pasa",
      "riverrrrrrmagic: apuesta 0.14 €",
      "Fretzo67500: se retira",
      "Asiento 1: riverrrrrrmagic (botón) recaudó (0.51 €)",
      "Asiento 2: SrLyce (ciega pequeña) se retiró en el Flop",
      "Asiento 3: Jumby34 (ciega grande) se retiró antes del Flop",
      "Asiento 4: xapkk se retiró antes del Flop (no apostó)",
      "Asiento 6: Fretzo67500 se retiró en el River"
    ]
  },
  "board": [
    "3c",
    "Th",
    "5d",
    "2c",
    "8c"
  ],
  "winner": "riverrrrrrmagic",
  "win_amount": 25.5,
  "sb": 0.01,
  "bb": 0.02,
  "rake": 1.5,
  "raw_text": "Mano n.º 257150013470 de PokerStars:  Hold'em No Limit (0.01 €/0.02 € EUR) - 30-07-2025 23:12:20 CET [30-07-2025 17:12:20 ET]\nMesa \"Gilgamesh\" 6-max El asiento n.º 1 es el botón\nAsiento 1: riverrrrrrmagic (2.25 € en fichas) \nAsiento 2: SrLyce (2.19 € en fichas) \nAsiento 3: Jumby34 (2 € en fichas) \nAsiento 4: xapkk (2.08 € en fichas) \nAsiento 6: Fretzo67500 (2.12 € en fichas) \nSrLyce: pone la ciega pequeña 0.01 €\nJumby34: pone la ciega grande 0.02 €\n*** CARTAS DE MANO ***\nRepartidas a SrLyce [4h Jd]\nxapkk: se retira \nFretzo67500: iguala 0.02 €\nriverrrrrrmagic: sube 0.02 € a 0.04 €\nSrLyce: iguala 0.03 €\nJumby34: se retira \nFretzo67500: iguala 0.02 €\n*** FLOP *** [3c Th 5d]\nSrLyce: pasa \nFretzo67500: apuesta 0.07 €\nsamaritano34 se une a la mesa en el asiento n.º 5 \nriverrrrrrmagic: iguala 0.07 €\nSrLyce: se retira \n*** TURN *** [3c Th 5d] [2c]\nFretzo67500: apuesta 0.13 €\nriverrrrrrmagic: iguala 0.13 €\n*** RIVER *** [3c Th 5d 2c] [8c]\nFretzo67500: pasa \nriverrrrrrmagic: apuesta 0.14 €\nFretzo67500: se retira \nLa apuesta no igualada (0.14 €) ha sido devuelta a riverrrrrrmagic\nriverrrrrrmagic se lleva 0.51 € del bote \n*** RESUMEN ***\nBote total 0.54 € | Comisión 0.03 € \nComunitarias [3c Th 5d 2c 8c]\nAsiento 1: riverrrrrrmagic (botón) recaudó (0.51 €)\nAsiento 2: SrLyce (ciega pequeña) se retiró en el Flop\nAsiento 3: Jumby34 (ciega grande) se retiró antes del Flop\nAsiento 4: xapkk se retiró antes del Flop (no apostó)\nAsiento 6: Fretzo67500 se retiró en el River"
}