{
  "hand_id": "257238481359",
  "date": "06-08-2025 19:03:15",
  "table": "Alruccabah II",
  "game_type": "holdem",
  "hero": "SrLyce",
  "hero_position": "",
  "hero_cards": [
    "Ah",
    "Jd"
  ],
  "stacks": {
    "zoioachado": 0.0,
    "SrLyce": 143.5,
    "yonisanlu": 143.0,
    "Nicanor Cast": 49.0,
    "rayao32": 42.5
  },
  "actions": {
    "preflop": [
      "Asiento 2: zoioachado (0 € en fichas) está ausente",
      "Asiento 1: SrLyce (2.87 € en fichas)",
      "Asiento 3: yonisanlu (2.86 € en fichas)",
      "Asiento 4: serviettski(fr) (2 € en fichas)",
      "Asiento 5: Nicanor Cast (0.98 € en fichas)",
      "Asiento 6: rayao32 (0.85 € en fichas)",
      "SrLyce: pone la ciega pequeña 0.01 €",
      "yonisanlu: pone la ciega grande 0.02 €",
      "serviettski(fr): se retira",
      "Nicanor Cast: se retira",
      "rayao32: se retira",
      "SrLyce: iguala 0.01 €",
      "yonisanlu: sube 0.08 € a 0.10 €",
      "SrLyce: iguala 0.08 €"
    ],
    "flop": [
      "SrLyce: pasa",
      "yonisanlu: pasa"
    ],
    "turn": [
      "SrLyce: pasa",
      "yonisanlu: pasa"
    ],
    "river": [
      "SrLyce: apuesta 0.06 €",
      "yonisanlu: se retira",
      "SrLyce: no muestra su mano",
      "Asiento 2: zoioachado",
      "Asiento 1: SrLyce (ciega pequeña) recaudó (0.19 €)",
      "Asiento 3: yonisanlu (ciega grande) se retiró en el River",
      "Asiento 4: serviettski(fr) se retiró antes del Flop (no apostó)",
      "Asiento 5: Nicanor Cast se retiró antes del Flop (no apostó)",
      "Asiento 6: rayao32 (botón) se retiró antes del Flop (no apostó)"
    ]
  },
  "board": [
    "4h",
    "6c",
    "3h",
    "9c",
    "Qc"
  ],
  "winner": "SrLyce",
  "win_amount": 9.5,
  "sb": 0.01,
  "bb": 0.02,
  "rake": 0.5,
  "raw_text": "Mano n.º 257238481359 de PokerStars:  Hold'em No Limit (0.01 €/0.02 € EUR) - 06-08-2025 19:03:15 CET [06-08-2025 13:03:15 ET]\nMesa \"Alruccabah II\" 6-max El asiento n.º 6 es el botón\nAsiento 2: zoioachado (0 € en fichas) está ausente\nAsiento 1: SrLyce (2.87 € en fichas) \nAsiento 3: yonisanlu (2.86 € en fichas) \nAsiento 4: serviettski(fr) (2 € en fichas) \nAsiento 5: Nicanor Cast (0.98 € en fichas) \nAsiento 6: rayao32 (0.85 € en fichas) \nSrLyce: pone la ciega pequeña 0.01 €\nyonisanlu: pone la ciega grande 0.02 €\n*** CARTAS DE MANO ***\nRepartidas a SrLyce [Ah Jd]\nserviettski(fr): se retira \nNicanor Cast: se retira \nrayao32: se retira \nSrLyce: iguala 0.01 €\nyonisanlu: sube 0.08 € a 0.10 €\nSrLyce: iguala 0.08 €\n*** FLOP *** [4h 6c 3h]\nSrLyce: pasa \nyonisanlu: pasa \n*** TURN *** [4h 6c 3h] [9c]\nSrLyce: pasa \nyonisanlu: pasa \n*** RIVER *** [4h 6c 3h 9c] [Qc]\nSrLyce: apuesta 0.06 €\nyonisanlu: se retira \nLa apuesta no igualada (0.06 €) ha sido devuelta a SrLyce\nSrLyce se lleva 0.19 € del bote \nSrLyce: no muestra su mano \n*** RESUMEN ***\nBote total 0.20 € | Comisión 0.01 € \nComunitarias [4h 6c 3h 9c Qc]\nAsiento 2: zoioachado\nAsiento 1: SrLyce (ciega pequeña) recaudó (0.19 €)\nAsiento 3: yonisanlu (ciega grande) se retiró en el River\nAsiento 4: serviettski(fr) se retiró antes del Flop (no apostó)\nAsiento 5: Nicanor Cast se retiró antes del Flop (no apostó)\nAsiento 6: rayao32 (botón) se retiró antes del Flop (no apostó)"
}