{
  "hand_id": "257150164960",
  "date": "30-07-2025 23:22:47",
  "table": "Lobelia",
  "game_type": "holdem",
  "hero": "SrLyce",
  "hero_position": "",
  "hero_cards": [
    "Qs",
    "7h"
  ],
  "stacks": {
    "LeVbks": 116.5,
    "fcis666": 48.5,
    "Dlaguancha": 111.5,
    "SrLyce": 105.5,
    "riverluck444": 96.0,
    "javipondio": 16.0
  },
  "actions": {
    "preflop": [
      "Asiento 1: LeVbks (2.33 € en fichas)",
      "Asiento 2: fcis666 (0.97 € en fichas)",
      "Asiento 3: Dlaguancha (2.23 € en fichas)",
      "Asiento 4: SrLyce (2.11 € en fichas)",
      "Asiento 5: riverluck444 (1.92 € en fichas)",
      "Asiento 6: javipondio (0.32 € en fichas)",
      "Dlaguancha: pone la ciega pequeña 0.01 €",
      "SrLyce: pone la ciega grande 0.02 €",
      "riverluck444: se retira",
      "javipondio: se retira",
      "LeVbks: sube 0.02 € a 0.04 €",
      "fcis666: iguala 0.04 €",
      "Dlaguancha: iguala 0.03 €",
      "SrLyce: iguala 0.02 €"
    ],
    "flop": [
      "Dlaguancha: pasa",
      "SrLyce: pasa",
      "LeVbks: apuesta 0.07 €",
      "fcis666: iguala 0.07 €",
      "Dlaguancha: se retira",
      "SrLyce: se retira"
    ],
    "turn": [
      "LeVbks: pasa",
      "fcis666: apuesta 0.12 €",
      "LeVbks: se retira",
      "fcis666: no muestra su mano",
      "Asiento 1: LeVbks se retiró en el Turn",
      "Asiento 2: fcis666 (botón) recaudó (0.28 €)",
      "Asiento 3: Dlaguancha (ciega pequeña) se retiró en el Flop",
      "Asiento 4: SrLyce (ciega grande) se retiró en el Flop",
      "Asiento 5: riverluck444 se retiró antes del Flop (no apostó)",
      "Asiento 6: javipondio se retiró antes del Flop (no apostó)"
    ],
    "river": []
  },
  "board": [
    "4c",
    "Jh",
    "8d",
    "2c"
  ],
  "winner": "fcis666",
  "win_amount": 14.0,
  "sb": 0.01,
  "bb": 0.02,
  "rake": 1.0,
  "raw_text": "Mano n.º 257150164960 de PokerStars:  Hold'em No Limit (0.01 €/0.02 € EUR) - 30-07-2025 23:22:47 CET [30-07-2025 17:22:47 ET]\nMesa \"Lobelia\" 6-max El asiento n.º 2 es el botón\nAsiento 1: LeVbks (2.33 € en fichas) \nAsiento 2: fcis666 (0.97 € en fichas) \nAsiento 3: Dlaguancha (2.23 € en fichas) \nAsiento 4: SrLyce (2.11 € en fichas) \nAsiento 5: riverluck444 (1.92 € en fichas) \nAsiento 6: javipondio (0.32 € en fichas) \nDlaguancha: pone la ciega pequeña 0.01 €\nSrLyce: pone la ciega grande 0.02 €\n*** CARTAS DE MANO ***\nRepartidas a SrLyce [Qs 7h]\nriverluck444: se retira \njavipondio: se retira \nLeVbks: sube 0.02 € a 0.04 €\nfcis666: iguala 0.04 €\nDlaguancha: iguala 0.03 €\nSrLyce: iguala 0.02 €\n*** FLOP *** [4c Jh 8d]\nDlaguancha: pasa \nSrLyce: pasa \nLeVbks: apuesta 0.07 €\nfcis666: iguala 0.07 €\nDlaguancha: se retira \nSrLyce: se retira \n*** TURN *** [4c Jh 8d] [2c]\nLeVbks: pasa \nfcis666: apuesta 0.12 €\nLeVbks: se retira \nLa apuesta no igualada (0.12 €) ha sido devuelta a fcis666\nfcis666 se lleva 0.28 € del bote \nfcis666: no muestra su mano \n*** RESUMEN ***\nBote total 0.30 € | Comisión 0.02 € \nComunitarias [4c Jh 8d 2c]\nAsiento 1: LeVbks se retiró en el Turn\nAsiento 2: fcis666 (botón) recaudó (0.28 €)\nAsiento 3: Dlaguancha (ciega pequeña) se retiró en el Flop\nAsiento 4: SrLyce (ciega grande) se retiró en el Flop\nAsiento 5: riverluck444 se retiró antes del Flop (no apostó)\nAsiento 6: javipondio se retiró antes del Flop (no apostó)"
}