{
  "hand_id": "257237893215",
  "date": "06-08-2025 18:09:27",
  "table": "Euneus III",
  "game_type": "holdem",
  "hero": "SrLyce",
  "hero_position": "",
  "hero_cards": [
    "Jh",
    "2h"
  ],
  "stacks": {
    "christgear": 102.5,
    "Il_BM00": 99.5,
    "djrojas9": 154.5,
    "JGDOBLAS": 96.0,
    "SrLyce": 110.0,
    "Begoton": 100.0
  },
  "actions": {
    "preflop": [
      "Asiento 1: christgear (2.05 € en fichas)",
      "Asiento 2: Il_BM00 (1.99 € en fichas)",
      "Asiento 3: djrojas9 (3.09 € en fichas)",
      "Asiento 4: JGDOBLAS (1.92 € en fichas)",
      "Asiento 5: SrLyce (2.20 € en fichas)",
      "Asiento 6: Begoton (2 € en fichas)",
      "christgear: pone la ciega pequeña 0.01 €",
      "Il_BM00: pone la ciega grande 0.02 €",
      "djrojas9: se retira",
      "JGDOBLAS: se retira",
      "SrLyce: se retira",
      "Begoton: se retira",
      "christgear: sube 0.03 € a 0.05 €",
      "Il_BM00: se retira",
      "christgear: no muestra su mano",
      "Asiento 1: christgear (ciega pequeña) recaudó (0.04 €)",
      "Asiento 2: Il_BM00 (ciega grande) se retiró antes del Flop",
      "Asiento 3: djrojas9 se retiró antes del Flop (no apostó)",
      "Asiento 4: JGDOBLAS se retiró antes del Flop (no apostó)",
      "Asiento 5: SrLyce se retiró antes del Flop (no apostó)",
      "Asiento 6: Begoton (botón) se retiró antes del Flop (no apostó)"
    ],
    "flop": [],
    "turn": [],
    "river": []
  },
  "board": [],
  "winner": "christgear",
  "win_amount": 2.0,
  "sb": 0.01,
  "bb": 0.02,
  "rake": 0.0,
  "raw_text": "Mano n.º 257237893215 de PokerStars:  Hold'em No Limit (0.01 €/0.02 € EUR) - 06-08-2025 18:09:27 CET [06-08-2025 12:09:27 ET]\nMesa \"Euneus III\" 6-max El asiento n.º 6 es el botón\nAsiento 1: christgear (2.05 € en fichas) \nAsiento 2: Il_BM00 (1.99 € en fichas) \nAsiento 3: djrojas9 (3.09 € en fichas) \nAsiento 4: JGDOBLAS (1.92 € en fichas) \nAsiento 5: SrLyce (2.20 € en fichas) \nAsiento 6: Begoton (2 € en fichas) \nchristgear: pone la ciega pequeña 0.01 €\nIl_BM00: pone la ciega grande 0.02 €\n*** CARTAS DE MANO ***\nRepartidas a SrLyce [Jh 2h]\ndjrojas9: se retira \nJGDOBLAS: se retira \nSrLyce: se retira \nBegoton: se retira \nchristgear: sube 0.03 € a 0.05 €\nIl_BM00: se retira \nLa apuesta no igualada (0.03 €) ha sido devuelta a christgear\nchristgear se lleva 0.04 € del bote \nchristgear: no muestra su mano \n*** RESUMEN ***\nBote total 0.04 € | Comisión 0 € \nAsiento 1: christgear (ciega pequeña) recaudó (0.04 €)\nAsiento 2: Il_BM00 (ciega grande) se retiró antes del Flop\nAsiento 3: djrojas9 se retiró antes del Flop (no apostó)\nAsiento 4: JGDOBLAS se retiró antes del Flop (no apostó)\nAsiento 5: SrLyce se retiró antes del Flop (no apostó)\nAsiento 6: Begoton (botón) se retiró antes del Flop (no apostó)"
}