{
  "hand_id": "257237904660",
  "date": "06-08-2025 18:10:31",
  "table": "Euneus III",
  "game_type": "holdem",
  "hero": "SrLyce",
  "hero_position": "",
  "hero_cards": [
    "9d",
    "6c"
  ],
  "stacks": {
    "Begoton": 100.0,
    "christgear": 103.5,
    "Il_BM00": 99.5,
    "djrojas9": 153.0,
    "SrLyce": 110.5
  },
  "actions": {
    "preflop": [
      "Asiento 6: Begoton (2 € en fichas) está ausente",
      "Asiento 1: christgear (2.07 € en fichas)",
      "Asiento 2: Il_BM00 (1.99 € en fichas)",
      "Asiento 3: djrojas9 (3.06 € en fichas)",
      "Asiento 5: SrLyce (2.21 € en fichas)",
      "SrLyce: pone la ciega pequeña 0.01 €",
      "Begoton: está ausente",
      "christgear: pone la ciega grande 0.02 €",
      "Il_BM00: sube 0.04 € a 0.06 €",
      "djrojas9: se retira",
      "SrLyce: se retira",
      "christgear: se retira",
      "Il_BM00: no muestra su mano",
      "Asiento 6: Begoton",
      "Asiento 1: christgear (ciega grande) se retiró antes del Flop",
      "Asiento 2: Il_BM00 recaudó (0.05 €)",
      "Asiento 3: djrojas9 (botón) se retiró antes del Flop (no apostó)",
      "Asiento 5: SrLyce (ciega pequeña) se retiró antes del Flop"
    ],
    "flop": [],
    "turn": [],
    "river": []
  },
  "board": [],
  "winner": "Il_BM00",
  "win_amount": 2.5,
  "sb": 0.01,
  "bb": 0.02,
  "rake": 0.0,
  "raw_text": "Mano n.º 257237904660 de PokerStars:  Hold'em No Limit (0.01 €/0.02 € EUR) - 06-08-2025 18:10:31 CET [06-08-2025 12:10:31 ET]\nMesa \"Euneus III\" 6-max El asiento n.º 3 es el botón\nAsiento 6: Begoton (2 € en fichas) está ausente\nAsiento 1: christgear (2.07 € en fichas) \nAsiento 2: Il_BM00 (1.99 € en fichas) \nAsiento 3: djrojas9 (3.06 € en fichas) \nAsiento 5: SrLyce (2.21 € en fichas) \nSrLyce: pone la ciega pequeña 0.01 €\nBegoton: está ausente \nchristgear: pone la ciega grande 0.02 €\n*** CARTAS DE MANO ***\nRepartidas a SrLyce [9d 6c]\nIl_BM00: sube 0.04 € a 0.06 €\ndjrojas9: se retira \nSrLyce: se retira \nBegoton deja la mesa\nchristgear: se retira \nLa apuesta no igualada (0.04 €) ha sido devuelta a Il_BM00\nIl_BM00 se lleva 0.05 € del bote \nIl_BM00: no muestra su mano \n*** RESUMEN ***\nBote total 0.05 € | Comisión 0 € \nAsiento 6: Begoton\nAsiento 1: christgear (ciega grande) se retiró antes del Flop\nAsiento 2: Il_BM00 recaudó (0.05 €)\nAsiento 3: djrojas9 (botón) se retiró antes del Flop (no apostó)\nAsiento 5: SrLyce (ciega pequeña) se retiró antes del Flop"
}