{
  "hand_id": "257237873972",
  "date": "06-08-2025 18:07:38",
  "table": "Nuwa III",
  "game_type": "holdem",
  "hero": "SrLyce",
  "hero_position": "",
  "hero_cards": [
    "Jd",
    "4h"
  ],
  "stacks": {
    "davinci1962": 204.5,
    "BuXHexter": 100.0,
    "kcg_rm": 109.0,
    "SrLyce": 100.0,
    "RiskAllinkali": 115.0,
    "acavada": 103.5
  },
  "actions": {
    "preflop": [
      "Asiento 1: davinci1962 (4.09 € en fichas)",
      "Asiento 2: BuXHexter (2 € en fichas)",
      "Asiento 3: kcg_rm (2.18 € en fichas)",
      "Asiento 4: SrLyce (2 € en fichas)",
      "Asiento 5: RiskAllinkali (2.30 € en fichas)",
      "Asiento 6: acavada (2.07 € en fichas)",
      "BuXHexter: pone la ciega pequeña 0.01 €",
      "kcg_rm: pone la ciega grande 0.02 €",
      "SrLyce: se retira",
      "RiskAllinkali: se retira",
      "acavada: sube 0.02 € a 0.04 €",
      "davinci1962: se retira",
      "BuXHexter: se retira",
      "kcg_rm: iguala 0.02 €"
    ],
    "flop": [
      "kcg_rm: pasa",
      "acavada: apuesta 0.04 €",
      "kcg_rm: iguala 0.04 €"
    ],
    "turn": [
      "kcg_rm: pasa",
      "acavada: pasa"
    ],
    "river": [
      "kcg_rm: pasa",
      "acavada: apuesta 0.08 €",
      "kcg_rm: se retira",
      "acavada: no muestra su mano",
      "Asiento 1: davinci1962 (botón) se retiró antes del Flop (no apostó)",
      "Asiento 2: BuXHexter (ciega pequeña) se retiró antes del Flop",
      "Asiento 3: kcg_rm (ciega grande) se retiró en el River",
      "Asiento 4: SrLyce se retiró antes del Flop (no apostó)",
      "Asiento 5: RiskAllinkali se retiró antes del Flop (no apostó)",
      "Asiento 6: acavada recaudó (0.16 €)"
    ]
  },
  "board": [
    "3s",
    "Ac",
    "4s",
    "8c",
    "Ad"
  ],
  "winner": "acavada",
  "win_amount": 8.0,
  "sb": 0.01,
  "bb": 0.02,
  "rake": 0.5,
  "raw_text": "Mano n.º 257237873972 de PokerStars:  Hold'em No Limit (0.01 €/0.02 € EUR) - 06-08-2025 18:07:38 CET [06-08-2025 12:07:38 ET]\nMesa \"Nuwa III\" 6-max El asiento n.º 1 es el botón\nAsiento 1: davinci1962 (4.09 € en fichas) \nAsiento 2: BuXHexter (2 € en fichas) \nAsiento 3: kcg_rm (2.18 € en fichas) \nAsiento 4: SrLyce (2 € en fichas) \nAsiento 5: RiskAllinkali (2.30 € en fichas) \nAsiento 6: acavada (2.07 € en fichas) \nBuXHexter: pone la ciega pequeña 0.01 €\nkcg_rm: pone la ciega grande 0.02 €\n*** CARTAS DE MANO ***\nRepartidas a SrLyce [Jd 4h]\nSrLyce: se retira \nRiskAllinkali: se retira \nacavada: sube 0.02 € a 0.04 €\ndavinci1962: se retira \nBuXHexter: se retira \nkcg_rm: iguala 0.02 €\n*** FLOP *** [3s Ac 4s]\nkcg_rm: pasa \nacavada: apuesta 0.04 €\nkcg_rm: iguala 0.04 €\n*** TURN *** [3s Ac 4s] [8c]\nkcg_rm: pasa \nacavada: pasa \n*** RIVER *** [3s Ac 4s 8c] [Ad]\nkcg_rm: pasa \nacavada: apuesta 0.08 €\nkcg_rm: se retira \nLa apuesta no igualada (0.08 €) ha sido devuelta a acavada\nacavada se lleva 0.16 € del bote \nacavada: no muestra su mano \n*** RESUMEN ***\nBote total 0.17 € | Comisión 0.01 € \nComunitarias [3s Ac 4s 8c Ad]\nAsiento 1: davinci1962 (botón) se retiró antes del Flop (no apostó)\nAsiento 2: BuXHexter (ciega pequeña) se retiró antes del Flop\nAsiento 3: kcg_rm (ciega grande) se retiró en el River\nAsiento 4: SrLyce se retiró antes del Flop (no apostó)\nAsiento 5: RiskAllinkali se retiró antes del Flop (no apostó)\nAsiento 6: acavada recaudó (0.16 €)"
}