{
  "hand_id": "257238154448",
  "date": "06-08-2025 18:32:54",
  "table": "Patientia III",
  "game_type": "holdem",
  "hero": "SrLyce",
  "hero_position": "",
  "hero_cards": [
    "3d",
    "Kd"
  ],
  "stacks": {
    "Phryxz": 101.0,
    "SrLyce": 93.5,
    "chordewman": 111.0,
    "niyomalo": 88.5
  },
  "actions": {
    "preflop": [
      "Asiento 1: Phryxz (2.02 € en fichas)",
      "Asiento 2: serviettski(fr) (2.50 € en fichas)",
      "Asiento 3: SrLyce (1.87 € en fichas)",
      "Asiento 4: chordewman (2.22 € en fichas)",
      "Asiento 6: niyomalo (1.77 € en fichas)",
      "chordewman: pone la ciega pequeña 0.01 €",
      "niyomalo: pone la ciega grande 0.02 €",
      "Phryxz: se retira",
      "serviettski(fr): sube 0.04 € a 0.06 €",
      "SrLyce: se retira",
      "chordewman: se retira",
      "niyomalo: se retira",
      "serviettski(fr): no muestra su mano",
      "Asiento 1: Phryxz se retiró antes del Flop (no apostó)",
      "Asiento 2: serviettski(fr) recaudó (0.05 €)",
      "Asiento 3: SrLyce (botón) se retiró antes del Flop (no apostó)",
      "Asiento 4: chordewman (ciega pequeña) se retiró antes del Flop",
      "Asiento 6: niyomalo (ciega grande) se retiró antes del Flop"
    ],
    "flop": [],
    "turn": [],
    "river": []
  },
  "board": [],
  "winner": "serviettski(fr)",
  "win_amount": 2.5,
  "sb": 0.01,
  "bb": 0.02,
  "rake": 0.0,
  "raw_text": "Mano n.º 257238154448 de PokerStars:  Hold'em No Limit (0.01 €/0.02 € EUR) - 06-08-2025 18:32:54 CET [06-08-2025 12:32:54 ET]\nMesa \"Patientia III\" 6-max El asiento n.º 3 es el botón\nAsiento 1: Phryxz (2.02 € en fichas) \nAsiento 2: serviettski(fr) (2.50 € en fichas) \nAsiento 3: SrLyce (1.87 € en fichas) \nAsiento 4: chordewman (2.22 € en fichas) \nAsiento 6: niyomalo (1.77 € en fichas) \nchordewman: pone la ciega pequeña 0.01 €\nlehamock se une a la mesa en el asiento n.º 5 \nniyomalo: pone la ciega grande 0.02 €\n*** CARTAS DE MANO ***\nRepartidas a SrLyce [3d Kd]\nPhryxz: se retira \nserviettski(fr): sube 0.04 € a 0.06 €\nSrLyce: se retira \nchordewman: se retira \nniyomalo: se retira \nLa apuesta no igualada (0.04 €) ha sido devuelta a serviettski(fr)\nserviettski(fr) se lleva 0.05 € del bote \nserviettski(fr): no muestra su mano \n*** RESUMEN ***\nBote total 0.05 € | Comisión 0 € \nAsiento 1: Phryxz se retiró antes del Flop (no apostó)\nAsiento 2: serviettski(fr) recaudó (0.05 €)\nAsiento 3: SrLyce (botón) se retiró antes del Flop (no apostó)\nAsiento 4: chordewman (ciega pequeña) se retiró antes del Flop\nAsiento 6: niyomalo (ciega grande) se retiró antes del Flop"
}