{
  "hand_id": "257168295117",
  "date": "01-08-2025 11:21:29",
  "table": "Jupiter",
  "game_type": "holdem",
  "hero": "SrLyce",
  "hero_position": "",
  "hero_cards": [
    "Ks",
    "7h"
  ],
  "stacks": {
    "LOLA19711971": 30.5,
    "sifilis5": 92.5,
    "Filou203": 110.0,
    "SrLyce": 115.0,
    "dadou13mars": 222.5,
    "Alvii37": 110.0
  },
  "actions": {
    "preflop": [
      "Asiento 4: LOLA19711971 (0.61 € en fichas) está ausente",
      "Asiento 1: sifilis5 (1.85 € en fichas)",
      "Asiento 2: Filou203 (2.20 € en fichas)",
      "Asiento 3: SrLyce (2.30 € en fichas)",
      "Asiento 5: dadou13mars (4.45 € en fichas)",
      "Asiento 6: Alvii37 (2.20 € en fichas)",
      "Alvii37: pone la ciega pequeña 0.01 €",
      "sifilis5: pone la ciega grande 0.02 €",
      "Filou203: se retira",
      "SrLyce: se retira",
      "dadou13mars: sube 0.04 € a 0.06 €",
      "Alvii37: se retira",
      "sifilis5: iguala 0.04 €"
    ],
    "flop": [
      "sifilis5: pasa",
      "dadou13mars: pasa"
    ],
    "turn": [
      "sifilis5: pasa",
      "dadou13mars: pasa"
    ],
    "river": [
      "sifilis5: apuesta 0.09 €",
      "dadou13mars: se retira",
      "sifilis5: no muestra su mano",
      "Asiento 4: LOLA19711971",
      "Asiento 1: sifilis5 (ciega grande) recaudó (0.12 €)",
      "Asiento 2: Filou203 se retiró antes del Flop (no apostó)",
      "Asiento 3: SrLyce se retiró antes del Flop (no apostó)",
      "Asiento 5: dadou13mars (botón) se retiró en el River",
      "Asiento 6: Alvii37 (ciega pequeña) se retiró antes del Flop"
    ]
  },
  "board": [
    "2d",
    "8s",
    "6c",
    "8c",
    "9d"
  ],
  "winner": "sifilis5",
  "win_amount": 6.0,
  "sb": 0.01,
  "bb": 0.02,
  "rake": 0.5,
  "raw_text": "Mano n.º 257168295117 de PokerStars:  Hold'em No Limit (0.01 €/0.02 € EUR) - 01-08-2025 11:21:29 CET [01-08-2025 5:21:29 ET]\nMesa \"Jupiter\" 6-max El asiento n.º 5 es el botón\nAsiento 4: LOLA19711971 (0.61 € en fichas) está ausente\nAsiento 1: sifilis5 (1.85 € en fichas) \nAsiento 2: Filou203 (2.20 € en fichas) \nAsiento 3: SrLyce (2.30 € en fichas) \nAsiento 5: dadou13mars (4.45 € en fichas) \nAsiento 6: Alvii37 (2.20 € en fichas) \nAlvii37: pone la ciega pequeña 0.01 €\nsifilis5: pone la ciega grande 0.02 €\n*** CARTAS DE MANO ***\nRepartidas a SrLyce [Ks 7h]\nFilou203: se retira \nSrLyce: se retira \ndadou13mars: sube 0.04 € a 0.06 €\nAlvii37: se retira \nsifilis5: iguala 0.04 €\n*** FLOP *** [2d 8s 6c]\nsifilis5: pasa \ndadou13mars: pasa \n*** TURN *** [2d 8s 6c] [8c]\nsifilis5: pasa \ndadou13mars: pasa \n*** RIVER *** [2d 8s 6c 8c] [9d]\nsifilis5: apuesta 0.09 €\ndadou13mars: se retira \nLa apuesta no igualada (0.09 €) ha sido devuelta a sifilis5\nsifilis5 se lleva 0.12 € del bote \nsifilis5: no muestra su mano \n*** RESUMEN ***\nBote total 0.13 € | Comisión 0.01 € \nComunitarias [2d 8s 6c 8c 9d]\nAsiento 4: LOLA19711971\nAsiento 1: sifilis5 (ciega grande) recaudó (0.12 €)\nAsiento 2: Filou203 se retiró antes del Flop (no apostó)\nAsiento 3: SrLyce se retiró antes del Flop (no apostó)\nAsiento 5: dadou13mars (botón) se retiró en el River\nAsiento 6: Alvii37 (ciega pequeña) se retiró antes del Flop"
}