{
  "hand_id": "257238767078",
  "date": "06-08-2025 19:27:19",
  "table": "Adelaide III",
  "game_type": "holdem",
  "hero": "SrLyce",
  "hero_position": "",
  "hero_cards": [
    "Qs",
    "6s"
  ],
  "stacks": {
    "Alceo27": 100.0,
    "aliendee07": 42.0,
    "Macklemore0": 132.0,
    "SrLyce": 150.5,
    "ismagonzalez7": 81.0,
    "McFlash3": 130.0
  },
  "actions": {
    "preflop": [
      "Asiento 1: Alceo27 (2 € en fichas)",
      "Asiento 2: aliendee07 (0.84 € en fichas)",
      "Asiento 3: Macklemore0 (2.64 € en fichas)",
      "Asiento 4: SrLyce (3.01 € en fichas)",
      "Asiento 5: ismagonzalez7 (1.62 € en fichas)",
      "Asiento 6: McFlash3 (2.60 € en fichas)",
      "aliendee07: pone la ciega pequeña 0.01 €",
      "Macklemore0: pone la ciega grande 0.02 €",
      "SrLyce: se retira",
      "ismagonzalez7: sube 0.02 € a 0.04 €",
      "McFlash3: se retira",
      "Alceo27: se retira",
      "aliendee07: sube 0.08 € a 0.12 €",
      "Macklemore0: se retira",
      "ismagonzalez7: iguala 0.08 €"
    ],
    "flop": [
      "aliendee07: pasa",
      "ismagonzalez7: pasa"
    ],
    "turn": [
      "aliendee07: pasa",
      "ismagonzalez7: pasa"
    ],
    "river": [
      "aliendee07: apuesta 0.12 €",
      "ismagonzalez7: se retira",
      "aliendee07: no muestra su mano",
      "Asiento 1: Alceo27 (botón) se retiró antes del Flop (no apostó)",
      "Asiento 2: aliendee07 (ciega pequeña) recaudó (0.24 €)",
      "Asiento 3: Macklemore0 (ciega grande) se retiró antes del Flop",
      "Asiento 4: SrLyce se retiró antes del Flop (no apostó)",
      "Asiento 5: ismagonzalez7 se retiró en el River",
      "Asiento 6: McFlash3 se retiró antes del Flop (no apostó)"
    ]
  },
  "board": [
    "Ah",
    "7s",
    "2c",
    "8c",
    "7h"
  ],
  "winner": "aliendee07",
  "win_amount": 12.0,
  "sb": 0.01,
  "bb": 0.02,
  "rake": 1.0,
  "raw_text": "Mano n.º 257238767078 de PokerStars:  Hold'em No Limit (0.01 €/0.02 € EUR) - 06-08-2025 19:27:19 CET [06-08-2025 13:27:19 ET]\nMesa \"Adelaide III\" 6-max El asiento n.º 1 es el botón\nAsiento 1: Alceo27 (2 € en fichas) \nAsiento 2: aliendee07 (0.84 € en fichas) \nAsiento 3: Macklemore0 (2.64 € en fichas) \nAsiento 4: SrLyce (3.01 € en fichas) \nAsiento 5: ismagonzalez7 (1.62 € en fichas) \nAsiento 6: McFlash3 (2.60 € en fichas) \naliendee07: pone la ciega pequeña 0.01 €\nMacklemore0: pone la ciega grande 0.02 €\n*** CARTAS DE MANO ***\nRepartidas a SrLyce [Qs 6s]\nSrLyce: se retira \nismagonzalez7: sube 0.02 € a 0.04 €\nMcFlash3: se retira \nAlceo27: se retira \naliendee07: sube 0.08 € a 0.12 €\nMacklemore0: se retira \nismagonzalez7: iguala 0.08 €\n*** FLOP *** [Ah 7s 2c]\naliendee07: pasa \nismagonzalez7: pasa \n*** TURN *** [Ah 7s 2c] [8c]\naliendee07: pasa \nismagonzalez7: pasa \n*** RIVER *** [Ah 7s 2c 8c] [7h]\naliendee07: apuesta 0.12 €\nismagonzalez7: se retira \nLa apuesta no igualada (0.12 €) ha sido devuelta a aliendee07\naliendee07 se lleva 0.24 € del bote \naliendee07: no muestra su mano \n*** RESUMEN ***\nBote total 0.26 € | Comisión 0.02 € \nComunitarias [Ah 7s 2c 8c 7h]\nAsiento 1: Alceo27 (botón) se retiró antes del Flop (no apostó)\nAsiento 2: aliendee07 (ciega pequeña) recaudó (0.24 €)\nAsiento 3: Macklemore0 (ciega grande) se retiró antes del Flop\nAsiento 4: SrLyce se retiró antes del Flop (no apostó)\nAsiento 5: ismagonzalez7 se retiró en el River\nAsiento 6: McFlash3 se retiró antes del Flop (no apostó)"
}