{
  "hand_id": "257149874677",
  "date": "30-07-2025 23:02:51",
  "table": "Gilgamesh",
  "game_type": "holdem",
  "hero": "SrLyce",
  "hero_position": "",
  "hero_cards": [
    "Qc",
    "Ad"
  ],
  "stacks": {
    "riverrrrrrmagic": 114.5,
    "SrLyce": 99.0,
    "Jumby34": 112.0,
    "Fluxy123": 110.5,
    "cbo54": 81.0,
    "Fretzo67500": 114.0
  },
  "actions": {
    "preflop": [
      "Asiento 1: riverrrrrrmagic (2.29 € en fichas)",
      "Asiento 2: SrLyce (1.98 € en fichas)",
      "Asiento 3: Jumby34 (2.24 € en fichas)",
      "Asiento 4: Fluxy123 (2.21 € en fichas)",
      "Asiento 5: cbo54 (1.62 € en fichas)",
      "Asiento 6: Fretzo67500 (2.28 € en fichas)",
      "Fretzo67500: pone la ciega pequeña 0.01 €",
      "riverrrrrrmagic: pone la ciega grande 0.02 €",
      "SrLyce: sube 0.04 € a 0.06 €",
      "Jumby34: iguala 0.06 €",
      "Fluxy123: se retira",
      "cbo54: se retira",
      "Fretzo67500: se retira",
      "riverrrrrrmagic: iguala 0.04 €"
    ],
    "flop": [
      "riverrrrrrmagic: pasa",
      "SrLyce: apuesta 0.09 €",
      "Jumby34: iguala 0.09 €",
      "riverrrrrrmagic: se retira"
    ],
    "turn": [
      "SrLyce: apuesta 0.35 €",
      "Jumby34: iguala 0.35 €"
    ],
    "river": [
      "SrLyce: apuesta 1.01 €",
      "Jumby34: se retira",
      "SrLyce: no muestra su mano",
      "Asiento 1: riverrrrrrmagic (ciega grande) se retiró en el Flop",
      "Asiento 2: SrLyce recaudó (1.01 €)",
      "Asiento 3: Jumby34 se retiró en el River",
      "Asiento 4: Fluxy123 se retiró antes del Flop (no apostó)",
      "Asiento 5: cbo54 (botón) se retiró antes del Flop (no apostó)",
      "Asiento 6: Fretzo67500 (ciega pequeña) se retiró antes del Flop"
    ]
  },
  "board": [
    "8d",
    "Qs",
    "As",
    "3d",
    "5h"
  ],
  "winner": "SrLyce",
  "win_amount": 50.5,
  "sb": 0.01,
  "bb": 0.02,
  "rake": 3.0,
  "raw_text": "Mano n.º 257149874677 de PokerStars:  Hold'em No Limit (0.01 €/0.02 € EUR) - 30-07-2025 23:02:51 CET [30-07-2025 17:02:51 ET]\nMesa \"Gilgamesh\" 6-max El asiento n.º 5 es el botón\nAsiento 1: riverrrrrrmagic (2.29 € en fichas) \nAsiento 2: SrLyce (1.98 € en fichas) \nAsiento 3: Jumby34 (2.24 € en fichas) \nAsiento 4: Fluxy123 (2.21 € en fichas) \nAsiento 5: cbo54 (1.62 € en fichas) \nAsiento 6: Fretzo67500 (2.28 € en fichas) \nFretzo67500: pone la ciega pequeña 0.01 €\nriverrrrrrmagic: pone la ciega grande 0.02 €\n*** CARTAS DE MANO ***\nRepartidas a SrLyce [Qc Ad]\nSrLyce: sube 0.04 € a 0.06 €\nJumby34: iguala 0.06 €\nFluxy123: se retira \ncbo54: se retira \nFretzo67500: se retira \nriverrrrrrmagic: iguala 0.04 €\n*** FLOP *** [8d Qs As]\nriverrrrrrmagic: pasa \nSrLyce: apuesta 0.09 €\nJumby34: iguala 0.09 €\nriverrrrrrmagic: se retira \n*** TURN *** [8d Qs As] [3d]\nSrLyce: apuesta 0.35 €\nJumby34: iguala 0.35 €\n*** RIVER *** [8d Qs As 3d] [5h]\nSrLyce: apuesta 1.01 €\nJumby34: se retira \nLa apuesta no igualada (1.01 €) ha sido devuelta a SrLyce\nSrLyce se lleva 1.01 € del bote \nSrLyce: no muestra su mano \n*** RESUMEN ***\nBote total 1.07 € | Comisión 0.06 € \nComunitarias [8d Qs As 3d 5h]\nAsiento 1: riverrrrrrmagic (ciega grande) se retiró en el Flop\nAsiento 2: SrLyce recaudó (1.01 €)\nAsiento 3: Jumby34 se retiró en el River\nAsiento 4: Fluxy123 se retiró antes del Flop (no apostó)\nAsiento 5: cbo54 (botón) se retiró antes del Flop (no apostó)\nAsiento 6: Fretzo67500 (ciega pequeña) se retiró antes del Flop"
}