{
  "hand_id": "257148966294",
  "date": "30-07-2025 21:57:20",
  "table": "Sirona",
  "game_type": "holdem",
  "hero": "SrLyce",
  "hero_position": "",
  "hero_cards": [
    "Ad",
    "Jh"
  ],
  "stacks": {
    "SrLyce": 115.5,
    "lecontrebandier": 96.5,
    "christoph363": 203.5,
    "oliverdu70": 137.0,
    "Dakoo44": 69.5
  },
  "actions": {
    "preflop": [
      "Asiento 1: SrLyce (2.31 € en fichas)",
      "Asiento 2: lecontrebandier (1.93 € en fichas)",
      "Asiento 3: christoph363 (4.07 € en fichas)",
      "Asiento 4: oliverdu70 (2.74 € en fichas)",
      "Asiento 6: Dakoo44 (1.39 € en fichas)",
      "Dakoo44: pone la ciega pequeña 0.01 €",
      "SrLyce: pone la ciega grande 0.02 €",
      "lecontrebandier: se retira",
      "christoph363: se retira",
      "oliverdu70: se retira",
      "Dakoo44: se retira",
      "SrLyce: no muestra su mano",
      "Asiento 1: SrLyce (ciega grande) recaudó (0.02 €)",
      "Asiento 2: lecontrebandier se retiró antes del Flop (no apostó)",
      "Asiento 3: christoph363 se retiró antes del Flop (no apostó)",
      "Asiento 4: oliverdu70 (botón) se retiró antes del Flop (no apostó)",
      "Asiento 6: Dakoo44 (ciega pequeña) se retiró antes del Flop"
    ],
    "flop": [],
    "turn": [],
    "river": []
  },
  "board": [],
  "winner": "SrLyce",
  "win_amount": 1.0,
  "sb": 0.01,
  "bb": 0.02,
  "rake": 0.0,
  "raw_text": "Mano n.º 257148966294 de PokerStars:  Hold'em No Limit (0.01 €/0.02 € EUR) - 30-07-2025 21:57:20 CET [30-07-2025 15:57:20 ET]\nMesa \"Sirona\" 6-max El asiento n.º 4 es el botón\nAsiento 1: SrLyce (2.31 € en fichas) \nAsiento 2: lecontrebandier (1.93 € en fichas) \nAsiento 3: christoph363 (4.07 € en fichas) \nAsiento 4: oliverdu70 (2.74 € en fichas) \nAsiento 6: Dakoo44 (1.39 € en fichas) \nDakoo44: pone la ciega pequeña 0.01 €\nSrLyce: pone la ciega grande 0.02 €\n*** CARTAS DE MANO ***\nRepartidas a SrLyce [Ad Jh]\nlecontrebandier: se retira \nchristoph363: se retira \noliverdu70: se retira \nDakoo44: se retira \nLa apuesta no igualada (0.01 €) ha sido devuelta a SrLyce\nSrLyce se lleva 0.02 € del bote \nSrLyce: no muestra su mano \n*** RESUMEN ***\nBote total 0.02 € | Comisión 0 € \nAsiento 1: SrLyce (ciega grande) recaudó (0.02 €)\nAsiento 2: lecontrebandier se retiró antes del Flop (no apostó)\nAsiento 3: christoph363 se retiró antes del Flop (no apostó)\nAsiento 4: oliverdu70 (botón) se retiró antes del Flop (no apostó)\nAsiento 6: Dakoo44 (ciega pequeña) se retiró antes del Flop"
}