{
  "hand_id": "257168248444",
  "date": "01-08-2025 11:12:24",
  "table": "Sekanina",
  "game_type": "holdem",
  "hero": "SrLyce",
  "hero_position": "",
  "hero_cards": [
    "8h",
    "2s"
  ],
  "stacks": {
    "DagonBZH56": 79.0,
    "practikal_C23": 97.0,
    "Alvii37": 104.0,
    "SrLyce": 161.5,
    "davinci1962": 110.5,
    "Elministrelas": 97.5
  },
  "actions": {
    "preflop": [
      "Asiento 1: DagonBZH56 (1.58 € en fichas)",
      "Asiento 2: practikal_C23 (1.94 € en fichas)",
      "Asiento 3: Alvii37 (2.08 € en fichas)",
      "Asiento 4: SrLyce (3.23 € en fichas)",
      "Asiento 5: davinci1962 (2.21 € en fichas)",
      "Asiento 6: Elministrelas (1.95 € en fichas)",
      "DagonBZH56: pone la ciega pequeña 0.01 €",
      "practikal_C23: pone la ciega grande 0.02 €",
      "Alvii37: se retira",
      "SrLyce: se retira",
      "davinci1962: se retira",
      "Elministrelas: se retira",
      "DagonBZH56: se retira",
      "Asiento 1: DagonBZH56 (ciega pequeña) se retiró antes del Flop",
      "Asiento 2: practikal_C23 (ciega grande) recaudó (0.02 €)",
      "Asiento 3: Alvii37 se retiró antes del Flop (no apostó)",
      "Asiento 4: SrLyce se retiró antes del Flop (no apostó)",
      "Asiento 5: davinci1962 se retiró antes del Flop (no apostó)",
      "Asiento 6: Elministrelas (botón) se retiró antes del Flop (no apostó)"
    ],
    "flop": [],
    "turn": [],
    "river": []
  },
  "board": [],
  "winner": "practikal_C23",
  "win_amount": 1.0,
  "sb": 0.01,
  "bb": 0.02,
  "rake": 0.0,
  "raw_text": "Mano n.º 257168248444 de PokerStars:  Hold'em No Limit (0.01 €/0.02 € EUR) - 01-08-2025 11:12:24 CET [01-08-2025 5:12:24 ET]\nMesa \"Sekanina\" 6-max El asiento n.º 6 es el botón\nAsiento 1: DagonBZH56 (1.58 € en fichas) \nAsiento 2: practikal_C23 (1.94 € en fichas) \nAsiento 3: Alvii37 (2.08 € en fichas) \nAsiento 4: SrLyce (3.23 € en fichas) \nAsiento 5: davinci1962 (2.21 € en fichas) \nAsiento 6: Elministrelas (1.95 € en fichas) \nDagonBZH56: pone la ciega pequeña 0.01 €\npractikal_C23: pone la ciega grande 0.02 €\n*** CARTAS DE MANO ***\nRepartidas a SrLyce [8h 2s]\nAlvii37: se retira \nSrLyce: se retira \ndavinci1962: se retira \nElministrelas: se retira \nDagonBZH56: se retira \nLa apuesta no igualada (0.01 €) ha sido devuelta a practikal_C23\npractikal_C23 se lleva 0.02 € del bote \n*** RESUMEN ***\nBote total 0.02 € | Comisión 0 € \nAsiento 1: DagonBZH56 (ciega pequeña) se retiró antes del Flop\nAsiento 2: practikal_C23 (ciega grande) recaudó (0.02 €)\nAsiento 3: Alvii37 se retiró antes del Flop (no apostó)\nAsiento 4: SrLyce se retiró antes del Flop (no apostó)\nAsiento 5: davinci1962 se retiró antes del Flop (no apostó)\nAsiento 6: Elministrelas (botón) se retiró antes del Flop (no apostó)"
}