{
  "hand_id": "257149907496",
  "date": "30-07-2025 23:05:05",
  "table": "Lobelia",
  "game_type": "holdem",
  "hero": "SrLyce",
  "hero_position": "",
  "hero_cards": [
    "4d",
    "2s"
  ],
  "stacks": {
    "LeVbks": 91.5,
    "fcis666": 57.5,
    "Dlaguancha": 63.0,
    "SrLyce": 117.5,
    "riverluck444": 73.5,
    "Kiffou39": 54.5
  },
  "actions": {
    "preflop": [
      "Asiento 1: LeVbks (1.83 € en fichas)",
      "Asiento 2: fcis666 (1.15 € en fichas)",
      "Asiento 3: Dlaguancha (1.26 € en fichas)",
      "Asiento 4: SrLyce (2.35 € en fichas)",
      "Asiento 5: riverluck444 (1.47 € en fichas)",
      "Asiento 6: Kiffou39 (1.09 € en fichas)",
      "fcis666: pone la ciega pequeña 0.01 €",
      "Dlaguancha: pone la ciega grande 0.02 €",
      "SrLyce: se retira",
      "riverluck444: se retira",
      "Kiffou39: sube 0.02 € a 0.04 €",
      "LeVbks: se retira",
      "fcis666: se retira",
      "Dlaguancha: iguala 0.02 €"
    ],
    "flop": [
      "Dlaguancha: pasa",
      "Kiffou39: apuesta 0.04 €",
      "Dlaguancha: se retira",
      "Kiffou39: no muestra su mano",
      "Asiento 1: LeVbks (botón) se retiró antes del Flop (no apostó)",
      "Asiento 2: fcis666 (ciega pequeña) se retiró antes del Flop",
      "Asiento 3: Dlaguancha (ciega grande) se retiró en el Flop",
      "Asiento 4: SrLyce se retiró antes del Flop (no apostó)",
      "Asiento 5: riverluck444 se retiró antes del Flop (no apostó)",
      "Asiento 6: Kiffou39 recaudó (0.08 €)"
    ],
    "turn": [],
    "river": []
  },
  "board": [
    "4h",
    "9d",
    "8c"
  ],
  "winner": "Kiffou39",
  "win_amount": 4.0,
  "sb": 0.01,
  "bb": 0.02,
  "rake": 0.5,
  "raw_text": "Mano n.º 257149907496 de PokerStars:  Hold'em No Limit (0.01 €/0.02 € EUR) - 30-07-2025 23:05:05 CET [30-07-2025 17:05:05 ET]\nMesa \"Lobelia\" 6-max El asiento n.º 1 es el botón\nAsiento 1: LeVbks (1.83 € en fichas) \nAsiento 2: fcis666 (1.15 € en fichas) \nAsiento 3: Dlaguancha (1.26 € en fichas) \nAsiento 4: SrLyce (2.35 € en fichas) \nAsiento 5: riverluck444 (1.47 € en fichas) \nAsiento 6: Kiffou39 (1.09 € en fichas) \nfcis666: pone la ciega pequeña 0.01 €\nDlaguancha: pone la ciega grande 0.02 €\n*** CARTAS DE MANO ***\nRepartidas a SrLyce [4d 2s]\nSrLyce: se retira \nriverluck444: se retira \nKiffou39: sube 0.02 € a 0.04 €\nLeVbks: se retira \nfcis666: se retira \nDlaguancha: iguala 0.02 €\n*** FLOP *** [4h 9d 8c]\nDlaguancha: pasa \nKiffou39: apuesta 0.04 €\nDlaguancha: se retira \nLa apuesta no igualada (0.04 €) ha sido devuelta a Kiffou39\nKiffou39 se lleva 0.08 € del bote \nKiffou39: no muestra su mano \n*** RESUMEN ***\nBote total 0.09 € | Comisión 0.01 € \nComunitarias [4h 9d 8c]\nAsiento 1: LeVbks (botón) se retiró antes del Flop (no apostó)\nAsiento 2: fcis666 (ciega pequeña) se retiró antes del Flop\nAsiento 3: Dlaguancha (ciega grande) se retiró en el Flop\nAsiento 4: SrLyce se retiró antes del Flop (no apostó)\nAsiento 5: riverluck444 se retiró antes del Flop (no apostó)\nAsiento 6: Kiffou39 recaudó (0.08 €)"
}