{
  "hand_id": "257150530975",
  "date": "30-07-2025 23:48:35",
  "table": "Mizuho",
  "game_type": "holdem",
  "hero": "SrLyce",
  "hero_position": "",
  "hero_cards": [
    "4s",
    "3s"
  ],
  "stacks": {
    "benipoker123": 129.0,
    "SrLyce": 94.5,
    "JstLeonel": 115.0,
    "Ozzy3110": 297.5,
    "toonsy2010": 93.0,
    "mivipkr": 165.5
  },
  "actions": {
    "preflop": [
      "Asiento 1: benipoker123 (2.58 € en fichas)",
      "Asiento 2: SrLyce (1.89 € en fichas)",
      "Asiento 3: JstLeonel (2.30 € en fichas)",
      "Asiento 4: Ozzy3110 (5.95 € en fichas)",
      "Asiento 5: toonsy2010 (1.86 € en fichas)",
      "Asiento 6: mivipkr (3.31 € en fichas)",
      "mivipkr: pone la ciega pequeña 0.01 €",
      "benipoker123: pone la ciega grande 0.02 €",
      "SrLyce: sube 0.04 € a 0.06 €",
      "JstLeonel: se retira",
      "Ozzy3110: sube 0.08 € a 0.14 €",
      "toonsy2010: se retira",
      "mivipkr: sube 0.28 € a 0.42 €",
      "benipoker123: sube 2.16 € a 2.58 € y está all-in",
      "SrLyce: iguala 1.83 € y está all-in",
      "Ozzy3110: se retira",
      "mivipkr: iguala 2.16 €"
    ],
    "flop": [],
    "turn": [],
    "river": [
      "mivipkr: muestra [Qd Qs] (doble pareja, damas y nueves)",
      "benipoker123: muestra [Kc Ad] (doble pareja, nueves y cuatros)",
      "SrLyce: muestra [4s 3s] (full de cuatros y nueves)",
      "Asiento 1: benipoker123 (ciega grande) muestra [Kc Ad] y perdió con doble pareja, nueves y cuatros",
      "Asiento 2: SrLyce muestra [4s 3s] y ganó (5.56 €) con full de cuatros y nueves",
      "Asiento 3: JstLeonel se retiró antes del Flop (no apostó)",
      "Asiento 4: Ozzy3110 se retiró antes del Flop",
      "Asiento 5: toonsy2010 (botón) se retiró antes del Flop (no apostó)",
      "Asiento 6: mivipkr (ciega pequeña) muestra [Qd Qs] y ganó (1.38 €) con doble pareja, damas y nueves"
    ]
  },
  "board": [
    "9h",
    "4h",
    "4d",
    "9c",
    "Ts"
  ],
  "winner": "mivipkr",
  "win_amount": 69.0,
  "sb": 0.01,
  "bb": 0.02,
  "rake": 12.5,
  "raw_text": "Mano n.º 257150530975 de PokerStars:  Hold'em No Limit (0.01 €/0.02 € EUR) - 30-07-2025 23:48:35 CET [30-07-2025 17:48:35 ET]\nMesa \"Mizuho\" 6-max El asiento n.º 5 es el botón\nAsiento 1: benipoker123 (2.58 € en fichas) \nAsiento 2: SrLyce (1.89 € en fichas) \nAsiento 3: JstLeonel (2.30 € en fichas) \nAsiento 4: Ozzy3110 (5.95 € en fichas) \nAsiento 5: toonsy2010 (1.86 € en fichas) \nAsiento 6: mivipkr (3.31 € en fichas) \nmivipkr: pone la ciega pequeña 0.01 €\nbenipoker123: pone la ciega grande 0.02 €\n*** CARTAS DE MANO ***\nRepartidas a SrLyce [4s 3s]\nSrLyce: sube 0.04 € a 0.06 €\nJstLeonel: se retira \nOzzy3110: sube 0.08 € a 0.14 €\ntoonsy2010: se retira \nmivipkr: sube 0.28 € a 0.42 €\nbenipoker123: sube 2.16 € a 2.58 € y está all-in\nSrLyce: iguala 1.83 € y está all-in\nOzzy3110: se retira \nmivipkr: iguala 2.16 €\n*** FLOP *** [9h 4h 4d]\n*** TURN *** [9h 4h 4d] [9c]\n*** RIVER *** [9h 4h 4d 9c] [Ts]\n*** SHOW DOWN ***\nmivipkr: muestra [Qd Qs] (doble pareja, damas y nueves)\nbenipoker123: muestra [Kc Ad] (doble pareja, nueves y cuatros)\nmivipkr se lleva 1.38 € del bote  secundario\nSrLyce: muestra [4s 3s] (full de cuatros y nueves)\nSrLyce se lleva 5.56 € del bote  principal\n*** RESUMEN ***\nBote total 7.19 € Bote principal 5.56 €. Bote secundario 1.38 €. | Comisión 0.25 € \nComunitarias [9h 4h 4d 9c Ts]\nAsiento 1: benipoker123 (ciega grande) muestra [Kc Ad] y perdió con doble pareja, nueves y cuatros\nAsiento 2: SrLyce muestra [4s 3s] y ganó (5.56 €) con full de cuatros y nueves\nAsiento 3: JstLeonel se retiró antes del Flop (no apostó)\nAsiento 4: Ozzy3110 se retiró antes del Flop\nAsiento 5: toonsy2010 (botón) se retiró antes del Flop (no apostó)\nAsiento 6: mivipkr (ciega pequeña) muestra [Qd Qs] y ganó (1.38 €) con doble pareja, damas y nueves"
}