{
  "hand_id": "257168374578",
  "date": "01-08-2025 11:36:12",
  "table": "Atlas",
  "game_type": "holdem",
  "hero": "SrLyce",
  "hero_position": "",
  "hero_cards": [
    "5s",
    "4c"
  ],
  "stacks": {
    "SrLyce": 108.5,
    "Fharock": 111.0,
    "ecuinas": 91.0,
    "LxckxStrxkx": 110.0,
    "soy_cule74": 99.0,
    "Akourdideh": 108.0
  },
  "actions": {
    "preflop": [
      "Asiento 1: SrLyce (2.17 € en fichas)",
      "Asiento 2: Fharock (2.22 € en fichas)",
      "Asiento 3: ecuinas (1.82 € en fichas)",
      "Asiento 4: LxckxStrxkx (2.20 € en fichas)",
      "Asiento 5: soy_cule74 (1.98 € en fichas)",
      "Asiento 6: Akourdideh (2.16 € en fichas)",
      "soy_cule74: pone la ciega pequeña 0.01 €",
      "Akourdideh: pone la ciega grande 0.02 €",
      "SrLyce: se retira",
      "Fharock: se retira",
      "ecuinas: se retira",
      "LxckxStrxkx: se retira",
      "soy_cule74: sube 0.04 € a 0.06 €",
      "Akourdideh: se retira",
      "soy_cule74: no muestra su mano",
      "Asiento 1: SrLyce se retiró antes del Flop (no apostó)",
      "Asiento 2: Fharock se retiró antes del Flop (no apostó)",
      "Asiento 3: ecuinas se retiró antes del Flop (no apostó)",
      "Asiento 4: LxckxStrxkx (botón) se retiró antes del Flop (no apostó)",
      "Asiento 5: soy_cule74 (ciega pequeña) recaudó (0.04 €)",
      "Asiento 6: Akourdideh (ciega grande) se retiró antes del Flop"
    ],
    "flop": [],
    "turn": [],
    "river": []
  },
  "board": [],
  "winner": "soy_cule74",
  "win_amount": 2.0,
  "sb": 0.01,
  "bb": 0.02,
  "rake": 0.0,
  "raw_text": "Mano n.º 257168374578 de PokerStars:  Hold'em No Limit (0.01 €/0.02 € EUR) - 01-08-2025 11:36:12 CET [01-08-2025 5:36:12 ET]\nMesa \"Atlas\" 6-max El asiento n.º 4 es el botón\nAsiento 1: SrLyce (2.17 € en fichas) \nAsiento 2: Fharock (2.22 € en fichas) \nAsiento 3: ecuinas (1.82 € en fichas) \nAsiento 4: LxckxStrxkx (2.20 € en fichas) \nAsiento 5: soy_cule74 (1.98 € en fichas) \nAsiento 6: Akourdideh (2.16 € en fichas) \nsoy_cule74: pone la ciega pequeña 0.01 €\nAkourdideh: pone la ciega grande 0.02 €\n*** CARTAS DE MANO ***\nRepartidas a SrLyce [5s 4c]\nSrLyce: se retira \nFharock: se retira \necuinas: se retira \nLxckxStrxkx: se retira \nsoy_cule74: sube 0.04 € a 0.06 €\nAkourdideh: se retira \nLa apuesta no igualada (0.04 €) ha sido devuelta a soy_cule74\nsoy_cule74 se lleva 0.04 € del bote \nsoy_cule74: no muestra su mano \n*** RESUMEN ***\nBote total 0.04 € | Comisión 0 € \nAsiento 1: SrLyce se retiró antes del Flop (no apostó)\nAsiento 2: Fharock se retiró antes del Flop (no apostó)\nAsiento 3: ecuinas se retiró antes del Flop (no apostó)\nAsiento 4: LxckxStrxkx (botón) se retiró antes del Flop (no apostó)\nAsiento 5: soy_cule74 (ciega pequeña) recaudó (0.04 €)\nAsiento 6: Akourdideh (ciega grande) se retiró antes del Flop"
}