{
  "hand_id": "257237805303",
  "date": "06-08-2025 18:00:55",
  "table": "Euneus III",
  "game_type": "holdem",
  "hero": "SrLyce",
  "hero_position": "",
  "hero_cards": [
    "3d",
    "6c"
  ],
  "stacks": {
    "DeMula62": 103.5,
    "Il_BM00": 105.5,
    "djrojas9": 140.0,
    "SrLyce": 122.0
  },
  "actions": {
    "preflop": [
      "Asiento 1: DeMula62 (2.07 € en fichas)",
      "Asiento 2: Il_BM00 (2.11 € en fichas)",
      "Asiento 3: djrojas9 (2.80 € en fichas)",
      "Asiento 5: SrLyce (2.44 € en fichas)",
      "Il_BM00: pone la ciega pequeña 0.01 €",
      "djrojas9: pone la ciega grande 0.02 €",
      "SrLyce: se retira",
      "DeMula62: se retira",
      "Il_BM00: sube 0.04 € a 0.06 €",
      "djrojas9: se retira",
      "Il_BM00: no muestra su mano",
      "Asiento 1: DeMula62 (botón) se retiró antes del Flop (no apostó)",
      "Asiento 2: Il_BM00 (ciega pequeña) recaudó (0.04 €)",
      "Asiento 3: djrojas9 (ciega grande) se retiró antes del Flop",
      "Asiento 5: SrLyce se retiró antes del Flop (no apostó)"
    ],
    "flop": [],
    "turn": [],
    "river": []
  },
  "board": [],
  "winner": "Il_BM00",
  "win_amount": 2.0,
  "sb": 0.01,
  "bb": 0.02,
  "rake": 0.0,
  "raw_text": "Mano n.º 257237805303 de PokerStars:  Hold'em No Limit (0.01 €/0.02 € EUR) - 06-08-2025 18:00:55 CET [06-08-2025 12:00:55 ET]\nMesa \"Euneus III\" 6-max El asiento n.º 1 es el botón\nAsiento 1: DeMula62 (2.07 € en fichas) \nAsiento 2: Il_BM00 (2.11 € en fichas) \nAsiento 3: djrojas9 (2.80 € en fichas) \nAsiento 5: SrLyce (2.44 € en fichas) \nIl_BM00: pone la ciega pequeña 0.01 €\ndjrojas9: pone la ciega grande 0.02 €\n*** CARTAS DE MANO ***\nRepartidas a SrLyce [3d 6c]\nSrLyce: se retira \nDeMula62: se retira \nIl_BM00: sube 0.04 € a 0.06 €\ndjrojas9: se retira \nLa apuesta no igualada (0.04 €) ha sido devuelta a Il_BM00\nIl_BM00 se lleva 0.04 € del bote \nIl_BM00: no muestra su mano \n*** RESUMEN ***\nBote total 0.04 € | Comisión 0 € \nAsiento 1: DeMula62 (botón) se retiró antes del Flop (no apostó)\nAsiento 2: Il_BM00 (ciega pequeña) recaudó (0.04 €)\nAsiento 3: djrojas9 (ciega grande) se retiró antes del Flop\nAsiento 5: SrLyce se retiró antes del Flop (no apostó)"
}