{
  "hand_id": "257237954153",
  "date": "06-08-2025 18:15:01",
  "table": "Euneus III",
  "game_type": "holdem",
  "hero": "SrLyce",
  "hero_position": "",
  "hero_cards": [
    "8s",
    "Ts"
  ],
  "stacks": {
    "christgear": 100.0,
    "Il_BM00": 128.0,
    "djrojas9": 140.0,
    "lol-in 2000": 100.0,
    "SrLyce": 118.5,
    "kcg_rm": 110.5
  },
  "actions": {
    "preflop": [
      "Asiento 1: christgear (2 € en fichas)",
      "Asiento 2: Il_BM00 (2.56 € en fichas)",
      "Asiento 3: djrojas9 (2.80 € en fichas)",
      "Asiento 4: lol-in 2000 (2 € en fichas)",
      "Asiento 5: SrLyce (2.37 € en fichas)",
      "Asiento 6: kcg_rm (2.21 € en fichas)",
      "djrojas9: pone la ciega pequeña 0.01 €",
      "lol-in 2000: pone la ciega grande 0.02 €",
      "SrLyce: sube 0.03 € a 0.05 €",
      "kcg_rm: se retira",
      "christgear: se retira",
      "Il_BM00: se retira",
      "djrojas9: iguala 0.04 €",
      "lol-in 2000: se retira"
    ],
    "flop": [
      "djrojas9: pasa",
      "SrLyce: pasa"
    ],
    "turn": [
      "djrojas9: pasa",
      "SrLyce: apuesta 0.06 €",
      "djrojas9: se retira",
      "SrLyce: no muestra su mano",
      "Asiento 1: christgear se retiró antes del Flop (no apostó)",
      "Asiento 2: Il_BM00 (botón) se retiró antes del Flop (no apostó)",
      "Asiento 3: djrojas9 (ciega pequeña) se retiró en el Turn",
      "Asiento 4: lol-in 2000 (ciega grande) se retiró antes del Flop",
      "Asiento 5: SrLyce recaudó (0.11 €)",
      "Asiento 6: kcg_rm se retiró antes del Flop (no apostó)"
    ],
    "river": []
  },
  "board": [
    "Ad",
    "9s",
    "4h",
    "Td"
  ],
  "winner": "SrLyce",
  "win_amount": 5.5,
  "sb": 0.01,
  "bb": 0.02,
  "rake": 0.5,
  "raw_text": "Mano n.º 257237954153 de PokerStars:  Hold'em No Limit (0.01 €/0.02 € EUR) - 06-08-2025 18:15:01 CET [06-08-2025 12:15:01 ET]\nMesa \"Euneus III\" 6-max El asiento n.º 2 es el botón\nAsiento 1: christgear (2 € en fichas) \nAsiento 2: Il_BM00 (2.56 € en fichas) \nAsiento 3: djrojas9 (2.80 € en fichas) \nAsiento 4: lol-in 2000 (2 € en fichas) \nAsiento 5: SrLyce (2.37 € en fichas) \nAsiento 6: kcg_rm (2.21 € en fichas) \ndjrojas9: pone la ciega pequeña 0.01 €\nlol-in 2000: pone la ciega grande 0.02 €\n*** CARTAS DE MANO ***\nRepartidas a SrLyce [8s Ts]\nSrLyce: sube 0.03 € a 0.05 €\nkcg_rm: se retira \nchristgear: se retira \nIl_BM00: se retira \ndjrojas9: iguala 0.04 €\nlol-in 2000: se retira \n*** FLOP *** [Ad 9s 4h]\ndjrojas9: pasa \nSrLyce: pasa \n*** TURN *** [Ad 9s 4h] [Td]\ndjrojas9: pasa \nSrLyce: apuesta 0.06 €\ndjrojas9: se retira \nLa apuesta no igualada (0.06 €) ha sido devuelta a SrLyce\nSrLyce se lleva 0.11 € del bote \nSrLyce: no muestra su mano \n*** RESUMEN ***\nBote total 0.12 € | Comisión 0.01 € \nComunitarias [Ad 9s 4h Td]\nAsiento 1: christgear se retiró antes del Flop (no apostó)\nAsiento 2: Il_BM00 (botón) se retiró antes del Flop (no apostó)\nAsiento 3: djrojas9 (ciega pequeña) se retiró en el Turn\nAsiento 4: lol-in 2000 (ciega grande) se retiró antes del Flop\nAsiento 5: SrLyce recaudó (0.11 €)\nAsiento 6: kcg_rm se retiró antes del Flop (no apostó)"
}