{
  "hand_id": "257150001268",
  "date": "30-07-2025 23:11:30",
  "table": "Gilgamesh",
  "game_type": "holdem",
  "hero": "SrLyce",
  "hero_position": "",
  "hero_cards": [
    "7s",
    "5s"
  ],
  "stacks": {
    "riverrrrrrmagic": 109.0,
    "SrLyce": 111.5,
    "Jumby34": 100.0,
    "xapkk": 104.0,
    "Fretzo67500": 108.0
  },
  "actions": {
    "preflop": [
      "Asiento 1: riverrrrrrmagic (2.18 € en fichas)",
      "Asiento 2: SrLyce (2.23 € en fichas)",
      "Asiento 3: Jumby34 (2 € en fichas)",
      "Asiento 4: xapkk (2.08 € en fichas)",
      "Asiento 6: Fretzo67500 (2.16 € en fichas)",
      "riverrrrrrmagic: pone la ciega pequeña 0.01 €",
      "SrLyce: pone la ciega grande 0.02 €",
      "Jumby34: se retira",
      "xapkk: se retira",
      "Fretzo67500: sube 0.02 € a 0.04 €",
      "riverrrrrrmagic: iguala 0.03 €",
      "SrLyce: iguala 0.02 €"
    ],
    "flop": [
      "riverrrrrrmagic: pasa",
      "SrLyce: pasa",
      "Fretzo67500: pasa"
    ],
    "turn": [
      "riverrrrrrmagic: apuesta 0.02 €",
      "SrLyce: se retira",
      "Fretzo67500: se retira",
      "Asiento 1: riverrrrrrmagic (ciega pequeña) recaudó (0.11 €)",
      "Asiento 2: SrLyce (ciega grande) se retiró en el Turn",
      "Asiento 3: Jumby34 se retiró antes del Flop (no apostó)",
      "Asiento 4: xapkk se retiró antes del Flop (no apostó)",
      "Asiento 6: Fretzo67500 (botón) se retiró en el Turn"
    ],
    "river": []
  },
  "board": [
    "9d",
    "9s",
    "Ah",
    "4d"
  ],
  "winner": "riverrrrrrmagic",
  "win_amount": 5.5,
  "sb": 0.01,
  "bb": 0.02,
  "rake": 0.5,
  "raw_text": "Mano n.º 257150001268 de PokerStars:  Hold'em No Limit (0.01 €/0.02 € EUR) - 30-07-2025 23:11:30 CET [30-07-2025 17:11:30 ET]\nMesa \"Gilgamesh\" 6-max El asiento n.º 6 es el botón\nAsiento 1: riverrrrrrmagic (2.18 € en fichas) \nAsiento 2: SrLyce (2.23 € en fichas) \nAsiento 3: Jumby34 (2 € en fichas) \nAsiento 4: xapkk (2.08 € en fichas) \nAsiento 6: Fretzo67500 (2.16 € en fichas) \nriverrrrrrmagic: pone la ciega pequeña 0.01 €\nSrLyce: pone la ciega grande 0.02 €\n*** CARTAS DE MANO ***\nRepartidas a SrLyce [7s 5s]\nJumby34: se retira \nxapkk: se retira \nFretzo67500: sube 0.02 € a 0.04 €\nriverrrrrrmagic: iguala 0.03 €\nSrLyce: iguala 0.02 €\n*** FLOP *** [9d 9s Ah]\nriverrrrrrmagic: pasa \nSrLyce: pasa \nFretzo67500: pasa \n*** TURN *** [9d 9s Ah] [4d]\nriverrrrrrmagic: apuesta 0.02 €\nSrLyce: se retira \nFretzo67500: se retira \nLa apuesta no igualada (0.02 €) ha sido devuelta a riverrrrrrmagic\nriverrrrrrmagic se lleva 0.11 € del bote \n*** RESUMEN ***\nBote total 0.12 € | Comisión 0.01 € \nComunitarias [9d 9s Ah 4d]\nAsiento 1: riverrrrrrmagic (ciega pequeña) recaudó (0.11 €)\nAsiento 2: SrLyce (ciega grande) se retiró en el Turn\nAsiento 3: Jumby34 se retiró antes del Flop (no apostó)\nAsiento 4: xapkk se retiró antes del Flop (no apostó)\nAsiento 6: Fretzo67500 (botón) se retiró en el Turn"
}