{
  "hand_id": "257148706782",
  "date": "30-07-2025 21:38:19",
  "table": "Esclangona",
  "game_type": "holdem",
  "hero": "SrLyce",
  "hero_position": "",
  "hero_cards": [
    "5h",
    "7h"
  ],
  "stacks": {
    "gabriella657": 285.0,
    "Zorgue1080": 95.0,
    "SrLyce": 137.0,
    "Davdgoni": 122.0,
    "DiaZzZ1": 115.5,
    "berlcht403": 29.0
  },
  "actions": {
    "preflop": [
      "Asiento 3: gabriella657 (5.70 € en fichas) está ausente",
      "Asiento 1: Zorgue1080 (1.90 € en fichas)",
      "Asiento 2: SrLyce (2.74 € en fichas)",
      "Asiento 4: Davdgoni (2.44 € en fichas)",
      "Asiento 5: DiaZzZ1 (2.31 € en fichas)",
      "Asiento 6: berlcht403 (0.58 € en fichas)",
      "SrLyce: pone la ciega pequeña 0.01 €",
      "Davdgoni: pone la ciega grande 0.02 €",
      "DiaZzZ1: se retira",
      "berlcht403: iguala 0.02 €",
      "Zorgue1080: se retira",
      "SrLyce: iguala 0.01 €",
      "Davdgoni: pasa"
    ],
    "flop": [
      "SrLyce: pasa",
      "Davdgoni: pasa",
      "berlcht403: apuesta 0.06 €",
      "SrLyce: se retira",
      "Davdgoni: iguala 0.06 €"
    ],
    "turn": [
      "Davdgoni: pasa",
      "berlcht403: apuesta 0.09 €",
      "Davdgoni: se retira",
      "Asiento 3: gabriella657",
      "Asiento 1: Zorgue1080 (botón) se retiró antes del Flop (no apostó)",
      "Asiento 2: SrLyce (ciega pequeña) se retiró en el Flop",
      "Asiento 4: Davdgoni (ciega grande) se retiró en el Turn",
      "Asiento 5: DiaZzZ1 se retiró antes del Flop (no apostó)",
      "Asiento 6: berlcht403 recaudó (0.17 €)"
    ],
    "river": []
  },
  "board": [
    "5s",
    "Ac",
    "Tc",
    "Kh"
  ],
  "winner": "berlcht403",
  "win_amount": 8.5,
  "sb": 0.01,
  "bb": 0.02,
  "rake": 0.5,
  "raw_text": "Mano n.º 257148706782 de PokerStars:  Hold'em No Limit (0.01 €/0.02 € EUR) - 30-07-2025 21:38:19 CET [30-07-2025 15:38:19 ET]\nMesa \"Esclangona\" 6-max El asiento n.º 1 es el botón\nAsiento 3: gabriella657 (5.70 € en fichas) está ausente\nAsiento 1: Zorgue1080 (1.90 € en fichas) \nAsiento 2: SrLyce (2.74 € en fichas) \nAsiento 4: Davdgoni (2.44 € en fichas) \nAsiento 5: DiaZzZ1 (2.31 € en fichas) \nAsiento 6: berlcht403 (0.58 € en fichas) \nSrLyce: pone la ciega pequeña 0.01 €\nDavdgoni: pone la ciega grande 0.02 €\n*** CARTAS DE MANO ***\nRepartidas a SrLyce [5h 7h]\nDiaZzZ1: se retira \nberlcht403: iguala 0.02 €\nZorgue1080: se retira \nSrLyce: iguala 0.01 €\nDavdgoni: pasa \n*** FLOP *** [5s Ac Tc]\nSrLyce: pasa \nDavdgoni: pasa \nberlcht403: apuesta 0.06 €\nSrLyce: se retira \nDavdgoni: iguala 0.06 €\n*** TURN *** [5s Ac Tc] [Kh]\nDavdgoni: pasa \nberlcht403: apuesta 0.09 €\nDavdgoni: se retira \nLa apuesta no igualada (0.09 €) ha sido devuelta a berlcht403\nberlcht403 se lleva 0.17 € del bote \ngabriella657 deja la mesa\n*** RESUMEN ***\nBote total 0.18 € | Comisión 0.01 € \nComunitarias [5s Ac Tc Kh]\nAsiento 3: gabriella657\nAsiento 1: Zorgue1080 (botón) se retiró antes del Flop (no apostó)\nAsiento 2: SrLyce (ciega pequeña) se retiró en el Flop\nAsiento 4: Davdgoni (ciega grande) se retiró en el Turn\nAsiento 5: DiaZzZ1 se retiró antes del Flop (no apostó)\nAsiento 6: berlcht403 recaudó (0.17 €)"
}