{
  "hand_id": "257168260527",
  "date": "01-08-2025 11:14:49",
  "table": "Atlas",
  "game_type": "holdem",
  "hero": "SrLyce",
  "hero_position": "",
  "hero_cards": [
    "2h",
    "Qs"
  ],
  "stacks": {
    "SrLyce": 97.5,
    "Fharock": 92.5,
    "ecuinas": 100.0,
    "Akourdideh": 109.0
  },
  "actions": {
    "preflop": [
      "Asiento 1: SrLyce (1.95 € en fichas)",
      "Asiento 2: Fharock (1.85 € en fichas)",
      "Asiento 3: ecuinas (2 € en fichas)",
      "Asiento 6: Akourdideh (2.18 € en fichas)",
      "Fharock: pone la ciega pequeña 0.01 €",
      "ecuinas: pone la ciega grande 0.02 €",
      "Akourdideh: sube 0.04 € a 0.06 €",
      "SrLyce: se retira",
      "Fharock: se retira",
      "ecuinas: se retira",
      "Asiento 1: SrLyce (botón) se retiró antes del Flop (no apostó)",
      "Asiento 2: Fharock (ciega pequeña) se retiró antes del Flop",
      "Asiento 3: ecuinas (ciega grande) se retiró antes del Flop",
      "Asiento 6: Akourdideh recaudó (0.05 €)"
    ],
    "flop": [],
    "turn": [],
    "river": []
  },
  "board": [],
  "winner": "Akourdideh",
  "win_amount": 2.5,
  "sb": 0.01,
  "bb": 0.02,
  "rake": 0.0,
  "raw_text": "Mano n.º 257168260527 de PokerStars:  Hold'em No Limit (0.01 €/0.02 € EUR) - 01-08-2025 11:14:49 CET [01-08-2025 5:14:49 ET]\nMesa \"Atlas\" 6-max El asiento n.º 1 es el botón\nAsiento 1: SrLyce (1.95 € en fichas) \nAsiento 2: Fharock (1.85 € en fichas) \nAsiento 3: ecuinas (2 € en fichas) \nAsiento 6: Akourdideh (2.18 € en fichas) \nFharock: pone la ciega pequeña 0.01 €\necuinas: pone la ciega grande 0.02 €\n*** CARTAS DE MANO ***\nRepartidas a SrLyce [2h Qs]\nAkourdideh: sube 0.04 € a 0.06 €\nSrLyce: se retira \nLxckxStrxkx se une a la mesa en el asiento n.º 4 \nFharock: se retira \necuinas: se retira \nLa apuesta no igualada (0.04 €) ha sido devuelta a Akourdideh\nAkourdideh se lleva 0.05 € del bote \n*** RESUMEN ***\nBote total 0.05 € | Comisión 0 € \nAsiento 1: SrLyce (botón) se retiró antes del Flop (no apostó)\nAsiento 2: Fharock (ciega pequeña) se retiró antes del Flop\nAsiento 3: ecuinas (ciega grande) se retiró antes del Flop\nAsiento 6: Akourdideh recaudó (0.05 €)"
}