{
  "hand_id": "257238277528",
  "date": "06-08-2025 18:43:48",
  "table": "Aidamina II",
  "game_type": "holdem",
  "hero": "SrLyce",
  "hero_position": "",
  "hero_cards": [
    "2d",
    "Jh"
  ],
  "stacks": {
    "Abrelatas787": 132.0,
    "GarciaTT416": 98.5,
    "McFlash3": 100.0,
    "niyomalo": 129.5,
    "durahimovic": 128.0,
    "SrLyce": 100.0
  },
  "actions": {
    "preflop": [
      "Asiento 5: Abrelatas787 (2.64 € en fichas) está ausente",
      "Asiento 1: GarciaTT416 (1.97 € en fichas)",
      "Asiento 2: McFlash3 (2 € en fichas)",
      "Asiento 3: niyomalo (2.59 € en fichas)",
      "Asiento 4: durahimovic (2.56 € en fichas)",
      "Asiento 6: SrLyce (2 € en fichas)",
      "durahimovic: pone la ciega pequeña 0.01 €",
      "Abrelatas787: está ausente",
      "SrLyce: pone la ciega grande 0.02 €",
      "GarciaTT416: se retira",
      "McFlash3: sube 0.04 € a 0.06 €",
      "niyomalo: iguala 0.06 €",
      "durahimovic: se retira",
      "SrLyce: se retira"
    ],
    "flop": [
      "McFlash3: apuesta 0.05 €",
      "niyomalo: se retira",
      "McFlash3: no muestra su mano",
      "Asiento 5: Abrelatas787",
      "Asiento 1: GarciaTT416 se retiró antes del Flop (no apostó)",
      "Asiento 2: McFlash3 recaudó (0.14 €)",
      "Asiento 3: niyomalo (botón) se retiró en el Flop",
      "Asiento 4: durahimovic (ciega pequeña) se retiró antes del Flop",
      "Asiento 6: SrLyce (ciega grande) se retiró antes del Flop"
    ],
    "turn": [],
    "river": []
  },
  "board": [
    "7c",
    "8h",
    "Ad"
  ],
  "winner": "McFlash3",
  "win_amount": 7.0,
  "sb": 0.01,
  "bb": 0.02,
  "rake": 0.5,
  "raw_text": "Mano n.º 257238277528 de PokerStars:  Hold'em No Limit (0.01 €/0.02 € EUR) - 06-08-2025 18:43:48 CET [06-08-2025 12:43:48 ET]\nMesa \"Aidamina II\" 6-max El asiento n.º 3 es el botón\nAsiento 5: Abrelatas787 (2.64 € en fichas) está ausente\nAsiento 1: GarciaTT416 (1.97 € en fichas) \nAsiento 2: McFlash3 (2 € en fichas) \nAsiento 3: niyomalo (2.59 € en fichas) \nAsiento 4: durahimovic (2.56 € en fichas) \nAsiento 6: SrLyce (2 € en fichas) \ndurahimovic: pone la ciega pequeña 0.01 €\nAbrelatas787: está ausente \nSrLyce: pone la ciega grande 0.02 €\n*** CARTAS DE MANO ***\nRepartidas a SrLyce [2d Jh]\nGarciaTT416: se retira \nAbrelatas787 deja la mesa\nMcFlash3: sube 0.04 € a 0.06 €\nniyomalo: iguala 0.06 €\ndurahimovic: se retira \nSrLyce: se retira \n*** FLOP *** [7c 8h Ad]\nMcFlash3: apuesta 0.05 €\nniyomalo: se retira \nLa apuesta no igualada (0.05 €) ha sido devuelta a McFlash3\nMcFlash3 se lleva 0.14 € del bote \nMcFlash3: no muestra su mano \n*** RESUMEN ***\nBote total 0.15 € | Comisión 0.01 € \nComunitarias [7c 8h Ad]\nAsiento 5: Abrelatas787\nAsiento 1: GarciaTT416 se retiró antes del Flop (no apostó)\nAsiento 2: McFlash3 recaudó (0.14 €)\nAsiento 3: niyomalo (botón) se retiró en el Flop\nAsiento 4: durahimovic (ciega pequeña) se retiró antes del Flop\nAsiento 6: SrLyce (ciega grande) se retiró antes del Flop"
}