{
  "hand_id": "257168239542",
  "date": "01-08-2025 11:10:39",
  "table": "Sekanina",
  "game_type": "holdem",
  "hero": "SrLyce",
  "hero_position": "",
  "hero_cards": [
    "8s",
    "9c"
  ],
  "stacks": {
    "DagonBZH56": 80.0,
    "practikal_C23": 0.0,
    "Alvii37": 100.5,
    "SrLyce": 167.5,
    "davinci1962": 106.5,
    "Elministrelas": 96.0
  },
  "actions": {
    "preflop": [
      "Asiento 1: DagonBZH56 (1.60 € en fichas) está ausente",
      "Asiento 2: practikal_C23 (0 € en fichas) está ausente",
      "Asiento 3: Alvii37 (2.01 € en fichas)",
      "Asiento 4: SrLyce (3.35 € en fichas)",
      "Asiento 5: davinci1962 (2.13 € en fichas)",
      "Asiento 6: Elministrelas (1.92 € en fichas)",
      "SrLyce: pone la ciega pequeña 0.01 €",
      "davinci1962: pone la ciega grande 0.02 €",
      "DagonBZH56: se ausenta",
      "Elministrelas: se retira",
      "Alvii37: sube 0.04 € a 0.06 €",
      "SrLyce: iguala 0.05 €",
      "davinci1962: se retira"
    ],
    "flop": [
      "SrLyce: pasa",
      "Alvii37: apuesta 0.04 €",
      "SrLyce: se retira",
      "Alvii37: no muestra su mano",
      "Asiento 1: DagonBZH56",
      "Asiento 2: practikal_C23",
      "Asiento 3: Alvii37 (botón) recaudó (0.13 €)",
      "Asiento 4: SrLyce (ciega pequeña) se retiró en el Flop",
      "Asiento 5: davinci1962 (ciega grande) se retiró antes del Flop",
      "Asiento 6: Elministrelas se retiró antes del Flop (no apostó)"
    ],
    "turn": [],
    "river": []
  },
  "board": [
    "Jh",
    "Qs",
    "Ad"
  ],
  "winner": "Alvii37",
  "win_amount": 6.5,
  "sb": 0.01,
  "bb": 0.02,
  "rake": 0.5,
  "raw_text": "Mano n.º 257168239542 de PokerStars:  Hold'em No Limit (0.01 €/0.02 € EUR) - 01-08-2025 11:10:39 CET [01-08-2025 5:10:39 ET]\nMesa \"Sekanina\" 6-max El asiento n.º 3 es el botón\nAsiento 1: DagonBZH56 (1.60 € en fichas) está ausente\nAsiento 2: practikal_C23 (0 € en fichas) está ausente\nAsiento 3: Alvii37 (2.01 € en fichas) \nAsiento 4: SrLyce (3.35 € en fichas) \nAsiento 5: davinci1962 (2.13 € en fichas) \nAsiento 6: Elministrelas (1.92 € en fichas) \nSrLyce: pone la ciega pequeña 0.01 €\ndavinci1962: pone la ciega grande 0.02 €\nDagonBZH56: se ausenta \n*** CARTAS DE MANO ***\nRepartidas a SrLyce [8s 9c]\nElministrelas: se retira \nAlvii37: sube 0.04 € a 0.06 €\nSrLyce: iguala 0.05 €\ndavinci1962: se retira \n*** FLOP *** [Jh Qs Ad]\nSrLyce: pasa \nAlvii37: apuesta 0.04 €\nSrLyce: se retira \nLa apuesta no igualada (0.04 €) ha sido devuelta a Alvii37\nAlvii37 se lleva 0.13 € del bote \nAlvii37: no muestra su mano \n*** RESUMEN ***\nBote total 0.14 € | Comisión 0.01 € \nComunitarias [Jh Qs Ad]\nAsiento 1: DagonBZH56\nAsiento 2: practikal_C23\nAsiento 3: Alvii37 (botón) recaudó (0.13 €)\nAsiento 4: SrLyce (ciega pequeña) se retiró en el Flop\nAsiento 5: davinci1962 (ciega grande) se retiró antes del Flop\nAsiento 6: Elministrelas se retiró antes del Flop (no apostó)"
}