{
  "hand_id": "257168381642",
  "date": "01-08-2025 11:37:29",
  "table": "Atlas",
  "game_type": "holdem",
  "hero": "SrLyce",
  "hero_position": "",
  "hero_cards": [
    "2h",
    "5d"
  ],
  "stacks": {
    "ecuinas": 91.0,
    "SrLyce": 119.5,
    "Fharock": 111.0,
    "LxckxStrxkx": 100.0,
    "soy_cule74": 100.0,
    "Akourdideh": 106.5
  },
  "actions": {
    "preflop": [
      "Asiento 3: ecuinas (1.82 € en fichas) está ausente",
      "Asiento 1: SrLyce (2.39 € en fichas)",
      "Asiento 2: Fharock (2.22 € en fichas)",
      "Asiento 4: LxckxStrxkx (2 € en fichas)",
      "Asiento 5: soy_cule74 (2 € en fichas)",
      "Asiento 6: Akourdideh (2.13 € en fichas)",
      "SrLyce: pone la ciega pequeña 0.01 €",
      "Fharock: pone la ciega grande 0.02 €",
      "LxckxStrxkx: sube 0.04 € a 0.06 €",
      "soy_cule74: se retira",
      "Akourdideh: se retira",
      "SrLyce: se retira",
      "Fharock: se retira",
      "LxckxStrxkx: no muestra su mano",
      "Asiento 3: ecuinas",
      "Asiento 1: SrLyce (ciega pequeña) se retiró antes del Flop",
      "Asiento 2: Fharock (ciega grande) se retiró antes del Flop",
      "Asiento 4: LxckxStrxkx recaudó (0.05 €)",
      "Asiento 5: soy_cule74 se retiró antes del Flop (no apostó)",
      "Asiento 6: Akourdideh (botón) se retiró antes del Flop (no apostó)"
    ],
    "flop": [],
    "turn": [],
    "river": []
  },
  "board": [],
  "winner": "LxckxStrxkx",
  "win_amount": 2.5,
  "sb": 0.01,
  "bb": 0.02,
  "rake": 0.0,
  "raw_text": "Mano n.º 257168381642 de PokerStars:  Hold'em No Limit (0.01 €/0.02 € EUR) - 01-08-2025 11:37:29 CET [01-08-2025 5:37:29 ET]\nMesa \"Atlas\" 6-max El asiento n.º 6 es el botón\nAsiento 3: ecuinas (1.82 € en fichas) está ausente\nAsiento 1: SrLyce (2.39 € en fichas) \nAsiento 2: Fharock (2.22 € en fichas) \nAsiento 4: LxckxStrxkx (2 € en fichas) \nAsiento 5: soy_cule74 (2 € en fichas) \nAsiento 6: Akourdideh (2.13 € en fichas) \nSrLyce: pone la ciega pequeña 0.01 €\nFharock: pone la ciega grande 0.02 €\n*** CARTAS DE MANO ***\nRepartidas a SrLyce [2h 5d]\nLxckxStrxkx: sube 0.04 € a 0.06 €\nsoy_cule74: se retira \nAkourdideh: se retira \nSrLyce: se retira \nFharock: se retira \nLa apuesta no igualada (0.04 €) ha sido devuelta a LxckxStrxkx\nLxckxStrxkx se lleva 0.05 € del bote \nLxckxStrxkx: no muestra su mano \n*** RESUMEN ***\nBote total 0.05 € | Comisión 0 € \nAsiento 3: ecuinas\nAsiento 1: SrLyce (ciega pequeña) se retiró antes del Flop\nAsiento 2: Fharock (ciega grande) se retiró antes del Flop\nAsiento 4: LxckxStrxkx recaudó (0.05 €)\nAsiento 5: soy_cule74 se retiró antes del Flop (no apostó)\nAsiento 6: Akourdideh (botón) se retiró antes del Flop (no apostó)"
}