{
  "hand_id": "257237865926",
  "date": "06-08-2025 18:06:52",
  "table": "Atreus",
  "game_type": "holdem",
  "hero": "SrLyce",
  "hero_position": "",
  "hero_cards": [
    "2d",
    "6d"
  ],
  "stacks": {
    "PrendsCa": 111.5,
    "NRules82": 74.5,
    "JENOFONTE73": 120.0,
    "SrLyce": 100.0,
    "FishamanReggae": 46.0
  },
  "actions": {
    "preflop": [
      "Asiento 1: PrendsCa (2.23 € en fichas)",
      "Asiento 2: NRules82 (1.49 € en fichas)",
      "Asiento 3: JENOFONTE73 (2.40 € en fichas)",
      "Asiento 5: SrLyce (2 € en fichas)",
      "Asiento 6: FishamanReggae (0.92 € en fichas)",
      "SrLyce: pone la ciega pequeña 0.01 €",
      "FishamanReggae: pone la ciega grande 0.02 €",
      "PrendsCa: se retira",
      "NRules82: sube 0.02 € a 0.04 €",
      "JENOFONTE73: se retira",
      "SrLyce: iguala 0.03 €",
      "FishamanReggae: se retira"
    ],
    "flop": [
      "SrLyce: pasa",
      "NRules82: pasa"
    ],
    "turn": [
      "SrLyce: pasa",
      "NRules82: apuesta 0.04 €",
      "SrLyce: se retira",
      "Asiento 1: PrendsCa se retiró antes del Flop (no apostó)",
      "Asiento 2: NRules82 recaudó (0.09 €)",
      "Asiento 3: JENOFONTE73 (botón) se retiró antes del Flop (no apostó)",
      "Asiento 5: SrLyce (ciega pequeña) se retiró en el Turn",
      "Asiento 6: FishamanReggae (ciega grande) se retiró antes del Flop"
    ],
    "river": []
  },
  "board": [
    "2s",
    "7h",
    "Qc",
    "Jd"
  ],
  "winner": "NRules82",
  "win_amount": 4.5,
  "sb": 0.01,
  "bb": 0.02,
  "rake": 0.5,
  "raw_text": "Mano n.º 257237865926 de PokerStars:  Hold'em No Limit (0.01 €/0.02 € EUR) - 06-08-2025 18:06:52 CET [06-08-2025 12:06:52 ET]\nMesa \"Atreus\" 6-max El asiento n.º 3 es el botón\nAsiento 1: PrendsCa (2.23 € en fichas) \nAsiento 2: NRules82 (1.49 € en fichas) \nAsiento 3: JENOFONTE73 (2.40 € en fichas) \nAsiento 5: SrLyce (2 € en fichas) \nAsiento 6: FishamanReggae (0.92 € en fichas) \nSrLyce: pone la ciega pequeña 0.01 €\nFishamanReggae: pone la ciega grande 0.02 €\n*** CARTAS DE MANO ***\nRepartidas a SrLyce [2d 6d]\nPrendsCa: se retira \nNRules82: sube 0.02 € a 0.04 €\nJENOFONTE73: se retira \nSrLyce: iguala 0.03 €\nFishamanReggae: se retira \n*** FLOP *** [2s 7h Qc]\nSrLyce: pasa \nNRules82: pasa \n*** TURN *** [2s 7h Qc] [Jd]\nSrLyce: pasa \nNRules82: apuesta 0.04 €\nFharock se une a la mesa en el asiento n.º 4 \nSrLyce: se retira \nLa apuesta no igualada (0.04 €) ha sido devuelta a NRules82\nNRules82 se lleva 0.09 € del bote \n*** RESUMEN ***\nBote total 0.10 € | Comisión 0.01 € \nComunitarias [2s 7h Qc Jd]\nAsiento 1: PrendsCa se retiró antes del Flop (no apostó)\nAsiento 2: NRules82 recaudó (0.09 €)\nAsiento 3: JENOFONTE73 (botón) se retiró antes del Flop (no apostó)\nAsiento 5: SrLyce (ciega pequeña) se retiró en el Turn\nAsiento 6: FishamanReggae (ciega grande) se retiró antes del Flop"
}