{
  "hand_id": "257237041123",
  "date": "06-08-2025 17:34:09",
  "table": "Kale III",
  "game_type": "holdem",
  "hero": "SrLyce",
  "hero_position": "",
  "hero_cards": [
    "Qc",
    "5d"
  ],
  "stacks": {
    "x__Nest__x": 88.0,
    "SrLyce": 112.5,
    "Dracoline000": 114.5,
    "Doblea315": 166.0,
    "Begoton": 110.5,
    "juanmemol": 100.0
  },
  "actions": {
    "preflop": [
      "Asiento 1: x__Nest__x (1.76 € en fichas)",
      "Asiento 2: SrLyce (2.25 € en fichas)",
      "Asiento 3: Dracoline000 (2.29 € en fichas)",
      "Asiento 4: Doblea315 (3.32 € en fichas)",
      "Asiento 5: Begoton (2.21 € en fichas)",
      "Asiento 6: juanmemol (2 € en fichas)",
      "juanmemol: pone la ciega pequeña 0.01 €",
      "x__Nest__x: pone la ciega grande 0.02 €",
      "SrLyce: se retira",
      "Dracoline000: se retira",
      "Doblea315: sube 0.03 € a 0.05 €",
      "Begoton: sube 0.13 € a 0.18 €",
      "juanmemol: se retira",
      "x__Nest__x: se retira",
      "Doblea315: se retira",
      "Begoton: no muestra su mano",
      "Asiento 1: x__Nest__x (ciega grande) se retiró antes del Flop",
      "Asiento 2: SrLyce se retiró antes del Flop (no apostó)",
      "Asiento 3: Dracoline000 se retiró antes del Flop (no apostó)",
      "Asiento 4: Doblea315 se retiró antes del Flop",
      "Asiento 5: Begoton (botón) recaudó (0.13 €)",
      "Asiento 6: juanmemol (ciega pequeña) se retiró antes del Flop"
    ],
    "flop": [],
    "turn": [],
    "river": []
  },
  "board": [],
  "winner": "Begoton",
  "win_amount": 6.5,
  "sb": 0.01,
  "bb": 0.02,
  "rake": 0.0,
  "raw_text": "Mano n.º 257237041123 de PokerStars:  Hold'em No Limit (0.01 €/0.02 € EUR) - 06-08-2025 17:34:09 CET [06-08-2025 11:34:09 ET]\nMesa \"Kale III\" 6-max El asiento n.º 5 es el botón\nAsiento 1: x__Nest__x (1.76 € en fichas) \nAsiento 2: SrLyce (2.25 € en fichas) \nAsiento 3: Dracoline000 (2.29 € en fichas) \nAsiento 4: Doblea315 (3.32 € en fichas) \nAsiento 5: Begoton (2.21 € en fichas) \nAsiento 6: juanmemol (2 € en fichas) \njuanmemol: pone la ciega pequeña 0.01 €\nx__Nest__x: pone la ciega grande 0.02 €\n*** CARTAS DE MANO ***\nRepartidas a SrLyce [Qc 5d]\nSrLyce: se retira \nDracoline000: se retira \nDoblea315: sube 0.03 € a 0.05 €\nBegoton: sube 0.13 € a 0.18 €\njuanmemol: se retira \nx__Nest__x: se retira \nDoblea315: se retira \nLa apuesta no igualada (0.13 €) ha sido devuelta a Begoton\nBegoton se lleva 0.13 € del bote \nBegoton: no muestra su mano \n*** RESUMEN ***\nBote total 0.13 € | Comisión 0 € \nAsiento 1: x__Nest__x (ciega grande) se retiró antes del Flop\nAsiento 2: SrLyce se retiró antes del Flop (no apostó)\nAsiento 3: Dracoline000 se retiró antes del Flop (no apostó)\nAsiento 4: Doblea315 se retiró antes del Flop\nAsiento 5: Begoton (botón) recaudó (0.13 €)\nAsiento 6: juanmemol (ciega pequeña) se retiró antes del Flop"
}