{
  "hand_id": "257168402503",
  "date": "01-08-2025 11:41:15",
  "table": "Atlas",
  "game_type": "holdem",
  "hero": "SrLyce",
  "hero_position": "",
  "hero_cards": [
    "Td",
    "Qd"
  ],
  "stacks": {
    "SrLyce": 116.0,
    "Fharock": 111.0,
    "ecuinas": 89.5,
    "LxckxStrxkx": 111.5,
    "soy_cule74": 100.0,
    "Akourdideh": 103.5
  },
  "actions": {
    "preflop": [
      "Asiento 1: SrLyce (2.32 € en fichas)",
      "Asiento 2: Fharock (2.22 € en fichas)",
      "Asiento 3: ecuinas (1.79 € en fichas)",
      "Asiento 4: LxckxStrxkx (2.23 € en fichas)",
      "Asiento 5: soy_cule74 (2 € en fichas)",
      "Asiento 6: Akourdideh (2.07 € en fichas)",
      "SrLyce: pone la ciega pequeña 0.01 €",
      "Fharock: pone la ciega grande 0.02 €",
      "ecuinas: se retira",
      "LxckxStrxkx: sube 0.04 € a 0.06 €",
      "soy_cule74: iguala 0.06 €",
      "Akourdideh: iguala 0.06 €",
      "SrLyce: iguala 0.05 €",
      "Fharock: se retira"
    ],
    "flop": [
      "SrLyce: pasa",
      "LxckxStrxkx: apuesta 0.12 €",
      "soy_cule74: se retira",
      "Akourdideh: se retira",
      "SrLyce: se retira",
      "LxckxStrxkx: no muestra su mano",
      "Asiento 1: SrLyce (ciega pequeña) se retiró en el Flop",
      "Asiento 2: Fharock (ciega grande) se retiró antes del Flop",
      "Asiento 3: ecuinas se retiró antes del Flop (no apostó)",
      "Asiento 4: LxckxStrxkx recaudó (0.24 €)",
      "Asiento 5: soy_cule74 se retiró en el Flop",
      "Asiento 6: Akourdideh (botón) se retiró en el Flop"
    ],
    "turn": [],
    "river": []
  },
  "board": [
    "Kh",
    "3s",
    "3c"
  ],
  "winner": "LxckxStrxkx",
  "win_amount": 12.0,
  "sb": 0.01,
  "bb": 0.02,
  "rake": 1.0,
  "raw_text": "Mano n.º 257168402503 de PokerStars:  Hold'em No Limit (0.01 €/0.02 € EUR) - 01-08-2025 11:41:15 CET [01-08-2025 5:41:15 ET]\nMesa \"Atlas\" 6-max El asiento n.º 6 es el botón\nAsiento 1: SrLyce (2.32 € en fichas) \nAsiento 2: Fharock (2.22 € en fichas) \nAsiento 3: ecuinas (1.79 € en fichas) \nAsiento 4: LxckxStrxkx (2.23 € en fichas) \nAsiento 5: soy_cule74 (2 € en fichas) \nAsiento 6: Akourdideh (2.07 € en fichas) \nSrLyce: pone la ciega pequeña 0.01 €\nFharock: pone la ciega grande 0.02 €\n*** CARTAS DE MANO ***\nRepartidas a SrLyce [Td Qd]\necuinas: se retira \nLxckxStrxkx: sube 0.04 € a 0.06 €\nsoy_cule74: iguala 0.06 €\nAkourdideh: iguala 0.06 €\nSrLyce: iguala 0.05 €\nFharock: se retira \n*** FLOP *** [Kh 3s 3c]\nSrLyce: pasa \nLxckxStrxkx: apuesta 0.12 €\nsoy_cule74: se retira \nAkourdideh: se retira \nSrLyce: se retira \nLa apuesta no igualada (0.12 €) ha sido devuelta a LxckxStrxkx\nLxckxStrxkx se lleva 0.24 € del bote \nLxckxStrxkx: no muestra su mano \n*** RESUMEN ***\nBote total 0.26 € | Comisión 0.02 € \nComunitarias [Kh 3s 3c]\nAsiento 1: SrLyce (ciega pequeña) se retiró en el Flop\nAsiento 2: Fharock (ciega grande) se retiró antes del Flop\nAsiento 3: ecuinas se retiró antes del Flop (no apostó)\nAsiento 4: LxckxStrxkx recaudó (0.24 €)\nAsiento 5: soy_cule74 se retiró en el Flop\nAsiento 6: Akourdideh (botón) se retiró en el Flop"
}