{
  "hand_id": "257168223282",
  "date": "01-08-2025 11:07:30",
  "table": "Sekanina",
  "game_type": "holdem",
  "hero": "SrLyce",
  "hero_position": "",
  "hero_cards": [
    "Qc",
    "3h"
  ],
  "stacks": {
    "practikal_C23": 82.5,
    "Alvii37": 92.0,
    "SrLyce": 102.5,
    "davinci1962": 109.5,
    "Elministrelas": 93.5
  },
  "actions": {
    "preflop": [
      "Asiento 2: practikal_C23 (1.65 € en fichas)",
      "Asiento 3: Alvii37 (1.84 € en fichas)",
      "Asiento 4: SrLyce (2.05 € en fichas)",
      "Asiento 5: davinci1962 (2.19 € en fichas)",
      "Asiento 6: Elministrelas (1.87 € en fichas)",
      "SrLyce: pone la ciega pequeña 0.01 €",
      "davinci1962: pone la ciega grande 0.02 €",
      "Elministrelas: sube 0.03 € a 0.05 €",
      "practikal_C23: se retira",
      "Alvii37: se retira",
      "SrLyce: se retira",
      "davinci1962: iguala 0.03 €"
    ],
    "flop": [
      "davinci1962: pasa",
      "Elministrelas: apuesta 0.03 €",
      "davinci1962: se retira",
      "Asiento 2: practikal_C23 se retiró antes del Flop (no apostó)",
      "Asiento 3: Alvii37 (botón) se retiró antes del Flop (no apostó)",
      "Asiento 4: SrLyce (ciega pequeña) se retiró antes del Flop",
      "Asiento 5: davinci1962 (ciega grande) se retiró en el Flop",
      "Asiento 6: Elministrelas recaudó (0.10 €)"
    ],
    "turn": [],
    "river": []
  },
  "board": [
    "Ah",
    "Ts",
    "6h"
  ],
  "winner": "Elministrelas",
  "win_amount": 5.0,
  "sb": 0.01,
  "bb": 0.02,
  "rake": 0.5,
  "raw_text": "Mano n.º 257168223282 de PokerStars:  Hold'em No Limit (0.01 €/0.02 € EUR) - 01-08-2025 11:07:30 CET [01-08-2025 5:07:30 ET]\nMesa \"Sekanina\" 6-max El asiento n.º 3 es el botón\nAsiento 2: practikal_C23 (1.65 € en fichas) \nAsiento 3: Alvii37 (1.84 € en fichas) \nAsiento 4: SrLyce (2.05 € en fichas) \nAsiento 5: davinci1962 (2.19 € en fichas) \nAsiento 6: Elministrelas (1.87 € en fichas) \nSrLyce: pone la ciega pequeña 0.01 €\ndavinci1962: pone la ciega grande 0.02 €\n*** CARTAS DE MANO ***\nRepartidas a SrLyce [Qc 3h]\nElministrelas: sube 0.03 € a 0.05 €\npractikal_C23: se retira \nAlvii37: se retira \nSrLyce: se retira \ndavinci1962: iguala 0.03 €\n*** FLOP *** [Ah Ts 6h]\ndavinci1962: pasa \nElministrelas: apuesta 0.03 €\ndavinci1962: se retira \nLa apuesta no igualada (0.03 €) ha sido devuelta a Elministrelas\nElministrelas se lleva 0.10 € del bote \n*** RESUMEN ***\nBote total 0.11 € | Comisión 0.01 € \nComunitarias [Ah Ts 6h]\nAsiento 2: practikal_C23 se retiró antes del Flop (no apostó)\nAsiento 3: Alvii37 (botón) se retiró antes del Flop (no apostó)\nAsiento 4: SrLyce (ciega pequeña) se retiró antes del Flop\nAsiento 5: davinci1962 (ciega grande) se retiró en el Flop\nAsiento 6: Elministrelas recaudó (0.10 €)"
}