{
  "hand_id": "257237855854",
  "date": "06-08-2025 18:05:56",
  "table": "Nuwa III",
  "game_type": "holdem",
  "hero": "SrLyce",
  "hero_position": "",
  "hero_cards": [
    "Jc",
    "Ac"
  ],
  "stacks": {
    "davinci1962": 124.0,
    "BuXHexter": 100.0,
    "kcg_rm": 109.0,
    "SrLyce": 92.0,
    "RiskAllinkali": 116.0,
    "acavada": 101.0
  },
  "actions": {
    "preflop": [
      "Asiento 1: davinci1962 (2.48 € en fichas)",
      "Asiento 2: BuXHexter (2 € en fichas)",
      "Asiento 3: kcg_rm (2.18 € en fichas)",
      "Asiento 4: SrLyce (1.84 € en fichas)",
      "Asiento 5: RiskAllinkali (2.32 € en fichas)",
      "Asiento 6: acavada (2.02 € en fichas)",
      "SrLyce: pone la ciega pequeña 0.01 €",
      "RiskAllinkali: pone la ciega grande 0.02 €",
      "acavada: se retira",
      "davinci1962: sube 0.03 € a 0.05 €",
      "BuXHexter: se retira",
      "kcg_rm: se retira",
      "SrLyce: sube 0.03 € a 0.08 €",
      "RiskAllinkali: se retira",
      "davinci1962: sube 0.33 € a 0.41 €",
      "SrLyce: sube 0.33 € a 0.74 €",
      "davinci1962: sube 1.50 € a 2.24 €",
      "SrLyce: iguala 1.10 € y está all-in"
    ],
    "flop": [],
    "turn": [],
    "river": [
      "SrLyce: muestra [Jc Ac] (doble pareja, jotas y dieces)",
      "davinci1962: muestra [Kc Ks] (doble pareja, reyes y dieces)",
      "Asiento 1: davinci1962 muestra [Kc Ks] y ganó (3.48 €) con doble pareja, reyes y dieces",
      "Asiento 2: BuXHexter se retiró antes del Flop (no apostó)",
      "Asiento 3: kcg_rm (botón) se retiró antes del Flop (no apostó)",
      "Asiento 4: SrLyce (ciega pequeña) muestra [Jc Ac] y perdió con doble pareja, jotas y dieces",
      "Asiento 5: RiskAllinkali (ciega grande) se retiró antes del Flop",
      "Asiento 6: acavada se retiró antes del Flop (no apostó)"
    ]
  },
  "board": [
    "5c",
    "Jd",
    "Td",
    "Th",
    "7c"
  ],
  "winner": "davinci1962",
  "win_amount": 174.0,
  "sb": 0.01,
  "bb": 0.02,
  "rake": 11.0,
  "raw_text": "Mano n.º 257237855854 de PokerStars:  Hold'em No Limit (0.01 €/0.02 € EUR) - 06-08-2025 18:05:56 CET [06-08-2025 12:05:56 ET]\nMesa \"Nuwa III\" 6-max El asiento n.º 3 es el botón\nAsiento 1: davinci1962 (2.48 € en fichas) \nAsiento 2: BuXHexter (2 € en fichas) \nAsiento 3: kcg_rm (2.18 € en fichas) \nAsiento 4: SrLyce (1.84 € en fichas) \nAsiento 5: RiskAllinkali (2.32 € en fichas) \nAsiento 6: acavada (2.02 € en fichas) \nSrLyce: pone la ciega pequeña 0.01 €\nRiskAllinkali: pone la ciega grande 0.02 €\n*** CARTAS DE MANO ***\nRepartidas a SrLyce [Jc Ac]\nacavada: se retira \ndavinci1962: sube 0.03 € a 0.05 €\nBuXHexter: se retira \nkcg_rm: se retira \nSrLyce: sube 0.03 € a 0.08 €\nRiskAllinkali: se retira \ndavinci1962: sube 0.33 € a 0.41 €\nSrLyce: sube 0.33 € a 0.74 €\ndavinci1962: sube 1.50 € a 2.24 €\nSrLyce: iguala 1.10 € y está all-in\nLa apuesta no igualada (0.40 €) ha sido devuelta a davinci1962\n*** FLOP *** [5c Jd Td]\n*** TURN *** [5c Jd Td] [Th]\n*** RIVER *** [5c Jd Td Th] [7c]\n*** SHOW DOWN ***\nSrLyce: muestra [Jc Ac] (doble pareja, jotas y dieces)\ndavinci1962: muestra [Kc Ks] (doble pareja, reyes y dieces)\ndavinci1962 se lleva 3.48 € del bote \n*** RESUMEN ***\nBote total 3.70 € | Comisión 0.22 € \nComunitarias [5c Jd Td Th 7c]\nAsiento 1: davinci1962 muestra [Kc Ks] y ganó (3.48 €) con doble pareja, reyes y dieces\nAsiento 2: BuXHexter se retiró antes del Flop (no apostó)\nAsiento 3: kcg_rm (botón) se retiró antes del Flop (no apostó)\nAsiento 4: SrLyce (ciega pequeña) muestra [Jc Ac] y perdió con doble pareja, jotas y dieces\nAsiento 5: RiskAllinkali (ciega grande) se retiró antes del Flop\nAsiento 6: acavada se retiró antes del Flop (no apostó)"
}