{
  "hand_id": "257150579245",
  "date": "30-07-2025 23:52:09",
  "table": "Lobelia",
  "game_type": "holdem",
  "hero": "SrLyce",
  "hero_position": "",
  "hero_cards": [
    "7c",
    "As"
  ],
  "stacks": {
    "LeVbks": 156.0,
    "fcis666": 18.5,
    "Dlaguancha": 119.5,
    "SrLyce": 105.0,
    "riverluck444": 69.5,
    "javipondio": 41.5
  },
  "actions": {
    "preflop": [
      "Asiento 1: LeVbks (3.12 € en fichas)",
      "Asiento 2: fcis666 (0.37 € en fichas)",
      "Asiento 3: Dlaguancha (2.39 € en fichas)",
      "Asiento 4: SrLyce (2.10 € en fichas)",
      "Asiento 5: riverluck444 (1.39 € en fichas)",
      "Asiento 6: javipondio (0.83 € en fichas)",
      "javipondio: pone la ciega pequeña 0.01 €",
      "LeVbks: pone la ciega grande 0.02 €",
      "fcis666: sube 0.04 € a 0.06 €",
      "Dlaguancha: se retira",
      "SrLyce: iguala 0.06 €",
      "riverluck444: se retira",
      "javipondio: se retira",
      "LeVbks: iguala 0.04 €"
    ],
    "flop": [
      "LeVbks: pasa",
      "fcis666: apuesta 0.08 €",
      "SrLyce: se retira",
      "LeVbks: se retira",
      "fcis666: no muestra su mano",
      "Asiento 1: LeVbks (ciega grande) se retiró en el Flop",
      "Asiento 2: fcis666 recaudó (0.18 €)",
      "Asiento 3: Dlaguancha se retiró antes del Flop (no apostó)",
      "Asiento 4: SrLyce se retiró en el Flop",
      "Asiento 5: riverluck444 (botón) se retiró antes del Flop (no apostó)",
      "Asiento 6: javipondio (ciega pequeña) se retiró antes del Flop"
    ],
    "turn": [],
    "river": []
  },
  "board": [
    "Jh",
    "8s",
    "8c"
  ],
  "winner": "fcis666",
  "win_amount": 9.0,
  "sb": 0.01,
  "bb": 0.02,
  "rake": 0.5,
  "raw_text": "Mano n.º 257150579245 de PokerStars:  Hold'em No Limit (0.01 €/0.02 € EUR) - 30-07-2025 23:52:09 CET [30-07-2025 17:52:09 ET]\nMesa \"Lobelia\" 6-max El asiento n.º 5 es el botón\nAsiento 1: LeVbks (3.12 € en fichas) \nAsiento 2: fcis666 (0.37 € en fichas) \nAsiento 3: Dlaguancha (2.39 € en fichas) \nAsiento 4: SrLyce (2.10 € en fichas) \nAsiento 5: riverluck444 (1.39 € en fichas) \nAsiento 6: javipondio (0.83 € en fichas) \njavipondio: pone la ciega pequeña 0.01 €\nLeVbks: pone la ciega grande 0.02 €\n*** CARTAS DE MANO ***\nRepartidas a SrLyce [7c As]\nfcis666: sube 0.04 € a 0.06 €\nDlaguancha: se retira \nSrLyce: iguala 0.06 €\nriverluck444: se retira \njavipondio: se retira \nLeVbks: iguala 0.04 €\n*** FLOP *** [Jh 8s 8c]\nLeVbks: pasa \nfcis666: apuesta 0.08 €\nSrLyce: se retira \nLeVbks: se retira \nLa apuesta no igualada (0.08 €) ha sido devuelta a fcis666\nfcis666 se lleva 0.18 € del bote \nfcis666: no muestra su mano \n*** RESUMEN ***\nBote total 0.19 € | Comisión 0.01 € \nComunitarias [Jh 8s 8c]\nAsiento 1: LeVbks (ciega grande) se retiró en el Flop\nAsiento 2: fcis666 recaudó (0.18 €)\nAsiento 3: Dlaguancha se retiró antes del Flop (no apostó)\nAsiento 4: SrLyce se retiró en el Flop\nAsiento 5: riverluck444 (botón) se retiró antes del Flop (no apostó)\nAsiento 6: javipondio (ciega pequeña) se retiró antes del Flop"
}