{
  "hand_id": "257148947860",
  "date": "30-07-2025 21:55:24",
  "table": "Sirona",
  "game_type": "holdem",
  "hero": "SrLyce",
  "hero_position": "",
  "hero_cards": [
    "Td",
    "Ac"
  ],
  "stacks": {
    "SrLyce": 110.0,
    "lecontrebandier": 98.0,
    "christoph363": 206.5,
    "oliverdu70": 141.0,
    "NachoAlmirante": 107.5,
    "Dakoo44": 70.5
  },
  "actions": {
    "preflop": [
      "Asiento 1: SrLyce (2.20 € en fichas)",
      "Asiento 2: lecontrebandier (1.96 € en fichas)",
      "Asiento 3: christoph363 (4.13 € en fichas)",
      "Asiento 4: oliverdu70 (2.82 € en fichas)",
      "Asiento 5: NachoAlmirante (2.15 € en fichas)",
      "Asiento 6: Dakoo44 (1.41 € en fichas)",
      "SrLyce: pone la ciega pequeña 0.01 €",
      "lecontrebandier: pone la ciega grande 0.02 €",
      "christoph363: se retira",
      "oliverdu70: iguala 0.02 €",
      "NachoAlmirante: sube 0.08 € a 0.10 €",
      "Dakoo44: se retira",
      "SrLyce: se retira",
      "lecontrebandier: se retira",
      "oliverdu70: se retira",
      "NachoAlmirante: no muestra su mano",
      "Asiento 1: SrLyce (ciega pequeña) se retiró antes del Flop",
      "Asiento 2: lecontrebandier (ciega grande) se retiró antes del Flop",
      "Asiento 3: christoph363 se retiró antes del Flop (no apostó)",
      "Asiento 4: oliverdu70 se retiró antes del Flop",
      "Asiento 5: NachoAlmirante recaudó (0.07 €)",
      "Asiento 6: Dakoo44 (botón) se retiró antes del Flop (no apostó)"
    ],
    "flop": [],
    "turn": [],
    "river": []
  },
  "board": [],
  "winner": "NachoAlmirante",
  "win_amount": 3.5,
  "sb": 0.01,
  "bb": 0.02,
  "rake": 0.0,
  "raw_text": "Mano n.º 257148947860 de PokerStars:  Hold'em No Limit (0.01 €/0.02 € EUR) - 30-07-2025 21:55:24 CET [30-07-2025 15:55:24 ET]\nMesa \"Sirona\" 6-max El asiento n.º 6 es el botón\nAsiento 1: SrLyce (2.20 € en fichas) \nAsiento 2: lecontrebandier (1.96 € en fichas) \nAsiento 3: christoph363 (4.13 € en fichas) \nAsiento 4: oliverdu70 (2.82 € en fichas) \nAsiento 5: NachoAlmirante (2.15 € en fichas) \nAsiento 6: Dakoo44 (1.41 € en fichas) \nSrLyce: pone la ciega pequeña 0.01 €\nlecontrebandier: pone la ciega grande 0.02 €\n*** CARTAS DE MANO ***\nRepartidas a SrLyce [Td Ac]\nchristoph363: se retira \noliverdu70: iguala 0.02 €\nNachoAlmirante: sube 0.08 € a 0.10 €\nDakoo44: se retira \nSrLyce: se retira \nlecontrebandier: se retira \noliverdu70: se retira \nLa apuesta no igualada (0.08 €) ha sido devuelta a NachoAlmirante\nNachoAlmirante se lleva 0.07 € del bote \nNachoAlmirante: no muestra su mano \n*** RESUMEN ***\nBote total 0.07 € | Comisión 0 € \nAsiento 1: SrLyce (ciega pequeña) se retiró antes del Flop\nAsiento 2: lecontrebandier (ciega grande) se retiró antes del Flop\nAsiento 3: christoph363 se retiró antes del Flop (no apostó)\nAsiento 4: oliverdu70 se retiró antes del Flop\nAsiento 5: NachoAlmirante recaudó (0.07 €)\nAsiento 6: Dakoo44 (botón) se retiró antes del Flop (no apostó)"
}