{
  "hand_id": "257238540143",
  "date": "06-08-2025 19:08:21",
  "table": "Herculina II",
  "game_type": "holdem",
  "hero": "SrLyce",
  "hero_position": "",
  "hero_cards": [
    "8h",
    "3c"
  ],
  "stacks": {
    "koldipk": 203.5,
    "David98X": 175.0,
    "JJer11": 208.0,
    "SrLyce": 100.0,
    "Macklemore0": 100.0,
    "ScarvBlack": 114.5
  },
  "actions": {
    "preflop": [
      "Asiento 1: koldipk (4.07 € en fichas)",
      "Asiento 2: David98X (3.50 € en fichas)",
      "Asiento 3: JJer11 (4.16 € en fichas)",
      "Asiento 4: SrLyce (2 € en fichas)",
      "Asiento 5: Macklemore0 (2 € en fichas)",
      "Asiento 6: ScarvBlack (2.29 € en fichas)",
      "JJer11: pone la ciega pequeña 0.01 €",
      "SrLyce: pone la ciega grande 0.02 €",
      "Macklemore0: se retira",
      "ScarvBlack: se retira",
      "koldipk: sube 0.02 € a 0.04 €",
      "David98X: se retira",
      "JJer11: se retira",
      "SrLyce: se retira",
      "Asiento 1: koldipk recaudó (0.05 €)",
      "Asiento 2: David98X (botón) se retiró antes del Flop (no apostó)",
      "Asiento 3: JJer11 (ciega pequeña) se retiró antes del Flop",
      "Asiento 4: SrLyce (ciega grande) se retiró antes del Flop",
      "Asiento 5: Macklemore0 se retiró antes del Flop (no apostó)",
      "Asiento 6: ScarvBlack se retiró antes del Flop (no apostó)"
    ],
    "flop": [],
    "turn": [],
    "river": []
  },
  "board": [],
  "winner": "koldipk",
  "win_amount": 2.5,
  "sb": 0.01,
  "bb": 0.02,
  "rake": 0.0,
  "raw_text": "Mano n.º 257238540143 de PokerStars:  Hold'em No Limit (0.01 €/0.02 € EUR) - 06-08-2025 19:08:21 CET [06-08-2025 13:08:21 ET]\nMesa \"Herculina II\" 6-max El asiento n.º 2 es el botón\nAsiento 1: koldipk (4.07 € en fichas) \nAsiento 2: David98X (3.50 € en fichas) \nAsiento 3: JJer11 (4.16 € en fichas) \nAsiento 4: SrLyce (2 € en fichas) \nAsiento 5: Macklemore0 (2 € en fichas) \nAsiento 6: ScarvBlack (2.29 € en fichas) \nJJer11: pone la ciega pequeña 0.01 €\nSrLyce: pone la ciega grande 0.02 €\n*** CARTAS DE MANO ***\nRepartidas a SrLyce [8h 3c]\nMacklemore0: se retira \nScarvBlack: se retira \nkoldipk: sube 0.02 € a 0.04 €\nDavid98X: se retira \nJJer11: se retira \nSrLyce: se retira \nLa apuesta no igualada (0.02 €) ha sido devuelta a koldipk\nkoldipk se lleva 0.05 € del bote \n*** RESUMEN ***\nBote total 0.05 € | Comisión 0 € \nAsiento 1: koldipk recaudó (0.05 €)\nAsiento 2: David98X (botón) se retiró antes del Flop (no apostó)\nAsiento 3: JJer11 (ciega pequeña) se retiró antes del Flop\nAsiento 4: SrLyce (ciega grande) se retiró antes del Flop\nAsiento 5: Macklemore0 se retiró antes del Flop (no apostó)\nAsiento 6: ScarvBlack se retiró antes del Flop (no apostó)"
}