{
  "hand_id": "257238357681",
  "date": "06-08-2025 18:50:50",
  "table": "Alruccabah II",
  "game_type": "holdem",
  "hero": "SrLyce",
  "hero_position": "",
  "hero_cards": [
    "8h",
    "Kc"
  ],
  "stacks": {
    "SrLyce": 100.0,
    "Davdgoni": 283.5,
    "tatinette35": 100.0,
    "Nicanor Cast": 55.5,
    "rayao32": 47.5
  },
  "actions": {
    "preflop": [
      "Asiento 1: SrLyce (2 € en fichas)",
      "Asiento 2: Davdgoni (5.67 € en fichas)",
      "Asiento 3: tatinette35 (2 € en fichas)",
      "Asiento 4: serviettski(fr) (2 € en fichas)",
      "Asiento 5: Nicanor Cast (1.11 € en fichas)",
      "Asiento 6: rayao32 (0.95 € en fichas)",
      "tatinette35: pone la ciega pequeña 0.01 €",
      "serviettski(fr): pone la ciega grande 0.02 €",
      "Nicanor Cast: se retira",
      "rayao32: iguala 0.02 €",
      "SrLyce: se retira",
      "Davdgoni: sube 0.07 € a 0.09 €",
      "tatinette35: se retira",
      "serviettski(fr): se retira",
      "rayao32: se retira",
      "Davdgoni: no muestra su mano",
      "Asiento 1: SrLyce se retiró antes del Flop (no apostó)",
      "Asiento 2: Davdgoni (botón) recaudó (0.07 €)",
      "Asiento 3: tatinette35 (ciega pequeña) se retiró antes del Flop",
      "Asiento 4: serviettski(fr) (ciega grande) se retiró antes del Flop",
      "Asiento 5: Nicanor Cast se retiró antes del Flop (no apostó)",
      "Asiento 6: rayao32 se retiró antes del Flop"
    ],
    "flop": [],
    "turn": [],
    "river": []
  },
  "board": [],
  "winner": "Davdgoni",
  "win_amount": 3.5,
  "sb": 0.01,
  "bb": 0.02,
  "rake": 0.0,
  "raw_text": "Mano n.º 257238357681 de PokerStars:  Hold'em No Limit (0.01 €/0.02 € EUR) - 06-08-2025 18:50:50 CET [06-08-2025 12:50:50 ET]\nMesa \"Alruccabah II\" 6-max El asiento n.º 2 es el botón\nAsiento 1: SrLyce (2 € en fichas) \nAsiento 2: Davdgoni (5.67 € en fichas) \nAsiento 3: tatinette35 (2 € en fichas) \nAsiento 4: serviettski(fr) (2 € en fichas) \nAsiento 5: Nicanor Cast (1.11 € en fichas) \nAsiento 6: rayao32 (0.95 € en fichas) \ntatinette35: pone la ciega pequeña 0.01 €\nserviettski(fr): pone la ciega grande 0.02 €\n*** CARTAS DE MANO ***\nRepartidas a SrLyce [8h Kc]\nNicanor Cast: se retira \nrayao32: iguala 0.02 €\nSrLyce: se retira \nDavdgoni: sube 0.07 € a 0.09 €\ntatinette35: se retira \nserviettski(fr): se retira \nrayao32: se retira \nLa apuesta no igualada (0.07 €) ha sido devuelta a Davdgoni\nDavdgoni se lleva 0.07 € del bote \nDavdgoni: no muestra su mano \n*** RESUMEN ***\nBote total 0.07 € | Comisión 0 € \nAsiento 1: SrLyce se retiró antes del Flop (no apostó)\nAsiento 2: Davdgoni (botón) recaudó (0.07 €)\nAsiento 3: tatinette35 (ciega pequeña) se retiró antes del Flop\nAsiento 4: serviettski(fr) (ciega grande) se retiró antes del Flop\nAsiento 5: Nicanor Cast se retiró antes del Flop (no apostó)\nAsiento 6: rayao32 se retiró antes del Flop"
}