{
  "hand_id": "257168320246",
  "date": "01-08-2025 11:26:10",
  "table": "Jupiter",
  "game_type": "holdem",
  "hero": "SrLyce",
  "hero_position": "",
  "hero_cards": [
    "6h",
    "6s"
  ],
  "stacks": {
    "sifilis5": 95.0,
    "Filou203": 111.5,
    "SrLyce": 119.0,
    "LOLA19711971": 30.5,
    "dadou13mars": 215.5,
    "Alvii37": 108.0
  },
  "actions": {
    "preflop": [
      "Asiento 1: sifilis5 (1.90 € en fichas)",
      "Asiento 2: Filou203 (2.23 € en fichas)",
      "Asiento 3: SrLyce (2.38 € en fichas)",
      "Asiento 4: LOLA19711971 (0.61 € en fichas)",
      "Asiento 5: dadou13mars (4.31 € en fichas)",
      "Asiento 6: Alvii37 (2.16 € en fichas)",
      "SrLyce: pone la ciega pequeña 0.01 €",
      "LOLA19711971: pone la ciega grande 0.02 €",
      "dadou13mars: se retira",
      "Alvii37: se retira",
      "sifilis5: sube 0.04 € a 0.06 €",
      "Filou203: se retira",
      "SrLyce: iguala 0.05 €",
      "LOLA19711971: iguala 0.04 €"
    ],
    "flop": [
      "SrLyce: pasa",
      "LOLA19711971: pasa",
      "sifilis5: apuesta 0.05 €",
      "SrLyce: iguala 0.05 €",
      "LOLA19711971: se retira"
    ],
    "turn": [
      "SrLyce: pasa",
      "sifilis5: pasa"
    ],
    "river": [
      "SrLyce: apuesta 0.13 €",
      "sifilis5: iguala 0.13 €",
      "SrLyce: muestra [6h 6s] (doble pareja, ochos y seises)",
      "sifilis5: muestra [Ac 7c] (doble pareja, ochos y sietes)",
      "Asiento 1: sifilis5 muestra [Ac 7c] y ganó (0.51 €) con doble pareja, ochos y sietes",
      "Asiento 2: Filou203 (botón) se retiró antes del Flop (no apostó)",
      "Asiento 3: SrLyce (ciega pequeña) muestra [6h 6s] y perdió con doble pareja, ochos y seises",
      "Asiento 4: LOLA19711971 (ciega grande) se retiró en el Flop",
      "Asiento 5: dadou13mars se retiró antes del Flop (no apostó)",
      "Asiento 6: Alvii37 se retiró antes del Flop (no apostó)"
    ]
  },
  "board": [
    "7s",
    "Kd",
    "8d",
    "8s",
    "4h"
  ],
  "winner": "sifilis5",
  "win_amount": 25.5,
  "sb": 0.01,
  "bb": 0.02,
  "rake": 1.5,
  "raw_text": "Mano n.º 257168320246 de PokerStars:  Hold'em No Limit (0.01 €/0.02 € EUR) - 01-08-2025 11:26:10 CET [01-08-2025 5:26:10 ET]\nMesa \"Jupiter\" 6-max El asiento n.º 2 es el botón\nAsiento 1: sifilis5 (1.90 € en fichas) \nAsiento 2: Filou203 (2.23 € en fichas) \nAsiento 3: SrLyce (2.38 € en fichas) \nAsiento 4: LOLA19711971 (0.61 € en fichas) \nAsiento 5: dadou13mars (4.31 € en fichas) \nAsiento 6: Alvii37 (2.16 € en fichas) \nSrLyce: pone la ciega pequeña 0.01 €\nLOLA19711971: pone la ciega grande 0.02 €\n*** CARTAS DE MANO ***\nRepartidas a SrLyce [6h 6s]\ndadou13mars: se retira \nAlvii37: se retira \nsifilis5: sube 0.04 € a 0.06 €\nFilou203: se retira \nSrLyce: iguala 0.05 €\nLOLA19711971: iguala 0.04 €\n*** FLOP *** [7s Kd 8d]\nSrLyce: pasa \nLOLA19711971: pasa \nsifilis5: apuesta 0.05 €\nSrLyce: iguala 0.05 €\nLOLA19711971: se retira \n*** TURN *** [7s Kd 8d] [8s]\nSrLyce: pasa \nsifilis5: pasa \n*** RIVER *** [7s Kd 8d 8s] [4h]\nSrLyce: apuesta 0.13 €\nsifilis5: iguala 0.13 €\n*** SHOW DOWN ***\nSrLyce: muestra [6h 6s] (doble pareja, ochos y seises)\nsifilis5: muestra [Ac 7c] (doble pareja, ochos y sietes)\nsifilis5 se lleva 0.51 € del bote \n*** RESUMEN ***\nBote total 0.54 € | Comisión 0.03 € \nComunitarias [7s Kd 8d 8s 4h]\nAsiento 1: sifilis5 muestra [Ac 7c] y ganó (0.51 €) con doble pareja, ochos y sietes\nAsiento 2: Filou203 (botón) se retiró antes del Flop (no apostó)\nAsiento 3: SrLyce (ciega pequeña) muestra [6h 6s] y perdió con doble pareja, ochos y seises\nAsiento 4: LOLA19711971 (ciega grande) se retiró en el Flop\nAsiento 5: dadou13mars se retiró antes del Flop (no apostó)\nAsiento 6: Alvii37 se retiró antes del Flop (no apostó)"
}