{
  "hand_id": "257168227085",
  "date": "01-08-2025 11:08:14",
  "table": "Sekanina",
  "game_type": "holdem",
  "hero": "SrLyce",
  "hero_position": "",
  "hero_cards": [
    "7h",
    "7s"
  ],
  "stacks": {
    "practikal_C23": 82.5,
    "Alvii37": 92.0,
    "SrLyce": 102.0,
    "davinci1962": 106.5,
    "Elministrelas": 96.5
  },
  "actions": {
    "preflop": [
      "Asiento 2: practikal_C23 (1.65 € en fichas)",
      "Asiento 3: Alvii37 (1.84 € en fichas)",
      "Asiento 4: SrLyce (2.04 € en fichas)",
      "Asiento 5: davinci1962 (2.13 € en fichas)",
      "Asiento 6: Elministrelas (1.93 € en fichas)",
      "Elministrelas: pone la ciega pequeña 0.01 €",
      "practikal_C23: pone la ciega grande 0.02 €",
      "Alvii37: sube 0.04 € a 0.06 €",
      "SrLyce: iguala 0.06 €",
      "davinci1962: se retira",
      "Elministrelas: se retira",
      "practikal_C23: se retira"
    ],
    "flop": [
      "Alvii37: pasa",
      "SrLyce: pasa"
    ],
    "turn": [
      "Alvii37: apuesta 0.14 €",
      "SrLyce: iguala 0.14 €"
    ],
    "river": [
      "Alvii37: apuesta 0.30 €",
      "SrLyce: se retira",
      "Alvii37: no muestra su mano",
      "Asiento 2: practikal_C23 (ciega grande) se retiró antes del Flop",
      "Asiento 3: Alvii37 recaudó (0.40 €)",
      "Asiento 4: SrLyce se retiró en el River",
      "Asiento 5: davinci1962 (botón) se retiró antes del Flop (no apostó)",
      "Asiento 6: Elministrelas (ciega pequeña) se retiró antes del Flop"
    ]
  },
  "board": [
    "Kc",
    "4c",
    "5c",
    "Ts",
    "9s"
  ],
  "winner": "Alvii37",
  "win_amount": 20.0,
  "sb": 0.01,
  "bb": 0.02,
  "rake": 1.5,
  "raw_text": "Mano n.º 257168227085 de PokerStars:  Hold'em No Limit (0.01 €/0.02 € EUR) - 01-08-2025 11:08:14 CET [01-08-2025 5:08:14 ET]\nMesa \"Sekanina\" 6-max El asiento n.º 5 es el botón\nAsiento 2: practikal_C23 (1.65 € en fichas) \nAsiento 3: Alvii37 (1.84 € en fichas) \nAsiento 4: SrLyce (2.04 € en fichas) \nAsiento 5: davinci1962 (2.13 € en fichas) \nAsiento 6: Elministrelas (1.93 € en fichas) \nElministrelas: pone la ciega pequeña 0.01 €\npractikal_C23: pone la ciega grande 0.02 €\n*** CARTAS DE MANO ***\nRepartidas a SrLyce [7h 7s]\nAlvii37: sube 0.04 € a 0.06 €\nSrLyce: iguala 0.06 €\ndavinci1962: se retira \nDagonBZH56 se une a la mesa en el asiento n.º 1 \nElministrelas: se retira \npractikal_C23: se retira \n*** FLOP *** [Kc 4c 5c]\nAlvii37: pasa \nSrLyce: pasa \n*** TURN *** [Kc 4c 5c] [Ts]\nAlvii37: apuesta 0.14 €\nSrLyce: iguala 0.14 €\n*** RIVER *** [Kc 4c 5c Ts] [9s]\nAlvii37: apuesta 0.30 €\nSrLyce: se retira \nLa apuesta no igualada (0.30 €) ha sido devuelta a Alvii37\nAlvii37 se lleva 0.40 € del bote \nAlvii37: no muestra su mano \n*** RESUMEN ***\nBote total 0.43 € | Comisión 0.03 € \nComunitarias [Kc 4c 5c Ts 9s]\nAsiento 2: practikal_C23 (ciega grande) se retiró antes del Flop\nAsiento 3: Alvii37 recaudó (0.40 €)\nAsiento 4: SrLyce se retiró en el River\nAsiento 5: davinci1962 (botón) se retiró antes del Flop (no apostó)\nAsiento 6: Elministrelas (ciega pequeña) se retiró antes del Flop"
}