{
  "hand_id": "257149853240",
  "date": "30-07-2025 23:01:22",
  "table": "Lobelia",
  "game_type": "holdem",
  "hero": "SrLyce",
  "hero_position": "",
  "hero_cards": [
    "Ac",
    "Jd"
  ],
  "stacks": {
    "LeVbks": 95.0,
    "fcis666": 60.5,
    "Dlaguancha": 78.5,
    "SrLyce": 99.0,
    "riverluck444": 77.5,
    "Kiffou39": 50.0
  },
  "actions": {
    "preflop": [
      "Asiento 1: LeVbks (1.90 € en fichas)",
      "Asiento 2: fcis666 (1.21 € en fichas)",
      "Asiento 3: Dlaguancha (1.57 € en fichas)",
      "Asiento 4: SrLyce (1.98 € en fichas)",
      "Asiento 5: riverluck444 (1.55 € en fichas)",
      "Asiento 6: Kiffou39 (1 € en fichas)",
      "SrLyce: pone la ciega pequeña 0.01 €",
      "riverluck444: pone la ciega grande 0.02 €",
      "Kiffou39: se retira",
      "LeVbks: se retira",
      "fcis666: se retira",
      "Dlaguancha: iguala 0.02 €",
      "SrLyce: sube 0.04 € a 0.06 €",
      "riverluck444: se retira",
      "Dlaguancha: iguala 0.04 €"
    ],
    "flop": [
      "SrLyce: apuesta 0.07 €",
      "Dlaguancha: iguala 0.07 €"
    ],
    "turn": [
      "SrLyce: pasa",
      "Dlaguancha: apuesta 0.02 €",
      "SrLyce: sube 0.10 € a 0.12 €",
      "Dlaguancha: iguala 0.10 €"
    ],
    "river": [
      "SrLyce: pasa",
      "Dlaguancha: pasa",
      "SrLyce: muestra [Ac Jd] (doble pareja, ases y jotas)",
      "Dlaguancha: descarta su mano sin mostrar",
      "Asiento 1: LeVbks se retiró antes del Flop (no apostó)",
      "Asiento 2: fcis666 se retiró antes del Flop (no apostó)",
      "Asiento 3: Dlaguancha (botón) descartó sin mostrar [2d Ah]",
      "Asiento 4: SrLyce (ciega pequeña) muestra [Ac Jd] y ganó (0.49 €) con doble pareja, ases y jotas",
      "Asiento 5: riverluck444 (ciega grande) se retiró antes del Flop",
      "Asiento 6: Kiffou39 se retiró antes del Flop (no apostó)"
    ]
  },
  "board": [
    "8s",
    "As",
    "Jc",
    "Th",
    "Kc"
  ],
  "winner": "SrLyce",
  "win_amount": 24.5,
  "sb": 0.01,
  "bb": 0.02,
  "rake": 1.5,
  "raw_text": "Mano n.º 257149853240 de PokerStars:  Hold'em No Limit (0.01 €/0.02 € EUR) - 30-07-2025 23:01:22 CET [30-07-2025 17:01:22 ET]\nMesa \"Lobelia\" 6-max El asiento n.º 3 es el botón\nAsiento 1: LeVbks (1.90 € en fichas) \nAsiento 2: fcis666 (1.21 € en fichas) \nAsiento 3: Dlaguancha (1.57 € en fichas) \nAsiento 4: SrLyce (1.98 € en fichas) \nAsiento 5: riverluck444 (1.55 € en fichas) \nAsiento 6: Kiffou39 (1 € en fichas) \nSrLyce: pone la ciega pequeña 0.01 €\nriverluck444: pone la ciega grande 0.02 €\n*** CARTAS DE MANO ***\nRepartidas a SrLyce [Ac Jd]\nKiffou39: se retira \nLeVbks: se retira \nfcis666: se retira \nDlaguancha: iguala 0.02 €\nSrLyce: sube 0.04 € a 0.06 €\nriverluck444: se retira \nDlaguancha: iguala 0.04 €\n*** FLOP *** [8s As Jc]\nSrLyce: apuesta 0.07 €\nDlaguancha: iguala 0.07 €\n*** TURN *** [8s As Jc] [Th]\nSrLyce: pasa \nDlaguancha: apuesta 0.02 €\nSrLyce: sube 0.10 € a 0.12 €\nDlaguancha: iguala 0.10 €\n*** RIVER *** [8s As Jc Th] [Kc]\nSrLyce: pasa \nDlaguancha: pasa \n*** SHOW DOWN ***\nSrLyce: muestra [Ac Jd] (doble pareja, ases y jotas)\nDlaguancha: descarta su mano sin mostrar \nSrLyce se lleva 0.49 € del bote \n*** RESUMEN ***\nBote total 0.52 € | Comisión 0.03 € \nComunitarias [8s As Jc Th Kc]\nAsiento 1: LeVbks se retiró antes del Flop (no apostó)\nAsiento 2: fcis666 se retiró antes del Flop (no apostó)\nAsiento 3: Dlaguancha (botón) descartó sin mostrar [2d Ah]\nAsiento 4: SrLyce (ciega pequeña) muestra [Ac Jd] y ganó (0.49 €) con doble pareja, ases y jotas\nAsiento 5: riverluck444 (ciega grande) se retiró antes del Flop\nAsiento 6: Kiffou39 se retiró antes del Flop (no apostó)"
}