{
  "hand_id": "257148670682",
  "date": "30-07-2025 21:35:46",
  "table": "Sirona",
  "game_type": "holdem",
  "hero": "SrLyce",
  "hero_position": "",
  "hero_cards": [
    "4s",
    "Jc"
  ],
  "stacks": {
    "SrLyce": 96.5,
    "lecontrebandier": 98.5,
    "christoph363": 179.5,
    "oliverdu70": 94.5,
    "olibellier": 33.0,
    "Dakoo44": 114.0
  },
  "actions": {
    "preflop": [
      "Asiento 1: SrLyce (1.93 € en fichas)",
      "Asiento 2: lecontrebandier (1.97 € en fichas)",
      "Asiento 3: christoph363 (3.59 € en fichas)",
      "Asiento 4: oliverdu70 (1.89 € en fichas)",
      "Asiento 5: olibellier (0.66 € en fichas)",
      "Asiento 6: Dakoo44 (2.28 € en fichas)",
      "olibellier: pone la ciega pequeña 0.01 €",
      "Dakoo44: pone la ciega grande 0.02 €",
      "SrLyce: se retira",
      "lecontrebandier: se retira",
      "christoph363: se retira",
      "oliverdu70: sube 0.04 € a 0.06 €",
      "olibellier: se retira",
      "Dakoo44: iguala 0.04 €"
    ],
    "flop": [
      "Dakoo44: pasa",
      "oliverdu70: pasa"
    ],
    "turn": [
      "Dakoo44: pasa",
      "oliverdu70: apuesta 0.06 €",
      "Dakoo44: iguala 0.06 €"
    ],
    "river": [
      "Dakoo44: pasa",
      "oliverdu70: apuesta 0.12 €",
      "Dakoo44: se retira",
      "Asiento 1: SrLyce se retiró antes del Flop (no apostó)",
      "Asiento 2: lecontrebandier se retiró antes del Flop (no apostó)",
      "Asiento 3: christoph363 se retiró antes del Flop (no apostó)",
      "Asiento 4: oliverdu70 (botón) recaudó (0.23 €)",
      "Asiento 5: olibellier (ciega pequeña) se retiró antes del Flop",
      "Asiento 6: Dakoo44 (ciega grande) se retiró en el River"
    ]
  },
  "board": [
    "Jh",
    "9s",
    "Qs",
    "5d",
    "5c"
  ],
  "winner": "oliverdu70",
  "win_amount": 11.5,
  "sb": 0.01,
  "bb": 0.02,
  "rake": 1.0,
  "raw_text": "Mano n.º 257148670682 de PokerStars:  Hold'em No Limit (0.01 €/0.02 € EUR) - 30-07-2025 21:35:46 CET [30-07-2025 15:35:46 ET]\nMesa \"Sirona\" 6-max El asiento n.º 4 es el botón\nAsiento 1: SrLyce (1.93 € en fichas) \nAsiento 2: lecontrebandier (1.97 € en fichas) \nAsiento 3: christoph363 (3.59 € en fichas) \nAsiento 4: oliverdu70 (1.89 € en fichas) \nAsiento 5: olibellier (0.66 € en fichas) \nAsiento 6: Dakoo44 (2.28 € en fichas) \nolibellier: pone la ciega pequeña 0.01 €\nDakoo44: pone la ciega grande 0.02 €\n*** CARTAS DE MANO ***\nRepartidas a SrLyce [4s Jc]\nSrLyce: se retira \nlecontrebandier: se retira \nchristoph363: se retira \noliverdu70: sube 0.04 € a 0.06 €\nolibellier: se retira \nDakoo44: iguala 0.04 €\n*** FLOP *** [Jh 9s Qs]\nDakoo44: pasa \noliverdu70: pasa \n*** TURN *** [Jh 9s Qs] [5d]\nDakoo44: pasa \noliverdu70: apuesta 0.06 €\nDakoo44: iguala 0.06 €\n*** RIVER *** [Jh 9s Qs 5d] [5c]\nDakoo44: pasa \noliverdu70: apuesta 0.12 €\nDakoo44: se retira \nLa apuesta no igualada (0.12 €) ha sido devuelta a oliverdu70\noliverdu70 se lleva 0.23 € del bote \n*** RESUMEN ***\nBote total 0.25 € | Comisión 0.02 € \nComunitarias [Jh 9s Qs 5d 5c]\nAsiento 1: SrLyce se retiró antes del Flop (no apostó)\nAsiento 2: lecontrebandier se retiró antes del Flop (no apostó)\nAsiento 3: christoph363 se retiró antes del Flop (no apostó)\nAsiento 4: oliverdu70 (botón) recaudó (0.23 €)\nAsiento 5: olibellier (ciega pequeña) se retiró antes del Flop\nAsiento 6: Dakoo44 (ciega grande) se retiró en el River"
}