{
  "hand_id": "257215052879",
  "date": "04-08-2025 22:21:25",
  "table": "Anneliese II",
  "game_type": "holdem",
  "hero": "SrLyce",
  "hero_position": "",
  "hero_cards": [
    "9h",
    "Jd"
  ],
  "stacks": {
    "SiveSinouts": 100.0,
    "betterrrrrr": 100.0,
    "ElManu62": 116.0,
    "SrLyce": 97.0,
    "Mr_Pkr98": 140.5,
    "Spotick": 111.0
  },
  "actions": {
    "preflop": [
      "Asiento 2: SiveSinouts (2 € en fichas) está ausente",
      "Asiento 1: betterrrrrr (2 € en fichas)",
      "Asiento 3: ElManu62 (2.32 € en fichas)",
      "Asiento 4: SrLyce (1.94 € en fichas)",
      "Asiento 5: Mr_Pkr98 (2.81 € en fichas)",
      "Asiento 6: Spotick (2.22 € en fichas)",
      "Mr_Pkr98: pone la ciega pequeña 0.01 €",
      "Spotick: pone la ciega grande 0.02 €",
      "SiveSinouts: se ausenta",
      "betterrrrrr: se retira",
      "ElManu62: se retira",
      "SrLyce: sube 0.04 € a 0.06 €",
      "Mr_Pkr98: se retira",
      "Spotick: se retira",
      "SrLyce: no muestra su mano",
      "Asiento 2: SiveSinouts",
      "Asiento 1: betterrrrrr se retiró antes del Flop (no apostó)",
      "Asiento 3: ElManu62 se retiró antes del Flop (no apostó)",
      "Asiento 4: SrLyce (botón) recaudó (0.05 €)",
      "Asiento 5: Mr_Pkr98 (ciega pequeña) se retiró antes del Flop",
      "Asiento 6: Spotick (ciega grande) se retiró antes del Flop"
    ],
    "flop": [],
    "turn": [],
    "river": []
  },
  "board": [],
  "winner": "SrLyce",
  "win_amount": 2.5,
  "sb": 0.01,
  "bb": 0.02,
  "rake": 0.0,
  "raw_text": "Mano n.º 257215052879 de PokerStars:  Hold'em No Limit (0.01 €/0.02 € EUR) - 04-08-2025 22:21:25 CET [04-08-2025 16:21:25 ET]\nMesa \"Anneliese II\" 6-max El asiento n.º 4 es el botón\nAsiento 2: SiveSinouts (2 € en fichas) está ausente\nAsiento 1: betterrrrrr (2 € en fichas) \nAsiento 3: ElManu62 (2.32 € en fichas) \nAsiento 4: SrLyce (1.94 € en fichas) \nAsiento 5: Mr_Pkr98 (2.81 € en fichas) \nAsiento 6: Spotick (2.22 € en fichas) \nMr_Pkr98: pone la ciega pequeña 0.01 €\nSpotick: pone la ciega grande 0.02 €\nSiveSinouts: se ausenta \n*** CARTAS DE MANO ***\nRepartidas a SrLyce [9h Jd]\nbetterrrrrr: se retira \nElManu62: se retira \nSiveSinouts deja la mesa\nSrLyce: sube 0.04 € a 0.06 €\nMr_Pkr98: se retira \nSpotick: se retira \nLa apuesta no igualada (0.04 €) ha sido devuelta a SrLyce\nSrLyce se lleva 0.05 € del bote \nSrLyce: no muestra su mano \n*** RESUMEN ***\nBote total 0.05 € | Comisión 0 € \nAsiento 2: SiveSinouts\nAsiento 1: betterrrrrr se retiró antes del Flop (no apostó)\nAsiento 3: ElManu62 se retiró antes del Flop (no apostó)\nAsiento 4: SrLyce (botón) recaudó (0.05 €)\nAsiento 5: Mr_Pkr98 (ciega pequeña) se retiró antes del Flop\nAsiento 6: Spotick (ciega grande) se retiró antes del Flop"
}