{
  "hand_id": "257238060905",
  "date": "06-08-2025 18:24:36",
  "table": "Alruccabah II",
  "game_type": "holdem",
  "hero": "SrLyce",
  "hero_position": "",
  "hero_cards": [
    "2d",
    "8c"
  ],
  "stacks": {
    "SrLyce": 99.0,
    "Davdgoni": 258.5,
    "PerroBestia": 29.5,
    "Nicanor Cast": 37.0,
    "THEBLACK972": 212.0
  },
  "actions": {
    "preflop": [
      "Asiento 1: SrLyce (1.98 € en fichas)",
      "Asiento 2: Davdgoni (5.17 € en fichas)",
      "Asiento 3: PerroBestia (0.59 € en fichas)",
      "Asiento 4: serviettski(fr) (2.04 € en fichas)",
      "Asiento 5: Nicanor Cast (0.74 € en fichas)",
      "Asiento 6: THEBLACK972 (4.24 € en fichas)",
      "serviettski(fr): pone la ciega pequeña 0.01 €",
      "Nicanor Cast: pone la ciega grande 0.02 €",
      "THEBLACK972: iguala 0.02 €",
      "SrLyce: se retira",
      "Davdgoni: sube 0.07 € a 0.09 €",
      "PerroBestia: se retira",
      "serviettski(fr): se retira",
      "Nicanor Cast: se retira",
      "THEBLACK972: iguala 0.07 €"
    ],
    "flop": [
      "THEBLACK972: pasa",
      "Davdgoni: pasa"
    ],
    "turn": [
      "THEBLACK972: pasa",
      "Davdgoni: pasa"
    ],
    "river": [
      "THEBLACK972: pasa",
      "Davdgoni: apuesta 0.20 €",
      "THEBLACK972: se retira",
      "Davdgoni: no muestra su mano",
      "Asiento 1: SrLyce se retiró antes del Flop (no apostó)",
      "Asiento 2: Davdgoni recaudó (0.20 €)",
      "Asiento 3: PerroBestia (botón) se retiró antes del Flop (no apostó)",
      "Asiento 4: serviettski(fr) (ciega pequeña) se retiró antes del Flop",
      "Asiento 5: Nicanor Cast (ciega grande) se retiró antes del Flop",
      "Asiento 6: THEBLACK972 se retiró en el River"
    ]
  },
  "board": [
    "3d",
    "2s",
    "4s",
    "6d",
    "4h"
  ],
  "winner": "Davdgoni",
  "win_amount": 10.0,
  "sb": 0.01,
  "bb": 0.02,
  "rake": 0.5,
  "raw_text": "Mano n.º 257238060905 de PokerStars:  Hold'em No Limit (0.01 €/0.02 € EUR) - 06-08-2025 18:24:36 CET [06-08-2025 12:24:36 ET]\nMesa \"Alruccabah II\" 6-max El asiento n.º 3 es el botón\nAsiento 1: SrLyce (1.98 € en fichas) \nAsiento 2: Davdgoni (5.17 € en fichas) \nAsiento 3: PerroBestia (0.59 € en fichas) \nAsiento 4: serviettski(fr) (2.04 € en fichas) \nAsiento 5: Nicanor Cast (0.74 € en fichas) \nAsiento 6: THEBLACK972 (4.24 € en fichas) \nserviettski(fr): pone la ciega pequeña 0.01 €\nNicanor Cast: pone la ciega grande 0.02 €\n*** CARTAS DE MANO ***\nRepartidas a SrLyce [2d 8c]\nTHEBLACK972: iguala 0.02 €\nSrLyce: se retira \nDavdgoni: sube 0.07 € a 0.09 €\nPerroBestia: se retira \nserviettski(fr): se retira \nNicanor Cast: se retira \nTHEBLACK972: iguala 0.07 €\n*** FLOP *** [3d 2s 4s]\nTHEBLACK972: pasa \nDavdgoni: pasa \n*** TURN *** [3d 2s 4s] [6d]\nTHEBLACK972: pasa \nDavdgoni: pasa \n*** RIVER *** [3d 2s 4s 6d] [4h]\nTHEBLACK972: pasa \nDavdgoni: apuesta 0.20 €\nTHEBLACK972: se retira \nLa apuesta no igualada (0.20 €) ha sido devuelta a Davdgoni\nDavdgoni se lleva 0.20 € del bote \nDavdgoni: no muestra su mano \n*** RESUMEN ***\nBote total 0.21 € | Comisión 0.01 € \nComunitarias [3d 2s 4s 6d 4h]\nAsiento 1: SrLyce se retiró antes del Flop (no apostó)\nAsiento 2: Davdgoni recaudó (0.20 €)\nAsiento 3: PerroBestia (botón) se retiró antes del Flop (no apostó)\nAsiento 4: serviettski(fr) (ciega pequeña) se retiró antes del Flop\nAsiento 5: Nicanor Cast (ciega grande) se retiró antes del Flop\nAsiento 6: THEBLACK972 se retiró en el River"
}