{
  "hand_id": "257168291753",
  "date": "01-08-2025 11:20:50",
  "table": "Atlas",
  "game_type": "holdem",
  "hero": "SrLyce",
  "hero_position": "",
  "hero_cards": [
    "6d",
    "5h"
  ],
  "stacks": {
    "SrLyce": 90.5,
    "Fharock": 96.5,
    "ecuinas": 97.5,
    "LxckxStrxkx": 106.5,
    "erCampos23": 34.0,
    "Akourdideh": 116.0
  },
  "actions": {
    "preflop": [
      "Asiento 1: SrLyce (1.81 € en fichas)",
      "Asiento 2: Fharock (1.93 € en fichas)",
      "Asiento 3: ecuinas (1.95 € en fichas)",
      "Asiento 4: LxckxStrxkx (2.13 € en fichas)",
      "Asiento 5: erCampos23 (0.68 € en fichas)",
      "Asiento 6: Akourdideh (2.32 € en fichas)",
      "ecuinas: pone la ciega pequeña 0.01 €",
      "LxckxStrxkx: pone la ciega grande 0.02 €",
      "erCampos23: se retira",
      "Akourdideh: se retira",
      "SrLyce: se retira",
      "Fharock: sube 0.02 € a 0.04 €",
      "ecuinas: iguala 0.03 €",
      "LxckxStrxkx: se retira"
    ],
    "flop": [
      "ecuinas: pasa",
      "Fharock: pasa"
    ],
    "turn": [
      "ecuinas: apuesta 0.05 €",
      "Fharock: iguala 0.05 €"
    ],
    "river": [
      "ecuinas: apuesta 0.08 €",
      "Fharock: se retira",
      "ecuinas: no muestra su mano",
      "Asiento 1: SrLyce se retiró antes del Flop (no apostó)",
      "Asiento 2: Fharock (botón) se retiró en el River",
      "Asiento 3: ecuinas (ciega pequeña) recaudó (0.19 €)",
      "Asiento 4: LxckxStrxkx (ciega grande) se retiró antes del Flop",
      "Asiento 5: erCampos23 se retiró antes del Flop (no apostó)",
      "Asiento 6: Akourdideh se retiró antes del Flop (no apostó)"
    ]
  },
  "board": [
    "6h",
    "4h",
    "3h",
    "5c",
    "9h"
  ],
  "winner": "ecuinas",
  "win_amount": 9.5,
  "sb": 0.01,
  "bb": 0.02,
  "rake": 0.5,
  "raw_text": "Mano n.º 257168291753 de PokerStars:  Hold'em No Limit (0.01 €/0.02 € EUR) - 01-08-2025 11:20:50 CET [01-08-2025 5:20:50 ET]\nMesa \"Atlas\" 6-max El asiento n.º 2 es el botón\nAsiento 1: SrLyce (1.81 € en fichas) \nAsiento 2: Fharock (1.93 € en fichas) \nAsiento 3: ecuinas (1.95 € en fichas) \nAsiento 4: LxckxStrxkx (2.13 € en fichas) \nAsiento 5: erCampos23 (0.68 € en fichas) \nAsiento 6: Akourdideh (2.32 € en fichas) \necuinas: pone la ciega pequeña 0.01 €\nLxckxStrxkx: pone la ciega grande 0.02 €\n*** CARTAS DE MANO ***\nRepartidas a SrLyce [6d 5h]\nerCampos23: se retira \nAkourdideh: se retira \nSrLyce: se retira \nFharock: sube 0.02 € a 0.04 €\necuinas: iguala 0.03 €\nLxckxStrxkx: se retira \n*** FLOP *** [6h 4h 3h]\necuinas: pasa \nFharock: pasa \n*** TURN *** [6h 4h 3h] [5c]\necuinas: apuesta 0.05 €\nFharock: iguala 0.05 €\n*** RIVER *** [6h 4h 3h 5c] [9h]\necuinas: apuesta 0.08 €\nFharock: se retira \nLa apuesta no igualada (0.08 €) ha sido devuelta a ecuinas\necuinas se lleva 0.19 € del bote \necuinas: no muestra su mano \n*** RESUMEN ***\nBote total 0.20 € | Comisión 0.01 € \nComunitarias [6h 4h 3h 5c 9h]\nAsiento 1: SrLyce se retiró antes del Flop (no apostó)\nAsiento 2: Fharock (botón) se retiró en el River\nAsiento 3: ecuinas (ciega pequeña) recaudó (0.19 €)\nAsiento 4: LxckxStrxkx (ciega grande) se retiró antes del Flop\nAsiento 5: erCampos23 se retiró antes del Flop (no apostó)\nAsiento 6: Akourdideh se retiró antes del Flop (no apostó)"
}