{
  "hand_id": "257237791488",
  "date": "06-08-2025 17:59:16",
  "table": "Euneus III",
  "game_type": "holdem",
  "hero": "SrLyce",
  "hero_position": "",
  "hero_cards": [
    "2d",
    "Kc"
  ],
  "stacks": {
    "DeMula62": 100.0,
    "Il_BM00": 106.5,
    "djrojas9": 146.0,
    "SrLyce": 118.0
  },
  "actions": {
    "preflop": [
      "Asiento 1: DeMula62 (2 € en fichas)",
      "Asiento 2: Il_BM00 (2.13 € en fichas)",
      "Asiento 3: djrojas9 (2.92 € en fichas)",
      "Asiento 5: SrLyce (2.36 € en fichas)",
      "djrojas9: pone la ciega pequeña 0.01 €",
      "SrLyce: pone la ciega grande 0.02 €",
      "DeMula62: se retira",
      "Il_BM00: se retira",
      "djrojas9: se retira",
      "SrLyce: no muestra su mano",
      "Asiento 1: DeMula62 se retiró antes del Flop (no apostó)",
      "Asiento 2: Il_BM00 (botón) se retiró antes del Flop (no apostó)",
      "Asiento 3: djrojas9 (ciega pequeña) se retiró antes del Flop",
      "Asiento 5: SrLyce (ciega grande) recaudó (0.02 €)"
    ],
    "flop": [],
    "turn": [],
    "river": []
  },
  "board": [],
  "winner": "SrLyce",
  "win_amount": 1.0,
  "sb": 0.01,
  "bb": 0.02,
  "rake": 0.0,
  "raw_text": "Mano n.º 257237791488 de PokerStars:  Hold'em No Limit (0.01 €/0.02 € EUR) - 06-08-2025 17:59:16 CET [06-08-2025 11:59:16 ET]\nMesa \"Euneus III\" 6-max El asiento n.º 2 es el botón\nAsiento 1: DeMula62 (2 € en fichas) \nAsiento 2: Il_BM00 (2.13 € en fichas) \nAsiento 3: djrojas9 (2.92 € en fichas) \nAsiento 5: SrLyce (2.36 € en fichas) \ndjrojas9: pone la ciega pequeña 0.01 €\nSrLyce: pone la ciega grande 0.02 €\n*** CARTAS DE MANO ***\nRepartidas a SrLyce [2d Kc]\nDeMula62: se retira \nIl_BM00: se retira \ndjrojas9: se retira \nLa apuesta no igualada (0.01 €) ha sido devuelta a SrLyce\nSrLyce se lleva 0.02 € del bote \nSrLyce: no muestra su mano \n*** RESUMEN ***\nBote total 0.02 € | Comisión 0 € \nAsiento 1: DeMula62 se retiró antes del Flop (no apostó)\nAsiento 2: Il_BM00 (botón) se retiró antes del Flop (no apostó)\nAsiento 3: djrojas9 (ciega pequeña) se retiró antes del Flop\nAsiento 5: SrLyce (ciega grande) recaudó (0.02 €)"
}