{
  "hand_id": "257238163472",
  "date": "06-08-2025 18:33:42",
  "table": "Alruccabah II",
  "game_type": "holdem",
  "hero": "SrLyce",
  "hero_position": "",
  "hero_cards": [
    "7s",
    "8d"
  ],
  "stacks": {
    "rayao32": 39.0,
    "SrLyce": 95.0,
    "Davdgoni": 260.5,
    "PerroBestia": 39.5,
    "Nicanor Cast": 54.5
  },
  "actions": {
    "preflop": [
      "Asiento 6: rayao32 (0.78 € en fichas) está ausente",
      "Asiento 1: SrLyce (1.90 € en fichas)",
      "Asiento 2: Davdgoni (5.21 € en fichas)",
      "Asiento 3: PerroBestia (0.79 € en fichas)",
      "Asiento 4: serviettski(fr) (2.17 € en fichas)",
      "Asiento 5: Nicanor Cast (1.09 € en fichas)",
      "serviettski(fr): pone la ciega pequeña 0.01 €",
      "Nicanor Cast: pone la ciega grande 0.02 €",
      "SrLyce: se retira",
      "Davdgoni: sube 0.04 € a 0.06 €",
      "PerroBestia: iguala 0.06 €",
      "serviettski(fr): se retira",
      "Nicanor Cast: se retira"
    ],
    "flop": [
      "Davdgoni: pasa",
      "PerroBestia: pasa"
    ],
    "turn": [
      "Davdgoni: pasa",
      "PerroBestia: apuesta 0.11 €",
      "Davdgoni: se retira",
      "PerroBestia: no muestra su mano",
      "Asiento 6: rayao32",
      "Asiento 1: SrLyce se retiró antes del Flop (no apostó)",
      "Asiento 2: Davdgoni se retiró en el Turn",
      "Asiento 3: PerroBestia (botón) recaudó (0.14 €)",
      "Asiento 4: serviettski(fr) (ciega pequeña) se retiró antes del Flop",
      "Asiento 5: Nicanor Cast (ciega grande) se retiró antes del Flop"
    ],
    "river": []
  },
  "board": [
    "4s",
    "Ac",
    "4d",
    "Jd"
  ],
  "winner": "PerroBestia",
  "win_amount": 7.0,
  "sb": 0.01,
  "bb": 0.02,
  "rake": 0.5,
  "raw_text": "Mano n.º 257238163472 de PokerStars:  Hold'em No Limit (0.01 €/0.02 € EUR) - 06-08-2025 18:33:42 CET [06-08-2025 12:33:42 ET]\nMesa \"Alruccabah II\" 6-max El asiento n.º 3 es el botón\nAsiento 6: rayao32 (0.78 € en fichas) está ausente\nAsiento 1: SrLyce (1.90 € en fichas) \nAsiento 2: Davdgoni (5.21 € en fichas) \nAsiento 3: PerroBestia (0.79 € en fichas) \nAsiento 4: serviettski(fr) (2.17 € en fichas) \nAsiento 5: Nicanor Cast (1.09 € en fichas) \nserviettski(fr): pone la ciega pequeña 0.01 €\nNicanor Cast: pone la ciega grande 0.02 €\n*** CARTAS DE MANO ***\nRepartidas a SrLyce [7s 8d]\nSrLyce: se retira \nDavdgoni: sube 0.04 € a 0.06 €\nPerroBestia: iguala 0.06 €\nserviettski(fr): se retira \nNicanor Cast: se retira \n*** FLOP *** [4s Ac 4d]\nDavdgoni: pasa \nPerroBestia: pasa \n*** TURN *** [4s Ac 4d] [Jd]\nDavdgoni: pasa \nPerroBestia: apuesta 0.11 €\nDavdgoni: se retira \nLa apuesta no igualada (0.11 €) ha sido devuelta a PerroBestia\nPerroBestia se lleva 0.14 € del bote \nPerroBestia: no muestra su mano \n*** RESUMEN ***\nBote total 0.15 € | Comisión 0.01 € \nComunitarias [4s Ac 4d Jd]\nAsiento 6: rayao32\nAsiento 1: SrLyce se retiró antes del Flop (no apostó)\nAsiento 2: Davdgoni se retiró en el Turn\nAsiento 3: PerroBestia (botón) recaudó (0.14 €)\nAsiento 4: serviettski(fr) (ciega pequeña) se retiró antes del Flop\nAsiento 5: Nicanor Cast (ciega grande) se retiró antes del Flop"
}