{
  "hand_id": "257150063273",
  "date": "30-07-2025 23:15:45",
  "table": "Gilgamesh",
  "game_type": "holdem",
  "hero": "SrLyce",
  "hero_position": "",
  "hero_cards": [
    "Ah",
    "Jd"
  ],
  "stacks": {
    "riverrrrrrmagic": 126.0,
    "SrLyce": 107.5,
    "Jumby34": 100.0,
    "xapkk": 100.0,
    "samaritano34": 48.5,
    "Fretzo67500": 120.5
  },
  "actions": {
    "preflop": [
      "Asiento 1: riverrrrrrmagic (2.52 € en fichas)",
      "Asiento 2: SrLyce (2.15 € en fichas)",
      "Asiento 3: Jumby34 (2 € en fichas)",
      "Asiento 4: xapkk (2 € en fichas)",
      "Asiento 5: samaritano34 (0.97 € en fichas)",
      "Asiento 6: Fretzo67500 (2.41 € en fichas)",
      "Fretzo67500: pone la ciega pequeña 0.01 €",
      "riverrrrrrmagic: pone la ciega grande 0.02 €",
      "SrLyce: sube 0.04 € a 0.06 €",
      "Jumby34: se retira",
      "xapkk: se retira",
      "samaritano34: sube 0.12 € a 0.18 €",
      "Fretzo67500: se retira",
      "riverrrrrrmagic: se retira",
      "SrLyce: iguala 0.12 €"
    ],
    "flop": [
      "SrLyce: pasa",
      "samaritano34: apuesta 0.24 €",
      "SrLyce: sube 0.24 € a 0.48 €",
      "samaritano34: sube 0.31 € a 0.79 € y está all-in",
      "SrLyce: iguala 0.31 €"
    ],
    "turn": [],
    "river": [
      "SrLyce: muestra [Ah Jd] (doble pareja, jotas y treses)",
      "samaritano34: muestra [9s 9c] (full de nueves y treses)",
      "Asiento 1: riverrrrrrmagic (ciega grande) se retiró antes del Flop",
      "Asiento 2: SrLyce muestra [Ah Jd] y perdió con doble pareja, jotas y treses",
      "Asiento 3: Jumby34 se retiró antes del Flop (no apostó)",
      "Asiento 4: xapkk se retiró antes del Flop (no apostó)",
      "Asiento 5: samaritano34 (botón) muestra [9s 9c] y ganó (1.85 €) con full de nueves y treses",
      "Asiento 6: Fretzo67500 (ciega pequeña) se retiró antes del Flop"
    ]
  },
  "board": [
    "Js",
    "9h",
    "3s",
    "8h",
    "3c"
  ],
  "winner": "samaritano34",
  "win_amount": 92.5,
  "sb": 0.01,
  "bb": 0.02,
  "rake": 6.0,
  "raw_text": "Mano n.º 257150063273 de PokerStars:  Hold'em No Limit (0.01 €/0.02 € EUR) - 30-07-2025 23:15:45 CET [30-07-2025 17:15:45 ET]\nMesa \"Gilgamesh\" 6-max El asiento n.º 5 es el botón\nAsiento 1: riverrrrrrmagic (2.52 € en fichas) \nAsiento 2: SrLyce (2.15 € en fichas) \nAsiento 3: Jumby34 (2 € en fichas) \nAsiento 4: xapkk (2 € en fichas) \nAsiento 5: samaritano34 (0.97 € en fichas) \nAsiento 6: Fretzo67500 (2.41 € en fichas) \nFretzo67500: pone la ciega pequeña 0.01 €\nriverrrrrrmagic: pone la ciega grande 0.02 €\n*** CARTAS DE MANO ***\nRepartidas a SrLyce [Ah Jd]\nSrLyce: sube 0.04 € a 0.06 €\nJumby34: se retira \nxapkk: se retira \nsamaritano34: sube 0.12 € a 0.18 €\nFretzo67500: se retira \nriverrrrrrmagic: se retira \nSrLyce: iguala 0.12 €\n*** FLOP *** [Js 9h 3s]\nSrLyce: pasa \nsamaritano34: apuesta 0.24 €\nSrLyce: sube 0.24 € a 0.48 €\nsamaritano34: sube 0.31 € a 0.79 € y está all-in\nSrLyce: iguala 0.31 €\n*** TURN *** [Js 9h 3s] [8h]\n*** RIVER *** [Js 9h 3s 8h] [3c]\n*** SHOW DOWN ***\nSrLyce: muestra [Ah Jd] (doble pareja, jotas y treses)\nsamaritano34: muestra [9s 9c] (full de nueves y treses)\nsamaritano34 se lleva 1.85 € del bote \n*** RESUMEN ***\nBote total 1.97 € | Comisión 0.12 € \nComunitarias [Js 9h 3s 8h 3c]\nAsiento 1: riverrrrrrmagic (ciega grande) se retiró antes del Flop\nAsiento 2: SrLyce muestra [Ah Jd] y perdió con doble pareja, jotas y treses\nAsiento 3: Jumby34 se retiró antes del Flop (no apostó)\nAsiento 4: xapkk se retiró antes del Flop (no apostó)\nAsiento 5: samaritano34 (botón) muestra [9s 9c] y ganó (1.85 €) con full de nueves y treses\nAsiento 6: Fretzo67500 (ciega pequeña) se retiró antes del Flop"
}