{
  "hand_id": "257168297043",
  "date": "01-08-2025 11:21:50",
  "table": "Atlas",
  "game_type": "holdem",
  "hero": "SrLyce",
  "hero_position": "",
  "hero_cards": [
    "As",
    "7d"
  ],
  "stacks": {
    "SrLyce": 90.5,
    "Fharock": 92.0,
    "ecuinas": 102.5,
    "LxckxStrxkx": 105.5,
    "erCampos23": 34.0,
    "Akourdideh": 116.0
  },
  "actions": {
    "preflop": [
      "Asiento 1: SrLyce (1.81 € en fichas)",
      "Asiento 2: Fharock (1.84 € en fichas)",
      "Asiento 3: ecuinas (2.05 € en fichas)",
      "Asiento 4: LxckxStrxkx (2.11 € en fichas)",
      "Asiento 5: erCampos23 (0.68 € en fichas)",
      "Asiento 6: Akourdideh (2.32 € en fichas)",
      "LxckxStrxkx: pone la ciega pequeña 0.01 €",
      "erCampos23: pone la ciega grande 0.02 €",
      "Akourdideh: se retira",
      "SrLyce: sube 0.04 € a 0.06 €",
      "Fharock: se retira",
      "ecuinas: se retira",
      "LxckxStrxkx: se retira",
      "erCampos23: se retira",
      "SrLyce: no muestra su mano",
      "Asiento 1: SrLyce recaudó (0.05 €)",
      "Asiento 2: Fharock se retiró antes del Flop (no apostó)",
      "Asiento 3: ecuinas (botón) se retiró antes del Flop (no apostó)",
      "Asiento 4: LxckxStrxkx (ciega pequeña) se retiró antes del Flop",
      "Asiento 5: erCampos23 (ciega grande) se retiró antes del Flop",
      "Asiento 6: Akourdideh se retiró antes del Flop (no apostó)"
    ],
    "flop": [],
    "turn": [],
    "river": []
  },
  "board": [],
  "winner": "SrLyce",
  "win_amount": 2.5,
  "sb": 0.01,
  "bb": 0.02,
  "rake": 0.0,
  "raw_text": "Mano n.º 257168297043 de PokerStars:  Hold'em No Limit (0.01 €/0.02 € EUR) - 01-08-2025 11:21:50 CET [01-08-2025 5:21:50 ET]\nMesa \"Atlas\" 6-max El asiento n.º 3 es el botón\nAsiento 1: SrLyce (1.81 € en fichas) \nAsiento 2: Fharock (1.84 € en fichas) \nAsiento 3: ecuinas (2.05 € en fichas) \nAsiento 4: LxckxStrxkx (2.11 € en fichas) \nAsiento 5: erCampos23 (0.68 € en fichas) \nAsiento 6: Akourdideh (2.32 € en fichas) \nLxckxStrxkx: pone la ciega pequeña 0.01 €\nerCampos23: pone la ciega grande 0.02 €\n*** CARTAS DE MANO ***\nRepartidas a SrLyce [As 7d]\nAkourdideh: se retira \nSrLyce: sube 0.04 € a 0.06 €\nFharock: se retira \necuinas: se retira \nLxckxStrxkx: se retira \nerCampos23: se retira \nLa apuesta no igualada (0.04 €) ha sido devuelta a SrLyce\nSrLyce se lleva 0.05 € del bote \nSrLyce: no muestra su mano \n*** RESUMEN ***\nBote total 0.05 € | Comisión 0 € \nAsiento 1: SrLyce recaudó (0.05 €)\nAsiento 2: Fharock se retiró antes del Flop (no apostó)\nAsiento 3: ecuinas (botón) se retiró antes del Flop (no apostó)\nAsiento 4: LxckxStrxkx (ciega pequeña) se retiró antes del Flop\nAsiento 5: erCampos23 (ciega grande) se retiró antes del Flop\nAsiento 6: Akourdideh se retiró antes del Flop (no apostó)"
}