{
  "hand_id": "257237591688",
  "date": "06-08-2025 17:39:06",
  "table": "Kale III",
  "game_type": "holdem",
  "hero": "SrLyce",
  "hero_position": "",
  "hero_cards": [
    "Jh",
    "2c"
  ],
  "stacks": {
    "x__Nest__x": 91.5,
    "SrLyce": 121.0,
    "Dracoline000": 107.0,
    "jeffounet33": 99.0,
    "Begoton": 101.0,
    "juanmemol": 104.0
  },
  "actions": {
    "preflop": [
      "Asiento 1: x__Nest__x (1.83 € en fichas)",
      "Asiento 2: SrLyce (2.42 € en fichas)",
      "Asiento 3: Dracoline000 (2.14 € en fichas)",
      "Asiento 4: jeffounet33 (1.98 € en fichas)",
      "Asiento 5: Begoton (2.02 € en fichas)",
      "Asiento 6: juanmemol (2.08 € en fichas)",
      "Dracoline000: pone la ciega pequeña 0.01 €",
      "jeffounet33: pone la ciega grande 0.02 €",
      "Begoton: se retira",
      "juanmemol: se retira",
      "x__Nest__x: se retira",
      "SrLyce: se retira",
      "Dracoline000: sube 0.04 € a 0.06 €",
      "jeffounet33: se retira",
      "Dracoline000: no muestra su mano",
      "Asiento 1: x__Nest__x se retiró antes del Flop (no apostó)",
      "Asiento 2: SrLyce (botón) se retiró antes del Flop (no apostó)",
      "Asiento 3: Dracoline000 (ciega pequeña) recaudó (0.04 €)",
      "Asiento 4: jeffounet33 (ciega grande) se retiró antes del Flop",
      "Asiento 5: Begoton se retiró antes del Flop (no apostó)",
      "Asiento 6: juanmemol se retiró antes del Flop (no apostó)"
    ],
    "flop": [],
    "turn": [],
    "river": []
  },
  "board": [],
  "winner": "Dracoline000",
  "win_amount": 2.0,
  "sb": 0.01,
  "bb": 0.02,
  "rake": 0.0,
  "raw_text": "Mano n.º 257237591688 de PokerStars:  Hold'em No Limit (0.01 €/0.02 € EUR) - 06-08-2025 17:39:06 CET [06-08-2025 11:39:06 ET]\nMesa \"Kale III\" 6-max El asiento n.º 2 es el botón\nAsiento 1: x__Nest__x (1.83 € en fichas) \nAsiento 2: SrLyce (2.42 € en fichas) \nAsiento 3: Dracoline000 (2.14 € en fichas) \nAsiento 4: jeffounet33 (1.98 € en fichas) \nAsiento 5: Begoton (2.02 € en fichas) \nAsiento 6: juanmemol (2.08 € en fichas) \nDracoline000: pone la ciega pequeña 0.01 €\njeffounet33: pone la ciega grande 0.02 €\n*** CARTAS DE MANO ***\nRepartidas a SrLyce [Jh 2c]\nBegoton: se retira \njuanmemol: se retira \nx__Nest__x: se retira \nSrLyce: se retira \nDracoline000: sube 0.04 € a 0.06 €\njeffounet33: se retira \nLa apuesta no igualada (0.04 €) ha sido devuelta a Dracoline000\nDracoline000 se lleva 0.04 € del bote \nDracoline000: no muestra su mano \n*** RESUMEN ***\nBote total 0.04 € | Comisión 0 € \nAsiento 1: x__Nest__x se retiró antes del Flop (no apostó)\nAsiento 2: SrLyce (botón) se retiró antes del Flop (no apostó)\nAsiento 3: Dracoline000 (ciega pequeña) recaudó (0.04 €)\nAsiento 4: jeffounet33 (ciega grande) se retiró antes del Flop\nAsiento 5: Begoton se retiró antes del Flop (no apostó)\nAsiento 6: juanmemol se retiró antes del Flop (no apostó)"
}