{
  "hand_id": "257238531153",
  "date": "06-08-2025 19:07:35",
  "table": "Herculina II",
  "game_type": "holdem",
  "hero": "SrLyce",
  "hero_position": "",
  "hero_cards": [
    "9h",
    "Qc"
  ],
  "stacks": {
    "Macklemore0": 100.0,
    "koldipk": 204.0,
    "David98X": 175.0,
    "JJer11": 209.0,
    "SrLyce": 100.0,
    "ScarvBlack": 113.0
  },
  "actions": {
    "preflop": [
      "Asiento 5: Macklemore0 (2 € en fichas) está ausente",
      "Asiento 1: koldipk (4.08 € en fichas)",
      "Asiento 2: David98X (3.50 € en fichas)",
      "Asiento 3: JJer11 (4.18 € en fichas)",
      "Asiento 4: SrLyce (2 € en fichas)",
      "Asiento 6: ScarvBlack (2.26 € en fichas)",
      "koldipk: pone la ciega pequeña 0.01 €",
      "David98X: pone la ciega grande 0.02 €",
      "JJer11: se retira",
      "SrLyce: se retira",
      "ScarvBlack: se retira",
      "koldipk: se retira",
      "David98X: no muestra su mano",
      "Asiento 5: Macklemore0",
      "Asiento 1: koldipk (ciega pequeña) se retiró antes del Flop",
      "Asiento 2: David98X (ciega grande) recaudó (0.02 €)",
      "Asiento 3: JJer11 se retiró antes del Flop (no apostó)",
      "Asiento 4: SrLyce se retiró antes del Flop (no apostó)",
      "Asiento 6: ScarvBlack (botón) se retiró antes del Flop (no apostó)"
    ],
    "flop": [],
    "turn": [],
    "river": []
  },
  "board": [],
  "winner": "David98X",
  "win_amount": 1.0,
  "sb": 0.01,
  "bb": 0.02,
  "rake": 0.0,
  "raw_text": "Mano n.º 257238531153 de PokerStars:  Hold'em No Limit (0.01 €/0.02 € EUR) - 06-08-2025 19:07:35 CET [06-08-2025 13:07:35 ET]\nMesa \"Herculina II\" 6-max El asiento n.º 6 es el botón\nAsiento 5: Macklemore0 (2 € en fichas) está ausente\nAsiento 1: koldipk (4.08 € en fichas) \nAsiento 2: David98X (3.50 € en fichas) \nAsiento 3: JJer11 (4.18 € en fichas) \nAsiento 4: SrLyce (2 € en fichas) \nAsiento 6: ScarvBlack (2.26 € en fichas) \nkoldipk: pone la ciega pequeña 0.01 €\nDavid98X: pone la ciega grande 0.02 €\n*** CARTAS DE MANO ***\nRepartidas a SrLyce [9h Qc]\nJJer11 ha agotado su tiempo\nJJer11: se retira \nSrLyce: se retira \nScarvBlack: se retira \nkoldipk: se retira \nLa apuesta no igualada (0.01 €) ha sido devuelta a David98X\nDavid98X se lleva 0.02 € del bote \nDavid98X: no muestra su mano \n*** RESUMEN ***\nBote total 0.02 € | Comisión 0 € \nAsiento 5: Macklemore0\nAsiento 1: koldipk (ciega pequeña) se retiró antes del Flop\nAsiento 2: David98X (ciega grande) recaudó (0.02 €)\nAsiento 3: JJer11 se retiró antes del Flop (no apostó)\nAsiento 4: SrLyce se retiró antes del Flop (no apostó)\nAsiento 6: ScarvBlack (botón) se retiró antes del Flop (no apostó)"
}