{
  "hand_id": "257238730726",
  "date": "06-08-2025 19:24:19",
  "table": "Herculina II",
  "game_type": "holdem",
  "hero": "SrLyce",
  "hero_position": "",
  "hero_cards": [
    "Js",
    "7s"
  ],
  "stacks": {
    "Alceo27": 120.5,
    "David98X": 143.0,
    "JJer11": 191.0,
    "SrLyce": 144.0,
    "Macklemore0": 104.0,
    "ScarvBlack": 100.0
  },
  "actions": {
    "preflop": [
      "Asiento 1: Alceo27 (2.41 € en fichas)",
      "Asiento 2: David98X (2.86 € en fichas)",
      "Asiento 3: JJer11 (3.82 € en fichas)",
      "Asiento 4: SrLyce (2.88 € en fichas)",
      "Asiento 5: Macklemore0 (2.08 € en fichas)",
      "Asiento 6: ScarvBlack (2 € en fichas)",
      "JJer11: pone la ciega pequeña 0.01 €",
      "SrLyce: pone la ciega grande 0.02 €",
      "Macklemore0: se retira",
      "ScarvBlack: se retira",
      "Alceo27: se retira",
      "David98X: se retira",
      "JJer11: se retira",
      "SrLyce: no muestra su mano",
      "Asiento 1: Alceo27 se retiró antes del Flop (no apostó)",
      "Asiento 2: David98X (botón) se retiró antes del Flop (no apostó)",
      "Asiento 3: JJer11 (ciega pequeña) se retiró antes del Flop",
      "Asiento 4: SrLyce (ciega grande) recaudó (0.02 €)",
      "Asiento 5: Macklemore0 se retiró antes del Flop (no apostó)",
      "Asiento 6: ScarvBlack se retiró antes del Flop (no apostó)"
    ],
    "flop": [],
    "turn": [],
    "river": []
  },
  "board": [],
  "winner": "SrLyce",
  "win_amount": 1.0,
  "sb": 0.01,
  "bb": 0.02,
  "rake": 0.0,
  "raw_text": "Mano n.º 257238730726 de PokerStars:  Hold'em No Limit (0.01 €/0.02 € EUR) - 06-08-2025 19:24:19 CET [06-08-2025 13:24:19 ET]\nMesa \"Herculina II\" 6-max El asiento n.º 2 es el botón\nAsiento 1: Alceo27 (2.41 € en fichas) \nAsiento 2: David98X (2.86 € en fichas) \nAsiento 3: JJer11 (3.82 € en fichas) \nAsiento 4: SrLyce (2.88 € en fichas) \nAsiento 5: Macklemore0 (2.08 € en fichas) \nAsiento 6: ScarvBlack (2 € en fichas) \nJJer11: pone la ciega pequeña 0.01 €\nSrLyce: pone la ciega grande 0.02 €\n*** CARTAS DE MANO ***\nRepartidas a SrLyce [Js 7s]\nMacklemore0: se retira \nScarvBlack: se retira \nAlceo27: se retira \nDavid98X: se retira \nJJer11: se retira \nLa apuesta no igualada (0.01 €) ha sido devuelta a SrLyce\nSrLyce se lleva 0.02 € del bote \nSrLyce: no muestra su mano \n*** RESUMEN ***\nBote total 0.02 € | Comisión 0 € \nAsiento 1: Alceo27 se retiró antes del Flop (no apostó)\nAsiento 2: David98X (botón) se retiró antes del Flop (no apostó)\nAsiento 3: JJer11 (ciega pequeña) se retiró antes del Flop\nAsiento 4: SrLyce (ciega grande) recaudó (0.02 €)\nAsiento 5: Macklemore0 se retiró antes del Flop (no apostó)\nAsiento 6: ScarvBlack se retiró antes del Flop (no apostó)"
}