{
  "hand_id": "257237994110",
  "date": "06-08-2025 18:18:36",
  "table": "Atreus",
  "game_type": "holdem",
  "hero": "SrLyce",
  "hero_position": "",
  "hero_cards": [
    "Kd",
    "7h"
  ],
  "stacks": {
    "PrendsCa": 100.0,
    "NRules82": 80.5,
    "JENOFONTE73": 133.5,
    "Fharock": 91.0,
    "SrLyce": 124.0,
    "FishamanReggae": 29.5
  },
  "actions": {
    "preflop": [
      "Asiento 1: PrendsCa (2 € en fichas)",
      "Asiento 2: NRules82 (1.61 € en fichas)",
      "Asiento 3: JENOFONTE73 (2.67 € en fichas)",
      "Asiento 4: Fharock (1.82 € en fichas)",
      "Asiento 5: SrLyce (2.48 € en fichas)",
      "Asiento 6: FishamanReggae (0.59 € en fichas)",
      "NRules82: pone la ciega pequeña 0.01 €",
      "JENOFONTE73: pone la ciega grande 0.02 €",
      "Fharock: se retira",
      "SrLyce: se retira",
      "FishamanReggae: se retira",
      "PrendsCa: se retira",
      "NRules82: iguala 0.01 €",
      "JENOFONTE73: sube 0.03 € a 0.05 €",
      "NRules82: iguala 0.03 €"
    ],
    "flop": [
      "NRules82: pasa",
      "JENOFONTE73: apuesta 0.09 €",
      "NRules82: iguala 0.09 €"
    ],
    "turn": [
      "NRules82: pasa",
      "JENOFONTE73: apuesta 0.13 €",
      "NRules82: iguala 0.13 €"
    ],
    "river": [
      "NRules82: pasa",
      "JENOFONTE73: pasa",
      "NRules82: muestra [3d 4d] (pareja de treses)",
      "JENOFONTE73: muestra [Jc Kh] (pareja de reyes)",
      "Asiento 1: PrendsCa (botón) se retiró antes del Flop (no apostó)",
      "Asiento 2: NRules82 (ciega pequeña) muestra [3d 4d] y perdió con pareja de treses",
      "Asiento 3: JENOFONTE73 (ciega grande) muestra [Jc Kh] y ganó (0.51 €) con pareja de reyes",
      "Asiento 4: Fharock se retiró antes del Flop (no apostó)",
      "Asiento 5: SrLyce se retiró antes del Flop (no apostó)",
      "Asiento 6: FishamanReggae se retiró antes del Flop (no apostó)"
    ]
  },
  "board": [
    "2h",
    "9s",
    "6c",
    "Kc",
    "3h"
  ],
  "winner": "JENOFONTE73",
  "win_amount": 25.5,
  "sb": 0.01,
  "bb": 0.02,
  "rake": 1.5,
  "raw_text": "Mano n.º 257237994110 de PokerStars:  Hold'em No Limit (0.01 €/0.02 € EUR) - 06-08-2025 18:18:36 CET [06-08-2025 12:18:36 ET]\nMesa \"Atreus\" 6-max El asiento n.º 1 es el botón\nAsiento 1: PrendsCa (2 € en fichas) \nAsiento 2: NRules82 (1.61 € en fichas) \nAsiento 3: JENOFONTE73 (2.67 € en fichas) \nAsiento 4: Fharock (1.82 € en fichas) \nAsiento 5: SrLyce (2.48 € en fichas) \nAsiento 6: FishamanReggae (0.59 € en fichas) \nNRules82: pone la ciega pequeña 0.01 €\nJENOFONTE73: pone la ciega grande 0.02 €\n*** CARTAS DE MANO ***\nRepartidas a SrLyce [Kd 7h]\nFharock: se retira \nSrLyce: se retira \nFishamanReggae: se retira \nPrendsCa: se retira \nNRules82: iguala 0.01 €\nJENOFONTE73: sube 0.03 € a 0.05 €\nNRules82: iguala 0.03 €\n*** FLOP *** [2h 9s 6c]\nNRules82: pasa \nJENOFONTE73: apuesta 0.09 €\nNRules82: iguala 0.09 €\n*** TURN *** [2h 9s 6c] [Kc]\nNRules82: pasa \nJENOFONTE73: apuesta 0.13 €\nNRules82: iguala 0.13 €\n*** RIVER *** [2h 9s 6c Kc] [3h]\nNRules82: pasa \nJENOFONTE73: pasa \n*** SHOW DOWN ***\nNRules82: muestra [3d 4d] (pareja de treses)\nJENOFONTE73: muestra [Jc Kh] (pareja de reyes)\nJENOFONTE73 se lleva 0.51 € del bote \n*** RESUMEN ***\nBote total 0.54 € | Comisión 0.03 € \nComunitarias [2h 9s 6c Kc 3h]\nAsiento 1: PrendsCa (botón) se retiró antes del Flop (no apostó)\nAsiento 2: NRules82 (ciega pequeña) muestra [3d 4d] y perdió con pareja de treses\nAsiento 3: JENOFONTE73 (ciega grande) muestra [Jc Kh] y ganó (0.51 €) con pareja de reyes\nAsiento 4: Fharock se retiró antes del Flop (no apostó)\nAsiento 5: SrLyce se retiró antes del Flop (no apostó)\nAsiento 6: FishamanReggae se retiró antes del Flop (no apostó)"
}