{
  "hand_id": "257237895168",
  "date": "06-08-2025 18:09:38",
  "table": "Atreus",
  "game_type": "holdem",
  "hero": "SrLyce",
  "hero_position": "",
  "hero_cards": [
    "5s",
    "9s"
  ],
  "stacks": {
    "PrendsCa": 110.0,
    "NRules82": 85.5,
    "JENOFONTE73": 117.0,
    "Fharock": 100.0,
    "SrLyce": 98.5,
    "FishamanReggae": 39.0
  },
  "actions": {
    "preflop": [
      "Asiento 1: PrendsCa (2.20 € en fichas)",
      "Asiento 2: NRules82 (1.71 € en fichas)",
      "Asiento 3: JENOFONTE73 (2.34 € en fichas)",
      "Asiento 4: Fharock (2 € en fichas)",
      "Asiento 5: SrLyce (1.97 € en fichas)",
      "Asiento 6: FishamanReggae (0.78 € en fichas)",
      "JENOFONTE73: pone la ciega pequeña 0.01 €",
      "Fharock: pone la ciega grande 0.02 €",
      "SrLyce: se retira",
      "FishamanReggae: se retira",
      "PrendsCa: sube 0.02 € a 0.04 €",
      "NRules82: se retira",
      "JENOFONTE73: se retira",
      "Fharock: iguala 0.02 €"
    ],
    "flop": [
      "Fharock: pasa",
      "PrendsCa: pasa"
    ],
    "turn": [
      "Fharock: apuesta 0.05 €",
      "PrendsCa: se retira",
      "Asiento 1: PrendsCa se retiró en el Turn",
      "Asiento 2: NRules82 (botón) se retiró antes del Flop (no apostó)",
      "Asiento 3: JENOFONTE73 (ciega pequeña) se retiró antes del Flop",
      "Asiento 4: Fharock (ciega grande) recaudó (0.08 €)",
      "Asiento 5: SrLyce se retiró antes del Flop (no apostó)",
      "Asiento 6: FishamanReggae se retiró antes del Flop (no apostó)"
    ],
    "river": []
  },
  "board": [
    "7s",
    "5d",
    "4c",
    "Jd"
  ],
  "winner": "Fharock",
  "win_amount": 4.0,
  "sb": 0.01,
  "bb": 0.02,
  "rake": 0.5,
  "raw_text": "Mano n.º 257237895168 de PokerStars:  Hold'em No Limit (0.01 €/0.02 € EUR) - 06-08-2025 18:09:38 CET [06-08-2025 12:09:38 ET]\nMesa \"Atreus\" 6-max El asiento n.º 2 es el botón\nAsiento 1: PrendsCa (2.20 € en fichas) \nAsiento 2: NRules82 (1.71 € en fichas) \nAsiento 3: JENOFONTE73 (2.34 € en fichas) \nAsiento 4: Fharock (2 € en fichas) \nAsiento 5: SrLyce (1.97 € en fichas) \nAsiento 6: FishamanReggae (0.78 € en fichas) \nJENOFONTE73: pone la ciega pequeña 0.01 €\nFharock: pone la ciega grande 0.02 €\n*** CARTAS DE MANO ***\nRepartidas a SrLyce [5s 9s]\nSrLyce: se retira \nFishamanReggae: se retira \nPrendsCa: sube 0.02 € a 0.04 €\nNRules82: se retira \nJENOFONTE73: se retira \nFharock: iguala 0.02 €\n*** FLOP *** [7s 5d 4c]\nFharock: pasa \nPrendsCa: pasa \n*** TURN *** [7s 5d 4c] [Jd]\nFharock: apuesta 0.05 €\nPrendsCa: se retira \nLa apuesta no igualada (0.05 €) ha sido devuelta a Fharock\nFharock se lleva 0.08 € del bote \n*** RESUMEN ***\nBote total 0.09 € | Comisión 0.01 € \nComunitarias [7s 5d 4c Jd]\nAsiento 1: PrendsCa se retiró en el Turn\nAsiento 2: NRules82 (botón) se retiró antes del Flop (no apostó)\nAsiento 3: JENOFONTE73 (ciega pequeña) se retiró antes del Flop\nAsiento 4: Fharock (ciega grande) recaudó (0.08 €)\nAsiento 5: SrLyce se retiró antes del Flop (no apostó)\nAsiento 6: FishamanReggae se retiró antes del Flop (no apostó)"
}