{
  "hand_id": "257237879403",
  "date": "06-08-2025 18:08:08",
  "table": "Euneus III",
  "game_type": "holdem",
  "hero": "SrLyce",
  "hero_position": "",
  "hero_cards": [
    "Kc",
    "7d"
  ],
  "stacks": {
    "christgear": 100.0,
    "Il_BM00": 99.5,
    "djrojas9": 154.5,
    "JGDOBLAS": 98.5,
    "SrLyce": 110.0,
    "Begoton": 100.0
  },
  "actions": {
    "preflop": [
      "Asiento 1: christgear (2 € en fichas)",
      "Asiento 2: Il_BM00 (1.99 € en fichas)",
      "Asiento 3: djrojas9 (3.09 € en fichas)",
      "Asiento 4: JGDOBLAS (1.97 € en fichas)",
      "Asiento 5: SrLyce (2.20 € en fichas)",
      "Asiento 6: Begoton (2 € en fichas)",
      "Begoton: pone la ciega pequeña 0.01 €",
      "christgear: pone la ciega grande 0.02 €",
      "Il_BM00: se retira",
      "djrojas9: se retira",
      "JGDOBLAS: sube 0.03 € a 0.05 €",
      "SrLyce: se retira",
      "Begoton: se retira",
      "christgear: iguala 0.03 €"
    ],
    "flop": [
      "christgear: pasa",
      "JGDOBLAS: pasa"
    ],
    "turn": [
      "christgear: pasa",
      "JGDOBLAS: pasa"
    ],
    "river": [
      "christgear: apuesta 0.08 €",
      "JGDOBLAS: se retira",
      "christgear: no muestra su mano",
      "Asiento 1: christgear (ciega grande) recaudó (0.10 €)",
      "Asiento 2: Il_BM00 se retiró antes del Flop (no apostó)",
      "Asiento 3: djrojas9 se retiró antes del Flop (no apostó)",
      "Asiento 4: JGDOBLAS se retiró en el River",
      "Asiento 5: SrLyce (botón) se retiró antes del Flop (no apostó)",
      "Asiento 6: Begoton (ciega pequeña) se retiró antes del Flop"
    ]
  },
  "board": [
    "3s",
    "Jc",
    "3d",
    "2s",
    "Qc"
  ],
  "winner": "christgear",
  "win_amount": 5.0,
  "sb": 0.01,
  "bb": 0.02,
  "rake": 0.5,
  "raw_text": "Mano n.º 257237879403 de PokerStars:  Hold'em No Limit (0.01 €/0.02 € EUR) - 06-08-2025 18:08:08 CET [06-08-2025 12:08:08 ET]\nMesa \"Euneus III\" 6-max El asiento n.º 5 es el botón\nAsiento 1: christgear (2 € en fichas) \nAsiento 2: Il_BM00 (1.99 € en fichas) \nAsiento 3: djrojas9 (3.09 € en fichas) \nAsiento 4: JGDOBLAS (1.97 € en fichas) \nAsiento 5: SrLyce (2.20 € en fichas) \nAsiento 6: Begoton (2 € en fichas) \nBegoton: pone la ciega pequeña 0.01 €\nchristgear: pone la ciega grande 0.02 €\n*** CARTAS DE MANO ***\nRepartidas a SrLyce [Kc 7d]\nIl_BM00: se retira \ndjrojas9: se retira \nJGDOBLAS: sube 0.03 € a 0.05 €\nSrLyce: se retira \nBegoton: se retira \nchristgear: iguala 0.03 €\n*** FLOP *** [3s Jc 3d]\nchristgear: pasa \nJGDOBLAS: pasa \n*** TURN *** [3s Jc 3d] [2s]\nchristgear: pasa \nJGDOBLAS: pasa \n*** RIVER *** [3s Jc 3d 2s] [Qc]\nchristgear: apuesta 0.08 €\nJGDOBLAS: se retira \nLa apuesta no igualada (0.08 €) ha sido devuelta a christgear\nchristgear se lleva 0.10 € del bote \nchristgear: no muestra su mano \n*** RESUMEN ***\nBote total 0.11 € | Comisión 0.01 € \nComunitarias [3s Jc 3d 2s Qc]\nAsiento 1: christgear (ciega grande) recaudó (0.10 €)\nAsiento 2: Il_BM00 se retiró antes del Flop (no apostó)\nAsiento 3: djrojas9 se retiró antes del Flop (no apostó)\nAsiento 4: JGDOBLAS se retiró en el River\nAsiento 5: SrLyce (botón) se retiró antes del Flop (no apostó)\nAsiento 6: Begoton (ciega pequeña) se retiró antes del Flop"
}