{
  "hand_id": "257237931549",
  "date": "06-08-2025 18:12:58",
  "table": "Nuwa III",
  "game_type": "holdem",
  "hero": "SrLyce",
  "hero_position": "",
  "hero_cards": [
    "8d",
    "7s"
  ],
  "stacks": {
    "xododo": 39.0,
    "BuXHexter": 101.0,
    "kcg_rm": 103.5,
    "SrLyce": 107.0,
    "acavada": 103.5
  },
  "actions": {
    "preflop": [
      "Asiento 5: serviettski(fr) (2 € en fichas) está ausente",
      "Asiento 1: xododo (0.78 € en fichas)",
      "Asiento 2: BuXHexter (2.02 € en fichas)",
      "Asiento 3: kcg_rm (2.07 € en fichas)",
      "Asiento 4: SrLyce (2.14 € en fichas)",
      "Asiento 6: acavada (2.07 € en fichas)",
      "acavada: pone la ciega pequeña 0.01 €",
      "xododo: pone la ciega grande 0.02 €",
      "BuXHexter: se retira",
      "kcg_rm: se retira",
      "SrLyce: sube 0.03 € a 0.05 €",
      "acavada: se retira",
      "xododo: se retira",
      "SrLyce: no muestra su mano",
      "Asiento 5: serviettski(fr)",
      "Asiento 1: xododo (ciega grande) se retiró antes del Flop",
      "Asiento 2: BuXHexter se retiró antes del Flop (no apostó)",
      "Asiento 3: kcg_rm se retiró antes del Flop (no apostó)",
      "Asiento 4: SrLyce (botón) recaudó (0.05 €)",
      "Asiento 6: acavada (ciega pequeña) se retiró antes del Flop"
    ],
    "flop": [],
    "turn": [],
    "river": []
  },
  "board": [],
  "winner": "SrLyce",
  "win_amount": 2.5,
  "sb": 0.01,
  "bb": 0.02,
  "rake": 0.0,
  "raw_text": "Mano n.º 257237931549 de PokerStars:  Hold'em No Limit (0.01 €/0.02 € EUR) - 06-08-2025 18:12:58 CET [06-08-2025 12:12:58 ET]\nMesa \"Nuwa III\" 6-max El asiento n.º 4 es el botón\nAsiento 5: serviettski(fr) (2 € en fichas) está ausente\nAsiento 1: xododo (0.78 € en fichas) \nAsiento 2: BuXHexter (2.02 € en fichas) \nAsiento 3: kcg_rm (2.07 € en fichas) \nAsiento 4: SrLyce (2.14 € en fichas) \nAsiento 6: acavada (2.07 € en fichas) \nacavada: pone la ciega pequeña 0.01 €\nxododo: pone la ciega grande 0.02 €\n*** CARTAS DE MANO ***\nRepartidas a SrLyce [8d 7s]\nBuXHexter: se retira \nkcg_rm: se retira \nSrLyce: sube 0.03 € a 0.05 €\nacavada: se retira \nxododo: se retira \nLa apuesta no igualada (0.03 €) ha sido devuelta a SrLyce\nSrLyce se lleva 0.05 € del bote \nSrLyce: no muestra su mano \n*** RESUMEN ***\nBote total 0.05 € | Comisión 0 € \nAsiento 5: serviettski(fr)\nAsiento 1: xododo (ciega grande) se retiró antes del Flop\nAsiento 2: BuXHexter se retiró antes del Flop (no apostó)\nAsiento 3: kcg_rm se retiró antes del Flop (no apostó)\nAsiento 4: SrLyce (botón) recaudó (0.05 €)\nAsiento 6: acavada (ciega pequeña) se retiró antes del Flop"
}