{
  "hand_id": "257149014185",
  "date": "30-07-2025 22:01:57",
  "table": "Sirona",
  "game_type": "holdem",
  "hero": "SrLyce",
  "hero_position": "",
  "hero_cards": [
    "3d",
    "8h"
  ],
  "stacks": {
    "SrLyce": 121.0,
    "lecontrebandier": 93.5,
    "christoph363": 211.0,
    "oliverdu70": 129.0,
    "NaruchoH1": 100.0,
    "Dakoo44": 64.5
  },
  "actions": {
    "preflop": [
      "Asiento 1: SrLyce (2.42 € en fichas)",
      "Asiento 2: lecontrebandier (1.87 € en fichas)",
      "Asiento 3: christoph363 (4.22 € en fichas)",
      "Asiento 4: oliverdu70 (2.58 € en fichas)",
      "Asiento 5: NaruchoH1 (2 € en fichas)",
      "Asiento 6: Dakoo44 (1.29 € en fichas)",
      "lecontrebandier: pone la ciega pequeña 0.01 €",
      "christoph363: pone la ciega grande 0.02 €",
      "oliverdu70: sube 0.04 € a 0.06 €",
      "NaruchoH1: se retira",
      "Dakoo44: sube 0.12 € a 0.18 €",
      "SrLyce: se retira",
      "lecontrebandier: se retira",
      "christoph363: se retira",
      "oliverdu70: iguala 0.12 €"
    ],
    "flop": [
      "oliverdu70: pasa",
      "Dakoo44: apuesta 0.09 €",
      "oliverdu70: sube 0.09 € a 0.18 €",
      "Dakoo44: sube 0.22 € a 0.40 €",
      "oliverdu70: iguala 0.22 €"
    ],
    "turn": [
      "oliverdu70: pasa",
      "Dakoo44: apuesta 0.71 € y está all-in",
      "oliverdu70: iguala 0.71 €"
    ],
    "river": [
      "oliverdu70: muestra [Ks Ad] (pareja de ases)",
      "Dakoo44: muestra [Jc Kc] (pareja de jotas)",
      "Asiento 1: SrLyce (botón) se retiró antes del Flop (no apostó)",
      "Asiento 2: lecontrebandier (ciega pequeña) se retiró antes del Flop",
      "Asiento 3: christoph363 (ciega grande) se retiró antes del Flop",
      "Asiento 4: oliverdu70 muestra [Ks Ad] y ganó (2.45 €) con pareja de ases",
      "Asiento 5: NaruchoH1 se retiró antes del Flop (no apostó)",
      "Asiento 6: Dakoo44 muestra [Jc Kc] y perdió con pareja de jotas"
    ]
  },
  "board": [
    "Js",
    "As",
    "2h",
    "5c",
    "6c"
  ],
  "winner": "oliverdu70",
  "win_amount": 122.5,
  "sb": 0.01,
  "bb": 0.02,
  "rake": 8.0,
  "raw_text": "Mano n.º 257149014185 de PokerStars:  Hold'em No Limit (0.01 €/0.02 € EUR) - 30-07-2025 22:01:57 CET [30-07-2025 16:01:57 ET]\nMesa \"Sirona\" 6-max El asiento n.º 1 es el botón\nAsiento 1: SrLyce (2.42 € en fichas) \nAsiento 2: lecontrebandier (1.87 € en fichas) \nAsiento 3: christoph363 (4.22 € en fichas) \nAsiento 4: oliverdu70 (2.58 € en fichas) \nAsiento 5: NaruchoH1 (2 € en fichas) \nAsiento 6: Dakoo44 (1.29 € en fichas) \nlecontrebandier: pone la ciega pequeña 0.01 €\nchristoph363: pone la ciega grande 0.02 €\n*** CARTAS DE MANO ***\nRepartidas a SrLyce [3d 8h]\noliverdu70: sube 0.04 € a 0.06 €\nNaruchoH1: se retira \nDakoo44: sube 0.12 € a 0.18 €\nSrLyce: se retira \nlecontrebandier: se retira \nchristoph363: se retira \noliverdu70: iguala 0.12 €\n*** FLOP *** [Js As 2h]\noliverdu70: pasa \nDakoo44: apuesta 0.09 €\noliverdu70: sube 0.09 € a 0.18 €\nDakoo44: sube 0.22 € a 0.40 €\noliverdu70: iguala 0.22 €\n*** TURN *** [Js As 2h] [5c]\noliverdu70: pasa \nDakoo44: apuesta 0.71 € y está all-in\noliverdu70: iguala 0.71 €\n*** RIVER *** [Js As 2h 5c] [6c]\n*** SHOW DOWN ***\noliverdu70: muestra [Ks Ad] (pareja de ases)\nDakoo44: muestra [Jc Kc] (pareja de jotas)\noliverdu70 se lleva 2.45 € del bote \n*** RESUMEN ***\nBote total 2.61 € | Comisión 0.16 € \nComunitarias [Js As 2h 5c 6c]\nAsiento 1: SrLyce (botón) se retiró antes del Flop (no apostó)\nAsiento 2: lecontrebandier (ciega pequeña) se retiró antes del Flop\nAsiento 3: christoph363 (ciega grande) se retiró antes del Flop\nAsiento 4: oliverdu70 muestra [Ks Ad] y ganó (2.45 €) con pareja de ases\nAsiento 5: NaruchoH1 se retiró antes del Flop (no apostó)\nAsiento 6: Dakoo44 muestra [Jc Kc] y perdió con pareja de jotas"
}