{
  "hand_id": "257149238007",
  "date": "30-07-2025 22:17:46",
  "table": "Leverrier",
  "game_type": "holdem",
  "hero": "SrLyce",
  "hero_position": "",
  "hero_cards": [
    "5s",
    "9d"
  ],
  "stacks": {
    "adrian15540": 89.0,
    "SrLyce": 103.0,
    "igonpar": 100.0,
    "futur64": 96.5,
    "denkweise": 100.0,
    "NaruchoH1": 115.5
  },
  "actions": {
    "preflop": [
      "Asiento 1: adrian15540 (1.78 € en fichas)",
      "Asiento 2: SrLyce (2.06 € en fichas)",
      "Asiento 3: igonpar (2 € en fichas)",
      "Asiento 4: futur64 (1.93 € en fichas)",
      "Asiento 5: denkweise (2 € en fichas)",
      "Asiento 6: NaruchoH1 (2.31 € en fichas)",
      "SrLyce: pone la ciega pequeña 0.01 €",
      "igonpar: pone la ciega grande 0.02 €",
      "futur64: se retira",
      "denkweise: sube 0.02 € a 0.04 €",
      "NaruchoH1: se retira",
      "adrian15540: se retira",
      "SrLyce: se retira",
      "igonpar: iguala 0.02 €"
    ],
    "flop": [
      "igonpar: pasa",
      "denkweise: apuesta 0.04 €",
      "igonpar: se retira",
      "denkweise: no muestra su mano",
      "Asiento 1: adrian15540 (botón) se retiró antes del Flop (no apostó)",
      "Asiento 2: SrLyce (ciega pequeña) se retiró antes del Flop",
      "Asiento 3: igonpar (ciega grande) se retiró en el Flop",
      "Asiento 4: futur64 se retiró antes del Flop (no apostó)",
      "Asiento 5: denkweise recaudó (0.08 €)",
      "Asiento 6: NaruchoH1 se retiró antes del Flop (no apostó)"
    ],
    "turn": [],
    "river": []
  },
  "board": [
    "8h",
    "Ac",
    "Kd"
  ],
  "winner": "denkweise",
  "win_amount": 4.0,
  "sb": 0.01,
  "bb": 0.02,
  "rake": 0.5,
  "raw_text": "Mano n.º 257149238007 de PokerStars:  Hold'em No Limit (0.01 €/0.02 € EUR) - 30-07-2025 22:17:46 CET [30-07-2025 16:17:46 ET]\nMesa \"Leverrier\" 6-max El asiento n.º 1 es el botón\nAsiento 1: adrian15540 (1.78 € en fichas) \nAsiento 2: SrLyce (2.06 € en fichas) \nAsiento 3: igonpar (2 € en fichas) \nAsiento 4: futur64 (1.93 € en fichas) \nAsiento 5: denkweise (2 € en fichas) \nAsiento 6: NaruchoH1 (2.31 € en fichas) \nSrLyce: pone la ciega pequeña 0.01 €\nigonpar: pone la ciega grande 0.02 €\n*** CARTAS DE MANO ***\nRepartidas a SrLyce [5s 9d]\nfutur64: se retira \ndenkweise: sube 0.02 € a 0.04 €\nNaruchoH1: se retira \nadrian15540: se retira \nSrLyce: se retira \nigonpar: iguala 0.02 €\n*** FLOP *** [8h Ac Kd]\nigonpar: pasa \ndenkweise: apuesta 0.04 €\nigonpar: se retira \nLa apuesta no igualada (0.04 €) ha sido devuelta a denkweise\ndenkweise se lleva 0.08 € del bote \ndenkweise: no muestra su mano \n*** RESUMEN ***\nBote total 0.09 € | Comisión 0.01 € \nComunitarias [8h Ac Kd]\nAsiento 1: adrian15540 (botón) se retiró antes del Flop (no apostó)\nAsiento 2: SrLyce (ciega pequeña) se retiró antes del Flop\nAsiento 3: igonpar (ciega grande) se retiró en el Flop\nAsiento 4: futur64 se retiró antes del Flop (no apostó)\nAsiento 5: denkweise recaudó (0.08 €)\nAsiento 6: NaruchoH1 se retiró antes del Flop (no apostó)"
}