{
  "hand_id": "257238556471",
  "date": "06-08-2025 19:09:44",
  "table": "Adelaide III",
  "game_type": "holdem",
  "hero": "SrLyce",
  "hero_position": "",
  "hero_cards": [
    "Ac",
    "Kh"
  ],
  "stacks": {
    "N3xtTIm35": 124.0,
    "Macklemore0": 100.0,
    "aliendee07": 69.5,
    "SrLyce": 89.5,
    "ismagonzalez7": 67.5,
    "pauquair5": 61.5
  },
  "actions": {
    "preflop": [
      "Asiento 1: N3xtTIm35 (2.48 € en fichas) está ausente",
      "Asiento 3: Macklemore0 (2 € en fichas) está ausente",
      "Asiento 2: aliendee07 (1.39 € en fichas)",
      "Asiento 4: SrLyce (1.79 € en fichas)",
      "Asiento 5: ismagonzalez7 (1.35 € en fichas)",
      "Asiento 6: pauquair5 (1.23 € en fichas)",
      "pauquair5: pone la ciega pequeña 0.01 €",
      "N3xtTIm35: está ausente",
      "aliendee07: pone la ciega grande 0.02 €",
      "Macklemore0: se ausenta",
      "SrLyce: sube 0.03 € a 0.05 €",
      "ismagonzalez7: se retira",
      "pauquair5: se retira",
      "aliendee07: se retira",
      "SrLyce: no muestra su mano",
      "Asiento 1: N3xtTIm35",
      "Asiento 3: Macklemore0",
      "Asiento 2: aliendee07 (ciega grande) se retiró antes del Flop",
      "Asiento 4: SrLyce recaudó (0.05 €)",
      "Asiento 5: ismagonzalez7 (botón) se retiró antes del Flop (no apostó)",
      "Asiento 6: pauquair5 (ciega pequeña) se retiró antes del Flop"
    ],
    "flop": [],
    "turn": [],
    "river": []
  },
  "board": [],
  "winner": "SrLyce",
  "win_amount": 2.5,
  "sb": 0.01,
  "bb": 0.02,
  "rake": 0.0,
  "raw_text": "Mano n.º 257238556471 de PokerStars:  Hold'em No Limit (0.01 €/0.02 € EUR) - 06-08-2025 19:09:44 CET [06-08-2025 13:09:44 ET]\nMesa \"Adelaide III\" 6-max El asiento n.º 5 es el botón\nAsiento 1: N3xtTIm35 (2.48 € en fichas) está ausente\nAsiento 3: Macklemore0 (2 € en fichas) está ausente\nAsiento 2: aliendee07 (1.39 € en fichas) \nAsiento 4: SrLyce (1.79 € en fichas) \nAsiento 5: ismagonzalez7 (1.35 € en fichas) \nAsiento 6: pauquair5 (1.23 € en fichas) \npauquair5: pone la ciega pequeña 0.01 €\nN3xtTIm35: está ausente \naliendee07: pone la ciega grande 0.02 €\nMacklemore0: se ausenta \n*** CARTAS DE MANO ***\nRepartidas a SrLyce [Ac Kh]\nSrLyce: sube 0.03 € a 0.05 €\nismagonzalez7: se retira \nN3xtTIm35 deja la mesa\npauquair5: se retira \naliendee07: se retira \nLa apuesta no igualada (0.03 €) ha sido devuelta a SrLyce\nSrLyce se lleva 0.05 € del bote \nSrLyce: no muestra su mano \n*** RESUMEN ***\nBote total 0.05 € | Comisión 0 € \nAsiento 1: N3xtTIm35\nAsiento 3: Macklemore0\nAsiento 2: aliendee07 (ciega grande) se retiró antes del Flop\nAsiento 4: SrLyce recaudó (0.05 €)\nAsiento 5: ismagonzalez7 (botón) se retiró antes del Flop (no apostó)\nAsiento 6: pauquair5 (ciega pequeña) se retiró antes del Flop"
}