{
  "hand_id": "257237603515",
  "date": "06-08-2025 17:40:15",
  "table": "Vanadis II",
  "game_type": "holdem",
  "hero": "SrLyce",
  "hero_position": "",
  "hero_cards": [
    "Jd",
    "Kc"
  ],
  "stacks": {
    "SrLyce": 93.0,
    "djrojas9": 95.5,
    "noreihh": 172.5,
    "chordewman": 138.5,
    "sarabiagar": 96.5,
    "idigon": 142.5
  },
  "actions": {
    "preflop": [
      "Asiento 1: SrLyce (1.86 € en fichas)",
      "Asiento 2: djrojas9 (1.91 € en fichas)",
      "Asiento 3: noreihh (3.45 € en fichas)",
      "Asiento 4: chordewman (2.77 € en fichas)",
      "Asiento 5: sarabiagar (1.93 € en fichas)",
      "Asiento 6: idigon (2.85 € en fichas)",
      "djrojas9: pone la ciega pequeña 0.01 €",
      "noreihh: pone la ciega grande 0.02 €",
      "chordewman: se retira",
      "sarabiagar: se retira",
      "idigon: sube 0.02 € a 0.04 €",
      "SrLyce: sube 0.02 € a 0.06 €",
      "djrojas9: se retira",
      "noreihh: se retira",
      "idigon: iguala 0.02 €"
    ],
    "flop": [
      "idigon: pasa",
      "SrLyce: pasa"
    ],
    "turn": [
      "idigon: apuesta 0.14 €",
      "SrLyce: iguala 0.14 €"
    ],
    "river": [
      "idigon: pasa",
      "SrLyce: apuesta 0.40 €",
      "idigon: se retira",
      "SrLyce: no muestra su mano",
      "Asiento 1: SrLyce (botón) recaudó (0.40 €)",
      "Asiento 2: djrojas9 (ciega pequeña) se retiró antes del Flop",
      "Asiento 3: noreihh (ciega grande) se retiró antes del Flop",
      "Asiento 4: chordewman se retiró antes del Flop (no apostó)",
      "Asiento 5: sarabiagar se retiró antes del Flop (no apostó)",
      "Asiento 6: idigon se retiró en el River"
    ]
  },
  "board": [
    "Qs",
    "7d",
    "4s",
    "Th",
    "Ad"
  ],
  "winner": "SrLyce",
  "win_amount": 20.0,
  "sb": 0.01,
  "bb": 0.02,
  "rake": 1.5,
  "raw_text": "Mano n.º 257237603515 de PokerStars:  Hold'em No Limit (0.01 €/0.02 € EUR) - 06-08-2025 17:40:15 CET [06-08-2025 11:40:15 ET]\nMesa \"Vanadis II\" 6-max El asiento n.º 1 es el botón\nAsiento 1: SrLyce (1.86 € en fichas) \nAsiento 2: djrojas9 (1.91 € en fichas) \nAsiento 3: noreihh (3.45 € en fichas) \nAsiento 4: chordewman (2.77 € en fichas) \nAsiento 5: sarabiagar (1.93 € en fichas) \nAsiento 6: idigon (2.85 € en fichas) \ndjrojas9: pone la ciega pequeña 0.01 €\nnoreihh: pone la ciega grande 0.02 €\n*** CARTAS DE MANO ***\nRepartidas a SrLyce [Jd Kc]\nchordewman: se retira \nsarabiagar: se retira \nidigon: sube 0.02 € a 0.04 €\nSrLyce: sube 0.02 € a 0.06 €\ndjrojas9: se retira \nnoreihh: se retira \nidigon: iguala 0.02 €\n*** FLOP *** [Qs 7d 4s]\nidigon: pasa \nSrLyce: pasa \n*** TURN *** [Qs 7d 4s] [Th]\nidigon: apuesta 0.14 €\nSrLyce: iguala 0.14 €\n*** RIVER *** [Qs 7d 4s Th] [Ad]\nidigon: pasa \nSrLyce: apuesta 0.40 €\nnoreihh no tiene conexión \nidigon: se retira \nLa apuesta no igualada (0.40 €) ha sido devuelta a SrLyce\nSrLyce se lleva 0.40 € del bote \nSrLyce: no muestra su mano \n*** RESUMEN ***\nBote total 0.43 € | Comisión 0.03 € \nComunitarias [Qs 7d 4s Th Ad]\nAsiento 1: SrLyce (botón) recaudó (0.40 €)\nAsiento 2: djrojas9 (ciega pequeña) se retiró antes del Flop\nAsiento 3: noreihh (ciega grande) se retiró antes del Flop\nAsiento 4: chordewman se retiró antes del Flop (no apostó)\nAsiento 5: sarabiagar se retiró antes del Flop (no apostó)\nAsiento 6: idigon se retiró en el River"
}