{
  "hand_id": "257149099202",
  "date": "30-07-2025 22:07:57",
  "table": "Sirona",
  "game_type": "holdem",
  "hero": "SrLyce",
  "hero_position": "",
  "hero_cards": [
    "Ac",
    "6h"
  ],
  "stacks": {
    "oliverdu70": 186.0,
    "SrLyce": 140.5,
    "lecontrebandier": 73.5,
    "christoph363": 213.5,
    "MitchATP65": 100.0
  },
  "actions": {
    "preflop": [
      "Asiento 4: oliverdu70 (3.72 € en fichas) está ausente",
      "Asiento 1: SrLyce (2.81 € en fichas)",
      "Asiento 2: lecontrebandier (1.47 € en fichas)",
      "Asiento 3: christoph363 (4.27 € en fichas)",
      "Asiento 6: MitchATP65 (2 € en fichas)",
      "christoph363: pone la ciega pequeña 0.01 €",
      "MitchATP65: pone la ciega grande 0.02 €",
      "SrLyce: se retira",
      "lecontrebandier: sube 0.02 € a 0.04 €",
      "christoph363: se retira",
      "MitchATP65: iguala 0.02 €"
    ],
    "flop": [
      "MitchATP65: pasa",
      "lecontrebandier: pasa"
    ],
    "turn": [
      "MitchATP65: pasa",
      "lecontrebandier: pasa"
    ],
    "river": [
      "MitchATP65: apuesta 0.08 €",
      "lecontrebandier: sube 0.08 € a 0.16 €",
      "MitchATP65: se retira",
      "lecontrebandier: no muestra su mano",
      "Asiento 4: oliverdu70",
      "Asiento 1: SrLyce se retiró antes del Flop (no apostó)",
      "Asiento 2: lecontrebandier (botón) recaudó (0.23 €)",
      "Asiento 3: christoph363 (ciega pequeña) se retiró antes del Flop",
      "Asiento 6: MitchATP65 (ciega grande) se retiró en el River"
    ]
  },
  "board": [
    "5d",
    "2s",
    "Qd",
    "2c",
    "Ks"
  ],
  "winner": "lecontrebandier",
  "win_amount": 11.5,
  "sb": 0.01,
  "bb": 0.02,
  "rake": 1.0,
  "raw_text": "Mano n.º 257149099202 de PokerStars:  Hold'em No Limit (0.01 €/0.02 € EUR) - 30-07-2025 22:07:57 CET [30-07-2025 16:07:57 ET]\nMesa \"Sirona\" 6-max El asiento n.º 2 es el botón\nAsiento 4: oliverdu70 (3.72 € en fichas) está ausente\nAsiento 1: SrLyce (2.81 € en fichas) \nAsiento 2: lecontrebandier (1.47 € en fichas) \nAsiento 3: christoph363 (4.27 € en fichas) \nAsiento 6: MitchATP65 (2 € en fichas) \nchristoph363: pone la ciega pequeña 0.01 €\nMitchATP65: pone la ciega grande 0.02 €\n*** CARTAS DE MANO ***\nRepartidas a SrLyce [Ac 6h]\nSrLyce: se retira \nlecontrebandier: sube 0.02 € a 0.04 €\nchristoph363: se retira \nMitchATP65: iguala 0.02 €\n*** FLOP *** [5d 2s Qd]\nMitchATP65: pasa \nlecontrebandier: pasa \n*** TURN *** [5d 2s Qd] [2c]\nMitchATP65: pasa \nlecontrebandier: pasa \n*** RIVER *** [5d 2s Qd 2c] [Ks]\nMitchATP65: apuesta 0.08 €\nlecontrebandier: sube 0.08 € a 0.16 €\nMitchATP65: se retira \nLa apuesta no igualada (0.08 €) ha sido devuelta a lecontrebandier\nlecontrebandier se lleva 0.23 € del bote \nlecontrebandier: no muestra su mano \n*** RESUMEN ***\nBote total 0.25 € | Comisión 0.02 € \nComunitarias [5d 2s Qd 2c Ks]\nAsiento 4: oliverdu70\nAsiento 1: SrLyce se retiró antes del Flop (no apostó)\nAsiento 2: lecontrebandier (botón) recaudó (0.23 €)\nAsiento 3: christoph363 (ciega pequeña) se retiró antes del Flop\nAsiento 6: MitchATP65 (ciega grande) se retiró en el River"
}