{
  "hand_id": "257238266741",
  "date": "06-08-2025 18:42:52",
  "table": "Aidamina II",
  "game_type": "holdem",
  "hero": "SrLyce",
  "hero_position": "",
  "hero_cards": [
    "Th",
    "Kc"
  ],
  "stacks": {
    "GarciaTT416": 98.5,
    "McFlash3": 100.0,
    "niyomalo": 130.0,
    "durahimovic": 133.0,
    "Abrelatas787": 148.0,
    "SrLyce": 60.0
  },
  "actions": {
    "preflop": [
      "Asiento 1: GarciaTT416 (1.97 € en fichas)",
      "Asiento 2: McFlash3 (2 € en fichas)",
      "Asiento 3: niyomalo (2.60 € en fichas)",
      "Asiento 4: durahimovic (2.66 € en fichas)",
      "Asiento 5: Abrelatas787 (2.96 € en fichas)",
      "Asiento 6: SrLyce (1.20 € en fichas)",
      "niyomalo: pone la ciega pequeña 0.01 €",
      "durahimovic: pone la ciega grande 0.02 €",
      "Abrelatas787: sube 0.04 € a 0.06 €",
      "SrLyce: iguala 0.06 €",
      "GarciaTT416: se retira",
      "McFlash3: se retira",
      "niyomalo: se retira",
      "durahimovic: sube 0.04 € a 0.10 €",
      "Abrelatas787: iguala 0.04 €",
      "SrLyce: iguala 0.04 €"
    ],
    "flop": [
      "durahimovic: pasa",
      "Abrelatas787: apuesta 0.22 €",
      "SrLyce: iguala 0.22 €",
      "durahimovic: se retira"
    ],
    "turn": [
      "Abrelatas787: pasa",
      "SrLyce: pasa"
    ],
    "river": [
      "Abrelatas787: pasa",
      "SrLyce: apuesta 0.71 €",
      "Abrelatas787: se retira",
      "SrLyce: no muestra su mano",
      "Asiento 1: GarciaTT416 se retiró antes del Flop (no apostó)",
      "Asiento 2: McFlash3 (botón) se retiró antes del Flop (no apostó)",
      "Asiento 3: niyomalo (ciega pequeña) se retiró antes del Flop",
      "Asiento 4: durahimovic (ciega grande) se retiró en el Flop",
      "Asiento 5: Abrelatas787 se retiró en el River",
      "Asiento 6: SrLyce recaudó (0.71 €)"
    ]
  },
  "board": [
    "4s",
    "8h",
    "Kh",
    "4d",
    "Qs"
  ],
  "winner": "SrLyce",
  "win_amount": 35.5,
  "sb": 0.01,
  "bb": 0.02,
  "rake": 2.0,
  "raw_text": "Mano n.º 257238266741 de PokerStars:  Hold'em No Limit (0.01 €/0.02 € EUR) - 06-08-2025 18:42:52 CET [06-08-2025 12:42:52 ET]\nMesa \"Aidamina II\" 6-max El asiento n.º 2 es el botón\nAsiento 1: GarciaTT416 (1.97 € en fichas) \nAsiento 2: McFlash3 (2 € en fichas) \nAsiento 3: niyomalo (2.60 € en fichas) \nAsiento 4: durahimovic (2.66 € en fichas) \nAsiento 5: Abrelatas787 (2.96 € en fichas) \nAsiento 6: SrLyce (1.20 € en fichas) \nniyomalo: pone la ciega pequeña 0.01 €\ndurahimovic: pone la ciega grande 0.02 €\n*** CARTAS DE MANO ***\nRepartidas a SrLyce [Th Kc]\nAbrelatas787: sube 0.04 € a 0.06 €\nSrLyce: iguala 0.06 €\nGarciaTT416: se retira \nMcFlash3: se retira \nniyomalo: se retira \ndurahimovic: sube 0.04 € a 0.10 €\nAbrelatas787: iguala 0.04 €\nSrLyce: iguala 0.04 €\n*** FLOP *** [4s 8h Kh]\ndurahimovic: pasa \nAbrelatas787: apuesta 0.22 €\nSrLyce: iguala 0.22 €\ndurahimovic: se retira \n*** TURN *** [4s 8h Kh] [4d]\nAbrelatas787: pasa \nSrLyce: pasa \n*** RIVER *** [4s 8h Kh 4d] [Qs]\nAbrelatas787: pasa \nSrLyce: apuesta 0.71 €\nAbrelatas787: se retira \nLa apuesta no igualada (0.71 €) ha sido devuelta a SrLyce\nSrLyce se lleva 0.71 € del bote \nSrLyce: no muestra su mano \n*** RESUMEN ***\nBote total 0.75 € | Comisión 0.04 € \nComunitarias [4s 8h Kh 4d Qs]\nAsiento 1: GarciaTT416 se retiró antes del Flop (no apostó)\nAsiento 2: McFlash3 (botón) se retiró antes del Flop (no apostó)\nAsiento 3: niyomalo (ciega pequeña) se retiró antes del Flop\nAsiento 4: durahimovic (ciega grande) se retiró en el Flop\nAsiento 5: Abrelatas787 se retiró en el River\nAsiento 6: SrLyce recaudó (0.71 €)"
}