{
  "hand_id": "257237962007",
  "date": "06-08-2025 18:15:44",
  "table": "Euneus III",
  "game_type": "holdem",
  "hero": "SrLyce",
  "hero_position": "",
  "hero_cards": [
    "Qd",
    "5h"
  ],
  "stacks": {
    "christgear": 100.0,
    "Il_BM00": 128.0,
    "djrojas9": 137.5,
    "lol-in 2000": 99.0,
    "SrLyce": 121.5,
    "kcg_rm": 110.5
  },
  "actions": {
    "preflop": [
      "Asiento 1: christgear (2 € en fichas)",
      "Asiento 2: Il_BM00 (2.56 € en fichas)",
      "Asiento 3: djrojas9 (2.75 € en fichas)",
      "Asiento 4: lol-in 2000 (1.98 € en fichas)",
      "Asiento 5: SrLyce (2.43 € en fichas)",
      "Asiento 6: kcg_rm (2.21 € en fichas)",
      "lol-in 2000: pone la ciega pequeña 0.01 €",
      "SrLyce: pone la ciega grande 0.02 €",
      "kcg_rm: se retira",
      "christgear: se retira",
      "Il_BM00: se retira",
      "djrojas9: sube 0.02 € a 0.04 €",
      "lol-in 2000: se retira",
      "SrLyce: iguala 0.02 €"
    ],
    "flop": [
      "SrLyce: apuesta 0.04 €",
      "djrojas9: iguala 0.04 €"
    ],
    "turn": [
      "SrLyce: apuesta 0.13 €",
      "djrojas9: se retira",
      "SrLyce: no muestra su mano",
      "Asiento 1: christgear se retiró antes del Flop (no apostó)",
      "Asiento 2: Il_BM00 se retiró antes del Flop (no apostó)",
      "Asiento 3: djrojas9 (botón) se retiró en el Turn",
      "Asiento 4: lol-in 2000 (ciega pequeña) se retiró antes del Flop",
      "Asiento 5: SrLyce (ciega grande) recaudó (0.16 €)",
      "Asiento 6: kcg_rm se retiró antes del Flop (no apostó)"
    ],
    "river": []
  },
  "board": [
    "Qh",
    "3s",
    "5c",
    "Qc"
  ],
  "winner": "SrLyce",
  "win_amount": 8.0,
  "sb": 0.01,
  "bb": 0.02,
  "rake": 0.5,
  "raw_text": "Mano n.º 257237962007 de PokerStars:  Hold'em No Limit (0.01 €/0.02 € EUR) - 06-08-2025 18:15:44 CET [06-08-2025 12:15:44 ET]\nMesa \"Euneus III\" 6-max El asiento n.º 3 es el botón\nAsiento 1: christgear (2 € en fichas) \nAsiento 2: Il_BM00 (2.56 € en fichas) \nAsiento 3: djrojas9 (2.75 € en fichas) \nAsiento 4: lol-in 2000 (1.98 € en fichas) \nAsiento 5: SrLyce (2.43 € en fichas) \nAsiento 6: kcg_rm (2.21 € en fichas) \nlol-in 2000: pone la ciega pequeña 0.01 €\nSrLyce: pone la ciega grande 0.02 €\n*** CARTAS DE MANO ***\nRepartidas a SrLyce [Qd 5h]\nkcg_rm: se retira \nchristgear: se retira \nIl_BM00: se retira \ndjrojas9: sube 0.02 € a 0.04 €\nlol-in 2000: se retira \nSrLyce: iguala 0.02 €\n*** FLOP *** [Qh 3s 5c]\nSrLyce: apuesta 0.04 €\ndjrojas9: iguala 0.04 €\n*** TURN *** [Qh 3s 5c] [Qc]\nSrLyce: apuesta 0.13 €\ndjrojas9: se retira \nLa apuesta no igualada (0.13 €) ha sido devuelta a SrLyce\nSrLyce se lleva 0.16 € del bote \nSrLyce: no muestra su mano \n*** RESUMEN ***\nBote total 0.17 € | Comisión 0.01 € \nComunitarias [Qh 3s 5c Qc]\nAsiento 1: christgear se retiró antes del Flop (no apostó)\nAsiento 2: Il_BM00 se retiró antes del Flop (no apostó)\nAsiento 3: djrojas9 (botón) se retiró en el Turn\nAsiento 4: lol-in 2000 (ciega pequeña) se retiró antes del Flop\nAsiento 5: SrLyce (ciega grande) recaudó (0.16 €)\nAsiento 6: kcg_rm se retiró antes del Flop (no apostó)"
}