{
  "hand_id": "257150160058",
  "date": "30-07-2025 23:22:27",
  "table": "Gilgamesh",
  "game_type": "holdem",
  "hero": "SrLyce",
  "hero_position": "",
  "hero_cards": [
    "2c",
    "4h"
  ],
  "stacks": {
    "riverrrrrrmagic": 121.5,
    "SrLyce": 97.5,
    "Jumby34": 100.5,
    "xapkk": 100.0,
    "samaritano34": 92.0,
    "Fretzo67500": 125.5
  },
  "actions": {
    "preflop": [
      "Asiento 1: riverrrrrrmagic (2.43 € en fichas)",
      "Asiento 2: SrLyce (1.95 € en fichas)",
      "Asiento 3: Jumby34 (2.01 € en fichas)",
      "Asiento 4: xapkk (2 € en fichas)",
      "Asiento 5: samaritano34 (1.84 € en fichas)",
      "Asiento 6: Fretzo67500 (2.51 € en fichas)",
      "Jumby34: pone la ciega pequeña 0.01 €",
      "xapkk: pone la ciega grande 0.02 €",
      "samaritano34: se retira",
      "Fretzo67500: iguala 0.02 €",
      "riverrrrrrmagic: se retira",
      "SrLyce: se retira",
      "Jumby34: se retira",
      "xapkk: pasa"
    ],
    "flop": [
      "xapkk: pasa",
      "Fretzo67500: pasa"
    ],
    "turn": [
      "xapkk: pasa",
      "Fretzo67500: apuesta 0.05 €",
      "xapkk: se retira",
      "Asiento 1: riverrrrrrmagic se retiró antes del Flop (no apostó)",
      "Asiento 2: SrLyce (botón) se retiró antes del Flop (no apostó)",
      "Asiento 3: Jumby34 (ciega pequeña) se retiró antes del Flop",
      "Asiento 4: xapkk (ciega grande) se retiró en el Turn",
      "Asiento 5: samaritano34 se retiró antes del Flop (no apostó)",
      "Asiento 6: Fretzo67500 recaudó (0.05 €)"
    ],
    "river": []
  },
  "board": [
    "4c",
    "As",
    "2d",
    "3s"
  ],
  "winner": "Fretzo67500",
  "win_amount": 2.5,
  "sb": 0.01,
  "bb": 0.02,
  "rake": 0.0,
  "raw_text": "Mano n.º 257150160058 de PokerStars:  Hold'em No Limit (0.01 €/0.02 € EUR) - 30-07-2025 23:22:27 CET [30-07-2025 17:22:27 ET]\nMesa \"Gilgamesh\" 6-max El asiento n.º 2 es el botón\nAsiento 1: riverrrrrrmagic (2.43 € en fichas) \nAsiento 2: SrLyce (1.95 € en fichas) \nAsiento 3: Jumby34 (2.01 € en fichas) \nAsiento 4: xapkk (2 € en fichas) \nAsiento 5: samaritano34 (1.84 € en fichas) \nAsiento 6: Fretzo67500 (2.51 € en fichas) \nJumby34: pone la ciega pequeña 0.01 €\nxapkk: pone la ciega grande 0.02 €\n*** CARTAS DE MANO ***\nRepartidas a SrLyce [2c 4h]\nsamaritano34: se retira \nFretzo67500: iguala 0.02 €\nriverrrrrrmagic: se retira \nSrLyce: se retira \nJumby34: se retira \nxapkk: pasa \n*** FLOP *** [4c As 2d]\nxapkk: pasa \nFretzo67500: pasa \n*** TURN *** [4c As 2d] [3s]\nxapkk: pasa \nFretzo67500: apuesta 0.05 €\nxapkk: se retira \nLa apuesta no igualada (0.05 €) ha sido devuelta a Fretzo67500\nFretzo67500 se lleva 0.05 € del bote \n*** RESUMEN ***\nBote total 0.05 € | Comisión 0 € \nComunitarias [4c As 2d 3s]\nAsiento 1: riverrrrrrmagic se retiró antes del Flop (no apostó)\nAsiento 2: SrLyce (botón) se retiró antes del Flop (no apostó)\nAsiento 3: Jumby34 (ciega pequeña) se retiró antes del Flop\nAsiento 4: xapkk (ciega grande) se retiró en el Turn\nAsiento 5: samaritano34 se retiró antes del Flop (no apostó)\nAsiento 6: Fretzo67500 recaudó (0.05 €)"
}