{
  "hand_id": "257238543161",
  "date": "06-08-2025 19:08:37",
  "table": "Herculina II",
  "game_type": "holdem",
  "hero": "SrLyce",
  "hero_position": "",
  "hero_cards": [
    "Jd",
    "2h"
  ],
  "stacks": {
    "koldipk": 205.0,
    "David98X": 175.0,
    "JJer11": 207.5,
    "SrLyce": 99.0,
    "Macklemore0": 100.0,
    "ScarvBlack": 114.5
  },
  "actions": {
    "preflop": [
      "Asiento 1: koldipk (4.10 € en fichas)",
      "Asiento 2: David98X (3.50 € en fichas)",
      "Asiento 3: JJer11 (4.15 € en fichas)",
      "Asiento 4: SrLyce (1.98 € en fichas)",
      "Asiento 5: Macklemore0 (2 € en fichas)",
      "Asiento 6: ScarvBlack (2.29 € en fichas)",
      "SrLyce: pone la ciega pequeña 0.01 €",
      "Macklemore0: pone la ciega grande 0.02 €",
      "ScarvBlack: se retira",
      "koldipk: se retira",
      "David98X: sube 0.04 € a 0.06 €",
      "JJer11: se retira",
      "SrLyce: se retira",
      "Macklemore0: se retira",
      "David98X: no muestra su mano",
      "Asiento 1: koldipk se retiró antes del Flop (no apostó)",
      "Asiento 2: David98X recaudó (0.05 €)",
      "Asiento 3: JJer11 (botón) se retiró antes del Flop (no apostó)",
      "Asiento 4: SrLyce (ciega pequeña) se retiró antes del Flop",
      "Asiento 5: Macklemore0 (ciega grande) se retiró antes del Flop",
      "Asiento 6: ScarvBlack se retiró antes del Flop (no apostó)"
    ],
    "flop": [],
    "turn": [],
    "river": []
  },
  "board": [],
  "winner": "David98X",
  "win_amount": 2.5,
  "sb": 0.01,
  "bb": 0.02,
  "rake": 0.0,
  "raw_text": "Mano n.º 257238543161 de PokerStars:  Hold'em No Limit (0.01 €/0.02 € EUR) - 06-08-2025 19:08:37 CET [06-08-2025 13:08:37 ET]\nMesa \"Herculina II\" 6-max El asiento n.º 3 es el botón\nAsiento 1: koldipk (4.10 € en fichas) \nAsiento 2: David98X (3.50 € en fichas) \nAsiento 3: JJer11 (4.15 € en fichas) \nAsiento 4: SrLyce (1.98 € en fichas) \nAsiento 5: Macklemore0 (2 € en fichas) \nAsiento 6: ScarvBlack (2.29 € en fichas) \nSrLyce: pone la ciega pequeña 0.01 €\nMacklemore0: pone la ciega grande 0.02 €\n*** CARTAS DE MANO ***\nRepartidas a SrLyce [Jd 2h]\nScarvBlack: se retira \nkoldipk: se retira \nDavid98X: sube 0.04 € a 0.06 €\nJJer11: se retira \nSrLyce: se retira \nMacklemore0: se retira \nLa apuesta no igualada (0.04 €) ha sido devuelta a David98X\nDavid98X se lleva 0.05 € del bote \nDavid98X: no muestra su mano \n*** RESUMEN ***\nBote total 0.05 € | Comisión 0 € \nAsiento 1: koldipk se retiró antes del Flop (no apostó)\nAsiento 2: David98X recaudó (0.05 €)\nAsiento 3: JJer11 (botón) se retiró antes del Flop (no apostó)\nAsiento 4: SrLyce (ciega pequeña) se retiró antes del Flop\nAsiento 5: Macklemore0 (ciega grande) se retiró antes del Flop\nAsiento 6: ScarvBlack se retiró antes del Flop (no apostó)"
}