{
  "hand_id": "257237563948",
  "date": "06-08-2025 17:36:24",
  "table": "Vanadis II",
  "game_type": "holdem",
  "hero": "SrLyce",
  "hero_position": "",
  "hero_cards": [
    "Ah",
    "Qh"
  ],
  "stacks": {
    "SrLyce": 97.0,
    "djrojas9": 98.5,
    "noreihh": 172.5,
    "chordewman": 110.5,
    "sarabiagar": 98.0,
    "idigon": 148.5
  },
  "actions": {
    "preflop": [
      "Asiento 1: SrLyce (1.94 € en fichas)",
      "Asiento 2: djrojas9 (1.97 € en fichas)",
      "Asiento 3: noreihh (3.45 € en fichas)",
      "Asiento 4: chordewman (2.21 € en fichas)",
      "Asiento 5: sarabiagar (1.96 € en fichas)",
      "Asiento 6: idigon (2.97 € en fichas)",
      "chordewman: pone la ciega pequeña 0.01 €",
      "sarabiagar: pone la ciega grande 0.02 €",
      "idigon: sube 0.02 € a 0.04 €",
      "SrLyce: sube 0.08 € a 0.12 €",
      "djrojas9: se retira",
      "noreihh: se retira",
      "chordewman: se retira",
      "sarabiagar: se retira",
      "idigon: se retira",
      "SrLyce: no muestra su mano",
      "Asiento 1: SrLyce recaudó (0.11 €)",
      "Asiento 2: djrojas9 se retiró antes del Flop (no apostó)",
      "Asiento 3: noreihh (botón) se retiró antes del Flop (no apostó)",
      "Asiento 4: chordewman (ciega pequeña) se retiró antes del Flop",
      "Asiento 5: sarabiagar (ciega grande) se retiró antes del Flop",
      "Asiento 6: idigon se retiró antes del Flop"
    ],
    "flop": [],
    "turn": [],
    "river": []
  },
  "board": [],
  "winner": "SrLyce",
  "win_amount": 5.5,
  "sb": 0.01,
  "bb": 0.02,
  "rake": 0.0,
  "raw_text": "Mano n.º 257237563948 de PokerStars:  Hold'em No Limit (0.01 €/0.02 € EUR) - 06-08-2025 17:36:24 CET [06-08-2025 11:36:24 ET]\nMesa \"Vanadis II\" 6-max El asiento n.º 3 es el botón\nAsiento 1: SrLyce (1.94 € en fichas) \nAsiento 2: djrojas9 (1.97 € en fichas) \nAsiento 3: noreihh (3.45 € en fichas) \nAsiento 4: chordewman (2.21 € en fichas) \nAsiento 5: sarabiagar (1.96 € en fichas) \nAsiento 6: idigon (2.97 € en fichas) \nchordewman: pone la ciega pequeña 0.01 €\nsarabiagar: pone la ciega grande 0.02 €\n*** CARTAS DE MANO ***\nRepartidas a SrLyce [Ah Qh]\nidigon: sube 0.02 € a 0.04 €\nSrLyce: sube 0.08 € a 0.12 €\ndjrojas9: se retira \nnoreihh: se retira \nchordewman: se retira \nsarabiagar: se retira \nidigon: se retira \nLa apuesta no igualada (0.08 €) ha sido devuelta a SrLyce\nSrLyce se lleva 0.11 € del bote \nSrLyce: no muestra su mano \n*** RESUMEN ***\nBote total 0.11 € | Comisión 0 € \nAsiento 1: SrLyce recaudó (0.11 €)\nAsiento 2: djrojas9 se retiró antes del Flop (no apostó)\nAsiento 3: noreihh (botón) se retiró antes del Flop (no apostó)\nAsiento 4: chordewman (ciega pequeña) se retiró antes del Flop\nAsiento 5: sarabiagar (ciega grande) se retiró antes del Flop\nAsiento 6: idigon se retiró antes del Flop"
}