{
  "hand_id": "257238777383",
  "date": "06-08-2025 19:28:11",
  "table": "Herculina II",
  "game_type": "holdem",
  "hero": "SrLyce",
  "hero_position": "",
  "hero_cards": [
    "Ks",
    "2c"
  ],
  "stacks": {
    "Alceo27": 119.0,
    "David98X": 138.5,
    "JJer11": 187.5,
    "SrLyce": 143.0,
    "Macklemore0": 103.0,
    "ScarvBlack": 109.0
  },
  "actions": {
    "preflop": [
      "Asiento 1: Alceo27 (2.38 € en fichas)",
      "Asiento 2: David98X (2.77 € en fichas)",
      "Asiento 3: JJer11 (3.75 € en fichas)",
      "Asiento 4: SrLyce (2.86 € en fichas)",
      "Asiento 5: Macklemore0 (2.06 € en fichas)",
      "Asiento 6: ScarvBlack (2.18 € en fichas)",
      "Macklemore0: pone la ciega pequeña 0.01 €",
      "ScarvBlack: pone la ciega grande 0.02 €",
      "Alceo27: se retira",
      "David98X: se retira",
      "JJer11: se retira",
      "SrLyce: se retira",
      "Macklemore0: se retira",
      "ScarvBlack: no muestra su mano",
      "Asiento 1: Alceo27 se retiró antes del Flop (no apostó)",
      "Asiento 2: David98X se retiró antes del Flop (no apostó)",
      "Asiento 3: JJer11 se retiró antes del Flop (no apostó)",
      "Asiento 4: SrLyce (botón) se retiró antes del Flop (no apostó)",
      "Asiento 5: Macklemore0 (ciega pequeña) se retiró antes del Flop",
      "Asiento 6: ScarvBlack (ciega grande) recaudó (0.02 €)"
    ],
    "flop": [],
    "turn": [],
    "river": []
  },
  "board": [],
  "winner": "ScarvBlack",
  "win_amount": 1.0,
  "sb": 0.01,
  "bb": 0.02,
  "rake": 0.0,
  "raw_text": "Mano n.º 257238777383 de PokerStars:  Hold'em No Limit (0.01 €/0.02 € EUR) - 06-08-2025 19:28:11 CET [06-08-2025 13:28:11 ET]\nMesa \"Herculina II\" 6-max El asiento n.º 4 es el botón\nAsiento 1: Alceo27 (2.38 € en fichas) \nAsiento 2: David98X (2.77 € en fichas) \nAsiento 3: JJer11 (3.75 € en fichas) \nAsiento 4: SrLyce (2.86 € en fichas) \nAsiento 5: Macklemore0 (2.06 € en fichas) \nAsiento 6: ScarvBlack (2.18 € en fichas) \nMacklemore0: pone la ciega pequeña 0.01 €\nScarvBlack: pone la ciega grande 0.02 €\n*** CARTAS DE MANO ***\nRepartidas a SrLyce [Ks 2c]\nAlceo27: se retira \nDavid98X: se retira \nJJer11: se retira \nSrLyce: se retira \nMacklemore0: se retira \nLa apuesta no igualada (0.01 €) ha sido devuelta a ScarvBlack\nScarvBlack se lleva 0.02 € del bote \nScarvBlack: no muestra su mano \n*** RESUMEN ***\nBote total 0.02 € | Comisión 0 € \nAsiento 1: Alceo27 se retiró antes del Flop (no apostó)\nAsiento 2: David98X se retiró antes del Flop (no apostó)\nAsiento 3: JJer11 se retiró antes del Flop (no apostó)\nAsiento 4: SrLyce (botón) se retiró antes del Flop (no apostó)\nAsiento 5: Macklemore0 (ciega pequeña) se retiró antes del Flop\nAsiento 6: ScarvBlack (ciega grande) recaudó (0.02 €)"
}