{
  "hand_id": "257149201998",
  "date": "30-07-2025 22:15:13",
  "table": "Esclangona",
  "game_type": "holdem",
  "hero": "SrLyce",
  "hero_position": "",
  "hero_cards": [
    "9c",
    "2c"
  ],
  "stacks": {
    "ansiedadd": 40.0,
    "SrLyce": 91.0,
    "NoahBolete": 130.5,
    "Davdgoni": 234.5,
    "DiaZzZ1": 99.0,
    "elketefaka1": 88.5
  },
  "actions": {
    "preflop": [
      "Asiento 1: ansiedadd (0.80 € en fichas) está ausente",
      "Asiento 2: SrLyce (1.82 € en fichas)",
      "Asiento 3: NoahBolete (2.61 € en fichas)",
      "Asiento 4: Davdgoni (4.69 € en fichas)",
      "Asiento 5: DiaZzZ1 (1.98 € en fichas)",
      "Asiento 6: elketefaka1 (1.77 € en fichas)",
      "DiaZzZ1: pone la ciega pequeña 0.01 €",
      "elketefaka1: pone la ciega grande 0.02 €",
      "ansiedadd: se ausenta",
      "SrLyce: se retira",
      "NoahBolete: se retira",
      "Davdgoni: sube 0.04 € a 0.06 €",
      "DiaZzZ1: se retira",
      "elketefaka1: se retira",
      "Davdgoni: no muestra su mano",
      "Asiento 1: ansiedadd",
      "Asiento 2: SrLyce se retiró antes del Flop (no apostó)",
      "Asiento 3: NoahBolete se retiró antes del Flop (no apostó)",
      "Asiento 4: Davdgoni (botón) recaudó (0.05 €)",
      "Asiento 5: DiaZzZ1 (ciega pequeña) se retiró antes del Flop",
      "Asiento 6: elketefaka1 (ciega grande) se retiró antes del Flop"
    ],
    "flop": [],
    "turn": [],
    "river": []
  },
  "board": [],
  "winner": "Davdgoni",
  "win_amount": 2.5,
  "sb": 0.01,
  "bb": 0.02,
  "rake": 0.0,
  "raw_text": "Mano n.º 257149201998 de PokerStars:  Hold'em No Limit (0.01 €/0.02 € EUR) - 30-07-2025 22:15:13 CET [30-07-2025 16:15:13 ET]\nMesa \"Esclangona\" 6-max El asiento n.º 4 es el botón\nAsiento 1: ansiedadd (0.80 € en fichas) está ausente\nAsiento 2: SrLyce (1.82 € en fichas) \nAsiento 3: NoahBolete (2.61 € en fichas) \nAsiento 4: Davdgoni (4.69 € en fichas) \nAsiento 5: DiaZzZ1 (1.98 € en fichas) \nAsiento 6: elketefaka1 (1.77 € en fichas) \nDiaZzZ1: pone la ciega pequeña 0.01 €\nelketefaka1: pone la ciega grande 0.02 €\nansiedadd: se ausenta \n*** CARTAS DE MANO ***\nRepartidas a SrLyce [9c 2c]\nSrLyce: se retira \nNoahBolete: se retira \nDavdgoni: sube 0.04 € a 0.06 €\nDiaZzZ1: se retira \nelketefaka1: se retira \nLa apuesta no igualada (0.04 €) ha sido devuelta a Davdgoni\nDavdgoni se lleva 0.05 € del bote \nDavdgoni: no muestra su mano \n*** RESUMEN ***\nBote total 0.05 € | Comisión 0 € \nAsiento 1: ansiedadd\nAsiento 2: SrLyce se retiró antes del Flop (no apostó)\nAsiento 3: NoahBolete se retiró antes del Flop (no apostó)\nAsiento 4: Davdgoni (botón) recaudó (0.05 €)\nAsiento 5: DiaZzZ1 (ciega pequeña) se retiró antes del Flop\nAsiento 6: elketefaka1 (ciega grande) se retiró antes del Flop"
}