{
  "hand_id": "257149265750",
  "date": "30-07-2025 22:19:43",
  "table": "Esclangona",
  "game_type": "holdem",
  "hero": "SrLyce",
  "hero_position": "",
  "hero_cards": [
    "5h",
    "5s"
  ],
  "stacks": {
    "BPEPMLP": 100.0,
    "ansiedadd": 43.0,
    "SrLyce": 196.0,
    "NoahBolete": 117.5,
    "DiaZzZ1": 95.5,
    "elketefaka1": 5.0
  },
  "actions": {
    "preflop": [
      "Asiento 4: BPEPMLP (2 € en fichas) está ausente",
      "Asiento 1: ansiedadd (0.86 € en fichas)",
      "Asiento 2: SrLyce (3.92 € en fichas)",
      "Asiento 3: NoahBolete (2.35 € en fichas)",
      "Asiento 5: DiaZzZ1 (1.91 € en fichas)",
      "Asiento 6: elketefaka1 (0.10 € en fichas)",
      "DiaZzZ1: pone la ciega pequeña 0.01 €",
      "elketefaka1: pone la ciega grande 0.02 €",
      "ansiedadd: se retira",
      "SrLyce: sube 0.04 € a 0.06 €",
      "NoahBolete: se retira",
      "DiaZzZ1: se retira",
      "elketefaka1: se retira",
      "SrLyce: no muestra su mano",
      "Asiento 4: BPEPMLP",
      "Asiento 1: ansiedadd se retiró antes del Flop (no apostó)",
      "Asiento 2: SrLyce recaudó (0.05 €)",
      "Asiento 3: NoahBolete (botón) se retiró antes del Flop (no apostó)",
      "Asiento 5: DiaZzZ1 (ciega pequeña) se retiró antes del Flop",
      "Asiento 6: elketefaka1 (ciega grande) se retiró antes del Flop"
    ],
    "flop": [],
    "turn": [],
    "river": []
  },
  "board": [],
  "winner": "SrLyce",
  "win_amount": 2.5,
  "sb": 0.01,
  "bb": 0.02,
  "rake": 0.0,
  "raw_text": "Mano n.º 257149265750 de PokerStars:  Hold'em No Limit (0.01 €/0.02 € EUR) - 30-07-2025 22:19:43 CET [30-07-2025 16:19:43 ET]\nMesa \"Esclangona\" 6-max El asiento n.º 3 es el botón\nAsiento 4: BPEPMLP (2 € en fichas) está ausente\nAsiento 1: ansiedadd (0.86 € en fichas) \nAsiento 2: SrLyce (3.92 € en fichas) \nAsiento 3: NoahBolete (2.35 € en fichas) \nAsiento 5: DiaZzZ1 (1.91 € en fichas) \nAsiento 6: elketefaka1 (0.10 € en fichas) \nDiaZzZ1: pone la ciega pequeña 0.01 €\nelketefaka1: pone la ciega grande 0.02 €\n*** CARTAS DE MANO ***\nRepartidas a SrLyce [5h 5s]\nansiedadd: se retira \nSrLyce: sube 0.04 € a 0.06 €\nNoahBolete: se retira \nDiaZzZ1: se retira \nelketefaka1: se retira \nLa apuesta no igualada (0.04 €) ha sido devuelta a SrLyce\nSrLyce se lleva 0.05 € del bote \nSrLyce: no muestra su mano \n*** RESUMEN ***\nBote total 0.05 € | Comisión 0 € \nAsiento 4: BPEPMLP\nAsiento 1: ansiedadd se retiró antes del Flop (no apostó)\nAsiento 2: SrLyce recaudó (0.05 €)\nAsiento 3: NoahBolete (botón) se retiró antes del Flop (no apostó)\nAsiento 5: DiaZzZ1 (ciega pequeña) se retiró antes del Flop\nAsiento 6: elketefaka1 (ciega grande) se retiró antes del Flop"
}