{
  "hand_id": "257148835575",
  "date": "30-07-2025 21:47:23",
  "table": "Sirona",
  "game_type": "holdem",
  "hero": "SrLyce",
  "hero_position": "",
  "hero_cards": [
    "8h",
    "8s"
  ],
  "stacks": {
    "SrLyce": 93.0,
    "lecontrebandier": 103.0,
    "christoph363": 179.0,
    "oliverdu70": 143.5,
    "olibellier": 24.5,
    "Dakoo44": 99.5
  },
  "actions": {
    "preflop": [
      "Asiento 1: SrLyce (1.86 € en fichas)",
      "Asiento 2: lecontrebandier (2.06 € en fichas)",
      "Asiento 3: christoph363 (3.58 € en fichas)",
      "Asiento 4: oliverdu70 (2.87 € en fichas)",
      "Asiento 5: olibellier (0.49 € en fichas)",
      "Asiento 6: Dakoo44 (1.99 € en fichas)",
      "SrLyce: pone la ciega pequeña 0.01 €",
      "lecontrebandier: pone la ciega grande 0.02 €",
      "christoph363: se retira",
      "oliverdu70: sube 0.04 € a 0.06 €",
      "olibellier: se retira",
      "Dakoo44: se retira",
      "SrLyce: iguala 0.05 €",
      "lecontrebandier: se retira"
    ],
    "flop": [
      "SrLyce: pasa",
      "oliverdu70: apuesta 0.07 €",
      "SrLyce: iguala 0.07 €"
    ],
    "turn": [
      "SrLyce: pasa",
      "oliverdu70: pasa"
    ],
    "river": [
      "SrLyce: apuesta 0.11 €",
      "oliverdu70: iguala 0.11 €",
      "SrLyce: muestra [8h 8s] (doble pareja, damas y ochos)",
      "oliverdu70: descarta su mano sin mostrar",
      "Asiento 1: SrLyce (ciega pequeña) muestra [8h 8s] y ganó (0.47 €) con doble pareja, damas y ochos",
      "Asiento 2: lecontrebandier (ciega grande) se retiró antes del Flop",
      "Asiento 3: christoph363 se retiró antes del Flop (no apostó)",
      "Asiento 4: oliverdu70 descartó sin mostrar [7d 7c]",
      "Asiento 5: olibellier se retiró antes del Flop (no apostó)",
      "Asiento 6: Dakoo44 (botón) se retiró antes del Flop (no apostó)"
    ]
  },
  "board": [
    "Ts",
    "Qs",
    "6h",
    "Qd",
    "2h"
  ],
  "winner": "SrLyce",
  "win_amount": 23.5,
  "sb": 0.01,
  "bb": 0.02,
  "rake": 1.5,
  "raw_text": "Mano n.º 257148835575 de PokerStars:  Hold'em No Limit (0.01 €/0.02 € EUR) - 30-07-2025 21:47:23 CET [30-07-2025 15:47:23 ET]\nMesa \"Sirona\" 6-max El asiento n.º 6 es el botón\nAsiento 1: SrLyce (1.86 € en fichas) \nAsiento 2: lecontrebandier (2.06 € en fichas) \nAsiento 3: christoph363 (3.58 € en fichas) \nAsiento 4: oliverdu70 (2.87 € en fichas) \nAsiento 5: olibellier (0.49 € en fichas) \nAsiento 6: Dakoo44 (1.99 € en fichas) \nSrLyce: pone la ciega pequeña 0.01 €\nlecontrebandier: pone la ciega grande 0.02 €\n*** CARTAS DE MANO ***\nRepartidas a SrLyce [8h 8s]\nchristoph363: se retira \noliverdu70: sube 0.04 € a 0.06 €\nolibellier: se retira \nDakoo44: se retira \nSrLyce: iguala 0.05 €\nlecontrebandier: se retira \n*** FLOP *** [Ts Qs 6h]\nSrLyce: pasa \noliverdu70: apuesta 0.07 €\nSrLyce: iguala 0.07 €\n*** TURN *** [Ts Qs 6h] [Qd]\nSrLyce: pasa \noliverdu70: pasa \n*** RIVER *** [Ts Qs 6h Qd] [2h]\nSrLyce: apuesta 0.11 €\noliverdu70: iguala 0.11 €\n*** SHOW DOWN ***\nSrLyce: muestra [8h 8s] (doble pareja, damas y ochos)\noliverdu70: descarta su mano sin mostrar \nSrLyce se lleva 0.47 € del bote \n*** RESUMEN ***\nBote total 0.50 € | Comisión 0.03 € \nComunitarias [Ts Qs 6h Qd 2h]\nAsiento 1: SrLyce (ciega pequeña) muestra [8h 8s] y ganó (0.47 €) con doble pareja, damas y ochos\nAsiento 2: lecontrebandier (ciega grande) se retiró antes del Flop\nAsiento 3: christoph363 se retiró antes del Flop (no apostó)\nAsiento 4: oliverdu70 descartó sin mostrar [7d 7c]\nAsiento 5: olibellier se retiró antes del Flop (no apostó)\nAsiento 6: Dakoo44 (botón) se retiró antes del Flop (no apostó)"
}