{
  "hand_id": "257150440567",
  "date": "30-07-2025 23:42:01",
  "table": "Martha",
  "game_type": "holdem",
  "hero": "SrLyce",
  "hero_position": "",
  "hero_cards": [
    "As",
    "Qs"
  ],
  "stacks": {
    "mivipkr": 107.5,
    "NovacaineZxc": 118.5,
    "BudyXXIII": 112.0,
    "Sigiilo": 100.0,
    "SrLyce": 97.0,
    "alexfw300": 101.0
  },
  "actions": {
    "preflop": [
      "Asiento 1: mivipkr (2.15 € en fichas)",
      "Asiento 2: NovacaineZxc (2.37 € en fichas)",
      "Asiento 3: BudyXXIII (2.24 € en fichas)",
      "Asiento 4: Sigiilo (2 € en fichas)",
      "Asiento 5: SrLyce (1.94 € en fichas)",
      "Asiento 6: alexfw300 (2.02 € en fichas)",
      "SrLyce: pone la ciega pequeña 0.01 €",
      "alexfw300: pone la ciega grande 0.02 €",
      "mivipkr: se retira",
      "NovacaineZxc: se retira",
      "BudyXXIII: se retira",
      "Sigiilo: se retira",
      "SrLyce: sube 0.04 € a 0.06 €",
      "alexfw300: se retira",
      "SrLyce: no muestra su mano",
      "Asiento 1: mivipkr se retiró antes del Flop (no apostó)",
      "Asiento 2: NovacaineZxc se retiró antes del Flop (no apostó)",
      "Asiento 3: BudyXXIII se retiró antes del Flop (no apostó)",
      "Asiento 4: Sigiilo (botón) se retiró antes del Flop (no apostó)",
      "Asiento 5: SrLyce (ciega pequeña) recaudó (0.04 €)",
      "Asiento 6: alexfw300 (ciega grande) se retiró antes del Flop"
    ],
    "flop": [],
    "turn": [],
    "river": []
  },
  "board": [],
  "winner": "SrLyce",
  "win_amount": 2.0,
  "sb": 0.01,
  "bb": 0.02,
  "rake": 0.0,
  "raw_text": "Mano n.º 257150440567 de PokerStars:  Hold'em No Limit (0.01 €/0.02 € EUR) - 30-07-2025 23:42:01 CET [30-07-2025 17:42:01 ET]\nMesa \"Martha\" 6-max El asiento n.º 4 es el botón\nAsiento 1: mivipkr (2.15 € en fichas) \nAsiento 2: NovacaineZxc (2.37 € en fichas) \nAsiento 3: BudyXXIII (2.24 € en fichas) \nAsiento 4: Sigiilo (2 € en fichas) \nAsiento 5: SrLyce (1.94 € en fichas) \nAsiento 6: alexfw300 (2.02 € en fichas) \nSrLyce: pone la ciega pequeña 0.01 €\nalexfw300: pone la ciega grande 0.02 €\n*** CARTAS DE MANO ***\nRepartidas a SrLyce [As Qs]\nmivipkr: se retira \nNovacaineZxc: se retira \nBudyXXIII: se retira \nSigiilo: se retira \nSrLyce: sube 0.04 € a 0.06 €\nalexfw300: se retira \nLa apuesta no igualada (0.04 €) ha sido devuelta a SrLyce\nSrLyce se lleva 0.04 € del bote \nSrLyce: no muestra su mano \n*** RESUMEN ***\nBote total 0.04 € | Comisión 0 € \nAsiento 1: mivipkr se retiró antes del Flop (no apostó)\nAsiento 2: NovacaineZxc se retiró antes del Flop (no apostó)\nAsiento 3: BudyXXIII se retiró antes del Flop (no apostó)\nAsiento 4: Sigiilo (botón) se retiró antes del Flop (no apostó)\nAsiento 5: SrLyce (ciega pequeña) recaudó (0.04 €)\nAsiento 6: alexfw300 (ciega grande) se retiró antes del Flop"
}