{
  "hand_id": "257215319067",
  "date": "04-08-2025 22:37:57",
  "table": "Aldhafera II",
  "game_type": "holdem",
  "hero": "SrLyce",
  "hero_position": "",
  "hero_cards": [
    "9c",
    "7h"
  ],
  "stacks": {
    "BudyXXIII": 292.5,
    "rhidoxxx": 0.0,
    "betterrrrrr": 171.5,
    "wsx25": 51.5,
    "SrLyce": 182.0,
    "jte-ken": 122.0
  },
  "actions": {
    "preflop": [
      "Asiento 2: BudyXXIII (5.85 € en fichas) está ausente",
      "Asiento 4: rhidoxxx (0 € en fichas) está ausente",
      "Asiento 6: betterrrrrr (3.43 € en fichas) está ausente",
      "Asiento 1: wsx25 (1.03 € en fichas)",
      "Asiento 3: SrLyce (3.64 € en fichas)",
      "Asiento 5: jte-ken (2.44 € en fichas)",
      "jte-ken: pone la ciega pequeña 0.01 €",
      "wsx25: pone la ciega grande 0.02 €",
      "SrLyce: se retira",
      "jte-ken: se retira",
      "wsx25: no muestra su mano",
      "Asiento 2: BudyXXIII",
      "Asiento 4: rhidoxxx",
      "Asiento 6: betterrrrrr",
      "Asiento 1: wsx25 (ciega grande) recaudó (0.02 €)",
      "Asiento 3: SrLyce (botón) se retiró antes del Flop (no apostó)",
      "Asiento 5: jte-ken (ciega pequeña) se retiró antes del Flop"
    ],
    "flop": [],
    "turn": [],
    "river": []
  },
  "board": [],
  "winner": "wsx25",
  "win_amount": 1.0,
  "sb": 0.01,
  "bb": 0.02,
  "rake": 0.0,
  "raw_text": "Mano n.º 257215319067 de PokerStars:  Hold'em No Limit (0.01 €/0.02 € EUR) - 04-08-2025 22:37:57 CET [04-08-2025 16:37:57 ET]\nMesa \"Aldhafera II\" 6-max El asiento n.º 3 es el botón\nAsiento 2: BudyXXIII (5.85 € en fichas) está ausente\nAsiento 4: rhidoxxx (0 € en fichas) está ausente\nAsiento 6: betterrrrrr (3.43 € en fichas) está ausente\nAsiento 1: wsx25 (1.03 € en fichas) \nAsiento 3: SrLyce (3.64 € en fichas) \nAsiento 5: jte-ken (2.44 € en fichas) \njte-ken: pone la ciega pequeña 0.01 €\nwsx25: pone la ciega grande 0.02 €\n*** CARTAS DE MANO ***\nRepartidas a SrLyce [9c 7h]\nSrLyce: se retira \njte-ken: se retira \nLa apuesta no igualada (0.01 €) ha sido devuelta a wsx25\nwsx25 se lleva 0.02 € del bote \nwsx25: no muestra su mano \n*** RESUMEN ***\nBote total 0.02 € | Comisión 0 € \nAsiento 2: BudyXXIII\nAsiento 4: rhidoxxx\nAsiento 6: betterrrrrr\nAsiento 1: wsx25 (ciega grande) recaudó (0.02 €)\nAsiento 3: SrLyce (botón) se retiró antes del Flop (no apostó)\nAsiento 5: jte-ken (ciega pequeña) se retiró antes del Flop"
}