{
  "hand_id": "257168300047",
  "date": "01-08-2025 11:22:24",
  "table": "Jupiter",
  "game_type": "holdem",
  "hero": "SrLyce",
  "hero_position": "",
  "hero_cards": [
    "8d",
    "Tc"
  ],
  "stacks": {
    "LOLA19711971": 30.5,
    "sifilis5": 95.5,
    "Filou203": 110.0,
    "SrLyce": 115.0,
    "dadou13mars": 219.5,
    "Alvii37": 109.5
  },
  "actions": {
    "preflop": [
      "Asiento 4: LOLA19711971 (0.61 € en fichas) está ausente",
      "Asiento 1: sifilis5 (1.91 € en fichas)",
      "Asiento 2: Filou203 (2.20 € en fichas)",
      "Asiento 3: SrLyce (2.30 € en fichas)",
      "Asiento 5: dadou13mars (4.39 € en fichas)",
      "Asiento 6: Alvii37 (2.19 € en fichas)",
      "sifilis5: pone la ciega pequeña 0.01 €",
      "Filou203: pone la ciega grande 0.02 €",
      "LOLA19711971: se ausenta",
      "SrLyce: se retira",
      "dadou13mars: se retira",
      "Alvii37: sube 0.04 € a 0.06 €",
      "sifilis5: se retira",
      "Filou203: sube 0.13 € a 0.19 €",
      "Alvii37: se retira",
      "Filou203: no muestra su mano",
      "Asiento 4: LOLA19711971",
      "Asiento 1: sifilis5 (ciega pequeña) se retiró antes del Flop",
      "Asiento 2: Filou203 (ciega grande) recaudó (0.13 €)",
      "Asiento 3: SrLyce se retiró antes del Flop (no apostó)",
      "Asiento 5: dadou13mars se retiró antes del Flop (no apostó)",
      "Asiento 6: Alvii37 (botón) se retiró antes del Flop"
    ],
    "flop": [],
    "turn": [],
    "river": []
  },
  "board": [],
  "winner": "Filou203",
  "win_amount": 6.5,
  "sb": 0.01,
  "bb": 0.02,
  "rake": 0.0,
  "raw_text": "Mano n.º 257168300047 de PokerStars:  Hold'em No Limit (0.01 €/0.02 € EUR) - 01-08-2025 11:22:24 CET [01-08-2025 5:22:24 ET]\nMesa \"Jupiter\" 6-max El asiento n.º 6 es el botón\nAsiento 4: LOLA19711971 (0.61 € en fichas) está ausente\nAsiento 1: sifilis5 (1.91 € en fichas) \nAsiento 2: Filou203 (2.20 € en fichas) \nAsiento 3: SrLyce (2.30 € en fichas) \nAsiento 5: dadou13mars (4.39 € en fichas) \nAsiento 6: Alvii37 (2.19 € en fichas) \nsifilis5: pone la ciega pequeña 0.01 €\nFilou203: pone la ciega grande 0.02 €\nLOLA19711971: se ausenta \n*** CARTAS DE MANO ***\nRepartidas a SrLyce [8d Tc]\nSrLyce: se retira \ndadou13mars: se retira \nAlvii37: sube 0.04 € a 0.06 €\nsifilis5: se retira \nFilou203: sube 0.13 € a 0.19 €\nAlvii37: se retira \nLa apuesta no igualada (0.13 €) ha sido devuelta a Filou203\nFilou203 se lleva 0.13 € del bote \nFilou203: no muestra su mano \n*** RESUMEN ***\nBote total 0.13 € | Comisión 0 € \nAsiento 4: LOLA19711971\nAsiento 1: sifilis5 (ciega pequeña) se retiró antes del Flop\nAsiento 2: Filou203 (ciega grande) recaudó (0.13 €)\nAsiento 3: SrLyce se retiró antes del Flop (no apostó)\nAsiento 5: dadou13mars se retiró antes del Flop (no apostó)\nAsiento 6: Alvii37 (botón) se retiró antes del Flop"
}