{
  "hand_id": "257237042475",
  "date": "06-08-2025 17:34:18",
  "table": "Themisto III",
  "game_type": "holdem",
  "hero": "SrLyce",
  "hero_position": "",
  "hero_cards": [
    "7d",
    "7c"
  ],
  "stacks": {
    "elso253": 77.5,
    "SrLyce": 101.5,
    "idigon": 24.5,
    "fred2d23po": 80.0,
    "mivipkr": 124.0,
    "marignamo": 93.5
  },
  "actions": {
    "preflop": [
      "Asiento 1: elso253 (1.55 € en fichas)",
      "Asiento 2: SrLyce (2.03 € en fichas)",
      "Asiento 3: idigon (0.49 € en fichas)",
      "Asiento 4: fred2d23po (1.60 € en fichas)",
      "Asiento 5: mivipkr (2.48 € en fichas)",
      "Asiento 6: marignamo (1.87 € en fichas)",
      "marignamo: pone la ciega pequeña 0.01 €",
      "elso253: pone la ciega grande 0.02 €",
      "fred2d23po: pone la ciega grande 0.02 €",
      "SrLyce: sube 0.04 € a 0.06 €",
      "idigon: iguala 0.06 €",
      "fred2d23po: iguala 0.04 €",
      "mivipkr: se retira",
      "marignamo: iguala 0.05 €",
      "elso253: iguala 0.04 €"
    ],
    "flop": [
      "marignamo: pasa",
      "elso253: apuesta 0.14 €",
      "SrLyce: sube 0.28 € a 0.42 €",
      "idigon: se retira",
      "fred2d23po: se retira",
      "marignamo: se retira",
      "elso253: se retira",
      "SrLyce: no muestra su mano",
      "Asiento 1: elso253 (ciega grande) se retiró en el Flop",
      "Asiento 2: SrLyce recaudó (0.55 €)",
      "Asiento 3: idigon se retiró en el Flop",
      "Asiento 4: fred2d23po se retiró en el Flop",
      "Asiento 5: mivipkr (botón) se retiró antes del Flop (no apostó)",
      "Asiento 6: marignamo (ciega pequeña) se retiró en el Flop"
    ],
    "turn": [],
    "river": []
  },
  "board": [
    "7h",
    "Jd",
    "2c"
  ],
  "winner": "SrLyce",
  "win_amount": 27.5,
  "sb": 0.01,
  "bb": 0.02,
  "rake": 1.5,
  "raw_text": "Mano n.º 257237042475 de PokerStars:  Hold'em No Limit (0.01 €/0.02 € EUR) - 06-08-2025 17:34:18 CET [06-08-2025 11:34:18 ET]\nMesa \"Themisto III\" 6-max El asiento n.º 5 es el botón\nAsiento 1: elso253 (1.55 € en fichas) \nAsiento 2: SrLyce (2.03 € en fichas) \nAsiento 3: idigon (0.49 € en fichas) \nAsiento 4: fred2d23po (1.60 € en fichas) \nAsiento 5: mivipkr (2.48 € en fichas) \nAsiento 6: marignamo (1.87 € en fichas) \nmarignamo: pone la ciega pequeña 0.01 €\nelso253: pone la ciega grande 0.02 €\nfred2d23po: pone la ciega grande 0.02 €\n*** CARTAS DE MANO ***\nRepartidas a SrLyce [7d 7c]\nSrLyce: sube 0.04 € a 0.06 €\nidigon: iguala 0.06 €\nfred2d23po: iguala 0.04 €\nmivipkr: se retira \nmarignamo: iguala 0.05 €\nelso253: iguala 0.04 €\n*** FLOP *** [7h Jd 2c]\nmarignamo: pasa \nelso253: apuesta 0.14 €\nSrLyce: sube 0.28 € a 0.42 €\nidigon: se retira \nfred2d23po: se retira \nmarignamo: se retira \nelso253: se retira \nLa apuesta no igualada (0.28 €) ha sido devuelta a SrLyce\nSrLyce se lleva 0.55 € del bote \nSrLyce: no muestra su mano \n*** RESUMEN ***\nBote total 0.58 € | Comisión 0.03 € \nComunitarias [7h Jd 2c]\nAsiento 1: elso253 (ciega grande) se retiró en el Flop\nAsiento 2: SrLyce recaudó (0.55 €)\nAsiento 3: idigon se retiró en el Flop\nAsiento 4: fred2d23po se retiró en el Flop\nAsiento 5: mivipkr (botón) se retiró antes del Flop (no apostó)\nAsiento 6: marignamo (ciega pequeña) se retiró en el Flop"
}