{
  "hand_id": "257237884077",
  "date": "06-08-2025 18:08:35",
  "table": "Nuwa III",
  "game_type": "holdem",
  "hero": "SrLyce",
  "hero_position": "",
  "hero_cards": [
    "7d",
    "Td"
  ],
  "stacks": {
    "davinci1962": 204.5,
    "BuXHexter": 100.0,
    "kcg_rm": 105.0,
    "SrLyce": 100.0,
    "RiskAllinkali": 115.0,
    "acavada": 107.5
  },
  "actions": {
    "preflop": [
      "Asiento 1: davinci1962 (4.09 € en fichas)",
      "Asiento 2: BuXHexter (2 € en fichas)",
      "Asiento 3: kcg_rm (2.10 € en fichas)",
      "Asiento 4: SrLyce (2 € en fichas)",
      "Asiento 5: RiskAllinkali (2.30 € en fichas)",
      "Asiento 6: acavada (2.15 € en fichas)",
      "kcg_rm: pone la ciega pequeña 0.01 €",
      "SrLyce: pone la ciega grande 0.02 €",
      "RiskAllinkali: se retira",
      "acavada: se retira",
      "davinci1962: se retira",
      "BuXHexter: se retira",
      "kcg_rm: se retira",
      "SrLyce: no muestra su mano",
      "Asiento 1: davinci1962 se retiró antes del Flop (no apostó)",
      "Asiento 2: BuXHexter (botón) se retiró antes del Flop (no apostó)",
      "Asiento 3: kcg_rm (ciega pequeña) se retiró antes del Flop",
      "Asiento 4: SrLyce (ciega grande) recaudó (0.02 €)",
      "Asiento 5: RiskAllinkali se retiró antes del Flop (no apostó)",
      "Asiento 6: acavada se retiró antes del Flop (no apostó)"
    ],
    "flop": [],
    "turn": [],
    "river": []
  },
  "board": [],
  "winner": "SrLyce",
  "win_amount": 1.0,
  "sb": 0.01,
  "bb": 0.02,
  "rake": 0.0,
  "raw_text": "Mano n.º 257237884077 de PokerStars:  Hold'em No Limit (0.01 €/0.02 € EUR) - 06-08-2025 18:08:35 CET [06-08-2025 12:08:35 ET]\nMesa \"Nuwa III\" 6-max El asiento n.º 2 es el botón\nAsiento 1: davinci1962 (4.09 € en fichas) \nAsiento 2: BuXHexter (2 € en fichas) \nAsiento 3: kcg_rm (2.10 € en fichas) \nAsiento 4: SrLyce (2 € en fichas) \nAsiento 5: RiskAllinkali (2.30 € en fichas) \nAsiento 6: acavada (2.15 € en fichas) \nkcg_rm: pone la ciega pequeña 0.01 €\nSrLyce: pone la ciega grande 0.02 €\n*** CARTAS DE MANO ***\nRepartidas a SrLyce [7d Td]\nRiskAllinkali: se retira \nRiskAllinkali deja la mesa\nacavada: se retira \ndavinci1962: se retira \nBuXHexter: se retira \nkcg_rm: se retira \nLa apuesta no igualada (0.01 €) ha sido devuelta a SrLyce\nSrLyce se lleva 0.02 € del bote \nSrLyce: no muestra su mano \n*** RESUMEN ***\nBote total 0.02 € | Comisión 0 € \nAsiento 1: davinci1962 se retiró antes del Flop (no apostó)\nAsiento 2: BuXHexter (botón) se retiró antes del Flop (no apostó)\nAsiento 3: kcg_rm (ciega pequeña) se retiró antes del Flop\nAsiento 4: SrLyce (ciega grande) recaudó (0.02 €)\nAsiento 5: RiskAllinkali se retiró antes del Flop (no apostó)\nAsiento 6: acavada se retiró antes del Flop (no apostó)"
}