{
  "hand_id": "257168240000",
  "date": "01-08-2025 11:10:45",
  "table": "Jupiter",
  "game_type": "holdem",
  "hero": "SrLyce",
  "hero_position": "",
  "hero_cards": [
    "2s",
    "9c"
  ],
  "stacks": {
    "sifilis5": 89.5,
    "Filou203": 117.0,
    "SrLyce": 115.5,
    "LOLA19711971": 26.0,
    "dadou13mars": 225.0,
    "Alvii37": 95.0
  },
  "actions": {
    "preflop": [
      "Asiento 1: sifilis5 (1.79 € en fichas)",
      "Asiento 2: Filou203 (2.34 € en fichas)",
      "Asiento 3: SrLyce (2.31 € en fichas)",
      "Asiento 4: LOLA19711971 (0.52 € en fichas)",
      "Asiento 5: dadou13mars (4.50 € en fichas)",
      "Asiento 6: Alvii37 (1.90 € en fichas)",
      "Alvii37: pone la ciega pequeña 0.01 €",
      "sifilis5: pone la ciega grande 0.02 €",
      "Filou203: se retira",
      "SrLyce: se retira",
      "LOLA19711971: se retira",
      "dadou13mars: se retira",
      "Alvii37: sube 0.04 € a 0.06 €",
      "sifilis5: se retira",
      "Alvii37: no muestra su mano",
      "Asiento 1: sifilis5 (ciega grande) se retiró antes del Flop",
      "Asiento 2: Filou203 se retiró antes del Flop (no apostó)",
      "Asiento 3: SrLyce se retiró antes del Flop (no apostó)",
      "Asiento 4: LOLA19711971 se retiró antes del Flop (no apostó)",
      "Asiento 5: dadou13mars (botón) se retiró antes del Flop (no apostó)",
      "Asiento 6: Alvii37 (ciega pequeña) recaudó (0.04 €)"
    ],
    "flop": [],
    "turn": [],
    "river": []
  },
  "board": [],
  "winner": "Alvii37",
  "win_amount": 2.0,
  "sb": 0.01,
  "bb": 0.02,
  "rake": 0.0,
  "raw_text": "Mano n.º 257168240000 de PokerStars:  Hold'em No Limit (0.01 €/0.02 € EUR) - 01-08-2025 11:10:45 CET [01-08-2025 5:10:45 ET]\nMesa \"Jupiter\" 6-max El asiento n.º 5 es el botón\nAsiento 1: sifilis5 (1.79 € en fichas) \nAsiento 2: Filou203 (2.34 € en fichas) \nAsiento 3: SrLyce (2.31 € en fichas) \nAsiento 4: LOLA19711971 (0.52 € en fichas) \nAsiento 5: dadou13mars (4.50 € en fichas) \nAsiento 6: Alvii37 (1.90 € en fichas) \nAlvii37: pone la ciega pequeña 0.01 €\nsifilis5: pone la ciega grande 0.02 €\n*** CARTAS DE MANO ***\nRepartidas a SrLyce [2s 9c]\nFilou203: se retira \nSrLyce: se retira \nLOLA19711971: se retira \ndadou13mars: se retira \nAlvii37: sube 0.04 € a 0.06 €\nsifilis5: se retira \nLa apuesta no igualada (0.04 €) ha sido devuelta a Alvii37\nAlvii37 se lleva 0.04 € del bote \nAlvii37: no muestra su mano \n*** RESUMEN ***\nBote total 0.04 € | Comisión 0 € \nAsiento 1: sifilis5 (ciega grande) se retiró antes del Flop\nAsiento 2: Filou203 se retiró antes del Flop (no apostó)\nAsiento 3: SrLyce se retiró antes del Flop (no apostó)\nAsiento 4: LOLA19711971 se retiró antes del Flop (no apostó)\nAsiento 5: dadou13mars (botón) se retiró antes del Flop (no apostó)\nAsiento 6: Alvii37 (ciega pequeña) recaudó (0.04 €)"
}