{
  "hand_id": "257168251669",
  "date": "01-08-2025 11:13:03",
  "table": "Atlas",
  "game_type": "holdem",
  "hero": "SrLyce",
  "hero_position": "",
  "hero_cards": [
    "Qc",
    "5h"
  ],
  "stacks": {
    "ecuinas": 101.0,
    "SrLyce": 99.0
  },
  "actions": {
    "preflop": [
      "Asiento 2: ecuinas (2.02 € en fichas)",
      "Asiento 3: SrLyce (1.98 € en fichas)",
      "SrLyce: pone la ciega pequeña 0.01 €",
      "ecuinas: pone la ciega grande 0.02 €",
      "SrLyce: se retira",
      "ecuinas: no muestra su mano",
      "Asiento 2: ecuinas (ciega grande) recaudó (0.02 €)",
      "Asiento 3: SrLyce (botón) (ciega pequeña) se retiró antes del Flop"
    ],
    "flop": [],
    "turn": [],
    "river": []
  },
  "board": [],
  "winner": "ecuinas",
  "win_amount": 1.0,
  "sb": 0.01,
  "bb": 0.02,
  "rake": 0.0,
  "raw_text": "Mano n.º 257168251669 de PokerStars:  Hold'em No Limit (0.01 €/0.02 € EUR) - 01-08-2025 11:13:03 CET [01-08-2025 5:13:03 ET]\nMesa \"Atlas\" 6-max El asiento n.º 3 es el botón\nAsiento 2: ecuinas (2.02 € en fichas) \nAsiento 3: SrLyce (1.98 € en fichas) \nSrLyce: pone la ciega pequeña 0.01 €\necuinas: pone la ciega grande 0.02 €\n*** CARTAS DE MANO ***\nRepartidas a SrLyce [Qc 5h]\nSrLyce: se retira \nLa apuesta no igualada (0.01 €) ha sido devuelta a ecuinas\necuinas se lleva 0.02 € del bote \necuinas: no muestra su mano \n*** RESUMEN ***\nBote total 0.02 € | Comisión 0 € \nAsiento 2: ecuinas (ciega grande) recaudó (0.02 €)\nAsiento 3: SrLyce (botón) (ciega pequeña) se retiró antes del Flop"
}