{
  "hand_id": "257238677001",
  "date": "06-08-2025 19:19:50",
  "table": "Herculina II",
  "game_type": "holdem",
  "hero": "SrLyce",
  "hero_position": "",
  "hero_cards": [
    "2d",
    "9h"
  ],
  "stacks": {
    "Alceo27": 122.0,
    "David98X": 150.5,
    "JJer11": 192.5,
    "SrLyce": 114.5,
    "Macklemore0": 101.0,
    "ScarvBlack": 110.0
  },
  "actions": {
    "preflop": [
      "Asiento 1: Alceo27 (2.44 € en fichas)",
      "Asiento 2: David98X (3.01 € en fichas)",
      "Asiento 3: JJer11 (3.85 € en fichas)",
      "Asiento 4: SrLyce (2.29 € en fichas)",
      "Asiento 5: Macklemore0 (2.02 € en fichas)",
      "Asiento 6: ScarvBlack (2.20 € en fichas)",
      "JJer11: pone la ciega pequeña 0.01 €",
      "SrLyce: pone la ciega grande 0.02 €",
      "Macklemore0: se retira",
      "ScarvBlack: sube 0.04 € a 0.06 €",
      "Alceo27: se retira",
      "David98X: se retira",
      "JJer11: se retira",
      "SrLyce: se retira",
      "ScarvBlack: no muestra su mano",
      "Asiento 1: Alceo27 se retiró antes del Flop (no apostó)",
      "Asiento 2: David98X (botón) se retiró antes del Flop (no apostó)",
      "Asiento 3: JJer11 (ciega pequeña) se retiró antes del Flop",
      "Asiento 4: SrLyce (ciega grande) se retiró antes del Flop",
      "Asiento 5: Macklemore0 se retiró antes del Flop (no apostó)",
      "Asiento 6: ScarvBlack recaudó (0.05 €)"
    ],
    "flop": [],
    "turn": [],
    "river": []
  },
  "board": [],
  "winner": "ScarvBlack",
  "win_amount": 2.5,
  "sb": 0.01,
  "bb": 0.02,
  "rake": 0.0,
  "raw_text": "Mano n.º 257238677001 de PokerStars:  Hold'em No Limit (0.01 €/0.02 € EUR) - 06-08-2025 19:19:50 CET [06-08-2025 13:19:50 ET]\nMesa \"Herculina II\" 6-max El asiento n.º 2 es el botón\nAsiento 1: Alceo27 (2.44 € en fichas) \nAsiento 2: David98X (3.01 € en fichas) \nAsiento 3: JJer11 (3.85 € en fichas) \nAsiento 4: SrLyce (2.29 € en fichas) \nAsiento 5: Macklemore0 (2.02 € en fichas) \nAsiento 6: ScarvBlack (2.20 € en fichas) \nJJer11: pone la ciega pequeña 0.01 €\nSrLyce: pone la ciega grande 0.02 €\n*** CARTAS DE MANO ***\nRepartidas a SrLyce [2d 9h]\nMacklemore0: se retira \nScarvBlack: sube 0.04 € a 0.06 €\nAlceo27: se retira \nDavid98X: se retira \nJJer11: se retira \nSrLyce: se retira \nLa apuesta no igualada (0.04 €) ha sido devuelta a ScarvBlack\nScarvBlack se lleva 0.05 € del bote \nScarvBlack: no muestra su mano \n*** RESUMEN ***\nBote total 0.05 € | Comisión 0 € \nAsiento 1: Alceo27 se retiró antes del Flop (no apostó)\nAsiento 2: David98X (botón) se retiró antes del Flop (no apostó)\nAsiento 3: JJer11 (ciega pequeña) se retiró antes del Flop\nAsiento 4: SrLyce (ciega grande) se retiró antes del Flop\nAsiento 5: Macklemore0 se retiró antes del Flop (no apostó)\nAsiento 6: ScarvBlack recaudó (0.05 €)"
}