{
  "hand_id": "257215006154",
  "date": "04-08-2025 22:18:26",
  "table": "Anneliese II",
  "game_type": "holdem",
  "hero": "SrLyce",
  "hero_position": "",
  "hero_cards": [
    "7s",
    "2s"
  ],
  "stacks": {
    "betterrrrrr": 100.0,
    "niyomalo": 103.0,
    "ElManu62": 118.0,
    "SrLyce": 98.5,
    "Mr_Pkr98": 141.5,
    "Spotick": 109.5
  },
  "actions": {
    "preflop": [
      "Asiento 1: betterrrrrr (2 € en fichas)",
      "Asiento 2: niyomalo (2.06 € en fichas)",
      "Asiento 3: ElManu62 (2.36 € en fichas)",
      "Asiento 4: SrLyce (1.97 € en fichas)",
      "Asiento 5: Mr_Pkr98 (2.83 € en fichas)",
      "Asiento 6: Spotick (2.19 € en fichas)",
      "Spotick: pone la ciega pequeña 0.01 €",
      "betterrrrrr: pone la ciega grande 0.02 €",
      "niyomalo: iguala 0.02 €",
      "ElManu62: sube 0.02 € a 0.04 €",
      "SrLyce: se retira",
      "Mr_Pkr98: se retira",
      "Spotick: se retira",
      "betterrrrrr: sube 0.16 € a 0.20 €",
      "niyomalo: iguala 0.18 €",
      "ElManu62: se retira"
    ],
    "flop": [
      "betterrrrrr: apuesta 0.10 €",
      "niyomalo: sube 0.10 € a 0.20 €",
      "betterrrrrr: iguala 0.10 €"
    ],
    "turn": [
      "betterrrrrr: pasa",
      "niyomalo: apuesta 0.40 €",
      "betterrrrrr: se retira",
      "niyomalo: no muestra su mano",
      "Asiento 1: betterrrrrr (ciega grande) se retiró en el Turn",
      "Asiento 2: niyomalo recaudó (0.80 €)",
      "Asiento 3: ElManu62 se retiró antes del Flop",
      "Asiento 4: SrLyce se retiró antes del Flop (no apostó)",
      "Asiento 5: Mr_Pkr98 (botón) se retiró antes del Flop (no apostó)",
      "Asiento 6: Spotick (ciega pequeña) se retiró antes del Flop"
    ],
    "river": []
  },
  "board": [
    "6s",
    "6d",
    "Ad",
    "8c"
  ],
  "winner": "niyomalo",
  "win_amount": 40.0,
  "sb": 0.01,
  "bb": 0.02,
  "rake": 2.5,
  "raw_text": "Mano n.º 257215006154 de PokerStars:  Hold'em No Limit (0.01 €/0.02 € EUR) - 04-08-2025 22:18:26 CET [04-08-2025 16:18:26 ET]\nMesa \"Anneliese II\" 6-max El asiento n.º 5 es el botón\nAsiento 1: betterrrrrr (2 € en fichas) \nAsiento 2: niyomalo (2.06 € en fichas) \nAsiento 3: ElManu62 (2.36 € en fichas) \nAsiento 4: SrLyce (1.97 € en fichas) \nAsiento 5: Mr_Pkr98 (2.83 € en fichas) \nAsiento 6: Spotick (2.19 € en fichas) \nSpotick: pone la ciega pequeña 0.01 €\nbetterrrrrr: pone la ciega grande 0.02 €\n*** CARTAS DE MANO ***\nRepartidas a SrLyce [7s 2s]\nniyomalo: iguala 0.02 €\nElManu62: sube 0.02 € a 0.04 €\nSrLyce: se retira \nMr_Pkr98: se retira \nSpotick: se retira \nbetterrrrrr: sube 0.16 € a 0.20 €\nniyomalo: iguala 0.18 €\nElManu62: se retira \n*** FLOP *** [6s 6d Ad]\nbetterrrrrr: apuesta 0.10 €\nniyomalo: sube 0.10 € a 0.20 €\nbetterrrrrr: iguala 0.10 €\n*** TURN *** [6s 6d Ad] [8c]\nbetterrrrrr: pasa \nniyomalo: apuesta 0.40 €\nbetterrrrrr: se retira \nLa apuesta no igualada (0.40 €) ha sido devuelta a niyomalo\nniyomalo se lleva 0.80 € del bote \nniyomalo: no muestra su mano \n*** RESUMEN ***\nBote total 0.85 € | Comisión 0.05 € \nComunitarias [6s 6d Ad 8c]\nAsiento 1: betterrrrrr (ciega grande) se retiró en el Turn\nAsiento 2: niyomalo recaudó (0.80 €)\nAsiento 3: ElManu62 se retiró antes del Flop\nAsiento 4: SrLyce se retiró antes del Flop (no apostó)\nAsiento 5: Mr_Pkr98 (botón) se retiró antes del Flop (no apostó)\nAsiento 6: Spotick (ciega pequeña) se retiró antes del Flop"
}