{
  "hand_id": "257237888075",
  "date": "06-08-2025 18:08:57",
  "table": "Atreus",
  "game_type": "holdem",
  "hero": "SrLyce",
  "hero_position": "",
  "hero_cards": [
    "3s",
    "7h"
  ],
  "stacks": {
    "Fharock": 100.0,
    "PrendsCa": 110.0,
    "NRules82": 81.0,
    "JENOFONTE73": 118.0,
    "SrLyce": 98.5,
    "FishamanReggae": 43.0
  },
  "actions": {
    "preflop": [
      "Asiento 4: Fharock (2 € en fichas) está ausente",
      "Asiento 1: PrendsCa (2.20 € en fichas)",
      "Asiento 2: NRules82 (1.62 € en fichas)",
      "Asiento 3: JENOFONTE73 (2.36 € en fichas)",
      "Asiento 5: SrLyce (1.97 € en fichas)",
      "Asiento 6: FishamanReggae (0.86 € en fichas)",
      "NRules82: pone la ciega pequeña 0.01 €",
      "JENOFONTE73: pone la ciega grande 0.02 €",
      "Fharock: se ausenta",
      "SrLyce: se retira",
      "FishamanReggae: iguala 0.02 €",
      "PrendsCa: se retira",
      "NRules82: sube 0.06 € a 0.08 €",
      "JENOFONTE73: se retira",
      "FishamanReggae: iguala 0.06 €"
    ],
    "flop": [
      "NRules82: apuesta 0.10 €",
      "FishamanReggae: se retira",
      "Asiento 4: Fharock",
      "Asiento 1: PrendsCa (botón) se retiró antes del Flop (no apostó)",
      "Asiento 2: NRules82 (ciega pequeña) recaudó (0.17 €)",
      "Asiento 3: JENOFONTE73 (ciega grande) se retiró antes del Flop",
      "Asiento 5: SrLyce se retiró antes del Flop (no apostó)",
      "Asiento 6: FishamanReggae se retiró en el Flop"
    ],
    "turn": [],
    "river": []
  },
  "board": [
    "Kd",
    "Ah",
    "Qh"
  ],
  "winner": "NRules82",
  "win_amount": 8.5,
  "sb": 0.01,
  "bb": 0.02,
  "rake": 0.5,
  "raw_text": "Mano n.º 257237888075 de PokerStars:  Hold'em No Limit (0.01 €/0.02 € EUR) - 06-08-2025 18:08:57 CET [06-08-2025 12:08:57 ET]\nMesa \"Atreus\" 6-max El asiento n.º 1 es el botón\nAsiento 4: Fharock (2 € en fichas) está ausente\nAsiento 1: PrendsCa (2.20 € en fichas) \nAsiento 2: NRules82 (1.62 € en fichas) \nAsiento 3: JENOFONTE73 (2.36 € en fichas) \nAsiento 5: SrLyce (1.97 € en fichas) \nAsiento 6: FishamanReggae (0.86 € en fichas) \nNRules82: pone la ciega pequeña 0.01 €\nJENOFONTE73: pone la ciega grande 0.02 €\nFharock: se ausenta \n*** CARTAS DE MANO ***\nRepartidas a SrLyce [3s 7h]\nSrLyce: se retira \nFishamanReggae: iguala 0.02 €\nPrendsCa: se retira \nNRules82: sube 0.06 € a 0.08 €\nJENOFONTE73: se retira \nFishamanReggae: iguala 0.06 €\n*** FLOP *** [Kd Ah Qh]\nNRules82: apuesta 0.10 €\nFishamanReggae: se retira \nLa apuesta no igualada (0.10 €) ha sido devuelta a NRules82\nNRules82 se lleva 0.17 € del bote \n*** RESUMEN ***\nBote total 0.18 € | Comisión 0.01 € \nComunitarias [Kd Ah Qh]\nAsiento 4: Fharock\nAsiento 1: PrendsCa (botón) se retiró antes del Flop (no apostó)\nAsiento 2: NRules82 (ciega pequeña) recaudó (0.17 €)\nAsiento 3: JENOFONTE73 (ciega grande) se retiró antes del Flop\nAsiento 5: SrLyce se retiró antes del Flop (no apostó)\nAsiento 6: FishamanReggae se retiró en el Flop"
}