{
  "hand_id": "257238813767",
  "date": "06-08-2025 19:31:09",
  "table": "Herculina II",
  "game_type": "holdem",
  "hero": "SrLyce",
  "hero_position": "",
  "hero_cards": [
    "Js",
    "Qs"
  ],
  "stacks": {
    "Alceo27": 117.5,
    "David98X": 129.5,
    "JJer11": 187.5,
    "SrLyce": 129.0,
    "Macklemore0": 102.5,
    "ScarvBlack": 131.0
  },
  "actions": {
    "preflop": [
      "Asiento 1: Alceo27 (2.35 € en fichas)",
      "Asiento 2: David98X (2.59 € en fichas)",
      "Asiento 3: JJer11 (3.75 € en fichas)",
      "Asiento 4: SrLyce (2.58 € en fichas)",
      "Asiento 5: Macklemore0 (2.05 € en fichas)",
      "Asiento 6: ScarvBlack (2.62 € en fichas)",
      "David98X: pone la ciega pequeña 0.01 €",
      "JJer11: pone la ciega grande 0.02 €",
      "SrLyce: sube 0.03 € a 0.05 €",
      "Macklemore0: iguala 0.05 €",
      "ScarvBlack: se retira",
      "Alceo27: se retira",
      "David98X: se retira",
      "JJer11: se retira"
    ],
    "flop": [
      "SrLyce: apuesta 0.04 €",
      "Macklemore0: se retira",
      "SrLyce: no muestra su mano",
      "Asiento 1: Alceo27 (botón) se retiró antes del Flop (no apostó)",
      "Asiento 2: David98X (ciega pequeña) se retiró antes del Flop",
      "Asiento 3: JJer11 (ciega grande) se retiró antes del Flop",
      "Asiento 4: SrLyce recaudó (0.12 €)",
      "Asiento 5: Macklemore0 se retiró en el Flop",
      "Asiento 6: ScarvBlack se retiró antes del Flop (no apostó)"
    ],
    "turn": [],
    "river": []
  },
  "board": [
    "5s",
    "3d",
    "Ad"
  ],
  "winner": "SrLyce",
  "win_amount": 6.0,
  "sb": 0.01,
  "bb": 0.02,
  "rake": 0.5,
  "raw_text": "Mano n.º 257238813767 de PokerStars:  Hold'em No Limit (0.01 €/0.02 € EUR) - 06-08-2025 19:31:09 CET [06-08-2025 13:31:09 ET]\nMesa \"Herculina II\" 6-max El asiento n.º 1 es el botón\nAsiento 1: Alceo27 (2.35 € en fichas) \nAsiento 2: David98X (2.59 € en fichas) \nAsiento 3: JJer11 (3.75 € en fichas) \nAsiento 4: SrLyce (2.58 € en fichas) \nAsiento 5: Macklemore0 (2.05 € en fichas) \nAsiento 6: ScarvBlack (2.62 € en fichas) \nDavid98X: pone la ciega pequeña 0.01 €\nJJer11: pone la ciega grande 0.02 €\n*** CARTAS DE MANO ***\nRepartidas a SrLyce [Js Qs]\nSrLyce: sube 0.03 € a 0.05 €\nMacklemore0: iguala 0.05 €\nScarvBlack: se retira \nAlceo27: se retira \nDavid98X: se retira \nJJer11: se retira \n*** FLOP *** [5s 3d Ad]\nSrLyce: apuesta 0.04 €\nMacklemore0: se retira \nLa apuesta no igualada (0.04 €) ha sido devuelta a SrLyce\nSrLyce se lleva 0.12 € del bote \nSrLyce: no muestra su mano \n*** RESUMEN ***\nBote total 0.13 € | Comisión 0.01 € \nComunitarias [5s 3d Ad]\nAsiento 1: Alceo27 (botón) se retiró antes del Flop (no apostó)\nAsiento 2: David98X (ciega pequeña) se retiró antes del Flop\nAsiento 3: JJer11 (ciega grande) se retiró antes del Flop\nAsiento 4: SrLyce recaudó (0.12 €)\nAsiento 5: Macklemore0 se retiró en el Flop\nAsiento 6: ScarvBlack se retiró antes del Flop (no apostó)"
}