{
  "hand_id": "257148722931",
  "date": "30-07-2025 21:39:27",
  "table": "Esclangona",
  "game_type": "holdem",
  "hero": "SrLyce",
  "hero_position": "",
  "hero_cards": [
    "Qs",
    "6d"
  ],
  "stacks": {
    "Zorgue1080": 95.0,
    "SrLyce": 136.0,
    "Davdgoni": 118.0,
    "DiaZzZ1": 115.5,
    "berlcht403": 33.5
  },
  "actions": {
    "preflop": [
      "Asiento 1: Zorgue1080 (1.90 € en fichas)",
      "Asiento 2: SrLyce (2.72 € en fichas)",
      "Asiento 4: Davdgoni (2.36 € en fichas)",
      "Asiento 5: DiaZzZ1 (2.31 € en fichas)",
      "Asiento 6: berlcht403 (0.67 € en fichas)",
      "Davdgoni: pone la ciega pequeña 0.01 €",
      "DiaZzZ1: pone la ciega grande 0.02 €",
      "berlcht403: iguala 0.02 €",
      "Zorgue1080: se retira",
      "SrLyce: se retira",
      "Davdgoni: se retira",
      "DiaZzZ1: pasa"
    ],
    "flop": [
      "DiaZzZ1: pasa",
      "berlcht403: apuesta 0.05 €",
      "DiaZzZ1: se retira",
      "Asiento 1: Zorgue1080 se retiró antes del Flop (no apostó)",
      "Asiento 2: SrLyce (botón) se retiró antes del Flop (no apostó)",
      "Asiento 4: Davdgoni (ciega pequeña) se retiró antes del Flop",
      "Asiento 5: DiaZzZ1 (ciega grande) se retiró en el Flop",
      "Asiento 6: berlcht403 recaudó (0.05 €)"
    ],
    "turn": [],
    "river": []
  },
  "board": [
    "8d",
    "5s",
    "Qc"
  ],
  "winner": "berlcht403",
  "win_amount": 2.5,
  "sb": 0.01,
  "bb": 0.02,
  "rake": 0.0,
  "raw_text": "Mano n.º 257148722931 de PokerStars:  Hold'em No Limit (0.01 €/0.02 € EUR) - 30-07-2025 21:39:27 CET [30-07-2025 15:39:27 ET]\nMesa \"Esclangona\" 6-max El asiento n.º 2 es el botón\nAsiento 1: Zorgue1080 (1.90 € en fichas) \nAsiento 2: SrLyce (2.72 € en fichas) \nAsiento 4: Davdgoni (2.36 € en fichas) \nAsiento 5: DiaZzZ1 (2.31 € en fichas) \nAsiento 6: berlcht403 (0.67 € en fichas) \nDavdgoni: pone la ciega pequeña 0.01 €\nDiaZzZ1: pone la ciega grande 0.02 €\n*** CARTAS DE MANO ***\nRepartidas a SrLyce [Qs 6d]\nNoahBolete se une a la mesa en el asiento n.º 3 \nberlcht403: iguala 0.02 €\nZorgue1080: se retira \nSrLyce: se retira \nDavdgoni: se retira \nDiaZzZ1: pasa \n*** FLOP *** [8d 5s Qc]\nDiaZzZ1: pasa \nberlcht403: apuesta 0.05 €\nDiaZzZ1: se retira \nLa apuesta no igualada (0.05 €) ha sido devuelta a berlcht403\nberlcht403 se lleva 0.05 € del bote \n*** RESUMEN ***\nBote total 0.05 € | Comisión 0 € \nComunitarias [8d 5s Qc]\nAsiento 1: Zorgue1080 se retiró antes del Flop (no apostó)\nAsiento 2: SrLyce (botón) se retiró antes del Flop (no apostó)\nAsiento 4: Davdgoni (ciega pequeña) se retiró antes del Flop\nAsiento 5: DiaZzZ1 (ciega grande) se retiró en el Flop\nAsiento 6: berlcht403 recaudó (0.05 €)"
}