{
  "hand_id": "257237715819",
  "date": "06-08-2025 17:51:02",
  "table": "Virtus",
  "game_type": "holdem",
  "hero": "SrLyce",
  "hero_position": "",
  "hero_cards": [
    "2c",
    "Qs"
  ],
  "stacks": {
    "Kingzilla87": 164.5,
    "SrLyce": 98.5,
    "zzranger_03": 179.5,
    "JGDOBLAS": 91.5,
    "don.corle": 143.0,
    "rudik34385": 98.5
  },
  "actions": {
    "preflop": [
      "Asiento 1: Kingzilla87 (3.29 € en fichas)",
      "Asiento 2: SrLyce (1.97 € en fichas)",
      "Asiento 3: zzranger_03 (3.59 € en fichas)",
      "Asiento 4: JGDOBLAS (1.83 € en fichas)",
      "Asiento 5: don.corle (2.86 € en fichas)",
      "Asiento 6: rudik34385 (1.97 € en fichas)",
      "zzranger_03: pone la ciega pequeña 0.01 €",
      "JGDOBLAS: pone la ciega grande 0.02 €",
      "don.corle: se retira",
      "rudik34385: se retira",
      "Kingzilla87: se retira",
      "SrLyce: se retira",
      "zzranger_03: sube 0.04 € a 0.06 €",
      "JGDOBLAS: se retira",
      "zzranger_03: no muestra su mano",
      "Asiento 1: Kingzilla87 se retiró antes del Flop (no apostó)",
      "Asiento 2: SrLyce (botón) se retiró antes del Flop (no apostó)",
      "Asiento 3: zzranger_03 (ciega pequeña) recaudó (0.04 €)",
      "Asiento 4: JGDOBLAS (ciega grande) se retiró antes del Flop",
      "Asiento 5: don.corle se retiró antes del Flop (no apostó)",
      "Asiento 6: rudik34385 se retiró antes del Flop (no apostó)"
    ],
    "flop": [],
    "turn": [],
    "river": []
  },
  "board": [],
  "winner": "zzranger_03",
  "win_amount": 2.0,
  "sb": 0.01,
  "bb": 0.02,
  "rake": 0.0,
  "raw_text": "Mano n.º 257237715819 de PokerStars:  Hold'em No Limit (0.01 €/0.02 € EUR) - 06-08-2025 17:51:02 CET [06-08-2025 11:51:02 ET]\nMesa \"Virtus\" 6-max El asiento n.º 2 es el botón\nAsiento 1: Kingzilla87 (3.29 € en fichas) \nAsiento 2: SrLyce (1.97 € en fichas) \nAsiento 3: zzranger_03 (3.59 € en fichas) \nAsiento 4: JGDOBLAS (1.83 € en fichas) \nAsiento 5: don.corle (2.86 € en fichas) \nAsiento 6: rudik34385 (1.97 € en fichas) \nzzranger_03: pone la ciega pequeña 0.01 €\nJGDOBLAS: pone la ciega grande 0.02 €\n*** CARTAS DE MANO ***\nRepartidas a SrLyce [2c Qs]\ndon.corle: se retira \nrudik34385: se retira \nKingzilla87: se retira \nSrLyce: se retira \nzzranger_03: sube 0.04 € a 0.06 €\nJGDOBLAS: se retira \nLa apuesta no igualada (0.04 €) ha sido devuelta a zzranger_03\nzzranger_03 se lleva 0.04 € del bote \nzzranger_03: no muestra su mano \n*** RESUMEN ***\nBote total 0.04 € | Comisión 0 € \nAsiento 1: Kingzilla87 se retiró antes del Flop (no apostó)\nAsiento 2: SrLyce (botón) se retiró antes del Flop (no apostó)\nAsiento 3: zzranger_03 (ciega pequeña) recaudó (0.04 €)\nAsiento 4: JGDOBLAS (ciega grande) se retiró antes del Flop\nAsiento 5: don.corle se retiró antes del Flop (no apostó)\nAsiento 6: rudik34385 se retiró antes del Flop (no apostó)"
}