{
  "hand_id": "257238716274",
  "date": "06-08-2025 19:23:07",
  "table": "Leonteus",
  "game_type": "holdem",
  "hero": "SrLyce",
  "hero_position": "",
  "hero_cards": [
    "5s",
    "7d"
  ],
  "stacks": {
    "practikal_C23": 44.0,
    "niyomalo": 96.0,
    "davinci1962": 156.0,
    "BuXHexter": 155.0,
    "Andark47": 207.5,
    "SrLyce": 89.5
  },
  "actions": {
    "preflop": [
      "Asiento 1: practikal_C23 (0.88 € en fichas)",
      "Asiento 2: niyomalo (1.92 € en fichas)",
      "Asiento 3: davinci1962 (3.12 € en fichas)",
      "Asiento 4: BuXHexter (3.10 € en fichas)",
      "Asiento 5: Andark47 (4.15 € en fichas)",
      "Asiento 6: SrLyce (1.79 € en fichas)",
      "practikal_C23: pone la ciega pequeña 0.01 €",
      "niyomalo: pone la ciega grande 0.02 €",
      "davinci1962: se retira",
      "BuXHexter: se retira",
      "Andark47: se retira",
      "SrLyce: se retira",
      "practikal_C23: iguala 0.01 €",
      "niyomalo: pasa"
    ],
    "flop": [
      "practikal_C23: pasa",
      "niyomalo: pasa"
    ],
    "turn": [
      "practikal_C23: apuesta 0.02 €",
      "niyomalo: se retira",
      "Asiento 1: practikal_C23 (ciega pequeña) recaudó (0.04 €)",
      "Asiento 2: niyomalo (ciega grande) se retiró en el Turn",
      "Asiento 3: davinci1962 se retiró antes del Flop (no apostó)",
      "Asiento 4: BuXHexter se retiró antes del Flop (no apostó)",
      "Asiento 5: Andark47 se retiró antes del Flop (no apostó)",
      "Asiento 6: SrLyce (botón) se retiró antes del Flop (no apostó)"
    ],
    "river": []
  },
  "board": [
    "9h",
    "4c",
    "Ac",
    "7h"
  ],
  "winner": "practikal_C23",
  "win_amount": 2.0,
  "sb": 0.01,
  "bb": 0.02,
  "rake": 0.0,
  "raw_text": "Mano n.º 257238716274 de PokerStars:  Hold'em No Limit (0.01 €/0.02 € EUR) - 06-08-2025 19:23:07 CET [06-08-2025 13:23:07 ET]\nMesa \"Leonteus\" 6-max El asiento n.º 6 es el botón\nAsiento 1: practikal_C23 (0.88 € en fichas) \nAsiento 2: niyomalo (1.92 € en fichas) \nAsiento 3: davinci1962 (3.12 € en fichas) \nAsiento 4: BuXHexter (3.10 € en fichas) \nAsiento 5: Andark47 (4.15 € en fichas) \nAsiento 6: SrLyce (1.79 € en fichas) \npractikal_C23: pone la ciega pequeña 0.01 €\nniyomalo: pone la ciega grande 0.02 €\n*** CARTAS DE MANO ***\nRepartidas a SrLyce [5s 7d]\ndavinci1962: se retira \nBuXHexter: se retira \nAndark47 ha agotado su tiempo\nAndark47: se retira \nSrLyce: se retira \npractikal_C23: iguala 0.01 €\nniyomalo: pasa \n*** FLOP *** [9h 4c Ac]\npractikal_C23: pasa \nniyomalo: pasa \n*** TURN *** [9h 4c Ac] [7h]\npractikal_C23: apuesta 0.02 €\nniyomalo: se retira \nLa apuesta no igualada (0.02 €) ha sido devuelta a practikal_C23\npractikal_C23 se lleva 0.04 € del bote \n*** RESUMEN ***\nBote total 0.04 € | Comisión 0 € \nComunitarias [9h 4c Ac 7h]\nAsiento 1: practikal_C23 (ciega pequeña) recaudó (0.04 €)\nAsiento 2: niyomalo (ciega grande) se retiró en el Turn\nAsiento 3: davinci1962 se retiró antes del Flop (no apostó)\nAsiento 4: BuXHexter se retiró antes del Flop (no apostó)\nAsiento 5: Andark47 se retiró antes del Flop (no apostó)\nAsiento 6: SrLyce (botón) se retiró antes del Flop (no apostó)"
}